A1: 股票代码 | B1: 600300.SH | C1: 603156.SH | D1: 000848.SZ | E1: 600189.SH | F1: 300997.SZ | G1: 605388.SH | H1: 603711.SH | I1: 605499.SH | J1: 605337.SH | K1: 605198.SH | L1: 600962.SH
A2: 股票简称 | B2: 维维股份 | C2: 养元饮品 | D2: 承德露露 | E2: 泉阳泉 | F2: 欢乐家 | G2: 均瑶健康 | H2: 香飘飘 | I2: 东鹏饮料 | J2: 李子园 | K2: 安德利 | L2: 国投中鲁
A3: 现价(元) | B3: 2.68 | C3: 21.88 | D3: 8.03 | E3: 7.9000000000000004 | F3: 12.05 | G3: 5.48 | H3: 11.74 | I3: 228.19999999999999 | J3: 9.62 | K3: 24.199999999999999 | L3: 15.27
A4: 所属同花顺行业 | B4: 食品饮料-饮料制造-软饮料 | C4: 食品饮料-饮料制造-软饮料 | D4: 食品饮料-饮料制造-软饮料 | E4: 食品饮料-饮料制造-软饮料 | F4: 食品饮料-饮料制造-软饮料 | G4: 食品饮料-饮料制造-软饮料 | H4: 食品饮料-饮料制造-软饮料 | I4: 食品饮料-饮料制造-软饮料 | J4: 食品饮料-饮料制造-软饮料 | K4: 食品饮料-饮料制造-软饮料 | L4: 食品饮料-饮料制造-软饮料
A5: 总股本(股)2023.12.29 | B5: 1617142180 | C5: 1265493600 | D5: 1052554074 | E5: 715197812 | F5: 447500000 | G5: 430000000 | H5: 410745800 | I5: 400010000 | J5: 394432041 | K5: 349000000 | L5: 262210000
A6: 总股本(股)2022.12.30 | B6: 1617142180 | C6: 1265493600 | D6: 1076419000 | E6: 715197812 | F6: 450000000 | G6: 430000000 | H6: 410745800 | I6: 400010000 | J6: 303408000 | K6: 357700000 | L6: 262210000
A7: 总股本(股)2021.12.31 | B7: 1672000000 | C7: 1265493600 | D7: 1076419000 | E7: 715197812 | F7: 450000000 | G7: 430000000 | H7: 415113800 | I7: 400010000 | J7: 216720000 | K7: 367300000 | L7: 262210000
A8: 总股本(股)2020.12.31 | B8: 1672000000 | C8: 1265493600 | D8: 1076419000 | E8: 715197812 | F8: 360000000 | G8: 430000000 | H8: 418171100 | I8: 360000000 | J8: 116100000 | K8: 378000000 | L8: 262210000
A9: 总股本(股)2019.12.31 | B9: 1672000000 | C9: 1054578000 | D9: 978562728 | E9: 716874877 | F9: -- | G9: 360000000 | H9: 419350000 | I9: -- | J9: 116100000 | K9: 358000000 | L9: 262210000
A10: 总股本(股)2018.12.28 | B10: 1672000000 | C10: 753270000 | D10: 978562728 | E10: 716874877 | F10: -- | G10: -- | H10: 419350000 | I10: -- | J10: -- | K10: -- | L10: 262210000
A11: 总股本(股)2017.12.29 | B11: 1672000000 | C11: 495000000 | D11: 978562728 | E11: 489342213 | F11: -- | G11: -- | H11: 400010000 | I11: -- | J11: -- | K11: -- | L11: 262210000
A12: 总股本(股)2016.12.30 | B12: 1672000000 | C12: -- | D12: 978562728 | E12: 310500000 | F12: -- | G12: -- | H12: 360000000 | I12: -- | J12: -- | K12: -- | L12: 262210000
A13: 总股本(股)2015.12.31 | B13: 1672000000 | C13: -- | D13: 752740560 | E13: 310500000 | F13: -- | G13: -- | H13: 360000000 | I13: -- | J13: -- | K13: -- | L13: 262210000
A14: 总股本(股)2014.12.31 | B14: 1672000000 | C14: -- | D14: 501827040 | E14: 310500000 | F14: -- | G14: -- | H14: -- | I14: -- | J14: -- | K14: -- | L14: 262210000
A15: 总股本(股)2013.12.31 | B15: 1672000000 | C15: -- | D15: 401461632 | E15: 310500000 | F15: -- | G15: -- | H15: -- | I15: -- | J15: -- | K15: -- | L15: 262210000
A16: 总股本(股)2012.12.31 | B16: 1672000000 | C16: -- | D16: 401461632 | E16: 310500000 | F16: -- | G16: -- | H16: -- | I16: -- | J16: -- | K16: -- | L16: 262210000
A17: 流通a股(股)2019.12.31 | B17: 1672000000 | C17: 639445325 | D17: 978355383 | E17: 477009588 | F17: -- | G17: -- | H17: 46297760 | I17: -- | J17: -- | K17: 0 | L17: 254020000
A18: 流通a股(股)2018.12.28 | B18: 1672000000 | C18: 60270000 | D18: 978320876 | E18: 425663217 | F18: -- | G18: -- | H18: 46297760 | I18: -- | J18: -- | K18: -- | L18: 254020000
A19: 流通a股(股)2017.12.29 | B19: 1672000000 | C19: -- | D19: 978251383 | E19: 310500000 | F19: -- | G19: -- | H19: 40010000 | I19: -- | J19: -- | K19: -- | L19: 254020000
A20: 流通a股(股)2016.12.30 | B20: 1672000000 | C20: -- | D20: 978084002 | E20: 310500000 | F20: -- | G20: -- | H20: -- | I20: -- | J20: -- | K20: -- | L20: 254020000
A21: 流通a股(股)2015.12.31 | B21: 1672000000 | C21: -- | D21: 752379809 | E21: 310500000 | F21: -- | G21: -- | H21: -- | I21: -- | J21: -- | K21: -- | L21: 254020000
A22: 流通a股(股)2014.12.31 | B22: 1672000000 | C22: -- | D22: 501644690 | E22: 310500000 | F22: -- | G22: -- | H22: -- | I22: -- | J22: -- | K22: -- | L22: 254020000
A23: 流通a股(股)2013.12.31 | B23: 1672000000 | C23: -- | D23: 401315752 | E23: 310500000 | F23: -- | G23: -- | H23: -- | I23: -- | J23: -- | K23: -- | L23: 254020000
A24: 流通a股(股)2012.12.31 | B24: 1672000000 | C24: -- | D24: 401313281 | E24: 310500000 | F24: -- | G24: -- | H24: -- | I24: -- | J24: -- | K24: -- | L24: 254020000
A25: 总现金2023.12.31 | B25: 661468746.79999995 | C25: 7232020088.76 | D25: 3119613190.5999999 | E25: 668521726.24 | F25: 894734877.10000002 | G25: 583089472.57 | H25: 2943033922.71 | I25: 7296245340.07 | J25: 1067848282.35 | K25: 690648761.92 | L25: 173465656.19999999
A26: 每股总现金 | B26: =B25/B5 -> 0.40903561540890609 | C26: =C25/C5 -> 5.7147820334768982 | D26: =D25/D5 -> 2.9638507585121938 | E26: =E25/E5 -> 0.93473681689619037 | F26: =F25/F5 -> 1.9994075465921788 | G26: =G25/G5 -> 1.3560220292325582 | H26: =H25/H5 -> 7.1650980307284948 | I26: =I25/I5 -> 18.240157346241343 | J26: =J25/J5 -> 2.7073061297015677 | K26: =K25/K5 -> 1.9789362805730657 | L26: =L25/L5 -> 0.66155240532397697
A27: 每股总现金占股价的比例 | B27: =B26/B3 -> 0.15262522963018882 | C27: =C26/C3 -> 0.26118747867810321 | D27: =D26/D3 -> 0.36909723020077134 | E27: =E26/E3 -> 0.1183211160628089 | F27: =F26/F3 -> 0.16592593747652934 | G27: =G26/G3 -> 0.24744927540740111 | H27: =H26/H3 -> 0.61031499409953105 | I27: =I26/I3 -> 7.9930575575115445e-02 | J27: =J26/J3 -> 0.28142475360723157 | K27: =K26/K3 -> 8.1774226469961395e-02 | L27: =L26/L3 -> 4.3323667670201509e-02
A28: 资产负债率 | B28: =(VLOOKUP($A832,'/Users/leaves/Documents/workspace2/finance/[近12年现金流量净额.xls]近12年现金流量净额'!$A$2:$BA$5124,17,FALSE)-VLOOKUP($A832,'/Users/leaves/Documents/workspace2/finance/[近12年所有者权益.xls]近12年所有者权益'!$A$2:$BA$5124,4,FALSE))/VLOOKUP($A832,'/Users/leaves/Documents/workspace2/finance/[近12年现金流量净额.xls]近12年现金流量净额'!$A$2:$BA$5124,17,FALSE) -> #N/A | C28: =(VLOOKUP($A1072,'/Users/leaves/Documents/workspace2/finance/[近12年现金流量净额.xls]近12年现金流量净额'!$A$2:$BA$5124,17,FALSE)-VLOOKUP($A1072,'/Users/leaves/Documents/workspace2/finance/[近12年所有者权益.xls]近12年所有者权益'!$A$2:$BA$5124,4,FALSE))/VLOOKUP($A1072,'/Users/leaves/Documents/workspace2/finance/[近12年现金流量净额.xls]近12年现金流量净额'!$A$2:$BA$5124,17,FALSE) -> #N/A | D28: =(VLOOKUP($A1320,'/Users/leaves/Documents/workspace2/finance/[近12年现金流量净额.xls]近12年现金流量净额'!$A$2:$BA$5124,17,FALSE)-VLOOKUP($A1320,'/Users/leaves/Documents/workspace2/finance/[近12年所有者权益.xls]近12年所有者权益'!$A$2:$BA$5124,4,FALSE))/VLOOKUP($A1320,'/Users/leaves/Documents/workspace2/finance/[近12年现金流量净额.xls]近12年现金流量净额'!$A$2:$BA$5124,17,FALSE) -> #N/A | E28: =(VLOOKUP($A1865,'/Users/leaves/Documents/workspace2/finance/[近12年现金流量净额.xls]近12年现金流量净额'!$A$2:$BA$5124,17,FALSE)-VLOOKUP($A1865,'/Users/leaves/Documents/workspace2/finance/[近12年所有者权益.xls]近12年所有者权益'!$A$2:$BA$5124,4,FALSE))/VLOOKUP($A1865,'/Users/leaves/Documents/workspace2/finance/[近12年现金流量净额.xls]近12年现金流量净额'!$A$2:$BA$5124,17,FALSE) -> #N/A | F28: =(VLOOKUP($A2622,'/Users/leaves/Documents/workspace2/finance/[近12年现金流量净额.xls]近12年现金流量净额'!$A$2:$BA$5124,17,FALSE)-VLOOKUP($A2622,'/Users/leaves/Documents/workspace2/finance/[近12年所有者权益.xls]近12年所有者权益'!$A$2:$BA$5124,4,FALSE))/VLOOKUP($A2622,'/Users/leaves/Documents/workspace2/finance/[近12年现金流量净额.xls]近12年现金流量净额'!$A$2:$BA$5124,17,FALSE) -> #N/A | G28: =(VLOOKUP($A2712,'/Users/leaves/Documents/workspace2/finance/[近12年现金流量净额.xls]近12年现金流量净额'!$A$2:$BA$5124,17,FALSE)-VLOOKUP($A2712,'/Users/leaves/Documents/workspace2/finance/[近12年所有者权益.xls]近12年所有者权益'!$A$2:$BA$5124,4,FALSE))/VLOOKUP($A2712,'/Users/leaves/Documents/workspace2/finance/[近12年现金流量净额.xls]近12年现金流量净额'!$A$2:$BA$5124,17,FALSE) -> #N/A | H28: =(VLOOKUP($A2830,'/Users/leaves/Documents/workspace2/finance/[近12年现金流量净额.xls]近12年现金流量净额'!$A$2:$BA$5124,17,FALSE)-VLOOKUP($A2830,'/Users/leaves/Documents/workspace2/finance/[近12年所有者权益.xls]近12年所有者权益'!$A$2:$BA$5124,4,FALSE))/VLOOKUP($A2830,'/Users/leaves/Documents/workspace2/finance/[近12年现金流量净额.xls]近12年现金流量净额'!$A$2:$BA$5124,17,FALSE) -> #N/A | I28: =(VLOOKUP($A2960,'/Users/leaves/Documents/workspace2/finance/[近12年现金流量净额.xls]近12年现金流量净额'!$A$2:$BA$5124,17,FALSE)-VLOOKUP($A2960,'/Users/leaves/Documents/workspace2/finance/[近12年所有者权益.xls]近12年所有者权益'!$A$2:$BA$5124,4,FALSE))/VLOOKUP($A2960,'/Users/leaves/Documents/workspace2/finance/[近12年现金流量净额.xls]近12年现金流量净额'!$A$2:$BA$5124,17,FALSE) -> #N/A | J28: =(VLOOKUP($A2991,'/Users/leaves/Documents/workspace2/finance/[近12年现金流量净额.xls]近12年现金流量净额'!$A$2:$BA$5124,17,FALSE)-VLOOKUP($A2991,'/Users/leaves/Documents/workspace2/finance/[近12年所有者权益.xls]近12年所有者权益'!$A$2:$BA$5124,4,FALSE))/VLOOKUP($A2991,'/Users/leaves/Documents/workspace2/finance/[近12年现金流量净额.xls]近12年现金流量净额'!$A$2:$BA$5124,17,FALSE) -> #N/A | K28: =(VLOOKUP($A3152,'/Users/leaves/Documents/workspace2/finance/[近12年现金流量净额.xls]近12年现金流量净额'!$A$2:$BA$5124,17,FALSE)-VLOOKUP($A3152,'/Users/leaves/Documents/workspace2/finance/[近12年所有者权益.xls]近12年所有者权益'!$A$2:$BA$5124,4,FALSE))/VLOOKUP($A3152,'/Users/leaves/Documents/workspace2/finance/[近12年现金流量净额.xls]近12年现金流量净额'!$A$2:$BA$5124,17,FALSE) -> #N/A | L28: =(VLOOKUP($A3525,'/Users/leaves/Documents/workspace2/finance/[近12年现金流量净额.xls]近12年现金流量净额'!$A$2:$BA$5124,17,FALSE)-VLOOKUP($A3525,'/Users/leaves/Documents/workspace2/finance/[近12年所有者权益.xls]近12年所有者权益'!$A$2:$BA$5124,4,FALSE))/VLOOKUP($A3525,'/Users/leaves/Documents/workspace2/finance/[近12年现金流量净额.xls]近12年现金流量净额'!$A$2:$BA$5124,17,FALSE) -> #N/A