B1: 002086.SZ | C1: 300832.SZ | D1: 603658.SH | E1: 300406.SZ | F1: 300482.SZ | G1: 688289.SH | H1: 688575.SH | I1: 688389.SH | J1: 300463.SZ | K1: 603387.SH | L1: 300396.SZ | M1: 300685.SZ | N1: 300439.SZ | O1: 688606.SH | P1: 688253.SH | Q1: 688468.SH | R1: 688075.SH | S1: 300639.SZ | T1: 688338.SH | U1: 688767.SH | V1: 600645.SH | W1: 002030.SZ | X1: 300642.SZ | Y1: 002932.SZ | Z1: 688656.SH | AA1: 688393.SH | AB1: 688068.SH | AC1: 688067.SH | AD1: 300289.SZ | AE1: 688193.SH | AF1: 688217.SH | AG1: 600538.SH | AH1: 688426.SH | AI1: 600807.SH | AJ1: 688317.SH | AK1: 300942.SZ | AL1: 002022.SZ | AM1: 688399.SH | AN1: 688298.SH
A2: 股票简称 | B2: 东方海洋 | C2: 新产业 | D2: 安图生物 | E2: 九强生物 | F2: 万孚生物 | G2: 圣湘生物 | H2: 亚辉龙 | I2: 普门科技 | J2: 迈克生物 | K2: 基蛋生物 | L2: 迪瑞医疗 | M2: 艾德生物 | N2: 美康生物 | O2: 奥泰生物 | P2: 英诺特 | Q2: 科美诊断 | R2: 安旭生物 | S2: 凯普生物 | T2: 赛科希德 | U2: 博拓生物 | V2: 中源协和 | W2: 达安基因 | X2: 透景生命 | Y2: 明德生物 | Z2: 浩欧博 | AA2: 安必平 | AB2: 热景生物 | AC2: 爱威科技 | AD2: 利德曼 | AE2: 仁度生物 | AF2: 睿昂基因 | AG2: 国发股份 | AH2: 康为世纪 | AI2: 济南高新 | AJ2: 之江生物 | AK2: 易瑞生物 | AL2: 科华生物 | AM2: 硕世生物 | AN2: 东方生物
A3: 所属同花顺行业 | B3: 医药生物-医疗器械-体外诊断 | C3: 医药生物-医疗器械-体外诊断 | D3: 医药生物-医疗器械-体外诊断 | E3: 医药生物-医疗器械-体外诊断 | F3: 医药生物-医疗器械-体外诊断 | G3: 医药生物-医疗器械-体外诊断 | H3: 医药生物-医疗器械-体外诊断 | I3: 医药生物-医疗器械-体外诊断 | J3: 医药生物-医疗器械-体外诊断 | K3: 医药生物-医疗器械-体外诊断 | L3: 医药生物-医疗器械-体外诊断 | M3: 医药生物-医疗器械-体外诊断 | N3: 医药生物-医疗器械-体外诊断 | O3: 医药生物-医疗器械-体外诊断 | P3: 医药生物-医疗器械-体外诊断 | Q3: 医药生物-医疗器械-体外诊断 | R3: 医药生物-医疗器械-体外诊断 | S3: 医药生物-医疗器械-体外诊断 | T3: 医药生物-医疗器械-体外诊断 | U3: 医药生物-医疗器械-体外诊断 | V3: 医药生物-医疗器械-体外诊断 | W3: 医药生物-医疗器械-体外诊断 | X3: 医药生物-医疗器械-体外诊断 | Y3: 医药生物-医疗器械-体外诊断 | Z3: 医药生物-医疗器械-体外诊断 | AA3: 医药生物-医疗器械-体外诊断 | AB3: 医药生物-医疗器械-体外诊断 | AC3: 医药生物-医疗器械-体外诊断 | AD3: 医药生物-医疗器械-体外诊断 | AE3: 医药生物-医疗器械-体外诊断 | AF3: 医药生物-医疗器械-体外诊断 | AG3: 医药生物-医疗器械-体外诊断 | AH3: 医药生物-医疗器械-体外诊断 | AI3: 医药生物-医疗器械-体外诊断 | AJ3: 医药生物-医疗器械-体外诊断 | AK3: 医药生物-医疗器械-体外诊断 | AL3: 医药生物-医疗器械-体外诊断 | AM3: 医药生物-医疗器械-体外诊断 | AN3: 医药生物-医疗器械-体外诊断
A4: 净利润(元)2023.12.31 | B4: 1749600271.3499999 | C4: 1653653244.98 | D4: 1217438887.27 | E4: 523742821.31999999 | F4: 487624779.55000001 | G4: 363721131.70999998 | H4: 355014548.67000002 | I4: 328579949.16000003 | J4: 312618556.85000002 | K4: 279771914.07999998 | L4: 275589641.99000001 | M4: 261484433.37 | N4: 256551420.88999999 | O4: 180576190.21000001 | P4: 173948077.93000001 | Q4: 147373517.72999999 | R4: 141553680.38999999 | S4: 140472219.75 | T4: 116912526.98 | U4: 106605811.84999999 | V4: 106452669.84999999 | W4: 104659624.06 | X4: 89403542.390000001 | Y4: 74925916.549999997 | Z4: 47331407.659999996 | AA4: 40057208.890000001 | AB4: 27382940.5 | AC4: 21533773.079999998 | AD4: 15337378.720000001 | AE4: 8259296.5800000001 | AF4: 7930692.3200000003 | AG4: -82308269.560000002 | AH4: -84409484.040000007 | AI4: -95101251.469999999 | AJ4: -136857073.34 | AK4: -184907769.72999999 | AL4: -234014886.40000001 | AM4: -373811354.73000002 | AN4: -397583595.26999998
A5: 净利润(元)2022.12.31 | B5: -1584901504.79 | C5: 1327918359.24 | D5: 1167437129.3900001 | E5: 389097640.01999998 | F5: 1197063465.55 | G5: 1936800511.21 | H5: 1012120273.22 | I5: 251482903.21000001 | J5: 708180360.28999996 | K5: 498909980.39999998 | L5: 261827947.55000001 | M5: 263743023.31999999 | N5: 198527038.63999999 | O5: 1184924321.1199999 | P5: 150683812.30000001 | Q5: 152625664.31999999 | R5: 3044673309.8200002 | S5: 1725997552.8599999 | T5: 104114179.36 | U5: 773634251.64999998 | V5: 112986649.52 | W5: 5412341064.1300001 | X5: 124757666.06 | Y5: 4208496913.9899998 | Z5: 41651124.729999997 | AA5: 42694280.880000003 | AB5: 944736633.48000002 | AC5: 17973042.73 | AD5: -56271757.899999999 | AE5: 23331394.530000001 | AF5: 40473558.799999997 | AG5: 34841980.189999998 | AH5: 159258880.74000001 | AI5: 18370741.82 | AJ5: 760273479.92999995 | AK5: 82965490.950000003 | AL5: 971562246.72000003 | AM5: 1827900394.2 | AN5: 2067714327.5999999
A6: 净利润(元)2021.12.31 | B6: -1003357160.46 | C6: 973696489.02999997 | D6: 973663074.63999999 | E6: 405651172.06 | F6: 634433145.20000005 | G6: 2242696395.5799999 | H6: 204747570.06 | I6: 190347063.61000001 | J6: 956604404.94000006 | K6: 398990048.56 | L6: 209948414.77000001 | M6: 239573622.91 | N6: 179488034.18000001 | O6: 765688919.14999998 | P6: 120252397.7 | Q6: 142757221.16999999 | R6: 738526270.09000003 | S6: 852160115.03999996 | T6: 97368830.480000004 | U6: 833590633.07000005 | V6: 155320080.74000001 | W6: 3618186564.1199999 | X6: 161082764.13999999 | Y6: 1413224434.03 | Z6: 86192663.310000002 | AA6: 79775774.510000005 | AB6: 2185763390.6100001 | AC6: 31275040.940000001 | AD6: 22419197.579999998 | AE6: 64618882.020000003 | AF6: 47332599.140000001 | AG6: 10486532.83 | AH6: 125847387.64 | AI6: 14685042.35 | AJ6: 758524934.05999994 | AK6: 236507393.22 | AL6: 850413412.99000001 | AM6: 1193214259.45 | AN6: 4920188146.6599998
A7: 净利润(元)2020.12.31 | B7: -309034268.81999999 | C7: 939147382.47000003 | D7: 747793833.40999997 | E7: 112277109.51000001 | F7: 634170281.67999995 | G7: 2616597026.75 | H7: 210532458.56 | I7: 143948219.18000001 | J7: 793917986.86000001 | K7: 304733135.74000001 | L7: 267071664.28999999 | M7: 180326353.21000001 | N7: 299480578.95999998 | O7: 679229342.5 | P7: 571452359 | Q7: 117020020.48 | R7: 648992193.52999997 | S7: 362662411.13999999 | T7: 69188424.170000002 | U7: 435146719.99000001 | V7: -126864303.09 | W7: 2449090154.3499999 | X7: 120552785.87 | Y7: 468927794.20999998 | Z7: 56617570.409999996 | AA7: 84745713.590000004 | AB7: 112066635.67 | AC7: 30100264.859999999 | AD7: -50983731.689999998 | AE7: 61376519.619999997 | AF7: 38713469.939999998 | AG7: 3200573.27 | AH7: 108156513.77 | AI7: -824989948.90999997 | AJ7: 932009443.5 | AK7: 65445058.170000002 | AL7: 675356413.27999997 | AM7: 819567339.92999995 | AN7: 1677358740.98
A8: 净利润(元)2019.12.31 | B8: -1024176845.86 | C8: 772608984.84000003 | D8: 774163957.63 | E8: 331648680.01999998 | F8: 387461316.97000003 | G8: 39478539.850000001 | H8: 107544527.53 | I8: 100559715.59 | J8: 525262640.00999999 | K8: 339672020.50999999 | L8: 231892235.08000001 | M8: 135474211.31 | N8: -559912183.23000002 | O8: 78419418.129999995 | P8: 21288252.559999999 | Q8: 140593235.16999999 | R8: 54474048.859999999 | S8: 147290874.46000001 | T8: 71040074.5 | U8: 28228431.09 | V8: 49694801.5 | W8: 92181843.109999999 | X8: 157018318.31 | Y8: 41525796.399999999 | Z8: 63838481.140000001 | AA8: 73988897.219999999 | AB8: 33877755.130000003 | AC8: 50520467.82 | AD8: 6309184.3399999999 | AE8: 3739161.8700000001 | AF8: 35947717.049999997 | AG8: 5772938.1399999997 | AH8: 8971580.3100000005 | AI8: 63124497.57 | AJ8: 51521833.299999997 | AK8: 92308448.819999993 | AL8: 202475418.80000001 | AM8: 83756179.760000005 | AN8: 82105186.239999995
A9: 净利润(元)2018.12.31 | B9: -791271047.60000002 | C9: 693996847.57000005 | D9: 562570893.29999995 | E9: 300665281.32999998 | F9: 307744491.33999997 | G9: 6762086.3399999999 | H9: 38033404.060000002 | I9: 81144019.849999994 | J9: 444928508.70999998 | K9: 249612047.46000001 | L9: 197727875.75 | M9: 126737914.51000001 | N9: 241172082.63 | O9: 56425304.68 | P9: 16967177.239999998 | Q9: -424245047.31999999 | R9: 33370537.359999999 | S9: 114079529.18000001 | T9: 56712821.590000004 | U9: 18906705.890000001 | V9: 59252904.299999997 | W9: 101582978.65000001 | X9: 141690851.93000001 | Y9: 61419875.140000001 | Z9: 40154443.710000001 | AA9: 61471775.420000002 | AB9: 48140837.25 | AC9: 27283160.859999999 | AD9: 40471724.960000001 | AE9: -32051158.260000002 | AF9: 14576759.08 | AG9: -21611113.91 | AH9: 6575335.04 | AI9: 35882980.340000004 | AJ9: 62318542.469999999 | AK9: 73936739.159999996 | AL9: 207778849.81 | AM9: 63824573.32 | AN9: 65369555.039999999
A10: 净利润(元)2017.12.31 | B10: 124054068.97 | C10: 538206809.11000001 | D10: 446564158.64999998 | E10: 273151407.89999998 | F10: 210695013.22999999 | G10: -10653273.52 | H10: 5894559.1600000001 | I10: 47585450.079999998 | J10: 374132214.88 | K10: 193988370.30000001 | L10: 167392770.12 | M10: 94065765.390000001 | N10: 229700185.53999999 | O10: 34169914.189999998 | P10: -- | Q10: -435229646.06 | R10: -5864989.6799999997 | S10: 93210017.920000002 | T10: 29347139.059999999 | U10: 4031157.2000000002 | V10: 10366521.83 | W10: 86447799.329999998 | X10: 126814971.01000001 | Y10: 65492647.25 | Z10: 21353853.940000001 | AA10: 48338747.299999997 | AB10: 30072299.82 | AC10: 24966894.82 | AD10: 73067135.849999994 | AE10: -- | AF10: 16868900.969999999 | AG10: 8850641.1799999997 | AH10: -- | AI10: -485024307.49000001 | AJ10: 51534429.219999999 | AK10: 39292616.219999999 | AL10: 217759949.25999999 | AM10: 42668448.539999999 | AN10: 33356634.609999999
A11: 净利润(元)2016.12.31 | B11: 76617087.030000001 | C11: 451694613.37 | D11: 349758059.56999999 | E11: 271646051.76999998 | F11: 144986730.41 | G11: -- | H11: -- | I11: 9879284.6799999997 | J11: 312022756.67000002 | K11: 138356904.49000001 | L11: 125136152.61 | M11: 67033948.600000001 | N11: 177494663.91999999 | O11: 15209591.16 | P11: -- | Q11: -- | R11: -- | S11: 76094578.579999998 | T11: 31021463.510000002 | U11: -- | V11: 37859920.799999997 | W11: 106685504.52 | X11: 97765499.230000004 | Y11: 59692000.240000002 | Z11: 4335004.7000000002 | AA11: 46028692.43 | AB11: 28799459.739999998 | AC11: 27649096.68 | AD11: 69648571.090000004 | AE11: -- | AF11: -- | AG11: -31861949.379999999 | AH11: -- | AI11: 135372532.16999999 | AJ11: 48737703.359999999 | AK11: 23438995.039999999 | AL11: 232400489.43000001 | AM11: 8360838.0199999996 | AN11: 35627016.950000003
A12: 净利润(元)2015.12.31 | B12: 49960214.399999999 | C12: 249118627.25999999 | D12: 278026789.52999997 | E12: 245043364.68000001 | F12: 125351543.48 | G12: -- | H12: -- | I12: -- | J12: 251043594.61000001 | K12: 105066842.78 | L12: 108278048.69 | M12: 21085157.399999999 | N12: 161267521.77000001 | O12: -- | P12: -- | Q12: -- | R12: -- | S12: 65212178.130000003 | T12: -- | U12: -- | V12: 208353113.61000001 | W12: 101237343.11 | X12: 65778553.899999999 | Y12: 35596515.979999997 | Z12: -- | AA12: 47152700 | AB12: -- | AC12: 24551086.75 | AD12: 157219571.78999999 | AE12: -- | AF12: -- | AG12: 4053060.4900000002 | AH12: -- | AI12: 115147637.87 | AJ12: 32524448.600000001 | AK12: -- | AL12: 210624935.56999999 | AM12: -- | AN12: --
A13: 净利润(元)2014.12.31 | B13: 41598501.630000003 | C13: 252872352.5 | D13: 208221070.66999999 | E13: 210640919.00999999 | F13: 98364048.890000001 | G13: -- | H13: -- | I13: -- | J13: 226210932.78 | K13: 75135877.920000002 | L13: 101358862.36 | M13: 19138943.27 | N13: 137684356.61000001 | O13: -- | P13: -- | Q13: -- | R13: -- | S13: 63459114.659999996 | T13: -- | U13: -- | V13: 35464991.490000002 | W13: 153055517.37 | X13: 36003236.329999998 | Y13: 21539670.73 | Z13: -- | AA13: 43491800 | AB13: -- | AC13: 17131229.539999999 | AD13: 128281332.73999999 | AE13: -- | AF13: -- | AG13: -49195976.640000001 | AH13: -- | AI13: 71521328.459999993 | AJ13: 34985468.810000002 | AK13: -- | AL13: 291973949.89999998 | AM13: -- | AN13: --
A14: 净利润(元)2013.12.31 | B14: 57006323.600000001 | C14: 141267859.65000001 | D14: 124075188.27 | E14: 180637381.77000001 | F14: 59003548.060000002 | G14: -- | H14: -- | I14: -- | J14: 193155928.02000001 | K14: 65627761.990000002 | L14: 93607824.329999998 | M14: 22049699.190000001 | N14: 103529869.38 | O14: -- | P14: -- | Q14: -- | R14: -- | S14: 29169943.48 | T14: -- | U14: -- | V14: 7215733.9199999999 | W14: 143765384.46000001 | X14: 22576480.940000001 | Y14: 7322142.3099999996 | Z14: -- | AA14: 38431300 | AB14: -- | AC14: 20298074.129999999 | AD14: 110072010.64 | AE14: -- | AF14: -- | AG14: 10688527.02 | AH14: -- | AI14: -54749363.859999999 | AJ14: 29573211.940000001 | AK14: -- | AL14: 288329176.61000001 | AM14: -- | AN14: --
A15: 净利润(元)2012.12.31 | B15: 99175680.620000005 | C15: 75128561.549999997 | D15: 96122497.409999996 | E15: 137009922.71000001 | F15: 37908549.359999999 | G15: -- | H15: -- | I15: -- | J15: 158209363.86000001 | K15: 21960307.77 | L15: 84222594.010000005 | M15: 7972533.21 | N15: 91734676.480000004 | O15: -- | P15: -- | Q15: -- | R15: -- | S15: 19725223 | T15: -- | U15: -- | V15: 13898900.74 | W15: 90165000.799999997 | X15: 13618109.85 | Y15: 1401869.5600000001 | Z15: -- | AA15: 27734300 | AB15: -- | AC15: 19563594.670000002 | AD15: 98287089.569999993 | AE15: -- | AF15: -- | AG15: -109567461.81 | AH15: -- | AI15: 14618118.07 | AJ15: -- | AK15: -- | AL15: 239830021.83000001 | AM15: -- | AN15: --
A16: 营业收入(元)2023.12.31 | B16: 437233445.62 | C16: 3929655726.27 | D16: 4443655727.6899996 | E16: 1741626675.3699999 | F16: 2764914157.4000001 | G16: 1007118933.74 | H16: 2053101446.48 | I16: 1145718825.9300001 | J16: 2895769512.02 | K16: 1369162256.52 | L16: 1378059471.02 | M16: 1043506694.3200001 | N16: 1885869216.24 | O16: 754696888.86000001 | P16: 478018082.95999998 | Q16: 445340815.75 | R16: 503357076.77999997 | S16: 1104453848.02 | T16: 275486908.66000003 | U16: 442110404.25 | V16: 1589723333.73 | W16: 1180897087.04 | X16: 542809310.94000006 | Y16: 749536774.55999994 | Z16: 394405785.16000003 | AA16: 497290538.5 | AB16: 541251205.97000003 | AC16: 200305925.13 | AD16: 461554624.39999998 | AE16: 164412273.09999999 | AF16: 258211314.47 | AG16: 369154644.31 | AH16: 171341280.84999999 | AI16: 715952553.52999997 | AJ16: 274333302.55000001 | AK16: 254106487.66 | AL16: 2428075213.9499998 | AM16: 403179297.92000002 | AN16: 820157331.66999996
A17: 营业收入(元)2022.12.31 | B17: 629302311.08000004 | C17: 3046955734.5 | D17: 4441627359.3999996 | E17: 1510871884.28 | F17: 5680513174.7700005 | G17: 6450356637.8599997 | H17: 3980756764.0100002 | I17: 983044751.88999999 | J17: 3608411895.1999998 | K17: 1821860703.1500001 | L17: 1220007787.71 | M17: 842180427.76999998 | N17: 2489086216.2199998 | O17: 3388568140.4099998 | P17: 446617687.14999998 | Q17: 465270072.25 | R17: 6165884330.9200001 | S17: 5596971056.7200003 | T17: 228812929.63 | U17: 1901143935.01 | V17: 1554886943.48 | W17: 12046135040.639999 | X17: 715970892.34000003 | Y17: 10530277815.190001 | Z17: 320391835.13999999 | AA17: 507381223.42000002 | AB17: 3556551569.1500001 | AC17: 196774016.31999999 | AD17: 705976839.21000004 | AE17: 303848685.60000002 | AF17: 424298139.43000001 | AG17: 459684048.23000002 | AH17: 521600437.02999997 | AI17: 1716705393.24 | AJ17: 2326255117.23 | AK17: 686897476.52999997 | AL17: 6969862627.7200003 | AM17: 5534792784.4499998 | AN17: 8767938106.3700008
A18: 营业收入(元)2021.12.31 | B18: 388969421.14999998 | C18: 2545415315.7199998 | D18: 3765916988.71 | E18: 1599384352.4300001 | F18: 3361043277.3299999 | G18: 4514539266.46 | H18: 1177896227.3900001 | I18: 778107053.62 | J18: 3980647183.4699998 | K18: 1401701386.4100001 | L18: 905795040.27999997 | M18: 917033391.27999997 | N18: 2251532206.9400001 | O18: 1873427739.6500001 | P18: 326906707.72000003 | Q18: 470774575.25999999 | R18: 1589279102.4000001 | S18: 2673022953.5599999 | T18: 239915362.66 | U18: 1818075902.95 | V18: 1535328653.6800001 | W18: 7664262202.2700005 | X18: 654588606.63 | Y18: 2829829546.3000002 | Z18: 317707531.85000002 | AA18: 438988843.56999999 | AB18: 5369203761.6300001 | AC18: 210668650.50999999 | AD18: 564057983.88 | AE18: 292306247.30000001 | AF18: 290951595.17000002 | AG18: 424717057.50999999 | AH18: 338463302.31 | AI18: 1281549835.26 | AJ18: 2018829748.78 | AK18: 597539623.16999996 | AL18: 4854310523.6800003 | AM18: 2839036343.4099998 | AN18: 10169167715.280001
A19: 营业收入(元)2020.12.31 | B19: 427984778.72000003 | C19: 2194966537.25 | D19: 2978131605.3600001 | E19: 848118493.10000002 | F19: 2810841254.4099998 | G19: 4762963903.3199997 | H19: 999007002.83000004 | I19: 553823040.25999999 | J19: 3703877006.6900001 | K19: 1123335618.5799999 | L19: 937235915.34000003 | M19: 728390555.97000003 | N19: 2302032421.3899999 | O19: 1135553932.6800001 | P19: 1037100283.2 | Q19: 418200080.01999998 | R19: 1199766026.02 | S19: 1354496759.29 | T19: 222398393.41 | U19: 865371453.85000002 | V19: 1318893856.21 | W19: 5341209627.8299999 | X19: 489580919.52999997 | Y19: 959099196.29999995 | Z19: 221856888.74000001 | AA19: 375433111.72000003 | AB19: 513533629.69999999 | AC19: 180199388.49000001 | AD19: 471510962.68000001 | AE19: 249903353.74000001 | AF19: 284925965.97000003 | AG19: 267699833.56 | AH19: 233211712.72 | AI19: 1089264386.47 | AJ19: 2052141874.3900001 | AK19: 258455671.50999999 | AL19: 4155428846.7399998 | AM19: 1739680701.97 | AN19: 3265355638.1100001
A20: 营业收入(元)2019.12.31 | B20: 585575782.24000001 | C20: 1681588076.26 | D20: 2679435637.4299998 | E20: 840861681.24000001 | F20: 2072320901.1199999 | G20: 365389084.87 | H20: 877357946.98000002 | I20: 422644271.26999998 | J20: 3222956019.79 | K20: 968204285.13999999 | L20: 1008790834.99 | M20: 578355544.11000001 | N20: 3133447697.27 | O20: 241335531.91 | P20: 138011048.05000001 | Q20: 454666503.35000002 | R20: 209802274.87 | S20: 729392802.05999994 | T20: 229568164.55000001 | U20: 208842040.5 | V20: 1386778848.03 | W20: 1098217159.0699999 | X20: 441452526.02999997 | Y20: 181155372.27000001 | Z20: 259127387.86000001 | AA20: 355159969.62 | AB20: 210412323.25 | AC20: 189982846.33000001 | AD20: 515143483.47000003 | AE20: 99168053.150000006 | AF20: 255479024.24000001 | AG20: 251153525.22999999 | AH20: 73938453.340000004 | AI20: 1522303329.3299999 | AJ20: 258872522.24000001 | AK20: 239178001.68000001 | AL20: 2414471289.3000002 | AM20: 288794709.93000001 | AN20: 367376821.29000002
A21: 营业收入(元)2018.12.31 | B21: 725034292.16999996 | C21: 1383610984.4400001 | D21: 1929676026.98 | E21: 774178200.28999996 | F21: 1650059430.26 | G21: 303446306.00999999 | H21: 728644765.14999998 | I21: 323429252.58999997 | J21: 2685304946.4099998 | K21: 686238289.65999997 | L21: 933418597.76999998 | M21: 439031481.74000001 | N21: 3135122919.8200002 | O21: 184189597.81 | P21: 78825726.409999996 | Q21: 366058490.06 | R21: 163733122.96000001 | S21: 580352056.71000004 | T21: 200090741.11000001 | U21: 180301425.22 | V21: 1320517677.1800001 | W21: 1478663128.23 | X21: 364846388.38999999 | Y21: 176381394.08000001 | Z21: 201446247.62 | AA21: 306296198.63 | AB21: 187123050.99000001 | AC21: 150540703.93000001 | AD21: 654804224.39999998 | AE21: 69343387.040000007 | AF21: 224443331.56 | AG21: 224523783.19999999 | AH21: 55828827.380000003 | AI21: 1422148983.54 | AJ21: 224350623.96000001 | AK21: 204933431.78 | AL21: 1990213558.0799999 | AM21: 230700330.36000001 | AN21: 285892848.27999997
A22: 营业收入(元)2017.12.31 | B22: 779407279.46000004 | C22: 1140564742.1199999 | D22: 1400142047.05 | E22: 694277363.10000002 | F22: 1145484483.0699999 | G22: 224596509.38 | H22: 530060629.41000003 | I22: 250829742 | J22: 1969983729.53 | K22: 488582766.19 | L22: 867690655.04999995 | M22: 330371305.08999997 | N22: 2584187565.7800002 | O22: 129720267.67 | P22: -- | Q22: 318603044.25 | R22: 110996257.94 | S22: 479085119.82999998 | T22: 156701853.69999999 | U22: 121770765.38 | V22: 1320846690.6500001 | W22: 1542429345.0999999 | X22: 302888219.45999998 | Y22: 165123343.69999999 | Z22: 146319708.97999999 | AA22: 260469661.65000001 | AB22: 142088955.69 | AC22: 134252298.91999999 | AD22: 575978026.74000001 | AE22: -- | AF22: 172318042.94999999 | AG22: 434487818.74000001 | AH22: -- | AI22: 1910941269.9000001 | AJ22: 192709557.84 | AK22: 137887788.63999999 | AL22: 1594116212.29 | AM22: 187286185.30000001 | AN22: 224237368.41999999
A23: 营业收入(元)2016.12.31 | B23: 706710877.5 | C23: 922504780.41999996 | D23: 980222975.48000002 | E23: 667402749.64999998 | F23: 547353286.90999997 | G23: -- | H23: -- | I23: 174536238.68000001 | J23: 1488780884.51 | K23: 369090356.88 | L23: 758694233.74000001 | M23: 252987005.08000001 | N23: 1055056670.89 | O23: 75699596.359999999 | P23: -- | Q23: -- | R23: -- | S23: 398303899.31999999 | T23: 125368253.34 | U23: -- | V23: 837900550.29999995 | W23: 1612560471.8099999 | X23: 231217644.44999999 | Y23: 140979148.34 | Z23: 111600293.09999999 | AA23: 241160419.22999999 | AB23: 122195767.11 | AC23: 117053027.29000001 | AD23: 533391826.12 | AE23: -- | AF23: -- | AG23: 455408516.23000002 | AH23: -- | AI23: 2098251453.6800001 | AJ23: 156641536.61000001 | AK23: 87046831.680000007 | AL23: 1396672088.9400001 | AM23: 129141955.34 | AN23: 182255120.22
A24: 营业收入(元)2015.12.31 | B24: 674606421.28999996 | C24: 731682197.27999997 | D24: 716488576.66999996 | E24: 566201720.59000003 | F24: 428779834 | G24: -- | H24: -- | I24: -- | J24: 1065169032.05 | K24: 276420264.13999999 | L24: 567325998.72000003 | M24: 176877645.24000001 | N24: 683141160.38999999 | O24: -- | P24: -- | Q24: -- | R24: -- | S24: 344833859.88999999 | T24: -- | U24: -- | V24: 708994855.88999999 | W24: 1474339102.1600001 | X24: 169382003.03 | Y24: 95341627.950000003 | Z24: -- | AA24: 202838800 | AB24: -- | AC24: 92499955.349999994 | AD24: 681675798.36000001 | AE24: -- | AF24: -- | AG24: 506408017.97000003 | AH24: -- | AI24: 1213144190.4400001 | AJ24: 126679647.65000001 | AK24: -- | AL24: 1155783343.3699999 | AM24: -- | AN24: --
A25: 营业收入(元)2014.12.31 | B25: 604504765.46000004 | C25: 545276457.40999997 | D25: 563295572.59000003 | E25: 508274279.05000001 | F25: 365395892.81999999 | G25: -- | H25: -- | I25: -- | J25: 934846080.29999995 | K25: 210293366.87 | L25: 486472263.30000001 | M25: 106810759.83 | N25: 597849201.88999999 | O25: -- | P25: -- | Q25: -- | R25: -- | S25: 264082642.78 | T25: -- | U25: -- | V25: 476864594.10000002 | W25: 1086153433.6300001 | X25: 118200965 | Y25: 57802454.549999997 | Z25: -- | AA25: 196936400 | AB25: -- | AC25: 79653010 | AD25: 536970837.99000001 | AE25: -- | AF25: -- | AG25: 415412217.22000003 | AH25: -- | AI25: 846431643.88999999 | AJ25: 101035766.02 | AK25: -- | AL25: 1217885733.45 | AM25: -- | AN25: --
A26: 营业收入(元)2013.12.31 | B26: 615510337.65999997 | C26: 378122833.82999998 | D26: 409364583.29000002 | E26: 444625403.57999998 | F26: 247643090.94 | G26: -- | H26: -- | I26: -- | J26: 779426579.57000005 | K26: 154195412.50999999 | L26: 464403761.39999998 | M26: 74377840.620000005 | N26: 432061495.63999999 | O26: -- | P26: -- | Q26: -- | R26: -- | S26: 182717806.30000001 | T26: -- | U26: -- | V26: 361309762.98000002 | W26: 854372322.70000005 | X26: 76828379.299999997 | Y26: 25947478.850000001 | Z26: -- | AA26: 142600600 | AB26: -- | AC26: 81952552.189999998 | AD26: 343630223.37 | AE26: -- | AF26: -- | AG26: 452415270.30000001 | AH26: -- | AI26: 840163626.24000001 | AJ26: 84271693.459999993 | AK26: -- | AL26: 1114434631.9400001 | AM26: -- | AN26: --
A27: 营业收入(元)2012.12.31 | B27: 676377709.29999995 | C27: 258082367.44999999 | D27: 318146292.85000002 | E27: 380144035.06999999 | F27: 227353601.02000001 | G27: -- | H27: -- | I27: -- | J27: 606154698.28999996 | K27: 73640347.290000007 | L27: 413634969.89999998 | M27: 38146803.32 | N27: 327742449.06999999 | O27: -- | P27: -- | Q27: -- | R27: -- | S27: 139014305.55000001 | T27: -- | U27: -- | V27: 300342739.94999999 | W27: 582692342.28999996 | X27: 48710540.810000002 | Y27: 7096033.3499999996 | Z27: -- | AA27: 107445800 | AB27: -- | AC27: 68406540.519999996 | AD27: 317273827.29000002 | AE27: -- | AF27: -- | AG27: 542982704.53999996 | AH27: -- | AI27: 487319582.06 | AJ27: -- | AK27: -- | AL27: 1013681321.29 | AM27: -- | AN27: --
A28: 净利润同比增长率 | B28: =(B4-B5)/B5 -> -2.1039173513699341 | C28: =(C4-C5)/C5 -> 0.24529737349698669 | D28: =(D4-D5)/D5 -> 4.2830364583424201e-02 | E28: =(E4-E5)/E5 -> 0.34604471333488201 | F28: =(F4-F5)/F5 -> -0.59264918395453914 | G28: =(G4-G5)/G5 -> -0.81220516537205567 | H28: =(H4-H5)/H5 -> -0.64923679718365634 | I28: =(I4-I5)/I5 -> 0.30656973084814587 | J28: =(J4-J5)/J5 -> -0.55856082097224125 | K28: =(K4-K5)/K5 -> -0.43923367927878798 | L28: =(L4-L5)/L5 -> 5.2560066901842069e-02 | M28: =(M4-M5)/M5 -> -8.5636007412398397e-03 | N28: =(N4-N5)/N5 -> 0.2922744561521356 | O28: =(O4-O5)/O5 -> -0.84760529681818164 | P28: =(P4-P5)/P5 -> 0.1543912731892037 | Q28: =(Q4-Q5)/Q5 -> -3.4411949087331604e-02 | R28: =(R4-R5)/R5 -> -0.95350776060819198 | S28: =(S4-S5)/S5 -> -0.91861389402479987 | T28: =(T4-T5)/T5 -> 0.12292607691548542 | U28: =(U4-U5)/U5 -> -0.86220127712464623 | V28: =(V4-V5)/V5 -> -5.7829661272001953e-02 | W28: =(W4-W5)/W5 -> -0.98066278107386351 | X28: =(X4-X5)/X5 -> -0.2833823746990991 | Y28: =(Y4-Y5)/Y5 -> -0.98219651384299955 | Z28: =(Z4-Z5)/Z5 -> 0.13637766007093369 | AA28: =(AA4-AA5)/AA5 -> -6.1766399050307695e-02 | AB28: =(AB4-AB5)/AB5 -> -0.97101526549348138 | AC28: =(AC4-AC5)/AC5 -> 0.19811505505723559 | AD28: =(AD4-AD5)/AD5 -> -1.2725590827863582 | AE28: =(AE4-AE5)/AE5 -> -0.64600073221598386 | AF28: =(AF4-AF5)/AF5 -> -0.80405250847375442 | AG28: =(AG4-AG5)/AG5 -> -3.3623304161002685 | AH28: =(AH4-AH5)/AH5 -> -1.5300142990317993 | AI28: =(AI4-AI5)/AI5 -> -6.1767779658448214 | AJ28: =(AJ4-AJ5)/AJ5 -> -1.1800103212236217 | AK28: =(AK4-AK5)/AK5 -> -3.2287310978661785 | AL28: =(AL4-AL5)/AL5 -> -1.2408645325505758 | AM28: =(AM4-AM5)/AM5 -> -1.2045031315251742 | AN28: =(AN4-AN5)/AN5 -> -1.1922816851259506
B29: =(B5-B6)/B6 -> 0.57959853903208758 | C29: =(C5-C6)/C6 -> 0.36379084673795753 | D29: =(D5-D6)/D6 -> 0.19901551141974416 | E29: =(E5-E6)/E6 -> -4.0807307312676969e-02 | F29: =(F5-F6)/F6 -> 0.88682365448078082 | G29: =(G5-G6)/G6 -> -0.13639647567672214 | H29: =(H5-H6)/H6 -> 3.9432590234082121 | I29: =(I5-I6)/I6 -> 0.32118089158055274 | J29: =(J5-J6)/J6 -> -0.25969360308933731 | K29: =(K5-K6)/K6 -> 0.25043214035192674 | L29: =(L5-L6)/L6 -> 0.24710609430813946 | M29: =(M5-M6)/M6 -> 0.10088506454268403 | N29: =(N5-N6)/N6 -> 0.10607394831070838 | O29: =(O5-O6)/O6 -> 0.54752705894633802 | P29: =(P5-P6)/P6 -> 0.25306285098712844 | Q29: =(Q5-Q6)/Q6 -> 6.9127453372382047e-02 | R29: =(R5-R6)/R6 -> 3.1226337276383722 | S29: =(S5-S6)/S6 -> 1.0254380865724775 | T29: =(T5-T6)/T6 -> 6.9276264763039552e-02 | U29: =(U5-U6)/U6 -> -7.1925450024778875e-02 | V29: =(V5-V6)/V6 -> -0.27255607271325455 | W29: =(W5-W6)/W6 -> 0.49587119630642013 | X29: =(X5-X6)/X6 -> -0.2255058030195532 | Y29: =(Y5-Y6)/Y6 -> 1.9779395350453315 | Z29: =(Z5-Z6)/Z6 -> -0.51676716868351291 | AA29: =(AA5-AA6)/AA6 -> -0.46482148067834533 | AB29: =(AB5-AB6)/AB6 -> -0.56777726375207327 | AC29: =(AC5-AC6)/AC6 -> -0.42532312701106895 | AD29: =(AD5-AD6)/AD6 -> -3.5099809080678077 | AE29: =(AE5-AE6)/AE6 -> -0.63893843717725152 | AF29: =(AF5-AF6)/AF6 -> -0.14491155069917852 | AG29: =(AG5-AG6)/AG6 -> 2.322545283062829 | AH29: =(AH5-AH6)/AH6 -> 0.26549214669101578 | AI29: =(AI5-AI6)/AI6 -> 0.25098323737554634 | AJ29: =(AJ5-AJ6)/AJ6 -> 2.3051923430399629e-03 | AK29: =(AK5-AK6)/AK6 -> -0.64920550761461726 | AL29: =(AL5-AL6)/AL6 -> 0.14245875227208418 | AM29: =(AM5-AM6)/AM6 -> 0.5319129651053216 | AN29: =(AN5-AN6)/AN6 -> -0.57974893114531834
B30: =(B6-B7)/B7 -> 2.2467504794570701 | C30: =(C6-C7)/C7 -> 3.678773662674141e-02 | D30: =(D6-D7)/D7 -> 0.30204747771189572 | E30: =(E6-E7)/E7 -> 2.6129463416928322 | F30: =(F6-F7)/F7 -> 4.1449990261880503e-04 | G30: =(G6-G7)/G7 -> -0.14289576398182005 | H30: =(H6-H7)/H7 -> -2.7477418634482696e-02 | I30: =(I6-I7)/I7 -> 0.32233010379920424 | J30: =(J6-J7)/J7 -> 0.2049158990885645 | K30: =(K6-K7)/K7 -> 0.3093096935162985 | L30: =(L6-L7)/L7 -> -0.21388734619923083 | M30: =(M6-M7)/M7 -> 0.32855580255096306 | N30: =(N6-N7)/N7 -> -0.40066886873497976 | O30: =(O6-O7)/O7 -> 0.1272906973243724 | P30: =(P6-P7)/P7 -> -0.78956706397986887 | Q30: =(Q6-Q7)/Q7 -> 0.21993843946044045 | R30: =(R6-R7)/R7 -> 0.13795863409851833 | S30: =(S6-S7)/S7 -> 1.3497337713089799 | T30: =(T6-T7)/T7 -> 0.40729943842569816 | U30: =(U6-U7)/U7 -> 0.91565418001807886 | V30: =(V6-V7)/V7 -> -2.2243009022783418 | W30: =(W6-W7)/W7 -> 0.47735948294654906 | X30: =(X6-X7)/X7 -> 0.33620109213988736 | Y30: =(Y6-Y7)/Y7 -> 2.0137356997804985 | Z30: =(Z6-Z7)/Z7 -> 0.52236598437251813 | AA30: =(AA6-AA7)/AA7 -> -5.864531513705315e-02 | AB30: =(AB6-AB7)/AB7 -> 18.504140349553872 | AC30: =(AC6-AC7)/AC7 -> 3.9028762220665786e-02 | AD30: =(AD6-AD7)/AD7 -> -1.4397323780910554 | AE30: =(AE6-AE7)/AE7 -> 5.2827407289862981e-02 | AF30: =(AF6-AF7)/AF7 -> 0.22263902495328744 | AG30: =(AG6-AG7)/AG7 -> 2.2764545427825813 | AH30: =(AH6-AH7)/AH7 -> 0.16356734563043049 | AI30: =(AI6-AI7)/AI7 -> -1.0178002681964819 | AJ30: =(AJ6-AJ7)/AJ7 -> -0.18614029144222943 | AK30: =(AK6-AK7)/AK7 -> 2.6138312018250285 | AL30: =(AL6-AL7)/AL7 -> 0.25920683696450236 | AM30: =(AM6-AM7)/AM7 -> 0.45590752744236201 | AN30: =(AN6-AN7)/AN7 -> 1.933295082592392
B31: =(B7-B8)/B8 -> -0.6982608325220393 | C31: =(C7-C8)/C8 -> 0.21555327584559286 | D31: =(D7-D8)/D8 -> -3.4062712375203641e-02 | E31: =(E7-E8)/E8 -> -0.66145769220842621 | F31: =(F7-F8)/F8 -> 0.63673185916802599 | G31: =(G7-G8)/G8 -> 65.278971732284063 | H31: =(H7-H8)/H8 -> 0.95763060562306235 | I31: =(I7-I8)/I8 -> 0.43147003087103702 | J31: =(J7-J8)/J8 -> 0.51146859948936274 | K31: =(K7-K8)/K8 -> -0.10286064986318581 | L31: =(L7-L8)/L8 -> 0.15170593874289712 | M31: =(M7-M8)/M8 -> 0.33107512836791286 | N31: =(N7-N8)/N8 -> -1.5348706242331931 | O31: =(O7-O8)/O8 -> 7.6614942918092783 | P31: =(P7-P8)/P8 -> 25.843554086432732 | Q31: =(Q7-Q8)/Q8 -> -0.16766962266353819 | R31: =(R7-R8)/R8 -> 10.913786603193937 | S31: =(S7-S8)/S8 -> 1.4622191460916931 | T31: =(T7-T8)/T8 -> -2.6064870328929599e-02 | U31: =(U7-U8)/U8 -> 14.415193235594025 | V31: =(V7-V8)/V8 -> -3.5528686957326916 | W31: =(W7-W8)/W8 -> 25.568031965118298 | X31: =(X7-X8)/X8 -> -0.2322374410354236 | Y31: =(Y7-Y8)/Y8 -> 10.292445536577356 | Z31: =(Z7-Z8)/Z8 -> -0.11311219504368059 | AA31: =(AA7-AA8)/AA8 -> 0.14538419646957951 | AB31: =(AB7-AB8)/AB8 -> 2.307971122642682 | AC31: =(AC7-AC8)/AC8 -> -0.40419663239769266 | AD31: =(AD7-AD8)/AD8 -> -9.0808752673091178 | AE31: =(AE7-AE8)/AE8 -> 15.414512597712172 | AF31: =(AF7-AF8)/AF8 -> 7.6938206845043614e-02 | AG31: =(AG7-AG8)/AG8 -> -0.44559023630902789 | AH31: =(AH7-AH8)/AH8 -> 11.055458462479058 | AI31: =(AI7-AI8)/AI8 -> -14.069251727432007 | AJ31: =(AJ7-AJ8)/AJ8 -> 17.089601704836852 | AK31: =(AK7-AK8)/AK8 -> -0.29101768032504993 | AL31: =(AL7-AL8)/AL8 -> 2.3354982905213775 | AM31: =(AM7-AM8)/AM8 -> 8.7851566568393817 | AN31: =(AN7-AN8)/AN8 -> 19.429388419836805
B32: =(B8-B9)/B9 -> 0.29434389008219791 | C32: =(C8-C9)/C9 -> 0.11327448755027776 | D32: =(D8-D9)/D9 -> 0.37611804458778608 | E32: =(E8-E9)/E9 -> 0.10304947266589677 | F32: =(F8-F9)/F9 -> 0.25903575164868803 | G32: =(G8-G9)/G9 -> 4.8382188373536801 | H32: =(H8-H9)/H9 -> 1.8276335023902142 | I32: =(I8-I9)/I9 -> 0.23927451186040805 | J32: =(J8-J9)/J9 -> 0.18055514476452891 | K32: =(K8-K9)/K9 -> 0.36079978497204535 | L32: =(L8-L9)/L9 -> 0.17278473862327939 | M32: =(M8-M9)/M9 -> 6.8931991139168355e-02 | N32: =(N8-N9)/N9 -> -3.3216293408595012 | O32: =(O8-O9)/O9 -> 0.38979166483430311 | P32: =(P8-P9)/P9 -> 0.25467261046894096 | Q32: =(Q8-Q9)/Q9 -> -1.3313962910307193 | R32: =(R8-R9)/R9 -> 0.63239951075213974 | S32: =(S8-S9)/S9 -> 0.29112449462863393 | T32: =(T8-T9)/T9 -> 0.25262810962885113 | U32: =(U8-U9)/U9 -> 0.49303803921392669 | V32: =(V8-V9)/V9 -> -0.16131028365473721 | W32: =(W8-W9)/W9 -> -9.254636618198836e-02 | X32: =(X8-X9)/X9 -> 0.108175412676411 | Y32: =(Y8-Y9)/Y9 -> -0.32390294989453478 | Z32: =(Z8-Z9)/Z9 -> 0.58982357223147797 | AA32: =(AA8-AA9)/AA9 -> 0.20362388615715041 | AB32: =(AB8-AB9)/AB9 -> -0.29627823143021881 | AC32: =(AC8-AC9)/AC9 -> 0.85170875468715768 | AD32: =(AD8-AD9)/AD9 -> -0.84410883533539427 | AE32: =(AE8-AE9)/AE9 -> -1.116662300927405 | AF32: =(AF8-AF9)/AF9 -> 1.4660980436537474 | AG32: =(AG8-AG9)/AG9 -> -1.267128208385812 | AH32: =(AH8-AH9)/AH9 -> 0.36442937970807954 | AI32: =(AI8-AI9)/AI9 -> 0.75917655032775888 | AJ32: =(AJ8-AJ9)/AJ9 -> -0.17325034800352579 | AK32: =(AK8-AK9)/AK9 -> 0.24847876534348365 | AL32: =(AL8-AL9)/AL9 -> -2.5524402579230884e-02 | AM32: =(AM8-AM9)/AM9 -> 0.31228734331004543 | AN32: =(AN8-AN9)/AN9 -> 0.25601568176132405
B33: =(B9-B10)/B10 -> -7.3784368716785353 | C33: =(C9-C10)/C10 -> 0.28946129224492828 | D33: =(D9-D10)/D10 -> 0.25977618759350918 | E33: =(E9-E10)/E10 -> 0.10072755488074499 | F33: =(F9-F10)/F10 -> 0.46061592356748532 | G33: =(G9-G10)/G10 -> -1.6347425819214298 | H33: =(H9-H10)/H10 -> 5.4522898197530347 | I33: =(I9-I10)/I10 -> 0.70522753727414145 | J33: =(J9-J10)/J10 -> 0.18922800821283819 | K33: =(K9-K10)/K10 -> 0.28673717436761204 | L33: =(L9-L10)/L10 -> 0.18122112208462443 | M33: =(M9-M10)/M10 -> 0.34733304921870478 | N33: =(N9-N10)/N10 -> 4.9942916080066846e-02 | O33: =(O9-O10)/O10 -> 0.65131537545719553 | P33: =(P9-P10)/P10 -> #VALUE! | Q33: =(Q9-Q10)/Q10 -> -2.5238627100520841e-02 | R33: =(R9-R10)/R10 -> -6.6897862026587571 | S33: =(S9-S10)/S10 -> 0.22389772822393214 | T33: =(T9-T10)/T10 -> 0.93248212284172161 | U33: =(U9-U10)/U10 -> 3.6901435374437894 | V33: =(V9-V10)/V10 -> 4.7157940987039817 | W33: =(W9-W10)/W10 -> 0.17507882719170206 | X33: =(X9-X10)/X10 -> 0.11730382305435344 | Y33: =(Y9-Y10)/Y10 -> -6.2186707684197318e-02 | Z33: =(Z9-Z10)/Z10 -> 0.88043075609797861 | AA33: =(AA9-AA10)/AA10 -> 0.27168739062462227 | AB33: =(AB9-AB10)/AB10 -> 0.60083656847499467 | AC33: =(AC9-AC10)/AC10 -> 9.2773492927303441e-02 | AD33: =(AD9-AD10)/AD10 -> -0.4461022114910228 | AE33: =(AE9-AE10)/AE10 -> #VALUE! | AF33: =(AF9-AF10)/AF10 -> -0.13587974071792769 | AG33: =(AG9-AG10)/AG10 -> -3.441756870545734 | AH33: =(AH9-AH10)/AH10 -> #VALUE! | AI33: =(AI9-AI10)/AI10 -> -1.0739818186137813 | AJ33: =(AJ9-AJ10)/AJ10 -> 0.2092603607573244 | AK33: =(AK9-AK10)/AK10 -> 0.88169550090599691 | AL33: =(AL9-AL10)/AL10 -> -4.5835331446017202e-02 | AM33: =(AM9-AM10)/AM10 -> 0.49582596752180857 | AN33: =(AN9-AN10)/AN10 -> 0.95971673414568126
B34: =(B10-B11)/B11 -> 0.61914363725973665 | C34: =(C10-C11)/C11 -> 0.19152806604123621 | D34: =(D10-D11)/D11 -> 0.27678018113153835 | E34: =(E10-E11)/E11 -> 5.5416087227896293e-03 | F34: =(F10-F11)/F11 -> 0.4532020456919551 | G34: =(G10-G11)/G11 -> #VALUE! | H34: =(H10-H11)/H11 -> #VALUE! | I34: =(I10-I11)/I11 -> 3.8166898334586712 | J34: =(J10-J11)/J11 -> 0.19905425768572349 | K34: =(K10-K11)/K11 -> 0.40208666141429078 | L34: =(L10-L11)/L11 -> 0.33768512638947118 | M34: =(M10-M11)/M11 -> 0.40325562427035661 | N34: =(N10-N11)/N11 -> 0.29412445685426331 | O34: =(O10-O11)/O11 -> 1.2466030697698252 | P34: =(P10-P11)/P11 -> #VALUE! | Q34: =(Q10-Q11)/Q11 -> #VALUE! | R34: =(R10-R11)/R11 -> #VALUE! | S34: =(S10-S11)/S11 -> 0.22492324235695904 | T34: =(T10-T11)/T11 -> -5.3973096706423022e-02 | U34: =(U10-U11)/U11 -> #VALUE! | V34: =(V10-V11)/V11 -> -0.72618744014910885 | W34: =(W10-W11)/W11 -> -0.18969498509711877 | X34: =(X10-X11)/X11 -> 0.29713418341637204 | Y34: =(Y10-Y11)/Y11 -> 9.7176288056652294e-02 | Z34: =(Z10-Z11)/Z11 -> 3.9259125232320975 | AA34: =(AA10-AA11)/AA11 -> 5.0187279890974677e-02 | AB34: =(AB10-AB11)/AB11 -> 4.4196665197581309e-02 | AC34: =(AC10-AC11)/AC11 -> -9.7008661477905447e-02 | AD34: =(AD10-AD11)/AD11 -> 4.9083056644227706e-02 | AE34: =(AE10-AE11)/AE11 -> #VALUE! | AF34: =(AF10-AF11)/AF11 -> #VALUE! | AG34: =(AG10-AG11)/AG11 -> -1.2777809064487318 | AH34: =(AH10-AH11)/AH11 -> #VALUE! | AI34: =(AI10-AI11)/AI11 -> -4.5828856837878265 | AJ34: =(AJ10-AJ11)/AJ11 -> 5.7383209859973167e-02 | AK34: =(AK10-AK11)/AK11 -> 0.67637802529267488 | AL34: =(AL10-AL11)/AL11 -> -6.2997028129795782e-02 | AM34: =(AM10-AM11)/AM11 -> 4.1033698342119056 | AN34: =(AN10-AN11)/AN11 -> -6.3726422652402373e-02
B35: =(B11-B12)/B12 -> 0.53356201429752081 | C35: =(C11-C12)/C12 -> 0.81317077064083054 | D35: =(D11-D12)/D12 -> 0.25800128887313567 | E35: =(E11-E12)/E12 -> 0.10856318074451921 | F35: =(F11-F12)/F12 -> 0.1566409665560505 | G35: =(G11-G12)/G12 -> #VALUE! | H35: =(H11-H12)/H12 -> #VALUE! | I35: =(I11-I12)/I12 -> #VALUE! | J35: =(J11-J12)/J12 -> 0.24290268052738825 | K35: =(K11-K12)/K12 -> 0.31684650294200084 | L35: =(L11-L12)/L12 -> 0.15569272002919765 | M35: =(M11-M12)/M12 -> 2.1792007680246201 | N35: =(N11-N12)/N12 -> 0.10062250583315313 | O35: =(O11-O12)/O12 -> #VALUE! | P35: =(P11-P12)/P12 -> #VALUE! | Q35: =(Q11-Q12)/Q12 -> #VALUE! | R35: =(R11-R12)/R12 -> #VALUE! | S35: =(S11-S12)/S12 -> 0.16687681292144557 | T35: =(T11-T12)/T12 -> #VALUE! | U35: =(U11-U12)/U12 -> #VALUE! | V35: =(V11-V12)/V12 -> -0.81828963271042321 | W35: =(W11-W12)/W12 -> 5.3815728886526255e-02 | X35: =(X11-X12)/X12 -> 0.48628228249937261 | Y35: =(Y11-Y12)/Y12 -> 0.67690569137547396 | Z35: =(Z11-Z12)/Z12 -> #VALUE! | AA35: =(AA11-AA12)/AA12 -> -2.3837607814610834e-02 | AB35: =(AB11-AB12)/AB12 -> #VALUE! | AC35: =(AC11-AC12)/AC12 -> 0.1261862646467167 | AD35: =(AD11-AD12)/AD12 -> -0.55699808683469509 | AE35: =(AE11-AE12)/AE12 -> #VALUE! | AF35: =(AF11-AF12)/AF12 -> #VALUE! | AG35: =(AG11-AG12)/AG12 -> -8.8612074649791364 | AH35: =(AH11-AH12)/AH12 -> #VALUE! | AI35: =(AI11-AI12)/AI12 -> 0.1756431540769737 | AJ35: =(AJ11-AJ12)/AJ12 -> 0.49849437754957043 | AK35: =(AK11-AK12)/AK12 -> #VALUE! | AL35: =(AL11-AL12)/AL12 -> 0.10338545054539866 | AM35: =(AM11-AM12)/AM12 -> #VALUE! | AN35: =(AN11-AN12)/AN12 -> #VALUE!
B36: =(B12-B13)/B13 -> 0.20100995089615672 | C36: =(C12-C13)/C13 -> -1.4844348157831961e-02 | D36: =(D12-D13)/D13 -> 0.33524810258339255 | E36: =(E12-E13)/E13 -> 0.16332270971703647 | F36: =(F12-F13)/F13 -> 0.27436339693763501 | G36: =(G12-G13)/G13 -> #VALUE! | H36: =(H12-H13)/H13 -> #VALUE! | I36: =(I12-I13)/I13 -> #VALUE! | J36: =(J12-J13)/J13 -> 0.10977657677646756 | K36: =(K12-K13)/K13 -> 0.39835782436545991 | L36: =(L12-L13)/L13 -> 6.8264246153679875e-02 | M36: =(M12-M13)/M13 -> 0.10168869318143911 | N36: =(N12-N13)/N13 -> 0.17128427470377672 | O36: =(O12-O13)/O13 -> #VALUE! | P36: =(P12-P13)/P13 -> #VALUE! | Q36: =(Q12-Q13)/Q13 -> #VALUE! | R36: =(R12-R13)/R13 -> #VALUE! | S36: =(S12-S13)/S13 -> 2.7625085527784865e-02 | T36: =(T12-T13)/T13 -> #VALUE! | U36: =(U12-U13)/U13 -> #VALUE! | V36: =(V12-V13)/V13 -> 4.87489535049653 | W36: =(W12-W13)/W13 -> -0.33855802881469166 | X36: =(X12-X13)/X13 -> 0.82701780742942455 | Y36: =(Y12-Y13)/Y13 -> 0.65260260596379116 | Z36: =(Z12-Z13)/Z13 -> #VALUE! | AA36: =(AA12-AA13)/AA13 -> 8.4174488064416741e-02 | AB36: =(AB12-AB13)/AB13 -> #VALUE! | AC36: =(AC12-AC13)/AC13 -> 0.43311877835010326 | AD36: =(AD12-AD13)/AD13 -> 0.22558417839836359 | AE36: =(AE12-AE13)/AE13 -> #VALUE! | AF36: =(AF12-AF13)/AF13 -> #VALUE! | AG36: =(AG12-AG13)/AG13 -> -1.0823860154186788 | AH36: =(AH12-AH13)/AH13 -> #VALUE! | AI36: =(AI12-AI13)/AI13 -> 0.60997621757541964 | AJ36: =(AJ12-AJ13)/AJ13 -> -7.0344068372082527e-02 | AK36: =(AK12-AK13)/AK13 -> #VALUE! | AL36: =(AL12-AL13)/AL13 -> -0.27861737102868844 | AM36: =(AM12-AM13)/AM13 -> #VALUE! | AN36: =(AN12-AN13)/AN13 -> #VALUE!
B37: =(B13-B14)/B14 -> -0.27028268088489743 | C37: =(C13-C14)/C14 -> 0.79002041318178906 | D37: =(D13-D14)/D14 -> 0.67818460381369849 | E37: =(E13-E14)/E14 -> 0.16609816277232448 | F37: =(F13-F14)/F14 -> 0.66708701636001233 | G37: =(G13-G14)/G14 -> #VALUE! | H37: =(H13-H14)/H14 -> #VALUE! | I37: =(I13-I14)/I14 -> #VALUE! | J37: =(J13-J14)/J14 -> 0.17113119487887199 | K37: =(K13-K14)/K14 -> 0.14487947846596985 | L37: =(L13-L14)/L14 -> 8.2803313563563963e-02 | M37: =(M13-M14)/M14 -> -0.13200887209019568 | N37: =(N13-N14)/N14 -> 0.32989983890193159 | O37: =(O13-O14)/O14 -> #VALUE! | P37: =(P13-P14)/P14 -> #VALUE! | Q37: =(Q13-Q14)/Q14 -> #VALUE! | R37: =(R13-R14)/R14 -> #VALUE! | S37: =(S13-S14)/S14 -> 1.1754966616068325 | T37: =(T13-T14)/T14 -> #VALUE! | U37: =(U13-U14)/U14 -> #VALUE! | V37: =(V13-V14)/V14 -> 3.9149527800215784 | W37: =(W13-W14)/W14 -> 6.462009575458548e-02 | X37: =(X13-X14)/X14 -> 0.5947231291574353 | Y37: =(Y13-Y14)/Y14 -> 1.9417170300805042 | Z37: =(Z13-Z14)/Z14 -> #VALUE! | AA37: =(AA13-AA14)/AA14 -> 0.13167652408323424 | AB37: =(AB13-AB14)/AB14 -> #VALUE! | AC37: =(AC13-AC14)/AC14 -> -0.15601699795349008 | AD37: =(AD13-AD14)/AD14 -> 0.16543099371151809 | AE37: =(AE13-AE14)/AE14 -> #VALUE! | AF37: =(AF13-AF14)/AF14 -> #VALUE! | AG37: =(AG13-AG14)/AG14 -> -5.6026900196768175 | AH37: =(AH13-AH14)/AH14 -> #VALUE! | AI37: =(AI13-AI14)/AI14 -> -2.3063408123405362 | AJ37: =(AJ13-AJ14)/AJ14 -> 0.18301214223807441 | AK37: =(AK13-AK14)/AK14 -> #VALUE! | AL37: =(AL13-AL14)/AL14 -> 1.2641014457340047e-02 | AM37: =(AM13-AM14)/AM14 -> #VALUE! | AN37: =(AN13-AN14)/AN14 -> #VALUE!
B38: =(B14-B15)/B15 -> -0.42519856436958026 | C38: =(C14-C15)/C15 -> 0.88034825551641371 | D38: =(D14-D15)/D15 -> 0.29080279448806717 | E38: =(E14-E15)/E15 -> 0.31842554318013455 | F38: =(F14-F15)/F15 -> 0.55647074488845605 | G38: =(G14-G15)/G15 -> #VALUE! | H38: =(H14-H15)/H15 -> #VALUE! | I38: =(I14-I15)/I15 -> #VALUE! | J38: =(J14-J15)/J15 -> 0.2208880897272574 | K38: =(K14-K15)/K15 -> 1.9884718683066072 | L38: =(L14-L15)/L15 -> 0.11143364117811018 | M38: =(M14-M15)/M15 -> 1.7657080389885262 | N38: =(N14-N15)/N15 -> 0.12857943530843083 | O38: =(O14-O15)/O15 -> #VALUE! | P38: =(P14-P15)/P15 -> #VALUE! | Q38: =(Q14-Q15)/Q15 -> #VALUE! | R38: =(R14-R15)/R15 -> #VALUE! | S38: =(S14-S15)/S15 -> 0.47881438298568285 | T38: =(T14-T15)/T15 -> #VALUE! | U38: =(U14-U15)/U15 -> #VALUE! | V38: =(V14-V15)/V15 -> -0.48084139494329536 | W38: =(W14-W15)/W15 -> 0.59446995158236626 | X38: =(X14-X15)/X15 -> 0.65782778878083448 | Y38: =(Y14-Y15)/Y15 -> 4.2231266866226838 | Z38: =(Z14-Z15)/Z15 -> #VALUE! | AA38: =(AA14-AA15)/AA15 -> 0.38569569089538946 | AB38: =(AB14-AB15)/AB15 -> #VALUE! | AC38: =(AC14-AC15)/AC15 -> 3.7543175085624339e-02 | AD38: =(AD14-AD15)/AD15 -> 0.11990304241949087 | AE38: =(AE14-AE15)/AE15 -> #VALUE! | AF38: =(AF14-AF15)/AF15 -> #VALUE! | AG38: =(AG14-AG15)/AG15 -> -1.0975520181213549 | AH38: =(AH14-AH15)/AH15 -> #VALUE! | AI38: =(AI14-AI15)/AI15 -> -4.7453086367088018 | AJ38: =(AJ14-AJ15)/AJ15 -> #VALUE! | AK38: =(AK14-AK15)/AK15 -> #VALUE! | AL38: =(AL14-AL15)/AL15 -> 0.20222303450557125 | AM38: =(AM14-AM15)/AM15 -> #VALUE! | AN38: =(AN14-AN15)/AN15 -> #VALUE!
A39: 营业收入同比增长率 | B39: =(B16-B17)/B17 -> -0.30520921674413376 | C39: =(C16-C17)/C17 -> 0.28969898767329794 | D39: =(D16-D17)/D17 -> 4.566723243243813e-04 | E39: =(E16-E17)/E17 -> 0.15272955535866975 | F39: =(F16-F17)/F17 -> -0.51326331401177516 | G39: =(G16-G17)/G17 -> -0.84386616271280679 | H39: =(H16-H17)/H17 -> -0.48424343204234965 | I39: =(I16-I17)/I17 -> 0.16547982553921703 | J39: =(J16-J17)/J17 -> -0.19749474391434488 | K39: =(K16-K17)/K17 -> -0.24848137173565671 | L39: =(L16-L17)/L17 -> 0.12954973312643259 | M39: =(M16-M17)/M17 -> 0.23905360408705961 | N39: =(N16-N17)/N17 -> -0.24234475931334473 | O39: =(O16-O17)/O17 -> -0.77728147772507661 | P39: =(P16-P17)/P17 -> 7.0307103174474e-02 | Q39: =(Q16-Q17)/Q17 -> -4.2833738270815679e-02 | R39: =(R16-R17)/R17 -> -0.91836417133941028 | S39: =(S16-S17)/S17 -> -0.80266936583601989 | T39: =(T16-T17)/T17 -> 0.20398313637902277 | U39: =(U16-U17)/U17 -> -0.76745032498148302 | V39: =(V16-V17)/V17 -> 2.2404452231126533e-02 | W39: =(W16-W17)/W17 -> -0.90196879886735348 | X39: =(X16-X17)/X17 -> -0.24185561627241273 | Y39: =(Y16-Y17)/Y17 -> -0.92882079773063653 | Z39: =(Z16-Z17)/Z17 -> 0.23101072468859432 | AA39: =(AA16-AA17)/AA17 -> -1.9887777580699217e-02 | AB39: =(AB16-AB17)/AB17 -> -0.84781572952157236 | AC39: =(AC16-AC17)/AC17 -> 1.7949060938291277e-02 | AD39: =(AD16-AD17)/AD17 -> -0.34621846105250792 | AE39: =(AE16-AE17)/AE17 -> -0.45890082500985491 | AF39: =(AF16-AF17)/AF17 -> -0.39143896596652583 | AG39: =(AG16-AG17)/AG17 -> -0.19693831941434739 | AH39: =(AH16-AH17)/AH17 -> -0.67150855581022972 | AI39: =(AI16-AI17)/AI17 -> -0.5829496683884956 | AJ39: =(AJ16-AJ17)/AJ17 -> -0.88207084402820624 | AK39: =(AK16-AK17)/AK17 -> -0.63006635437988545 | AL39: =(AL16-AL17)/AL17 -> -0.65163227115937028 | AM39: =(AM16-AM17)/AM17 -> -0.92715548465468622 | AN39: =(AN16-AN17)/AN17 -> -0.90645949803476067
B40: =(B17-B18)/B18 -> 0.6178709092849729 | C40: =(C17-C18)/C18 -> 0.19703677261725511 | D40: =(D17-D18)/D18 -> 0.17942784525408817 | E40: =(E17-E18)/E18 -> -5.5341586914690037e-02 | F40: =(F17-F18)/F18 -> 0.69010414506848561 | G40: =(G17-G18)/G18 -> 0.42879621975642673 | H40: =(H17-H18)/H18 -> 2.3795479359252383 | I40: =(I17-I18)/I18 -> 0.26337982327311521 | J40: =(J17-J18)/J18 -> -9.3511248576799502e-02 | K40: =(K17-K18)/K18 -> 0.29974951927250409 | L40: =(L17-L18)/L18 -> 0.34689166252541015 | M40: =(M17-M18)/M18 -> -8.1625123165384228e-02 | N40: =(N17-N18)/N18 -> 0.1055077109480274 | O40: =(O17-O18)/O18 -> 0.80875305126156782 | P40: =(P17-P18)/P18 -> 0.36619309608212142 | Q40: =(Q17-Q18)/Q18 -> -1.1692439012790689e-02 | R40: =(R17-R18)/R18 -> 2.8796736970924637 | S40: =(S17-S18)/S18 -> 1.0938731742897352 | T40: =(T17-T18)/T18 -> -4.6276457276035285e-02 | U40: =(U17-U18)/U18 -> 4.5690079234433613e-02 | V40: =(V17-V18)/V18 -> 1.2738829405105585e-02 | W40: =(W17-W18)/W18 -> 0.5717279397189956 | X40: =(X17-X18)/X18 -> 9.3772309949011673e-02 | Y40: =(Y17-Y18)/Y18 -> 2.7211703542209214 | Z40: =(Z17-Z18)/Z18 -> 8.4489759319502315e-03 | AA40: =(AA17-AA18)/AA18 -> 0.15579525733230704 | AB40: =(AB17-AB18)/AB18 -> -0.33760167670181868 | AC40: =(AC17-AC18)/AC18 -> -6.5954920945109713e-02 | AD40: =(AD17-AD18)/AD18 -> 0.25160330920906254 | AE40: =(AE17-AE18)/AE18 -> 3.9487484125352156e-02 | AF40: =(AF17-AF18)/AF18 -> 0.4583117826939116 | AG40: =(AG17-AG18)/AG18 -> 8.2330083291219658e-02 | AH40: =(AH17-AH18)/AH18 -> 0.54108416915540192 | AI40: =(AI17-AI18)/AI18 -> 0.33955414452666677 | AJ40: =(AJ17-AJ18)/AJ18 -> 0.15227899659977789 | AK40: =(AK17-AK18)/AK18 -> 0.14954297572092171 | AL40: =(AL17-AL18)/AL18 -> 0.43580897713898675 | AM40: =(AM17-AM18)/AM18 -> 0.94953220563640106 | AN40: =(AN17-AN18)/AN18 -> -0.13779196568904439
B41: =(B18-B19)/B19 -> -9.1160619512417343e-02 | C41: =(C18-C19)/C19 -> 0.15966019186290892 | D41: =(D18-D19)/D19 -> 0.26452336153719824 | E41: =(E18-E19)/E19 -> 0.88580294551061012 | F41: =(F18-F19)/F19 -> 0.19574283039171075 | G41: =(G18-G19)/G19 -> -5.2157572869035711e-02 | H41: =(H18-H19)/H19 -> 0.17906703762159859 | I41: =(I18-I19)/I19 -> 0.40497414707540291 | J41: =(J18-J19)/J19 -> 7.4724451238551703e-02 | K41: =(K18-K19)/K19 -> 0.24780285003504138 | L41: =(L18-L19)/L19 -> -3.3546383088183612e-02 | M41: =(M18-M19)/M19 -> 0.25898583358042537 | N41: =(N18-N19)/N19 -> -2.1937229893359653e-02 | O41: =(O18-O19)/O19 -> 0.6497919523985598 | P41: =(P18-P19)/P19 -> -0.68478775580764395 | Q41: =(Q18-Q19)/Q19 -> 0.1257161290774638 | R41: =(R18-R19)/R19 -> 0.32465753149565096 | S41: =(S18-S19)/S19 -> 0.97344359462413554 | T41: =(T18-T19)/T19 -> 7.8763919925027487e-02 | U41: =(U18-U19)/U19 -> 1.1009196627199329 | V41: =(V18-V19)/V19 -> 0.16410327218594484 | W41: =(W18-W19)/W19 -> 0.43493005073904933 | X41: =(X18-X19)/X19 -> 0.33703863961530239 | Y41: =(Y18-Y19)/Y19 -> 1.9505076818090128 | Z41: =(Z18-Z19)/Z19 -> 0.43203816502777126 | AA41: =(AA18-AA19)/AA19 -> 0.16928643176630664 | AB41: =(AB18-AB19)/AB19 -> 9.455408275338506 | AC41: =(AC18-AC19)/AC19 -> 0.1690863785683204 | AD41: =(AD18-AD19)/AD19 -> 0.19627755985560999 | AE41: =(AE18-AE19)/AE19 -> 0.16967716889512441 | AF41: =(AF18-AF19)/AF19 -> 2.1148052194844287e-02 | AG41: =(AG18-AG19)/AG19 -> 0.58654210524493078 | AH41: =(AH18-AH19)/AH19 -> 0.45131347976663494 | AI41: =(AI18-AI19)/AI19 -> 0.1765278027799505 | AJ41: =(AJ18-AJ19)/AJ19 -> -1.6232857009412262e-02 | AK41: =(AK18-AK19)/AK19 -> 1.3119617367223468 | AL41: =(AL18-AL19)/AL19 -> 0.16818521089304281 | AM41: =(AM18-AM19)/AM19 -> 0.63192954902304688 | AN41: =(AN18-AN19)/AN19 -> 2.1142603876268593
B42: =(B19-B20)/B20 -> -0.26912144986113995 | C42: =(C19-C20)/C20 -> 0.30529382804128757 | D42: =(D19-D20)/D20 -> 0.11147719458434042 | E42: =(E19-E20)/E20 -> 8.6302087750015615e-03 | F42: =(F19-F20)/F20 -> 0.35637354856135534 | G42: =(G19-G20)/G20 -> 12.03532070481687 | H42: =(H19-H20)/H20 -> 0.13865384848764936 | I42: =(I19-I20)/I20 -> 0.31037630912592784 | J42: =(J19-J20)/J20 -> 0.14921735945107178 | K42: =(K19-K20)/K20 -> 0.16022582818621622 | L42: =(L19-L20)/L20 -> -7.0931373648640744e-02 | M42: =(M19-M20)/M20 -> 0.25941657063369344 | N42: =(N19-N20)/N20 -> -0.26533561629395197 | O42: =(O19-O20)/O20 -> 3.7052911094064522 | P42: =(P19-P20)/P20 -> 6.5146178356986981 | Q42: =(Q19-Q20)/Q20 -> -8.0204772204052976e-02 | R42: =(R19-R20)/R20 -> 4.7185558486599453 | S42: =(S19-S20)/S20 -> 0.8570196408088202 | T42: =(T19-T20)/T20 -> -3.123155666664067e-02 | U42: =(U19-U20)/U20 -> 3.1436650004863367 | V42: =(V19-V20)/V20 -> -4.8951562764628628e-02 | W42: =(W19-W20)/W20 -> 3.8635277492413991 | X42: =(X19-X20)/X20 -> 0.10902280689799319 | Y42: =(Y19-Y20)/Y20 -> 4.294345866102864 | Z42: =(Z19-Z20)/Z20 -> -0.14383079854197547 | AA42: =(AA19-AA20)/AA20 -> 5.7081720447524187e-02 | AB42: =(AB19-AB20)/AB20 -> 1.4406062428665285 | AC42: =(AC19-AC20)/AC20 -> -5.1496532602770609e-02 | AD42: =(AD19-AD20)/AD20 -> -8.4699743256173812e-02 | AE42: =(AE19-AE20)/AE20 -> 1.5199985862584213 | AF42: =(AF19-AF20)/AF20 -> 0.11526168074893388 | AG42: =(AG19-AG20)/AG20 -> 6.5881250581083128e-02 | AH42: =(AH19-AH20)/AH20 -> 2.1541329603906481 | AI42: =(AI19-AI20)/AI20 -> -0.284462980876873 | AJ42: =(AJ19-AJ20)/AJ20 -> 6.9272294202297182 | AK42: =(AK19-AK20)/AK20 -> 8.0599677623328758e-02 | AL42: =(AL19-AL20)/AL20 -> 0.72105125671000847 | AM42: =(AM19-AM20)/AM20 -> 5.023935488263187 | AN42: =(AN19-AN20)/AN20 -> 7.8883006463066785
B43: =(B20-B21)/B21 -> -0.19234746747302939 | C43: =(C20-C21)/C21 -> 0.21536190097580252 | D43: =(D20-D21)/D21 -> 0.38854170335701155 | E43: =(E20-E21)/E21 -> 8.6134537145351076e-02 | F43: =(F20-F21)/F21 -> 0.25590682560655659 | G43: =(G20-G21)/G21 -> 0.20413093728008244 | H43: =(H20-H21)/H21 -> 0.20409558805982186 | I43: =(I20-I21)/I21 -> 0.30675957071134641 | J43: =(J20-J21)/J21 -> 0.20021974565636913 | K43: =(K20-K21)/K21 -> 0.41088642200321029 | L43: =(L20-L21)/L21 -> 8.0748591682305651e-02 | M43: =(M20-M21)/M21 -> 0.31734412716332144 | N43: =(N20-N21)/N21 -> -5.3434030908630907e-04 | O43: =(O20-O21)/O21 -> 0.31025603388823642 | P43: =(P20-P21)/P21 -> 0.75083763049840591 | Q43: =(Q20-Q21)/Q21 -> 0.24205971366891788 | R43: =(R20-R21)/R21 -> 0.28136733165014316 | S43: =(S20-S21)/S21 -> 0.25681091955615326 | T43: =(T20-T21)/T21 -> 0.14732027717261922 | U43: =(U20-U21)/U21 -> 0.15829389726218385 | V43: =(V20-V21)/V21 -> 5.0178177842724804e-02 | W43: =(W20-W21)/W21 -> -0.25729049564886647 | X43: =(X20-X21)/X21 -> 0.20996819504791805 | Y43: =(Y20-Y21)/Y21 -> 2.7066223253880733e-02 | Z43: =(Z20-Z21)/Z21 -> 0.2863351436002291 | AA43: =(AA20-AA21)/AA21 -> 0.15953110488656935 | AB43: =(AB20-AB21)/AB21 -> 0.12445966510691719 | AC43: =(AC20-AC21)/AC21 -> 0.26200317502394721 | AD43: =(AD20-AD21)/AD21 -> -0.21328625522838021 | AE43: =(AE20-AE21)/AE21 -> 0.43010108653613865 | AF43: =(AF20-AF21)/AF21 -> 0.13827852431295468 | AG43: =(AG20-AG21)/AG21 -> 0.11860543970203333 | AH43: =(AH20-AH21)/AH21 -> 0.32437768819209617 | AI43: =(AI20-AI21)/AI21 -> 7.0424650967788688e-02 | AJ43: =(AJ20-AJ21)/AJ21 -> 0.15387475938624975 | AK43: =(AK20-AK21)/AK21 -> 0.16710094396292652 | AL43: =(AL20-AL21)/AL21 -> 0.21317196312806272 | AM43: =(AM20-AM21)/AM21 -> 0.25181749622701316 | AN43: =(AN20-AN21)/AN21 -> 0.28501577951399343
B44: =(B21-B22)/B22 -> -6.9761970054567038e-02 | C44: =(C21-C22)/C22 -> 0.21309289454997815 | D44: =(D21-D22)/D22 -> 0.37820018407824452 | E44: =(E21-E22)/E22 -> 0.11508489464964948 | F44: =(F21-F22)/F22 -> 0.44049042535931565 | G44: =(G21-G22)/G22 -> 0.35107311706519984 | H44: =(H21-H22)/H22 -> 0.37464419110138403 | I44: =(I21-I22)/I22 -> 0.28943740886198405 | J44: =(J21-J22)/J22 -> 0.36311021566186319 | K44: =(K21-K22)/K22 -> 0.40454870115728914 | L44: =(L21-L22)/L22 -> 7.5750432873121706e-02 | M44: =(M21-M22)/M22 -> 0.32890319157833264 | N44: =(N21-N22)/N22 -> 0.21319480108004776 | O44: =(O21-O22)/O22 -> 0.41989837916898587 | P44: =(P21-P22)/P22 -> #VALUE! | Q44: =(Q21-Q22)/Q22 -> 0.14894850085852562 | R44: =(R21-R22)/R22 -> 0.47512290953544928 | S44: =(S21-S22)/S22 -> 0.21137566726333293 | T44: =(T21-T22)/T22 -> 0.27688815662044736 | U44: =(U21-U22)/U22 -> 0.48066265870423164 | V44: =(V21-V22)/V22 -> -2.4909285258391207e-04 | W44: =(W21-W22)/W22 -> -4.1341418375222719e-02 | X44: =(X21-X22)/X22 -> 0.20455786970011994 | Y44: =(Y21-Y22)/Y22 -> 6.8179641519698866e-02 | Z44: =(Z21-Z22)/Z22 -> 0.37675402052320306 | AA44: =(AA21-AA22)/AA22 -> 0.17593809847067074 | AB44: =(AB21-AB22)/AB22 -> 0.31694296774375857 | AC44: =(AC21-AC22)/AC22 -> 0.12132682375671025 | AD44: =(AD21-AD22)/AD22 -> 0.1368562583995632 | AE44: =(AE21-AE22)/AE22 -> #VALUE! | AF44: =(AF21-AF22)/AF22 -> 0.30249466461921665 | AG44: =(AG21-AG22)/AG22 -> -0.48324492997039281 | AH44: =(AH21-AH22)/AH22 -> #VALUE! | AI44: =(AI21-AI22)/AI22 -> -0.25578613747013729 | AJ44: =(AJ21-AJ22)/AJ22 -> 0.16419043494599511 | AK44: =(AK21-AK22)/AK22 -> 0.48623336265870526 | AL44: =(AL21-AL22)/AL22 -> 0.24847457339449122 | AM44: =(AM21-AM22)/AM22 -> 0.23180644632415395 | AN44: =(AN21-AN22)/AN22 -> 0.27495631211885407
B45: =(B22-B23)/B23 -> 0.10286583138095258 | C45: =(C22-C23)/C23 -> 0.23637813735850899 | D45: =(D22-D23)/D23 -> 0.4283913783640626 | E45: =(E22-E23)/E23 -> 4.0267459886992762e-02 | F45: =(F22-F23)/F23 -> 1.0927698991937347 | G45: =(G22-G23)/G23 -> #VALUE! | H45: =(H22-H23)/H23 -> #VALUE! | I45: =(I22-I23)/I23 -> 0.43712127577057963 | J45: =(J22-J23)/J23 -> 0.32321938710166709 | K45: =(K22-K23)/K23 -> 0.32374839136978539 | L45: =(L22-L23)/L23 -> 0.14366317346673332 | M45: =(M22-M23)/M23 -> 0.3058825095997692 | N45: =(N22-N23)/N23 -> 1.4493353173153172 | O45: =(O22-O23)/O23 -> 0.71361901393895366 | P45: =(P22-P23)/P23 -> #VALUE! | Q45: =(Q22-Q23)/Q23 -> #VALUE! | R45: =(R22-R23)/R23 -> #VALUE! | S45: =(S22-S23)/S23 -> 0.20281302956840958 | T45: =(T22-T23)/T23 -> 0.24993249507132348 | U45: =(U22-U23)/U23 -> #VALUE! | V45: =(V22-V23)/V23 -> 0.57637644488607531 | W45: =(W22-W23)/W23 -> -4.3490540625296469e-02 | X45: =(X22-X23)/X23 -> 0.30997018060833376 | Y45: =(Y22-Y23)/Y23 -> 0.17126075483000738 | Z45: =(Z22-Z23)/Z23 -> 0.31110505999199745 | AA45: =(AA22-AA23)/AA23 -> 8.0068041354598773e-02 | AB45: =(AB22-AB23)/AB23 -> 0.16279768972760122 | AC45: =(AC22-AC23)/AC23 -> 0.14693572672314248 | AD45: =(AD22-AD23)/AD23 -> 7.9840369751783866e-02 | AE45: =(AE22-AE23)/AE23 -> #VALUE! | AF45: =(AF22-AF23)/AF23 -> #VALUE! | AG45: =(AG22-AG23)/AG23 -> -4.5938309768968393e-02 | AH45: =(AH22-AH23)/AH23 -> #VALUE! | AI45: =(AI22-AI23)/AI23 -> -8.9269655193846109e-02 | AJ45: =(AJ22-AJ23)/AJ23 -> 0.23025834660828653 | AK45: =(AK22-AK23)/AK23 -> 0.58406441657636188 | AL45: =(AL22-AL23)/AL23 -> 0.14136755857980202 | AM45: =(AM22-AM23)/AM23 -> 0.45023501314441228 | AN45: =(AN22-AN23)/AN23 -> 0.23034879979955158
B46: =(B23-B24)/B24 -> 4.758990605012188e-02 | C46: =(C23-C24)/C24 -> 0.2607998169825308 | D46: =(D23-D24)/D24 -> 0.36809295695368882 | E46: =(E23-E24)/E24 -> 0.17873670351009405 | F46: =(F23-F24)/F24 -> 0.27653691593620972 | G46: =(G23-G24)/G24 -> #VALUE! | H46: =(H23-H24)/H24 -> #VALUE! | I46: =(I23-I24)/I24 -> #VALUE! | J46: =(J23-J24)/J24 -> 0.39769448764833726 | K46: =(K23-K24)/K24 -> 0.33525072059501726 | L46: =(L23-L24)/L24 -> 0.33731617350829096 | M46: =(M23-M24)/M24 -> 0.43029383242144298 | N46: =(N23-N24)/N24 -> 0.54441970717688326 | O46: =(O23-O24)/O24 -> #VALUE! | P46: =(P23-P24)/P24 -> #VALUE! | Q46: =(Q23-Q24)/Q24 -> #VALUE! | R46: =(R23-R24)/R24 -> #VALUE! | S46: =(S23-S24)/S24 -> 0.15506029322948925 | T46: =(T23-T24)/T24 -> #VALUE! | U46: =(U23-U24)/U24 -> #VALUE! | V46: =(V23-V24)/V24 -> 0.18181471041589559 | W46: =(W23-W24)/W24 -> 9.3751410002961194e-02 | X46: =(X23-X24)/X24 -> 0.36506618361956672 | Y46: =(Y23-Y24)/Y24 -> 0.47867360114653884 | Z46: =(Z23-Z24)/Z24 -> #VALUE! | AA46: =(AA23-AA24)/AA24 -> 0.18892647378115029 | AB46: =(AB23-AB24)/AB24 -> #VALUE! | AC46: =(AC23-AC24)/AC24 -> 0.26543874369556669 | AD46: =(AD23-AD24)/AD24 -> -0.21752858557799307 | AE46: =(AE23-AE24)/AE24 -> #VALUE! | AF46: =(AF23-AF24)/AF24 -> #VALUE! | AG46: =(AG23-AG24)/AG24 -> -0.10070832200571764 | AH46: =(AH23-AH24)/AH24 -> #VALUE! | AI46: =(AI23-AI24)/AI24 -> 0.72959774296819324 | AJ46: =(AJ23-AJ24)/AJ24 -> 0.23651699002811369 | AK46: =(AK23-AK24)/AK24 -> #VALUE! | AL46: =(AL23-AL24)/AL24 -> 0.20842032977186165 | AM46: =(AM23-AM24)/AM24 -> #VALUE! | AN46: =(AN23-AN24)/AN24 -> #VALUE!
B47: =(B24-B25)/B25 -> 0.11596543126778466 | C47: =(C24-C25)/C25 -> 0.3418554704441224 | D47: =(D24-D25)/D25 -> 0.27195847355168701 | E47: =(E24-E25)/E25 -> 0.11396886273346438 | F47: =(F24-F25)/F25 -> 0.17346648505221152 | G47: =(G24-G25)/G25 -> #VALUE! | H47: =(H24-H25)/H25 -> #VALUE! | I47: =(I24-I25)/I25 -> #VALUE! | J47: =(J24-J25)/J25 -> 0.13940578507659601 | K47: =(K24-K25)/K25 -> 0.31445070405325037 | L47: =(L24-L25)/L25 -> 0.1662042042675283 | M47: =(M24-M25)/M25 -> 0.65599089007061151 | N47: =(N24-N25)/N25 -> 0.14266466900075098 | O47: =(O24-O25)/O25 -> #VALUE! | P47: =(P24-P25)/P25 -> #VALUE! | Q47: =(Q24-Q25)/Q25 -> #VALUE! | R47: =(R24-R25)/R25 -> #VALUE! | S47: =(S24-S25)/S25 -> 0.30578010072881467 | T47: =(T24-T25)/T25 -> #VALUE! | U47: =(U24-U25)/U25 -> #VALUE! | V47: =(V24-V25)/V25 -> 0.48678443453766146 | W47: =(W24-W25)/W25 -> 0.35739487305458911 | X47: =(X24-X25)/X25 -> 0.4330001707684874 | Y47: =(Y24-Y25)/Y25 -> 0.64943908856894739 | Z47: =(Z24-Z25)/Z25 -> #VALUE! | AA47: =(AA24-AA25)/AA25 -> 2.9971097267950466e-02 | AB47: =(AB24-AB25)/AB25 -> #VALUE! | AC47: =(AC24-AC25)/AC25 -> 0.1612863763717152 | AD47: =(AD24-AD25)/AD25 -> 0.26948383437667212 | AE47: =(AE24-AE25)/AE25 -> #VALUE! | AF47: =(AF24-AF25)/AF25 -> #VALUE! | AG47: =(AG24-AG25)/AG25 -> 0.21904940918434548 | AH47: =(AH24-AH25)/AH25 -> #VALUE! | AI47: =(AI24-AI25)/AI25 -> 0.43324531779633829 | AJ47: =(AJ24-AJ25)/AJ25 -> 0.25380993919444145 | AK47: =(AK24-AK25)/AK25 -> #VALUE! | AL47: =(AL24-AL25)/AL25 -> -5.0991967780161011e-02 | AM47: =(AM24-AM25)/AM25 -> #VALUE! | AN47: =(AN24-AN25)/AN25 -> #VALUE!
B48: =(B25-B26)/B26 -> -1.7880401882184579e-02 | C48: =(C25-C26)/C26 -> 0.4420617022434315 | D48: =(D25-D26)/D26 -> 0.37602419843670987 | E48: =(E25-E26)/E26 -> 0.14315168444609103 | F48: =(F25-F26)/F26 -> 0.47549399191003328 | G48: =(G25-G26)/G26 -> #VALUE! | H48: =(H25-H26)/H26 -> #VALUE! | I48: =(I25-I26)/I26 -> #VALUE! | J48: =(J25-J26)/J26 -> 0.19940236168972184 | K48: =(K25-K26)/K26 -> 0.36381078688940832 | L48: =(L25-L26)/L26 -> 4.7520075706260281e-02 | M48: =(M25-M26)/M26 -> 0.43605620894133446 | N48: =(N25-N26)/N26 -> 0.38371321657446827 | O48: =(O25-O26)/O26 -> #VALUE! | P48: =(P25-P26)/P26 -> #VALUE! | Q48: =(Q25-Q26)/Q26 -> #VALUE! | R48: =(R25-R26)/R26 -> #VALUE! | S48: =(S25-S26)/S26 -> 0.44530326916474139 | T48: =(T25-T26)/T26 -> #VALUE! | U48: =(U25-U26)/U26 -> #VALUE! | V48: =(V25-V26)/V26 -> 0.31982205564258842 | W48: =(W25-W26)/W26 -> 0.27128817820025114 | X48: =(X25-X26)/X26 -> 0.53850655287739491 | Y48: =(Y25-Y26)/Y26 -> 1.2276713234511412 | Z48: =(Z25-Z26)/Z26 -> #VALUE! | AA48: =(AA25-AA26)/AA26 -> 0.3810348624059085 | AB48: =(AB25-AB26)/AB26 -> #VALUE! | AC48: =(AC25-AC26)/AC26 -> -2.8059433520370484e-02 | AD48: =(AD25-AD26)/AD26 -> 0.5626414717654874 | AE48: =(AE25-AE26)/AE26 -> #VALUE! | AF48: =(AF25-AF26)/AF26 -> #VALUE! | AG48: =(AG25-AG26)/AG26 -> -8.179001795289309e-02 | AH48: =(AH25-AH26)/AH26 -> #VALUE! | AI48: =(AI25-AI26)/AI26 -> 7.4604725249191673e-03 | AJ48: =(AJ25-AJ26)/AJ26 -> 0.19892886770997617 | AK48: =(AK25-AK26)/AK26 -> #VALUE! | AL48: =(AL25-AL26)/AL26 -> 9.2828326171013761e-02 | AM48: =(AM25-AM26)/AM26 -> #VALUE! | AN48: =(AN25-AN26)/AN26 -> #VALUE!
B49: =(B26-B27)/B27 -> -8.9990209321051007e-02 | C49: =(C26-C27)/C27 -> 0.46512463275220162 | D49: =(D26-D27)/D27 -> 0.28671806803987404 | E49: =(E26-E27)/E27 -> 0.1696235178282525 | F49: =(F26-F27)/F27 -> 8.9241999374424452e-02 | G49: =(G26-G27)/G27 -> #VALUE! | H49: =(H26-H27)/H27 -> #VALUE! | I49: =(I26-I27)/I27 -> #VALUE! | J49: =(J26-J27)/J27 -> 0.28585422462089433 | K49: =(K26-K27)/K27 -> 1.0938984970123704 | L49: =(L26-L27)/L27 -> 0.12273815125513643 | M49: =(M26-M27)/M27 -> 0.94977912031240697 | N49: =(N26-N27)/N27 -> 0.31829580472720298 | O49: =(O26-O27)/O27 -> #VALUE! | P49: =(P26-P27)/P27 -> #VALUE! | Q49: =(Q26-Q27)/Q27 -> #VALUE! | R49: =(R26-R27)/R27 -> #VALUE! | S49: =(S26-S27)/S27 -> 0.31438131908144468 | T49: =(T26-T27)/T27 -> #VALUE! | U49: =(U26-U27)/U27 -> #VALUE! | V49: =(V26-V27)/V27 -> 0.20299149911247932 | W49: =(W26-W27)/W27 -> 0.46624944364686327 | X49: =(X26-X27)/X27 -> 0.57724340609717806 | Y49: =(Y26-Y27)/Y27 -> 2.6566173762416154 | Z49: =(Z26-Z27)/Z27 -> #VALUE! | AA49: =(AA26-AA27)/AA27 -> 0.32718635814522301 | AB49: =(AB26-AB27)/AB27 -> #VALUE! | AC49: =(AC26-AC27)/AC27 -> 0.19802217108230402 | AD49: =(AD26-AD27)/AD27 -> 8.307144747842457e-02 | AE49: =(AE26-AE27)/AE27 -> #VALUE! | AF49: =(AF26-AF27)/AF27 -> #VALUE! | AG49: =(AG26-AG27)/AG27 -> -0.16679616769142985 | AH49: =(AH26-AH27)/AH27 -> #VALUE! | AI49: =(AI26-AI27)/AI27 -> 0.72405061723244479 | AJ49: =(AJ26-AJ27)/AJ27 -> #VALUE! | AK49: =(AK26-AK27)/AK27 -> #VALUE! | AL49: =(AL26-AL27)/AL27 -> 9.9393476563011451e-02 | AM49: =(AM26-AM27)/AM27 -> #VALUE! | AN49: =(AN26-AN27)/AN27 -> #VALUE!