A1: 股票代码 | B1: 股票简称 | C1: 最新价(港元)2024.07.21 | D1: 归属于母公司所有者的净利润(港元)2023财年4季报 | E1: 归属于母公司所有者的净利润(港元)2022财年4季报 | F1: 归属于母公司所有者的净利润(港元)2021财年4季报 | G1: 归属于母公司所有者的净利润(港元)2020财年4季报 | H1: 归属于母公司所有者的净利润(港元)2019财年4季报 | I1: 归属于母公司所有者的净利润(港元)2018财年4季报 | J1: 归属于母公司所有者的净利润(港元)2017财年4季报 | K1: 归属于母公司所有者的净利润(港元)2016财年4季报 | L1: 归属于母公司所有者的净利润(港元)2015财年4季报 | M1: 归属于母公司所有者的净利润(港元)2014财年4季报 | N1: 近10复合增长率 | O1: 近5年复合增长率 | P1: 折现率 | Q1: 零增长模型 | R1: 不变增长模型 | S1: 两阶段增长模型 | T1: 三阶段增长模型
A2: 1398.HK | B2: 工商银行 | C2: 4.25 | D2: 382605589800 | E2: 389953711300 | F2: 414776109500 | G2: 365993157300 | H2: 343853632500 | I2: 333803362000 | J2: 337624626800 | K2: 304259138750 | L2: 323178540000 | M2: 344184546900 | N2: =POWER(D2/M2,1/9)-1 -> 1.1827923140667718e-02 | O2: =POWER(D2/I2,1/5)-1 -> 2.7666313700253298e-02
A3: 0939.HK | B3: 建设银行 | C3: 5.34 | D3: 359052636600 | E3: 360228276300 | F3: 364870387500 | G3: 316361249400 | H3: 293646592500 | I3: 285468653400 | J3: 289197459100 | K3: 256024221250 | L3: 268309927250 | M3: 284309057000 | N3: =POWER(D3/M3,1/9)-1 -> 2.6273340199967077e-02 | O3: =POWER(D3/I3,1/5)-1 -> 4.6935529972432111e-02
A4: 1288.HK | B4: 农业银行 | C4: 3.35 | D4: 277659786600 | E4: 272888518100 | F4: 278432932500 | G4: 246002200500 | H4: 237019515000 | I4: 230888723800 | J4: 231342141800 | K4: 199292686250 | L4: 209550941100 | M4: 223949381900 | N4: =POWER(D4/M4,1/9)-1 -> 2.4173842489674469e-02 | O4: =POWER(D4/I4,1/5)-1 -> 3.7581100419226576e-02
A5: 3988.HK | B5: 中国银行 | C5: 3.39 | D5: 237445689600 | E5: 241435962000 | F5: 252134346000 | G5: 215544387900 | H5: 209425087500 | I5: 205045919600 | J5: 198601381700 | K5: 175421925000 | L5: 195027899650 | M5: 211637600500 | N5: =POWER(D5/M5,1/9)-1 -> 1.286691340084567e-02 | O5: =POWER(D5/I5,1/5)-1 -> 2.9775681910920726e-02
A6: 0857.HK | B6: 中国石油股份 | C6: 7.11 | D6: 176648245200 | E6: 168515578000 | F6: 112862165000 | G6: 22653251400 | H6: 51049635000 | I6: 60386789600 | J6: 27332522200 | K6: 8731091250 | L6: 41769767850 | M6: 133739938800 | N6: =POWER(D6/M6,1/9)-1 -> 3.1401072341930458e-02 | O6: =POWER(D6/I6,1/5)-1 -> 0.23946274409917545
A7: 0005.HK | B7: 汇丰控股 | C7: 66.35 | D7: 175216352000 | E7: 115730176000 | F7: 98309386000 | G7: 30221194000 | H7: 46480603000 | I7: 98771072000 | J7: 75662962000 | K7: 10072446000 | L7: 97439286000 | M7: 101719940000 | N7: =POWER(D7/M7,1/9)-1 -> 6.2284754634482464e-02 | O7: =POWER(D7/I7,1/5)-1 -> 0.12147339031259907
A8: 3968.HK | B8: 招商银行 | C8: 33.85 | D8: 155708632800 | E8: 149783477500 | F8: 142420370500 | G8: 114054102900 | H8: 103778872500 | I8: 91725616000 | J8: 84102835000 | K8: 68987511250 | L8: 67853380800 | M8: 69771336900 | N8: =POWER(D8/M8,1/9)-1 -> 9.3294829185082584e-02 | O8: =POWER(D8/I8,1/5)-1 -> 0.1116406279468638
A9: 0941.HK | B9: 中国移动 | C9: 75 | D9: 144441889200 | E9: 141530297900 | F9: 142223226000 | G9: 128538071700 | H9: 119171317500 | I9: 134105446600 | J9: 137009093100 | K9: 120838436250 | L9: 127647290950 | M9: 136293142200 | N9: =POWER(D9/M9,1/9)-1 -> 6.4729990426193318e-03 | O9: =POWER(D9/I9,1/5)-1 -> 1.4960985756221401e-02
A10: 80941.HK | B10: 中国移动-R | C10: 70.099999999999994 | D10: 144441889200 | E10: 141530297900 | F10: 142223226000 | G10: 128538071700 | H10: -- | I10: -- | J10: -- | K10: -- | L10: -- | M10: -- | N10: =POWER(D10/M10,1/9)-1 -> #VALUE! | O10: =POWER(D10/I10,1/5)-1 -> #VALUE!
A11: 0883.HK | B11: 中国海洋石油 | C11: 20.5 | D11: 135756696600 | E11: 159851770000 | F11: 86106840000 | G11: 29745056400 | H11: 68217787500 | I11: 59975755000 | J11: 29585255300 | K11: 707866250 | L11: 23810308300 | M11: 75122332100 | N11: =POWER(D11/M11,1/9)-1 -> 6.7959267699299941e-02 | O11: =POWER(D11/I11,1/5)-1 -> 0.17748967483432732
A12: 80883.HK | B12: 中国海洋石油-R | C12: 19.08 | D12: 135756696600 | E12: 159851770000 | F12: 86106840000 | G12: 29745056400 | H12: -- | I12: -- | J12: -- | K12: -- | L12: -- | M12: -- | N12: =POWER(D12/M12,1/9)-1 -> #VALUE! | O12: =POWER(D12/I12,1/5)-1 -> #VALUE!
A13: 0700.HK | B13: 腾讯控股 | C13: 364 | D13: 126299779200 | E13: 212356928300 | F13: 275294539000 | G13: 190521639300 | H13: 104273925000 | I13: 89629453400 | J13: 85733339000 | K13: 45666818750 | L13: 33877296300 | M13: 29712499000 | N13: =POWER(D13/M13,1/9)-1 -> 0.17443576392178151 | O13: =POWER(D13/I13,1/5)-1 -> 7.1002214158173871e-02
A14: 80700.HK | B14: 腾讯控股-R | C14: 339.19999999999999 | D14: 126299779200 | E14: 212356928300 | F14: 275294539000 | G14: 190521639300 | H14: -- | I14: -- | J14: -- | K14: -- | L14: -- | M14: -- | N14: =POWER(D14/M14,1/9)-1 -> #VALUE! | O14: =POWER(D14/I14,1/5)-1 -> #VALUE!
A15: 2318.HK | B15: 中国平安 | C15: 34.35 | D15: 93905973000 | E15: 94505449400 | F15: 124431241000 | G15: 170559698100 | H15: 166962322500 | I15: 122290194400 | J15: 106807603200 | K15: 69335332500 | L15: 63745438150 | M15: 49016264100 | N15: =POWER(D15/M15,1/9)-1 -> 7.4911122286409171e-02 | O15: =POWER(D15/I15,1/5)-1 -> -5.1449807924524582e-02
A16: 82318.HK | B16: 中国平安-R | C16: 32 | D16: 93905973000 | E16: 94505449400 | F16: 124431241000 | G16: 170559698100 | H16: -- | I16: -- | J16: -- | K16: -- | L16: -- | M16: -- | N16: =POWER(D16/M16,1/9)-1 -> #VALUE! | O16: =POWER(D16/I16,1/5)-1 -> #VALUE!
A17: 3328.HK | B17: 交通银行 | C17: 5.54 | D17: 93456531000 | E17: 95511714600 | F17: 100369816000 | G17: 88057572000 | H17: 86361517500 | I17: 83835118000 | J17: 84190354700 | K17: 73704767500 | L17: 78240254400 | M17: 82174215000 | N17: =POWER(D17/M17,1/9)-1 -> 1.4397645475692888e-02 | O17: =POWER(D17/I17,1/5)-1 -> 2.196667747226666e-02
A18: 1658.HK | B18: 邮储银行 | C18: 4.08 | D18: 88741774800 | E18: 88573899600 | F18: 86809703000 | G18: 73438918500 | H18: 68092627500 | I18: 59561304600 | J18: 57167148700 | K18: 44228861250 | L18: 40995926950 | M18: 40640359300 | N18: =POWER(D18/M18,1/9)-1 -> 9.0650540773241861e-02 | O18: =POWER(D18/I18,1/5)-1 -> 8.3010785459704639e-02
A19: 89988.HK | B19: 阿里巴巴-SWR | C19: 68.75 | D19: 82874161550 | E19: 76410936750 | F19: 178002249000 | G19: 162942953950 | H19: -- | I19: -- | J19: -- | K19: -- | L19: -- | M19: -- | N19: =POWER(D19/M19,1/9)-1 -> #VALUE! | O19: =POWER(D19/I19,1/5)-1 -> #VALUE!
A20: 9988.HK | B20: 阿里巴巴-SW | C20: 73.799999999999997 | D20: 82874161550 | E20: 76410936750 | F20: 178002249000 | G20: 162942953950 | H20: 102246720000 | I20: 79958855250 | J20: 49304707500 | K20: -- | L20: -- | M20: -- | N20: =POWER(D20/M20,1/9)-1 -> #VALUE! | O20: =POWER(D20/I20,1/5)-1 -> 7.1879377794918931e-03
A21: 1088.HK | B21: 中国神华 | C21: 33.100000000000001 | D21: 70841925000 | E21: 82241874300 | F21: 62966239000 | G21: 42728423100 | H21: 46607572500 | I21: 50254388200 | J21: 57301425500 | K21: 27681237500 | L21: 20756106450 | M21: 49043717900 | N21: =POWER(D21/M21,1/9)-1 -> 4.1706127298380524e-02 | O21: =POWER(D21/I21,1/5)-1 -> 7.1083361024895764e-02
A22: 0998.HK | B22: 中信银行 | C22: 4.54 | D22: 68214333600 | E22: 64657051500 | F22: 64446659500 | G22: 54791643000 | H22: 53656762500 | I22: 50682501800 | J22: 51032377400 | K22: 46260226250 | L22: 48403865900 | M22: 50779546800 | N22: =POWER(D22/M22,1/9)-1 -> 3.3339379038146877e-02 | O22: =POWER(D22/I22,1/5)-1 -> 6.1215340302775756e-02
A23: 0386.HK | B23: 中国石油化工股份 | C23: 4.73 | D23: 63919422000 | E23: 74627199300 | F23: 88133387500 | G23: 39860711700 | H23: 64217137500 | I23: 70158254800 | J23: 61436431600 | K23: 51864260000 | L23: 38235737600 | M23: 57984921400 | N23: =POWER(D23/M23,1/9)-1 -> 1.0885516083375846e-02 | O23: =POWER(D23/I23,1/5)-1 -> -1.845365011808775e-02
A24: 0267.HK | B24: 中信股份 | C24: 7.16 | D24: 63030403800 | E24: 85067764800 | F24: 70222000000 | G24: 56628000000 | H24: 53903000000 | I24: 50239000000 | J24: 43902000000 | K24: 43146000000 | L24: 41812000000 | M24: 39834000000 | N24: =POWER(D24/M24,1/9)-1 -> 5.2310778896327736e-02 | O24: =POWER(D24/I24,1/5)-1 -> 4.6409853758786479e-02
A25: 2628.HK | B25: 中国人寿 | C25: 11 | D25: 50623612200 | E25: 36191704200 | F25: 62162967000 | G25: 59901318300 | H25: 65135722500 | I25: 12974347000 | J25: 38668121700 | K25: 21254878750 | L25: 40807758950 | M25: 40196106900 | N25: =POWER(D25/M25,1/9)-1 -> 2.5958760568283612e-02 | O25: =POWER(D25/I25,1/5)-1 -> 0.31296613419672115
A26: 6818.HK | B26: 中国光大银行 | C26: 2.42 | D26: 39442372200 | E26: 45119487600 | F26: 47274271500 | G26: 42450710400 | H26: 40122720000 | I26: 36673167400 | J26: 36080895500 | K26: 32525176250 | L26: 34726404400 | M26: 36043095700 | N26: =POWER(D26/M26,1/9)-1 -> 1.0064234903502278e-02 | O26: =POWER(D26/I26,1/5)-1 -> 1.466556356037918e-02
A27: 0390.HK | B27: 中国中铁 | C27: 3.78 | D27: 34843813200 | E27: 33215776400 | F27: 31186790500 | G27: 28209889200 | H27: 26460165000 | I27: 19581642800 | J27: 19262726300 | K27: 13121640000 | L27: 13730383750 | M27: 12805949800 | N27: =POWER(D27/M27,1/9)-1 -> 0.11763898544981166 | O27: =POWER(D27/I27,1/5)-1 -> 0.12216136056025229
A28: 1988.HK | B28: 民生银行 | C28: 2.78 | D28: 34537973400 | E28: 35154980300 | F28: 38024398500 | G28: 36915526800 | H28: 59519167500 | I28: 56676092200 | J28: 59093781000 | K28: 53165533750 | L28: 54228841550 | M28: 55588953400 | N28: =POWER(D28/M28,1/9)-1 -> -5.1506713058909748e-02 | O28: =POWER(D28/I28,1/5)-1 -> -9.4310379713447801e-02
A29: 1109.HK | B29: 华润置地 | C29: 25.35 | D29: 34382720786.400002 | E29: 31690432906.5 | F29: 39675317155.5 | G29: 35530490132.099998 | H29: 32041268430 | I29: 27597244475 | J29: 23606820560 | K29: 19500880000 | L29: 17697752000 | M29: 15140938000 | N29: =POWER(D29/M29,1/9)-1 -> 9.5409200665788285e-02 | O29: =POWER(D29/I29,1/5)-1 -> 4.4948540973881679e-02
A30: 0728.HK | B30: 中国电信 | C30: 4.78 | D30: 33374905200 | E30: 31127663300 | F30: 31774550500 | G30: 24851115000 | H30: 22927747500 | I30: 24149706000 | J30: 22319921300 | K30: 20022502500 | L30: 23584506700 | M30: 22062872000 | N30: =POWER(D30/M30,1/9)-1 -> 4.7063716952733037e-02 | O30: =POWER(D30/I30,1/5)-1 -> 6.6845767454219329e-02
A31: 1211.HK | B31: 比亚迪股份 | C31: 243 | D31: 32887098392.400002 | E31: 18744683327.400002 | F31: 3705231693 | G31: 4788616772.6999998 | H31: 1804147875 | I31: 3165528888.4000001 | J31: 4875300474.1999998 | K31: 5378485560 | L31: 3272490842.5999999 | M31: 540995847.5 | N31: =POWER(D31/M31,1/9)-1 -> 0.57835072469320115 | O31: =POWER(D31/I31,1/5)-1 -> 0.59704022625194164
A32: 81211.HK | B32: 比亚迪股份-R | C32: 226.59999999999999 | D32: 32887098392.400002 | E32: 18744683327.400002 | F32: 3705231693 | G32: 4788616772.6999998 | H32: -- | I32: -- | J32: -- | K32: -- | L32: -- | M32: -- | N32: =POWER(D32/M32,1/9)-1 -> #VALUE! | O32: =POWER(D32/I32,1/5)-1 -> #VALUE!
A33: 2388.HK | B33: 中银香港 | C33: 22.65 | D33: 32723000000 | E33: 27054000000 | F33: 22970000000 | G33: 26487000000 | H33: 32184000000 | I33: 32070000000 | J33: 31163000000 | K33: 55876000000 | L33: 26982000000 | M33: 24577000000 | N33: =POWER(D33/M33,1/9)-1 -> 3.2318724477623961e-02 | O33: =POWER(D33/I33,1/5)-1 -> 4.0395733435729664e-03
A34: 82388.HK | B34: 中银香港-R | C34: 21.100000000000001 | D34: 32723000000 | E34: 27054000000 | F34: 22970000000 | G34: 26487000000 | H34: -- | I34: -- | J34: -- | K34: -- | L34: -- | M34: -- | N34: =POWER(D34/M34,1/9)-1 -> #VALUE! | O34: =POWER(D34/I34,1/5)-1 -> #VALUE!
A35: 9999.HK | B35: 网易-S | C35: 141.80000000000001 | D35: 32246424302.400002 | E35: 22942846560 | F35: 20641203029 | G35: 14377596492.6 | H35: 23558743875 | I35: 7005130610.1999998 | J35: 12837748067.1 | K35: -- | L35: -- | M35: -- | N35: =POWER(D35/M35,1/9)-1 -> #VALUE! | O35: =POWER(D35/I35,1/5)-1 -> 0.35710379644575396
A36: 2601.HK | B36: 中国太保 | C36: 20.15 | D36: 29879123400 | E36: 27761412900 | F36: 32858233000 | G36: 29301669600 | H36: 31000567500 | I36: 20516433400 | J36: 17578271800 | K36: 13398341250 | L36: 20849014400 | M36: 13788047100 | N36: =POWER(D36/M36,1/9)-1 -> 8.97285864527535e-02 | O36: =POWER(D36/I36,1/5)-1 -> 7.8085481409297497e-02
A37: 1299.HK | B37: 友邦保险 | C37: 54.15 | D37: 29400604000 | E37: 2201856000 | F37: 57915746000 | G37: 44804587000 | H37: 51767976000 | I37: 20344898000 | J37: 50759744000 | K37: 32300148000 | L37: 21427367500 | M37: 26747850000 | N37: =POWER(D37/M37,1/9)-1 -> 1.0562181494345291e-02 | O37: =POWER(D37/I37,1/5)-1 -> 7.6416006418214222e-02
A38: 81299.HK | B38: 友邦保险-R | C38: 50.45 | D38: 29400604000 | E38: 2201856000 | F38: 57915746000 | G38: 44804587000 | H38: -- | I38: -- | J38: -- | K38: -- | L38: -- | M38: -- | N38: =POWER(D38/M38,1/9)-1 -> #VALUE! | O38: =POWER(D38/I38,1/5)-1 -> #VALUE!
A39: 0019.HK | B39: 太古股份公司A | C39: 69.35 | D39: 28853000000 | E39: 4195000000 | F39: 3357000000 | G39: -10999000000 | H39: 9007000000 | I39: 23629000000 | J39: 26070000000 | K39: 9644000000 | L39: 13429000000 | M39: 11069000000 | N39: =POWER(D39/M39,1/9)-1 -> 0.11232423267567127 | O39: =POWER(D39/I39,1/5)-1 -> 4.0756487431464539e-02
A40: 0087.HK | B40: 太古股份公司B | C40: 10.5 | D40: 28853000000 | E40: 4195000000 | F40: 3357000000 | G40: -10999000000 | H40: 9007000000 | I40: 23629000000 | J40: 26070000000 | K40: 9644000000 | L40: 13429000000 | M40: 11069000000 | N40: =POWER(D40/M40,1/9)-1 -> 0.11232423267567127 | O40: =POWER(D40/I40,1/5)-1 -> 4.0756487431464539e-02
A41: 0945.HK | B41: 宏利金融-S | C41: 202.40000000000001 | D41: 28288800000 | E41: 42038969000 | F41: 43525230000 | G41: 35725035000 | H41: 33421532000 | I41: 27592800000 | J41: 13080568000 | K41: 16910581500 | L41: 12233448500 | M41: 23386680000 | N41: =POWER(D41/M41,1/9)-1 -> 2.1369496911311847e-02 | O41: =POWER(D41/I41,1/5)-1 -> 4.9946513876770737e-03
A42: 0688.HK | B42: 中国海外发展 | C42: 13.02 | D42: 28073503319.400002 | E42: 26244961090.700001 | F42: 49170239544.5 | G42: 52329122772.599998 | H42: 46508464777.5 | I42: 42943730220.199997 | J42: 40766835000 | K42: 37020638000 | L42: 34643211000 | M42: 27200018000 | N42: =POWER(D42/M42,1/9)-1 -> 3.5182360759959952e-03 | O42: =POWER(D42/I42,1/5)-1 -> -8.1499558834188135e-02
A43: 2328.HK | B43: 中国财险 | C43: 9.55 | D43: 26950077000 | E43: 30129294800 | F43: 27379820000 | G43: 24872569200 | H43: 27135135000 | I43: 17631221000 | J43: 23746612300 | K43: 20024725000 | L43: 25693164350 | M43: 18862008500 | N43: =POWER(D43/M43,1/9)-1 -> 4.0444980516089579e-02 | O43: =POWER(D43/I43,1/5)-1 -> 8.8567901674851512e-02
A44: 89618.HK | B44: 京东集团-SWR | C44: 95.65 | D44: 26491865400 | E44: 11709678000 | F44: -4359220000 | G44: 58885819500 | H44: -- | I44: -- | J44: -- | K44: -- | L44: -- | M44: -- | N44: =POWER(D44/M44,1/9)-1 -> #VALUE! | O44: =POWER(D44/I44,1/5)-1 -> #VALUE!
A45: 9618.HK | B45: 京东集团-SW | C45: 102.7 | D45: 26491865400 | E45: 11709678000 | F45: -4359220000 | G45: 58885819500 | H45: 13615793212.5 | I45: -2836973333.8000002 | J45: -182540917.30000001 | K45: -- | L45: -- | M45: -- | N45: =POWER(D45/M45,1/9)-1 -> #VALUE! | O45: =POWER(D45/I45,1/5)-1 -> -2.5633328626243106
A46: 1919.HK | B46: 中远海控 | C46: 10.62 | D46: 26155614819.599998 | E46: 123734707664.60001 | F46: 109407786826 | G46: 11832108106.200001 | H46: 7476193455 | I46: 1400507603.5999999 | J46: 3191395070.4000001 | K46: -11008045833.75 | L46: 551922617.10000002 | M46: 452399939.10000002 | N46: =POWER(D46/M46,1/9)-1 -> 0.56957650225452716 | O46: =POWER(D46/I46,1/5)-1 -> 0.79579142072515596
A47: 1186.HK | B47: 中国铁建 | C47: 5.05 | D47: 25814383106.400002 | E47: 26957951877.5 | F47: 26615730775.5 | G47: 24277387975.5 | H47: 21185402962.5 | I47: 19433964102.799999 | J47: 18903158206.5 | K47: 15400158112.5 | L47: 14871714401.9 | M47: 14643687205.6 | N47: =POWER(D47/M47,1/9)-1 -> 6.5017666574105126e-02 | O47: =POWER(D47/I47,1/5)-1 -> 5.8424955240965026e-02
A48: 1800.HK | B48: 中国交通建设 | C48: 4.41 | D48: 25658753400 | E48: 20876618600 | F48: 20597314500 | G48: 17746199100 | H48: 21020175000 | I48: 21406818600 | J48: 23888082500 | K48: 17993360000 | L48: 18261704400 | M48: 17451881500 | N48: =POWER(D48/M48,1/9)-1 -> 4.3756649488675192e-02 | O48: =POWER(D48/I48,1/5)-1 -> 3.6899547124002563e-02
A49: 1339.HK | B49: 中国人民保险集团 | C49: 2.57 | D49: 24469376400 | E49: 27612503700 | F49: 26297362000 | G49: 23880908400 | H49: 24735862500 | I49: 14701603200 | J49: 19301091100 | K49: 15829756250 | L49: 22982369100 | M49: 16358721100 | N49: =POWER(D49/M49,1/9)-1 -> 4.5756071764656125e-02 | O49: =POWER(D49/I49,1/5)-1 -> 0.10726517489771781
A50: 0016.HK | B50: 新鸿基地产 | C50: 70.15 | D50: 23907000000 | E50: 25560000000 | F50: 26686000000 | G50: 23521000000 | H50: 44912000000 | I50: 49951000000 | J50: 41782000000 | K50: 32666000000 | L50: 31082000000 | M50: 33520000000 | N50: =POWER(D50/M50,1/9)-1 -> -3.685598519502864e-02 | O50: =POWER(D50/I50,1/5)-1 -> -0.13702904504257263
A51: 80016.HK | B51: 新鸿基地产-R | C51: 65.25 | D51: 23907000000 | E51: 25560000000 | F51: 26686000000 | G51: 23521000000 | H51: -- | I51: -- | J51: -- | K51: -- | L51: -- | M51: -- | N51: =POWER(D51/M51,1/9)-1 -> #VALUE! | O51: =POWER(D51/I51,1/5)-1 -> #VALUE!
A52: 2888.HK | B52: 渣打集团 | C52: 72.35 | D52: 23565787000 | E52: 19886976000 | F52: 14855190000 | G52: 2550737000 | H52: 14444885000 | I52: 4841412000 | J52: 6048036000 | K52: -3706412000 | L52: -18291180000 | M52: 19483072000 | N52: =POWER(D52/M52,1/9)-1 -> 2.1363894572161923e-02 | O52: =POWER(D52/I52,1/5)-1 -> 0.37234081874251146
A53: 0001.HK | B53: 长和 | C53: 40.899999999999999 | D53: 23500000000 | E53: 36680000000 | F53: 33484000000 | G53: 29143000000 | H53: 39830000000 | I53: 39000000000 | J53: 35100000000 | K53: 33008000000 | L53: 118570000000 | M53: 53869000000 | N53: =POWER(D53/M53,1/9)-1 -> -8.8052403229601062e-02 | O53: =POWER(D53/I53,1/5)-1 -> -9.6349171619524054e-02
A54: 2899.HK | B54: 紫金矿业 | C54: 16.32 | D54: 23151107733.73 | E54: 22609432066.650002 | F54: 19191430038.68 | G54: 7757545408.8999996 | H54: 4787322355.3900003 | I54: 4661170655.1199999 | J54: 4205402663.0100002 | K54: 2044476438.73 | L54: 1947152605.1700001 | M54: 2926403704.6500001 | N54: =POWER(D54/M54,1/9)-1 -> 0.25835787369637941 | O54: =POWER(D54/I54,1/5)-1 -> 0.37789255782627151
A55: 89888.HK | B55: 百度集团-SWR | C55: 82.15 | D55: 22269303000 | E55: 8527307900 | F55: 12521737000 | G55: 26784376800 | H55: -- | I55: -- | J55: -- | K55: -- | L55: -- | M55: -- | N55: =POWER(D55/M55,1/9)-1 -> #VALUE! | O55: =POWER(D55/I55,1/5)-1 -> #VALUE!
A56: 9888.HK | B56: 百度集团-SW | C56: 88.15 | D56: 22269303000 | E56: 8527307900 | F56: 12521737000 | G56: 26784376800 | H56: -- | I56: -- | J56: -- | K56: -- | L56: -- | M56: -- | N56: =POWER(D56/M56,1/9)-1 -> #VALUE! | O56: =POWER(D56/I56,1/5)-1 -> #VALUE!
A57: 1898.HK | B57: 中煤能源 | C57: 7.83 | D57: 22125260127.599998 | E57: 22245532978.900002 | F57: 18578454411 | G57: 6381015435 | H57: 6925335240 | I57: 5016840112.8000002 | J57: 4036982837.0999999 | K57: 1907090578.75 | L57: -3841909555.5500002 | M57: 176074946.30000001 | N57: =POWER(D57/M57,1/9)-1 -> 0.71097405709233996 | O57: =POWER(D57/I57,1/5)-1 -> 0.34552454649558562
A58: 6030.HK | B58: 中信证券 | C58: 11.58 | D58: 21041979940.799999 | E58: 23487282285.299999 | F58: 28092465530.5 | G58: 17762079975.599998 | H58: 13665471675 | I58: 10691335585.6 | J58: 13707341408.5 | K58: 11518294051.25 | L58: 23285546557.650002 | M58: 14147684392.6 | N58: =POWER(D58/M58,1/9)-1 -> 4.5094815387398013e-02 | O58: =POWER(D58/I58,1/5)-1 -> 0.1450143462482687
A59: 0762.HK | B59: 中国联通 | C59: 7.19 | D59: 20527441200 | E59: 18890034500 | F59: 17593616000 | G59: 14890406700 | H59: 12661275000 | I59: 11610304200 | J59: 2191589200 | K59: 694531250 | L59: 12421440100 | M59: 15043434500 | N59: =POWER(D59/M59,1/9)-1 -> 3.5138940310431854e-02 | O59: =POWER(D59/I59,1/5)-1 -> 0.12072289363576472
A60: 1171.HK | B60: 兖矿能源 | C60: 9.93 | D60: 19489309106.400002 | E60: 34302743617.799999 | F60: 20744787157.5 | G60: 7530424200 | H60: 10491810787.5 | I60: 9772098261.6000004 | J60: 8827111057.5 | K60: 1832885748.75 | L60: 193412006.94999999 | M60: 956088568.20000005 | N60: =POWER(D60/M60,1/9)-1 -> 0.39790478323028311 | O60: =POWER(D60/I60,1/5)-1 -> 0.14805243403465118
A61: 1810.HK | B61: 小米集团-W | C61: 16.52 | D61: 19156284642.599998 | E61: 2790953243 | F61: 23680998564.5 | G61: 24261725217.599998 | H61: 11224353270 | I61: 15432454599.6 | J61: -52543010582.400002 | K61: 614799062.5 | L61: -8915981984.75 | M61: -- | N61: =POWER(D61/M61,1/9)-1 -> #VALUE! | O61: =POWER(D61/I61,1/5)-1 -> 4.4179721451558462e-02
A62: 81810.HK | B62: 小米集团-WR | C62: 15.42 | D62: 19156284642.599998 | E62: 2790953243 | F62: 23680998564.5 | G62: 24261725217.599998 | H62: -- | I62: -- | J62: -- | K62: -- | L62: -- | M62: -- | N62: =POWER(D62/M62,1/9)-1 -> #VALUE! | O62: =POWER(D62/I62,1/5)-1 -> #VALUE!
A63: 6690.HK | B63: 海尔智家 | C63: 23.699999999999999 | D63: 18193631400 | E63: 16595479100 | F63: 16015235500 | G63: 10587647700 | H63: 9170205000 | I63: 8521282400 | J63: 8325161600 | K63: -- | L63: -- | M63: -- | N63: =POWER(D63/M63,1/9)-1 -> #VALUE! | O63: =POWER(D63/I63,1/5)-1 -> 0.16381214958135848
A64: 1113.HK | B64: 长实集团 | C64: 30.199999999999999 | D64: 17340000000 | E64: 21683000000 | F64: 21241000000 | G64: 16332000000 | H64: 29134000000 | I64: 40117000000 | J64: 30125000000 | K64: 19415000000 | L64: 17113000000 | M64: 17068000000 | N64: =POWER(D64/M64,1/9)-1 -> 1.758277964116095e-03 | O64: =POWER(D64/I64,1/5)-1 -> -0.1544405863278866
A65: 0011.HK | B65: 恒生银行 | C65: 99.55 | D65: 17140000000 | E65: 9455000000 | F65: 13257000000 | G65: 15987000000 | H65: 24840000000 | I65: 24211000000 | J65: 20018000000 | K65: 15866000000 | L65: 27184000000 | M65: 15131000000 | N65: =POWER(D65/M65,1/9)-1 -> 1.3948529221907924e-02 | O65: =POWER(D65/I65,1/5)-1 -> -6.6746520134932208e-02
A66: 80011.HK | B66: 恒生银行-R | C66: 92.95 | D66: 17140000000 | E66: 9455000000 | F66: 13257000000 | G66: 15987000000 | H66: -- | I66: -- | J66: -- | K66: -- | L66: -- | M66: -- | N66: =POWER(D66/M66,1/9)-1 -> #VALUE! | O66: =POWER(D66/I66,1/5)-1 -> #VALUE!
A67: 6288.HK | B67: 迅销 | C67: 20.199999999999999 | D67: 15922308750 | E67: 15503561200 | F67: 12026016835 | G67: 6619553820 | H67: 11999069290 | I67: 10943589590 | J67: 8453373600 | K67: 3609185720 | L67: 7038427190 | M67: 5561131600 | N67: =POWER(D67/M67,1/9)-1 -> 0.12398449089386787 | O67: =POWER(D67/I67,1/5)-1 -> 7.7877108578099374e-02
A68: 2016.HK | B68: 浙商银行 | C68: 2.12 | D68: 15439977000 | E68: 13330757700 | F68: 14436855000 | G68: 13560246300 | H68: 14443423770 | I68: 13082987657.6 | J68: 13127654076.1 | K68: 11282685715 | L68: 8291963974.5 | M68: 6358678193.6999998 | N68: =POWER(D68/M68,1/9)-1 -> 0.10359282173517914 | O68: =POWER(D68/I68,1/5)-1 -> 3.3684355660284604e-02
A69: 3698.HK | B69: 徽商银行 | C69: 2.2000000000000002 | D69: 15284565437.4 | E69: 14561063560 | F69: 13008303095.5 | G69: 10395893636.1 | H69: 10548393165 | I69: 9530089970.2000008 | J69: 8698252086.6000004 | K69: 7634812010 | L69: 7245245369.0500002 | M69: 7079006006.5 | N69: =POWER(D69/M69,1/9)-1 -> 8.9286980284617234e-02 | O69: =POWER(D69/I69,1/5)-1 -> 9.9084843616943807e-02
A70: 3690.HK | B70: 美团-W | C70: 117.5 | D70: 15188758653.6 | E70: -7542600691 | F70: -28822745085.5 | G70: 5611838264.6999998 | H70: 2501824357.5 | I70: -131482306900.60001 | J70: -22679132121.299999 | K70: -6434026375 | L70: -12371267454.9 | M70: -- | N70: =POWER(D70/M70,1/9)-1 -> #VALUE! | O70: =POWER(D70/I70,1/5)-1 -> -1.6494279760095876
A71: 83690.HK | B71: 美团-WR | C71: 109.7 | D71: 15188758653.6 | E71: -7542600691 | F71: -28822745085.5 | G71: 5611838264.6999998 | H71: -- | I71: -- | J71: -- | K71: -- | L71: -- | M71: -- | N71: =POWER(D71/M71,1/9)-1 -> #VALUE! | O71: =POWER(D71/I71,1/5)-1 -> #VALUE!
A72: 0960.HK | B72: 龙湖集团 | C72: 10.68 | D72: 14086182058.200001 | E72: 27482824092.599998 | F72: 29208838507 | G72: 23840413597.5 | H72: 20491124797.5 | I72: 18487300182 | J72: 15104457943.299999 | K72: 10171219021.25 | L72: 10570380913.85 | M72: 10424497372.799999 | N72: =POWER(D72/M72,1/9)-1 -> 3.4014106538130084e-02 | O72: =POWER(D72/I72,1/5)-1 -> -5.2925898086005896e-02 | P72: 2.8999999999999998e-02
A73: 6886.HK | B73: 华泰证券 | C73: 8.18 | D73: 13337611194.6 | E73: 11979085201.5 | F73: 16224122955 | G73: 12899334174.299999 | H73: 10059337170 | I73: 5730275486.8000002 | J73: 11121619828 | K73: 6968217585 | L73: 12580055139.549999 | M73: 5598423820.3999996 | N73: =POWER(D73/M73,1/9)-1 -> 0.10126098461824617 | O73: =POWER(D73/I73,1/5)-1 -> 0.18407854057548612
A74: 2202.HK | B74: 万科企业 | C74: 4.64 | D74: 13332734200.799999 | E74: 25515116489.900002 | F74: 27580678408.5 | G74: 49482378085.5 | H74: 43439557222.5 | I74: 38453541567.199997 | J74: 33631321003.5 | K74: 23361370917.5 | L74: 21309327426.299999 | M74: 19648752046.599998 | N74: =POWER(D74/M74,1/9)-1 -> -4.2172859613987201e-02 | O74: =POWER(D74/I74,1/5)-1 -> -0.19091048097333707
A75: 2378.HK | B75: 保诚 | C75: 70.799999999999997 | D75: 13286511000 | E75: -7862656000 | F75: -15923516000 | G75: 16420854000 | H75: 6097221000 | I75: 31484846000 | J75: 25201561000 | K75: 18381088500 | L75: 29627552000 | M75: 26724960000 | N75: =POWER(D75/M75,1/9)-1 -> -7.4711640467864271e-02 | O75: =POWER(D75/I75,1/5)-1 -> -0.15848497301729347
A76: 9633.HK | B76: 农夫山泉 | C76: 33.75 | D76: 13241545707.6 | E76: 9583491525 | F76: 8769616753 | G76: 6290164049.3999996 | H76: 5530024740 | I76: 4105858777.4000001 | J76: 4052772350.0999999 | K76: -- | L76: -- | M76: -- | N76: =POWER(D76/M76,1/9)-1 -> #VALUE! | O76: =POWER(D76/I76,1/5)-1 -> 0.26388318311988179 | Q76: =130/0.029 -> 4482.7586206896549
A77: 1766.HK | B77: 中国中车 | C77: 4.97 | D77: 12838229611.200001 | E77: 13146254688.799999 | F77: 12615539822.5 | G77: 13505482070.700001 | H77: 13180833157.5 | I77: 12871923098.4 | J77: 12937747117.200001 | K77: 12546164741.25 | L77: 13899026967.9 | M77: 13496622517.200001 | N77: =POWER(D77/M77,1/9)-1 -> -5.5414848161848829e-03 | O77: =POWER(D77/I77,1/5)-1 -> -5.2406809484417671e-04
A78: 2015.HK | B78: 理想汽车-W | C78: 77.25 | D78: 12830070594.6 | E78: -2269979741.5 | F78: -393621647.5 | G78: -943966921.5 | H78: -- | I78: -- | J78: -- | K78: -- | L78: -- | M78: -- | N78: =POWER(D78/M78,1/9)-1 -> #VALUE! | O78: =POWER(D78/I78,1/5)-1 -> #VALUE!
A79: 0992.HK | B79: 联想集团 | C79: 10.18 | D79: 12623833144 | E79: 15895504758 | F79: 9161336925 | G79: 5157780705 | H79: 4680696207 | I79: -1485996227 | J79: 4157602680 | K79: -993580011 | L79: 6426684825 | M79: 6338828982 | N79: =POWER(D79/M79,1/9)-1 -> 7.9549269463905503e-02 | O79: =POWER(D79/I79,1/5)-1 -> -2.53403301960281
A80: 80992.HK | B80: 联想集团-R | C80: 9.43 | D80: 12623833144 | E80: 15895504758 | F80: 9161336925 | G80: 5157780705 | H80: -- | I80: -- | J80: -- | K80: -- | L80: -- | M80: -- | N80: =POWER(D80/M80,1/9)-1 -> #VALUE! | O80: =POWER(D80/I80,1/5)-1 -> #VALUE!
A81: 1378.HK | B81: 中国宏桥 | C81: 9.88 | D81: 12563195223.6 | E81: 9816673179.2999992 | F81: 19681807279 | G81: 12510106118.4 | H81: 6811536862.5 | I81: 6156890689.1999998 | J81: 6150433729.6000004 | K81: 7611872476.25 | L81: 4359043437.6000004 | M81: 6630881372.8000002 | N81: =POWER(D81/M81,1/9)-1 -> 7.3585256938885513e-02 | O81: =POWER(D81/I81,1/5)-1 -> 0.15331444917634562
A82: 0388.HK | B82: 香港交易所 | C82: 239 | D82: 11862000000 | E82: 10078000000 | F82: 12535000000 | G82: 11505000000 | H82: 9391000000 | I82: 9312000000 | J82: 7404000000 | K82: 5769000000 | L82: 7956000000 | M82: 5165000000 | N82: =POWER(D82/M82,1/9)-1 -> 9.6783336986632662e-02 | O82: =POWER(D82/I82,1/5)-1 -> 4.9597990309506068e-02
A83: 80388.HK | B83: 香港交易所-R | C83: 222.40000000000001 | D83: 11862000000 | E83: 10078000000 | F83: 12535000000 | G83: 11505000000 | H83: -- | I83: -- | J83: -- | K83: -- | L83: -- | M83: -- | N83: =POWER(D83/M83,1/9)-1 -> #VALUE! | O83: =POWER(D83/I83,1/5)-1 -> #VALUE!
A84: 1816.HK | B84: 中广核电力 | C84: 3.31 | D84: 11756273761.9 | E84: 11241352262.219999 | F84: 11956231928.18 | G84: 11397314453.67 | H84: 10577920147.6 | I84: 9908817536.2199993 | J84: 11466390735.1 | K84: 8097605407.5 | L84: 8266905877.1499996 | M84: 7727946451.8999996 | N84: =POWER(D84/M84,1/9)-1 -> 4.7719592068894423e-02 | O84: =POWER(D84/I84,1/5)-1 -> 3.4783682919699688e-02
A85: 2359.HK | B85: 药明康德 | C85: 28.65 | D85: 11718382384.799999 | E85: 9939514244.5 | F85: 6235836046.5 | G85: 3520411334.6999998 | H85: 2072460742.5 | I85: 2573831487.8000002 | J85: 1471161797.7 | K85: 1083446525 | L85: 410403816.39999998 | M85: -- | N85: =POWER(D85/M85,1/9)-1 -> #VALUE! | O85: =POWER(D85/I85,1/5)-1 -> 0.35412111812312075
A86: 0914.HK | B86: 海螺水泥 | C86: 19.899999999999999 | D86: 11717480212.200001 | E86: 17892289839.299999 | F86: 40777296134.5 | G86: 41945429424.900002 | H86: 37581304852.5 | I86: 33996663795.799999 | J86: 19060938242.099998 | K86: 9527710815 | L86: 8865888135 | M86: 13703086324.299999 | N86: =POWER(D86/M86,1/9)-1 -> -1.7242868748422957e-02 | O86: =POWER(D86/I86,1/5)-1 -> -0.19187305836332391
A87: 3618.HK | B87: 重庆农村商业银行 | C87: 3.86 | D87: 11690265951 | E87: 11411379029.4 | F87: 11705863670.5 | G87: 10013386704.299999 | H87: 10906680427.5 | I87: 10313656272.6 | J87: 10713338029.700001 | K87: 8828601215 | L87: 8494959612.8999996 | M87: 8521230242.3999996 | N87: =POWER(D87/M87,1/9)-1 -> 3.5757317332721472e-02 | O87: =POWER(D87/I87,1/5)-1 -> 2.5374109983424153e-02
A88: 2020.HK | B88: 安踏体育 | C88: 72.599999999999994 | D88: 11220703200 | E88: 8562279000 | F88: 9453140000 | G88: 6152587800 | H88: 5972085390 | I88: 4671510703 | J88: 3702014972.6999998 | K88: 2650937992.5 | L88: 2399815876.6500001 | M88: 2121816849 | N88: =POWER(D88/M88,1/9)-1 -> 0.20328366248683993 | O88: =POWER(D88/I88,1/5)-1 -> 0.19155075273000377
A89: 82020.HK | B89: 安踏体育-R | C89: 67.599999999999994 | D89: 11220703200 | E89: 8562279000 | F89: 9453140000 | G89: 6152587800 | H89: -- | I89: -- | J89: -- | K89: -- | L89: -- | M89: -- | N89: =POWER(D89/M89,1/9)-1 -> #VALUE! | O89: =POWER(D89/I89,1/5)-1 -> #VALUE!
A90: 0836.HK | B90: 华润电力 | C90: 21.600000000000001 | D90: 11003283000 | E90: 7042478000 | F90: 2137849000 | G90: 7582668000 | H90: 6590345000 | I90: 3950435000 | J90: 4623323000 | K90: 7708373000 | L90: 10025241000 | M90: 9214858000 | N90: =POWER(D90/M90,1/9)-1 -> 1.9903994842939365e-02 | O90: =POWER(D90/I90,1/5)-1 -> 0.22736991152164632
A91: 9961.HK | B91: 携程集团-S | C91: 344.19999999999999 | D91: 10872111600 | E91: 1582724300 | F91: -673475000 | G91: -3870099300 | H91: -- | I91: -- | J91: -- | K91: -- | L91: -- | M91: -- | N91: =POWER(D91/M91,1/9)-1 -> #VALUE! | O91: =POWER(D91/I91,1/5)-1 -> #VALUE!
A92: 0788.HK | B92: 中国铁塔 | C92: 0.98 | D92: 10687950000 | E92: 9912614700 | F92: 8974360500 | G92: 7661533200 | H92: 5835585000 | I92: 3017290000 | J92: 2329462700 | K92: 84455000 | L92: -4229075800 | M92: -- | N92: =POWER(D92/M92,1/9)-1 -> #VALUE! | O92: =POWER(D92/I92,1/5)-1 -> 0.28782090901852908
A93: 0316.HK | B93: 东方海外国际 | C93: 107.2 | D93: 10684291972 | E93: 77808632960 | F93: 55585134346 | G93: 6998811419 | H93: 10503051091 | I93: 847372444 | J93: 1075643984 | K93: -1699839634 | L93: 2199987175.5 | M93: 2098292728 | N93: =POWER(D93/M93,1/9)-1 -> 0.1982355097719346 | O93: =POWER(D93/I93,1/5)-1 -> 0.66010012446153743
A94: 0763.HK | B94: 中兴通讯 | C94: 18.02 | D94: 10222890438.6 | E94: 9115380789.5 | F94: 8342446254.5 | G94: 5077198408.8000002 | H94: 5752752547.5 | I94: -7951597553.1999998 | J94: 5476781410.8000002 | K94: -2619680752.5 | L94: 3772633154.25 | M94: 3286433250.9000001 | N94: =POWER(D94/M94,1/9)-1 -> 0.13438633900468622 | O94: =POWER(D94/I94,1/5)-1 -> -2.0515353156832505
A95: 1099.HK | B95: 国药控股 | C95: 18.899999999999999 | D95: 9924731712 | E95: 9617791405.5 | F95: 9500462027 | G95: 8566428447.6000004 | H95: 6987210097.5 | I95: 6644689701.1999998 | J95: 6684567657.6000004 | K95: 5150867111.25 | L95: 4436321683.1000004 | M95: 3587491621.6999998 | N95: =POWER(D95/M95,1/9)-1 -> 0.11970365998764332 | O95: =POWER(D95/I95,1/5)-1 -> 8.3549644985598803e-02
A96: 2338.HK | B96: 潍柴动力 | C96: 12.12 | D96: 9881030629.3199997 | E96: 5533345212.8000002 | F96: 11623695014.23 | G96: 10999177379.719999 | H96: 10174787608.49 | I96: 9857460593.1299992 | J96: 8162521876.2799997 | K96: 2712770867.0100002 | L96: 1660904009.4400001 | M96: 6242528918.6700001 | N96: =POWER(D96/M96,1/9)-1 -> 5.2349955321097985e-02 | O96: =POWER(D96/I96,1/5)-1 -> 4.7776047515579734e-04
A97: 3668.HK | B97: 兖煤澳大利亚 | C97: 34.700000000000003 | D97: 9676170500 | E97: 19088278000 | F97: 4476269000 | G97: -6210880000 | H97: 3923583000 | I97: 4712838000 | J97: 1395755000 | K97: -1269951500 | L97: -1646914500 | M97: -- | N97: =POWER(D97/M97,1/9)-1 -> #VALUE! | O97: =POWER(D97/I97,1/5)-1 -> 0.15473997393297245
A98: 2057.HK | B98: 中通快递-W | C98: 153 | D98: 9590658184.7999992 | E98: 7681296073.6000004 | F98: 5822285661.5 | G98: 5139726674.6999998 | H98: 6340857037.5 | I98: 4990512265 | J98: 3788119970.6999998 | K98: -- | L98: -- | M98: -- | N98: =POWER(D98/M98,1/9)-1 -> #VALUE! | O98: =POWER(D98/I98,1/5)-1 -> 0.13956908032044124
A99: 1336.HK | B99: 新华保险 | C99: 14.800000000000001 | D99: 9550094400 | E99: 11080198200 | F99: 18302601500 | G99: 17037018600 | H99: 16269682500 | I99: 9019989200 | J99: 6453678700 | K99: 5491797500 | L99: 10115206050 | M99: 7994047400 | N99: =POWER(D99/M99,1/9)-1 -> 1.9958090633646952e-02 | O99: =POWER(D99/I99,1/5)-1 -> 1.1487055795469825e-02
A100: 2611.HK | B100: 国泰君安 | C100: 7.99 | D100: 9495386346.6000004 | E100: 12385581371.200001 | F100: 17838192732 | G100: 12712226136.6 | H100: 8928269602.5 | I100: 6966086877.6000004 | J100: 11139633300.5 | K100: 10280637141.25 | L100: 17876720904.349998 | M100: 8433198384.8000002 | N100: =POWER(D100/M100,1/9)-1 -> 1.3268356771109602e-02 | O100: =POWER(D100/I100,1/5)-1 -> 6.3909656358929201e-02
A101: 0012.HK | B101: 恒基地产 | C101: 22.5 | D101: 9261000000 | E101: 9239000000 | F101: 13195000000 | G101: 10192000000 | H101: 16994000000 | I101: 31157000000 | J101: 30809000000 | K101: 21916000000 | L101: 21326000000 | M101: 16752000000 | N101: =POWER(D101/M101,1/9)-1 -> -6.3734491679222405e-02 | O101: =POWER(D101/I101,1/5)-1 -> -0.21545031931423275
A102: 3311.HK | B102: 中国建筑国际 | C102: 10.9 | D102: 9164045000 | E102: 7956876000 | F102: 6800879000 | G102: 6015368000 | H102: 5413208000 | I102: 4500148000 | J102: 5490091000 | K102: 5130066000 | L102: 4524126000 | M102: 3457410000 | N102: =POWER(D102/M102,1/9)-1 -> 0.11439041990324883 | O102: =POWER(D102/I102,1/5)-1 -> 0.15284808693275087
A103: 0293.HK | B103: 国泰航空 | C103: 8 | D103: 9067000000 | E103: -7162000000 | F103: -6123000000 | G103: -21876000000 | H103: 1691000000 | I103: 2345000000 | J103: -1259000000 | K103: -575000000 | L103: 6000000000 | M103: 3150000000 | N103: =POWER(D103/M103,1/9)-1 -> 0.12464901412784846 | O103: =POWER(D103/I103,1/5)-1 -> 0.31058186368866325
A104: 3993.HK | B104: 洛阳钼业 | C104: 6.93 | D104: 9043334154.6499996 | E104: 6844122419.0600004 | F104: 6252318122.3900003 | G104: 2775681835.46 | H104: 2075213380.77 | I104: 5278075889.0699997 | J104: 3270354827.8899999 | K104: 1109072595.3599999 | L104: 895162300.53999996 | M104: 2276488172.6100001 | N104: =POWER(D104/M104,1/9)-1 -> 0.16563498994386028 | O104: =POWER(D104/I104,1/5)-1 -> 0.11370607756306428
A105: 6099.HK | B105: 招商证券 | C105: 6.07 | D105: 8979763464 | E105: 8416178769 | F105: 13277222887.5 | G105: 10357073453.1 | H105: 7241725192.5 | I105: 4125029385.5999999 | J105: 6226798864 | K105: 6004584923.75 | L105: 12829234261.450001 | M105: 4805254836.6999998 | N105: =POWER(D105/M105,1/9)-1 -> 7.1943888351387209e-02 | O105: =POWER(D105/I105,1/5)-1 -> 0.16833549218635446
A106: 3996.HK | B106: 中国能源建设 | C106: 0.81 | D106: 8754380359.2000008 | E106: 8809719838.2999992 | F106: 7964272899 | G106: 5371796756.1000004 | H106: 5675250570 | I106: 5204181941 | J106: 6307586740.5 | K106: 4757585735 | L106: 4981360879.5500002 | M106: 2686539019.1999998 | N106: =POWER(D106/M106,1/9)-1 -> 0.14025919841359857 | O106: =POWER(D106/I106,1/5)-1 -> 0.10962079758153598
A107: 1114.HK | B107: 华晨中国 | C107: 3.7999999999999998 | D107: 8479099326.6000004 | E107: 8062412249.5 | F107: 14645662862.5 | G107: 13371926.1 | H107: 7557325072.5 | I107: 6627686987.3999996 | J107: 5246530268 | K107: 4091704732.5 | L107: 4109980744.6500001 | M107: 6742945288.6000004 | N107: =POWER(D107/M107,1/9)-1 -> 2.5783160264314153e-02 | O107: =POWER(D107/I107,1/5)-1 -> 5.0503603959269228e-02
A108: 1038.HK | B108: 长江基建集团 | C108: 50.85 | D108: 8027000000 | E108: 7748000000 | F108: 7515000000 | G108: 7320000000 | H108: 10506000000 | I108: 10443000000 | J108: 10256000000 | K108: 9636000000 | L108: 11162000000 | M108: 31782000000 | N108: =POWER(D108/M108,1/9)-1 -> -0.1417834341789298 | O108: =POWER(D108/I108,1/5)-1 -> -5.1263526609258148e-02
A109: 9696.HK | B109: 天齐锂业 | C109: 21.800000000000001 | D109: 7978519596.6000004 | E109: 27011891979 | F109: 4468427032.5 | G109: -2182273548 | H109: -- | I109: -- | J109: -- | K109: -- | L109: -- | M109: -- | N109: =POWER(D109/M109,1/9)-1 -> #VALUE! | O109: =POWER(D109/I109,1/5)-1 -> #VALUE!
A110: 0066.HK | B110: 港铁公司 | C110: 25 | D110: 7784000000 | E110: 9827000000 | F110: 9552000000 | G110: -4809000000 | H110: 11932000000 | I110: 16008000000 | J110: 16829000000 | K110: 10254000000 | L110: 12994000000 | M110: 15606000000 | N110: =POWER(D110/M110,1/9)-1 -> -7.4376055743638703e-02 | O110: =POWER(D110/I110,1/5)-1 -> -0.13428857244143333
A111: 2333.HK | B111: 长城汽车 | C111: 12.02 | D111: 7697033721.04 | E111: 9324921763.8099995 | F111: 8236101960.6199999 | G111: 6391552062.6099997 | H111: 5025257693.96 | I111: 5929047683.6899996 | J111: 6027227569.4899998 | K111: 11724975310.08 | L111: 9478177930.9300003 | M111: 10035032172.41 | N111: =POWER(D111/M111,1/9)-1 -> -2.9041845793364995e-02 | O111: =POWER(D111/I111,1/5)-1 -> 5.3580415702354722e-02
A112: 82333.HK | B112: 长城汽车-R | C112: 11.1 | D112: 7697033721.04 | E112: 9324921763.8099995 | F112: 8236101960.6199999 | G112: 6391552062.6099997 | H112: -- | I112: -- | J112: -- | K112: -- | L112: -- | M112: -- | N112: =POWER(D112/M112,1/9)-1 -> #VALUE! | O112: =POWER(D112/I112,1/5)-1 -> #VALUE!
A113: 6881.HK | B113: 中国银河 | C113: 3.78 | D113: 7629250545 | E113: 7983613336.3999996 | F113: 12080913326.5 | G113: 8603930389.2000008 | H113: 5842769407.5 | I113: 3287282802.1999998 | J113: 4772497197 | K113: 5726877992.5 | L113: 11567051535.5 | M113: 4705491471.1999998 | N113: =POWER(D113/M113,1/9)-1 -> 5.5163243230649472e-02 | O113: =POWER(D113/I113,1/5)-1 -> 0.18339290715942469
A114: 0669.HK | B114: 创科实业 | C114: 96.900000000000006 | D114: 7626191740 | E114: 8410387200 | F114: 8570025394 | G114: 6208292280 | H114: 4788226300 | I114: 4327995142 | J114: 3675900950 | K114: 3171246428 | L114: 2746986463.5 | M114: 2329359480 | N114: =POWER(D114/M114,1/9)-1 -> 0.14085416893573743 | O114: =POWER(D114/I114,1/5)-1 -> 0.11996433045660204
A115: 1618.HK | B115: 中国中冶 | C115: 1.55 | D115: 7550583944.3999996 | E115: 10416544866.700001 | F115: 8925719686.5 | G115: 7951971816.3000002 | H115: 6249804255 | I115: 6217916233.3999996 | J115: 6336662463.3000002 | K115: 5416771456.25 | L115: 5446936729.6000004 | M115: 4947846130.1999998 | N115: =POWER(D115/M115,1/9)-1 -> 4.8083875277802335e-02 | O115: =POWER(D115/I115,1/5)-1 -> 3.9602067778546468e-02
A116: 2688.HK | B116: 新奥能源 | C116: 59.700000000000003 | D116: 7471699200 | E116: 6616306500 | F116: 9495997500 | G116: 7482748200 | H116: 6336225000 | I116: 3208574800 | J116: 3359317800 | K116: 2390298750 | L116: 2394437800 | M116: 3703767200 | N116: =POWER(D116/M116,1/9)-1 -> 8.1095268092207906e-02 | O116: =POWER(D116/I116,1/5)-1 -> 0.18419014431574654
A117: 1880.HK | B117: 中国中免 | C117: 56.100000000000001 | D117: 7443227597.3999996 | E117: 5769060532.1999998 | F117: 11910169046.5 | G117: 7069573681.1999998 | H117: -- | I117: -- | J117: -- | K117: -- | L117: -- | M117: -- | N117: =POWER(D117/M117,1/9)-1 -> #VALUE! | O117: =POWER(D117/I117,1/5)-1 -> #VALUE!
A118: 0358.HK | B118: 江西铜业股份 | C118: 14.42 | D118: 7394788711.8000002 | E118: 6770265075.6000004 | F118: 7068456862.5 | G118: 2655200397.5999999 | H118: 2724451590 | I118: 2749738356.1999998 | J118: 1979519375.7 | K118: 930567417.5 | L118: 810952333.79999995 | M118: 3617775658.9000001 | N118: =POWER(D118/M118,1/9)-1 -> 8.2675321201150176e-02 | O118: =POWER(D118/I118,1/5)-1 -> 0.21878437981077559
A119: 9690.HK | B119: 途虎-W | C119: 17.84 | D119: 7347757347 | E119: -2409816761.3000002 | F119: -7151786536.5 | G119: -4682032307.1000004 | H119: -- | I119: -- | J119: -- | K119: -- | L119: -- | M119: -- | N119: =POWER(D119/M119,1/9)-1 -> #VALUE! | O119: =POWER(D119/I119,1/5)-1 -> #VALUE!
A120: 2600.HK | B120: 中国铝业 | C120: 4.65 | D120: 7302276009 | E120: 4596595743.5 | F120: 6795879489 | G120: 599690182.20000005 | H120: 950991382.5 | I120: 805513956 | J120: 1694079269.2 | K120: 287160335 | L120: 152103250.69999999 | M120: -20226175343 | N120: =POWER(D120/M120,1/9)-1 -> -1.892972891901713 | O120: =POWER(D120/I120,1/5)-1 -> 0.55409310992806837
A121: 0981.HK | B121: 中芯国际 | C121: 17.62 | D121: 7049630586 | E121: 14194491136 | F121: 13270020358 | G121: 5485635150 | H121: 1827460947 | I121: 1050186870 | J121: 1404011706 | K121: 2920389020 | L121: 1964061955.5 | M121: 1186427564 | N121: =POWER(D121/M121,1/9)-1 -> 0.21896625000441339 | O121: =POWER(D121/I121,1/5)-1 -> 0.46345696225616884
A122: 1024.HK | B122: 快手-W | C122: 45.200000000000003 | D122: 7011295200 | E122: -15444514769.200001 | F122: -95601175853.5 | G122: -139017544939.79999 | H122: -21960589245 | I122: -14151983901 | J122: -24031890555 | K122: -- | L122: -- | M122: -- | N122: =POWER(D122/M122,1/9)-1 -> #VALUE! | O122: =POWER(D122/I122,1/5)-1 -> -1.8689527968381574
A123: 81024.HK | B123: 快手-WR | C123: 42.05 | D123: 7011295200 | E123: -15444514769.200001 | F123: -95601175853.5 | G123: -139017544939.79999 | H123: -- | I123: -- | J123: -- | K123: -- | L123: -- | M123: -- | N123: =POWER(D123/M123,1/9)-1 -> #VALUE! | O123: =POWER(D123/I123,1/5)-1 -> #VALUE!
A124: 1776.HK | B124: 广发证券 | C124: 6.76 | D124: 6897200511.6000004 | E124: 8721006054.2999992 | F124: 13275360423 | G124: 11964453106.5 | H124: 8424744217.5 | I124: 4896123463.6000004 | J124: 10305023861.1 | K124: 8923456403.75 | L124: 15525052514.700001 | M124: 6267662607.1999998 | N124: =POWER(D124/M124,1/9)-1 -> 1.0691428201090369e-02 | O124: =POWER(D124/I124,1/5)-1 -> 7.0937431193182743e-02
A125: 0027.HK | B125: 银河娱乐 | C125: 33.95 | D125: 6827956000 | E125: -3433770000 | F125: 1326231000 | G125: -3973078000 | H125: 13041545000 | I125: 13507389000 | J125: 10504361000 | K125: 6283397000 | L125: 4161050000 | M125: 10339810000 | N125: =POWER(D125/M125,1/9)-1 -> -4.5061615280692968e-02 | O125: =POWER(D125/I125,1/5)-1 -> -0.12754334187214633
A126: 0916.HK | B126: 龙源电力 | C126: 7.35 | D126: 6796854363.6000004 | E126: 5531586457.3999996 | F126: 8789762227 | G126: 5633359211.1000004 | H126: 4832952825 | I126: 4467648927.3999996 | J126: 4421606741.6999998 | K126: 3795338802.5 | L126: 3384997665.8499999 | M126: 3187763045.8000002 | N126: =POWER(D126/M126,1/9)-1 -> 8.7766726912906767e-02 | O126: =POWER(D126/I126,1/5)-1 -> 8.7541366770094164e-02
A127: 3360.HK | B127: 远东宏信 | C127: 5.08 | D127: 6788735906.3999996 | E127: 6916915819.3999996 | F127: 6749744002.5 | G127: 5453837616.8999996 | H127: 4847270235 | I127: 4471819619.1999998 | J127: 3871316437.3000002 | K127: 3202853640 | L127: 2943781339.4499998 | M127: 2865120996.5999999 | N127: =POWER(D127/M127,1/9)-1 -> 0.10059447275239353 | O127: =POWER(D127/I127,1/5)-1 -> 8.7078552546686616e-02
A128: 0002.HK | B128: 中电控股 | C128: 64.95 | D128: 6655000000 | E128: 924000000 | F128: 8491000000 | G128: 11456000000 | H128: 4657000000 | I128: 13550000000 | J128: 14249000000 | K128: 12711000000 | L128: 15656000000 | M128: 11221000000 | N128: =POWER(D128/M128,1/9)-1 -> -5.6393938692342105e-02 | O128: =POWER(D128/I128,1/5)-1 -> -0.13255538978487791
A129: 1876.HK | B129: 百威亚太 | C129: 10 | D129: 6654972000 | E129: 7128704000 | F129: 7408100000 | G129: 3985042000 | H129: 6992726000 | I129: 7504972000 | J129: 4485236000 | K129: -- | L129: -- | M129: -- | N129: =POWER(D129/M129,1/9)-1 -> #VALUE! | O129: =POWER(D129/I129,1/5)-1 -> -2.3753631763482996e-02
A130: 6066.HK | B130: 中信建投证券 | C130: 5.44 | D130: 6632816803.1999998 | E130: 7507563033.1000004 | F130: 11866652765.5 | G130: 10892706161.700001 | H130: 6148136340 | I130: 3515381956 | J130: 4814096629.1999998 | K130: 5517635173.75 | L130: 9813931441.25 | M130: 4251751287.5 | N130: =POWER(D130/M130,1/9)-1 -> 5.0652033960132847e-02 | O130: =POWER(D130/I130,1/5)-1 -> 0.13539008310868916
A131: 9987.HK | B131: 百胜中国 | C131: 236.80000000000001 | D131: 6459697000 | E131: 3451136000 | F131: 7720020000 | G131: 6078352000 | H131: 5552131000 | I131: 5546472000 | J131: 3109972000 | K131: -- | L131: -- | M131: -- | N131: =POWER(D131/M131,1/9)-1 -> #VALUE! | O131: =POWER(D131/I131,1/5)-1 -> 3.0953469450853532e-02
A132: 2423.HK | B132: 贝壳-W | C132: 37.05 | D132: 6449190148.8000002 | E132: -1563630079.4000001 | F132: -641795960.5 | G132: 858723425.39999998 | H132: -- | I132: -- | J132: -- | K132: -- | L132: -- | M132: -- | N132: =POWER(D132/M132,1/9)-1 -> #VALUE! | O132: =POWER(D132/I132,1/5)-1 -> #VALUE!
A133: 1093.HK | B133: 石药集团 | C133: 6.02 | D133: 6438338865 | E133: 6871697059 | F133: 6863549032.5 | G133: 6149792794.5 | H133: 4150513455 | I133: 3507801157.1999998 | J133: 2770522000 | K133: 2100848000 | L133: 1665271000 | M133: 1268446000 | N133: =POWER(D133/M133,1/9)-1 -> 0.19781319847200773 | O133: =POWER(D133/I133,1/5)-1 -> 0.12913994834815745
A134: 0144.HK | B134: 招商局港口 | C134: 11.64 | D134: 6233000000 | E134: 7781000000 | F134: 8144000000 | G134: 5151000000 | H134: 8362000000 | I134: 7245000000 | J134: 6028000000 | K134: 5494000000 | L134: 4808000000 | M134: 4526000000 | N134: =POWER(D134/M134,1/9)-1 -> 3.6197424704071279e-02 | O134: =POWER(D134/I134,1/5)-1 -> -2.9642543574068259e-02
A135: 0135.HK | B135: 昆仑能源 | C135: 8.08 | D135: 6228608400 | E135: 5897706800 | F135: 28183092000 | G135: 7226489700 | H135: 6203242500 | I135: 5276272400 | J135: 5706764000 | K135: 740092500 | L135: 1491000000 | M135: 5610000000 | N135: =POWER(D135/M135,1/9)-1 -> 1.1690271928502138e-02 | O135: =POWER(D135/I135,1/5)-1 -> 3.3743432966445885e-02
A136: 1508.HK | B136: 中国再保险 | C136: 0.52 | D136: 6196211305.1999998 | E136: 2111034963.9000001 | F136: 7290748919 | G136: 6806381898.8999996 | H136: 6760143037.5 | I136: 4246853892.5999999 | J136: 6301773274.3999996 | K136: 5718550285 | L136: 8913059500.5 | M136: 6744050928 | N136: =POWER(D136/M136,1/9)-1 -> -9.3694689470743553e-03 | O136: =POWER(D136/I136,1/5)-1 -> 7.8479215991138496e-02
A137: 3606.HK | B137: 福耀玻璃 | C137: 45.799999999999997 | D137: 6170163400.8000002 | E137: 5364152727.3000002 | F137: 3851850874 | G137: 3099232015.5 | H137: 3238367490 | I137: 4690957991 | J137: 3774402156.9000001 | K137: 3493157701.25 | L137: 3063253906.8499999 | M137: 2769395835.5 | N137: =POWER(D137/M137,1/9)-1 -> 9.3092332214303797e-02 | O137: =POWER(D137/I137,1/5)-1 -> 5.6348024159411425e-02
A138: 0003.HK | B138: 香港中华煤气 | C138: 6.31 | D138: 6070100000 | E138: 5247900000 | F138: 5017000000 | G138: 6007300000 | H138: 6965700000 | I138: 9312800000 | J138: 8225300000 | K138: 7340700000 | L138: 7302000000 | M138: 7109200000 | N138: =POWER(D138/M138,1/9)-1 -> -1.7403953021884577e-02 | O138: =POWER(D138/I138,1/5)-1 -> -8.2041359878335163e-02
A139: 0392.HK | B139: 北京控股 | C139: 25.55 | D139: 6027225498 | E139: 8542707593.1000004 | F139: 9918640000 | G139: 5286888000 | H139: 8054780000 | I139: 7577383000 | J139: 6880378000 | K139: 6235883000 | L139: 5667378000 | M139: 4831678000 | N139: =POWER(D139/M139,1/9)-1 -> 2.4870112916636211e-02 | O139: =POWER(D139/I139,1/5)-1 -> -4.4744294785033722e-02
A140: 3908.HK | B140: 中金公司 | C140: 8.36 | D140: 6024200834.46 | E140: 7947517125.8699999 | F140: 12763409347.799999 | G140: 8468316088.25 | H140: 4673071336.75 | I140: 3911270521.9200001 | J140: 3248238814.6300001 | K140: 1959420179.1300001 | L140: 2256560393.5100002 | M140: 1395717891.79 | N140: =POWER(D140/M140,1/9)-1 -> 0.17643210034748802 | O140: =POWER(D140/I140,1/5)-1 -> 9.0225453822914137e-02
A141: 0006.HK | B141: 电能实业 | C141: 46.899999999999999 | D141: 6003000000 | E141: 5649000000 | F141: 6140000000 | G141: 6132000000 | H141: 7131000000 | I141: 7636000000 | J141: 8319000000 | K141: 6417000000 | L141: 7732000000 | M141: 61005000000 | N141: =POWER(D141/M141,1/9)-1 -> -0.22712112907394588 | O141: =POWER(D141/I141,1/5)-1 -> -4.6983357606942611e-02
A142: 2588.HK | B142: 中银航空租赁 | C142: 63.95 | D142: 5966838522 | E142: 156628480 | F142: 4377157764 | G142: 3952797273 | H142: 5468490833 | I142: 4860519126 | J142: 4584059658 | K142: 3241792320 | L142: 2660800903.5 | M142: 2393299944 | N142: =POWER(D142/M142,1/9)-1 -> 0.1068353397828401 | O142: =POWER(D142/I142,1/5)-1 -> 4.1867103755500512e-02
A143: 0902.HK | B143: 华能国际电力股份 | C143: 4.89 | D143: 5964621516 | E143: -11527132242.299999 | F143: -15325057095.5 | G143: 723938605.79999995 | H143: 856390537.5 | I143: 836227691 | J143: 1894065380.4000001 | K143: 9468324503.75 | L143: 16055355804.65 | M143: 13424055884.299999 | N143: =POWER(D143/M143,1/9)-1 -> -8.6190939253727783e-02 | O143: =POWER(D143/I143,1/5)-1 -> 0.48132949150584281
A144: 0083.HK | B144: 信和置业 | C144: 8.12 | D144: 5849379302 | E144: 5735396549 | F144: 9646036990 | G144: 1688050428 | H144: 6914903934 | I144: 13995949179 | J144: 7414672305 | K144: 7090436987 | L144: 9371985144 | M144: 8921483066 | N144: =POWER(D144/M144,1/9)-1 -> -4.5820013528959591e-02 | O144: =POWER(D144/I144,1/5)-1 -> -0.1601117888787893
A145: 3808.HK | B145: 中国重汽 | C145: 18.06 | D145: 5829708893.3999996 | E145: 2026715129.4000001 | F145: 5292375939.5 | G145: 8165139555.6000004 | H145: 3725514795 | I145: 4948231492.6000004 | J145: 3624302274.6999998 | K145: 591301681.25 | L145: 242202793.30000001 | M145: 509183132.80000001 | N145: =POWER(D145/M145,1/9)-1 -> 0.31111694077932239 | O145: =POWER(D145/I145,1/5)-1 -> 3.3330794221230198e-02
A146: 1913.HK | B146: 普拉达 | C146: 52.65 | D146: 5785250659 | E146: 3888083094 | F146: 2596644423 | G146: -516161226 | H146: 2231622406 | I146: 1839125736 | J146: 2609891033 | K146: 2788889508 | L146: 3943887500 | M146: 6645104225 | N146: =POWER(D146/M146,1/9)-1 -> -1.5278600417856558e-02 | O146: =POWER(D146/I146,1/5)-1 -> 0.25759890843983868
A147: 0576.HK | B147: 浙江沪杭甬 | C147: 5.03 | D147: 5726196919.8000002 | E147: 6067898734.6000004 | F147: 5831596759.5 | G147: 2880101200.5 | H147: 4147174365 | I147: 4002287167 | J147: 3839033657 | K147: 3375316306.25 | L147: 3516013164 | M147: 2826486012.5999999 | N147: =POWER(D147/M147,1/9)-1 -> 8.1605349286377749e-02 | O147: =POWER(D147/I147,1/5)-1 -> 7.4265445403605135e-02
A148: 0175.HK | B148: 吉利汽车 | C148: 8.07 | D148: 5662937410.1999998 | E148: 5779117543.6999998 | F148: 5779713470 | G148: 6432175358.6999998 | H148: 9151920465 | I148: 14293081490.200001 | J148: 12748760913.5 | K148: 5681152277.5 | L148: 2658495130.4499998 | M148: 1785230765.2 | N148: =POWER(D148/M148,1/9)-1 -> 0.13685549833329591 | O148: =POWER(D148/I148,1/5)-1 -> -0.16903414559094576
A149: 80175.HK | B149: 吉利汽车-R | C149: 7.51 | D149: 5662937410.1999998 | E149: 5779117543.6999998 | F149: 5779713470 | G149: 6432175358.6999998 | H149: -- | I149: -- | J149: -- | K149: -- | L149: -- | M149: -- | N149: =POWER(D149/M149,1/9)-1 -> #VALUE! | O149: =POWER(D149/I149,1/5)-1 -> #VALUE!
A150: 9889.HK | B150: 东莞农商银行 | C150: 5.01 | D150: 5657798424.6000004 | E150: 6691529336.1000004 | F150: 6844587650 | G150: 5788970099.3999996 | H150: -- | I150: -- | J150: -- | K150: -- | L150: -- | M150: -- | N150: =POWER(D150/M150,1/9)-1 -> #VALUE! | O150: =POWER(D150/I150,1/5)-1 -> #VALUE!
A151: 0291.HK | B151: 华润啤酒 | C151: 27.55 | D151: 5648718600 | E151: 4900466400 | F151: 5616781500 | G151: 2495838600 | H151: 1466160000 | I151: 1112412200 | J151: 1408707500 | K151: 698976250 | L151: -4118000000 | M151: -161000000 | N151: =POWER(D151/M151,1/9)-1 -> -2.4848427116329064 | O151: =POWER(D151/I151,1/5)-1 -> 0.38400238779043416
A152: 80291.HK | B152: 华润啤酒-R | C152: 25.75 | D152: 5648718600 | E152: 4900466400 | F152: 5616781500 | G152: 2495838600 | H152: -- | I152: -- | J152: -- | K152: -- | L152: -- | M152: -- | N152: =POWER(D152/M152,1/9)-1 -> #VALUE! | O152: =POWER(D152/I152,1/5)-1 -> #VALUE!
A153: 0881.HK | B153: 中升控股 | C153: 12.5 | D153: 5500816007.3999996 | E153: 7521668795.5 | F153: 10198799275 | G153: 6602886428.1000004 | H153: 5030619577.5 | I153: 4140673749.5999999 | J153: 4016810145.6999998 | K153: 2067178365 | L153: 542116712.20000005 | M153: 937054349.5 | N153: =POWER(D153/M153,1/9)-1 -> 0.21732607998576703 | O153: =POWER(D153/I153,1/5)-1 -> 5.8452129828451271e-02
A154: 1772.HK | B154: 赣锋锂业 | C154: 17.74 | D154: 5461868021.3999996 | E154: 23130466511.5 | F154: 6399141489 | G154: 1222065797.0999999 | H154: 403132537.5 | I154: 1521848205.5999999 | J154: 2512352497.1999998 | K154: 1241274028.75 | L154: 256645863.34999999 | M154: -- | N154: =POWER(D154/M154,1/9)-1 -> #VALUE! | O154: =POWER(D154/I154,1/5)-1 -> 0.29120135474861231
A155: 1928.HK | B155: 金沙中国有限公司 | C155: 15.54 | D155: 5405212000 | E155: -12352256000 | F155: -8172304000 | G155: -11807819000 | H155: 15830971000 | I155: 14688750000 | J155: 12525842000 | K155: 9490896000 | L155: 11307979500 | M155: 19759992224 | N155: =POWER(D155/M155,1/9)-1 -> -0.13414069353230362 | O155: =POWER(D155/I155,1/5)-1 -> -0.18122310546116693
A156: 6198.HK | B156: 青岛港 | C156: 5.71 | D156: 5396945235.4799995 | E156: 5104850116.0500002 | F156: 4876219186.6599998 | G156: 4579116680.1400003 | H156: 4235485157.8699999 | I156: 4091542739.46 | J156: 3648204076.21 | K156: 2429363117.9899998 | L156: 2248509142.27 | M156: 1978340794.4000001 | N156: =POWER(D156/M156,1/9)-1 -> 0.11796300884874622 | O156: =POWER(D156/I156,1/5)-1 -> 5.6944501575788786e-02
A157: 1698.HK | B157: 腾讯音乐-SW | C157: 55 | D157: 5393304000 | E157: 4148023700 | F157: 3709010500 | G157: 4952344500 | H157: -- | I157: -- | J157: -- | K157: -- | L157: -- | M157: -- | N157: =POWER(D157/M157,1/9)-1 -> #VALUE! | O157: =POWER(D157/I157,1/5)-1 -> #VALUE!
A158: 1929.HK | B158: 周大福 | C158: 8.03 | D158: 5384400000 | E158: 6712300000 | F158: 6026400000 | G158: 2901000000 | H158: 4576800000 | I158: 4094900000 | J158: 3055300000 | K158: 2941400000 | L158: 5456000000 | M158: 7272000000 | N158: =POWER(D158/M158,1/9)-1 -> -3.2840369650612877e-02 | O158: =POWER(D158/I158,1/5)-1 -> 5.6279382824544921e-02
A159: 0966.HK | B159: 中国太平 | C159: 7.97 | D159: 5373949000 | E159: 2796608000 | F159: 7513701000 | G159: 6548980000 | H159: 8831182000 | I159: 6627322000 | J159: 5881461000 | K159: 4577852000 | L159: 6087735000 | M159: 3963486000 | N159: =POWER(D159/M159,1/9)-1 -> 3.4405188410981724e-02 | O159: =POWER(D159/I159,1/5)-1 -> -4.1060752744611073e-02
A160: 0868.HK | B160: 信义玻璃 | C160: 8.4000000000000004 | D160: 5365114000 | E160: 5127154000 | F160: 11555887000 | G160: 6422213000 | H160: 4477792000 | I160: 4236806000 | J160: 4013764000 | K160: 3213428000 | L160: 2113143000 | M160: 1363680000 | N160: =POWER(D160/M160,1/9)-1 -> 0.16438412557081472 | O160: =POWER(D160/I160,1/5)-1 -> 4.8354286326908191e-02
A161: 2319.HK | B161: 蒙牛乳业 | C161: 14.5 | D161: 5271841751.3999996 | E161: 5982282713.1999998 | F161: 6153770056.5 | G161: 4201499943.5999999 | H161: 4587825847.5 | I161: 3464793958 | J161: 2455154177.0999999 | K161: -834720993.75 | L161: 2784052580.5500002 | M161: 2933567063.6999998 | N161: =POWER(D161/M161,1/9)-1 -> 6.7296657583965969e-02 | O161: =POWER(D161/I161,1/5)-1 -> 8.7569426682054807e-02
A162: 1193.HK | B162: 华润燃气 | C162: 26.85 | D162: 5223705000 | E162: 4733455000 | F162: 6395368000 | G162: 5151292000 | H162: 5043477000 | I162: 4450101000 | J162: 3653994000 | K162: 3289399000 | L162: 2837910000 | M162: 2479898000 | N162: =POWER(D162/M162,1/9)-1 -> 8.6299113075625211e-02 | O162: =POWER(D162/I162,1/5)-1 -> 3.2575354274757107e-02
A163: 1963.HK | B163: 重庆银行 | C163: 5.03 | D163: 5172186209.3999996 | E163: 5150957620.6999998 | F163: 5353020526.5 | G163: 4906649437.8000002 | H163: 4701867840 | I163: 4292347794.1999998 | J163: 4466958730.8999996 | K163: 3891783078.75 | L163: 3728150239.0500002 | M163: 3527991749.6999998 | N163: =POWER(D163/M163,1/9)-1 -> 4.3423785101473378e-02 | O163: =POWER(D163/I163,1/5)-1 -> 3.7996405472518591e-02
A164: 6806.HK | B164: 申万宏源 | C164: 1.39 | D164: 5049469908 | E164: 3146347610.8000002 | F164: 11508302840.5 | G164: 9256503982.5 | H164: 6409324027.5 | I164: 4736791195.3999996 | J164: 5514559948.6999998 | K164: 6010815702.5 | L164: -- | M164: -- | N164: =POWER(D164/M164,1/9)-1 -> #VALUE! | O164: =POWER(D164/I164,1/5)-1 -> 1.2866738336994921e-02
A165: 2313.HK | B165: 申洲国际 | C165: 70.65 | D165: 4995671700.6000004 | E165: 5147275502.3000002 | F165: 4128649099 | G165: 6086718638.3999996 | H165: 5693892705 | I165: 5169798498.1999998 | J165: 4511126206.8999996 | K165: 3275601621.25 | L165: 2769202597.1999998 | M165: 2577995429.3000002 | N165: =POWER(D165/M165,1/9)-1 -> 7.6275681456731803e-02 | O165: =POWER(D165/I165,1/5)-1 -> -6.8289430477423974e-03
A166: 6823.HK | B166: 香港电讯-SS | C166: 9.22 | D166: 4991000000 | E166: 4901000000 | F166: 4808000000 | G166: 5303000000 | H166: 5217000000 | I166: 4825000000 | J166: 4745000000 | K166: 4889000000 | L166: 3949000000 | M166: 2991000000 | N166: =POWER(D166/M166,1/9)-1 -> 5.8541541824612242e-02 | O166: =POWER(D166/I166,1/5)-1 -> 6.7880461938953918e-03
A167: 6862.HK | B167: 海底捞 | C167: 13.14 | D167: 4931891496 | E167: 1550547503.7 | F167: -5097807787.5 | G167: 368620104.89999998 | H167: 2620214542.5 | I167: 1874313221.5999999 | J167: 1232283370.5 | K167: 816956551.25 | L167: 320700602.64999998 | M167: -- | N167: =POWER(D167/M167,1/9)-1 -> #VALUE! | O167: =POWER(D167/I167,1/5)-1 -> 0.21348459923576457
A168: 0288.HK | B168: 万洲国际 | C168: 5.23 | D168: 4913119000 | E168: 10696960000 | F168: 8328264000 | G168: 6419484000 | H168: 11407955000 | I168: 7387462000 | J168: 8853262000 | K168: 8033144000 | L168: 6091893000 | M168: 5941096000 | N168: =POWER(D168/M168,1/9)-1 -> -2.0888161977741238e-02 | O168: =POWER(D168/I168,1/5)-1 -> -7.8336466271984984e-02
A169: 2238.HK | B169: 广汽集团 | C169: 2.88 | D169: 4854899889 | E169: 9005543333 | F169: 9197256235 | G169: 7108557154.5 | H169: 7393676137.5 | I169: 12410287975.799999 | J169: 13193500061.9 | K169: 6987031047.5 | L169: 4952996905.6499996 | M169: 3985992264 | N169: =POWER(D169/M169,1/9)-1 -> 2.2153172293949863e-02 | O169: =POWER(D169/I169,1/5)-1 -> -0.17114285813126551
A170: 0177.HK | B170: 江苏宁沪高速公路 | C170: 7.36 | D170: 4837828313.9899998 | E170: 4201174318.6199999 | F170: 5240872285.5200005 | G170: 2937096280.1100001 | H170: 4693169635.5100002 | I170: 4983201228.6999998 | J170: 4301487580.3599997 | K170: 3718313472.1999998 | L170: 2947921515.2800002 | M170: 2780206182.3000002 | N170: =POWER(D170/M170,1/9)-1 -> 6.348258620536229e-02 | O170: =POWER(D170/I170,1/5)-1 -> -5.9038189526833262e-03
A171: 1997.HK | B171: 九龙仓置业 | C171: 20.75 | D171: 4766000000 | E171: -8856000000 | F171: 4391000000 | G171: -7854000000 | H171: 3928000000 | I171: 18027000000 | J171: 17218000000 | K171: 9917000000 | L171: 13787000000 | M171: 35127000000 | N171: =POWER(D171/M171,1/9)-1 -> -0.19903681842122323 | O171: =POWER(D171/I171,1/5)-1 -> -0.23361655309801233
A172: 1799.HK | B172: 新特能源 | C172: 7.54 | D172: 4763026850.46 | E172: 15111433428.299999 | F172: 6067721704.5299997 | G172: 756346991.99000001 | H172: 449952435 | I172: 1261337664.2 | J172: 1283627461.9000001 | K172: 890259046.25 | L172: 719527382.85000002 | M172: 717334100.70000005 | N172: =POWER(D172/M172,1/9)-1 -> 0.23410264652067836 | O172: =POWER(D172/I172,1/5)-1 -> 0.30439862734400713
A173: 1908.HK | B173: 建发国际集团 | C173: 14.199999999999999 | D173: 4756555402.1999998 | E173: 4760668863.6999998 | F173: 3927347421.5 | G173: 2666979945.3000002 | H173: 1919857177.5 | I173: 1617319815.5999999 | J173: 632795005.70000005 | K173: -31199455 | L173: 14898201.4 | M173: 31067718.399999999 | N173: =POWER(D173/M173,1/9)-1 -> 0.74894402889330358 | O173: =POWER(D173/I173,1/5)-1 -> 0.24079298764776169
A174: 3660.HK | B174: 奇富科技-S | C174: 74.45 | D174: 4697585323.1999998 | E174: 4539669561.3000002 | F174: 7079722262.5 | G174: 4167604691.4000001 | H174: -- | I174: -- | J174: -- | K174: -- | L174: -- | M174: -- | N174: =POWER(D174/M174,1/9)-1 -> #VALUE! | O174: =POWER(D174/I174,1/5)-1 -> #VALUE!
A175: 1359.HK | B175: 中国信达 | C175: 0.67 | D175: 4674354652.8000002 | E175: 5981689332.6000004 | F175: 13511932598.5 | G175: 14490739983.9 | H175: 13334210032.5 | I175: 12478009626.6 | J175: 20469403564.299999 | K175: 17237882243.75 | L175: 16497010797.700001 | M175: 14845321639.700001 | N175: =POWER(D175/M175,1/9)-1 -> -0.12049787260852696 | O175: =POWER(D175/I175,1/5)-1 -> -0.17829625039669406
A176: 0168.HK | B176: 青岛啤酒股份 | C176: 51 | D176: 4669679198.6599998 | E176: 4174927721.9299998 | F176: 3851575130.0700002 | G176: 2623757546.4000001 | H176: 2069725522.6800001 | I176: 1619316584.1099999 | J176: 1514231306.6900001 | K176: 1159574293.1199999 | L176: 2014725221.6800001 | M176: 2483443349.1100001 | N176: =POWER(D176/M176,1/9)-1 -> 7.2680312471306241e-02 | O176: =POWER(D176/I176,1/5)-1 -> 0.23592198156714117
A177: 0598.HK | B177: 中国外运 | C177: 3.5 | D177: 4627983740.3800001 | E177: 4589404242.9399996 | F177: 4547205244.0200005 | G177: 3282996548.2399998 | H177: 3132905724.0300002 | I177: 3078895552.6500001 | J177: 2762494560.7800002 | K177: 2504455240 | L177: 1756153127.2 | M177: 1536705240.7 | N177: =POWER(D177/M177,1/9)-1 -> 0.13031668682326969 | O177: =POWER(D177/I177,1/5)-1 -> 8.4924142744344788e-02
A178: 1606.HK | B178: 国银金租 | C178: 1.42 | D178: 4549393333.8000002 | E178: 3780345451.3000002 | F178: 4802748594 | G178: 3895511799.9000001 | H178: 3283354687.5 | I178: 2854451982.4000001 | J178: 2554811540.6999998 | K178: 1735037963.75 | L178: 1237799681.3 | M178: 2391052521.9000001 | N178: =POWER(D178/M178,1/9)-1 -> 7.4089536110451881e-02 | O178: =POWER(D178/I178,1/5)-1 -> 9.7706280558167657e-02
A179: 9668.HK | B179: 渤海银行 | C179: 0.93 | D179: 4528295868.6000004 | E179: 5818147547.5 | F179: 9403822038 | G179: 8932779174.8999996 | H179: 9155404830 | I179: 8061464483 | J179: 8097154798 | K179: -- | L179: -- | M179: -- | N179: =POWER(D179/M179,1/9)-1 -> #VALUE! | O179: =POWER(D179/I179,1/5)-1 -> -0.10894570068577591
A180: 1179.HK | B180: 华住集团-S | C180: 23.800000000000001 | D180: 4477977000 | E180: -2054270100 | F180: -569392500 | G180: -2612644800 | H180: 1976857500 | I180: 815237600 | J180: 1472249200 | K180: -- | L180: -- | M180: -- | N180: =POWER(D180/M180,1/9)-1 -> #VALUE! | O180: =POWER(D180/I180,1/5)-1 -> 0.40591651124239236
A181: 6060.HK | B181: 众安在线 | C181: 12.86 | D181: 4470144651 | E181: -1529810769.5 | F181: 1426040455 | G181: 660057533.39999998 | H181: -507457867.5 | I181: -1985598847 | J181: -1195603025 | K181: 10414635 | L181: 52048444.850000001 | M181: 46148589.899999999 | N181: =POWER(D181/M181,1/9)-1 -> 0.66220580043920663 | O181: =POWER(D181/I181,1/5)-1 -> -2.1762131025878482
A182: 0874.HK | B182: 白云山 | C182: 20.85 | D182: 4445834981.6099997 | E182: 4474633714.7299995 | F182: 4554990219.7200003 | G182: 3474680010.1900001 | H182: 3563578583.98 | I182: 3917899945.3699999 | J182: 2471714497.6900001 | K182: 1675801305.73 | L182: 1529278137.6500001 | M182: 1490168894.8800001 | N182: =POWER(D182/M182,1/9)-1 -> 0.12913644995178619 | O182: =POWER(D182/I182,1/5)-1 -> 2.5604693311808591e-02
A183: 0285.HK | B183: 比亚迪电子 | C183: 33.700000000000003 | D183: 4430154178.8000002 | E183: 2095578865.8 | F183: 2828450509 | G183: 6485570094.8999996 | H183: 1785368287.5 | I183: 2491962732 | J183: 3098998245.1999998 | K183: 1370716873.75 | L183: 1068023927.25 | M183: 1125227686.3 | N183: =POWER(D183/M183,1/9)-1 -> 0.16447705837409399 | O183: =POWER(D183/I183,1/5)-1 -> 0.12195505482173918
A184: 0257.HK | B184: 光大环境 | C184: 3.56 | D184: 4429160000 | E184: 4601939000 | F184: 6804099000 | G184: 6015863000 | H184: 5203291000 | I184: 4319235000 | J184: 3509990000 | K184: 2784863000 | L184: 2084888000 | M184: 1703147000 | N184: =POWER(D184/M184,1/9)-1 -> 0.11203588990372526 | O184: =POWER(D184/I184,1/5)-1 -> 5.0389825006482702e-03
A185: 0384.HK | B185: 中国燃气 | C185: 7.16 | D185: 4293484000 | E185: 7662036000 | F185: 10478683000 | G185: 9188474000 | H185: 8224382000 | I185: 6095153000 | J185: 4147732000 | K185: 2273121000 | L185: 3371053000 | M185: 2575506000 | N185: =POWER(D185/M185,1/9)-1 -> 5.8426754400126457e-02 | O185: =POWER(D185/I185,1/5)-1 -> -6.7679899806235344e-02
A186: 6178.HK | B186: 光大证券 | C186: 4.93 | D186: 4255012112.4000001 | E186: 3194299757.5 | F186: 4060559552 | G186: 2742619111.1999998 | H186: 634678537.5 | I186: 117643567.8 | J186: 3616445883 | K186: 3348217363.75 | L186: 8992685141.7999992 | M186: 2581040305.3000002 | N186: =POWER(D186/M186,1/9)-1 -> 5.7116594691058342e-02 | O186: =POWER(D186/I186,1/5)-1 -> 1.0495877784699013
A187: 3323.HK | B187: 中国建材 | C187: 2.6000000000000001 | D187: 4234673217.5999999 | E187: 8981464038.5 | F187: 19959292448.5 | G187: 14973491665.200001 | H187: 12263631622.5 | I187: 9031083718.3999996 | J187: 5921822682 | K187: 1164698902.5 | L187: 1198937109.05 | M187: 7386995213.8999996 | N187: =POWER(D187/M187,1/9)-1 -> -5.9951563096607652e-02 | O187: =POWER(D187/I187,1/5)-1 -> -0.14055912120628411
A188: 3320.HK | B188: 华润医药 | C188: 5.42 | D188: 4225025561.4000001 | E188: 4678695477.1999998 | F188: 3768889000 | G188: 3297126000 | H188: 3286419000 | I188: 3977603000 | J188: 3483036000 | K188: 2821410000 | L188: 2850076000 | M188: 2645940000 | N188: =POWER(D188/M188,1/9)-1 -> 5.3375616240263657e-02 | O188: =POWER(D188/I188,1/5)-1 -> 1.2142313385865133e-02
A189: 0809.HK | B189: 大成生化科技 | C189: 0.07 | D189: 4224593000 | E189: -1443068000 | F189: -400801000 | G189: -2429949000 | H189: -1067819000 | I189: -1222322000 | J189: -837491000 | K189: -1850640000 | L189: -1995970000 | M189: -3365133000 | N189: =POWER(D189/M189,1/9)-1 -> -2.0255948917631454 | O189: =POWER(D189/I189,1/5)-1 -> -2.2815036554081916
A190: 0968.HK | B190: 信义光能 | C190: 3.7000000000000002 | D190: 4187127000 | E190: 3820144000 | F190: 4924347000 | G190: 4560853000 | H190: 2416462000 | I190: 1863146000 | J190: 2332031000 | K190: 1985630000 | L190: 1205597000 | M190: 492972000 | N190: =POWER(D190/M190,1/9)-1 -> 0.26833113438787004 | O190: =POWER(D190/I190,1/5)-1 -> 0.17580106453564093
A191: 1308.HK | B191: 海丰国际 | C191: 16.86 | D191: 4150710723 | E191: 15182070400 | F191: 9066843772 | G191: 2726140872 | H191: 1712960899 | I191: 1547324676 | J191: 1473821982 | K191: 952113660 | L191: 1110235873.5 | M191: 935994080 | N191: =POWER(D191/M191,1/9)-1 -> 0.17997322205860122 | O191: =POWER(D191/I191,1/5)-1 -> 0.21817085049563278
A192: 2607.HK | B192: 上海医药 | C192: 11.76 | D192: 4130481140.8899999 | E192: 6336709174.6000004 | F192: 6236950661.0600004 | G192: 5359040992.8999996 | H192: 4560510795 | I192: 4418978331.8000002 | J192: 4220900091.5999999 | K192: 3551992832.5 | L192: 3383482913.4499998 | M192: 3233472374.9000001 | N192: =POWER(D192/M192,1/9)-1 -> 2.7577555685298627e-02 | O192: =POWER(D192/I192,1/5)-1 -> -1.3412169165286092e-02
A193: 1578.HK | B193: 天津银行 | C193: 1.63 | D193: 4121601283.8000002 | E193: 4021637016.5 | F193: 3913533837 | G193: 5134210561.5 | H193: 5082357592.5 | I193: 4760768972.8000002 | J193: 4695355175.3999996 | K193: 5025131396.25 | L193: 5781979262 | M193: 5512262564.8999996 | N193: =POWER(D193/M193,1/9)-1 -> -3.1787521484813452e-02 | O193: =POWER(D193/I193,1/5)-1 -> -2.8421772508320453e-02
A194: 6963.HK | B194: 阳光保险 | C194: 2.74 | D194: 4097595600 | E194: 5506256100 | F194: 7203733500 | G194: 6697286100 | H194: -- | I194: -- | J194: -- | K194: -- | L194: -- | M194: -- | N194: =POWER(D194/M194,1/9)-1 -> #VALUE! | O194: =POWER(D194/I194,1/5)-1 -> #VALUE!
A195: 0101.HK | B195: 恒隆地产 | C195: 6.77 | D195: 3970000000 | E195: 3836000000 | F195: 3868000000 | G195: -2571000000 | H195: 6172000000 | I195: 8078000000 | J195: 8124000000 | K195: 6195000000 | L195: 5092000000 | M195: 11704000000 | N195: =POWER(D195/M195,1/9)-1 -> -0.11319432030950849 | O195: =POWER(D195/I195,1/5)-1 -> -0.13244437179793878
A196: 1071.HK | B196: 华电国际电力股份 | C196: 3.83 | D196: 3939326244 | E196: -1051012414.6 | F196: -5239909788 | G196: 3872357950.5 | H196: 3783099570 | I196: 1646115009.5999999 | J196: 522606504.5 | K196: 3475766638.75 | L196: 8619786735.9500008 | M196: 7436292255.5 | N196: =POWER(D196/M196,1/9)-1 -> -6.8161583252715707e-02 | O196: =POWER(D196/I196,1/5)-1 -> 0.19067258689190791
A197: 0552.HK | B197: 中国通信服务 | C197: 4.16 | D197: 3929209414.1999998 | E197: 3788327886.9000001 | F197: 3866277933 | G197: 3672810052.5 | H197: 3407513407.5 | I197: 3303447506.4000001 | J197: 3254069965.6999998 | K197: 2818406701.25 | L197: 2745385232.5999999 | M197: 2683306958.1999998 | N197: =POWER(D197/M197,1/9)-1 -> 4.3287175241271125e-02 | O197: =POWER(D197/I197,1/5)-1 -> 3.5303192406543005e-02
A198: 0142.HK | B198: 第一太平 | C198: 3.42 | D198: 3914873200 | E198: 3057612800 | F198: 2599073400 | G198: 1563004800 | H198: -1977119300 | I198: 1032521200 | J198: 944712600 | K198: 800212800 | L198: 624690300 | M198: 628236000 | N198: =POWER(D198/M198,1/9)-1 -> 0.2254294692926333 | O198: =POWER(D198/I198,1/5)-1 -> 0.30546052659871026
A199: 1072.HK | B199: 东方电气 | C199: 10.52 | D199: 3891941438.3600001 | E199: 3220331313.71 | F199: 2802925582.9699998 | G199: 2219315601.29 | H199: 1427798256.76 | I199: 1285290661.6900001 | J199: 1267601246.74 | K199: -1982810936.79 | L199: 516371383.94 | M199: 1595138664.3699999 | N199: =POWER(D199/M199,1/9)-1 -> 0.10418253296559099 | O199: =POWER(D199/I199,1/5)-1 -> 0.24805288616082888
A200: 1157.HK | B200: 中联重科 | C200: 4.69 | D200: 3891510000 | E200: 2647650700 | F200: 7718023500 | G200: 8696102400 | H200: 4895767500 | I200: 2312496600 | J200: 1608923800 | K200: -1032351250 | L200: 104668450 | M200: 741252600 | N200: =POWER(D200/M200,1/9)-1 -> 0.20231116503932811 | O200: =POWER(D200/I200,1/5)-1 -> 0.10970465949853048
A201: 6199.HK | B201: 贵州银行 | C201: 1.6000000000000001 | D201: 3881464423.1999998 | E201: 4320008185.5 | F201: 4537635772.5 | G201: 4375063229.6999998 | H201: 3982364347.5 | I201: 3275263740.5999999 | J201: 2703464350.5999999 | K201: 2179643532.5 | L201: -- | M201: -- | N201: =POWER(D201/M201,1/9)-1 -> #VALUE! | O201: =POWER(D201/I201,1/5)-1 -> 3.454614443479942e-02
A202: 0151.HK | B202: 中国旺旺 | C202: 4.68 | D202: 3853551932.8000002 | E202: 5182924278.75 | F202: 4923885308.25 | G202: 3983665554.75 | H202: 4057886352.8000002 | I202: 3893701958.0999999 | J202: 3766978996.1999998 | K202: 3910675440 | L202: 3978019702.3000002 | M202: 4812636780 | N202: =POWER(D202/M202,1/9)-1 -> -2.4392011356926147e-02 | O202: =POWER(D202/I202,1/5)-1 -> -2.0708652609212619e-03
A203: 3969.HK | B203: 中国通号 | C203: 3.36 | D203: 3811845471.0300002 | E203: 4099109575.75 | F203: 4009836708.02 | G203: 4551921307.6400003 | H203: 4264240202.3000002 | I203: 3880969954.8299999 | J203: 3968412950.5 | K203: 3388580186.25 | L203: 2935894748.1500001 | M203: 2537565965.0999999 | N203: =POWER(D203/M203,1/9)-1 -> 4.624965380088164e-02 | O203: =POWER(D203/I203,1/5)-1 -> -3.5878807760590936e-03
A204: 2269.HK | B204: 药明生物 | C204: 10.82 | D204: 3726782929.8000002 | E204: 4986524636.6000004 | F204: 4149191311 | G204: 2012983223.4000001 | H204: 1132927087.5 | I204: 717992051.20000005 | J204: 302875709.19999999 | K204: 156792930 | L204: 52344809.450000003 | M204: 52384346.200000003 | N204: =POWER(D204/M204,1/9)-1 -> 0.60617369033288138 | O204: =POWER(D204/I204,1/5)-1 -> 0.39008991400915138
A205: 6186.HK | B205: 中国飞鹤 | C205: 3.6000000000000001 | D205: 3716127865.8000002 | E205: 5575124348.8000002 | F205: 8413593378 | G205: 8864008928.7000008 | H205: 4396889797.5 | I205: 2553030404.4000001 | J205: 1390994951.4000001 | K205: 463377915 | L205: 484391474 | M205: 605806781.89999998 | N205: =POWER(D205/M205,1/9)-1 -> 0.22328739868200076 | O205: =POWER(D205/I205,1/5)-1 -> 7.797063998758258e-02
A206: 1138.HK | B206: 中远海能 | C206: 8.89 | D206: 3670863575.4000001 | E206: 1648287215.8 | F206: -6104605157 | G206: 2838408538.5 | H206: 462485197.5 | I206: 85029509.400000006 | J206: 2127625487.2 | K206: 2147517295 | L206: 1388822142.05 | M206: 386116482.69999999 | N206: =POWER(D206/M206,1/9)-1 -> 0.28431694172548938 | O206: =POWER(D206/I206,1/5)-1 -> 1.123438631952594
A207: 3866.HK | B207: 青岛银行 | C207: 2.29 | D207: 3634340383.8000002 | E207: 2902148931.9000001 | F207: 2997922533.5 | G207: 2261230963.5 | H207: 2553280762.5 | I207: 2303788587.1999998 | J207: 2278212122.8000002 | K207: 2320962306.25 | L207: 2133091264.8 | M207: 1866049760.8 | N207: =POWER(D207/M207,1/9)-1 -> 7.687905721200794e-02 | O207: =POWER(D207/I207,1/5)-1 -> 9.5460179770464171e-02
A208: 0564.HK | B208: 郑煤机 | C208: 9.15 | D208: 3618922330.8000002 | E208: 2863382903.5 | F208: 2385062732.5 | G208: 1476941693.0999999 | H208: 1162482727.5 | I208: 947706878.39999998 | J208: 340787325 | K208: 68894166.25 | L208: 49626957.899999999 | M208: 256061592.59999999 | N208: =POWER(D208/M208,1/9)-1 -> 0.34215869391043263 | O208: =POWER(D208/I208,1/5)-1 -> 0.30731741320908412
A209: 3692.HK | B209: 翰森制药 | C209: 17.28 | D209: 3592798788.5999999 | E209: 2914724990.6999998 | F209: 3321948499 | G209: 3061880253.3000002 | H209: 2857159185 | I209: 2166810452.8000002 | J209: 1912812579.7 | K209: 1640242782.5 | L209: 1703615445.55 | M209: -- | N209: =POWER(D209/M209,1/9)-1 -> #VALUE! | O209: =POWER(D209/I209,1/5)-1 -> 0.10642605600746657
A210: 0023.HK | B210: 东亚银行 | C210: 10.04 | D210: 3522000000 | E210: 3651000000 | F210: 4459000000 | G210: 2822000000 | H210: 2580000000 | I210: 5796000000 | J210: 8747000000 | K210: 3228000000 | L210: 4991000000 | M210: 6331000000 | N210: =POWER(D210/M210,1/9)-1 -> -6.3081330235065569e-02 | O210: =POWER(D210/I210,1/5)-1 -> -9.482574139850386e-02
A211: 2331.HK | B211: 李宁 | C211: 15.06 | D211: 3493490742 | E211: 4584411135.3999996 | F211: 4911323784.5 | G211: 2024423079.5999999 | H211: 1675287832.5 | I211: 814398451.79999995 | J211: 617619329.5 | K211: 714816007.5 | L211: 16828099.449999999 | M211: -975210139.89999998 | N211: =POWER(D211/M211,1/9)-1 -> -2.1523210292452144 | O211: =POWER(D211/I211,1/5)-1 -> 0.33808755479589903
A212: 82331.HK | B212: 李宁-R | C212: 14.02 | D212: 3493490742 | E212: 4584411135.3999996 | F212: 4911323784.5 | G212: 2024423079.5999999 | H212: -- | I212: -- | J212: -- | K212: -- | L212: -- | M212: -- | N212: =POWER(D212/M212,1/9)-1 -> #VALUE! | O212: =POWER(D212/I212,1/5)-1 -> #VALUE!
A213: 0123.HK | B213: 越秀地产 | C213: 5.43 | D213: 3491490177 | E213: 4459776391.1999998 | F213: 4394643560.5 | G213: 5063024334 | H213: 3892644742.5 | I213: 3105969861 | J213: 2709804133.8000002 | K213: 1711496132.5 | L213: 1191208108.45 | M213: 3083879114.5 | N213: =POWER(D213/M213,1/9)-1 -> 1.3888942220020351e-02 | O213: =POWER(D213/I213,1/5)-1 -> 2.3676462126811737e-02
A214: 0546.HK | B214: 阜丰集团 | C214: 4.5 | D214: 3446588728.8000002 | E214: 4355682091.8000002 | F214: 1568143680 | G214: 750779001.89999998 | H214: 1270846702.5 | I214: 2100761405.4000001 | J214: 1657335382 | K214: 1214053960 | L214: 607148749.04999995 | M214: 781719501.20000005 | N214: =POWER(D214/M214,1/9)-1 -> 0.17921547152608497 | O214: =POWER(D214/I214,1/5)-1 -> 0.10408509415276579
A215: 0363.HK | B215: 上海实业控股 | C215: 11.6 | D215: 3423695000 | E215: 2313924000 | F215: 3728312000 | G215: 2189309000 | H215: 3349531000 | I215: 3333020000 | J215: 3135182000 | K215: 2903030000 | L215: 2826764000 | M215: 3096256000 | N215: =POWER(D215/M215,1/9)-1 -> 1.1232250813345335e-02 | O215: =POWER(D215/I215,1/5)-1 -> 5.3827506851140683e-03
A216: 0322.HK | B216: 康师傅控股 | C216: 9.45 | D216: 3417360748.1999998 | E216: 2969511167.1999998 | F216: 4656139209 | G216: 4841811269.6999998 | H216: 3722371267.5 | I216: 2804737290.5999999 | J216: 2180891415.3000002 | K216: 1290938013.75 | L216: 1986763170 | M216: 3106138392 | N216: =POWER(D216/M216,1/9)-1 -> 1.0666290475832119e-02 | O216: =POWER(D216/I216,1/5)-1 -> 4.0302704695642122e-02
A217: 3898.HK | B217: 时代电气 | C217: 29.399999999999999 | D217: 3404472335.6500001 | E217: 2883224349.3400002 | F217: 2470667277.6999998 | G217: 2950494344.8899999 | H217: 2971615621.3699999 | I217: 2974578551.0100002 | J217: 3025389483.8099999 | K217: 3215004446.4400001 | L217: 3487315035.4899998 | M217: 2988493676.6999998 | N217: =POWER(D217/M217,1/9)-1 -> 1.4585397906641928e-02 | O217: =POWER(D217/I217,1/5)-1 -> 2.7365253795788913e-02
A218: 0053.HK | B218: 国浩集团 | C218: 68 | D218: 3400275480 | E218: 15381579542 | F218: 2501774001 | G218: -872873160.5 | H218: 3370885812 | I218: 4898234262 | J218: 6125676673 | K218: 3087626969.5 | L218: 4624467385 | M218: 5752041325.5 | N218: =POWER(D218/M218,1/9)-1 -> -5.6737745198438549e-02 | O218: =POWER(D218/I218,1/5)-1 -> -7.0402578555782025e-02
A219: 3900.HK | B219: 绿城中国 | C219: 6.39 | D219: 3389154426 | E219: 2915518045 | F219: 3986200565 | G219: 2948198023.1999998 | H219: 1333561920 | I219: 445985065.60000002 | J219: 1993116100.5999999 | K219: 1681371256.25 | L219: 626179590.14999998 | M219: 2152349218.3000002 | N219: =POWER(D219/M219,1/9)-1 -> 5.1740833656361618e-02 | O219: =POWER(D219/I219,1/5)-1 -> 0.50021743493909643
A220: 0579.HK | B220: 京能清洁能源 | C220: 1.85 | D220: 3351786064.1999998 | E220: 3211576609 | F220: 3096640499 | G220: 2745410541 | H220: 2336435475 | I220: 2272580699.8000002 | J220: 2127415679.7 | K220: 2173126051.25 | L220: 2247011700.1500001 | M220: 1507875007 | N220: =POWER(D220/M220,1/9)-1 -> 9.2812517391256177e-02 | O220: =POWER(D220/I220,1/5)-1 -> 8.0815079649938726e-02
A221: 1958.HK | B221: 北京汽车 | C221: 2.15 | D221: 3321865285.1999998 | E221: 4734181075.6999998 | F221: 4724335287.5 | G221: 2418139830.9000001 | H221: 4562415015 | I221: 5043388849 | J221: 2700897505.6999998 | K221: 7075250962.5 | L221: 3902840706.0500002 | M221: 5629036055.3000002 | N221: =POWER(D221/M221,1/9)-1 -> -5.6917304342611108e-02 | O221: =POWER(D221/I221,1/5)-1 -> -8.0118441281983976e-02
A222: 2883.HK | B222: 中海油田服务 | C222: 6.82 | D222: 3303130131 | E222: 2653996262.5 | F222: 383484012 | G222: 3221928585.3000002 | H222: 2796250965 | I222: 80615157.200000003 | J222: 51278151.899999999 | K222: -12730686692.5 | L222: 1262968327.3499999 | M222: 9349339178.2000008 | N222: =POWER(D222/M222,1/9)-1 -> -0.10917199170226266 | O222: =POWER(D222/I222,1/5)-1 -> 1.1013664575734214
A223: 0247.HK | B223: 尖沙咀置业 | C223: 18 | D223: 3287132467 | E223: 3159245014 | F223: 5304883959 | G223: 901781260 | H223: 3714769199 | I223: 7328005075 | J223: 3848282418 | K223: 3622174285 | L223: 4747169520 | M223: 4513349683 | N223: =POWER(D223/M223,1/9)-1 -> -3.4611714027072082e-02 | O223: =POWER(D223/I223,1/5)-1 -> -0.14814379950165724
A224: 1910.HK | B224: 新秀丽 | C224: 19.800000000000001 | D224: 3257187000 | E224: 2441561600 | F224: 111511400 | G224: -9906008100 | H224: 1031777500 | I224: 1854307800 | J224: 2611438800 | K224: 1982441918 | L224: 1531801069.5 | M224: 1444601536 | N224: =POWER(D224/M224,1/9)-1 -> 9.4542767536946348e-02 | O224: =POWER(D224/I224,1/5)-1 -> 0.1192630675368751
A225: 0683.HK | B225: 嘉里建设 | C225: 13.56 | D225: 3243327000 | E225: 2754780000 | F225: 10358011000 | G225: 5403203000 | H225: 6897450000 | I225: 7499295000 | J225: 9242116000 | K225: 6537258000 | L225: 5529963000 | M225: 6773636000 | N225: =POWER(D225/M225,1/9)-1 -> -7.8568172754143517e-02 | O225: =POWER(D225/I225,1/5)-1 -> -0.15434336644324254
A226: 1209.HK | B226: 华润万象生活 | C226: 23.899999999999999 | D226: 3210494653.8000002 | E226: 2488730740.5999999 | F226: 2112170662.5 | G226: 974628549 | H226: 407807040 | I226: 481534434.80000001 | J226: 465584422.69999999 | K226: -- | L226: -- | M226: -- | N226: =POWER(D226/M226,1/9)-1 -> #VALUE! | O226: =POWER(D226/I226,1/5)-1 -> 0.46146668689085213
A227: 2638.HK | B227: 港灯-SS | C227: 5.23 | D227: 3156000000 | E227: 2954000000 | F227: 2933000000 | G227: 2732000000 | H227: 2327000000 | I227: 3051000000 | J227: 3341000000 | K227: 3599000000 | L227: 3591000000 | M227: 3201000000 | N227: =POWER(D227/M227,1/9)-1 -> -1.5718586678735713e-03 | O227: =POWER(D227/I227,1/5)-1 -> 6.7901486821535517e-03
A228: 0270.HK | B228: 粤海投资 | C228: 4.09 | D228: 3122069000 | E228: 4763503000 | F228: 4696962000 | G228: 4509944000 | H228: 5044370000 | I228: 5015119000 | J228: 5685371000 | K228: 4212037000 | L228: 3905277000 | M228: 4397130000 | N228: =POWER(D228/M228,1/9)-1 -> -3.7335849480854555e-02 | O228: =POWER(D228/I228,1/5)-1 -> -9.0438119473118528e-02
A229: 0921.HK | B229: 海信家电 | C229: 22.800000000000001 | D229: 3110273203.5700002 | E229: 1618715625.26 | F229: 1190926036.21 | G229: 1881870328.4400001 | H229: 2004425122.24 | I229: 1568372742.53 | J229: 2419515598.54 | K229: 1208742329.8800001 | L229: 682503063.99000001 | M229: 839186085.30999994 | N229: =POWER(D229/M229,1/9)-1 -> 0.15668628190247258 | O229: =POWER(D229/I229,1/5)-1 -> 0.1467529092020845
A230: 1044.HK | B230: 恒安国际 | C230: 23.899999999999999 | D230: 3069944274.5999999 | E230: 2171873396.9000001 | F230: 4008524424.5 | G230: 5476559998.5 | H230: 4366880452.5 | I230: 4326457973 | J230: 4548675754.8999996 | K230: 3996967336.25 | L230: 3833761881.1500001 | M230: 3915818000 | N230: =POWER(D230/M230,1/9)-1 -> -2.667821533471848e-02 | O230: =POWER(D230/I230,1/5)-1 -> -6.6316679441946969e-02
A231: 6655.HK | B231: 华新水泥 | C231: 7.7999999999999998 | D231: 3027832342.98 | E231: 3044593566.1300001 | F231: 6567637209.8500004 | G231: 6711110724.0200005 | H231: -- | I231: -- | J231: -- | K231: -- | L231: -- | M231: -- | N231: =POWER(D231/M231,1/9)-1 -> #VALUE! | O231: =POWER(D231/I231,1/5)-1 -> #VALUE!
A232: 6865.HK | B232: 福莱特玻璃 | C232: 11.9 | D232: 3024595975.5799999 | E232: 2393847184.1500001 | F232: 2595165291.21 | G232: 1940991018.3800001 | H232: 801519844.44000006 | I232: 463768535.99000001 | J232: 514940737.89999998 | K232: 673466395 | L232: 510158729.5 | M232: 490009149.30000001 | N232: =POWER(D232/M232,1/9)-1 -> 0.22413479429764704 | O232: =POWER(D232/I232,1/5)-1 -> 0.45503425509665729
A233: 3933.HK | B233: 联邦制药 | C233: 8.0999999999999996 | D233: 2961219870 | E233: 1783632141.4000001 | F233: 1209926001 | G233: 837892589.10000002 | H233: 717171270 | I233: 777581820.79999995 | J233: 98019666.200000003 | K233: -302663383.75 | L233: 110358000 | M233: 681076000 | N233: =POWER(D233/M233,1/9)-1 -> 0.17738758786827868 | O233: =POWER(D233/I233,1/5)-1 -> 0.30660679153349468
A234: 0754.HK | B234: 合生创展集团 | C234: 3.24 | D234: 2922321000 | E234: 8762461000 | F234: 9759179000 | G234: 13633830000 | H234: 9486000000 | I234: 5775467000 | J234: 5796385000 | K234: 3868433000 | L234: 1645942000 | M234: 2947301000 | N234: =POWER(D234/M234,1/9)-1 -> -9.4529434414569735e-04 | O234: =POWER(D234/I234,1/5)-1 -> -0.12737397238289938
A235: 2380.HK | B235: 中国电力 | C235: 3.65 | D235: 2916244976.4000001 | E235: 2798635604 | F235: -478175821.5 | G235: 2014507663.5 | H235: 1435295767.5 | I235: 1250587003 | J235: 953451600.79999995 | K235: 2629070815 | L235: 4879452618.8999996 | M235: 3451549139.4000001 | N235: =POWER(D235/M235,1/9)-1 -> -1.8550921849493585e-02 | O235: =POWER(D235/I235,1/5)-1 -> 0.18451896521917344
A236: 1585.HK | B236: 雅迪控股 | C236: 10.18 | D236: 2894141199.5999999 | E236: 2437930141.4000001 | F236: 1676946627.5 | G236: 1141111949.0999999 | H236: 577089292.5 | I236: 490777589.60000002 | J236: 485192432.19999999 | K236: 477980851.25 | L236: 441567965.35000002 | M236: 278860725.60000002 | N236: =POWER(D236/M236,1/9)-1 -> 0.29689135668632338 | O236: =POWER(D236/I236,1/5)-1 -> 0.42602453758452263
A237: 0010.HK | B237: 恒隆集团 | C237: 8.94 | D237: 2811000000 | E237: 2718000000 | F237: 2589000000 | G237: -1541000000 | H237: 6816000000 | I237: 5285000000 | J237: 5314000000 | K237: 3713000000 | L237: 3211000000 | M237: 6825000000 | N237: =POWER(D237/M237,1/9)-1 -> -9.3859890631983411e-02 | O237: =POWER(D237/I237,1/5)-1 -> -0.11862004184327524
A238: 3958.HK | B238: 东方证券 | C238: 3.03 | D238: 2758318731 | E238: 3128286729.8000002 | F238: 6286578102 | G238: 3146259621.9000001 | H238: 2721201900 | I238: 1401631401.8 | J238: 4260442211.4000001 | K238: 2571404718.75 | L238: 8614830861.25 | M238: 2922171240.9000001 | N238: =POWER(D238/M238,1/9)-1 -> -6.3912194854837123e-03 | O238: =POWER(D238/I238,1/5)-1 -> 0.14499113966965416
A239: 3800.HK | B239: 协鑫科技 | C239: 1.15 | D239: 2751545311.1999998 | E239: 18083789326.700001 | F239: 6225299224 | G239: -6755527101.6000004 | H239: -220378822.5 | I239: -789504101.39999998 | J239: 2367105762.1999998 | K239: 2255184085 | L239: 2852179981 | M239: 1932582797.2 | N239: =POWER(D239/M239,1/9)-1 -> 4.0036853821762586e-02 | O239: =POWER(D239/I239,1/5)-1 -> -2.2836435877650931
A240: 1882.HK | B240: 海天国际 | C240: 21.399999999999999 | D240: 2731212993.5999999 | E240: 2554771970.8000002 | F240: 3737134816 | G240: 2846276270.4000001 | H240: 1956204982.5 | I240: 2182562983.8000002 | J240: 2404266866.5999999 | K240: 1723426512.5 | L240: 1603350126.75 | M240: 1628529466.4000001 | N240: =POWER(D240/M240,1/9)-1 -> 5.9134476965801985e-02 | O240: =POWER(D240/I240,1/5)-1 -> 4.5870123195794976e-02
A241: 0586.HK | B241: 海螺创业 | C241: 7.16 | D241: 2700714517.1999998 | E241: 18003559982.799999 | F241: 9132478960.5 | G241: 9079449621.2999992 | H241: 7817841142.5 | I241: 6771560483.3999996 | J241: 4079859097.8000002 | K241: 2200955085 | L241: 2286641057 | M241: 2793429141.5999999 | N241: =POWER(D241/M241,1/9)-1 -> -3.7433705142392304e-03 | O241: =POWER(D241/I241,1/5)-1 -> -0.16793360297232063
A242: 2357.HK | B242: 中航科工 | C242: 3.67 | D242: 2682349778.8499999 | E242: 2500322808.5300002 | F242: 2901178786.4899998 | G242: 2303935558.1399999 | H242: 1538636580 | I242: 1463793268.8 | J242: 1465391492 | K242: 1289141122.5 | L242: 1344091080.3 | M242: 974981774.20000005 | N242: =POWER(D242/M242,1/9)-1 -> 0.11901378005324847 | O242: =POWER(D242/I242,1/5)-1 -> 0.12877435170040719
A243: 9898.HK | B243: 微博-SW | C243: 61.65 | D243: 2676032978 | E243: 668013440 | F243: 3340031562 | G243: 2429511092 | H243: -- | I243: -- | J243: -- | K243: -- | L243: -- | M243: -- | N243: =POWER(D243/M243,1/9)-1 -> #VALUE! | O243: =POWER(D243/I243,1/5)-1 -> #VALUE!
A244: 0526.HK | B244: 利时集团控股 | C244: 0.07 | D244: 2671621623.0500002 | E244: -475035567.5 | F244: -3021013460.25 | G244: -168614075.69999999 | H244: 245929040 | I244: -1173411352.8 | J244: -741414106.20000005 | K244: 29945104.199999999 | L244: 102773221.2 | M244: 1203068025 | N244: =POWER(D244/M244,1/9)-1 -> 9.2693368257182218e-02 | O244: =POWER(D244/I244,1/5)-1 -> -2.1788673315615616
A245: 2282.HK | B245: 美高梅中国 | C245: 11.46 | D245: 2638304000 | E245: -5231911000 | F245: -3846616000 | G245: -5201531000 | H245: 1931228000 | I245: 1068499000 | J245: 2320185000 | K245: 3036508000 | L245: 3112515000 | M245: 5706943000 | N245: =POWER(D245/M245,1/9)-1 -> -8.2155661449418771e-02 | O245: =POWER(D245/I245,1/5)-1 -> 0.19814710620897791
A246: 1216.HK | B246: 中原银行 | C246: 0.34 | D246: 2637022008.5999999 | E246: 3204938868.5999999 | F246: 3675950224.5 | G246: 3250710586.5 | H246: 3535601257.5 | I246: 2749236233.5999999 | J246: 4602221026.6999998 | K246: 3732767648.75 | L246: 3518035970 | M246: 3301253311.3000002 | N246: =POWER(D246/M246,1/9)-1 -> -2.4652368135094971e-02 | O246: =POWER(D246/I246,1/5)-1 -> -8.2999409949200409e-03
A247: 1972.HK | B247: 太古地产 | C247: 12.88 | D247: 2637000000 | E247: 7980000000 | F247: 7112000000 | G247: 4096000000 | H247: 13423000000 | I247: 28666000000 | J247: 33957000000 | K247: 15050000000 | L247: 14072000000 | M247: 9516000000 | N247: =POWER(D247/M247,1/9)-1 -> -0.13289267467726962 | O247: =POWER(D247/I247,1/5)-1 -> -0.37949025465358643
A248: 0867.HK | B248: 康哲药业 | C248: 6.54 | D248: 2631910428 | E248: 3676468875.1999998 | F248: 3694808749 | G248: 3015981376.1999998 | H248: 2191095660 | I248: 2106276783.8 | J248: 2007926112.3 | K248: 1529008880 | L248: 1171269356.75 | M248: 1304931525.8 | N248: =POWER(D248/M248,1/9)-1 -> 8.1069734473357746e-02 | O248: =POWER(D248/I248,1/5)-1 -> 4.5565230812145474e-02
A249: 2196.HK | B249: 复星医药 | C249: 13.58 | D249: 2628200887.1999998 | E249: 4215681497.5 | F249: 5790306619.5 | G249: 4365706814.6999998 | H249: 3711908115 | I249: 3083241127.8000002 | J249: 3745963050 | K249: 3116891785 | L249: 2892376193.9499998 | M249: 2635323955.3000002 | N249: =POWER(D249/M249,1/9)-1 -> -3.0068576580499773e-04 | O249: =POWER(D249/I249,1/5)-1 -> -3.1431783903462907e-02
A250: 3983.HK | B250: 中海石油化学 | C250: 2.16 | D250: 2610798712.1999998 | E250: 1852992241.8 | F250: 1833808751 | G250: 888543571.5 | H250: 785844997.5 | I250: 1570004154 | J250: 60223144.799999997 | K250: -239478820 | L250: 975718114.85000002 | M250: 131395134.7 | N250: =POWER(D250/M250,1/9)-1 -> 0.39393906552264246 | O250: =POWER(D250/I250,1/5)-1 -> 0.10706856099558948
A251: 2128.HK | B251: 中国联塑 | C251: 3.09 | D251: 2595869564.4000001 | E251: 2839790948.1999998 | F251: 3727572695.5 | G251: 4470613085.1000004 | H251: 3380103367.5 | I251: 2837133876.4000001 | J251: 2749143639.5 | K251: 2135852503.75 | L251: 1906514647.8499999 | M251: 1939266549.5999999 | N251: =POWER(D251/M251,1/9)-1 -> 3.293193983840137e-02 | O251: =POWER(D251/I251,1/5)-1 -> -1.7617522608211922e-02
A252: 2386.HK | B252: 中石化炼化工程 | C252: 4.94 | D252: 2560114809 | E252: 2574098580 | F252: 2607681730.5 | G252: 2838992569.5 | H252: 2440013197.5 | I252: 1912246819.2 | J252: 1354725828.5999999 | K252: 1856774290 | L252: 3901785789.1999998 | M252: 4354920172.1000004 | N252: =POWER(D252/M252,1/9)-1 -> -5.7319854099580403e-02 | O252: =POWER(D252/I252,1/5)-1 -> 6.0090881574074606e-02
A253: 1177.HK | B253: 中国生物制药 | C253: 2.85 | D253: 2556271531.8000002 | E253: 2869401317 | F253: 17888000494 | G253: 3302857403.4000001 | H253: 3024842295 | I253: 10300170694.200001 | J253: 2602753153.9000001 | K253: 1819536302.5 | L253: 1778692000 | M253: 1513205000 | N253: =POWER(D253/M253,1/9)-1 -> 5.9988183754562829e-02 | O253: =POWER(D253/I253,1/5)-1 -> -0.24324985591139758
A254: 0548.HK | B254: 深圳高速公路股份 | C254: 7.27 | D254: 2551073567.1399999 | E254: 2272120262.75 | F254: 3199764605.1799998 | G254: 2448786328.7800002 | H254: 4026894460.4000001 | I254: 3916841621.5100002 | J254: 1659263799.95 | K254: 1299443777.6900001 | L254: 1826001555.97 | M254: 2729011751.79 | N254: =POWER(D254/M254,1/9)-1 -> -7.4637039310020414e-03 | O254: =POWER(D254/I254,1/5)-1 -> -8.218025934985429e-02
A255: 6979.HK | B255: 珍酒李渡 | C255: 7.76 | D255: 2550948384.5999999 | E255: 1161791834.5999999 | F255: 1263925226.5 | G255: 619892887.20000005 | H255: -- | I255: -- | J255: -- | K255: -- | L255: -- | M255: -- | N255: =POWER(D255/M255,1/9)-1 -> #VALUE! | O255: =POWER(D255/I255,1/5)-1 -> #VALUE!
A256: 1199.HK | B256: 中远海运港口 | C256: 4.73 | D256: 2535114727 | E256: 2382712704 | F256: 2765576296 | G256: 2693965922 | H256: 2398528379 | I256: 2542783222 | J256: 4004315556 | K256: 1915478374 | L256: 3327390406.5 | M256: 2270638804 | N256: =POWER(D256/M256,1/9)-1 -> 1.2317205113423491e-02 | O256: =POWER(D256/I256,1/5)-1 -> -6.0388650748233186e-04
A257: 0081.HK | B257: 中国海外宏洋集团 | C257: 1.81 | D257: 2523108193.1999998 | E257: 3554011364 | F257: 6184429087.5 | G257: 5214282403.5 | H257: 3720918517.5 | I257: 2326392074.4000001 | J257: 1271398000 | K257: 900243000 | L257: 851196000 | M257: 1267402000 | N257: =POWER(D257/M257,1/9)-1 -> 7.950487896765579e-02 | O257: =POWER(D257/I257,1/5)-1 -> 1.6367086987609358e-02
A258: 6821.HK | B258: 凯莱英 | C258: 45.399999999999999 | D258: 2482758167.4000001 | E258: 3721964020.0999999 | F258: 1308085594.5 | G258: 857860489.79999995 | H258: -- | I258: -- | J258: -- | K258: -- | L258: -- | M258: -- | N258: =POWER(D258/M258,1/9)-1 -> #VALUE! | O258: =POWER(D258/I258,1/5)-1 -> #VALUE!
A259: 1798.HK | B259: 大唐新能源 | C259: 2.03 | D259: 2455087887 | E259: 3304086449.5 | F259: 1850230520.5 | G259: 1105296546 | H259: 1046468347.5 | I259: 1376885069.4000001 | J259: 733340754.20000005 | K259: 220248638.75 | L259: 16124821.550000001 | M259: -187328508.5 | N259: =POWER(D259/M259,1/9)-1 -> -2.3309525549105579 | O259: =POWER(D259/I259,1/5)-1 -> 0.12262283175766098
A260: 3998.HK | B260: 波司登 | C260: 4.01 | D260: 2444283153.3000002 | E260: 2543359839.75 | F260: 2024553535.5 | G260: 1313455813.5999999 | H260: 1145392035.2 | I260: 769132082.70000005 | J260: 442352691.60000002 | K260: 336540421.80000001 | L260: 165259469.69999999 | M260: 867685296 | N260: =POWER(D260/M260,1/9)-1 -> 0.12195796561529026 | O260: =POWER(D260/I260,1/5)-1 -> 0.26017284642611993
A261: 0956.HK | B261: 新天绿色能源 | C261: 3.45 | D261: 2361120011.79 | E261: 2519128040.8000002 | F261: 2695326716.5599999 | G261: 1800430930.2 | H261: 1581023355 | I261: 1444320931.5999999 | J261: 1126505622.4000001 | K261: 601824107.5 | L261: 197991545.65000001 | M261: 418112638.69999999 | N261: =POWER(D261/M261,1/9)-1 -> 0.21209339642464053 | O261: =POWER(D261/I261,1/5)-1 -> 0.1032930219207282
A262: 6618.HK | B262: 京东健康 | C262: 20.55 | D262: 2347886104.1999998 | E262: 428796450.5 | F262: -1314509321.5 | G262: -20541637259.700001 | H262: -1085992087.5 | I262: 244715882.19999999 | J262: 214044412.59999999 | K262: -- | L262: -- | M262: -- | N262: =POWER(D262/M262,1/9)-1 -> #VALUE! | O262: =POWER(D262/I262,1/5)-1 -> 0.5718205912860943
A263: 86618.HK | B263: 京东健康-R | C263: 19.22 | D263: 2347886104.1999998 | E263: 428796450.5 | F263: -1314509321.5 | G263: -20541637259.700001 | H263: -- | I263: -- | J263: -- | K263: -- | L263: -- | M263: -- | N263: =POWER(D263/M263,1/9)-1 -> #VALUE! | O263: =POWER(D263/I263,1/5)-1 -> #VALUE!
A264: 1277.HK | B264: 力量发展 | C264: 1.05 | D264: 2277718342.1999998 | E264: 3005859677.3000002 | F264: 3022832537 | G264: 971155352.39999998 | H264: 931216102.5 | I264: 918817180.60000002 | J264: 647463547.20000005 | K264: 153470292.5 | L264: -2472057.1000000001 | M264: 76803253.400000006 | N264: =POWER(D264/M264,1/9)-1 -> 0.45736700747041636 | O264: =POWER(D264/I264,1/5)-1 -> 0.19909662985504806
A265: 9926.HK | B265: 康方生物 | C265: 40.25 | D265: 2223422460 | E265: -1318064143.3 | F265: -1316255458.5 | G265: -1402927086.9000001 | H265: -374793855 | I265: -162030750.19999999 | J265: -4549825.5 | K265: -- | L265: -- | M265: -- | N265: =POWER(D265/M265,1/9)-1 -> #VALUE! | O265: =POWER(D265/I265,1/5)-1 -> -2.6884371885996101
A266: 3347.HK | B266: 泰格医药 | C266: 29.899999999999999 | D266: 2221456973.4000001 | E266: 2274346616.5999999 | F266: 3523961611 | G266: 2085383997 | H266: 940093522.5 | I266: 656842399.60000002 | J266: 413592925.30000001 | K266: -- | L266: -- | M266: -- | N266: =POWER(D266/M266,1/9)-1 -> #VALUE! | O266: =POWER(D266/I266,1/5)-1 -> 0.27595496270195996
A267: 2666.HK | B267: 环球医疗 | C267: 4.45 | D267: 2215330311.5999999 | E267: 2132122537.2 | F267: 2247242808.5 | G267: 1963699350.3 | H267: 1663662480 | I267: 1539584177.8 | J267: 1377126076.2 | K267: 969354487.5 | L267: 774459502.29999995 | M267: 569838560.20000005 | N267: =POWER(D267/M267,1/9)-1 -> 0.16284208067441419 | O267: =POWER(D267/I267,1/5)-1 -> 7.5491568774953555e-02
A268: 0486.HK | B268: 俄铝 | C268: 2.44 | D268: 2202702000 | E268: 13999744000 | F268: 25148550000 | G268: 5884527000 | H268: 7475520000 | I268: 13302132000 | J268: 9548708000 | K268: 9141966000 | L268: 4324779000 | M268: -705796000 | N268: =POWER(D268/M268,1/9)-1 -> -2.1348007575543999 | O268: =POWER(D268/I268,1/5)-1 -> -0.30207798366493155
A269: 2558.HK | B269: 晋商银行 | C269: 1.3 | D269: 2195591038.1999998 | E269: 2073895655.7 | F269: 2064051486 | G269: 1867364032.8 | H269: 1657956525 | I269: 1491888223.8 | J269: 1471082670.3 | K269: 1140678122.5 | L269: -- | M269: -- | N269: =POWER(D269/M269,1/9)-1 -> #VALUE! | O269: =POWER(D269/I269,1/5)-1 -> 8.0346409025776833e-02
A270: 1066.HK | B270: 威高股份 | C270: 4.05 | D270: 2194489357.1999998 | E270: 3072164882.9000001 | F270: 2786875060.5 | G270: 2487236657.6999998 | H270: 2061656752.5 | I270: 1677083791 | J270: 2072490474 | K270: 1228968046.25 | L270: 1308633172.8 | M270: 1353906609.2 | N270: =POWER(D270/M270,1/9)-1 -> 5.5127578303034941e-02 | O270: =POWER(D270/I270,1/5)-1 -> 5.5250929793904779e-02
A271: 1347.HK | B271: 华虹半导体 | C271: 23.600000000000001 | D271: 2187345574 | E271: 3512912896 | F271: 2038989848 | G271: 770981579 | H271: 1263339519 | I271: 1434859772 | J271: 1135077268 | K271: 998963328 | L271: 872311024.5 | M271: 722006040 | N271: =POWER(D271/M271,1/9)-1 -> 0.13106167162817961 | O271: =POWER(D271/I271,1/5)-1 -> 8.7981694612753403e-02
A272: 1558.HK | B272: 东阳光长江药业 | C272: 9.35 | D272: 2184314428.8000002 | E272: 86415844.299999997 | F272: -719576200.5 | G272: 1000546414.5 | H272: 2144157307.5 | I272: 1073171489.6 | J272: 775809388.89999998 | K272: 422938416.25 | L272: 312535287.5 | M272: 168894529.69999999 | N272: =POWER(D272/M272,1/9)-1 -> 0.3289914121282691 | O272: =POWER(D272/I272,1/5)-1 -> 0.1527342726308083
A273: 1551.HK | B273: 广州农商银行 | C273: 1.52 | D273: 2180357146.8000002 | E273: 3239661786.5999999 | F273: 3145671928 | G273: 5264056147.5 | H273: 8403988890 | I273: 7430887308.1999998 | J273: 6844182010.1999998 | K273: 5584682442.5 | L273: 5881444866.8000002 | M273: 6707075651 | N273: =POWER(D273/M273,1/9)-1 -> -0.11737310038919435 | O273: =POWER(D273/I273,1/5)-1 -> -0.21747649318090412
A274: 1258.HK | B274: 中国有色矿业 | C274: 5.43 | D274: 2168685095 | E274: 2058922752 | F274: 2784829558 | G274: 968853645 | H274: 1050263838 | I274: 1145800840 | J274: 1112932392 | K274: 91745328 | L274: -2169380451 | M274: 1138743676 | N274: =POWER(D274/M274,1/9)-1 -> 7.4201149915698927e-02 | O274: =POWER(D274/I274,1/5)-1 -> 0.13610238531597418
A275: 0551.HK | B275: 裕元集团 | C275: 12.12 | D275: 2145759810 | E275: 2313877376 | F275: 897331456 | G275: -703902623 | H275: 2340351702 | I275: 2405946744 | J275: 4057231964 | K275: 4144978240 | L275: 3024113341.5 | M275: 2567391120 | N275: =POWER(D275/M275,1/9)-1 -> -1.97356012404869e-02 | O275: =POWER(D275/I275,1/5)-1 -> -2.2629966327485596e-02
A276: 2602.HK | B276: 万物云 | C276: 21.300000000000001 | D276: 2142737755.2 | E276: 1703983769 | F276: 2042027629 | G276: 1744988084.0999999 | H276: -- | I276: -- | J276: -- | K276: -- | L276: -- | M276: -- | N276: =POWER(D276/M276,1/9)-1 -> #VALUE! | O276: =POWER(D276/I276,1/5)-1 -> #VALUE!
A277: 1513.HK | B277: 丽珠医药 | C277: 24.05 | D277: 2141592043.4400001 | E277: 2153984736.8699999 | F277: 2174324140.8600001 | G277: 2044001694.27 | H277: 1455963305.24 | I277: 1232164347.95 | J277: 5309549924.46 | K277: 871612945.85000002 | L277: 732256986.92999995 | M277: 643889485.07000005 | N277: =POWER(D277/M277,1/9)-1 -> 0.14285652558665252 | O277: =POWER(D277/I277,1/5)-1 -> 0.11689827765853056
A278: 1733.HK | B278: 易大宗 | C278: 1.61 | D278: 2122640000 | E278: 1665748000 | F278: 3462244000 | G278: 462364000 | H278: 312404000 | I278: 879772000 | J278: 904742000 | K278: 2873605000 | L278: -1722992000 | M278: -3693055000 | N278: =POWER(D278/M278,1/9)-1 -> -1.9403222874085753 | O278: =POWER(D278/I278,1/5)-1 -> 0.19261767552093167
A279: 0631.HK | B279: 三一国际 | C279: 4.5 | D279: 2114561030.4000001 | E279: 1878186099.0999999 | F279: 1541732439.5 | G279: 1245707133.5999999 | H279: 1027771455 | I279: 683397967.39999998 | J279: 275070820.39999998 | K279: -716061718.75 | L279: 21244167.199999999 | M279: 209984133 | N279: =POWER(D279/M279,1/9)-1 -> 0.29255250557250245 | O279: =POWER(D279/I279,1/5)-1 -> 0.25345661982046819
A280: 1811.HK | B280: 中广核新能源 | C280: 2.25 | D280: 2090887535 | E280: 1523676544 | F280: 1904848652 | G280: 1256660511 | H280: 865968909 | I280: 691044974 | J280: 483467808 | K280: 616225888 | L280: 805114189.5 | M280: 1568286468 | N280: =POWER(D280/M280,1/9)-1 -> 3.24721939313668e-02 | O280: =POWER(D280/I280,1/5)-1 -> 0.24785715109929063
A281: 0425.HK | B281: 敏实集团 | C281: 11.58 | D281: 2086321822.2 | E281: 1692808810.4000001 | F281: 1832472821.5 | G281: 1663307177.0999999 | H281: 1888910250 | I281: 1890800149.5999999 | J281: 2428077020.5999999 | K281: 1910395436.25 | L281: 1495555735.8499999 | M281: 1394659279.5 | N281: =POWER(D281/M281,1/9)-1 -> 4.5766673854892082e-02 | O281: =POWER(D281/I281,1/5)-1 -> 1.987544241560113e-02
A282: 0371.HK | B282: 北控水务集团 | C282: 2.19 | D282: 2078045512.2 | E282: 1374151000 | F282: 4195940000 | G282: 4153869000 | H282: 4925718000 | I282: 4471265000 | J282: 3717227000 | K282: 3227013000 | L282: 2455370000 | M282: 1794413000 | N282: =POWER(D282/M282,1/9)-1 -> 1.6439199151105699e-02 | O282: =POWER(D282/I282,1/5)-1 -> -0.14208368086649725
A283: 6110.HK | B283: 滔搏 | C283: 3.79 | D283: 2071225650 | E283: 3028644675 | F283: 3313870630 | G283: 2571055080 | H283: 2583225140 | I283: 1777050000 | J283: 1491512925 | K283: -- | L283: -- | M283: -- | N283: =POWER(D283/M283,1/9)-1 -> #VALUE! | O283: =POWER(D283/I283,1/5)-1 -> 3.1111317355515311e-02
A284: 0148.HK | B284: 建滔集团 | C284: 17.06 | D284: 2062971000 | E284: 3655220000 | F284: 10778032000 | G284: 4702884000 | H284: 3094421000 | I284: 6075760000 | J284: 5593434000 | K284: 5026831000 | L284: 1650323000 | M284: 2536800000 | N284: =POWER(D284/M284,1/9)-1 -> -2.2711050237551711e-02 | O284: =POWER(D284/I284,1/5)-1 -> -0.19429046633649139
A285: 2518.HK | B285: 汽车之家-S | C285: 52 | D285: 2060951369.4000001 | E285: 2038675245.5999999 | F285: 2630919067 | G285: 3904256770.1999998 | H285: -- | I285: -- | J285: -- | K285: -- | L285: -- | M285: -- | N285: =POWER(D285/M285,1/9)-1 -> #VALUE! | O285: =POWER(D285/I285,1/5)-1 -> #VALUE!
A286: 0659.HK | B286: 新创建集团 | C286: 7.04 | D286: 2026700000 | E286: 1586800000 | F286: 1113500000 | G286: 253200000 | H286: 4043200000 | I286: 6068800000 | J286: 5628900000 | K286: 4912800000 | L286: 4477600000 | M286: 4324900000 | N286: =POWER(D286/M286,1/9)-1 -> -8.0771013302016637e-02 | O286: =POWER(D286/I286,1/5)-1 -> -0.19695972247443527
A287: 0819.HK | B287: 天能动力 | C287: 5.21 | D287: 1997096623.2 | E287: 2026501918.5 | F287: 1591791224 | G287: 2952242139.9000001 | H287: 1879441672.5 | I287: 1352973330.8 | J287: 1412746594.0999999 | K287: 954059242.5 | L287: 718491282.79999995 | M287: -380505924.30000001 | N287: =POWER(D287/M287,1/9)-1 -> -2.2022760168223865 | O287: =POWER(D287/I287,1/5)-1 -> 8.0990726426185766e-02
A288: 1787.HK | B288: 山东黄金 | C288: 17.100000000000001 | D288: 1977427506.5999999 | E288: 945644490.29999995 | F288: -522063126 | G288: 2382510364.1999998 | H288: 1442137102.5 | I288: 1098078364.5999999 | J288: 1341473188 | K288: 1429780922.5 | L288: 761998076.5 | M288: -- | N288: =POWER(D288/M288,1/9)-1 -> #VALUE! | O288: =POWER(D288/I288,1/5)-1 -> 0.12484698154906471
A289: 9896.HK | B289: 名创优品 | C289: 33.65 | D289: 1938631892.4000001 | E289: 745706211.60000002 | F289: -1702257030 | G289: -287483972.05000001 | H289: -- | I289: -- | J289: -- | K289: -- | L289: -- | M289: -- | N289: =POWER(D289/M289,1/9)-1 -> #VALUE! | O289: =POWER(D289/I289,1/5)-1 -> #VALUE!
A290: 2799.HK | B290: 中信金融资产 | C290: 0.39 | D290: 1936153384.2 | E290: -31114225372.799999 | F290: 463442637.5 | G290: -122650074972.89999 | H290: 1591802760 | I290: 1793865438.5999999 | J290: 26366916151 | K290: 21795455202.5 | L290: 17031618430.65 | M290: 13297880715.299999 | N290: =POWER(D290/M290,1/9)-1 -> -0.19273247715973596 | O290: =POWER(D290/I290,1/5)-1 -> 1.5383213742401258e-02
A291: 1999.HK | B291: 敏华控股 | C291: 4.61 | D291: 1914914000 | E291: 2247491000 | F291: 1924513000 | G291: 1638069000 | H291: 1363801000 | I291: 1535908000 | J291: 1752370000 | K291: 1327244000 | L291: 1075159000 | M291: 976965000 | N291: =POWER(D291/M291,1/9)-1 -> 7.7641913410207319e-02 | O291: =POWER(D291/I291,1/5)-1 -> 4.5097513253992361e-02
A292: 0152.HK | B292: 深圳国际 | C292: 6.23 | D292: 1901643000 | E292: 1253919000 | F292: 3573011000 | G292: 4006970000 | H292: 5020594000 | I292: 4212652000 | J292: 3816794000 | K292: 2115695000 | L292: 2198385000 | M292: 2229254000 | N292: =POWER(D292/M292,1/9)-1 -> -1.7505931428828614e-02 | O292: =POWER(D292/I292,1/5)-1 -> -0.14706746473848298
A293: 3877.HK | B293: 中国船舶租赁 | C293: 1.47 | D293: 1901606000 | E293: 1684909000 | F293: 1351626000 | G293: 1108518000 | H293: 883089000 | I293: 690089000 | J293: 608438000 | K293: 433780000 | L293: 941119000 | M293: -- | N293: =POWER(D293/M293,1/9)-1 -> #VALUE! | O293: =POWER(D293/I293,1/5)-1 -> 0.22473770083207056
A294: 0639.HK | B294: 首钢资源 | C294: 2.85 | D294: 1889247000 | E294: 2715374000 | F294: 2538495000 | G294: 1080041000 | H294: 1140413000 | I294: 1100488000 | J294: 1080649000 | K294: 111795000 | L294: -416471000 | M294: -425302000 | N294: =POWER(D294/M294,1/9)-1 -> -2.1801972292068044 | O294: =POWER(D294/I294,1/5)-1 -> 0.1141423586152972
A295: 9677.HK | B295: 威海银行 | C295: 2.58 | D295: 1884396301.2 | E295: 1908324418.7 | F295: 1938932076 | G295: 1621968509.4000001 | H295: 1608860280 | I295: 1098063562.8 | J295: 1878597172.5999999 | K295: -- | L295: -- | M295: -- | N295: =POWER(D295/M295,1/9)-1 -> #VALUE! | O295: =POWER(D295/I295,1/5)-1 -> 0.11406095226896906
A296: 0512.HK | B296: 远大医药 | C296: 4.45 | D296: 1879998000 | E296: 2079419000 | F296: 2402563000 | G296: 1792661000 | H296: 1150948000 | I296: 712667000 | J296: 460811000 | K296: 269143000 | L296: 180906000 | M296: 175208000 | N296: =POWER(D296/M296,1/9)-1 -> 0.30170176886988798 | O296: =POWER(D296/I296,1/5)-1 -> 0.21409912912906792
A297: 0975.HK | B297: Mongol Mining | C297: 9.01 | D297: 1872187346 | E297: 462054016 | F297: -430745924 | G297: 224371820 | H297: 751655749 | I297: 648443682 | J297: 2430255582 | K297: -1196038992 | L297: -1455257131.5 | M297: -2193683772 | N297: =POWER(D297/M297,1/9)-1 -> -1.9825458128393465 | O297: =POWER(D297/I297,1/5)-1 -> 0.23621898380307815
A298: 2356.HK | B298: 大新银行集团 | C298: 6.15 | D298: 1860306000 | E298: 1608800000 | F298: 1657556000 | G298: 1493126000 | H298: 2240033000 | I298: 2479735000 | J298: 2186236000 | K298: 2145491000 | L298: 2200604000 | M298: 2033641000 | N298: =POWER(D298/M298,1/9)-1 -> -9.8497032414458507e-03 | O298: =POWER(D298/I298,1/5)-1 -> -5.5861249203258079e-02
A299: 0855.HK | B299: 中国水务 | C299: 4.71 | D299: 1856786000 | E299: 1893573000 | F299: 1692464000 | G299: 1639495000 | H299: 1369235000 | I299: 1140518000 | J299: 853634000 | K299: 608112000 | L299: 370858000 | M299: 281295000 | N299: =POWER(D299/M299,1/9)-1 -> 0.23329408593643808 | O299: =POWER(D299/I299,1/5)-1 -> 0.1023815646176589
A300: 0220.HK | B300: 统一企业中国 | C300: 6.45 | D300: 1827431172 | E300: 1378715311.7 | F300: 1837625517.5 | G300: 1937675405.7 | H300: 1526741910 | I300: 1172420974.4000001 | J300: 1052893162.4 | K300: 674894351.25 | L300: 981419605.25 | M300: 356321622.30000001 | N300: =POWER(D300/M300,1/9)-1 -> 0.19919210687152122 | O300: =POWER(D300/I300,1/5)-1 -> 9.2827184950227348e-02
A301: 0995.HK | B301: 安徽皖通高速公路 | C301: 8.64 | D301: 1817199241.2 | E301: 1630620041.7 | F301: 1851401142.5 | G301: 1034031653.1 | H301: 1217912962.5 | I301: 1269950034.5999999 | J301: 1298690441.5 | K301: 1027989593.75 | L301: 1092993820.8499999 | M301: 1063341829.5 | N301: =POWER(D301/M301,1/9)-1 -> 6.1350551281911692e-02 | O301: =POWER(D301/I301,1/5)-1 -> 7.4294079983852734e-02
A302: 6969.HK | B302: 思摩尔国际 | C302: 8.55 | D302: 1803347658 | E302: 2831887479.5999999 | F302: 6473891091.5 | G302: 2860465839.9000001 | H302: 2429209207.5 | I302: 835677747.20000005 | J302: 226568122 | K302: 118014750 | L302: -- | M302: -- | N302: =POWER(D302/M302,1/9)-1 -> #VALUE! | O302: =POWER(D302/I302,1/5)-1 -> 0.16629422311790032
A303: 3759.HK | B303: 康龙化成 | C303: 8.71 | D303: 1755121435.2 | E303: 1550125594.3 | F303: 2033521027.5 | G303: 1396658884.8 | H303: 611484825 | I303: 382617421.19999999 | J303: 266751653.30000001 | K303: 190394907.5 | L303: -- | M303: -- | N303: =POWER(D303/M303,1/9)-1 -> #VALUE! | O303: =POWER(D303/I303,1/5)-1 -> 0.35615236602798395
A304: 0811.HK | B304: 新华文轩 | C304: 9.13 | D304: 1731059850.29 | E304: 1575586882.6700001 | F304: 1599125328.8 | G304: 1505105748.3099999 | H304: 1272885649.55 | I304: 1061385617.9 | J304: 1107597171.0999999 | K304: 719492471.36000001 | L304: 761221305.46000004 | M304: 796117771.39999998 | N304: =POWER(D304/M304,1/9)-1 -> 9.0138406697744644e-02 | O304: =POWER(D304/I304,1/5)-1 -> 0.10277719634304217
A305: 0780.HK | B305: 同程旅行 | C305: 13.76 | D305: 1703638402.2 | E305: -164712752.90000001 | F305: 885808198 | G305: 390458096.69999999 | H305: 768948397.5 | I305: 603409040.20000005 | J305: 234474867.5 | K305: -2377260453.75 | L305: -1077574629.3 | M305: -- | N305: =POWER(D305/M305,1/9)-1 -> #VALUE! | O305: =POWER(D305/I305,1/5)-1 -> 0.23070261029135741
A306: 1530.HK | B306: 三生制药 | C306: 6.56 | D306: 1698275791.8 | E306: 2160181768.5 | F306: 2021951951.5 | G306: 996179292.89999998 | H306: 1088128747.5 | I306: 1454182346.2 | J306: 1121437872.0999999 | K306: 791836745 | L306: 618931594 | M306: 364047371.19999999 | N306: =POWER(D306/M306,1/9)-1 -> 0.18663376608351134 | O306: =POWER(D306/I306,1/5)-1 -> 3.1520516186084313e-02
A307: 6666.HK | B307: 恒大物业 | C307: 0.69 | D307: 1689462343.8 | E307: 1604924179.9000001 | F307: -387302003 | G307: 3155077298.0999999 | H307: 1039534260 | I307: 272210795 | J307: 127759579.59999999 | K307: -- | L307: -- | M307: -- | N307: =POWER(D307/M307,1/9)-1 -> #VALUE! | O307: =POWER(D307/I307,1/5)-1 -> 0.44068367316950807
A308: 3369.HK | B308: 秦港股份 | C308: 1.88 | D308: 1678504075.22 | E308: 1476027542.1400001 | F308: 1271513895.1500001 | G308: 1186097849 | H308: 1040668892.83 | I308: 922565757.07000005 | J308: 1154505750.54 | K308: 405638547.94999999 | L308: 1581187930.77 | M308: 2471022604.8400002 | N308: =POWER(D308/M308,1/9)-1 -> -4.205977739747091e-02 | O308: =POWER(D308/I308,1/5)-1 -> 0.12715856073001719
A309: 1905.HK | B309: 海通恒信 | C309: 0.69999999999999996 | D309: 1609803682.2 | E309: 1617191139.3 | F309: 1617847359.5 | G309: 1269717959.0999999 | H309: 1415299222.5 | I309: 1383692758.8 | J309: 1398709872.9000001 | K309: 821237086.25 | L309: 570229011.39999998 | M309: 500236937.69999999 | N309: =POWER(D309/M309,1/9)-1 -> 0.13867473441670919 | O309: =POWER(D309/I309,1/5)-1 -> 3.073411308016194e-02
A310: 0440.HK | B310: 大新金融 | C310: 20.399999999999999 | D310: 1592095000 | E310: 1171373000 | F310: 1308404000 | G310: 1158152000 | H310: 1707809000 | I310: 1915181000 | J310: 5404774000 | K310: 1891817000 | L310: 1947467000 | M310: 1726887000 | N310: =POWER(D310/M310,1/9)-1 -> -8.9893086777816933e-03 | O310: =POWER(D310/I310,1/5)-1 -> -3.6277872327468708e-02
A311: 2367.HK | B311: 巨子生物 | C311: 39.899999999999999 | D311: 1591411638.5999999 | E311: 1130384402.5 | F311: 1014047634 | G311: 985045755 | H311: -- | I311: -- | J311: -- | K311: -- | L311: -- | M311: -- | N311: =POWER(D311/M311,1/9)-1 -> #VALUE! | O311: =POWER(D311/I311,1/5)-1 -> #VALUE!
A312: 1821.HK | B312: ESR | C312: 11.88 | D312: 1590585174 | E312: 4482924160 | F312: 2724933120 | G312: 2220970898 | H312: 1909193299 | I312: 1590631028 | J312: 1455474710 | K312: 684422318 | L312: -- | M312: -- | N312: =POWER(D312/M312,1/9)-1 -> #VALUE! | O312: =POWER(D312/I312,1/5)-1 -> -5.7655770503428627e-06
A313: 0119.HK | B313: 保利置业集团 | C313: 1.48 | D313: 1583599021.2 | E313: 920696558.79999995 | F313: 2521387542 | G313: 1880112000 | H313: 3832948000 | I313: 2241590000 | J313: 2462061000 | K313: 80745000 | L313: -2817149000 | M313: 929448000 | N313: =POWER(D313/M313,1/9)-1 -> 6.0995024973134582e-02 | O313: =POWER(D313/I313,1/5)-1 -> -6.7137127235394445e-02
A314: 1083.HK | B314: 港华智慧能源 | C314: 2.84 | D314: 1574623000 | E314: 964855000 | F314: 1253202000 | G314: 1447113000 | H314: 1308425000 | I314: 1224274000 | J314: 1365385000 | K314: 973997000 | L314: 807042000 | M314: 1054189000 | N314: =POWER(D314/M314,1/9)-1 -> 4.5591423520122465e-02 | O314: =POWER(D314/I314,1/5)-1 -> 5.1621830166081795e-02
A315: 2866.HK | B315: 中远海发 | C315: 0.95 | D315: 1542961791 | E315: 4425682953 | F315: 7121889144.5 | G315: 2164319958.3000002 | H315: 1949739127.5 | I315: 1576115020.2 | J315: 1754953416.7 | K315: 386162708.75 | L315: -234634911.55000001 | M315: 1302852524.4000001 | N315: =POWER(D315/M315,1/9)-1 -> 1.8971911307169798e-02 | O315: =POWER(D315/I315,1/5)-1 -> -4.2428059304771004e-03
A316: 0696.HK | B316: 中国民航信息网络 | C316: 9.29 | D316: 1533531256.21 | E316: 706753341.62 | F316: 675067557.03999996 | G316: 432421066.81999999 | H316: 2841647167.5 | I316: 2647391879.4000001 | J316: 2695910081.6999998 | K316: 2690462932.5 | L316: 2251385430.0999999 | M316: 2062265813.0999999 | N316: =POWER(D316/M316,1/9)-1 -> -3.2378895206077951e-02 | O316: =POWER(D316/I316,1/5)-1 -> -0.10344924636932229
A317: 6049.HK | B317: 保利物业 | C317: 27.5 | D317: 1512909468 | E317: 1255499717.3 | F317: 1035551078.5 | G317: 802774447.5 | H317: 548146042.5 | I317: 373966338.39999998 | J317: 263075825.90000001 | K317: 161726880 | L317: -- | M317: -- | N317: =POWER(D317/M317,1/9)-1 -> #VALUE! | O317: =POWER(D317/I317,1/5)-1 -> 0.32250123338350156
A318: 0656.HK | B318: 复星国际 | C318: 4.13 | D318: 1511390134.8 | E318: 594949787.10000002 | F318: 12343650618 | G318: 9532744686 | H318: 16535738017.5 | I318: 15260892628.799999 | J318: 15776802262.200001 | K318: 11408938161.25 | L318: 9452700627.4500008 | M318: 8553036717.6000004 | N318: =POWER(D318/M318,1/9)-1 -> -0.17517501997041063 | O318: =POWER(D318/I318,1/5)-1 -> -0.3702628283412821
A319: 6196.HK | B319: 郑州银行 | C319: 0.77 | D319: 1501922255.4000001 | E319: 1607331545.3 | F319: 3374701183.5 | G319: 3187289587.5 | H319: 3671123835 | I319: 3482784976.5999999 | J319: 5131320773.6000004 | K319: 4443630940 | L319: 3947260114.5500002 | M319: 3073681275.6999998 | N319: =POWER(D319/M319,1/9)-1 -> -7.6486645116046414e-02 | O319: =POWER(D319/I319,1/5)-1 -> -0.15482983450607635
A320: 0839.HK | B320: 中教控股 | C320: 4.24 | D320: 1483431000 | E320: 2097396000 | F320: 1740236600 | G320: 715993161.5 | H320: 648737829.89999998 | I320: -- | J320: 514189027.60000002 | K320: 457117132.5 | L320: 408774987.14999998 | M320: 385457591.5 | N320: =POWER(D320/M320,1/9)-1 -> 0.16153501202142118 | O320: =POWER(D320/I320,1/5)-1 -> #VALUE!
A321: 2880.HK | B321: 辽港股份 | C321: 0.61 | D321: 1472316165.53 | E321: 1443668815.5899999 | F321: 2346235331.9400001 | G321: 2447079256.0900002 | H321: 802622541.63 | I321: 595847142.25999999 | J321: 600385075.21000004 | K321: 590087882.24000001 | L321: 569600155.66999996 | M321: 649874598.47000003 | N321: =POWER(D321/M321,1/9)-1 -> 9.512451762249996e-02 | O321: =POWER(D321/I321,1/5)-1 -> 0.19832120353255633
A322: 2669.HK | B322: 中海物业 | C322: 4.82 | D322: 1471651788.5999999 | E322: 1436236002.5999999 | F322: 983872000 | G322: 700008000 | H322: 537840000 | I322: 403189000 | J322: 306760000 | K322: 237529000 | L322: 117050000 | M322: 97088000 | N322: =POWER(D322/M322,1/9)-1 -> 0.35263981744690831 | O322: =POWER(D322/I322,1/5)-1 -> 0.2955652106098785
A323: 0069.HK | B323: 香格里拉(亚洲) | C323: 5.5999999999999996 | D323: 1438309729 | E323: -1237716352 | F323: -2265903850 | G323: -3567628233 | H323: 1187400695 | I323: 1511217770 | J323: 1234588558 | K323: 822342716 | L323: 1086085315.5 | M323: 1402975084 | N323: =POWER(D323/M323,1/9)-1 -> 2.7675540671003862e-03 | O323: =POWER(D323/I323,1/5)-1 -> -9.8406945793552136e-03
A324: 6869.HK | B324: 长飞光纤光缆 | C324: 8.02 | D324: 1422251308.6900001 | E324: 1316490959.3399999 | F324: 867566094.14999998 | G324: 648009580.54999995 | H324: 895368984.44000006 | I324: 1695586101.3499999 | J324: 1520628615.51 | K324: 796869862.95000005 | L324: 671197608.10000002 | M324: 581950677.60000002 | N324: =POWER(D324/M324,1/9)-1 -> 0.10438660203693129 | O324: =POWER(D324/I324,1/5)-1 -> -3.4546638934440099e-02
A325: 0313.HK | B325: 裕田中国 | C325: 0.01 | D325: 1421817000 | E325: -398884000 | F325: -415682000 | G325: -294856000 | H325: -268297000 | I325: -391630000 | J325: -324554000 | K325: -340209000 | L325: -207565000 | M325: -199648000 | N325: =POWER(D325/M325,1/9)-1 -> -2.2437439206690803 | O325: =POWER(D325/I325,1/5)-1 -> -2.2941766205883116
A326: 0570.HK | B326: 中国中药 | C326: 3.49 | D326: 1408836240 | E326: 862168474.60000002 | F326: 2366784621 | G326: 1982433634.5 | H326: 1774717395 | I326: 1638465894.8 | J326: 1403233322.5999999 | K326: 1074497628.75 | L326: 735732175.79999995 | M326: 515495011 | N326: =POWER(D326/M326,1/9)-1 -> 0.11818874462200113 | O326: =POWER(D326/I326,1/5)-1 -> -2.9747832166718169e-02
A327: 9901.HK | B327: 新东方-S | C327: 55.45 | D327: 1389289394 | E327: -9322422129 | F327: 2595721468 | G327: 3204570749 | H327: 1868096055 | I327: 2324324370 | J327: -- | K327: -- | L327: -- | M327: -- | N327: =POWER(D327/M327,1/9)-1 -> #VALUE! | O327: =POWER(D327/I327,1/5)-1 -> -9.7807532280820952e-02
A328: 3918.HK | B328: 金界控股 | C328: 4 | D328: 1388264652 | E328: 837439232 | F328: -1146477556 | G328: 793155159 | H328: 4059191786 | I328: 3059788052 | J328: 1994023404 | K328: 1427968886 | L328: 1337914561.5 | M328: 1055483016 | N328: =POWER(D328/M328,1/9)-1 -> 3.0919032201599084e-02 | O328: =POWER(D328/I328,1/5)-1 -> -0.14619993354753114
A329: 2208.HK | B329: 金风科技 | C329: 3.44 | D329: 1333531684.8 | E329: 2480053395.4000001 | F329: 4416427415.5 | G329: 3390323793 | H329: 2356644345 | I329: 3581116749.8000002 | J329: 3577106377.3000002 | K329: 3295459658.75 | L329: 3351150946.8499999 | M329: 2283260167.8000002 | N329: =POWER(D329/M329,1/9)-1 -> -5.8002454969567241e-02 | O329: =POWER(D329/I329,1/5)-1 -> -0.17927630544722961
A330: 2005.HK | B330: 石四药集团 | C330: 4.33 | D330: 1318616000 | E330: 1122837000 | F330: 785533000 | G330: 611971000 | H330: 1136101000 | I330: 911774000 | J330: 664719000 | K330: 489535000 | L330: 403416000 | M330: 602929000 | N330: =POWER(D330/M330,1/9)-1 -> 9.0840746698030328e-02 | O330: =POWER(D330/I330,1/5)-1 -> 7.6579801583560148e-02
A331: 0107.HK | B331: 四川成渝高速公路 | C331: 3.1000000000000001 | D331: 1305370306.8 | E331: 862794570.10000002 | F331: 2290863172 | G331: 804304847.10000002 | H331: 1213751392.5 | I331: 967397826.79999995 | J331: 1072267386.4 | K331: 1174128970 | L331: 1183795465.3 | M331: 1217949152.0999999 | N331: =POWER(D331/M331,1/9)-1 -> 7.7317746717318059e-03 | O331: =POWER(D331/I331,1/5)-1 -> 6.1758446147756496e-02
A332: 1866.HK | B332: 中国心连心化肥 | C332: 3.58 | D332: 1301060048.4000001 | E332: 1496098629.0999999 | F332: 1586272402.5 | G332: 414378337.80000001 | H332: 353683162.5 | I332: 711547575.20000005 | J332: 476896044.19999999 | K332: 33470850 | L332: 480745719 | M332: 300489328.39999998 | N332: =POWER(D332/M332,1/9)-1 -> 0.17684346130028694 | O332: =POWER(D332/I332,1/5)-1 -> 0.12828464977621756
A333: 0934.HK | B333: 中石化冠德 | C333: 4.0999999999999996 | D333: 1298612000 | E333: 434882000 | F333: 1050396000 | G333: 2302098000 | H333: 1285111000 | I333: 1262071000 | J333: 1207928000 | K333: 1005259000 | L333: 1026852000 | M333: 1018364000 | N333: =POWER(D333/M333,1/9)-1 -> 2.7379056349717601e-02 | O333: =POWER(D333/I333,1/5)-1 -> 5.7247198038508085e-03
A334: 0590.HK | B334: 六福集团 | C334: 15.1 | D334: 1284757000 | E334: 1392364000 | F334: 1017335000 | G334: 866315000 | H334: 1492747000 | I334: 1369393000 | J334: 1016838000 | K334: 958692000 | L334: 1614805000 | M334: 1864928000 | N334: =POWER(D334/M334,1/9)-1 -> -4.05603590989424e-02 | O334: =POWER(D334/I334,1/5)-1 -> -1.2678537589364436e-02
A335: 2232.HK | B335: 晶苑国际 | C335: 3.38 | D335: 1276934469 | E335: 1348644608 | F335: 1271900588 | G335: 837983005 | H335: 1182876448 | I335: 1168770128 | J335: 1159824206 | K335: 958797608 | L335: 529242892.5 | M335: 634464068 | N335: =POWER(D335/M335,1/9)-1 -> 8.0814808771688895e-02 | O335: =POWER(D335/I335,1/5)-1 -> 1.7859657085367964e-02
A336: 1271.HK | B336: 佳明集团控股 | C336: 3.16 | D336: 1275460000 | E336: 17547000 | F336: 149035000 | G336: 33829000 | H336: 149000000 | I336: 171787000 | J336: 203020000 | K336: 401929000 | L336: 327813000 | M336: 438482000 | N336: =POWER(D336/M336,1/9)-1 -> 0.12596242318486794 | O336: =POWER(D336/I336,1/5)-1 -> 0.49325957964274103
A337: 2555.HK | B337: 茶百道 | C337: 10.52 | D337: 1248803098.2 | E337: -- | F337: -- | G337: -- | H337: -- | I337: -- | J337: -- | K337: -- | L337: -- | M337: -- | N337: =POWER(D337/M337,1/9)-1 -> #VALUE! | O337: =POWER(D337/I337,1/5)-1 -> #VALUE!
A338: 0179.HK | B338: 德昌电机控股 | C338: 10.94 | D338: 1239084860 | E338: 1146082512 | F338: 1648572125 | G338: -3828310035 | H338: 2208151321 | I338: 2072504903 | J338: 1848638400 | K338: 1338719310 | L338: 1635482970 | M338: 1612304872.5 | N338: =POWER(D338/M338,1/9)-1 -> -2.8830854960235297e-02 | O338: =POWER(D338/I338,1/5)-1 -> -9.7762036918201511e-02
A339: 1883.HK | B339: 中信国际电讯 | C339: 2.67 | D339: 1231000000 | E339: 1191000000 | F339: 1076000000 | G339: 1023000000 | H339: 1002228000 | I339: 951039000 | J339: 881338000 | K339: 850088000 | L339: 802213000 | M339: 723734000 | N339: =POWER(D339/M339,1/9)-1 -> 6.0793887520361523e-02 | O339: =POWER(D339/I339,1/5)-1 -> 5.296017403068376e-02
A340: 3899.HK | B340: 中集安瑞科 | C340: 6.98 | D340: 1221136106.4000001 | E340: 1190215442.2 | F340: 1081944934.5 | G340: 691210223.70000005 | H340: 1018050322.5 | I340: 894372577.20000005 | J340: 503630315.30000001 | K340: -1032097885 | L340: 610598103.70000005 | M340: 1282389460.2 | N340: =POWER(D340/M340,1/9)-1 -> -5.4234003406923303e-03 | O340: =POWER(D340/I340,1/5)-1 -> 6.4263381781529461e-02
A341: 6169.HK | B341: 宇华教育 | C341: 0.43 | D341: 1219773713.7 | E341: 1279701444 | F341: 993658226.5 | G341: 230489818.5 | H341: 530880238.5 | I341: 609106770 | J341: 372026775.55000001 | K341: 361403905.80000001 | L341: 109713600 | M341: 262071108 | N341: =POWER(D341/M341,1/9)-1 -> 0.18633318935105492 | O341: =POWER(D341/I341,1/5)-1 -> 0.14899243341792578
A342: 0028.HK | B342: 天安 | C342: 3.98 | D342: 1217370000 | E342: 1528558000 | F342: 1430348000 | G342: 618037000 | H342: 1345942000 | I342: 1251202000 | J342: 2054142000 | K342: 5712954000 | L342: 2600020000 | M342: 1284522000 | N342: =POWER(D342/M342,1/9)-1 -> -5.9482244701487552e-03 | O342: =POWER(D342/I342,1/5)-1 -> -5.4673782219906153e-03
A343: 3650.HK | B343: Keep | C343: 6.52 | D343: 1212296349.5999999 | E343: -117943983.09999999 | F343: -3561136206.5 | G343: -2669389967.0999999 | H343: -- | I343: -- | J343: -- | K343: -- | L343: -- | M343: -- | N343: =POWER(D343/M343,1/9)-1 -> #VALUE! | O343: =POWER(D343/I343,1/5)-1 -> #VALUE!
A344: 2382.HK | B344: 舜宇光学科技 | C344: 48.25 | D344: 1205178723 | E344: 2716234667.5999999 | F344: 6107814571.5 | G344: 5806690076.6999998 | H344: 4460275515 | I344: 2836106859.1999998 | J344: 3478673090.5999999 | K344: 1412124271.25 | L344: 895717313.60000002 | M344: 706431198.39999998 | N344: =POWER(D344/M344,1/9)-1 -> 6.1147442373788108e-02 | O344: =POWER(D344/I344,1/5)-1 -> -0.15731401106921805
A345: 2076.HK | B345: BOSS直聘-W | C345: 61.299999999999997 | D345: 1204972637.4000001 | E345: 120983084.5 | F345: -1512427705.5 | G345: -1461121604.4000001 | H345: -- | I345: -- | J345: -- | K345: -- | L345: -- | M345: -- | N345: =POWER(D345/M345,1/9)-1 -> #VALUE! | O345: =POWER(D345/I345,1/5)-1 -> #VALUE!
A346: 0990.HK | B346: 荣晖国际 | C346: 0.46 | D346: 1200955000 | E346: 1206822000 | F346: 997967000 | G346: 445977000 | H346: 145745000 | I346: 61893000 | J346: 21349000 | K346: -25937000 | L346: -23383000 | M346: -22253000 | N346: =POWER(D346/M346,1/9)-1 -> -2.5576138360379943 | O346: =POWER(D346/I346,1/5)-1 -> 0.80957688541365491
A347: 1822.HK | B347: 中木国际 | C347: 0.41 | D347: 1200803000 | E347: -150133000 | F347: -274550000 | G347: -1055985000 | H347: -691607000 | I347: -226976000 | J347: -4445000 | K347: -16629865 | L347: -7578335 | M347: -49585052 | N347: =POWER(D347/M347,1/9)-1 -> -2.4249224247669767 | O347: =POWER(D347/I347,1/5)-1 -> -2.3953988644283806
A348: 1857.HK | B348: 中国光大水务 | C348: 1.44 | D348: 1187412000 | E348: 1010565000 | F348: 1200329000 | G348: 1024271000 | H348: 833483000 | I348: 676459000 | J348: 513356000 | K348: 349343000 | L348: 406242000 | M348: -- | N348: =POWER(D348/M348,1/9)-1 -> #VALUE! | O348: =POWER(D348/I348,1/5)-1 -> 0.11910797562512343
A349: 9992.HK | B349: 泡泡玛特 | C349: 41.600000000000001 | D349: 1186465492.8 | E349: 536592046 | F349: 1046138105.5 | G349: 623965609.5 | H349: 504124365 | I349: 113314610.59999999 | J349: 1881074.1000000001 | K349: -- | L349: -- | M349: -- | N349: =POWER(D349/M349,1/9)-1 -> #VALUE! | O349: =POWER(D349/I349,1/5)-1 -> 0.5995353415102862
A350: 0751.HK | B350: 创维集团 | C350: 2.85 | D350: 1171837800 | E350: 932938700 | F350: 2000833000 | G350: 1716336000 | H350: 834772500 | I350: 573589350 | J350: 1310000000 | K350: 2170000000 | L350: 3128000000 | M350: 1254000000 | N350: =POWER(D350/M350,1/9)-1 -> -7.5011864504226367e-03 | O350: =POWER(D350/I350,1/5)-1 -> 0.15359478683448802
A351: 1128.HK | B351: 永利澳门 | C351: 6 | D351: 1171656000 | E351: -7339270000 | F351: -5179295000 | G351: -7216872000 | H351: 5056661000 | I351: 6245390000 | J351: 3700494000 | K351: 1435532000 | L351: 2410398000 | M351: 6445435000 | N351: =POWER(D351/M351,1/9)-1 -> -0.17257708722902632 | O351: =POWER(D351/I351,1/5)-1 -> -0.28443661232766249
A352: 0303.HK | B352: 伟易达 | C352: 54.600000000000001 | D352: 1171518400 | E352: 1352413700 | F352: 1795247500 | G352: 1478878500 | H352: 1344533700 | I352: 1619248700 | J352: 1390830000 | K352: 1406484900 | L352: 1536265500 | M352: 1580774700 | N352: =POWER(D352/M352,1/9)-1 -> -3.2742454293545498e-02 | O352: =POWER(D352/I352,1/5)-1 -> -6.2681667149304232e-02
A353: 0525.HK | B353: 广深铁路股份 | C353: 2.29 | D353: 1160096401.8 | E353: -2250181586.5 | F353: -1191584215.5 | G353: -664932404.39999998 | H353: 836380582.5 | I353: 892729577.39999998 | J353: 1217316302.9000001 | K353: 1287108646.25 | L353: 1259340213.0999999 | M353: 826136005.89999998 | N353: =POWER(D353/M353,1/9)-1 -> 3.8442617608736906e-02 | O353: =POWER(D353/I353,1/5)-1 -> 5.3791839726093027e-02
A354: 0327.HK | B354: 百富环球 | C354: 4.5999999999999996 | D354: 1155164000 | E354: 1264675000 | F354: 1083774000 | G354: 900123000 | H354: 623873000 | I354: 522470000 | J354: 407507000 | K354: 600908000 | L354: 620736000 | M354: 391806000 | N354: =POWER(D354/M354,1/9)-1 -> 0.12765105168814994 | O354: =POWER(D354/I354,1/5)-1 -> 0.17196989932954376
A355: 2245.HK | B355: 力勤资源 | C355: 5.47 | D355: 1152506313 | E355: 1957521987.8 | F355: 1346347546 | G355: 619973936.39999998 | H355: -- | I355: -- | J355: -- | K355: -- | L355: -- | M355: -- | N355: =POWER(D355/M355,1/9)-1 -> #VALUE! | O355: =POWER(D355/I355,1/5)-1 -> #VALUE!
A356: 1809.HK | B356: 浦林成山 | C356: 7.66 | D356: 1132803214.2 | E356: 444226602.30000001 | F356: 338334248 | G356: 720884958 | H356: 536083747.5 | I356: 544933960 | J356: 208246532.19999999 | K356: 323602667.5 | L356: 191865501.19999999 | M356: -- | N356: =POWER(D356/M356,1/9)-1 -> #VALUE! | O356: =POWER(D356/I356,1/5)-1 -> 0.15760960016586756
A357: 1368.HK | B357: 特步国际 | C357: 4.85 | D357: 1129095865.8 | E357: 1039763001.4 | F357: 1112261105.5 | G357: 611480457 | H357: 813151110 | I357: 747511394.79999995 | J357: 489317847.10000002 | K357: 586573312.5 | L357: 732211082.10000002 | M357: 596502439.5 | N357: =POWER(D357/M357,1/9)-1 -> 7.3472577963279884e-02 | O357: =POWER(D357/I357,1/5)-1 -> 8.598193260558129e-02
A358: 6686.HK | B358: 诺亚控股 | C358: 12.12 | D358: 1106607322.8 | E358: 1101669745.0999999 | F358: 1609153409.5 | G358: -888233677.5 | H358: -- | I358: -- | J358: -- | K358: -- | L358: -- | M358: -- | N358: =POWER(D358/M358,1/9)-1 -> #VALUE! | O358: =POWER(D358/I358,1/5)-1 -> #VALUE!
A359: 6837.HK | B359: 海通证券 | C359: 3.51 | D359: 1105414657.2 | E359: 7383805950.6999998 | F359: 15706070066.5 | G359: 12962384492.4 | H359: 10642229640 | I359: 5933350489.8000002 | J359: 10332627334.700001 | K359: 8938154907.5 | L359: 18627280718.549999 | M359: 9622086441.7000008 | N359: =POWER(D359/M359,1/9)-1 -> -0.21370774826400207 | O359: =POWER(D359/I359,1/5)-1 -> -0.28542956571143496
A360: 0618.HK | B360: 北大资源 | C360: 0.19 | D360: 1104878335.5 | E360: -- | F360: -- | G360: -2414065916.6999998 | H360: -2706447547.5 | I360: 815590566 | J360: 399774403.89999998 | K360: -262246110 | L360: -237695000 | M360: -215245000 | N360: =POWER(D360/M360,1/9)-1 -> -2.1993094759380565 | O360: =POWER(D360/I360,1/5)-1 -> 6.259667564149396e-02
A361: 1836.HK | B361: 九兴控股 | C361: 12.54 | D361: 1101913392 | E361: 921601664 | F361: 699433812 | G361: 13063805 | H361: 746967975 | I361: 512774470 | J361: 484116370 | K361: 632548058 | L361: 938174773.5 | M361: 936156956 | N361: =POWER(D361/M361,1/9)-1 -> 1.8278402398293148e-02 | O361: =POWER(D361/I361,1/5)-1 -> 0.16531735217141108
A362: 0038.HK | B362: 第一拖拉机股份 | C362: 6.67 | D362: 1092936283.73 | E362: 768293584.86000001 | F362: 536587184.14999998 | G362: 333911667.36000001 | H362: 68698789.859999999 | I362: -1480303849.99 | J362: 67754901.920000002 | K362: 248219611.74000001 | L362: 159146392.5 | M362: 209270642.87 | N362: =POWER(D362/M362,1/9)-1 -> 0.20161452838862126 | O362: =POWER(D362/I362,1/5)-1 -> -1.9411282178914573
A363: 1270.HK | B363: 朗廷-SS | C363: 0.56 | D363: 1080319000 | E363: 419561000 | F363: -346562000 | G363: -2832807000 | H363: -2634711000 | I363: 895640000 | J363: 1146059000 | K363: 409609000 | L363: 1442191000 | M363: 557063000 | N363: =POWER(D363/M363,1/9)-1 -> 7.6368192680602576e-02 | O363: =POWER(D363/I363,1/5)-1 -> 3.8206411589449152e-02
A364: 1797.HK | B364: 东方甄选 | C364: 10.88 | D364: 1068074649.9 | E364: -628276974.10000002 | F364: -2022989481.2 | G364: -805965831 | H364: -45040933.850000001 | I364: 112107987.5 | J364: 108265410 | K364: 70195741.25 | L364: -- | M364: -- | N364: =POWER(D364/M364,1/9)-1 -> #VALUE! | O364: =POWER(D364/I364,1/5)-1 -> 0.56961452952728941
A365: 9979.HK | B365: 绿城管理控股 | C365: 4.54 | D365: 1067267993.4 | E365: 839920086.39999998 | F365: 692116788 | G365: 523631467.5 | H365: 362929357.5 | I365: 381317140 | J365: 295986829.80000001 | K365: -- | L365: -- | M365: -- | N365: =POWER(D365/M365,1/9)-1 -> #VALUE! | O365: =POWER(D365/I365,1/5)-1 -> 0.2285629997974985
A366: 2877.HK | B366: 神威药业 | C366: 7.98 | D366: 1062776862 | E366: 815360221.29999995 | F366: 681647313 | G366: 351649832.69999999 | H366: 562270125 | I366: 575990413.60000002 | J366: 541366891.70000005 | K366: 654744055 | L366: 773730351.29999995 | M366: 879488722.5 | N366: =POWER(D366/M366,1/9)-1 -> 2.1256059055297705e-02 | O366: =POWER(D366/I366,1/5)-1 -> 0.13033029341347113
A367: 0182.HK | B367: 协合新能源 | C367: 0.61 | D367: 1056489058.8 | E367: 983496757.70000005 | F367: 964335383 | G367: 802631419.5 | H367: 675297427.5 | I367: 572039471.60000002 | J367: 239823160.40000001 | K367: 508746918.75 | L367: 479934244.5 | M367: 317188000 | N367: =POWER(D367/M367,1/9)-1 -> 0.1430386543206863 | O367: =POWER(D367/I367,1/5)-1 -> 0.13054486409285815
A368: 9930.HK | B368: 宏信建发 | C368: 1.34 | D368: 1054990553.4 | E368: 751948592.20000005 | F368: 868951731 | G368: 534415778.69999999 | H368: -- | I368: -- | J368: -- | K368: -- | L368: -- | M368: -- | N368: =POWER(D368/M368,1/9)-1 -> #VALUE! | O368: =POWER(D368/I368,1/5)-1 -> #VALUE!
A369: 1361.HK | B369: 361度 | C369: 3.65 | D369: 1053916277.4 | E369: 842822687.70000005 | F369: 736781650 | G369: 494715973.5 | H369: 483210352.5 | I369: 345752969 | J369: 547544823.39999998 | K369: 447447035 | L369: 608769345.95000005 | M369: 496217451.80000001 | N369: =POWER(D369/M369,1/9)-1 -> 8.7297102954301931e-02 | O369: =POWER(D369/I369,1/5)-1 -> 0.24970652908821744
A370: 2314.HK | B370: 理文造纸 | C370: 2.39 | D370: 1050931000 | E370: 1185236000 | F370: 3122838000 | G370: 3523823000 | H370: 3235605000 | I370: 4880206000 | J370: 5040292000 | K370: 2862743000 | L370: 2331675000 | M370: 1904394000 | N370: =POWER(D370/M370,1/9)-1 -> -6.3919832037312108e-02 | O370: =POWER(D370/I370,1/5)-1 -> -0.26442457787582463
A371: 1691.HK | B371: JS环球生活 | C371: 1.56 | D371: 1028763377 | E371: 2594395392 | F371: 3279051202 | G371: 2670365790 | H371: 328097458 | I371: 273273422 | J371: 376689498 | K371: 402703990 | L371: -- | M371: -- | N371: =POWER(D371/M371,1/9)-1 -> #VALUE! | O371: =POWER(D371/I371,1/5)-1 -> 0.30359780353998533
A372: 0116.HK | B372: 周生生 | C372: 6.93 | D372: 1012680000 | E372: 452326000 | F372: 643257000 | G372: 544464000 | H372: 643533000 | I372: 1012257000 | J372: 876418000 | K372: 742176000 | L372: 1130320000 | M372: 1082324000 | N372: =POWER(D372/M372,1/9)-1 -> -7.3627940779147361e-03 | O372: =POWER(D372/I372,1/5)-1 -> 8.3561647437946363e-05
A373: 6088.HK | B373: 鸿腾精密科技 | C373: 3.09 | D373: 1007376859 | E373: 1324385152 | F373: 1073199750 | G373: 329572277 | H373: 1833168818 | I373: 1832732964 | J373: 1410348860 | K373: 1307029748 | L373: 1371908254.5 | M373: 1450565900 | N373: =POWER(D373/M373,1/9)-1 -> -3.9701929460751906e-02 | O373: =POWER(D373/I373,1/5)-1 -> -0.11280608226323696
A374: 3990.HK | B374: 美的置业 | C374: 6.61 | D374: 1001470780.8 | E374: 1947510100.3 | F374: 4583985546.5 | G374: 5156733895.8000002 | H374: 4811020770 | I374: 3654902584.1999998 | J374: 2292826713.8000002 | K374: 1119458803.75 | L374: 459924929.80000001 | M374: -- | N374: =POWER(D374/M374,1/9)-1 -> #VALUE! | O374: =POWER(D374/I374,1/5)-1 -> -0.22811518848116685
A375: 1381.HK | B375: 粤丰环保 | C375: 4.41 | D375: 1001264000 | E375: 1332805000 | F375: 1321995000 | G375: 1053790000 | H375: 892622000 | I375: 754364000 | J375: 564247000 | K375: 400018000 | L375: 272001000 | M375: 191038000 | N375: =POWER(D375/M375,1/9)-1 -> 0.20208876358522354 | O375: =POWER(D375/I375,1/5)-1 -> 5.8262798251073944e-02
A376: 1896.HK | B376: 猫眼娱乐 | C376: 8.36 | D376: 997993634.39999998 | E376: 118664839 | F376: 451230699 | G376: -770291596.79999995 | H376: 517912080 | I376: -156088396.80000001 | J376: -90479784.099999994 | K376: -564695022.5 | L376: -1525844903.5999999 | M376: -- | N376: =POWER(D376/M376,1/9)-1 -> #VALUE! | O376: =POWER(D376/I376,1/5)-1 -> -2.4492771008880503
A377: 3868.HK | B377: 信义能源 | C377: 1 | D377: 992987000 | E377: 971451000 | F377: 1232275000 | G377: 922007000 | H377: 890986000 | I377: 740813000 | J377: 719639000 | K377: 659005000 | L377: 256088000 | M377: -- | N377: =POWER(D377/M377,1/9)-1 -> #VALUE! | O377: =POWER(D377/I377,1/5)-1 -> 6.0344513557416546e-02
A378: 1983.HK | B378: 泸州银行 | C378: 1.92 | D378: 985633979.39999998 | E378: 803691154.89999998 | F378: 782647746.5 | G378: 686622600.60000002 | H378: 708396660 | I378: 749548350.20000005 | J378: 741763026.70000005 | K378: 602390845 | L378: 530957173.75 | M378: -- | N378: =POWER(D378/M378,1/9)-1 -> #VALUE! | O378: =POWER(D378/I378,1/5)-1 -> 5.6290084220513403e-02
A379: 0973.HK | B379: L'Occitane | C379: 33.45 | D379: 985629375 | E379: 2117555466 | F379: 1378081290 | G379: 991645920 | H379: 1042518706 | I379: 930287267 | J379: 1096172100 | K379: 969694284 | L379: 1023121880 | M379: 953800575 | N379: =POWER(D379/M379,1/9)-1 -> 3.6539692837325166e-03 | O379: =POWER(D379/I379,1/5)-1 -> 1.162443847716732e-02
A380: 0071.HK | B380: 美丽华酒店 | C380: 9.42 | D380: 977136000 | E380: 480104000 | F380: 329958000 | G380: 301899000 | H380: 1288227000 | I380: 1624151000 | J380: 1519245000 | K380: 1276719000 | L380: 1355385000 | M380: 1300775000 | N380: =POWER(D380/M380,1/9)-1 -> -3.1287822581501978e-02 | O380: =POWER(D380/I380,1/5)-1 -> -9.66298792610083e-02
A381: 0017.HK | B381: 新世界发展 | C381: 7.69 | D381: 976400000 | E381: 1249200000 | F381: 1151500000 | G381: 1096200000 | H381: 18160100000 | I381: 23338100000 | J381: 7675700000 | K381: 8666300000 | L381: 19112000000 | M381: 9725400000 | N381: =POWER(D381/M381,1/9)-1 -> -0.22539546884475981 | O381: =POWER(D381/I381,1/5)-1 -> -0.46995535055002269
A382: 2355.HK | B382: 宝业集团 | C382: 4.86 | D382: 974802427.20000005 | E382: 795058933.70000005 | F382: 965490086.5 | G382: 946468719.60000002 | H382: 957352192.5 | I382: 995335655 | J382: 730004215.5 | K382: 585554296.25 | L382: 662886462.75 | M382: 809515225.79999995 | N382: =POWER(D382/M382,1/9)-1 -> 2.0858927651181247e-02 | O382: =POWER(D382/I382,1/5)-1 -> -4.1603636656663001e-03
A383: 6623.HK | B383: 陆控 | C383: 10.04 | D383: 972181413 | E383: 9813758168.8999996 | F383: 20576963310 | G383: 14724868476.6 | H383: -- | I383: -- | J383: -- | K383: -- | L383: -- | M383: -- | N383: =POWER(D383/M383,1/9)-1 -> #VALUE! | O383: =POWER(D383/I383,1/5)-1 -> #VALUE!
A384: 9985.HK | B384: 卫龙美味 | C384: 6.23 | D384: 965044054.79999995 | E384: 170678145.69999999 | F384: 1012329660.5 | G384: 975884811.60000002 | H384: -- | I384: -- | J384: -- | K384: -- | L384: -- | M384: -- | N384: =POWER(D384/M384,1/9)-1 -> #VALUE! | O384: =POWER(D384/I384,1/5)-1 -> #VALUE!
A385: 1030.HK | B385: 新城发展 | C385: 1.47 | D385: 963884275.20000005 | E385: 316627211.30000001 | F385: 10519219088 | G385: 12131452599.299999 | H385: 8730209490 | I385: 7698079154.3999996 | J385: 4548624202.1999998 | K385: 1537917771.25 | L385: 1212378184.5 | M385: 1279997235.9000001 | N385: =POWER(D385/M385,1/9)-1 -> -3.1024327269138841e-02 | O385: =POWER(D385/I385,1/5)-1 -> -0.34002345011125634
A386: 1599.HK | B386: 城建设计 | C386: 1.55 | D386: 956820362.39999998 | E386: 1096796353.0999999 | F386: 1127324904.5 | G386: 937471066.5 | H386: 735409987.5 | I386: 640328145.20000005 | J386: 594557289.10000002 | K386: 524454437.5 | L386: 467631585.44999999 | M386: 436536634.30000001 | N386: =POWER(D386/M386,1/9)-1 -> 9.1108014825408867e-02 | O386: =POWER(D386/I386,1/5)-1 -> 8.3641337261084248e-02
A387: 1065.HK | B387: 天津创业环保股份 | C387: 3.08 | D387: 948439913.39999998 | E387: 847489637.39999998 | F387: 848809930.5 | G387: 679429484.10000002 | H387: 566692072.5 | I387: 570629884.79999995 | J387: 609342123.89999998 | K387: 492470440 | L387: 388728038.85000002 | M387: 384562847.19999999 | N387: =POWER(D387/M387,1/9)-1 -> 0.10550389617065914 | O387: =POWER(D387/I387,1/5)-1 -> 0.10695779264542704
A388: 0004.HK | B388: 九龙仓集团 | C388: 24 | D388: 945000000 | E388: -1705000000 | F388: 6019000000 | G388: 3864000000 | H388: 3386000000 | I388: 6623000000 | J388: 21876000000 | K388: 21440000000 | L388: 16024000000 | M388: 35930000000 | N388: =POWER(D388/M388,1/9)-1 -> -0.3325148297750421 | O388: =POWER(D388/I388,1/5)-1 -> -0.32255286459706101
A389: 1907.HK | B389: 中国旭阳集团 | C389: 2.96 | D389: 943624306.79999995 | E389: 2092763128.2 | F389: 3200462180.5 | G389: 1970198781 | H389: 1523336887.5 | I389: 2378157384.8000002 | J389: 904778658.60000002 | K389: 399271013.75 | L389: -596393771.79999995 | M389: -- | N389: =POWER(D389/M389,1/9)-1 -> #VALUE! | O389: =POWER(D389/I389,1/5)-1 -> -0.16878818954710295
A390: 1579.HK | B390: 颐海国际 | C390: 12.06 | D390: 934725355.20000005 | E390: 837035534.70000005 | F390: 938213124.5 | G390: 1055096101.8 | H390: 803073495 | I390: 589559109.79999995 | J390: 312517263 | K390: 207492600 | L390: 146473499.34999999 | M390: 53048229 | N390: =POWER(D390/M390,1/9)-1 -> 0.3754534714489921 | O390: =POWER(D390/I390,1/5)-1 -> 9.6557308530238695e-02
A391: 2155.HK | B391: 森松国际 | C391: 4.49 | D391: 925942600.79999995 | E391: 754998974.60000002 | F391: 467560631 | G391: 344917981.5 | H391: -- | I391: -- | J391: -- | K391: -- | L391: -- | M391: -- | N391: =POWER(D391/M391,1/9)-1 -> #VALUE! | O391: =POWER(D391/I391,1/5)-1 -> #VALUE!
A392: 0856.HK | B392: 伟仕佳杰 | C392: 4.13 | D392: 922033000 | E392: 823071000 | F392: 1314026000 | G392: 1067580000 | H392: 809948000 | I392: 740827000 | J392: 716441000 | K392: 551915000 | L392: 450381000 | M392: 607374000 | N392: =POWER(D392/M392,1/9)-1 -> 4.7474268251634033e-02 | O392: =POWER(D392/I392,1/5)-1 -> 4.4734490423522733e-02
A393: 3709.HK | B393: 赢家时尚 | C393: 9.01 | D393: 918801954 | E393: 431415898.69999999 | F393: 690640041 | G393: 539737612.20000005 | H393: 453264705 | I393: 310563397.39999998 | J393: 303941531.30000001 | K393: 259690235 | L393: 239967122.25 | M393: 160292755 | N393: =POWER(D393/M393,1/9)-1 -> 0.21410555537034526 | O393: =POWER(D393/I393,1/5)-1 -> 0.2422652253687696
A394: 0506.HK | B394: 中国食品 | C394: 2.7999999999999998 | D394: 912670907.39999998 | E394: 744360991.60000002 | F394: 700922167.5 | G394: 594441054.60000002 | H394: 466879207.5 | I394: 365328918.80000001 | J394: 1869860788.3 | K394: 499735000 | L394: 54633000 | M394: -224688000 | N394: =POWER(D394/M394,1/9)-1 -> -2.1685226841163203 | O394: =POWER(D394/I394,1/5)-1 -> 0.20095305455303336
A395: 1888.HK | B395: 建滔积层板 | C395: 7.94 | D395: 907402000 | E395: 1909169000 | F395: 6781656000 | G395: 2802885000 | H395: 2402247000 | I395: 3250381000 | J395: 3764540000 | K395: 4346561000 | L395: 1265403000 | M395: 1121842000 | N395: =POWER(D395/M395,1/9)-1 -> -2.3295665191413684e-02 | O395: =POWER(D395/I395,1/5)-1 -> -0.22522947138236726
A396: 1686.HK | B396: 新意网集团 | C396: 2.7000000000000002 | D396: 905365000 | E396: 846831000 | F396: 787727000 | G396: 783249000 | H396: 865194000 | I396: 776373000 | J396: 629801000 | K396: 548991000 | L396: 569402000 | M396: 585489000 | N396: =POWER(D396/M396,1/9)-1 -> 4.9624319389909077e-02 | O396: =POWER(D396/I396,1/5)-1 -> 3.1218404875785755e-02
A397: 0272.HK | B397: 瑞安房地产 | C397: 0.67 | D397: 887922000 | E397: 1022058600 | F397: 2003282000 | G397: -882006000 | H397: 2159010000 | I397: 2170171600 | J397: 2000964100 | K397: 1209040000 | L397: 926727400 | M397: 2218766200 | N397: =POWER(D397/M397,1/9)-1 -> -9.6751954301668386e-02 | O397: =POWER(D397/I397,1/5)-1 -> -0.16367294149046507
A398: 0772.HK | B398: 阅文集团 | C398: 25.699999999999999 | D398: 882308359.79999995 | E398: 686094626.60000002 | F398: 2261172720.5 | G398: -5344323461.1000004 | H398: 1224727477.5 | I398: 1036850149.6 | J398: 666743058.10000002 | K398: 40763983.75 | L398: -408776163.19999999 | M398: -26368127 | N398: =POWER(D398/M398,1/9)-1 -> -2.4770440820656199 | O398: =POWER(D398/I398,1/5)-1 -> -3.1764771877049625e-02
A399: 0098.HK | B399: 兴发铝业 | C399: 7.82 | D399: 881532250.20000005 | E399: 516414849.39999998 | F399: 1087111100 | G399: 912262381.5 | H399: 677326807.5 | I399: 563868878 | J399: 458735107 | K399: 331681455 | L399: 312555280.35000002 | M399: 280285827.39999998 | N399: =POWER(D399/M399,1/9)-1 -> 0.13577683697998055 | O399: =POWER(D399/I399,1/5)-1 -> 9.3482950813350119e-02
A400: 1448.HK | B400: 福寿园 | C400: 4.91 | D400: 867357288 | E400: 742962147.60000002 | F400: 881680408.5 | G400: 739054281.60000002 | H400: 646562032.5 | I400: 556051250.39999998 | J400: 500360915 | K400: 376684857.5 | L400: 334520366.19999999 | M400: 287481218.80000001 | N400: =POWER(D400/M400,1/9)-1 -> 0.13054438454799766 | O400: =POWER(D400/I400,1/5)-1 -> 9.2991141451196357e-02
A401: 1681.HK | B401: 康臣药业 | C401: 5.79 | D401: 860006170.79999995 | E401: 770387386.70000005 | F401: 722665614 | G401: 594505417.20000005 | H401: 89198850 | I401: 529850925.80000001 | J401: 475054533.80000001 | K401: 341738267.5 | L401: 293646748.44999999 | M401: 263556480 | N401: =POWER(D401/M401,1/9)-1 -> 0.14043296712162112 | O401: =POWER(D401/I401,1/5)-1 -> 0.10171579030441391
A402: 2343.HK | B402: 太平洋航运 | C402: 2.28 | D402: 854359369 | E402: 5480091648 | F402: 6587828380 | G402: -1614391684 | H402: 195640588 | I402: 566272856 | J402: 28208540 | K402: -671085438 | L402: -143694270 | M402: -2210180784 | N402: =POWER(D402/M402,1/9)-1 -> -1.8997767236108449 | O402: =POWER(D402/I402,1/5)-1 -> 8.5732825768880749e-02
A403: 1052.HK | B403: 越秀交通基建 | C403: 3.75 | D403: 838931725.79999995 | E403: 511157903.39999998 | F403: 1793872908 | G403: 191289222.90000001 | H403: 1271256825 | I403: 1200238111 | J403: 1136487663.8 | K403: 1021035391.25 | L403: 625759740.29999995 | M403: 760432823 | N403: =POWER(D403/M403,1/9)-1 -> 1.0975521964754709e-02 | O403: =POWER(D403/I403,1/5)-1 -> -6.9123983427775926e-02
A404: 1126.HK | B404: 德林国际 | C404: 4.49 | D404: 829847000 | E404: 687096000 | F404: 193562000 | G404: 272776000 | H404: 477469000 | I404: 332498000 | J404: 406338000 | K404: 295500000 | L404: 150783000 | M404: 122787000 | N404: =POWER(D404/M404,1/9)-1 -> 0.23653117774010246 | O404: =POWER(D404/I404,1/5)-1 -> 0.20072014818787487
A405: 2018.HK | B405: 瑞声科技 | C405: 30.800000000000001 | D405: 811593594 | E405: 926514170.5 | F405: 1611783635.5 | G405: 1795844073.3 | H405: 2483504062.5 | I405: 4321994661 | J405: 6383637763.1000004 | K405: 4473520231.25 | L405: 3653874449.1999998 | M405: 2892251590.5 | N405: =POWER(D405/M405,1/9)-1 -> -0.13168348696868226 | O405: =POWER(D405/I405,1/5)-1 -> -0.2843002312713564
A406: 9899.HK | B406: 云音乐 | C406: 96.05 | D406: 804810308.39999998 | E406: -249867381.40000001 | F406: -2517684654 | G406: -3517848749.6999998 | H406: -- | I406: -- | J406: -- | K406: -- | L406: -- | M406: -- | N406: =POWER(D406/M406,1/9)-1 -> #VALUE! | O406: =POWER(D406/I406,1/5)-1 -> #VALUE!
A407: 2066.HK | B407: 盛京银行 | C407: 0.69999999999999996 | D407: 802894150.79999995 | E407: 1105422933.8 | F407: 492201244.5 | G407: 1434781806.3 | H407: 6082802820 | I407: 5839557176.1999998 | J407: 9087727939.5 | K407: 7628197850 | L407: 7304839350.6999998 | M407: 6744815890.6999998 | N407: =POWER(D407/M407,1/9)-1 -> -0.21059715313300054 | O407: =POWER(D407/I407,1/5)-1 -> -0.3275566922319656
A408: 0173.HK | B408: 嘉华国际 | C408: 1.81 | D408: 802156000 | E408: 1372387000 | F408: 3354877000 | G408: 3268439000 | H408: 3149738000 | I408: 4046390000 | J408: 3906182000 | K408: 3181996000 | L408: 1366754000 | M408: 1829960000 | N408: =POWER(D408/M408,1/9)-1 -> -8.7565043041761381e-02 | O408: =POWER(D408/I408,1/5)-1 -> -0.27650052632583333
A409: 0129.HK | B409: 泛海集团 | C409: 0.40000000000000002 | D409: 801412000 | E409: -883576000 | F409: 1353248000 | G409: 727979000 | H409: 1388728000 | I409: 1463061000 | J409: 1451468000 | K409: 721333000 | L409: 967016000 | M409: 1400385000 | N409: =POWER(D409/M409,1/9)-1 -> -6.0130407853557388e-02 | O409: =POWER(D409/I409,1/5)-1 -> -0.11341846592245153
A410: 1890.HK | B410: 中国科培 | C410: 1.41 | D410: 799004960.25 | E410: 800568664 | F410: -- | G410: 673173201 | H410: 509886195 | I410: 389351101.60000002 | J410: 276797236.39999998 | K410: 199218232.5 | L410: 140541503.15000001 | M410: -- | N410: =POWER(D410/M410,1/9)-1 -> #VALUE! | O410: =POWER(D410/I410,1/5)-1 -> 0.15462674644471663
A411: 2660.HK | B411: 禅游科技 | C411: 2.68 | D411: 795711848.39999998 | E411: 767991302.29999995 | F411: 612670003.5 | G411: 263371759.19999999 | H411: 179379982.5 | I411: 123889927.40000001 | J411: 79602164.400000006 | K411: 44906723.75 | L411: 29427123.100000001 | M411: -- | N411: =POWER(D411/M411,1/9)-1 -> #VALUE! | O411: =POWER(D411/I411,1/5)-1 -> 0.45058761539569225
A412: 0636.HK | B412: 嘉里物流 | C412: 6.83 | D412: 791165000 | E412: 3579191000 | F412: 7938653000 | G412: 2895757000 | H412: 3788323000 | I412: 2439775000 | J412: 2115897000 | K412: 1877202000 | L412: 1804445000 | M412: 1658830000 | N412: =POWER(D412/M412,1/9)-1 -> -7.8969717667150441e-02 | O412: =POWER(D412/I412,1/5)-1 -> -0.20166814664229904
A413: 1385.HK | B413: 上海复旦 | C413: 12.66 | D413: 788709734.50999999 | E413: 1214786972.6199999 | F413: 629964572.98000002 | G413: 158365277.55000001 | H413: -180963480 | I413: 122379005.2 | J413: 254313065.80000001 | K413: 235871702.5 | L413: 186871992.90000001 | M413: 209601027.69999999 | N413: =POWER(D413/M413,1/9)-1 -> 0.15863618623005049 | O413: =POWER(D413/I413,1/5)-1 -> 0.45158361205012576
A414: 0013.HK | B414: 和黄医药 | C414: 29.600000000000001 | D414: 787192580 | E414: -2817399680 | F414: -1517865104 | G414: -974784690 | H414: -- | I414: -- | J414: -- | K414: -- | L414: -- | M414: -- | N414: =POWER(D414/M414,1/9)-1 -> #VALUE! | O414: =POWER(D414/I414,1/5)-1 -> #VALUE!
A415: 2096.HK | B415: 先声药业 | C415: 5.52 | D415: 783521008.20000005 | E415: 1052255580.8 | F415: 1845439052 | G415: 798017574.60000002 | H415: 1121549820 | I415: 835376018.20000005 | J415: 420105350.10000002 | K415: -- | L415: -- | M415: -- | N415: =POWER(D415/M415,1/9)-1 -> #VALUE! | O415: =POWER(D415/I415,1/5)-1 -> -1.2735028417348304e-02
A416: 0354.HK | B416: 中国软件国际 | C416: 4.06 | D416: 782022502.79999995 | E416: 856725392.10000002 | F416: 1392147519.5 | G416: 1138178683.2 | H416: 843587340 | I416: 815013295.79999995 | J416: 678058276.29999995 | K416: 491262511.25 | L416: 329359858.80000001 | M416: 249627420.19999999 | N416: =POWER(D416/M416,1/9)-1 -> 0.1352800227259181 | O416: =POWER(D416/I416,1/5)-1 -> -8.2301276983415272e-03
A417: 0189.HK | B417: 东岳集团 | C417: 7.29 | D417: 775882686.60000002 | E417: 4349433545.8999996 | F417: 2540645253.5 | G417: 920345847.29999995 | H417: 1634873445 | I417: 2424190982.8000002 | J417: 1919914863.3 | K417: 653586132.5 | L417: -812037827.95000005 | M417: 603080120.39999998 | N417: =POWER(D417/M417,1/9)-1 -> 2.8390116718306935e-02 | O417: =POWER(D417/I417,1/5)-1 -> -0.20375659932412338
A418: 0041.HK | B418: 鹰君 | C418: 10.94 | D418: 763511000 | E418: -181404000 | F418: -499034000 | G418: -8540252000 | H418: -337790000 | I418: 5810713000 | J418: 8817852000 | K418: 2769792000 | L418: 3312335000 | M418: 2115101000 | N418: =POWER(D418/M418,1/9)-1 -> -0.10704088156039804 | O418: =POWER(D418/I418,1/5)-1 -> -0.33362733373181197
A419: 0136.HK | B419: 中国儒意 | C419: 2.14 | D419: 756112719.60000002 | E419: 890663152.5 | F419: 1439202605.5 | G419: 14329021.800000001 | H419: 100647637.5 | I419: 141751145.59999999 | J419: 115353362.40000001 | K419: 4786153.75 | L419: -128431000 | M419: -545696000 | N419: =POWER(D419/M419,1/9)-1 -> -2.0369010354829449 | O419: =POWER(D419/I419,1/5)-1 -> 0.39769365392868994
A420: 2001.HK | B420: 新高教集团 | C420: 1.88 | D420: 756000510.54999995 | E420: 704819410.39999998 | F420: 684313093.60000002 | G420: 197778351.75 | H420: 431853405 | I420: 276144658 | J420: 279784895.19999999 | K420: 124187743.75 | L420: 122101039.15000001 | M420: 101464253.2 | N420: =POWER(D420/M420,1/9)-1 -> 0.25000604702208729 | O420: =POWER(D420/I420,1/5)-1 -> 0.22314258965911171
A421: 1818.HK | B421: 招金矿业 | C421: 14.88 | D421: 752464566 | E421: 453442051.19999999 | F421: 41261976.5 | G421: 1254073079.7 | H421: 535584225 | I421: 540023178.20000005 | J421: 772032853.89999998 | K421: 392629072.5 | L421: 362388047 | M421: 568278685.20000005 | N421: =POWER(D421/M421,1/9)-1 -> 3.1685169037544592e-02 | O421: =POWER(D421/I421,1/5)-1 -> 6.8598919262278679e-02
A422: 6078.HK | B422: 海吉亚医疗 | C422: 26.15 | D422: 748625673.60000002 | E422: 537860030.39999998 | F422: 540564096.5 | G422: 202724311.5 | H422: 44439622.5 | I422: 2946696.7999999998 | J422: -55669722.600000001 | K422: -- | L422: -- | M422: -- | N422: =POWER(D422/M422,1/9)-1 -> #VALUE! | O422: =POWER(D422/I422,1/5)-1 -> 2.0268148295417685
A423: 1070.HK | B423: TCL电子 | C423: 5.19 | D423: 743633000 | E423: 447007000 | F423: 1183999000 | G423: 3599442000 | H423: 2279426000 | I423: 1040819000 | J423: 814639000 | K423: 182764000 | L423: 25811000 | M423: 234499000 | N423: =POWER(D423/M423,1/9)-1 -> 0.13681776325380213 | O423: =POWER(D423/I423,1/5)-1 -> -6.5032126083960917e-02
A424: 1916.HK | B424: 江西银行 | C424: 0.69999999999999996 | D424: 739920749.39999998 | E424: 1531453283.0999999 | F424: 2535090921.5 | G424: 2215938763.5 | H424: 2291533207.5 | I424: 3112429138.8000002 | J424: 3435119451.4000001 | K424: 1819504076.25 | L424: 908582124.54999995 | M424: -- | N424: =POWER(D424/M424,1/9)-1 -> #VALUE! | O424: =POWER(D424/I424,1/5)-1 -> -0.24973075066341766
A425: 1456.HK | B425: 国联证券 | C425: 2.89 | D425: 735899887.79999995 | E425: 865574208.5 | F425: 1088139680 | G425: 700683444.89999998 | H425: 582600802.5 | I425: 57599496.799999997 | J425: 433392758.80000001 | K425: 677938065 | L425: 1730484659.9000001 | M425: 892192344.5 | N425: =POWER(D425/M425,1/9)-1 -> -2.1171302032625405e-02 | O425: =POWER(D425/I425,1/5)-1 -> 0.66448547422118676
A426: 1969.HK | B426: 中国春来 | C426: 4.34 | D426: 735688255.35000002 | E426: 627809168 | F426: 731435663.75 | G426: 159811159 | H426: 180334309.80000001 | I426: 136492830 | J426: 179787471.94999999 | K426: 127269888.90000001 | L426: -75519528 | M426: -- | N426: =POWER(D426/M426,1/9)-1 -> #VALUE! | O426: =POWER(D426/I426,1/5)-1 -> 0.40060862658236629
A427: 3382.HK | B427: 天津港发展 | C427: 0.63 | D427: 728594000 | E427: 345266000 | F427: 923116000 | G427: 636161000 | H427: 388491000 | I427: 387745000 | J427: 774592000 | K427: 530479000 | L427: 639387000 | M427: 819125000 | N427: =POWER(D427/M427,1/9)-1 -> -1.2929031255150103e-02 | O427: =POWER(D427/I427,1/5)-1 -> 0.13445657587262483
A428: 9638.HK | B428: 法拉帝 | C428: 23.05 | D428: 715998332 | E428: 503770092 | F428: 331315852.5 | G428: 209805204 | H428: -- | I428: -- | J428: -- | K428: -- | L428: -- | M428: -- | N428: =POWER(D428/M428,1/9)-1 -> #VALUE! | O428: =POWER(D428/I428,1/5)-1 -> #VALUE!
A429: 0522.HK | B429: ASMPT | C429: 114.40000000000001 | D429: 715353000 | E429: 2620251000 | F429: 3168976000 | G429: 1621516000 | H429: 619249000 | I429: 2216062000 | J429: 2815473000 | K429: 1463864000 | L429: 956191000 | M429: 1599954000 | N429: =POWER(D429/M429,1/9)-1 -> -8.5556263420076495e-02 | O429: =POWER(D429/I429,1/5)-1 -> -0.20239530961769248
A430: 2507.HK | B430: 西锐 | C430: 24.65 | D430: 711917973 | E430: -- | F430: -- | G430: -- | H430: -- | I430: -- | J430: -- | K430: -- | L430: -- | M430: -- | N430: =POWER(D430/M430,1/9)-1 -> #VALUE! | O430: =POWER(D430/I430,1/5)-1 -> #VALUE!
A431: 3339.HK | B431: 中国龙工 | C431: 1.45 | D431: 707531328 | E431: 451752157.39999998 | F431: 1561706483.5 | G431: 2335212196.5 | H431: 1836505087.5 | I431: 1302406966.2 | J431: 1253611801.5 | K431: 513135245 | L431: 137075683.80000001 | M431: 520197098.19999999 | N431: =POWER(D431/M431,1/9)-1 -> 3.4765575267983184e-02 | O431: =POWER(D431/I431,1/5)-1 -> -0.11488481253483418
A432: 2139.HK | B432: 甘肃银行 | C432: 0.32 | D432: 706567768.20000005 | E432: 677660951 | F432: 698767047.5 | G432: 665269712.10000002 | H432: 568931542.5 | I432: 3911407530.8000002 | J432: 4026462489.5999999 | K432: 2130302921.25 | L432: 1523424592.7 | M432: 1322709109.2 | N432: =POWER(D432/M432,1/9)-1 -> -6.7297211227313913e-02 | O432: =POWER(D432/I432,1/5)-1 -> -0.28982700975508469
A433: 1313.HK | B433: 华润建材科技 | C433: 1.89 | D433: 705756580.20000005 | E433: 1935735000 | F433: 7767357000 | G433: 8959865000 | H433: 8617503000 | I433: 7975439000 | J433: 3616742000 | K433: 1325855000 | L433: 1014969000 | M433: 4206393000 | N433: =POWER(D433/M433,1/9)-1 -> -0.17991179519451983 | O433: =POWER(D433/I433,1/5)-1 -> -0.38428452690091575
A434: 1668.HK | B434: 华南城 | C434: 0.19 | D434: 699984000 | E434: 760200000 | F434: 2415498000 | G434: 2633141000 | H434: 3250962000 | I434: 4511679000 | J434: 4322626000 | K434: 3537012000 | L434: 3727872000 | M434: 3494481000 | N434: =POWER(D434/M434,1/9)-1 -> -0.16360444826992937 | O434: =POWER(D434/I434,1/5)-1 -> -0.3111098356962001
A435: 1330.HK | B435: 绿色动力环保 | C435: 2.73 | D435: 689818224.35000002 | E435: 840171980.20000005 | F435: 854438806.13 | G435: 599985229.42999995 | H435: 464978869.25 | I435: 416330274.43000001 | J435: 247545792.21000001 | K435: 256693961.52000001 | L435: 266678745.90000001 | M435: 177257955.5 | N435: =POWER(D435/M435,1/9)-1 -> 0.16297366619782538 | O435: =POWER(D435/I435,1/5)-1 -> 0.10626541216739382
A436: 0085.HK | B436: 中电华大科技 | C436: 1.15 | D436: 686431000 | E436: 531431000 | F436: 125444000 | G436: -1013263000 | H436: 155159000 | I436: 113321000 | J436: 220097000 | K436: 1061166000 | L436: 177353000 | M436: 170108000 | N436: =POWER(D436/M436,1/9)-1 -> 0.16766732587240796 | O436: =POWER(D436/I436,1/5)-1 -> 0.43369674105527012
A437: 0297.HK | B437: 中化化肥 | C437: 1.01 | D437: 685726813.79999995 | E437: 1260320088.5999999 | F437: 1061166394 | G437: 767671800.60000002 | H437: 688119622.5 | I437: 524309359.60000002 | J437: -2646576545.5999999 | K437: -5151627206.25 | L437: 259736522.75 | M437: 286192138.10000002 | N437: =POWER(D437/M437,1/9)-1 -> 0.10196027048507328 | O437: =POWER(D437/I437,1/5)-1 -> 5.5146358090013337e-02
A438: 1785.HK | B438: 成都高速 | C438: 2 | D438: 678291631.21000004 | E438: 571639388.63999999 | F438: 752642127.07000005 | G438: 406892148.57999998 | H438: 490348942.5 | I438: 473074636.80000001 | J438: 406326392.39999998 | K438: 309434230 | L438: 288058158.85000002 | M438: -- | N438: =POWER(D438/M438,1/9)-1 -> #VALUE! | O438: =POWER(D438/I438,1/5)-1 -> 7.4725018257296272e-02
A439: 2618.HK | B439: 京东物流 | C439: 8.15 | D439: 675470766.60000002 | E439: -1575768435.4000001 | F439: -19398480020 | G439: -4927308640.5 | H439: -- | I439: -- | J439: -- | K439: -- | L439: -- | M439: -- | N439: =POWER(D439/M439,1/9)-1 -> #VALUE! | O439: =POWER(D439/I439,1/5)-1 -> #VALUE!
A440: 3306.HK | B440: 江南布衣 | C440: 13.04 | D440: 670001292.79999995 | E440: 654672032 | F440: 778582803 | G440: 380043974.19999999 | H440: 551033143.54999995 | I440: 485116952.19999999 | J440: 382186465.80000001 | K440: 277916963.19999999 | L440: 245856453.84999999 | M440: 186531072 | N440: =POWER(D440/M440,1/9)-1 -> 0.15266396731580012 | O440: =POWER(D440/I440,1/5)-1 -> 6.670870180372046e-02
A441: 1571.HK | B441: 信邦控股 | C441: 2.93 | D441: 665825302.79999995 | E441: 486545017.60000002 | F441: 263561380 | G441: 396218549.39999998 | H441: 229592610 | I441: 449546606.39999998 | J441: 469093603 | K441: 331531436.25 | L441: 268663918.30000001 | M441: 217865869.40000001 | N441: =POWER(D441/M441,1/9)-1 -> 0.13216024148147265 | O441: =POWER(D441/I441,1/5)-1 -> 8.1725616307734006e-02
A442: 0382.HK | B442: 中汇集团 | C442: 2.17 | D442: 664716831.5 | E442: 645118084.79999995 | F442: 498589837.39999998 | G442: 329598925.25 | H442: 237289361.40000001 | I442: 185464687.5 | J442: 155556015.5 | K442: 105537602.8 | L442: -- | M442: -- | N442: =POWER(D442/M442,1/9)-1 -> #VALUE! | O442: =POWER(D442/I442,1/5)-1 -> 0.29084794808345271
A443: 2869.HK | B443: 绿城服务 | C443: 3.47 | D443: 663610978.79999995 | E443: 617635878.10000002 | F443: 1036263737.5 | G443: 846742446.60000002 | H443: 533500087.5 | I443: 550280825.60000002 | J443: 464553368.69999999 | K443: 317306325 | L443: 232643858.90000001 | M443: 185826036.90000001 | N443: =POWER(D443/M443,1/9)-1 -> 0.15192180635857411 | O443: =POWER(D443/I443,1/5)-1 -> 3.8163692810261551e-02
A444: 0807.HK | B444: 上海实业环境 | C444: 0.97 | D444: 662124531.60000002 | E444: 880139107.60000002 | F444: 864691695.5 | G444: 757266513.60000002 | H444: 670780492.5 | I444: 615113848.20000005 | J444: 642194381.70000005 | K444: 505536517.5 | L444: 423836659.5 | M444: 362774513.19999999 | N444: =POWER(D444/M444,1/9)-1 -> 6.9137731534451685e-02 | O444: =POWER(D444/I444,1/5)-1 -> 1.4838266603344641e-02
A445: 1651.HK | B445: 津上机床中国 | C445: 9.38 | D445: 661982924.60000002 | E445: 823075983 | F445: 464169156 | G445: 170104177.94999999 | H445: 429068556 | I445: 242544568.5 | J445: 127075757.40000001 | K445: 66852403.200000003 | L445: 222886579.5 | M445: 32325369 | N445: =POWER(D445/M445,1/9)-1 -> 0.39862203518714945 | O445: =POWER(D445/I445,1/5)-1 -> 0.22239354175481307
A446: 1666.HK | B446: 同仁堂科技 | C446: 5.29 | D446: 646964085.60000002 | E446: 657555952.79999995 | F446: 621126400.5 | G446: 557276420.70000005 | H446: 466723875 | I446: 771760159 | J446: 799265867.39999998 | K446: 661920507.5 | L446: 636280683.60000002 | M446: 576763157.29999995 | N446: =POWER(D446/M446,1/9)-1 -> 1.2843902742147195e-02 | O446: =POWER(D446/I446,1/5)-1 -> -3.4661641576260394e-02
A447: 1112.HK | B447: H&H国际控股 | C447: 8.55 | D447: 637818489 | E447: 690152402.29999995 | F447: 622638658 | G447: 1354825578.5999999 | H447: 1123142257.5 | I447: 960008312.79999995 | J447: 1118389069.4000001 | K447: 1060572555 | L447: 294820446.35000002 | M447: 1006788249.4 | N447: =POWER(D447/M447,1/9)-1 -> -4.9453825236798754e-02 | O447: =POWER(D447/I447,1/5)-1 -> -7.8523164626998931e-02
A448: 0882.HK | B448: 天津发展 | C448: 1.85 | D448: 635634000 | E448: 358162000 | F448: 470379000 | G448: 294478000 | H448: 461441000 | I448: 471931000 | J448: 488837000 | K448: 515214000 | L448: 562351000 | M448: 737009000 | N448: =POWER(D448/M448,1/9)-1 -> -1.6307478235850548e-02 | O448: =POWER(D448/I448,1/5)-1 -> 6.1367347694071706e-02
A449: 1033.HK | B449: 中石化油服 | C449: 0.5 | D449: 631502184.60000002 | E449: 644838881.5 | F449: 171981025 | G449: -42594930.299999997 | H449: 1102830577.5 | I449: 273478056.80000001 | J449: -12664118573.5 | K449: -18000296422.5 | L449: -13575145.15 | M449: 1568994653.2 | N449: =POWER(D449/M449,1/9)-1 -> -9.6176330748715788e-02 | O449: =POWER(D449/I449,1/5)-1 -> 0.18219869167454505
A450: 1133.HK | B450: 哈尔滨电气 | C450: 2.65 | D450: 630051954.59000003 | E450: 111274010.23999999 | F450: -5072427880.1899996 | G450: -8677672.6799999997 | H450: 118648550.28 | I450: 81201139.790000007 | J450: 232858438.59 | K450: 459260391.92000002 | L450: 230754567.33000001 | M450: 706822262.22000003 | N450: =POWER(D450/M450,1/9)-1 -> -1.2693960368721613e-02 | O450: =POWER(D450/I450,1/5)-1 -> 0.50647818656689281
A451: 3669.HK | B451: 永达汽车 | C451: 1.54 | D451: 627661099.79999995 | E451: 1608037735.9000001 | F451: 3036880001 | G451: 1936791015.9000001 | H451: 1646059620 | I451: 1426778521.4000001 | J451: 1810255077 | K451: 945976010 | L451: 616800591.39999998 | M451: 625360127 | N451: =POWER(D451/M451,1/9)-1 -> 4.0815925317949642e-04 | O451: =POWER(D451/I451,1/5)-1 -> -0.15145724425355112
A452: 1428.HK | B452: 耀才证券金融 | C452: 1.8 | D452: 620595000 | E452: 561502000 | F452: 703905000 | G452: 470978000 | H452: 440928000 | I452: 516099000 | J452: 271910000 | K452: 325475000 | L452: 218377000 | M452: 166747000 | N452: =POWER(D452/M452,1/9)-1 -> 0.15722203259757772 | O452: =POWER(D452/I452,1/5)-1 -> 3.7564373083788238e-02
A453: 6680.HK | B453: 金力永磁 | C453: 5.7999999999999998 | D453: 617920266.60000002 | E453: 792701204.70000005 | F453: 554972788 | G453: 291421933.80000001 | H453: -- | I453: -- | J453: -- | K453: -- | L453: -- | M453: -- | N453: =POWER(D453/M453,1/9)-1 -> #VALUE! | O453: =POWER(D453/I453,1/5)-1 -> #VALUE!
A454: 0259.HK | B454: 亿都(国际控股) | C454: 2.84 | D454: 615109000 | E454: 266579000 | F454: 187734000 | G454: 123822000 | H454: 288747000 | I454: 120598000 | J454: 442408000 | K454: 201004000 | L454: 208549000 | M454: 105345000 | N454: =POWER(D454/M454,1/9)-1 -> 0.21660244178017884 | O454: =POWER(D454/I454,1/5)-1 -> 0.38523161609251089
A455: 0241.HK | B455: 阿里健康 | C455: 3.2999999999999998 | D455: 612224596.35000002 | E455: -327495703.75 | F455: 412815339 | G455: -7189606.9000000004 | H455: -95650872.799999997 | I455: -133680059.09999999 | J455: -234388991.40000001 | K455: -229527223.19999999 | L455: -101534372.09999999 | M455: -39200000 | N455: =POWER(D455/M455,1/9)-1 -> -2.3571409888005306 | O455: =POWER(D455/I455,1/5)-1 -> -2.3557163351406309
A456: 2858.HK | B456: 易鑫集团 | C456: 0.66 | D456: 608344959.60000002 | E456: 418315273.39999998 | F456: 35452948.5 | G456: -1377537233.0999999 | H456: 34570980 | I456: -189667988 | J456: -21976880043 | K456: -1557231296.25 | L456: -33171666.300000001 | M456: 81113.5 | N456: =POWER(D456/M456,1/9)-1 -> 1.6950192004890767 | O456: =POWER(D456/I456,1/5)-1 -> -2.2624993854045856
A457: 2148.HK | B457: Vesync | C457: 4.39 | D457: 605204091 | E457: -127083008 | F457: 324303224 | G457: 424267419 | H457: 49618764 | I457: 34164074 | J457: 14588738 | K457: -- | L457: -- | M457: -- | N457: =POWER(D457/M457,1/9)-1 -> #VALUE! | O457: =POWER(D457/I457,1/5)-1 -> 0.77691412736765386
A458: 0777.HK | B458: 网龙 | C458: 11.72 | D458: 602910000 | E458: 940835400 | F458: 1300419000 | G458: 1136477841.9000001 | H458: 902059410 | I458: 621189417.79999995 | J458: -24988672.699999999 | K458: -225297047.5 | L458: -168150452.94999999 | M458: 220480219.90000001 | N458: =POWER(D458/M458,1/9)-1 -> 0.11825935316720648 | O458: =POWER(D458/I458,1/5)-1 -> -5.9558182134312743e-03
A459: 6055.HK | B459: 中烟香港 | C459: 14.48 | D459: 598773000 | E459: 374903743 | F459: 702829173 | G459: 106120529 | H459: 318925470 | I459: 259483752 | J459: 344329887 | K459: 334558875 | L459: 387812768 | M459: -- | N459: =POWER(D459/M459,1/9)-1 -> #VALUE! | O459: =POWER(D459/I459,1/5)-1 -> 0.18203519540139657
A460: 2696.HK | B460: 复宏汉霖 | C460: 22.45 | D460: 598546027.79999995 | E460: -784321677.89999998 | F460: -1204971674 | G460: -1184201517.9000001 | H460: -978332137.5 | I460: -562110879.60000002 | J460: -324376781.80000001 | K460: -82642551.25 | L460: -- | M460: -- | N460: =POWER(D460/M460,1/9)-1 -> #VALUE! | O460: =POWER(D460/I460,1/5)-1 -> -2.0126400793877908
A461: 0517.HK | B461: 中远海运国际 | C461: 3.68 | D461: 593673000 | E461: 347062000 | F461: 288341000 | G461: 338523000 | H461: 330607000 | I461: 286140000 | J461: 356627000 | K461: 237205000 | L461: 335763000 | M461: 358970000 | N461: =POWER(D461/M461,1/9)-1 -> 5.7490735840858287e-02 | O461: =POWER(D461/I461,1/5)-1 -> 0.15716088512350868
A462: 0842.HK | B462: 理士国际 | C462: 1.56 | D462: 586874786.39999998 | E462: 499491093.19999999 | F462: 166686287 | G462: 147476170.80000001 | H462: 148164855 | I462: 121167534.8 | J462: 291194826.5 | K462: 268809152.5 | L462: 125342232.95 | M462: 102066988.90000001 | N462: =POWER(D462/M462,1/9)-1 -> 0.21452562746492432 | O462: =POWER(D462/I462,1/5)-1 -> 0.37098226212588292
A463: 1286.HK | B463: 鹰普精密 | C463: 2.01 | D463: 585093000 | E463: 581945000 | F463: 382780000 | G463: -148191000 | H463: 538856000 | I463: 409603000 | J463: 401559000 | K463: 339373000 | L463: 331661000 | M463: -- | N463: =POWER(D463/M463,1/9)-1 -> #VALUE! | O463: =POWER(D463/I463,1/5)-1 -> 7.3921048996020255e-02
A464: 1675.HK | B464: 亚信科技 | C464: 6.0999999999999996 | D464: 584283369.60000002 | E464: 938404344.5 | F464: 962125160.5 | G464: 789160565.70000005 | H464: 456850762.5 | I464: 232426972.40000001 | J464: 394156358.5 | K464: -234934918.75 | L464: -123734572.59999999 | M464: -- | N464: =POWER(D464/M464,1/9)-1 -> #VALUE! | O464: =POWER(D464/I464,1/5)-1 -> 0.20245103365558026
A465: 2186.HK | B465: 绿叶制药 | C465: 2.82 | D465: 583841601 | E465: 682282776.70000005 | F465: -164563004 | G465: 842179853.39999998 | H465: 1641118035 | I465: 1484020497.8 | J465: 1176566890.8 | K465: 990722713.75 | L465: 887356774.14999998 | M465: 755633399.60000002 | N465: =POWER(D465/M465,1/9)-1 -> -2.8251753389670786e-02 | O465: =POWER(D465/I465,1/5)-1 -> -0.17020459141587263
A466: 1234.HK | B466: 中国利郎 | C466: 4.15 | D466: 581454077.39999998 | E466: 505457614.10000002 | F466: 573221511.5 | G466: 664176739.79999995 | H466: 907611150 | I466: 855309488.39999998 | J466: 732574657.10000002 | K466: 599923870 | L466: 735225298.25 | M466: 692469693.20000005 | N466: =POWER(D466/M466,1/9)-1 -> -1.9227467724353353e-02 | O466: =POWER(D466/I466,1/5)-1 -> -7.4282601758301925e-02
A467: 0830.HK | B467: 中国建筑兴业 | C467: 2.08 | D467: 580420000 | E467: 421852000 | F467: 291976000 | G467: 194344000 | H467: 175560000 | I467: 182780000 | J467: 123691000 | K467: 88391000 | L467: 71463000 | M467: 57738000 | N467: =POWER(D467/M467,1/9)-1 -> 0.29230348273405782 | O467: =POWER(D467/I467,1/5)-1 -> 0.25997735315231041
A468: 0737.HK | B468: 湾区发展 | C468: 1.78 | D468: 579323064.60000002 | E468: 314257073.19999999 | F468: 871150933 | G468: 820815045.89999998 | H468: 683939055 | I468: 775756093.39999998 | J468: 717721728.14999998 | K468: 593758718.39999998 | L468: 649113302.60000002 | M468: 689925600 | N468: =POWER(D468/M468,1/9)-1 -> -1.9226486644946195e-02 | O468: =POWER(D468/I468,1/5)-1 -> -5.67232614161578e-02
A469: 80737.HK | B469: 湾区发展-R | C469: 1.61 | D469: 579323064.60000002 | E469: 314257073.19999999 | F469: 871150933 | G469: 820815045.89999998 | H469: 683939055 | I469: 775756093.39999998 | J469: 717721728.14999998 | K469: 593758718.39999998 | L469: 649113302.60000002 | M469: 689925600 | N469: =POWER(D469/M469,1/9)-1 -> -1.9226486644946195e-02 | O469: =POWER(D469/I469,1/5)-1 -> -5.67232614161578e-02
A470: 1576.HK | B470: 齐鲁高速 | C470: 2.12 | D470: 575790012 | E470: 881825617.10000002 | F470: 1045029933 | G470: 739902914.39999998 | H470: 577100467.5 | I470: 465123793 | J470: 633201432.79999995 | K470: 492534892.5 | L470: 294360610.80000001 | M470: -- | N470: =POWER(D470/M470,1/9)-1 -> #VALUE! | O470: =POWER(D470/I470,1/5)-1 -> 4.361212016163174e-02
A471: 1272.HK | B471: 大唐环境 | C471: 0.67 | D471: 572627475 | E471: 307322642.5 | F471: -255102534 | G471: 360993136.80000001 | H471: 244667685 | I471: 873005609.60000002 | J471: 1048946383.6 | K471: 1134101745 | L471: 830000815.64999998 | M471: 667888559 | N471: =POWER(D471/M471,1/9)-1 -> -1.6953090979521135e-02 | O471: =POWER(D471/I471,1/5)-1 -> -8.0882511932135803e-02
A472: 3393.HK | B472: 威胜控股 | C472: 5.95 | D472: 571375614.60000002 | E472: 365275395.69999999 | F472: 328268858 | G472: 275555361 | H472: 313533622.5 | I472: 308352236.19999999 | J472: 361558267.5 | K472: 341448231.25 | L472: 498095984.64999998 | M472: 602035628.10000002 | N472: =POWER(D472/M472,1/9)-1 -> -5.7909247078499204e-03 | O472: =POWER(D472/I472,1/5)-1 -> 0.13129253095376292
A473: 9911.HK | B473: 赤子城科技 | C473: 3.3999999999999999 | D473: 562180689 | E473: 146805293.5 | F473: -350554758 | G473: 47304127.200000003 | H473: 76453762.5 | I473: 68016548.200000003 | J473: 38342020.899999999 | K473: 45800168.75 | L473: -- | M473: -- | N473: =POWER(D473/M473,1/9)-1 -> #VALUE! | O473: =POWER(D473/I473,1/5)-1 -> 0.52564070383285566
A474: 1909.HK | B474: 火岩控股 | C474: 0.13 | D474: 559911000 | E474: 30201000 | F474: -1213086000 | G474: 386180000 | H474: 233321982.41 | I474: 102317706.66 | J474: 52030961.590000004 | K474: 24471914.16 | L474: 10265955.67 | M474: 12032159.460000001 | N474: =POWER(D474/M474,1/9)-1 -> 0.53217502917574278 | O474: =POWER(D474/I474,1/5)-1 -> 0.40486191916730818
A475: 0798.HK | B475: 中电光谷 | C475: 0.29 | D475: 555455502 | E475: 604764257.10000002 | F475: 783928573.5 | G475: 553446846 | H475: 636161460 | I475: 616535959.60000002 | J475: 535021114 | K475: 479976656.25 | L475: 587890930.29999995 | M475: 518115601 | N475: =POWER(D475/M475,1/9)-1 -> 7.7622060549658034e-03 | O475: =POWER(D475/I475,1/5)-1 -> -2.0649448560192352e-02
A476: 2798.HK | B476: 久泰邦达能源 | C476: 0.99 | D476: 552696366.60000002 | E476: 839255635.5 | F476: 369517365 | G476: 411777612 | H476: 243638467.5 | I476: 200670279.80000001 | J476: 99267721.099999994 | K476: 56708198.75 | L476: 52169578 | M476: -- | N476: =POWER(D476/M476,1/9)-1 -> #VALUE! | O476: =POWER(D476/I476,1/5)-1 -> 0.22461820319529791
A477: 9997.HK | B477: 康基医疗 | C477: 5.54 | D477: 552507820.20000005 | E477: 540060953.5 | F477: 559338130.5 | G477: 298327802.39999998 | H477: 230701170 | I477: 167033758.59999999 | J477: 141116524.5 | K477: -- | L477: -- | M477: -- | N477: =POWER(D477/M477,1/9)-1 -> #VALUE! | O477: =POWER(D477/I477,1/5)-1 -> 0.27030157084642137
A478: 1205.HK | B478: 中信资源 | C478: 0.45 | D478: 551803000 | E478: 1335537000 | F478: 1103366000 | G478: -363848000 | H478: 631104000 | I478: 1286732000 | J478: 518315000 | K478: 362985000 | L478: -6104909000 | M478: 223830000 | N478: =POWER(D478/M478,1/9)-1 -> 0.10545391039718832 | O478: =POWER(D478/I478,1/5)-1 -> -0.15577309036083775
A479: 1142.HK | B479: 能源及能量环球 | C479: 0.32 | D479: 550211000 | E479: -343499000 | F479: 524584000 | G479: -1475433000 | H479: -61730000 | I479: -509455000 | J479: 1978002000 | K479: -459930000 | L479: -601347000 | M479: -670714000 | N479: =POWER(D479/M479,1/9)-1 -> -1.9782357812877585 | O479: =POWER(D479/I479,1/5)-1 -> -2.0155111307434601
A480: 0719.HK | B480: 山东新华制药股份 | C480: 5.2000000000000002 | D480: 544276675.00999999 | E480: 463867594.38999999 | F480: 426797633.33999997 | G480: 387200106.63999999 | H480: 335212301.93000001 | I480: 290701038.30000001 | J480: 251279737.58000001 | K480: 135874259.58000001 | L480: 97685367.540000007 | M480: 63300115.659999996 | N480: =POWER(D480/M480,1/9)-1 -> 0.27005904942712444 | O480: =POWER(D480/I480,1/5)-1 -> 0.13363860769094749
A481: 3613.HK | B481: 同仁堂国药 | C481: 8.81 | D481: 540393000 | E481: 645875000 | F481: 607838000 | G481: 542456000 | H481: 556118000 | I481: 580720000 | J481: 489967000 | K481: 420315000 | L481: 354249000 | M481: 287124000 | N481: =POWER(D481/M481,1/9)-1 -> 7.2792132538804566e-02 | O481: =POWER(D481/I481,1/5)-1 -> -1.4291307820258559e-02
A482: 3316.HK | B482: 滨江服务 | C482: 16.399999999999999 | D482: 539927829 | E482: 464771559.5 | F482: 393984099.5 | G482: 261681645 | H482: 128156017.5 | I482: 79903532.200000003 | J482: 68544709.700000003 | K482: 24777541.25 | L482: 13488117.449999999 | M482: -- | N482: =POWER(D482/M482,1/9)-1 -> #VALUE! | O482: =POWER(D482/I482,1/5)-1 -> 0.46539244071049612
A483: 3813.HK | B483: 宝胜国际 | C483: 0.59999999999999998 | D483: 537603885 | E483: 100585908.40000001 | F483: 436640781.5 | G483: 360954996 | H483: 931184812.5 | I483: 618132276.79999995 | J483: 472752645.80000001 | K483: 622943413.75 | L483: 466412021.60000002 | M483: 36057644 | N483: =POWER(D483/M483,1/9)-1 -> 0.3501592799361084 | O483: =POWER(D483/I483,1/5)-1 -> -2.7530038406043178e-02
A484: 6626.HK | B484: 越秀服务 | C484: 3.08 | D484: 533871324 | E484: 469401281.89999998 | F484: 440251832 | G484: 237344238.90000001 | H484: -- | I484: -- | J484: -- | K484: -- | L484: -- | M484: -- | N484: =POWER(D484/M484,1/9)-1 -> #VALUE! | O484: =POWER(D484/I484,1/5)-1 -> #VALUE!
A485: 0558.HK | B485: 力劲科技 | C485: 2.97 | D485: 532235000 | E485: 625509000 | F485: 343667000 | G485: 3278000 | H485: 190676000 | I485: 241669000 | J485: 136789000 | K485: 710000 | L485: 105159000 | M485: 70624000 | N485: =POWER(D485/M485,1/9)-1 -> 0.25158755300330782 | O485: =POWER(D485/I485,1/5)-1 -> 0.1710528546855421
A486: 3888.HK | B486: 金山软件 | C486: 22.15 | D486: 529965563.39999998 | E486: -6822967651.3999996 | F486: 484084034 | G486: 11972686751.700001 | H486: -1728085237.5 | I486: 443159060.39999998 | J486: 3838682379.3000002 | K486: -300850935 | L486: 434171786.89999998 | M486: 959364305.70000005 | N486: =POWER(D486/M486,1/9)-1 -> -6.3812846947206237e-02 | O486: =POWER(D486/I486,1/5)-1 -> 3.6424339676817796e-02
A487: 1600.HK | B487: 天伦燃气 | C487: 3.58 | D487: 525695864.39999998 | E487: 501551003.80000001 | F487: 1225322864 | G487: 1243761952.8 | H487: 881907532.5 | I487: 648025081.20000005 | J487: 484655325 | K487: 348242413.75 | L487: 334282804.10000002 | M487: 274728928.69999999 | N487: =POWER(D487/M487,1/9)-1 -> 7.4767346090164555e-02 | O487: =POWER(D487/I487,1/5)-1 -> -4.0978046266063495e-02
A488: 0672.HK | B488: 众安集团 | C488: 0.11 | D488: 525564320.39999998 | E488: 210654625.40000001 | F488: 89550134 | G488: 986743020.60000002 | H488: 712008420 | I488: 326642706.60000002 | J488: 656319821.5 | K488: 139208510 | L488: 494656038.39999998 | M488: 398984827.5 | N488: =POWER(D488/M488,1/9)-1 -> 3.1090084254292494e-02 | O488: =POWER(D488/I488,1/5)-1 -> 9.9792064461995178e-02
A489: 0906.HK | B489: 中粮包装 | C489: 7.05 | D489: 520431912 | E489: 548834187.20000005 | F489: 566328801 | G489: 464111557.19999999 | H489: 337585575 | I489: 290412454.60000002 | J489: 372271637.89999998 | K489: 326786398.75 | L489: 332702192.89999998 | M489: 431592454.5 | N489: =POWER(D489/M489,1/9)-1 -> 2.1015254258616167e-02 | O489: =POWER(D489/I489,1/5)-1 -> 0.12375008159047485
A490: 0032.HK | B490: 港通控股 | C490: 7.21 | D490: 519974000 | E490: -445250000 | F490: -49245000 | G490: 725243000 | H490: 727306000 | I490: 447391000 | J490: 1180048000 | K490: 410426000 | L490: 619808000 | M490: 472214000 | N490: =POWER(D490/M490,1/9)-1 -> 1.0762676210905431e-02 | O490: =POWER(D490/I490,1/5)-1 -> 3.0525818667657356e-02
A491: 0331.HK | B491: 丰盛生活服务 | C491: 5.55 | D491: 514448000 | E491: 494481000 | F491: 578457000 | G491: 407588000 | H491: 307374000 | I491: 236784000 | J491: 225396000 | K491: 163211000 | L491: 149151000 | M491: 131200000 | N491: =POWER(D491/M491,1/9)-1 -> 0.16394962069664754 | O491: =POWER(D491/I491,1/5)-1 -> 0.16787893746283067
A492: 2156.HK | B492: 建发物业 | C492: 2.78 | D492: 512305781.39999998 | E492: 278879857.19999999 | F492: 195153463 | G492: 126482044.2 | H492: 76192267.5 | I492: 54464931 | J492: 36866175 | K492: -- | L492: -- | M492: -- | N492: =POWER(D492/M492,1/9)-1 -> #VALUE! | O492: =POWER(D492/I492,1/5)-1 -> 0.56560593798835512
A493: 2145.HK | B493: 上美股份 | C493: 38 | D493: 505462204.80000001 | E493: 165948022.40000001 | F493: 414967131.5 | G493: 242500398.30000001 | H493: -- | I493: -- | J493: -- | K493: -- | L493: -- | M493: -- | N493: =POWER(D493/M493,1/9)-1 -> #VALUE! | O493: =POWER(D493/I493,1/5)-1 -> #VALUE!
A494: 3319.HK | B494: 雅生活服务 | C494: 2.74 | D494: 505211175 | E494: 2075253888.0999999 | F494: 2826706821 | G494: 2091082470.9000001 | H494: 1375378770 | I494: 912069837 | J494: 347353700.30000001 | K494: 178544537.5 | L494: 76403264.299999997 | M494: 51917631.600000001 | N494: =POWER(D494/M494,1/9)-1 -> 0.28764261614189834 | O494: =POWER(D494/I494,1/5)-1 -> -0.11143547401924125
A495: 2003.HK | B495: 维信金科 | C495: 2.31 | D495: 497571757.19999999 | E495: 600674894.60000002 | F495: 1444022237.5 | G495: -1036453593.9 | H495: 72402825 | I495: -1169288685.8 | J495: -1202656153.7 | K495: -627911812.5 | L495: -356511325.14999998 | M495: -- | N495: =POWER(D495/M495,1/9)-1 -> #VALUE! | O495: =POWER(D495/I495,1/5)-1 -> -1.8429208467957077
A496: 1164.HK | B496: 中广核矿业 | C496: 2.23 | D496: 497099000 | E496: 514915000 | F496: 178498000 | G496: 155217000 | H496: 160009000 | I496: 122066000 | J496: 52078000 | K496: 389130000 | L496: 297981000 | M496: -41706000 | N496: =POWER(D496/M496,1/9)-1 -> -2.3169906922428334 | O496: =POWER(D496/I496,1/5)-1 -> 0.32424894382033487
A497: 9922.HK | B497: 九毛九 | C497: 3.41 | D497: 497085044.39999998 | E497: 55592768 | F497: 416251632 | G497: 147870689.69999999 | H497: 183732645 | I497: 79301212.799999997 | J497: 80159652.900000006 | K497: 57631647.5 | L497: -- | M497: -- | N497: =POWER(D497/M497,1/9)-1 -> #VALUE! | O497: =POWER(D497/I497,1/5)-1 -> 0.44354449051097622
A498: 9909.HK | B498: 宝龙商业 | C498: 2.86 | D498: 496525982.39999998 | E498: 499832907.5 | F498: 536507328 | G498: 363605781.60000002 | H498: 199601145 | I498: 151824339.80000001 | J498: 94223948.799999997 | K498: 69938741.25 | L498: -- | M498: -- | N498: =POWER(D498/M498,1/9)-1 -> #VALUE! | O498: =POWER(D498/I498,1/5)-1 -> 0.26741871465546874
A499: 0563.HK | B499: 上实城市开发 | C499: 0.42 | D499: 494570000 | E499: 406823000 | F499: 572328000 | G499: 521765000 | H499: 600292000 | I499: 573074000 | J499: 536109000 | K499: 521888000 | L499: 517385000 | M499: 161181000 | N499: =POWER(D499/M499,1/9)-1 -> 0.13266517278319201 | O499: =POWER(D499/I499,1/5)-1 -> -2.9035363486924592e-02
A500: 1899.HK | B500: 兴达国际 | C500: 1.29 | D500: 492633376.19999999 | E500: 393019887.10000002 | F500: 267987947.5 | G500: 137063732.40000001 | H500: 322680360 | I500: 300206691.80000001 | J500: 344519500.69999999 | K500: 308696360 | L500: 204343391.69999999 | M500: 409046645.19999999 | N500: =POWER(D500/M500,1/9)-1 -> 2.087444621145873e-02 | O500: =POWER(D500/I500,1/5)-1 -> 0.10413122685455956
A501: 9878.HK | B501: 汇通达网络 | C501: 21 | D501: 491399055 | E501: 342910813.19999999 | F501: -268854893.5 | G501: -289797374.10000002 | H501: -- | I501: -- | J501: -- | K501: -- | L501: -- | M501: -- | N501: =POWER(D501/M501,1/9)-1 -> #VALUE! | O501: =POWER(D501/I501,1/5)-1 -> #VALUE!
A502: 1755.HK | B502: 新城悦服务 | C502: 2.88 | D502: 487858329 | E502: 477723275.60000002 | F502: 643419647.5 | G502: 539200065.29999995 | H502: 315147292.5 | I502: 173242544.40000001 | J502: 88006453.400000006 | K502: 48153796.25 | L502: 26118894.449999999 | M502: -- | N502: =POWER(D502/M502,1/9)-1 -> #VALUE! | O502: =POWER(D502/I502,1/5)-1 -> 0.23006435626253952
A503: 3798.HK | B503: 家乡互动 | C503: 1.36 | D503: 478969243.19999999 | E503: 524875599.39999998 | F503: 613123068.5 | G503: 465799287.60000002 | H503: 231085590 | I503: 232378012.59999999 | J503: 142152374.09999999 | K503: 25843230 | L503: 13334054.9 | M503: -- | N503: =POWER(D503/M503,1/9)-1 -> #VALUE! | O503: =POWER(D503/I503,1/5)-1 -> 0.15563987501590315
A504: 1995.HK | B504: 永升服务 | C504: 1.55 | D504: 476268206.39999998 | E504: 541613219.10000002 | F504: 755533643 | G504: 465284386.80000001 | H504: 250146787.5 | I504: 114453210.59999999 | J504: 91646313.799999997 | K504: 37338000 | L504: 18301690.100000001 | M504: -- | N504: =POWER(D504/M504,1/9)-1 -> #VALUE! | O504: =POWER(D504/I504,1/5)-1 -> 0.32997881187854361
A505: 0710.HK | B505: 京东方精电 | C505: 4.47 | D505: 475260000 | E505: 582451000 | F505: 327798000 | G505: 68639000 | H505: 25020000 | I505: 17133000 | J505: 22113000 | K505: 50523000 | L505: 300605000 | M505: 250442000 | N505: =POWER(D505/M505,1/9)-1 -> 7.3776237648454313e-02 | O505: =POWER(D505/I505,1/5)-1 -> 0.94365674485437112
A506: 0240.HK | B506: 利基控股 | C506: 0.99 | D506: 473518000 | E506: 434327000 | F506: 294539000 | G506: 440907000 | H506: 296419000 | I506: 412188000 | J506: 184230000 | K506: 150506000 | L506: 94307000 | M506: 55203000 | N506: =POWER(D506/M506,1/9)-1 -> 0.26972070449126884 | O506: =POWER(D506/I506,1/5)-1 -> 2.8130468791966345e-02
A507: 9616.HK | B507: 东软教育 | C507: 2.95 | D507: 470861748 | E507: 434761843.30000001 | F507: 348029839 | G507: 88493807.400000006 | H507: 155570527.5 | I507: 150284952.59999999 | J507: 137655300.19999999 | K507: 68559680 | L507: -- | M507: -- | N507: =POWER(D507/M507,1/9)-1 -> #VALUE! | O507: =POWER(D507/I507,1/5)-1 -> 0.25659573796029811
A508: 0818.HK | B508: 高阳科技 | C508: 0.37 | D508: 463432000 | E508: 939416000 | F508: 3521526000 | G508: 656685000 | H508: 569111000 | I508: 278175000 | J508: 346144000 | K508: 283964000 | L508: 183486000 | M508: 397071000 | N508: =POWER(D508/M508,1/9)-1 -> 1.7319897346163238e-02 | O508: =POWER(D508/I508,1/5)-1 -> 0.10747411530234285
A509: 9879.HK | B509: 米高集团 | C509: 6.99 | D509: 462996472.55000001 | E509: -- | F509: -- | G509: -- | H509: -- | I509: -- | J509: -- | K509: -- | L509: -- | M509: -- | N509: =POWER(D509/M509,1/9)-1 -> #VALUE! | O509: =POWER(D509/I509,1/5)-1 -> #VALUE!
A510: 2233.HK | B510: 西部水泥 | C510: 1.11 | D510: 461804943.60000002 | E510: 1370354962.5999999 | F510: 1940918215 | G510: 1859936112 | H510: 2012931517.5 | I510: 1320148631.4000001 | J510: 852229672.70000005 | K510: 11466988.75 | L510: -363640540.25 | M510: 44802105.799999997 | N510: =POWER(D510/M510,1/9)-1 -> 0.29590555064195367 | O510: =POWER(D510/I510,1/5)-1 -> -0.18947362879038365
A511: 6181.HK | B511: 老铺黄金 | C511: 81.5 | D511: 456350252.39999998 | E511: -- | F511: -- | G511: -- | H511: -- | I511: -- | J511: -- | K511: -- | L511: -- | M511: -- | N511: =POWER(D511/M511,1/9)-1 -> #VALUE! | O511: =POWER(D511/I511,1/5)-1 -> #VALUE!
A512: 6826.HK | B512: 昊海生物科技 | C512: 32.100000000000001 | D512: 456151840.19999999 | E512: 203588207 | F512: 431310533 | G512: 274222816.80000001 | H512: 414345532.5 | I512: 471995244 | J512: 446488343.5 | K512: 338989035 | L512: 321619097.69999999 | M512: 229091977.80000001 | N512: =POWER(D512/M512,1/9)-1 -> 7.9526439141731409e-02 | O512: =POWER(D512/I512,1/5)-1 -> -6.8053723116059395e-03
A513: 0480.HK | B513: 香港兴业国际 | C513: 1.21 | D513: 455600000 | E513: 1097300000 | F513: 897300000 | G513: 1624600000 | H513: 2206900000 | I513: 2305100000 | J513: 823900000 | K513: 783900000 | L513: 910000000 | M513: 834600000 | N513: =POWER(D513/M513,1/9)-1 -> -6.5047641123567423e-02 | O513: =POWER(D513/I513,1/5)-1 -> -0.27693258762676098
A514: 6127.HK | B514: 昭衍新药 | C514: 7.28 | D514: 435183726.60000002 | E514: 1211869321.7 | F514: 682609770 | G514: 373005105 | H514: 209908965 | I514: 120089280.59999999 | J514: 95812491.299999997 | K514: -- | L514: -- | M514: -- | N514: =POWER(D514/M514,1/9)-1 -> #VALUE! | O514: =POWER(D514/I514,1/5)-1 -> 0.29370030558845306
A515: 1108.HK | B515: 凯盛新能 | C515: 4.12 | D515: 432692677 | E515: 461436502.98000002 | F515: 313172848.56 | G515: 444413675.70999998 | H515: 60344870.049999997 | I515: 17813750.5 | J515: 105110275.91 | K515: 12797225.880000001 | L515: -217281259.75 | M515: 26404580.550000001 | N515: =POWER(D515/M515,1/9)-1 -> 0.36440868341441424 | O515: =POWER(D515/I515,1/5)-1 -> 0.89271330903421053
A516: 2002.HK | B516: 阳光纸业 | C516: 2.12 | D516: 431145325.80000001 | E516: 232082884.90000001 | F516: 681582414.5 | G516: 593220549 | H516: 391122765 | I516: 379098008.60000002 | J516: 474801565.89999998 | K516: 136807098.75 | L516: 60281970.899999999 | M516: -47377771.399999999 | N516: =POWER(D516/M516,1/9)-1 -> -2.2780887320078183 | O516: =POWER(D516/I516,1/5)-1 -> 2.606396546395251e-02
A517: 9956.HK | B517: 安能物流 | C517: 7.34 | D517: 430125859.80000001 | E517: -460745370.60000002 | F517: -2466814026 | G517: 259980803.69999999 | H517: -- | I517: -- | J517: -- | K517: -- | L517: -- | M517: -- | N517: =POWER(D517/M517,1/9)-1 -> #VALUE! | O517: =POWER(D517/I517,1/5)-1 -> #VALUE!
A518: 0214.HK | B518: 汇汉控股 | C518: 0.37 | D518: 428738000 | E518: -905830000 | F518: 1006781000 | G518: 553577000 | H518: 810091000 | I518: 814381000 | J518: 1010889000 | K518: 549704000 | L518: 513254000 | M518: 773883000 | N518: =POWER(D518/M518,1/9)-1 -> -6.3512785816166817e-02 | O518: =POWER(D518/I518,1/5)-1 -> -0.12042501620839463
A519: 1935.HK | B519: 嘉宏教育 | C519: 0.74 | D519: 425540455.19999999 | E519: 413704728.69999999 | F519: 399231082 | G519: 316964350.80000001 | H519: 196427445 | I519: 177673975.59999999 | J519: 146271794.5 | K519: 107271185 | L519: 134294325.55000001 | M519: -- | N519: =POWER(D519/M519,1/9)-1 -> #VALUE! | O519: =POWER(D519/I519,1/5)-1 -> 0.1908674003381432
A520: 6190.HK | B520: 九江银行 | C520: 6.16 | D520: 424867388.39999998 | E520: 1822012359.5999999 | F520: 2116562944 | G520: 1993878258.3 | H520: 2053082175 | I520: 2001303556.8 | J520: 2117790910.5 | K520: 1753908100 | L520: 2096954776.45 | M520: -- | N520: =POWER(D520/M520,1/9)-1 -> #VALUE! | O520: =POWER(D520/I520,1/5)-1 -> -0.26652032143745719
A521: 3700.HK | B521: 映宇宙 | C521: 0.72 | D521: 423713089.80000001 | E521: -187378538.09999999 | F521: 508634034.5 | G521: 231116561.40000001 | H521: 61386510 | I521: 1255432884.5999999 | J521: -287031046.80000001 | K521: -1630343767.5 | L521: -- | M521: -- | N521: =POWER(D521/M521,1/9)-1 -> #VALUE! | O521: =POWER(D521/I521,1/5)-1 -> -0.19525983798605684
A522: 1756.HK | B522: 中国职业教育 | C522: 0.58 | D522: 422505872.64999998 | E522: 295322451.19999999 | F522: 172889613.84999999 | G522: 346765971.75 | H522: 244187066.09999999 | I522: 221842732.5 | J522: 228920220.59999999 | K522: 235597369 | L522: 258280491 | M522: -- | N522: =POWER(D522/M522,1/9)-1 -> #VALUE! | O522: =POWER(D522/I522,1/5)-1 -> 0.13751598621461159
A523: 0989.HK | B523: 华音国际控股 | C523: 0.04 | D523: 418329986.55000001 | E523: -70245920 | F523: -610124415.75 | G523: -1947911877.0999999 | H523: 26899291.199999999 | I523: 62899883.100000001 | J523: 79918217.700000003 | K523: -141480375.30000001 | L523: -22713000 | M523: -3850000 | N523: =POWER(D523/M523,1/9)-1 -> -2.6835603784477424 | O523: =POWER(D523/I523,1/5)-1 -> 0.46074306002997001
A524: 1357.HK | B524: 美图公司 | C524: 2.39 | D524: 414684786.60000002 | E524: 106201590.2 | F524: -54507393 | G524: -48832143 | H524: -443113335 | I524: -1428415828.2 | J524: -236571743.59999999 | K524: -6957402900 | L524: -2607957909.8499999 | M524: -2211698094.4000001 | N524: =POWER(D524/M524,1/9)-1 -> -1.8302738545153603 | O524: =POWER(D524/I524,1/5)-1 -> -1.7808591250316712
A525: 1763.HK | B525: 中国同辐 | C525: 10.699999999999999 | D525: 406654025.39999998 | E525: 441769600.5 | F525: 411127099.5 | G525: 254568385.80000001 | H525: 367691025 | I525: 366518755.80000001 | J525: 325446200.60000002 | K525: 291267515 | L525: 298957790.25 | M525: 298926957.60000002 | N525: =POWER(D525/M525,1/9)-1 -> 3.4787348720888955e-02 | O525: =POWER(D525/I525,1/5)-1 -> 2.1000075987062106e-02
A526: 0826.HK | B526: 天工国际 | C526: 1.79 | D526: 405823105.80000001 | E526: 568037833.5 | F526: 813522289.5 | G526: 640078905.60000002 | H526: 441575655 | I526: 294709531 | J526: 202732791.09999999 | K526: 122872023.75 | L526: 85408279.150000006 | M526: 578359221.39999998 | N526: =POWER(D526/M526,1/9)-1 -> -3.8599496822472323e-02 | O526: =POWER(D526/I526,1/5)-1 -> 6.6076862512345791e-02
A527: 3600.HK | B527: 现代牙科 | C527: 4.15 | D527: 404102000 | E527: 220458000 | F527: 360825000 | G527: 107763000 | H527: 161557000 | I527: 85391000 | J527: 155371000 | K527: 101483000 | L527: 81963000 | M527: 120186000 | N527: =POWER(D527/M527,1/9)-1 -> 0.144235019781211 | O527: =POWER(D527/I527,1/5)-1 -> 0.36463271954895227
A528: 1184.HK | B528: 时捷集团 | C528: 3.86 | D528: 403801000 | E528: 400337000 | F528: 713191000 | G528: 261897000 | H528: 236435000 | I528: 313095000 | J528: 303003000 | K528: 201842000 | L528: 80530000 | M528: 145479000 | N528: =POWER(D528/M528,1/9)-1 -> 0.12011602161814872 | O528: =POWER(D528/I528,1/5)-1 -> 5.2199888868818656e-02
A529: 0697.HK | B529: 首程控股 | C529: 1.34 | D529: 403565000 | E529: 922010000 | F529: -1095327000 | G529: 658613000 | H529: 443003000 | I529: 353097000 | J529: 57286000 | K529: -1621162000 | L529: -3349310000 | M529: -1640708000 | N529: =POWER(D529/M529,1/9)-1 -> -1.8556974627811398 | O529: =POWER(D529/I529,1/5)-1 -> 2.7079103354699763e-02
A530: 0062.HK | B530: 载通 | C530: 9.19 | D530: 401663000 | E530: 143640000 | F530: 245044000 | G530: 1904114000 | H530: 605311000 | I530: 720072000 | J530: 1294834000 | K530: 830873000 | L530: 628711000 | M530: 415072000 | N530: =POWER(D530/M530,1/9)-1 -> -3.6420815369220261e-03 | O530: =POWER(D530/I530,1/5)-1 -> -0.11019020776388611
A531: 0746.HK | B531: 理文化工 | C531: 3.7999999999999998 | D531: 400665000 | E531: 1156775000 | F531: 1288009000 | G531: 502628000 | H531: 700771000 | I531: 872641000 | J531: 703053000 | K531: 216195000 | L531: 269678000 | M531: 330111000 | N531: =POWER(D531/M531,1/9)-1 -> 2.1755121703305402e-02 | O531: =POWER(D531/I531,1/5)-1 -> -0.14416674363726878
A532: 1526.HK | B532: 瑞慈医疗 | C532: 1.17 | D532: 398800848.60000002 | E532: 328043583.30000001 | F532: 222311648.5 | G532: -9387404.4000000004 | H532: -77289652.5 | I532: -61297669.600000001 | J532: -74530817.400000006 | K532: 65479295 | L532: 34084281.100000001 | M532: 10381280.1 | N532: =POWER(D532/M532,1/9)-1 -> 0.49987867143416631 | O532: =POWER(D532/I532,1/5)-1 -> -2.4543281886952593
A533: 0376.HK | B533: 云锋金融 | C533: 0.90000000000000002 | D533: 397164000 | E533: -256400000 | F533: 513414000 | G533: 618315000 | H533: 255619000 | I533: -195612000 | J533: -379054000 | K533: -316688000 | L533: -152419000 | M533: 758856000 | N533: =POWER(D533/M533,1/9)-1 -> -6.9413554225645435e-02 | O533: =POWER(D533/I533,1/5)-1 -> -2.1521655259150485
A534: 2411.HK | B534: 百果园集团 | C534: 1.89 | D534: 396514175.39999998 | E534: 364711345.69999999 | F534: 282057452.5 | G534: 58478189.700000003 | H534: -- | I534: -- | J534: -- | K534: -- | L534: -- | M534: -- | N534: =POWER(D534/M534,1/9)-1 -> #VALUE! | O534: =POWER(D534/I534,1/5)-1 -> #VALUE!
A535: 2039.HK | B535: 中集集团 | C535: 5.96 | D535: 391397113.80000001 | E535: 3569072627.0999999 | F535: 7947067449.5 | G535: 6049648164.6000004 | H535: 1723437555 | I535: 3848964429.5999999 | J535: 3008330233.8000002 | K535: 466578315 | L535: 2322361223.6500001 | M535: 3092049115.8000002 | N535: =POWER(D535/M535,1/9)-1 -> -0.20518972924080425 | O535: =POWER(D535/I535,1/5)-1 -> -0.36692561138069613
A536: 2299.HK | B536: 百宏实业 | C536: 4.2000000000000002 | D536: 387394887.60000002 | E536: 739828285.79999995 | F536: 2154790609.5 | G536: 931448395.79999995 | H536: 953475585 | I536: 881299172 | J536: 618803842.70000005 | K536: 350433798.75 | L536: 237430382.40000001 | M536: 254003805.5 | N536: =POWER(D536/M536,1/9)-1 -> 4.8016655403700259e-02 | O536: =POWER(D536/I536,1/5)-1 -> -0.15158936353167707
A537: 1050.HK | B537: 嘉利国际 | C537: 0.84 | D537: 386173000 | E537: 549102000 | F537: 445328000 | G537: 250266000 | H537: 221386000 | I537: 182563000 | J537: 168333000 | K537: 117076000 | L537: 76298000 | M537: 34291000 | N537: =POWER(D537/M537,1/9)-1 -> 0.30871367217710821 | O537: =POWER(D537/I537,1/5)-1 -> 0.1616460725747797
A538: 2199.HK | B538: 维珍妮 | C538: 2.37 | D538: 383258000 | E538: 520694000 | F538: 125515000 | G538: 289953000 | H538: 282438000 | I538: 240188000 | J538: 97635000 | K538: 442054000 | L538: 337806000 | M538: 166911000 | N538: =POWER(D538/M538,1/9)-1 -> 9.6760517375291677e-02 | O538: =POWER(D538/I538,1/5)-1 -> 9.7963706466890565e-02
A539: 0951.HK | B539: 超威动力 | C539: 1.41 | D539: 380960193.60000002 | E539: 470621886.10000002 | F539: 632171390.5 | G539: 858641184.29999995 | H539: 627297450 | I539: 469916160.39999998 | J539: 545278902.39999998 | K539: 559843305 | L539: 390059327.44999999 | M539: -36132944.5 | N539: =POWER(D539/M539,1/9)-1 -> -2.2991641480445102 | O539: =POWER(D539/I539,1/5)-1 -> -4.1103256730261384e-02
A540: 1250.HK | B540: 山高新能源 | C540: 1.65 | D540: 378198000 | E540: 258236000 | F540: -391579000 | G540: 686502000 | H540: 682864000 | I540: 1268645000 | J540: 1560348000 | K540: 505101000 | L540: 38492000 | M540: 35900835.100000001 | N540: =POWER(D540/M540,1/9)-1 -> 0.29904397503282487 | O540: =POWER(D540/I540,1/5)-1 -> -0.21498885397952261
A541: 1951.HK | B541: 锦欣生殖 | C541: 2.54 | D541: 377885352.60000002 | E541: 136639984.40000001 | F541: 416208774.5 | G541: 299908261.80000001 | H541: 457753702.5 | I541: 189690760 | J541: 118430938.7 | K541: 97327720 | L541: -- | M541: -- | N541: =POWER(D541/M541,1/9)-1 -> #VALUE! | O541: =POWER(D541/I541,1/5)-1 -> 0.14779089772650589
A542: 0535.HK | B542: 金地商置 | C542: 0.23 | D542: 375687471.60000002 | E542: 2606621703 | F542: 4915425859.5 | G542: 5190185761.1999998 | H542: 4246084290 | I542: 2564835409.1999998 | J542: 1970426918.0999999 | K542: 1518536460 | L542: 1242146362.0999999 | M542: 450347143.60000002 | N542: =POWER(D542/M542,1/9)-1 -> -1.9938665817910817e-02 | O542: =POWER(D542/I542,1/5)-1 -> -0.3189900734299046
A543: 0900.HK | B543: Aeon信贷 | C543: 5.7000000000000002 | D543: 373611000 | E543: 342592000 | F543: 301575000 | G543: 370083000 | H543: 437254000 | I543: 371148000 | J543: 298796000 | K543: 249967000 | L543: -- | M543: 221948000 | N543: =POWER(D543/M543,1/9)-1 -> 5.957041676162711e-02 | O543: =POWER(D543/I543,1/5)-1 -> 1.3237242072721145e-03
A544: 6608.HK | B544: 百融云-W | C544: 9 | D544: 373211155.80000001 | E544: 270361574.10000002 | F544: -4411893092 | G544: -131770504.5 | H544: -- | I544: -- | J544: -- | K544: -- | L544: -- | M544: -- | N544: =POWER(D544/M544,1/9)-1 -> #VALUE! | O544: =POWER(D544/I544,1/5)-1 -> #VALUE!
A545: 0207.HK | B545: 大悦城地产 | C545: 0.20000000000000001 | D545: 372737597.39999998 | E545: 598765021.29999995 | F545: 724495017 | G545: 1316492882.7 | H545: 1828124955 | I545: 2394784360.5999999 | J545: 1382525921.8 | K545: 886311886.25 | L545: 853985179.35000002 | M545: 2134146101 | N545: =POWER(D545/M545,1/9)-1 -> -0.17624574162494466 | O545: =POWER(D545/I545,1/5)-1 -> -0.31066971744274774
A546: 1713.HK | B546: 四川能投发展 | C546: 2.03 | D546: 371611439.49000001 | E546: 340056308.06 | F546: 330073392.64999998 | G546: 305159699.22000003 | H546: 196958257.5 | I546: 192594190 | J546: 150235357.90000001 | K546: 129577306.25 | L546: 115426955.40000001 | M546: 124365714 | N546: =POWER(D546/M546,1/9)-1 -> 0.12933017953692216 | O546: =POWER(D546/I546,1/5)-1 -> 0.14048395200316843
A547: 0816.HK | B547: 金茂服务 | C547: 2.56 | D547: 369764703 | E547: 379043856.19999999 | F547: 217932836.5 | G547: 91924095.599999994 | H547: -- | I547: -- | J547: -- | K547: -- | L547: -- | M547: -- | N547: =POWER(D547/M547,1/9)-1 -> #VALUE! | O547: =POWER(D547/I547,1/5)-1 -> #VALUE!
A548: 3939.HK | B548: 万国国际矿业 | C548: 7.2999999999999998 | D548: 367651229.39999998 | E548: 203667174 | F548: 236857484 | G548: 103350840.90000001 | H548: 62064832.5 | I548: 82144297 | J548: 84958849.599999994 | K548: 24416385 | L548: 19490676.649999999 | M548: 30008251.300000001 | N548: =POWER(D548/M548,1/9)-1 -> 0.32102364986013776 | O548: =POWER(D548/I548,1/5)-1 -> 0.34949637117622534
A549: 1415.HK | B549: 高伟电子 | C549: 23.5 | D549: 363906679 | E549: 658253440 | F549: 388379390 | G549: 328882260 | H549: 228003360 | I549: 108939604 | J549: 215814866 | K549: 220950230 | L549: 470300340 | M549: 412960464 | N549: =POWER(D549/M549,1/9)-1 -> -1.3952241578077507e-02 | O549: =POWER(D549/I549,1/5)-1 -> 0.27280199352848333
A550: 1823.HK | B550: 华昱高速 | C550: 0.65 | D550: 361123358.39999998 | E550: 55308486.799999997 | F550: 105828637 | G550: 73911000 | H550: 50420000 | I550: 76580000 | J550: 15845000 | K550: -10477000 | L550: -180707000 | M550: -2351000 | N550: =POWER(D550/M550,1/9)-1 -> -2.7495794189930418 | O550: =POWER(D550/I550,1/5)-1 -> 0.3636660981641795
A551: 1773.HK | B551: 天立国际控股 | C551: 4.19 | D551: 358849483.55000001 | E551: 109745535.2 | F551: -- | G551: 451480992.89999998 | H551: 296077155 | I551: 221722993.80000001 | J551: 157317260.19999999 | K551: 79026543.75 | L551: 19488324.550000001 | M551: -- | N551: =POWER(D551/M551,1/9)-1 -> #VALUE! | O551: =POWER(D551/I551,1/5)-1 -> 0.10108366132355151
A552: 2276.HK | B552: 康耐特光学 | C552: 11.98 | D552: 358481516.39999998 | E552: 280407304.60000002 | F552: 224722689 | G552: 153113857.80000001 | H552: -- | I552: -- | J552: -- | K552: -- | L552: -- | M552: -- | N552: =POWER(D552/M552,1/9)-1 -> #VALUE! | O552: =POWER(D552/I552,1/5)-1 -> #VALUE!
A553: 2348.HK | B553: 东瑞制药 | C553: 1.19 | D553: 357361200 | E553: 403924101.69999999 | F553: 438585287.5 | G553: 319584147 | H553: 285443025 | I553: 346088856 | J553: 351251324.19999999 | K553: 295500266.25 | L553: 355399957.89999998 | M553: 256000445.5 | N553: =POWER(D553/M553,1/9)-1 -> 3.7758495601100783e-02 | O553: =POWER(D553/I553,1/5)-1 -> 6.430886656457524e-03
A554: 6929.HK | B554: 业聚医疗 | C554: 3.45 | D554: 352065203 | E554: 144377728 | F554: -34654312 | G554: 54821463 | H554: -- | I554: -- | J554: -- | K554: -- | L554: -- | M554: -- | N554: =POWER(D554/M554,1/9)-1 -> #VALUE! | O554: =POWER(D554/I554,1/5)-1 -> #VALUE!
A555: 3330.HK | B555: 灵宝黄金 | C555: 3.34 | D555: 348681488.39999998 | E555: 270994438.19999999 | F555: 159216837 | G555: 106913430 | H555: -260938485 | I555: 906510053.20000005 | J555: 95712982.599999994 | K555: -86072980 | L555: -543525620.10000002 | M555: 42038007.299999997 | N555: =POWER(D555/M555,1/9)-1 -> 0.26499095112179982 | O555: =POWER(D555/I555,1/5)-1 -> -0.1739406461579559
A556: 1760.HK | B556: 英恒科技 | C556: 1.58 | D556: 347929495.19999999 | E556: 468119760.30000001 | F556: 245642047 | G556: 112992120 | H556: 132662895 | I556: 184765176.40000001 | J556: 146752553.40000001 | K556: 104230805 | L556: 102767953.2 | M556: -- | N556: =POWER(D556/M556,1/9)-1 -> #VALUE! | O556: =POWER(D556/I556,1/5)-1 -> 0.13494345628162674
A557: 3768.HK | B557: 滇池水务 | C557: 0.65 | D557: 346953877.19999999 | E557: 363530225 | F557: 414221411 | G557: 415433169.30000001 | H557: 411699292.5 | I557: 396857891.39999998 | J557: 375348015.30000001 | K557: 305585971.25 | L557: 279442416.55000001 | M557: 306375672.69999999 | N557: =POWER(D557/M557,1/9)-1 -> 1.3915916785835813e-02 | O557: =POWER(D557/I557,1/5)-1 -> -2.651930182236184e-02
A558: 2111.HK | B558: 超盈国际控股 | C558: 2.21 | D558: 346918000 | E558: 299199000 | F558: 401794000 | G558: 257769000 | H558: 300724000 | I558: 283553000 | J558: 304219000 | K558: 456251000 | L558: 342383000 | M558: 246904000 | N558: =POWER(D558/M558,1/9)-1 -> 3.8510680988719015e-02 | O558: =POWER(D558/I558,1/5)-1 -> 4.1162499887734016e-02
A559: 0662.HK | B559: 亚洲金融 | C559: 3.7000000000000002 | D559: 346753000 | E559: 199911000 | F559: 677618000 | G559: 337952000 | H559: 408965000 | I559: 255889000 | J559: 477098000 | K559: 367271000 | L559: 186063000 | M559: 365507000 | N559: =POWER(D559/M559,1/9)-1 -> -5.8354317767753683e-03 | O559: =POWER(D559/I559,1/5)-1 -> 6.2658503914133856e-02
A560: 0709.HK | B560: 佐丹奴国际 | C560: 1.61 | D560: 345000000 | E560: 268000000 | F560: 190000000 | G560: -112000000 | H560: 230000000 | I560: 480000000 | J560: 500000000 | K560: 434000000 | L560: 426000000 | M560: 408000000 | N560: =POWER(D560/M560,1/9)-1 -> -1.8463287939820772e-02 | O560: =POWER(D560/I560,1/5)-1 -> -6.3914384722571271e-02
A561: 2000.HK | B561: 晨讯科技 | C561: 0.44 | D561: 344285000 | E561: -509453000 | F561: -245800000 | G561: -38323000 | H561: -76938000 | I561: 238012000 | J561: 111651000 | K561: 77278000 | L561: 64645000 | M561: 23967000 | N561: =POWER(D561/M561,1/9)-1 -> 0.34458846324632075 | O561: =POWER(D561/I561,1/5)-1 -> 7.6623486165961374e-02
A562: 0034.HK | B562: 九龙建业 | C562: 4.84 | D562: 337195000 | E562: 1214934000 | F562: 2209081000 | G562: 800868000 | H562: 2449733000 | I562: 2193309000 | J562: 1635026000 | K562: 946737000 | L562: 1202040000 | M562: 1040717000 | N562: =POWER(D562/M562,1/9)-1 -> -0.11769955658141806 | O562: =POWER(D562/I562,1/5)-1 -> -0.31236771174282008
A563: 1992.HK | B563: 复星旅游文化 | C563: 3.78 | D563: 336751543.80000001 | E563: -614701690 | F563: -3328978353.5 | G563: -3068283140.0999999 | H563: 680246835 | I563: 351190922.60000002 | J563: -235586247.80000001 | K563: -389173085 | L563: -742031099.60000002 | M563: -- | N563: =POWER(D563/M563,1/9)-1 -> #VALUE! | O563: =POWER(D563/I563,1/5)-1 -> -8.361767296123146e-03
A564: 2779.HK | B564: 中国新华教育 | C564: 0.63 | D564: 336641923.80000001 | E564: 265679959.09999999 | F564: 434063209 | G564: 387716726.69999999 | H564: 302477077.5 | I564: 291492986 | J564: 206160446.19999999 | K564: 191743965 | L564: 176373394.55000001 | M564: 166191578.30000001 | N564: =POWER(D564/M564,1/9)-1 -> 8.158867678746895e-02 | O564: =POWER(D564/I564,1/5)-1 -> 2.921952903385483e-02
A565: 0497.HK | B565: 资本策略地产 | C565: 0.08 | D565: 335654000 | E565: 1156180000 | F565: 330809000 | G565: 1155643000 | H565: 529852000 | I565: 1010233000 | J565: 1346734000 | K565: 1645022000 | L565: 262936000 | M565: 815489000 | N565: =POWER(D565/M565,1/9)-1 -> -9.3925836774760962e-02 | O565: =POWER(D565/I565,1/5)-1 -> -0.19777894687979869
A566: 2722.HK | B566: 重庆机电 | C566: 0.54 | D566: 332835752.01999998 | E566: 349940185.88 | F566: 363078075.32999998 | G566: 218079209.5 | H566: 206553026.72999999 | I566: 505607669.44 | J566: 379625574.20999998 | K566: 489876782.5 | L566: 491158465.69999999 | M566: 638853669.70000005 | N566: =POWER(D566/M566,1/9)-1 -> -6.9885299397394851e-02 | O566: =POWER(D566/I566,1/5)-1 -> -8.0221479139848118e-02
A567: 6989.HK | B567: 卓越商企服务 | C567: 1.38 | D567: 331806585.60000002 | E567: 455181581.39999998 | F567: 624602756 | G567: 387352005.30000001 | H567: 199484925 | I567: 143205137.80000001 | J567: 130770017.5 | K567: -- | L567: -- | M567: -- | N567: =POWER(D567/M567,1/9)-1 -> #VALUE! | O567: =POWER(D567/I567,1/5)-1 -> 0.18300145942182588
A568: 1568.HK | B568: 承达集团 | C568: 0.37 | D568: 330268000 | E568: 287530000 | F568: 371287000 | G568: 406458000 | H568: 412974000 | I568: 381202000 | J568: 421093000 | K568: 523167000 | L568: 381579000 | M568: 177880000 | N568: =POWER(D568/M568,1/9)-1 -> 7.117377280851267e-02 | O568: =POWER(D568/I568,1/5)-1 -> -2.8277485759494958e-02
A569: 1475.HK | B569: 日清食品 | C569: 4.66 | D569: 330169000 | E569: 316519000 | F569: 303821000 | G569: 301912000 | H569: 250964000 | I569: 205448000 | J569: 195363000 | K569: 90762000 | L569: 101268000 | M569: 149487000 | N569: =POWER(D569/M569,1/9)-1 -> 9.2036074955503366e-02 | O569: =POWER(D569/I569,1/5)-1 -> 9.9529473364770471e-02
A570: 2559.HK | B570: 嘀嗒出行 | C570: 2.52 | D570: 329280940.80000001 | E570: -- | F570: -- | G570: -- | H570: -- | I570: -- | J570: -- | K570: -- | L570: -- | M570: -- | N570: =POWER(D570/M570,1/9)-1 -> #VALUE! | O570: =POWER(D570/I570,1/5)-1 -> #VALUE!
A571: 1979.HK | B571: 天宝集团 | C571: 1.2 | D571: 328856000 | E571: 296902000 | F571: 378616000 | G571: 289057000 | H571: 176752000 | I571: 55416000 | J571: 157575000 | K571: 194069000 | L571: 127601000 | M571: 54717000 | N571: =POWER(D571/M571,1/9)-1 -> 0.2205135639086957 | O571: =POWER(D571/I571,1/5)-1 -> 0.4278221635773527
A572: 6993.HK | B572: 蓝月亮集团 | C572: 2.21 | D572: 325309000 | E572: 611366000 | F572: 1014415000 | G572: 1309411000 | H572: 1079617000 | I572: 553985000 | J572: 86159000 | K572: -- | L572: -- | M572: -- | N572: =POWER(D572/M572,1/9)-1 -> #VALUE! | O572: =POWER(D572/I572,1/5)-1 -> -0.10100015968938192
A573: 3931.HK | B573: 中创新航 | C573: 13.800000000000001 | D573: 322696067.39999998 | E573: 780223290.60000002 | F573: 171465510.5 | G573: 6146628.2999999998 | H573: -- | I573: -- | J573: -- | K573: -- | L573: -- | M573: -- | N573: =POWER(D573/M573,1/9)-1 -> #VALUE! | O573: =POWER(D573/I573,1/5)-1 -> #VALUE!
A574: 6098.HK | B574: 碧桂园服务 | C574: 4.87 | D574: 320457627 | E574: 2192374358.1999998 | F574: 4938892177.5 | G574: 3201595963.1999998 | H574: 1866967020 | I574: 1051103144.4 | J574: 481649682.69999999 | K574: 360246136.25 | L574: 259263750.65000001 | M574: -- | N574: =POWER(D574/M574,1/9)-1 -> #VALUE! | O574: =POWER(D574/I574,1/5)-1 -> -0.21145759078906134
A575: 1830.HK | B575: 完美医疗 | C575: 2.61 | D575: 315638000 | E575: 305245000 | F575: 284634000 | G575: 360157000 | H575: 319033000 | I575: 194187000 | J575: 91356000 | K575: 130017000 | L575: 134912000 | M575: 83024000 | N575: =POWER(D575/M575,1/9)-1 -> 0.15995955777034365 | O575: =POWER(D575/I575,1/5)-1 -> 0.10203103745769448
A576: 3989.HK | B576: 首创环境 | C576: 0.10000000000000001 | D576: 312833556 | E576: 1837293602.2 | F576: 625408477 | G576: 554282367.89999998 | H576: 338322007.5 | I576: 208059793.80000001 | J576: 177847223.80000001 | K576: 48726090 | L576: 185610091.25 | M576: -68266000 | N576: =POWER(D576/M576,1/9)-1 -> -2.1842858536999339 | O576: =POWER(D576/I576,1/5)-1 -> 8.4988246386303645e-02
A577: 2727.HK | B577: 上海电气 | C577: 1.46 | D577: 312586911 | E577: -4023350600.4000001 | F577: -12230193346 | G577: 4479368782.5 | H577: 4156880970 | I577: 3393551756 | J577: 3149112265.1999998 | K577: 2616467017.5 | L577: 2461841929.6999998 | M577: 3132932815.5999999 | N577: =POWER(D577/M577,1/9)-1 -> -0.22593047898179464 | O577: =POWER(D577/I577,1/5)-1 -> -0.37932641568697112
A578: 3718.HK | B578: 北控城市资源 | C578: 0.5 | D578: 312125410.80000001 | E578: 313280138.60000002 | F578: 502033000 | G578: 426829000 | H578: 281328000 | I578: 430383000 | J578: -28522000 | K578: -27020000 | L578: -- | M578: -- | N578: =POWER(D578/M578,1/9)-1 -> #VALUE! | O578: =POWER(D578/I578,1/5)-1 -> -6.2233306980009728e-02
A579: 2268.HK | B579: 药明合联 | C579: 14.5 | D579: 310814355.60000002 | E579: -- | F579: -- | G579: -- | H579: -- | I579: 661041000 | J579: 961981000 | K579: 310633000 | L579: 223881000 | M579: 272970000 | N579: =POWER(D579/M579,1/9)-1 -> 1.4530546494151864e-02 | O579: =POWER(D579/I579,1/5)-1 -> -0.14008696050086589
A580: 1525.HK | B580: 建桥教育 | C580: 3.04 | D580: 310624713 | E580: 253745789.19999999 | F580: 219200194 | G580: 230103446.40000001 | H580: 140156850 | I580: 123623495 | J580: 55200952.700000003 | K580: 14318456.25 | L580: -- | M580: -- | N580: =POWER(D580/M580,1/9)-1 -> #VALUE! | O580: =POWER(D580/I580,1/5)-1 -> 0.20233917444748184
A581: 1858.HK | B581: 春立医疗 | C581: 8.02 | D581: 304550684.27999997 | E581: 347137968.20999998 | F581: 394730722.19999999 | G581: 337752613.56 | H581: 264580862.06 | I581: 120288615.38 | J581: 81865671.849999994 | K581: 70498356.549999997 | L581: 44531859.530000001 | M581: 46211230.82 | N581: =POWER(D581/M581,1/9)-1 -> 0.23307708499485269 | O581: =POWER(D581/I581,1/5)-1 -> 0.20416780268443402
A582: 0679.HK | B582: 亚洲联网科技 | C582: 0.87 | D582: 304179000 | E582: -32727000 | F582: -838547000 | G582: 138772000 | H582: 614056000 | I582: 84513000 | J582: 209483000 | K582: 761996000 | L582: 29013000 | M582: 9892000 | N582: =POWER(D582/M582,1/9)-1 -> 0.46324188574030134 | O582: =POWER(D582/I582,1/5)-1 -> 0.29193642183758439
A583: 0873.HK | B583: 世茂服务 | C583: 0.76 | D583: 299531169 | E583: -1045884072 | F583: 1359742351.5 | G583: 825929488.79999995 | H583: 429713392.5 | I583: 166458765.59999999 | J583: 130417540.90000001 | K583: -- | L583: -- | M583: -- | N583: =POWER(D583/M583,1/9)-1 -> #VALUE! | O583: =POWER(D583/I583,1/5)-1 -> 0.12467507476997675
A584: 0887.HK | B584: 英皇钟表珠宝 | C584: 0.16 | D584: 299219000 | E584: 222125000 | F584: 204695000 | G584: 33993000 | H584: 90031000 | I584: 264284000 | J584: 159691000 | K584: -64821000 | L584: -120082000 | M584: 138142000 | N584: =POWER(D584/M584,1/9)-1 -> 8.9672363636929875e-02 | O584: =POWER(D584/I584,1/5)-1 -> 2.5141131981107234e-02
A585: 0667.HK | B585: 中国东方教育 | C585: 2.23 | D585: 298848236.39999998 | E585: 413529873.19999999 | F585: 370002267 | G585: 307050126.60000002 | H585: 947436615 | I585: 580791889.79999995 | J585: 769239416.89999998 | K585: 628387427.5 | L585: 394290755.35000002 | M585: -- | N585: =POWER(D585/M585,1/9)-1 -> #VALUE! | O585: =POWER(D585/I585,1/5)-1 -> -0.12443976165846027
A586: 3390.HK | B586: 满贯集团 | C586: 3.81 | D586: 297319000 | E586: 43750000 | F586: -18816000 | G586: -61134000 | H586: 54516000 | I586: 100900000 | J586: 63926000 | K586: 43991000 | L586: -- | M586: -- | N586: =POWER(D586/M586,1/9)-1 -> #VALUE! | O586: =POWER(D586/I586,1/5)-1 -> 0.24127011517187236
A587: 0398.HK | B587: 东方表行集团 | C587: 3.36 | D587: 295432000 | E587: 362574000 | F587: 233256000 | G587: 100301000 | H587: 138099000 | I587: 138763000 | J587: 16383000 | K587: -15528000 | L587: 4508000 | M587: 20605000 | N587: =POWER(D587/M587,1/9)-1 -> 0.34430657869588988 | O587: =POWER(D587/I587,1/5)-1 -> 0.16315280086175332
A588: 6069.HK | B588: 盛业 | C588: 4.89 | D588: 294051265.19999999 | E588: 247504011.90000001 | F588: 503322153.5 | G588: 392435458.80000001 | H588: 313283302.5 | I588: 237308150.59999999 | J588: 106470712.3 | K588: 53348890 | L588: 43506793.700000003 | M588: -- | N588: =POWER(D588/M588,1/9)-1 -> #VALUE! | O588: =POWER(D588/I588,1/5)-1 -> 4.3811505315255683e-02
A589: 2368.HK | B589: 鹰美 | C589: 4.53 | D589: 292639000 | E589: 274633000 | F589: 313559000 | G589: 223458000 | H589: 140418000 | I589: 230012000 | J589: 155119000 | K589: 125129000 | L589: 105183000 | M589: 21870000 | N589: =POWER(D589/M589,1/9)-1 -> 0.33402762969975353 | O589: =POWER(D589/I589,1/5)-1 -> 4.9340275023350699e-02
A590: 0587.HK | B590: 海螺环保 | C590: 0.78 | D590: 289539306 | E590: 370756833.60000002 | F590: 708504271.5 | G590: 558984413.39999998 | H590: -- | I590: -- | J590: -- | K590: -- | L590: -- | M590: -- | N590: =POWER(D590/M590,1/9)-1 -> #VALUE! | O590: =POWER(D590/I590,1/5)-1 -> #VALUE!
A591: 3889.HK | B591: 大成糖业 | C591: 0.14 | D591: 289516000 | E591: -212491000 | F591: -96262000 | G591: -8726000 | H591: -162570000 | I591: -208496000 | J591: -140258000 | K591: -162358000 | L591: -753454000 | M591: -1093115000 | N591: =POWER(D591/M591,1/9)-1 -> -1.8627592716002281 | O591: =POWER(D591/I591,1/5)-1 -> -2.0678615970436005
A592: 6610.HK | B592: 飞天云动 | C592: 0.49 | D592: 289328835.60000002 | E592: 267073162.59999999 | F592: 85962349 | G592: 70182647.700000003 | H592: -- | I592: -- | J592: -- | K592: -- | L592: -- | M592: -- | N592: =POWER(D592/M592,1/9)-1 -> #VALUE! | O592: =POWER(D592/I592,1/5)-1 -> #VALUE!
A593: 1302.HK | B593: 先健科技 | C593: 1.38 | D593: 288565880.39999998 | E593: 367012669.69999999 | F593: 358131964 | G593: 257551711.5 | H593: 144381000 | I593: 137863965.19999999 | J593: 195986580.80000001 | K593: 161855785 | L593: 2774301.9500000002 | M593: -101384387.59999999 | N593: =POWER(D593/M593,1/9)-1 -> -2.1232459916576234 | O593: =POWER(D593/I593,1/5)-1 -> 0.15920125544679098
A594: 1316.HK | B594: 耐世特 | C594: 3.53 | D594: 286952707 | E594: 452965504 | F594: 923595120 | G594: 905286798 | H594: 1810049215 | I594: 2974232938 | J594: 2748722966 | K594: 2285282142 | L594: 1592200716 | M594: 1251802888 | N594: =POWER(D594/M594,1/9)-1 -> -0.1509771568118371 | O594: =POWER(D594/I594,1/5)-1 -> -0.37354905394776816
A595: 1601.HK | B595: 中关村科技租赁 | C595: 0.69999999999999996 | D595: 284874975 | E595: 255067922.40000001 | F595: 239900366.5 | G595: 192451325.40000001 | H595: 154501080 | I595: 135488845.59999999 | J595: 116814821.5 | K595: 91814808.75 | L595: -- | M595: -- | N595: =POWER(D595/M595,1/9)-1 -> #VALUE! | O595: =POWER(D595/I595,1/5)-1 -> 0.16024619148011787
A596: 0583.HK | B596: 长城环亚控股 | C596: 0.29999999999999999 | D596: 284850000 | E596: 317582000 | F596: 759678000 | G596: -319580000 | H596: 486951000 | I596: 583455000 | J596: 249158000 | K596: 1715360000 | L596: 316232000 | M596: 136768000 | N596: =POWER(D596/M596,1/9)-1 -> 8.4934514184990206e-02 | O596: =POWER(D596/I596,1/5)-1 -> -0.13359336084265316
A597: 1515.HK | B597: 华润医疗 | C597: 3.38 | D597: 282468816 | E597: 156776569.40000001 | F597: 511736917.5 | G597: 369645138.89999998 | H597: 436791637.5 | I597: 490620462.80000001 | J597: 504777662.60000002 | K597: -1674613745 | L597: 196453272.25 | M597: 287080642.89999998 | N597: =POWER(D597/M597,1/9)-1 -> -1.7978267867276854e-03 | O597: =POWER(D597/I597,1/5)-1 -> -0.10454251637035239
A598: 0606.HK | B598: 中骏商管 | C598: 0.26 | D598: 281776017.60000002 | E598: 234722638.90000001 | F598: 343605720.5 | G598: 185613395.09999999 | H598: -- | I598: -- | J598: -- | K598: -- | L598: -- | M598: -- | N598: =POWER(D598/M598,1/9)-1 -> #VALUE! | O598: =POWER(D598/I598,1/5)-1 -> #VALUE!
A599: 0693.HK | B599: 陈唱国际 | C599: 1.31 | D599: 280330000 | E599: 418073000 | F599: 378098000 | G599: 9507000 | H599: 212932000 | I599: 600899000 | J599: 501924000 | K599: 191073000 | L599: 308215000 | M599: 349227000 | N599: =POWER(D599/M599,1/9)-1 -> -2.4121496500667416e-02 | O599: =POWER(D599/I599,1/5)-1 -> -0.14143413220588508
A600: 2218.HK | B600: 安德利果汁 | C600: 8.41 | D600: 280101105.35000002 | E600: 219244913.91999999 | F600: 195938349.02000001 | G600: 180904522.63999999 | H600: 189157797.94999999 | I600: 156370594.25999999 | J600: 103615199.84999999 | K600: 135224192.02000001 | L600: 86066007.459999993 | M600: 72875991.049999997 | N600: =POWER(D600/M600,1/9)-1 -> 0.16136849023023014 | O600: =POWER(D600/I600,1/5)-1 -> 0.12365230549274031
A601: 3303.HK | B601: 巨涛海洋石油服务 | C601: 0.58 | D601: 279518941.80000001 | E601: -234908775.40000001 | F601: 13498888 | G601: 174866032.80000001 | H601: 4943820 | I601: 30328888.199999999 | J601: 66636060.899999999 | K601: 12874942.5 | L601: 31416999.699999999 | M601: 35510242.399999999 | N601: =POWER(D601/M601,1/9)-1 -> 0.25765625834404671 | O601: =POWER(D601/I601,1/5)-1 -> 0.55923275922773885
A602: 2222.HK | B602: 雷士国际 | C602: 0.86 | D602: 278954243 | E602: -516257152 | F602: 7119243 | G602: -61678441.200000003 | H602: 4106792385 | I602: -372996251.19999999 | J602: 376775905.19999999 | K602: 167718740 | L602: 65575371.950000003 | M602: -441947528.69999999 | N602: =POWER(D602/M602,1/9)-1 -> -1.9501579509030056 | O602: =POWER(D602/I602,1/5)-1 -> -1.9435516988880395
A603: 2273.HK | B603: 固生堂 | C603: 37.05 | D603: 276463832.39999998 | E603: 206773961.40000001 | F603: -620905990.5 | G603: -304827233.10000002 | H603: -- | I603: -- | J603: -- | K603: -- | L603: -- | M603: -- | N603: =POWER(D603/M603,1/9)-1 -> #VALUE! | O603: =POWER(D603/I603,1/5)-1 -> #VALUE!
A604: 1061.HK | B604: 亿胜生物科技 | C604: 2.3999999999999999 | D604: 275259617 | E604: 225411310 | F604: 345968083 | G604: 218925555 | H604: 302502420 | I604: 231091674 | J604: 167298653 | K604: 136284381 | L604: 104895190 | M604: 75273091 | N604: =POWER(D604/M604,1/9)-1 -> 0.15496007678983381 | O604: =POWER(D604/I604,1/5)-1 -> 3.5599043256152596e-02
A605: 6896.HK | B605: 金嗓子 | C605: 3.16 | D605: 274227584.39999998 | E605: 317242025.80000001 | F605: 229768853.5 | G605: 183614578.80000001 | H605: 187307527.5 | I605: 116348979.59999999 | J605: 73588482 | K605: 114360960 | L605: 181838498.90000001 | M605: 152110274.69999999 | N605: =POWER(D605/M605,1/9)-1 -> 6.7675252490814186e-02 | O605: =POWER(D605/I605,1/5)-1 -> 0.18705191193869375
A606: 0982.HK | B606: 华发物业服务 | C606: 0.27 | D606: 273155500.80000001 | E606: 218185821 | F606: 190893427.5 | G606: 36789000 | H606: 4265000 | I606: 34224000 | J606: 344000 | K606: -28985000 | L606: 13130000 | M606: 17665000 | N606: =POWER(D606/M606,1/9)-1 -> 0.35563893722550755 | O606: =POWER(D606/I606,1/5)-1 -> 0.51501117646218142
A607: 0315.HK | B607: 数码通电讯 | C607: 3.7999999999999998 | D607: 268846000 | E607: 423170000 | F607: 444621000 | G607: 378985000 | H607: 632247000 | I607: 615243000 | J607: 672102000 | K607: 797150000 | L607: 935379000 | M607: 537110000 | N607: =POWER(D607/M607,1/9)-1 -> -7.4013868419236406e-02 | O607: =POWER(D607/I607,1/5)-1 -> -0.15259430253932971
A608: 1382.HK | B608: 互太纺织 | C608: 1.64 | D608: 268572000 | E608: 572677000 | F608: 721491000 | G608: 743489000 | H608: 861780000 | I608: 744035000 | J608: 975573000 | K608: 1125530000 | L608: 1074785000 | M608: 1116802000 | N608: =POWER(D608/M608,1/9)-1 -> -0.14644479171808933 | O608: =POWER(D608/I608,1/5)-1 -> -0.184369470036571
A609: 0468.HK | B609: 纷美包装 | C609: 2.39 | D609: 267707386.80000001 | E609: 205762055.69999999 | F609: 349070664 | G609: 408539219.69999999 | H609: 376953982.5 | I609: 409963177.39999998 | J609: 411565585.39999998 | K609: 370886355 | L609: 372255106.5 | M609: 349033886.30000001 | N609: =POWER(D609/M609,1/9)-1 -> -2.9044791516934509e-02 | O609: =POWER(D609/I609,1/5)-1 -> -8.1703136707576896e-02
A610: 2192.HK | B610: 医脉通 | C610: 8 | D610: 265610356.19999999 | E610: 132349820.09999999 | F610: 49734292 | G610: 101546304.3 | H610: -- | I610: -- | J610: -- | K610: -- | L610: -- | M610: -- | N610: =POWER(D610/M610,1/9)-1 -> #VALUE! | O610: =POWER(D610/I610,1/5)-1 -> #VALUE!
A611: 0271.HK | B611: 亚证地产 | C611: 0.18 | D611: 264999000 | E611: -43701000 | F611: -1563052000 | G611: -56650000 | H611: 58014000 | I611: 112747000 | J611: 169165000 | K611: 61762000 | L611: 195718000 | M611: 247203000 | N611: =POWER(D611/M611,1/9)-1 -> 7.7539284215877302e-03 | O611: =POWER(D611/I611,1/5)-1 -> 0.18639101250741374
A612: 2377.HK | B612: 博奇环保 | C612: 0.74 | D612: 263289700.80000001 | E612: 171188046.90000001 | F612: 426418655.5 | G612: 247447975.19999999 | H612: 203985097.5 | I612: 449017157.39999998 | J612: -43661540.200000003 | K612: 168955561.25 | L612: 161806839.25 | M612: 129332356 | N612: =POWER(D612/M612,1/9)-1 -> 8.2188624891534667e-02 | O612: =POWER(D612/I612,1/5)-1 -> -0.10125976034506801
A613: 0732.HK | B613: 信利国际 | C613: 1.07 | D613: 262799000 | E613: 318233000 | F613: 1377998000 | G613: 502287000 | H613: 562456000 | I613: 74190000 | J613: 62987000 | K613: 581867000 | L613: 845422000 | M613: 1118369000 | N613: =POWER(D613/M613,1/9)-1 -> -0.14863577140656759 | O613: =POWER(D613/I613,1/5)-1 -> 0.28782148856899781
A614: 2517.HK | B614: 锅圈 | C614: 2.65 | D614: 262688983.19999999 | E614: -- | F614: -- | G614: -- | H614: -- | I614: -- | J614: -- | K614: -- | L614: -- | M614: -- | N614: =POWER(D614/M614,1/9)-1 -> #VALUE! | O614: =POWER(D614/I614,1/5)-1 -> #VALUE!
A615: 9908.HK | B615: 嘉兴燃气 | C615: 7.59 | D615: 261996184.80000001 | E615: 78226966.400000006 | F615: 132841107 | G615: 110274588 | H615: 97108515 | I615: 80091401.200000003 | J615: 74690271.099999994 | K615: 33297495 | L615: -- | M615: -- | N615: =POWER(D615/M615,1/9)-1 -> #VALUE! | O615: =POWER(D615/I615,1/5)-1 -> 0.26748204267055198
A616: 1931.HK | B616: 华检医疗 | C616: 0.89 | D616: 261074280.59999999 | E616: 236899871.90000001 | F616: 213725454.5 | G616: 189175984.19999999 | H616: 307313617.5 | I616: 117776784 | J616: 132760191.5 | K616: 62527815 | L616: -- | M616: -- | N616: =POWER(D616/M616,1/9)-1 -> #VALUE! | O616: =POWER(D616/I616,1/5)-1 -> 0.1725756728111123
A617: 9890.HK | B617: 中旭未来 | C617: 13.02 | D617: 258140849.40000001 | E617: 579918982.70000005 | F617: 754183019.5 | G617: -1550784665.7 | H617: -- | I617: -- | J617: -- | K617: -- | L617: -- | M617: -- | N617: =POWER(D617/M617,1/9)-1 -> #VALUE! | O617: =POWER(D617/I617,1/5)-1 -> #VALUE!
A618: 0025.HK | B618: 其士国际 | C618: 4.24 | D618: 257568000 | E618: 644523000 | F618: 640552000 | G618: 533081000 | H618: 654561000 | I618: 907929000 | J618: 540263000 | K618: 315056000 | L618: 1537162000 | M618: 470369000 | N618: =POWER(D618/M618,1/9)-1 -> -6.4725171729608899e-02 | O618: =POWER(D618/I618,1/5)-1 -> -0.22273698384235108
A619: 9860.HK | B619: 艾迪康控股 | C619: 9.34 | D619: 257480937 | E619: 768002583.29999995 | F619: 386378730 | G619: 338643819.89999998 | H619: -- | I619: -- | J619: -- | K619: -- | L619: -- | M619: -- | N619: =POWER(D619/M619,1/9)-1 -> #VALUE! | O619: =POWER(D619/I619,1/5)-1 -> #VALUE!
A620: 2886.HK | B620: 滨海投资 | C620: 1.17 | D620: 256612000 | E620: 325833000 | F620: 399659000 | G620: 354904000 | H620: 81111000 | I620: 104049000 | J620: 221421000 | K620: 172226000 | L620: 198860000 | M620: 213635000 | N620: =POWER(D620/M620,1/9)-1 -> 2.057505891726108e-02 | O620: =POWER(D620/I620,1/5)-1 -> 0.19786481955359103
A621: 0336.HK | B621: 华宝国际 | C621: 2.35 | D621: 256108494.59999999 | E621: -1189634470.7 | F621: 826697909.5 | G621: 498689768.10000002 | H621: 1242664470 | I621: 1579303921.05 | J621: 1202757153.5999999 | K621: 1415393119.8 | L621: 1986584000 | M621: 1977325000 | N621: =POWER(D621/M621,1/9)-1 -> -0.20315882066739754 | O621: =POWER(D621/I621,1/5)-1 -> -0.30498903890640838
A622: 3331.HK | B622: 维达国际 | C622: 23.45 | D622: 253151520 | E622: 706039502 | F622: 1638364572 | G622: 1874329244 | H622: 1138316393 | I622: 649304689 | J622: 620956454 | K622: 653534554 | L622: 314441112 | M622: 593467132 | N622: =POWER(D622/M622,1/9)-1 -> -9.0323246827354264e-02 | O622: =POWER(D622/I622,1/5)-1 -> -0.17170240562470407
A623: 0113.HK | B623: 迪生创建 | C623: 5.39 | D623: 252637000 | E623: 200939000 | F623: 461820000 | G623: 645823000 | H623: 411341000 | I623: 151809000 | J623: 80161000 | K623: -288152000 | L623: -110260000 | M623: 154830000 | N623: =POWER(D623/M623,1/9)-1 -> 5.5909923222472457e-02 | O623: =POWER(D623/I623,1/5)-1 -> 0.10723520834277656
A624: 1977.HK | B624: 安乐工程 | C624: 1.03 | D624: 251500000 | E624: 114558000 | F624: 314299000 | G624: 301350000 | H624: 245001000 | I624: 315282000 | J624: 433577000 | K624: 120832000 | L624: 278484000 | M624: -- | N624: =POWER(D624/M624,1/9)-1 -> #VALUE! | O624: =POWER(D624/I624,1/5)-1 -> -4.4198379478734395e-02
A625: 2633.HK | B625: 雅各臣科研制药 | C625: 0.59 | D625: 251044000 | E625: 177666000 | F625: 173713000 | G625: 215631000 | H625: 250561000 | I625: 202270000 | J625: 179328000 | K625: 145610000 | L625: 101904000 | M625: 172357000 | N625: =POWER(D625/M625,1/9)-1 -> 4.2669737819588383e-02 | O625: =POWER(D625/I625,1/5)-1 -> 4.415187895071826e-02
A626: 2219.HK | B626: 朝聚眼科 | C626: 3.02 | D626: 250935526.80000001 | E626: 211803031.19999999 | F626: 198061650.5 | G626: 147961274.09999999 | H626: -- | I626: -- | J626: -- | K626: -- | L626: -- | M626: -- | N626: =POWER(D626/M626,1/9)-1 -> #VALUE! | O626: =POWER(D626/I626,1/5)-1 -> #VALUE!
A627: 3633.HK | B627: 中裕能源 | C627: 4.74 | D627: 246720000 | E627: 174077000 | F627: 1188997000 | G627: 1056617000 | H627: 430121000 | I627: 620684000 | J627: 557959000 | K627: 206150000 | L627: 93390000 | M627: 324351000 | N627: =POWER(D627/M627,1/9)-1 -> -2.9939567657128685e-02 | O627: =POWER(D627/I627,1/5)-1 -> -0.16849136958696331
A628: 1696.HK | B628: 复锐医疗科技 | C628: 3.48 | D628: 246038689 | E628: 313647360 | F628: 243648510 | G628: 103456032 | H628: 161852795 | I628: 171024054 | J628: 86336886 | K628: 62458470 | L628: 60562407 | M628: 46093908 | N628: =POWER(D628/M628,1/9)-1 -> 0.20453039587464361 | O628: =POWER(D628/I628,1/5)-1 -> 7.5447567215662259e-02
A629: 1665.HK | B629: 槟杰科达 | C629: 0.64 | D629: 241703648.55000001 | E629: 236336007.94999999 | F629: 218177024.40000001 | G629: 219850441.84999999 | H629: 249932645.34999999 | I629: 189347039.69999999 | J629: 76536603 | K629: 54061965 | L629: 17342672.399999999 | M629: 20104320 | N629: =POWER(D629/M629,1/9)-1 -> 0.31825465354213001 | O629: =POWER(D629/I629,1/5)-1 -> 5.0037809479724693e-02
A630: 0308.HK | B630: 香港中旅 | C630: 1.16 | D630: 239548000 | E630: -355792000 | F630: 174016000 | G630: -390792000 | H630: 386880000 | I630: 687076000 | J630: 1147843000 | K630: 352053000 | L630: 1352750000 | M630: 1738884000 | N630: =POWER(D630/M630,1/9)-1 -> -0.19768136028785843 | O630: =POWER(D630/I630,1/5)-1 -> -0.19001392234319103
A631: 6117.HK | B631: 日照港裕廊 | C631: 0.66 | D631: 239247842.40000001 | E631: 225476731.30000001 | F631: 206078452 | G631: 180130655.09999999 | H631: 157713892.5 | I631: 169824467.19999999 | J631: 152238719.80000001 | K631: 87124222.5 | L631: -- | M631: -- | N631: =POWER(D631/M631,1/9)-1 -> #VALUE! | O631: =POWER(D631/I631,1/5)-1 -> 7.0950884435927009e-02
A632: 1045.HK | B632: 亚太卫星 | C632: 2.14 | D632: 237654000 | E632: 231610000 | F632: 263382000 | G632: 231462000 | H632: 362326000 | I632: 507007000 | J632: 504557000 | K632: 493608000 | L632: 513831000 | M632: 508045000 | N632: =POWER(D632/M632,1/9)-1 -> -8.0952188526863256e-02 | O632: =POWER(D632/I632,1/5)-1 -> -0.14061803648585436
A633: 0838.HK | B633: 亿和控股 | C633: 0.68 | D633: 237095000 | E633: 206017000 | F633: 155190000 | G633: -15371000 | H633: 51781000 | I633: 82663000 | J633: 133699000 | K633: 53486000 | L633: 205469000 | M633: 277125000 | N633: =POWER(D633/M633,1/9)-1 -> -1.7184823072431077e-02 | O633: =POWER(D633/I633,1/5)-1 -> 0.23458855485123387
A634: 2373.HK | B634: 美丽田园医疗健康 | C634: 15.800000000000001 | D634: 236403203.40000001 | E634: 116317262.90000001 | F634: 236910137.5 | G634: 179928032.09999999 | H634: -- | I634: -- | J634: -- | K634: -- | L634: -- | M634: -- | N634: =POWER(D634/M634,1/9)-1 -> #VALUE! | O634: =POWER(D634/I634,1/5)-1 -> #VALUE!
A635: 3658.HK | B635: 新希望服务 | C635: 1.58 | D635: 235646825.40000001 | E635: 229041527.30000001 | F635: 203137203 | G635: 130834863 | H635: -- | I635: -- | J635: -- | K635: -- | L635: -- | M635: -- | N635: =POWER(D635/M635,1/9)-1 -> #VALUE! | O635: =POWER(D635/I635,1/5)-1 -> #VALUE!
A636: 9857.HK | B636: 柠萌影视 | C636: 6.13 | D636: 234179013.59999999 | E636: -825807555.39999998 | F636: 74587968.5 | G636: 59749947 | H636: -- | I636: -- | J636: -- | K636: -- | L636: -- | M636: -- | N636: =POWER(D636/M636,1/9)-1 -> #VALUE! | O636: =POWER(D636/I636,1/5)-1 -> #VALUE!
A637: 6868.HK | B637: 天福 | C637: 4.56 | D637: 233751495.59999999 | E637: 232898501.19999999 | F637: 440184484.5 | G637: 364016987.10000002 | H637: 305230597.5 | I637: 305848454.80000001 | J637: 291945337.89999998 | K637: 183822975 | L637: 172119621.69999999 | M637: 337180084.19999999 | N637: =POWER(D637/M637,1/9)-1 -> -3.988912906344444e-02 | O637: =POWER(D637/I637,1/5)-1 -> -5.2346389643701308e-02
A638: 1635.HK | B638: 大众公用 | C638: 1.17 | D638: 232990732.80000001 | E638: -375195907.10000002 | F638: 371459422 | G638: 614103828.89999998 | H638: 588333577.5 | I638: 544807575.39999998 | J638: 568438053.70000005 | K638: 608567172.5 | L638: 545451990 | M638: 424871265.10000002 | N638: =POWER(D638/M638,1/9)-1 -> -6.4574872198845279e-02 | O638: =POWER(D638/I638,1/5)-1 -> -0.15623967181185905
A639: 1375.HK | B639: 中州证券 | C639: 1.01 | D639: 231957622.96000001 | E639: 120230625.92 | F639: 628426057.96000004 | G639: 124317600.02 | H639: 65064202.5 | I639: 74907355.400000006 | J639: 529893418.69999999 | K639: 798595367.5 | L639: 1652939451.05 | M639: 701681691 | N639: =POWER(D639/M639,1/9)-1 -> -0.11572898566448542 | O639: =POWER(D639/I639,1/5)-1 -> 0.25365153565009746
A640: 0609.HK | B640: 天德化工 | C640: 1.17 | D640: 231376030.19999999 | E640: 982489364.39999998 | F640: 464877751.5 | G640: 113017149.90000001 | H640: 24034072.5 | I640: -69520638.799999997 | J640: 121762681.8 | K640: 244033833.75 | L640: 202716914.55000001 | M640: 192806789.5 | N640: =POWER(D640/M640,1/9)-1 -> 2.0468398686287914e-02 | O640: =POWER(D640/I640,1/5)-1 -> -2.2718647246941814
A641: 0400.HK | B641: 硬蛋创新 | C641: 1.07 | D641: 230969340 | E641: 354690433.39999998 | F641: 362636899.5 | G641: 146842080 | H641: 122999872.5 | I641: 333813609.39999998 | J641: 362097772.5 | K641: 532065388.75 | L641: 403238143.75 | M641: 242239852.19999999 | N641: =POWER(D641/M641,1/9)-1 -> -5.2797225305742934e-03 | O641: =POWER(D641/I641,1/5)-1 -> -7.1012096659804791e-02
A642: 2281.HK | B642: 兴泸水务 | C642: 0.58 | D642: 230093902.12 | E642: 229257628.65000001 | F642: 296238825.47000003 | G642: 294663209 | H642: 212985442.5 | I642: 175418409 | J642: 157413172.19999999 | K642: 140736478.75 | L642: 153371032.59999999 | M642: 125271689.40000001 | N642: =POWER(D642/M642,1/9)-1 -> 6.9890005563174595e-02 | O642: =POWER(D642/I642,1/5)-1 -> 5.5761907387927856e-02
A643: 0752.HK | B643: 笔克远东 | C643: 1.79 | D643: 228083000 | E643: 162642000 | F643: 136909000 | G643: 50536000 | H643: 256831000 | I643: 271508000 | J643: 281439000 | K643: 300501000 | L643: 274695000 | M643: 240494000 | N643: =POWER(D643/M643,1/9)-1 -> -5.8699865121086825e-03 | O643: =POWER(D643/I643,1/5)-1 -> -3.4255914214359029e-02
A644: 2127.HK | B644: 汇森股份 | C644: 0.15 | D644: 227026308.59999999 | E644: 377800690 | F644: 1087438041.5 | G644: 644440067.70000005 | H644: 635078602.5 | I644: 438889310.39999998 | J644: 401368940.89999998 | K644: 327680955 | L644: -- | M644: -- | N644: =POWER(D644/M644,1/9)-1 -> #VALUE! | O644: =POWER(D644/I644,1/5)-1 -> -0.12351550693187718
A645: 1765.HK | B645: 希教国际控股 | C645: 0.21 | D645: 225845920.05000001 | E645: 505467888.80000001 | F645: 729724350.75 | G645: -- | H645: 547431960 | I645: 191189157.59999999 | J645: 253821516.80000001 | K645: 172233748.75 | L645: 76667875.549999997 | M645: -- | N645: =POWER(D645/M645,1/9)-1 -> #VALUE! | O645: =POWER(D645/I645,1/5)-1 -> 3.3879199614009092e-02
A646: 0869.HK | B646: 彩星玩具 | C646: 0.66 | D646: 223745000 | E646: 9722000 | F646: 42981000 | G646: -30063000 | H646: -37278000 | I646: 562000 | J646: 55764000 | K646: 110206000 | L646: 276245000 | M646: 490672000 | N646: =POWER(D646/M646,1/9)-1 -> -8.3553966439128713e-02 | O646: =POWER(D646/I646,1/5)-1 -> 2.3113371741774302
A647: 3399.HK | B647: 粤运交通 | C647: 1.23 | D647: 221309096.43000001 | E647: -169692614.13999999 | F647: -269772209.79000002 | G647: -273175483.83999997 | H647: 340803951.77999997 | I647: 341603906.58999997 | J647: 513800364.25 | K647: 372439977.79000002 | L647: 312853154.38999999 | M647: 249552111.47999999 | N647: =POWER(D647/M647,1/9)-1 -> -1.3256614091409769e-02 | O647: =POWER(D647/I647,1/5)-1 -> -8.3156337673759961e-02
A648: 0596.HK | B648: 浪潮数字企业 | C648: 3.04 | D648: 221026806 | E648: 133894189 | F648: 65830344.5 | G648: -157044000 | H648: 203059000 | I648: 324030000 | J648: 139201000 | K648: 59893000 | L648: 6994000 | M648: -69100000 | N648: =POWER(D648/M648,1/9)-1 -> -2.1379087406327333 | O648: =POWER(D648/I648,1/5)-1 -> -7.3656741188951047e-02
A649: 0184.HK | B649: 激成投资 | C649: 2.25 | D649: 219656000 | E649: 76302000 | F649: -194724000 | G649: -562586000 | H649: 5516000 | I649: 196579000 | J649: 131005000 | K649: 225345000 | L649: 228972000 | M649: 268143000 | N649: =POWER(D649/M649,1/9)-1 -> -2.1918198130140731e-02 | O649: =POWER(D649/I649,1/5)-1 -> 2.2447906060750533e-02
A650: 1730.HK | B650: 贤能集团 | C650: 1.8999999999999999 | D650: 219655933.5 | E650: 251398511 | F650: 160408108 | G650: 136679184 | H650: 46467829 | I650: 30971296 | J650: 13302092 | K650: 85726373 | L650: 22992123.5 | M650: 77779710 | N650: =POWER(D650/M650,1/9)-1 -> 0.12227012525433967 | O650: =POWER(D650/I650,1/5)-1 -> 0.47964221020131048
A651: 1523.HK | B651: 珩湾科技 | C651: 3.88 | D651: 219481289 | E651: 176921472 | F651: 165317600 | G651: 110325190 | H651: 94137043 | I651: 83197080 | J651: 68403756 | K651: 40630960 | L651: 26018428.5 | M651: 29030397.760000002 | N651: =POWER(D651/M651,1/9)-1 -> 0.25203381160884719 | O651: =POWER(D651/I651,1/5)-1 -> 0.21410957351967608
A652: 0346.HK | B652: 延长石油国际 | C652: 0.25 | D652: 217593000 | E652: -199510000 | F652: 353601000 | G652: -795765000 | H652: -443742000 | I652: -741000 | J652: -65289000 | K652: -267722000 | L652: -4544205000 | M652: -4634817000 | N652: =POWER(D652/M652,1/9)-1 -> -1.7118711126473589 | O652: =POWER(D652/I652,1/5)-1 -> -4.1157696482375714
A653: 1497.HK | B653: 燕之屋 | C653: 13.04 | D653: 216483057 | E653: -- | F653: -- | G653: -- | H653: -- | I653: -- | J653: -- | K653: -- | L653: -- | M653: -- | N653: =POWER(D653/M653,1/9)-1 -> #VALUE! | O653: =POWER(D653/I653,1/5)-1 -> #VALUE!
A654: 3337.HK | B654: 安东油田服务 | C654: 0.52 | D654: 215417550.59999999 | E654: 331447061 | F654: 88430941 | G654: -114236463.59999999 | H654: 300141502.5 | I654: 253250827.80000001 | J654: 65334055.5 | K654: -178300062.5 | L654: -229013392.55000001 | M654: -247350002.69999999 | N654: =POWER(D654/M654,1/9)-1 -> -1.9847588831527652 | O654: =POWER(D654/I654,1/5)-1 -> -3.1842437974446858e-02
A655: 1729.HK | B655: 汇聚科技 | C655: 3.66 | D655: 215140000 | E655: 168223000 | F655: 226361000 | G655: 154080000 | H655: 122934000 | I655: 132120000 | J655: 81684000 | K655: 71599000 | L655: 66717000 | M655: -- | N655: =POWER(D655/M655,1/9)-1 -> #VALUE! | O655: =POWER(D655/I655,1/5)-1 -> 0.10242872276567816
A656: 1970.HK | B656: IMAX China | C656: 8.6999999999999993 | D656: 214810311 | E656: 83998464 | F656: 298016166 | G656: -207307467 | H656: 334007791 | I656: 335021010 | J656: 341573382 | K656: 279826352 | L656: -1409544682.5 | M656: 176689436 | N656: =POWER(D656/M656,1/9)-1 -> 2.1944171442074945e-02 | O656: =POWER(D656/I656,1/5)-1 -> -8.5051570411196487e-02
A657: 8095.HK | B657: 北大青鸟环宇 | C657: 0.28 | D657: 213985913.40000001 | E657: 376089362.30000001 | F657: 194661214 | G657: 76478263.5 | H657: 1567169707.5 | I657: 167407219.40000001 | J657: 204613865.19999999 | K657: 143973550 | L657: 89377447.900000006 | M657: 125843227.59999999 | N657: =POWER(D657/M657,1/9)-1 -> 6.0760305219262678e-02 | O657: =POWER(D657/I657,1/5)-1 -> 5.032136660056219e-02
A658: 0866.HK | B658: 中国秦发 | C658: 0.75 | D658: 213839022.59999999 | E658: 509324740.89999998 | F658: 3414746007 | G658: -3464187027.9000001 | H658: 90987967.5 | I658: 1713033947.4000001 | J658: 3786544616.0999999 | K658: -367314797.5 | L658: -7075013307.6000004 | M658: -1482572586.5999999 | N658: =POWER(D658/M658,1/9)-1 -> -1.8064239991913169 | O658: =POWER(D658/I658,1/5)-1 -> -0.34042498161891355
A659: 1243.HK | B659: 宏安地产 | C659: 0.04 | D659: 211066000 | E659: 285079000 | F659: 466745000 | G659: 457320000 | H659: 500302000 | I659: 1808456000 | J659: 38816000 | K659: 410000000 | L659: 457399000 | M659: 427319000 | N659: =POWER(D659/M659,1/9)-1 -> -7.53808214686843e-02 | O659: =POWER(D659/I659,1/5)-1 -> -0.34923817774728871
A660: 0154.HK | B660: 北京控股环境集团 | C660: 0.35 | D660: 209323774.80000001 | E660: 398448304.30000001 | F660: 264051000 | G660: 129027000 | H660: 222232000 | I660: 265008000 | J660: 190308000 | K660: 130101000 | L660: 83283000 | M660: 7519000 | N660: =POWER(D660/M660,1/9)-1 -> 0.44716352598461917 | O660: =POWER(D660/I660,1/5)-1 -> -4.608008714507672e-02
A661: 9636.HK | B661: 九方财富 | C661: 9.1999999999999993 | D661: 209066167.80000001 | E661: 519550967.39999998 | F661: 284301961 | G661: 102675033.59999999 | H661: -- | I661: -- | J661: -- | K661: -- | L661: -- | M661: -- | N661: =POWER(D661/M661,1/9)-1 -> #VALUE! | O661: =POWER(D661/I661,1/5)-1 -> #VALUE!
A662: 1702.HK | B662: 东光化工 | C662: 1.8999999999999999 | D662: 208365696 | E662: 219280078 | F662: 325816184.5 | G662: 149316464.40000001 | H662: 180535477.5 | I662: 113477430.40000001 | J662: 56208028.700000003 | K662: 20902612.5 | L662: 127125124.75 | M662: 111293961.5 | N662: =POWER(D662/M662,1/9)-1 -> 7.216499628649875e-02 | O662: =POWER(D662/I662,1/5)-1 -> 0.12923243939443108
A663: 2469.HK | B663: 粉笔 | C663: 2.96 | D663: 206706049.19999999 | E663: -2354736150.6999998 | F663: -2505291489.5 | G663: -577442176.79999995 | H663: -- | I663: -- | J663: -- | K663: -- | L663: -- | M663: -- | N663: =POWER(D663/M663,1/9)-1 -> #VALUE! | O663: =POWER(D663/I663,1/5)-1 -> #VALUE!
A664: 2421.HK | B664: 嘉创地产 | C664: 0.65 | D664: 206697935.69999999 | E664: 300493695 | F664: 190075677.75 | G664: 140754076.05000001 | H664: -- | I664: -- | J664: -- | K664: -- | L664: -- | M664: -- | N664: =POWER(D664/M664,1/9)-1 -> #VALUE! | O664: =POWER(D664/I664,1/5)-1 -> #VALUE!
A665: 0505.HK | B665: 兴业合金 | C665: 1.05 | D665: 205479401.40000001 | E665: 244354356.69999999 | F665: 339158336.5 | G665: 179776660.80000001 | H665: 66225285 | I665: 31344519.399999999 | J665: 162503701.59999999 | K665: 94239556.25 | L665: 22166190.399999999 | M665: 23401868.699999999 | N665: =POWER(D665/M665,1/9)-1 -> 0.27302023210381443 | O665: =POWER(D665/I665,1/5)-1 -> 0.45653637604935571
A666: 2283.HK | B666: 东江集团控股 | C666: 1.8999999999999999 | D666: 204191000 | E666: 226909000 | F666: 282383000 | G666: 209687000 | H666: 301803000 | I666: 350185000 | J666: 301833000 | K666: 205698000 | L666: 187088000 | M666: 153923000 | N666: =POWER(D666/M666,1/9)-1 -> 3.1898565051715622e-02 | O666: =POWER(D666/I666,1/5)-1 -> -0.10226571525723149
A667: 3991.HK | B667: 长虹佳华 | C667: 0.42 | D667: 204029000 | E667: 207016000 | F667: 233856000 | G667: 195460000 | H667: 289166000 | I667: 270150000 | J667: 244526000 | K667: 131725000 | L667: 74557000 | M667: 185110000 | N667: =POWER(D667/M667,1/9)-1 -> 1.0871098673326252e-02 | O667: =POWER(D667/I667,1/5)-1 -> -5.4596108077316519e-02
A668: 1086.HK | B668: 好孩子国际 | C668: 0.63 | D668: 203496000 | E668: 33487000 | F668: 123817000 | G668: 256574000 | H668: 202194000 | I668: 163764000 | J668: 179350000 | K668: 207390000 | L668: 197434000 | M668: 57475000 | N668: =POWER(D668/M668,1/9)-1 -> 0.15082302949828974 | O668: =POWER(D668/I668,1/5)-1 -> 4.4401502352026112e-02
A669: 1023.HK | B669: 时代集团控股 | C669: 0.56 | D669: 202796000 | E669: 111647000 | F669: -150249000 | G669: -132833000 | H669: 125566000 | I669: 256675000 | J669: 211082000 | K669: 370142000 | L669: 411947000 | M669: 504254000 | N669: =POWER(D669/M669,1/9)-1 -> -9.6255724950613186e-02 | O669: =POWER(D669/I669,1/5)-1 -> -4.6029021738078879e-02
A670: 1938.HK | B670: 珠江钢管 | C670: 0.19 | D670: 201457443.59999999 | E670: 183918655.40000001 | F670: -115536473 | G670: 742447620.89999998 | H670: -155207340 | I670: -567948481.79999995 | J670: -1045703359.1 | K670: -1662212195 | L670: 22102683.699999999 | M670: -448304331.30000001 | N670: =POWER(D670/M670,1/9)-1 -> -1.9149579894206874 | O670: =POWER(D670/I670,1/5)-1 -> -1.8127834935496354
A671: 1788.HK | B671: 国泰君安国际 | C671: 0.62 | D671: 201261000 | E671: 80381000 | F671: 1094743000 | G671: 1562587000 | H671: 895303000 | I671: 796835000 | J671: 1228174000 | K671: 969139000 | L671: 1013541000 | M671: 799791000 | N671: =POWER(D671/M671,1/9)-1 -> -0.14213224144159209 | O671: =POWER(D671/I671,1/5)-1 -> -0.24058661954212623
A672: 2360.HK | B672: 优品360 | C672: 1.73 | D672: 200997000 | E672: 109804000 | F672: 81449000 | G672: 12100000 | H672: 59728000 | I672: 53599000 | J672: 25144000 | K672: 12450000 | L672: -- | M672: -- | N672: =POWER(D672/M672,1/9)-1 -> #VALUE! | O672: =POWER(D672/I672,1/5)-1 -> 0.30258651444412421
A673: 9658.HK | B673: 特海国际 | C673: 13.34 | D673: 200375583 | E673: -322064384 | F673: -1175564096 | G673: -416801280 | H673: -- | I673: -- | J673: -- | K673: -- | L673: -- | M673: -- | N673: =POWER(D673/M673,1/9)-1 -> #VALUE! | O673: =POWER(D673/I673,1/5)-1 -> #VALUE!
A674: 1789.HK | B674: 爱康医疗 | C674: 4.51 | D674: 199622404.80000001 | E674: 231003293.19999999 | F674: 113411965.5 | G674: 374264943.30000001 | H674: 298363560 | I674: 165024129.59999999 | J674: 126335286.40000001 | K674: 85928517.5 | L674: 76333877.349999994 | M674: 64542635.899999999 | N674: =POWER(D674/M674,1/9)-1 -> 0.13366498162784368 | O674: =POWER(D674/I674,1/5)-1 -> 3.8801017782277514e-02
A675: 6616.HK | B675: 环球新材国际 | C675: 4.55 | D675: 199045803.59999999 | E675: 252455242.80000001 | F675: 198400837 | G675: 176606206.80000001 | H675: -- | I675: -- | J675: -- | K675: -- | L675: -- | M675: -- | N675: =POWER(D675/M675,1/9)-1 -> #VALUE! | O675: =POWER(D675/I675,1/5)-1 -> #VALUE!
A676: 0538.HK | B676: 味千(中国) | C676: 0.99 | D676: 198618285.59999999 | E676: -162340358.59999999 | F676: 25641030 | G676: -92810869.200000003 | H676: 174822817.5 | I676: 627391372 | J676: -583444685 | K676: 739305735 | L676: 184558000 | M676: 275565000 | N676: =POWER(D676/M676,1/9)-1 -> -3.572820540070254e-02 | O676: =POWER(D676/I676,1/5)-1 -> -0.20549590970685228
A677: 9869.HK | B677: 海伦司 | C677: 2.08 | D677: 197864100 | E677: -1806257315 | F677: -281635000 | G677: 83518816.799999997 | H677: -- | I677: -- | J677: -- | K677: -- | L677: -- | M677: -- | N677: =POWER(D677/M677,1/9)-1 -> #VALUE! | O677: =POWER(D677/I677,1/5)-1 -> #VALUE!
A678: 6858.HK | B678: 本间高尔夫 | C678: 3.29 | D678: 192024959.68000001 | E678: 398589262.86000001 | F678: 130467497.38 | G678: -52312689.090000004 | H678: 298065277.26999998 | I678: 290752248.88 | J678: 317611386 | K678: 246239176.99000001 | L678: 148593487.5 | M678: 195415511.58000001 | N678: =POWER(D678/M678,1/9)-1 -> -1.9428611162605192e-03 | O678: =POWER(D678/I678,1/5)-1 -> -7.9620535755418831e-02
A679: 1117.HK | B679: 现代牧业 | C679: 0.65 | D679: 192009295.80000001 | E679: 634552865.70000005 | F679: 1247559784 | G679: 917774919 | H679: 381369225 | I679: -564845796.79999995 | J679: -1169066572.4000001 | K679: -824661958.75 | L679: 377860160.80000001 | M679: 917602084.29999995 | N679: =POWER(D679/M679,1/9)-1 -> -0.15953689859687159 | O679: =POWER(D679/I679,1/5)-1 -> -1.8058950174357364
A680: 6601.HK | B680: 朝云集团 | C680: 1.74 | D680: 191852539.19999999 | E680: 73021913 | F680: 112767878.5 | G680: 266724573.90000001 | H680: -- | I680: -- | J680: -- | K680: -- | L680: -- | M680: -- | N680: =POWER(D680/M680,1/9)-1 -> #VALUE! | O680: =POWER(D680/I680,1/5)-1 -> #VALUE!
A681: 1717.HK | B681: 澳优 | C681: 2.1000000000000001 | D681: 191163029.40000001 | E681: 244262980.59999999 | F681: 935265753 | G681: 1196793941.4000001 | H681: 981600825 | I681: 723124860 | J681: 369420653.69999999 | K681: 236331760 | L681: 59561052.25 | M681: 112584290.09999999 | N681: =POWER(D681/M681,1/9)-1 -> 6.0589554687594305e-02 | O681: =POWER(D681/I681,1/5)-1 -> -0.23363065870899613
A682: 0837.HK | B682: 谭木匠 | C682: 5.7999999999999998 | D682: 190447210.80000001 | E682: 120988725 | F682: 131833343.5 | G682: 94231614 | H682: 136875870 | I682: 130381086 | J682: 144126962.40000001 | K682: 126685833.75 | L682: 141015451.30000001 | M682: 160682099.80000001 | N682: =POWER(D682/M682,1/9)-1 -> 1.9062430576293421e-02 | O682: =POWER(D682/I682,1/5)-1 -> 7.8728131254966804e-02
A683: 0050.HK | B683: 香港小轮(集团) | C683: 4.18 | D683: 190393000 | E683: 1299136000 | F683: 118249000 | G683: 26588000 | H683: 136416000 | I683: 344643000 | J683: 311125000 | K683: 236678000 | L683: 192915000 | M683: 1031411000 | N683: =POWER(D683/M683,1/9)-1 -> -0.17116362615422287 | O683: =POWER(D683/I683,1/5)-1 -> -0.11191138414373736
A684: 2407.HK | B684: 高视医疗 | C684: 12.300000000000001 | D684: 190215912.59999999 | E684: -394405193.89999998 | F684: -233202351.5 | G684: 118435527.3 | H684: -- | I684: -- | J684: -- | K684: -- | L684: -- | M684: -- | N684: =POWER(D684/M684,1/9)-1 -> #VALUE! | O684: =POWER(D684/I684,1/5)-1 -> #VALUE!
A685: 6138.HK | B685: 哈尔滨银行 | C685: 0.29999999999999999 | D685: 188977206.59999999 | E685: 23429508.899999999 | F685: 335675858.5 | G685: 888771224.39999998 | H685: 3976564522.5 | I685: 6317683781.1999998 | J685: 6293153183.3999996 | K685: 5419123972.5 | L685: 5242368712.3500004 | M685: 4750198736.6000004 | N685: =POWER(D685/M685,1/9)-1 -> -0.30110674444248353 | O685: =POWER(D685/I685,1/5)-1 -> -0.50435548080270753
A686: 1727.HK | B686: 河北建设 | C686: 0.52 | D686: 187883199 | E686: 368578472.5 | F686: -423646387.5 | G686: 905672366.39999998 | H686: 860938762.5 | I686: 1313988805.4000001 | J686: 1261537729.4000001 | K686: 853637802.5 | L686: 477802065.85000002 | M686: 447354679.39999998 | N686: =POWER(D686/M686,1/9)-1 -> -9.1892360807502627e-02 | O686: =POWER(D686/I686,1/5)-1 -> -0.32226602706214613
A687: 6668.HK | B687: 星盛商业 | C687: 1.19 | D687: 187556531.40000001 | E687: 174037627.5 | F687: 226439438 | G687: 151179404.09999999 | H687: 94576260 | I687: 75432250 | J687: 49055391.299999997 | K687: -- | L687: -- | M687: -- | N687: =POWER(D687/M687,1/9)-1 -> #VALUE! | O687: =POWER(D687/I687,1/5)-1 -> 0.19981704140420242
A688: 1127.HK | B688: 狮子山集团 | C688: 1.47 | D688: 185248000 | E688: 219911000 | F688: 132491000 | G688: 104323000 | H688: 138801000 | I688: 169395000 | J688: 147668000 | K688: 146146000 | L688: 163241000 | M688: 146446000 | N688: =POWER(D688/M688,1/9)-1 -> 2.6459407378856215e-02 | O688: =POWER(D688/I688,1/5)-1 -> 1.8053469087466523e-02
A689: 2488.HK | B689: 元征科技 | C689: 4.41 | D689: 185151916.24000001 | E689: 370053602.74000001 | F689: 113129674.06999999 | G689: -143577819.38999999 | H689: -153020969.63999999 | I689: 67071582.109999999 | J689: 72026180.640000001 | K689: 23793570.850000001 | L689: -110429512.44 | M689: -58580631.399999999 | N689: =POWER(D689/M689,1/9)-1 -> -2.136398004764076 | O689: =POWER(D689/I689,1/5)-1 -> 0.22517445198325325
A690: 6122.HK | B690: 九台农商银行 | C690: 0.97 | D690: 184543077.59999999 | E690: 1898974725.9000001 | F690: 1382947851 | G690: 1316353430.4000001 | H690: 1164598155 | I690: 1119175484 | J690: 1529264088.4000001 | K690: 2096702055 | L690: 1429866287.05 | M690: 1376458658 | N690: =POWER(D690/M690,1/9)-1 -> -0.20009727488593232 | O690: =POWER(D690/I690,1/5)-1 -> -0.30266748766427254
A691: 1303.HK | B691: 汇力资源 | C691: 0.55 | D691: 183732985.80000001 | E691: 204010116.40000001 | F691: -20430782.5 | G691: -19950022.199999999 | H691: -17894527.5 | I691: -46988883.399999999 | J691: -55304058.100000001 | K691: -38465918.75 | L691: -119731298.40000001 | M691: -67968121.400000006 | N691: =POWER(D691/M691,1/9)-1 -> -2.1168294925923989 | O691: =POWER(D691/I691,1/5)-1 -> -2.3135251770081746
A692: 0064.HK | B692: 结好控股 | C692: 0.15 | D692: 183700000 | E692: 60185000 | F692: 189640000 | G692: 118295000 | H692: 195080000 | I692: 297143000 | J692: 341945000 | K692: 463714000 | L692: 260583000 | M692: 487406000 | N692: =POWER(D692/M692,1/9)-1 -> -0.10275066979906355 | O692: =POWER(D692/I692,1/5)-1 -> -9.170122072136111e-02
A693: 1373.HK | B693: 国际家居零售 | C693: 1.19 | D693: 181571000 | E693: 220822000 | F693: 254918000 | G693: 150927000 | H693: 119052000 | I693: 104845000 | J693: 87492000 | K693: 66492000 | L693: 88390000 | M693: 144365000 | N693: =POWER(D693/M693,1/9)-1 -> 2.5805332261307656e-02 | O693: =POWER(D693/I693,1/5)-1 -> 0.11609137578325979
A694: 1419.HK | B694: 盈健医疗 | C694: 1.05 | D694: 180839000 | E694: 375309000 | F694: 144453000 | G694: -40374000 | H694: 26624000 | I694: 24111000 | J694: 13469000 | K694: 23431000 | L694: 33727000 | M694: 38748000 | N694: =POWER(D694/M694,1/9)-1 -> 0.1866922047114874 | O694: =POWER(D694/I694,1/5)-1 -> 0.49628862628572556
A695: 0528.HK | B695: 金达控股 | C695: 1.06 | D695: 179350378.19999999 | E695: 198202657.59999999 | F695: 108029063.5 | G695: -13321866.300000001 | H695: 169265490 | I695: 116144031.59999999 | J695: -3754954.7999999998 | K695: 73724770 | L695: 141559962.44999999 | M695: 137864248.30000001 | N695: =POWER(D695/M695,1/9)-1 -> 2.9661597545373564e-02 | O695: =POWER(D695/I695,1/5)-1 -> 9.0789829458113758e-02
A696: 0898.HK | B696: 万事昌国际 | C696: 0.72 | D696: 179229000 | E696: 264120000 | F696: 421295000 | G696: 37355000 | H696: 530993000 | I696: 732554000 | J696: 651494000 | K696: 516430000 | L696: 659603000 | M696: 480088000 | N696: =POWER(D696/M696,1/9)-1 -> -0.10369842620113612 | O696: =POWER(D696/I696,1/5)-1 -> -0.24540534002060022
A697: 3737.HK | B697: 中智药业 | C697: 1.15 | D697: 178433955 | E697: 120015174.7 | F697: 63830736 | G697: 165116290.80000001 | H697: 128170545 | I697: 96859563.400000006 | J697: 83990138.400000006 | K697: 59865260 | L697: 94717890.950000003 | M697: 108177955.2 | N697: =POWER(D697/M697,1/9)-1 -> 5.7179536868802394e-02 | O697: =POWER(D697/I697,1/5)-1 -> 0.12997022256529256
A698: 3833.HK | B698: 新疆新鑫矿业 | C698: 0.92 | D698: 178311891.15000001 | E698: 840044678.60000002 | F698: 631334337.12 | G698: 180976190.71000001 | H698: 30642477.93 | I698: -61704657.390000001 | J698: -97815069.109999999 | K698: -230104274.84 | L698: -871486584.48000002 | M698: 97039122.239999995 | N698: =POWER(D698/M698,1/9)-1 -> 6.9939625044013853e-02 | O698: =POWER(D698/I698,1/5)-1 -> -2.2364383649928379
A699: 2142.HK | B699: 和铂医药-B | C699: 1.36 | D699: 178067367 | E699: -1071429376 | F699: -1074385046 | G699: -2297965941 | H699: -525311020 | I699: -270923222 | J699: -- | K699: -- | L699: -- | M699: -- | N699: =POWER(D699/M699,1/9)-1 -> #VALUE! | O699: =POWER(D699/I699,1/5)-1 -> -1.9194912928519856
A700: 9977.HK | B700: 凤祥股份 | C700: 1.52 | D700: 175741249.11000001 | E700: -867541210.22000003 | F700: 62340119.479999997 | G700: 181931616.75 | H700: 935930835 | I700: 159840083.80000001 | J700: 44958750 | K700: 133411118.75 | L700: -- | M700: -- | N700: =POWER(D700/M700,1/9)-1 -> #VALUE! | O700: =POWER(D700/I700,1/5)-1 -> 1.9148810825081908e-02
A701: 1425.HK | B701: 捷隆控股 | C701: 0.58 | D701: 175420000 | E701: 172553000 | F701: 158316000 | G701: 105609000 | H701: 52403000 | I701: 37165000 | J701: 46565000 | K701: 41159000 | L701: -- | M701: -- | N701: =POWER(D701/M701,1/9)-1 -> #VALUE! | O701: =POWER(D701/I701,1/5)-1 -> 0.36392030196422498
A702: 6068.HK | B702: 光正教育 | C702: 0.16 | D702: 175345844 | E702: 109343108 | F702: -2554614302.1999998 | G702: 578798133.25 | H702: 393503051.39999998 | I702: 356172525 | J702: 237386233.15000001 | K702: 178996254.84999999 | L702: 219312915 | M702: 114646337 | N702: =POWER(D702/M702,1/9)-1 -> 4.8344259632244313e-02 | O702: =POWER(D702/I702,1/5)-1 -> -0.13214531490526749
A703: 1655.HK | B703: Okura Holdings | C703: 0.22 | D703: 174379100 | E703: -76082995 | F703: -40525595 | G703: -457841330 | H703: 43494370 | I703: 52678700 | J703: 18747955 | K703: 45692600 | L703: 35644850 | M703: 77968800 | N703: =POWER(D703/M703,1/9)-1 -> 9.3557211954190311e-02 | O703: =POWER(D703/I703,1/5)-1 -> 0.27049182986763354
A704: 1522.HK | B704: 京投交通科技 | C704: 0.27 | D704: 174313000 | E704: 179252000 | F704: 187535000 | G704: 168407000 | H704: 96870000 | I704: 47398000 | J704: 38554000 | K704: 25728000 | L704: 22945000 | M704: -- | N704: =POWER(D704/M704,1/9)-1 -> #VALUE! | O704: =POWER(D704/I704,1/5)-1 -> 0.29751967538407831
A705: 1627.HK | B705: 安保工程控股 | C705: 0.43 | D705: 174068000 | E705: 122880000 | F705: 94700000 | G705: 23975000 | H705: 141432000 | I705: 174971000 | J705: 101487000 | K705: 201890000 | L705: 68685000 | M705: 58314000 | N705: =POWER(D705/M705,1/9)-1 -> 0.12920239254444832 | O705: =POWER(D705/I705,1/5)-1 -> -1.0343084214594622e-03
A706: 1697.HK | B706: 山东国信 | C706: 0.33 | D706: 173894093.91 | E706: 316351954.89999998 | F706: 573701515.5 | G706: 748296274.20000005 | H706: 741914955 | I706: 993141572.79999995 | J706: 1072781714.5 | K706: 925703476.25 | L706: 1264853535.5 | M706: 1229815433.2 | N706: =POWER(D706/M706,1/9)-1 -> -0.19535375646584885 | O706: =POWER(D706/I706,1/5)-1 -> -0.29424374804598741
A707: 3662.HK | B707: 星悦康旅 | C707: 0.55 | D707: 172253579.40000001 | E707: 180955136.69999999 | F707: -233806030 | G707: 299302776.60000002 | H707: 181569165 | I707: 88974758.400000006 | J707: 83623275 | K707: 45566806.25 | L707: 31653385.75 | M707: -- | N707: =POWER(D707/M707,1/9)-1 -> #VALUE! | O707: =POWER(D707/I707,1/5)-1 -> 0.14124867826911247
A708: 0035.HK | B708: 远东发展 | C708: 1.13 | D708: 172185000 | E708: 1300381000 | F708: 543194000 | G708: 365853000 | H708: 1713659000 | I708: 1566722000 | J708: 1117688000 | K708: 734427000 | L708: 956539000 | M708: 914057000 | N708: =POWER(D708/M708,1/9)-1 -> -0.16929486914978309 | O708: =POWER(D708/I708,1/5)-1 -> -0.35701524710424271
A709: 1501.HK | B709: 瑛泰医疗 | C709: 27.199999999999999 | D709: 171508163.40000001 | E709: 148585435.30000001 | F709: 175054520 | G709: 144641832.59999999 | H709: 111318645 | I709: 66552308.600000001 | J709: 48879153 | K709: 37783611.25 | L709: -- | M709: -- | N709: =POWER(D709/M709,1/9)-1 -> #VALUE! | O709: =POWER(D709/I709,1/5)-1 -> 0.20843789091251219
A710: 0458.HK | B710: 联亚集团 | C710: 3 | D710: 171232000 | E710: 30772000 | F710: 21134000 | G710: -169437000 | H710: -38829000 | I710: -80455000 | J710: -64180000 | K710: -84091000 | L710: -45669000 | M710: 148277000 | N710: =POWER(D710/M710,1/9)-1 -> 1.6121596922140879e-02 | O710: =POWER(D710/I710,1/5)-1 -> -2.163071404003559
A711: 1860.HK | B711: 汇量科技 | C711: 2.01 | D711: 170311044 | E711: 117073152 | F711: -194622484 | G711: -40362118 | H711: 171851303 | I711: 171204236 | J711: 212282938 | K711: 152986420 | L711: 67514605.5 | M711: -- | N711: =POWER(D711/M711,1/9)-1 -> #VALUE! | O711: =POWER(D711/I711,1/5)-1 -> -1.0456070839616194e-03
A712: 2520.HK | B712: 山西安装 | C712: 2.07 | D712: 169847420.40000001 | E712: -- | F712: -- | G712: -- | H712: -- | I712: -- | J712: -- | K712: -- | L712: -- | M712: -- | N712: =POWER(D712/M712,1/9)-1 -> #VALUE! | O712: =POWER(D712/I712,1/5)-1 -> #VALUE!
A713: 0487.HK | B713: 实德环球 | C713: 0.08 | D713: 169301000 | E713: -287072000 | F713: 4859000 | G713: -141936000 | H713: 74194000 | I713: 54464000 | J713: -29810000 | K713: -30977000 | L713: -6670000 | M713: 96890000 | N713: =POWER(D713/M713,1/9)-1 -> 6.3974389015367006e-02 | O713: =POWER(D713/I713,1/5)-1 -> 0.25461361987170239
A714: 1553.HK | B714: 迈科管业 | C714: 1.2 | D714: 168519922.19999999 | E714: 157589929.5 | F714: 142067714.5 | G714: 118626231.3 | H714: 86429685 | I714: 59373435.600000001 | J714: 47760579.299999997 | K714: 5079523.75 | L714: -- | M714: -- | N714: =POWER(D714/M714,1/9)-1 -> #VALUE! | O714: =POWER(D714/I714,1/5)-1 -> 0.2320031380729799
A715: 1358.HK | B715: 普华和顺 | C715: 1.14 | D715: 167920300.80000001 | E715: 119624852.09999999 | F715: 905052440 | G715: 753059106.60000002 | H715: 91614885 | I715: 1896468100.4000001 | J715: 146366507.59999999 | K715: 216637076.25 | L715: 245302861.09999999 | M715: 220416577 | N715: =POWER(D715/M715,1/9)-1 -> -2.9773311837019811e-02 | O715: =POWER(D715/I715,1/5)-1 -> -0.38421155925078276
A716: 1837.HK | B716: 五谷磨房 | C716: 0.49 | D716: 167033475 | E716: 131380782.2 | F716: 105957209.5 | G716: -17225338.800000001 | H716: 141173775 | I716: 119825125.40000001 | J716: 222634531.09999999 | K716: 97353278.75 | L716: 33727937.950000003 | M716: -- | N716: =POWER(D716/M716,1/9)-1 -> #VALUE! | O716: =POWER(D716/I716,1/5)-1 -> 6.8688472447633764e-02
A717: 0018.HK | B717: 东方企控集团 | C717: 0.41 | D717: 166564000 | E717: 166744000 | F717: 211238000 | G717: -10987000 | H717: 81388000 | I717: 158134000 | J717: 163889000 | K717: 54612000 | L717: 60786000 | M717: 90361000 | N717: =POWER(D717/M717,1/9)-1 -> 7.0313796790133276e-02 | O717: =POWER(D717/I717,1/5)-1 -> 1.0441505016725916e-02
A718: 3788.HK | B718: 中国罕王 | C718: 0.87 | D718: 166398775.19999999 | E718: -57868145.700000003 | F718: 806892846.5 | G718: 452254536 | H718: 331421445 | I718: 451672372.60000002 | J718: 1051630720.7 | K718: -230482140 | L718: -448775975.80000001 | M718: 11218621 | N718: =POWER(D718/M718,1/9)-1 -> 0.34938076936792095 | O718: =POWER(D718/I718,1/5)-1 -> -0.18103504167232487
A719: 2291.HK | B719: 心泰医疗 | C719: 18.52 | D719: 166109378.40000001 | E719: -22351045.300000001 | F719: 71874476.5 | G719: 81969346.799999997 | H719: -- | I719: -- | J719: -- | K719: -- | L719: -- | M719: -- | N719: =POWER(D719/M719,1/9)-1 -> #VALUE! | O719: =POWER(D719/I719,1/5)-1 -> #VALUE!
A720: 2409.HK | B720: 洲际船务 | C720: 3.73 | D720: 165679121 | E720: 447523328 | F720: 262145366 | G720: 3496603 | H720: -- | I720: -- | J720: -- | K720: -- | L720: -- | M720: -- | N720: =POWER(D720/M720,1/9)-1 -> #VALUE! | O720: =POWER(D720/I720,1/5)-1 -> #VALUE!
A721: 0169.HK | B721: 万达酒店发展 | C721: 0.22 | D721: 165154000 | E721: 193242000 | F721: 233070000 | G721: 165131000 | H721: -150387000 | I721: 766716000 | J721: -285438000 | K721: -60663000 | L721: -262693000 | M721: -176026000 | N721: =POWER(D721/M721,1/9)-1 -> -1.9929413259131612 | O721: =POWER(D721/I721,1/5)-1 -> -0.26438442803588047
A722: 2418.HK | B722: 德银天下 | C722: 1.54 | D722: 163615523.40000001 | E722: 255415377.19999999 | F722: 444149415.5 | G722: 326573448.60000002 | H722: -- | I722: -- | J722: -- | K722: -- | L722: -- | M722: -- | N722: =POWER(D722/M722,1/9)-1 -> #VALUE! | O722: =POWER(D722/I722,1/5)-1 -> #VALUE!
A723: 2481.HK | B723: 慧居科技 | C723: 2.1000000000000001 | D723: 163311876 | E723: 108783811.09999999 | F723: 135547252 | G723: 79654677 | H723: -- | I723: -- | J723: -- | K723: -- | L723: -- | M723: -- | N723: =POWER(D723/M723,1/9)-1 -> #VALUE! | O723: =POWER(D723/I723,1/5)-1 -> #VALUE!
A724: 8049.HK | B724: 吉林长龙药业 | C724: 1.3 | D724: 162464513.40000001 | E724: 218360676.5 | F724: 175450033.5 | G724: 150844480.19999999 | H724: 161731305 | I724: 183560537.59999999 | J724: 173123557.80000001 | K724: 158542037.5 | L724: 138348169.90000001 | M724: 165702401.5 | N724: =POWER(D724/M724,1/9)-1 -> -2.1902444113488517e-03 | O724: =POWER(D724/I724,1/5)-1 -> -2.4121300784982425e-02
A725: 1851.HK | B725: 银杏教育 | C725: 0.69999999999999996 | D725: 162272678.40000001 | E725: 95897524.799999997 | F725: 47367333.5 | G725: 20176483.199999999 | H725: 35847165 | I725: 28360248.800000001 | J725: 49389884.399999999 | K725: 44332207.5 | L725: 43326858.049999997 | M725: -- | N725: =POWER(D725/M725,1/9)-1 -> #VALUE! | O725: =POWER(D725/I725,1/5)-1 -> 0.4174477980069089
A726: 0232.HK | B726: 大陆航空科技控股 | C726: 0.13 | D726: 162209000 | E726: 50832000 | F726: -55972000 | G726: -756738000 | H726: -54016000 | I726: 398968000 | J726: -288481000 | K726: -685842000 | L726: 41820000 | M726: 27266000 | N726: =POWER(D726/M726,1/9)-1 -> 0.21913104520081328 | O726: =POWER(D726/I726,1/5)-1 -> -0.16472905120808345
A727: 6968.HK | B727: 港龙中国地产 | C727: 0.16 | D727: 162206906.40000001 | E727: 137499596.59999999 | F727: 588906132 | G727: 1145115541.2 | H727: 746535817.5 | I727: 404010576.60000002 | J727: 37592708.399999999 | K727: 43744356.25 | L727: -- | M727: -- | N727: =POWER(D727/M727,1/9)-1 -> #VALUE! | O727: =POWER(D727/I727,1/5)-1 -> -0.1668267434641808
A728: 3318.HK | B728: 中国波顿 | C728: 1.82 | D728: 160450794 | E728: 54506407.700000003 | F728: 224710444 | G728: 139001761.80000001 | H728: 133467495 | I728: 145131649 | J728: 155986481.19999999 | K728: 102291673.75 | L728: 84107567.849999994 | M728: 85091805.200000003 | N728: =POWER(D728/M728,1/9)-1 -> 7.301554770003249e-02 | O728: =POWER(D728/I728,1/5)-1 -> 2.0271952947707339e-02
A729: 1345.HK | B729: 上海先锋控股 | C729: 1.8999999999999999 | D729: 159736071.59999999 | E729: 265437417.59999999 | F729: 174654108.5 | G729: 62512771.200000003 | H729: 116920672.5 | I729: 96322144.200000003 | J729: 334403182.5 | K729: 263860756.25 | L729: 204987867.09999999 | M729: 326597892.19999999 | N729: =POWER(D729/M729,1/9)-1 -> -7.639189409259628e-02 | O729: =POWER(D729/I729,1/5)-1 -> 0.10645911683150544
A730: 2451.HK | B730: 绿源集团控股 | C730: 5.85 | D730: 159614393.40000001 | E730: -- | F730: -- | G730: -- | H730: -- | I730: -- | J730: -- | K730: -- | L730: -- | M730: -- | N730: =POWER(D730/M730,1/9)-1 -> #VALUE! | O730: =POWER(D730/I730,1/5)-1 -> #VALUE!
A731: 2172.HK | B731: 微创脑科学 | C731: 7.18 | D731: 159549717.59999999 | E731: -24553096.5 | F731: 29596165 | G731: 53977575.299999997 | H731: -- | I731: -- | J731: -- | K731: -- | L731: -- | M731: -- | N731: =POWER(D731/M731,1/9)-1 -> #VALUE! | O731: =POWER(D731/I731,1/5)-1 -> #VALUE!
A732: 1003.HK | B732: 欢喜传媒 | C732: 0.58 | D732: 159135000 | E732: -221812000 | F732: -235557000 | G732: -236391000 | H732: 105103000 | I732: -444693000 | J732: -95159000 | K732: -1253745000 | L732: -92796000 | M732: -13144000 | N732: =POWER(D732/M732,1/9)-1 -> -2.3192818057582567 | O732: =POWER(D732/I732,1/5)-1 -> -1.8142187197645216
A733: 1745.HK | B733: 驴迹科技 | C733: 0.39 | D733: 159132065.40000001 | E733: 42345489.700000003 | F733: -673006016.5 | G733: -119961159.3 | H733: 179676120 | I733: 113612923.8 | J733: 30643884 | K733: 4270533.75 | L733: -- | M733: -- | N733: =POWER(D733/M733,1/9)-1 -> #VALUE! | O733: =POWER(D733/I733,1/5)-1 -> 6.9709844526902209e-02
A734: 1786.HK | B734: 铁建装备 | C734: 0.74 | D734: 158987503.94 | E734: 130447976.19 | F734: 61685600.060000002 | G734: 26408597.879999999 | H734: 136517152.5 | I734: 178031496 | J734: 66043804.299999997 | K734: 516929052.5 | L734: 536555171.75 | M734: 442829794 | N734: =POWER(D734/M734,1/9)-1 -> -0.10757942782629215 | O734: =POWER(D734/I734,1/5)-1 -> -2.2372904086748746e-02
A735: 0655.HK | B735: 香港华人有限公司 | C735: 0.27 | D735: 157119000 | E735: 488768000 | F735: 670303000 | G735: 424838000 | H735: 10818000 | I735: 326840000 | J735: 44996000 | K735: 229455000 | L735: 655067000 | M735: 313577000 | N735: =POWER(D735/M735,1/9)-1 -> -7.390863683756399e-02 | O735: =POWER(D735/I735,1/5)-1 -> -0.13626861447418959
A736: 3348.HK | B736: 中国鹏飞集团 | C736: 1.08 | D736: 156609709.19999999 | E736: 137876382 | F736: 133755808.5 | G736: 157255710.30000001 | H736: 88209862.5 | I736: 82555331.599999994 | J736: 70399408 | K736: 35384422.5 | L736: -- | M736: -- | N736: =POWER(D736/M736,1/9)-1 -> #VALUE! | O736: =POWER(D736/I736,1/5)-1 -> 0.13661847618295453
A737: 1278.HK | B737: 中国新城镇 | C737: 0.08 | D737: 154408539.59999999 | E737: 3048126.2000000002 | F737: 132959883.5 | G737: -299077507.5 | H737: 106622910 | I737: 95520569.799999997 | J737: 402367624.60000002 | K737: 358549257.5 | L737: 76609073.049999997 | M737: -76626051.599999994 | N737: =POWER(D737/M737,1/9)-1 -> -2.080962283162112 | O737: =POWER(D737/I737,1/5)-1 -> 0.10081637749339323
A738: 0588.HK | B738: 北京北辰实业股份 | C738: 0.63 | D738: 153914153.40000001 | E738: -1659832191.2 | F738: 253929463 | G738: 25814170.199999999 | H738: 1998882307.5 | I738: 1597945398 | J738: 1666184462.9000001 | K738: 896568723.75 | L738: 894605946.35000002 | M738: 973352016.79999995 | N738: =POWER(D738/M738,1/9)-1 -> -0.18529391826298092 | O738: =POWER(D738/I738,1/5)-1 -> -0.37375636546540014
A739: 1268.HK | B739: 美东汽车 | C739: 2.14 | D739: 153690528.59999999 | E739: 587772814.89999998 | F739: 1427326180 | G739: 894590080.20000005 | H739: 615531292.5 | I739: 413230959.39999998 | J739: 330641034.30000001 | K739: 168973341.25 | L739: 120148796.15000001 | M739: 138117572 | N739: =POWER(D739/M739,1/9)-1 -> 1.1941372576455e-02 | O739: =POWER(D739/I739,1/5)-1 -> -0.17947682745939719
A740: 0160.HK | B740: 汉国置业 | C740: 1.27 | D740: 153423000 | E740: 91693000 | F740: 121516000 | G740: -35946000 | H740: 1158507000 | I740: 2979893000 | J740: 584879000 | K740: 460100000 | L740: 1898184000 | M740: 436782000 | N740: =POWER(D740/M740,1/9)-1 -> -0.10974592372060754 | O740: =POWER(D740/I740,1/5)-1 -> -0.44749277682838617
A741: 0099.HK | B741: 王氏国际 | C741: 1.55 | D741: 152726000 | E741: 112436000 | F741: 89474000 | G741: -761674000 | H741: 266327000 | I741: 1421749000 | J741: 479907000 | K741: 468225000 | L741: 598233000 | M741: 616595000 | N741: =POWER(D741/M741,1/9)-1 -> -0.14363876928333974 | O741: =POWER(D741/I741,1/5)-1 -> -0.35994394678774411
A742: 1569.HK | B742: 民生教育 | C742: 0.22 | D742: 152228197.80000001 | E742: 552843454.60000002 | F742: 706396907 | G742: 156695517.30000001 | H742: 381745822.5 | I742: 378970485.39999998 | J742: 311650458.30000001 | K742: 270512698.75 | L742: 238981592.34999999 | M742: 233090249.40000001 | N742: =POWER(D742/M742,1/9)-1 -> -4.6235349361685718e-02 | O742: =POWER(D742/I742,1/5)-1 -> -0.16674497078923123
A743: 2878.HK | B743: 晶门半导体 | C743: 0.31 | D743: 151869273 | E743: 217320064 | F743: 185452036 | G743: 90826395 | H743: -212367064 | I743: -107145618 | J743: -79960662 | K743: -53727466 | L743: -49874467.5 | M743: -23306780 | N743: =POWER(D743/M743,1/9)-1 -> -2.2315245415995433 | O743: =POWER(D743/I743,1/5)-1 -> -2.072257518112492
A744: 0716.HK | B744: 胜狮货柜 | C744: 0.76 | D744: 151830218 | E744: 361822720 | F744: 1456681996 | G744: 35477728 | H744: -858361010 | I744: 566022168 | J744: 323905928 | K744: -460851236 | L744: -21104611.5 | M744: 217330876 | N744: =POWER(D744/M744,1/9)-1 -> -3.9067291842970864e-02 | O744: =POWER(D744/I744,1/5)-1 -> -0.23139190345540372
A745: 1900.HK | B745: 中国智能交通 | C745: 0.18 | D745: 150395351.40000001 | E745: 54701569 | F745: 91248515.5 | G745: -211090257.59999999 | H745: -49437082.5 | I745: -132394130.8 | J745: 29361061 | K745: 83906042.5 | L745: -327501699.80000001 | M745: -242912470.30000001 | N745: =POWER(D745/M745,1/9)-1 -> -1.9481235977012896 | O745: =POWER(D745/I745,1/5)-1 -> -2.0258246625211926
A746: 1469.HK | B746: 结好金融 | C746: 0.69 | D746: 149831000 | E746: 466867000 | F746: 213209000 | G746: 139716000 | H746: 132980000 | I746: 276937000 | J746: 274060000 | K746: 344489000 | L746: 191985000 | M746: 113349000 | N746: =POWER(D746/M746,1/9)-1 -> 3.1489679987929176e-02 | O746: =POWER(D746/I746,1/5)-1 -> -0.11560935712161025
A747: 1855.HK | B747: 中庆股份 | C747: 29.399999999999999 | D747: 148212817.19999999 | E747: -118773136.59999999 | F747: 41091771 | G747: 81651109.5 | H747: 55311780 | I747: 80172241.799999997 | J747: 63094510.299999997 | K747: 42832020 | L747: -- | M747: -- | N747: =POWER(D747/M747,1/9)-1 -> #VALUE! | O747: =POWER(D747/I747,1/5)-1 -> 0.13076497243469154
A748: 2175.HK | B748: 中国通才教育 | C748: 3.11 | D748: 147543337.19999999 | E748: -- | F748: 156379058.84999999 | G748: 161427000.75 | H748: -- | I748: -- | J748: -- | K748: -- | L748: -- | M748: -- | N748: =POWER(D748/M748,1/9)-1 -> #VALUE! | O748: =POWER(D748/I748,1/5)-1 -> #VALUE!
A749: 1921.HK | B749: 达力普控股 | C749: 4.47 | D749: 147464112.59999999 | E749: 171001910.40000001 | F749: 101558805.5 | G749: -138757422.30000001 | H749: 372942157.5 | I749: 342944042.80000001 | J749: 278395370.10000002 | K749: -58857356.25 | L749: -- | M749: -- | N749: =POWER(D749/M749,1/9)-1 -> #VALUE! | O749: =POWER(D749/I749,1/5)-1 -> -0.15531921338159171
A750: 1461.HK | B750: 中泰期货 | C750: 0.49 | D750: 146582574.59 | E750: 187331899.53999999 | F750: 230907521.11000001 | G750: 67740444.599999994 | H750: 33245625 | I750: 134034853.40000001 | J750: 190182705.90000001 | K750: 125574583.75 | L750: 110058287.15000001 | M750: 100195138.90000001 | N750: =POWER(D750/M750,1/9)-1 -> 4.3180647142397444e-02 | O750: =POWER(D750/I750,1/5)-1 -> 1.8058936163606765e-02
A751: 1140.HK | B751: 华科智能投资 | C751: 0.10000000000000001 | D751: 146383000 | E751: 221273000 | F751: 372556000 | G751: -1372674000 | H751: 256690000 | I751: 143420000 | J751: 188060000 | K751: 44157000 | L751: -2951000 | M751: 47220000 | N751: =POWER(D751/M751,1/9)-1 -> 0.13395566085684996 | O751: =POWER(D751/I751,1/5)-1 -> 4.0981919379283749e-03
A752: 0978.HK | B752: 招商局置地 | C752: 0.29 | D752: 146248426.80000001 | E752: 371888317.89999998 | F752: 686416740.5 | G752: 835831794 | H752: 2005320225 | I752: 1384687895.2 | J752: 1963946863.5999999 | K752: 901722701.25 | L752: 218058486.80000001 | M752: 474507735.5 | N752: =POWER(D752/M752,1/9)-1 -> -0.12258445808224205 | O752: =POWER(D752/I752,1/5)-1 -> -0.36210696315068247
A753: 0045.HK | B753: 大酒店 | C753: 5.56 | D753: 146000000 | E753: -488000000 | F753: -120000000 | G753: -1940000000 | H753: 494000000 | I753: 1216000000 | J753: 1155000000 | K753: 675000000 | L753: 1000000000 | M753: 1146000000 | N753: =POWER(D753/M753,1/9)-1 -> -0.20462076494416637 | O753: =POWER(D753/I753,1/5)-1 -> -0.34553887256636306
A754: 3315.HK | B754: 金邦达宝嘉 | C754: 1.04 | D754: 144754306.19999999 | E754: 166312398.69999999 | F754: 169206308 | G754: 173618113.5 | H754: 197937187.5 | I754: 199467918.19999999 | J754: 197191475.30000001 | K754: 227695125 | L754: 284413579.89999998 | M754: 266435385.30000001 | N754: =POWER(D754/M754,1/9)-1 -> -6.5541638682813486e-02 | O754: =POWER(D754/I754,1/5)-1 -> -6.2110470619870628e-02
A755: 3869.HK | B755: 弘和仁爱医疗 | C755: 6 | D755: 144023140.80000001 | E755: -596310275.70000005 | F755: -343728170.5 | G755: -481935229.80000001 | H755: 168630750 | I755: -57487914 | J755: -16483676.1 | K755: 26745565 | L755: 59902106.75 | M755: -- | N755: =POWER(D755/M755,1/9)-1 -> #VALUE! | O755: =POWER(D755/I755,1/5)-1 -> -2.2016310598678941
A756: 0917.HK | B756: 趣致集团 | C756: 53 | D756: 143538620.40000001 | E756: -- | F756: -- | G756: -- | H756: -- | I756: -- | J756: -- | K756: -- | L756: -- | M756: -- | N756: =POWER(D756/M756,1/9)-1 -> #VALUE! | O756: =POWER(D756/I756,1/5)-1 -> #VALUE!
A757: 2217.HK | B757: 谭仔国际 | C757: 1.01 | D757: 140953000 | E757: 202960000 | F757: 287792000 | G757: 190896000 | H757: -- | I757: -- | J757: -- | K757: -- | L757: -- | M757: -- | N757: =POWER(D757/M757,1/9)-1 -> #VALUE! | O757: =POWER(D757/I757,1/5)-1 -> #VALUE!
A758: 1502.HK | B758: 金融街物业 | C758: 2.29 | D758: 140421027.59999999 | E758: 136557633.09999999 | F758: 168634466.5 | G758: 125035077.59999999 | H758: 117579997.5 | I758: 99115130 | J758: 95214240.200000003 | K758: -- | L758: -- | M758: -- | N758: =POWER(D758/M758,1/9)-1 -> #VALUE! | O758: =POWER(D758/I758,1/5)-1 -> 7.2157130827668947e-02
A759: 1940.HK | B759: Cgii Hldgs | C759: 0.49 | D759: 140397197.31 | E759: 127184836.81 | F759: -32836839.760000002 | G759: -33012472.66 | H759: 149563420.78 | I759: 136441419.99000001 | J759: 95900962.930000007 | K759: 49908076.619999997 | L759: -- | M759: -- | N759: =POWER(D759/M759,1/9)-1 -> #VALUE! | O759: =POWER(D759/I759,1/5)-1 -> 5.7324005439993719e-03
A760: 1118.HK | B760: 高力集团 | C760: 0.85 | D760: 138921000 | E760: 75673000 | F760: 197584000 | G760: 93545000 | H760: -6233000 | I760: -84782000 | J760: 42432000 | K760: 72670000 | L760: 92740000 | M760: 107436000 | N760: =POWER(D760/M760,1/9)-1 -> 2.8968329368620704e-02 | O760: =POWER(D760/I760,1/5)-1 -> -2.1038062497345109
A761: 2180.HK | B761: 万宝盛华 | C761: 4.78 | D761: 138642991.19999999 | E761: 133799428.59999999 | F761: 170412440.5 | G761: 150604908.30000001 | H761: 123091507.5 | I761: 111760421.59999999 | J761: 101173972.09999999 | K761: 72655747.5 | L761: -- | M761: -- | N761: =POWER(D761/M761,1/9)-1 -> #VALUE! | O761: =POWER(D761/I761,1/5)-1 -> 4.405163456531791e-02
A762: 2146.HK | B762: 荣万家 | C762: 1.41 | D762: 138480746.53 | E762: 265749280.34999999 | F762: 488519563.97000003 | G762: 314370461.87 | H762: 126536760 | I762: 82286622 | J762: 46018577.600000001 | K762: -- | L762: -- | M762: -- | N762: =POWER(D762/M762,1/9)-1 -> #VALUE! | O762: =POWER(D762/I762,1/5)-1 -> 0.10971647168532828
A763: 1293.HK | B763: 广汇宝信 | C763: 0.12 | D763: 137843861.40000001 | E763: -787393494.20000005 | F763: 675906857 | G763: 251989114.19999999 | H763: 703133235 | I763: 633382685.20000005 | J763: 968618884.70000005 | K763: 460308642.5 | L763: 258841548.69999999 | M763: 881821047.60000002 | N763: =POWER(D763/M763,1/9)-1 -> -0.18633577982295513 | O763: =POWER(D763/I763,1/5)-1 -> -0.26286972491956107
A764: 6136.HK | B764: 康达环保 | C764: 0.22 | D764: 136754238.59999999 | E764: 265869479.90000001 | F764: 505414824 | G764: 560774647.20000005 | H764: 421149990 | I764: 345394310 | J764: 496881707.19999999 | K764: 371798691.25 | L764: 382078652.14999998 | M764: 367865945.19999999 | N764: =POWER(D764/M764,1/9)-1 -> -0.10411939522663627 | O764: =POWER(D764/I764,1/5)-1 -> -0.16914521872366339
A765: 0450.HK | B765: 鸿兴印刷集团 | C765: 1.08 | D765: 135155000 | E765: 66038000 | F765: 51953000 | G765: 109357000 | H765: 75753000 | I765: -74518000 | J765: 1050483000 | K765: 37785000 | L765: 38199000 | M765: 7914000 | N765: =POWER(D765/M765,1/9)-1 -> 0.3706839934713726 | O765: =POWER(D765/I765,1/5)-1 -> -2.1264558773409545
A766: 1982.HK | B766: 南旋控股 | C766: 0.69999999999999996 | D766: 134844000 | E766: 263302000 | F766: 313677000 | G766: 157045000 | H766: -298511000 | I766: 326968000 | J766: 328131000 | K766: 231887000 | L766: 273346000 | M766: 219368000 | N766: =POWER(D766/M766,1/9)-1 -> -5.2634435651785161e-02 | O766: =POWER(D766/I766,1/5)-1 -> -0.16234482629822977
A767: 3689.HK | B767: 康华医疗 | C767: 2.58 | D767: 132708164.40000001 | E767: 68850199.200000003 | F767: 115478921.5 | G767: -30240886.800000001 | H767: 82990020 | I767: 191219899.80000001 | J767: 187738148.80000001 | K767: 156975175 | L767: 139770014.34999999 | M767: 127581552.3 | N767: =POWER(D767/M767,1/9)-1 -> 4.3870035912982885e-03 | O767: =POWER(D767/I767,1/5)-1 -> -7.0449666186147564e-02
A768: 1853.HK | B768: 春城热力 | C768: 1.45 | D768: 132591449.06 | E768: 129356945.37 | F768: 150317166.90000001 | G768: 203226590.00999999 | H768: 149712592.5 | I768: 116908032.2 | J768: 102903984.8 | K768: 80892332.5 | L768: -- | M768: -- | N768: =POWER(D768/M768,1/9)-1 -> #VALUE! | O768: =POWER(D768/I768,1/5)-1 -> 2.5496619991978164e-02
A769: 3818.HK | B769: 中国动向 | C769: 0.32 | D769: 131435821.15000001 | E769: -2199434779.5 | F769: 2144137916.25 | G769: 399907419.44999999 | H769: -- | I769: -- | J769: 964691288.29999995 | K769: 967127542.5 | L769: 944251721.04999995 | M769: 1142266512.9000001 | N769: =POWER(D769/M769,1/9)-1 -> -0.21356886362958427 | O769: =POWER(D769/I769,1/5)-1 -> #VALUE!
A770: 0771.HK | B770: 自动系统 | C770: 0.56 | D770: 131319000 | E770: 101585000 | F770: 4132000 | G770: 856298000 | H770: 93276000 | I770: 84333000 | J770: 52579000 | K770: 28797000 | L770: 19704000 | M770: 28495000 | N770: =POWER(D770/M770,1/9)-1 -> 0.18502842362544158 | O770: =POWER(D770/I770,1/5)-1 -> 9.2612094108402765e-02
A771: 1846.HK | B771: 德视佳 | C771: 5.32 | D771: 131242000 | E771: 89472000 | F771: 133560000 | G771: 65580000 | H771: -392000 | I771: 34313016 | J771: 81645539 | K771: 19381032 | L771: -- | M771: -- | N771: =POWER(D771/M771,1/9)-1 -> #VALUE! | O771: =POWER(D771/I771,1/5)-1 -> 0.30774416051229392
A772: 1450.HK | B772: 交个朋友控股 | C772: 1.42 | D772: 130954244.40000001 | E772: -10386416.699999999 | F772: -75447567.5 | G772: -116247198.90000001 | H772: -94233187.5 | I772: -40362231.399999999 | J772: -178276430 | K772: 57113805 | L772: 58904816.350000001 | M772: 121112438.7 | N772: =POWER(D772/M772,1/9)-1 -> 8.7187469221770009e-03 | O772: =POWER(D772/I772,1/5)-1 -> -2.2654030655050521
A773: 2490.HK | B773: 乐舱物流 | C773: 27 | D773: 130312967.40000001 | E773: 429742926.39999998 | F773: 470312082.5 | G773: 30418479.899999999 | H773: -- | I773: -- | J773: -- | K773: -- | L773: -- | M773: -- | N773: =POWER(D773/M773,1/9)-1 -> #VALUE! | O773: =POWER(D773/I773,1/5)-1 -> #VALUE!
A774: 0057.HK | B774: 震雄集团 | C774: 1.42 | D774: 130289000 | E774: 213309000 | F774: 203021000 | G774: 93651000 | H774: 90279000 | I774: 101877000 | J774: 51485000 | K774: -173087000 | L774: 20356000 | M774: 81368000 | N774: =POWER(D774/M774,1/9)-1 -> 5.3700347494612943e-02 | O774: =POWER(D774/I774,1/5)-1 -> 5.0428074772454812e-02
A775: 0858.HK | B775: 精优药业 | C775: 0.04 | D775: 129265000 | E775: 130588000 | F775: -121098000 | G775: 83280000 | H775: 64030000 | I775: 29930000 | J775: 20796000 | K775: 32781000 | L775: 565457000 | M775: 13816000 | N775: =POWER(D775/M775,1/9)-1 -> 0.28203489843552743 | O775: =POWER(D775/I775,1/5)-1 -> 0.33990758851476288
A776: 0677.HK | B776: 金源发展国际实业 | C776: 0.42 | D776: 128679000 | E776: 18697000 | F776: 40212000 | G776: -22652000 | H776: 4356000 | I776: 65367000 | J776: 59762000 | K776: -45762000 | L776: 143016000 | M776: 83382000 | N776: =POWER(D776/M776,1/9)-1 -> 4.9390826180453207e-02 | O776: =POWER(D776/I776,1/5)-1 -> 0.14506416808666045
A777: 0434.HK | B777: 博雅互动 | C777: 1.55 | D777: 128451619.8 | E777: 72424020 | F777: -5346167 | G777: -53757073.799999997 | H777: 37726800 | I777: 229464335.19999999 | J777: 291626430.5 | K777: 234774898.75 | L777: 420789513.94999999 | M777: 349493113.5 | N777: =POWER(D777/M777,1/9)-1 -> -0.10525329662697791 | O777: =POWER(D777/I777,1/5)-1 -> -0.10955955467573053
A778: 1922.HK | B778: 银城生活服务 | C778: 1.27 | D778: 128056987.8 | E778: 120406625.40000001 | F778: 108605803 | G778: 80198183.400000006 | H778: 37012717.5 | I778: 31119076.600000001 | J778: 24686549.899999999 | K778: 26199941.25 | L778: -- | M778: -- | N778: =POWER(D778/M778,1/9)-1 -> #VALUE! | O778: =POWER(D778/I778,1/5)-1 -> 0.32701342363989094
A779: 1458.HK | B779: 周黑鸭 | C779: 1.73 | D779: 126694411.2 | E779: 28521752.300000001 | F779: 419298188 | G779: 180240309.90000001 | H779: 455323140 | I779: 614949889.79999995 | J779: 913115809.20000005 | K779: 795222723.75 | L779: 650047524.89999998 | M779: 512770845.30000001 | N779: =POWER(D779/M779,1/9)-1 -> -0.14387510511478196 | O779: =POWER(D779/I779,1/5)-1 -> -0.27090596369005282
A780: 2189.HK | B780: 嘉涛(香港)控股 | C780: 0.54 | D780: 126150000 | E780: 98936000 | F780: 79874000 | G780: 47865000 | H780: 37882000 | I780: 36437000 | J780: 33482000 | K780: 30842000 | L780: -- | M780: -- | N780: =POWER(D780/M780,1/9)-1 -> #VALUE! | O780: =POWER(D780/I780,1/5)-1 -> 0.28194362931614392
A781: 6808.HK | B781: 高鑫零售 | C781: 1.33 | D781: 124581550 | E781: -911371750 | F781: -- | G781: -- | H781: 3166995000 | I781: 2821450800 | J781: 3348527700 | K781: 2857023750 | L781: 2873090150 | M781: 3617662100 | N781: =POWER(D781/M781,1/9)-1 -> -0.31222354658618323 | O781: =POWER(D781/I781,1/5)-1 -> -0.46420796930270469
A782: 2210.HK | B782: 京城佳业 | C782: 4.58 | D782: 124521742.8 | E782: 128829020 | F782: 101331048.5 | G782: 68539017.599999994 | H782: -- | I782: -- | J782: -- | K782: -- | L782: -- | M782: -- | N782: =POWER(D782/M782,1/9)-1 -> #VALUE! | O782: =POWER(D782/I782,1/5)-1 -> #VALUE!
A783: 0289.HK | B783: 永安国际 | C783: 11.96 | D783: 123360000 | E783: -300946000 | F783: 552495000 | G783: -456149000 | H783: 765658000 | I783: 1697681000 | J783: 2657189000 | K783: 986769000 | L783: 1068514000 | M783: 1274507000 | N783: =POWER(D783/M783,1/9)-1 -> -0.22853774614785771 | O783: =POWER(D783/I783,1/5)-1 -> -0.4080791274503871
A784: 6913.HK | B784: 华南职业教育 | C784: 0.32 | D784: 123213976.2 | E784: 161179543.69999999 | F784: 188497081 | G784: 203220141.90000001 | H784: -- | I784: -- | J784: -- | K784: -- | L784: -- | M784: -- | N784: =POWER(D784/M784,1/9)-1 -> #VALUE! | O784: =POWER(D784/I784,1/5)-1 -> #VALUE!
A785: 0757.HK | B785: 阳光能源 | C785: 0.12 | D785: 122671357.2 | E785: 1079713534.8 | F785: 236600339 | G785: -257030851.19999999 | H785: -397262310 | I785: -253226917.19999999 | J785: 128836191.8 | K785: -265754326.25 | L785: 18408710.649999999 | M785: -79673423.400000006 | N785: =POWER(D785/M785,1/9)-1 -> -2.0491208575738131 | O785: =POWER(D785/I785,1/5)-1 -> -1.8650608556497128
A786: 1692.HK | B786: 登辉控股 | C786: 2.54 | D786: 122206000 | E786: 134311000 | F786: 106504000 | G786: 104192000 | H786: 60810000 | I786: 38039000 | J786: 49464000 | K786: 22967000 | L786: -- | M786: -- | N786: =POWER(D786/M786,1/9)-1 -> #VALUE! | O786: =POWER(D786/I786,1/5)-1 -> 0.26291083012233685
A787: 1346.HK | B787: 利华控股集团 | C787: 0.77 | D787: 121999790.29000001 | E787: 113351788.93000001 | F787: 33670804.850000001 | G787: 836571.95999999996 | H787: 37681020.460000001 | I787: 50638897.659999996 | J787: 35134752.390000001 | K787: 30373945.539999999 | L787: -- | M787: -- | N787: =POWER(D787/M787,1/9)-1 -> #VALUE! | O787: =POWER(D787/I787,1/5)-1 -> 0.19227096599235782
A788: 6661.HK | B788: 湖州燃气 | C788: 5.75 | D788: 121499519.40000001 | E788: 117425057.09999999 | F788: 146589793 | G788: 173492964 | H788: -- | I788: -- | J788: -- | K788: -- | L788: -- | M788: -- | N788: =POWER(D788/M788,1/9)-1 -> #VALUE! | O788: =POWER(D788/I788,1/5)-1 -> #VALUE!
A789: 2473.HK | B789: 喜相逢集团 | C789: 4.91 | D789: 120860434.8 | E789: -- | F789: -- | G789: -- | H789: -- | I789: -- | J789: -- | K789: -- | L789: -- | M789: -- | N789: =POWER(D789/M789,1/9)-1 -> #VALUE! | O789: =POWER(D789/I789,1/5)-1 -> #VALUE!
A790: 1556.HK | B790: 建业建荣 | C790: 0.26 | D790: 120466000 | E790: 96024000 | F790: 66693000 | G790: 77180000 | H790: 57573000 | I790: 57636000 | J790: 81606000 | K790: 102028000 | L790: 140499000 | M790: 98590000 | N790: =POWER(D790/M790,1/9)-1 -> 2.2516159994916851e-02 | O790: =POWER(D790/I790,1/5)-1 -> 0.15886842879053664
A791: 2149.HK | B791: 贝克微 | C791: 24.75 | D791: 119658999.59999999 | E791: -- | F791: -- | G791: -- | H791: -- | I791: -- | J791: -- | K791: -- | L791: -- | M791: -- | N791: =POWER(D791/M791,1/9)-1 -> #VALUE! | O791: =POWER(D791/I791,1/5)-1 -> #VALUE!
A792: 0952.HK | B792: 华富建业金融 | C792: 0.22 | D792: 119537000 | E792: -1583664000 | F792: -2260577000 | G792: 103250000 | H792: 5347000 | I792: 100175000 | J792: -57947000 | K792: 24688000 | L792: 36037000 | M792: 31602000 | N792: =POWER(D792/M792,1/9)-1 -> 0.15930749230984032 | O792: =POWER(D792/I792,1/5)-1 -> 3.5973389888263041e-02
A793: 1349.HK | B793: 复旦张江 | C793: 1.78 | D793: 119077320.8 | E793: 155674526.25 | F793: 261180655.66999999 | G793: 196261569.87 | H793: 254072546 | I793: 127670274.09999999 | J793: 90261584.299999997 | K793: 154139265 | L793: 150208634.15000001 | M793: 147574158.19999999 | N793: =POWER(D793/M793,1/9)-1 -> -2.3557831192848266e-02 | O793: =POWER(D793/I793,1/5)-1 -> -1.3838933239123552e-02
A794: 9919.HK | B794: 艾德韦宣集团 | C794: 1.03 | D794: 118380830.40000001 | E794: 26659259.199999999 | F794: 113251556 | G794: 27917873.699999999 | H794: 33490357.5 | I794: 42258000.399999999 | J794: 25130142.899999999 | K794: 36062285 | L794: -- | M794: -- | N794: =POWER(D794/M794,1/9)-1 -> #VALUE! | O794: =POWER(D794/I794,1/5)-1 -> 0.22878100103676791
A795: 3838.HK | B795: 中国淀粉 | C795: 0.20000000000000001 | D795: 118344655.8 | E795: 397101352.89999998 | F795: 423183526.5 | G795: 226604028 | H795: 108226522.5 | I795: 262899324.19999999 | J795: 465373416.30000001 | K795: 237454122.5 | L795: 116284295.84999999 | M795: 78274527.5 | N795: =POWER(D795/M795,1/9)-1 -> 4.7002159296304136e-02 | O795: =POWER(D795/I795,1/5)-1 -> -0.14754426627790052
A796: 1100.HK | B796: 飞达控股 | C796: 1.73 | D796: 117949000 | E796: 195390000 | F796: 128076000 | G796: 45895000 | H796: 58213000 | I796: 62513000 | J796: 77228000 | K796: 71586000 | L796: 52554000 | M796: 33042000 | N796: =POWER(D796/M796,1/9)-1 -> 0.15186903626748993 | O796: =POWER(D796/I796,1/5)-1 -> 0.13538926683368602
A797: 0743.HK | B797: 亚洲水泥(中国) | C797: 2.86 | D797: 116293665.59999999 | E797: 473883223.19999999 | F797: 2165291921.5 | G797: 3180833065.1999998 | H797: 3517152450 | I797: 2756367285.4000001 | J797: 722189785.29999995 | K797: 148420772.5 | L797: -351783604.14999998 | M797: 986231592.70000005 | N797: =POWER(D797/M797,1/9)-1 -> -0.21142699578723834 | O797: =POWER(D797/I797,1/5)-1 -> -0.4690620182516545
A798: 1731.HK | B798: 其利工业集团 | C798: 0.65 | D798: 116219869 | E798: 80773760 | F798: 30427796 | G798: 23173717 | H798: -4407442 | I798: 57736580 | J798: 164734748 | K798: 144185630 | L798: 107096409 | M798: -- | N798: =POWER(D798/M798,1/9)-1 -> #VALUE! | O798: =POWER(D798/I798,1/5)-1 -> 0.1501801423229685
A799: 0533.HK | B799: 金利来集团 | C799: 1 | D799: 116164000 | E799: 154462000 | F799: 221043000 | G799: 148286000 | H799: 306028000 | I799: 376244000 | J799: 322275000 | K799: 388844000 | L799: 401872000 | M799: 421042000 | N799: =POWER(D799/M799,1/9)-1 -> -0.13331619364274117 | O799: =POWER(D799/I799,1/5)-1 -> -0.2094662878843625
A800: 0560.HK | B800: 珠江船务 | C800: 0.72 | D800: 114069000 | E800: 93490000 | F800: 44074000 | G800: 49821000 | H800: 214078000 | I800: 226072000 | J800: 268988000 | K800: 321771000 | L800: 265004000 | M800: 221268000 | N800: =POWER(D800/M800,1/9)-1 -> -7.0974425985481981e-02 | O800: =POWER(D800/I800,1/5)-1 -> -0.12786408450898823
A801: 0608.HK | B801: 达利国际 | C801: 1.5 | D801: 113662000 | E801: 154043000 | F801: 147214000 | G801: 124518000 | H801: 71964000 | I801: 43640000 | J801: 41976000 | K801: 43277000 | L801: 46424000 | M801: 101468000 | N801: =POWER(D801/M801,1/9)-1 -> 1.268935230444268e-02 | O801: =POWER(D801/I801,1/5)-1 -> 0.21100548541481379
A802: 2361.HK | B802: 中康控股 | C802: 4.99 | D802: 111847478.40000001 | E802: 62900599.799999997 | F802: 96506518.5 | G802: 80960999.400000006 | H802: -- | I802: -- | J802: -- | K802: -- | L802: -- | M802: -- | N802: =POWER(D802/M802,1/9)-1 -> #VALUE! | O802: =POWER(D802/I802,1/5)-1 -> #VALUE!
A803: 2165.HK | B803: 领悦服务集团 | C803: 1.39 | D803: 111662220.59999999 | E803: 86868212.400000006 | F803: 86465618.5 | G803: 77730950.400000006 | H803: -- | I803: -- | J803: -- | K803: -- | L803: -- | M803: -- | N803: =POWER(D803/M803,1/9)-1 -> #VALUE! | O803: =POWER(D803/I803,1/5)-1 -> #VALUE!
A804: 6959.HK | B804: 长久股份 | C804: 18.08 | D804: 111179892.59999999 | E804: -- | F804: -- | G804: -- | H804: -- | I804: -- | J804: -- | K804: -- | L804: -- | M804: -- | N804: =POWER(D804/M804,1/9)-1 -> #VALUE! | O804: =POWER(D804/I804,1/5)-1 -> #VALUE!
A805: 0341.HK | B805: 大家乐集团 | C805: 8.01 | D805: 110353000 | E805: 21214000 | F805: 359130000 | G805: 73634000 | H805: 569907000 | I805: 458055000 | J805: 503827000 | K805: 517982000 | L805: 586773000 | M805: 581196000 | N805: =POWER(D805/M805,1/9)-1 -> -0.16856355259542311 | O805: =POWER(D805/I805,1/5)-1 -> -0.24773076146000306
A806: 1161.HK | B806: 奥思集团 | C806: 0.92 | D806: 110320000 | E806: 67432000 | F806: 170340000 | G806: 27736000 | H806: 107690000 | I806: 95238000 | J806: 69331000 | K806: 29063000 | L806: 50563000 | M806: 47930000 | N806: =POWER(D806/M806,1/9)-1 -> 9.7052533988654988e-02 | O806: =POWER(D806/I806,1/5)-1 -> 2.983772607885582e-02
A807: 1626.HK | B807: 嘉耀控股 | C807: 3.01 | D807: 108836217 | E807: 6200037.5999999996 | F807: -32110063.5 | G807: -31233739.5 | H807: 4718085 | I807: 14783582.4 | J807: 2770657.8999999999 | K807: 2840355 | L807: 2948357.3500000001 | M807: 9135875.9000000004 | N807: =POWER(D807/M807,1/9)-1 -> 0.31691619490652312 | O807: =POWER(D807/I807,1/5)-1 -> 0.49072917228582091
A808: 0833.HK | B808: 华讯 | C808: 0.45 | D808: 108423000 | E808: 112053000 | F808: 69347000 | G808: 122444000 | H808: -262040000 | I808: 104241000 | J808: 110998000 | K808: 71758000 | L808: 41410000 | M808: 45232000 | N808: =POWER(D808/M808,1/9)-1 -> 0.10201163792752999 | O808: =POWER(D808/I808,1/5)-1 -> 7.8979692267744372e-03
A809: 1341.HK | B809: 昊天国际建投 | C809: 0.95 | D809: 108000000 | E809: -412000000 | F809: 100000000 | G809: 72000000 | H809: -6452000 | I809: -12528000 | J809: 300000 | K809: -11240000 | L809: 24324000 | M809: 39232000 | N809: =POWER(D809/M809,1/9)-1 -> 0.11908947668388081 | O809: =POWER(D809/I809,1/5)-1 -> -2.5385386195966162
A810: 0611.HK | B810: 中国核能科技 | C810: 0.32 | D810: 107689000 | E810: 92243000 | F810: 89784000 | G810: 57064000 | H810: 96820000 | I810: 90960000 | J810: 116081000 | K810: 78571000 | L810: 3559000 | M810: -40931000 | N810: =POWER(D810/M810,1/9)-1 -> -2.1134735054220402 | O810: =POWER(D810/I810,1/5)-1 -> 3.4342044515307535e-02
A811: 6889.HK | B811: Dynam Japan | C811: 3.51 | D811: 106526910 | E811: 321706860 | F811: 165835340 | G811: 910589640 | H811: 891922760 | I811: 803315500.89999998 | J811: 650520000 | K811: 727430560 | L811: 729043500 | M811: 1601139150 | N811: =POWER(D811/M811,1/9)-1 -> -0.26001045524672883 | O811: =POWER(D811/I811,1/5)-1 -> -0.33240260019806922
A812: 2302.HK | B812: 中核国际 | C812: 2.03 | D812: 106315000 | E812: 80843000 | F812: 2389000 | G812: -46097000 | H812: -219323000 | I812: 23613000 | J812: 257000 | K812: -28192000 | L812: -220599000 | M812: -156397000 | N812: =POWER(D812/M812,1/9)-1 -> -1.9580187608274093 | O812: =POWER(D812/I812,1/5)-1 -> 0.35110367505411189
A813: 0623.HK | B813: 中视金桥 | C813: 0.94 | D813: 106088043.59999999 | E813: 46646935 | F813: 45402011 | G813: 103949174.7 | H813: 29505352.5 | I813: 93509802.200000003 | J813: 111548053.8 | K813: -30077092.5 | L813: 143093531.65000001 | M813: 382569950.89999998 | N813: =POWER(D813/M813,1/9)-1 -> -0.13282614382535685 | O813: =POWER(D813/I813,1/5)-1 -> 2.5561857880195271e-02
A814: 0711.HK | B814: 亚洲联合基建控股 | C814: 0.46 | D814: 105091000 | E814: 121999000 | F814: -184506000 | G814: 101432000 | H814: 136648000 | I814: 150176000 | J814: 205506000 | K814: 301950000 | L814: 102518000 | M814: 93009000 | N814: =POWER(D814/M814,1/9)-1 -> 1.3662533007408495e-02 | O814: =POWER(D814/I814,1/5)-1 -> -6.890713549256644e-02
A815: 0239.HK | B815: 白花油 | C815: 2.37 | D815: 105039000 | E815: 29955000 | F815: 38186000 | G815: -38356000 | H815: 36046000 | I815: 37280000 | J815: 102589000 | K815: 61199000 | L815: 61014000 | M815: 146465000 | N815: =POWER(D815/M815,1/9)-1 -> -3.6265483628371675e-02 | O815: =POWER(D815/I815,1/5)-1 -> 0.23019776866240749
A816: 0922.HK | B816: 安贤园中国 | C816: 0.17 | D816: 104921000 | E816: 73125000 | F816: 80295000 | G816: 53641000 | H816: 17082000 | I816: 16730000 | J816: 6240000 | K816: 9465000 | L816: 37425000 | M816: 5719000 | N816: =POWER(D816/M816,1/9)-1 -> 0.38163584384158278 | O816: =POWER(D816/I816,1/5)-1 -> 0.44368783190022398
A817: 0658.HK | B817: 中国高速传动 | C817: 1.12 | D817: 104705735.40000001 | E817: 114613831.90000001 | F817: 1610517502.5 | G817: 1002275861.4 | H817: 489675090 | I817: 237285378.59999999 | J817: 541541931.10000002 | K817: 1232370693.75 | L817: 1214973726.8499999 | M817: 260089813.80000001 | N817: =POWER(D817/M817,1/9)-1 -> -9.6154655745543161e-02 | O817: =POWER(D817/I817,1/5)-1 -> -0.15093703357823862
A818: 3828.HK | B818: 明辉国际 | C818: 0.71 | D818: 104181000 | E818: 75511000 | F818: -93535000 | G818: 79046000 | H818: 97936000 | I818: 100249000 | J818: 108923000 | K818: 157443000 | L818: -221864000 | M818: 63264000 | N818: =POWER(D818/M818,1/9)-1 -> 5.6988368608298812e-02 | O818: =POWER(D818/I818,1/5)-1 -> 7.724215008876989e-03
A819: 1282.HK | B819: 中泽丰 | C819: 0.13 | D819: 102497000 | E819: -551522000 | F819: -188957000 | G819: -217251000 | H819: 684292000 | I819: 670827000 | J819: 869170000 | K819: 466593000 | L819: 181687000 | M819: -583152000 | N819: =POWER(D819/M819,1/9)-1 -> -1.8243340988862333 | O819: =POWER(D819/I819,1/5)-1 -> -0.31321607092300208
A820: 8512.HK | B820: 凯富善集团控股 | C820: 0.29999999999999999 | D820: 102286000 | E820: 73058000 | F820: 106211000 | G820: 90482000 | H820: 24663000 | I820: 4774000 | J820: -9855000 | K820: 8557000 | L820: 11032000 | M820: -- | N820: =POWER(D820/M820,1/9)-1 -> #VALUE! | O820: =POWER(D820/I820,1/5)-1 -> 0.84580898686553763
A821: 6866.HK | B821: 佐力小贷 | C821: 0.31 | D821: 101562930 | E821: 105296854 | F821: 142640780.5 | G821: 131399823.59999999 | H821: 147048472.5 | I821: 155951764.80000001 | J821: 178429889.19999999 | K821: 162405853.75 | L821: 171804440.30000001 | M821: 116552612.09999999 | N821: =POWER(D821/M821,1/9)-1 -> -1.5179629059364763e-02 | O821: =POWER(D821/I821,1/5)-1 -> -8.2198030026292668e-02
A822: 0536.HK | B822: 贸易通 | C822: 0.89 | D822: 100639000 | E822: 52333000 | F822: 73653000 | G822: 72800000 | H822: 82201000 | I822: 89768000 | J822: 74120000 | K822: 79252000 | L822: 81404000 | M822: 74183000 | N822: =POWER(D822/M822,1/9)-1 -> 3.4470215938481097e-02 | O822: =POWER(D822/I822,1/5)-1 -> 2.3125602910734289e-02
A823: 8053.HK | B823: 比优集团 | C823: 0.36 | D823: 100603601.95 | E823: 141805251.25 | F823: 145049308.5 | G823: 250672314.55000001 | H823: 216273989.59999999 | I823: 194794192.34999999 | J823: 55527204.299999997 | K823: -7392240.9000000004 | L823: 35809114.5 | M823: -40792340 | N823: =POWER(D823/M823,1/9)-1 -> -2.1055017505204203 | O823: =POWER(D823/I823,1/5)-1 -> -0.12379141278738937
A824: 2101.HK | B824: 福禄控股 | C824: 1.51 | D824: 100427266.8 | E824: 110419556.09999999 | F824: 83537839 | G824: 144098326.19999999 | H824: 90112965 | I824: 71514327.400000006 | J824: 93672454.799999997 | K824: -- | L824: -- | M824: -- | N824: =POWER(D824/M824,1/9)-1 -> #VALUE! | O824: =POWER(D824/I824,1/5)-1 -> 7.026597017603109e-02
A825: 0335.HK | B825: 美建集团 | C825: 0.77 | D825: 100310000 | E825: 87036000 | F825: 46227000 | G825: 47738000 | H825: 254624000 | I825: 163603000 | J825: 225867000 | K825: 518309000 | L825: 315407000 | M825: 164910000 | N825: =POWER(D825/M825,1/9)-1 -> -5.3739298017152271e-02 | O825: =POWER(D825/I825,1/5)-1 -> -9.3201916750032865e-02
A826: 2198.HK | B826: 中国三江化工 | C826: 1.74 | D826: 100277087.40000001 | E826: -347319428 | F826: 466058169.5 | G826: 1338421458.9000001 | H826: 615154695 | I826: 454204619 | J826: 828191727.70000005 | K826: 614092307.5 | L826: -171117627.09999999 | M826: 165696162 | N826: =POWER(D826/M826,1/9)-1 -> -5.4273684899159624e-02 | O826: =POWER(D826/I826,1/5)-1 -> -0.26075221326793485
A827: 3978.HK | B827: 卓越教育集团 | C827: 2.93 | D827: 100023865.2 | E827: 63497364.700000003 | F827: -398000459.5 | G827: 154559632.5 | H827: 151473772.5 | I827: 62508001.399999999 | J827: 58724519.799999997 | K827: 51548665 | L827: 69670378.049999997 | M827: -- | N827: =POWER(D827/M827,1/9)-1 -> #VALUE! | O827: =POWER(D827/I827,1/5)-1 -> 9.8584845782147212e-02
A828: 6805.HK | B828: 金茂源环保 | C828: 1.09 | D828: 99937265.400000006 | E828: 125484203.5 | F828: 68467917.5 | G828: 122299667.09999999 | H828: 61625655 | I828: 54579929.600000001 | J828: 24211785.5 | K828: 18187828.75 | L828: -- | M828: -- | N828: =POWER(D828/M828,1/9)-1 -> #VALUE! | O828: =POWER(D828/I828,1/5)-1 -> 0.12859701709837279
A829: 1948.HK | B829: 优矩控股 | C829: 1.11 | D829: 99271872 | E829: 128128469.90000001 | F829: 311452799.5 | G829: 158736050.09999999 | H829: -- | I829: -- | J829: -- | K829: -- | L829: -- | M829: -- | N829: =POWER(D829/M829,1/9)-1 -> #VALUE! | O829: =POWER(D829/I829,1/5)-1 -> #VALUE!
A830: 6123.HK | B830: 圆通国际快递 | C830: 1.46 | D830: 96775000 | E830: 136744000 | F830: 273377000 | G830: 252231000 | H830: 26101000 | I830: 104163000 | J830: 97501000 | K830: 4967000 | L830: 49900000 | M830: 59573000 | N830: =POWER(D830/M830,1/9)-1 -> 5.5389172503645501e-02 | O830: =POWER(D830/I830,1/5)-1 -> -1.4605939788777667e-02
A831: 2136.HK | B831: 利福中国 | C831: 0.80000000000000004 | D831: 96210185.400000006 | E831: -27571892.100000001 | F831: 175584728.5 | G831: 253574341.19999999 | H831: -93329130 | I831: 384931056.39999998 | J831: 323211451 | K831: 308969727.5 | L831: 305977000 | M831: 324799000 | N831: =POWER(D831/M831,1/9)-1 -> -0.12644632229861308 | O831: =POWER(D831/I831,1/5)-1 -> -0.24217728272094752
A832: 9936.HK | B832: 稀美资源 | C832: 3.2999999999999998 | D832: 95525060.400000006 | E832: 118150425.40000001 | F832: 124978592.5 | G832: 83801297.099999994 | H832: 77836110 | I832: 87753040.599999994 | J832: 46258357.600000001 | K832: 26533316.25 | L832: 21266512.149999999 | M832: 14964816.800000001 | N832: =POWER(D832/M832,1/9)-1 -> 0.22871043406552038 | O832: =POWER(D832/I832,1/5)-1 -> 1.7117272523197835e-02
A833: 1432.HK | B833: 中国圣牧 | C833: 0.19 | D833: 94356511.200000003 | E833: 469808526 | F833: 577612568.5 | G833: 484721892 | H833: 31001685 | I833: -2533612720 | J833: -1217202407.4000001 | K833: 756333418.75 | L833: 941606784.60000002 | M833: 887541421.20000005 | N833: =POWER(D833/M833,1/9)-1 -> -0.22045250076958789 | O833: =POWER(D833/I833,1/5)-1 -> -1.5178527999772014
A834: 1769.HK | B834: 思考乐教育 | C834: 4.38 | D834: 94260045.599999994 | E834: 61381049.100000001 | F834: -32585169.5 | G834: 58329202.200000003 | H834: 105923355 | I834: 82222860.400000006 | J834: 35503025.700000003 | K834: 11530330 | L834: -- | M834: -- | N834: =POWER(D834/M834,1/9)-1 -> #VALUE! | O834: =POWER(D834/I834,1/5)-1 -> 2.7701553177712279e-02
A835: 2120.HK | B835: 康宁医院 | C835: 13.08 | D835: 94215985.640000001 | E835: -27323464.52 | F835: 53922076.130000003 | G835: 66472455.560000002 | H835: 64020897.799999997 | I835: 91766237.829999998 | J835: 58830950.950000003 | K835: 76488993.260000005 | L835: 65516569.450000003 | M835: 63889984.200000003 | N835: =POWER(D835/M835,1/9)-1 -> 4.4103460151275753e-02 | O835: =POWER(D835/I835,1/5)-1 -> 5.2829891867729462e-03
A836: 3686.HK | B836: 祈福生活服务 | C836: 0.42 | D836: 94095615.599999994 | E836: 107327434 | F836: 99336338 | G836: 153442822.19999999 | H836: 107067675 | I836: 82753448 | J836: 67528042.5 | K836: 27807920 | L836: 40981814.350000001 | M836: 36922865.200000003 | N836: =POWER(D836/M836,1/9)-1 -> 0.10953640079546023 | O836: =POWER(D836/I836,1/5)-1 -> 2.6021964374004947e-02
A837: 2738.HK | B837: 华津国际控股 | C837: 1.22 | D837: 93896107.200000003 | E837: -186473801.90000001 | F837: 75966755.5 | G837: 43406614.200000003 | H837: 20539650 | I837: 7300703.2000000002 | J837: 111060101.5 | K837: 104827546.25 | L837: 113826351.34999999 | M837: 50231718.700000003 | N837: =POWER(D837/M837,1/9)-1 -> 7.1977094090353022e-02 | O837: =POWER(D837/I837,1/5)-1 -> 0.66669671272874109
A838: 6811.HK | B838: 太兴集团 | C838: 0.78 | D838: 93836000 | E838: -43153000 | F838: 99716000 | G838: 118959000 | H838: 76864000 | I838: 304934000 | J838: 115682000 | K838: 108644000 | L838: -- | M838: -- | N838: =POWER(D838/M838,1/9)-1 -> #VALUE! | O838: =POWER(D838/I838,1/5)-1 -> -0.20998974801693249
A839: 1518.HK | B839: 新世纪医疗 | C839: 0.83 | D839: 92260576.799999997 | E839: -335873725.39999998 | F839: -124238994.5 | G839: -442651397.69999999 | H839: -29676330 | I839: 47267840.399999999 | J839: 88110757.700000003 | K839: 109608143.75 | L839: 48103973.149999999 | M839: 58283169.5 | N839: =POWER(D839/M839,1/9)-1 -> 5.2358388282900181e-02 | O839: =POWER(D839/I839,1/5)-1 -> 0.14311541423116525
A840: 2439.HK | B840: 中宝新材 | C840: 0.28 | D840: 92047914 | E840: 63746674.799999997 | F840: 96021616.5 | G840: 58727296.799999997 | H840: -- | I840: -- | J840: -- | K840: -- | L840: -- | M840: -- | N840: =POWER(D840/M840,1/9)-1 -> #VALUE! | O840: =POWER(D840/I840,1/5)-1 -> #VALUE!
A841: 6828.HK | B841: 北京燃气蓝天 | C841: 0.03 | D841: 91291000 | E841: 18645000 | F841: -275400000 | G841: -3716327000 | H841: -10871000 | I841: 260657000 | J841: -12489000 | K841: 99876000 | L841: 17160000 | M841: -70763000 | N841: =POWER(D841/M841,1/9)-1 -> -2.0287060715194398 | O841: =POWER(D841/I841,1/5)-1 -> -0.18927845539834143
A842: 1478.HK | B842: 丘钛科技 | C842: 4.87 | D842: 89797415.400000006 | E842: 193075443.09999999 | F842: 1056714112 | G842: 1001324725.2 | H842: 606100710 | I842: 16394701.4 | J842: 523052495.30000001 | K842: 211976493.75 | L842: 119955923.95 | M842: 243971937.40000001 | N842: =POWER(D842/M842,1/9)-1 -> -0.10511067169111299 | O842: =POWER(D842/I842,1/5)-1 -> 0.40511563119074268
A843: 0755.HK | B843: 上海证大 | C843: 0.01 | D843: 89504000 | E843: 2883611000 | F843: -2070423000 | G843: -1150773000 | H843: -1058026000 | I843: -905485000 | J843: 34400000 | K843: -1034703000 | L843: -957138000 | M843: -438468000 | N843: =POWER(D843/M843,1/9)-1 -> -1.8381518864047761 | O843: =POWER(D843/I843,1/5)-1 -> -1.6294949303743222
A844: 0353.HK | B844: 能源国际投资 | C844: 0.52 | D844: 89308000 | E844: 12762000 | F844: -- | G844: -- | H844: 31310000 | I844: -76478000 | J844: -177551000 | K844: -189971000 | L844: -492568000 | M844: -673621000 | N844: =POWER(D844/M844,1/9)-1 -> -1.7989087798500014 | O844: =POWER(D844/I844,1/5)-1 -> -2.0315036482397364
A845: 0529.HK | B845: 新龙国际 | C845: 1.8 | D845: 88719000 | E845: 44460000 | F845: 115106000 | G845: -310035000 | H845: 78781000 | I845: 282999000 | J845: 367835000 | K845: 236209000 | L845: 240684000 | M845: 176174000 | N845: =POWER(D845/M845,1/9)-1 -> -7.3389531158827515e-02 | O845: =POWER(D845/I845,1/5)-1 -> -0.20704900680056904
A846: 1978.HK | B846: 叙福楼集团 | C846: 0.67 | D846: 88065000 | E846: 77705000 | F846: 90076000 | G846: 140328000 | H846: -11226000 | I846: 35211000 | J846: 22391000 | K846: 36281000 | L846: 41913000 | M846: 41267000 | N846: =POWER(D846/M846,1/9)-1 -> 8.7872069986959511e-02 | O846: =POWER(D846/I846,1/5)-1 -> 0.20122675312713478
A847: 6911.HK | B847: 澜沧古茶 | C847: 5.99 | D847: 87783696 | E847: -- | F847: -- | G847: -- | H847: -- | I847: -- | J847: -- | K847: -- | L847: -- | M847: -- | N847: =POWER(D847/M847,1/9)-1 -> #VALUE! | O847: =POWER(D847/I847,1/5)-1 -> #VALUE!
A848: 1538.HK | B848: 中奥到家 | C848: 0.33 | D848: 87755194.799999997 | E848: 86758786.700000003 | F848: 130142309 | G848: 156745577.09999999 | H848: 121324740 | I848: 109405796.8 | J848: 108559196.09999999 | K848: -7093108.75 | L848: 12831881.550000001 | M848: 69921084.900000006 | N848: =POWER(D848/M848,1/9)-1 -> 2.55639392165532e-02 | O848: =POWER(D848/I848,1/5)-1 -> -4.3144185599679363e-02
A849: 0096.HK | B849: 友成控股 | C849: 0.49 | D849: 86705035.200000003 | E849: 62445975.5 | F849: 63083791 | G849: 62513963.100000001 | H849: 39233190 | I849: 103957595.8 | J849: 100102155.5 | K849: 71422260 | L849: 72671657.650000006 | M849: 62818038.100000001 | N849: =POWER(D849/M849,1/9)-1 -> 3.645656223845517e-02 | O849: =POWER(D849/I849,1/5)-1 -> -3.5643486072856279e-02
A850: 0408.HK | B850: 叶氏化工集团 | C850: 1.57 | D850: 86623000 | E850: 1217830000 | F850: 406280000 | G850: 302575000 | H850: 272907000 | I850: 184805000 | J850: 170560000 | K850: 169343000 | L850: 47847000 | M850: 223182000 | N850: =POWER(D850/M850,1/9)-1 -> -9.9817738742697615e-02 | O850: =POWER(D850/I850,1/5)-1 -> -0.14062265480748626
A851: 1319.HK | B851: 霭华押业信贷 | C851: 0.24 | D851: 86107000 | E851: 71671000 | F851: 93144000 | G851: 107383000 | H851: 100820000 | I851: 100908000 | J851: 103230000 | K851: 91366000 | L851: 80091046 | M851: 41076096 | N851: =POWER(D851/M851,1/9)-1 -> 8.571687675578854e-02 | O851: =POWER(D851/I851,1/5)-1 -> -3.1225782908817501e-02
A852: 0236.HK | B852: 香港生力啤 | C852: 1.1000000000000001 | D852: 85898000 | E852: 32305000 | F852: 19364000 | G852: 17228000 | H852: 11583000 | I852: -73556000 | J852: 12480000 | K852: 8654000 | L852: -16074000 | M852: 35323000 | N852: =POWER(D852/M852,1/9)-1 -> 0.10377513875257627 | O852: =POWER(D852/I852,1/5)-1 -> -2.0315089240211663
A853: 6093.HK | B853: 和泓服务 | C853: 1.39 | D853: 85392883.799999997 | E853: 77520775.799999997 | F853: 105544553 | G853: 67171908.299999997 | H853: 15413677.5 | I853: 19226399.600000001 | J853: 26219943 | K853: 20818157.5 | L853: -- | M853: -- | N853: =POWER(D853/M853,1/9)-1 -> #VALUE! | O853: =POWER(D853/I853,1/5)-1 -> 0.34742544129440223
A854: 0411.HK | B854: 南顺(香港) | C854: 8.45 | D854: 85349000 | E854: 257260000 | F854: 357698000 | G854: 316889000 | H854: 340076000 | I854: 326379000 | J854: 273051000 | K854: 202013000 | L854: 114470000 | M854: 140763000 | N854: =POWER(D854/M854,1/9)-1 -> -5.4075099224906942e-02 | O854: =POWER(D854/I854,1/5)-1 -> -0.23529268261414427
A855: 6890.HK | B855: 康利国际控股 | C855: 0.35 | D855: 84896305.200000003 | E855: -35256509.299999997 | F855: 120119776.5 | G855: 86306670.900000006 | H855: 27600015 | I855: 57978650.600000001 | J855: 79321621.799999997 | K855: 37706935 | L855: 19431874.149999999 | M855: -- | N855: =POWER(D855/M855,1/9)-1 -> #VALUE! | O855: =POWER(D855/I855,1/5)-1 -> 7.9255168753962435e-02
A856: 1057.HK | B856: 浙江世宝 | C856: 2.03 | D856: 84631400.569999993 | E856: 17850594.670000002 | F856: 41824418.590000004 | G856: 48684313.990000002 | H856: -197475318.53999999 | I856: 8287150.1900000004 | J856: 39151439.630000003 | K856: 70550539.25 | L856: 62966708.920000002 | M856: 54127302.68 | N856: =POWER(D856/M856,1/9)-1 -> 5.0916834935579525e-02 | O856: =POWER(D856/I856,1/5)-1 -> 0.59156823826919602
A857: 1521.HK | B857: 方达控股 | C857: 0.77 | D857: 84421288 | E857: 200938880 | F857: 143701544 | G857: 132963950 | H857: 143467688 | I857: 88061994 | J857: 79429310 | K857: 51533084 | L857: 35133016.5 | M857: -- | N857: =POWER(D857/M857,1/9)-1 -> #VALUE! | O857: =POWER(D857/I857,1/5)-1 -> -8.4087364199433301e-03
A858: 8328.HK | B858: 信义储电 | C858: 1.15 | D858: 83142000 | E858: 45898000 | F858: 62629000 | G858: 19921000 | H858: 25022000 | I858: 59096000 | J858: 9388000 | K858: 63000 | L858: -4543000 | M858: 9933000 | N858: =POWER(D858/M858,1/9)-1 -> 0.26627102736515917 | O858: =POWER(D858/I858,1/5)-1 -> 7.0662215279931884e-02
A859: 1001.HK | B859: 沪港联合 | C859: 0.24 | D859: 82846000 | E859: 65503000 | F859: 1673000 | G859: -90309000 | H859: 13888000 | I859: -147712000 | J859: 101776000 | K859: 70105000 | L859: 215533000 | M859: 103708000 | N859: =POWER(D859/M859,1/9)-1 -> -2.4646284214878023e-02 | O859: =POWER(D859/I859,1/5)-1 -> -1.8907814267770346
A860: 0114.HK | B860: 兴利集团 | C860: 0.42 | D860: 82327000 | E860: -61147000 | F860: 33921000 | G860: 8798000 | H860: -26158000 | I860: -26754000 | J860: 50115000 | K860: 39024000 | L860: 16222000 | M860: 26474000 | N860: =POWER(D860/M860,1/9)-1 -> 0.13434972343114038 | O860: =POWER(D860/I860,1/5)-1 -> -2.252076064731332
A861: 2152.HK | B861: 苏新服务 | C861: 6.73 | D861: 81590166 | E861: 73059140.299999997 | F861: 67916892.5 | G861: 56423354.100000001 | H861: -- | I861: -- | J861: -- | K861: -- | L861: -- | M861: -- | N861: =POWER(D861/M861,1/9)-1 -> #VALUE! | O861: =POWER(D861/I861,1/5)-1 -> #VALUE!
A862: 2458.HK | B862: 望尘科技控股 | C862: 3.37 | D862: 81341328.599999994 | E862: 15257552.5 | F862: 48962857 | G862: 49461466.200000003 | H862: -- | I862: -- | J862: -- | K862: -- | L862: -- | M862: -- | N862: =POWER(D862/M862,1/9)-1 -> #VALUE! | O862: =POWER(D862/I862,1/5)-1 -> #VALUE!
A863: 1412.HK | B863: 隽思集团 | C863: 1.08 | D863: 80099000 | E863: 126839000 | F863: 119042000 | G863: 129348000 | H863: 84288000 | I863: 50991000 | J863: 78889000 | K863: 89835000 | L863: -- | M863: -- | N863: =POWER(D863/M863,1/9)-1 -> #VALUE! | O863: =POWER(D863/I863,1/5)-1 -> 9.4527589000886092e-02
A864: 1586.HK | B864: 力鸿检验 | C864: 1.36 | D864: 80048000 | E864: 69397000 | F864: 49836000 | G864: 52455000 | H864: 27011092.5 | I864: 15964310.6 | J864: 42674845.5 | K864: 37369115 | L864: 32467212.350000001 | M864: 47475107.600000001 | N864: =POWER(D864/M864,1/9)-1 -> 5.9764559927383276e-02 | O864: =POWER(D864/I864,1/5)-1 -> 0.38051160992450761
A865: 2881.HK | B865: 武汉有机 | C865: 4.71 | D865: 79915172.400000006 | E865: -- | F865: -- | G865: -- | H865: -- | I865: -- | J865: -- | K865: -- | L865: -- | M865: -- | N865: =POWER(D865/M865,1/9)-1 -> #VALUE! | O865: =POWER(D865/I865,1/5)-1 -> #VALUE!
A866: 0280.HK | B866: 景福集团 | C866: 0.36 | D866: 79466000 | E866: 60050000 | F866: 28615000 | G866: 5692000 | H866: 767000 | I866: -22737000 | J866: -85987000 | K866: -119172000 | L866: -149251000 | M866: -131229000 | N866: =POWER(D866/M866,1/9)-1 -> -1.9457897756952813 | O866: =POWER(D866/I866,1/5)-1 -> -2.284368478015752
A867: 0090.HK | B867: 普星能量 | C867: 0.35 | D867: 77657000.400000006 | E867: 58584489.200000003 | F867: 127133712.5 | G867: 148022061 | H867: 61299345 | I867: 51897388 | J867: 41028755.799999997 | K867: 46342458.75 | L867: 51382800.549999997 | M867: -185808566.30000001 | N867: =POWER(D867/M867,1/9)-1 -> -1.9076149758465035 | O867: =POWER(D867/I867,1/5)-1 -> 8.3944440427896838e-02
A868: 1975.HK | B868: 新兴印刷 | C868: 0.34 | D868: 77486000 | E868: 115780000 | F868: 77832000 | G868: 44853000 | H868: 32252000 | I868: 9017000 | J868: 36781000 | K868: 43270000 | L868: 16816000 | M868: 21477000 | N868: =POWER(D868/M868,1/9)-1 -> 0.15323184141384782 | O868: =POWER(D868/I868,1/5)-1 -> 0.53756057465553075
A869: 0496.HK | B869: 卡森国际 | C869: 0.28 | D869: 77200981.200000003 | E869: 77025539.900000006 | F869: 269437755.5 | G869: 137038702.5 | H869: 497240565 | I869: 512141141.39999998 | J869: -243797513.90000001 | K869: -44334430 | L869: 223988130.90000001 | M869: 40454422.200000003 | N869: =POWER(D869/M869,1/9)-1 -> 7.4444756631726339e-02 | O869: =POWER(D869/I869,1/5)-1 -> -0.31506930252712817
A870: 2529.HK | B870: 泓盈城市服务 | C870: 2.8999999999999999 | D870: 76929123.599999994 | E870: -- | F870: -- | G870: -- | H870: -- | I870: -- | J870: -- | K870: -- | L870: -- | M870: -- | N870: =POWER(D870/M870,1/9)-1 -> #VALUE! | O870: =POWER(D870/I870,1/5)-1 -> #VALUE!
A871: 0127.HK | B871: 华人置业 | C871: 1.35 | D871: 76832000 | E871: 1152235000 | F871: -3515305000 | G871: 622233000 | H871: 790167000 | I871: 1015290000 | J871: 3708886000 | K871: 6360312000 | L871: 7727208000 | M871: 8744927000 | N871: =POWER(D871/M871,1/9)-1 -> -0.40907580504358587 | O871: =POWER(D871/I871,1/5)-1 -> -0.40325277799585624
A872: 1196.HK | B872: 伟禄集团 | C872: 5.2999999999999998 | D872: 76689000 | E872: 114892000 | F872: 122197000 | G872: 885185000 | H872: -415529000 | I872: 363282000 | J872: 93254000 | K872: 80097000 | L872: 32427000 | M872: -12444000 | N872: =POWER(D872/M872,1/9)-1 -> -2.2239186810030382 | O872: =POWER(D872/I872,1/5)-1 -> -0.2673478321583086
A873: 1085.HK | B873: 亨鑫科技 | C873: 1.15 | D873: 76407332.400000006 | E873: 71749416.200000003 | F873: 87310523.5 | G873: 73062278.099999994 | H873: 126803842.5 | I873: 134669053.59999999 | J873: 136742937.30000001 | K873: 110949422.5 | L873: 135455086.90000001 | M873: 121154867.3 | N873: =POWER(D873/M873,1/9)-1 -> -4.9931524423798224e-02 | O873: =POWER(D873/I873,1/5)-1 -> -0.10716039660703525
A874: 2505.HK | B874: EDA集团控股 | C874: 6.93 | D874: 76079568.599999994 | E874: -- | F874: -- | G874: -- | H874: -- | I874: -- | J874: -- | K874: -- | L874: -- | M874: -- | N874: =POWER(D874/M874,1/9)-1 -> #VALUE! | O874: =POWER(D874/I874,1/5)-1 -> #VALUE!
A875: 6033.HK | B875: 电讯数码控股 | C875: 0.69 | D875: 75580000 | E875: 113059000 | F875: 135218000 | G875: 80201000 | H875: 131753000 | I875: 128168000 | J875: 95593000 | K875: 89769000 | L875: 86817000 | M875: 80738000 | N875: =POWER(D875/M875,1/9)-1 -> -7.3084564277307029e-03 | O875: =POWER(D875/I875,1/5)-1 -> -0.10024254019726564
A876: 2545.HK | B876: 中赣通信 | C876: 0.38 | D876: 75190550.400000006 | E876: -- | F876: -- | G876: -- | H876: -- | I876: -- | J876: -- | K876: -- | L876: -- | M876: -- | N876: =POWER(D876/M876,1/9)-1 -> #VALUE! | O876: =POWER(D876/I876,1/5)-1 -> #VALUE!
A877: 0321.HK | B877: 德永佳集团 | C877: 1 | D877: 75149000 | E877: 191064000 | F877: 274213000 | G877: 169054000 | H877: 325246000 | I877: 304328000 | J877: 478525000 | K877: 1050655000 | L877: 773293000 | M877: 668352000 | N877: =POWER(D877/M877,1/9)-1 -> -0.21558400762286356 | O877: =POWER(D877/I877,1/5)-1 -> -0.24400963798988884
A878: 1480.HK | B878: 恩达集团控股 | C878: 1.09 | D878: 75083000 | E878: 94264000 | F878: 46244000 | G878: 38702000 | H878: 55901000 | I878: 58393000 | J878: 24275000 | K878: 23383000 | L878: 42413000 | M878: 44209000 | N878: =POWER(D878/M878,1/9)-1 -> 6.0617996006364194e-02 | O878: =POWER(D878/I878,1/5)-1 -> 5.1565104136226836e-02
A879: 0206.HK | B879: 华商能源 | C879: 0.22 | D879: 74220122 | E879: 202063232 | F879: 71897560 | G879: 84631748 | H879: 75541687 | I879: -323998572 | J879: -646921060 | K879: -856429300 | L879: 16252798.5 | M879: 159013512 | N879: =POWER(D879/M879,1/9)-1 -> -8.1176785392093165e-02 | O879: =POWER(D879/I879,1/5)-1 -> -1.7447246235171985
A880: 2147.HK | B880: 正味集团 | C880: 0.06 | D880: 74012135.400000006 | E880: 52678885.700000003 | F880: 59133554 | G880: 48795194.100000001 | H880: -- | I880: -- | J880: -- | K880: -- | L880: -- | M880: -- | N880: =POWER(D880/M880,1/9)-1 -> #VALUE! | O880: =POWER(D880/I880,1/5)-1 -> #VALUE!
A881: 0573.HK | B881: 稻香控股 | C881: 0.69999999999999996 | D881: 73655000 | E881: -143138000 | F881: -21232000 | G881: -57956000 | H881: 124968000 | I881: 116390000 | J881: 89082000 | K881: 177845000 | L881: 171323000 | M881: 207368000 | N881: =POWER(D881/M881,1/9)-1 -> -0.1086440536002341 | O881: =POWER(D881/I881,1/5)-1 -> -8.7448647445940608e-02
A882: 1790.HK | B882: 达力环保 | C882: 0.56 | D882: 73260000 | E882: 68127000 | F882: 115269000 | G882: 126536000 | H882: 107696000 | I882: 69996000 | J882: 58915000 | K882: 46218000 | L882: 45596000 | M882: -- | N882: =POWER(D882/M882,1/9)-1 -> #VALUE! | O882: =POWER(D882/I882,1/5)-1 -> 9.157003115829232e-03
A883: 0799.HK | B883: IGG | C883: 2.7000000000000002 | D883: 73053000 | E883: -503589000 | F883: 370438000 | G883: 16258157295 | H883: 1283250878 | I883: 1482012618 | J883: 1219187164 | K883: 563064464 | L883: 321583746 | M883: 514788988 | N883: =POWER(D883/M883,1/9)-1 -> -0.19503174011945512 | O883: =POWER(D883/I883,1/5)-1 -> -0.45228172611320394
A884: 3368.HK | B884: 百盛集团 | C884: 0.10000000000000001 | D884: 72801930.599999994 | E884: -466107229.89999998 | F884: -215486285.5 | G884: -298110876.60000002 | H884: -248924242.5 | I884: -90271623.799999997 | J884: -162992852.80000001 | K884: 163639341.25 | L884: -218926411.69999999 | M884: 293296432.80000001 | N884: =POWER(D884/M884,1/9)-1 -> -0.14343649184163842 | O884: =POWER(D884/I884,1/5)-1 -> -1.9578959307809551
A885: 1582.HK | B885: 华营建筑 | C885: 0.43 | D885: 71887000 | E885: 56532000 | F885: 48563000 | G885: 89141000 | H885: 58518000 | I885: 63431000 | J885: 58893000 | K885: 45869000 | L885: 43610000 | M885: 21442000 | N885: =POWER(D885/M885,1/9)-1 -> 0.143868547926296 | O885: =POWER(D885/I885,1/5)-1 -> 2.5344391796481736e-02
A886: 6882.HK | B886: 东瀛游 | C886: 0.63 | D886: 71657000 | E886: -74299000 | F886: -155635000 | G886: -108760000 | H886: 14001000 | I886: 34817000 | J886: 28559000 | K886: 18670000 | L886: 150469000 | M886: 74507000 | N886: =POWER(D886/M886,1/9)-1 -> -4.3242051472554e-03 | O886: =POWER(D886/I886,1/5)-1 -> 0.1552964927130851
A887: 2540.HK | B887: 乐思集团 | C887: 1.91 | D887: 71506222.200000003 | E887: -- | F887: -- | G887: -- | H887: -- | I887: -- | J887: -- | K887: -- | L887: -- | M887: -- | N887: =POWER(D887/M887,1/9)-1 -> #VALUE! | O887: =POWER(D887/I887,1/5)-1 -> #VALUE!
A888: 2489.HK | B888: 集海资源 | C888: 0.71 | D888: 71280405 | E888: -- | F888: -- | G888: -- | H888: -- | I888: -- | J888: -- | K888: -- | L888: -- | M888: -- | N888: =POWER(D888/M888,1/9)-1 -> #VALUE! | O888: =POWER(D888/I888,1/5)-1 -> #VALUE!
A889: 1111.HK | B889: 华视集团控股 | C889: 0.29999999999999999 | D889: 71234364.599999994 | E889: -- | F889: -- | G889: -- | H889: 1952973172.5 | I889: 1607542000 | J889: 1412893000 | K889: 1268279000 | L889: 1041963000 | M889: 2742404000 | N889: =POWER(D889/M889,1/9)-1 -> -0.33343916664663154 | O889: =POWER(D889/I889,1/5)-1 -> -0.46382637680290451
A890: 2166.HK | B890: 芯智控股 | C890: 1.14 | D890: 71130000 | E890: 164736000 | F890: 214061000 | G890: 71002000 | H890: 55102000 | I890: 80499000 | J890: 77582000 | K890: 71949366 | L890: 47247048 | M890: 51530864 | N890: =POWER(D890/M890,1/9)-1 -> 3.6463306657401162e-02 | O890: =POWER(D890/I890,1/5)-1 -> -2.4443415192932472e-02
A891: 1577.HK | B891: 汇鑫小贷 | C891: 0.65 | D891: 71050124.069999993 | E891: 68475868.549999997 | F891: 51525406.109999999 | G891: 48982541.710000001 | H891: 71991525.769999996 | I891: 100185240.93000001 | J891: 109059686.5 | K891: 95032944.299999997 | L891: 88503394.599999994 | M891: 91682046.209999993 | N891: =POWER(D891/M891,1/9)-1 -> -2.7929333062604034e-02 | O891: =POWER(D891/I891,1/5)-1 -> -6.6418539406841171e-02
A892: 0690.HK | B892: 联康生物科技集团 | C892: 0.06 | D892: 70876000 | E892: 38512000 | F892: -19591000 | G892: -71319000 | H892: 2459000 | I892: -138567000 | J892: -279309000 | K892: -55727000 | L892: -59799000 | M892: -366130000 | N892: =POWER(D892/M892,1/9)-1 -> -1.8332256940679459 | O892: =POWER(D892/I892,1/5)-1 -> -1.8745162362479677
A893: 1476.HK | B893: 恒投证券 | C893: 1.61 | D893: 70315749 | E893: -1451156253.2 | F893: 341939176 | G893: 505441881.60000002 | H893: 827551215 | I893: -766785615.60000002 | J893: 846665577.79999995 | K893: 391963433.75 | L893: 1939064183.7 | M893: 816257629.5 | N893: =POWER(D893/M893,1/9)-1 -> -0.23846177752878461 | O893: =POWER(D893/I893,1/5)-1 -> -1.6201199880631809
A894: 1208.HK | B894: 五矿资源 | C894: 2.76 | D894: 70299000 | E894: 1346099200 | F894: 5202045800 | G894: -501619100 | H894: -1794124800 | I894: 535062200 | J894: 1149439400 | K894: -1184035800 | L894: -7955888250 | M894: 805072800 | N894: =POWER(D894/M894,1/9)-1 -> -0.23731360524669698 | O894: =POWER(D894/I894,1/5)-1 -> -0.33363991445974783
A895: 1285.HK | B895: 嘉士利集团 | C895: 1.12 | D895: 70066911.599999994 | E895: 64272369.399999999 | F895: 141341586 | G895: 170047181.09999999 | H895: 122460120 | I895: 98464989.400000006 | J895: 127761977.40000001 | K895: 99609116.25 | L895: 123662833.55 | M895: 89460703.099999994 | N895: =POWER(D895/M895,1/9)-1 -> -2.6784621070439218e-02 | O895: =POWER(D895/I895,1/5)-1 -> -6.5786309642254404e-02
A896: 2138.HK | B896: 医思健康 | C896: 1.1000000000000001 | D896: 69654000 | E896: 197501000 | F896: 192865000 | G896: 286576155 | H896: 361105819 | I896: 279223799 | J896: 200702539 | K896: 148663969 | L896: 174415159 | M896: 81121682 | N896: =POWER(D896/M896,1/9)-1 -> -1.6791878645441072e-02 | O896: =POWER(D896/I896,1/5)-1 -> -0.24247193723364713
A897: 0228.HK | B897: 中能控股 | C897: 0.09 | D897: 69529000 | E897: 83265000 | F897: 123775000 | G897: -14173000 | H897: -72352000 | I897: 27544000 | J897: -235510000 | K897: -162688000 | L897: -1281436000 | M897: -36654000 | N897: =POWER(D897/M897,1/9)-1 -> -2.0737269289375986 | O897: =POWER(D897/I897,1/5)-1 -> 0.20344928906502524
A898: 2176.HK | B898: 赛迪顾问 | C898: 0.89 | D898: 69140622.599999994 | E898: 33953553.799999997 | F898: 52556764.5 | G898: 25296885.600000001 | H898: -- | I898: -- | J898: -- | K898: -- | L898: -- | M898: -- | N898: =POWER(D898/M898,1/9)-1 -> #VALUE! | O898: =POWER(D898/I898,1/5)-1 -> #VALUE!
A899: 0943.HK | B899: 中证国际 | C899: 0.01 | D899: 69131000 | E899: -- | F899: -- | G899: -53788000 | H899: -70485000 | I899: 55386000 | J899: -43664000 | K899: -39237000 | L899: -49090000 | M899: -19876000 | N899: =POWER(D899/M899,1/9)-1 -> -2.1485484413429434 | O899: =POWER(D899/I899,1/5)-1 -> 4.5332775546961468e-02
A900: 1863.HK | B900: 中国龙天集团 | C900: 1.37 | D900: 69060600 | E900: 52104682.799999997 | F900: 130938234 | G900: 53672448.899999999 | H900: 45200640 | I900: 35438925 | J900: 34043964.399999999 | K900: 24727535 | L900: -814081802.85000002 | M900: -198699373.30000001 | N900: =POWER(D900/M900,1/9)-1 -> -1.8892088185857785 | O900: =POWER(D900/I900,1/5)-1 -> 0.14274666238708789
A901: 8371.HK | B901: 尝高美集团 | C901: 1.46 | D901: 68567000 | E901: 26381000 | F901: 24967000 | G901: 30072000 | H901: 27252000 | I901: 1208000 | J901: 14214000 | K901: 12001000 | L901: -- | M901: -- | N901: =POWER(D901/M901,1/9)-1 -> #VALUE! | O901: =POWER(D901/I901,1/5)-1 -> 1.2428986152034009
A902: 0210.HK | B902: 达芙妮国际 | C902: 0.18 | D902: 68441247 | E902: 48629006.700000003 | F902: 52723000 | G902: -241987000 | H902: -1070127000 | I902: -994397000 | J902: -734204000 | K902: -819127000 | L902: -378888000 | M902: 176031000 | N902: =POWER(D902/M902,1/9)-1 -> -9.9643910151559822e-02 | O902: =POWER(D902/I902,1/5)-1 -> -1.5855333306089399
A903: 0195.HK | B903: 绿科科技国际 | C903: 0.40000000000000002 | D903: 68390000 | E903: 216115000 | F903: 349815000 | G903: -25663000 | H903: -61589000 | I903: 39345000 | J903: 25402000 | K903: 84119000 | L903: -144343000 | M903: -23465000 | N903: =POWER(D903/M903,1/9)-1 -> -2.1262093176314947 | O903: =POWER(D903/I903,1/5)-1 -> 0.11691625331403732
A904: 0217.HK | B904: 中国诚通发展集团 | C904: 0.09 | D904: 68003000 | E904: 76066000 | F904: 104222000 | G904: 121372000 | H904: 47539000 | I904: 113440000 | J904: 23363000 | K904: 63804000 | L904: 81830000 | M904: -51417000 | N904: =POWER(D904/M904,1/9)-1 -> -2.0315523193516745 | O904: =POWER(D904/I904,1/5)-1 -> -9.7281441659168633e-02
A905: 0229.HK | B905: 利民实业 | C905: 0.93 | D905: 67871000 | E905: 30504000 | F905: 41960000 | G905: 63218000 | H905: 38973000 | I905: 52574000 | J905: 36462000 | K905: 51011000 | L905: 36328469 | M905: 28286391 | N905: =POWER(D905/M905,1/9)-1 -> 0.1021331838273114 | O905: =POWER(D905/I905,1/5)-1 -> 5.2404376472722225e-02
A906: 2215.HK | B906: 德信服务集团 | C906: 1.82 | D906: 67708985.400000006 | E906: 137654146.30000001 | F906: 120272839 | G906: 115840761 | H906: -- | I906: -- | J906: -- | K906: -- | L906: -- | M906: -- | N906: =POWER(D906/M906,1/9)-1 -> #VALUE! | O906: =POWER(D906/I906,1/5)-1 -> #VALUE!
A907: 0640.HK | B907: 星谦发展 | C907: 0.75 | D907: 67054000 | E907: 101350000 | F907: 41463000 | G907: 56018000 | H907: 66035000 | I907: 40311000 | J907: -20279000 | K907: 37159000 | L907: 49183000 | M907: 39533000 | N907: =POWER(D907/M907,1/9)-1 -> 6.0464420063084612e-02 | O907: =POWER(D907/I907,1/5)-1 -> 0.10713409055683276
A908: 1245.HK | B908: Niraku | C908: 0.19 | D908: 66888990 | E908: -76032780 | F908: -384656580 | G908: 12785970 | H908: 43194100 | I908: -1108531.05 | J908: 34194000 | K908: 12487190 | L908: 195435000 | M908: 278570340 | N908: =POWER(D908/M908,1/9)-1 -> -0.14658995268714281 | O908: =POWER(D908/I908,1/5)-1 -> -3.2704992104622113
A909: 1925.HK | B909: 旷世控股 | C909: 1.15 | D909: 66479049 | E909: 59343700.5 | F909: 60000500 | G909: 48684347.399999999 | H909: 31088850 | I909: 87683586 | J909: 45197331.100000001 | K909: 50703003.75 | L909: -- | M909: -- | N909: =POWER(D909/M909,1/9)-1 -> #VALUE! | O909: =POWER(D909/I909,1/5)-1 -> -5.3864584796439963e-02
A910: 1748.HK | B910: 信源企业集团 | C910: 3.93 | D910: 66370067 | E910: 85349248 | F910: 13420358 | G910: 66699059 | H910: 46753148 | I910: 51806242 | J910: 42891046 | K910: 34040060 | L910: 26173438.5 | M910: -- | N910: =POWER(D910/M910,1/9)-1 -> #VALUE! | O910: =POWER(D910/I910,1/5)-1 -> 5.0795086169563852e-02
A911: 1735.HK | B911: 中环新能源 | C911: 8.31 | D911: 66323000 | E911: -27843000 | F911: 61985000 | G911: -12687000 | H911: -10814000 | I911: 10728000 | J911: 26956000 | K911: 30065000 | L911: 8444000 | M911: -- | N911: =POWER(D911/M911,1/9)-1 -> #VALUE! | O911: =POWER(D911/I911,1/5)-1 -> 0.4395577088971756
A912: 1203.HK | B912: 广南(集团) | C912: 0.55 | D912: 65924000 | E912: 135673000 | F912: 54062000 | G912: 69899000 | H912: 54213000 | I912: 118377000 | J912: 65797000 | K912: 108484000 | L912: 66285000 | M912: 144895000 | N912: =POWER(D912/M912,1/9)-1 -> -8.3781818445231471e-02 | O912: =POWER(D912/I912,1/5)-1 -> -0.11048096877841052
A913: 1180.HK | B913: 汇彩控股 | C913: 0.84 | D913: 65782000 | E913: -154565000 | F913: -86115000 | G913: -189152000 | H913: 926000 | I913: 58224000 | J913: -30698000 | K913: -380380000 | L913: -165192000 | M913: 58443000 | N913: =POWER(D913/M913,1/9)-1 -> 1.3230573444941829e-02 | O913: =POWER(D913/I913,1/5)-1 -> 2.4710076885705146e-02
A914: 8502.HK | B914: 远航港口 | C914: 0.27 | D914: 64829268 | E914: 72302185.200000003 | F914: 70048747 | G914: 53133710.100000001 | H914: 46300260 | I914: 20227229 | J914: -2325866 | K914: 3823811.25 | L914: 4778291.1500000004 | M914: -- | N914: =POWER(D914/M914,1/9)-1 -> #VALUE! | O914: =POWER(D914/I914,1/5)-1 -> 0.26231268167556876
A915: 2169.HK | B915: 沧港铁路 | C915: 0.81 | D915: 64651683.600000001 | E915: 76796535.599999994 | F915: 94768953 | G915: 75863243.099999994 | H915: 78441795 | I915: 93030451.599999994 | J915: 96438317.099999994 | K915: 77254100 | L915: -- | M915: -- | N915: =POWER(D915/M915,1/9)-1 -> #VALUE! | O915: =POWER(D915/I915,1/5)-1 -> -7.0197002477356385e-02
A916: 1455.HK | B916: 科利实业控股 | C916: 0.16 | D916: 64205000 | E916: 59721000 | F916: 58139000 | G916: 43356000 | H916: 33823000 | I916: 30157000 | J916: 34424000 | K916: -- | L916: -- | M916: -- | N916: =POWER(D916/M916,1/9)-1 -> #VALUE! | O916: =POWER(D916/I916,1/5)-1 -> 0.16315111908281921
A917: 1091.HK | B917: 南方锰业 | C917: 0.23 | D917: 64144000 | E917: -- | F917: 466185000 | G917: -437929000 | H917: -202338000 | I917: 330931000 | J917: 140851000 | K917: -87913000 | L917: -956007000 | M917: 15488000 | N917: =POWER(D917/M917,1/9)-1 -> 0.1710445331734336 | O917: =POWER(D917/I917,1/5)-1 -> -0.27974925287625996
A918: 6838.HK | B918: 盈利时 | C918: 0.73 | D918: 63726000 | E918: 112396000 | F918: 94419000 | G918: 96085000 | H918: 138396000 | I918: 154126000 | J918: 116435000 | K918: 48704000 | L918: 80732000 | M918: 45670000 | N918: =POWER(D918/M918,1/9)-1 -> 3.7710432939357386e-02 | O918: =POWER(D918/I918,1/5)-1 -> -0.16191484056620664
A919: 0616.HK | B919: 高山企业 | C919: 0.29999999999999999 | D919: 63572000 | E919: 116447000 | F919: -180793000 | G919: -206192000 | H919: 50510000 | I919: 53539000 | J919: -26627000 | K919: -69268000 | L919: 31086000 | M919: -2541000 | N919: =POWER(D919/M919,1/9)-1 -> -2.4300866636528395 | O919: =POWER(D919/I919,1/5)-1 -> 3.4949416222684659e-02
A920: 2107.HK | B920: 第一服务控股 | C920: 0.32 | D920: 62622617.399999999 | E920: 46633397.799999997 | F920: 43428117 | G920: 110347293.90000001 | H920: 86376045 | I920: 57921720.600000001 | J920: 47533987.200000003 | K920: -- | L920: -- | M920: -- | N920: =POWER(D920/M920,1/9)-1 -> #VALUE! | O920: =POWER(D920/I920,1/5)-1 -> 1.5729234141231618e-02
A921: 1418.HK | B921: 盛诺集团 | C921: 0.13 | D921: 62593000 | E921: -35970000 | F921: 15305000 | G921: 58523000 | H921: -216509000 | I921: -5801000 | J921: 39674000 | K921: 103525000 | L921: 172674000 | M921: 194393000 | N921: =POWER(D921/M921,1/9)-1 -> -0.11830956936908421 | O921: =POWER(D921/I921,1/5)-1 -> -2.60917983003253
A922: 0103.HK | B922: 首佳科技 | C922: 0.24 | D922: 62506000 | E922: 47858000 | F922: 80879000 | G922: 148254000 | H922: 108344000 | I922: -8681000 | J922: -68518000 | K922: 10103000 | L922: -376985000 | M922: -275774000 | N922: =POWER(D922/M922,1/9)-1 -> -1.8479578508440568 | O922: =POWER(D922/I922,1/5)-1 -> -2.4841246906210812
A923: 6909.HK | B923: 百得利控股 | C923: 0.89 | D923: 62278410.600000001 | E923: 193500736.80000001 | F923: 558408735 | G923: 280077429.60000002 | H923: -- | I923: -- | J923: -- | K923: -- | L923: -- | M923: -- | N923: =POWER(D923/M923,1/9)-1 -> #VALUE! | O923: =POWER(D923/I923,1/5)-1 -> #VALUE!
A924: 3309.HK | B924: 希玛医疗 | C924: 2.62 | D924: 61998000 | E924: -21875000 | F924: 21861000 | G924: -6246000 | H924: 41435000 | I924: 42571000 | J924: 40127000 | K924: 46887000 | L924: 38357000 | M924: 22361000 | N924: =POWER(D924/M924,1/9)-1 -> 0.1199782956918809 | O924: =POWER(D924/I924,1/5)-1 -> 7.8084409355073214e-02
A925: 1449.HK | B925: 立德教育 | C925: 0.29999999999999999 | D925: 61920344.850000001 | E925: 63689220 | F925: 62683466.950000003 | G925: 47897439.25 | H925: 76859981.700000003 | I925: 64580152.5 | J925: 55905795.799999997 | K925: -- | L925: -- | M925: -- | N925: =POWER(D925/M925,1/9)-1 -> #VALUE! | O925: =POWER(D925/I925,1/5)-1 -> -8.3763865666077741e-03
A926: 1292.HK | B926: 长安民生物流 | C926: 2.08 | D926: 61877053.329999998 | E926: 43411544.200000003 | F926: 35691726 | G926: 501789.90000000002 | H926: -62543122.5 | I926: 52499707.399999999 | J926: 152618771.09999999 | K926: 125576806.25 | L926: 279850505.89999998 | M926: 276988875.60000002 | N926: =POWER(D926/M926,1/9)-1 -> -0.15340803152108984 | O926: =POWER(D926/I926,1/5)-1 -> 3.3414493508961529e-02
A927: 8188.HK | B927: 骏杰集团控股 | C927: 0.35 | D927: 61479000 | E927: 5804000 | F927: 10451000 | G927: 1008000 | H927: -28217000 | I927: -9859000 | J927: -1662000 | K927: 17708000 | L927: 15366000 | M927: 6937000 | N927: =POWER(D927/M927,1/9)-1 -> 0.27433584720854554 | O927: =POWER(D927/I927,1/5)-1 -> -2.4420449089569898
A928: 1280.HK | B928: 奇点国峰 | C928: 0.5 | D928: 61227154.799999997 | E928: -154286852.69999999 | F928: -73514082 | G928: -99182766.599999994 | H928: -121625347.5 | I928: -183008316.59999999 | J928: -857960414.70000005 | K928: -803158160 | L928: -468771177.89999998 | M928: 62399991.600000001 | N928: =POWER(D928/M928,1/9)-1 -> -2.1060395986002289e-03 | O928: =POWER(D928/I928,1/5)-1 -> -1.8033312294236961
A929: 1263.HK | B929: 栢能集团 | C929: 4.34 | D929: 60843000 | E929: 702484000 | F929: 2374320000 | G929: 207276000 | H929: 10266000 | I929: 270843000 | J929: 332293000 | K929: 150189000 | L929: -18460000 | M929: 51349000 | N929: =POWER(D929/M929,1/9)-1 -> 1.9028931596774656e-02 | O929: =POWER(D929/I929,1/5)-1 -> -0.25817989275382613
A930: 1314.HK | B930: 翠华控股 | C930: 0.21 | D930: 60578000 | E930: -118254000 | F930: -124114000 | G930: -317389000 | H930: 4741000 | I930: 80205000 | J930: 90483000 | K930: 71675000 | L930: 157407000 | M930: 156031000 | N930: =POWER(D930/M930,1/9)-1 -> -9.9787802356266164e-02 | O930: =POWER(D930/I930,1/5)-1 -> -5.4584545059829015e-02
A931: 1334.HK | B931: 瑞昌国际控股 | C931: 1.29 | D931: 60522298.200000003 | E931: -- | F931: -- | G931: -- | H931: -- | I931: -- | J931: -- | K931: -- | L931: -- | M931: -- | N931: =POWER(D931/M931,1/9)-1 -> #VALUE! | O931: =POWER(D931/I931,1/5)-1 -> #VALUE!
A932: 0722.HK | B932: 联合医务 | C932: 0.47 | D932: 60452000 | E932: 72168000 | F932: 34834000 | G932: 58915000 | H932: 12798000 | I932: 37555000 | J932: 44085000 | K932: 6676000 | L932: 41392000 | M932: 41537000 | N932: =POWER(D932/M932,1/9)-1 -> 4.2577610434192614e-02 | O932: =POWER(D932/I932,1/5)-1 -> 9.9888297932527959e-02
A933: 2415.HK | B933: 梅斯健康 | C933: 1.7 | D933: 60337040.399999999 | E933: -112675756.09999999 | F933: -184936235 | G933: 34462596.600000001 | H933: -- | I933: -- | J933: -- | K933: -- | L933: -- | M933: -- | N933: =POWER(D933/M933,1/9)-1 -> #VALUE! | O933: =POWER(D933/I933,1/5)-1 -> #VALUE!
A934: 2502.HK | B934: 金源氢化 | C934: 0.63 | D934: 60208785 | E934: -- | F934: -- | G934: -- | H934: -- | I934: -- | J934: -- | K934: -- | L934: -- | M934: -- | N934: =POWER(D934/M934,1/9)-1 -> #VALUE! | O934: =POWER(D934/I934,1/5)-1 -> #VALUE!
A935: 2115.HK | B935: 捷芯隆 | C935: 0.16 | D935: 59862385.799999997 | E935: 84556735.5 | F935: 42409333 | G935: 12542363.699999999 | H935: 20320620 | I935: 23564465.600000001 | J935: 16663511.1 | K935: 17302162.5 | L935: -- | M935: -- | N935: =POWER(D935/M935,1/9)-1 -> #VALUE! | O935: =POWER(D935/I935,1/5)-1 -> 0.2049784646324897
A936: 0224.HK | B936: 建生国际 | C936: 0.69 | D936: 59835000 | E936: 211814000 | F936: 292529000 | G936: 38454000 | H936: 539701000 | I936: 623498000 | J936: 805189000 | K936: 365553000 | L936: 804243000 | M936: 477449000 | N936: =POWER(D936/M936,1/9)-1 -> -0.20607235783044719 | O936: =POWER(D936/I936,1/5)-1 -> -0.37421658906904121
A937: 0912.HK | B937: 信佳国际 | C937: 1.18 | D937: 59810000 | E937: 56465000 | F937: 79274000 | G937: 27705000 | H937: 55557000 | I937: 74111000 | J937: 61745000 | K937: 80038000 | L937: 170406000 | M937: 81487000 | N937: =POWER(D937/M937,1/9)-1 -> -3.3779686559610722e-02 | O937: =POWER(D937/I937,1/5)-1 -> -4.1971948049307373e-02
A938: 0418.HK | B938: 方正控股 | C938: 0.55 | D938: 59756000 | E938: 34751000 | F938: 43484000 | G938: 53897000 | H938: -238790000 | I938: 87336000 | J938: 89836000 | K938: 40235000 | L938: 7382000 | M938: 6381000 | N938: =POWER(D938/M938,1/9)-1 -> 0.28216418525703979 | O938: =POWER(D938/I938,1/5)-1 -> -7.3089836355296978e-02
A939: 2209.HK | B939: 喆丽控股 | C939: 4.65 | D939: 59152703 | E939: -52953856 | F939: -16102870 | G939: 86988660 | H939: -- | I939: -- | J939: -- | K939: -- | L939: -- | M939: -- | N939: =POWER(D939/M939,1/9)-1 -> #VALUE! | O939: =POWER(D939/I939,1/5)-1 -> #VALUE!
A940: 1273.HK | B940: 香港信贷 | C940: 0.34 | D940: 58885000 | E940: 70550000 | F940: 73218000 | G940: 55495000 | H940: 42164000 | I940: 50050000 | J940: 46299000 | K940: 48061000 | L940: 52876000 | M940: 40532000 | N940: =POWER(D940/M940,1/9)-1 -> 4.2372536857156584e-02 | O940: =POWER(D940/I940,1/5)-1 -> 3.3047091999103717e-02
A941: 6699.HK | B941: 时代天使 | C941: 56.399999999999999 | D941: 58619295 | E941: 241166346.09999999 | F941: 350020876 | G941: 179606219.09999999 | H941: -- | I941: -- | J941: -- | K941: -- | L941: -- | M941: -- | N941: =POWER(D941/M941,1/9)-1 -> #VALUE! | O941: =POWER(D941/I941,1/5)-1 -> #VALUE!
A942: 0380.HK | B942: 中国管业 | C942: 0.09 | D942: 58390000 | E942: 49218000 | F942: 56424000 | G942: 20152000 | H942: 6790000 | I942: 26015000 | J942: 74945000 | K942: 50572000 | L942: 34023000 | M942: 21729000 | N942: =POWER(D942/M942,1/9)-1 -> 0.11609165126819199 | O942: =POWER(D942/I942,1/5)-1 -> 0.17550079994289081
A943: 0178.HK | B943: 莎莎国际 | C943: 0.76 | D943: 58247000 | E943: -343732000 | F943: -351368000 | G943: -515936000 | H943: 470752000 | I943: 440120000 | J943: 326705000 | K943: 383470000 | L943: 838811000 | M943: 935235000 | N943: =POWER(D943/M943,1/9)-1 -> -0.26541982864852953 | O943: =POWER(D943/I943,1/5)-1 -> -0.33267024211600227
A944: 2260.HK | B944: 环龙控股 | C944: 2.26 | D944: 58234528.799999997 | E944: 59154179.700000003 | F944: 61391532 | G944: 48292212.299999997 | H944: -- | I944: -- | J944: -- | K944: -- | L944: -- | M944: -- | N944: =POWER(D944/M944,1/9)-1 -> #VALUE! | O944: =POWER(D944/I944,1/5)-1 -> #VALUE!
A945: 0831.HK | B945: 利亚零售 | C945: 0.59 | D945: 57709000 | E945: 67785000 | F945: 80370000 | G945: 3140446000 | H945: 207574000 | I945: 183203000 | J945: 150311000 | K945: 139627000 | L945: 159178000 | M945: 121032000 | N945: =POWER(D945/M945,1/9)-1 -> -7.8998429012910765e-02 | O945: =POWER(D945/I945,1/5)-1 -> -0.20628937588483831
A946: 3332.HK | B946: 中生联合 | C946: 0.77 | D946: 57662312.399999999 | E946: -16070912.6 | F946: -38825221.5 | G946: -59124199.5 | H946: -217530315 | I946: -128476208.2 | J946: 5046170.0999999996 | K946: 96936560 | L946: 160216819.65000001 | M946: 134614716.69999999 | N946: =POWER(D946/M946,1/9)-1 -> -8.9900585874941541e-02 | O946: =POWER(D946/I946,1/5)-1 -> -1.851949532291594
A947: 1612.HK | B947: 永胜医疗 | C947: 0.41 | D947: 57275000 | E947: -17398000 | F947: 60695000 | G947: 216865000 | H947: 11525000 | I947: 30943000 | J947: 13155000 | K947: 29242000 | L947: 58153000 | M947: 35759000 | N947: =POWER(D947/M947,1/9)-1 -> 5.373421372859255e-02 | O947: =POWER(D947/I947,1/5)-1 -> 0.13104669777425926
A948: 2161.HK | B948: 健倍苗苗 | C948: 0.95 | D948: 57093000 | E948: 24620000 | F948: 22600000 | G948: 41022000 | H948: 52459000 | I948: 42379000 | J948: -- | K948: -- | L948: -- | M948: -- | N948: =POWER(D948/M948,1/9)-1 -> #VALUE! | O948: =POWER(D948/I948,1/5)-1 -> 6.1417959808148348e-02
A949: 1022.HK | B949: 飞鱼科技 | C949: 0.22 | D949: 57016650.600000001 | E949: -33433499.699999999 | F949: -95637123.5 | G949: -25578174 | H949: -89782185 | I949: -122408608.8 | J949: -452530799.5 | K949: -167800972.5 | L949: 77480526.099999994 | M949: 147108691.5 | N949: =POWER(D949/M949,1/9)-1 -> -9.995837200040969e-02 | O949: =POWER(D949/I949,1/5)-1 -> -1.8582976982687414
A950: 6038.HK | B950: 信越控股 | C950: 0.24 | D950: 57003000 | E950: 43404000 | F950: 36800000 | G950: 23299000 | H950: 26366000 | I950: 36939000 | J950: 52267000 | K950: 50052000 | L950: 46168000 | M950: 30753000 | N950: =POWER(D950/M950,1/9)-1 -> 7.0973966016290024e-02 | O950: =POWER(D950/I950,1/5)-1 -> 9.0642747341101781e-02
A951: 1861.HK | B951: 保宝龙科技 | C951: 1.5 | D951: 56922000 | E951: 41996000 | F951: 18093000 | G951: 53161000 | H951: 37412000 | I951: 41686000 | J951: 39210000 | K951: 69368000 | L951: 57748000 | M951: -- | N951: =POWER(D951/M951,1/9)-1 -> #VALUE! | O951: =POWER(D951/I951,1/5)-1 -> 6.4285108055662121e-02
A952: 9900.HK | B952: 德益控股 | C952: 1.46 | D952: 56758000 | E952: 13322000 | F952: 34072000 | G952: 24499000 | H952: 38268000 | I952: 9678000 | J952: 23626000 | K952: 11380000 | L952: -- | M952: -- | N952: =POWER(D952/M952,1/9)-1 -> #VALUE! | O952: =POWER(D952/I952,1/5)-1 -> 0.42445355420507891
A953: 1283.HK | B953: 高升集团控股 | C953: 1.01 | D953: 56477000 | E953: 68181000 | F953: 73303000 | G953: 72655000 | H953: 45395000 | I953: 36069000 | J953: 31305000 | K953: 27621000 | L953: -- | M953: -- | N953: =POWER(D953/M953,1/9)-1 -> #VALUE! | O953: =POWER(D953/I953,1/5)-1 -> 9.3824139407127083e-02
A954: 2289.HK | B954: 创美药业 | C954: 8.5999999999999996 | D954: 56284088.299999997 | E954: 101958060.17 | F954: 28350922.059999999 | G954: 48338655.200000003 | H954: 44871374.789999999 | I954: 51729956.719999999 | J954: 53662658.329999998 | K954: 62739252.289999999 | L954: 30999501.949999999 | M954: 45479715.5 | N954: =POWER(D954/M954,1/9)-1 -> 2.396549392412517e-02 | O954: =POWER(D954/I954,1/5)-1 -> 1.7018151386569924e-02
A955: 2405.HK | B955: 力盟科技 | C955: 2.8999999999999999 | D955: 56122035 | E955: 42897152 | F955: 45033450 | G955: 45672923 | H955: -- | I955: -- | J955: -- | K955: -- | L955: -- | M955: -- | N955: =POWER(D955/M955,1/9)-1 -> #VALUE! | O955: =POWER(D955/I955,1/5)-1 -> #VALUE!
A956: 2531.HK | B956: 广联科技控股 | C956: 7.13 | D956: 56047609.799999997 | E956: -- | F956: -- | G956: -- | H956: -- | I956: -- | J956: -- | K956: -- | L956: -- | M956: -- | N956: =POWER(D956/M956,1/9)-1 -> #VALUE! | O956: =POWER(D956/I956,1/5)-1 -> #VALUE!
A957: 2098.HK | B957: 卓尔智联 | C957: 0.40000000000000002 | D957: 55813023 | E957: -3429721818.4000001 | F957: -1624732723 | G957: -1502330355 | H957: 103700647.5 | I957: 1556673425.2 | J957: 2852225061.5 | K957: 2276896798.75 | L957: 2396468838.3499999 | M957: 1962720830.0999999 | N957: =POWER(D957/M957,1/9)-1 -> -0.32670008888204349 | O957: =POWER(D957/I957,1/5)-1 -> -0.48606569597691229
A958: 1051.HK | B958: 国际资源 | C958: 2.46 | D958: 55512777 | E958: -702150016 | F958: 544908644 | G958: 567232739 | H958: 339248442 | I958: 377661472 | J958: 244179686 | K958: 992031252 | L958: 460557961.5 | M958: 486588172 | N958: =POWER(D958/M958,1/9)-1 -> -0.21431595504252643 | O958: =POWER(D958/I958,1/5)-1 -> -0.31851224888890561
A959: 9699.HK | B959: 顺丰同城 | C959: 10.96 | D959: 55462239 | E959: -323655274.30000001 | F959: -1100643049.5 | G959: -903075216.29999995 | H959: -- | I959: -- | J959: -- | K959: -- | L959: -- | M959: -- | N959: =POWER(D959/M959,1/9)-1 -> #VALUE! | O959: =POWER(D959/I959,1/5)-1 -> #VALUE!
A960: 2623.HK | B960: 爱德新能源 | C960: 0.80000000000000004 | D960: 55385505 | E960: 65018043.5 | F960: -36804796.5 | G960: 72354289.5 | H960: -79682220 | I960: -109073325.59999999 | J960: -167406003.69999999 | K960: -130282950 | L960: -307435934.69999999 | M960: -98161061.900000006 | N960: =POWER(D960/M960,1/9)-1 -> -1.9383915683375761 | O960: =POWER(D960/I960,1/5)-1 -> -1.8732438043846669
A961: 1758.HK | B961: 博骏教育 | C961: 0.18 | D961: 54872972.649999999 | E961: -10689330.4 | F961: -919169110.14999998 | G961: 9704096.5 | H961: 29053338 | I961: 19138005 | J961: 41553527.5 | K961: 34534877.649999999 | L961: 26100288 | M961: 19537934 | N961: =POWER(D961/M961,1/9)-1 -> 0.12158216432924873 | O961: =POWER(D961/I961,1/5)-1 -> 0.23450361170917167
A962: 8310.HK | B962: 大丰港 | C962: 0.35 | D962: 54715000 | E962: -61967000 | F962: -73472000 | G962: 563632000 | H962: -946599000 | I962: -155630000 | J962: 175000 | K962: -36959000 | L962: -24108000 | M962: -19275000 | N962: =POWER(D962/M962,1/9)-1 -> -2.1229121466064758 | O962: =POWER(D962/I962,1/5)-1 -> -1.8113394946492181
A963: 2317.HK | B963: 味丹国际 | C963: 0.59999999999999998 | D963: 54567646 | E963: -34245888 | F963: 85887172 | G963: 129087450 | H963: 121189081 | I963: 111908690 | J963: 148942654 | K963: 174472754 | L963: 93742297.5 | M963: -18878104 | N963: =POWER(D963/M963,1/9)-1 -> -2.125173899709059 | O963: =POWER(D963/I963,1/5)-1 -> -0.13380777444022329
A964: 6058.HK | B964: 兴证国际 | C964: 0.20000000000000001 | D964: 54564283 | E964: -297402416 | F964: 40093639 | G964: -492537583 | H964: -461859447 | I964: 143800671 | J964: 152831841 | K964: 101119554 | L964: 50504033 | M964: 18771336 | N964: =POWER(D964/M964,1/9)-1 -> 0.12587548607977395 | O964: =POWER(D964/I964,1/5)-1 -> -0.17618535524165435
A965: 1354.HK | B965: 经发物业 | C965: 9.36 | D965: 54509641.200000003 | E965: -- | F965: -- | G965: -- | H965: -- | I965: -- | J965: -- | K965: -- | L965: -- | M965: -- | N965: =POWER(D965/M965,1/9)-1 -> #VALUE! | O965: =POWER(D965/I965,1/5)-1 -> #VALUE!
A966: 1596.HK | B966: 翼辰实业 | C966: 3.12 | D966: 54200759.82 | E966: 181660266.05000001 | F966: 301334257.91000003 | G966: 300635970.43000001 | H966: 216595612.19999999 | I966: 185556619.91999999 | J966: 211102312 | K966: 339883591.25 | L966: 268220547.44999999 | M966: 235116839 | N966: =POWER(D966/M966,1/9)-1 -> -0.15044540463963263 | O966: =POWER(D966/I966,1/5)-1 -> -0.21818178523488441
A967: 2271.HK | B967: 众安智慧生活 | C967: 1.35 | D967: 54093085.200000003 | E967: 57326657.700000003 | F967: 47744479.5 | G967: 43546066.5 | H967: -- | I967: -- | J967: -- | K967: -- | L967: -- | M967: -- | N967: =POWER(D967/M967,1/9)-1 -> #VALUE! | O967: =POWER(D967/I967,1/5)-1 -> #VALUE!
A968: 0653.HK | B968: 卓悦控股 | C968: 0.02 | D968: 53971000 | E968: 167221000 | F968: -216738000 | G968: -255734000 | H968: -129648000 | I968: -39613000 | J968: -202342000 | K968: -91628000 | L968: 432228000 | M968: 225522000 | N968: =POWER(D968/M968,1/9)-1 -> -0.14690609530957055 | O968: =POWER(D968/I968,1/5)-1 -> -2.0638111702618493
A969: 2497.HK | B969: 富景中国控股 | C969: 1.07 | D969: 53965926 | E969: -- | F969: -- | G969: -- | H969: -- | I969: -- | J969: -- | K969: -- | L969: -- | M969: -- | N969: =POWER(D969/M969,1/9)-1 -> #VALUE! | O969: =POWER(D969/I969,1/5)-1 -> #VALUE!
A970: 0428.HK | B970: 中国天弓控股 | C970: 0.56 | D970: 53505000 | E970: -48079000 | F970: -28643000 | G970: -4166000 | H970: -35361000 | I970: -78458000 | J970: -205508000 | K970: -194959000 | L970: 316286000 | M970: -36569000 | N970: =POWER(D970/M970,1/9)-1 -> -2.0431928147873997 | O970: =POWER(D970/I970,1/5)-1 -> -1.9262994944865715
A971: 9913.HK | B971: 智勤控股 | C971: 2.44 | D971: 53501000 | E971: 38751000 | F971: 42773000 | G971: 39601000 | H971: 41557000 | I971: 61626000 | J971: 56533000 | K971: -- | L971: -- | M971: -- | N971: =POWER(D971/M971,1/9)-1 -> #VALUE! | O971: =POWER(D971/I971,1/5)-1 -> -2.788065857938149e-02
A972: 1643.HK | B972: 现代中药集团 | C972: 0.35 | D972: 53489079 | E972: 99079894.900000006 | F972: 100134712 | G972: 75777426.299999997 | H972: 51669847.5 | I972: 54922648.200000003 | J972: 31028730.899999999 | K972: -- | L972: -- | M972: -- | N972: =POWER(D972/M972,1/9)-1 -> #VALUE! | O972: =POWER(D972/I972,1/5)-1 -> -5.2756937356693845e-03
A973: 1170.HK | B973: 信星集团 | C973: 0.75 | D973: 53410000 | E973: -18035000 | F973: 88098000 | G973: -51386000 | H973: 35593000 | I973: 257260000 | J973: 132556000 | K973: 120205000 | L973: 92480000 | M973: 67592000 | N973: =POWER(D973/M973,1/9)-1 -> -2.5826380980056851e-02 | O973: =POWER(D973/I973,1/5)-1 -> -0.26978615578730158
A974: 0317.HK | B974: 中船防务 | C974: 15.84 | D974: 52691652.079999998 | E974: 776573918.67999995 | F974: 97209872.519999996 | G974: 4365136349.9399996 | H974: 612747978.32000005 | I974: -2128059522.6700001 | J974: -60553546.149999999 | K974: 79147948.290000007 | L974: 115630070.27 | M974: 528733700.97000003 | N974: =POWER(D974/M974,1/9)-1 -> -0.22603244000960965 | O974: =POWER(D974/I974,1/5)-1 -> -1.4772562328376424
A975: 2483.HK | B975: K Cash集团 | C975: 1.7 | D975: 51566000 | E975: -- | F975: -- | G975: -- | H975: -- | I975: -- | J975: -- | K975: -- | L975: -- | M975: -- | N975: =POWER(D975/M975,1/9)-1 -> #VALUE! | O975: =POWER(D975/I975,1/5)-1 -> #VALUE!
A976: 3999.HK | B976: 大成食品 | C976: 0.63 | D976: 51547708.799999997 | E976: 103618241.2 | F976: 190376688.5 | G976: 241824591 | H976: 149390752.5 | I976: 14955511 | J976: 34911968 | K976: 59895263.75 | L976: -180581301.44999999 | M976: -135352225.59999999 | N976: =POWER(D976/M976,1/9)-1 -> -1.8982888233020505 | O976: =POWER(D976/I976,1/5)-1 -> 0.28080089377642992
A977: 0340.HK | B977: 潼关黄金 | C977: 0.5 | D977: 51454000 | E977: 50340000 | F977: 138677000 | G977: -6330000 | H977: -21071000 | I977: 57526000 | J977: -74068000 | K977: -21130000 | L977: -75663000 | M977: 630412000 | N977: =POWER(D977/M977,1/9)-1 -> -0.24301321705005963 | O977: =POWER(D977/I977,1/5)-1 -> -2.2062740626443644e-02
A978: 1120.HK | B978: 雅视光学 | C978: 0.81 | D978: 51321000 | E978: 114773000 | F978: 20700000 | G978: -511830000 | H978: -136292000 | I978: -38294000 | J978: -674549000 | K978: 835754000 | L978: -48873000 | M978: -100927000 | N978: =POWER(D978/M978,1/9)-1 -> -1.9276097506018102 | O978: =POWER(D978/I978,1/5)-1 -> -2.0603100441505449
A979: 0500.HK | B979: 先丰服务集团 | C979: 0.18 | D979: 51175000 | E979: -28966000 | F979: -159699000 | G979: -228029000 | H979: -354793000 | I979: -258846000 | J979: -223760000 | K979: -209816000 | L979: -142920000 | M979: -130440000 | N979: =POWER(D979/M979,1/9)-1 -> -1.9012591221054234 | O979: =POWER(D979/I979,1/5)-1 -> -1.7231081870264915
A980: 8609.HK | B980: 永续农业 | C980: 0.5 | D980: 51092640 | E980: 20450770.5 | F980: 43089319 | G980: 28069836 | H980: 9062132.5 | I980: 2828776.5 | J980: 9718880 | K980: 8020718 | L980: -- | M980: -- | N980: =POWER(D980/M980,1/9)-1 -> #VALUE! | O980: =POWER(D980/I980,1/5)-1 -> 0.78382374904980656
A981: 1962.HK | B981: 训修实业 | C981: 0.47 | D981: 51011000 | E981: 66289000 | F981: 54067000 | G981: -16176000 | H981: 90328000 | I981: 110975000 | J981: 110151000 | K981: 32970000 | L981: 68706000 | M981: 70326000 | N981: =POWER(D981/M981,1/9)-1 -> -3.5048857725184401e-02 | O981: =POWER(D981/I981,1/5)-1 -> -0.14397246045789391
A982: 1290.HK | B982: 中国汇融 | C982: 0.98 | D982: 50919586.200000003 | E982: 46316401.700000003 | F982: 106738440.5 | G982: 2641250.3999999999 | H982: 56354407.5 | I982: 69450045.599999994 | J982: 61028805.600000001 | K982: 44536677.5 | L982: 119823030.3 | M982: 205907243.69999999 | N982: =POWER(D982/M982,1/9)-1 -> -0.14379206388920429 | O982: =POWER(D982/I982,1/5)-1 -> -6.0184797115349742e-02
A983: 0420.HK | B983: 福田实业 | C983: 0.66 | D983: 50903000 | E983: -115532000 | F983: 241334000 | G983: 85706000 | H983: 141089000 | I983: 160792000 | J983: 156846000 | K983: 127903000 | L983: 99860000 | M983: 90590000 | N983: =POWER(D983/M983,1/9)-1 -> -6.2038978403573419e-02 | O983: =POWER(D983/I983,1/5)-1 -> -0.20549654841766418
A984: 0084.HK | B984: 宝光实业 | C984: 0.08 | D984: 50795000 | E984: -106716000 | F984: -81890000 | G984: -402898000 | H984: -34551000 | I984: -150577000 | J984: -177921000 | K984: -190009000 | L984: 91756000 | M984: 171712000 | N984: =POWER(D984/M984,1/9)-1 -> -0.12657729022597164 | O984: =POWER(D984/I984,1/5)-1 -> -1.8046600963082646
A985: 1669.HK | B985: 环球信贷集团 | C985: 0.56 | D985: 50304000 | E985: 50959000 | F985: 52520000 | G985: 64165000 | H985: 62500000 | I985: 68413000 | J985: 63006000 | K985: 76543000 | L985: 47180000 | M985: 35552000 | N985: =POWER(D985/M985,1/9)-1 -> 3.9318649463452093e-02 | O985: =POWER(D985/I985,1/5)-1 -> -5.9642967147247594e-02
A986: 8476.HK | B986: 大洋环球控股 | C986: 2.11 | D986: 50152000 | E986: 37405000 | F986: 27346000 | G986: 18700000 | H986: 24953000 | I986: 6654000 | J986: 17273000 | K986: 9079000 | L986: -- | M986: -- | N986: =POWER(D986/M986,1/9)-1 -> #VALUE! | O986: =POWER(D986/I986,1/5)-1 -> 0.49775608281421135
A987: 0406.HK | B987: 有利集团 | C987: 1.11 | D987: 49636000 | E987: 68186000 | F987: 150428000 | G987: -41561000 | H987: 30087000 | I987: 52535000 | J987: -29798000 | K987: -159347000 | L987: 76064000 | M987: 38615000 | N987: =POWER(D987/M987,1/9)-1 -> 2.8290059313599514e-02 | O987: =POWER(D987/I987,1/5)-1 -> -1.1288449312909399e-02
A988: 2433.HK | B988: 中天湖南集团 | C988: 0.17 | D988: 49632647.399999999 | E988: 72729735.099999994 | F988: 74167965 | G988: 57846482.700000003 | H988: -- | I988: -- | J988: -- | K988: -- | L988: -- | M988: -- | N988: =POWER(D988/M988,1/9)-1 -> #VALUE! | O988: =POWER(D988/I988,1/5)-1 -> #VALUE!
A989: 0759.HK | B989: CEC国际 | C989: 0.19 | D989: 49565000 | E989: 39884000 | F989: 32324000 | G989: 12349000 | H989: -9521000 | I989: -32869000 | J989: -49993000 | K989: -29715000 | L989: 27708000 | M989: 23773000 | N989: =POWER(D989/M989,1/9)-1 -> 8.5062036484119474e-02 | O989: =POWER(D989/I989,1/5)-1 -> -2.0856197206365614
A990: 1489.HK | B990: GC Construction | C990: 0.40000000000000002 | D990: 49328000 | E990: 31294000 | F990: 46039000 | G990: 25810000 | H990: -- | I990: -- | J990: -- | K990: -- | L990: -- | M990: -- | N990: =POWER(D990/M990,1/9)-1 -> #VALUE! | O990: =POWER(D990/I990,1/5)-1 -> #VALUE!
A991: 0212.HK | B991: 南洋集团 | C991: 25.399999999999999 | D991: 48961000 | E991: 12268000 | F991: 190717000 | G991: 86766000 | H991: 60281000 | I991: 334518000 | J991: 354983000 | K991: 125840000 | L991: 157131000 | M991: 357758000 | N991: =POWER(D991/M991,1/9)-1 -> -0.1982684180935852 | O991: =POWER(D991/I991,1/5)-1 -> -0.31909557338410344
A992: 0213.HK | B992: 乐声电子 | C992: 0.57 | D992: 48869383 | E992: 91356972 | F992: 116262504 | G992: 120824879 | H992: 221825779 | I992: 218708930 | J992: 145158827 | K992: 244730955 | L992: 133074103 | M992: 228475853 | N992: =POWER(D992/M992,1/9)-1 -> -0.15748548003619078 | O992: =POWER(D992/I992,1/5)-1 -> -0.25897293888823336
A993: 0712.HK | B993: 卡姆丹克太阳能 | C993: 0.09 | D993: 48732667.200000003 | E993: -62953620.5 | F993: -65138502 | G993: -78312597.599999994 | H993: -136402050 | I993: -204813645.19999999 | J993: -168200874.40000001 | K993: -1119106537.5 | L993: -511245399.69999999 | M993: -112923718.90000001 | N993: =POWER(D993/M993,1/9)-1 -> -1.9108530866103854 | O993: =POWER(D993/I993,1/5)-1 -> -1.7503990212027576
A994: 2119.HK | B994: 捷荣国际控股 | C994: 0.59 | D994: 48711000 | E994: 47424000 | F994: 80244000 | G994: 76797000 | H994: 75478000 | I994: 75784000 | J994: 46095000 | K994: 64946000 | L994: 41247000 | M994: 45195000 | N994: =POWER(D994/M994,1/9)-1 -> 8.3590115061626946e-03 | O994: =POWER(D994/I994,1/5)-1 -> -8.4602115942305489e-02
A995: 2522.HK | B995: 一脉阳光 | C995: 17.399999999999999 | D995: 48687723 | E995: -- | F995: -- | G995: -- | H995: -- | I995: -- | J995: -- | K995: -- | L995: -- | M995: -- | N995: =POWER(D995/M995,1/9)-1 -> #VALUE! | O995: =POWER(D995/I995,1/5)-1 -> #VALUE!
A996: 0703.HK | B996: 佳景集团 | C996: 0.20000000000000001 | D996: 48588000 | E996: -125612000 | F996: -72953000 | G996: -120945000 | H996: -376838000 | I996: -60125000 | J996: 11015000 | K996: -1539000 | L996: -45907000 | M996: 168809000 | N996: =POWER(D996/M996,1/9)-1 -> -0.12922948719237326 | O996: =POWER(D996/I996,1/5)-1 -> -1.9582852128884993
A997: 2130.HK | B997: 嘉泓物流 | C997: 3.62 | D997: 48278000 | E997: 86632000 | F997: 83413000 | G997: 55521000 | H997: 23614000 | I997: 23004000 | J997: 27936000 | K997: -- | L997: -- | M997: -- | N997: =POWER(D997/M997,1/9)-1 -> #VALUE! | O997: =POWER(D997/I997,1/5)-1 -> 0.15981623132855804
A998: 8368.HK | B998: 中国创意控股 | C998: 0.86 | D998: 48072754.799999997 | E998: 55363763.700000003 | F998: 28850444.5 | G998: 23841575.699999999 | H998: 1804762.5 | I998: -85166141.400000006 | J998: -87869778.799999997 | K998: -17933352.5 | L998: 620954.40000000002 | M998: 8102614.7000000002 | N998: =POWER(D998/M998,1/9)-1 -> 0.21876314717794854 | O998: =POWER(D998/I998,1/5)-1 -> -1.8919210377545792
A999: 2023.HK | B999: 中国绿岛科技 | C999: 0.90000000000000002 | D999: 47772396 | E999: 25180320.100000001 | F999: 43463627.5 | G999: 48292212.299999997 | H999: 26542860 | I999: 26459925.399999999 | J999: 26195965 | K999: 25872122.5 | L999: 4194970.3499999996 | M999: 25591933.199999999 | N999: =POWER(D999/M999,1/9)-1 -> 7.1813753424140092e-02 | O999: =POWER(D999/I999,1/5)-1 -> 0.12542791110526608
A1000: 2230.HK | B1000: 羚邦集团 | C1000: 0.16 | D1000: 47523000 | E1000: 42426000 | F1000: 38567000 | G1000: 35951000 | H1000: 105579000 | I1000: 93899000 | J1000: 53592000 | K1000: 35354000 | L1000: -- | M1000: -- | N1000: =POWER(D1000/M1000,1/9)-1 -> #VALUE! | O1000: =POWER(D1000/I1000,1/5)-1 -> -0.12733295394201372
A1001: 0875.HK | B1001: 中国金控 | C1001: 2.07 | D1001: 47293000 | E1001: 41037000 | F1001: 35711000 | G1001: -68089000 | H1001: -59582000 | I1001: -158594000 | J1001: -72929000 | K1001: -520683000 | L1001: -42397000 | M1001: -164169000 | N1001: =POWER(D1001/M1001,1/9)-1 -> -1.8708534546882329 | O1001: =POWER(D1001/I1001,1/5)-1 -> -1.785058503761362
A1002: 1710.HK | B1002: 致丰工业电子 | C1002: 0.19 | D1002: 47149000 | E1002: 45418000 | F1002: -10584000 | G1002: 28881000 | H1002: 22357000 | I1002: 42378000 | J1002: 70008000 | K1002: 75257000 | L1002: 29757000 | M1002: 21878000 | N1002: =POWER(D1002/M1002,1/9)-1 -> 8.9059610913173382e-02 | O1002: =POWER(D1002/I1002,1/5)-1 -> 2.1565942796058835e-02
A1003: 1397.HK | B1003: 碧瑶绿色集团 | C1003: 0.64 | D1003: 47111000 | E1003: 53709000 | F1003: 12847000 | G1003: 51376000 | H1003: -11031000 | I1003: 17893000 | J1003: 20616000 | K1003: 25011000 | L1003: 24086000 | M1003: 17681000 | N1003: =POWER(D1003/M1003,1/9)-1 -> 0.11504042053540742 | O1003: =POWER(D1003/I1003,1/5)-1 -> 0.21363427236144861
A1004: 1490.HK | B1004: 车市科技 | C1004: 0.22 | D1004: 47009440.799999997 | E1004: 18496327.600000001 | F1004: 50220418.5 | G1004: 77045607.900000006 | H1004: 57785925 | I1004: 54200775.799999997 | J1004: 32939777.5 | K1004: 13330555 | L1004: -- | M1004: -- | N1004: =POWER(D1004/M1004,1/9)-1 -> #VALUE! | O1004: =POWER(D1004/I1004,1/5)-1 -> -2.8067920940925362e-02
A1005: 2293.HK | B1005: 百本医护 | C1005: 0.62 | D1005: 46919000 | E1005: 58620000 | F1005: 61022000 | G1005: 30691000 | H1005: 38920000 | I1005: 42221000 | J1005: 32611000 | K1005: 26842000 | L1005: 22387000 | M1005: 8699000 | N1005: =POWER(D1005/M1005,1/9)-1 -> 0.20592399081695989 | O1005: =POWER(D1005/I1005,1/5)-1 -> 2.1325196819207637e-02
A1006: 1527.HK | B1006: 天洁环境 | C1006: 1.23 | D1006: 46815413.399999999 | E1006: 60471800.5 | F1006: 25239394 | G1006: 5350439.0999999996 | H1006: 38317957.5 | I1006: 35565309.600000001 | J1006: 99705319.599999994 | K1006: 117233541.25 | L1006: 113447663.25 | M1006: 92580453.099999994 | N1006: =POWER(D1006/M1006,1/9)-1 -> -7.2963961055412474e-02 | O1006: =POWER(D1006/I1006,1/5)-1 -> 5.6507182354358587e-02
A1007: 3601.HK | B1007: 鲁大师 | C1007: 0.81 | D1007: 46744160.399999999 | E1007: 68234256.599999994 | F1007: 67394031 | G1007: 86614181.099999994 | H1007: 117004485 | I1007: 81880141.799999997 | J1007: 63743115.200000003 | K1007: 35228847.5 | L1007: 12609608.1 | M1007: -- | N1007: =POWER(D1007/M1007,1/9)-1 -> #VALUE! | O1007: =POWER(D1007/I1007,1/5)-1 -> -0.10605714924177778
A1008: 2298.HK | B1008: 都市丽人 | C1008: 0.20000000000000001 | D1008: 46569864.600000001 | E1008: 37254374.399999999 | F1008: -604888306 | G1008: -140757430.5 | H1008: -1450304910 | I1008: 430651539.39999998 | J1008: 380053697.80000001 | K1008: 268879161.25 | L1008: 635076408.39999998 | M1008: 530640773.30000001 | N1008: =POWER(D1008/M1008,1/9)-1 -> -0.23688608438810388 | O1008: =POWER(D1008/I1008,1/5)-1 -> -0.35909184999801791
A1009: 6833.HK | B1009: 兴科蓉医药 | C1009: 0.24 | D1009: 46426262.399999999 | E1009: 78360082.200000003 | F1009: 165409133.5 | G1009: 140807490.30000001 | H1009: 25588515 | I1009: -319507100.39999998 | J1009: -222870714.40000001 | K1009: 21521578.75 | L1009: 81869544.700000003 | M1009: 86563079.299999997 | N1009: =POWER(D1009/M1009,1/9)-1 -> -6.6881541527630151e-02 | O1009: =POWER(D1009/I1009,1/5)-1 -> -1.6799181609587637
A1010: 1328.HK | B1010: 金涌投资 | C1010: 0.07 | D1010: 46393000 | E1010: -33397000 | F1010: -67729000 | G1010: 17254000 | H1010: -38852000 | I1010: 76446000 | J1010: -49200000 | K1010: -33166000 | L1010: 28294000 | M1010: 44513000 | N1010: =POWER(D1010/M1010,1/9)-1 -> 4.6069466586153851e-03 | O1010: =POWER(D1010/I1010,1/5)-1 -> -9.5060514789806039e-02
A1011: 6677.HK | B1011: 远洋服务 | C1011: 0.46 | D1011: 46202637.600000001 | E1011: 85076789.599999994 | F1011: 537579990 | G1011: 307073964.60000002 | H1011: 230768220 | I1011: 156162405.80000001 | J1011: 124887015.2 | K1011: -- | L1011: -- | M1011: -- | N1011: =POWER(D1011/M1011,1/9)-1 -> #VALUE! | O1011: =POWER(D1011/I1011,1/5)-1 -> -0.21617690500682785
A1012: 2321.HK | B1012: 双财庄 | C1012: 0.37 | D1012: 46079574.600000001 | E1012: 47492011.649999999 | F1012: 44082433.799999997 | G1012: 36275390.450000003 | H1012: -- | I1012: -- | J1012: -- | K1012: -- | L1012: -- | M1012: -- | N1012: =POWER(D1012/M1012,1/9)-1 -> #VALUE! | O1012: =POWER(D1012/I1012,1/5)-1 -> #VALUE!
A1013: 0686.HK | B1013: 北京能源国际 | C1013: 0.17 | D1013: 46040400 | E1013: 303458900 | F1013: 690618000 | G1013: 287247900 | H1013: -3664282500 | I1013: -513508600 | J1013: 183431700 | K1013: 407828750 | L1013: 424554050 | M1013: 314301085.60000002 | N1013: =POWER(D1013/M1013,1/9)-1 -> -0.19218789576533557 | O1013: =POWER(D1013/I1013,1/5)-1 -> -1.6173312661462886
A1014: 0483.HK | B1014: 包浩斯国际 | C1014: 0.32 | D1014: 45967000 | E1014: 142611000 | F1014: 99737000 | G1014: -172601000 | H1014: -62103000 | I1014: 40603000 | J1014: 64877000 | K1014: 52949000 | L1014: 129367000 | M1014: 125119000 | N1014: =POWER(D1014/M1014,1/9)-1 -> -0.10529405766558619 | O1014: =POWER(D1014/I1014,1/5)-1 -> 2.5126847350893433e-02
A1015: 1872.HK | B1015: 冠轈控股 | C1015: 0.76 | D1015: 45895926 | E1015: 29262288 | F1015: 57654171 | G1015: 19058000 | H1015: 17383698 | I1015: 42663060 | J1015: 46738893.710000001 | K1015: 24862083.68 | L1015: 25142629.870000001 | M1015: -- | N1015: =POWER(D1015/M1015,1/9)-1 -> #VALUE! | O1015: =POWER(D1015/I1015,1/5)-1 -> 1.4715809760881493e-02
A1016: 0345.HK | B1016: 维他奶国际 | C1016: 5.53 | D1016: 45721000 | E1016: -158750000 | F1016: 548346000 | G1016: 535878000 | H1016: 695907000 | I1016: 585774000 | J1016: 618372000 | K1016: 530616000 | L1016: 372079000 | M1016: 306693000 | N1016: =POWER(D1016/M1016,1/9)-1 -> -0.19061179174226239 | O1016: =POWER(D1016/I1016,1/5)-1 -> -0.39954961743268613
A1017: 1181.HK | B1017: 唐宫中国 | C1017: 0.35 | D1017: 45702770.399999999 | E1017: -170268645.40000001 | F1017: 49677965 | G1017: 5219330.0999999996 | H1017: 102008752.5 | I1017: 131135977.8 | J1017: 157450338.09999999 | K1017: 112227360 | L1017: 57143093.450000003 | M1017: 66388280 | N1017: =POWER(D1017/M1017,1/9)-1 -> -4.0635913736024931e-02 | O1017: =POWER(D1017/I1017,1/5)-1 -> -0.19007625130781558
A1018: 2455.HK | B1018: 润华服务 | C1018: 0.64 | D1018: 45447355.799999997 | E1018: 45312392.700000003 | F1018: 54245350 | G1018: 58014540.600000001 | H1018: -- | I1018: -- | J1018: -- | K1018: -- | L1018: -- | M1018: -- | N1018: =POWER(D1018/M1018,1/9)-1 -> #VALUE! | O1018: =POWER(D1018/I1018,1/5)-1 -> #VALUE!
A1019: 1137.HK | B1019: 香港科技探索 | C1019: 1.94 | D1019: 45321000 | E1019: 212204000 | F1019: 14780000 | G1019: 183581000 | H1019: -289913000 | I1019: -133095000 | J1019: -204920000 | K1019: -257116000 | L1019: -812559000 | M1019: -- | N1019: =POWER(D1019/M1019,1/9)-1 -> #VALUE! | O1019: =POWER(D1019/I1019,1/5)-1 -> -1.8061717002597268
A1020: 2457.HK | B1020: 步阳国际 | C1020: 0.24 | D1020: 45288406.799999997 | E1020: 60899350.399999999 | F1020: 46118343.5 | G1020: 41366081.399999999 | H1020: -- | I1020: -- | J1020: -- | K1020: -- | L1020: -- | M1020: -- | N1020: =POWER(D1020/M1020,1/9)-1 -> #VALUE! | O1020: =POWER(D1020/I1020,1/5)-1 -> #VALUE!
A1021: 9960.HK | B1021: 康圣环球 | C1021: 1.35 | D1021: 45257713.200000003 | E1021: 85123041.700000003 | F1021: -1780949535 | G1021: -1160934438 | H1021: -- | I1021: -- | J1021: -- | K1021: -- | L1021: -- | M1021: -- | N1021: =POWER(D1021/M1021,1/9)-1 -> #VALUE! | O1021: =POWER(D1021/I1021,1/5)-1 -> #VALUE!
A1022: 0256.HK | B1022: 冠城钟表珠宝 | C1022: 0.96 | D1022: 45100000 | E1022: -111051000 | F1022: -100907000 | G1022: -169233000 | H1022: 44246000 | I1022: 201372000 | J1022: 1170484000 | K1022: 36703000 | L1022: 307675000 | M1022: 132005000 | N1022: =POWER(D1022/M1022,1/9)-1 -> -0.1124839001557969 | O1022: =POWER(D1022/I1022,1/5)-1 -> -0.2586291744013326
A1023: 1148.HK | B1023: 新晨动力 | C1023: 0.17 | D1023: 45022030.200000003 | E1023: -130666694.90000001 | F1023: -480950538.5 | G1023: -963816824.10000002 | H1023: 7652640 | I1023: 12210346.4 | J1023: 153570697.69999999 | K1023: 206576930 | L1023: 264217273.25 | M1023: 338862253.39999998 | N1023: =POWER(D1023/M1023,1/9)-1 -> -0.20090169597797458 | O1023: =POWER(D1023/I1023,1/5)-1 -> 0.29819346331467766
A1024: 2515.HK | B1024: 天津建发 | C1024: 1.33 | D1024: 44993529 | E1024: -- | F1024: -- | G1024: -- | H1024: -- | I1024: -- | J1024: -- | K1024: -- | L1024: -- | M1024: -- | N1024: =POWER(D1024/M1024,1/9)-1 -> #VALUE! | O1024: =POWER(D1024/I1024,1/5)-1 -> #VALUE!
A1025: 6919.HK | B1025: 人瑞人才 | C1025: 5.4000000000000004 | D1025: 44993529 | E1025: -8238514.2999999998 | F1025: 124491241.5 | G1025: 217660010.40000001 | H1025: -871461142.5 | I1025: -155914191 | J1025: -52757594.5 | K1025: -39360475 | L1025: -- | M1025: -- | N1025: =POWER(D1025/M1025,1/9)-1 -> #VALUE! | O1025: =POWER(D1025/I1025,1/5)-1 -> -1.7799250733205598
A1026: 0052.HK | B1026: 大快活集团 | C1026: 7.52 | D1026: 44880000 | E1026: 42640000 | F1026: 153617000 | G1026: 60867000 | H1026: 179947000 | I1026: 216077000 | J1026: 205281000 | K1026: 200778000 | L1026: 143967000 | M1026: 107611000 | N1026: =POWER(D1026/M1026,1/9)-1 -> -9.2598326954590138e-02 | O1026: =POWER(D1026/I1026,1/5)-1 -> -0.26972091733957104
A1027: 0133.HK | B1027: 招商局中国基金 | C1027: 12.82 | D1027: 44728215.219999999 | E1027: -1195954631.55 | F1027: 188753451.87 | G1027: 696124464.51999998 | H1027: 792786480.53999996 | I1027: -681723493.25 | J1027: 921292744.88 | K1027: -120944286.66 | L1027: 358372362.31 | M1027: 1152761637.72 | N1027: =POWER(D1027/M1027,1/9)-1 -> -0.30304510506527882 | O1027: =POWER(D1027/I1027,1/5)-1 -> -1.5799554869584163
A1028: 2536.HK | B1028: 百乐皇宫 | C1028: 6.23 | D1028: 44154000 | E1028: -- | F1028: -- | G1028: -- | H1028: -- | I1028: -- | J1028: -- | K1028: -- | L1028: -- | M1028: -- | N1028: =POWER(D1028/M1028,1/9)-1 -> #VALUE! | O1028: =POWER(D1028/I1028,1/5)-1 -> #VALUE!
A1029: 9916.HK | B1029: 兴业物联 | C1029: 0.56 | D1029: 44037642.600000001 | E1029: 53218117.5 | F1029: 66769536 | G1029: 51851225.700000003 | H1029: 39305827.5 | I1029: 38962892 | J1029: 23113593.100000001 | K1029: 12763817.5 | L1029: -- | M1029: -- | N1029: =POWER(D1029/M1029,1/9)-1 -> #VALUE! | O1029: =POWER(D1029/I1029,1/5)-1 -> 2.4789284298482483e-02
A1030: 2442.HK | B1030: 怡俊集团控股 | C1030: 1.3 | D1030: 43844000 | E1030: 28766000 | F1030: 40513000 | G1030: 27541000 | H1030: -- | I1030: -- | J1030: -- | K1030: -- | L1030: -- | M1030: -- | N1030: =POWER(D1030/M1030,1/9)-1 -> #VALUE! | O1030: =POWER(D1030/I1030,1/5)-1 -> #VALUE!
A1031: 1598.HK | B1031: 21世纪教育 | C1031: 0.13 | D1031: 43750438.200000003 | E1031: 30797130 | F1031: 35730910 | G1031: 91995609.599999994 | H1031: 92288737.5 | I1031: 79041612 | J1031: 53996058.200000003 | K1031: 43999943.75 | L1031: 31555773.600000001 | M1031: 31988668.600000001 | N1031: =POWER(D1031/M1031,1/9)-1 -> 3.5403389852594946e-02 | O1031: =POWER(D1031/I1031,1/5)-1 -> -0.11156568655856258
A1032: 2350.HK | B1032: 数科集团 | C1032: 0.46 | D1032: 43737000 | E1032: 47258000 | F1032: 24776000 | G1032: 26109000 | H1032: -- | I1032: -- | J1032: -- | K1032: -- | L1032: -- | M1032: -- | N1032: =POWER(D1032/M1032,1/9)-1 -> #VALUE! | O1032: =POWER(D1032/I1032,1/5)-1 -> #VALUE!
A1033: 0104.HK | B1033: 冠亚商业 | C1033: 0.21 | D1033: 43652000 | E1033: 83821000 | F1033: 58542000 | G1033: -146174000 | H1033: 70462000 | I1033: 62938000 | J1033: 31104000 | K1033: -35678000 | L1033: -30936000 | M1033: -153278000 | N1033: =POWER(D1033/M1033,1/9)-1 -> -1.8697443001295331 | O1033: =POWER(D1033/I1033,1/5)-1 -> -7.0566671662945835e-02
A1034: 0393.HK | B1034: 旭日企业 | C1034: 1.01 | D1034: 43610000 | E1034: 39229000 | F1034: 36996000 | G1034: 90018000 | H1034: 110383000 | I1034: 107430000 | J1034: 88669000 | K1034: 88320000 | L1034: 88152000 | M1034: 119405000 | N1034: =POWER(D1034/M1034,1/9)-1 -> -0.10587970520038581 | O1034: =POWER(D1034/I1034,1/5)-1 -> -0.16498918169786991
A1035: 1499.HK | B1035: 欧科云链 | C1035: 0.15 | D1035: 43491000 | E1035: -58061000 | F1035: -93855000 | G1035: -61602000 | H1035: -27235000 | I1035: 25368000 | J1035: 8359000 | K1035: 29225000 | L1035: 38499000 | M1035: 19348000 | N1035: =POWER(D1035/M1035,1/9)-1 -> 9.4170024357577375e-02 | O1035: =POWER(D1035/I1035,1/5)-1 -> 0.11383954551023567
A1036: 1817.HK | B1036: 慕尚集团控股 | C1036: 0.95 | D1036: 43373345.399999999 | E1036: 14021154.9 | F1036: -109818058 | G1036: -359176681.19999999 | H1036: 234168772.5 | I1036: 432773889.80000001 | J1036: 457265255.60000002 | K1036: 305484847.5 | L1036: -- | M1036: -- | N1036: =POWER(D1036/M1036,1/9)-1 -> #VALUE! | O1036: =POWER(D1036/I1036,1/5)-1 -> -0.36876310638770282
A1037: 2337.HK | B1037: 众诚能源 | C1037: 3.34 | D1037: 43287841.799999997 | E1037: 18647493 | F1037: 216271190 | G1037: 146941007.69999999 | H1037: 39829935 | I1037: 48926780.600000001 | J1037: 37002849.600000001 | K1037: 37989192.5 | L1037: 30800749.5 | M1037: 10569713 | N1037: =POWER(D1037/M1037,1/9)-1 -> 0.16958997636630224 | O1037: =POWER(D1037/I1037,1/5)-1 -> -2.4193158321755948e-02
A1038: 2108.HK | B1038: K2 F&B | C1038: 0.17 | D1038: 43267890 | E1038: 33048213 | F1038: 26373348 | G1038: 12842160 | H1038: 29828714 | I1038: 22962258 | J1038: 32211795 | K1038: 33327937.5 | L1038: 21787455 | M1038: -- | N1038: =POWER(D1038/M1038,1/9)-1 -> #VALUE! | O1038: =POWER(D1038/I1038,1/5)-1 -> 0.13508981002850207
A1039: 2376.HK | B1039: 鲁商服务 | C1039: 1.32 | D1039: 43224820.450000003 | E1039: 86572650.200000003 | F1039: 92829345 | G1039: 53995453.799999997 | H1039: -- | I1039: -- | J1039: -- | K1039: -- | L1039: -- | M1039: -- | N1039: =POWER(D1039/M1039,1/9)-1 -> #VALUE! | O1039: =POWER(D1039/I1039,1/5)-1 -> #VALUE!
A1040: 2270.HK | B1040: 德商产投服务 | C1040: 1.19 | D1040: 42976521 | E1040: 37899647.600000001 | F1040: 40947280 | G1040: 51165883.200000003 | H1040: -- | I1040: -- | J1040: -- | K1040: -- | L1040: -- | M1040: -- | N1040: =POWER(D1040/M1040,1/9)-1 -> #VALUE! | O1040: =POWER(D1040/I1040,1/5)-1 -> #VALUE!
A1041: 0258.HK | B1041: 汤臣集团 | C1041: 1.85 | D1041: 42684000 | E1041: 17168000 | F1041: 283448000 | G1041: 174993000 | H1041: 172513000 | I1041: 407681000 | J1041: 1255486000 | K1041: 876256000 | L1041: 534074000 | M1041: 95985000 | N1041: =POWER(D1041/M1041,1/9)-1 -> -8.6106161916404633e-02 | O1041: =POWER(D1041/I1041,1/5)-1 -> -0.36322071359932584
A1042: 6830.HK | B1042: 华众车载 | C1042: 2.24 | D1042: 42258510 | E1042: 122169845.7 | F1042: 62049088.5 | G1042: 128217450.59999999 | H1042: 93967222.5 | I1042: 157971641.19999999 | J1042: 165629233.90000001 | K1042: 116577903.75 | L1042: 81622574.200000003 | M1042: 108046925.7 | N1042: =POWER(D1042/M1042,1/9)-1 -> -9.9051023584411646e-02 | O1042: =POWER(D1042/I1042,1/5)-1 -> -0.23181289979041431
A1043: 2205.HK | B1043: 康桥悦生活 | C1043: 0.67 | D1043: 42186160.799999997 | E1043: 61053900.100000001 | F1043: 102717182.5 | G1043: 105343697.7 | H1043: -- | I1043: -- | J1043: -- | K1043: -- | L1043: -- | M1043: -- | N1043: =POWER(D1043/M1043,1/9)-1 -> #VALUE! | O1043: =POWER(D1043/I1043,1/5)-1 -> #VALUE!
A1044: 2193.HK | B1044: 万景控股 | C1044: 0.18 | D1044: 42135000 | E1044: 36922000 | F1044: 15744000 | G1044: 2949000 | H1044: -2634000 | I1044: 7007000 | J1044: 8529000 | K1044: 27202000 | L1044: 34985000 | M1044: 40710000 | N1044: =POWER(D1044/M1044,1/9)-1 -> 3.8300924300425088e-03 | O1044: =POWER(D1044/I1044,1/5)-1 -> 0.43160160347514376
A1045: 1543.HK | B1045: 中盈盛达融资担保 | C1045: 0.63 | D1045: 42094080 | E1045: 48036754.200000003 | F1045: 100393081.5 | G1045: 127029126.3 | H1045: 148804065 | I1045: 142429751.19999999 | J1045: 127166124.09999999 | K1045: 127052546.25 | L1045: 131839909.2 | M1045: 181267458.19999999 | N1045: =POWER(D1045/M1045,1/9)-1 -> -0.14975404350755106 | O1045: =POWER(D1045/I1045,1/5)-1 -> -0.21634652943969623
A1046: 9906.HK | B1046: 宏力医疗管理 | C1046: 2.1000000000000001 | D1046: 41995422 | E1046: 55217110.700000003 | F1046: 44835067.5 | G1046: 26031096 | H1046: 55162035 | I1046: 82806962.200000003 | J1046: 85123098.900000006 | K1046: 84361655 | L1046: -- | M1046: -- | N1046: =POWER(D1046/M1046,1/9)-1 -> #VALUE! | O1046: =POWER(D1046/I1046,1/5)-1 -> -0.12697431846642182
A1047: 1110.HK | B1047: 金活医药集团 | C1047: 0.54 | D1047: 41760835.200000003 | E1047: 25654122.100000001 | F1047: 37125615.5 | G1047: 13964300.4 | H1047: 48529672.5 | I1047: 46688293 | J1047: 61215834 | K1047: 52190967.5 | L1047: 38192223.75 | M1047: 47326607.5 | N1047: =POWER(D1047/M1047,1/9)-1 -> -1.3805344495110727e-02 | O1047: =POWER(D1047/I1047,1/5)-1 -> -2.2059941721840781e-02
A1048: 2450.HK | B1048: 淮北绿金股份 | C1048: 1.07 | D1048: 41096538 | E1048: 76045221 | F1048: 79232497 | G1048: 148019677.19999999 | H1048: -- | I1048: -- | J1048: -- | K1048: -- | L1048: -- | M1048: -- | N1048: =POWER(D1048/M1048,1/9)-1 -> #VALUE! | O1048: =POWER(D1048/I1048,1/5)-1 -> #VALUE!
A1049: 0932.HK | B1049: 顺腾国际控股 | C1049: 0.03 | D1049: 41036000 | E1049: -43888000 | F1049: -127377000 | G1049: -139690000 | H1049: -4344000 | I1049: -139217000 | J1049: 12746000 | K1049: 10421000 | L1049: 31521000 | M1049: -5733000 | N1049: =POWER(D1049/M1049,1/9)-1 -> -2.24444554613995 | O1049: =POWER(D1049/I1049,1/5)-1 -> -1.7832394432857761
A1050: 2327.HK | B1050: 美瑞健康国际 | C1050: 0.14 | D1050: 40830000 | E1050: 17822000 | F1050: 60323000 | G1050: 83439000 | H1050: -20174000 | I1050: 80537000 | J1050: 80066000 | K1050: 34380000 | L1050: 1981000 | M1050: 89219000 | N1050: =POWER(D1050/M1050,1/9)-1 -> -8.3188134377916501e-02 | O1050: =POWER(D1050/I1050,1/5)-1 -> -0.12703509129548873
A1051: 1123.HK | B1051: 中港照相 | C1051: 0.14 | D1051: 40810000 | E1051: 18110000 | F1051: 33635000 | G1051: -29093000 | H1051: -46691000 | I1051: 38206000 | J1051: -19436000 | K1051: -70480000 | L1051: -33289000 | M1051: 15469000 | N1051: =POWER(D1051/M1051,1/9)-1 -> 0.11381123688815498 | O1051: =POWER(D1051/I1051,1/5)-1 -> 1.3274246439495263e-02
A1052: 0374.HK | B1052: 四洲集团 | C1052: 2.52 | D1052: 40732000 | E1052: 12634000 | F1052: 30127000 | G1052: -19808000 | H1052: 30161000 | I1052: 347703000 | J1052: 50274000 | K1052: 45827000 | L1052: 140185000 | M1052: 160137000 | N1052: =POWER(D1052/M1052,1/9)-1 -> -0.14110865295991126 | O1052: =POWER(D1052/I1052,1/5)-1 -> -0.34875341426322459
A1053: 0595.HK | B1053: 先思行 | C1053: 0.45 | D1053: 40718000 | E1053: 231021000 | F1053: 269788000 | G1053: 93443000 | H1053: 57278000 | I1053: 163267000 | J1053: 276122000 | K1053: 2147000 | L1053: -94287000 | M1053: 3353000 | N1053: =POWER(D1053/M1053,1/9)-1 -> 0.319725638394176 | O1053: =POWER(D1053/I1053,1/5)-1 -> -0.24250877700802032
A1054: 0628.HK | B1054: 国美金融科技 | C1054: 0.21 | D1054: 40556111.399999999 | E1054: -6360227.7999999998 | F1054: -156715183.5 | G1054: 17063240.399999999 | H1054: -35724240 | I1054: 1638445.3999999999 | J1054: 26044903.600000001 | K1054: 2068036.25 | L1054: -41783000 | M1054: -98097000 | N1054: =POWER(D1054/M1054,1/9)-1 -> -1.9065209440105817 | O1054: =POWER(D1054/I1054,1/5)-1 -> 0.89987429468797409
A1055: 1063.HK | B1055: 新确科技 | C1055: 0.10000000000000001 | D1055: 40070000 | E1055: -56992000 | F1055: -58753000 | G1055: -70107000 | H1055: -42766000 | I1055: -24842000 | J1055: -217084000 | K1055: -52352000 | L1055: 50919000 | M1055: -32867000 | N1055: =POWER(D1055/M1055,1/9)-1 -> -2.0222618226630837 | O1055: =POWER(D1055/I1055,1/5)-1 -> -2.1003391286967199
A1056: 1416.HK | B1056: CTR Holdings | C1056: 0.05 | D1056: 39995312.5 | E1056: -1759041 | F1056: -19875956 | G1056: 41319075 | H1056: 37887509 | I1056: 32119896 | J1056: 21038196 | K1056: 16886512.5 | L1056: -- | M1056: -- | N1056: =POWER(D1056/M1056,1/9)-1 -> #VALUE! | O1056: =POWER(D1056/I1056,1/5)-1 -> 4.4833269225031724e-02
A1057: 0222.HK | B1057: 闽信集团 | C1057: 2.02 | D1057: 39409000 | E1057: 446365000 | F1057: 495931000 | G1057: 436062000 | H1057: 571486000 | I1057: 578090000 | J1057: 516890000 | K1057: 265612000 | L1057: 477339000 | M1057: 472687000 | N1057: =POWER(D1057/M1057,1/9)-1 -> -0.24122410002665995 | O1057: =POWER(D1057/I1057,1/5)-1 -> -0.41558683375810967
A1058: 0077.HK | B1058: 进智公共交通 | C1058: 0.62 | D1058: 39285000 | E1058: -18385000 | F1058: 21821000 | G1058: -36373000 | H1058: -43258000 | I1058: -29303000 | J1058: 30416000 | K1058: 29426000 | L1058: -22902000 | M1058: -18144000 | N1058: =POWER(D1058/M1058,1/9)-1 -> -2.0896250527785325 | O1058: =POWER(D1058/I1058,1/5)-1 -> -2.060383434476611
A1059: 8646.HK | B1059: 中国宏光 | C1059: 0.20000000000000001 | D1059: 39165033.600000001 | E1059: 38987136 | F1059: 47755500 | G1059: 12271802.4 | H1059: 29789197.5 | I1059: 36167629 | J1059: 27888811.800000001 | K1059: -- | L1059: -- | M1059: -- | N1059: =POWER(D1059/M1059,1/9)-1 -> #VALUE! | O1059: =POWER(D1059/I1059,1/5)-1 -> 1.6051433394618453e-02
A1060: 0521.HK | B1060: CWT Int'l | C1060: 0.10000000000000001 | D1060: 39093000 | E1060: 153213000 | F1060: 208905000 | G1060: 41465000 | H1060: -597557000 | I1060: -557289000 | J1060: 204478000 | K1060: -21902000 | L1060: -213810000 | M1060: -335016000 | N1060: =POWER(D1060/M1060,1/9)-1 -> -1.7876568423473476 | O1060: =POWER(D1060/I1060,1/5)-1 -> -1.5877649789152848
A1061: 0146.HK | B1061: 太平地毡 | C1061: 1.16 | D1061: 38424000 | E1061: 25275000 | F1061: 16634000 | G1061: -- | H1061: -- | I1061: -34136000 | J1061: 194251000 | K1061: -33372000 | L1061: 18958000 | M1061: 23832000 | N1061: =POWER(D1061/M1061,1/9)-1 -> 5.4506158359062917e-02 | O1061: =POWER(D1061/I1061,1/5)-1 -> -2.0239482043979198
A1062: 2479.HK | B1062: 天聚地合 | C1062: 66.599999999999994 | D1062: 38094046.200000003 | E1062: -- | F1062: -- | G1062: -- | H1062: -- | I1062: -- | J1062: -- | K1062: -- | L1062: -- | M1062: -- | N1062: =POWER(D1062/M1062,1/9)-1 -> #VALUE! | O1062: =POWER(D1062/I1062,1/5)-1 -> #VALUE!
A1063: 1795.HK | B1063: 亚东集团 | C1063: 1.41 | D1063: 37856170.799999997 | E1063: 56327161.100000001 | F1063: 43061991.5 | G1063: 42898864.799999997 | H1063: 58852020 | I1063: 55888181 | J1063: 36641980.700000003 | K1063: 3318192.5 | L1063: -- | M1063: -- | N1063: =POWER(D1063/M1063,1/9)-1 -> #VALUE! | O1063: =POWER(D1063/I1063,1/5)-1 -> -7.4953974501456466e-02
A1064: 6683.HK | B1064: 巨星传奇 | C1064: 10.74 | D1064: 37835343 | E1064: 68124830.900000006 | F1064: 53448200.5 | G1064: 93044481.599999994 | H1064: -- | I1064: -- | J1064: -- | K1064: -- | L1064: -- | M1064: -- | N1064: =POWER(D1064/M1064,1/9)-1 -> #VALUE! | O1064: =POWER(D1064/I1064,1/5)-1 -> #VALUE!
A1065: 1933.HK | B1065: 元力控股 | C1065: 0.17 | D1065: 37225881.5 | E1065: 27157398.25 | F1065: 24697533.75 | G1065: -75507247.200000003 | H1065: 23640468.800000001 | I1065: 20896647.300000001 | J1065: 20324715.600000001 | K1065: 26555047.199999999 | L1065: 16777592.100000001 | M1065: 22510727 | N1065: =POWER(D1065/M1065,1/9)-1 -> 5.74816255111954e-02 | O1065: =POWER(D1065/I1065,1/5)-1 -> 0.12241555202529075
A1066: 0381.HK | B1066: 侨雄国际 | C1066: 0.12 | D1066: 37213000 | E1066: -59521000 | F1066: -226754000 | G1066: -71776000 | H1066: -301937000 | I1066: -208066000 | J1066: -91289000 | K1066: -149652000 | L1066: -89665000 | M1066: -509606000 | N1066: =POWER(D1066/M1066,1/9)-1 -> -1.747683496221176 | O1066: =POWER(D1066/I1066,1/5)-1 -> -1.7087592060469396
A1067: 2663.HK | B1067: 应力控股 | C1067: 0.42 | D1067: 37147000 | E1067: 11505000 | F1067: 50171000 | G1067: 53753000 | H1067: 28302000 | I1067: 26220000 | J1067: 30964000 | K1067: 24956000 | L1067: 11921000 | M1067: 9727000 | N1067: =POWER(D1067/M1067,1/9)-1 -> 0.16054113010260962 | O1067: =POWER(D1067/I1067,1/5)-1 -> 7.2156571163315419e-02
A1068: 3389.HK | B1068: 亨得利 | C1068: 0.14 | D1068: 37144737 | E1068: -90272818.200000003 | F1068: 32182309 | G1068: -456588284.39999998 | H1068: -371591100 | I1068: 78274195.599999994 | J1068: -283398379.80000001 | K1068: -357131302.5 | L1068: 170372011.40000001 | M1068: 629216138 | N1068: =POWER(D1068/M1068,1/9)-1 -> -0.26977739908678311 | O1068: =POWER(D1068/I1068,1/5)-1 -> -0.13849910115901909
A1069: 2033.HK | B1069: 时计宝 | C1069: 0.46 | D1069: 37070000 | E1069: 33020000 | F1069: 259103000 | G1069: 91402000 | H1069: 305360000 | I1069: 291447000 | J1069: 235744000 | K1069: 296341000 | L1069: 336755000 | M1069: 309890000 | N1069: =POWER(D1069/M1069,1/9)-1 -> -0.21016749532893808 | O1069: =POWER(D1069/I1069,1/5)-1 -> -0.33794724162030232
A1070: 0040.HK | B1070: 金山科技工业 | C1070: 0.57 | D1070: 36930000 | E1070: 156903000 | F1070: 121862000 | G1070: 20902000 | H1070: 61437000 | I1070: 20355000 | J1070: 20108000 | K1070: 18705000 | L1070: 51517000 | M1070: -127914000 | N1070: =POWER(D1070/M1070,1/9)-1 -> -1.8710663712693183 | O1070: =POWER(D1070/I1070,1/5)-1 -> 0.12652709095169645
A1071: 1305.HK | B1071: 伟志控股 | C1071: 0.86 | D1071: 36417000 | E1071: 59912000 | F1071: 51469000 | G1071: 30958000 | H1071: 37148000 | I1071: 45107000 | J1071: 22330000 | K1071: 6399000 | L1071: -38767000 | M1071: 61193000 | N1071: =POWER(D1071/M1071,1/9)-1 -> -5.6035146540199365e-02 | O1071: =POWER(D1071/I1071,1/5)-1 -> -4.1897343165355982e-02
A1072: 6696.HK | B1072: 多想云 | C1072: 0.15 | D1072: 36248045.399999999 | E1072: 76399444.400000006 | F1072: 68750777 | G1072: 31488806.100000001 | H1072: -- | I1072: -- | J1072: -- | K1072: -- | L1072: -- | M1072: -- | N1072: =POWER(D1072/M1072,1/9)-1 -> #VALUE! | O1072: =POWER(D1072/I1072,1/5)-1 -> #VALUE!
A1073: 1593.HK | B1073: 辰林教育 | C1073: 1.49 | D1073: 36196791.350000001 | E1073: -43181348 | F1073: -- | G1073: 92323382.099999994 | H1073: 93389475 | I1073: 94770232.400000006 | J1073: 83890629.700000003 | K1073: 45722381.25 | L1073: 29716431.399999999 | M1073: -- | N1073: =POWER(D1073/M1073,1/9)-1 -> #VALUE! | O1073: =POWER(D1073/I1073,1/5)-1 -> -0.1751031869111408
A1074: 2682.HK | B1074: 润利海事 | C1074: 0.15 | D1074: 36011000 | E1074: 40803000 | F1074: 25020000 | G1074: 9700000 | H1074: 11753000 | I1074: 32398000 | J1074: 22162000 | K1074: 10644000 | L1074: -- | M1074: -- | N1074: =POWER(D1074/M1074,1/9)-1 -> #VALUE! | O1074: =POWER(D1074/I1074,1/5)-1 -> 2.1370702313780354e-02
A1075: 1401.HK | B1075: Sprocomm Intel | C1075: 2.93 | D1075: 35482897.799999997 | E1075: 7339418.5999999996 | F1075: -21739773 | G1075: 36804680.100000001 | H1075: 43580265 | I1075: 51684469.799999997 | J1075: 39172858.600000001 | K1075: 47482601.25 | L1075: -- | M1075: -- | N1075: =POWER(D1075/M1075,1/9)-1 -> #VALUE! | O1075: =POWER(D1075/I1075,1/5)-1 -> -7.2461803813913206e-02
A1076: 1957.HK | B1076: 大人国际 | C1076: 0.44 | D1076: 35045695.049999997 | E1076: 26778636.800000001 | F1076: 17428895.100000001 | G1076: 744922.09999999998 | H1076: 35998169.049999997 | I1076: 38659292.700000003 | J1076: 40204593 | K1076: 34321353 | L1076: -- | M1076: -- | N1076: =POWER(D1076/M1076,1/9)-1 -> #VALUE! | O1076: =POWER(D1076/I1076,1/5)-1 -> -1.9435525820719834e-02
A1077: 3903.HK | B1077: 瀚华金控 | C1077: 0.31 | D1077: 34927124.399999999 | E1077: 13851939.9 | F1077: 93946089 | G1077: 180091322.40000001 | H1077: 270224910 | I1077: 329534750.60000002 | J1077: 315096096.89999998 | K1077: 268600237.5 | L1077: 356296108 | M1077: 539095295.79999995 | N1077: =POWER(D1077/M1077,1/9)-1 -> -0.26219066933182633 | O1077: =POWER(D1077/I1077,1/5)-1 -> -0.36165961330823582
A1078: 2503.HK | B1078: 中深建业 | C1078: 0.97 | D1078: 34874506.799999997 | E1078: -- | F1078: -- | G1078: -- | H1078: -- | I1078: -- | J1078: -- | K1078: -- | L1078: -- | M1078: -- | N1078: =POWER(D1078/M1078,1/9)-1 -> #VALUE! | O1078: =POWER(D1078/I1078,1/5)-1 -> #VALUE!
A1079: 1565.HK | B1079: 成实外教育 | C1079: 0.23 | D1079: 34681111.850000001 | E1079: 12936784 | F1079: -- | G1079: 268738884.89999998 | H1079: 443803950 | I1079: 405764020.60000002 | J1079: 367311788.60000002 | K1079: 335937542.5 | L1079: 128985635.84999999 | M1079: 98733848 | N1079: =POWER(D1079/M1079,1/9)-1 -> -0.10974564792945185 | O1079: =POWER(D1079/I1079,1/5)-1 -> -0.38854585217515025
A1080: 1749.HK | B1080: 杉杉品牌 | C1080: 0.81 | D1080: 34645815.359999999 | E1080: 18056737.489999998 | F1080: 15149348.689999999 | G1080: -81418438.700000003 | H1080: -18228851.09 | I1080: 41229201.289999999 | J1080: 53914878.280000001 | K1080: 39165420.619999997 | L1080: 62130482.759999998 | M1080: 68198368.930000007 | N1080: =POWER(D1080/M1080,1/9)-1 -> -7.2487771199225559e-02 | O1080: =POWER(D1080/I1080,1/5)-1 -> -3.4195614726257206e-02
A1081: 0580.HK | B1081: 赛晶科技 | C1081: 1.07 | D1081: 34581821.399999999 | E1081: 27058606.600000001 | F1081: 18929545.5 | G1081: 211246396.5 | H1081: 218631052.5 | I1081: 208706518.59999999 | J1081: 233650024.30000001 | K1081: 159859980 | L1081: 73234985.599999994 | M1081: -40105010.200000003 | N1081: =POWER(D1081/M1081,1/9)-1 -> -1.9836711058711565 | O1081: =POWER(D1081/I1081,1/5)-1 -> -0.30198883412633459
A1082: 3326.HK | B1082: 保发集团 | C1082: 0.19 | D1082: 34364000 | E1082: 29400000 | F1082: 38758000 | G1082: 76527000 | H1082: 171017000 | I1082: 55270000 | J1082: 48843000 | K1082: 34699000 | L1082: 56460000 | M1082: 90439000 | N1082: =POWER(D1082/M1082,1/9)-1 -> -0.10194005045237031 | O1082: =POWER(D1082/I1082,1/5)-1 -> -9.0667215473699936e-02
A1083: 0829.HK | B1083: 神冠控股 | C1083: 0.28 | D1083: 34247480.399999999 | E1083: 26583676.5 | F1083: 150187374 | G1083: 108169692.59999999 | H1083: 84308670 | I1083: 91382897.400000006 | J1083: 82477126.599999994 | K1083: 171313633.75 | L1083: 342689209.5 | M1083: 683195300.39999998 | N1083: =POWER(D1083/M1083,1/9)-1 -> -0.28292453744852875 | O1083: =POWER(D1083/I1083,1/5)-1 -> -0.17822534935913348
A1084: 2499.HK | B1084: 佛朗斯股份 | C1084: 14.28 | D1084: 34223364 | E1084: -- | F1084: -- | G1084: -- | H1084: -- | I1084: -- | J1084: -- | K1084: -- | L1084: -- | M1084: -- | N1084: =POWER(D1084/M1084,1/9)-1 -> #VALUE! | O1084: =POWER(D1084/I1084,1/5)-1 -> #VALUE!
A1085: 2258.HK | B1085: 华滋国际海洋 | C1085: 0.19 | D1085: 33708150 | E1085: 30569253.800000001 | F1085: 57627419 | G1085: 55823828.399999999 | H1085: 113049652.5 | I1085: 149497041.40000001 | J1085: 104632798.59999999 | K1085: 83302633.75 | L1085: 74974363.549999997 | M1085: -- | N1085: =POWER(D1085/M1085,1/9)-1 -> #VALUE! | O1085: =POWER(D1085/I1085,1/5)-1 -> -0.25762991325242812
A1086: 2017.HK | B1086: 沧海控股 | C1086: 0.28 | D1086: 33702669 | E1086: 37422461.299999997 | F1086: 38461545 | G1086: 27449457 | H1086: 46110285 | I1086: 19408575.600000001 | J1086: 96305239.200000003 | K1086: 120019445 | L1086: 111935262.95 | M1086: 64814678.100000001 | N1086: =POWER(D1086/M1086,1/9)-1 -> -7.0084607866064075e-02 | O1086: =POWER(D1086/I1086,1/5)-1 -> 0.11669385505183127
A1087: 8195.HK | B1087: 传承教育集团 | C1087: 2 | D1087: 33389000 | E1087: 27180000 | F1087: 40566000 | G1087: -31600000 | H1087: -9427000 | I1087: -269171000 | J1087: -294298000 | K1087: -29302000 | L1087: -18391000 | M1087: 7053000 | N1087: =POWER(D1087/M1087,1/9)-1 -> 0.18857202209056334 | O1087: =POWER(D1087/I1087,1/5)-1 -> -1.6587415067492415
A1088: 1753.HK | B1088: 兑吧 | C1088: 0.28 | D1088: 33379290 | E1088: -51776405.700000003 | F1088: -14416038.5 | G1088: -75764315.400000006 | H1088: -223280970 | I1088: -331995265.19999999 | J1088: 117621681.2 | K1088: -97166588.75 | L1088: -11377107.699999999 | M1088: -- | N1088: =POWER(D1088/M1088,1/9)-1 -> #VALUE! | O1088: =POWER(D1088/I1088,1/5)-1 -> -1.6316391507397783
A1089: 0046.HK | B1089: 科联系统 | C1089: 2.1000000000000001 | D1089: 33350000 | E1089: 47011000 | F1089: 53844000 | G1089: 60125000 | H1089: 55893000 | I1089: 68028000 | J1089: 54329000 | K1089: 50344000 | L1089: 44103000 | M1089: 48791000 | N1089: =POWER(D1089/M1089,1/9)-1 -> -4.1395267374780942e-02 | O1089: =POWER(D1089/I1089,1/5)-1 -> -0.13287516065833427
A1090: 1540.HK | B1090: 澳狮环球 | C1090: 0.5 | D1090: 33333000 | E1090: 11224000 | F1090: 18351000 | G1090: 28058000 | H1090: 6001000 | I1090: 41204143.5 | J1090: 34680550 | K1090: 83324483 | L1090: 68179996.5 | M1090: -- | N1090: =POWER(D1090/M1090,1/9)-1 -> #VALUE! | O1090: =POWER(D1090/I1090,1/5)-1 -> -4.1511950874396408e-02
A1091: 3913.HK | B1091: 合景悠活 | C1091: 0.38 | D1091: 33218148.600000001 | E1091: 3849077.2000000002 | F1091: 826345253.5 | G1091: 385082627.69999999 | H1091: 206611222.5 | I1091: 90725925.200000003 | J1091: 52929037.200000003 | K1091: -- | L1091: -- | M1091: -- | N1091: =POWER(D1091/M1091,1/9)-1 -> #VALUE! | O1091: =POWER(D1091/I1091,1/5)-1 -> -0.18204614499959426
A1092: 1985.HK | B1092: 美高域 | C1092: 1.28 | D1092: 33179000 | E1092: 31970000 | F1092: 47332000 | G1092: 40619000 | H1092: 28883000 | I1092: 30082000 | J1092: 19960000 | K1092: 24861000 | L1092: 27534000 | M1092: 29301000 | N1092: =POWER(D1092/M1092,1/9)-1 -> 1.3906418204389759e-02 | O1092: =POWER(D1092/I1092,1/5)-1 -> 1.9791334029896746e-02
A1093: 0216.HK | B1093: 建业实业 | C1093: 0.71 | D1093: 32975000 | E1093: 55704000 | F1093: 77876000 | G1093: -45423000 | H1093: 781394000 | I1093: 2040243000 | J1093: 419415000 | K1093: 309615000 | L1093: 1283791000 | M1093: 256490000 | N1093: =POWER(D1093/M1093,1/9)-1 -> -0.20381735371082965 | O1093: =POWER(D1093/I1093,1/5)-1 -> -0.5617715370815658
A1094: 6667.HK | B1094: 美因基因 | C1094: 9.34 | D1094: 32927655.600000001 | E1094: -19874865.800000001 | F1094: 96753867.5 | G1094: 94275714.299999997 | H1094: -- | I1094: -- | J1094: -- | K1094: -- | L1094: -- | M1094: -- | N1094: =POWER(D1094/M1094,1/9)-1 -> #VALUE! | O1094: =POWER(D1094/I1094,1/5)-1 -> #VALUE!
A1095: 0048.HK | B1095: 中国汽车内饰 | C1095: 0.19 | D1095: 32919982.199999999 | E1095: -88621279.799999997 | F1095: -502045 | G1095: -4636491 | H1095: -33721680 | I1095: -73923605 | J1095: -283923498 | K1095: -148440775 | L1095: 155211550.84999999 | M1095: 32295652 | N1095: =POWER(D1095/M1095,1/9)-1 -> 2.1297343292543403e-03 | O1095: =POWER(D1095/I1095,1/5)-1 -> -1.8506194144577275
A1096: 1953.HK | B1096: Rimbaco | C1096: 0.15 | D1096: 32858496.449999999 | E1096: 386756.70000000001 | F1096: 23970298 | G1096: 11567947.199999999 | H1096: 22925200.5 | I1096: 32649843.5 | J1096: 55564914.600000001 | K1096: 19799896.600000001 | L1096: -- | M1096: -- | N1096: =POWER(D1096/M1096,1/9)-1 -> #VALUE! | O1096: =POWER(D1096/I1096,1/5)-1 -> 1.2748705323368803e-03
A1097: 2132.HK | B1097: 誉燊丰控股 | C1097: 0.19 | D1097: 32791000 | E1097: 41230000 | F1097: 47873000 | G1097: 40449000 | H1097: 23527000 | I1097: 31057000 | J1097: 23402000 | K1097: 12799000 | L1097: -- | M1097: -- | N1097: =POWER(D1097/M1097,1/9)-1 -> #VALUE! | O1097: =POWER(D1097/I1097,1/5)-1 -> 1.0925221420412967e-02
A1098: 8348.HK | B1098: 滨海泰达物流 | C1098: 0.32 | D1098: 32642643.600000001 | E1098: 33335355 | F1098: 41243609 | G1098: -154215173.40000001 | H1098: 10564845 | I1098: 2925063.3999999999 | J1098: 49792714.799999997 | K1098: 48209358.75 | L1098: 63135068.200000003 | M1098: 63909950.600000001 | N1098: =POWER(D1098/M1098,1/9)-1 -> -7.1932319056417615e-02 | O1098: =POWER(D1098/I1098,1/5)-1 -> 0.62005592906108387
A1099: 1767.HK | B1099: TS Wonders | C1099: 0.24 | D1099: 32289044.690000001 | E1099: 33871016.82 | F1099: 19763354.449999999 | G1099: 40055922.619999997 | H1099: 16819109.489999998 | I1099: 12270619.550000001 | J1099: 34917562.399999999 | K1099: 30627366.41 | L1099: 17918926.25 | M1099: -- | N1099: =POWER(D1099/M1099,1/9)-1 -> #VALUE! | O1099: =POWER(D1099/I1099,1/5)-1 -> 0.21349430082732579
A1100: 1289.HK | B1100: 盛力达科技 | C1100: 0.86 | D1100: 32169085.199999999 | E1100: 25499572.399999999 | F1100: 5768619.5 | G1100: 2883206.1000000001 | H1100: 9028282.5 | I1100: 54714284.399999999 | J1100: 40109199.5 | K1100: 31790640 | L1100: -104437944.2 | M1100: 139268135.80000001 | N1100: =POWER(D1100/M1100,1/9)-1 -> -0.1502573070063068 | O1100: =POWER(D1100/I1100,1/5)-1 -> -0.10077660475529515
A1101: 0730.HK | B1101: 首惠产业金融 | C1101: 0.11 | D1101: 32082000 | E1101: 14526000 | F1101: 27294000 | G1101: 5980000 | H1101: -7921000 | I1101: -58882000 | J1101: -11332000 | K1101: -82375000 | L1101: -55244000 | M1101: 10165000 | N1101: =POWER(D1101/M1101,1/9)-1 -> 0.13621772837375334 | O1101: =POWER(D1101/I1101,1/5)-1 -> -1.8856370493015628
A1102: 1986.HK | B1102: 彩客新能源 | C1102: 1.02 | D1102: 31856668.199999999 | E1102: 273039683.5 | F1102: 277029655.5 | G1102: 172676512.5 | H1102: 578783422.5 | I1102: 253795078.59999999 | J1102: 163207455.90000001 | K1102: 134373461.25 | L1102: 114629593.5 | M1102: 180769546.09999999 | N1102: =POWER(D1102/M1102,1/9)-1 -> -0.17542423765507098 | O1102: =POWER(D1102/I1102,1/5)-1 -> -0.3396967556189463
A1103: 1685.HK | B1103: 博耳电力 | C1103: 0.16 | D1103: 31676891.399999999 | E1103: 34103591.100000001 | F1103: 14867879 | G1103: 18860625.600000001 | H1103: 3888900 | I1103: -1091267259.4000001 | J1103: -264925728.59999999 | K1103: -782761166.25 | L1103: 611409578.20000005 | M1103: 572682524.29999995 | N1103: =POWER(D1103/M1103,1/9)-1 -> -0.27503958795297734 | O1103: =POWER(D1103/I1103,1/5)-1 -> -1.4926769974667715
A1104: 0332.HK | B1104: 元亨燃气 | C1104: 0.03 | D1104: 31299685.75 | E1104: 79410200.75 | F1104: 2798382.75 | G1104: -58600863.649999999 | H1104: 33098290.399999999 | I1104: 177525279 | J1104: -95494779.900000006 | K1104: 11590880.4 | L1104: 24065675.100000001 | M1104: 129359000 | N1104: =POWER(D1104/M1104,1/9)-1 -> -0.14586398118342681 | O1104: =POWER(D1104/I1104,1/5)-1 -> -0.29326604955543067
A1105: 1442.HK | B1105: 鹰辉物流 | C1105: 0.31 | D1105: 31252745.850000001 | E1105: 63858113.100000001 | F1105: 79456026.599999994 | G1105: 48456603.649999999 | H1105: 37057778 | I1105: 42654155.700000003 | J1105: 17245156.5 | K1105: 20426866.199999999 | L1105: -- | M1105: -- | N1105: =POWER(D1105/M1105,1/9)-1 -> #VALUE! | O1105: =POWER(D1105/I1105,1/5)-1 -> -6.0308353704784268e-02
A1106: 8481.HK | B1106: 盛龙锦秀国际 | C1106: 0.5 | D1106: 31080558.600000001 | E1106: 13602629.800000001 | F1106: 16648302 | G1106: 11051296.800000001 | H1106: 21501817.5 | I1106: 15636393.800000001 | J1106: 8397095.5999999996 | K1106: 23037323.75 | L1106: 6340085.5499999998 | M1106: 15359153.199999999 | N1106: =POWER(D1106/M1106,1/9)-1 -> 8.1467580074514601e-02 | O1106: =POWER(D1106/I1106,1/5)-1 -> 0.14728269566001506
A1107: 1895.HK | B1107: 鑫苑服务 | C1107: 0.35 | D1107: 30831721.199999999 | E1107: -- | F1107: 145837950 | G1107: 152647824.90000001 | H1107: 90873982.5 | I1107: 86647460 | J1107: 83239627 | K1107: 28840271.25 | L1107: -- | M1107: -- | N1107: =POWER(D1107/M1107,1/9)-1 -> #VALUE! | O1107: =POWER(D1107/I1107,1/5)-1 -> -0.18670446732711088
A1108: 1429.HK | B1108: 天任集团 | C1108: 0.04 | D1108: 30579000 | E1108: 28787000 | F1108: 60608000 | G1108: 38006000 | H1108: 64476000 | I1108: 41754000 | J1108: 38981000 | K1108: -- | L1108: -- | M1108: -- | N1108: =POWER(D1108/M1108,1/9)-1 -> #VALUE! | O1108: =POWER(D1108/I1108,1/5)-1 -> -6.039560740661587e-02
A1109: 2521.HK | B1109: 升辉清洁 | C1109: 0.35 | D1109: 30571921.800000001 | E1109: -- | F1109: -- | G1109: -- | H1109: -- | I1109: -- | J1109: -- | K1109: -- | L1109: -- | M1109: -- | N1109: =POWER(D1109/M1109,1/9)-1 -> #VALUE! | O1109: =POWER(D1109/I1109,1/5)-1 -> #VALUE!
A1110: 1955.HK | B1110: 庄臣控股 | C1110: 0.36 | D1110: 30550000 | E1110: 129636000 | F1110: 188535000 | G1110: 28457000 | H1110: 21807000 | I1110: 35931000 | J1110: 44338000 | K1110: 26443000 | L1110: -- | M1110: -- | N1110: =POWER(D1110/M1110,1/9)-1 -> #VALUE! | O1110: =POWER(D1110/I1110,1/5)-1 -> -3.1926388252523363e-02
A1111: 0674.HK | B1111: 中国唐商 | C1111: 0.08 | D1111: 30366064 | E1111: 8021068 | F1111: -13347485 | G1111: -37308877 | H1111: -18871185 | I1111: -11058371 | J1111: -89855350 | K1111: -131334493 | L1111: -445229478 | M1111: -52291302 | N1111: =POWER(D1111/M1111,1/9)-1 -> -1.9413979050448238 | O1111: =POWER(D1111/I1111,1/5)-1 -> -2.2238817797707666
A1112: 8659.HK | B1112: 易和国际控股 | C1112: 0.75 | D1112: 30231003.600000001 | E1112: 38145573.399999999 | F1112: 43140359.5 | G1112: 24743844 | H1112: 22909867.5 | I1112: 25520580.399999999 | J1112: 27171869.600000001 | K1112: -- | L1112: -- | M1112: -- | N1112: =POWER(D1112/M1112,1/9)-1 -> #VALUE! | O1112: =POWER(D1112/I1112,1/5)-1 -> 3.4456906703649759e-02
A1113: 2427.HK | B1113: Guanze Medical | C1113: 0.76 | D1113: 30218945.399999999 | E1113: 20242626.399999999 | F1113: 28083907.5 | G1113: 34616351.700000003 | H1113: -- | I1113: -- | J1113: -- | K1113: -- | L1113: -- | M1113: -- | N1113: =POWER(D1113/M1113,1/9)-1 -> #VALUE! | O1113: =POWER(D1113/I1113,1/5)-1 -> #VALUE!
A1114: 2516.HK | B1114: 泛远国际 | C1114: 0.59999999999999998 | D1114: 29979973.800000001 | E1114: -- | F1114: -- | G1114: -- | H1114: -- | I1114: -- | J1114: -- | K1114: -- | L1114: -- | M1114: -- | N1114: =POWER(D1114/M1114,1/9)-1 -> #VALUE! | O1114: =POWER(D1114/I1114,1/5)-1 -> #VALUE!
A1115: 1379.HK | B1115: 温岭工量刃具 | C1115: 2.47 | D1115: 29827602 | E1115: 64875902.899999999 | F1115: 57939666.5 | G1115: 33469743.899999999 | H1115: 36259522.5 | I1115: 42083794.600000001 | J1115: 53821018.799999997 | K1115: 51874261.25 | L1115: 100190051.59999999 | M1115: -- | N1115: =POWER(D1115/M1115,1/9)-1 -> #VALUE! | O1115: =POWER(D1115/I1115,1/5)-1 -> -6.6529302813145508e-02
A1116: 1868.HK | B1116: 同方友友 | C1116: 0.40000000000000002 | D1116: 29401180.199999999 | E1116: 55018565.100000001 | F1116: -333281961 | G1116: -33644953.200000003 | H1116: -25587397.5 | I1116: 165998771.19999999 | J1116: 144317587.5 | K1116: 13088302.5 | L1116: 6841082.8499999996 | M1116: -659422000 | N1116: =POWER(D1116/M1116,1/9)-1 -> -1.7078011420981956 | O1116: =POWER(D1116/I1116,1/5)-1 -> -0.2926213006915841
A1117: 1656.HK | B1117: 亿仕登控股 | C1117: 1.75 | D1117: 29310888 | E1117: 85154190 | F1117: 147137647.5 | G1117: 88775096 | H1117: 40752801 | I1117: 62851932 | J1117: 55463205 | K1117: 27632962.5 | L1117: 47812882.5 | M1117: 43698020 | N1117: =POWER(D1117/M1117,1/9)-1 -> -4.3401510516573927e-02 | O1117: =POWER(D1117/I1117,1/5)-1 -> -0.14149650248219281
A1118: 0252.HK | B1118: 华信地产财务 | C1118: 2.7999999999999998 | D1118: 29221316 | E1118: 26512717 | F1118: 6266111 | G1118: -185675835 | H1118: -46776402 | I1118: 65660616 | J1118: 95807428 | K1118: 37168950 | L1118: 161311725 | M1118: 95930602 | N1118: =POWER(D1118/M1118,1/9)-1 -> -0.12372975114401197 | O1118: =POWER(D1118/I1118,1/5)-1 -> -0.14949090215413507
A1119: 8309.HK | B1119: 万成环球控股 | C1119: 0.07 | D1119: 28264000 | E1119: 2253000 | F1119: 28615000 | G1119: 14062000 | H1119: 2226000 | I1119: -10024000 | J1119: 2782000 | K1119: 12522000 | L1119: 14354000 | M1119: -- | N1119: =POWER(D1119/M1119,1/9)-1 -> #VALUE! | O1119: =POWER(D1119/I1119,1/5)-1 -> -2.2303778760361475
A1120: 1848.HK | B1120: 中国飞机租赁 | C1120: 2.87 | D1120: 28256000 | E1120: 73598000 | F1120: 525780000 | G1120: 334143000 | H1120: 896007000 | I1120: 808913000 | J1120: 734663000 | K1120: 638415000 | L1120: 380165000 | M1120: 302750000 | N1120: =POWER(D1120/M1120,1/9)-1 -> -0.23165104783100532 | O1120: =POWER(D1120/I1120,1/5)-1 -> -0.48874004980796348
A1121: 8601.HK | B1121: 宝燵控股 | C1121: 0.29 | D1121: 28229000 | E1121: 19959000 | F1121: 20232000 | G1121: 23987000 | H1121: 16498000 | I1121: -1438000 | J1121: 17190000 | K1121: 14162000 | L1121: -- | M1121: -- | N1121: =POWER(D1121/M1121,1/9)-1 -> #VALUE! | O1121: =POWER(D1121/I1121,1/5)-1 -> -2.8137913296482315
A1122: 2078.HK | B1122: 荣阳实业 | C1122: 0.16 | D1122: 28163000 | E1122: -104623000 | F1122: -340725000 | G1122: 920832000 | H1122: -495594000 | I1122: -233463000 | J1122: -156332000 | K1122: -- | L1122: -336677000 | M1122: 2565000 | N1122: =POWER(D1122/M1122,1/9)-1 -> 0.30503236644757203 | O1122: =POWER(D1122/I1122,1/5)-1 -> -1.6550767272808677
A1123: 2440.HK | B1123: 濠暻科技 | C1123: 1.07 | D1123: 27945426.600000001 | E1123: 32155362.399999999 | F1123: 42098310 | G1123: 34032320.700000003 | H1123: -- | I1123: -- | J1123: -- | K1123: -- | L1123: -- | M1123: -- | N1123: =POWER(D1123/M1123,1/9)-1 -> #VALUE! | O1123: =POWER(D1123/I1123,1/5)-1 -> #VALUE!
A1124: 2789.HK | B1124: 远大中国 | C1124: 0.04 | D1124: 27760168.800000001 | E1124: 81368724.900000006 | F1124: -1219392610.5 | G1124: -823155937.5 | H1124: 100373850 | I1124: 90084893.400000006 | J1124: 72715682.799999997 | K1124: 96722088.75 | L1124: -226103844.84999999 | M1124: 31942496.300000001 | N1124: =POWER(D1124/M1124,1/9)-1 -> -1.5471848499520324e-02 | O1124: =POWER(D1124/I1124,1/5)-1 -> -0.20976906534092854
A1125: 1705.HK | B1125: 宾仕国际 | C1125: 0.42 | D1125: 27753000 | E1125: 596000 | F1125: 583000 | G1125: 1099000 | H1125: 13466000 | I1125: 14085000 | J1125: 27356000 | K1125: 19808000 | L1125: 13666000 | M1125: -- | N1125: =POWER(D1125/M1125,1/9)-1 -> #VALUE! | O1125: =POWER(D1125/I1125,1/5)-1 -> 0.14527720509676256
A1126: 1036.HK | B1126: 万科海外 | C1126: 1.27 | D1126: 27699000 | E1126: 28169000 | F1126: 424580000 | G1126: 185746000 | H1126: 133363000 | I1126: 676843000 | J1126: 155149000 | K1126: 131320000 | L1126: 161705000 | M1126: 137555000 | N1126: =POWER(D1126/M1126,1/9)-1 -> -0.16311593034956862 | O1126: =POWER(D1126/I1126,1/5)-1 -> -0.47229011463434678
A1127: 8326.HK | B1127: 同景新能源 | C1127: 0.13 | D1127: 27633000 | E1127: 5497000 | F1127: -8630000 | G1127: 6329000 | H1127: 29640000 | I1127: 21006000 | J1127: 25992000 | K1127: 5078000 | L1127: 539000 | M1127: -5976000 | N1127: =POWER(D1127/M1127,1/9)-1 -> -2.1854707085186083 | O1127: =POWER(D1127/I1127,1/5)-1 -> 5.6372130902300421e-02
A1128: 1712.HK | B1128: 龙资源 | C1128: 1.76 | D1128: 27602885.5 | E1128: 13248947 | F1128: 1652428 | G1128: 60872596 | H1128: 34439127 | I1128: -52720726.5 | J1128: -3553385 | K1128: 30003303.5 | L1128: 14505298.5 | M1128: 49250600 | N1128: =POWER(D1128/M1128,1/9)-1 -> -6.2307745465458364e-02 | O1128: =POWER(D1128/I1128,1/5)-1 -> -1.8786069200765791
A1129: 0423.HK | B1129: 经济日报集团 | C1129: 0.87 | D1129: 27458000 | E1129: 33017000 | F1129: 30916000 | G1129: 10573000 | H1129: 71521000 | I1129: 71257000 | J1129: 28759000 | K1129: 57482000 | L1129: 45377000 | M1129: 28138000 | N1129: =POWER(D1129/M1129,1/9)-1 -> -2.7144659876429111e-03 | O1129: =POWER(D1129/I1129,1/5)-1 -> -0.17364192874976347
A1130: 2550.HK | B1130: 宜搜科技 | C1130: 18.98 | D1130: 27417058.199999999 | E1130: -- | F1130: -- | G1130: -- | H1130: -- | I1130: -- | J1130: -- | K1130: -- | L1130: -- | M1130: -- | N1130: =POWER(D1130/M1130,1/9)-1 -> #VALUE! | O1130: =POWER(D1130/I1130,1/5)-1 -> #VALUE!
A1131: 8637.HK | B1131: 元续科技 | C1131: 1.37 | D1131: 27268833 | E1131: -- | F1131: -- | G1131: -- | H1131: -- | I1131: -- | J1131: -- | K1131: -- | L1131: -- | M1131: -- | N1131: =POWER(D1131/M1131,1/9)-1 -> #VALUE! | O1131: =POWER(D1131/I1131,1/5)-1 -> #VALUE!
A1132: 1260.HK | B1132: 皓天财经集团 | C1132: 0.17 | D1132: 27222000 | E1132: -128923000 | F1132: 118319000 | G1132: 75674000 | H1132: 161513000 | I1132: 134706000 | J1132: 271162000 | K1132: 239892000 | L1132: 198957000 | M1132: 153821000 | N1132: =POWER(D1132/M1132,1/9)-1 -> -0.17503823190357148 | O1132: =POWER(D1132/I1132,1/5)-1 -> -0.27371576403884201
A1133: 1407.HK | B1133: 交运燃气 | C1133: 0.51 | D1133: 26898555.600000001 | E1133: 57308608.100000001 | F1133: 82659872.5 | G1133: 59691543.899999999 | H1133: -- | I1133: -- | J1133: -- | K1133: -- | L1133: -- | M1133: -- | N1133: =POWER(D1133/M1133,1/9)-1 -> #VALUE! | O1133: =POWER(D1133/I1133,1/5)-1 -> #VALUE!
A1134: 0800.HK | B1134: A8新媒体 | C1134: 0.33 | D1134: 26799897.600000001 | E1134: 14912353.9 | F1134: 71051612.5 | G1134: 60432905.700000003 | H1134: -57087487.5 | I1134: -96962037.400000006 | J1134: 30008467 | K1134: 26831131.25 | L1134: 25880156.300000001 | M1134: 13424908.199999999 | N1134: =POWER(D1134/M1134,1/9)-1 -> 7.9836439667161141e-02 | O1134: =POWER(D1134/I1134,1/5)-1 -> -1.7732257000432599
A1135: 0235.HK | B1135: 中策资本控股 | C1135: 0.02 | D1135: 26788000 | E1135: -189249000 | F1135: -3583297000 | G1135: 2283187000 | H1135: -322947000 | I1135: 708790000 | J1135: 126193000 | K1135: -436870000 | L1135: 584148000 | M1135: 376994000 | N1135: =POWER(D1135/M1135,1/9)-1 -> -0.25458067059326328 | O1135: =POWER(D1135/I1135,1/5)-1 -> -0.48062081360553166
A1136: 8329.HK | B1136: 海王英特龙 | C1136: 0.14 | D1136: 26448017.399999999 | E1136: 61307722.600000001 | F1136: 44030571 | G1136: 43614004.799999997 | H1136: 66735982.5 | I1136: 54754135.399999999 | J1136: 60253117.299999997 | K1136: 69666485 | L1136: 24761732.75 | M1136: 41397834.600000001 | N1136: =POWER(D1136/M1136,1/9)-1 -> -4.8564176080250099e-02 | O1136: =POWER(D1136/I1136,1/5)-1 -> -0.13543979931051964
A1137: 8017.HK | B1137: 捷利交易宝 | C1137: 0.24 | D1137: 26318699 | E1137: 25259615 | F1137: 20578678 | G1137: 13025105 | H1137: -17697740 | I1137: -1069348 | J1137: -2628252 | K1137: 3427512 | L1137: -- | M1137: -- | N1137: =POWER(D1137/M1137,1/9)-1 -> #VALUE! | O1137: =POWER(D1137/I1137,1/5)-1 -> -2.8977066136108052
A1138: 8299.HK | B1138: 大唐潼金 | C1138: 0.18 | D1138: 26109000 | E1138: -137000 | F1138: -17974000 | G1138: -35239000 | H1138: 33000 | I1138: 15290000 | J1138: -9779000 | K1138: 11114000 | L1138: 14384000 | M1138: -32688000 | N1138: =POWER(D1138/M1138,1/9)-1 -> -1.9753393933183478 | O1138: =POWER(D1138/I1138,1/5)-1 -> 0.11295229807987472
A1139: 0305.HK | B1139: 五菱汽车 | C1139: 0.37 | D1139: 25735487.399999999 | E1139: 25507469.100000001 | F1139: -29569226 | G1139: -39813035.700000003 | H1139: -138599055 | I1139: 80468277.799999997 | J1139: 207599126.19999999 | K1139: 156088397.5 | L1139: 96685422.599999994 | M1139: 61699919.700000003 | N1139: =POWER(D1139/M1139,1/9)-1 -> -9.2586343685338246e-02 | O1139: =POWER(D1139/I1139,1/5)-1 -> -0.20387449344112163
A1140: 0385.HK | B1140: 建联集团 | C1140: 0.39 | D1140: 25734000 | E1140: -10197000 | F1140: 77379000 | G1140: 124084000 | H1140: 130983000 | I1140: 195867000 | J1140: 176770000 | K1140: 209928000 | L1140: 169087000 | M1140: 142314000 | N1140: =POWER(D1140/M1140,1/9)-1 -> -0.17306133848042882 | O1140: =POWER(D1140/I1140,1/5)-1 -> -0.33363956193509148
A1141: 0531.HK | B1141: 顺诚 | C1141: 0.44 | D1141: 25682568 | E1141: 118096000 | F1141: 211778084 | G1141: -108596271 | H1141: -378518283 | I1141: 140346110 | J1141: 703744468 | K1141: 50749930 | L1141: 22019170.5 | M1141: 135698976 | N1141: =POWER(D1141/M1141,1/9)-1 -> -0.16886122893858346 | O1141: =POWER(D1141/I1141,1/5)-1 -> -0.28798750775466953
A1142: 6939.HK | B1142: 美佳音控股 | C1142: 0.59 | D1142: 25444994.399999999 | E1142: 50642665.200000003 | F1142: 38281543.5 | G1142: 34267125 | H1142: -- | I1142: -- | J1142: -- | K1142: -- | L1142: -- | M1142: -- | N1142: =POWER(D1142/M1142,1/9)-1 -> #VALUE! | O1142: =POWER(D1142/I1142,1/5)-1 -> #VALUE!
A1143: 3848.HK | B1143: 浩森金融科技 | C1143: 2.65 | D1143: 25402242.600000001 | E1143: 27200747.199999999 | F1143: 37447659 | G1143: -133066099.8 | H1143: 40531725 | I1143: 26917642.600000001 | J1143: 31636573.199999999 | K1143: 32848550 | L1143: 29094300.949999999 | M1143: 27566111 | N1143: =POWER(D1143/M1143,1/9)-1 -> -9.0421708466061901e-03 | O1143: =POWER(D1143/I1143,1/5)-1 -> -1.1522001202874277e-02
A1144: 1447.HK | B1144: 新福港 | C1144: 0.59999999999999998 | D1144: 25324000 | E1144: 18729000 | F1144: 17426000 | G1144: -19027000 | H1144: -28827000 | I1144: 129689000 | J1144: 141874000 | K1144: 105967000 | L1144: 71962000 | M1144: 72480000 | N1144: =POWER(D1144/M1144,1/9)-1 -> -0.11027227389336114 | O1144: =POWER(D1144/I1144,1/5)-1 -> -0.2786835565642245
A1145: 1778.HK | B1145: 彩生活 | C1145: 0.21 | D1145: 25220273.399999999 | E1145: 35374959.799999997 | F1145: 21619772 | G1145: 598001259.89999998 | H1145: 557151975 | I1145: 552244910.60000002 | J1145: 384435677.30000001 | K1145: 208676081.25 | L1145: 198091509.90000001 | M1145: 181787832.5 | N1145: =POWER(D1145/M1145,1/9)-1 -> -0.19705237130487141 | O1145: =POWER(D1145/I1145,1/5)-1 -> -0.46058426159311905
A1146: 2535.HK | B1146: 泓基集团 | C1146: 0.59999999999999998 | D1146: 25205000 | E1146: -- | F1146: -- | G1146: -- | H1146: -- | I1146: -- | J1146: -- | K1146: -- | L1146: -- | M1146: -- | N1146: =POWER(D1146/M1146,1/9)-1 -> #VALUE! | O1146: =POWER(D1146/I1146,1/5)-1 -> #VALUE!
A1147: 2501.HK | B1147: 迈越科技 | C1147: 0.94 | D1147: 25082152.199999999 | E1147: -- | F1147: -- | G1147: -- | H1147: -- | I1147: -- | J1147: -- | K1147: -- | L1147: -- | M1147: -- | N1147: =POWER(D1147/M1147,1/9)-1 -> #VALUE! | O1147: =POWER(D1147/I1147,1/5)-1 -> #VALUE!
A1148: 6812.HK | B1148: 永顺控股香港 | C1148: 0.24 | D1148: 24745000 | E1148: 22096000 | F1148: 73809000 | G1148: 20702000 | H1148: 20842000 | I1148: 21804000 | J1148: 8679000 | K1148: 18814000 | L1148: 14331000 | M1148: -- | N1148: =POWER(D1148/M1148,1/9)-1 -> #VALUE! | O1148: =POWER(D1148/I1148,1/5)-1 -> 2.5628916846938798e-02
A1149: 0927.HK | B1149: 富士高实业 | C1149: 0.77 | D1149: 24613000 | E1149: -37073000 | F1149: 10266000 | G1149: 28991000 | H1149: 40490000 | I1149: 30518000 | J1149: 2770000 | K1149: 11259000 | L1149: 12602000 | M1149: 62318000 | N1149: =POWER(D1149/M1149,1/9)-1 -> -9.8071026667292061e-02 | O1149: =POWER(D1149/I1149,1/5)-1 -> -4.2096640037924127e-02
A1150: 1820.HK | B1150: 济丰包装 | C1150: 6.2999999999999998 | D1150: 24570226.800000001 | E1150: 25744370.100000001 | F1150: 53423710.5 | G1150: 93467606.099999994 | H1150: 85135620 | I1150: 102783699.2 | J1150: 102978316.59999999 | K1150: 59057381.25 | L1150: 35496717.149999999 | M1150: -- | N1150: =POWER(D1150/M1150,1/9)-1 -> #VALUE! | O1150: =POWER(D1150/I1150,1/5)-1 -> -0.24890134501517647
A1151: 6885.HK | B1151: 金马能源 | C1151: 0.73 | D1151: 24471568.800000001 | E1151: 476001795 | F1151: 595746189 | G1151: 578634076.79999995 | H1151: 656198235 | I1151: 947779748.79999995 | J1151: 638210437 | K1151: 295524713.75 | L1151: 27791237.550000001 | M1151: 130268281 | N1151: =POWER(D1151/M1151,1/9)-1 -> -0.16954963362952213 | O1151: =POWER(D1151/I1151,1/5)-1 -> -0.51872768770438982
A1152: 8257.HK | B1152: 靖洋集团 | C1152: 0.06 | D1152: 23629326.600000001 | E1152: -20631834 | F1152: 22232840 | G1152: 38141164.5 | H1152: 46100740 | I1152: 14261656.5 | J1152: 10002621 | K1152: 3003528 | L1152: 14961510 | M1152: 13920732 | N1152: =POWER(D1152/M1152,1/9)-1 -> 6.0552425132048393e-02 | O1152: =POWER(D1152/I1152,1/5)-1 -> 0.10625761856760496
A1153: 2182.HK | B1153: 天长集团 | C1153: 0.47 | D1153: 23457000 | E1153: 105945000 | F1153: 96264000 | G1153: 73714000 | H1153: 127196000 | I1153: 75755000 | J1153: 20078000 | K1153: 33857000 | L1153: 17761000 | M1153: 52636000 | N1153: =POWER(D1153/M1153,1/9)-1 -> -8.5889193199735425e-02 | O1153: =POWER(D1153/I1153,1/5)-1 -> -0.20900774146786849
A1154: 8405.HK | B1154: 恒智控股 | C1154: 0.54 | D1154: 23408000 | E1154: 36498000 | F1154: 46954000 | G1154: 46182000 | H1154: 28235000 | I1154: 21901000 | J1154: 1491000 | K1154: 6684000 | L1154: 36184000 | M1154: -- | N1154: =POWER(D1154/M1154,1/9)-1 -> #VALUE! | O1154: =POWER(D1154/I1154,1/5)-1 -> 1.3398069697579063e-02
A1155: 2237.HK | B1155: 中国石墨 | C1155: 0.43 | D1155: 23368791.600000001 | E1155: 89099594.200000003 | F1155: 65296462.5 | G1155: 43962039.600000001 | H1155: -- | I1155: -- | J1155: -- | K1155: -- | L1155: -- | M1155: -- | N1155: =POWER(D1155/M1155,1/9)-1 -> #VALUE! | O1155: =POWER(D1155/I1155,1/5)-1 -> #VALUE!
A1156: 0987.HK | B1156: 中国再生能源投资 | C1156: 0.12 | D1156: 23281000 | E1156: 31111000 | F1156: 113354000 | G1156: 86152000 | H1156: 57376000 | I1156: 62254000 | J1156: 60330000 | K1156: 61098000 | L1156: 40454000 | M1156: 14462000 | N1156: =POWER(D1156/M1156,1/9)-1 -> 5.432573707831545e-02 | O1156: =POWER(D1156/I1156,1/5)-1 -> -0.17857697185026566
A1157: 2116.HK | B1157: 江苏创新 | C1157: 0.38 | D1157: 23152840.199999999 | E1157: 12925769.800000001 | F1157: 14275221 | G1157: 26283778.800000001 | H1157: 30112155 | I1157: 26155919.199999999 | J1157: 32822285.300000001 | K1157: 37055742.5 | L1157: 27286712.100000001 | M1157: 20490518 | N1157: =POWER(D1157/M1157,1/9)-1 -> 1.3665330545840293e-02 | O1157: =POWER(D1157/I1157,1/5)-1 -> -2.4096540727268079e-02
A1158: 0806.HK | B1158: 惠理集团 | C1158: 1.58 | D1158: 23088000 | E1158: -544315000 | F1158: 457813000 | G1158: 1379475000 | H1158: 513409000 | I1158: 229453000 | J1158: 2048084000 | K1158: 137547000 | L1158: 273586000 | M1158: 804179000 | N1158: =POWER(D1158/M1158,1/9)-1 -> -0.3259837014760586 | O1158: =POWER(D1158/I1158,1/5)-1 -> -0.36825979835370681
A1159: 1028.HK | B1159: 千百度 | C1159: 0.38 | D1159: 22833846 | E1159: 16683470.9 | F1159: 33485177 | G1159: 7364750.0999999996 | H1159: -348078900 | I1159: -440671219.39999998 | J1159: 24567858.800000001 | K1159: 229198646.25 | L1159: 302823466.60000002 | M1159: 302271329.60000002 | N1159: =POWER(D1159/M1159,1/9)-1 -> -0.24949503803790796 | O1159: =POWER(D1159/I1159,1/5)-1 -> -1.5532136356300452
A1160: 2030.HK | B1160: 卡宾 | C1160: 1.32 | D1160: 22815210.600000001 | E1160: -96023872 | F1160: 201053104 | G1160: 231477707.09999999 | H1160: 176167170 | I1160: 241255676.80000001 | J1160: 242037528.69999999 | K1160: 201901901.25 | L1160: 338182585.89999998 | M1160: 293882945.80000001 | N1160: =POWER(D1160/M1160,1/9)-1 -> -0.24721278770635791 | O1160: =POWER(D1160/I1160,1/5)-1 -> -0.37605057596449643
A1161: 3816.HK | B1161: KFM金德 | C1161: 0.34 | D1161: 22666000 | E1161: -48192000 | F1161: 17923000 | G1161: 644000 | H1161: 49658000 | I1161: 35064000 | J1161: -15481000 | K1161: -45827000 | L1161: 31473000 | M1161: 36383000 | N1161: =POWER(D1161/M1161,1/9)-1 -> -5.1223231781782008e-02 | O1161: =POWER(D1161/I1161,1/5)-1 -> -8.3562851468662047e-02
A1162: 1930.HK | B1162: 勋龙 | C1162: 0.25 | D1162: 22529102.399999999 | E1162: 19529667.199999999 | F1162: 25953277.5 | G1162: 33786789.299999997 | H1162: 26499277.5 | I1162: 35696248.600000001 | J1162: 45045070.799999997 | K1162: 23249572.5 | L1162: -- | M1162: -- | N1162: =POWER(D1162/M1162,1/9)-1 -> #VALUE! | O1162: =POWER(D1162/I1162,1/5)-1 -> -8.7938208822477604e-02
A1163: 0320.HK | B1163: 金宝通 | C1163: 0.52 | D1163: 22504000 | E1163: 84227000 | F1163: 81391000 | G1163: 10993000 | H1163: 10289000 | I1163: 126404000 | J1163: 126449000 | K1163: 97724000 | L1163: 76307000 | M1163: 33874000 | N1163: =POWER(D1163/M1163,1/9)-1 -> -4.4422500452712455e-02 | O1163: =POWER(D1163/I1163,1/5)-1 -> -0.29189154438183917
A1164: 2477.HK | B1164: 经纬天地 | C1164: 2.86 | D1164: 22359191.399999999 | E1164: -- | F1164: -- | G1164: -- | H1164: -- | I1164: -- | J1164: -- | K1164: -- | L1164: -- | M1164: -- | N1164: =POWER(D1164/M1164,1/9)-1 -> #VALUE! | O1164: =POWER(D1164/I1164,1/5)-1 -> #VALUE!
A1165: 1587.HK | B1165: 欣融国际 | C1165: 0.40000000000000002 | D1165: 22205723.399999999 | E1165: 53767502.200000003 | F1165: 105381694.5 | G1165: 41594926.200000003 | H1165: 33526117.5 | I1165: 32029956.600000001 | J1165: 32632859.100000001 | K1165: 33078578.75 | L1165: 37819415.899999999 | M1165: 31973693.800000001 | N1165: =POWER(D1165/M1165,1/9)-1 -> -3.9697603457442332e-02 | O1165: =POWER(D1165/I1165,1/5)-1 -> -7.0644838847882085e-02
A1166: 0368.HK | B1166: 德合集团 | C1166: 0.23 | D1166: 22168000 | E1166: 28065000 | F1166: 12597000 | G1166: 18049000 | H1166: 33675000 | I1166: 40169000 | J1166: 30633000 | K1166: -- | L1166: -- | M1166: -- | N1166: =POWER(D1166/M1166,1/9)-1 -> #VALUE! | O1166: =POWER(D1166/I1166,1/5)-1 -> -0.11209377963169231
A1167: 1399.HK | B1167: 锐信控股 | C1167: 0.22 | D1167: 22043485.800000001 | E1167: 27117267.800000001 | F1167: 51651859 | G1167: -62792867.700000003 | H1167: 58716802.5 | I1167: 106201776.40000001 | J1167: 25326762.5 | K1167: -132184298.75 | L1167: 44887476.399999999 | M1167: -2116438.3999999999 | N1167: =POWER(D1167/M1167,1/9)-1 -> -2.2974031854958685 | O1167: =POWER(D1167/I1167,1/5)-1 -> -0.26982039524118162
A1168: 9882.HK | B1168: 永联丰控股 | C1168: 0.96 | D1168: 22039000 | E1168: -- | F1168: -- | G1168: -- | H1168: -- | I1168: -- | J1168: -- | K1168: -- | L1168: -- | M1168: -- | N1168: =POWER(D1168/M1168,1/9)-1 -> #VALUE! | O1168: =POWER(D1168/I1168,1/5)-1 -> #VALUE!
A1169: 2080.HK | B1169: 奥克斯国际 | C1169: 0.19 | D1169: 21511000 | E1169: 12297000 | F1169: -8621000 | G1169: 13213000 | H1169: -9635000 | I1169: -25517000 | J1169: -28803000 | K1169: -25982000 | L1169: -104000 | M1169: -585000 | N1169: =POWER(D1169/M1169,1/9)-1 -> -2.4926052693048293 | O1169: =POWER(D1169/I1169,1/5)-1 -> -1.9664206414621819
A1170: 0689.HK | B1170: 长盈集团(控股) | C1170: 0.03 | D1170: 21500000 | E1170: -46746000 | F1170: -29371000 | G1170: 8519000 | H1170: -138099000 | I1170: -115227000 | J1170: -54855000 | K1170: -31079000 | L1170: -276548000 | M1170: -381143000 | N1170: =POWER(D1170/M1170,1/9)-1 -> -1.7265427409363441 | O1170: =POWER(D1170/I1170,1/5)-1 -> -1.7147873221076457
A1171: 6898.HK | B1171: 中国铝罐 | C1171: 0.63 | D1171: 21461000 | E1171: 20513000 | F1171: 18096000 | G1171: 21669000 | H1171: 39182000 | I1171: 79473000 | J1171: 70987000 | K1171: 94833000 | L1171: 78954000 | M1171: 81130000 | N1171: =POWER(D1171/M1171,1/9)-1 -> -0.137359525767627 | O1171: =POWER(D1171/I1171,1/5)-1 -> -0.23036276719685456
A1172: 3789.HK | B1172: 御佳控股 | C1172: 0.06 | D1172: 21403000 | E1172: 6778000 | F1172: 37113000 | G1172: 26967000 | H1172: 43376000 | I1172: 56060000 | J1172: 63783000 | K1172: 49791000 | L1172: 34270000 | M1172: 39166000 | N1172: =POWER(D1172/M1172,1/9)-1 -> -6.4937579096626452e-02 | O1172: =POWER(D1172/I1172,1/5)-1 -> -0.17517025968673328
A1173: 0265.HK | B1173: 东胜智慧城市服务 | C1173: 0.02 | D1173: 21362000 | E1173: 9745000 | F1173: -22545000 | G1173: -27759000 | H1173: -34097000 | I1173: -56078000 | J1173: -46846000 | K1173: -191816000 | L1173: 1369000 | M1173: 1029000 | N1173: =POWER(D1173/M1173,1/9)-1 -> 0.40074313924388805 | O1173: =POWER(D1173/I1173,1/5)-1 -> -1.8244605484255667
A1174: 0828.HK | B1174: 王朝酒业 | C1174: 0.28 | D1174: 21338000 | E1174: 16333000 | F1174: 32811000 | G1174: 116378000 | H1174: -72943000 | I1174: -78668000 | J1174: -133625000 | K1174: -100632000 | L1174: -205551000 | M1174: -393523000 | N1174: =POWER(D1174/M1174,1/9)-1 -> -1.7233587384398095 | O1174: =POWER(D1174/I1174,1/5)-1 -> -1.7703199053513119
A1175: 1950.HK | B1175: 帝王实业控股 | C1175: 0.12 | D1175: 21322186.199999999 | E1175: 24650113.100000001 | F1175: -3183700 | G1175: -3762828.2999999998 | H1175: 26958570 | I1175: 35057494 | J1175: 41901555 | K1175: 28232417.5 | L1175: -- | M1175: -- | N1175: =POWER(D1175/M1175,1/9)-1 -> #VALUE! | O1175: =POWER(D1175/I1175,1/5)-1 -> -9.4663202557488502e-02
A1176: 1663.HK | B1176: 汉港控股 | C1176: 0.12 | D1176: 21250869.350000001 | E1176: 319558506.75 | F1176: 68146482 | G1176: 62178200.700000003 | H1176: 24196056 | I1176: 6102040.9500000002 | J1176: 59113719.600000001 | K1176: 113759771.40000001 | L1176: 116166792.59999999 | M1176: 179566232 | N1176: =POWER(D1176/M1176,1/9)-1 -> -0.21110919811027884 | O1176: =POWER(D1176/I1176,1/5)-1 -> 0.28345402618456927
A1177: 0131.HK | B1177: 卓能(集团) | C1177: 1.82 | D1177: 21202000 | E1177: -149187000 | F1177: 148700000 | G1177: 47696000 | H1177: 572899000 | I1177: 606619000 | J1177: 440660000 | K1177: 315348000 | L1177: 241028000 | M1177: 395232000 | N1177: =POWER(D1177/M1177,1/9)-1 -> -0.27750294510025653 | O1177: =POWER(D1177/I1177,1/5)-1 -> -0.48868072521740191
A1178: 8480.HK | B1178: 飞霓控股 | C1178: 0.16 | D1178: 21167103.600000001 | E1178: 32209182.649999999 | F1178: -1439014.5 | G1178: -62164328.200000003 | H1178: -96688841.099999994 | I1178: 1753195.8 | J1178: 16996122 | K1178: 11799423.6 | L1178: 10175234.4 | M1178: -- | N1178: =POWER(D1178/M1178,1/9)-1 -> #VALUE! | O1178: =POWER(D1178/I1178,1/5)-1 -> 0.64575886362776158
A1179: 1693.HK | B1179: 璋利国际 | C1179: 0.04 | D1179: 21150560.699999999 | E1179: -- | F1179: -- | G1179: -360338357.39999998 | H1179: -99352508.049999997 | I1179: -7840817.9299999997 | J1179: 101485764.06999999 | K1179: 117699655.56999999 | L1179: -- | M1179: 7186333 | N1179: =POWER(D1179/M1179,1/9)-1 -> 0.1274323841617202 | O1179: =POWER(D1179/I1179,1/5)-1 -> -2.2195289185130354
A1180: 1443.HK | B1180: 富临集团控股 | C1180: 0.15 | D1180: 21138000 | E1180: -49169000 | F1180: -122192000 | G1180: -637476000 | H1180: 25496000 | I1180: 42477000 | J1180: 82842000 | K1180: 101404000 | L1180: 160292000 | M1180: 167541000 | N1180: =POWER(D1180/M1180,1/9)-1 -> -0.20548014535549119 | O1180: =POWER(D1180/I1180,1/5)-1 -> -0.13027488486721928
A1181: 3699.HK | B1181: 光大永年 | C1181: 0.39 | D1181: 21110619.600000001 | E1181: 24877989.300000001 | F1181: 40008088.5 | G1181: 40503145.799999997 | H1181: 41661517.5 | I1181: 41620384.399999999 | J1181: 29092507.399999999 | K1181: 35019932.5 | L1181: 40344395.25 | M1181: 39217753.299999997 | N1181: =POWER(D1181/M1181,1/9)-1 -> -6.6502538922324272e-02 | O1181: =POWER(D1181/I1181,1/5)-1 -> -0.12695027751620591
A1182: 6119.HK | B1182: 天源集团 | C1182: 0.53 | D1182: 20950574.399999999 | E1182: 19720316.100000001 | F1182: 15573191 | G1182: 24801055.199999999 | H1182: 16150110 | I1182: 6659671.4000000004 | J1182: 23071631.600000001 | K1182: 13770610 | L1182: 8798030.0500000007 | M1182: 28076502.100000001 | N1182: =POWER(D1182/M1182,1/9)-1 -> -3.2006261144271297e-02 | O1182: =POWER(D1182/I1182,1/5)-1 -> 0.25761765838579409
A1183: 8140.HK | B1183: 人和科技 | C1183: 0.09 | D1183: 20795000 | E1183: 20530000 | F1183: 21641000 | G1183: 7212000 | H1183: 1006000 | I1183: -1165000 | J1183: 944000 | K1183: 14191000 | L1183: -- | M1183: -- | N1183: =POWER(D1183/M1183,1/9)-1 -> #VALUE! | O1183: =POWER(D1183/I1183,1/5)-1 -> -2.7796172217809483
A1184: 2352.HK | B1184: 东原仁知服务 | C1184: 4.9000000000000004 | D1184: 20791625.399999999 | E1184: 102343488.2 | F1184: 157617640 | G1184: 100970616.59999999 | H1184: -- | I1184: -- | J1184: -- | K1184: -- | L1184: -- | M1184: -- | N1184: =POWER(D1184/M1184,1/9)-1 -> #VALUE! | O1184: =POWER(D1184/I1184,1/5)-1 -> #VALUE!
A1185: 2381.HK | B1185: 蚬壳电业 | C1185: 0.10000000000000001 | D1185: 20773000 | E1185: 22370000 | F1185: 28319000 | G1185: 36353000 | H1185: 45367000 | I1185: 34628000 | J1185: 31206000 | K1185: 23917000 | L1185: -- | M1185: -- | N1185: =POWER(D1185/M1185,1/9)-1 -> #VALUE! | O1185: =POWER(D1185/I1185,1/5)-1 -> -9.7152577669137763e-02
A1186: 8473.HK | B1186: 弥明生活百货 | C1186: 0.13 | D1186: 20740000 | E1186: 20122000 | F1186: 27137000 | G1186: 15852000 | H1186: 27627000 | I1186: 6035000 | J1186: 9600000 | K1186: 17591000 | L1186: 7284000 | M1186: -- | N1186: =POWER(D1186/M1186,1/9)-1 -> #VALUE! | O1186: =POWER(D1186/I1186,1/5)-1 -> 0.28004811830454912
A1187: 1889.HK | B1187: 三爱健康集团 | C1187: 0.02 | D1187: 20425494.600000001 | E1187: 32959697.699999999 | F1187: 11051112.5 | G1187: 7654381.7999999998 | H1187: -- | I1187: -261599043 | J1187: -1380825881.5999999 | K1187: -440341702.5 | L1187: 48456788.149999999 | M1187: -54943789.100000001 | N1187: =POWER(D1187/M1187,1/9)-1 -> -1.8958812384605859 | O1187: =POWER(D1187/I1187,1/5)-1 -> -1.6004920832843135
A1188: 1152.HK | B1188: 正乾金融控股 | C1188: 0.07 | D1188: 20346000 | E1188: 15297000 | F1188: 15628000 | G1188: 4511000 | H1188: -18698000 | I1188: -22008000 | J1188: -10908000 | K1188: -42944000 | L1188: -77410000 | M1188: -23440000 | N1188: =POWER(D1188/M1188,1/9)-1 -> -1.9843942042909517 | O1188: =POWER(D1188/I1188,1/5)-1 -> -1.984418331879227
A1189: 2129.HK | B1189: Legion Conso | C1189: 0.10000000000000001 | D1189: 20284164.399999999 | E1189: 26438617 | F1189: 16491148.27 | G1189: 24964338.079999998 | H1189: 35080447.140000001 | I1189: 20761705.399999999 | J1189: 34843582.240000002 | K1189: 26602466.960000001 | L1189: 25591948.16 | M1189: -- | N1189: =POWER(D1189/M1189,1/9)-1 -> #VALUE! | O1189: =POWER(D1189/I1189,1/5)-1 -> -4.6431272964836401e-03
A1190: 8645.HK | B1190: 比特元宇宙 | C1190: 0.5 | D1190: 20150000 | E1190: -38040000 | F1190: -4867691.5 | G1190: -935640.75 | H1190: 16293621.699999999 | I1190: 18753621.100000001 | J1190: 10968958.59 | K1190: -- | L1190: -- | M1190: -- | N1190: =POWER(D1190/M1190,1/9)-1 -> #VALUE! | O1190: =POWER(D1190/I1190,1/5)-1 -> 1.4467136387241064e-02
A1191: 1870.HK | B1191: 益美国际控股 | C1191: 1.99 | D1191: 20046000 | E1191: -79544000 | F1191: -187463000 | G1191: -47838000 | H1191: 40964000 | I1191: 80135000 | J1191: 52667000 | K1191: 49975000 | L1191: -- | M1191: -- | N1191: =POWER(D1191/M1191,1/9)-1 -> #VALUE! | O1191: =POWER(D1191/I1191,1/5)-1 -> -0.24204905816503219
A1192: 6083.HK | B1192: 环宇物流(亚洲) | C1192: 0.28 | D1192: 20025000 | E1192: 20486000 | F1192: 15250000 | G1192: 20578000 | H1192: 22515000 | I1192: 11108000 | J1192: 23630000 | K1192: 23511000 | L1192: 150000 | M1192: 21416000 | N1192: =POWER(D1192/M1192,1/9)-1 -> -7.4340975188329494e-03 | O1192: =POWER(D1192/I1192,1/5)-1 -> 0.12509017128981248
A1193: 1841.HK | B1193: 优越集团控股 | C1193: 0.21 | D1193: 19991000 | E1193: 11756000 | F1193: 27583000 | G1193: 25920000 | H1193: 27734000 | I1193: 40688000 | J1193: 27604000 | K1193: 13386000 | L1193: 16553000 | M1193: 9496000 | N1193: =POWER(D1193/M1193,1/9)-1 -> 8.6229353792863783e-02 | O1193: =POWER(D1193/I1193,1/5)-1 -> -0.13249170676455335
A1194: 3839.HK | B1194: 正大企业国际 | C1194: 0.74 | D1194: 19941483 | E1194: -52134016 | F1194: 152560072 | G1194: 126025015 | H1194: 123034600 | I1194: 165798776 | J1194: 127735458 | K1194: 62481732 | L1194: 63414591 | M1194: 150699080 | N1194: =POWER(D1194/M1194,1/9)-1 -> -0.20126041973838482 | O1194: =POWER(D1194/I1194,1/5)-1 -> -0.34531072490934667
A1195: 1825.HK | B1195: 美臻集团 | C1195: 0.13 | D1195: 19927000 | E1195: -38847000 | F1195: -33253000 | G1195: -58638000 | H1195: -22670000 | I1195: 20012000 | J1195: 31114000 | K1195: 26154000 | L1195: 14334000 | M1195: -- | N1195: =POWER(D1195/M1195,1/9)-1 -> #VALUE! | O1195: =POWER(D1195/I1195,1/5)-1 -> -8.5093726247253976e-04
A1196: 0518.HK | B1196: 同得仕(集团) | C1196: 0.22 | D1196: 19718000 | E1196: -26064000 | F1196: 255996000 | G1196: -83606000 | H1196: -94086000 | I1196: -46546000 | J1196: -119638000 | K1196: -65451000 | L1196: 197578000 | M1196: -43889000 | N1196: =POWER(D1196/M1196,1/9)-1 -> -1.914933830437044 | O1196: =POWER(D1196/I1196,1/5)-1 -> -1.842162888348593
A1197: 8319.HK | B1197: 思博系统 | C1197: 0.11 | D1197: 19652000 | E1197: 15217000 | F1197: 21720000 | G1197: 10695000 | H1197: 10753000 | I1197: 6889000 | J1197: 6987000 | K1197: -1769000 | L1197: 15599000 | M1197: 7965000 | N1197: =POWER(D1197/M1197,1/9)-1 -> 0.10555437708750115 | O1197: =POWER(D1197/I1197,1/5)-1 -> 0.23324713196620928
A1198: 1742.HK | B1198: HPC Holdings | C1198: 0.05 | D1198: 19455249 | E1198: -922462 | F1198: -26998753 | G1198: -25929075 | H1198: 85642275 | I1198: 77647472.5 | J1198: 156593844 | K1198: 139145519.5 | L1198: 96946920 | M1198: 86739292.5 | N1198: =POWER(D1198/M1198,1/9)-1 -> -0.15302812160102397 | O1198: =POWER(D1198/I1198,1/5)-1 -> -0.24180329278584911
A1199: 1936.HK | B1199: 利特米 | C1199: 0.58 | D1199: 19403178.300000001 | E1199: 20057383.350000001 | F1199: 22123446.300000001 | G1199: 16309162.35 | H1199: 26096437.300000001 | I1199: 30114829.800000001 | J1199: 20957508 | K1199: 18264387.600000001 | L1199: -- | M1199: -- | N1199: =POWER(D1199/M1199,1/9)-1 -> #VALUE! | O1199: =POWER(D1199/I1199,1/5)-1 -> -8.4162352239161131e-02
A1200: 8062.HK | B1200: 俊盟国际 | C1200: 0.32 | D1200: 19304000 | E1200: 10434000 | F1200: 26548000 | G1200: 4245000 | H1200: 9746000 | I1200: 21698000 | J1200: -1295000 | K1200: 13298000 | L1200: 9674000 | M1200: -- | N1200: =POWER(D1200/M1200,1/9)-1 -> #VALUE! | O1200: =POWER(D1200/I1200,1/5)-1 -> -2.31103219610026e-02
A1201: 6966.HK | B1201: 中国万桐园 | C1201: 0.59 | D1201: 19295312.399999999 | E1201: 24852043 | F1201: 22212430 | G1201: 20907117.899999999 | H1201: 26318242.5 | I1201: 32162034.199999999 | J1201: 8539764.6999999993 | K1201: 17994471.25 | L1201: 16853972.550000001 | M1201: -- | N1201: =POWER(D1201/M1201,1/9)-1 -> #VALUE! | O1201: =POWER(D1201/I1201,1/5)-1 -> -9.7137404724028542e-02
A1202: 1420.HK | B1202: 川控股 | C1202: 0.11 | D1202: 19207155 | E1202: 10035613.5 | F1202: 8660250 | G1202: -49075816 | H1202: 5771434 | I1202: 17541810 | J1202: 32480665 | K1202: 41377050 | L1202: 63246120 | M1202: 83569460 | N1202: =POWER(D1202/M1202,1/9)-1 -> -0.15072926191160763 | O1202: =POWER(D1202/I1202,1/5)-1 -> 1.8304651720051357e-02
A1203: 2265.HK | B1203: 鸿承环保科技 | C1203: 0.87 | D1203: 19175826.600000001 | E1203: 90491669.599999994 | F1203: 104833118.5 | G1203: 86847793.5 | H1203: -- | I1203: -- | J1203: -- | K1203: -- | L1203: -- | M1203: -- | N1203: =POWER(D1203/M1203,1/9)-1 -> #VALUE! | O1203: =POWER(D1203/I1203,1/5)-1 -> #VALUE!
A1204: 8023.HK | B1204: 邝文记 | C1204: 0.49 | D1204: 19116886 | E1204: 7463648 | F1204: 15567820 | G1204: 6212831 | H1204: 9979511 | I1204: 6646653 | J1204: -2838093 | K1204: 16796818 | L1204: 11085779 | M1204: -- | N1204: =POWER(D1204/M1204,1/9)-1 -> #VALUE! | O1204: =POWER(D1204/I1204,1/5)-1 -> 0.23527265835823385
A1205: 1591.HK | B1205: 汛和集团 | C1205: 0.02 | D1205: 18932000 | E1205: -4495000 | F1205: -6073000 | G1205: -33053000 | H1205: -25132000 | I1205: 5562000 | J1205: 18158000 | K1205: 25553000 | L1205: 28210000 | M1205: 17381000 | N1205: =POWER(D1205/M1205,1/9)-1 -> 9.5425712350865055e-03 | O1205: =POWER(D1205/I1205,1/5)-1 -> 0.277594702222556
A1206: 1629.HK | B1206: 冠均国际控股 | C1206: 0.15 | D1206: 18890814.600000001 | E1206: -10374007.6 | F1206: 29830044.5 | G1206: -628131.30000000005 | H1206: 8650567.5 | I1206: -5264886.4000000004 | J1206: 5663603.5999999996 | K1206: -10484643.75 | L1206: 25746086.600000001 | M1206: 18193134.100000001 | N1206: =POWER(D1206/M1206,1/9)-1 -> 4.1900346708827474e-03 | O1206: =POWER(D1206/I1206,1/5)-1 -> -2.2911370277378236
A1207: 1856.HK | B1207: 依波路 | C1207: 1.55 | D1207: 18871000 | E1207: -12068000 | F1207: -31823000 | G1207: 1327000 | H1207: -79047000 | I1207: -97666000 | J1207: -197283000 | K1207: -145011000 | L1207: -11916000 | M1207: 58811000 | N1207: =POWER(D1207/M1207,1/9)-1 -> -0.11864984870604267 | O1207: =POWER(D1207/I1207,1/5)-1 -> -1.7197974482337546
A1208: 8030.HK | B1208: 汇联金融服务 | C1208: 0.41 | D1208: 18554281.199999999 | E1208: 2938700.5 | F1208: -324830462 | G1208: -558673327.5 | H1208: -752874277.5 | I1208: 116791895 | J1208: 183146361.80000001 | K1208: 112595183.75 | L1208: 50741853.299999997 | M1208: -107772387.7 | N1208: =POWER(D1208/M1208,1/9)-1 -> -1.8224397074840719 | O1208: =POWER(D1208/I1208,1/5)-1 -> -0.30784033775988939
A1209: 1231.HK | B1209: 新矿资源 | C1209: 0.32 | D1209: 18535503 | E1209: -16677888 | F1209: -13911632 | G1209: 6442743 | H1209: -542629308 | I1209: -120698431.59999999 | J1209: -55802800.5 | K1209: -597913618.75 | L1209: -53335043.549999997 | M1209: -57548156.399999999 | N1209: =POWER(D1209/M1209,1/9)-1 -> -1.8817192630220334 | O1209: =POWER(D1209/I1209,1/5)-1 -> -1.6874807622963239
A1210: 1251.HK | B1210: 华油能源 | C1210: 0.22 | D1210: 18355869 | E1210: 14937172.1 | F1210: 10769477.5 | G1210: -108688169.09999999 | H1210: 222299805 | I1210: 93135202.799999997 | J1210: 6643104.9000000004 | K1210: -324869492.5 | L1210: -484726648.25 | M1210: 144976030.40000001 | N1210: =POWER(D1210/M1210,1/9)-1 -> -0.20516786704830114 | O1210: =POWER(D1210/I1210,1/5)-1 -> -0.27734299469152834
A1211: 1009.HK | B1211: 国际娱乐 | C1211: 0.95 | D1211: 18282000 | E1211: -256391000 | F1211: -242040000 | G1211: -279564000 | H1211: -77527000 | I1211: -67278000 | J1211: -31486000 | K1211: 31703000 | L1211: 45944000 | M1211: 114694000 | N1211: =POWER(D1211/M1211,1/9)-1 -> -0.1845694079545076 | O1211: =POWER(D1211/I1211,1/5)-1 -> -1.7706019903814925
A1212: 3773.HK | B1212: 银盛数惠 | C1212: 2.41 | D1212: 17926158.600000001 | E1212: 30757646.5 | F1212: 32422311 | G1212: 36010874.700000003 | H1212: 743137.5 | I1212: -29414592.399999999 | J1212: -22824658.199999999 | K1212: 37276881.25 | L1212: 31521668.149999999 | M1212: 35508994.5 | N1212: =POWER(D1212/M1212,1/9)-1 -> -7.3134877901113504e-02 | O1212: =POWER(D1212/I1212,1/5)-1 -> -1.9057010681907518
A1213: 8426.HK | B1213: 雅居投资控股 | C1213: 0.34 | D1213: 17774000 | E1213: 21180000 | F1213: 25457000 | G1213: 19440000 | H1213: 7186000 | I1213: 12142000 | J1213: -2160000 | K1213: 13300000 | L1213: 2095000 | M1213: -- | N1213: =POWER(D1213/M1213,1/9)-1 -> #VALUE! | O1213: =POWER(D1213/I1213,1/5)-1 -> 7.9192676368816661e-02
A1214: 1945.HK | B1214: 清科创业 | C1214: 1.04 | D1214: 17676225 | E1214: 22960219.300000001 | F1214: 14041341.5 | G1214: 37482871.200000003 | H1214: 38581687.5 | I1214: 30925514.600000001 | J1214: 22075345.699999999 | K1214: -- | L1214: -- | M1214: -- | N1214: =POWER(D1214/M1214,1/9)-1 -> #VALUE! | O1214: =POWER(D1214/I1214,1/5)-1 -> -0.10584148386858638
A1215: 6663.HK | B1215: 国际永胜集团 | C1215: 0.24 | D1215: 17645000 | E1215: 56570000 | F1215: 66213000 | G1215: 47088000 | H1215: -- | I1215: -- | J1215: -- | K1215: -- | L1215: -- | M1215: -- | N1215: =POWER(D1215/M1215,1/9)-1 -> #VALUE! | O1215: =POWER(D1215/I1215,1/5)-1 -> #VALUE!
A1216: 6113.HK | B1216: UTS Marketing | C1216: 1.1000000000000001 | D1216: 17511801.75 | E1216: 17979485.949999999 | F1216: 35799690.600000001 | G1216: 31020408.899999999 | H1216: 25419200.699999999 | I1216: 28639949.100000001 | J1216: 10148638.5 | K1216: 24722437.199999999 | L1216: 34392870 | M1216: 33177900 | N1216: =POWER(D1216/M1216,1/9)-1 -> -6.8539034394213716e-02 | O1216: =POWER(D1216/I1216,1/5)-1 -> -9.3700546662110362e-02
A1217: 1588.HK | B1217: 畅捷通 | C1217: 3.55 | D1217: 17403271.199999999 | E1217: -239264369.5 | F1217: -228128023.5 | G1217: 39799924.799999997 | H1217: 103277115 | I1217: 121616143.2 | J1217: 269648195.69999999 | K1217: -136250362.5 | L1217: -85401222.849999994 | M1217: 126836556 | N1217: =POWER(D1217/M1217,1/9)-1 -> -0.19803752099457084 | O1217: =POWER(D1217/I1217,1/5)-1 -> -0.32215884676126272
A1218: 8162.HK | B1218: 港银控股 | C1218: 0.37 | D1218: 17375000 | E1218: -22074000 | F1218: -29159000 | G1218: -46856000 | H1218: -34002000 | I1218: -27417000 | J1218: -17923000 | K1218: 2870000 | L1218: -313000 | M1218: 1957000 | N1218: =POWER(D1218/M1218,1/9)-1 -> 0.27458981286456408 | O1218: =POWER(D1218/I1218,1/5)-1 -> -1.9128112338373935
A1219: 0775.HK | B1219: 长江生命科技 | C1219: 0.35 | D1219: 17250000 | E1219: 131963000 | F1219: 162801000 | G1219: 125234000 | H1219: 181735000 | I1219: 263001000 | J1219: 258402000 | K1219: 252960000 | L1219: 218857000 | M1219: 263558000 | N1219: =POWER(D1219/M1219,1/9)-1 -> -0.26135669420720276 | O1219: =POWER(D1219/I1219,1/5)-1 -> -0.42008233255266025
A1220: 8070.HK | B1220: 侨洋国际控股 | C1220: 0.25 | D1220: 17182000 | E1220: 16805000 | F1220: 12233000 | G1220: 1202000 | H1220: -1938000 | I1220: -6929000 | J1220: -6737000 | K1220: -6228000 | L1220: -529000 | M1220: 5026000 | N1220: =POWER(D1220/M1220,1/9)-1 -> 0.14634885989380009 | O1220: =POWER(D1220/I1220,1/5)-1 -> -2.1991696564361423
A1221: 1545.HK | B1221: 设计都会 | C1221: 0.07 | D1221: 17117748 | E1221: 26460703.5 | F1221: 27735894 | G1221: 43475696 | H1221: 35143291 | I1221: 32476752 | J1221: 41248165 | K1221: 22565400 | L1221: 23602162.5 | M1221: -- | N1221: =POWER(D1221/M1221,1/9)-1 -> #VALUE! | O1221: =POWER(D1221/I1221,1/5)-1 -> -0.12021853542242833
A1222: 1762.HK | B1222: 万咖壹联 | C1222: 0.08 | D1222: 16977945.600000001 | E1222: -146130689.69999999 | F1222: 76282676.5 | G1222: 79634414.700000003 | H1222: 118157745 | I1222: -479966582.60000002 | J1222: -173948401 | K1222: -108943616.25 | L1222: -18997911.699999999 | M1222: -- | N1222: =POWER(D1222/M1222,1/9)-1 -> #VALUE! | O1222: =POWER(D1222/I1222,1/5)-1 -> -1.5125483353461637
A1223: 0950.HK | B1223: 李氏大药厂 | C1223: 1.13 | D1223: 16698000 | E1223: 51284000 | F1223: 1987176000 | G1223: 129316000 | H1223: 125553000 | I1223: 418269000 | J1223: 232559000 | K1223: 252002000 | L1223: 229052000 | M1223: 192830000 | N1223: =POWER(D1223/M1223,1/9)-1 -> -0.23802044759773955 | O1223: =POWER(D1223/I1223,1/5)-1 -> -0.47490031744886607
A1224: 0629.HK | B1224: 悦达国际控股 | C1224: 0.25 | D1224: 16653470.4 | E1224: 34455558.299999997 | F1224: 18507093 | G1224: 12513758.1 | H1224: 33722797.5 | I1224: -52961979 | J1224: -30854890.399999999 | K1224: -46032420 | L1224: -192172450.25 | M1224: -279524608.39999998 | N1224: =POWER(D1224/M1224,1/9)-1 -> -1.7309678908923511 | O1224: =POWER(D1224/I1224,1/5)-1 -> -1.7934290711678142
A1225: 8509.HK | B1225: 威扬酒业控股 | C1225: 0.38 | D1225: 16599000 | E1225: 21244000 | F1225: 27605000 | G1225: 11944000 | H1225: 32766000 | I1225: 11579000 | J1225: 3698000 | K1225: 3847000 | L1225: 9172000 | M1225: -- | N1225: =POWER(D1225/M1225,1/9)-1 -> #VALUE! | O1225: =POWER(D1225/I1225,1/5)-1 -> 7.4687442339084864e-02
A1226: 8603.HK | B1226: 亮晴控股 | C1226: 0.49 | D1226: 16369000 | E1226: -8778000 | F1226: -26959000 | G1226: -31858000 | H1226: -222000 | I1226: 15849000 | J1226: 13599000 | K1226: -- | L1226: -- | M1226: -- | N1226: =POWER(D1226/M1226,1/9)-1 -> #VALUE! | O1226: =POWER(D1226/I1226,1/5)-1 -> 6.4774677011636417e-03
A1227: 1451.HK | B1227: 万成集团股份 | C1227: 1 | D1227: 16282000 | E1227: 13805000 | F1227: 15412000 | G1227: 14001000 | H1227: 12619000 | I1227: -3120000 | J1227: 17498000 | K1227: 31374000 | L1227: 49254000 | M1227: 22555000 | N1227: =POWER(D1227/M1227,1/9)-1 -> -3.5562963503423695e-02 | O1227: =POWER(D1227/I1227,1/5)-1 -> -2.3915878596934057
A1228: 1351.HK | B1228: 辉煌明天 | C1228: 0.25 | D1228: 16236914.4 | E1228: -25305539.199999999 | F1228: -21128747.5 | G1228: 80255394.599999994 | H1228: 42949995 | I1228: 48260699.600000001 | J1228: 36998054 | K1228: 2030253.75 | L1228: -- | M1228: -- | N1228: =POWER(D1228/M1228,1/9)-1 -> #VALUE! | O1228: =POWER(D1228/I1228,1/5)-1 -> -0.19576683688967134
A1229: 8223.HK | B1229: 紫元元 | C1229: 2.82 | D1229: 15963960.6 | E1229: 17838645.300000001 | F1229: 6720056 | G1229: 15472053.9 | H1229: 18855577.5 | I1229: 19293577 | J1229: 11467478.5 | K1229: 5797391.25 | L1229: 573912.40000000002 | M1229: -- | N1229: =POWER(D1229/M1229,1/9)-1 -> #VALUE! | O1229: =POWER(D1229/I1229,1/5)-1 -> -3.7178944893022536e-02
A1230: 0815.HK | B1230: 中国白银集团 | C1230: 0.31 | D1230: 15948613.800000001 | E1230: -136236124.59999999 | F1230: -2954626662.5 | G1230: 271159633.80000001 | H1230: -129847912.5 | I1230: 169594470 | J1230: 342868615.39999998 | K1230: 337906677.5 | L1230: -12900092.449999999 | M1230: 309903486 | N1230: =POWER(D1230/M1230,1/9)-1 -> -0.28082771541498108 | O1230: =POWER(D1230/I1230,1/5)-1 -> -0.37675005203372636
A1231: 6669.HK | B1231: 先瑞达医疗-B | C1231: 6.81 | D1231: 15880649.4 | E1231: 79127190.200000003 | F1231: -96829786.5 | G1231: -52255279.799999997 | H1231: -- | I1231: -- | J1231: -- | K1231: -- | L1231: -- | M1231: -- | N1231: =POWER(D1231/M1231,1/9)-1 -> #VALUE! | O1231: =POWER(D1231/I1231,1/5)-1 -> #VALUE!
A1232: 0725.HK | B1232: 恒都集团 | C1232: 0.51 | D1232: 15746000 | E1232: 15848000 | F1232: 13689000 | G1232: -19231000 | H1232: -13198000 | I1232: -1760000 | J1232: 19283000 | K1232: 14622000 | L1232: 11688000 | M1232: 18917000 | N1232: =POWER(D1232/M1232,1/9)-1 -> -2.0179678293333003e-02 | O1232: =POWER(D1232/I1232,1/5)-1 -> -2.5499993493276327
A1233: 0915.HK | B1233: 道和环球 | C1233: 0.07 | D1233: 15450158 | E1233: 7971968 | F1233: 31862628 | G1233: -26957181 | H1233: -120519399 | I1233: -659309440 | J1233: 2266060 | K1233: -4343080 | L1233: 12988162 | M1233: 34545140 | N1233: =POWER(D1233/M1233,1/9)-1 -> -8.5525132596780296e-02 | O1233: =POWER(D1233/I1233,1/5)-1 -> -1.4720290489612791
A1234: 1719.HK | B1234: 中国通商集团 | C1234: 0.73 | D1234: 15360000 | E1234: 20775000 | F1234: 28040000 | G1234: 25860000 | H1234: 34530000 | I1234: 71259000 | J1234: 66795000 | K1234: 68913000 | L1234: 52628000 | M1234: 25590000 | N1234: =POWER(D1234/M1234,1/9)-1 -> -5.5136674816391507e-02 | O1234: =POWER(D1234/I1234,1/5)-1 -> -0.26428383487809859
A1235: 2512.HK | B1235: 云工场 | C1235: 3.59 | D1235: 15262392.6 | E1235: -- | F1235: -- | G1235: -- | H1235: -- | I1235: -- | J1235: -- | K1235: -- | L1235: -- | M1235: -- | N1235: =POWER(D1235/M1235,1/9)-1 -> #VALUE! | O1235: =POWER(D1235/I1235,1/5)-1 -> #VALUE!
A1236: 0412.HK | B1236: 山高控股 | C1236: 5.66 | D1236: 15092000 | E1236: -458067000 | F1236: -314660000 | G1236: -284700000 | H1236: -2095524000 | I1236: 671330000 | J1236: 159356000 | K1236: 71696000 | L1236: -128727000 | M1236: 281025000 | N1236: =POWER(D1236/M1236,1/9)-1 -> -0.27741474802143218 | O1236: =POWER(D1236/I1236,1/5)-1 -> -0.53187466235998881
A1237: 1338.HK | B1237: 霸王集团 | C1237: 0.05 | D1237: 14937917.4 | E1237: -21920111.100000001 | F1237: -11123358 | G1237: -4812892.2000000002 | H1237: -6816750 | I1237: -1361765.6000000001 | J1237: 23051250.300000001 | K1237: 48566070 | L1237: -129865321.25 | M1237: -145326690.30000001 | N1237: =POWER(D1237/M1237,1/9)-1 -> -1.7766334189273414 | O1237: =POWER(D1237/I1237,1/5)-1 -> -2.6144981023996103
A1238: 8052.HK | B1238: 陆庆娱乐 | C1238: 0.05 | D1238: 14899000 | E1238: -32093000 | F1238: -71997000 | G1238: -31759000 | H1238: -30633000 | I1238: 2201000 | J1238: -9275000 | K1238: -6184000 | L1238: 9420000 | M1238: 8792000 | N1238: =POWER(D1238/M1238,1/9)-1 -> 6.0357127788254639e-02 | O1238: =POWER(D1238/I1238,1/5)-1 -> 0.46591036468013947
A1239: 8436.HK | B1239: 德宝集团控股 | C1239: 0.23 | D1239: 14658000 | E1239: 1008000 | F1239: 4377000 | G1239: 18409000 | H1239: 33053000 | I1239: 32249000 | J1239: 5470000 | K1239: 13660000 | L1239: 12883000 | M1239: -- | N1239: =POWER(D1239/M1239,1/9)-1 -> #VALUE! | O1239: =POWER(D1239/I1239,1/5)-1 -> -0.14589415680095752
A1240: 1284.HK | B1240: 新传企划 | C1240: 0.33 | D1240: 14525000 | E1240: 39431000 | F1240: 33049000 | G1240: 41168000 | H1240: -- | I1240: -- | J1240: -- | K1240: -- | L1240: -- | M1240: -- | N1240: =POWER(D1240/M1240,1/9)-1 -> #VALUE! | O1240: =POWER(D1240/I1240,1/5)-1 -> #VALUE!
A1241: 1891.HK | B1241: 兴合控股 | C1241: 0.12 | D1241: 14512449 | E1241: 4221393.9500000002 | F1241: 47627642.25 | G1241: 16195301.199999999 | H1241: 12692479.199999999 | I1241: 46616832.600000001 | J1241: 44082967.5 | K1241: 20848644.600000001 | L1241: 24614823.600000001 | M1241: -- | N1241: =POWER(D1241/M1241,1/9)-1 -> #VALUE! | O1241: =POWER(D1241/I1241,1/5)-1 -> -0.20815607544164194
A1242: 2150.HK | B1242: 奈雪的茶 | C1242: 1.97 | D1242: 14496148.800000001 | E1242: -529447788.69999999 | F1242: -5540257597 | G1242: -240611236.80000001 | H1242: -- | I1242: -- | J1242: -- | K1242: -- | L1242: -- | M1242: -- | N1242: =POWER(D1242/M1242,1/9)-1 -> #VALUE! | O1242: =POWER(D1242/I1242,1/5)-1 -> #VALUE!
A1243: 0626.HK | B1243: 大众金融控股 | C1243: 1.16 | D1243: 14381000 | E1243: 328697000 | F1243: 496461000 | G1243: 396997000 | H1243: 466340000 | I1243: 510478000 | J1243: 503514000 | K1243: 406561000 | L1243: 422955000 | M1243: 384390000 | N1243: =POWER(D1243/M1243,1/9)-1 -> -0.30586117879262131 | O1243: =POWER(D1243/I1243,1/5)-1 -> -0.51026356980299803
A1244: 0334.HK | B1244: 华显光电 | C1244: 0.21 | D1244: 14344873.199999999 | E1244: 190677102.5 | F1244: 236591767.5 | G1244: 29972709.300000001 | H1244: 58610640 | I1244: 93116985.200000003 | J1244: 138753492.59999999 | K1244: 101245987.5 | L1244: -- | M1244: 111966816 | N1244: =POWER(D1244/M1244,1/9)-1 -> -0.20412426300150777 | O1244: =POWER(D1244/I1244,1/5)-1 -> -0.31208692918439451
A1245: 0076.HK | B1245: 谊砾控股 | C1245: 0.41 | D1245: 14176965 | E1245: 4466176 | F1245: 37453794 | G1245: 23057422 | H1245: -72683858 | I1245: 54125106 | J1245: -74834678 | K1245: -244491374 | L1245: -59446335 | M1245: -178550876 | N1245: =POWER(D1245/M1245,1/9)-1 -> -1.7546714495136686 | O1245: =POWER(D1245/I1245,1/5)-1 -> -0.23504321433735909
A1246: 0599.HK | B1246: 怡邦行控股 | C1246: 0.15 | D1246: 14073000 | E1246: 11894000 | F1246: 10769000 | G1246: 11326000 | H1246: 15085000 | I1246: 44194000 | J1246: 42307000 | K1246: 78377000 | L1246: 65910000 | M1246: 9019000 | N1246: =POWER(D1246/M1246,1/9)-1 -> 5.0678417257993491e-02 | O1246: =POWER(D1246/I1246,1/5)-1 -> -0.20456503888913047
A1247: 8472.HK | B1247: 立高控股 | C1247: 0.73 | D1247: 14060000 | E1247: 20326000 | F1247: 5361000 | G1247: 18387000 | H1247: -16115000 | I1247: -11687000 | J1247: -8239000 | K1247: 8789000 | L1247: 15088000 | M1247: 12208000 | N1247: =POWER(D1247/M1247,1/9)-1 -> 1.5817392605994796e-02 | O1247: =POWER(D1247/I1247,1/5)-1 -> -2.0376632962217882
A1248: 2295.HK | B1248: 丰城控股 | C1248: 2.6000000000000001 | D1248: 13942000 | E1248: 14475000 | F1248: 27801000 | G1248: 39350000 | H1248: -- | I1248: -- | J1248: -- | K1248: -- | L1248: -- | M1248: -- | N1248: =POWER(D1248/M1248,1/9)-1 -> #VALUE! | O1248: =POWER(D1248/I1248,1/5)-1 -> #VALUE!
A1249: 2422.HK | B1249: 润歌互动 | C1249: 0.47 | D1249: 13766079.6 | E1249: 77278234.299999997 | F1249: 61206632.5 | G1249: 54563990.100000001 | H1249: -- | I1249: -- | J1249: -- | K1249: -- | L1249: -- | M1249: -- | N1249: =POWER(D1249/M1249,1/9)-1 -> #VALUE! | O1249: =POWER(D1249/I1249,1/5)-1 -> #VALUE!
A1250: 3628.HK | B1250: 仁恒实业控股 | C1250: 0.18 | D1250: 13558000 | E1250: -2363000 | F1250: 721000 | G1250: -783000 | H1250: 703000 | I1250: 9223000 | J1250: -3230000 | K1250: -12987000 | L1250: 1180000 | M1250: 10608000 | N1250: =POWER(D1250/M1250,1/9)-1 -> 2.7638189669083157e-02 | O1250: =POWER(D1250/I1250,1/5)-1 -> 8.0101785956274263e-02
A1251: 0318.HK | B1251: 黄河实业 | C1251: 0.32 | D1251: 13508000 | E1251: 20037000 | F1251: 20238000 | G1251: 10218000 | H1251: 22160000 | I1251: 38776000 | J1251: -4807000 | K1251: 8359000 | L1251: -6663000 | M1251: -34582000 | N1251: =POWER(D1251/M1251,1/9)-1 -> -1.9008197158663291 | O1251: =POWER(D1251/I1251,1/5)-1 -> -0.19014809324983994
A1252: 9998.HK | B1252: 光荣控股 | C1252: 0.12 | D1252: 13435012.5 | E1252: -2206022 | F1252: -35864900 | G1252: -94137378.5 | H1252: 34185327 | I1252: 36034560 | J1252: 29493670 | K1252: 27827761.5 | L1252: -- | M1252: -- | N1252: =POWER(D1252/M1252,1/9)-1 -> #VALUE! | O1252: =POWER(D1252/I1252,1/5)-1 -> -0.17907445439937419
A1253: 0668.HK | B1253: 东银国际控股 | C1253: 0.20000000000000001 | D1253: 13286000 | E1253: -17317000 | F1253: 54185000 | G1253: 114552000 | H1253: -79691000 | I1253: 17053000 | J1253: 24432000 | K1253: -59888000 | L1253: -38014000 | M1253: -29793000 | N1253: =POWER(D1253/M1253,1/9)-1 -> -1.914178729902845 | O1253: =POWER(D1253/I1253,1/5)-1 -> -4.8697383586372989e-02
A1254: 1094.HK | B1254: 承辉国际 | C1254: 0.21 | D1254: 13282000 | E1254: -- | F1254: -- | G1254: 1643000 | H1254: -14174000 | I1254: -24402000 | J1254: -176395000 | K1254: -208224000 | L1254: -1073902000 | M1254: -665164000 | N1254: =POWER(D1254/M1254,1/9)-1 -> -1.6473636420109217 | O1254: =POWER(D1254/I1254,1/5)-1 -> -1.8854572752593357
A1255: 1218.HK | B1255: 永义国际 | C1255: 2.77 | D1255: 13280000 | E1255: 979437000 | F1255: 22308000 | G1255: -297755000 | H1255: 315959000 | I1255: 297163000 | J1255: -243846000 | K1255: 138936000 | L1255: 202867000 | M1255: 13036000 | N1255: =POWER(D1255/M1255,1/9)-1 -> 2.0626112702175625e-03 | O1255: =POWER(D1255/I1255,1/5)-1 -> -0.46291791256659565
A1256: 0422.HK | B1256: 越南制造加工出口 | C1256: 0.58 | D1256: 13170892.58 | E1256: -1564301.5700000001 | F1256: -43423490.520000003 | G1256: -56487148.530000001 | H1256: -137006479.25999999 | I1256: -327795500.27999997 | J1256: -72921951.450000003 | K1256: -5793183.9900000002 | L1256: -62195910.130000003 | M1256: -80523854.569999993 | N1256: =POWER(D1256/M1256,1/9)-1 -> -1.8177721095030708 | O1256: =POWER(D1256/I1256,1/5)-1 -> -1.5257780410979107
A1257: 8423.HK | B1257: CHI HO DEV | C1257: 0.06 | D1257: 13148000 | E1257: 8022000 | F1257: 21443000 | G1257: 19514000 | H1257: 18156000 | I1257: 23139000 | J1257: 12523000 | K1257: 14997000 | L1257: 7777000 | M1257: -- | N1257: =POWER(D1257/M1257,1/9)-1 -> #VALUE! | O1257: =POWER(D1257/I1257,1/5)-1 -> -0.10689396947488083
A1258: 1771.HK | B1258: 新丰泰集团 | C1258: 0.58 | D1258: 13007509.199999999 | E1258: 91675046.5 | F1258: 423494549.5 | G1258: 173050769.09999999 | H1258: 134020657.5 | I1258: 242706253.19999999 | J1258: 176615953.5 | K1258: 52076508.75 | L1258: 30478511.800000001 | M1258: 215100523 | N1258: =POWER(D1258/M1258,1/9)-1 -> -0.26782151347458627 | O1258: =POWER(D1258/I1258,1/5)-1 -> -0.44304175792800393
A1259: 1222.HK | B1259: 宏安集团 | C1259: 0.03 | D1259: 12784000 | E1259: -305226000 | F1259: 123884000 | G1259: 474860000 | H1259: 419782000 | I1259: 1223444000 | J1259: 423690000 | K1259: 449077000 | L1259: 588188000 | M1259: 593521000 | N1259: =POWER(D1259/M1259,1/9)-1 -> -0.34716503289987144 | O1259: =POWER(D1259/I1259,1/5)-1 -> -0.59837888889594359
A1260: 1496.HK | B1260: 亚积邦租赁 | C1260: 0.12 | D1260: 12776000 | E1260: -4455000 | F1260: -5684000 | G1260: -19679000 | H1260: -2523000 | I1260: 21081000 | J1260: 11971000 | K1260: 20923000 | L1260: 42925000 | M1260: 40125424 | N1260: =POWER(D1260/M1260,1/9)-1 -> -0.11940740351704793 | O1260: =POWER(D1260/I1260,1/5)-1 -> -9.530802288261242e-02
A1261: 9923.HK | B1261: 移卡 | C1261: 10.96 | D1261: 12745517.4 | E1261: 173639408.19999999 | F1261: 515433683 | G1261: 523133253.30000001 | H1261: 94610902.5 | I1261: -208129248.40000001 | J1261: -410052573.60000002 | K1261: -202416410 | L1261: -- | M1261: -- | N1261: =POWER(D1261/M1261,1/9)-1 -> #VALUE! | O1261: =POWER(D1261/I1261,1/5)-1 -> -1.5720116458176387
A1262: 0351.HK | B1262: 亚洲能源物流 | C1262: 0.13 | D1262: 12676000 | E1262: -56664000 | F1262: -53799000 | G1262: 111222000 | H1262: -3059000 | I1262: -138559000 | J1262: -62004000 | K1262: -267385000 | L1262: -297864000 | M1262: -184812000 | N1262: =POWER(D1262/M1262,1/9)-1 -> -1.7424969495202469 | O1262: =POWER(D1262/I1262,1/5)-1 -> -1.6198255836745725
A1263: 1546.HK | B1263: 德莱建业 | C1263: 0.10000000000000001 | D1263: 12660000 | E1263: 4264000 | F1263: 21123000 | G1263: 12756000 | H1263: 37508000 | I1263: 61218000 | J1263: 24967000 | K1263: 2860000 | L1263: 17796000 | M1263: 12346000 | N1263: =POWER(D1263/M1263,1/9)-1 -> 2.7944853980506057e-03 | O1263: =POWER(D1263/I1263,1/5)-1 -> -0.27035617104179266
A1264: 8081.HK | B1264: 恒泰裕集团 | C1264: 0.05 | D1264: 12644000 | E1264: 11205000 | F1264: 55699000 | G1264: -72697000 | H1264: -127582000 | I1264: -144945000 | J1264: -260665000 | K1264: -344617000 | L1264: 63951000 | M1264: -26189000 | N1264: =POWER(D1264/M1264,1/9)-1 -> -1.9222801069966451 | O1264: =POWER(D1264/I1264,1/5)-1 -> -1.6139545888159996
A1265: 2486.HK | B1265: 普乐师集团控股 | C1265: 3.6000000000000001 | D1265: 12608492.4 | E1265: 59453126.200000003 | F1265: 71834068 | G1265: 64212420.600000001 | H1265: -- | I1265: -- | J1265: -- | K1265: -- | L1265: -- | M1265: -- | N1265: =POWER(D1265/M1265,1/9)-1 -> #VALUE! | O1265: =POWER(D1265/I1265,1/5)-1 -> #VALUE!
A1266: 0648.HK | B1266: 京玖康疗 | C1266: 0.38 | D1266: 12511000 | E1266: -19225000 | F1266: -26275000 | G1266: -50846000 | H1266: -- | I1266: -- | J1266: -133721000 | K1266: -311388000 | L1266: -436503000 | M1266: -61138000 | N1266: =POWER(D1266/M1266,1/9)-1 -> -1.8383827051000434 | O1266: =POWER(D1266/I1266,1/5)-1 -> #VALUE!
A1267: 2025.HK | B1267: 瑞丰动力 | C1267: 1.68 | D1267: 12351981.6 | E1267: 23026777.199999999 | F1267: 44779965 | G1267: 40047840 | H1267: 33653512.5 | I1267: 116534571.40000001 | J1267: 113653322.2 | K1267: 104151906.25 | L1267: 86351471.25 | M1267: 79616020 | N1267: =POWER(D1267/M1267,1/9)-1 -> -0.18701637729813902 | O1267: =POWER(D1267/I1267,1/5)-1 -> -0.36165366309404279
A1268: 0093.HK | B1268: 零在科技金融 | C1268: 0.59 | D1268: 12136000 | E1268: 15189000 | F1268: 21267000 | G1268: -26983000 | H1268: -19880000 | I1268: 83193000 | J1268: -132387000 | K1268: -396081000 | L1268: -149548000 | M1268: 43550000 | N1268: =POWER(D1268/M1268,1/9)-1 -> -0.13235304816879889 | O1268: =POWER(D1268/I1268,1/5)-1 -> -0.31954759021566936
A1269: 1897.HK | B1269: 美亨实业 | C1269: 0.42 | D1269: 12106000 | E1269: 24625000 | F1269: 38940000 | G1269: 24240000 | H1269: 22882000 | I1269: 50112000 | J1269: 55337000 | K1269: 31264000 | L1269: -- | M1269: -- | N1269: =POWER(D1269/M1269,1/9)-1 -> #VALUE! | O1269: =POWER(D1269/I1269,1/5)-1 -> -0.24731755549768142
A1270: 2051.HK | B1270: 51信用卡 | C1270: 0.25 | D1270: 12098759.4 | E1270: -93290485.700000003 | F1270: -286149731.5 | G1270: -2025122724.9000001 | H1270: -1261521165 | I1270: 2461748842.4000001 | J1270: -1644015603 | K1270: -2479689922.5 | L1270: -815358993.14999998 | M1270: -- | N1270: =POWER(D1270/M1270,1/9)-1 -> #VALUE! | O1270: =POWER(D1270/I1270,1/5)-1 -> -0.65461822303912687
A1271: 1572.HK | B1271: 中国艺术金融 | C1271: 0.13 | D1271: 12079027.800000001 | E1271: 16465747.6 | F1271: 31056993.5 | G1271: 52325601.899999999 | H1271: 120161422.5 | I1271: 156314978.19999999 | J1271: 192586500.40000001 | K1271: 99919155 | L1271: 55102646.700000003 | M1271: 32321857.899999999 | N1271: =POWER(D1271/M1271,1/9)-1 -> -0.10359563490947532 | O1271: =POWER(D1271/I1271,1/5)-1 -> -0.40075243596748489
A1272: 1662.HK | B1272: 义合控股 | C1272: 1.67 | D1272: 12079000 | E1272: 39512000 | F1272: 49317000 | G1272: 24580000 | H1272: 41057000 | I1272: 30152000 | J1272: 22534000 | K1272: 94294000 | L1272: 86001000 | M1272: 24332000 | N1272: =POWER(D1272/M1272,1/9)-1 -> -7.4863303226818889e-02 | O1272: =POWER(D1272/I1272,1/5)-1 -> -0.16719567608031594
A1273: 1427.HK | B1273: 中国天保集团 | C1273: 0.23 | D1273: 12047238 | E1273: -391841022.60000002 | F1273: 51193896 | G1273: 395318664.89999998 | H1273: 355040925 | I1273: 123204490.2 | J1273: 71286594 | K1273: 41264046.25 | L1273: -- | M1273: -- | N1273: =POWER(D1273/M1273,1/9)-1 -> #VALUE! | O1273: =POWER(D1273/I1273,1/5)-1 -> -0.37186616047851051
A1274: 2263.HK | B1274: 富石金融 | C1274: 0.17 | D1274: 12006000 | E1274: 12808000 | F1274: 10688000 | G1274: 13603000 | H1274: 37781000 | I1274: 33029000 | J1274: 13629000 | K1274: -- | L1274: -- | M1274: -- | N1274: =POWER(D1274/M1274,1/9)-1 -> #VALUE! | O1274: =POWER(D1274/I1274,1/5)-1 -> -0.18322848588504959
A1275: 1732.HK | B1275: 象兴国际 | C1275: 0.15 | D1275: 11989139.4 | E1275: 11525797.699999999 | F1275: 13047047.5 | G1275: 17170511.399999999 | H1275: 12925005 | I1275: 30661359.399999999 | J1275: 12659185.1 | K1275: 4523898.75 | L1275: 11572332 | M1275: 18035898.699999999 | N1275: =POWER(D1275/M1275,1/9)-1 -> -4.4359670943418861e-02 | O1275: =POWER(D1275/I1275,1/5)-1 -> -0.17121988814225442
A1276: 1971.HK | B1276: 弘阳服务 | C1276: 0.55 | D1276: 11910213 | E1276: 103773919 | F1276: 156680897.5 | G1276: 83136216.900000006 | H1276: 66000667.5 | I1276: 37563552.600000001 | J1276: 34422816.799999997 | K1276: -- | L1276: -- | M1276: -- | N1276: =POWER(D1276/M1276,1/9)-1 -> #VALUE! | O1276: =POWER(D1276/I1276,1/5)-1 -> -0.20524993184817464
A1277: 1630.HK | B1277: 建成控股 | C1277: 0.02 | D1277: 11887000 | E1277: -12497000 | F1277: 2631000 | G1277: -10831000 | H1277: -19319000 | I1277: 27280000 | J1277: 67571000 | K1277: 46155000 | L1277: 29732000 | M1277: 8744000 | N1277: =POWER(D1277/M1277,1/9)-1 -> 3.4708490146730941e-02 | O1277: =POWER(D1277/I1277,1/5)-1 -> -0.15307377816486534
A1278: 1631.HK | B1278: REF Holdings | C1278: 0.19 | D1278: 11714000 | E1278: 11162000 | F1278: 8628000 | G1278: 18266000 | H1278: 33538000 | I1278: 36739000 | J1278: 64383000 | K1278: 45619000 | L1278: 28672000 | M1278: 25563000 | N1278: =POWER(D1278/M1278,1/9)-1 -> -8.3054103983187244e-02 | O1278: =POWER(D1278/I1278,1/5)-1 -> -0.20436188880445394
A1279: 2207.HK | B1279: 融信服务 | C1279: 0.84 | D1279: 11683299.6 | E1279: 17517136.800000001 | F1279: 137633800 | G1279: 98344860.900000006 | H1279: -- | I1279: -- | J1279: -- | K1279: -- | L1279: -- | M1279: -- | N1279: =POWER(D1279/M1279,1/9)-1 -> #VALUE! | O1279: =POWER(D1279/I1279,1/5)-1 -> #VALUE!
A1280: 6888.HK | B1280: 英达公路再生科技 | C1280: 0.16 | D1280: 11677000 | E1280: -32477000 | F1280: 31948000 | G1280: 31636000 | H1280: 4145000 | I1280: -139130000 | J1280: -265004000 | K1280: 43138000 | L1280: 64502000 | M1280: 58497000 | N1280: =POWER(D1280/M1280,1/9)-1 -> -0.16392702169688855 | O1280: =POWER(D1280/I1280,1/5)-1 -> -1.6092311476138585
A1281: 1459.HK | B1281: 巨匠建设 | C1281: 0.31 | D1281: 11584641.6 | E1281: 61893206.5 | F1281: 114883814.5 | G1281: 137486856.90000001 | H1281: 149425395 | I1281: 194809905.59999999 | J1281: 148414228.80000001 | K1281: 99661345 | L1281: 115860917.84999999 | M1281: 102889355 | N1281: =POWER(D1281/M1281,1/9)-1 -> -0.21546474947927152 | O1281: =POWER(D1281/I1281,1/5)-1 -> -0.43133786231029869
A1282: 3728.HK | B1282: 正利控股 | C1282: 0.08 | D1282: 11559000 | E1282: -18161000 | F1282: 11538000 | G1282: 12170000 | H1282: 11026000 | I1282: 19702000 | J1282: 25451000 | K1282: 21116000 | L1282: 18478000 | M1282: 9420000 | N1282: =POWER(D1282/M1282,1/9)-1 -> 2.2997031371798204e-02 | O1282: =POWER(D1282/I1282,1/5)-1 -> -0.10116083047911861
A1283: 0383.HK | B1283: 天安卓健 | C1283: 0.75 | D1283: 11295000 | E1283: -123574000 | F1283: -137296000 | G1283: -111928000 | H1283: -- | I1283: -137110000 | J1283: -71813000 | K1283: -783160000 | L1283: 228443000 | M1283: 927908000 | N1283: =POWER(D1283/M1283,1/9)-1 -> -0.38727642467261547 | O1283: =POWER(D1283/I1283,1/5)-1 -> -1.6069646816599219
A1284: 0387.HK | B1284: 力丰(集团) | C1284: 0.86 | D1284: 11288000 | E1284: 8317000 | F1284: -38984000 | G1284: 4451000 | H1284: -43413000 | I1284: 19210000 | J1284: 28031000 | K1284: 23673000 | L1284: 21458000 | M1284: 22565000 | N1284: =POWER(D1284/M1284,1/9)-1 -> -7.4075149022348907e-02 | O1284: =POWER(D1284/I1284,1/5)-1 -> -0.10087944315131314
A1285: 8146.HK | B1285: 怡园酒业 | C1285: 0.10000000000000001 | D1285: 11203164 | E1285: -674603.80000000005 | F1285: 9477630 | G1285: -669847.80000000005 | H1285: 33525 | I1285: 7019469 | J1285: 1335574.6000000001 | K1285: 12540456.25 | L1285: 21589925.899999999 | M1285: -- | N1285: =POWER(D1285/M1285,1/9)-1 -> #VALUE! | O1285: =POWER(D1285/I1285,1/5)-1 -> 9.8012506031563085e-02
A1286: 2187.HK | B1286: 智欣集团控股 | C1286: 0.76 | D1286: 11047503.6 | E1286: 1413509.3 | F1286: 24977351 | G1286: 74640353.700000003 | H1286: -- | I1286: -- | J1286: -- | K1286: -- | L1286: -- | M1286: -- | N1286: =POWER(D1286/M1286,1/9)-1 -> #VALUE! | O1286: =POWER(D1286/I1286,1/5)-1 -> #VALUE!
A1287: 1460.HK | B1287: 扬科集团 | C1287: 0.16 | D1287: 10966000 | E1287: 8122000 | F1287: 8099000 | G1287: 70086000 | H1287: 83920000 | I1287: -11169000 | J1287: 30445000 | K1287: 28817000 | L1287: 20067000 | M1287: -1590000 | N1287: =POWER(D1287/M1287,1/9)-1 -> -2.23931999749946 | O1287: =POWER(D1287/I1287,1/5)-1 -> -1.9963382194147363
A1288: 8462.HK | B1288: 中安控股集团 | C1288: 0.08 | D1288: 10908717 | E1288: 5445907.5 | F1288: 8590968 | G1288: 1360448 | H1288: -7049477 | I1288: -14377968 | J1288: -7516670 | K1288: 7630837.5 | L1288: 11063685 | M1288: 11239480 | N1288: =POWER(D1288/M1288,1/9)-1 -> -3.3134301734998317e-03 | O1288: =POWER(D1288/I1288,1/5)-1 -> -1.9462703503871381
A1289: 1843.HK | B1289: 快餐帝国 | C1289: 0.15 | D1289: 10898580.5 | E1289: 16369878 | F1289: 5993931 | G1289: 19357194 | H1289: 13109692 | I1289: 18712984.5 | J1289: 17441720 | K1289: 19132515 | L1289: -- | M1289: -- | N1289: =POWER(D1289/M1289,1/9)-1 -> #VALUE! | O1289: =POWER(D1289/I1289,1/5)-1 -> -0.10247743597381487
A1290: 1633.HK | B1290: 上谕集团 | C1290: 0.10000000000000001 | D1290: 10836000 | E1290: 11192000 | F1290: -14475000 | G1290: 1331000 | H1290: -45321000 | I1290: -25716000 | J1290: 36445000 | K1290: 39951000 | L1290: 11182000 | M1290: 43733000 | N1290: =POWER(D1290/M1290,1/9)-1 -> -0.1436066172096927 | O1290: =POWER(D1290/I1290,1/5)-1 -> -1.8412655713551045
A1291: 0893.HK | B1291: 中国铁钛 | C1291: 0.06 | D1291: 10629851.4 | E1291: 1471042.3999999999 | F1291: 10176819.5 | G1291: -20326662.600000001 | H1291: 77329882.5 | I1291: -505503103.39999998 | J1291: -419003561 | K1291: -859820797.5 | L1291: -1300145619.95 | M1291: -457206849.89999998 | N1291: =POWER(D1291/M1291,1/9)-1 -> -1.6584010216498677 | O1291: =POWER(D1291/I1291,1/5)-1 -> -1.4619135193614547
A1292: 1552.HK | B1292: BHCC Holding | C1292: 0.14 | D1292: 10610103.449999999 | E1292: -51217793.170000002 | F1292: 5229936.5199999996 | G1292: 16299621.310000001 | H1292: 315688.19 | I1292: 18061633.260000002 | J1292: 30483749.98 | K1292: 41320379.100000001 | L1292: 38400817.07 | M1292: 19634322.620000001 | N1292: =POWER(D1292/M1292,1/9)-1 -> -6.6099924273498645e-02 | O1292: =POWER(D1292/I1292,1/5)-1 -> -0.10093204269571765
A1293: 0635.HK | B1293: 彩星集团 | C1293: 0.56 | D1293: 10340000 | E1293: -212779000 | F1293: -49430000 | G1293: -507600000 | H1293: 416717000 | I1293: 520625000 | J1293: 282196000 | K1293: -110132000 | L1293: 413718000 | M1293: 757665000 | N1293: =POWER(D1293/M1293,1/9)-1 -> -0.37944169765470703 | O1293: =POWER(D1293/I1293,1/5)-1 -> -0.5433335525059213
A1294: 8313.HK | B1294: 杰地集团 | C1294: 0.02 | D1294: 10281303 | E1294: -15766921.5 | F1294: 43076083.5 | G1294: -118822232 | H1294: 26729026 | I1294: 6207102 | J1294: 38752350 | K1294: 19235287.5 | L1294: 32818245 | M1294: -- | N1294: =POWER(D1294/M1294,1/9)-1 -> #VALUE! | O1294: =POWER(D1294/I1294,1/5)-1 -> 0.10619541806701149
A1295: 8149.HK | B1295: 浩德控股 | C1295: 0.11 | D1295: 9878000 | E1295: 6980000 | F1295: 6294000 | G1295: 494000 | H1295: 29746000 | I1295: 26295000 | J1295: 12356000 | K1295: 17331000 | L1295: 15761000 | M1295: -- | N1295: =POWER(D1295/M1295,1/9)-1 -> #VALUE! | O1295: =POWER(D1295/I1295,1/5)-1 -> -0.17783465044995517
A1296: 6877.HK | B1296: Clsa Premium | C1296: 0.12 | D1296: 9842000 | E1296: -31052000 | F1296: -56542000 | G1296: -71636000 | H1296: -179988000 | I1296: 34249000 | J1296: 27354000 | K1296: 38688000 | L1296: 94709000 | M1296: 35081000 | N1296: =POWER(D1296/M1296,1/9)-1 -> -0.13170373500230781 | O1296: =POWER(D1296/I1296,1/5)-1 -> -0.22073155073931727
A1297: 6080.HK | B1297: 荣智控股 | C1297: 0.04 | D1297: 9823000 | E1297: 4368000 | F1297: -46355000 | G1297: -13722000 | H1297: -34507000 | I1297: 11989000 | J1297: 23383000 | K1297: 21305000 | L1297: 11819000 | M1297: -- | N1297: =POWER(D1297/M1297,1/9)-1 -> #VALUE! | O1297: =POWER(D1297/I1297,1/5)-1 -> -3.9068927746478188e-02
A1298: 1701.HK | B1298: 途屹控股 | C1298: 0.13 | D1298: 9779200.1999999993 | E1298: -20826982.199999999 | F1298: -49702455 | G1298: -53983534.799999997 | H1298: 28623645 | I1298: 7963368.4000000004 | J1298: 25942997.100000001 | K1298: 16942117.5 | L1298: 19407177.100000001 | M1298: -- | N1298: =POWER(D1298/M1298,1/9)-1 -> #VALUE! | O1298: =POWER(D1298/I1298,1/5)-1 -> 4.1936629306319917e-02
A1299: 1059.HK | B1299: 看通集团 | C1299: 0.39 | D1299: 9694000 | E1299: 4558000 | F1299: 5689000 | G1299: 3875000 | H1299: 2437000 | I1299: -1643888000 | J1299: -1756580000 | K1299: -11764000 | L1299: 8927000 | M1299: 2148000 | N1299: =POWER(D1299/M1299,1/9)-1 -> 0.1822756600820421 | O1299: =POWER(D1299/I1299,1/5)-1 -> -1.3582004755055204
A1300: 8432.HK | B1300: 太平洋酒吧 | C1300: 0.05 | D1300: 9674000 | E1300: -10262000 | F1300: -36907000 | G1300: 4429000 | H1300: 7298000 | I1300: 5698000 | J1300: -4275000 | K1300: 9450000 | L1300: 7273000 | M1300: -- | N1300: =POWER(D1300/M1300,1/9)-1 -> #VALUE! | O1300: =POWER(D1300/I1300,1/5)-1 -> 0.11167215494023708
A1301: 2131.HK | B1301: 云想科技 | C1301: 0.56 | D1301: 9642175.1999999993 | E1301: -200866101.69999999 | F1301: 143755075.5 | G1301: 123490375.2 | H1301: 81503745 | I1301: 79113343.799999997 | J1301: 39561302.200000003 | K1301: -- | L1301: -- | M1301: -- | N1301: =POWER(D1301/M1301,1/9)-1 -> #VALUE! | O1301: =POWER(D1301/I1301,1/5)-1 -> -0.34357508661550562
A1302: 1759.HK | B1302: 中油洁能控股 | C1302: 0.67 | D1302: 9638886.5999999996 | E1302: 12494835.6 | F1302: 11833568 | G1302: 15050121.300000001 | H1302: 24635287.5 | I1302: 42850072.399999999 | J1302: 98609525 | K1302: 89803446.25 | L1302: 71628501.299999997 | M1302: -- | N1302: =POWER(D1302/M1302,1/9)-1 -> #VALUE! | O1302: =POWER(D1302/I1302,1/5)-1 -> -0.25798093800617738
A1303: 8128.HK | B1303: 中国恒有源集团 | C1303: 0.05 | D1303: 9475000 | E1303: -134332000 | F1303: -97329000 | G1303: -242399000 | H1303: -441039000 | I1303: -410297000 | J1303: 10533000 | K1303: -30816000 | L1303: -47506000 | M1303: -53506000 | N1303: =POWER(D1303/M1303,1/9)-1 -> -1.8250192490924031 | O1303: =POWER(D1303/I1303,1/5)-1 -> -1.4706479543914996
A1304: 8115.HK | B1304: 上海青浦消防 | C1304: 0.83 | D1304: 9340720.1999999993 | E1304: 6301566.5999999996 | F1304: 73163875 | G1304: -1672235.7 | H1304: -11732632.5 | I1304: -3864408.3999999999 | J1304: -275747 | K1304: 352266.25 | L1304: -1258373.5 | M1304: 9152098.5999999996 | N1304: =POWER(D1304/M1304,1/9)-1 -> 2.269254234921636e-03 | O1304: =POWER(D1304/I1304,1/5)-1 -> -2.1930522637427807
A1305: 1362.HK | B1305: 新龙移动 | C1305: 0.37 | D1305: 9010000 | E1305: 21452000 | F1305: 33286000 | G1305: 10830000 | H1305: -5003000 | I1305: 97000 | J1305: 1320000 | K1305: -7724000 | L1305: 641000 | M1305: -15775000 | N1305: =POWER(D1305/M1305,1/9)-1 -> -1.9396645108668893 | O1305: =POWER(D1305/I1305,1/5)-1 -> 1.4750878105955683
A1306: 8350.HK | B1306: 立桥证券控股 | C1306: 0.17 | D1306: 8909000 | E1306: -12740000 | F1306: -20167000 | G1306: -21748000 | H1306: -16535000 | I1306: 19483000 | J1306: -971000 | K1306: 11042000 | L1306: 17751000 | M1306: -- | N1306: =POWER(D1306/M1306,1/9)-1 -> #VALUE! | O1306: =POWER(D1306/I1306,1/5)-1 -> -0.14486511114398548
A1307: 1621.HK | B1307: 域高国际控股 | C1307: 0.07 | D1307: 8796000 | E1307: 9169000 | F1307: 18340000 | G1307: 16012000 | H1307: 17988000 | I1307: 6816000 | J1307: 20983000 | K1307: 22219000 | L1307: 9475000 | M1307: -- | N1307: =POWER(D1307/M1307,1/9)-1 -> #VALUE! | O1307: =POWER(D1307/I1307,1/5)-1 -> 5.2328004041809928e-02
A1308: 1466.HK | B1308: 钱唐控股 | C1308: 0.59999999999999998 | D1308: 8726000 | E1308: -15462000 | F1308: -51785000 | G1308: -281822000 | H1308: -42816000 | I1308: -129787000 | J1308: -23886000 | K1308: -10940000 | L1308: 10056000 | M1308: 29596000 | N1308: =POWER(D1308/M1308,1/9)-1 -> -0.12689859361651867 | O1308: =POWER(D1308/I1308,1/5)-1 -> -1.582796322874144
A1309: 1737.HK | B1309: 亚洲实业集团 | C1309: 0.13 | D1309: 8586000 | E1309: 32518000 | F1309: 40522000 | G1309: -8852000 | H1309: 468000 | I1309: 12139000 | J1309: 34213000 | K1309: 19114000 | L1309: 18463000 | M1309: -- | N1309: =POWER(D1309/M1309,1/9)-1 -> #VALUE! | O1309: =POWER(D1309/I1309,1/5)-1 -> -6.6914169277650926e-02
A1310: 3678.HK | B1310: 弘业期货 | C1310: 1.18 | D1310: 8541038.2599999998 | E1310: 13968031.66 | F1310: 98218946.819999993 | G1310: 79049734.420000002 | H1310: 23765196.539999999 | I1310: 91673364.549999997 | J1310: 122004859.59999999 | K1310: 87680958.75 | L1310: 82523428.5 | M1310: 72632771.599999994 | N1310: =POWER(D1310/M1310,1/9)-1 -> -0.21166887770983278 | O1310: =POWER(D1310/I1310,1/5)-1 -> -0.37790960021273856
A1311: 2683.HK | B1311: 华新手袋国际控股 | C1311: 0.41 | D1311: 8495000 | E1311: 39544000 | F1311: 5562000 | G1311: 11086000 | H1311: 40670000 | I1311: 45578000 | J1311: 54931000 | K1311: 48133000 | L1311: 7244000 | M1311: -- | N1311: =POWER(D1311/M1311,1/9)-1 -> #VALUE! | O1311: =POWER(D1311/I1311,1/5)-1 -> -0.28536937471379609
A1312: 1720.HK | B1312: 普天通信集团 | C1312: 0.05 | D1312: 8383737.5999999996 | E1312: 27841508 | F1312: 53881673.5 | G1312: 38488834.799999997 | H1312: 74595360 | I1312: 96773029.799999997 | J1312: 69597343.900000006 | K1312: 57898347.5 | L1312: 40418486.399999999 | M1312: 22197645.199999999 | N1312: =POWER(D1312/M1312,1/9)-1 -> -0.10254117976812538 | O1312: =POWER(D1312/I1312,1/5)-1 -> -0.38689244499759812
A1313: 1376.HK | B1313: RafflesInterior | C1313: 0.22 | D1313: 8304357 | E1313: -7938793.5 | F1313: -6454773 | G1313: -93524936 | H1313: 26821554 | I1313: 36978480 | J1313: 46327470 | K1313: 30920175 | L1313: -- | M1313: -- | N1313: =POWER(D1313/M1313,1/9)-1 -> #VALUE! | O1313: =POWER(D1313/I1313,1/5)-1 -> -0.25822636834830803
A1314: 8341.HK | B1314: 艾硕控股 | C1314: 0.15 | D1314: 8261000 | E1314: 8162000 | F1314: -5654000 | G1314: -27422000 | H1314: -12439000 | I1314: -35245000 | J1314: -26739000 | K1314: 13722000 | L1314: 4748000 | M1314: -- | N1314: =POWER(D1314/M1314,1/9)-1 -> #VALUE! | O1314: =POWER(D1314/I1314,1/5)-1 -> -1.7481471423893846
A1315: 8083.HK | B1315: 中国有赞 | C1315: 0.07 | D1315: 8143669.7999999998 | E1315: -341914700.89999998 | F1315: -3072880301 | G1315: -351218364.89999998 | H1315: -1023148357.5 | I1315: -826517710.20000005 | J1315: -112192000 | K1315: -214422000 | L1315: -153818000 | M1315: -122724000 | N1315: =POWER(D1315/M1315,1/9)-1 -> -1.739773826210929 | O1315: =POWER(D1315/I1315,1/5)-1 -> -1.3969297023119316
A1316: 1869.HK | B1316: 猫屎咖啡控股 | C1316: 0.20000000000000001 | D1316: 7987000 | E1316: -41352000 | F1316: -92430000 | G1316: -39817000 | H1316: -59341000 | I1316: 2262000 | J1316: 23188000 | K1316: 11348000 | L1316: 3652000 | M1316: 16432000 | N1316: =POWER(D1316/M1316,1/9)-1 -> -7.7028821039039519e-02 | O1316: =POWER(D1316/I1316,1/5)-1 -> 0.28699902166708391
A1317: 6829.HK | B1317: 龙升集团控股 | C1317: 0.08 | D1317: 7923000 | E1317: 7431000 | F1317: -20110000 | G1317: -20097000 | H1317: 9833000 | I1317: 51028000 | J1317: 47337000 | K1317: 44019000 | L1317: 13777000 | M1317: -- | N1317: =POWER(D1317/M1317,1/9)-1 -> #VALUE! | O1317: =POWER(D1317/I1317,1/5)-1 -> -0.31100475957496576
A1318: 8226.HK | B1318: 树熊金融集团 | C1318: 0.14 | D1318: 7745000 | E1318: -59423000 | F1318: 80777000 | G1318: 4264000 | H1318: 9046000 | I1318: 11625000 | J1318: -9741000 | K1318: -71897000 | L1318: -234190000 | M1318: -16695000 | N1318: =POWER(D1318/M1318,1/9)-1 -> -1.9181998597170424 | O1318: =POWER(D1318/I1318,1/5)-1 -> -7.8011100901107078e-02
A1319: 8281.HK | B1319: 中国金典集团 | C1319: 0.13 | D1319: 7740268.2000000002 | E1319: 13708671.199999999 | F1319: 15728702.5 | G1319: 21642520.199999999 | H1319: 10721295 | I1319: 1861611 | J1319: 3300571.7000000002 | K1319: 11781472.5 | L1319: 33116391.949999999 | M1319: 21398989.199999999 | N1319: =POWER(D1319/M1319,1/9)-1 -> -0.10684014525782004 | O1319: =POWER(D1319/I1319,1/5)-1 -> 0.32976045801387199
A1320: 8483.HK | B1320: 名仕快相 | C1320: 0.07 | D1320: 7658000 | E1320: -11518000 | F1320: -7408000 | G1320: -4478000 | H1320: -4946000 | I1320: 1780000 | J1320: -3486000 | K1320: 5976000 | L1320: 5969000 | M1320: -- | N1320: =POWER(D1320/M1320,1/9)-1 -> #VALUE! | O1320: =POWER(D1320/I1320,1/5)-1 -> 0.33887203927878229
A1321: 8372.HK | B1321: 君百延集团 | C1321: 0.10000000000000001 | D1321: 7562000 | E1321: 4048000 | F1321: 7859000 | G1321: 9566000 | H1321: 6608000 | I1321: -3080000 | J1321: 11802000 | K1321: 12979000 | L1321: -- | M1321: -- | N1321: =POWER(D1321/M1321,1/9)-1 -> #VALUE! | O1321: =POWER(D1321/I1321,1/5)-1 -> -2.1967879045523455
A1322: 0876.HK | B1322: 佳兆业健康 | C1322: 0.02 | D1322: 7468000 | E1322: -123318000 | F1322: 2359000 | G1322: -39692000 | H1322: -354673000 | I1322: -22039000 | J1322: 3911000 | K1322: -15188000 | L1322: -30613000 | M1322: -90005000 | N1322: =POWER(D1322/M1322,1/9)-1 -> -1.7583714302373301 | O1322: =POWER(D1322/I1322,1/5)-1 -> -1.8053830492948744
A1323: 6860.HK | B1323: 指尖悦动 | C1323: 0.08 | D1323: 7425658.7999999998 | E1323: -157205247.40000001 | F1323: -633555075.5 | G1323: 152132924.09999999 | H1323: 43260660 | I1323: 177160467 | J1323: 288685528.80000001 | K1323: 240663412.5 | L1323: 3989161.6000000001 | M1323: -- | N1323: =POWER(D1323/M1323,1/9)-1 -> #VALUE! | O1323: =POWER(D1323/I1323,1/5)-1 -> -0.46975859839795664
A1324: 1690.HK | B1324: 立基工程控股 | C1324: 0.08 | D1324: 7424000 | E1324: 11498000 | F1324: 10708000 | G1324: -1764000 | H1324: -31708000 | I1324: 17817000 | J1324: 27274000 | K1324: 26964000 | L1324: 14514000 | M1324: 24253000 | N1324: =POWER(D1324/M1324,1/9)-1 -> -0.12325212523275464 | O1324: =POWER(D1324/I1324,1/5)-1 -> -0.16061601925971403
A1325: 1878.HK | B1325: 南戈壁 | C1325: 3.12 | D1325: 7092388 | E1325: -237511552 | F1325: -112080654 | G1325: -155750017 | H1325: 32713187 | I1325: -322173250 | J1325: -293759516 | K1325: -471799884 | L1325: -1447522132.5 | M1325: -804165348 | N1325: =POWER(D1325/M1325,1/9)-1 -> -1.5911753918535227 | O1325: =POWER(D1325/I1325,1/5)-1 -> -1.4661660072239719
A1326: 2102.HK | B1326: 德利机械 | C1326: 0.14 | D1326: 7077000 | E1326: 45062000 | F1326: 52584000 | G1326: 51285000 | H1326: 38551000 | I1326: 54947000 | J1326: 12101000 | K1326: 23516000 | L1326: 31212000 | M1326: -- | N1326: =POWER(D1326/M1326,1/9)-1 -> #VALUE! | O1326: =POWER(D1326/I1326,1/5)-1 -> -0.3362859029987334
A1327: 1850.HK | B1327: 鸿盛昌资源 | C1327: 0.24 | D1327: 7054000 | E1327: -6992000 | F1327: 4887000 | G1327: -20653000 | H1327: 19071000 | I1327: 24085000 | J1327: 1649000 | K1327: 12836000 | L1327: 6422000 | M1327: -- | N1327: =POWER(D1327/M1327,1/9)-1 -> #VALUE! | O1327: =POWER(D1327/I1327,1/5)-1 -> -0.21776406881223542
A1328: 1750.HK | B1328: 全达电器集团控股 | C1328: 0.03 | D1328: 6998000 | E1328: 8316000 | F1328: -20165000 | G1328: -31422000 | H1328: 11461000 | I1328: 10157000 | J1328: 12431000 | K1328: 26285000 | L1328: 23747000 | M1328: 10657000 | N1328: =POWER(D1328/M1328,1/9)-1 -> -4.5657356179620967e-02 | O1328: =POWER(D1328/I1328,1/5)-1 -> -7.1799715624827343e-02
A1329: 8152.HK | B1329: 明梁控股 | C1329: 0.05 | D1329: 6888000 | E1329: -8452000 | F1329: -9059000 | G1329: -5379000 | H1329: -1334000 | I1329: -4951000 | J1329: -8645000 | K1329: 21150000 | L1329: 26436000 | M1329: -- | N1329: =POWER(D1329/M1329,1/9)-1 -> #VALUE! | O1329: =POWER(D1329/I1329,1/5)-1 -> -2.0682675649595814
A1330: 0149.HK | B1330: 中国农产品交易 | C1330: 0.04 | D1330: 6836000 | E1330: 6401000 | F1330: 489602000 | G1330: -- | H1330: -- | I1330: -212596000 | J1330: -340970000 | K1330: -740997000 | L1330: -489117000 | M1330: -340420000 | N1330: =POWER(D1330/M1330,1/9)-1 -> -1.6477699187434629 | O1330: =POWER(D1330/I1330,1/5)-1 -> -1.5028626654078727
A1331: 0301.HK | B1331: 三和精化 | C1331: 1.2 | D1331: 6811786.7999999998 | E1331: 5067425.2000000002 | F1331: 17161367.5 | G1331: 78450858 | H1331: 26747362.5 | I1331: 27705553.800000001 | J1331: 23005692.100000001 | K1331: 25719881.25 | L1331: -- | M1331: -- | N1331: =POWER(D1331/M1331,1/9)-1 -> #VALUE! | O1331: =POWER(D1331/I1331,1/5)-1 -> -0.24466633377290692
A1332: 1147.HK | B1332: 伊登软件 | C1332: 0.07 | D1332: 6727379.4000000004 | E1332: -31327337 | F1332: 23796933 | G1332: 19100197.5 | H1332: 27432390 | I1332: 30890218 | J1332: 26820591.899999999 | K1332: 13240543.75 | L1332: -- | M1332: -- | N1332: =POWER(D1332/M1332,1/9)-1 -> #VALUE! | O1332: =POWER(D1332/I1332,1/5)-1 -> -0.26276662195950751
A1333: 2342.HK | B1333: 京信通信 | C1333: 0.91 | D1333: 6696000 | E1333: 190237000 | F1333: -592567000 | G1333: -194104000 | H1333: 151749000 | I1333: -171384000 | J1333: 27373000 | K1333: 152257000 | L1333: 212876000 | M1333: 151061000 | N1333: =POWER(D1333/M1333,1/9)-1 -> -0.29265834832081339 | O1333: =POWER(D1333/I1333,1/5)-1 -> -1.522840274553414
A1334: 0029.HK | B1334: 达力集团 | C1334: 7.08 | D1334: 6634000 | E1334: 31152000 | F1334: -14065000 | G1334: -28413000 | H1334: 48730000 | I1334: 126125000 | J1334: 115591000 | K1334: 95085000 | L1334: 101586000 | M1334: 94972000 | N1334: =POWER(D1334/M1334,1/9)-1 -> -0.25599553379168971 | O1334: =POWER(D1334/I1334,1/5)-1 -> -0.44512538386341582
A1335: 8033.HK | B1335: 爱达利网络 | C1335: 0.14 | D1335: 6532000 | E1335: 5460000 | F1335: -6321000 | G1335: 3826000 | H1335: -5256000 | I1335: -171000 | J1335: -4827000 | K1335: 8989000 | L1335: 7253000 | M1335: 29746000 | N1335: =POWER(D1335/M1335,1/9)-1 -> -0.1550200571924768 | O1335: =POWER(D1335/I1335,1/5)-1 -> -3.0720966716643634
A1336: 0403.HK | B1336: 星光集团 | C1336: 0.19 | D1336: 6478000 | E1336: 357473000 | F1336: -98525000 | G1336: 8499000 | H1336: -37925000 | I1336: -54436000 | J1336: -9184000 | K1336: 68112000 | L1336: 2651000 | M1336: 15057000 | N1336: =POWER(D1336/M1336,1/9)-1 -> -8.945738358247779e-02 | O1336: =POWER(D1336/I1336,1/5)-1 -> -1.6532974268821776
A1337: 1937.HK | B1337: 佳辰控股 | C1337: 0.20000000000000001 | D1337: 6456618 | E1337: 12051492.300000001 | F1337: 30051679 | G1337: 886773.59999999998 | H1337: 21344250 | I1337: 28015253 | J1337: 24518703.899999999 | K1337: 21300440 | L1337: -- | M1337: -- | N1337: =POWER(D1337/M1337,1/9)-1 -> #VALUE! | O1337: =POWER(D1337/I1337,1/5)-1 -> -0.25437217107990695
A1338: 2347.HK | B1338: 友和集团 | C1338: 0.62 | D1338: 6303000 | E1338: -225000 | F1338: 28733000 | G1338: 18324000 | H1338: -- | I1338: -- | J1338: -- | K1338: -- | L1338: -- | M1338: -- | N1338: =POWER(D1338/M1338,1/9)-1 -> #VALUE! | O1338: =POWER(D1338/I1338,1/5)-1 -> #VALUE!
A1339: 8416.HK | B1339: HM INTL HLDGS | C1339: 0.13 | D1339: 6265000 | E1339: 7103000 | F1339: 3884000 | G1339: -4527000 | H1339: 2614000 | I1339: 7162000 | J1339: 9922000 | K1339: 14969000 | L1339: 13873000 | M1339: 10868000 | N1339: =POWER(D1339/M1339,1/9)-1 -> -5.9369515493528979e-02 | O1339: =POWER(D1339/I1339,1/5)-1 -> -2.6407203967677817e-02
A1340: 8136.HK | B1340: 英马斯集团 | C1340: 0.05 | D1340: 6126000 | E1340: 11371000 | F1340: 5429000 | G1340: 4987000 | H1340: 6586000 | I1340: -3525000 | J1340: 16427000 | K1340: 6474000 | L1340: -- | M1340: -- | N1340: =POWER(D1340/M1340,1/9)-1 -> #VALUE! | O1340: =POWER(D1340/I1340,1/5)-1 -> -2.1168724395644452
A1341: 1808.HK | B1341: 企展控股 | C1341: 5.16 | D1341: 6083910 | E1341: -25120530.800000001 | F1341: -29167590 | G1341: -20063252.699999999 | H1341: -91481902.5 | I1341: -28466138.600000001 | J1341: -122510795.40000001 | K1341: -356721251.25 | L1341: 8745107.8000000007 | M1341: 14315908.800000001 | N1341: =POWER(D1341/M1341,1/9)-1 -> -9.0700200525712926e-02 | O1341: =POWER(D1341/I1341,1/5)-1 -> -1.734464559265448
A1342: 8510.HK | B1342: Topstandardcorp | C1342: 0.13 | D1342: 6009000 | E1342: -7505000 | F1342: -3029000 | G1342: -94195000 | H1342: -37654000 | I1342: -21894000 | J1342: 7406000 | K1342: 6958000 | L1342: -- | M1342: -- | N1342: =POWER(D1342/M1342,1/9)-1 -> #VALUE! | O1342: =POWER(D1342/I1342,1/5)-1 -> -1.7721388742071063
A1343: 1793.HK | B1343: 伟工控股 | C1343: 0.15 | D1343: 5947000 | E1343: 14209000 | F1343: 19242000 | G1343: 50496000 | H1343: 37228000 | I1343: 41407000 | J1343: 31818000 | K1343: 20208000 | L1343: -- | M1343: -- | N1343: =POWER(D1343/M1343,1/9)-1 -> #VALUE! | O1343: =POWER(D1343/I1343,1/5)-1 -> -0.32166404952570404
A1344: 8373.HK | B1344: 靛蓝星 | C1344: 0.07 | D1344: 5913081 | E1344: 1700754 | F1344: -21448552.5 | G1344: -12103296 | H1344: 879016 | I1344: 14395194 | J1344: 15214535 | K1344: 15948075 | L1344: 13722697.5 | M1344: -- | N1344: =POWER(D1344/M1344,1/9)-1 -> #VALUE! | O1344: =POWER(D1344/I1344,1/5)-1 -> -0.16301194273914288
A1345: 1792.HK | B1345: CMON | C1345: 0.04 | D1345: 5904709.8300000001 | E1345: 4525290.3700000001 | F1345: 3283628.6299999999 | G1345: -38019758.380000003 | H1345: -5942929.3799999999 | I1345: 16202827.18 | J1345: 27322580.870000001 | K1345: 7890625.4800000004 | L1345: 14153149.300000001 | M1345: 19881784.690000001 | N1345: =POWER(D1345/M1345,1/9)-1 -> -0.12619221338057729 | O1345: =POWER(D1345/I1345,1/5)-1 -> -0.18281280630177721
A1346: 8051.HK | B1346: 讯智海 | C1346: 2.75 | D1346: 5891000 | E1346: 5421000 | F1346: 2232000 | G1346: 8997000 | H1346: 2489000 | I1346: -14601000 | J1346: -13210000 | K1346: -7517000 | L1346: -7843000 | M1346: -6548000 | N1346: =POWER(D1346/M1346,1/9)-1 -> -1.9883205299968005 | O1346: =POWER(D1346/I1346,1/5)-1 -> -1.8339908470898898
A1347: 1752.HK | B1347: 澳洲成峰高教 | C1347: 0.07 | D1347: 5776470 | E1347: -7010703 | F1347: 1080770 | G1347: 23127227.5 | H1347: 22648608 | I1347: 9022930 | J1347: 27584388 | K1347: 19745033 | L1347: 28363657.5 | M1347: -- | N1347: =POWER(D1347/M1347,1/9)-1 -> #VALUE! | O1347: =POWER(D1347/I1347,1/5)-1 -> -8.53330500677566e-02
A1348: 8545.HK | B1348: 佰悦集团 | C1348: 0.03 | D1348: 5762000 | E1348: 1481000 | F1348: 8677000 | G1348: 7450000 | H1348: 15121000 | I1348: 16910000 | J1348: 11272000 | K1348: 18259000 | L1348: -- | M1348: -- | N1348: =POWER(D1348/M1348,1/9)-1 -> #VALUE! | O1348: =POWER(D1348/I1348,1/5)-1 -> -0.19371992178079989
A1349: 1402.HK | B1349: 超智能控股 | C1349: 0.26 | D1349: 5739000 | E1349: 6697000 | F1349: 12789000 | G1349: 2621000 | H1349: 23503000 | I1349: 16909000 | J1349: 19206000 | K1349: 11786000 | L1349: 4841000 | M1349: 35683000 | N1349: =POWER(D1349/M1349,1/9)-1 -> -0.183757075972107 | O1349: =POWER(D1349/I1349,1/5)-1 -> -0.19435510387604416
A1350: 8635.HK | B1350: 连成科技集团 | C1350: 0.07 | D1350: 5711000 | E1350: 11221000 | F1350: 13032000 | G1350: 6759000 | H1350: 6485000 | I1350: 6426000 | J1350: 13363000 | K1350: -- | L1350: -- | M1350: -- | N1350: =POWER(D1350/M1350,1/9)-1 -> #VALUE! | O1350: =POWER(D1350/I1350,1/5)-1 -> -2.3315517367422545e-02
A1351: 1617.HK | B1351: 南方通信 | C1351: 0.09 | D1351: 5698047.5999999996 | E1351: -9140994.3000000007 | F1351: -73335305 | G1351: -22863025.800000001 | H1351: 37834080 | I1351: 161034475.19999999 | J1351: 156255034.80000001 | K1351: 111161671.25 | L1351: 84856711.700000003 | M1351: 29311923.100000001 | N1351: =POWER(D1351/M1351,1/9)-1 -> -0.16638669038540832 | O1351: =POWER(D1351/I1351,1/5)-1 -> -0.48742025331047545
A1352: 0544.HK | B1352: 大同集团 | C1352: 0.11 | D1352: 5672000 | E1352: 4760000 | F1352: -80270000 | G1352: -40584000 | H1352: -67138000 | I1352: -37934000 | J1352: -35351000 | K1352: -12327000 | L1352: -6444000 | M1352: -23851000 | N1352: =POWER(D1352/M1352,1/9)-1 -> -1.8524956685980742 | O1352: =POWER(D1352/I1352,1/5)-1 -> -1.6838195556675692
A1353: 0929.HK | B1353: 国际精密 | C1353: 0.46 | D1353: 5667000 | E1353: 8693000 | F1353: 81432000 | G1353: 27410000 | H1353: 40345000 | I1353: 85328000 | J1353: 114808000 | K1353: 110201000 | L1353: 86093000 | M1353: 94845000 | N1353: =POWER(D1353/M1353,1/9)-1 -> -0.26879754425348057 | O1353: =POWER(D1353/I1353,1/5)-1 -> -0.41863038577275136
A1354: 8013.HK | B1354: ECI TECH | C1354: 0.06 | D1354: 5624000 | E1354: 6344000 | F1354: 8716000 | G1354: 3655000 | H1354: 877000 | I1354: 1124000 | J1354: -4937000 | K1354: 10243000 | L1354: 7565000 | M1354: -- | N1354: =POWER(D1354/M1354,1/9)-1 -> #VALUE! | O1354: =POWER(D1354/I1354,1/5)-1 -> 0.37992600836847834
A1355: 8169.HK | B1355: 环康集团 | C1355: 0.03 | D1355: 5593000 | E1355: 4379000 | F1355: 5062000 | G1355: -7786000 | H1355: -574000 | I1355: 4847000 | J1355: 5136000 | K1355: -16441000 | L1355: 3980000 | M1355: -16315000 | N1355: =POWER(D1355/M1355,1/9)-1 -> -1.8878503066427075 | O1355: =POWER(D1355/I1355,1/5)-1 -> 2.9044983659908263e-02
A1356: 8616.HK | B1356: 新威工程集团 | C1356: 0.04 | D1356: 5512000 | E1356: 10853000 | F1356: 12442000 | G1356: 19380000 | H1356: 20793000 | I1356: 15564000 | J1356: -- | K1356: -- | L1356: -- | M1356: -- | N1356: =POWER(D1356/M1356,1/9)-1 -> #VALUE! | O1356: =POWER(D1356/I1356,1/5)-1 -> -0.18747338166094307
A1357: 1317.HK | B1357: 枫叶教育 | C1357: 0.25 | D1357: 5503744 | E1357: -- | F1357: -3769264499.6500001 | G1357: 571343098.5 | H1357: 718950793.20000005 | I1357: 622897425 | J1357: 486639821.80000001 | K1357: 356635836.19999999 | L1357: 247271838 | M1357: 50485396 | N1357: =POWER(D1357/M1357,1/9)-1 -> -0.2182737105192587 | O1357: =POWER(D1357/I1357,1/5)-1 -> -0.61162761873354854
A1358: 1927.HK | B1358: 久久王 | C1358: 0.12 | D1358: 5393304 | E1358: 18124054.600000001 | F1358: 33415380.5 | G1358: 52536568.200000003 | H1358: -- | I1358: -- | J1358: -- | K1358: -- | L1358: -- | M1358: -- | N1358: =POWER(D1358/M1358,1/9)-1 -> #VALUE! | O1358: =POWER(D1358/I1358,1/5)-1 -> #VALUE!
A1359: 0936.HK | B1359: 佳兆业资本 | C1359: 0.12 | D1359: 5381000 | E1359: 5179000 | F1359: 4478000 | G1359: -131900000 | H1359: -32173000 | I1359: -42672000 | J1359: -47449000 | K1359: -72143000 | L1359: -42035000 | M1359: -11079000 | N1359: =POWER(D1359/M1359,1/9)-1 -> -1.9228930619063149 | O1359: =POWER(D1359/I1359,1/5)-1 -> -1.6609125500280721
A1360: 1143.HK | B1360: 中国储能科技发展 | C1360: 2.28 | D1360: 5257000 | E1360: -54042000 | F1360: -46397000 | G1360: -173052000 | H1360: -171735000 | I1360: -57984000 | J1360: -128428000 | K1360: -82646000 | L1360: -1844000 | M1360: 577000 | N1360: =POWER(D1360/M1360,1/9)-1 -> 0.27825652470311368 | O1360: =POWER(D1360/I1360,1/5)-1 -> -1.6187083269713911
A1361: 1780.HK | B1361: 荣尊国际控股 | C1361: 1.63 | D1361: 5208000 | E1361: 10136000 | F1361: -39946000 | G1361: 30864000 | H1361: 33394000 | I1361: 50273000 | J1361: 32251000 | K1361: 15046000 | L1361: -- | M1361: -- | N1361: =POWER(D1361/M1361,1/9)-1 -> #VALUE! | O1361: =POWER(D1361/I1361,1/5)-1 -> -0.36457070268570491
A1362: 8452.HK | B1362: 富银融资股份 | C1362: 0.26 | D1362: 5202565.2000000002 | E1362: -33146989.370000001 | F1362: 18283433.18 | G1362: 3860510.46 | H1362: 40298392.119999997 | I1362: 45774794.219999999 | J1362: 24804052.890000001 | K1362: 17968032.390000001 | L1362: 7527235.1100000003 | M1362: 6111564.04 | N1362: =POWER(D1362/M1362,1/9)-1 -> -1.7733206028120896e-02 | O1362: =POWER(D1362/I1362,1/5)-1 -> -0.35268119129721742
A1363: 8529.HK | B1363: 优博控股 | C1363: 0.27 | D1363: 5038000 | E1363: -- | F1363: -- | G1363: -- | H1363: -- | I1363: -- | J1363: -- | K1363: -- | L1363: -- | M1363: -- | N1363: =POWER(D1363/M1363,1/9)-1 -> #VALUE! | O1363: =POWER(D1363/I1363,1/5)-1 -> #VALUE!
A1364: 1173.HK | B1364: 威高国际 | C1364: 0.05 | D1364: 5027000 | E1364: -53366000 | F1364: -184882000 | G1364: -258448000 | H1364: -79351000 | I1364: 5262000 | J1364: -25894000 | K1364: 58933000 | L1364: 102441000 | M1364: 45760000 | N1364: =POWER(D1364/M1364,1/9)-1 -> -0.21760734757147038 | O1364: =POWER(D1364/I1364,1/5)-1 -> -9.0959389507827559e-03
A1365: 1943.HK | B1365: 银涛控股 | C1365: 0.66 | D1365: 4967000 | E1365: -33844000 | F1365: 14127000 | G1365: -13656000 | H1365: 29333000 | I1365: 37222000 | J1365: 18359000 | K1365: 18072000 | L1365: -- | M1365: -- | N1365: =POWER(D1365/M1365,1/9)-1 -> #VALUE! | O1365: =POWER(D1365/I1365,1/5)-1 -> -0.33156544775869123
A1366: 0865.HK | B1366: 建德国际控股 | C1366: 0.02 | D1366: 4940573.4000000004 | E1366: 35333220.100000001 | F1366: 1595523.5 | G1366: 117859839.59999999 | H1366: 37038420 | I1366: 12472224.4 | J1366: 26010135.5 | K1366: -576689855 | L1366: 26108310 | M1366: -117477000 | N1366: =POWER(D1366/M1366,1/9)-1 -> -1.7032206447780132 | O1366: =POWER(D1366/I1366,1/5)-1 -> -0.16906569724757314
A1367: 8535.HK | B1367: 荧德控股 | C1367: 0.04 | D1367: 4856000 | E1367: 20782000 | F1367: 28511000 | G1367: 9595000 | H1367: 22946000 | I1367: 18733000 | J1367: 14987000 | K1367: 8721000 | L1367: -- | M1367: -- | N1367: =POWER(D1367/M1367,1/9)-1 -> #VALUE! | O1367: =POWER(D1367/I1367,1/5)-1 -> -0.23663144034289851
A1368: 8092.HK | B1368: ITE Holdings | C1368: 0.03 | D1368: 4820984 | E1368: 6162186 | F1368: 8453187 | G1368: 1023284 | H1368: -3455685 | I1368: 1321854 | J1368: 382539 | K1368: 329315 | L1368: 3243839 | M1368: 2070026 | N1368: =POWER(D1368/M1368,1/9)-1 -> 9.8488572417258391e-02 | O1368: =POWER(D1368/I1368,1/5)-1 -> 0.29535987461407132
A1369: 0508.HK | B1369: 鼎亿集团投资 | C1369: 0.52 | D1369: 4666000 | E1369: -101326000 | F1369: 42935000 | G1369: -348493000 | H1369: -212508000 | I1369: -221629000 | J1369: -440817000 | K1369: -510919000 | L1369: -724363000 | M1369: -140124000 | N1369: =POWER(D1369/M1369,1/9)-1 -> -1.6852133266230103 | O1369: =POWER(D1369/I1369,1/5)-1 -> -1.4620230359279496
A1370: 1343.HK | B1370: 伟源控股 | C1370: 0.08 | D1370: 4545792 | E1370: 12656638.5 | F1370: 8931604.5 | G1370: -22423936 | H1370: 39145127 | I1370: 51620580 | J1370: 27901089.969999999 | K1370: 24623822.440000001 | L1370: -- | M1370: -- | N1370: =POWER(D1370/M1370,1/9)-1 -> #VALUE! | O1370: =POWER(D1370/I1370,1/5)-1 -> -0.38488355772288585
A1371: 1204.HK | B1371: 博维智慧 | C1371: 3.45 | D1371: 4502000 | E1371: 3252000 | F1371: 24003000 | G1371: 29858000 | H1371: -- | I1371: -- | J1371: -- | K1371: -- | L1371: -- | M1371: -- | N1371: =POWER(D1371/M1371,1/9)-1 -> #VALUE! | O1371: =POWER(D1371/I1371,1/5)-1 -> #VALUE!
A1372: 8066.HK | B1372: 品创控股 | C1372: 0.07 | D1372: 4335500 | E1372: -7735405 | F1372: -5762933 | G1372: 3955709 | H1372: -42133116 | I1372: 1614760 | J1372: -19770206 | K1372: -234001534 | L1372: 5529253 | M1372: -133816554 | N1372: =POWER(D1372/M1372,1/9)-1 -> -1.6831298473418572 | O1372: =POWER(D1372/I1372,1/5)-1 -> 0.21838976353858475
A1373: 6162.HK | B1373: 天瑞汽车内饰 | C1373: 0.08 | D1373: 4106365.2000000002 | E1373: -29341881 | F1373: 8974360.5 | G1373: 60636720.600000001 | H1373: 50088585 | I1373: 31899017.600000001 | J1373: 42027439.5 | K1373: 27760136.25 | L1373: 24379516.5 | M1373: -- | N1373: =POWER(D1373/M1373,1/9)-1 -> #VALUE! | O1373: =POWER(D1373/I1373,1/5)-1 -> -0.33635465494117045
A1374: 8126.HK | B1374: G.A.控股 | C1374: 0.12 | D1374: 4078000 | E1374: 26104000 | F1374: 65433000 | G1374: 52811000 | H1374: 26879000 | I1374: 21987000 | J1374: 46149000 | K1374: 47899000 | L1374: 96008000 | M1374: 56202000 | N1374: =POWER(D1374/M1374,1/9)-1 -> -0.25284517457011768 | O1374: =POWER(D1374/I1374,1/5)-1 -> -0.28606898538160674
A1375: 0894.HK | B1375: 万裕科技 | C1375: 0.39 | D1375: 4076000 | E1375: 42686000 | F1375: 76494000 | G1375: 24064000 | H1375: 31578000 | I1375: 43046000 | J1375: 48177000 | K1375: -14905000 | L1375: -45095000 | M1375: 43257000 | N1375: =POWER(D1375/M1375,1/9)-1 -> -0.23083457623498338 | O1375: =POWER(D1375/I1375,1/5)-1 -> -0.37589124516000694
A1376: 0031.HK | B1376: 航天控股 | C1376: 0.28 | D1376: 4047000 | E1376: -119918000 | F1376: 345764000 | G1376: 296681000 | H1376: 338350000 | I1376: 404115000 | J1376: 486183000 | K1376: 796108000 | L1376: 984696000 | M1376: 415692000 | N1376: =POWER(D1376/M1376,1/9)-1 -> -0.40229812900777906 | O1376: =POWER(D1376/I1376,1/5)-1 -> -0.60177763552552532
A1377: 8447.HK | B1377: MS Concept | C1377: 0.04 | D1377: 3967000 | E1377: -4895000 | F1377: 3812000 | G1377: -2875000 | H1377: 774000 | I1377: 5556000 | J1377: 11312000 | K1377: 10616000 | L1377: -- | M1377: -- | N1377: =POWER(D1377/M1377,1/9)-1 -> #VALUE! | O1377: =POWER(D1377/I1377,1/5)-1 -> -6.5154175312284512e-02
A1378: 8113.HK | B1378: 时腾科技 | C1378: 0.07 | D1378: 3942000 | E1378: -68545000 | F1378: -46954000 | G1378: 32127000 | H1378: 14652000 | I1378: 4178000 | J1378: 37212000 | K1378: 30690000 | L1378: 12483000 | M1378: 20032000 | N1378: =POWER(D1378/M1378,1/9)-1 -> -0.16525331903005869 | O1378: =POWER(D1378/I1378,1/5)-1 -> -1.1561536666959249e-02
A1379: 1723.HK | B1379: 港亚控股 | C1379: 0.31 | D1379: 3940000 | E1379: 19458000 | F1379: 10758000 | G1379: 26577000 | H1379: 15946000 | I1379: 19393000 | J1379: 26312000 | K1379: 23011000 | L1379: 26776000 | M1379: -- | N1379: =POWER(D1379/M1379,1/9)-1 -> #VALUE! | O1379: =POWER(D1379/I1379,1/5)-1 -> -0.27294001212434271
A1380: 8210.HK | B1380: 衍汇亚洲 | C1380: 0.06 | D1380: 3912000 | E1380: -8821000 | F1380: -3545000 | G1380: -457000 | H1380: 165000 | I1380: 4778000 | J1380: 11857000 | K1380: 13491000 | L1380: -- | M1380: -- | N1380: =POWER(D1380/M1380,1/9)-1 -> #VALUE! | O1380: =POWER(D1380/I1380,1/5)-1 -> -3.9205429590214447e-02
A1381: 8451.HK | B1381: 日光控股 | C1381: 0.09 | D1381: 3736525 | E1381: 1425970 | F1381: 1406136 | G1381: 2247417 | H1381: 2327365 | I1381: -7463584 | J1381: 4257590 | K1381: 7195926.5 | L1381: -- | M1381: -- | N1381: =POWER(D1381/M1381,1/9)-1 -> #VALUE! | O1381: =POWER(D1381/I1381,1/5)-1 -> -1.8707712737269713
A1382: 8412.HK | B1382: 新爱德集团 | C1382: 0.5 | D1382: 3649000 | E1382: -8871000 | F1382: -36873000 | G1382: -35704000 | H1382: -26780000 | I1382: -25135000 | J1382: -9513000 | K1382: 8384000 | L1382: 7099000 | M1382: -- | N1382: =POWER(D1382/M1382,1/9)-1 -> #VALUE! | O1382: =POWER(D1382/I1382,1/5)-1 -> -1.6797966103775059
A1383: 1329.HK | B1383: 首创钜大 | C1383: 0.45 | D1383: 3572515.7999999998 | E1383: -167490135.09999999 | F1383: -103737191 | G1383: -144265192.19999999 | H1383: -249804832.5 | I1383: -225098942.80000001 | J1383: 135666325.09999999 | K1383: 252557121.25 | L1383: 742116951.25 | M1383: 3264506.3999999999 | N1383: =POWER(D1383/M1383,1/9)-1 -> 1.0068289943786057e-02 | O1383: =POWER(D1383/I1383,1/5)-1 -> -1.4366366040258254
A1384: 0676.HK | B1384: 创信国际 | C1384: 0.79 | D1384: 3522761 | E1384: 13140864 | F1384: -7462686 | G1384: -4845625 | H1384: -171080390 | I1384: -119593844 | J1384: 4555562 | K1384: 1767912 | L1384: 10222909.5 | M1384: 10904936 | N1384: =POWER(D1384/M1384,1/9)-1 -> -0.11799034369766326 | O1384: =POWER(D1384/I1384,1/5)-1 -> -1.4941227740069936
A1385: 8293.HK | B1385: 星亚控股 | C1385: 0.08 | D1385: 3312759.1600000001 | E1385: -9764866.9800000004 | F1385: -7713553.9800000004 | G1385: -5293473.8700000001 | H1385: -23435187.890000001 | I1385: -17794945.420000002 | J1385: -3558452.9900000002 | K1385: -7517696.5800000001 | L1385: 11927912.92 | M1385: 13967551.449999999 | N1385: =POWER(D1385/M1385,1/9)-1 -> -0.14775730554898492 | O1385: =POWER(D1385/I1385,1/5)-1 -> -1.7144611867692321
A1386: 8196.HK | B1386: 福田股份 | C1386: 0.08 | D1386: 3146094 | E1386: -13026170.699999999 | F1386: -20867929 | G1386: -127111367.40000001 | H1386: -26995447.5 | I1386: 9520973.1999999993 | J1386: 50128406.799999997 | K1386: 42475308.75 | L1386: 19895237.850000001 | M1386: 28342304.800000001 | N1386: =POWER(D1386/M1386,1/9)-1 -> -0.21670332839306705 | O1386: =POWER(D1386/I1386,1/5)-1 -> -0.19865769602507732
A1387: 1202.HK | B1387: 四威科技 | C1387: 0.66 | D1387: 3038351.3900000001 | E1387: -2509189.0800000001 | F1387: -64002522.149999999 | G1387: -51037109.009999998 | H1387: -56026336.960000001 | I1387: -17093707.879999999 | J1387: 36357067.869999997 | K1387: -17894752 | L1387: -47780906.57 | M1387: -36818576.5 | N1387: =POWER(D1387/M1387,1/9)-1 -> -1.7579123792918747 | O1387: =POWER(D1387/I1387,1/5)-1 -> -1.7078811443216608
A1388: 8532.HK | B1388: 宝发控股 | C1388: 0.05 | D1388: 3018000 | E1388: 2657000 | F1388: 1939000 | G1388: 3069000 | H1388: -6581000 | I1388: 4169000 | J1388: 7182000 | K1388: 16425000 | L1388: -- | M1388: -- | N1388: =POWER(D1388/M1388,1/9)-1 -> #VALUE! | O1388: =POWER(D1388/I1388,1/5)-1 -> -6.2572978321622008e-02
A1389: 9933.HK | B1389: GHW Intl | C1389: 1.8 | D1389: 2986048.7999999998 | E1389: 309806718.69999999 | F1389: 160058068.5 | G1389: -6168082.5 | H1389: 32527072.5 | I1389: 84549020.200000003 | J1389: 93781554.700000003 | K1389: 21278215 | L1389: -- | M1389: -- | N1389: =POWER(D1389/M1389,1/9)-1 -> #VALUE! | O1389: =POWER(D1389/I1389,1/5)-1 -> -0.48761351694941901
A1390: 1620.HK | B1390: 富盈环球集团 | C1390: 0.05 | D1390: 2917000 | E1390: -13802000 | F1390: -75768000 | G1390: -48061000 | H1390: 10747000 | I1390: 11095000 | J1390: 12365000 | K1390: 34998000 | L1390: 25489000 | M1390: 11864000 | N1390: =POWER(D1390/M1390,1/9)-1 -> -0.14434126560590199 | O1390: =POWER(D1390/I1390,1/5)-1 -> -0.23447068784319647
A1391: 9938.HK | B1391: 华和控股 | C1391: 0.07 | D1391: 2852000 | E1391: 1424000 | F1391: 5952000 | G1391: 27650000 | H1391: 33210000 | I1391: 27174000 | J1391: 26398000 | K1391: -- | L1391: -- | M1391: -- | N1391: =POWER(D1391/M1391,1/9)-1 -> #VALUE! | O1391: =POWER(D1391/I1391,1/5)-1 -> -0.36291234457867705
A1392: 1547.HK | B1392: IBI GROUP HLDGS | C1392: 0.20000000000000001 | D1392: 2800000 | E1392: 27010000 | F1392: 54390000 | G1392: 21627000 | H1392: 20852000 | I1392: 18175000 | J1392: 10797000 | K1392: 28269000 | L1392: 22383000 | M1392: 14574000 | N1392: =POWER(D1392/M1392,1/9)-1 -> -0.16747420948303404 | O1392: =POWER(D1392/I1392,1/5)-1 -> -0.31208192229907872
A1393: 8270.HK | B1393: 中国煤层气 | C1393: 0.51 | D1393: 2773386 | E1393: 143599233.30000001 | F1393: -2737982 | G1393: -48423321.299999997 | H1393: -70972425 | I1393: -120334079.59999999 | J1393: -84185559.099999994 | K1393: -112238472.5 | L1393: -277480765.14999998 | M1393: -415984969.19999999 | N1393: =POWER(D1393/M1393,1/9)-1 -> -1.5730793270837635 | O1393: =POWER(D1393/I1393,1/5)-1 -> -1.4704617672974098
A1394: 0854.HK | B1394: 威雅利 | C1394: 3.18 | D1394: 2716000 | E1394: 82192000 | F1394: 92483000 | G1394: -72553000 | H1394: -18963000 | I1394: 111956000 | J1394: 37514000 | K1394: -71605000 | L1394: 31957000 | M1394: 29004000 | N1394: =POWER(D1394/M1394,1/9)-1 -> -0.23136687554267621 | O1394: =POWER(D1394/I1394,1/5)-1 -> -0.52469051771379438
A1395: 1650.HK | B1395: Hygieia Group | C1395: 0.12 | D1395: 2687226 | E1395: -9342498 | F1395: 29704657.5 | G1395: 51591472 | H1395: 15348082 | I1395: 37690488 | J1395: 30242030 | K1395: 37264012.5 | L1395: -- | M1395: -- | N1395: =POWER(D1395/M1395,1/9)-1 -> #VALUE! | O1395: =POWER(D1395/I1395,1/5)-1 -> -0.41032259572477026
A1396: 8290.HK | B1396: 亚势备份 | C1396: 0.02 | D1396: 2644000 | E1396: -1964000 | F1396: -15673000 | G1396: -3664000 | H1396: 111000 | I1396: 7860000 | J1396: -680000 | K1396: -11101000 | L1396: 45362000 | M1396: 18467000 | N1396: =POWER(D1396/M1396,1/9)-1 -> -0.19423716241074895 | O1396: =POWER(D1396/I1396,1/5)-1 -> -0.19579312596767884
A1397: 0574.HK | B1397: 百信国际 | C1397: 0.04 | D1397: 2576070 | E1397: -- | F1397: -66591983.5 | G1397: -498755322.60000002 | H1397: -216483217.5 | I1397: -67643087.400000006 | J1397: 12201205.300000001 | K1397: 8528843.75 | L1397: 103794644.84999999 | M1397: 57333517.600000001 | N1397: =POWER(D1397/M1397,1/9)-1 -> -0.29159236991211412 | O1397: =POWER(D1397/I1397,1/5)-1 -> -1.5201718521201288
A1398: 8139.HK | B1398: 长安仁恒 | C1398: 1.45 | D1398: 2524193.4300000002 | E1398: 1602135.52 | F1398: 9103813.4199999999 | G1398: 1403002.1799999999 | H1398: -1007131.23 | I1398: 1069241.04 | J1398: -7629768.4299999997 | K1398: 2039990.52 | L1398: 2308439.1400000001 | M1398: 15153041.300000001 | N1398: =POWER(D1398/M1398,1/9)-1 -> -0.18056662741857399 | O1398: =POWER(D1398/I1398,1/5)-1 -> 0.18743378803738997
A1399: 0063.HK | B1399: 中亚烯谷集团 | C1399: 0.10000000000000001 | D1399: 2509000 | E1399: -47007000 | F1399: -330000 | G1399: -22961000 | H1399: -10000 | I1399: -88822000 | J1399: 51898000 | K1399: -43947000 | L1399: -26469000 | M1399: -24043000 | N1399: =POWER(D1399/M1399,1/9)-1 -> -1.7779394192155238 | O1399: =POWER(D1399/I1399,1/5)-1 -> -1.4899999352915982
A1400: 3878.HK | B1400: Vicon Holdings | C1400: 0.24 | D1400: 2391000 | E1400: -24561000 | F1400: -51509000 | G1400: 23731000 | H1400: 29155000 | I1400: 18221000 | J1400: 30188000 | K1400: 31066000 | L1400: 26034000 | M1400: -- | N1400: =POWER(D1400/M1400,1/9)-1 -> #VALUE! | O1400: =POWER(D1400/I1400,1/5)-1 -> -0.33380483932301397
A1401: 8425.HK | B1401: 兴铭控股 | C1401: 0.06 | D1401: 2369000 | E1401: -3035000 | F1401: 4579000 | G1401: 1104000 | H1401: 6325000 | I1401: 15374000 | J1401: 2812000 | K1401: 9562000 | L1401: 9832000 | M1401: -- | N1401: =POWER(D1401/M1401,1/9)-1 -> #VALUE! | O1401: =POWER(D1401/I1401,1/5)-1 -> -0.3120519613713737
A1402: 0767.HK | B1402: 中基长寿科学 | C1402: 0.33 | D1402: 2313000 | E1402: -904000 | F1402: 6055000 | G1402: -11487000 | H1402: -825678000 | I1402: -2199094000 | J1402: 82274000 | K1402: 321907000 | L1402: -148282000 | M1402: -26008000 | N1402: =POWER(D1402/M1402,1/9)-1 -> -1.7642401551773474 | O1402: =POWER(D1402/I1402,1/5)-1 -> -1.253738499804925
A1403: 8521.HK | B1403: 智纺国际控股 | C1403: 0.66 | D1403: 2202000 | E1403: -11025000 | F1403: -32503000 | G1403: 6111000 | H1403: 34992000 | I1403: 24281000 | J1403: 20252000 | K1403: 18895000 | L1403: 12051000 | M1403: -- | N1403: =POWER(D1403/M1403,1/9)-1 -> #VALUE! | O1403: =POWER(D1403/I1403,1/5)-1 -> -0.38125721306181515
A1404: 1217.HK | B1404: 中国创新投资 | C1404: 0.01 | D1404: 2193000 | E1404: 5756000 | F1404: -33923000 | G1404: -9813000 | H1404: 23872000 | I1404: 10172000 | J1404: 37005000 | K1404: -54172000 | L1404: -138000 | M1404: -15913000 | N1404: =POWER(D1404/M1404,1/9)-1 -> -1.8023524338199641 | O1404: =POWER(D1404/I1404,1/5)-1 -> -0.26425646262029223
A1405: 1708.HK | B1405: 三宝科技 | C1405: 0.57 | D1405: 2186880.3799999999 | E1405: -308565207.67000002 | F1405: -72545178.799999997 | G1405: -166121165.72999999 | H1405: 119598715.40000001 | I1405: 223156621.56 | J1405: 266274641.56 | K1405: 212276970.87 | L1405: 193423676.91 | M1405: 172151601.50999999 | N1405: =POWER(D1405/M1405,1/9)-1 -> -0.3843643321498007 | O1405: =POWER(D1405/I1405,1/5)-1 -> -0.60350012925622532
A1406: 8353.HK | B1406: 安科系统 | C1406: 0.35 | D1406: 2163191.7200000002 | E1406: 13575376.390000001 | F1406: 12527528.65 | G1406: 1462542.3400000001 | H1406: -35656553.140000001 | I1406: 1671658.6000000001 | J1406: -13090177.83 | K1406: 14028298.1 | L1406: -2038347.48 | M1406: -- | N1406: =POWER(D1406/M1406,1/9)-1 -> #VALUE! | O1406: =POWER(D1406/I1406,1/5)-1 -> 5.2905719912235583e-02
A1407: 8627.HK | B1407: 旅橙文化 | C1407: 0.07 | D1407: 2067433.2 | E1407: -4179610.5 | F1407: -940416 | G1407: -2159722.7999999998 | H1407: 9922282.5 | I1407: 7181150.2000000002 | J1407: 14585817.4 | K1407: 10350182.5 | L1407: -- | M1407: -- | N1407: =POWER(D1407/M1407,1/9)-1 -> #VALUE! | O1407: =POWER(D1407/I1407,1/5)-1 -> -0.22044368298099215
A1408: 1845.HK | B1408: 维港环保科技 | C1408: 0.18 | D1408: 1920542.3999999999 | E1408: -81615778.799999997 | F1408: -15198494 | G1408: -13026275.1 | H1408: 74854620 | I1408: 56701141.399999999 | J1408: 36200785.5 | K1408: 21694933.75 | L1408: 18364020.75 | M1408: -- | N1408: =POWER(D1408/M1408,1/9)-1 -> #VALUE! | O1408: =POWER(D1408/I1408,1/5)-1 -> -0.49187984764162707
A1409: 8036.HK | B1409: 电子交易集团 | C1409: 0.07 | D1409: 1919000 | E1409: 1972000 | F1409: 327000 | G1409: 1510000 | H1409: 1014000 | I1409: 882000 | J1409: 9877000 | K1409: 6789000 | L1409: 21335471 | M1409: 15993246 | N1409: =POWER(D1409/M1409,1/9)-1 -> -0.2099000401909229 | O1409: =POWER(D1409/I1409,1/5)-1 -> 0.16821096404782221
A1410: 8619.HK | B1410: 饮食天王(环球) | C1410: 0.26 | D1410: 1871000 | E1410: -4651000 | F1410: 6315000 | G1410: -6964000 | H1410: -419000 | I1410: 2089000 | J1410: 16286000 | K1410: 13281000 | L1410: -- | M1410: -- | N1410: =POWER(D1410/M1410,1/9)-1 -> #VALUE! | O1410: =POWER(D1410/I1410,1/5)-1 -> -2.1801326613999805e-02
A1411: 2326.HK | B1411: 新源万恒控股 | C1411: 0.01 | D1411: 1842000 | E1411: -5452000 | F1411: -37907000 | G1411: -16898000 | H1411: -70350000 | I1411: 233638000 | J1411: 66348000 | K1411: 177716000 | L1411: 17198000 | M1411: -3680000 | N1411: =POWER(D1411/M1411,1/9)-1 -> -1.9259864789220353 | O1411: =POWER(D1411/I1411,1/5)-1 -> -0.62037987382551707
A1412: 0401.HK | B1412: 万嘉集团 | C1412: 0.05 | D1412: 1820000 | E1412: -50999000 | F1412: -4536000 | G1412: -20744000 | H1412: -66592000 | I1412: -55586000 | J1412: -25792000 | K1412: -13802000 | L1412: -772949000 | M1412: 48920000 | N1412: =POWER(D1412/M1412,1/9)-1 -> -0.30629295601206341 | O1412: =POWER(D1412/I1412,1/5)-1 -> -1.5046859249489986
A1413: 1949.HK | B1413: Platt Nera | C1413: 0.43 | D1413: 1798647.8999999999 | E1413: -18997374.199999999 | F1413: -6876297.7000000002 | G1413: 1097117.8500000001 | H1413: -9695487.5999999996 | I1413: 27398408.5 | J1413: 18974721.600000001 | K1413: 20338010 | L1413: -- | M1413: -- | N1413: =POWER(D1413/M1413,1/9)-1 -> #VALUE! | O1413: =POWER(D1413/I1413,1/5)-1 -> -0.4199784044102578
A1414: 0556.HK | B1414: 泛亚环保 | C1414: 0.79 | D1414: 1590586.2 | E1414: -1014161.9 | F1414: 10163350 | G1414: -34978689.299999997 | H1414: -65512320 | I1414: -22039880.199999999 | J1414: -176668705.09999999 | K1414: 83836033.75 | L1414: 82158853 | M1414: 35386700.299999997 | N1414: =POWER(D1414/M1414,1/9)-1 -> -0.29156190804142179 | O1414: =POWER(D1414/I1414,1/5)-1 -> -1.5911117552744418
A1415: 8187.HK | B1415: 积木集团 | C1415: 0.40000000000000002 | D1415: 1538000 | E1415: -5288000 | F1415: -14883000 | G1415: -8705000 | H1415: -33345000 | I1415: -3991000 | J1415: -9009000 | K1415: -13671000 | L1415: 6436000 | M1415: 8406000 | N1415: =POWER(D1415/M1415,1/9)-1 -> -0.17198010422070587 | O1415: =POWER(D1415/I1415,1/5)-1 -> -1.8263707213154898
A1416: 8250.HK | B1416: 丝路能源 | C1416: 0.19 | D1416: 1459000 | E1416: -8963000 | F1416: -29871000 | G1416: -101204000 | H1416: -29989000 | I1416: -75721000 | J1416: -140228000 | K1416: -130043000 | L1416: -63856000 | M1416: -3556000 | N1416: =POWER(D1416/M1416,1/9)-1 -> -1.9057542766346756 | O1416: =POWER(D1416/I1416,1/5)-1 -> -1.4539079509755573
A1417: 8191.HK | B1417: 鸿伟亚洲 | C1417: 0.20000000000000001 | D1417: 1453000 | E1417: -- | F1417: -34781000 | G1417: -70212000 | H1417: 25290000 | I1417: -59614000 | J1417: 30295000 | K1417: 40453000 | L1417: 24655000 | M1417: 26193000 | N1417: =POWER(D1417/M1417,1/9)-1 -> -0.27480738201461197 | O1417: =POWER(D1417/I1417,1/5)-1 -> -1.4757551193641445
A1418: 1653.HK | B1418: MOS House | C1418: 0.34 | D1418: 1412000 | E1418: 11870000 | F1418: 10054000 | G1418: -655000 | H1418: 5824000 | I1418: 17077000 | J1418: 30637000 | K1418: 14229000 | L1418: 33014000 | M1418: -- | N1418: =POWER(D1418/M1418,1/9)-1 -> #VALUE! | O1418: =POWER(D1418/I1418,1/5)-1 -> -0.39258624320382163
A1419: 1134.HK | B1419: 恒发光学 | C1419: 0.37 | D1419: 1388000 | E1419: 9183000 | F1419: -2140000 | G1419: -13402000 | H1419: 8377000 | I1419: 30420000 | J1419: 32331000 | K1419: 44195000 | L1419: -- | M1419: -- | N1419: =POWER(D1419/M1419,1/9)-1 -> #VALUE! | O1419: =POWER(D1419/I1419,1/5)-1 -> -0.46068058933246314
A1420: 8493.HK | B1420: 龙皇集团 | C1420: 0.17 | D1420: 1327000 | E1420: -5295000 | F1420: -50766000 | G1420: -74759000 | H1420: -35473000 | I1420: -58067000 | J1420: -10161000 | K1420: 1128000 | L1420: 1880000 | M1420: -- | N1420: =POWER(D1420/M1420,1/9)-1 -> #VALUE! | O1420: =POWER(D1420/I1420,1/5)-1 -> -1.4696651184455489
A1421: 1751.HK | B1421: 景联集团 | C1421: 0.54 | D1421: 1318000 | E1421: -9032000 | F1421: -41003000 | G1421: -66070000 | H1421: -24657000 | I1421: 20183000 | J1421: 25023000 | K1421: 3560000 | L1421: 14197000 | M1421: 9129000 | N1421: =POWER(D1421/M1421,1/9)-1 -> -0.19348909342519771 | O1421: =POWER(D1421/I1421,1/5)-1 -> -0.42059006454939774
A1422: 0948.HK | B1422: 阿尔法企业 | C1422: 0.29999999999999999 | D1422: 1315000 | E1422: -31644000 | F1422: -14993000 | G1422: -88056000 | H1422: 28783000 | I1422: -175632000 | J1422: 10696000 | K1422: 2903429.8799999999 | L1422: -391437207.81 | M1422: -610253294.92999995 | N1422: =POWER(D1422/M1422,1/9)-1 -> -1.505490323797793 | O1422: =POWER(D1422/I1422,1/5)-1 -> -1.3757200930255693
A1423: 9918.HK | B1423: 丽年国际 | C1423: 0.58 | D1423: 1245000 | E1423: 15134000 | F1423: 20120000 | G1423: 1451000 | H1423: 33390000 | I1423: 77018000 | J1423: 74172000 | K1423: 982000 | L1423: -- | M1423: -- | N1423: =POWER(D1423/M1423,1/9)-1 -> #VALUE! | O1423: =POWER(D1423/I1423,1/5)-1 -> -0.56175656098705751
A1424: 8040.HK | B1424: 快意智能 | C1424: 0.35 | D1424: 1188000 | E1424: -13563000 | F1424: 2558000 | G1424: -4951000 | H1424: 10686000 | I1424: 6996000 | J1424: 13518000 | K1424: 12390000 | L1424: -- | M1424: -- | N1424: =POWER(D1424/M1424,1/9)-1 -> #VALUE! | O1424: =POWER(D1424/I1424,1/5)-1 -> -0.29855547790035519
A1425: 1842.HK | B1425: 植华集团 | C1425: 0.05 | D1425: 1088000 | E1425: -466000 | F1425: -3008000 | G1425: -14477000 | H1425: -29500000 | I1425: 27119000 | J1425: 28329000 | K1425: 24618000 | L1425: 28341000 | M1425: -- | N1425: =POWER(D1425/M1425,1/9)-1 -> #VALUE! | O1425: =POWER(D1425/I1425,1/5)-1 -> -0.47438101306594949
A1426: 8080.HK | B1426: 北亚策略 | C1426: 0.25 | D1426: 1088000 | E1426: 79793000 | F1426: 137263000 | G1426: 110976000 | H1426: 110153000 | I1426: 108211000 | J1426: 30621000 | K1426: -271330000 | L1426: 25553000 | M1426: 47150000 | N1426: =POWER(D1426/M1426,1/9)-1 -> -0.34214911015589899 | O1426: =POWER(D1426/I1426,1/5)-1 -> -0.60146038495029319
A1427: 0060.HK | B1427: 香港食品投资 | C1427: 0.55 | D1427: 1050000 | E1427: -17337000 | F1427: -4162000 | G1427: -24111000 | H1427: 188050000 | I1427: 66620000 | J1427: -10398000 | K1427: -15549000 | L1427: 21569000 | M1427: 25293000 | N1427: =POWER(D1427/M1427,1/9)-1 -> -0.2977925391796914 | O1427: =POWER(D1427/I1427,1/5)-1 -> -0.56396943449420955
A1428: 1413.HK | B1428: 广联工程控股 | C1428: 0.17 | D1428: 1001000 | E1428: 23519000 | F1428: 31134000 | G1428: 38408000 | H1428: -- | I1428: -- | J1428: -- | K1428: -- | L1428: -- | M1428: -- | N1428: =POWER(D1428/M1428,1/9)-1 -> #VALUE! | O1428: =POWER(D1428/I1428,1/5)-1 -> #VALUE!
A1429: 8043.HK | B1429: Atlinks | C1429: 0.18 | D1429: 906800.75 | E1429: -7437750.7699999996 | F1429: 1810637.3799999999 | G1429: 4904051.25 | H1429: -14688315.189999999 | I1429: -6581805.8200000003 | J1429: -10957071.390000001 | K1429: 11444613.59 | L1429: 11404105.529999999 | M1429: -- | N1429: =POWER(D1429/M1429,1/9)-1 -> #VALUE! | O1429: =POWER(D1429/I1429,1/5)-1 -> -1.6727184844453338
A1430: 6100.HK | B1430: 同道猎聘 | C1430: 2.44 | D1430: 822150 | E1430: 50050412.700000003 | F1430: 164603412.5 | G1430: 63918021.299999997 | H1430: 134494477.5 | I1430: 8809348.1999999993 | J1430: 10787702.199999999 | K1430: -154662663.75 | L1430: -271333551.80000001 | M1430: -- | N1430: =POWER(D1430/M1430,1/9)-1 -> #VALUE! | O1430: =POWER(D1430/I1430,1/5)-1 -> -0.37769762715179089
A1431: 1182.HK | B1431: 胜龙国际 | C1431: 0.25 | D1431: 816000 | E1431: 2032000 | F1431: -10544000 | G1431: -11855000 | H1431: -38898000 | I1431: -131612000 | J1431: -156179000 | K1431: -231469000 | L1431: -47319000 | M1431: -11759000 | N1431: =POWER(D1431/M1431,1/9)-1 -> -1.7434602476772816 | O1431: =POWER(D1431/I1431,1/5)-1 -> -1.3618086403171525
A1432: 1757.HK | B1432: 俊裕地基 | C1432: 0.17 | D1432: 810000 | E1432: 2956000 | F1432: 652000 | G1432: -25746000 | H1432: -68283000 | I1432: 16049000 | J1432: 25825000 | K1432: 22200000 | L1432: 17837000 | M1432: -- | N1432: =POWER(D1432/M1432,1/9)-1 -> #VALUE! | O1432: =POWER(D1432/I1432,1/5)-1 -> -0.44968999535298215
A1433: 8501.HK | B1433: 庄皇集团公司 | C1433: 0.35 | D1433: 751000 | E1433: -5735000 | F1433: 397000 | G1433: 16224000 | H1433: 28116000 | I1433: 6911000 | J1433: 24100000 | K1433: 18604000 | L1433: -- | M1433: -- | N1433: =POWER(D1433/M1433,1/9)-1 -> #VALUE! | O1433: =POWER(D1433/I1433,1/5)-1 -> -0.35846580684302498
A1434: 1746.HK | B1434: 万顺集团控股 | C1434: 0.16 | D1434: 680000 | E1434: 238000 | F1434: -2225000 | G1434: -8464000 | H1434: 1007000 | I1434: 12581000 | J1434: 23404000 | K1434: 17703000 | L1434: 20716000 | M1434: -- | N1434: =POWER(D1434/M1434,1/9)-1 -> #VALUE! | O1434: =POWER(D1434/I1434,1/5)-1 -> -0.44209693148886298
A1435: 1549.HK | B1435: 永丰集团控股 | C1435: 0.09 | D1435: 513000 | E1435: 27642000 | F1435: 22783000 | G1435: 26225000 | H1435: 1602000 | I1435: -5230000 | J1435: -1161000 | K1435: -7208000 | L1435: 38228000 | M1435: 34598000 | N1435: =POWER(D1435/M1435,1/9)-1 -> -0.37369604773385168 | O1435: =POWER(D1435/I1435,1/5)-1 -> -1.6285258372699447
A1436: 8490.HK | B1436: 骏码半导体 | C1436: 0.15 | D1436: 510000 | E1436: 8640000 | F1436: 6849000 | G1436: -14112000 | H1436: -684000 | I1436: 350000 | J1436: 1992000 | K1436: 9920000 | L1436: 3888000 | M1436: -- | N1436: =POWER(D1436/M1436,1/9)-1 -> #VALUE! | O1436: =POWER(D1436/I1436,1/5)-1 -> 7.8202728077545691e-02
A1437: 2031.HK | B1437: 澳至尊 | C1437: 0.24 | D1437: 497000 | E1437: -843000 | F1437: 3844000 | G1437: 12047000 | H1437: 31210000 | I1437: 12530000 | J1437: 3082000 | K1437: 12293000 | L1437: 23174000 | M1437: 34575000 | N1437: =POWER(D1437/M1437,1/9)-1 -> -0.37585104971335592 | O1437: =POWER(D1437/I1437,1/5)-1 -> -0.47557780548868245
A1438: 1671.HK | B1438: 天保能源 | C1438: 0.41 | D1438: 282819.59999999998 | E1438: 8895068.5 | F1438: 527759.5 | G1438: 20870169 | H1438: 11542657.5 | I1438: 29998694.199999999 | J1438: 36293100.799999997 | K1438: 60360877.5 | L1438: 64733320.149999999 | M1438: 58081009.700000003 | N1438: =POWER(D1438/M1438,1/9)-1 -> -0.44658259165446557 | O1438: =POWER(D1438/I1438,1/5)-1 -> -0.60655735543753297
A1439: 0723.HK | B1439: 信保环球控股 | C1439: 0.02 | D1439: 280000 | E1439: 12758000 | F1439: 33080000 | G1439: 33709000 | H1439: 26372000 | I1439: 21865000 | J1439: -1751000 | K1439: -33077000 | L1439: -56508000 | M1439: -490133000 | N1439: =POWER(D1439/M1439,1/9)-1 -> -1.4361635239741322 | O1439: =POWER(D1439/I1439,1/5)-1 -> -0.5817059279389325
A1440: 8427.HK | B1440: 瑞强集团 | C1440: 0.44 | D1440: 149195.20000000001 | E1440: -3446112.1499999999 | F1440: -9103742.6999999993 | G1440: -7894459.7999999998 | H1440: -4956676.3499999996 | I1440: -6087300 | J1440: -2018989.95 | K1440: 9203579 | L1440: 8134674.5999999996 | M1440: -- | N1440: =POWER(D1440/M1440,1/9)-1 -> #VALUE! | O1440: =POWER(D1440/I1440,1/5)-1 -> -1.4762840403027107
A1441: 1987.HK | B1441: Beng Soon Mach | C1441: 0.18 | D1441: 146098.67999999999 | E1441: 3056278.2400000002 | F1441: 1095746.79 | G1441: -70321170.099999994 | H1441: 18703835.460000001 | I1441: 17673026.18 | J1441: 26529964.02 | K1441: 30168550.91 | L1441: 4268614.1900000004 | M1441: -- | N1441: =POWER(D1441/M1441,1/9)-1 -> #VALUE! | O1441: =POWER(D1441/I1441,1/5)-1 -> -0.61676331552817953
A1442: 2227.HK | B1442: 守益控股 | C1442: 0.10000000000000001 | D1442: -35514 | E1442: -5306119.5 | F1442: -23105547 | G1442: -18348456 | H1442: -43742612 | I1442: 4231854 | J1442: 31533775 | K1442: 61926150 | L1442: 54090345 | M1442: 27946340 | N1442: =POWER(D1442/M1442,1/9)-1 -> -1.4766839362217581 | O1442: =POWER(D1442/I1442,1/5)-1 -> -1.3843915064282188
A1443: 8160.HK | B1443: 金汇教育 | C1443: 0.18 | D1443: -250000 | E1443: -6968000 | F1443: -3466000 | G1443: -7022000 | H1443: -1792000 | I1443: 3921000 | J1443: 2791000 | K1443: 4989000 | L1443: 9164000 | M1443: 10312000 | N1443: =POWER(D1443/M1443,1/9)-1 -> -1.6614709704954105 | O1443: =POWER(D1443/I1443,1/5)-1 -> -1.576645136222361
A1444: 1213.HK | B1444: 万保刚集团 | C1444: 0.23 | D1444: -378000 | E1444: 13211000 | F1444: 12151000 | G1444: -5729000 | H1444: -7690000 | I1444: -17132000 | J1444: -3763000 | K1444: 3766000 | L1444: 7789000 | M1444: 1013000 | N1444: =POWER(D1444/M1444,1/9)-1 -> -1.8962545484788644 | O1444: =POWER(D1444/I1444,1/5)-1 -> -0.53362340554617882
A1445: 0459.HK | B1445: 鋑联控股 | C1445: 0.10000000000000001 | D1445: -733000 | E1445: -3689000 | F1445: 49839000 | G1445: -7275000 | H1445: -19504000 | I1445: 48148000 | J1445: 89918000 | K1445: 18100000 | L1445: 2371000 | M1445: 39661000 | N1445: =POWER(D1445/M1445,1/9)-1 -> -1.6418234645346979 | O1445: =POWER(D1445/I1445,1/5)-1 -> -1.4330171971343975
A1446: 8208.HK | B1446: WMCH Global | C1446: 0.04 | D1446: -733956 | E1446: -10076385 | F1446: -62197915.5 | G1446: -19521256 | H1446: -4794107 | I1446: 7355502 | J1446: 15045030 | K1446: -- | L1446: -- | M1446: -- | N1446: =POWER(D1446/M1446,1/9)-1 -> #VALUE! | O1446: =POWER(D1446/I1446,1/5)-1 -> -1.6306836050758595
A1447: 8283.HK | B1447: 中食民安 | C1447: 0.09 | D1447: -840498 | E1447: -436837.5 | F1447: -3227386.5 | G1447: 6321392 | H1447: -7153571 | I1447: -21762180 | J1447: -11929645 | K1447: -3061987.5 | L1447: 9407970 | M1447: 12886140 | N1447: =POWER(D1447/M1447,1/9)-1 -> -1.7383600734374376 | O1447: =POWER(D1447/I1447,1/5)-1 -> -0.47836483928382101
A1448: 8020.HK | B1448: 宏海控股集团 | C1448: 0.02 | D1448: -1026000 | E1448: -4972000 | F1448: -8152000 | G1448: -39512000 | H1448: -18965000 | I1448: -18694000 | J1448: -198553000 | K1448: 18491000 | L1448: -41727000 | M1448: -21723000 | N1448: =POWER(D1448/M1448,1/9)-1 -> -0.2876524237632806 | O1448: =POWER(D1448/I1448,1/5)-1 -> -0.4403854154092921
A1449: 3708.HK | B1449: 中国供应链产业 | C1449: 0.02 | D1449: -1326000 | E1449: -11104000 | F1449: -6017000 | G1449: -14493000 | H1449: -13410000 | I1449: 3650000 | J1449: 1313000 | K1449: 11581000 | L1449: 10839000 | M1449: 45976000 | N1449: =POWER(D1449/M1449,1/9)-1 -> -1.674357605641795 | O1449: =POWER(D1449/I1449,1/5)-1 -> -1.8166766373662171
A1450: 1632.HK | B1450: 民商创科 | C1450: 0.26 | D1450: -1363000 | E1450: -6029000 | F1450: 25550000 | G1450: -20937000 | H1450: -42936000 | I1450: -1501000 | J1450: -7928000 | K1450: 23905000 | L1450: 18805000 | M1450: 15981000 | N1450: =POWER(D1450/M1450,1/9)-1 -> -1.7606943868087628 | O1450: =POWER(D1450/I1450,1/5)-1 -> -1.9103843723195402e-02
A1451: 0789.HK | B1451: 雅天妮集团 | C1451: 0.42 | D1451: -1435000 | E1451: -22377000 | F1451: -26621000 | G1451: 10981000 | H1451: 31043000 | I1451: -145039000 | J1451: -14390000 | K1451: -100030000 | L1451: -90990000 | M1451: -108299000 | N1451: =POWER(D1451/M1451,1/9)-1 -> -0.3814730800123256 | O1451: =POWER(D1451/I1451,1/5)-1 -> -0.6027412965333484
A1452: 8041.HK | B1452: 荟萃国际(控股) | C1452: 0.24 | D1452: -1482000 | E1452: -15256000 | F1452: -5170000 | G1452: -25673000 | H1452: -3898000 | I1452: -138268000 | J1452: -46075000 | K1452: -47251000 | L1452: -245444000 | M1452: -104391000 | N1452: =POWER(D1452/M1452,1/9)-1 -> -0.37671419178771826 | O1452: =POWER(D1452/I1452,1/5)-1 -> -0.59633108760691855
A1453: 0745.HK | B1453: 中国国家文化产业 | C1453: 0.18 | D1453: -1498000 | E1453: -34551000 | F1453: -56317000 | G1453: -92227000 | H1453: -65904000 | I1453: -358673000 | J1453: -263438000 | K1453: 123250000 | L1453: -159994000 | M1453: -203701000 | N1453: =POWER(D1453/M1453,1/9)-1 -> -0.42064265543399304 | O1453: =POWER(D1453/I1453,1/5)-1 -> -0.66567979409778966
A1454: 8489.HK | B1454: 裕程物流 | C1454: 0.15 | D1454: -1505000 | E1454: -27590000 | F1454: 22980000 | G1454: 23174000 | H1454: -7439000 | I1454: 4238000 | J1454: 12614000 | K1454: 1618000 | L1454: -- | M1454: -- | N1454: =POWER(D1454/M1454,1/9)-1 -> #VALUE! | O1454: =POWER(D1454/I1454,1/5)-1 -> -1.8129711041401111
A1455: 8186.HK | B1455: 曼妠 | C1455: 1.1000000000000001 | D1455: -1643000 | E1455: 49290000 | F1455: -7287000 | G1455: -29918000 | H1455: -20818000 | I1455: -37585000 | J1455: -103347000 | K1455: -317743000 | L1455: -35083000 | M1455: -41665000 | N1455: =POWER(D1455/M1455,1/9)-1 -> -0.30179150130103138 | O1455: =POWER(D1455/I1455,1/5)-1 -> -0.46528224878148761
A1456: 9689.HK | B1456: 金泰丰国际控股 | C1456: 0.5 | D1456: -1654165.8 | E1456: 35811534.5 | F1456: 45411807 | G1456: 18122839.5 | H1456: -- | I1456: -- | J1456: -- | K1456: -- | L1456: -- | M1456: -- | N1456: =POWER(D1456/M1456,1/9)-1 -> #VALUE! | O1456: =POWER(D1456/I1456,1/5)-1 -> #VALUE!
A1457: 0844.HK | B1457: 广泰国际控股 | C1457: 0.31 | D1457: -1710072 | E1457: -175983.60000000001 | F1457: -17455247.5 | G1457: 10634131.800000001 | H1457: -7537537.5 | I1457: -22877889.800000001 | J1457: -36481328.100000001 | K1457: -13933963.75 | L1457: -8178251.7000000002 | M1457: 32034840.899999999 | N1457: =POWER(D1457/M1457,1/9)-1 -> -1.7221029041300195 | O1457: =POWER(D1457/I1457,1/5)-1 -> -0.40472220001750514
A1458: 1741.HK | B1458: 日赢控股 | C1458: 0.05 | D1458: -1769000 | E1458: -135787000 | F1458: -21274000 | G1458: 10299000 | H1458: -11070000 | I1458: 9909000 | J1458: 23677000 | K1458: 20350000 | L1458: 23807000 | M1458: -- | N1458: =POWER(D1458/M1458,1/9)-1 -> #VALUE! | O1458: =POWER(D1458/I1458,1/5)-1 -> -1.7084995861451346
A1459: 8519.HK | B1459: 新享时代 | C1459: 0.42 | D1459: -1801000 | E1459: -19744000 | F1459: -19476000 | G1459: -20407000 | H1459: -31957000 | I1459: -15435000 | J1459: -4567000 | K1459: -8245000 | L1459: -7033000 | M1459: 2747000 | N1459: =POWER(D1459/M1459,1/9)-1 -> -1.9541756716221366 | O1459: =POWER(D1459/I1459,1/5)-1 -> -0.34926912086550455
A1460: 0685.HK | B1460: 世界华文媒体 | C1460: 0.23 | D1460: -1923740 | E1460: 3132400 | F1460: -10130825 | G1460: 54711525 | H1460: -88638757 | I1460: -90145765 | J1460: 117762120 | K1460: 206623021.5 | L1460: 243731895 | M1460: 374142534 | N1460: =POWER(D1460/M1460,1/9)-1 -> -1.5567738251917747 | O1460: =POWER(D1460/I1460,1/5)-1 -> -0.53672356566582169
A1461: 8400.HK | B1461: 亚洲先锋娱乐 | C1461: 0.04 | D1461: -1933329 | E1461: -14741361 | F1461: -23076762 | G1461: -32032449 | H1461: -3049022 | I1461: 20701271 | J1461: 4492286 | K1461: 9562281 | L1461: 12758698 | M1461: -- | N1461: =POWER(D1461/M1461,1/9)-1 -> #VALUE! | O1461: =POWER(D1461/I1461,1/5)-1 -> -1.6223887743379493
A1462: 8168.HK | B1462: 宝积资本 | C1462: 0.05 | D1462: -1941000 | E1462: -9285000 | F1462: -9430000 | G1462: 5623000 | H1462: -4667000 | I1462: 1025000 | J1462: 7316000 | K1462: 13030000 | L1462: 8803000 | M1462: -- | N1462: =POWER(D1462/M1462,1/9)-1 -> #VALUE! | O1462: =POWER(D1462/I1462,1/5)-1 -> -2.1362145175228564
A1463: 8537.HK | B1463: 创辉珠宝 | C1463: 0.18 | D1463: -2170000 | E1463: -7683000 | F1463: -280000 | G1463: -5484000 | H1463: 2223000 | I1463: 4630000 | J1463: 4439000 | K1463: -- | L1463: -- | M1463: -- | N1463: =POWER(D1463/M1463,1/9)-1 -> #VALUE! | O1463: =POWER(D1463/I1463,1/5)-1 -> -1.8593612140323357
A1464: 1583.HK | B1464: 亲亲食品 | C1464: 0.82 | D1464: -2194592.3999999999 | E1464: -1564674.7 | F1464: -98989804.5 | G1464: 21048954 | H1464: 90726472.5 | I1464: 37300536 | J1464: -7836010.4000000004 | K1464: 35028822.5 | L1464: 74975539.599999994 | M1464: 114331350.09999999 | N1464: =POWER(D1464/M1464,1/9)-1 -> -1.6445300509904088 | O1464: =POWER(D1464/I1464,1/5)-1 -> -1.5674502081609152
A1465: 1235.HK | B1465: 专业旅运 | C1465: 0.15 | D1465: -2204000 | E1465: -17921000 | F1465: -32890000 | G1465: -45311000 | H1465: -11402000 | I1465: 1396000 | J1465: -688000 | K1465: 31585000 | L1465: 45406000 | M1465: 43268000 | N1465: =POWER(D1465/M1465,1/9)-1 -> -1.7183536581070227 | O1465: =POWER(D1465/I1465,1/5)-1 -> -2.0956333275450083
A1466: 8057.HK | B1466: 麦迪森控股 | C1466: 0.12 | D1466: -2211000 | E1466: -16641000 | F1466: -34968000 | G1466: -278922000 | H1466: -369244000 | I1466: -123969000 | J1466: -15638000 | K1466: -9447000 | L1466: 14159000 | M1466: 7204000 | N1466: =POWER(D1466/M1466,1/9)-1 -> -1.8770041953881338 | O1466: =POWER(D1466/I1466,1/5)-1 -> -0.55305392377766693
A1467: 1215.HK | B1467: 开源控股 | C1467: 0.02 | D1467: -2397000 | E1467: -41116000 | F1467: -164363000 | G1467: -332874000 | H1467: -30615000 | I1467: 338856000 | J1467: 4680000 | K1467: -129350000 | L1467: -20343000 | M1467: 106417000 | N1467: =POWER(D1467/M1467,1/9)-1 -> -1.6560876931777333 | O1467: =POWER(D1467/I1467,1/5)-1 -> -1.3714758377718361
A1468: 8668.HK | B1468: 瀛海集团 | C1468: 0.13 | D1468: -2546000 | E1468: -12080000 | F1468: -24853000 | G1468: -25472000 | H1468: -1066000 | I1468: 16276000 | J1468: 18218000 | K1468: -- | L1468: -- | M1468: -- | N1468: =POWER(D1468/M1468,1/9)-1 -> #VALUE! | O1468: =POWER(D1468/I1468,1/5)-1 -> -1.6900207385307411
A1469: 1237.HK | B1469: 中科生物 | C1469: 0.32 | D1469: -2591416.7999999998 | E1469: -7398079.7999999998 | F1469: 57664154 | G1469: -110964698.09999999 | H1469: -72046342.5 | I1469: -210562436.59999999 | J1469: -48622588.399999999 | K1469: -24775318.75 | L1469: 51513342.100000001 | M1469: 113321799 | N1469: =POWER(D1469/M1469,1/9)-1 -> -1.6571908896874059 | O1469: =POWER(D1469/I1469,1/5)-1 -> -0.58501607455909388
A1470: 1470.HK | B1470: 富一国际控股 | C1470: 0.04 | D1470: -2657000 | E1470: -6446000 | F1470: -769000 | G1470: -59005000 | H1470: -26893000 | I1470: -20248000 | J1470: -27691000 | K1470: -12649000 | L1470: 16170000 | M1470: 34402000 | N1470: =POWER(D1470/M1470,1/9)-1 -> -1.7523554925552975 | O1470: =POWER(D1470/I1470,1/5)-1 -> -0.33380420908525144
A1471: 0630.HK | B1471: 隽泰控股 | C1471: 0.09 | D1471: -2753000 | E1471: -104251000 | F1471: -18108000 | G1471: -34969000 | H1471: -34546000 | I1471: -26752000 | J1471: -147930000 | K1471: -18409000 | L1471: -18606000 | M1471: -48287000 | N1471: =POWER(D1471/M1471,1/9)-1 -> -0.27259696344364648 | O1471: =POWER(D1471/I1471,1/5)-1 -> -0.36541472401848729
A1472: 2372.HK | B1472: 伟立控股 | C1472: 0.28 | D1472: -2806272 | E1472: 28148351.199999999 | F1472: 43698731.5 | G1472: 50263614.899999999 | H1472: -- | I1472: -- | J1472: -- | K1472: -- | L1472: -- | M1472: -- | N1472: =POWER(D1472/M1472,1/9)-1 -> #VALUE! | O1472: =POWER(D1472/I1472,1/5)-1 -> #VALUE!
A1473: 8173.HK | B1473: 客思控股 | C1473: 0.38 | D1473: -3052000 | E1473: 4151000 | F1473: 8213000 | G1473: -42646000 | H1473: 17166000 | I1473: -76092000 | J1473: 2686000 | K1473: -430699000 | L1473: -887338000 | M1473: -175363000 | N1473: =POWER(D1473/M1473,1/9)-1 -> -0.36244701306998262 | O1473: =POWER(D1473/I1473,1/5)-1 -> -0.47440756459363187
A1474: 1695.HK | B1474: 椰丰集团 | C1474: 0.05 | D1474: -3060476.6699999999 | E1474: -1575948.6599999999 | F1474: -6359659.1699999999 | G1474: -5822459.7300000004 | H1474: -3508778.04 | I1474: 11919703.720000001 | J1474: 364285.34999999998 | K1474: 23089430.510000002 | L1474: 24593583.07 | M1474: 16314875.460000001 | N1474: =POWER(D1474/M1474,1/9)-1 -> -1.8303191119933859 | O1474: =POWER(D1474/I1474,1/5)-1 -> -1.7619118400537719
A1475: 8366.HK | B1475: 浙江联合投资 | C1475: 0.01 | D1475: -3076000 | E1475: -7364000 | F1475: -93360000 | G1475: -39581000 | H1475: -13526000 | I1475: -10798000 | J1475: 4567000 | K1475: 7190000 | L1475: 11431000 | M1475: 11537000 | N1475: =POWER(D1475/M1475,1/9)-1 -> -1.863396695337556 | O1475: =POWER(D1475/I1475,1/5)-1 -> -0.22209134835122313
A1476: 0953.HK | B1476: 邵氏兄弟控股 | C1476: 0.12 | D1476: -3176787.6000000001 | E1476: -340686.20000000001 | F1476: 20085473.5 | G1476: 2697269.7000000002 | H1476: 19993192.5 | I1476: 14307647.6 | J1476: -8662052.5 | K1476: -34727673.75 | L1476: -124511941.65000001 | M1476: -206121882.5 | N1476: =POWER(D1476/M1476,1/9)-1 -> -0.37099866920120605 | O1476: =POWER(D1476/I1476,1/5)-1 -> -1.7400890673096874
A1477: 1406.HK | B1477: 清晰医疗 | C1477: 0.46 | D1477: -3191000 | E1477: 13491000 | F1477: 35769000 | G1477: 26387000 | H1477: -- | I1477: -- | J1477: -- | K1477: -- | L1477: -- | M1477: -- | N1477: =POWER(D1477/M1477,1/9)-1 -> #VALUE! | O1477: =POWER(D1477/I1477,1/5)-1 -> #VALUE!
A1478: 8362.HK | B1478: 运兴泰集团 | C1478: 0.05 | D1478: -3199000 | E1478: -9580000 | F1478: -23133000 | G1478: -5734000 | H1478: -7602000 | I1478: 3555000 | J1478: -7534000 | K1478: 4633000 | L1478: 8364000 | M1478: -- | N1478: =POWER(D1478/M1478,1/9)-1 -> #VALUE! | O1478: =POWER(D1478/I1478,1/5)-1 -> -1.9791177572797318
A1479: 2885.HK | B1479: 彼岸控股 | C1479: 0.41 | D1479: -3263000 | E1479: -3195000 | F1479: 16982000 | G1479: 27186000 | H1479: 30313000 | I1479: 11507000 | J1479: 34469000 | K1479: 26038000 | L1479: 24919000 | M1479: -- | N1479: =POWER(D1479/M1479,1/9)-1 -> #VALUE! | O1479: =POWER(D1479/I1479,1/5)-1 -> -1.777196779159945
A1480: 8320.HK | B1480: 沛然环保 | C1480: 0.08 | D1480: -3288000 | E1480: -4936000 | F1480: 3545000 | G1480: 771000 | H1480: -9884000 | I1480: -4095000 | J1480: -6088000 | K1480: 5448000 | L1480: 9997000 | M1480: -- | N1480: =POWER(D1480/M1480,1/9)-1 -> #VALUE! | O1480: =POWER(D1480/I1480,1/5)-1 -> -4.294789997369941e-02
A1481: 1536.HK | B1481: 煜荣集团 | C1481: 0.10000000000000001 | D1481: -3504000 | E1481: -454000 | F1481: -4412000 | G1481: 13677000 | H1481: 13859000 | I1481: -2324000 | J1481: -2311000 | K1481: 26974000 | L1481: 21141000 | M1481: 18887000 | N1481: =POWER(D1481/M1481,1/9)-1 -> -1.829299178632684 | O1481: =POWER(D1481/I1481,1/5)-1 -> 8.5589401641136931e-02
A1482: 8307.HK | B1482: 密迪斯肌 | C1482: 0.22 | D1482: -3537000 | E1482: 3922000 | F1482: 953000 | G1482: -3237000 | H1482: -5480000 | I1482: 2533000 | J1482: 3168000 | K1482: 2354000 | L1482: 3328000 | M1482: 13737000 | N1482: =POWER(D1482/M1482,1/9)-1 -> -1.8600565703185796 | O1482: =POWER(D1482/I1482,1/5)-1 -> -2.0690548152332404
A1483: 0770.HK | B1483: 沪光国际 | C1483: 0.10000000000000001 | D1483: -3556699.7999999998 | E1483: -7577765.5 | F1483: -5522894.5099999998 | G1483: 293303.73999999999 | H1483: -4328450.6699999999 | I1483: -21027497.920000002 | J1483: -11111804.93 | K1483: -11737578.73 | L1483: -30120341.870000001 | M1483: 18683723.129999999 | N1483: =POWER(D1483/M1483,1/9)-1 -> -1.8316752054925911 | O1483: =POWER(D1483/I1483,1/5)-1 -> -0.29910667759894771
A1484: 1408.HK | B1484: 濠江机电 | C1484: 0.18 | D1484: -3649514.5800000001 | E1484: 9040776.7300000004 | F1484: 25473786.5 | G1484: 25896116.600000001 | H1484: 39357281.700000003 | I1484: 26631068.059999999 | J1484: 28980582.629999999 | K1484: 19178640.850000001 | L1484: 21923301.050000001 | M1484: -- | N1484: =POWER(D1484/M1484,1/9)-1 -> #VALUE! | O1484: =POWER(D1484/I1484,1/5)-1 -> -1.6720000474223822
A1485: 1481.HK | B1485: 竣球控股 | C1485: 0.47 | D1485: -3690000 | E1485: -16500000 | F1485: 1649000 | G1485: 16001000 | H1485: 23142000 | I1485: -17035000 | J1485: -177000 | K1485: 10694000 | L1485: 7239000 | M1485: -- | N1485: =POWER(D1485/M1485,1/9)-1 -> #VALUE! | O1485: =POWER(D1485/I1485,1/5)-1 -> -0.26356088801278521
A1486: 8249.HK | B1486: 瑞远智控 | C1486: 0.09 | D1486: -3852046.7999999998 | E1486: -5225359.2000000002 | F1486: -4939633 | G1486: -10126382.4 | H1486: -7648170 | I1486: -1290033.8 | J1486: -8602107.5 | K1486: -2915920 | L1486: 5320450.2000000002 | M1486: -8918741.3000000007 | N1486: =POWER(D1486/M1486,1/9)-1 -> -8.9064653185049747e-02 | O1486: =POWER(D1486/I1486,1/5)-1 -> 0.24456646048551911
A1487: 8340.HK | B1487: 紫荆国际金融 | C1487: 0.14 | D1487: -3928000 | E1487: -7569000 | F1487: 5833000 | G1487: -2773000 | H1487: -6692000 | I1487: 1804000 | J1487: 13378000 | K1487: 1471000 | L1487: 2534000 | M1487: -6052000 | N1487: =POWER(D1487/M1487,1/9)-1 -> -4.6893578635168964e-02 | O1487: =POWER(D1487/I1487,1/5)-1 -> -2.1683877344803211
A1488: 8206.HK | B1488: 神通机器人教育 | C1488: 0.02 | D1488: -3959000 | E1488: -82848000 | F1488: -23202000 | G1488: -233033000 | H1488: 58832000 | I1488: 27602000 | J1488: 3846000 | K1488: -20370000 | L1488: -9871000 | M1488: -9113000 | N1488: =POWER(D1488/M1488,1/9)-1 -> -8.8473397344458471e-02 | O1488: =POWER(D1488/I1488,1/5)-1 -> -1.6781550342143778
A1489: 0021.HK | B1489: 大中华控股 | C1489: 0.13 | D1489: -4041000 | E1489: 53021000 | F1489: -47673000 | G1489: -82479000 | H1489: -3549000 | I1489: 41712000 | J1489: -74874000 | K1489: -3492000 | L1489: -7241000 | M1489: -35194000 | N1489: =POWER(D1489/M1489,1/9)-1 -> -0.21375517077585282 | O1489: =POWER(D1489/I1489,1/5)-1 -> -1.6269682771921978
A1490: 8069.HK | B1490: 飞道旅游科技 | C1490: 0.04 | D1490: -4125000 | E1490: -15500000 | F1490: -16474000 | G1490: -25915000 | H1490: -33116000 | I1490: -1757000 | J1490: -14232000 | K1490: 23109000 | L1490: 16226000 | M1490: -- | N1490: =POWER(D1490/M1490,1/9)-1 -> #VALUE! | O1490: =POWER(D1490/I1490,1/5)-1 -> 0.18612494164804994
A1491: 8042.HK | B1491: 高奥士国际 | C1491: 0.06 | D1491: -4157000 | E1491: 14047000 | F1491: 12804000 | G1491: -1617000 | H1491: 1749000 | I1491: -4904000 | J1491: 16145000 | K1491: 5824000 | L1491: -- | M1491: -- | N1491: =POWER(D1491/M1491,1/9)-1 -> #VALUE! | O1491: =POWER(D1491/I1491,1/5)-1 -> -3.2511274786965139e-02
A1492: 8413.HK | B1492: 亚洲富思 | C1492: 0.16 | D1492: -4408000 | E1492: -2137000 | F1492: -14618000 | G1492: -3573000 | H1492: 3909000 | I1492: 2394000 | J1492: -1824000 | K1492: 12056000 | L1492: 9040000 | M1492: -- | N1492: =POWER(D1492/M1492,1/9)-1 -> #VALUE! | O1492: =POWER(D1492/I1492,1/5)-1 -> -2.1298570190937278
A1493: 2223.HK | B1493: 卡撒天娇 | C1493: 0.35 | D1493: -4640000 | E1493: 5378000 | F1493: 11936000 | G1493: 16129000 | H1493: 18498000 | I1493: 7837000 | J1493: 27037000 | K1493: 7930000 | L1493: -16230000 | M1493: 12753000 | N1493: =POWER(D1493/M1493,1/9)-1 -> -1.8937411114977345 | O1493: =POWER(D1493/I1493,1/5)-1 -> -1.9004790780257035
A1494: 8039.HK | B1494: 中国来骑哦 | C1494: 0.38 | D1494: -4644000 | E1494: 388000 | F1494: -13141000 | G1494: -34334000 | H1494: -5155000 | I1494: 8028000 | J1494: 7401000 | K1494: 5924000 | L1494: 13316000 | M1494: 6350000 | N1494: =POWER(D1494/M1494,1/9)-1 -> -1.9658330310123198 | O1494: =POWER(D1494/I1494,1/5)-1 -> -1.8963073740689156
A1495: 8347.HK | B1495: F8企业 | C1495: 0.07 | D1495: -4837000 | E1495: -31217000 | F1495: 6387000 | G1495: 4664000 | H1495: 804000 | I1495: 1241000 | J1495: 7282000 | K1495: 12303000 | L1495: 8486000 | M1495: -- | N1495: =POWER(D1495/M1495,1/9)-1 -> #VALUE! | O1495: =POWER(D1495/I1495,1/5)-1 -> -2.3126860233590376
A1496: 1680.HK | B1496: 澳门励骏 | C1496: 0.15 | D1496: -4921000 | E1496: -607209000 | F1496: -1190444000 | G1496: -1955147000 | H1496: -190252000 | I1496: 1966106000 | J1496: -507341000 | K1496: -277495000 | L1496: -268508000 | M1496: 478941000 | N1496: =POWER(D1496/M1496,1/9)-1 -> -1.6012923871737292 | O1496: =POWER(D1496/I1496,1/5)-1 -> -1.301779189150305
A1497: 0540.HK | B1497: 迅捷环球控股 | C1497: 0.08 | D1497: -4950000 | E1497: -34458000 | F1497: -31274000 | G1497: -148849000 | H1497: 26649000 | I1497: 22222000 | J1497: 34106000 | K1497: 31484000 | L1497: 24830000 | M1497: 24097000 | N1497: =POWER(D1497/M1497,1/9)-1 -> -1.8387391467781562 | O1497: =POWER(D1497/I1497,1/5)-1 -> -1.7405670943817508
A1498: 8507.HK | B1498: 爱世纪集团 | C1498: 0.07 | D1498: -4955000 | E1498: 19214000 | F1498: -16691000 | G1498: -16991000 | H1498: -13458000 | I1498: 2741000 | J1498: 14518000 | K1498: 9907000 | L1498: -- | M1498: -- | N1498: =POWER(D1498/M1498,1/9)-1 -> #VALUE! | O1498: =POWER(D1498/I1498,1/5)-1 -> -2.1257110383459628
A1499: 1298.HK | B1499: 云能国际 | C1499: 0.98 | D1499: -4970000 | E1499: -8877000 | F1499: -26952000 | G1499: -62199000 | H1499: -19792000 | I1499: -73213000 | J1499: 10431690 | K1499: 7854802 | L1499: 27227506.5 | M1499: 26742688 | N1499: =POWER(D1499/M1499,1/9)-1 -> -1.829458366973586 | O1499: =POWER(D1499/I1499,1/5)-1 -> -0.41607961479078093
A1500: 8201.HK | B1500: 宝联控股 | C1500: 0.07 | D1500: -4997000 | E1500: 10677000 | F1500: 19192000 | G1500: -36719000 | H1500: 18477000 | I1500: -8289000 | J1500: -13386000 | K1500: -51058000 | L1500: -27205000 | M1500: 13094000 | N1500: =POWER(D1500/M1500,1/9)-1 -> -1.8984940876069123 | O1500: =POWER(D1500/I1500,1/5)-1 -> -9.6264292639278715e-02
A1501: 8133.HK | B1501: 吉盛集团控股 | C1501: 0.52 | D1501: -5043000 | E1501: -12137000 | F1501: -14002000 | G1501: -22670000 | H1501: -10487000 | I1501: -9711000 | J1501: -4935000 | K1501: -3758000 | L1501: -12459000 | M1501: -1811000 | N1501: =POWER(D1501/M1501,1/9)-1 -> 0.12051828121416142 | O1501: =POWER(D1501/I1501,1/5)-1 -> -0.12282751002126258
A1502: 8357.HK | B1502: Republic Hc | C1502: 0.09 | D1502: -5061449.3600000003 | E1502: -8552247.3100000005 | F1502: -5761554.6299999999 | G1502: -842123.18000000005 | H1502: 3687049.96 | I1502: -4195162.6200000001 | J1502: 11733843.35 | K1502: 10592900.18 | L1502: -- | M1502: -- | N1502: =POWER(D1502/M1502,1/9)-1 -> #VALUE! | O1502: =POWER(D1502/I1502,1/5)-1 -> 3.8257839867655186e-02
A1503: 0150.HK | B1503: Hypebeast | C1503: 0.22 | D1503: -5069000 | E1503: 100167000 | F1503: 70584000 | G1503: 65775000 | H1503: 61798000 | I1503: 45171000 | J1503: 23305000 | K1503: 4216000 | L1503: 9055000 | M1503: 10306000 | N1503: =POWER(D1503/M1503,1/9)-1 -> -1.9241854526414899 | O1503: =POWER(D1503/I1503,1/5)-1 -> -1.6456728383264934
A1504: 1682.HK | B1504: 杭品生活科技 | C1504: 0.10000000000000001 | D1504: -5509000 | E1504: -12673000 | F1504: -3960000 | G1504: -24002000 | H1504: 476000 | I1504: 7995000 | J1504: -11443000 | K1504: -24757000 | L1504: -6833000 | M1504: 18961000 | N1504: =POWER(D1504/M1504,1/9)-1 -> -1.8716795093942662 | O1504: =POWER(D1504/I1504,1/5)-1 -> -1.9282198698336379
A1505: 8098.HK | B1505: 昌利控股 | C1505: 0.04 | D1505: -5557338 | E1505: -8013191 | F1505: 15188601 | G1505: 23513421 | H1505: 12517978 | I1505: 16469209 | J1505: 42738543 | K1505: 21090715 | L1505: 22675357 | M1505: 24784305 | N1505: =POWER(D1505/M1505,1/9)-1 -> -1.8469435244573615 | O1505: =POWER(D1505/I1505,1/5)-1 -> -1.8047089176483939
A1506: 1683.HK | B1506: 旷逸国际 | C1506: 0.08 | D1506: -5635000 | E1506: -4172000 | F1506: 4987000 | G1506: -10107000 | H1506: 8205000 | I1506: -17373000 | J1506: -- | K1506: 24181000 | L1506: 21255000 | M1506: 23200000 | N1506: =POWER(D1506/M1506,1/9)-1 -> -1.8544994167239963 | O1506: =POWER(D1506/I1506,1/5)-1 -> -0.20163071537341559
A1507: 8411.HK | B1507: K W Nelson GP | C1507: 0.04 | D1507: -5686000 | E1507: -3402000 | F1507: -5166000 | G1507: 16748000 | H1507: 27193000 | I1507: 28734000 | J1507: 26102000 | K1507: 4668000 | L1507: 12926000 | M1507: 21806000 | N1507: =POWER(D1507/M1507,1/9)-1 -> -1.8612649248102833 | O1507: =POWER(D1507/I1507,1/5)-1 -> -1.7232395271655436
A1508: 8143.HK | B1508: 金威医疗 | C1508: 0.20000000000000001 | D1508: -5881000 | E1508: -12689000 | F1508: -30183000 | G1508: -49504000 | H1508: -50356000 | I1508: -102735000 | J1508: 3589000 | K1508: -43372000 | L1508: -505581000 | M1508: 21913000 | N1508: =POWER(D1508/M1508,1/9)-1 -> -1.8640277769969553 | O1508: =POWER(D1508/I1508,1/5)-1 -> -0.43565257105283606
A1509: 8121.HK | B1509: 国恩控股 | C1509: 2 | D1509: -5897000 | E1509: -31000 | F1509: -16246000 | G1509: -26206000 | H1509: -27579000 | I1509: -28889000 | J1509: -16020000 | K1509: -19502000 | L1509: 9118000 | M1509: 4601000 | N1509: =POWER(D1509/M1509,1/9)-1 -> -2.0279581466941976 | O1509: =POWER(D1509/I1509,1/5)-1 -> -0.27225417305577782
A1510: 3928.HK | B1510: S&T Hldgs | C1510: 1.3999999999999999 | D1510: -5961832.5800000001 | E1510: -8188731.4500000002 | F1510: -63988573.670000002 | G1510: -40122903.600000001 | H1510: 20246820.989999998 | I1510: 38835198.460000001 | J1510: 22752215.75 | K1510: 14669921.32 | L1510: -- | M1510: -- | N1510: =POWER(D1510/M1510,1/9)-1 -> #VALUE! | O1510: =POWER(D1510/I1510,1/5)-1 -> -1.6874337486373494
A1511: 8456.HK | B1511: 民信国际控股 | C1511: 0.14 | D1511: -6008000 | E1511: -21421000 | F1511: -64845000 | G1511: -60348000 | H1511: -18769000 | I1511: -4264000 | J1511: 10269000 | K1511: 11171000 | L1511: -- | M1511: -- | N1511: =POWER(D1511/M1511,1/9)-1 -> #VALUE! | O1511: =POWER(D1511/I1511,1/5)-1 -> 7.0982922028046236e-02
A1512: 8241.HK | B1512: 英记茶庄集团 | C1512: 0.16 | D1512: -6071000 | E1512: -7783000 | F1512: -9142000 | G1512: -12304000 | H1512: -2752000 | I1512: -3175000 | J1512: 12295000 | K1512: 7889000 | L1512: -- | M1512: -- | N1512: =POWER(D1512/M1512,1/9)-1 -> #VALUE! | O1512: =POWER(D1512/I1512,1/5)-1 -> 0.13842205439951538
A1513: 8495.HK | B1513: 1957 & CO. | C1513: 0.19 | D1513: -6246000 | E1513: -533000 | F1513: 13165000 | G1513: -12909000 | H1513: -14189000 | I1513: -5620000 | J1513: -11094000 | K1513: 359000 | L1513: 643000 | M1513: -- | N1513: =POWER(D1513/M1513,1/9)-1 -> #VALUE! | O1513: =POWER(D1513/I1513,1/5)-1 -> 2.1346565589863475e-02
A1514: 0810.HK | B1514: 中国铸晨81 | C1514: 0.35 | D1514: -6311000 | E1514: -27991000 | F1514: -9579000 | G1514: -43928000 | H1514: -49958000 | I1514: -53840000 | J1514: -45339000 | K1514: -74015000 | L1514: -47986000 | M1514: -85772000 | N1514: =POWER(D1514/M1514,1/9)-1 -> -0.25168641933280311 | O1514: =POWER(D1514/I1514,1/5)-1 -> -0.34867368376811403
A1515: 8622.HK | B1515: 华康生物医学 | C1515: 0.10000000000000001 | D1515: -6338228.4000000004 | E1515: -3468907.5 | F1515: -5167390 | G1515: -13858221.300000001 | H1515: -317370 | I1515: -522617.40000000002 | J1515: -2340252.7999999998 | K1515: 9363392.5 | L1515: 9330780.6999999993 | M1515: -- | N1515: =POWER(D1515/M1515,1/9)-1 -> #VALUE! | O1515: =POWER(D1515/I1515,1/5)-1 -> 0.64723971280821924
A1516: 8491.HK | B1516: Cool Link | C1516: 0.29999999999999999 | D1516: -6339249 | E1516: -50678974.5 | F1516: -6933973.5 | G1516: -2040672 | H1516: -5013861 | I1516: -2101572 | J1516: -6230770 | K1516: 6547612.5 | L1516: 9375075 | M1516: -- | N1516: =POWER(D1516/M1516,1/9)-1 -> #VALUE! | O1516: =POWER(D1516/I1516,1/5)-1 -> 0.24709261502821178
A1517: 0645.HK | B1517: 安域亚洲 | C1517: 0.09 | D1517: -6509308 | E1517: -16664368 | F1517: -17587050 | G1517: -5343195 | H1517: -11585124 | I1517: -19449822 | J1517: 1017870 | K1517: -103664295 | L1517: 12237390 | M1517: -63324066 | N1517: =POWER(D1517/M1517,1/9)-1 -> -0.22336233732971611 | O1517: =POWER(D1517/I1517,1/5)-1 -> -0.19661477929071514
A1518: 0042.HK | B1518: 东北电气 | C1518: 0.20000000000000001 | D1518: -6528967.2000000002 | E1518: -28362690.199999999 | F1518: 21586710.5 | G1518: 76254186.299999997 | H1518: -44885505 | I1518: 16619005.6 | J1518: -476032408.42000002 | K1518: -110562434.25 | L1518: 5801851.5700000003 | M1518: 7698426.2999999998 | N1518: =POWER(D1518/M1518,1/9)-1 -> -1.9818591010472422 | O1518: =POWER(D1518/I1518,1/5)-1 -> -1.8295601673268167
A1519: 2680.HK | B1519: 创升控股 | C1519: 0.36 | D1519: -6577000 | E1519: -22517000 | F1519: 2380000 | G1519: 1607000 | H1519: 12259000 | I1519: 25431000 | J1519: 16847000 | K1519: 15727000 | L1519: -- | M1519: -- | N1519: =POWER(D1519/M1519,1/9)-1 -> #VALUE! | O1519: =POWER(D1519/I1519,1/5)-1 -> -1.763014657449105
A1520: 8392.HK | B1520: 舍图控股 | C1520: 0.03 | D1520: -6593000 | E1520: 3355000 | F1520: -7338000 | G1520: -11230000 | H1520: -7024000 | I1520: -4934000 | J1520: 10347000 | K1520: 9432000 | L1520: -- | M1520: -- | N1520: =POWER(D1520/M1520,1/9)-1 -> #VALUE! | O1520: =POWER(D1520/I1520,1/5)-1 -> 5.9684998151742441e-02
A1521: 8621.HK | B1521: Metropolis Cap | C1521: 0.02 | D1521: -6695969.9800000004 | E1521: -4102086.3399999999 | F1521: 2427914.1099999999 | G1521: 9727449.8900000006 | H1521: -55855953.329999998 | I1521: 505805.96999999997 | J1521: 6093276.1699999999 | K1521: 7234411.9699999997 | L1521: -- | M1521: -- | N1521: =POWER(D1521/M1521,1/9)-1 -> #VALUE! | O1521: =POWER(D1521/I1521,1/5)-1 -> -2.6763546728661565
A1522: 8439.HK | B1522: 新百利融资 | C1522: 0.51 | D1522: -6821000 | E1522: -3637000 | F1522: 8540000 | G1522: -5816000 | H1522: 9616000 | I1522: 5888000 | J1522: -2807000 | K1522: 9299000 | L1522: 18198000 | M1522: -- | N1522: =POWER(D1522/M1522,1/9)-1 -> #VALUE! | O1522: =POWER(D1522/I1522,1/5)-1 -> -2.0298549236019148
A1523: 8222.HK | B1523: 壹照明 | C1523: 0.04 | D1523: -6845000 | E1523: 2395000 | F1523: 8157000 | G1523: -4932000 | H1523: -24247000 | I1523: -27413000 | J1523: -12441000 | K1523: 5657000 | L1523: -12697000 | M1523: 5857000 | N1523: =POWER(D1523/M1523,1/9)-1 -> -2.0174709662350301 | O1523: =POWER(D1523/I1523,1/5)-1 -> -0.24232426790393324
A1524: 0682.HK | B1524: 超大现代 | C1524: 0.02 | D1524: -6861859.2000000002 | E1524: -19989941 | F1524: -31762809 | G1524: -15247446.5 | H1524: -61550734.149999999 | I1524: -850044359.20000005 | J1524: -3741771620.0999999 | K1524: -4932742764 | L1524: -8278630450.6499996 | M1524: -2422028544 | N1524: =POWER(D1524/M1524,1/9)-1 -> -0.47890361470274323 | O1524: =POWER(D1524/I1524,1/5)-1 -> -0.61858300298117697
A1525: 1703.HK | B1525: 维力生活科技 | C1525: 0.05 | D1525: -6940000 | E1525: -32013000 | F1525: -124269000 | G1525: -112371000 | H1525: 37749000 | I1525: 52982000 | J1525: 40394000 | K1525: 42294000 | L1525: -- | M1525: -- | N1525: =POWER(D1525/M1525,1/9)-1 -> #VALUE! | O1525: =POWER(D1525/I1525,1/5)-1 -> -1.6659570555070387
A1526: 3997.HK | B1526: 电讯首科 | C1526: 0.40000000000000002 | D1526: -7115000 | E1526: -1007000 | F1526: 9573000 | G1526: 2507000 | H1526: 9402000 | I1526: 25270000 | J1526: 22650000 | K1526: 22381000 | L1526: 24480000 | M1526: 14346000 | N1526: =POWER(D1526/M1526,1/9)-1 -> -1.9250398731965994 | O1526: =POWER(D1526/I1526,1/5)-1 -> -1.7760932969699614
A1527: 1463.HK | B1527: C-Link Sq | C1527: 0.54 | D1527: -7220538.1500000004 | E1527: -1430770.6499999999 | F1527: 5094485.0999999996 | G1527: -9774690.25 | H1527: 24831374.550000001 | I1527: 22303074 | J1527: 21534727.5 | K1527: 15929049 | L1527: -- | M1527: -- | N1527: =POWER(D1527/M1527,1/9)-1 -> #VALUE! | O1527: =POWER(D1527/I1527,1/5)-1 -> -1.7980699680843057
A1528: 0439.HK | B1528: 光启科学 | C1528: 0.52 | D1528: -7295000 | E1528: -67912000 | F1528: -40608000 | G1528: -78348000 | H1528: -294436000 | I1528: -457609000 | J1528: 66051000 | K1528: 664315000 | L1528: 30012000 | M1528: -37908000 | N1528: =POWER(D1528/M1528,1/9)-1 -> -0.16732186992786258 | O1528: =POWER(D1528/I1528,1/5)-1 -> -0.56297513454294601
A1529: 8246.HK | B1529: 中华燃气 | C1529: 0.19 | D1529: -7296307.2000000002 | E1529: -5927037.4000000004 | F1529: -234260319.5 | G1529: -156159162.30000001 | H1529: 49416967.5 | I1529: 94377415.400000006 | J1529: 50863332.5 | K1529: 105624312.5 | L1529: 21602862.449999999 | M1529: -40236039.700000003 | N1529: =POWER(D1529/M1529,1/9)-1 -> -0.17280144941394371 | O1529: =POWER(D1529/I1529,1/5)-1 -> -1.5993037652764541
A1530: 0339.HK | B1530: 核心经济投资 | C1530: 0.28 | D1530: -7360719 | E1530: -11797983 | F1530: -14991938 | G1530: -9090504 | H1530: -11182075 | I1530: -11590262 | J1530: -6591963 | K1530: -13044689 | L1530: -19702564 | M1530: 645136 | N1530: =POWER(D1530/M1530,1/9)-1 -> -2.3106125703564584 | O1530: =POWER(D1530/I1530,1/5)-1 -> -8.6801063506884324e-02
A1531: 8418.HK | B1531: 傲迪玛汽车 | C1531: 0.68 | D1531: -7457940 | E1531: -8666856 | F1531: -2459511 | G1531: -4626696 | H1531: -12473931 | I1531: -1567566 | J1531: 10363185 | K1531: 6188325 | L1531: -- | M1531: -- | N1531: =POWER(D1531/M1531,1/9)-1 -> #VALUE! | O1531: =POWER(D1531/I1531,1/5)-1 -> 0.36608779100403988
A1532: 8205.HK | B1532: 交大慧谷 | C1532: 0.22 | D1532: -7661353.79 | E1532: -24635735.699999999 | F1532: -5492824.54 | G1532: -28213982.469999999 | H1532: 5690311.04 | I1532: 6436943.6299999999 | J1532: -12101354.16 | K1532: -367765.14000000001 | L1532: 3079708.6000000001 | M1532: -16512746.359999999 | N1532: =POWER(D1532/M1532,1/9)-1 -> -8.1788110428387739e-02 | O1532: =POWER(D1532/I1532,1/5)-1 -> -2.0354405346011895
A1533: 8450.HK | B1533: 钜京控股 | C1533: 0.04 | D1533: -7680000 | E1533: -2781000 | F1533: -1729000 | G1533: 11262000 | H1533: -11543000 | I1533: 4737000 | J1533: 10216000 | K1533: 10754000 | L1533: 10633000 | M1533: -- | N1533: =POWER(D1533/M1533,1/9)-1 -> #VALUE! | O1533: =POWER(D1533/I1533,1/5)-1 -> -2.1014671949362533
A1534: 3738.HK | B1534: 阜博集团 | C1534: 1.24 | D1534: -7818000 | E1534: 42002000 | F1534: -22677000 | G1534: 81187000 | H1534: -48201530 | I1534: -19600668 | J1534: -19894444 | K1534: 22005852 | L1534: 20360563.5 | M1534: 14061628 | N1534: =POWER(D1534/M1534,1/9)-1 -> -1.9368570735206974 | O1534: =POWER(D1534/I1534,1/5)-1 -> -0.16792023884541762
A1535: 8296.HK | B1535: 中国生命集团 | C1535: 0.06 | D1535: -7863042.5999999996 | E1535: -955500.69999999995 | F1535: -12088264 | G1535: -3544710.6000000001 | H1535: -4250970 | I1535: -9509587.1999999993 | J1535: -23179532.600000001 | K1535: -35026600 | L1535: -11057222.1 | M1535: -13904101.800000001 | N1535: =POWER(D1535/M1535,1/9)-1 -> -6.1370525282091526e-02 | O1535: =POWER(D1535/I1535,1/5)-1 -> -3.7311480496771576e-02
A1536: 8031.HK | B1536: 易通讯集团 | C1536: 0.13 | D1536: -7922000 | E1536: -9296000 | F1536: -18620000 | G1536: -5137000 | H1536: 7591000 | I1536: 3946000 | J1536: 1115000 | K1536: 4814000 | L1536: 9190000 | M1536: 14383000 | N1536: =POWER(D1536/M1536,1/9)-1 -> -1.9358809242592749 | O1536: =POWER(D1536/I1536,1/5)-1 -> -2.1495703436192759
A1537: 0037.HK | B1537: 远东酒店实业 | C1537: 0.54 | D1537: -7946189 | E1537: 53982244 | F1537: 7890996 | G1537: -24044174 | H1537: -9595470 | I1537: 7435898 | J1537: -4775157 | K1537: -10549887 | L1537: -68017187 | M1537: -4348643 | N1537: =POWER(D1537/M1537,1/9)-1 -> 6.927511426014421e-02 | O1537: =POWER(D1537/I1537,1/5)-1 -> -2.0133631168940109
A1538: 2312.HK | B1538: 中国金融租赁 | C1538: 0.11 | D1538: -7967000 | E1538: -20502000 | F1538: -51597000 | G1538: -19807000 | H1538: -65683000 | I1538: -27128000 | J1538: -45370000 | K1538: -37656000 | L1538: -34148000 | M1538: -34874000 | N1538: =POWER(D1538/M1538,1/9)-1 -> -0.15129886344269139 | O1538: =POWER(D1538/I1538,1/5)-1 -> -0.21733591001080033
A1539: 9929.HK | B1539: 澳达控股 | C1539: 0.06 | D1539: -7970000 | E1539: -6945000 | F1539: -4826213.6100000003 | G1539: -19626213.66 | H1539: 19676699.100000001 | I1539: 40277670.049999997 | J1539: 37766019.560000002 | K1539: 18698058.32 | L1539: -- | M1539: -- | N1539: =POWER(D1539/M1539,1/9)-1 -> #VALUE! | O1539: =POWER(D1539/I1539,1/5)-1 -> -1.7232339362313758
A1540: 8028.HK | B1540: 天时资源 | C1540: 0.17 | D1540: -8044000 | E1540: 6948000 | F1540: 7976000 | G1540: -61734000 | H1540: -27785000 | I1540: 2002000 | J1540: -16574000 | K1540: -20621000 | L1540: -33443000 | M1540: -56903000 | N1540: =POWER(D1540/M1540,1/9)-1 -> -0.19537598829570635 | O1540: =POWER(D1540/I1540,1/5)-1 -> -2.3206921539240284
A1541: 6063.HK | B1541: 智中国际 | C1541: 0.20000000000000001 | D1541: -8102000 | E1541: -22656000 | F1541: 21736000 | G1541: 34158000 | H1541: 36490000 | I1541: 32555000 | J1541: 16403000 | K1541: -- | L1541: -- | M1541: -- | N1541: =POWER(D1541/M1541,1/9)-1 -> #VALUE! | O1541: =POWER(D1541/I1541,1/5)-1 -> -1.7571726317015011
A1542: 1917.HK | B1542: 豆盟科技 | C1542: 0.06 | D1542: -8245616.4000000004 | E1542: -61235524.200000003 | F1542: -133398254.5 | G1542: -87906200.700000003 | H1542: 12199747.5 | I1542: 49209153.399999999 | J1542: 41674962.899999999 | K1542: 26141045 | L1542: 25245089.300000001 | M1542: -- | N1542: =POWER(D1542/M1542,1/9)-1 -> #VALUE! | O1542: =POWER(D1542/I1542,1/5)-1 -> -1.6995768774767348
A1543: 1395.HK | B1543: 强泰环保 | C1543: 0.11 | D1543: -8265000 | E1543: -3291000 | F1543: 6145000 | G1543: -4956000 | H1543: 970000 | I1543: -139718000 | J1543: -61074000 | K1543: 10343000 | L1543: 39506000 | M1543: 9267000 | N1543: =POWER(D1543/M1543,1/9)-1 -> -1.9873660457722069 | O1543: =POWER(D1543/I1543,1/5)-1 -> -0.43193491175416654
A1544: 1939.HK | B1544: 东京中央拍卖 | C1544: 0.69999999999999996 | D1544: -8286000 | E1544: 8434000 | F1544: 8363000 | G1544: 8444000 | H1544: 8632000 | I1544: 44063000 | J1544: 30780000 | K1544: 18497000 | L1544: -- | M1544: -- | N1544: =POWER(D1544/M1544,1/9)-1 -> #VALUE! | O1544: =POWER(D1544/I1544,1/5)-1 -> -1.7159029850986576
A1545: 2310.HK | B1545: 时代环球集团 | C1545: 0.04 | D1545: -8290000 | E1545: -28348000 | F1545: -20940000 | G1545: -78780000 | H1545: -30444000 | I1545: -21820000 | J1545: -8529000 | K1545: -26074000 | L1545: -33055000 | M1545: -91806000 | N1545: =POWER(D1545/M1545,1/9)-1 -> -0.2344653910358997 | O1545: =POWER(D1545/I1545,1/5)-1 -> -0.17597581786456351
A1546: 1472.HK | B1546: 生兴控股 | C1546: 0.06 | D1546: -8397000 | E1546: 11975000 | F1546: 26424000 | G1546: 48030000 | H1546: 41035000 | I1546: 35003000 | J1546: 40445000 | K1546: 16576000 | L1546: -- | M1546: -- | N1546: =POWER(D1546/M1546,1/9)-1 -> #VALUE! | O1546: =POWER(D1546/I1546,1/5)-1 -> -1.7516294308742406
A1547: 8402.HK | B1547: 高原之宝 | C1547: 0.19 | D1547: -8511155.0199999996 | E1547: -39400133.119999997 | F1547: -55164689.759999998 | G1547: -19884073.41 | H1547: 30812379.170000002 | I1547: 37567035 | J1547: -2403428.9300000002 | K1547: 17342432.25 | L1547: 15766469.33 | M1547: -- | N1547: =POWER(D1547/M1547,1/9)-1 -> #VALUE! | O1547: =POWER(D1547/I1547,1/5)-1 -> -1.7430812726858698
A1548: 8148.HK | B1548: 悟喜生活 | C1548: -- | D1548: -8542000 | E1548: -21223000 | F1548: -83337000 | G1548: -71611000 | H1548: -61470000 | I1548: -38967000 | J1548: -48823000 | K1548: -37986000 | L1548: -20131000 | M1548: -1978000 | N1548: =POWER(D1548/M1548,1/9)-1 -> 0.17650177475828599 | O1548: =POWER(D1548/I1548,1/5)-1 -> -0.26180258661029354
A1549: 8429.HK | B1549: 华美乐乐 | C1549: 0.03 | D1549: -8601000 | E1549: -4445000 | F1549: -13491000 | G1549: -620000 | H1549: -1531000 | I1549: 2784000 | J1549: -2347000 | K1549: 9144000 | L1549: 5929000 | M1549: -- | N1549: =POWER(D1549/M1549,1/9)-1 -> #VALUE! | O1549: =POWER(D1549/I1549,1/5)-1 -> -2.2530717622489123
A1550: 8179.HK | B1550: 百利达集团控股 | C1550: 0.11 | D1550: -8699000 | E1550: 6725000 | F1550: -63163000 | G1550: -33712000 | H1550: -53422000 | I1550: -97367000 | J1550: -79417000 | K1550: -332265000 | L1550: 90249000 | M1550: 81626000 | N1550: =POWER(D1550/M1550,1/9)-1 -> -1.7797584516090548 | O1550: =POWER(D1550/I1550,1/5)-1 -> -0.38310463337620682
A1551: 8239.HK | B1551: 首都金融控股 | C1551: 0.59 | D1551: -8819000 | E1551: -7626000 | F1551: -19017000 | G1551: -75952000 | H1551: -36849000 | I1551: -29625000 | J1551: -14735000 | K1551: -254406000 | L1551: -959988000 | M1551: -61057000 | N1551: =POWER(D1551/M1551,1/9)-1 -> -0.19344954167042094 | O1551: =POWER(D1551/I1551,1/5)-1 -> -0.21521228373384071
A1552: 1867.HK | B1552: 标准发展集团 | C1552: 0.25 | D1552: -8829000 | E1552: -21010000 | F1552: 1006000 | G1552: 1043000 | H1552: 16129000 | I1552: 21940000 | J1552: 13210000 | K1552: 9957000 | L1552: 10545000 | M1552: -- | N1552: =POWER(D1552/M1552,1/9)-1 -> #VALUE! | O1552: =POWER(D1552/I1552,1/5)-1 -> -1.8335563776843
A1553: 0643.HK | B1553: 恒富控股 | C1553: 0.20000000000000001 | D1553: -8917000 | E1553: -7625000 | F1553: -19000 | G1553: -15274000 | H1553: -14825000 | I1553: -50615000 | J1553: -29956000 | K1553: -49719000 | L1553: -37983000 | M1553: -14724000 | N1553: =POWER(D1553/M1553,1/9)-1 -> -5.4200200658045983e-02 | O1553: =POWER(D1553/I1553,1/5)-1 -> -0.29337677899185233
A1554: 0924.HK | B1554: 坤集团 | C1554: 0.49 | D1554: -8949434.5399999991 | E1554: -3485870.21 | F1554: -1058462.5 | G1554: 20572374.289999999 | H1554: 21085721.109999999 | I1554: 20165235.84 | J1554: 21685883.969999999 | K1554: 17552628.75 | L1554: -- | M1554: -- | N1554: =POWER(D1554/M1554,1/9)-1 -> #VALUE! | O1554: =POWER(D1554/I1554,1/5)-1 -> -1.8500382294604953
A1555: 1915.HK | B1555: 泰和小贷 | C1555: 0.53 | D1555: -9024983.9100000001 | E1555: -10854507.130000001 | F1555: 5584807.3600000003 | G1555: 43784011.460000001 | H1555: 56008256.289999999 | I1555: 78284110.530000001 | J1555: 54950247.119999997 | K1555: 44984164.539999999 | L1555: 72211919.709999993 | M1555: 84223956.890000001 | N1555: =POWER(D1555/M1555,1/9)-1 -> -1.7802313953738125 | O1555: =POWER(D1555/I1555,1/5)-1 -> -1.6491642023264461
A1556: 8220.HK | B1556: 比高集团 | C1556: 1.18 | D1556: -9030000 | E1556: -13779000 | F1556: -21488000 | G1556: -41475000 | H1556: -26410000 | I1556: -10542000 | J1556: -60139000 | K1556: -49346000 | L1556: -65947000 | M1556: -59464000 | N1556: =POWER(D1556/M1556,1/9)-1 -> -0.18894896812926387 | O1556: =POWER(D1556/I1556,1/5)-1 -> -3.04885384076512e-02
A1557: 0979.HK | B1557: 绿色能源科技集团 | C1557: 0.19 | D1557: -9034000 | E1557: -27731000 | F1557: -21165000 | G1557: -26327000 | H1557: -25899000 | I1557: -- | J1557: -3118000 | K1557: -36630000 | L1557: -43148000 | M1557: -36198000 | N1557: =POWER(D1557/M1557,1/9)-1 -> -0.14291928470051862 | O1557: =POWER(D1557/I1557,1/5)-1 -> #VALUE!
A1558: 8285.HK | B1558: 森浩集团 | C1558: 0.02 | D1558: -9042553.8000000007 | E1558: -18383517.600000001 | F1558: -10528251 | G1558: -19082319 | H1558: -18771765 | I1558: -5990174.5999999996 | J1558: 4602577.0999999996 | K1558: 6953091.25 | L1558: 11880457.1 | M1558: -- | N1558: =POWER(D1558/M1558,1/9)-1 -> #VALUE! | O1558: =POWER(D1558/I1558,1/5)-1 -> 8.5851220952001039e-02
A1559: 8076.HK | B1559: 新利软件 | C1559: 0.01 | D1559: -9058996.8000000007 | E1559: -20735606.100000001 | F1559: -16858916 | G1559: -37192047.600000001 | H1559: 27941970 | I1559: 25280335.800000001 | J1559: 18940222.199999999 | K1559: 7809865 | L1559: 1521808.7 | M1559: 712550.90000000002 | N1559: =POWER(D1559/M1559,1/9)-1 -> -2.3264656978728881 | O1559: =POWER(D1559/I1559,1/5)-1 -> -1.8144406719818988
A1560: 8611.HK | B1560: Mindtell Tech | C1560: 0.07 | D1560: -9107196 | E1560: -11752299.199999999 | F1560: -11578282.5 | G1560: -21291101.199999999 | H1560: 2459212.7999999998 | I1560: 14663217.4 | J1560: 31584643.199999999 | K1560: 14575283.800000001 | L1560: -- | M1560: -- | N1560: =POWER(D1560/M1560,1/9)-1 -> #VALUE! | O1560: =POWER(D1560/I1560,1/5)-1 -> -1.9091406611728079
A1561: 0834.HK | B1561: 康大食品 | C1561: 0.29999999999999999 | D1561: -9156558.5999999996 | E1561: -17391917.699999999 | F1561: -49734292 | G1561: -42976338.299999997 | H1561: 4879005 | I1561: 6423981.2000000002 | J1561: -18922238.699999999 | K1561: 6995318.75 | L1561: -32999963 | M1561: -4936692.4000000004 | N1561: =POWER(D1561/M1561,1/9)-1 -> 7.1052329614984089e-02 | O1561: =POWER(D1561/I1561,1/5)-1 -> -2.0734593511045221
A1562: 1871.HK | B1562: 向中国际 | C1562: 0.24 | D1562: -9255216.5999999996 | E1562: -9777242.6999999993 | F1562: -4224525 | G1562: 8134717.5 | H1562: 21326370 | I1562: 24223715 | J1562: 20263807.800000001 | K1562: 20134738.75 | L1562: 12042752 | M1562: -- | N1562: =POWER(D1562/M1562,1/9)-1 -> #VALUE! | O1562: =POWER(D1562/I1562,1/5)-1 -> -1.8249529269354441
A1563: 0976.HK | B1563: 齐合环保 | C1563: 0.51 | D1563: -9300000 | E1563: 264500000 | F1563: 702000000 | G1563: -848100000 | H1563: -128700000 | I1563: 401200000 | J1563: 426800000 | K1563: -439900000 | L1563: -1138804000 | M1563: -1057980000 | N1563: =POWER(D1563/M1563,1/9)-1 -> -0.40904261312963375 | O1563: =POWER(D1563/I1563,1/5)-1 -> -1.4710037933456579
A1564: 8356.HK | B1564: 中国新华电视 | C1564: 0.72 | D1564: -9440000 | E1564: -41729000 | F1564: -72946000 | G1564: -100831000 | H1564: -65302000 | I1564: -45817000 | J1564: -104527000 | K1564: -46443000 | L1564: -41723000 | M1564: -431292000 | N1564: =POWER(D1564/M1564,1/9)-1 -> -0.34599985663052846 | O1564: =POWER(D1564/I1564,1/5)-1 -> -0.27089669137801398
A1565: 1849.HK | B1565: 秀商时代控股 | C1565: 0.08 | D1565: -9442069 | E1565: 6223126 | F1565: 44690960 | G1565: 13778233.5 | H1565: 15567667.5 | I1565: 22953600 | J1565: 18374035 | K1565: 16383444 | L1565: -- | M1565: -- | N1565: =POWER(D1565/M1565,1/9)-1 -> #VALUE! | O1565: =POWER(D1565/I1565,1/5)-1 -> -1.8372270897140897
A1566: 2167.HK | B1566: 天润云 | C1566: 2.62 | D1566: -9461302.1999999993 | E1566: -8318609.4000000004 | F1566: 21818141 | G1566: 83632047.299999997 | H1566: -- | I1566: -- | J1566: -- | K1566: -- | L1566: -- | M1566: -- | N1566: =POWER(D1566/M1566,1/9)-1 -> #VALUE! | O1566: =POWER(D1566/I1566,1/5)-1 -> #VALUE!
A1567: 8091.HK | B1567: 奥传思维控股 | C1567: 0.04 | D1567: -9462000 | E1567: -3050000 | F1567: -4692000 | G1567: -5687000 | H1567: 644000 | I1567: 3439000 | J1567: -1884000 | K1567: 14196000 | L1567: 11659000 | M1567: -- | N1567: =POWER(D1567/M1567,1/9)-1 -> #VALUE! | O1567: =POWER(D1567/I1567,1/5)-1 -> -2.2243628780558544
A1568: 8221.HK | B1568: 高裕金融 | C1568: 0.03 | D1568: -9514000 | E1568: -24791000 | F1568: -16060000 | G1568: -6216000 | H1568: 22028000 | I1568: 35106000 | J1568: 25573000 | K1568: 6955000 | L1568: 16532000 | M1568: 18399000 | N1568: =POWER(D1568/M1568,1/9)-1 -> -1.9293393476497955 | O1568: =POWER(D1568/I1568,1/5)-1 -> -1.770187311827029
A1569: 8333.HK | B1569: 阿仕特朗金融 | C1569: 0.47 | D1569: -9562000 | E1569: -34116000 | F1569: -8873000 | G1569: -2121000 | H1569: 12030000 | I1569: 22485000 | J1569: 22865000 | K1569: 16918000 | L1569: 38337000 | M1569: 20192000 | N1569: =POWER(D1569/M1569,1/9)-1 -> -1.9203010839178143 | O1569: =POWER(D1569/I1569,1/5)-1 -> -1.8428128907653325
A1570: 8096.HK | B1570: 赏之味 | C1570: 0.09 | D1570: -9650000 | E1570: -13833000 | F1570: -13384000 | G1570: -56436000 | H1570: -12261000 | I1570: 12972000 | J1570: 6234000 | K1570: -- | L1570: -- | M1570: -- | N1570: =POWER(D1570/M1570,1/9)-1 -> #VALUE! | O1570: =POWER(D1570/I1570,1/5)-1 -> -1.9425492987905471
A1571: 8349.HK | B1571: 硅鑫集团 | C1571: 0.69999999999999996 | D1571: -9767142 | E1571: -- | F1571: -2501653.5 | G1571: 6613853.0999999996 | H1571: 3882195 | I1571: 1673742 | J1571: 818848.69999999995 | K1571: -8635523.75 | L1571: 5151099 | M1571: 4436284.5 | N1571: =POWER(D1571/M1571,1/9)-1 -> -2.0916492570939562 | O1571: =POWER(D1571/I1571,1/5)-1 -> -2.4230357067193111
A1572: 8059.HK | B1572: 朝威控股 | C1572: 0.01 | D1572: -9773000 | E1572: -10329000 | F1572: -36846000 | G1572: -15250000 | H1572: -44411000 | I1572: -194804000 | J1572: 18138000 | K1572: -68092000 | L1572: 10614000 | M1572: 4822000 | N1572: =POWER(D1572/M1572,1/9)-1 -> -2.0816555073142018 | O1572: =POWER(D1572/I1572,1/5)-1 -> -0.45035028677821887
A1573: 8417.HK | B1573: 大地教育 | C1573: 0.02 | D1573: -9861000 | E1573: -5148000 | F1573: 6041000 | G1573: -4508000 | H1573: -522000 | I1573: 445000 | J1573: 2652000 | K1573: 8399000 | L1573: 10972000 | M1573: 10160000 | N1573: =POWER(D1573/M1573,1/9)-1 -> -1.996686517428889 | O1573: =POWER(D1573/I1573,1/5)-1 -> -2.8582844363116191
A1574: 8337.HK | B1574: 直通电讯 | C1574: 0.09 | D1574: -9935000 | E1574: -12317000 | F1574: -14205000 | G1574: -668000 | H1574: -59076000 | I1574: -1778000 | J1574: -6222000 | K1574: 3243000 | L1574: -36040000 | M1574: -24940000 | N1574: =POWER(D1574/M1574,1/9)-1 -> -9.721213333974188e-02 | O1574: =POWER(D1574/I1574,1/5)-1 -> 0.41074078771308953
A1575: 8217.HK | B1575: 万民好物 | C1575: 0.07 | D1575: -9963000 | E1575: -20147000 | F1575: -13130000 | G1575: -55567000 | H1575: -6048000 | I1575: -2892000 | J1575: 30549000 | K1575: 8391000 | L1575: 18079000 | M1575: 9430000 | N1575: =POWER(D1575/M1575,1/9)-1 -> -2.0061278248152168 | O1575: =POWER(D1575/I1575,1/5)-1 -> 0.28067333854114329
A1576: 1615.HK | B1576: 奥邦建筑 | C1576: 0.22 | D1576: -9981553.4299999997 | E1576: 14933980.640000001 | F1576: -6448543.71 | G1576: -49295145.810000002 | H1576: 19639805.899999999 | I1576: 23974757.370000001 | J1576: 34758252.560000002 | K1576: 58510679.829999998 | L1576: 52316505.049999997 | M1576: 52281553.590000004 | N1576: =POWER(D1576/M1576,1/9)-1 -> -1.8319445972022905 | O1576: =POWER(D1576/I1576,1/5)-1 -> -1.8392450396335627
A1577: 0352.HK | B1577: 富阳 | C1577: 0.14 | D1577: -10002825 | E1577: -16085577.9 | F1577: -3563295 | G1577: 69130.199999999997 | H1577: -13892760 | I1577: -8599845.8000000007 | J1577: -19954491.600000001 | K1577: -6059646.25 | L1577: -5790870.2000000002 | M1577: -7543555.5 | N1577: =POWER(D1577/M1577,1/9)-1 -> 3.1849330625139949e-02 | O1577: =POWER(D1577/I1577,1/5)-1 -> 3.0686057800809685e-02
A1578: 8395.HK | B1578: 齐家控股 | C1578: 0.65 | D1578: -10014000 | E1578: 5230000 | F1578: 14559000 | G1578: 5216000 | H1578: 1092000 | I1578: -10102000 | J1578: -7148000 | K1578: 7794000 | L1578: 6790000 | M1578: -- | N1578: =POWER(D1578/M1578,1/9)-1 -> #VALUE! | O1578: =POWER(D1578/I1578,1/5)-1 -> -1.7483319116911034e-03
A1579: 0862.HK | B1579: 远见控股 | C1579: 0.03 | D1579: -10029000 | E1579: -37546000 | F1579: -68934000 | G1579: -108328000 | H1579: -66613000 | I1579: 9819000 | J1579: -46055000 | K1579: -26803000 | L1579: -45189000 | M1579: -14080000 | N1579: =POWER(D1579/M1579,1/9)-1 -> -3.6995468535884646e-02 | O1579: =POWER(D1579/I1579,1/5)-1 -> -2.0042412913088272
A1580: 8050.HK | B1580: 量子思维 | C1580: 0.14 | D1580: -10108000 | E1580: -18189000 | F1580: 16703000 | G1580: -26710000 | H1580: -22928000 | I1580: -8519000 | J1580: -39606000 | K1580: -4253000 | L1580: -2819000 | M1580: -10481000 | N1580: =POWER(D1580/M1580,1/9)-1 -> -4.0182279705242019e-03 | O1580: =POWER(D1580/I1580,1/5)-1 -> 3.4797386060536617e-02
A1581: 8071.HK | B1581: 中彩网通控股 | C1581: 0.01 | D1581: -10108000 | E1581: -9746000 | F1581: -19195000 | G1581: -17315000 | H1581: -5680000 | I1581: 16197000 | J1581: -48293000 | K1581: -37043000 | L1581: -54679000 | M1581: -186051000 | N1581: =POWER(D1581/M1581,1/9)-1 -> -0.27648400596790779 | O1581: =POWER(D1581/I1581,1/5)-1 -> -1.9100099276041287
A1582: 1160.HK | B1582: 金石资本集团 | C1582: 0.27 | D1582: -10172000 | E1582: -6035000 | F1582: -8379000 | G1582: -10215000 | H1582: -9418000 | I1582: -10438000 | J1582: -5977000 | K1582: -11922000 | L1582: 1131000 | M1582: -3876000 | N1582: =POWER(D1582/M1582,1/9)-1 -> 0.11316121153162695 | O1582: =POWER(D1582/I1582,1/5)-1 -> -5.1495246360727664e-03
A1583: 8019.HK | B1583: 皓文控股 | C1583: 0.18 | D1583: -10280163.6 | E1583: -59564808.100000001 | F1583: -11545810.5 | G1583: -30478074.899999999 | H1583: -27993375 | I1583: -10888431.800000001 | J1583: -73128104.400000006 | K1583: -93368336.25 | L1583: -108985729.55 | M1583: -15754737.5 | N1583: =POWER(D1583/M1583,1/9)-1 -> -4.6328593385721817e-02 | O1583: =POWER(D1583/I1583,1/5)-1 -> -1.1431112345763217e-02
A1584: 1901.HK | B1584: 飞扬集团 | C1584: 0.10000000000000001 | D1584: -10496115 | E1584: -44563334.299999997 | F1584: -168340586.5 | G1584: -102943211.09999999 | H1584: 18306885 | I1584: 26752545.600000001 | J1584: 35903458.299999997 | K1584: 19939158.75 | L1584: -- | M1584: -- | N1584: =POWER(D1584/M1584,1/9)-1 -> #VALUE! | O1584: =POWER(D1584/I1584,1/5)-1 -> -1.8293401548306285
A1585: 2700.HK | B1585: 格林国际控股 | C1585: 0.29999999999999999 | D1585: -10626000 | E1585: -13229000 | F1585: -69180000 | G1585: -59274000 | H1585: -147992000 | I1585: -79454000 | J1585: -323029000 | K1585: -134537000 | L1585: -205103000 | M1585: -99147000 | N1585: =POWER(D1585/M1585,1/9)-1 -> -0.2197527472391132 | O1585: =POWER(D1585/I1585,1/5)-1 -> -0.33126999612275154
A1586: 0227.HK | B1586: 第一上海 | C1586: 0.13 | D1586: -10629000 | E1586: -55501000 | F1586: -139899000 | G1586: -90331000 | H1586: 10618000 | I1586: 33403000 | J1586: 61944000 | K1586: -49909000 | L1586: 134862000 | M1586: 211091000 | N1586: =POWER(D1586/M1586,1/9)-1 -> -1.7174312649241901 | O1586: =POWER(D1586/I1586,1/5)-1 -> -1.7953190529660201
A1587: 8156.HK | B1587: 国药科技股份 | C1587: 0.10000000000000001 | D1587: -10635000 | E1587: -87998000 | F1587: -106340000 | G1587: -161075000 | H1587: -46796000 | I1587: -61034000 | J1587: -175027000 | K1587: -206778000 | L1587: 19107000 | M1587: 14887000 | N1587: =POWER(D1587/M1587,1/9)-1 -> -1.9633187955282887 | O1587: =POWER(D1587/I1587,1/5)-1 -> -0.29492854553776449
A1588: 0070.HK | B1588: 金粤控股 | C1588: 0.05 | D1588: -10849000 | E1588: -3631000 | F1588: -30356000 | G1588: -85705000 | H1588: 42579000 | I1588: 39009000 | J1588: -10153000 | K1588: -202108000 | L1588: -828012000 | M1588: 148762000 | N1588: =POWER(D1588/M1588,1/9)-1 -> -1.7475759132979998 | O1588: =POWER(D1588/I1588,1/5)-1 -> -1.7741854026424442
A1589: 3919.HK | B1589: 金力集团 | C1589: 0.05 | D1589: -10919000 | E1589: -22794000 | F1589: 4712000 | G1589: 12340000 | H1589: 7380000 | I1589: 6195000 | J1589: 23321000 | K1589: 24040000 | L1589: 3399000 | M1589: 11693000 | N1589: =POWER(D1589/M1589,1/9)-1 -> -1.9924193258940257 | O1589: =POWER(D1589/I1589,1/5)-1 -> -2.1200265329834211
A1590: 2370.HK | B1590: 力高健康生活 | C1590: 1.68 | D1590: -10943364.6 | E1590: -- | F1590: 39355430 | G1590: 47213542.799999997 | H1590: -- | I1590: -- | J1590: -- | K1590: -- | L1590: -- | M1590: -- | N1590: =POWER(D1590/M1590,1/9)-1 -> #VALUE! | O1590: =POWER(D1590/I1590,1/5)-1 -> #VALUE!
A1591: 8268.HK | B1591: 智城发展控股 | C1591: 0.35 | D1591: -10975000 | E1591: 15336000 | F1591: 9860000 | G1591: -3216000 | H1591: -14917000 | I1591: 38831000 | J1591: 65535000 | K1591: 10856000 | L1591: -3977000 | M1591: 15946000 | N1591: =POWER(D1591/M1591,1/9)-1 -> -1.9593399492073942 | O1591: =POWER(D1591/I1591,1/5)-1 -> -1.7766854882802878
A1592: 1637.HK | B1592: 顺兴集团控股 | C1592: 0.11 | D1592: -11002000 | E1592: 11733000 | F1592: 44134000 | G1592: 26027000 | H1592: 22697000 | I1592: 35586000 | J1592: 10052000 | K1592: 23648000 | L1592: 12142000 | M1592: 25018000 | N1592: =POWER(D1592/M1592,1/9)-1 -> -1.9127622547325505 | O1592: =POWER(D1592/I1592,1/5)-1 -> -1.7907487120828829
A1593: 1440.HK | B1593: 应星控股 | C1593: 2.87 | D1593: -11061754.199999999 | E1593: -10081829.699999999 | F1593: 25937359 | G1593: 52230249.899999999 | H1593: 46768492.5 | I1593: 35922830 | J1593: 20139122.199999999 | K1593: -- | L1593: -- | M1593: -- | N1593: =POWER(D1593/M1593,1/9)-1 -> #VALUE! | O1593: =POWER(D1593/I1593,1/5)-1 -> -1.7901157011587019
A1594: 1597.HK | B1594: 纳泉能源科技 | C1594: 4.5 | D1594: -11119852.800000001 | E1594: 6062409.4000000004 | F1594: 25798990.5 | G1594: 47882198.700000003 | H1594: 47544037.5 | I1594: 30563439.800000001 | J1594: 7674158.9000000004 | K1594: -- | L1594: -- | M1594: -- | N1594: =POWER(D1594/M1594,1/9)-1 -> #VALUE! | O1594: =POWER(D1594/I1594,1/5)-1 -> -1.8169196855064604
A1595: 1183.HK | B1595: 澳能建设 | C1595: 0.17 | D1595: -11247572.859999999 | E1595: 78974757.569999993 | F1595: 122782524.73 | G1595: 49436893.390000001 | H1595: 54691262.340000004 | I1595: 53411650.68 | J1595: 75916505.140000001 | K1595: 66020388.590000004 | L1595: 94247573.159999996 | M1595: 70828155.599999994 | N1595: =POWER(D1595/M1595,1/9)-1 -> -1.815090583377879 | O1595: =POWER(D1595/I1595,1/5)-1 -> -1.7322924609333819
A1596: 2336.HK | B1596: 硕奥国际 | C1596: 0.12 | D1596: -11313000 | E1596: -9813000 | F1596: -9754000 | G1596: -9808000 | H1596: -10825000 | I1596: -485000 | J1596: 5321000 | K1596: -15896000 | L1596: -16367000 | M1596: -11419000 | N1596: =POWER(D1596/M1596,1/9)-1 -> -1.0356997119074229e-03 | O1596: =POWER(D1596/I1596,1/5)-1 -> 0.87744494188374822
A1597: 8286.HK | B1597: 长城微光 | C1597: 0.08 | D1597: -11391710.4 | E1597: 14022283 | F1597: -49457555 | G1597: -33267120.899999999 | H1597: -9074100 | I1597: -33289248.199999999 | J1597: -34210611.5 | K1597: -37333555 | L1597: -17470222.75 | M1597: -14108757.4 | N1597: =POWER(D1597/M1597,1/9)-1 -> -2.3487523049369297e-02 | O1597: =POWER(D1597/I1597,1/5)-1 -> -0.19303074311468793
A1598: 0396.HK | B1598: 兴利(香港)控股 | C1598: 0.12 | D1598: -11456000 | E1598: -26796000 | F1598: -5519000 | G1598: -59205000 | H1598: -105478000 | I1598: -74189000 | J1598: 9174000 | K1598: 10570000 | L1598: 16713000 | M1598: 28120000 | N1598: =POWER(D1598/M1598,1/9)-1 -> -1.9050417879134303 | O1598: =POWER(D1598/I1598,1/5)-1 -> -0.31176192123876512
A1599: 8445.HK | B1599: 怡康泰工程集团 | C1599: 0.21 | D1599: -11611000 | E1599: -36420000 | F1599: -8515000 | G1599: -8372000 | H1599: 11930000 | I1599: 13241000 | J1599: 12556000 | K1599: 12321000 | L1599: -- | M1599: -- | N1599: =POWER(D1599/M1599,1/9)-1 -> #VALUE! | O1599: =POWER(D1599/I1599,1/5)-1 -> -1.9740691028783512
A1600: 1069.HK | B1600: 中国健康科技集团 | C1600: 0.06 | D1600: -11646720 | E1600: -22139460 | F1600: -- | G1600: -- | H1600: -380490870 | I1600: -74294788.599999994 | J1600: -9278287.0999999996 | K1600: -58287285 | L1600: -70391296.700000003 | M1600: -112712823.8 | N1600: =POWER(D1600/M1600,1/9)-1 -> -0.22291230186267985 | O1600: =POWER(D1600/I1600,1/5)-1 -> -0.30968222421770164
A1601: 8060.HK | B1601: 国联通信 | C1601: 0.10000000000000001 | D1601: -11815000 | E1601: -21192000 | F1601: 2265000 | G1601: -23192000 | H1601: -10467000 | I1601: -4777000 | J1601: -21904000 | K1601: -28788000 | L1601: -42462000 | M1601: -56809000 | N1601: =POWER(D1601/M1601,1/9)-1 -> -0.16010680097736907 | O1601: =POWER(D1601/I1601,1/5)-1 -> 0.19854873242489002
A1602: 0475.HK | B1602: 中发展控股 | C1602: 0.67 | D1602: -11906000 | E1602: -13976000 | F1602: -24613000 | G1602: -33476000 | H1602: -35605000 | I1602: -23099000 | J1602: -37941000 | K1602: -36806000 | L1602: -22154000 | M1602: -19992000 | N1602: =POWER(D1602/M1602,1/9)-1 -> -5.5960949402150462e-02 | O1602: =POWER(D1602/I1602,1/5)-1 -> -0.12414030847236013
A1603: 1163.HK | B1603: 虎视传媒 | C1603: 0.14 | D1603: -11920078.800000001 | E1603: 10139362.800000001 | F1603: 14489508.5 | G1603: 3442207.2000000002 | H1603: 22368997.5 | I1603: 24187279.800000001 | J1603: 29715935.399999999 | K1603: 7378700 | L1603: -- | M1603: -- | N1603: =POWER(D1603/M1603,1/9)-1 -> #VALUE! | O1603: =POWER(D1603/I1603,1/5)-1 -> -1.8680373642269892
A1604: 8631.HK | B1604: 申港控股 | C1604: 0.52 | D1604: -12066000 | E1604: -3134000 | F1604: -7503000 | G1604: 1699000 | H1604: -179000 | I1604: 4882000 | J1604: 12355000 | K1604: 5051000 | L1604: -- | M1604: -- | N1604: =POWER(D1604/M1604,1/9)-1 -> #VALUE! | O1604: =POWER(D1604/I1604,1/5)-1 -> -2.1983760176539349
A1605: 0092.HK | B1605: 冠军科技集团 | C1605: 0.20000000000000001 | D1605: -12183000 | E1605: -50869000 | F1605: -59822000 | G1605: -39521000 | H1605: -72177000 | I1605: -3811905000 | J1605: -4188139000 | K1605: -28590000 | L1605: 7382000 | M1605: 2228000 | N1605: =POWER(D1605/M1605,1/9)-1 -> -2.2077641032791284 | O1605: =POWER(D1605/I1605,1/5)-1 -> -0.68309985703774645
A1606: 8375.HK | B1606: 弘浩国际控股 | C1606: 0.15 | D1606: -12188000 | E1606: -18546000 | F1606: 5077000 | G1606: 804000 | H1606: 1546000 | I1606: 5133000 | J1606: -607000 | K1606: 9126000 | L1606: 6650000 | M1606: -- | N1606: =POWER(D1606/M1606,1/9)-1 -> #VALUE! | O1606: =POWER(D1606/I1606,1/5)-1 -> -2.1888094159606215
A1607: 1865.HK | B1607: 卓航控股 | C1607: 0.02 | D1607: -12193637 | E1607: 5927424 | F1607: 18790223 | G1607: 8533056 | H1607: 3960702 | I1607: 26900289 | J1607: 18070000 | K1607: 23102655.5 | L1607: -- | M1607: -- | N1607: =POWER(D1607/M1607,1/9)-1 -> #VALUE! | O1607: =POWER(D1607/I1607,1/5)-1 -> -1.8536409948225852
A1608: 8007.HK | B1608: 环球战略集团 | C1608: 0.05 | D1608: -12229000 | E1608: -15504000 | F1608: -20982000 | G1608: -101836000 | H1608: -- | I1608: -70595000 | J1608: -33225000 | K1608: -33224000 | L1608: -81455000 | M1608: -2055000 | N1608: =POWER(D1608/M1608,1/9)-1 -> 0.21917022190581248 | O1608: =POWER(D1608/I1608,1/5)-1 -> -0.2957556028676066
A1609: 8103.HK | B1609: Hmvod视频 | C1609: 0.65 | D1609: -12331000 | E1609: -28144000 | F1609: -8599000 | G1609: -39134000 | H1609: -33589000 | I1609: -86135000 | J1609: -39686000 | K1609: -19802000 | L1609: -460000 | M1609: -207019000 | N1609: =POWER(D1609/M1609,1/9)-1 -> -0.269050176271314 | O1609: =POWER(D1609/I1609,1/5)-1 -> -0.32210297506389662
A1610: 8419.HK | B1610: AV策划推广 | C1610: 0.06 | D1610: -12369000 | E1610: -53529000 | F1610: -9723000 | G1610: 7146000 | H1610: 24516000 | I1610: 21645000 | J1610: -4610000 | K1610: 6280000 | L1610: 3200000 | M1610: -- | N1610: =POWER(D1610/M1610,1/9)-1 -> #VALUE! | O1610: =POWER(D1610/I1610,1/5)-1 -> -1.8941191567811169
A1611: 8213.HK | B1611: 荣晖控股 | C1611: 0.56 | D1611: -12391000 | E1611: -19810000 | F1611: 2521000 | G1611: -22967000 | H1611: -75916000 | I1611: -37687000 | J1611: -47333000 | K1611: -38705000 | L1611: -36643000 | M1611: -27712000 | N1611: =POWER(D1611/M1611,1/9)-1 -> -8.55502787813891e-02 | O1611: =POWER(D1611/I1611,1/5)-1 -> -0.19946014564150361
A1612: 8048.HK | B1612: 御德国际控股 | C1612: 0.03 | D1612: -12405000 | E1612: -6915000 | F1612: -8908000 | G1612: -8717000 | H1612: -14680000 | I1612: -23668000 | J1612: -10387000 | K1612: -42763000 | L1612: -28467000 | M1612: -27019000 | N1612: =POWER(D1612/M1612,1/9)-1 -> -8.2858408808927919e-02 | O1612: =POWER(D1612/I1612,1/5)-1 -> -0.12120608396622534
A1613: 0145.HK | B1613: 信能低碳 | C1613: 0.15 | D1613: -12567000 | E1613: -51972000 | F1613: -65923000 | G1613: -67422000 | H1613: -109325000 | I1613: -1371738000 | J1613: -193233000 | K1613: -201928000 | L1613: -815428000 | M1613: -243371000 | N1613: =POWER(D1613/M1613,1/9)-1 -> -0.28055787133372956 | O1613: =POWER(D1613/I1613,1/5)-1 -> -0.60880608649345946
A1614: 0110.HK | B1614: 中国长远 | C1614: 0.22 | D1614: -12616000 | E1614: -14372000 | F1614: -9928000 | G1614: 219000 | H1614: -26093000 | I1614: 7799000 | J1614: -111714000 | K1614: -49807000 | L1614: -23118000 | M1614: -24482000 | N1614: =POWER(D1614/M1614,1/9)-1 -> -7.1015838538534437e-02 | O1614: =POWER(D1614/I1614,1/5)-1 -> -2.1009727044806024
A1615: 1747.HK | B1615: Home Control | C1615: 0.32 | D1615: -12646009 | E1615: 35721600 | F1615: 29679188 | G1615: 28895431 | H1615: 21351954 | I1615: 28586266 | J1615: 41132896 | K1615: 44368388 | L1615: -- | M1615: -- | N1615: =POWER(D1615/M1615,1/9)-1 -> #VALUE! | O1615: =POWER(D1615/I1615,1/5)-1 -> -1.8494918393983975
A1616: 0840.HK | B1616: 天业节水 | C1616: 0.19 | D1616: -12666550.779999999 | E1616: -88190367.689999998 | F1616: -81841051.799999997 | G1616: 774686.06000000006 | H1616: -53582430.979999997 | I1616: -54239270.82 | J1616: 1616899.04 | K1616: -69846072.450000003 | L1616: -7989924.9199999999 | M1616: 2595042.25 | N1616: =POWER(D1616/M1616,1/9)-1 -> -2.192618517897289 | O1616: =POWER(D1616/I1616,1/5)-1 -> -0.25240066699122787
A1617: 1220.HK | B1617: 志道国际 | C1617: 0.04 | D1617: -12747000 | E1617: -24910000 | F1617: -5351000 | G1617: -79539000 | H1617: 3578000 | I1617: 2525000 | J1617: -13624000 | K1617: -73673000 | L1617: -6765000 | M1617: -6504000 | N1617: =POWER(D1617/M1617,1/9)-1 -> 7.7630108867443148e-02 | O1617: =POWER(D1617/I1617,1/5)-1 -> -2.3823859802500373
A1618: 8247.HK | B1618: 中生北控生物科技 | C1618: 0.59 | D1618: -12768537.6 | E1618: 9144378.5999999996 | F1618: -1395930 | G1618: 3239584.2000000002 | H1618: -- | I1618: -2332991.3999999999 | J1618: 30176313 | K1618: 17757775 | L1618: 691517.40000000002 | M1618: 10588431.5 | N1618: =POWER(D1618/M1618,1/9)-1 -> -2.0210203357117691 | O1618: =POWER(D1618/I1618,1/5)-1 -> 0.40490062066114652
A1619: 8131.HK | B1619: 辰罡科技 | C1619: 0.12 | D1619: -12782000 | E1619: 9110000 | F1619: 15640000 | G1619: -2987000 | H1619: -4965000 | I1619: -5049000 | J1619: -5828000 | K1619: -4295000 | L1619: -14227000 | M1619: 2057000 | N1619: =POWER(D1619/M1619,1/9)-1 -> -2.2250437910737153 | O1619: =POWER(D1619/I1619,1/5)-1 -> 0.20414472779255766
A1620: 0585.HK | B1620: 意力国际 | C1620: 0.34 | D1620: -12845000 | E1620: -10972000 | F1620: -33699000 | G1620: 265869000 | H1620: -159496000 | I1620: -117563000 | J1620: -441038000 | K1620: -424549000 | L1620: -81238000 | M1620: 3455000 | N1620: =POWER(D1620/M1620,1/9)-1 -> -2.1570846105747354 | O1620: =POWER(D1620/I1620,1/5)-1 -> -0.35776689282647256
A1621: 0111.HK | B1621: 信达国际控股 | C1621: 0.24 | D1621: -12849000 | E1621: -22408000 | F1621: 57794000 | G1621: 83671000 | H1621: 51559000 | I1621: 55174000 | J1621: 66361000 | K1621: 41080000 | L1621: 40586000 | M1621: 28230000 | N1621: =POWER(D1621/M1621,1/9)-1 -> -1.9162576331137982 | O1621: =POWER(D1621/I1621,1/5)-1 -> -1.7471829819383196
A1622: 0687.HK | B1622: 泰升集团 | C1622: 0.31 | D1622: -13038000 | E1622: 4525000 | F1622: -107000 | G1622: -104882000 | H1622: -766655000 | I1622: 360908000 | J1622: 6004000 | K1622: 396874000 | L1622: 399394000 | M1622: 270020000 | N1622: =POWER(D1622/M1622,1/9)-1 -> -1.7140970304623377 | O1622: =POWER(D1622/I1622,1/5)-1 -> -1.514710340829498
A1623: 0329.HK | B1623: 东建国际 | C1623: 0.76 | D1623: -13118000 | E1623: -75708000 | F1623: -122622000 | G1623: -19556000 | H1623: -96897000 | I1623: -60792000 | J1623: 42584000 | K1623: -449897000 | L1623: 33369000 | M1623: 321665000 | N1623: =POWER(D1623/M1623,1/9)-1 -> -1.7008209741522187 | O1623: =POWER(D1623/I1623,1/5)-1 -> -0.26412467773486192
A1624: 1241.HK | B1624: 双桦控股 | C1624: 0.06 | D1624: -13271693.4 | E1624: -22504466.899999999 | F1624: -22752434.5 | G1624: -6141860.7000000002 | H1624: -35063797.5 | I1624: -15080757 | J1624: -20605494.300000001 | K1624: -18164492.5 | L1624: -45858893.700000003 | M1624: 11639163.300000001 | N1624: =POWER(D1624/M1624,1/9)-1 -> -2.0146910788366141 | O1624: =POWER(D1624/I1624,1/5)-1 -> -2.5233400510713433e-02
A1625: 1335.HK | B1625: 顺泰控股 | C1625: 0.19 | D1625: -13389000 | E1625: 7313000 | F1625: -6794000 | G1625: 15053000 | H1625: -47873000 | I1625: -26498000 | J1625: -165219000 | K1625: 36132000 | L1625: 326530000 | M1625: 92507000 | N1625: =POWER(D1625/M1625,1/9)-1 -> -1.8067340614159719 | O1625: =POWER(D1625/I1625,1/5)-1 -> -0.1276173712054447
A1626: 8607.HK | B1626: 纳尼亚集团 | C1626: 0.04 | D1626: -13456951.199999999 | E1626: -3558027.3999999999 | F1626: -38833793 | G1626: -11797426.199999999 | H1626: 34915170 | I1626: 44739009.799999997 | J1626: 16721058.300000001 | K1626: 9282271.25 | L1626: -- | M1626: -- | N1626: =POWER(D1626/M1626,1/9)-1 -> #VALUE! | O1626: =POWER(D1626/I1626,1/5)-1 -> -1.786415495006487
A1627: 8475.HK | B1627: 易站绿色科技 | C1627: 0.5 | D1627: -13458294.5 | E1627: -14375960 | F1627: -38947268 | G1627: -42201095 | H1627: -- | I1627: -22001248 | J1627: 9263135 | K1627: 6412155.5 | L1627: -- | M1627: -- | N1627: =POWER(D1627/M1627,1/9)-1 -> #VALUE! | O1627: =POWER(D1627/I1627,1/5)-1 -> -9.3623697565122899e-02
A1628: 8027.HK | B1628: 吉辉控股 | C1628: 0.20000000000000001 | D1628: -13498007.23 | E1628: -9446739.0800000001 | F1628: 1418883.8100000001 | G1628: -20097564.059999999 | H1628: -9176632.1099999994 | I1628: 5078201.8300000001 | J1628: -1169642.95 | K1628: 5759539.5 | L1628: 934020.63 | M1628: 15032159.9 | N1628: =POWER(D1628/M1628,1/9)-1 -> -1.9881101564713815 | O1628: =POWER(D1628/I1628,1/5)-1 -> -2.2159394242266748
A1629: 8420.HK | B1629: Nexion Tech | C1629: 0.01 | D1629: -13762982 | E1629: -9635072 | F1629: -24220588 | G1629: -44292889 | H1629: -16391635 | I1629: 12009522 | J1629: 9220520 | K1629: 9894104 | L1629: 10463175 | M1629: 10571428 | N1629: =POWER(D1629/M1629,1/9)-1 -> -2.0297480715135654 | O1629: =POWER(D1629/I1629,1/5)-1 -> -2.0276313952504887
A1630: 0375.HK | B1630: YGM贸易 | C1630: 1.06 | D1630: -13771000 | E1630: 3284000 | F1630: -11740000 | G1630: -87125000 | H1630: 90189000 | I1630: 151023000 | J1630: -97335000 | K1630: -87871000 | L1630: 81095000 | M1630: 218702000 | N1630: =POWER(D1630/M1630,1/9)-1 -> -1.7354752802295659 | O1630: =POWER(D1630/I1630,1/5)-1 -> -1.6194189348349965
A1631: 1903.HK | B1631: JBB Builders | C1631: 0.46 | D1631: -13793768.1 | E1631: 22304949.850000001 | F1631: -17614982 | G1631: 3905440.5 | H1631: 37117240.799999997 | I1631: 44769380 | J1631: 38610538.75 | K1631: 31586739.199999999 | L1631: 14934223.25 | M1631: -- | N1631: =POWER(D1631/M1631,1/9)-1 -> #VALUE! | O1631: =POWER(D1631/I1631,1/5)-1 -> -1.7902060821354531
A1632: 8365.HK | B1632: 亦辰集团 | C1632: 0.46 | D1632: -13829000 | E1632: -8253000 | F1632: -20088000 | G1632: -35226000 | H1632: -23317000 | I1632: 24110000 | J1632: 15980000 | K1632: 14857000 | L1632: 36357000 | M1632: -4359000 | N1632: =POWER(D1632/M1632,1/9)-1 -> 0.13687193430877942 | O1632: =POWER(D1632/I1632,1/5)-1 -> -1.8947850374799811
A1633: 8200.HK | B1633: 修身堂 | C1633: 0.5 | D1633: -13933000 | E1633: 8952000 | F1633: -26420000 | G1633: -56489000 | H1633: -95376000 | I1633: 6439000 | J1633: 26071000 | K1633: -3744000 | L1633: 37527000 | M1633: 3221000 | N1633: =POWER(D1633/M1633,1/9)-1 -> -2.1767187047617149 | O1633: =POWER(D1633/I1633,1/5)-1 -> -2.1669311751828242
A1634: 1247.HK | B1634: 米格国际控股 | C1634: 2 | D1634: -13939279.199999999 | E1634: -11643120.1 | F1634: -30599030.5 | G1634: -93228034.200000003 | H1634: -288642427.5 | I1634: -229639679.59999999 | J1634: -186154401.90000001 | K1634: -160525618.75 | L1634: 35679004.899999999 | M1634: 172102880.59999999 | N1634: =POWER(D1634/M1634,1/9)-1 -> -1.756339720300466 | O1634: =POWER(D1634/I1634,1/5)-1 -> -0.42899662272624195
A1635: 8262.HK | B1635: 宏强控股 | C1635: 0.03 | D1635: -14079000 | E1635: -11956000 | F1635: -22474000 | G1635: 2363000 | H1635: 16120000 | I1635: 8325000 | J1635: 5905000 | K1635: 6010000 | L1635: 18469000 | M1635: 12544000 | N1635: =POWER(D1635/M1635,1/9)-1 -> -2.0129094907460363 | O1635: =POWER(D1635/I1635,1/5)-1 -> -2.1108042004673386
A1636: 8606.HK | B1636: 倢冠控股 | C1636: 0.07 | D1636: -14088000 | E1636: -67058000 | F1636: -20344000 | G1636: 10316000 | H1636: 2179000 | I1636: -9008000 | J1636: 5985000 | K1636: 17197000 | L1636: 15755000 | M1636: -- | N1636: =POWER(D1636/M1636,1/9)-1 -> #VALUE! | O1636: =POWER(D1636/I1636,1/5)-1 -> 9.3563970335807989e-02
A1637: 1884.HK | B1637: eprint集团 | C1637: 0.13 | D1637: -14243000 | E1637: 2097000 | F1637: 19009000 | G1637: 5688000 | H1637: 17353000 | I1637: 22032000 | J1637: 17321000 | K1637: 26053000 | L1637: 32335000 | M1637: 21577000 | N1637: =POWER(D1637/M1637,1/9)-1 -> -1.9548974036971689 | O1637: =POWER(D1637/I1637,1/5)-1 -> -1.9164515504124817
A1638: 0768.HK | B1638: 开明投资 | C1638: 0.03 | D1638: -14433000 | E1638: -129000 | F1638: -8698000 | G1638: -44515000 | H1638: -23282000 | I1638: -21492000 | J1638: 4828867 | K1638: -10166331 | L1638: 66880233 | M1638: -3395955 | N1638: =POWER(D1638/M1638,1/9)-1 -> 0.1744151138429042 | O1638: =POWER(D1638/I1638,1/5)-1 -> -7.6544534670603404e-02
A1639: 0986.HK | B1639: 中国环保能源 | C1639: 0.05 | D1639: -14461000 | E1639: 604000 | F1639: 4447000 | G1639: -29411000 | H1639: -51456000 | I1639: -337438000 | J1639: 27465000 | K1639: -102562000 | L1639: -147882000 | M1639: -1414607000 | N1639: =POWER(D1639/M1639,1/9)-1 -> -0.39904731435527607 | O1639: =POWER(D1639/I1639,1/5)-1 -> -0.46740036121868922
A1640: 8218.HK | B1640: 毅高国际控股 | C1640: 0.16 | D1640: -14464000 | E1640: -21852000 | F1640: -26680000 | G1640: -25099000 | H1640: 5272000 | I1640: -14716000 | J1640: -13993000 | K1640: -13739000 | L1640: -12631000 | M1640: -8721000 | N1640: =POWER(D1640/M1640,1/9)-1 -> 5.7824373938842655e-02 | O1640: =POWER(D1640/I1640,1/5)-1 -> -3.4485467750706711e-03
A1641: 1960.HK | B1641: TBKS HLDGS | C1641: 0.27 | D1641: -14618778.300000001 | E1641: 18521281.100000001 | F1641: 1126191.5 | G1641: 21979413.75 | H1641: 30874314.5 | I1641: 35546620 | J1641: 31195715.25 | K1641: 7113161.5999999996 | L1641: -- | M1641: -- | N1641: =POWER(D1641/M1641,1/9)-1 -> #VALUE! | O1641: =POWER(D1641/I1641,1/5)-1 -> -1.8371871498985213
A1642: 0913.HK | B1642: 港湾数字 | C1642: 0.34 | D1642: -14783000 | E1642: -44080000 | F1642: -22644000 | G1642: -42368000 | H1642: -70637000 | I1642: -123270000 | J1642: -613334000 | K1642: -368836000 | L1642: 112686000 | M1642: 267908000 | N1642: =POWER(D1642/M1642,1/9)-1 -> -1.7247653676450665 | O1642: =POWER(D1642/I1642,1/5)-1 -> -0.34569379905334607
A1643: 6822.HK | B1643: 科劲国际 | C1643: 0.39 | D1643: -14829000 | E1643: 23248000 | F1643: 94907000 | G1643: 114081000 | H1643: 124945000 | I1643: 118003000 | J1643: 143552000 | K1643: 133844000 | L1643: 163545000 | M1643: 95146000 | N1643: =POWER(D1643/M1643,1/9)-1 -> -1.8133966324045794 | O1643: =POWER(D1643/I1643,1/5)-1 -> -1.6604558074525941
A1644: 1947.HK | B1644: 美皓集团 | C1644: 0.5 | D1644: -14901742.800000001 | E1644: 32101213.600000001 | F1644: 39268490.5 | G1644: 17762885.699999999 | H1644: -- | I1644: -- | J1644: -- | K1644: -- | L1644: -- | M1644: -- | N1644: =POWER(D1644/M1644,1/9)-1 -> #VALUE! | O1644: =POWER(D1644/I1644,1/5)-1 -> #VALUE!
A1645: 0157.HK | B1645: 自然美 | C1645: 0.5 | D1645: -15111000 | E1645: -30472000 | F1645: 35264000 | G1645: 7758000 | H1645: 21908000 | I1645: 26259000 | J1645: 105388000 | K1645: 148403000 | L1645: 136830000 | M1645: 71480000 | N1645: =POWER(D1645/M1645,1/9)-1 -> -1.8414185330274551 | O1645: =POWER(D1645/I1645,1/5)-1 -> -1.8953709597638813
A1646: 3302.HK | B1646: 精技集团 | C1646: 0.19 | D1646: -15146721 | E1646: 26973259.5 | F1646: 68895175.5 | G1646: -15598240 | H1646: -9437856 | I1646: 50116176 | J1646: 46947040 | K1646: 16602300 | L1646: 61590405 | M1646: -- | N1646: =POWER(D1646/M1646,1/9)-1 -> #VALUE! | O1646: =POWER(D1646/I1646,1/5)-1 -> -1.7871692854528225
A1647: 2393.HK | B1647: 巨星医疗控股 | C1647: 0.04 | D1647: -15224025.6 | E1647: -1119336919.2 | F1647: 4073911.5 | G1647: -703799071.5 | H1647: 226487077.5 | I1647: 286637995.60000002 | J1647: 299686635.19999999 | K1647: 223395698.75 | L1647: 191409193.80000001 | M1647: 125913110 | N1647: =POWER(D1647/M1647,1/9)-1 -> -1.7907713941909238 | O1647: =POWER(D1647/I1647,1/5)-1 -> -1.5559543715058004
A1648: 2340.HK | B1648: 升柏控股 | C1648: 0.20000000000000001 | D1648: -15244000 | E1648: 436740000 | F1648: 19612000 | G1648: 14213000 | H1648: 37582000 | I1648: -160018000 | J1648: -54377000 | K1648: -39483000 | L1648: 51281000 | M1648: 39742000 | N1648: =POWER(D1648/M1648,1/9)-1 -> -1.8990027589975396 | O1648: =POWER(D1648/I1648,1/5)-1 -> -0.37513525782038137
A1649: 1500.HK | B1649: 现恒建筑 | C1649: 0.08 | D1649: -15329000 | E1649: 62192000 | F1649: 28703000 | G1649: 3757000 | H1649: 10569000 | I1649: 23018000 | J1649: 106697000 | K1649: 92075000 | L1649: 72653000 | M1649: 60977000 | N1649: =POWER(D1649/M1649,1/9)-1 -> -1.8577722151057547 | O1649: =POWER(D1649/I1649,1/5)-1 -> -1.9219115324005234
A1650: 8232.HK | B1650: Classified Gp | C1650: 0.33 | D1650: -15346000 | E1650: -20392000 | F1650: -16553000 | G1650: -16393000 | H1650: -17229000 | I1650: -25938000 | J1650: -35972000 | K1650: -13074000 | L1650: 2936000 | M1650: 2606000 | N1650: =POWER(D1650/M1650,1/9)-1 -> -2.2177492330494095 | O1650: =POWER(D1650/I1650,1/5)-1 -> -9.9649227377814564e-02
A1651: 1941.HK | B1651: 烨星集团 | C1651: 0.19 | D1651: -15399417.6 | E1651: -58558542.899999999 | F1651: 37620313.5 | G1651: 24679481.399999999 | H1651: 28918665 | I1651: 42059884 | J1651: 43024924.299999997 | K1651: 19505771.25 | L1651: -- | M1651: -- | N1651: =POWER(D1651/M1651,1/9)-1 -> #VALUE! | O1651: =POWER(D1651/I1651,1/5)-1 -> -1.817950919855061
A1652: 0660.HK | B1652: 玮俊生物科技 | C1652: 0.10000000000000001 | D1652: -15433000 | E1652: -- | F1652: -- | G1652: -8149000 | H1652: -3159000 | I1652: -53617000 | J1652: -17399000 | K1652: -39169000 | L1652: -19596000 | M1652: -15884000 | N1652: =POWER(D1652/M1652,1/9)-1 -> -3.1953549908644296e-03 | O1652: =POWER(D1652/I1652,1/5)-1 -> -0.22047585938887015
A1653: 0557.HK | B1653: 天元医疗 | C1653: 0.58 | D1653: -15484000 | E1653: -29036000 | F1653: -16854000 | G1653: -65101000 | H1653: -170203000 | I1653: -27622000 | J1653: 14877000 | K1653: -57550000 | L1653: -55067000 | M1653: -18978000 | N1653: =POWER(D1653/M1653,1/9)-1 -> -2.2354482509269413e-02 | O1653: =POWER(D1653/I1653,1/5)-1 -> -0.10931198539567211
A1654: 1007.HK | B1654: 龙辉国际控股 | C1654: 3.89 | D1654: -15735951 | E1654: -70286270.5 | F1654: -41576673 | G1654: -82310230.200000003 | H1654: -142495777.5 | I1654: -513616767 | J1654: 25675000 | K1654: -8835000 | L1654: -3411000 | M1654: -3414000 | N1654: =POWER(D1654/M1654,1/9)-1 -> 0.18504981996756986 | O1654: =POWER(D1654/I1654,1/5)-1 -> -0.50197544011411643
A1655: 8123.HK | B1655: 华亿金控 | C1655: 0.01 | D1655: -15777000 | E1655: -30660000 | F1655: -32090000 | G1655: -41399000 | H1655: -127674239 | I1655: -31213014 | J1655: -136497133 | K1655: -244075407 | L1655: -62850046 | M1655: 114540442 | N1655: =POWER(D1655/M1655,1/9)-1 -> -1.8023070694892056 | O1655: =POWER(D1655/I1655,1/5)-1 -> -0.12755563151863969
A1656: 8360.HK | B1656: 利骏集团香港 | C1656: 0.81 | D1656: -15857000 | E1656: -17919000 | F1656: -32319000 | G1656: -38038000 | H1656: -56433000 | I1656: -35158000 | J1656: 2450328 | K1656: -7829137 | L1656: 15293764 | M1656: 5907018 | N1656: =POWER(D1656/M1656,1/9)-1 -> -2.1159643049416896 | O1656: =POWER(D1656/I1656,1/5)-1 -> -0.1472153532154642
A1657: 0812.HK | B1657: 西证国际证券 | C1657: 0.03 | D1657: -15943000 | E1657: -241138000 | F1657: -63786000 | G1657: -138488000 | H1657: -344595000 | I1657: -201748000 | J1657: 1092000 | K1657: -166923000 | L1657: 11291000 | M1657: -17739000 | N1657: =POWER(D1657/M1657,1/9)-1 -> -1.1790578121085526e-02 | O1657: =POWER(D1657/I1657,1/5)-1 -> -0.39806144469566584
A1658: 6036.HK | B1658: 光丽科技 | C1658: 0.45 | D1658: -16210000 | E1658: -32436000 | F1658: 6735000 | G1658: -5115000 | H1658: -16985000 | I1658: 22614000 | J1658: 34986000 | K1658: 39741000 | L1658: 24453000 | M1658: 11298000 | N1658: =POWER(D1658/M1658,1/9)-1 -> -2.0409267289192945 | O1658: =POWER(D1658/I1658,1/5)-1 -> -1.9355804225119475
A1659: 8315.HK | B1659: 新都酒店 | C1659: 0.25 | D1659: -16315000 | E1659: -35506000 | F1659: -16959000 | G1659: -38806000 | H1659: -85171000 | I1659: -74705000 | J1659: 6197000 | K1659: -55000 | L1659: 2926000 | M1659: 8362000 | N1659: =POWER(D1659/M1659,1/9)-1 -> -2.0770924720235682 | O1659: =POWER(D1659/I1659,1/5)-1 -> -0.26235486643286388
A1660: 8317.HK | B1660: 财华社集团 | C1660: 0.08 | D1660: -16341000 | E1660: -9100000 | F1660: -12830000 | G1660: -20293000 | H1660: -28870000 | I1660: -35814000 | J1660: -29122000 | K1660: -35957000 | L1660: -36214000 | M1660: -19305000 | N1660: =POWER(D1660/M1660,1/9)-1 -> -1.8350304956084917e-02 | O1660: =POWER(D1660/I1660,1/5)-1 -> -0.14523809137444244
A1661: 8401.HK | B1661: 源想集团 | C1661: 0.20000000000000001 | D1661: -16349000 | E1661: -13128000 | F1661: -9535000 | G1661: -5341000 | H1661: 5372000 | I1661: -26293000 | J1661: 12260000 | K1661: 8009000 | L1661: -- | M1661: -- | N1661: =POWER(D1661/M1661,1/9)-1 -> #VALUE! | O1661: =POWER(D1661/I1661,1/5)-1 -> -9.065180207935164e-02
A1662: 1707.HK | B1662: 致浩达控股 | C1662: 0.07 | D1662: -16366000 | E1662: -31693000 | F1662: -14280000 | G1662: -28065000 | H1662: -12498000 | I1662: 5337000 | J1662: 9517000 | K1662: 20404000 | L1662: 35403000 | M1662: 25945000 | N1662: =POWER(D1662/M1662,1/9)-1 -> -1.9500914945539476 | O1662: =POWER(D1662/I1662,1/5)-1 -> -2.2512067216418332
A1663: 8229.HK | B1663: 未来数据集团 | C1663: 0.49 | D1663: -16367000 | E1663: -3346000 | F1663: 7250000 | G1663: 7876000 | H1663: 4373000 | I1663: 5758000 | J1663: 5271000 | K1663: 3708000 | L1663: 8131000 | M1663: 10775000 | N1663: =POWER(D1663/M1663,1/9)-1 -> -2.0475443592129894 | O1663: =POWER(D1663/I1663,1/5)-1 -> -2.232365365519307
A1664: 1657.HK | B1664: 桦欣控股 | C1664: 7.65 | D1664: -16427000 | E1664: 491000 | F1664: -88000 | G1664: 15841000 | H1664: 18321000 | I1664: 23551000 | J1664: 6208000 | K1664: 17503000 | L1664: 7576000 | M1664: -- | N1664: =POWER(D1664/M1664,1/9)-1 -> #VALUE! | O1664: =POWER(D1664/I1664,1/5)-1 -> -1.9304858666781302
A1665: 1389.HK | B1665: 美捷汇控股 | C1665: 0.20000000000000001 | D1665: -16594000 | E1665: -8714000 | F1665: -5035000 | G1665: -32360000 | H1665: -1103000 | I1665: 6642000 | J1665: -2529000 | K1665: 7448000 | L1665: 24132000 | M1665: 12793000 | N1665: =POWER(D1665/M1665,1/9)-1 -> -2.029326579379954 | O1665: =POWER(D1665/I1665,1/5)-1 -> -2.2009652545633629
A1666: 1439.HK | B1666: 移动互联(中国) | C1666: 0.02 | D1666: -16594275.6 | E1666: -- | F1666: -232574183 | G1666: -284705577.30000001 | H1666: -493165042.5 | I1666: -393814413.60000002 | J1666: -60725483.899999999 | K1666: 8802211.25 | L1666: 64406378.25 | M1666: 77522043.799999997 | N1666: =POWER(D1666/M1666,1/9)-1 -> -1.8425870638869259 | O1666: =POWER(D1666/I1666,1/5)-1 -> -0.4691970372485571
A1667: 1000.HK | B1667: 北青传媒 | C1667: 0.37 | D1667: -16793784 | E1667: -26510350 | F1667: -78562695.5 | G1667: -155156774.40000001 | H1667: -219631215 | I1667: -315745166 | J1667: -102207423.90000001 | K1667: -65383727.5 | L1667: -53359740.600000001 | M1667: 13110437.4 | N1667: =POWER(D1667/M1667,1/9)-1 -> -2.0278930539947271 | O1667: =POWER(D1667/I1667,1/5)-1 -> -0.44388786683864834
A1668: 2528.HK | B1668: 尚晋国际控股 | C1668: 0.23 | D1668: -16852000 | E1668: -33137000 | F1668: 32157000 | G1668: -131144000 | H1668: 37170000 | I1668: 103941000 | J1668: 60786000 | K1668: 7933000 | L1668: -- | M1668: -- | N1668: =POWER(D1668/M1668,1/9)-1 -> #VALUE! | O1668: =POWER(D1668/I1668,1/5)-1 -> -1.6949809684826505
A1669: 2443.HK | B1669: 汽车街 | C1669: 6.71 | D1669: -17000965.800000001 | E1669: -- | F1669: -- | G1669: -- | H1669: -- | I1669: -- | J1669: -- | K1669: -- | L1669: -- | M1669: -- | N1669: =POWER(D1669/M1669,1/9)-1 -> #VALUE! | O1669: =POWER(D1669/I1669,1/5)-1 -> #VALUE!
A1670: 1616.HK | B1670: 一元宇宙 | C1670: 0.02 | D1670: -17150049 | E1670: -- | F1670: -653696876 | G1670: -335580636.89999998 | H1670: 33729502.5 | I1670: -164783885 | J1670: -97253569.099999994 | K1670: 27253406.25 | L1670: 8628678.8499999996 | M1670: 9526468.5999999996 | N1670: =POWER(D1670/M1670,1/9)-1 -> -2.0675061372898558 | O1670: =POWER(D1670/I1670,1/5)-1 -> -0.36398094751280574
A1671: 8147.HK | B1671: 汇思太平洋 | C1671: 0.34 | D1671: -17334000 | E1671: -18377000 | F1671: -22593000 | G1671: -14880000 | H1671: -1081000 | I1671: -36293000 | J1671: -33665000 | K1671: -44094000 | L1671: -17526000 | M1671: -1613000 | N1671: =POWER(D1671/M1671,1/9)-1 -> 0.3019219109123028 | O1671: =POWER(D1671/I1671,1/5)-1 -> -0.13738861716839779
A1672: 8117.HK | B1672: 中国基础能源 | C1672: 0.02 | D1672: -17500000 | E1672: -9855000 | F1672: -7941000 | G1672: 10279000 | H1672: -31260000 | I1672: -10717000 | J1672: -20732000 | K1672: -59567000 | L1672: -91321000 | M1672: -46605000 | N1672: =POWER(D1672/M1672,1/9)-1 -> -0.10312080762537368 | O1672: =POWER(D1672/I1672,1/5)-1 -> 0.10304432248399098
A1673: 8271.HK | B1673: 环球数码创意 | C1673: 0.07 | D1673: -17520000 | E1673: -6185000 | F1673: 5668000 | G1673: 7403000 | H1673: 9718000 | I1673: -300541000 | J1673: -29295000 | K1673: -62158000 | L1673: 10994000 | M1673: 31862000 | N1673: =POWER(D1673/M1673,1/9)-1 -> -1.9357075177205481 | O1673: =POWER(D1673/I1673,1/5)-1 -> -0.43359630880615851
A1674: 0309.HK | B1674: 新华通讯频媒 | C1674: 0.07 | D1674: -17671000 | E1674: -16651000 | F1674: 20938000 | G1674: -47199000 | H1674: -15582000 | I1674: -39964000 | J1674: -18033000 | K1674: -60248000 | L1674: -1622000 | M1674: -70588000 | N1674: =POWER(D1674/M1674,1/9)-1 -> -0.14262655585711004 | O1674: =POWER(D1674/I1674,1/5)-1 -> -0.15058791559027862
A1675: 8525.HK | B1675: 百应控股 | C1675: 0.53 | D1675: -17763421.129999999 | E1675: -29772031.170000002 | F1675: -8663301.9900000002 | G1675: 7542512.4500000002 | H1675: 21408867.199999999 | I1675: 26393864.969999999 | J1675: 24804444.93 | K1675: 16626286.92 | L1675: 12388771.779999999 | M1675: -- | N1675: =POWER(D1675/M1675,1/9)-1 -> #VALUE! | O1675: =POWER(D1675/I1675,1/5)-1 -> -1.9238569373017023
A1676: 8446.HK | B1676: 耀星科技集团 | C1676: 0.21 | D1676: -17882091 | E1676: -24243425 | F1676: -35011096 | G1676: -24257194 | H1676: 22484660 | I1676: 17919344 | J1676: -443192 | K1676: 7058939 | L1676: 1219220 | M1676: -- | N1676: =POWER(D1676/M1676,1/9)-1 -> #VALUE! | O1676: =POWER(D1676/I1676,1/5)-1 -> -1.9995838685032461
A1677: 8455.HK | B1677: 礼建德集团 | C1677: 0.02 | D1677: -17908000 | E1677: -3572000 | F1677: -1450000 | G1677: -3747000 | H1677: -2990000 | I1677: 149000 | J1677: 2745000 | K1677: 8987000 | L1677: 11968000 | M1677: -- | N1677: =POWER(D1677/M1677,1/9)-1 -> #VALUE! | O1677: =POWER(D1677/I1677,1/5)-1 -> -3.6059865113278993
A1678: 2266.HK | B1678: 黎氏企业 | C1678: 0.29999999999999999 | D1678: -18006796.18 | E1678: 5161165.0700000003 | F1678: -20133980.66 | G1678: -78210679.900000006 | H1678: 6199029.1500000004 | I1678: 2250485.4500000002 | J1678: 17558252.489999998 | K1678: 29355339.91 | L1678: 40160194.32 | M1678: 42063106.950000003 | N1678: =POWER(D1678/M1678,1/9)-1 -> -1.9100378497512489 | O1678: =POWER(D1678/I1678,1/5)-1 -> -2.5157656043759076
A1679: 6189.HK | B1679: 爱得威建设集团 | C1679: 0.23 | D1679: -18089492.399999999 | E1679: -- | F1679: -707900798.67999995 | G1679: -395410640.04000002 | H1679: 78559132.5 | I1679: 148829821.80000001 | J1679: 138879377.09999999 | K1679: 119574945 | L1679: 118439995.5 | M1679: 99370277 | N1679: =POWER(D1679/M1679,1/9)-1 -> -1.8275545929034107 | O1679: =POWER(D1679/I1679,1/5)-1 -> -1.6560656258305495
A1680: 8035.HK | B1680: 骏高控股 | C1680: 0.10000000000000001 | D1680: -18173000 | E1680: 4452000 | F1680: 17338000 | G1680: 11170000 | H1680: -18070000 | I1680: -24937000 | J1680: 1682000 | K1680: -2523000 | L1680: 13623000 | M1680: 9251000 | N1680: =POWER(D1680/M1680,1/9)-1 -> -2.0779087415722106 | O1680: =POWER(D1680/I1680,1/5)-1 -> -6.1322335167462438e-02
A1681: 1037.HK | B1681: 云智汇科技 | C1681: 0.24 | D1681: -18450142.199999999 | E1681: 31395023 | F1681: 41952594.5 | G1681: 17442264.600000001 | H1681: 12935062.5 | I1681: 1639584 | J1681: 78879227.700000003 | K1681: -97599000 | L1681: -39724000 | M1681: 8175000 | N1681: =POWER(D1681/M1681,1/9)-1 -> -2.0946596407161895 | O1681: =POWER(D1681/I1681,1/5)-1 -> -2.6227559464140313
A1682: 0426.HK | B1682: 万华媒体 | C1682: 0.06 | D1682: -18507000 | E1682: -12332000 | F1682: -17255000 | G1682: -26848000 | H1682: -12107000 | I1682: -20550000 | J1682: -62019000 | K1682: -15605000 | L1682: -11072000 | M1682: 28646000 | N1682: =POWER(D1682/M1682,1/9)-1 -> -1.9526187279906384 | O1682: =POWER(D1682/I1682,1/5)-1 -> -2.0724611609079013e-02
A1683: 0361.HK | B1683: 顺龙控股 | C1683: 0.05 | D1683: -18537000 | E1683: -15949000 | F1683: -23671000 | G1683: -19542000 | H1683: -23119000 | I1683: -40502000 | J1683: -31972000 | K1683: -144018000 | L1683: -91068000 | M1683: 8295000 | N1683: =POWER(D1683/M1683,1/9)-1 -> -2.0934591477115472 | O1683: =POWER(D1683/I1683,1/5)-1 -> -0.14471157194003625
A1684: 8403.HK | B1684: 天平道合 | C1684: 0.79 | D1684: -18545511.600000001 | E1684: -41702472.700000003 | F1684: -9368649.5 | G1684: -21256344.600000001 | H1684: -1400227.5 | I1684: -1134045.6000000001 | J1684: -939937.59999999998 | K1684: 12212637.5 | L1684: 12335588.449999999 | M1684: -- | N1684: =POWER(D1684/M1684,1/9)-1 -> #VALUE! | O1684: =POWER(D1684/I1684,1/5)-1 -> 0.74872556886938346
A1685: 2225.HK | B1685: 今海医疗科技 | C1685: 4.7999999999999998 | D1685: -18591579 | E1685: 2726366.9100000001 | F1685: -1421464.5700000001 | G1685: 7406695.2599999998 | H1685: -3965877.3100000001 | I1685: -20320662.379999999 | J1685: 13313583.189999999 | K1685: 35498618.509999998 | L1685: 34671324.520000003 | M1685: 24365792.100000001 | N1685: =POWER(D1685/M1685,1/9)-1 -> -1.9703946997889941 | O1685: =POWER(D1685/I1685,1/5)-1 -> -1.7628661182173322e-02
A1686: 1796.HK | B1686: 耀高控股 | C1686: 1.7 | D1686: -18663000 | E1686: -4020000 | F1686: -32515000 | G1686: -7962000 | H1686: 35963000 | I1686: 38594000 | J1686: 27139000 | K1686: 11860000 | L1686: -- | M1686: -- | N1686: =POWER(D1686/M1686,1/9)-1 -> #VALUE! | O1686: =POWER(D1686/I1686,1/5)-1 -> -1.8647535084796591
A1687: 2262.HK | B1687: 梁志天设计集团 | C1687: 0.13 | D1687: -18841000 | E1687: -62441000 | F1687: 2940000 | G1687: 33531000 | H1687: 38648000 | I1687: 56727000 | J1687: 72251000 | K1687: 60007433 | L1687: 34700997 | M1687: 73374320 | N1687: =POWER(D1687/M1687,1/9)-1 -> -1.8597962369437213 | O1687: =POWER(D1687/I1687,1/5)-1 -> -1.8021633702439779
A1688: 8316.HK | B1688: 中国红包 | C1688: 0.16 | D1688: -19041000 | E1688: -10419000 | F1688: -29450000 | G1688: -7207000 | H1688: -6385000 | I1688: -24916000 | J1688: -28928000 | K1688: -22231000 | L1688: 11874000 | M1688: 26132000 | N1688: =POWER(D1688/M1688,1/9)-1 -> -1.9654374082387038 | O1688: =POWER(D1688/I1688,1/5)-1 -> -5.2362395626385116e-02
A1689: 8267.HK | B1689: 蓝港互动 | C1689: 0.41 | D1689: -19102381.199999999 | E1689: -68412496.400000006 | F1689: -92210972.5 | G1689: -41137236.600000001 | H1689: -121420845 | I1689: -190005013.59999999 | J1689: -352594092.19999999 | K1689: -174879635 | L1689: -61049931.549999997 | M1689: -192902877.80000001 | N1689: =POWER(D1689/M1689,1/9)-1 -> -0.22657797864179596 | O1689: =POWER(D1689/I1689,1/5)-1 -> -0.3683674690765194
A1690: 8311.HK | B1690: 圆美光电 | C1690: 0.04 | D1690: -19104000 | E1690: 4038000 | F1690: -43857000 | G1690: -16883000 | H1690: -34078000 | I1690: -55780000 | J1690: -98329000 | K1690: 90729000 | L1690: 27732000 | M1690: 26148000 | N1690: =POWER(D1690/M1690,1/9)-1 -> -1.9657261278544234 | O1690: =POWER(D1690/I1690,1/5)-1 -> -0.19289663143684299
A1691: 2086.HK | B1691: 高维科技 | C1691: 0.53 | D1691: -19211000 | E1691: 1126000 | F1691: -21323000 | G1691: -20223000 | H1691: -8259000 | I1691: -23454000 | J1691: 5689000 | K1691: -18503000 | L1691: 20304000 | M1691: 23724000 | N1691: =POWER(D1691/M1691,1/9)-1 -> -1.976827789632529 | O1691: =POWER(D1691/I1691,1/5)-1 -> -3.912562799471031e-02
A1692: 3363.HK | B1692: 正业国际 | C1692: 0.46 | D1692: -19241598.600000001 | E1692: 53209092.700000003 | F1692: 196949804.5 | G1692: 65282746.799999997 | H1692: 91840620 | I1692: 124515018.8 | J1692: 219045024.5 | K1692: 101844951.25 | L1692: 48377992.799999997 | M1692: 49267092 | N1692: =POWER(D1692/M1692,1/9)-1 -> -1.9008066429618369 | O1692: =POWER(D1692/I1692,1/5)-1 -> -1.6883413867178234
A1693: 1020.HK | B1693: 赛伯乐国际控股 | C1693: 0.08 | D1693: -19254753 | E1693: 12128203.1 | F1693: -315827938 | G1693: -90854961.299999997 | H1693: -109965352.5 | I1693: -92893819.599999994 | J1693: -166716636.19999999 | K1693: -154124818.75 | L1693: -319217603.60000002 | M1693: -216762725.80000001 | N1693: =POWER(D1693/M1693,1/9)-1 -> -0.23586059787148528 | O1693: =POWER(D1693/I1693,1/5)-1 -> -0.27002123577242743
A1694: 0484.HK | B1694: 云游控股 | C1694: 0.77 | D1694: -19311755.399999999 | E1694: -22682706.699999999 | F1694: 21492424 | G1694: -58727296.799999997 | H1694: -241240312.5 | I1694: -324360952.19999999 | J1694: 88760561.5 | K1694: -439137107.5 | L1694: -151879801.19999999 | M1694: -48082834.899999999 | N1694: =POWER(D1694/M1694,1/9)-1 -> -9.6389438115868975e-02 | O1694: =POWER(D1694/I1694,1/5)-1 -> -0.43120124506301294
A1695: 6193.HK | B1695: 泰林科建 | C1695: 0.23 | D1695: -19333679.399999999 | E1695: 10112288.4 | F1695: 2097568.5 | G1695: 17383861.5 | H1695: 27880507.5 | I1695: 35634764.200000003 | J1695: 31724092.899999999 | K1695: 10491311.25 | L1695: -- | M1695: -- | N1695: =POWER(D1695/M1695,1/9)-1 -> #VALUE! | O1695: =POWER(D1695/I1695,1/5)-1 -> -1.8848876312056029
A1696: 1221.HK | B1696: 信和酒店 | C1696: 1.5 | D1696: -19487037 | E1696: -92418031 | F1696: -95334892 | G1696: -76363020 | H1696: 196306408 | I1696: 195127516 | J1696: 177912615 | K1696: 165546903 | L1696: 203964723 | M1696: 234514741 | N1696: =POWER(D1696/M1696,1/9)-1 -> -1.7584952256541335 | O1696: =POWER(D1696/I1696,1/5)-1 -> -1.6307909571301329
A1697: 0248.HK | B1697: 香港通讯国际控股 | C1697: 0.03 | D1697: -19568000 | E1697: -1943000 | F1697: 4747000 | G1697: -23034000 | H1697: 1041000 | I1697: -3548000 | J1697: -4427000 | K1697: -22282000 | L1697: -3660000 | M1697: -12175000 | N1697: =POWER(D1697/M1697,1/9)-1 -> 5.4138066518124361e-02 | O1697: =POWER(D1697/I1697,1/5)-1 -> 0.40705983361970954
A1698: 0128.HK | B1698: 安宁控股 | C1698: 0.31 | D1698: -19747000 | E1698: -150663000 | F1698: -21280000 | G1698: 11881000 | H1698: 46197000 | I1698: -73097000 | J1698: -6505000 | K1698: -3935000 | L1698: -106896000 | M1698: 29001000 | N1698: =POWER(D1698/M1698,1/9)-1 -> -1.9581957477012384 | O1698: =POWER(D1698/I1698,1/5)-1 -> -0.23030207710305961
A1699: 8219.HK | B1699: 恒伟集团控股 | C1699: 0.19 | D1699: -19764000 | E1699: -10646000 | F1699: -2549000 | G1699: -26208000 | H1699: -14548000 | I1699: -7104000 | J1699: 3960000 | K1699: 4067000 | L1699: -- | M1699: -- | N1699: =POWER(D1699/M1699,1/9)-1 -> #VALUE! | O1699: =POWER(D1699/I1699,1/5)-1 -> 0.22708424052751508
A1700: 8460.HK | B1700: 基地锦标集团 | C1700: 0.06 | D1700: -19773000 | E1700: -6518000 | F1700: 586000 | G1700: 487000 | H1700: -7857000 | I1700: -4054000 | J1700: -5996000 | K1700: 7547000 | L1700: 11456000 | M1700: 7857000 | N1700: =POWER(D1700/M1700,1/9)-1 -> -2.1079880855700646 | O1700: =POWER(D1700/I1700,1/5)-1 -> 0.37289639424812004
A1701: 1281.HK | B1701: 鑫达投资控股 | C1701: 0.06 | D1701: -19927819.800000001 | E1701: -345613740.80000001 | F1701: -34556614.5 | G1701: 1268181.6000000001 | H1701: -295603335 | I1701: 122649992 | J1701: 162087683.30000001 | K1701: 57180480 | L1701: 15260424.800000001 | M1701: -87557655.599999994 | N1701: =POWER(D1701/M1701,1/9)-1 -> -0.15165215195097947 | O1701: =POWER(D1701/I1701,1/5)-1 -> -1.6952779439421914
A1702: 2177.HK | B1702: 优趣汇控股 | C1702: 1.62 | D1702: -19969475.399999999 | E1702: -133024423.90000001 | F1702: 37319086.5 | G1702: -1296787.2 | H1702: -- | I1702: -- | J1702: -- | K1702: -- | L1702: -- | M1702: -- | N1702: =POWER(D1702/M1702,1/9)-1 -> #VALUE! | O1702: =POWER(D1702/I1702,1/5)-1 -> #VALUE!
A1703: 0088.HK | B1703: 大昌集团 | C1703: 3.17 | D1703: -20000000 | E1703: 2900000 | F1703: -28200000 | G1703: 124700000 | H1703: 231600000 | I1703: 354700000 | J1703: 196200000 | K1703: 226300000 | L1703: 553900000 | M1703: 1012500000 | N1703: =POWER(D1703/M1703,1/9)-1 -> -1.6465857173234533 | O1703: =POWER(D1703/I1703,1/5)-1 -> -1.5626440900347802
A1704: 8620.HK | B1704: 亚洲速运 | C1704: 0.11 | D1704: -20175000 | E1704: -18303000 | F1704: -7709000 | G1704: -2385000 | H1704: -149000 | I1704: 6438000 | J1704: 4210000 | K1704: -- | L1704: -- | M1704: -- | N1704: =POWER(D1704/M1704,1/9)-1 -> #VALUE! | O1704: =POWER(D1704/I1704,1/5)-1 -> -2.2566447298113186
A1705: 1716.HK | B1705: 毛记葵涌 | C1705: 0.40000000000000002 | D1705: -20387000 | E1705: -16325000 | F1705: 9343000 | G1705: 13307000 | H1705: 15555000 | I1705: 6917000 | J1705: 36263000 | K1705: 22400000 | L1705: 7818000 | M1705: -- | N1705: =POWER(D1705/M1705,1/9)-1 -> #VALUE! | O1705: =POWER(D1705/I1705,1/5)-1 -> -2.2413295943096454
A1706: 8406.HK | B1706: 中国口腔产业 | C1706: 0.05 | D1706: -20417821.199999999 | E1706: -39315413.100000001 | F1706: -2611858.5 | G1706: 28077588.300000001 | H1706: 21100635 | I1706: 24208913.199999999 | J1706: 11448296.1 | K1706: 10473531.25 | L1706: 8658080.0999999996 | M1706: 7199135.0999999996 | N1706: =POWER(D1706/M1706,1/9)-1 -> -2.1228021363626506 | O1706: =POWER(D1706/I1706,1/5)-1 -> -1.9665110432914803
A1707: 1827.HK | B1707: 卓珈控股 | C1707: 1.15 | D1707: -20501000 | E1707: 25382000 | F1707: -12653000 | G1707: 13556000 | H1707: 21798000 | I1707: 26513000 | J1707: 59000 | K1707: 18488000 | L1707: 13495000 | M1707: -- | N1707: =POWER(D1707/M1707,1/9)-1 -> #VALUE! | O1707: =POWER(D1707/I1707,1/5)-1 -> -1.9498679513194492
A1708: 8448.HK | B1708: 环球印馆 | C1708: 0.06 | D1708: -20502806 | E1708: -4446765 | F1708: -12536316 | G1708: -15511192 | H1708: -5335256 | I1708: -9153876 | J1708: 3390571 | K1708: 5267465 | L1708: -- | M1708: -- | N1708: =POWER(D1708/M1708,1/9)-1 -> #VALUE! | O1708: =POWER(D1708/I1708,1/5)-1 -> 0.17501025090844124
A1709: 0897.HK | B1709: 位元堂 | C1709: 0.34 | D1709: -20515000 | E1709: -108912000 | F1709: -375995000 | G1709: 438548000 | H1709: 74627000 | I1709: -115581000 | J1709: -93303000 | K1709: 25387000 | L1709: 120979000 | M1709: 163374000 | N1709: =POWER(D1709/M1709,1/9)-1 -> -1.794102400354824 | O1709: =POWER(D1709/I1709,1/5)-1 -> -0.29231984893342688
A1710: 0919.HK | B1710: 现代健康科技 | C1710: 0.10000000000000001 | D1710: -20607000 | E1710: -68808000 | F1710: 125723000 | G1710: -31590000 | H1710: -13289000 | I1710: -22855000 | J1710: 33262000 | K1710: 10367000 | L1710: 68849000 | M1710: 54844000 | N1710: =POWER(D1710/M1710,1/9)-1 -> -1.896943469324724 | O1710: =POWER(D1710/I1710,1/5)-1 -> -2.0494883058289393e-02
A1711: 0888.HK | B1711: 贝森金融 | C1711: 0.04 | D1711: -20636000 | E1711: -123092000 | F1711: -258760000 | G1711: -343973000 | H1711: 20766000 | I1711: 16257000 | J1711: -6577000 | K1711: -45260000 | L1711: -47913000 | M1711: 70587000 | N1711: =POWER(D1711/M1711,1/9)-1 -> -1.8722794556096392 | O1711: =POWER(D1711/I1711,1/5)-1 -> -2.048858791249387
A1712: 2221.HK | B1712: 创业集团控股 | C1712: 0.09 | D1712: -20797000 | E1712: 5504000 | F1712: -54998000 | G1712: -295679000 | H1712: -92663000 | I1712: -224790000 | J1712: 47610000 | K1712: 49715000 | L1712: 53352000 | M1712: 50603426 | N1712: =POWER(D1712/M1712,1/9)-1 -> -1.9059228141494227 | O1712: =POWER(D1712/I1712,1/5)-1 -> -0.37878098464906695
A1713: 1711.HK | B1713: 欧化 | C1713: 0.08 | D1713: -21017000 | E1713: 4142000 | F1713: 16826000 | G1713: -11628000 | H1713: -3978000 | I1713: 8477000 | J1713: 30145000 | K1713: 22353000 | L1713: 23288000 | M1713: -- | N1713: =POWER(D1713/M1713,1/9)-1 -> #VALUE! | O1713: =POWER(D1713/I1713,1/5)-1 -> -2.1991284533984281
A1714: 1486.HK | B1714: 思城控股 | C1714: 0.48 | D1714: -21240000 | E1714: -18797000 | F1714: -1139000 | G1714: 9498000 | H1714: -11717000 | I1714: 46982000 | J1714: 33491000 | K1714: 20745000 | L1714: 27666000 | M1714: 28798000 | N1714: =POWER(D1714/M1714,1/9)-1 -> -1.9667412340384396 | O1714: =POWER(D1714/I1714,1/5)-1 -> -1.8531877325511075
A1715: 2212.HK | B1715: 高鹏矿业 | C1715: 0.18 | D1715: -21489904.800000001 | E1715: -10002862.699999999 | F1715: -3050229.5 | G1715: -14019127.800000001 | H1715: -21025762.5 | I1715: -56392580.799999997 | J1715: -51757711.899999999 | K1715: -13233876.25 | L1715: -3250602.2000000002 | M1715: -15266808.6 | N1715: =POWER(D1715/M1715,1/9)-1 -> 3.8719943238434418e-02 | O1715: =POWER(D1715/I1715,1/5)-1 -> -0.17547751362631625
A1716: 2863.HK | B1716: 高丰集团控股 | C1716: 0.31 | D1716: -21574000 | E1716: 11591000 | F1716: 16992000 | G1716: 23150000 | H1716: 21908000 | I1716: 27125000 | J1716: 22363000 | K1716: 29413000 | L1716: 28064000 | M1716: 11693000 | N1716: =POWER(D1716/M1716,1/9)-1 -> -2.0704245981065785 | O1716: =POWER(D1716/I1716,1/5)-1 -> -1.9552393083990376
A1717: 0994.HK | B1717: 中天顺联 | C1717: 0.20000000000000001 | D1717: -21600000 | E1717: -87451000 | F1717: -100827000 | G1717: -55459000 | H1717: -108138000 | I1717: 17394000 | J1717: 22887000 | K1717: 42137000 | L1717: 54327000 | M1717: 44657000 | N1717: =POWER(D1717/M1717,1/9)-1 -> -1.9224685712009144 | O1717: =POWER(D1717/I1717,1/5)-1 -> -2.0442653241776894
A1718: 0657.HK | B1718: 环科国际 | C1718: 0.02 | D1718: -21630000 | E1718: -14080000 | F1718: -8760000 | G1718: -23237000 | H1718: -12802000 | I1718: -8945000 | J1718: -9008000 | K1718: -9304000 | L1718: -4713000 | M1718: -7687000 | N1718: =POWER(D1718/M1718,1/9)-1 -> 0.12181742627241143 | O1718: =POWER(D1718/I1718,1/5)-1 -> 0.19315052014642098
A1719: 0223.HK | B1719: 易生活控股 | C1719: 0.24 | D1719: -21673000 | E1719: -40840000 | F1719: -26403000 | G1719: -76932000 | H1719: -138609000 | I1719: -126655000 | J1719: -152116000 | K1719: 267469000 | L1719: -120090000 | M1719: -46044000 | N1719: =POWER(D1719/M1719,1/9)-1 -> -8.0316398430295144e-02 | O1719: =POWER(D1719/I1719,1/5)-1 -> -0.29747895552029857
A1720: 1894.HK | B1720: 恒益控股 | C1720: 0.02 | D1720: -21707000 | E1720: 19678000 | F1720: -81620000 | G1720: 12245000 | H1720: 16061000 | I1720: 52224000 | J1720: 38093000 | K1720: 29406000 | L1720: -- | M1720: -- | N1720: =POWER(D1720/M1720,1/9)-1 -> #VALUE! | O1720: =POWER(D1720/I1720,1/5)-1 -> -1.8389690401970693
A1721: 6163.HK | B1721: 彭顺国际 | C1721: 0.23 | D1721: -21808275 | E1721: -10809450 | F1721: 6409896 | G1721: 3232584 | H1721: 29008438 | I1721: -11346762 | J1721: 9245370 | K1721: 16411696 | L1721: 40297400 | M1721: 18696099.5 | N1721: =POWER(D1721/M1721,1/9)-1 -> -2.0172554699502321 | O1721: =POWER(D1721/I1721,1/5)-1 -> 0.13959326494653213
A1722: 1188.HK | B1722: 正道集团 | C1722: 0.02 | D1722: -21909000 | E1722: -620248000 | F1722: -55239000 | G1722: -72904000 | H1722: -644022000 | I1722: -288571000 | J1722: -306030000 | K1722: -355303000 | L1722: -350517000 | M1722: -415156000 | N1722: =POWER(D1722/M1722,1/9)-1 -> -0.2788166477505164 | O1722: =POWER(D1722/I1722,1/5)-1 -> -0.40286301062763774
A1723: 1581.HK | B1723: 进升集团控股 | C1723: 0.10000000000000001 | D1723: -21959000 | E1723: 12131000 | F1723: 3738000 | G1723: -15598000 | H1723: -45499000 | I1723: 5713000 | J1723: 23930000 | K1723: 36748000 | L1723: 35863000 | M1723: 29241000 | N1723: =POWER(D1723/M1723,1/9)-1 -> -1.968679340775727 | O1723: =POWER(D1723/I1723,1/5)-1 -> -2.3090302026129224
A1724: 8300.HK | B1724: 今米房集团 | C1724: 0.08 | D1724: -22002000 | E1724: -10178000 | F1724: -4098000 | G1724: -65476000 | H1724: -18377000 | I1724: -423000 | J1724: -14845000 | K1724: 12619000 | L1724: 21213000 | M1724: 13637000 | N1724: =POWER(D1724/M1724,1/9)-1 -> -2.0545874314005439 | O1724: =POWER(D1724/I1724,1/5)-1 -> 1.2040647993458928
A1725: 0302.HK | B1725: 中手游 | C1725: 0.88 | D1725: -22010599.800000001 | E1725: -231299983.5 | F1725: 749112365 | G1725: 835902116.10000002 | H1725: 277528890 | I1725: 354155837 | J1725: 368618589.60000002 | K1725: 222886746.25 | L1725: -- | M1725: -- | N1725: =POWER(D1725/M1725,1/9)-1 -> #VALUE! | O1725: =POWER(D1725/I1725,1/5)-1 -> -1.5737034937871237
A1726: 8189.HK | B1726: 泰达生物 | C1726: 0.08 | D1726: -22099017.100000001 | E1726: -31706451.93 | F1726: -51741300.149999999 | G1726: -57209334.68 | H1726: -94564869.319999993 | I1726: -202306241.91 | J1726: -16487335.140000001 | K1726: 6634954.8200000003 | L1726: 30065144.34 | M1726: 22196931.399999999 | N1726: =POWER(D1726/M1726,1/9)-1 -> -1.9995089071058887 | O1726: =POWER(D1726/I1726,1/5)-1 -> -0.35779640101933241
A1727: 6108.HK | B1727: 新锐医药 | C1727: 0.05 | D1727: -22170000 | E1727: -77947000 | F1727: -2824000 | G1727: -69731000 | H1727: -44109000 | I1727: 33204000 | J1727: -105012000 | K1727: -20458000 | L1727: 14804000 | M1727: 29681000 | N1727: =POWER(D1727/M1727,1/9)-1 -> -1.9681012837530032 | O1727: =POWER(D1727/I1727,1/5)-1 -> -1.9223910016946375
A1728: 8428.HK | B1728: 国茂控股 | C1728: 0.29 | D1728: -22227000 | E1728: -40299000 | F1728: -9940000 | G1728: -32883000 | H1728: -20561000 | I1728: -9746000 | J1728: -8256000 | K1728: 8200000 | L1728: 8177000 | M1728: -- | N1728: =POWER(D1728/M1728,1/9)-1 -> #VALUE! | O1728: =POWER(D1728/I1728,1/5)-1 -> 0.17926358639915407
A1729: 0310.HK | B1729: 嘉进投资国际 | C1729: 0.10000000000000001 | D1729: -22401000 | E1729: -4807000 | F1729: -15954000 | G1729: -66644000 | H1729: -78496000 | I1729: -87204000 | J1729: 160000 | K1729: -43297000 | L1729: 17126000 | M1729: -15815000 | N1729: =POWER(D1729/M1729,1/9)-1 -> 3.9440899073599045e-02 | O1729: =POWER(D1729/I1729,1/5)-1 -> -0.23801538984022808
A1730: 2113.HK | B1730: 世纪集团国际 | C1730: 0.06 | D1730: -22544000 | E1730: -24032000 | F1730: -31886000 | G1730: -8145000 | H1730: -86892000 | I1730: 8714000 | J1730: 19746000 | K1730: 28424000 | L1730: 25671000 | M1730: 9653000 | N1730: =POWER(D1730/M1730,1/9)-1 -> -2.0988283408762349 | O1730: =POWER(D1730/I1730,1/5)-1 -> -2.2093797265565844
A1731: 3938.HK | B1731: LFG投资控股 | C1731: 0.19 | D1731: -22684000 | E1731: -3294000 | F1731: 16124000 | G1731: 14150000 | H1731: 49014000 | I1731: 50236000 | J1731: 35880000 | K1731: -- | L1731: -- | M1731: -- | N1731: =POWER(D1731/M1731,1/9)-1 -> #VALUE! | O1731: =POWER(D1731/I1731,1/5)-1 -> -1.8529840637969275
A1732: 8178.HK | B1732: 中国信息科技 | C1732: 1.3 | D1732: -22755000 | E1732: -82295000 | F1732: -90326000 | G1732: -9758000 | H1732: -80850000 | I1732: -75308000 | J1732: -112456000 | K1732: -48143000 | L1732: -105462000 | M1732: 1049000 | N1732: =POWER(D1732/M1732,1/9)-1 -> -2.4075956886633714 | O1732: =POWER(D1732/I1732,1/5)-1 -> -0.21286876728779835
A1733: 0204.HK | B1733: 资本界金控 | C1733: 0.49 | D1733: -22802000 | E1733: -20010000 | F1733: -15450000 | G1733: -52541000 | H1733: -87911000 | I1733: -19365000 | J1733: -14707000 | K1733: -23974000 | L1733: -88885000 | M1733: -89215000 | N1733: =POWER(D1733/M1733,1/9)-1 -> -0.14064904806280765 | O1733: =POWER(D1733/I1733,1/5)-1 -> 3.3215917032938913e-02
A1734: 0181.HK | B1734: 闽港控股 | C1734: 0.08 | D1734: -22829072 | E1734: -14307797 | F1734: 3640579 | G1734: 2027369 | H1734: 9462022 | I1734: 9415644 | J1734: 7947117 | K1734: 1665501 | L1734: -2136168 | M1734: -500450 | N1734: =POWER(D1734/M1734,1/9)-1 -> 0.52878885190661795 | O1734: =POWER(D1734/I1734,1/5)-1 -> -2.1937892000809214
A1735: 6133.HK | B1735: 维太创科 | C1735: 0.19 | D1735: -22843711.800000001 | E1735: -19794770.699999999 | F1735: -25108372.5 | G1735: -116359237.5 | H1735: -6228945 | I1735: 16565491.4 | J1735: -131526523.40000001 | K1735: 17219930 | L1735: 212746268.94999999 | M1735: 194953177.5 | N1735: =POWER(D1735/M1735,1/9)-1 -> -1.788020240695769 | O1735: =POWER(D1735/I1735,1/5)-1 -> -2.0663811750152616
A1736: 8385.HK | B1736: 万里印刷 | C1736: 0.14 | D1736: -22962000 | E1736: -59655000 | F1736: -83086000 | G1736: -100824000 | H1736: 18199000 | I1736: 24335000 | J1736: 6530000 | K1736: 13365000 | L1736: 13550000 | M1736: 11547000 | N1736: =POWER(D1736/M1736,1/9)-1 -> -2.079372059718462 | O1736: =POWER(D1736/I1736,1/5)-1 -> -1.9884522001116882
A1737: 8422.HK | B1737: WT集团 | C1737: 0.10000000000000001 | D1737: -23203000 | E1737: -8948000 | F1737: -7396000 | G1737: -5874000 | H1737: 6436000 | I1737: -9563000 | J1737: 9467000 | K1737: 8531000 | L1737: -- | M1737: -- | N1737: =POWER(D1737/M1737,1/9)-1 -> #VALUE! | O1737: =POWER(D1737/I1737,1/5)-1 -> 0.19396060353050482
A1738: 6182.HK | B1738: 乙德投资控股 | C1738: 0.15 | D1738: -23206000 | E1738: 13742000 | F1738: 11300000 | G1738: -23820000 | H1738: 769000 | I1738: 2328000 | J1738: 28293000 | K1738: 18920000 | L1738: 24318000 | M1738: -- | N1738: =POWER(D1738/M1738,1/9)-1 -> #VALUE! | O1738: =POWER(D1738/I1738,1/5)-1 -> -2.5838843307527863
A1739: 0082.HK | B1739: 疯狂体育 | C1739: 0.11 | D1739: -23222000 | E1739: 17758000 | F1739: 157012000 | G1739: -131916000 | H1739: -185190000 | I1739: -647558000 | J1739: -366304000 | K1739: -980071000 | L1739: 142666000 | M1739: -131590000 | N1739: =POWER(D1739/M1739,1/9)-1 -> -0.17529730292161472 | O1739: =POWER(D1739/I1739,1/5)-1 -> -0.48604607207388584
A1740: 0294.HK | B1740: 长江制衣 | C1740: 1.18 | D1740: -23249000 | E1740: 30665000 | F1740: -27822000 | G1740: -51009000 | H1740: 22062000 | I1740: 36558000 | J1740: 30380000 | K1740: 4413000 | L1740: -23241000 | M1740: 11920000 | N1740: =POWER(D1740/M1740,1/9)-1 -> -2.0770514429548581 | O1740: =POWER(D1740/I1740,1/5)-1 -> -1.9134491369471007
A1741: 0205.HK | B1741: 财讯传媒 | C1741: 0.20000000000000001 | D1741: -23279000 | E1741: -82473000 | F1741: -40136000 | G1741: -137831000 | H1741: -95294000 | I1741: -125077000 | J1741: -251707000 | K1741: -15200000 | L1741: -200113000 | M1741: -121246000 | N1741: =POWER(D1741/M1741,1/9)-1 -> -0.16753434998223249 | O1741: =POWER(D1741/I1741,1/5)-1 -> -0.28557380017675871
A1742: 8100.HK | B1742: 智易控股 | C1742: 0.21 | D1742: -23415000 | E1742: -8059000 | F1742: -18197000 | G1742: -39286000 | H1742: -67200000 | I1742: -251411000 | J1742: -512327000 | K1742: 17092000 | L1742: 60510000 | M1742: 52737000 | N1742: =POWER(D1742/M1742,1/9)-1 -> -1.9137341574802409 | O1742: =POWER(D1742/I1742,1/5)-1 -> -0.37795475112851751
A1743: 8471.HK | B1743: 新达控股 | C1743: 0.14 | D1743: -23715190.800000001 | E1743: -7606778.2999999998 | F1743: -1724096 | G1743: -16211031.9 | H1743: -5749537.5 | I1743: -3169862.3999999999 | J1743: -7748490.7000000002 | K1743: 10702448.75 | L1743: 7190369.7000000002 | M1743: -- | N1743: =POWER(D1743/M1743,1/9)-1 -> #VALUE! | O1743: =POWER(D1743/I1743,1/5)-1 -> 0.49553727711561724
A1744: 0065.HK | B1744: 弘海高新资源 | C1744: 0.11 | D1744: -23734000 | E1744: 10237000 | F1744: 14372000 | G1744: -42505000 | H1744: -10629000 | I1744: -18933000 | J1744: -143604000 | K1744: -120278000 | L1744: -170849000 | M1744: -113109000 | N1744: =POWER(D1744/M1744,1/9)-1 -> -0.15927755569522795 | O1744: =POWER(D1744/I1744,1/5)-1 -> 4.6237544230394834e-02
A1745: 0022.HK | B1745: 茂盛控股 | C1745: 0.05 | D1745: -23765000 | E1745: -44406000 | F1745: -43263000 | G1745: -70661000 | H1745: 1267000 | I1745: -107000 | J1745: -516000 | K1745: 35759000 | L1745: 36047000 | M1745: 55093000 | N1745: =POWER(D1745/M1745,1/9)-1 -> -1.9108079692163722 | O1745: =POWER(D1745/I1745,1/5)-1 -> 1.9465295995721568
A1746: 0455.HK | B1746: 天大药业 | C1746: 0.27 | D1746: -24155000 | E1746: -19771000 | F1746: -27142070 | G1746: 3142995 | H1746: 2657173 | I1746: 10007756 | J1746: 12442265 | K1746: 6568591 | L1746: -17941969 | M1746: 22049566 | N1746: =POWER(D1746/M1746,1/9)-1 -> -2.0101846786799928 | O1746: =POWER(D1746/I1746,1/5)-1 -> -2.1927078199923216
A1747: 8379.HK | B1747: 懒猪科技 | C1747: 0.11 | D1747: -24156000 | E1747: -23187000 | F1747: -7101000 | G1747: -3378000 | H1747: -1486000 | I1747: 4214000 | J1747: 13524000 | K1747: 13049000 | L1747: -- | M1747: -- | N1747: =POWER(D1747/M1747,1/9)-1 -> #VALUE! | O1747: =POWER(D1747/I1747,1/5)-1 -> -2.4179669157557249
A1748: 2157.HK | B1748: 乐普生物-B | C1748: 2.92 | D1748: -24221635.199999999 | E1748: -777319561.20000005 | F1748: -1237964602 | G1748: -693505823.10000002 | H1748: -- | I1748: -- | J1748: -- | K1748: -- | L1748: -- | M1748: -- | N1748: =POWER(D1748/M1748,1/9)-1 -> #VALUE! | O1748: =POWER(D1748/I1748,1/5)-1 -> #VALUE!
A1749: 0889.HK | B1749: 连达科技控股 | C1749: 0.29999999999999999 | D1749: -24227000 | E1749: 27875000 | F1749: 3826000 | G1749: -6908000 | H1749: 17643000 | I1749: 47969000 | J1749: 43091000 | K1749: 21924000 | L1749: 2802000 | M1749: 32638000 | N1749: =POWER(D1749/M1749,1/9)-1 -> -1.9674300358004668 | O1749: =POWER(D1749/I1749,1/5)-1 -> -1.8723038612425711
A1750: 2728.HK | B1750: 金泰能源控股 | C1750: 0.02 | D1750: -24256000 | E1750: -31913000 | F1750: 94295000 | G1750: 321803000 | H1750: -599250000 | I1750: -351811000 | J1750: 46853000 | K1750: 24370000 | L1750: -10172000 | M1750: 7572000 | N1750: =POWER(D1750/M1750,1/9)-1 -> -2.1380955650051132 | O1750: =POWER(D1750/I1750,1/5)-1 -> -0.41426395030766494
A1751: 0164.HK | B1751: 中国宝力科技 | C1751: 0.56 | D1751: -24273000 | E1751: 96614000 | F1751: -111404000 | G1751: -114089000 | H1751: -1298305000 | I1751: -294509000 | J1751: -378728000 | K1751: -77097000 | L1751: -67899000 | M1751: -51471000 | N1751: =POWER(D1751/M1751,1/9)-1 -> -8.012464545529252e-02 | O1751: =POWER(D1751/I1751,1/5)-1 -> -0.39297723729043021
A1752: 1002.HK | B1752: 威铖国际 | C1752: 0.07 | D1752: -24362280 | E1752: -56113673.350000001 | F1752: -6750394.2000000002 | G1752: -37374623 | H1752: -138733275.30000001 | I1752: -10165373.5 | J1752: 15651553 | K1752: -38028510 | L1752: -28860202.800000001 | M1752: -25729000 | N1752: =POWER(D1752/M1752,1/9)-1 -> -6.0463938616835966e-03 | O1752: =POWER(D1752/I1752,1/5)-1 -> 0.19101962606030121
A1753: 0804.HK | B1753: 鼎石资本 | C1753: 0.29 | D1753: -24388000 | E1753: -41470000 | F1753: -4933000 | G1753: -18828000 | H1753: 7231000 | I1753: -3005000 | J1753: 14061000 | K1753: 27550000 | L1753: 15410000 | M1753: 21217000 | N1753: =POWER(D1753/M1753,1/9)-1 -> -2.0155968768406094 | O1753: =POWER(D1753/I1753,1/5)-1 -> 0.52007963967958082
A1754: 1162.HK | B1754: 莹岚集团 | C1754: 0.17 | D1754: -24419000 | E1754: 604000 | F1754: -483000 | G1754: 17162000 | H1754: 24091000 | I1754: 11356000 | J1754: 12269000 | K1754: 18208000 | L1754: 12191000 | M1754: -- | N1754: =POWER(D1754/M1754,1/9)-1 -> #VALUE! | O1754: =POWER(D1754/I1754,1/5)-1 -> -2.1654683878085934
A1755: 0591.HK | B1755: 中国高精密 | C1755: 0.13 | D1755: -24471052.800000001 | E1755: -42034517.600000001 | F1755: -31157700 | G1755: -96395431 | H1755: -53970415.299999997 | I1755: -70052443.200000003 | J1755: -103376567.90000001 | K1755: -109361816 | L1755: -82131612.5 | M1755: -24342240 | N1755: =POWER(D1755/M1755,1/9)-1 -> 5.865928377022378e-04 | O1755: =POWER(D1755/I1755,1/5)-1 -> -0.18969993548417186
A1756: 8125.HK | B1756: 仁德资源 | C1756: 0.16 | D1756: -24564000 | E1756: -21068000 | F1756: -19427000 | G1756: -28114000 | H1756: -20074000 | I1756: -28093000 | J1756: -35034000 | K1756: -9370000 | L1756: 5451000 | M1756: 9645000 | N1756: =POWER(D1756/M1756,1/9)-1 -> -2.1094577337362503 | O1756: =POWER(D1756/I1756,1/5)-1 -> -2.6490500086942204e-02
A1757: 0918.HK | B1757: 国能国际资产 | C1757: 0.83 | D1757: -24652000 | E1757: -11716000 | F1757: 7614000 | G1757: 9376000 | H1757: -28249000 | I1757: 13339000 | J1757: -12749000 | K1757: -25593000 | L1757: 510000 | M1757: 1248000 | N1757: =POWER(D1757/M1757,1/9)-1 -> -2.3930276296510558 | O1757: =POWER(D1757/I1757,1/5)-1 -> -2.1306957956459032
A1758: 1300.HK | B1758: 俊知集团 | C1758: 0.34 | D1758: -24716021.399999999 | E1758: -63581972.200000003 | F1758: 254043341.5 | G1758: -166107951.59999999 | H1758: 401147857.5 | I1758: 393340756 | J1758: 332266742.69999999 | K1758: 214035640 | L1758: 323711290.64999998 | M1758: 460561205.10000002 | N1758: =POWER(D1758/M1758,1/9)-1 -> -1.7225278285893975 | O1758: =POWER(D1758/I1758,1/5)-1 -> -1.5749656809024084
A1759: 8067.HK | B1759: 东方大学城控股 | C1759: 0.32 | D1759: -24821532.800000001 | E1759: 6807005.4000000004 | F1759: 41973873 | G1759: 49068058.600000001 | H1759: 35399827.600000001 | I1759: 192962230.59999999 | J1759: 48633761.450000003 | K1759: 61442575.600000001 | L1759: 52624191.200000003 | M1759: 50425440 | N1759: =POWER(D1759/M1759,1/9)-1 -> -1.9242674433678073 | O1759: =POWER(D1759/I1759,1/5)-1 -> -1.663546338757659
A1760: 0245.HK | B1760: 中薇金融 | C1760: 0.06 | D1760: -24834000 | E1760: -623263000 | F1760: 71189000 | G1760: 323452000 | H1760: -568815000 | I1760: 143233000 | J1760: 192033000 | K1760: 36933000 | L1760: -28580000 | M1760: -30144000 | N1760: =POWER(D1760/M1760,1/9)-1 -> -2.1300124995862313e-02 | O1760: =POWER(D1760/I1760,1/5)-1 -> -1.7043697845492887
A1761: 8161.HK | B1761: 医汇集团 | C1761: 0.33 | D1761: -24882000 | E1761: -6216000 | F1761: 4755000 | G1761: -14942000 | H1761: -13437000 | I1761: -12704000 | J1761: -4261000 | K1761: -2256000 | L1761: 10549000 | M1761: 5542000 | N1761: =POWER(D1761/M1761,1/9)-1 -> -2.1815952911937195 | O1761: =POWER(D1761/I1761,1/5)-1 -> 0.14390237090451929
A1762: 1195.HK | B1762: 京维集团 | C1762: 0.02 | D1762: -24912118.399999999 | E1762: -12672205.199999999 | F1762: -7676343 | G1762: -14507545.25 | H1762: -9653568.4499999993 | I1762: -23420564.199999999 | J1762: -104573018.59999999 | K1762: -51558441.200000003 | L1762: 26134716.300000001 | M1762: -126174048 | N1762: =POWER(D1762/M1762,1/9)-1 -> -0.16494395404455919 | O1762: =POWER(D1762/I1762,1/5)-1 -> 1.2424534994381009e-02
A1763: 0750.HK | B1763: 水发兴业能源 | C1763: 0.33 | D1763: -24930876.600000001 | E1763: 4328519.7000000002 | F1763: 271116545 | G1763: 370242280.80000001 | H1763: -1112167290 | I1763: -772882818.60000002 | J1763: 172398223.30000001 | K1763: 557804161.25 | L1763: 418657335.30000001 | M1763: 729109285.10000002 | N1763: =POWER(D1763/M1763,1/9)-1 -> -1.6872345595792657 | O1763: =POWER(D1763/I1763,1/5)-1 -> -0.49681836814846803
A1764: 8540.HK | B1764: 胜利证券 | C1764: 3.1000000000000001 | D1764: -24969812 | E1764: -24162432 | F1764: 15108225 | G1764: 23183516 | H1764: 9414656 | I1764: 7253776 | J1764: 17653083 | K1764: 7094198 | L1764: 14493925 | M1764: -- | N1764: =POWER(D1764/M1764,1/9)-1 -> #VALUE! | O1764: =POWER(D1764/I1764,1/5)-1 -> -2.2804724134797261
A1765: 1539.HK | B1765: 知行集团控股 | C1765: 0.56 | D1765: -25084000 | E1765: -382145000 | F1765: -279797000 | G1765: -109762000 | H1765: 44554000 | I1765: 125704000 | J1765: 74072000 | K1765: 35402000 | L1765: 26229000 | M1765: 23538000 | N1765: =POWER(D1765/M1765,1/9)-1 -> -2.0070932673550832 | O1765: =POWER(D1765/I1765,1/5)-1 -> -1.7244518718899338
A1766: 0928.HK | B1766: 帝王国际投资 | C1766: 0.06 | D1766: -25192000 | E1766: -34458000 | F1766: -4583000 | G1766: -24854000 | H1766: -118854000 | I1766: -94242000 | J1766: -37674000 | K1766: -34337000 | L1766: -45333000 | M1766: -110804000 | N1766: =POWER(D1766/M1766,1/9)-1 -> -0.15175165060672002 | O1766: =POWER(D1766/I1766,1/5)-1 -> -0.23192499793043675
A1767: 8536.HK | B1767: TL Natural Gas | C1767: 0.72 | D1767: -25238908.800000001 | E1767: -3467779.3999999999 | F1767: -10383760 | G1767: -26985807.899999999 | H1767: -3054127.5 | I1767: 5238698.5999999996 | J1767: -6494441.2999999998 | K1767: 4218305 | L1767: 7008081.9500000002 | M1767: -- | N1767: =POWER(D1767/M1767,1/9)-1 -> #VALUE! | O1767: =POWER(D1767/I1767,1/5)-1 -> -2.3695233218144462
A1768: 0905.HK | B1768: 胡桃资本 | C1768: 0.19 | D1768: -25294000 | E1768: -117036000 | F1768: -64030000 | G1768: -18792000 | H1768: -91295000 | I1768: -141223000 | J1768: 26468000 | K1768: -87070000 | L1768: -64053000 | M1768: -17604000 | N1768: =POWER(D1768/M1768,1/9)-1 -> 4.1093110950937817e-02 | O1768: =POWER(D1768/I1768,1/5)-1 -> -0.29103888412442958
A1769: 8269.HK | B1769: 富誉控股 | C1769: 0.04 | D1769: -25512000 | E1769: -28091000 | F1769: -66695000 | G1769: -19855000 | H1769: -16745000 | I1769: -57105000 | J1769: -81635000 | K1769: -49893000 | L1769: -202603000 | M1769: -159407000 | N1769: =POWER(D1769/M1769,1/9)-1 -> -0.18420337935168773 | O1769: =POWER(D1769/I1769,1/5)-1 -> -0.14883437873253957
A1770: 2309.HK | B1770: 大象未来集团 | C1770: 3.38 | D1770: -25657000 | E1770: -40661000 | F1770: -74232000 | G1770: -260484000 | H1770: -360927000 | I1770: -425027000 | J1770: -177712000 | K1770: -58574000 | L1770: -4161000 | M1770: -157430000 | N1770: =POWER(D1770/M1770,1/9)-1 -> -0.18255677706034623 | O1770: =POWER(D1770/I1770,1/5)-1 -> -0.42962842894466413
A1771: 8163.HK | B1771: 声扬集团 | C1771: 0.11 | D1771: -25673000 | E1771: -27820000 | F1771: -31123000 | G1771: -71711000 | H1771: -84110000 | I1771: -92051000 | J1771: -6725000 | K1771: -42617000 | L1771: -124944000 | M1771: -172225000 | N1771: =POWER(D1771/M1771,1/9)-1 -> -0.19061830002334057 | O1771: =POWER(D1771/I1771,1/5)-1 -> -0.22537836601532568
A1772: 1433.HK | B1772: 常达控股 | C1772: 0.04 | D1772: -25676000 | E1772: 12558000 | F1772: 14984000 | G1772: 1647000 | H1772: 25331000 | I1772: 31940000 | J1772: 24208000 | K1772: 19229000 | L1772: -- | M1772: -- | N1772: =POWER(D1772/M1772,1/9)-1 -> #VALUE! | O1772: =POWER(D1772/I1772,1/5)-1 -> -1.9572789101114445
A1773: 1640.HK | B1773: 瑞诚中国传媒 | C1773: 0.76 | D1773: -25728910.199999999 | E1773: -12842290.4 | F1773: 544902.5 | G1773: 3389763.6000000001 | H1773: 40569720 | I1773: 52545251.399999999 | J1773: 48211365.700000003 | K1773: 17519967.5 | L1773: -- | M1773: -- | N1773: =POWER(D1773/M1773,1/9)-1 -> #VALUE! | O1773: =POWER(D1773/I1773,1/5)-1 -> -1.8669171276738141
A1774: 3626.HK | B1774: Hssp Intl | C1774: 0.27 | D1774: -25965000 | E1774: -3835000 | F1774: -2957000 | G1774: -9716000 | H1774: 1665000 | I1774: 12712000 | J1774: 10670000 | K1774: 3158000 | L1774: 27472000 | M1774: 23294000 | N1774: =POWER(D1774/M1774,1/9)-1 -> -2.0121345512885953 | O1774: =POWER(D1774/I1774,1/5)-1 -> -2.1535459228803511
A1775: 0442.HK | B1775: 域能控股 | C1775: 1.1000000000000001 | D1775: -25966000 | E1775: -78168000 | F1775: -74998000 | G1775: -67694000 | H1775: -17136000 | I1775: -37297000 | J1775: -9154000 | K1775: -13502000 | L1775: 20342000 | M1775: 37572000 | N1775: =POWER(D1775/M1775,1/9)-1 -> -1.9597788893061501 | O1775: =POWER(D1775/I1775,1/5)-1 -> -6.9864478031481769e-02
A1776: 0567.HK | B1776: 大昌微线集团 | C1776: 0.07 | D1776: -26017000 | E1776: -29128000 | F1776: -66976000 | G1776: -87248000 | H1776: 100466000 | I1776: -80077000 | J1776: -51009000 | K1776: -60901000 | L1776: 14292000 | M1776: -37545000 | N1776: =POWER(D1776/M1776,1/9)-1 -> -3.9935154328253453e-02 | O1776: =POWER(D1776/I1776,1/5)-1 -> -0.20136215815985803
A1777: 0675.HK | B1777: 坚宝国际 | C1777: 0.40000000000000002 | D1777: -26097860 | E1777: -503036 | F1777: 63297533 | G1777: 66909865 | H1777: 16658614 | I1777: 1224620 | J1777: 8291860 | K1777: -8110149 | L1777: 154114 | M1777: 10522689 | N1777: =POWER(D1777/M1777,1/9)-1 -> -2.1061930024973483 | O1777: =POWER(D1777/I1777,1/5)-1 -> -2.8438292908122875
A1778: 1967.HK | B1778: 信恳智能 | C1778: 0.28 | D1778: -26133408 | E1778: -10242019.9 | F1778: 8866604.5 | G1778: 13988138.4 | H1778: 30965925 | I1778: 46470820.399999999 | J1778: 38377987.899999999 | K1778: 39296022.5 | L1778: -- | M1778: -- | N1778: =POWER(D1778/M1778,1/9)-1 -> #VALUE! | O1778: =POWER(D1778/I1778,1/5)-1 -> -1.8912573857754045
A1779: 1301.HK | B1779: 德基科技控股 | C1779: 0.96 | D1779: -26159716.800000001 | E1779: -46012942.799999997 | F1779: 13056843.5 | G1779: -20553123.600000001 | H1779: -39197430 | I1779: -55121903.200000003 | J1779: 25365127.300000001 | K1779: -31669513.75 | L1779: 36208227.399999999 | M1779: 92751415.400000006 | N1779: =POWER(D1779/M1779,1/9)-1 -> -1.8688075979127994 | O1779: =POWER(D1779/I1779,1/5)-1 -> -0.1384871357271783
A1780: 1532.HK | B1780: 中国派对文化 | C1780: 0.07 | D1780: -26234258.399999999 | E1780: -17079434 | F1780: -21700589 | G1780: -81570060.299999997 | H1780: -80689087.5 | I1780: -13361471 | J1780: 16770213.199999999 | K1780: 62987872.5 | L1780: 78461351.799999997 | M1780: 73101982 | N1780: =POWER(D1780/M1780,1/9)-1 -> -1.8923779874446831 | O1780: =POWER(D1780/I1780,1/5)-1 -> 0.14446602264957176
A1781: 8245.HK | B1781: 善裕集团控股 | C1781: 0.17 | D1781: -26300000 | E1781: -60447000 | F1781: -34581000 | G1781: -19474000 | H1781: -9789000 | I1781: 890000 | J1781: 4283000 | K1781: -14850000 | L1781: 10536000 | M1781: 24722000 | N1781: =POWER(D1781/M1781,1/9)-1 -> -2.0068987322312664 | O1781: =POWER(D1781/I1781,1/5)-1 -> -2.9683990572906493
A1782: 1667.HK | B1782: 迪米生活控股 | C1782: 0.29999999999999999 | D1782: -26642000 | E1782: -60495000 | F1782: -52810000 | G1782: -17038000 | H1782: 14666000 | I1782: 15587000 | J1782: 8146000 | K1782: 24308000 | L1782: 22597000 | M1782: 13582000 | N1782: =POWER(D1782/M1782,1/9)-1 -> -2.0777336805255047 | O1782: =POWER(D1782/I1782,1/5)-1 -> -2.1131683702237591
A1783: 8275.HK | B1783: 中国新消费集团 | C1783: 0.13 | D1783: -26757000 | E1783: -37796000 | F1783: -14714000 | G1783: -12604000 | H1783: -2406000 | I1783: -14462000 | J1783: 5280000 | K1783: 17281000 | L1783: -- | M1783: -- | N1783: =POWER(D1783/M1783,1/9)-1 -> #VALUE! | O1783: =POWER(D1783/I1783,1/5)-1 -> 0.13094585261946601
A1784: 8482.HK | B1784: 万励达 | C1784: 0.02 | D1784: -26771000 | E1784: 9238000 | F1784: 4849000 | G1784: -21997000 | H1784: -15971000 | I1784: 10333000 | J1784: 11481000 | K1784: 6328000 | L1784: -- | M1784: -- | N1784: =POWER(D1784/M1784,1/9)-1 -> #VALUE! | O1784: =POWER(D1784/I1784,1/5)-1 -> -2.2097277217864892
A1785: 8523.HK | B1785: 常满控股 | C1785: 0.23 | D1785: -26772000 | E1785: -210581000 | F1785: 20647000 | G1785: 28905000 | H1785: 24763000 | I1785: 8777000 | J1785: 9744000 | K1785: 5326000 | L1785: -- | M1785: -- | N1785: =POWER(D1785/M1785,1/9)-1 -> #VALUE! | O1785: =POWER(D1785/I1785,1/5)-1 -> -2.2498760424109419
A1786: 3321.HK | B1786: 伟鸿集团控股 | C1786: 0.05 | D1786: -26976699.129999999 | E1786: -- | F1786: -28244660.300000001 | G1786: 44396116.670000002 | H1786: 36820388.490000002 | I1786: 30903883.609999999 | J1786: 23260194.260000002 | K1786: 17466990.359999999 | L1786: 16533980.640000001 | M1786: -- | N1786: =POWER(D1786/M1786,1/9)-1 -> #VALUE! | O1786: =POWER(D1786/I1786,1/5)-1 -> -1.9731844249170956
A1787: 1575.HK | B1787: 慕容家居 | C1787: 0.09 | D1787: -27106833.600000001 | E1787: -225257879.90000001 | F1787: -148786546 | G1787: -108691744.8 | H1787: -156937230 | I1787: 98380733 | J1787: 174673735.5 | K1787: 89651205 | L1787: 97692121.400000006 | M1787: 30403835.600000001 | N1787: =POWER(D1787/M1787,1/9)-1 -> -1.9873273262352884 | O1787: =POWER(D1787/I1787,1/5)-1 -> -1.7727406291136085
A1788: 0621.HK | B1788: 坛金矿业 | C1788: 0.03 | D1788: -27111000 | E1788: 45147000 | F1788: -526232000 | G1788: -41359000 | H1788: -33871000 | I1788: -389047000 | J1788: 128217000 | K1788: 382210000 | L1788: -110730000 | M1788: -726863000 | N1788: =POWER(D1788/M1788,1/9)-1 -> -0.30609627411943974 | O1788: =POWER(D1788/I1788,1/5)-1 -> -0.41301271587702593
A1789: 8516.HK | B1789: 广骏集团控股 | C1789: 0.12 | D1789: -27261000 | E1789: -20402000 | F1789: -29538000 | G1789: -16525000 | H1789: 1923000 | I1789: 6854000 | J1789: 16458000 | K1789: 11003000 | L1789: -- | M1789: -- | N1789: =POWER(D1789/M1789,1/9)-1 -> #VALUE! | O1789: =POWER(D1789/I1789,1/5)-1 -> -2.3180125225164918
A1790: 1410.HK | B1790: 安领国际 | C1790: 0.29999999999999999 | D1790: -27478000 | E1790: 22789000 | F1790: 34739000 | G1790: 23344000 | H1790: 26174000 | I1790: 18182000 | J1790: -5414000 | K1790: 11990000 | L1790: 5721000 | M1790: -- | N1790: =POWER(D1790/M1790,1/9)-1 -> #VALUE! | O1790: =POWER(D1790/I1790,1/5)-1 -> -2.0860971977098304
A1791: 1854.HK | B1791: 中国万天控股 | C1791: 1.08 | D1791: -27728000 | E1791: -10955000 | F1791: -8240000 | G1791: -4739000 | H1791: 16059000 | I1791: 22861000 | J1791: 3410000 | K1791: 11073000 | L1791: 8753000 | M1791: -- | N1791: =POWER(D1791/M1791,1/9)-1 -> #VALUE! | O1791: =POWER(D1791/I1791,1/5)-1 -> -2.0393568061505913
A1792: 8176.HK | B1792: 超人智能 | C1792: 0.31 | D1792: -27756000 | E1792: -13697000 | F1792: -36944000 | G1792: -109602000 | H1792: -168425000 | I1792: -132345000 | J1792: -99059000 | K1792: -44946000 | L1792: -42086000 | M1792: -11768000 | N1792: =POWER(D1792/M1792,1/9)-1 -> 0.10003378659099793 | O1792: =POWER(D1792/I1792,1/5)-1 -> -0.26830536931842675
A1793: 0851.HK | B1793: 盛源控股 | C1793: 0.20000000000000001 | D1793: -27768000 | E1793: -5802000 | F1793: 4650000 | G1793: 12006000 | H1793: -77334000 | I1793: -81646000 | J1793: -184507000 | K1793: -16911000 | L1793: -34385000 | M1793: -5040000 | N1793: =POWER(D1793/M1793,1/9)-1 -> 0.20877649695103218 | O1793: =POWER(D1793/I1793,1/5)-1 -> -0.19402431950467569
A1794: 1775.HK | B1794: 精英汇集团 | C1794: 0.24 | D1794: -27844000 | E1794: -25506000 | F1794: -26963000 | G1794: -19230000 | H1794: 11928000 | I1794: 25883000 | J1794: 34426000 | K1794: 30546000 | L1794: 30769000 | M1794: -- | N1794: =POWER(D1794/M1794,1/9)-1 -> #VALUE! | O1794: =POWER(D1794/I1794,1/5)-1 -> -2.0147134162995486
A1795: 1452.HK | B1795: 迪诺斯环保 | C1795: 0.07 | D1795: -27880750.800000001 | E1795: -26545321.100000001 | F1795: -15056452 | G1795: -25062081.300000001 | H1795: -44764815 | I1795: -45220637.600000001 | J1795: -87518501.099999994 | K1795: -67137280 | L1795: 30043373.300000001 | M1795: 91764326.5 | N1795: =POWER(D1795/M1795,1/9)-1 -> -1.8760209839315931 | O1795: =POWER(D1795/I1795,1/5)-1 -> -9.2192938501156396e-02
A1796: 1150.HK | B1796: 米兰站 | C1796: 0.09 | D1796: -27884000 | E1796: -45855000 | F1796: 20530000 | G1796: -3108000 | H1796: -23491000 | I1796: -40012000 | J1796: -80784000 | K1796: -72820000 | L1796: -48242000 | M1796: -52918000 | N1796: =POWER(D1796/M1796,1/9)-1 -> -6.8713050828330235e-02 | O1796: =POWER(D1796/I1796,1/5)-1 -> -6.9678703414351895e-02
A1797: 0264.HK | B1797: 中联发展控股 | C1797: 1.49 | D1797: -27909000 | E1797: -18936000 | F1797: -20987000 | G1797: -21758000 | H1797: -18327000 | I1797: -31466000 | J1797: -14225000 | K1797: -28052000 | L1797: -25780000 | M1797: -38866000 | N1797: =POWER(D1797/M1797,1/9)-1 -> -3.6127963110718864e-02 | O1797: =POWER(D1797/I1797,1/5)-1 -> -2.3706163677035375e-02
A1798: 8496.HK | B1798: 环球友饮智能 | C1798: 0.38 | D1798: -28163351.530000001 | E1798: -9508349.7599999998 | F1798: -28229317.699999999 | G1798: -14367193.279999999 | H1798: 8383653.96 | I1798: 4960362.2400000002 | J1798: -- | K1798: -- | L1798: -- | M1798: -- | N1798: =POWER(D1798/M1798,1/9)-1 -> #VALUE! | O1798: =POWER(D1798/I1798,1/5)-1 -> -2.4152533404488219
A1799: 8018.HK | B1799: 汇财金融投资 | C1799: 0.07 | D1799: -28193000 | E1799: -27156000 | F1799: -24950000 | G1799: -49111000 | H1799: -20839000 | I1799: -15203000 | J1799: -46503000 | K1799: 2008000 | L1799: -15896000 | M1799: 11318955 | N1799: =POWER(D1799/M1799,1/9)-1 -> -2.1067186219282279 | O1799: =POWER(D1799/I1799,1/5)-1 -> 0.13146832136823794
A1800: 8511.HK | B1800: 民富国际 | C1800: 0.03 | D1800: -28251000 | E1800: -9245000 | F1800: -3339000 | G1800: 3138000 | H1800: 7311000 | I1800: -11235000 | J1800: 17259000 | K1800: 3622000 | L1800: -- | M1800: -- | N1800: =POWER(D1800/M1800,1/9)-1 -> #VALUE! | O1800: =POWER(D1800/I1800,1/5)-1 -> 0.2025195611231474
A1801: 0356.HK | B1801: 鼎立资本 | C1801: 0.06 | D1801: -28325379 | E1801: -24097700 | F1801: -4781495 | G1801: -40913149 | H1801: -25809037 | I1801: -45200178 | J1801: 8035081 | K1801: 5207002 | L1801: 1582664 | M1801: -3742514 | N1801: =POWER(D1801/M1801,1/9)-1 -> 0.2521836617000266 | O1801: =POWER(D1801/I1801,1/5)-1 -> -8.923335537902255e-02
A1802: 0822.HK | B1802: 嘉瑞国际 | C1802: 0.27 | D1802: -28435000 | E1802: 74844000 | F1802: 131139000 | G1802: 123991000 | H1802: 88705000 | I1802: 113556000 | J1802: 33998000 | K1802: 59243000 | L1802: -63489000 | M1802: 77246000 | N1802: =POWER(D1802/M1802,1/9)-1 -> -1.8949015248509142 | O1802: =POWER(D1802/I1802,1/5)-1 -> -1.7581037227416809
A1803: 1082.HK | B1803: 源宇宙教育 | C1803: 1.67 | D1803: -28541000 | E1803: -32892000 | F1803: 3617000 | G1803: -107194000 | H1803: -77438000 | I1803: -8246000 | J1803: -333326000 | K1803: -144718000 | L1803: 33028000 | M1803: -66517000 | N1803: =POWER(D1803/M1803,1/9)-1 -> -8.9728960518793532e-02 | O1803: =POWER(D1803/I1803,1/5)-1 -> 0.28187350442961945
A1804: 0209.HK | B1804: 瀛晟科学 | C1804: 0.23 | D1804: -28650000 | E1804: 8079000 | F1804: -136015000 | G1804: -95779000 | H1804: -42422000 | I1804: -153625000 | J1804: -77733000 | K1804: -227296000 | L1804: -133261000 | M1804: -120853000 | N1804: =POWER(D1804/M1804,1/9)-1 -> -0.14780143421312797 | O1804: =POWER(D1804/I1804,1/5)-1 -> -0.28528557734347426
A1805: 8111.HK | B1805: 中国科技产业集团 | C1805: 0.09 | D1805: -28733763 | E1805: -4602489 | F1805: 81719171.25 | G1805: -29387218 | H1805: -62479048.799999997 | I1805: -6389460.4500000002 | J1805: -333148000 | K1805: 46490000 | L1805: 29673000 | M1805: 10065000 | N1805: =POWER(D1805/M1805,1/9)-1 -> -2.1236210286407786 | O1805: =POWER(D1805/I1805,1/5)-1 -> 0.35078324117004289
A1806: 0079.HK | B1806: 世纪建业 | C1806: 0.13 | D1806: -28736000 | E1806: -27266000 | F1806: -12491000 | G1806: -24063000 | H1806: -21234000 | I1806: -12873000 | J1806: 10793000 | K1806: -19617000 | L1806: -19132000 | M1806: 14489000 | N1806: =POWER(D1806/M1806,1/9)-1 -> -2.0790538044532383 | O1806: =POWER(D1806/I1806,1/5)-1 -> 0.17421955627657959
A1807: 8181.HK | B1807: 时时服务 | C1807: 0.08 | D1807: -28802000 | E1807: -25949000 | F1807: 15856000 | G1807: 14174000 | H1807: 52229000 | I1807: 28694621 | J1807: 10188178 | K1807: 2814868 | L1807: 4974424 | M1807: 5028381 | N1807: =POWER(D1807/M1807,1/9)-1 -> -2.2140081651116903 | O1807: =POWER(D1807/I1807,1/5)-1 -> -2.0007473082113485
A1808: 1312.HK | B1808: 华控康泰 | C1808: 0.04 | D1808: -28843000 | E1808: -41546000 | F1808: -15048000 | G1808: -267164000 | H1808: 36102000 | I1808: 32499000 | J1808: -1806000 | K1808: -37076000 | L1808: -34237000 | M1808: 17280000 | N1808: =POWER(D1808/M1808,1/9)-1 -> -2.0585755397824581 | O1808: =POWER(D1808/I1808,1/5)-1 -> -1.9764141992798234
A1809: 1721.HK | B1809: FSM Holdings | C1809: 0.51 | D1809: -28861044 | E1809: 12004294.5 | F1809: -18128790 | G1809: -15240536 | H1809: 341197 | I1809: 11782584 | J1809: 35876610 | K1809: 12033450 | L1809: 30619762.5 | M1809: -- | N1809: =POWER(D1809/M1809,1/9)-1 -> #VALUE! | O1809: =POWER(D1809/I1809,1/5)-1 -> -2.1962289221159716
A1810: 8056.HK | B1810: 生活概念 | C1810: 0.02 | D1810: -28883000 | E1810: -40848000 | F1810: -64432000 | G1810: -130858000 | H1810: -27917000 | I1810: -2266000 | J1810: -29634000 | K1810: 18120000 | L1810: 23378000 | M1810: 39555000 | N1810: =POWER(D1810/M1810,1/9)-1 -> -1.965665615936145 | O1810: =POWER(D1810/I1810,1/5)-1 -> 0.66370560192770145
A1811: 8487.HK | B1811: ISP Global | C1811: 0.14 | D1811: -28928080 | E1811: -5392063.1399999997 | F1811: -2577695.04 | G1811: 1578426.8799999999 | H1811: 586615.13 | I1811: -9455345.2799999993 | J1811: 7654502.8300000001 | K1811: 7413439.5700000003 | L1811: -- | M1811: -- | N1811: =POWER(D1811/M1811,1/9)-1 -> #VALUE! | O1811: =POWER(D1811/I1811,1/5)-1 -> 0.25062885148705938
A1812: 3778.HK | B1812: 中国织材控股 | C1812: 0.27 | D1812: -29074512.600000001 | E1812: -14173448.4 | F1812: 248015128 | G1812: 74791725 | H1812: -1570087.5 | I1812: 91439827.400000006 | J1812: 60296277.700000003 | K1812: 16497617.5 | L1812: 16256539.15 | M1812: -63428261.200000003 | N1812: =POWER(D1812/M1812,1/9)-1 -> -8.3022142951560851e-02 | O1812: =POWER(D1812/I1812,1/5)-1 -> -1.7951982379997482
A1813: 0756.HK | B1813: 森美控股 | C1813: 1.01 | D1813: -29104937.600000001 | E1813: -46629919.799999997 | F1813: -58177080 | G1813: 345743248.39999998 | H1813: -2709398505.5 | I1813: 13668596.4 | J1813: 77784279.950000003 | K1813: 73004644 | L1813: 97464928.75 | M1813: 145852512 | N1813: =POWER(D1813/M1813,1/9)-1 -> -1.8360419785178435 | O1813: =POWER(D1813/I1813,1/5)-1 -> -2.1631843503440509
A1814: 8527.HK | B1814: 聚利宝控股 | C1814: 0.20000000000000001 | D1814: -29139237 | E1814: -9825931.5 | F1814: -16275496.5 | G1814: -11745592 | H1814: -16608776 | I1814: -14446872 | J1814: -13221390 | K1814: 7335900 | L1814: 4040602.5 | M1814: -- | N1814: =POWER(D1814/M1814,1/9)-1 -> #VALUE! | O1814: =POWER(D1814/I1814,1/5)-1 -> 0.15064371643054586
A1815: 1405.HK | B1815: 达势股份 | C1815: 69.400000000000006 | D1815: -29162208.600000001 | E1815: -251151159.19999999 | F1815: -576816643.5 | G1815: -326640195 | H1815: -- | I1815: -- | J1815: -- | K1815: -- | L1815: -- | M1815: -- | N1815: =POWER(D1815/M1815,1/9)-1 -> #VALUE! | O1815: =POWER(D1815/I1815,1/5)-1 -> #VALUE!
A1816: 8277.HK | B1816: 骏东控股 | C1816: 0.18 | D1816: -29194000 | E1816: -5039000 | F1816: -27499000 | G1816: -31505000 | H1816: 3344000 | I1816: -3843000 | J1816: -15397000 | K1816: -9450000 | L1816: 2119000 | M1816: -13764000 | N1816: =POWER(D1816/M1816,1/9)-1 -> 8.713434308507928e-02 | O1816: =POWER(D1816/I1816,1/5)-1 -> 0.50011531140747034
A1817: 8211.HK | B1817: 浙江永安 | C1817: 0.02 | D1817: -29308003.199999999 | E1817: -40133285.600000001 | F1817: -23045090 | G1817: -34196802.899999999 | H1817: -54943005 | I1817: -4065940.6000000001 | J1817: -2648370.1000000001 | K1817: -8015446.25 | L1817: -20203362.949999999 | M1817: -9127140.5999999996 | N1817: =POWER(D1817/M1817,1/9)-1 -> 0.13839927358497883 | O1817: =POWER(D1817/I1817,1/5)-1 -> 0.48444817499885318
A1818: 0974.HK | B1818: 中国顺客隆 | C1818: 1.06 | D1818: -29327734.800000001 | E1818: -28202500 | F1818: -46586102.5 | G1818: -19667541.899999999 | H1818: -23049555 | I1818: 12805834.199999999 | J1818: 14004350.9 | K1818: 27111166.25 | L1818: 33671487.549999997 | M1818: 38623752.899999999 | N1818: =POWER(D1818/M1818,1/9)-1 -> -1.9698705749120289 | O1818: =POWER(D1818/I1818,1/5)-1 -> -2.1802503262979203
A1819: 8072.HK | B1819: 罗马元宇宙集团 | C1819: 0.01 | D1819: -29352000 | E1819: -34864000 | F1819: -54082000 | G1819: -158376000 | H1819: -71415000 | I1819: -25548000 | J1819: 21249000 | K1819: 36587000 | L1819: 29191000 | M1819: 20031000 | N1819: =POWER(D1819/M1819,1/9)-1 -> -2.043367319954756 | O1819: =POWER(D1819/I1819,1/5)-1 -> 2.8149238640131413e-02
A1820: 2195.HK | B1820: 盈汇企业控股 | C1820: 0.12 | D1820: -29412000 | E1820: -7409000 | F1820: 26282000 | G1820: 37737000 | H1820: -- | I1820: -- | J1820: -- | K1820: -- | L1820: -- | M1820: -- | N1820: =POWER(D1820/M1820,1/9)-1 -> #VALUE! | O1820: =POWER(D1820/I1820,1/5)-1 -> #VALUE!
A1821: 8291.HK | B1821: 港娱国际 | C1821: 0.08 | D1821: -29639055.600000001 | E1821: -117361883.5 | F1821: -66983823.5 | G1821: -27329075.100000001 | H1821: -32297985 | I1821: -9018850.5999999996 | J1821: -4260890.5999999996 | K1821: 8161020 | L1821: 6968096.25 | M1821: 9949506.6999999993 | N1821: =POWER(D1821/M1821,1/9)-1 -> -2.128947239175627 | O1821: =POWER(D1821/I1821,1/5)-1 -> 0.26865236596256392
A1822: 0193.HK | B1822: 冠中地产 | C1822: 0.36 | D1822: -29967000 | E1822: -98255000 | F1822: -34068000 | G1822: -29497000 | H1822: 149957000 | I1822: 37188000 | J1822: 60252000 | K1822: -133564000 | L1822: -52558000 | M1822: -55521000 | N1822: =POWER(D1822/M1822,1/9)-1 -> -6.6223612737109083e-02 | O1822: =POWER(D1822/I1822,1/5)-1 -> -1.9577410210652346
A1823: 8093.HK | B1823: 万星控股 | C1823: 0.10000000000000001 | D1823: -29991000 | E1823: -99493000 | F1823: -44130000 | G1823: -44039000 | H1823: -36606000 | I1823: 199455000 | J1823: -2760000 | K1823: 3827000 | L1823: 116000 | M1823: 12896000 | N1823: =POWER(D1823/M1823,1/9)-1 -> -2.0983132263670798 | O1823: =POWER(D1823/I1823,1/5)-1 -> -1.6845878764036302
A1824: 0784.HK | B1824: 凌锐控股 | C1824: 0.05 | D1824: -30039000 | E1824: 2240000 | F1824: -550000 | G1824: 288000 | H1824: -20493000 | I1824: 15187000 | J1824: 27973000 | K1824: 17601000 | L1824: 18173000 | M1824: -- | N1824: =POWER(D1824/M1824,1/9)-1 -> #VALUE! | O1824: =POWER(D1824/I1824,1/5)-1 -> -2.1461532641820593
A1825: 0075.HK | B1825: 渝太地产 | C1825: 0.26 | D1825: -30094000 | E1825: -475968000 | F1825: -120977000 | G1825: -134303000 | H1825: 83785000 | I1825: 82309000 | J1825: 54764000 | K1825: 356112000 | L1825: 534352000 | M1825: 482253000 | N1825: =POWER(D1825/M1825,1/9)-1 -> -1.7347403427444537 | O1825: =POWER(D1825/I1825,1/5)-1 -> -1.8177235742528817
A1826: 8430.HK | B1826: 春能控股 | C1826: 0.14 | D1826: -30271879.079999998 | E1826: -50466153.090000004 | F1826: -20813092.219999999 | G1826: -4758108.2400000002 | H1826: -5668236.3700000001 | I1826: 2682404.0099999998 | J1826: -2375326.1699999999 | K1826: 17941053.489999998 | L1826: 16694234.43 | M1826: -- | N1826: =POWER(D1826/M1826,1/9)-1 -> #VALUE! | O1826: =POWER(D1826/I1826,1/5)-1 -> -2.6236897087810034
A1827: 8305.HK | B1827: 洢人壹方控股 | C1827: 0.04 | D1827: -30321000 | E1827: -24637000 | F1827: -42636000 | G1827: -2291000 | H1827: 2258000 | I1827: 12912000 | J1827: 3514000 | K1827: 11172000 | L1827: 7224000 | M1827: -- | N1827: =POWER(D1827/M1827,1/9)-1 -> #VALUE! | O1827: =POWER(D1827/I1827,1/5)-1 -> -2.1861783705805307
A1828: 0765.HK | B1828: 威发国际 | C1828: 0.55 | D1828: -30532000 | E1828: -6825000 | F1828: -6520000 | G1828: -15801000 | H1828: -55038000 | I1828: -36424000 | J1828: -11408000 | K1828: 23272000 | L1828: -16090000 | M1828: 7677000 | N1828: =POWER(D1828/M1828,1/9)-1 -> -2.165784268079014 | O1828: =POWER(D1828/I1828,1/5)-1 -> -3.4675067612003008e-02
A1829: 8198.HK | B1829: 加幂科技 | C1829: 0.20000000000000001 | D1829: -30548000 | E1829: -56893000 | F1829: -286686000 | G1829: -46767000 | H1829: -33618000 | I1829: -34087000 | J1829: -17929000 | K1829: -2303000 | L1829: -35934000 | M1829: -65403000 | N1829: =POWER(D1829/M1829,1/9)-1 -> -8.1106853300833892e-02 | O1829: =POWER(D1829/I1829,1/5)-1 -> -2.1684802052250429e-02
A1830: 0125.HK | B1830: 新兴光学 | C1830: 0.64 | D1830: -30558000 | E1830: 9091000 | F1830: 9608000 | G1830: -165913000 | H1830: 72124000 | I1830: 64055000 | J1830: 70903000 | K1830: 55440000 | L1830: 67007000 | M1830: 44304000 | N1830: =POWER(D1830/M1830,1/9)-1 -> -1.9595680440236674 | O1830: =POWER(D1830/I1830,1/5)-1 -> -1.862411180563988
A1831: 8132.HK | B1831: 百能国际能源 | C1831: 0.08 | D1831: -30744000 | E1831: 104744000 | F1831: -37987000 | G1831: -31926000 | H1831: -235286000 | I1831: -88168000 | J1831: -166789000 | K1831: -109552000 | L1831: -217075000 | M1831: -88677902 | N1831: =POWER(D1831/M1831,1/9)-1 -> -0.11103886641756278 | O1831: =POWER(D1831/I1831,1/5)-1 -> -0.18999094018818008
A1832: 1145.HK | B1832: 勇利投资 | C1832: 0.08 | D1832: -31040914 | E1832: 8768384 | F1832: 81785424 | G1832: -26902910 | H1832: 1401660 | I1832: 9800334 | J1832: 77241390 | K1832: -134772274 | L1832: -285551671.5 | M1832: -75419344 | N1832: =POWER(D1832/M1832,1/9)-1 -> -9.3930929627445203e-02 | O1832: =POWER(D1832/I1832,1/5)-1 -> -2.2593276089140266
A1833: 0515.HK | B1833: 中华银科技 | C1833: 0.07 | D1833: -31043000 | E1833: -41053000 | F1833: -3936000 | G1833: -74351000 | H1833: -102896000 | I1833: -133768000 | J1833: -98458000 | K1833: -89036000 | L1833: -81225000 | M1833: -111872000 | N1833: =POWER(D1833/M1833,1/9)-1 -> -0.13276253478179689 | O1833: =POWER(D1833/I1833,1/5)-1 -> -0.25334102426283023
A1834: 1025.HK | B1834: 嘉艺控股 | C1834: 0.05 | D1834: -31284000 | E1834: -25072000 | F1834: -44737000 | G1834: -47045000 | H1834: 12164000 | I1834: 23817000 | J1834: 23832000 | K1834: 12089000 | L1834: -- | M1834: -- | N1834: =POWER(D1834/M1834,1/9)-1 -> #VALUE! | O1834: =POWER(D1834/I1834,1/5)-1 -> -2.0560562328441234
A1835: 1473.HK | B1835: 环联连讯 | C1835: 0.17 | D1835: -31398000 | E1835: 3735000 | F1835: 50129000 | G1835: 33448000 | H1835: 27648000 | I1835: 34946000 | J1835: 25415000 | K1835: -- | L1835: -- | M1835: -- | N1835: =POWER(D1835/M1835,1/9)-1 -> #VALUE! | O1835: =POWER(D1835/I1835,1/5)-1 -> -1.9788156454148531
A1836: 3822.HK | B1836: 三和建筑集团 | C1836: 0.05 | D1836: -31455000 | E1836: -100697000 | F1836: -33751000 | G1836: 73018000 | H1836: -50370000 | I1836: 5519000 | J1836: 78980000 | K1836: 152877000 | L1836: 219168000 | M1836: 127086000 | N1836: =POWER(D1836/M1836,1/9)-1 -> -1.8562909045183797 | O1836: =POWER(D1836/I1836,1/5)-1 -> -2.4163345814753119
A1837: 8082.HK | B1837: 光尚文化控股 | C1837: 0.11 | D1837: -31614000 | E1837: -58452000 | F1837: -69142000 | G1837: -30541000 | H1837: -49122000 | I1837: -8260000 | J1837: -19641000 | K1837: -17293000 | L1837: -21336000 | M1837: -60436000 | N1837: =POWER(D1837/M1837,1/9)-1 -> -6.9467542283350614e-02 | O1837: =POWER(D1837/I1837,1/5)-1 -> 0.30791608343869603
A1838: 8321.HK | B1838: 泰锦控股 | C1838: 0.19 | D1838: -31749000 | E1838: -18778000 | F1838: -11566000 | G1838: -3918000 | H1838: 3676000 | I1838: 10962000 | J1838: -2548000 | K1838: 12902000 | L1838: 10548000 | M1838: -- | N1838: =POWER(D1838/M1838,1/9)-1 -> #VALUE! | O1838: =POWER(D1838/I1838,1/5)-1 -> -2.2369953031456511
A1839: 0413.HK | B1839: 南华集团控股 | C1839: 0.04 | D1839: -31846000 | E1839: 74734000 | F1839: 30852000 | G1839: 69775000 | H1839: 594040000 | I1839: 140003000 | J1839: 229872000 | K1839: 152142000 | L1839: 156749000 | M1839: 189780000 | N1839: =POWER(D1839/M1839,1/9)-1 -> -1.8201006591188782 | O1839: =POWER(D1839/I1839,1/5)-1 -> -1.743675561058214
A1840: 8203.HK | B1840: 凯顺控股 | C1840: 0.28 | D1840: -31890000 | E1840: -15233000 | F1840: -66178000 | G1840: -60295000 | H1840: -318129864 | I1840: 10510099 | J1840: 49306943 | K1840: -13416000 | L1840: -91073480 | M1840: -201452358 | N1840: =POWER(D1840/M1840,1/9)-1 -> -0.18519520932579348 | O1840: =POWER(D1840/I1840,1/5)-1 -> -2.248560359664312
A1841: 0802.HK | B1841: 中国钱包 | C1841: 0.05 | D1841: -32118000 | E1841: -67462000 | F1841: -32370000 | G1841: -41800000 | H1841: -74635000 | I1841: -46754000 | J1841: -392785000 | K1841: -176783000 | L1841: 156498000 | M1841: -115556000 | N1841: =POWER(D1841/M1841,1/9)-1 -> -0.13260416467410185 | O1841: =POWER(D1841/I1841,1/5)-1 -> -7.2346165158642894e-02
A1842: 8065.HK | B1842: 高萌科技 | C1842: 0.11 | D1842: -32222000 | E1842: 7885000 | F1842: 31997000 | G1842: 21612000 | H1842: 19255000 | I1842: -2146000 | J1842: 13327000 | K1842: 22153000 | L1842: -- | M1842: -- | N1842: =POWER(D1842/M1842,1/9)-1 -> #VALUE! | O1842: =POWER(D1842/I1842,1/5)-1 -> 0.7191135171761307
A1843: 8613.HK | B1843: 东方支付集团控股 | C1843: 0.12 | D1843: -32231000 | E1843: -38506000 | F1843: -30655000 | G1843: -5575000 | H1843: -8105000 | I1843: -1094000 | J1843: 8593000 | K1843: 7635000 | L1843: -- | M1843: -- | N1843: =POWER(D1843/M1843,1/9)-1 -> #VALUE! | O1843: =POWER(D1843/I1843,1/5)-1 -> 0.96721257388704118
A1844: 2482.HK | B1844: 维天运通 | C1844: 0.75 | D1844: -32408056.800000001 | E1844: 1571443.3 | F1844: 62136028 | G1844: 31072833 | H1844: -- | I1844: -- | J1844: -- | K1844: -- | L1844: -- | M1844: -- | N1844: =POWER(D1844/M1844,1/9)-1 -> #VALUE! | O1844: =POWER(D1844/I1844,1/5)-1 -> #VALUE!
A1845: 8282.HK | B1845: 智傲控股 | C1845: 0.48 | D1845: -32483000 | E1845: -11128000 | F1845: 556000 | G1845: -10070000 | H1845: -1863000 | I1845: -24340000 | J1845: -17703000 | K1845: -8808000 | L1845: 3098000 | M1845: 7040000 | N1845: =POWER(D1845/M1845,1/9)-1 -> -2.1851874731520526 | O1845: =POWER(D1845/I1845,1/5)-1 -> 5.9417424594989443e-02
A1846: 8026.HK | B1846: 朗华国际集团 | C1846: 0.31 | D1846: -32792000 | E1846: -37322000 | F1846: -41052000 | G1846: -38111000 | H1846: -54006000 | I1846: 23329000 | J1846: -23657000 | K1846: -31359000 | L1846: -29707000 | M1846: -41613000 | N1846: =POWER(D1846/M1846,1/9)-1 -> -2.6122527681774366e-02 | O1846: =POWER(D1846/I1846,1/5)-1 -> -2.0704696445007293
A1847: 0201.HK | B1847: 华大酒店 | C1847: 0.07 | D1847: -32911000 | E1847: 592799000 | F1847: 65522000 | G1847: -201710000 | H1847: 31831000 | I1847: 260349000 | J1847: 152174000 | K1847: 133224000 | L1847: 144056000 | M1847: 905672000 | N1847: =POWER(D1847/M1847,1/9)-1 -> -1.691896488316742 | O1847: =POWER(D1847/I1847,1/5)-1 -> -1.661236826553256
A1848: 0436.HK | B1848: 新宇环保 | C1848: 0.06 | D1848: -33118000 | E1848: 7273000 | F1848: 40419000 | G1848: 74576000 | H1848: 40625000 | I1848: 74386000 | J1848: 83577000 | K1848: 61947000 | L1848: 44336000 | M1848: 57153000 | N1848: =POWER(D1848/M1848,1/9)-1 -> -1.9411729835637719 | O1848: =POWER(D1848/I1848,1/5)-1 -> -1.8505788492338175
A1849: 1722.HK | B1849: 建鹏控股 | C1849: 0.06 | D1849: -33129126.34 | E1849: -11301941.789999999 | F1849: -20174757.359999999 | G1849: 12511650.529999999 | H1849: 13827184.52 | I1849: 16344660.25 | J1849: 5885436.9100000001 | K1849: 25222330.190000001 | L1849: 20411650.559999999 | M1849: 15653398.119999999 | N1849: =POWER(D1849/M1849,1/9)-1 -> -2.0868708172880357 | O1849: =POWER(D1849/I1849,1/5)-1 -> -2.151772797353912
A1850: 8431.HK | B1850: 浩柏国际 | C1850: 0.16 | D1850: -33207000 | E1850: -30430000 | F1850: -28935000 | G1850: -21907000 | H1850: 2982000 | I1850: 2983000 | J1850: 814000 | K1850: 9609000 | L1850: 6726000 | M1850: -- | N1850: =POWER(D1850/M1850,1/9)-1 -> #VALUE! | O1850: =POWER(D1850/I1850,1/5)-1 -> -2.6192551155862507
A1851: 8547.HK | B1851: Pacific Legend | C1851: 0.14 | D1851: -33524000 | E1851: -46369000 | F1851: -28166000 | G1851: -43830000 | H1851: -7802000 | I1851: -17368000 | J1851: 3123000 | K1851: 5420000 | L1851: -- | M1851: -- | N1851: =POWER(D1851/M1851,1/9)-1 -> #VALUE! | O1851: =POWER(D1851/I1851,1/5)-1 -> 0.14056805656627325
A1852: 1993.HK | B1852: 雅仕维 | C1852: 1.2 | D1852: -33999739.200000003 | E1852: -138916490.19999999 | F1852: -183688469.5 | G1852: -166437000 | H1852: -126411000 | I1852: 62953000 | J1852: 44690000 | K1852: 16883000 | L1852: -39616000 | M1852: 142555000 | N1852: =POWER(D1852/M1852,1/9)-1 -> -1.8527712889793473 | O1852: =POWER(D1852/I1852,1/5)-1 -> -1.8840805395155051
A1853: 2203.HK | B1853: 脑洞科技 | C1853: 0.10000000000000001 | D1853: -34116000 | E1853: -57612000 | F1853: -51552000 | G1853: -58755000 | H1853: -49938000 | I1853: 37515000 | J1853: 45354000 | K1853: 45781000 | L1853: 26551000 | M1853: 16216000 | N1853: =POWER(D1853/M1853,1/9)-1 -> -2.086151698211328 | O1853: =POWER(D1853/I1853,1/5)-1 -> -1.981184391674977
A1854: 8063.HK | B1854: 环球大通集团 | C1854: 0.04 | D1854: -34140000 | E1854: -162815000 | F1854: -183091000 | G1854: -267084000 | H1854: -54593000 | I1854: -64656000 | J1854: -28449000 | K1854: -55792000 | L1854: -126182000 | M1854: -5535000 | N1854: =POWER(D1854/M1854,1/9)-1 -> 0.22403542775035468 | O1854: =POWER(D1854/I1854,1/5)-1 -> -0.11990219724751883
A1855: 8107.HK | B1855: 威诚国际控股 | C1855: 7.15 | D1855: -34156000 | E1855: 4898000 | F1855: -8689000 | G1855: 2551000 | H1855: 3143000 | I1855: 12512000 | J1855: 22465000 | K1855: 42874000 | L1855: 53300000 | M1855: -- | N1855: =POWER(D1855/M1855,1/9)-1 -> #VALUE! | O1855: =POWER(D1855/I1855,1/5)-1 -> -2.2224414119686986
A1856: 0243.HK | B1856: 品质国际 | C1856: 0.15 | D1856: -34319000 | E1856: 10102000 | F1856: -12205000 | G1856: -68145000 | H1856: -45422000 | I1856: -211423000 | J1856: -55150000 | K1856: -10991000 | L1856: -46736000 | M1856: 1655000 | N1856: =POWER(D1856/M1856,1/9)-1 -> -2.4005675814158569 | O1856: =POWER(D1856/I1856,1/5)-1 -> -0.30485327866797318
A1857: 2100.HK | B1857: 百奥家庭互动 | C1857: 0.23 | D1857: -34506183.600000001 | E1857: 11469392.699999999 | F1857: 32369657.5 | G1857: 326807061 | H1857: 169440937.5 | I1857: 127608595 | J1857: -17256966.600000001 | K1857: 39463821.25 | L1857: 116321929.45 | M1857: -164350925.80000001 | N1857: =POWER(D1857/M1857,1/9)-1 -> -0.15922356595412213 | O1857: =POWER(D1857/I1857,1/5)-1 -> -1.7698451894862823
A1858: 1446.HK | B1858: 鸿福堂 | C1858: 0.17 | D1858: -34621000 | E1858: 7472000 | F1858: 8223000 | G1858: 62530000 | H1858: 10012000 | I1858: 9374000 | J1858: 8106000 | K1858: 8961000 | L1858: 8707000 | M1858: -38345000 | N1858: =POWER(D1858/M1858,1/9)-1 -> -1.1287337543201992e-02 | O1858: =POWER(D1858/I1858,1/5)-1 -> -2.2986225255568673
A1859: 8367.HK | B1859: 倩碧控股 | C1859: 0.04 | D1859: -34625000 | E1859: 4007000 | F1859: 8585000 | G1859: -44459000 | H1859: -16087000 | I1859: -12163000 | J1859: 6292000 | K1859: 5299000 | L1859: -- | M1859: -- | N1859: =POWER(D1859/M1859,1/9)-1 -> #VALUE! | O1859: =POWER(D1859/I1859,1/5)-1 -> 0.2327352507918623
A1860: 8292.HK | B1860: 盛良物流 | C1860: 0.05 | D1860: -34670138.700000003 | E1860: -22252295.449999999 | F1860: -21712299.300000001 | G1860: -3089689.8500000001 | H1860: -8617645.5 | I1860: -7380083.4000000004 | J1860: -4171810.5 | K1860: -12100.200000000001 | L1860: 12581832.6 | M1860: 8603481.2400000002 | N1860: =POWER(D1860/M1860,1/9)-1 -> -2.1674908479406891 | O1860: =POWER(D1860/I1860,1/5)-1 -> 0.36263287288091894
A1861: 8297.HK | B1861: 海纳星空科技 | C1861: 0.10000000000000001 | D1861: -34720000 | E1861: -18805000 | F1861: 3701000 | G1861: -46839000 | H1861: -24418000 | I1861: -1324000 | J1861: 1057000 | K1861: 8436000 | L1861: 7481000 | M1861: -- | N1861: =POWER(D1861/M1861,1/9)-1 -> #VALUE! | O1861: =POWER(D1861/I1861,1/5)-1 -> 0.92193345364601731
A1862: 1483.HK | B1862: 网誉科技 | C1862: 1.11 | D1862: -34845000 | E1862: -157410000 | F1862: 37615000 | G1862: 95600000 | H1862: -71003000 | I1862: -27260000 | J1862: -56186000 | K1862: -53846000 | L1862: -5978000 | M1862: 21429000 | N1862: =POWER(D1862/M1862,1/9)-1 -> -2.0555038954229854 | O1862: =POWER(D1862/I1862,1/5)-1 -> 5.0323115338502422e-02
A1863: 1130.HK | B1863: 中国环境资源 | C1863: 0.24 | D1863: -35065000 | E1863: -16743000 | F1863: -46102000 | G1863: -55558000 | H1863: -122322000 | I1863: -159784000 | J1863: -27673000 | K1863: -106609000 | L1863: -68901000 | M1863: -69161000 | N1863: =POWER(D1863/M1863,1/9)-1 -> -7.2692825489552582e-02 | O1863: =POWER(D1863/I1863,1/5)-1 -> -0.26164008549695994
A1864: 0554.HK | B1864: 汉思能源 | C1864: 0.28 | D1864: -35125000 | E1864: 207000 | F1864: -16047000 | G1864: -40095000 | H1864: 1108620000 | I1864: -62406000 | J1864: 355000 | K1864: -75611000 | L1864: -94469000 | M1864: -108814000 | N1864: =POWER(D1864/M1864,1/9)-1 -> -0.11806446872561893 | O1864: =POWER(D1864/I1864,1/5)-1 -> -0.10858898304742604
A1865: 0524.HK | B1865: 长城天下 | C1865: 0.22 | D1865: -35253000 | E1865: -23202000 | F1865: -21973000 | G1865: 16851000 | H1865: -219027000 | I1865: -11727000 | J1865: -15735000 | K1865: -79264000 | L1865: 3882000 | M1865: -71011000 | N1865: =POWER(D1865/M1865,1/9)-1 -> -7.4859213472480368e-02 | O1865: =POWER(D1865/I1865,1/5)-1 -> 0.24624041514591277
A1866: 0226.HK | B1866: 力宝 | C1866: 0.89 | D1866: -35381000 | E1866: 125281000 | F1866: 500070000 | G1866: -10315000 | H1866: -112191000 | I1866: 92290000 | J1866: 255963000 | K1866: -169760000 | L1866: 743849000 | M1866: 112173000 | N1866: =POWER(D1866/M1866,1/9)-1 -> -1.8796708412610443 | O1866: =POWER(D1866/I1866,1/5)-1 -> -1.8255114312268406
A1867: 0543.HK | B1867: 太平洋网络 | C1867: 0.40000000000000002 | D1867: -35446723.200000003 | E1867: -7506377.4000000004 | F1867: 61127040 | G1867: 192953115.30000001 | H1867: 171116070 | I1867: 151145734.19999999 | J1867: 126264551.3 | K1867: 168016555 | L1867: 211490247.55000001 | M1867: 276069173.30000001 | N1867: =POWER(D1867/M1867,1/9)-1 -> -1.7960693602986553 | O1867: =POWER(D1867/I1867,1/5)-1 -> -1.7482315898354825
A1868: 2135.HK | B1868: 瑞丽医美 | C1868: 0.11 | D1868: -35579363.399999999 | E1868: -17949199.100000001 | F1868: -21662629.5 | G1868: 5066766.9000000004 | H1868: 11059897.5 | I1868: 20329703 | J1868: 20835683.100000001 | K1868: -- | L1868: -- | M1868: -- | N1868: =POWER(D1868/M1868,1/9)-1 -> #VALUE! | O1868: =POWER(D1868/I1868,1/5)-1 -> -2.1184418980473918
A1869: 1102.HK | B1869: 环能国际 | C1869: 0.11 | D1869: -35750000 | E1869: -257028000 | F1869: -357773000 | G1869: -25776000 | H1869: -25086000 | I1869: -14531000 | J1869: -93900000 | K1869: -34849000 | L1869: -44720000 | M1869: -84431000 | N1869: =POWER(D1869/M1869,1/9)-1 -> -9.1069960044084852e-02 | O1869: =POWER(D1869/I1869,1/5)-1 -> 0.19728104978799221
A1870: 8526.HK | B1870: 荣丰集团亚洲 | C1870: 0.07 | D1870: -35905000 | E1870: -11199000 | F1870: -21823000 | G1870: 22571000 | H1870: 21311000 | I1870: 10140000 | J1870: 5211000 | K1870: 15405000 | L1870: 15684000 | M1870: -- | N1870: =POWER(D1870/M1870,1/9)-1 -> #VALUE! | O1870: =POWER(D1870/I1870,1/5)-1 -> -2.2877257946692708
A1871: 0287.HK | B1871: 永发置业 | C1871: 3.8999999999999999 | D1871: -36227357 | E1871: 13484564 | F1871: -3671068 | G1871: -89310429 | H1871: 165638663 | I1871: 361186148 | J1871: 50948669 | K1871: 3722832 | L1871: 73141493 | M1871: 29145993 | N1871: =POWER(D1871/M1871,1/9)-1 -> -2.0244607181720058 | O1871: =POWER(D1871/I1871,1/5)-1 -> -1.6313368120288305
A1872: 0695.HK | B1872: 东吴水泥 | C1872: 1.69 | D1872: -36525000 | E1872: -40468000 | F1872: 46541000 | G1872: 60879000 | H1872: 74502607.5 | I1872: 102854292.40000001 | J1872: 31050311.100000001 | K1872: 2849245 | L1872: -13803298.85 | M1872: 7164193.9000000004 | N1872: =POWER(D1872/M1872,1/9)-1 -> -2.1984020511155826 | O1872: =POWER(D1872/I1872,1/5)-1 -> -1.812968205007242
A1873: 3623.HK | B1873: 中国金融发展 | C1873: 0.93 | D1873: -36636100.200000003 | E1873: -83681329.900000006 | F1873: -87157461 | G1873: -99427106.099999994 | H1873: -480593167.5 | I1873: 6446753.2000000002 | J1873: 19543268.899999999 | K1873: 21506021.25 | L1873: 28986104.350000001 | M1873: 32545232 | N1873: =POWER(D1873/M1873,1/9)-1 -> -2.0132428334460188 | O1873: =POWER(D1873/I1873,1/5)-1 -> -2.415512271441143
A1874: 8612.HK | B1874: 维亮控股 | C1874: 0.02 | D1874: -36727040 | E1874: -33515440 | F1874: -31863369 | G1874: -14752304 | H1874: 2134812 | I1874: 8026120 | J1874: -679240 | K1874: -4232771 | L1874: 10052065 | M1874: -- | N1874: =POWER(D1874/M1874,1/9)-1 -> #VALUE! | O1874: =POWER(D1874/I1874,1/5)-1 -> -2.3554891819563291
A1875: 0234.HK | B1875: 新世纪集团 | C1875: 0.03 | D1875: -36866000 | E1875: -1501000 | F1875: -56712000 | G1875: 15461000 | H1875: 47492000 | I1875: 148611000 | J1875: 76482000 | K1875: -32376000 | L1875: 98830000 | M1875: 29907000 | N1875: =POWER(D1875/M1875,1/9)-1 -> -2.0235163778701271 | O1875: =POWER(D1875/I1875,1/5)-1 -> -1.7566848040596241
A1876: 2495.HK | B1876: 声通科技 | C1876: 162.09999999999999 | D1876: -37001134.799999997 | E1876: -- | F1876: -- | G1876: -- | H1876: -- | I1876: -- | J1876: -- | K1876: -- | L1876: -- | M1876: -- | N1876: =POWER(D1876/M1876,1/9)-1 -> #VALUE! | O1876: =POWER(D1876/I1876,1/5)-1 -> #VALUE!
A1877: 0760.HK | B1877: 新天地产集团 | C1877: 0.13 | D1877: -37025251.200000003 | E1877: -44162858.799999997 | F1877: 200854735 | G1877: -120224569.2 | H1877: -111575670 | I1877: 79275025 | J1877: 76330366.299999997 | K1877: -81911348.75 | L1877: -135392756.25 | M1877: 22122771.199999999 | N1877: =POWER(D1877/M1877,1/9)-1 -> -2.0588902339928019 | O1877: =POWER(D1877/I1877,1/5)-1 -> -1.8587610240474215
A1878: 0495.HK | B1878: 百利大 | C1878: 0.04 | D1878: -37221000 | E1878: -81849000 | F1878: -44535000 | G1878: -128591000 | H1878: -58170000 | I1878: 16284000 | J1878: 96899000 | K1878: 733569000 | L1878: -120713000 | M1878: 195495000 | N1878: =POWER(D1878/M1878,1/9)-1 -> -1.8316898011514251 | O1878: =POWER(D1878/I1878,1/5)-1 -> -2.1797918416059519
A1879: 0343.HK | B1879: 文化传信 | C1879: 0.19 | D1879: -37223000 | E1879: -28943000 | F1879: -57191000 | G1879: -58235000 | H1879: -31335000 | I1879: -58042000 | J1879: -48753000 | K1879: -58078000 | L1879: -115684000 | M1879: -147229000 | N1879: =POWER(D1879/M1879,1/9)-1 -> -0.14168550754372244 | O1879: =POWER(D1879/I1879,1/5)-1 -> -8.5015366031458983e-02
A1880: 1847.HK | B1880: 云南建投混凝土 | C1880: 0.48 | D1880: -37363977 | E1880: 30653861.300000001 | F1880: 858374.5 | G1880: 246068946.90000001 | H1880: 227617987.5 | I1880: 186443472.80000001 | J1880: 237832986.40000001 | K1880: 194771010 | L1880: -- | M1880: -- | N1880: =POWER(D1880/M1880,1/9)-1 -> #VALUE! | O1880: =POWER(D1880/I1880,1/5)-1 -> -1.7250720803056976
A1881: 1529.HK | B1881: 乐氏国际控股 | C1881: 0.25 | D1881: -37743262.200000003 | E1881: -191777 | F1881: -20941399 | G1881: 2935649.7000000002 | H1881: 10416217.5 | I1881: 25319048.199999999 | J1881: 8317968.2000000002 | K1881: 6330791.25 | L1881: 6922230.2999999998 | M1881: -- | N1881: =POWER(D1881/M1881,1/9)-1 -> #VALUE! | O1881: =POWER(D1881/I1881,1/5)-1 -> -2.0831245801430764
A1882: 1968.HK | B1882: 兴纺控股 | C1882: 0.13 | D1882: -37800000 | E1882: -49962000 | F1882: -11907000 | G1882: -41032000 | H1882: 5268000 | I1882: 72801000 | J1882: 126478000 | K1882: 91850000 | L1882: 103962000 | M1882: -- | N1882: =POWER(D1882/M1882,1/9)-1 -> #VALUE! | O1882: =POWER(D1882/I1882,1/5)-1 -> -1.877143987909637
A1883: 2363.HK | B1883: 通达宏泰 | C1883: 0.33 | D1883: -37846000 | E1883: -231423000 | F1883: -196960000 | G1883: -165274000 | H1883: -68121000 | I1883: 4073000 | J1883: 22863000 | K1883: 24104000 | L1883: 25709000 | M1883: 26032000 | N1883: =POWER(D1883/M1883,1/9)-1 -> -2.0424540929349715 | O1883: =POWER(D1883/I1883,1/5)-1 -> -2.5617845239141674
A1884: 1647.HK | B1884: 雄岸科技 | C1884: 0.06 | D1884: -38017039.960000001 | E1884: -5687126 | F1884: 30471805.52 | G1884: -4900891.0599999996 | H1884: 28328307.260000002 | I1884: 20709018.239999998 | J1884: 26068449.199999999 | K1884: 32278879.73 | L1884: 26064707.280000001 | M1884: 31320412.219999999 | N1884: =POWER(D1884/M1884,1/9)-1 -> -2.0217628123101221 | O1884: =POWER(D1884/I1884,1/5)-1 -> -2.1291815090643222
A1885: 1783.HK | B1885: 晋景新能 | C1885: 4.53 | D1885: -38065000 | E1885: -19391000 | F1885: -12314000 | G1885: -2051000 | H1885: 16824000 | I1885: 23324000 | J1885: 22475000 | K1885: 19662000 | L1885: 13223000 | M1885: -- | N1885: =POWER(D1885/M1885,1/9)-1 -> #VALUE! | O1885: =POWER(D1885/I1885,1/5)-1 -> -2.1029213920003702
A1886: 1355.HK | B1886: 朸浚国际 | C1886: 0.22 | D1886: -38178000 | E1886: -7794000 | F1886: 4977000 | G1886: 2063000 | H1886: -14970351 | I1886: -4378134 | J1886: -42089318 | K1886: -98289233 | L1886: -123835604 | M1886: -51543485 | N1886: =POWER(D1886/M1886,1/9)-1 -> -3.2801780689875604e-02 | O1886: =POWER(D1886/I1886,1/5)-1 -> 0.54207261497001391
A1887: 0072.HK | B1887: 超媒体控股 | C1887: 0.24 | D1887: -38193800.399999999 | E1887: -79179082.799999997 | F1887: -12276837 | G1887: -93286437.299999997 | H1887: 403417.5 | I1887: -39936395 | J1887: -45874709.600000001 | K1887: 3428206.25 | L1887: 24606494.149999999 | M1887: 47161884.700000003 | N1887: =POWER(D1887/M1887,1/9)-1 -> -1.9768377026131696 | O1887: =POWER(D1887/I1887,1/5)-1 -> -8.8832792939433913e-03
A1888: 1815.HK | B1888: 金猫银猫 | C1888: 0.28 | D1888: -38364807.600000001 | E1888: -28882744.300000001 | F1888: 86939.5 | G1888: -42435215.700000003 | H1888: -5680252.5 | I1888: 162452032.19999999 | J1888: 121454564.5 | K1888: 55855870 | L1888: 38757903.799999997 | M1888: 46807481.100000001 | N1888: =POWER(D1888/M1888,1/9)-1 -> -1.9781421472466196 | O1888: =POWER(D1888/I1888,1/5)-1 -> -1.7492755742606469
A1889: 0896.HK | B1889: 兴胜创建 | C1889: 0.44 | D1889: -38432000 | E1889: 154343000 | F1889: 274986000 | G1889: 221376000 | H1889: 578022000 | I1889: 616298000 | J1889: 516939000 | K1889: 635701000 | L1889: 419202000 | M1889: 155698000 | N1889: =POWER(D1889/M1889,1/9)-1 -> -1.8560319900709139 | O1889: =POWER(D1889/I1889,1/5)-1 -> -1.5740906126404326
A1890: 8193.HK | B1890: 亚太金融投资 | C1890: 0.11 | D1890: -38521000 | E1890: -44772000 | F1890: -4243000 | G1890: -126468000 | H1890: -64178000 | I1890: -176700000 | J1890: -124323000 | K1890: -3473000 | L1890: -127602000 | M1890: 31282000 | N1890: =POWER(D1890/M1890,1/9)-1 -> -2.023398514749891 | O1890: =POWER(D1890/I1890,1/5)-1 -> -0.26261856252566584
A1891: 0379.HK | B1891: 恒嘉融资租赁 | C1891: 0.05 | D1891: -38601000 | E1891: 7028000 | F1891: -40619000 | G1891: -242933000 | H1891: -34132000 | I1891: -372098000 | J1891: -42654000 | K1891: 29813000 | L1891: 3448000 | M1891: 27607000 | N1891: =POWER(D1891/M1891,1/9)-1 -> -2.037947727223715 | O1891: =POWER(D1891/I1891,1/5)-1 -> -0.36439362565895161
A1892: 0033.HK | B1892: Intl Genius | C1892: 4.57 | D1892: -38710000 | E1892: 41375000 | F1892: -- | G1892: -- | H1892: -380376000 | I1892: -103031000 | J1892: -141274000 | K1892: -113355000 | L1892: -64182000 | M1892: -75131000 | N1892: =POWER(D1892/M1892,1/9)-1 -> -7.1032662080089515e-02 | O1892: =POWER(D1892/I1892,1/5)-1 -> -0.17781215640671821
A1893: 1259.HK | B1893: 未来发展控股 | C1893: 0.08 | D1893: -38748000 | E1893: -88857000 | F1893: -104891000 | G1893: -40416137.100000001 | H1893: -54084765 | I1893: -491231891 | J1893: -204704981.59999999 | K1893: -123558776.25 | L1893: -59165899.450000003 | M1893: 250070424.69999999 | N1893: =POWER(D1893/M1893,1/9)-1 -> -1.8128693965745108 | O1893: =POWER(D1893/I1893,1/5)-1 -> -0.39828263156527577
A1894: 1645.HK | B1894: 海纳智能 | C1894: 1.06 | D1894: -39239575.200000003 | E1894: -3550130.7000000002 | F1894: 33037010 | G1894: 47619980.700000003 | H1894: 29527702.5 | I1894: 43990949.600000001 | J1894: 36004165.899999999 | K1894: 9586753.75 | L1894: -- | M1894: -- | N1894: =POWER(D1894/M1894,1/9)-1 -> #VALUE! | O1894: =POWER(D1894/I1894,1/5)-1 -> -1.9773996789884676
A1895: 1652.HK | B1895: 福森药业 | C1895: 1.03 | D1895: -39766847.399999999 | E1895: -39037900.5 | F1895: 20381802.5 | G1895: 83589138.900000006 | H1895: 59712495 | I1895: 116002845.2 | J1895: 116077498 | K1895: 105649871.25 | L1895: 52779947.950000003 | M1895: -- | N1895: =POWER(D1895/M1895,1/9)-1 -> #VALUE! | O1895: =POWER(D1895/I1895,1/5)-1 -> -1.8072545550981434
A1896: 0923.HK | B1896: 综合环保集团 | C1896: 0.02 | D1896: -39800000 | E1896: -27579000 | F1896: -23893000 | G1896: -77589000 | H1896: -51524000 | I1896: -80965000 | J1896: -81201000 | K1896: -104078000 | L1896: -149607000 | M1896: -484888000 | N1896: =POWER(D1896/M1896,1/9)-1 -> -0.24253916592528979 | O1896: =POWER(D1896/I1896,1/5)-1 -> -0.13240478047809146
A1897: 8513.HK | B1897: 加和国际控股 | C1897: 0.20000000000000001 | D1897: -39935493 | E1897: -17077434 | F1897: -40714722 | G1897: 4597376 | H1897: -9599780 | I1897: -17811684 | J1897: -4804590 | K1897: 9011289.7899999991 | L1897: 5952821.75 | M1897: -- | N1897: =POWER(D1897/M1897,1/9)-1 -> #VALUE! | O1897: =POWER(D1897/I1897,1/5)-1 -> 0.17525149874795365
A1898: 8437.HK | B1898: 德斯控股 | C1898: 0.02 | D1898: -39947331 | E1898: -108621100.5 | F1898: -50720197.5 | G1898: -54371008 | H1898: 913714 | I1898: 10628442 | J1898: -2747150 | K1898: 14376862.5 | L1898: 12341107.5 | M1898: -- | N1898: =POWER(D1898/M1898,1/9)-1 -> #VALUE! | O1898: =POWER(D1898/I1898,1/5)-1 -> -2.3031776775874531
A1899: 1592.HK | B1899: 基石控股 | C1899: 0.03 | D1899: -40449000 | E1899: -44407000 | F1899: -46749000 | G1899: -34099000 | H1899: 2090000 | I1899: 20540000 | J1899: 25274000 | K1899: 27371000 | L1899: 43782000 | M1899: 26705000 | N1899: =POWER(D1899/M1899,1/9)-1 -> -2.0472129954843052 | O1899: =POWER(D1899/I1899,1/5)-1 -> -2.1451476072931488
A1900: 0430.HK | B1900: 东方兴业控股 | C1900: 0.31 | D1900: -40816000 | E1900: 12184000 | F1900: 18807000 | G1900: -115404000 | H1900: 52045000 | I1900: -91785000 | J1900: 200919000 | K1900: 63189000 | L1900: -20745000 | M1900: 126487000 | N1900: =POWER(D1900/M1900,1/9)-1 -> -1.8819023613495169 | O1900: =POWER(D1900/I1900,1/5)-1 -> -0.14962252924861708
A1901: 2153.HK | B1901: 达丰设备 | C1901: 0.96 | D1901: -40932468.350000001 | E1901: 58745863.75 | F1901: 119887548.75 | G1901: 83466467.349999994 | H1901: 79761779.200000003 | I1901: 63818375.850000001 | J1901: 40935042.899999999 | K1901: -- | L1901: -- | M1901: -- | N1901: =POWER(D1901/M1901,1/9)-1 -> #VALUE! | O1901: =POWER(D1901/I1901,1/5)-1 -> -1.9150070441056886
A1902: 6633.HK | B1902: 青瓷游戏 | C1902: 2.66 | D1902: -40966090.200000003 | E1902: 56724252.299999997 | F1902: -449674359.5 | G1902: 123646514.09999999 | H1902: -- | I1902: -- | J1902: -- | K1902: -- | L1902: -- | M1902: -- | N1902: =POWER(D1902/M1902,1/9)-1 -> #VALUE! | O1902: =POWER(D1902/I1902,1/5)-1 -> #VALUE!
A1903: 1613.HK | B1903: 协同通信 | C1903: 0.36 | D1903: -40971000 | E1903: -109678000 | F1903: -15133000 | G1903: -38677000 | H1903: 208667000 | I1903: -545125000 | J1903: -196693000 | K1903: -469702000 | L1903: 33739000 | M1903: 30027000 | N1903: =POWER(D1903/M1903,1/9)-1 -> -2.0351327969490018 | O1903: =POWER(D1903/I1903,1/5)-1 -> -0.40406884203581317
A1904: 1660.HK | B1904: 兆邦基生活 | C1904: 0.14 | D1904: -40985000 | E1904: 37987000 | F1904: 88220000 | G1904: 36946000 | H1904: 30604000 | I1904: 28239000 | J1904: 17182000 | K1904: 32985000 | L1904: 29447000 | M1904: 12563000 | N1904: =POWER(D1904/M1904,1/9)-1 -> -2.1404048730125078 | O1904: =POWER(D1904/I1904,1/5)-1 -> -2.0773458056758836
A1905: 1226.HK | B1905: 中国投融资 | C1905: 0.26 | D1905: -41152000 | E1905: -7018000 | F1905: 3569000 | G1905: -126376000 | H1905: -86157000 | I1905: -1041708000 | J1905: 355764000 | K1905: 35690000 | L1905: 192000 | M1905: -93562000 | N1905: =POWER(D1905/M1905,1/9)-1 -> -8.7220838541963386e-02 | O1905: =POWER(D1905/I1905,1/5)-1 -> -0.47600277203593488
A1906: 1039.HK | B1906: 畅由联盟 | C1906: 0.14 | D1906: -41175464.399999999 | E1906: -39173272.5 | F1906: -60572341.5 | G1906: -1969018.8 | H1906: -87494662.5 | I1906: -78753546.200000003 | J1906: -79622545.700000003 | K1906: -196251195 | L1906: -675026826.89999998 | M1906: -513699282.89999998 | N1906: =POWER(D1906/M1906,1/9)-1 -> -0.2445349210394846 | O1906: =POWER(D1906/I1906,1/5)-1 -> -0.12163771979075233
A1907: 1689.HK | B1907: 华禧控股 | C1907: 0.69999999999999996 | D1907: -41184000 | E1907: -53107000 | F1907: 36996000 | G1907: 94275000 | H1907: 56296000 | I1907: 32215000 | J1907: 48199000 | K1907: 45077000 | L1907: 70667000 | M1907: 56579000 | N1907: =POWER(D1907/M1907,1/9)-1 -> -1.9653277845154633 | O1907: =POWER(D1907/I1907,1/5)-1 -> -2.0503500922260587
A1908: 0969.HK | B1908: 华联国际 | C1908: 0.15 | D1908: -41212000 | E1908: -33138000 | F1908: -33178000 | G1908: -95956000 | H1908: -91875000 | I1908: -70911000 | J1908: -91993000 | K1908: -545300000 | L1908: -572389000 | M1908: -210083000 | N1908: =POWER(D1908/M1908,1/9)-1 -> -0.16554361462596168 | O1908: =POWER(D1908/I1908,1/5)-1 -> -0.10285629068602298
A1909: 1875.HK | B1909: 东曜药业-B | C1909: 2.14 | D1909: -41389223.399999999 | E1909: -56310239.600000001 | F1909: -319858992 | G1909: -343860766.19999999 | H1909: -334467750 | I1909: -305444251.80000001 | J1909: -178260844.30000001 | K1909: -- | L1909: -- | M1909: -- | N1909: =POWER(D1909/M1909,1/9)-1 -> #VALUE! | O1909: =POWER(D1909/I1909,1/5)-1 -> -0.32951191551407644
A1910: 2322.HK | B1910: 香港潮商集团 | C1910: 0.79 | D1910: -41749000 | E1910: -26842000 | F1910: -23168000 | G1910: -19469000 | H1910: -32167000 | I1910: -48407000 | J1910: -17693000 | K1910: -18754000 | L1910: 7983000 | M1910: -3487000 | N1910: =POWER(D1910/M1910,1/9)-1 -> 0.3176478198348609 | O1910: =POWER(D1910/I1910,1/5)-1 -> -2.9160178287862881e-02
A1911: 1200.HK | B1911: 美联集团 | C1911: 0.75 | D1911: -41916000 | E1911: -533971000 | F1911: 100213000 | G1911: 131854000 | H1911: -68924000 | I1911: 58134000 | J1911: 193452000 | K1911: 10549000 | L1911: -99486000 | M1911: 63975000 | N1911: =POWER(D1911/M1911,1/9)-1 -> -1.954105974230969 | O1911: =POWER(D1911/I1911,1/5)-1 -> -1.9366771483239318
A1912: 0673.HK | B1912: 中国卫生集团 | C1912: 0.80000000000000004 | D1912: -42046000 | E1912: -12205000 | F1912: -7744000 | G1912: -36679000 | H1912: -23081000 | I1912: -39246000 | J1912: -69277000 | K1912: -73214000 | L1912: -55926000 | M1912: -67570000 | N1912: =POWER(D1912/M1912,1/9)-1 -> -5.134595468143599e-02 | O1912: =POWER(D1912/I1912,1/5)-1 -> 1.3878368462112656e-02
A1913: 8172.HK | B1913: 拉近网娱 | C1913: 0.05 | D1913: -42222000 | E1913: -94607000 | F1913: -131259000 | G1913: -130339000 | H1913: -87588000 | I1913: -236071000 | J1913: -79853000 | K1913: -224239000 | L1913: -30343000 | M1913: -2601000 | N1913: =POWER(D1913/M1913,1/9)-1 -> 0.36297759417796693 | O1913: =POWER(D1913/I1913,1/5)-1 -> -0.29123994635592476
A1914: 0130.HK | B1914: 慕诗国际 | C1914: 0.14 | D1914: -42857000 | E1914: -40718000 | F1914: -22751000 | G1914: -146694000 | H1914: -19717000 | I1914: 2007000 | J1914: -52000000 | K1914: -56515000 | L1914: 11331000 | M1914: 27923000 | N1914: =POWER(D1914/M1914,1/9)-1 -> -2.048753199984664 | O1914: =POWER(D1914/I1914,1/5)-1 -> -2.8445688867856251
A1915: 0646.HK | B1915: 中国环保科技 | C1915: 0.20000000000000001 | D1915: -43163000 | E1915: -25016000 | F1915: -53787000 | G1915: -68051000 | H1915: -260883000 | I1915: -309054000 | J1915: -64379000 | K1915: -55239000 | L1915: -74117000 | M1915: -75307000 | N1915: =POWER(D1915/M1915,1/9)-1 -> -5.9969795406643267e-02 | O1915: =POWER(D1915/I1915,1/5)-1 -> -0.32544797454533214
A1916: 1327.HK | B1916: 励时集团 | C1916: 0.05 | D1916: -43339363.200000003 | E1916: -54427440.700000003 | F1916: -53705345.5 | G1916: -174305839.80000001 | H1916: -141980610 | I1916: -121621836.2 | J1916: -135696297.59999999 | K1916: -358393682.5 | L1916: 101023871.05 | M1916: 143714403.5 | N1916: =POWER(D1916/M1916,1/9)-1 -> -1.8752932533967617 | O1916: =POWER(D1916/I1916,1/5)-1 -> -0.1864688363222029
A1917: 0519.HK | B1917: 实力建业 | C1917: 0.07 | D1917: -43449000 | E1917: -162877000 | F1917: -60227000 | G1917: -255149000 | H1917: -77751000 | I1917: 10638000 | J1917: 290980000 | K1917: 370036000 | L1917: 7679000 | M1917: -96068000 | N1917: =POWER(D1917/M1917,1/9)-1 -> -8.4388526384907792e-02 | O1917: =POWER(D1917/I1917,1/5)-1 -> -2.3250246566179924
A1918: 8073.HK | B1918: 兴业新材料 | C1918: 0.25 | D1918: -43605739.799999997 | E1918: -14775853.800000001 | F1918: -22299369.5 | G1918: 696069.59999999998 | H1918: 20361967.5 | I1918: 22530616.800000001 | J1918: 16815771.399999999 | K1918: 7090886.25 | L1918: 9050880.8000000007 | M1918: 485433.09999999998 | N1918: =POWER(D1918/M1918,1/9)-1 -> -2.6483370874446557 | O1918: =POWER(D1918/I1918,1/5)-1 -> -2.1411799049671099
A1919: 0118.HK | B1919: 大同机械 | C1919: 0.23 | D1919: -43801000 | E1919: 24414000 | F1919: 89732000 | G1919: 19578000 | H1919: 15755000 | I1919: 74052000 | J1919: 27284000 | K1919: -303160000 | L1919: -49601000 | M1919: -33301502 | N1919: =POWER(D1919/M1919,1/9)-1 -> 3.0918817878533567e-02 | O1919: =POWER(D1919/I1919,1/5)-1 -> -1.9003045534378666
A1920: 0464.HK | B1920: 中国智能科技 | C1920: 0.27 | D1920: -44380000 | E1920: -11466000 | F1920: -24428000 | G1920: -40071000 | H1920: -54335000 | I1920: -38941000 | J1920: -22220000 | K1920: -22537000 | L1920: 793000 | M1920: -31614000 | N1920: =POWER(D1920/M1920,1/9)-1 -> 3.8406836656583954e-02 | O1920: =POWER(D1920/I1920,1/5)-1 -> 2.6493112202303104e-02
A1921: 0637.HK | B1921: 利记 | C1921: 0.16 | D1921: -44469000 | E1921: 18657000 | F1921: 16882000 | G1921: -128057000 | H1921: -86652000 | I1921: 90153000 | J1921: 41496000 | K1921: -116772000 | L1921: 27353000 | M1921: -- | N1921: =POWER(D1921/M1921,1/9)-1 -> #VALUE! | O1921: =POWER(D1921/I1921,1/5)-1 -> -1.86819131297616
A1922: 7836.HK | B1922: Aquila Acq-Z | C1922: 7.5999999999999996 | D1922: -44541000 | E1922: -134211000 | F1922: -- | G1922: -- | H1922: -- | I1922: -- | J1922: -- | K1922: -- | L1922: -- | M1922: -- | N1922: =POWER(D1922/M1922,1/9)-1 -> #VALUE! | O1922: =POWER(D1922/I1922,1/5)-1 -> #VALUE!
A1923: 0253.HK | B1923: 顺豪控股 | C1923: 0.69 | D1923: -45018000 | E1923: 258021000 | F1923: 30413000 | G1923: -96007000 | H1923: 3525000 | I1923: 310239000 | J1923: 407250000 | K1923: 193945000 | L1923: 85403000 | M1923: 344811000 | N1923: =POWER(D1923/M1923,1/9)-1 -> -1.7975466965752913 | O1923: =POWER(D1923/I1923,1/5)-1 -> -1.6797323836860596
A1924: 2022.HK | B1924: 游莱互动 | C1924: 0.07 | D1924: -45076742.039999999 | E1924: -45781958.140000001 | F1924: -26263040.16 | G1924: -28213011.940000001 | H1924: -44867183.32 | I1924: 7341272.7400000002 | J1924: 13492230.640000001 | K1924: 53809092.359999999 | L1924: 34675643.990000002 | M1924: 58189242.640000001 | N1924: =POWER(D1924/M1924,1/9)-1 -> -1.9720282082095992 | O1924: =POWER(D1924/I1924,1/5)-1 -> -2.4375939356636511
A1925: 0058.HK | B1925: 新威国际 | C1925: 0.07 | D1925: -45146000 | E1925: -37385000 | F1925: -24744000 | G1925: -18827000 | H1925: -283995000 | I1925: -50501000 | J1925: -7784000 | K1925: -183049000 | L1925: 390554000 | M1925: -- | N1925: =POWER(D1925/M1925,1/9)-1 -> #VALUE! | O1925: =POWER(D1925/I1925,1/5)-1 -> -2.2168868604517167e-02
A1926: 1087.HK | B1926: 威讯控股 | C1926: 0.32 | D1926: -45195229.799999997 | E1926: -40478484.200000003 | F1926: -20629151.5 | G1926: -98988486.900000006 | H1926: -23574780 | I1926: -52570300.600000001 | J1926: -114628027.90000001 | K1926: -77345222.5 | L1926: 29226018.550000001 | M1926: 61623797.799999997 | N1926: =POWER(D1926/M1926,1/9)-1 -> -1.9661359391743893 | O1926: =POWER(D1926/I1926,1/5)-1 -> -2.9779542375962698e-02
A1927: 8120.HK | B1927: 国农金融投资 | C1927: 0.05 | D1927: -45308000 | E1927: -18844000 | F1927: -20558000 | G1927: -28453000 | H1927: -104211000 | I1927: -40542000 | J1927: -98487000 | K1927: -17683000 | L1927: 6168000 | M1927: -15289000 | N1927: =POWER(D1927/M1927,1/9)-1 -> 0.12829264417237352 | O1927: =POWER(D1927/I1927,1/5)-1 -> 2.247793445624402e-02
A1928: 1159.HK | B1928: 星光文化 | C1928: 0.22 | D1928: -45720000 | E1928: -135867000 | F1928: -399264000 | G1928: -162275000 | H1928: 98181000 | I1928: -49606000 | J1928: -294439000 | K1928: -39766000 | L1928: 8734000 | M1928: -17736000 | N1928: =POWER(D1928/M1928,1/9)-1 -> 0.11094997781973648 | O1928: =POWER(D1928/I1928,1/5)-1 -> -1.6182819185036279e-02
A1929: 3860.HK | B1929: EPS创健科技 | C1929: 0.82 | D1929: -45737000 | E1929: -22600000 | F1929: 6505000 | G1929: 22735000 | H1929: 27234000 | I1929: 14084000 | J1929: 6094000 | K1929: 12466000 | L1929: 10532000 | M1929: -- | N1929: =POWER(D1929/M1929,1/9)-1 -> #VALUE! | O1929: =POWER(D1929/I1929,1/5)-1 -> -2.2656345784078238
A1930: 8047.HK | B1930: 中国海洋发展 | C1930: 0.03 | D1930: -45753000 | E1930: -653280000 | F1930: -377799000 | G1930: 28029000 | H1930: 43668000 | I1930: 57054000 | J1930: -67199000 | K1930: -205532000 | L1930: -59185000 | M1930: -76292000 | N1930: =POWER(D1930/M1930,1/9)-1 -> -5.5228615803531667e-02 | O1930: =POWER(D1930/I1930,1/5)-1 -> -1.9568121809999099
A1931: 2250.HK | B1931: 小黄鸭德盈 | C1931: 1.13 | D1931: -46206000 | E1931: 75555000 | F1931: 62943000 | G1931: 54548000 | H1931: -- | I1931: -- | J1931: -- | K1931: -- | L1931: -- | M1931: -- | N1931: =POWER(D1931/M1931,1/9)-1 -> #VALUE! | O1931: =POWER(D1931/I1931,1/5)-1 -> #VALUE!
A1932: 7841.HK | B1932: 汇德收购-Z | C1932: 7.2999999999999998 | D1932: -46264094 | E1932: -- | F1932: -- | G1932: -- | H1932: -- | I1932: -- | J1932: -- | K1932: -- | L1932: -- | M1932: -- | N1932: =POWER(D1932/M1932,1/9)-1 -> #VALUE! | O1932: =POWER(D1932/I1932,1/5)-1 -> #VALUE!
A1933: 1010.HK | B1933: 天玺曜11 | C1933: 0.51 | D1933: -46447000 | E1933: -2236000 | F1933: -52840000 | G1933: -5495000 | H1933: -21065000 | I1933: -40187000 | J1933: -2686000 | K1933: -4994000 | L1933: -25253000 | M1933: 17268000 | N1933: =POWER(D1933/M1933,1/9)-1 -> -2.116210698897135 | O1933: =POWER(D1933/I1933,1/5)-1 -> 2.9376895618159704e-02
A1934: 8377.HK | B1934: 维港育马 | C1934: 0.14 | D1934: -46825000 | E1934: -22904000 | F1934: -27241000 | G1934: -15595000 | H1934: -19219000 | I1934: -10855000 | J1934: -13190000 | K1934: -477000 | L1934: 4678000 | M1934: -- | N1934: =POWER(D1934/M1934,1/9)-1 -> #VALUE! | O1934: =POWER(D1934/I1934,1/5)-1 -> 0.33958288948162085
A1935: 8106.HK | B1935: 升华兰德 | C1935: 0.06 | D1935: -46887762.600000001 | E1935: -18239120.800000001 | F1935: 814292.5 | G1935: 5989297.5 | H1935: 5156145 | I1935: 9556269.8000000007 | J1935: -5265568.7999999998 | K1935: -3922712.5 | L1935: -11032525.050000001 | M1935: -14022652.300000001 | N1935: =POWER(D1935/M1935,1/9)-1 -> 0.14353037459019635 | O1935: =POWER(D1935/I1935,1/5)-1 -> -2.3745299947434644
A1936: 0311.HK | B1936: 联泰控股 | C1936: 0.18 | D1936: -46928488 | E1936: 102581504 | F1936: 87298610 | G1936: -217301084 | H1936: 195959855 | I1936: 182555702 | J1936: 171165670 | K1936: 143231888 | L1936: 98966134.5 | M1936: 167327944 | N1936: =POWER(D1936/M1936,1/9)-1 -> -1.8682644298539448 | O1936: =POWER(D1936/I1936,1/5)-1 -> -1.7620934550749672
A1937: 1718.HK | B1937: 宏基集团控股 | C1937: 0.48 | D1937: -46995578 | E1937: -12756585 | F1937: -12239849 | G1937: -60371732 | H1937: -55228625 | I1937: -70247482 | J1937: -1010941 | K1937: 25573227 | L1937: 61999801 | M1937: 39367398 | N1937: =POWER(D1937/M1937,1/9)-1 -> -2.019874417927654 | O1937: =POWER(D1937/I1937,1/5)-1 -> -7.7247465500788981e-02
A1938: 0115.HK | B1938: 钧濠集团 | C1938: 5.2000000000000002 | D1938: -47026000 | E1938: -392648000 | F1938: -224271000 | G1938: 34682000 | H1938: -101219000 | I1938: 193255000 | J1938: 127979000 | K1938: 19166000 | L1938: 457920000 | M1938: -65855000 | N1938: =POWER(D1938/M1938,1/9)-1 -> -3.6725817403961969e-02 | O1938: =POWER(D1938/I1938,1/5)-1 -> -1.7537745326394374
A1939: 0864.HK | B1939: 永利地产发展 | C1939: 0.20000000000000001 | D1939: -47092000 | E1939: 17527000 | F1939: 17406000 | G1939: -96600000 | H1939: -90081000 | I1939: 19447000 | J1939: 49552000 | K1939: -1058000 | L1939: 25991000 | M1939: 82955000 | N1939: =POWER(D1939/M1939,1/9)-1 -> -1.939027444354307 | O1939: =POWER(D1939/I1939,1/5)-1 -> -2.1934903290393319
A1940: 8227.HK | B1940: 海天天线 | C1940: 0.40000000000000002 | D1940: -47114767.200000003 | E1940: -33983552.640000001 | F1940: -27748350.079999998 | G1940: -40753940.549999997 | H1940: -27082820.960000001 | I1940: -46774142.340000004 | J1940: -20000476.609999999 | K1940: -41842797.469999999 | L1940: -25797886.899999999 | M1940: -4521058.0899999999 | N1940: =POWER(D1940/M1940,1/9)-1 -> 0.29748362260663508 | O1940: =POWER(D1940/I1940,1/5)-1 -> 1.4522423673428708e-03
A1941: 2188.HK | B1941: 泰坦能源技术 | C1941: 0.31 | D1941: -48209779.799999997 | E1941: -20561878.699999999 | F1941: 22769577.5 | G1941: -35306461.799999997 | H1941: -53196352.5 | I1941: -45735284.799999997 | J1941: 196267123.40000001 | K1941: 8088788.75 | L1941: -30649039.050000001 | M1941: -54696704.899999999 | N1941: =POWER(D1941/M1941,1/9)-1 -> -1.3928923032775153e-02 | O1941: =POWER(D1941/I1941,1/5)-1 -> 1.0594085024904665e-02
A1942: 8112.HK | B1942: 基石金融 | C1942: 0.21 | D1942: -48637971 | E1942: -31985715 | F1942: -15541192 | G1942: -58082647 | H1942: -18107764 | I1942: -107933612 | J1942: -52706931 | K1942: -19460622 | L1942: -18139328 | M1942: -13003482 | N1942: =POWER(D1942/M1942,1/9)-1 -> 0.15786335660522366 | O1942: =POWER(D1942/I1942,1/5)-1 -> -0.14736383859279445
A1943: 0391.HK | B1943: 美亚娱乐资讯 | C1943: 0.12 | D1943: -48915000 | E1943: -39232000 | F1943: -58249000 | G1943: -97188000 | H1943: -85428000 | I1943: -49159000 | J1943: -82259000 | K1943: -66188000 | L1943: -39338000 | M1943: -23896000 | N1943: =POWER(D1943/M1943,1/9)-1 -> 8.285059298750741e-02 | O1943: =POWER(D1943/I1943,1/5)-1 -> -9.9467395164298811e-04
A1944: 1803.HK | B1944: 北京体育文化 | C1944: 0.07 | D1944: -49023000 | E1944: -66628000 | F1944: -38804000 | G1944: -11862000 | H1944: -63417000 | I1944: -55275000 | J1944: -24106000 | K1944: -48264000 | L1944: -40612000 | M1944: 13117000 | N1944: =POWER(D1944/M1944,1/9)-1 -> -2.1577595552712934 | O1944: =POWER(D1944/I1944,1/5)-1 -> -2.372037267949556e-02
A1945: 1105.HK | B1945: 星岛 | C1945: 0.25 | D1945: -49065000 | E1945: -138784000 | F1945: -139812000 | G1945: -80909000 | H1945: -22676000 | I1945: 24243000 | J1945: 41349000 | K1945: 33822000 | L1945: 62280000 | M1945: 114167000 | N1945: =POWER(D1945/M1945,1/9)-1 -> -1.9104328358282179 | O1945: =POWER(D1945/I1945,1/5)-1 -> -2.1514288008905575
A1946: 8006.HK | B1946: 华泰瑞银 | C1946: 0.17 | D1946: -49071000 | E1946: -43023000 | F1946: -22130000 | G1946: -23597000 | H1946: -2665000 | I1946: -28625000 | J1946: -179888000 | K1946: 115200000 | L1946: 11213000 | M1946: 3322000 | N1946: =POWER(D1946/M1946,1/9)-1 -> -2.3487645485114381 | O1946: =POWER(D1946/I1946,1/5)-1 -> 0.11382223305166561
A1947: 1709.HK | B1947: 德林控股 | C1947: 4.38 | D1947: -49177000 | E1947: 109775000 | F1947: 200798000 | G1947: -51409000 | H1947: 18682000 | I1947: 15688000 | J1947: 25143000 | K1947: 4139000 | L1947: 14780000 | M1947: 9490000 | N1947: =POWER(D1947/M1947,1/9)-1 -> -2.2005725913323531 | O1947: =POWER(D1947/I1947,1/5)-1 -> -2.2567210517692633
A1948: 0260.HK | B1948: 幸福控股 | C1948: 0.01 | D1948: -49386000 | E1948: -- | F1948: -39859000 | G1948: -85562000 | H1948: -440760000 | I1948: -517071000 | J1948: -302643000 | K1948: -259711000 | L1948: -294968000 | M1948: -79799000 | N1948: =POWER(D1948/M1948,1/9)-1 -> -5.1919627184623507e-02 | O1948: =POWER(D1948/I1948,1/5)-1 -> -0.37481185498516179
A1949: 6893.HK | B1949: 衍生集团 | C1949: 0.28 | D1949: -49491000 | E1949: -11910000 | F1949: -31950000 | G1949: -19789000 | H1949: 4668000 | I1949: 530000 | J1949: 9798000 | K1949: 21214000 | L1949: 11051000 | M1949: 49704000 | N1949: =POWER(D1949/M1949,1/9)-1 -> -1.9995229385078717 | O1949: =POWER(D1949/I1949,1/5)-1 -> -3.4777077080299734
A1950: 0632.HK | B1950: 中港石油 | C1950: 0.12 | D1950: -49552000 | E1950: -1193000 | F1950: 147820000 | G1950: 8716000 | H1950: -268841000 | I1950: -58415000 | J1950: -351633000 | K1950: 132075000 | L1950: -1487577000 | M1950: -123125000 | N1950: =POWER(D1950/M1950,1/9)-1 -> -9.6185221565880497e-02 | O1950: =POWER(D1950/I1950,1/5)-1 -> -3.237437407259447e-02
A1951: 1906.HK | B1951: 博尼控股 | C1951: 0.28 | D1951: -49626070.200000003 | E1951: -80021773.5 | F1951: -8018026 | G1951: 57546123.899999999 | H1951: -13632382.5 | I1951: 30402897.199999999 | J1951: 22063356.699999999 | K1951: 21411565 | L1951: 22628378.050000001 | M1951: -- | N1951: =POWER(D1951/M1951,1/9)-1 -> #VALUE! | O1951: =POWER(D1951/I1951,1/5)-1 -> -2.1029580198817253
A1952: 3666.HK | B1952: 上海小南国 | C1952: 0.03 | D1952: -49787211.600000001 | E1952: -78096106.799999997 | F1952: -100859616 | G1952: -379920508.80000001 | H1952: -183796342.5 | I1952: -86570035.200000003 | J1952: 121900555.3 | K1952: 38865968.75 | L1952: -109657254.09999999 | M1952: 706311.40000000002 | N1952: =POWER(D1952/M1952,1/9)-1 -> -2.6045263111650065 | O1952: =POWER(D1952/I1952,1/5)-1 -> -0.10473822477892347
A1953: 0244.HK | B1953: 先施 | C1953: 0.21 | D1953: -50477000 | E1953: -59038000 | F1953: -145017000 | G1953: -147364000 | H1953: -132068000 | I1953: -90497000 | J1953: -92614000 | K1953: -181796000 | L1953: -122567000 | M1953: -85068000 | N1953: =POWER(D1953/M1953,1/9)-1 -> -5.6343043280558724e-02 | O1953: =POWER(D1953/I1953,1/5)-1 -> -0.11020108750297419
A1954: 3830.HK | B1954: 童园国际 | C1954: 0.04 | D1954: -50549000 | E1954: -65541000 | F1954: 6599000 | G1954: 163831000 | H1954: -9361000 | I1954: -13724000 | J1954: 22584000 | K1954: 34025000 | L1954: 36532000 | M1954: 28804000 | N1954: =POWER(D1954/M1954,1/9)-1 -> -2.064486049029763 | O1954: =POWER(D1954/I1954,1/5)-1 -> 0.29791535926375734
A1955: 2330.HK | B1955: 中国上城 | C1955: 0.27 | D1955: -50678422.200000003 | E1955: -62911880.799999997 | F1955: -490933887 | G1955: -9267022.5 | H1955: 82900620 | I1955: -39237294.600000001 | J1955: 53593227.799999997 | K1955: 5125085 | L1955: -39730497.149999999 | M1955: 62634596.799999997 | N1955: =POWER(D1955/M1955,1/9)-1 -> -1.97673950952412 | O1955: =POWER(D1955/I1955,1/5)-1 -> 5.2506547019444572e-02
A1956: 1013.HK | B1956: 伟俊集团控股 | C1956: 0.12 | D1956: -50721000 | E1956: -127083000 | F1956: -17932000 | G1956: -28094000 | H1956: -28771000 | I1956: -33505000 | J1956: -48853000 | K1956: -56747000 | L1956: -29113000 | M1956: -39147000 | N1956: =POWER(D1956/M1956,1/9)-1 -> 2.9197715412467184e-02 | O1956: =POWER(D1956/I1956,1/5)-1 -> 8.6464741697065417e-02
A1957: 0485.HK | B1957: 中国华星 | C1957: 0.12 | D1957: -51210000 | E1957: -17607000 | F1957: -15428000 | G1957: -25114000 | H1957: -13949000 | I1957: -27251000 | J1957: -46055000 | K1957: -22243000 | L1957: -246934000 | M1957: -193036000 | N1957: =POWER(D1957/M1957,1/9)-1 -> -0.13708405051932693 | O1957: =POWER(D1957/I1957,1/5)-1 -> 0.13447378917828501
A1958: 1920.HK | B1958: 恒新丰控股 | C1958: 0.35 | D1958: -51618000 | E1958: -56203000 | F1958: -83186000 | G1958: 7369000 | H1958: 35826000 | I1958: 40321000 | J1958: 21270000 | K1958: 11394000 | L1958: -- | M1958: -- | N1958: =POWER(D1958/M1958,1/9)-1 -> #VALUE! | O1958: =POWER(D1958/I1958,1/5)-1 -> -2.0506401076592056
A1959: 1782.HK | B1959: 国际商业数字技术 | C1959: 4.73 | D1959: -51691311 | E1959: -13457104.9 | F1959: 4460853.5 | G1959: 1315857.6000000001 | H1959: 14316292.5 | I1959: 31758969.800000001 | J1959: 26585607.5 | K1959: 11358086.25 | L1959: 21558172.550000001 | M1959: 12193230.9 | N1959: =POWER(D1959/M1959,1/9)-1 -> -2.1740858689103888 | O1959: =POWER(D1959/I1959,1/5)-1 -> -2.1023264495351235
A1960: 0499.HK | B1960: 青岛控股 | C1960: 0.22 | D1960: -51876568.799999997 | E1960: -71669321.099999994 | F1960: 10239269 | G1960: 2902276.5 | H1960: 9535000 | I1960: 5817000 | J1960: 5759000 | K1960: -11459000 | L1960: 7192000 | M1960: 713000 | N1960: =POWER(D1960/M1960,1/9)-1 -> -2.6101848864895949 | O1960: =POWER(D1960/I1960,1/5)-1 -> -2.5490107649427163
A1961: 0215.HK | B1961: 和记电讯香港 | C1961: 1.03 | D1961: -52000000 | E1961: -158000000 | F1961: 4000000 | G1961: 361000000 | H1961: 429000000 | I1961: 404000000 | J1961: 4766000000 | K1961: 682000000 | L1961: 915000000 | M1961: 833000000 | N1961: =POWER(D1961/M1961,1/9)-1 -> -1.734769172291089 | O1961: =POWER(D1961/I1961,1/5)-1 -> -1.6636275325321215
A1962: 1047.HK | B1962: 毅兴行 | C1962: 0.36 | D1962: -52007000 | E1962: 56598000 | F1962: 89865000 | G1962: -6212000 | H1962: 7806000 | I1962: 46171000 | J1962: 34430000 | K1962: -26492000 | L1962: 25225000 | M1962: 3241000 | N1962: =POWER(D1962/M1962,1/9)-1 -> -2.3612297089596588 | O1962: =POWER(D1962/I1962,1/5)-1 -> -2.0240908935465791
A1963: 0080.HK | B1963: 中国新经济投资 | C1963: 0.07 | D1963: -52436843 | E1963: -52745075 | F1963: -4980239 | G1963: -31106691 | H1963: -34070940 | I1963: -92959437 | J1963: -510737658 | K1963: 47873600 | L1963: -169536116 | M1963: 136337823 | N1963: =POWER(D1963/M1963,1/9)-1 -> -1.899272124243371 | O1963: =POWER(D1963/I1963,1/5)-1 -> -0.10819765417509297
A1964: 0911.HK | B1964: 前海健康 | C1964: 0.29999999999999999 | D1964: -52705000 | E1964: -233703000 | F1964: -888000 | G1964: -804000 | H1964: 26715000 | I1964: 5071000 | J1964: 35861000 | K1964: -525710000 | L1964: -438396000 | M1964: 205353000 | N1964: =POWER(D1964/M1964,1/9)-1 -> -1.8597502431407116 | O1964: =POWER(D1964/I1964,1/5)-1 -> -2.5971718287900014
A1965: 1736.HK | B1965: 中国育儿网络 | C1965: 0.07 | D1965: -52816012.200000003 | E1965: -47652072.100000001 | F1965: -63006647.5 | G1965: -114630982.5 | H1965: -1546620 | I1965: 34348146.200000003 | J1965: 41462757.600000001 | K1965: 49858453.75 | L1965: 40603126.25 | M1965: 17027595.5 | N1965: =POWER(D1965/M1965,1/9)-1 -> -2.1340275018065666 | O1965: =POWER(D1965/I1965,1/5)-1 -> -2.0898643853311549
A1966: 0970.HK | B1966: 新耀莱 | C1966: 0.79 | D1966: -53127000 | E1966: 34052000 | F1966: 37527000 | G1966: 30283000 | H1966: 97429000 | I1966: 664565000 | J1966: 87845000 | K1966: -32328000 | L1966: -455685000 | M1966: 18951000 | N1966: =POWER(D1966/M1966,1/9)-1 -> -2.1213535788189866 | O1966: =POWER(D1966/I1966,1/5)-1 -> -1.6033308957833841
A1967: 3893.HK | B1967: 易纬集团 | C1967: 0.57 | D1967: -53556000 | E1967: -21888000 | F1967: -11798000 | G1967: -28204000 | H1967: -9634000 | I1967: -22940000 | J1967: -20719000 | K1967: 11508000 | L1967: 23783000 | M1967: 20181000 | N1967: =POWER(D1967/M1967,1/9)-1 -> -2.1145412871855997 | O1967: =POWER(D1967/I1967,1/5)-1 -> 0.18479426650048358
A1968: 1715.HK | B1968: 火山邑动国际控股 | C1968: 0.66 | D1968: -54062391.600000001 | E1968: -48748585.299999997 | F1968: -54310248.5 | G1968: -25182463.199999999 | H1968: 20965417.5 | I1968: 25509194.399999999 | J1968: 24450366.600000001 | K1968: 26554430 | L1968: 20607924.149999999 | M1968: 12385407.5 | N1968: =POWER(D1968/M1968,1/9)-1 -> -2.1779027597777856 | O1968: =POWER(D1968/I1968,1/5)-1 -> -2.1620898343393873
A1969: 8079.HK | B1969: 仍志集团控股 | C1969: 0.03 | D1969: -54104000 | E1969: -64324000 | F1969: -93952000 | G1969: -63441000 | H1969: -37108000 | I1969: -6756000 | J1969: 26315000 | K1969: 32922000 | L1969: 40724000 | M1969: -12259000 | N1969: =POWER(D1969/M1969,1/9)-1 -> 0.17934696067876188 | O1969: =POWER(D1969/I1969,1/5)-1 -> 0.51603052806795091
A1970: 1323.HK | B1970: 华盛国际控股 | C1970: 0.11 | D1970: -54774000 | E1970: 31293000 | F1970: 43891000 | G1970: -78234000 | H1970: -15539000 | I1970: -31317000 | J1970: -190400000 | K1970: -284394000 | L1970: -258875000 | M1970: -137128000 | N1970: =POWER(D1970/M1970,1/9)-1 -> -9.6940263300696716e-02 | O1970: =POWER(D1970/I1970,1/5)-1 -> 0.11830138053251749
A1971: 1673.HK | B1971: 华章科技 | C1971: 0.25 | D1971: -55266696.210000001 | E1971: -426100457.48000002 | F1971: 21635334.25 | G1971: -84955859.430000007 | H1971: -145797080.47 | I1971: 57082697.240000002 | J1971: 35315983.409999996 | K1971: 32899402.890000001 | L1971: 34454137 | M1971: 28495589 | N1971: =POWER(D1971/M1971,1/9)-1 -> -2.0763787026070304 | O1971: =POWER(D1971/I1971,1/5)-1 -> -1.9935547489961354
A1972: 2339.HK | B1972: 京西国际 | C1972: 0.21 | D1972: -55320000 | E1972: -4885000 | F1972: -9305000 | G1972: -51544000 | H1972: 4889000 | I1972: 120879000 | J1972: -8572000 | K1972: 107910000 | L1972: 134067000 | M1972: 344462000 | N1972: =POWER(D1972/M1972,1/9)-1 -> -1.8161105340853787 | O1972: =POWER(D1972/I1972,1/5)-1 -> -1.855275955034283
A1973: 0159.HK | B1973: 布莱克万矿业 | C1973: 0.10000000000000001 | D1973: -56556000 | E1973: -20814000 | F1973: -14172000 | G1973: -21016000 | H1973: 67588000 | I1973: 108086000 | J1973: -38308000 | K1973: -627158000 | L1973: -1236548000 | M1973: -207098000 | N1973: =POWER(D1973/M1973,1/9)-1 -> -0.13430088076380775 | O1973: =POWER(D1973/I1973,1/5)-1 -> -1.8785001665565337
A1974: 0187.HK | B1974: 京城机电股份 | C1974: 2 | D1974: -56646292.399999999 | E1974: 20646953.149999999 | F1974: -28509141.370000001 | G1974: 186451011.84999999 | H1974: -145316074.33000001 | I1974: -106955706.42 | J1974: 25019081.609999999 | K1974: -165340204.03999999 | L1974: -244403622.18000001 | M1974: 26725284.34 | N1974: =POWER(D1974/M1974,1/9)-1 -> -2.0870509655841452 | O1974: =POWER(D1974/I1974,1/5)-1 -> -0.11936994001497803
A1975: 0738.HK | B1975: 莱尔斯丹 | C1975: 0.39 | D1975: -56693120.25 | E1975: 3689091 | F1975: 126992030.2 | G1975: -34065307.799999997 | H1975: -32917977.600000001 | I1975: 73849050 | J1975: 84892708.25 | K1975: 144912858.30000001 | L1975: 233327921.40000001 | M1975: 287150000 | N1975: =POWER(D1975/M1975,1/9)-1 -> -1.8350519689800173 | O1975: =POWER(D1975/I1975,1/5)-1 -> -1.9484994632339658
A1976: 0736.HK | B1976: 中国置业投资 | C1976: 0.10000000000000001 | D1976: -57180000 | E1976: 13038000 | F1976: 36169000 | G1976: -92591000 | H1976: -62354000 | I1976: -569456000 | J1976: -16530000 | K1976: -109071000 | L1976: -25477038 | M1976: -154130347 | N1976: =POWER(D1976/M1976,1/9)-1 -> -0.10432455926956974 | O1976: =POWER(D1976/I1976,1/5)-1 -> -0.36852407816805222
A1977: 2399.HK | B1977: 中国安储能源 | C1977: 0.29999999999999999 | D1977: -57293989.200000003 | E1977: -112823537.2 | F1977: -218056511 | G1977: -658201745.10000002 | H1977: -347454217.5 | I1977: -50595968.200000003 | J1977: 26526861.399999999 | K1977: 146228276.25 | L1977: 339486825.35000002 | M1977: 337724168.60000002 | N1977: =POWER(D1977/M1977,1/9)-1 -> -1.821096313544321 | O1977: =POWER(D1977/I1977,1/5)-1 -> 2.5176471290045521e-02
A1978: 1959.HK | B1978: 世纪联合控股 | C1978: 0.16 | D1978: -57394839.600000001 | E1978: -26659259.199999999 | F1978: 3282884.5 | G1978: 25541225.100000001 | H1978: 36953490 | I1978: 39211106.799999997 | J1978: 36781053.100000001 | K1978: 16408717.5 | L1978: -- | M1978: -- | N1978: =POWER(D1978/M1978,1/9)-1 -> #VALUE! | O1978: =POWER(D1978/I1978,1/5)-1 -> -2.079177169525726
A1979: 1570.HK | B1979: 伟业控股 | C1979: 3.1000000000000001 | D1979: -57695198.399999999 | E1979: 8601762.5 | F1979: -156772735 | G1979: 27747432 | H1979: -34519575 | I1979: 189437990.80000001 | J1979: 148275156.40000001 | K1979: 72619076.25 | L1979: 110687473.90000001 | M1979: 322326330.5 | N1979: =POWER(D1979/M1979,1/9)-1 -> -1.8260049579839102 | O1979: =POWER(D1979/I1979,1/5)-1 -> -1.7883780396270477
A1980: 8003.HK | B1980: 世大控股 | C1980: 0.12 | D1980: -58164000 | E1980: -41082000 | F1980: -22099000 | G1980: -31739000 | H1980: -16783000 | I1980: -38756000 | J1980: -17822000 | K1980: -24766000 | L1980: -15511000 | M1980: -15243000 | N1980: =POWER(D1980/M1980,1/9)-1 -> 0.16043394425752977 | O1980: =POWER(D1980/I1980,1/5)-1 -> 8.4583676243028316e-02
A1981: 7801.HK | B1981: Interra Acq-Z | C1981: 7.83 | D1981: -58174577 | E1981: -- | F1981: -- | G1981: -- | H1981: -- | I1981: -- | J1981: -- | K1981: -- | L1981: -- | M1981: -- | N1981: =POWER(D1981/M1981,1/9)-1 -> #VALUE! | O1981: =POWER(D1981/I1981,1/5)-1 -> #VALUE!
A1982: 1229.HK | B1982: 南南资源 | C1982: 0.16 | D1982: -58328000 | E1982: 66592000 | F1982: -2936000 | G1982: -25306000 | H1982: 28843000 | I1982: 36678000 | J1982: 48267000 | K1982: -79608000 | L1982: -5519000 | M1982: -13456000 | N1982: =POWER(D1982/M1982,1/9)-1 -> 0.17699185188871724 | O1982: =POWER(D1982/I1982,1/5)-1 -> -2.0972214464808232
A1983: 1961.HK | B1983: 多牛科技 | C1983: 0.69 | D1983: -58449384 | E1983: -95262404.5 | F1983: -104151072 | G1983: -1574499.8999999999 | H1983: 41620170 | I1983: 54298695.399999999 | J1983: 55908303.700000003 | K1983: 40506173.75 | L1983: -- | M1983: -- | N1983: =POWER(D1983/M1983,1/9)-1 -> #VALUE! | O1983: =POWER(D1983/I1983,1/5)-1 -> -2.0148412431943425
A1984: 0290.HK | B1984: 国富创新 | C1984: 1.05 | D1984: -58855000 | E1984: -79309000 | F1984: -13495000 | G1984: -71814000 | H1984: -104179000 | I1984: -65450000 | J1984: 30907000 | K1984: -42301000 | L1984: -156732000 | M1984: -15254000 | N1984: =POWER(D1984/M1984,1/9)-1 -> 0.16186458353784539 | O1984: =POWER(D1984/I1984,1/5)-1 -> -2.1017919106093297e-02
A1985: 0460.HK | B1985: 四环医药 | C1985: 0.55 | D1985: -59213435.399999999 | E1985: -2160218995.8000002 | F1985: 510015270.5 | G1985: 564224005.79999995 | H1985: -3076848510 | I1985: 1844481901.5999999 | J1985: 1737128171.5 | K1985: 1898280588.75 | L1985: 2425459646.9000001 | M1985: 2085591559.9000001 | N1985: =POWER(D1985/M1985,1/9)-1 -> -1.6731817490241023 | O1985: =POWER(D1985/I1985,1/5)-1 -> -1.5027003319816439
A1986: 1826.HK | B1986: 丰展控股 | C1986: 0.07 | D1986: -59284000 | E1986: -969000 | F1986: 40100000 | G1986: -245030000 | H1986: 20568000 | I1986: 32057000 | J1986: 31183000 | K1986: 31174000 | L1986: 15317000 | M1986: 19120000 | N1986: =POWER(D1986/M1986,1/9)-1 -> -2.1339803063359 | O1986: =POWER(D1986/I1986,1/5)-1 -> -2.1308445889230487
A1987: 1122.HK | B1987: 庆铃汽车股份 | C1987: 0.55 | D1987: -59489677.799999997 | E1987: -16442057.5 | F1987: 394386960 | G1987: 358748789.10000002 | H1987: 385881690 | I1987: 516664799.19999999 | J1987: 595764581.39999998 | K1987: 534830178.75 | L1987: 564371106.35000002 | M1987: 554752697.10000002 | N1987: =POWER(D1987/M1987,1/9)-1 -> -1.7802975509241867 | O1987: =POWER(D1987/I1987,1/5)-1 -> -1.6490027673097143
A1988: 1561.HK | B1988: 联洋智能控股 | C1988: 0.18 | D1988: -59900000 | E1988: -85329000 | F1988: -238682000 | G1988: -627682000 | H1988: -23309000 | I1988: 8563000 | J1988: 6105000 | K1988: 41603000 | L1988: 44305000 | M1988: 41431000 | N1988: =POWER(D1988/M1988,1/9)-1 -> -2.0418112555828154 | O1988: =POWER(D1988/I1988,1/5)-1 -> -2.4755712188134855
A1989: 8623.HK | B1989: 中国蜀塔 | C1989: -- | D1989: -60044000 | E1989: -21527000 | F1989: -25224000 | G1989: 1895000 | H1989: 26607000 | I1989: 17486000 | J1989: 2180000 | K1989: -- | L1989: -- | M1989: -- | N1989: =POWER(D1989/M1989,1/9)-1 -> #VALUE! | O1989: =POWER(D1989/I1989,1/5)-1 -> -2.2798404390997042
A1990: 8087.HK | B1990: 中国三三传媒 | C1990: 0.11 | D1990: -61042993.200000003 | E1990: -64830778.899999999 | F1990: -138557073 | G1990: -147417767.69999999 | H1990: -88036650 | I1990: -32867966.199999999 | J1990: -43201162.600000001 | K1990: -66211608.75 | L1990: -53136291.100000001 | M1990: -73779591.700000003 | N1990: =POWER(D1990/M1990,1/9)-1 -> -2.0835841398244792e-02 | O1990: =POWER(D1990/I1990,1/5)-1 -> 0.13180757903968754
A1991: 1421.HK | B1991: 工盖有限公司 | C1991: 0.39 | D1991: -61622000 | E1991: -44005000 | F1991: -30142000 | G1991: -74903000 | H1991: -52575000 | I1991: -10599240.960000001 | J1991: -220975031.55000001 | K1991: 22843896.039999999 | L1991: 22413098.739999998 | M1991: 35673298.68 | N1991: =POWER(D1991/M1991,1/9)-1 -> -2.0626174576597958 | O1991: =POWER(D1991/I1991,1/5)-1 -> 0.42197579825629661
A1992: 0661.HK | B1992: 中国大冶有色金属 | C1992: 0.06 | D1992: -61745657.399999999 | E1992: 125117571 | F1992: 350740882 | G1992: 365216038.5 | H1992: 163897020 | I1992: -114951917.40000001 | J1992: -116589428.3 | K1992: -181671595 | L1992: -1148221128.8499999 | M1992: -119240588.7 | N1992: =POWER(D1992/M1992,1/9)-1 -> -7.0514800825449253e-02 | O1992: =POWER(D1992/I1992,1/5)-1 -> -0.11688341722209439
A1993: 2389.HK | B1993: 北京健康 | C1993: 0.08 | D1993: -61882000 | E1993: -97696000 | F1993: -39410000 | G1993: -185324000 | H1993: -422394000 | I1993: 43450000 | J1993: 213675000 | K1993: -68015000 | L1993: -56480000 | M1993: -174565000 | N1993: =POWER(D1993/M1993,1/9)-1 -> -0.10883863080482936 | O1993: =POWER(D1993/I1993,1/5)-1 -> -2.0732846350831253
A1994: 0684.HK | B1994: 亚伦国际 | C1994: 1.05 | D1994: -62053000 | E1994: -26995000 | F1994: 46402000 | G1994: -18164000 | H1994: 28119000 | I1994: 46780000 | J1994: 72947000 | K1994: 135656000 | L1994: 70480000 | M1994: 83457000 | N1994: =POWER(D1994/M1994,1/9)-1 -> -1.9676092279000974 | O1994: =POWER(D1994/I1994,1/5)-1 -> -2.0581336190781903
A1995: 1835.HK | B1995: 瑞威资管 | C1995: 1.8 | D1995: -62190714.600000001 | E1995: -38911553.299999997 | F1995: -48033461.5 | G1995: 5275349.4000000004 | H1995: 10561492.5 | I1995: 52073871 | J1995: 77945284.599999994 | K1995: 47904876.25 | L1995: 12169765.4 | M1995: -- | N1995: =POWER(D1995/M1995,1/9)-1 -> #VALUE! | O1995: =POWER(D1995/I1995,1/5)-1 -> -2.0361464344053362
A1996: 0365.HK | B1996: 芯成科技 | C1996: 0.12 | D1996: -62509000 | E1996: -24504000 | F1996: 38282000 | G1996: 19650000 | H1996: -13573000 | I1996: -122919000 | J1996: 51569000 | K1996: -8436000 | L1996: 2535000 | M1996: 9426000 | N1996: =POWER(D1996/M1996,1/9)-1 -> -2.2339301285826352 | O1996: =POWER(D1996/I1996,1/5)-1 -> -0.12649638517718254
A1997: 0959.HK | B1997: 世纪娱乐国际 | C1997: 0.22 | D1997: -62549000 | E1997: -3675000 | F1997: -42999000 | G1997: -39219000 | H1997: -418039000 | I1997: -52772000 | J1997: -983869000 | K1997: -43136000 | L1997: -40240000 | M1997: 66662000 | N1997: =POWER(D1997/M1997,1/9)-1 -> -1.992948884828714 | O1997: =POWER(D1997/I1997,1/5)-1 -> 3.4578296309595746e-02
A1998: 2292.HK | B1998: 晋安实业 | C1998: 0.90000000000000002 | D1998: -62631000 | E1998: -38966000 | F1998: -8393000 | G1998: -79812000 | H1998: -185897000 | I1998: 50542000 | J1998: 180727000 | K1998: 240845000 | L1998: 205507000 | M1998: 109310000 | N1998: =POWER(D1998/M1998,1/9)-1 -> -1.9399948941799354 | O1998: =POWER(D1998/I1998,1/5)-1 -> -2.0438242557451156
A1999: 6928.HK | B1999: 万马控股 | C1999: 0.27 | D1999: -62635988.530000001 | E1999: -10889298.82 | F1999: 681451.97999999998 | G1999: 1014378.1800000001 | H1999: 12950461.77 | I1999: 24358120.969999999 | J1999: 2345089.9900000002 | K1999: 16173761.18 | L1999: 15418632.119999999 | M1999: -- | N1999: =POWER(D1999/M1999,1/9)-1 -> #VALUE! | O1999: =POWER(D1999/I1999,1/5)-1 -> -2.2079140437136178
A2000: 0073.HK | B2000: 亚洲果业 | C2000: 2.7000000000000002 | D2000: -63334432 | E2000: -24243294.399999999 | F2000: 4802376 | G2000: 27153827.800000001 | H2000: 615627826.39999998 | I2000: -262202502.40000001 | J2000: -32811334.899999999 | K2000: -6057549594.8000002 | L2000: -1526924734.6500001 | M2000: -2295295392 | N2000: =POWER(D2000/M2000,1/9)-1 -> -0.32894873487330956 | O2000: =POWER(D2000/I2000,1/5)-1 -> -0.24733692651480554
A2001: 8225.HK | B2001: 中国医疗集团 | C2001: 0.09 | D2001: -63594946.799999997 | E2001: -17853310.600000001 | F2001: 44479962.5 | G2001: 72288735 | H2001: 31057560 | I2001: 26374530.399999999 | J2001: 36511300.600000001 | K2001: 2363628.75 | L2001: -3943295.6499999999 | M2001: 55053604.299999997 | N2001: =POWER(D2001/M2001,1/9)-1 -> -2.0161542786373117 | O2001: =POWER(D2001/I2001,1/5)-1 -> -2.1924703091609867
A2002: 9963.HK | B2002: 高科桥 | C2002: 0.19 | D2002: -64222000 | E2002: -70820000 | F2002: -87321000 | G2002: 28231000 | H2002: 35763000 | I2002: 79558000 | J2002: 104350000 | K2002: 63915000 | L2002: -391000 | M2002: -4926000 | N2002: =POWER(D2002/M2002,1/9)-1 -> 0.33017853512162731 | O2002: =POWER(D2002/I2002,1/5)-1 -> -1.9580760721996349
A2003: 0947.HK | B2003: 摩比发展 | C2003: 0.15 | D2003: -64889559 | E2003: -259193384.09999999 | F2003: -403718874.5 | G2003: -35534114.700000003 | H2003: 26385292.5 | I2003: 19002095.399999999 | J2003: -58157440.100000001 | K2003: 73174701.25 | L2003: 105439938.8 | M2003: 121765090.40000001 | N2003: =POWER(D2003/M2003,1/9)-1 -> -1.9324552596817162 | O2003: =POWER(D2003/I2003,1/5)-1 -> -2.2784232658255803
A2004: 1380.HK | B2004: 中国金石 | C2004: 0.14 | D2004: -65333520 | E2004: -69811340.400000006 | F2004: -61643779 | G2004: -36292163.100000001 | H2004: -76554337.5 | I2004: -21940822 | J2004: 9347823.3000000007 | K2004: -138403965 | L2004: -230817453.25 | M2004: -35699923.200000003 | N2004: =POWER(D2004/M2004,1/9)-1 -> 6.9456679510204955e-02 | O2004: =POWER(D2004/I2004,1/5)-1 -> 0.24387469474667367
A2005: 9978.HK | B2005: 方圆生活服务 | C2005: 0.08 | D2005: -66439585.799999997 | E2005: 20489680.300000001 | F2005: 24731226.5 | G2005: 13008396.6 | H2005: 24769387.5 | I2005: 34291216.200000003 | J2005: -7966690.5 | K2005: 17032128.75 | L2005: 15162812.65 | M2005: -- | N2005: =POWER(D2005/M2005,1/9)-1 -> #VALUE! | O2005: =POWER(D2005/I2005,1/5)-1 -> -2.1414287456112011
A2006: 1058.HK | B2006: 南粤控股 | C2006: 0.29999999999999999 | D2006: -66449000 | E2006: -43929000 | F2006: -19943000 | G2006: -2751000 | H2006: -38994000 | I2006: -81241000 | J2006: -99623000 | K2006: -39994000 | L2006: -38349000 | M2006: 1998000 | N2006: =POWER(D2006/M2006,1/9)-1 -> -2.4760437099774091 | O2006: =POWER(D2006/I2006,1/5)-1 -> -3.9399877225626212e-02
A2007: 8657.HK | B2007: True Partner | C2007: 0.35 | D2007: -67001000 | E2007: -33636000 | F2007: -26020000 | G2007: 26149000 | H2007: -21756000 | I2007: 84030000 | J2007: -- | K2007: -- | L2007: -- | M2007: -- | N2007: =POWER(D2007/M2007,1/9)-1 -> #VALUE! | O2007: =POWER(D2007/I2007,1/5)-1 -> -1.9557171607534638
A2008: 1932.HK | B2008: 中漆集团 | C2008: 0.26 | D2008: -67115000 | E2008: -98084000 | F2008: -59533000 | G2008: -10801000 | H2008: -28036000 | I2008: -139260000 | J2008: 17332000 | K2008: 55448000 | L2008: 42498000 | M2008: 97274000 | N2008: =POWER(D2008/M2008,1/9)-1 -> -1.9596026185818936 | O2008: =POWER(D2008/I2008,1/5)-1 -> -0.13583108405009492
A2009: 8153.HK | B2009: 嘉鼎国际集团 | C2009: 0.11 | D2009: -67214000 | E2009: -44321000 | F2009: 2386000 | G2009: -48589000 | H2009: -50622000 | I2009: -34175000 | J2009: 131144000 | K2009: -233399000 | L2009: -133491000 | M2009: -247690000 | N2009: =POWER(D2009/M2009,1/9)-1 -> -0.13491007921532694 | O2009: =POWER(D2009/I2009,1/5)-1 -> 0.1448543633215873
A2010: 0794.HK | B2010: 锦胜集团(控股) | C2010: 0.20000000000000001 | D2010: -67236000 | E2010: -38985000 | F2010: 27326000 | G2010: 11979000 | H2010: 41969000 | I2010: 96496000 | J2010: 18383000 | K2010: -66002000 | L2010: 53935000 | M2010: 37216000 | N2010: =POWER(D2010/M2010,1/9)-1 -> -2.0679264739579386 | O2010: =POWER(D2010/I2010,1/5)-1 -> -1.930290340317431
A2011: 0183.HK | B2011: 宏辉集团 | C2011: 0.14 | D2011: -67611000 | E2011: -144050000 | F2011: 36139000 | G2011: -153375000 | H2011: 42997000 | I2011: 145954000 | J2011: 7106000 | K2011: -41259000 | L2011: -28580000 | M2011: 10502000 | N2011: =POWER(D2011/M2011,1/9)-1 -> -2.2298739249058999 | O2011: =POWER(D2011/I2011,1/5)-1 -> -1.8573541838645495
A2012: 0701.HK | B2012: 北海集团 | C2012: 0.29 | D2012: -68579000 | E2012: -94081000 | F2012: -20633000 | G2012: -94242000 | H2012: 234793000 | I2012: -25091000 | J2012: 37516000 | K2012: 87666000 | L2012: 86354000 | M2012: 149192000 | N2012: =POWER(D2012/M2012,1/9)-1 -> -1.9172631718157216 | O2012: =POWER(D2012/I2012,1/5)-1 -> 0.22274145230565257
A2013: 0211.HK | B2013: 大凌集团 | C2013: 0.14 | D2013: -68694000 | E2013: 7389000 | F2013: -38895000 | G2013: -66661000 | H2013: 183000 | I2013: -25552000 | J2013: 5698000 | K2013: 1247000 | L2013: 94081000 | M2013: 81603000 | N2013: =POWER(D2013/M2013,1/9)-1 -> -1.9810480928421614 | O2013: =POWER(D2013/I2013,1/5)-1 -> 0.2187055288791977
A2014: 2011.HK | B2014: 进腾集团 | C2014: 1.82 | D2014: -69043000 | E2014: -1888000 | F2014: -17503000 | G2014: -46907000 | H2014: -44180000 | I2014: -33177000 | J2014: -45127000 | K2014: 21940000 | L2014: 4161000 | M2014: 3661000 | N2014: =POWER(D2014/M2014,1/9)-1 -> -2.3858761984390489 | O2014: =POWER(D2014/I2014,1/5)-1 -> 0.15786121932706076
A2015: 1802.HK | B2015: 文业集团 | C2015: 0.05 | D2015: -69574717.799999997 | E2015: -- | F2015: -73301019 | G2015: 25112141.100000001 | H2015: 44773755 | I2015: 69136930.599999994 | J2015: 67176764.799999997 | K2015: 51772026.25 | L2015: -- | M2015: -- | N2015: =POWER(D2015/M2015,1/9)-1 -> #VALUE! | O2015: =POWER(D2015/I2015,1/5)-1 -> -2.0012632395806662
A2016: 0559.HK | B2016: 德泰新能源集团 | C2016: 0.01 | D2016: -69831000 | E2016: -135838000 | F2016: -35365000 | G2016: -163520000 | H2016: -154992000 | I2016: -156754000 | J2016: -144426000 | K2016: -494057000 | L2016: 12055000 | M2016: -41276000 | N2016: =POWER(D2016/M2016,1/9)-1 -> 6.0162150811207571e-02 | O2016: =POWER(D2016/I2016,1/5)-1 -> -0.14932058078365062
A2017: 8118.HK | B2017: 濠亮环球 | C2017: 0.07 | D2017: -69935000 | E2017: 5667000 | F2017: 24126000 | G2017: 18504000 | H2017: 23418000 | I2017: 7449000 | J2017: 16061000 | K2017: 11969000 | L2017: 8613000 | M2017: -- | N2017: =POWER(D2017/M2017,1/9)-1 -> #VALUE! | O2017: =POWER(D2017/I2017,1/5)-1 -> -2.5650179425388124
A2018: 0417.HK | B2018: 谢瑞麟 | C2018: 0.78 | D2018: -71435000 | E2018: 15546000 | F2018: -43980000 | G2018: -89670000 | H2018: 54161000 | I2018: 49419000 | J2018: 23177000 | K2018: 23623000 | L2018: 39758000 | M2018: 74529000 | N2018: =POWER(D2018/M2018,1/9)-1 -> -1.9952999282831536 | O2018: =POWER(D2018/I2018,1/5)-1 -> -2.0764736886318671
A2019: 0097.HK | B2019: 恒基发展 | C2019: 0.13 | D2019: -72000000 | E2019: 5000000 | F2019: 34000000 | G2019: 127000000 | H2019: 62000000 | I2019: 97000000 | J2019: 111000000 | K2019: 100000000 | L2019: 449000000 | M2019: -7000000 | N2019: =POWER(D2019/M2019,1/9)-1 -> 0.29559867490784186 | O2019: =POWER(D2019/I2019,1/5)-1 -> -1.9421328619915363
A2020: 1388.HK | B2020: 安莉芳控股 | C2020: 0.34 | D2020: -72168000 | E2020: -51239000 | F2020: -27485000 | G2020: -2824000 | H2020: 80322000 | I2020: 151165000 | J2020: 495299000 | K2020: 98402000 | L2020: 201574000 | M2020: 188093000 | N2020: =POWER(D2020/M2020,1/9)-1 -> -1.8990310074025489 | O2020: =POWER(D2020/I2020,1/5)-1 -> -1.8625388874256137
A2021: 1348.HK | B2021: 滉达富控股 | C2021: 0.07 | D2021: -72321000 | E2021: -94374000 | F2021: -35628000 | G2021: -87662000 | H2021: -35787000 | I2021: -47169000 | J2021: -94143000 | K2021: -77572000 | L2021: -3721000 | M2021: 20189000 | N2021: =POWER(D2021/M2021,1/9)-1 -> -2.1523175581710174 | O2021: =POWER(D2021/I2021,1/5)-1 -> 8.9234906626266097e-02
A2022: 0255.HK | B2022: 龙记集团 | C2022: 1.3 | D2022: -72431000 | E2022: 15814000 | F2022: 227841000 | G2022: 181081000 | H2022: 149339000 | I2022: 170521000 | J2022: 278276000 | K2022: 191731000 | L2022: 125632000 | M2022: 137837000 | N2022: =POWER(D2022/M2022,1/9)-1 -> -1.9310027487580768 | O2022: =POWER(D2022/I2022,1/5)-1 -> -1.8426152639109441
A2023: 0147.HK | B2023: 国际商业结算 | C2023: 0.06 | D2023: -72716000 | E2023: -119137000 | F2023: -132284000 | G2023: -175491000 | H2023: -217980000 | I2023: -67640000 | J2023: -78467000 | K2023: -161159000 | L2023: -223794000 | M2023: -43927000 | N2023: =POWER(D2023/M2023,1/9)-1 -> 5.7601476719046252e-02 | O2023: =POWER(D2023/I2023,1/5)-1 -> 1.4577615750734019e-02
A2024: 0036.HK | B2024: 远东控股国际 | C2024: 0.07 | D2024: -72851000 | E2024: -68799000 | F2024: -240662000 | G2024: 93439000 | H2024: -132314000 | I2024: -105995000 | J2024: 69450000 | K2024: -53887000 | L2024: 69100000 | M2024: 25846000 | N2024: =POWER(D2024/M2024,1/9)-1 -> -2.1220305618730291 | O2024: =POWER(D2024/I2024,1/5)-1 -> -7.2251998111225624e-02
A2025: 0859.HK | B2025: 中昌国际控股 | C2025: 0.13 | D2025: -72864000 | E2025: -63338000 | F2025: 246283000 | G2025: -181080000 | H2025: -94787000 | I2025: 20702000 | J2025: 34106000 | K2025: 1571000 | L2025: 486169000 | M2025: 123600000 | N2025: =POWER(D2025/M2025,1/9)-1 -> -1.9429732937795172 | O2025: =POWER(D2025/I2025,1/5)-1 -> -2.2861752286250487
A2026: 0219.HK | B2026: 顺豪物业 | C2026: 0.75 | D2026: -72968000 | E2026: 482146000 | F2026: 68226000 | G2026: -171635000 | H2026: 17311000 | I2026: 604054000 | J2026: 793515000 | K2026: 381389000 | L2026: 170245000 | M2026: 644500000 | N2026: =POWER(D2026/M2026,1/9)-1 -> -1.7850165913506078 | O2026: =POWER(D2026/I2026,1/5)-1 -> -1.6552564968174712
A2027: 7827.HK | B2027: VISION DEAL-Z | C2027: 8.45 | D2027: -73321000 | E2027: -- | F2027: -- | G2027: -- | H2027: -- | I2027: -- | J2027: -- | K2027: -- | L2027: -- | M2027: -- | N2027: =POWER(D2027/M2027,1/9)-1 -> #VALUE! | O2027: =POWER(D2027/I2027,1/5)-1 -> #VALUE!
A2028: 2178.HK | B2028: 百勤油服 | C2028: 0.08 | D2028: -73510000 | E2028: -28588000 | F2028: -81785000 | G2028: -73025000 | H2028: -87032000 | I2028: -623070000 | J2028: -180262000 | K2028: -443353000 | L2028: -384342000 | M2028: -423082000 | N2028: =POWER(D2028/M2028,1/9)-1 -> -0.17672130857620461 | O2028: =POWER(D2028/I2028,1/5)-1 -> -0.34782834954026554
A2029: 8238.HK | B2029: 惠陶集团 | C2029: 0.06 | D2029: -73721000 | E2029: 10104000 | F2029: 21531000 | G2029: -2847000 | H2029: -38900995 | I2029: -37463722 | J2029: -15128391 | K2029: -26293024 | L2029: -5761648 | M2029: 6626734 | N2029: =POWER(D2029/M2029,1/9)-1 -> -2.3069369332962135 | O2029: =POWER(D2029/I2029,1/5)-1 -> 0.14497514486666896
A2030: 9676.HK | B2030: 十月稻田 | C2030: 21.75 | D2030: -73801665 | E2030: -- | F2030: -- | G2030: -- | H2030: -- | I2030: -- | J2030: -- | K2030: -- | L2030: -- | M2030: -- | N2030: =POWER(D2030/M2030,1/9)-1 -> #VALUE! | O2030: =POWER(D2030/I2030,1/5)-1 -> #VALUE!
A2031: 1557.HK | B2031: 剑虹集团控股 | C2031: 0.23 | D2031: -74115000 | E2031: -18346000 | F2031: 1071000 | G2031: 1009000 | H2031: -29107000 | I2031: -25190000 | J2031: -33849000 | K2031: 40303000 | L2031: 46581000 | M2031: 30189000 | N2031: =POWER(D2031/M2031,1/9)-1 -> -2.1049425791379854 | O2031: =POWER(D2031/I2031,1/5)-1 -> 0.24089658420635263
A2032: 0180.HK | B2032: 开达集团 | C2032: 0.31 | D2032: -74634000 | E2032: -86384000 | F2032: 45942000 | G2032: -110366000 | H2032: -14364000 | I2032: 181750000 | J2032: 321748000 | K2032: 122905000 | L2032: 124339000 | M2032: 145840000 | N2032: =POWER(D2032/M2032,1/9)-1 -> -1.9282679164715799 | O2032: =POWER(D2032/I2032,1/5)-1 -> -1.8369364060688365
A2033: 1239.HK | B2033: Teamway Intl Gp | C2033: 0.16 | D2033: -74864979 | E2033: -55954888.100000001 | F2033: -53135953 | G2033: -45797565.600000001 | H2033: -42726495 | I2033: -364707243.19999999 | J2033: -2367827.5 | K2033: 17507743.75 | L2033: -3014216.1499999999 | M2033: 17596637.899999999 | N2033: =POWER(D2033/M2033,1/9)-1 -> -2.1745516308036748 | O2033: =POWER(D2033/I2033,1/5)-1 -> -0.27143741632163121
A2034: 0724.HK | B2034: 瑞鑫国际集团 | C2034: 0.10000000000000001 | D2034: -74915000 | E2034: -58178000 | F2034: -54151000 | G2034: -56383000 | H2034: -60282000 | I2034: -85881000 | J2034: -42749000 | K2034: -66703000 | L2034: -23211000 | M2034: -40434000 | N2034: =POWER(D2034/M2034,1/9)-1 -> 7.092241470473315e-02 | O2034: =POWER(D2034/I2034,1/5)-1 -> -2.6951834455865464e-02
A2035: 0277.HK | B2035: 太兴置业 | C2035: 1.95 | D2035: -75204000 | E2035: -55083000 | F2035: -134229000 | G2035: -531208000 | H2035: 25534000 | I2035: 110255000 | J2035: -29312000 | K2035: -58072000 | L2035: 266743000 | M2035: 250846000 | N2035: =POWER(D2035/M2035,1/9)-1 -> -1.8747227418171284 | O2035: =POWER(D2035/I2035,1/5)-1 -> -1.926335972608366
A2036: 9600.HK | B2036: 新纽科技 | C2036: 1.7 | D2036: -75812095.799999997 | E2036: 19728212.800000001 | F2036: 15976051.5 | G2036: 38175365.100000001 | H2036: 36995955 | I2036: 35436647.799999997 | J2036: 1845107.1000000001 | K2036: -- | L2036: -- | M2036: -- | N2036: =POWER(D2036/M2036,1/9)-1 -> #VALUE! | O2036: =POWER(D2036/I2036,1/5)-1 -> -2.1642792946418172
A2037: 1912.HK | B2037: 康特隆 | C2037: 0.08 | D2037: -76149439 | E2037: -12367872 | F2037: 16929458 | G2037: 15668813 | H2037: 19568731 | I2037: 20454574 | J2037: 19902258 | K2037: 9095442 | L2037: 17826150 | M2037: -- | N2037: =POWER(D2037/M2037,1/9)-1 -> #VALUE! | O2037: =POWER(D2037/I2037,1/5)-1 -> -2.3006943502597199
A2038: 0907.HK | B2038: 高雅光学 | C2038: 0.07 | D2038: -77389000 | E2038: -177076000 | F2038: -15274000 | G2038: -98399000 | H2038: -99090000 | I2038: -14117000 | J2038: 8038000 | K2038: -86729000 | L2038: -84230000 | M2038: -68300000 | N2038: =POWER(D2038/M2038,1/9)-1 -> 1.397845143725851e-02 | O2038: =POWER(D2038/I2038,1/5)-1 -> 0.40535927430482444
A2039: 2385.HK | B2039: 读书郎 | C2039: 6.57 | D2039: -78320201.400000006 | E2039: 5876272.9000000004 | F2039: 100587777 | G2039: 109670294.7 | H2039: -- | I2039: -- | J2039: -- | K2039: -- | L2039: -- | M2039: -- | N2039: =POWER(D2039/M2039,1/9)-1 -> #VALUE! | O2039: =POWER(D2039/I2039,1/5)-1 -> #VALUE!
A2040: 0188.HK | B2040: 新华汇富金融 | C2040: 0.22 | D2040: -78497000 | E2040: -78069000 | F2040: 31758000 | G2040: -40934000 | H2040: -32821000 | I2040: 20401000 | J2040: -1929000 | K2040: -69912000 | L2040: 9086000 | M2040: 31870270 | N2040: =POWER(D2040/M2040,1/9)-1 -> -2.1053412266380533 | O2040: =POWER(D2040/I2040,1/5)-1 -> -2.309303475406117
A2041: 2392.HK | B2041: 玄武云 | C2041: 0.61 | D2041: -79325416.799999997 | E2041: -40246095.600000001 | F2041: 17771168.5 | G2041: 33072841.199999999 | H2041: -- | I2041: -- | J2041: -- | K2041: -- | L2041: -- | M2041: -- | N2041: =POWER(D2041/M2041,1/9)-1 -> #VALUE! | O2041: =POWER(D2041/I2041,1/5)-1 -> #VALUE!
A2042: 1075.HK | B2042: 首都信息 | C2042: 2.35 | D2042: -79920031.989999995 | E2042: 144952349.22999999 | F2042: 22465714.789999999 | G2042: 151955371.84999999 | H2042: 142646327.08000001 | I2042: 70785997.010000005 | J2042: 97267327.239999995 | K2042: 79612241.480000004 | L2042: 119418469.09999999 | M2042: 83600564.700000003 | N2042: =POWER(D2042/M2042,1/9)-1 -> -1.9950098545481314 | O2042: =POWER(D2042/I2042,1/5)-1 -> -2.0245700561351683
A2043: 0476.HK | B2043: 科轩动力控股 | C2043: 0.09 | D2043: -81160000 | E2043: -408335000 | F2043: -780525000 | G2043: -146850000 | H2043: -156625000 | I2043: -321861000 | J2043: -118408000 | K2043: -120140000 | L2043: -48414000 | M2043: -35986000 | N2043: =POWER(D2043/M2043,1/9)-1 -> 9.4574647348185215e-02 | O2043: =POWER(D2043/I2043,1/5)-1 -> -0.24083751903096129
A2044: 3882.HK | B2044: 天彩控股 | C2044: 0.59 | D2044: -81496000 | E2044: -23983000 | F2044: -3853000 | G2044: -64021000 | H2044: -82310000 | I2044: -253728000 | J2044: -485300000 | K2044: 53728000 | L2044: 213517000 | M2044: 201906000 | N2044: =POWER(D2044/M2044,1/9)-1 -> -1.9041089851790898 | O2044: =POWER(D2044/I2044,1/5)-1 -> -0.20319219518521636
A2045: 1417.HK | B2045: 浦江中国 | C2045: 0.38 | D2045: -81627436.799999997 | E2045: 14129452.5 | F2045: 47253455 | G2045: 31238507.100000001 | H2045: 19893735 | I2045: 28926133 | J2045: 43063289.100000001 | K2045: 34410967.5 | L2045: 40521978.799999997 | M2045: 35781036.700000003 | N2045: =POWER(D2045/M2045,1/9)-1 -> -2.0959686660599006 | O2045: =POWER(D2045/I2045,1/5)-1 -> -2.2305780269835553
A2046: 0055.HK | B2046: 中星集团控股 | C2046: 0.21 | D2046: -81961487 | E2046: -1942228 | F2046: -10706159 | G2046: -87187111 | H2046: -30782482 | I2046: -37922569 | J2046: 48145604 | K2046: 74205738 | L2046: -67261328 | M2046: -21015858 | N2046: =POWER(D2046/M2046,1/9)-1 -> 0.16325153354133382 | O2046: =POWER(D2046/I2046,1/5)-1 -> 0.16665491701211788
A2047: 0472.HK | B2047: 新丝路文旅 | C2047: 0.18 | D2047: -82255000 | E2047: -112474000 | F2047: 61864000 | G2047: -92028000 | H2047: -188729000 | I2047: 64413000 | J2047: -70986000 | K2047: -92482000 | L2047: -35336000 | M2047: -193044000 | N2047: =POWER(D2047/M2047,1/9)-1 -> -9.0434456532835772e-02 | O2047: =POWER(D2047/I2047,1/5)-1 -> -2.0501171615737257
A2048: 1942.HK | B2048: 马可数字科技 | C2048: 0.98 | D2048: -82833256.799999997 | E2048: 17253161.399999999 | F2048: 18578448.899999999 | G2048: 19620545 | H2048: 39698835.299999997 | I2048: 26743845.199999999 | J2048: 18312800 | K2048: -- | L2048: -- | M2048: -- | N2048: =POWER(D2048/M2048,1/9)-1 -> #VALUE! | O2048: =POWER(D2048/I2048,1/5)-1 -> -2.25370736584473
A2049: 0814.HK | B2049: 北京京客隆 | C2049: 0.41 | D2049: -82955054.489999995 | E2049: -108377351.03 | F2049: -27519689.739999998 | G2049: 65149914.310000002 | H2049: 59155349.729999997 | I2049: 72087404.140000001 | J2049: 56929771.299999997 | K2049: 29654601.920000002 | L2049: 29241909.34 | M2049: 51575513.579999998 | N2049: =POWER(D2049/M2049,1/9)-1 -> -2.0542248633862474 | O2049: =POWER(D2049/I2049,1/5)-1 -> -2.0284819950792552
A2050: 1726.HK | B2050: HKE Holdings | C2050: 1.73 | D2050: -83979188.980000004 | E2050: -63565807.399999999 | F2050: 1459403.76 | G2050: 323785.71000000002 | H2050: 13069972.439999999 | I2050: 5057602.5599999996 | J2050: 29191150.190000001 | K2050: 15379120.529999999 | L2050: 19987622.079999998 | M2050: -- | N2050: =POWER(D2050/M2050,1/9)-1 -> #VALUE! | O2050: =POWER(D2050/I2050,1/5)-1 -> -2.75406383957458
A2051: 0622.HK | B2051: 威华达控股 | C2051: 0.11 | D2051: -84486000 | E2051: -81088000 | F2051: -3145728000 | G2051: 2819555000 | H2051: -360031000 | I2051: 21035000 | J2051: 57464000 | K2051: -941990000 | L2051: 713071000 | M2051: 511276000 | N2051: =POWER(D2051/M2051,1/9)-1 -> -1.8187013046223419 | O2051: =POWER(D2051/I2051,1/5)-1 -> -2.3205913446123478
A2052: 0333.HK | B2052: 黛丽斯国际 | C2052: 0.29999999999999999 | D2052: -84732000 | E2052: 3550000 | F2052: 2797000 | G2052: -77235000 | H2052: -61224000 | I2052: 16010000 | J2052: 5397000 | K2052: 32298000 | L2052: 34178000 | M2052: 37026000 | N2052: =POWER(D2052/M2052,1/9)-1 -> -2.096349347092568 | O2052: =POWER(D2052/I2052,1/5)-1 -> -2.3955044481193495
A2053: 1315.HK | B2053: 绿色经济 | C2053: 0.11 | D2053: -85348000 | E2053: -13566000 | F2053: 7216000 | G2053: -18965000 | H2053: -145451000 | I2053: -22372000 | J2053: -145000 | K2053: 19918000 | L2053: -117263000 | M2053: -48318000 | N2053: =POWER(D2053/M2053,1/9)-1 -> 6.5255590614768488e-02 | O2053: =POWER(D2053/I2053,1/5)-1 -> 0.30706657135449933
A2054: 8370.HK | B2054: 智升集团控股 | C2054: 0.32 | D2054: -85404966.400000006 | E2054: -- | F2054: -- | G2054: -32125280.699999999 | H2054: -18406342.5 | I2054: 5669089.4000000004 | J2054: 11477069.699999999 | K2054: 287813.75 | L2054: 5018205.3499999996 | M2054: -- | N2054: =POWER(D2054/M2054,1/9)-1 -> #VALUE! | O2054: =POWER(D2054/I2054,1/5)-1 -> -2.7202594968291458
A2055: 2190.HK | B2055: 归创通桥-B | C2055: 10.9 | D2055: -86308210.799999997 | E2055: -128101395.5 | F2055: -244519180.5 | G2055: -119747809.2 | H2055: -- | I2055: -- | J2055: -- | K2055: -- | L2055: -- | M2055: -- | N2055: =POWER(D2055/M2055,1/9)-1 -> #VALUE! | O2055: =POWER(D2055/I2055,1/5)-1 -> #VALUE!
A2056: 0186.HK | B2056: 敏捷控股 | C2056: 0.17 | D2056: -87000000 | E2056: -97000000 | F2056: -86000000 | G2056: -87000000 | H2056: 91000000 | I2056: 175000000 | J2056: -- | K2056: -- | L2056: -163000000 | M2056: -93000000 | N2056: =POWER(D2056/M2056,1/9)-1 -> -7.3827652306436287e-03 | O2056: =POWER(D2056/I2056,1/5)-1 -> -1.8695533664471675
A2057: 2110.HK | B2057: 天成控股 | C2057: 0.14 | D2057: -87050000 | E2057: 16684000 | F2057: 37635000 | G2057: 28113000 | H2057: 28752000 | I2057: 32988000 | J2057: 22340000 | K2057: -- | L2057: -- | M2057: -- | N2057: =POWER(D2057/M2057,1/9)-1 -> #VALUE! | O2057: =POWER(D2057/I2057,1/5)-1 -> -2.2141785546665211
A2058: 2028.HK | B2058: 映美控股 | C2058: 0.07 | D2058: -87113917.799999997 | E2058: -45154458.700000003 | F2058: -30782705.5 | G2058: -29932184.699999999 | H2058: -40293697.5 | I2058: -32192776.399999999 | J2058: 16608361.699999999 | K2058: 67981830 | L2058: 104575542.05 | M2058: 103082779.5 | N2058: =POWER(D2058/M2058,1/9)-1 -> -1.9814720494170437 | O2058: =POWER(D2058/I2058,1/5)-1 -> 0.2202977837859037
A2059: 3603.HK | B2059: 信基沙溪 | C2059: 0.05 | D2059: -87683941.799999997 | E2059: -190317238.59999999 | F2059: -254078852 | G2059: 39293367.299999997 | H2059: 114996337.5 | I2059: 215437921.80000001 | J2059: 92207399 | K2059: 65509298.75 | L2059: -- | M2059: -- | N2059: =POWER(D2059/M2059,1/9)-1 -> #VALUE! | O2059: =POWER(D2059/I2059,1/5)-1 -> -1.8354483061114883
A2060: 0389.HK | B2060: 通天酒业 | C2060: 0.53 | D2060: -87914143.799999997 | E2060: -29785224.300000001 | F2060: 13880932 | G2060: -193278504 | H2060: -908527.5 | I2060: -4160444.3999999999 | J2060: -47420091.700000003 | K2060: -103669623.75 | L2060: 11267735.050000001 | M2060: -822326167.20000005 | N2060: =POWER(D2060/M2060,1/9)-1 -> -0.2199674282662899 | O2060: =POWER(D2060/I2060,1/5)-1 -> 0.8407033625287903
A2061: 8237.HK | B2061: 华星控股 | C2061: 0.02 | D2061: -88245082 | E2061: -- | F2061: -113066303 | G2061: -48207538 | H2061: -55624724 | I2061: -3253782 | J2061: 11047089 | K2061: 10675733 | L2061: -1979068 | M2061: -2203704 | N2061: =POWER(D2061/M2061,1/9)-1 -> 0.50681416627901199 | O2061: =POWER(D2061/I2061,1/5)-1 -> 0.93490840767430772
A2062: 6958.HK | B2062: 正荣服务 | C2062: 0.23 | D2062: -88999381.799999997 | E2062: -317363860.60000002 | F2062: 213770761 | G2062: 204586059.30000001 | H2062: 117737565 | I2062: 45102223.200000003 | J2062: 24334073.300000001 | K2062: -- | L2062: -- | M2062: -- | N2062: =POWER(D2062/M2062,1/9)-1 -> #VALUE! | O2062: =POWER(D2062/I2062,1/5)-1 -> -2.145612669793274
A2063: 1201.HK | B2063: 天臣控股 | C2063: 0.08 | D2063: -89726000 | E2063: -196061000 | F2063: -326942000 | G2063: -25198000 | H2063: -104331000 | I2063: 59163000 | J2063: 19096000 | K2063: 6021000 | L2063: 28248000 | M2063: 65171000 | N2063: =POWER(D2063/M2063,1/9)-1 -> -2.036165969314625 | O2063: =POWER(D2063/I2063,1/5)-1 -> -2.0868600457917648
A2064: 2882.HK | B2064: 香港资源控股 | C2064: 0.69 | D2064: -89744000 | E2064: -78919000 | F2064: -15112000 | G2064: -62721000 | H2064: -181414000 | I2064: -59654000 | J2064: -143703000 | K2064: -62650000 | L2064: -93862000 | M2064: -184126000 | N2064: =POWER(D2064/M2064,1/9)-1 -> -7.6746112683584444e-02 | O2064: =POWER(D2064/I2064,1/5)-1 -> 8.5108512732482433e-02
A2065: 0279.HK | B2065: 裕承科金 | C2065: 0.03 | D2065: -89915000 | E2065: 2769719000 | F2065: -701690000 | G2065: -3838847000 | H2065: -2160250000 | I2065: 269894000 | J2065: 418208000 | K2065: -620996000 | L2065: 533025000 | M2065: 477336000 | N2065: =POWER(D2065/M2065,1/9)-1 -> -1.8307021390942144 | O2065: =POWER(D2065/I2065,1/5)-1 -> -1.8026529085005869
A2066: 2362.HK | B2066: 金川国际 | C2066: 0.59999999999999998 | D2066: -90279538 | E2066: 8026624 | F2066: 939869546 | G2066: 232148079 | H2066: 68097315 | I2066: 524337454 | J2066: 325249936 | K2066: 64722638 | L2066: -2261340133.5 | M2066: -1787851072 | N2066: =POWER(D2066/M2066,1/9)-1 -> -0.28234196059989891 | O2066: =POWER(D2066/I2066,1/5)-1 -> -1.7033891896701823
A2067: 1132.HK | B2067: 橙天嘉禾 | C2067: 0.06 | D2067: -90398000 | E2067: -46146000 | F2067: -314153000 | G2067: -288171000 | H2067: -35092000 | I2067: 52529000 | J2067: 2242136000 | K2067: -59078000 | L2067: -180471000 | M2067: 12731000 | N2067: =POWER(D2067/M2067,1/9)-1 -> -2.2433359131548052 | O2067: =POWER(D2067/I2067,1/5)-1 -> -2.1146844373691929
A2068: 0262.HK | B2068: 迪臣发展国际 | C2068: 0.06 | D2068: -90967000 | E2068: -27274000 | F2068: -36738000 | G2068: -35296000 | H2068: 27486000 | I2068: 47776000 | J2068: 144934000 | K2068: 140998000 | L2068: 94476000 | M2068: 145712000 | N2068: =POWER(D2068/M2068,1/9)-1 -> -1.9489982133415045 | O2068: =POWER(D2068/I2068,1/5)-1 -> -2.1374565535198649
A2069: 2400.HK | B2069: 心动公司 | C2069: 17.16 | D2069: -91027351.799999997 | E2069: -624397709.5 | F2069: -1057736569.5 | G2069: 10899925.5 | H2069: 387284152.5 | I2069: 324532880.80000001 | J2069: 139827707 | K2069: 27982386.25 | L2069: -- | M2069: -- | N2069: =POWER(D2069/M2069,1/9)-1 -> #VALUE! | O2069: =POWER(D2069/I2069,1/5)-1 -> -1.7755014973091927
A2070: 0465.HK | B2070: 富通科技 | C2070: 0.42 | D2070: -91312363.799999997 | E2070: -85231339.299999997 | F2070: -89015027.5 | G2070: 3536367.2999999998 | H2070: 3201637.5 | I2070: 22119582.199999999 | J2070: -47864883.600000001 | K2070: 19632453.75 | L2070: 27841807.699999999 | M2070: 42881587.700000003 | N2070: =POWER(D2070/M2070,1/9)-1 -> -2.0876100000784548 | O2070: =POWER(D2070/I2070,1/5)-1 -> -2.3278546328766847
A2071: 1542.HK | B2071: 台州水务 | C2071: 2.83 | D2071: -92080800 | E2071: 63088992.5 | F2071: 147319595 | G2071: 122847941.09999999 | H2071: 103413450 | I2071: 125758370 | J2071: 215798403.30000001 | K2071: 91634786.25 | L2071: -- | M2071: -- | N2071: =POWER(D2071/M2071,1/9)-1 -> #VALUE! | O2071: =POWER(D2071/I2071,1/5)-1 -> -1.9395641485658217
A2072: 1046.HK | B2072: 寰宇娱乐文化 | C2072: 0.39 | D2072: -92757000 | E2072: -76552000 | F2072: 154345000 | G2072: -27063000 | H2072: -121200000 | I2072: -135284000 | J2072: -114328000 | K2072: -140790000 | L2072: 161956000 | M2072: -24327000 | N2072: =POWER(D2072/M2072,1/9)-1 -> 0.16033725839393709 | O2072: =POWER(D2072/I2072,1/5)-1 -> -7.2700444406262443e-02
A2073: 8500.HK | B2073: 天泓文创 | C2073: 0.43 | D2073: -92790041.400000006 | E2073: -44853256 | F2073: 5964539.5 | G2073: 74769078.900000006 | H2073: -47257957.5 | I2073: 21032219.199999999 | J2073: 20695411.800000001 | K2073: -- | L2073: -- | M2073: -- | N2073: =POWER(D2073/M2073,1/9)-1 -> #VALUE! | O2073: =POWER(D2073/I2073,1/5)-1 -> -2.345622541885616
A2074: 0094.HK | B2074: 绿心集团 | C2074: 0.07 | D2074: -93075000 | E2074: -68152000 | F2074: -36938000 | G2074: -17237000 | H2074: -143814000 | I2074: -56880000 | J2074: 86451000 | K2074: 8735000 | L2074: -436933000 | M2074: -133303000 | N2074: =POWER(D2074/M2074,1/9)-1 -> -3.9127194100410878e-02 | O2074: =POWER(D2074/I2074,1/5)-1 -> 0.10350598113860809
A2075: 1084.HK | B2075: 绿新亲水胶体 | C2075: 0.78 | D2075: -93535457.400000006 | E2075: 261869237.30000001 | F2075: 103622000 | G2075: 68902000 | H2075: 93309000 | I2075: 93597000 | J2075: 92769000 | K2075: 53395000 | L2075: 29839000 | M2075: -- | N2075: =POWER(D2075/M2075,1/9)-1 -> #VALUE! | O2075: =POWER(D2075/I2075,1/5)-1 -> -1.999868459901986
A2076: 1520.HK | B2076: 天机控股 | C2076: 0.09 | D2076: -93749000 | E2076: -65895000 | F2076: -46271000 | G2076: -68115000 | H2076: -76680000 | I2076: -60032000 | J2076: -15632000 | K2076: -18769000 | L2076: 15732000 | M2076: 25679000 | N2076: =POWER(D2076/M2076,1/9)-1 -> -2.1547490541210781 | O2076: =POWER(D2076/I2076,1/5)-1 -> 9.3243153693905123e-02
A2077: 0954.HK | B2077: 常茂生物 | C2077: 0.42 | D2077: -94335683.400000006 | E2077: 91853286.299999997 | F2077: 71410391 | G2077: 20056101.300000001 | H2077: 65149132.5 | I2077: 57527765 | J2077: 4054679.7999999998 | K2077: 36862385 | L2077: 53244487.700000003 | M2077: 46450581.700000003 | N2077: =POWER(D2077/M2077,1/9)-1 -> -2.0819002092040417 | O2077: =POWER(D2077/I2077,1/5)-1 -> -2.1039761717272185
A2078: 0841.HK | B2078: 木薯资源 | C2078: 0.08 | D2078: -94711000 | E2078: 44972000 | F2078: -7129000 | G2078: -34367000 | H2078: 26094000 | I2078: 33155000 | J2078: 17058000 | K2078: 16613000 | L2078: 173180000 | M2078: 118709000 | N2078: =POWER(D2078/M2078,1/9)-1 -> -1.9752183487692325 | O2078: =POWER(D2078/I2078,1/5)-1 -> -2.2335884031718569
A2079: 0510.HK | B2079: 时富金融服务集团 | C2079: 0.22 | D2079: -95247000 | E2079: -69798000 | F2079: -53470000 | G2079: -39178000 | H2079: -114048000 | I2079: -144132000 | J2079: -46082000 | K2079: -51198000 | L2079: 13606000 | M2079: 32675000 | N2079: =POWER(D2079/M2079,1/9)-1 -> -2.1262276614874995 | O2079: =POWER(D2079/I2079,1/5)-1 -> -7.9511899662444763e-02
A2080: 0852.HK | B2080: 海峡石油化工 | C2080: 0.29999999999999999 | D2080: -95407000 | E2080: 6180000 | F2080: 6224000 | G2080: -93013000 | H2080: 125044000 | I2080: 7452000 | J2080: 21234000 | K2080: 172157000 | L2080: 33064000 | M2080: -354715000 | N2080: =POWER(D2080/M2080,1/9)-1 -> -0.13576189751930545 | O2080: =POWER(D2080/I2080,1/5)-1 -> -2.6651811222647068
A2081: 8037.HK | B2081: 中国生物科技服务 | C2081: 0.47 | D2081: -95447000 | E2081: 258087000 | F2081: 19385000 | G2081: 30170000 | H2081: -98845000 | I2081: -64250000 | J2081: -63022000 | K2081: -50151000 | L2081: -62269000 | M2081: -82929000 | N2081: =POWER(D2081/M2081,1/9)-1 -> 1.5743340833729746e-02 | O2081: =POWER(D2081/I2081,1/5)-1 -> 8.2375193075206798e-02
A2082: 1661.HK | B2082: 智美体育 | C2082: 0.15 | D2082: -95564523.599999994 | E2082: -85147859.900000006 | F2082: -58591100.5 | G2082: -52425721.5 | H2082: -508598835 | I2082: 52799159.200000003 | J2082: 121793853.2 | K2082: 103749633.75 | L2082: 59735107.649999999 | M2082: 346908712.60000002 | N2082: =POWER(D2082/M2082,1/9)-1 -> -1.8665364436688812 | O2082: =POWER(D2082/I2082,1/5)-1 -> -2.1259884572541203
A2083: 0132.HK | B2083: 兴业控股 | C2083: 0.14 | D2083: -95636000 | E2083: -21535000 | F2083: -15500000 | G2083: -83871000 | H2083: 68612000 | I2083: 42383000 | J2083: 31266000 | K2083: -4331000 | L2083: 5773000 | M2083: 81038000 | N2083: =POWER(D2083/M2083,1/9)-1 -> -2.0185738470485197 | O2083: =POWER(D2083/I2083,1/5)-1 -> -2.1767547007191244
A2084: 0360.HK | B2084: 新焦点 | C2084: 0.07 | D2084: -95720184 | E2084: -54716234.299999997 | F2084: -103831477.5 | G2084: -556316941.20000005 | H2084: -213563190 | I2084: 122778653.8 | J2084: -378210988.5 | K2084: -137193813.75 | L2084: -106981740.34999999 | M2084: -53937981.700000003 | N2084: =POWER(D2084/M2084,1/9)-1 -> 6.5807468664208724e-02 | O2084: =POWER(D2084/I2084,1/5)-1 -> -1.9514284451195669
A2085: 0419.HK | B2085: 华谊腾讯娱乐 | C2085: 0.07 | D2085: -97087000 | E2085: -269980000 | F2085: -110402000 | G2085: -56574000 | H2085: -28770000 | I2085: 73737000 | J2085: -103669000 | K2085: -139506000 | L2085: -493670000 | M2085: 55178000 | N2085: =POWER(D2085/M2085,1/9)-1 -> -2.0647952992418501 | O2085: =POWER(D2085/I2085,1/5)-1 -> -2.0565623321423874
A2086: 0296.HK | B2086: 英皇娱乐酒店 | C2086: 0.35 | D2086: -98192000 | E2086: -528317000 | F2086: -177576000 | G2086: 263915000 | H2086: 367492000 | I2086: 393574000 | J2086: 346490000 | K2086: 256224000 | L2086: 504277000 | M2086: 600006000 | N2086: =POWER(D2086/M2086,1/9)-1 -> -1.817820202630533 | O2086: =POWER(D2086/I2086,1/5)-1 -> -1.7575476251515201
A2087: 0366.HK | B2087: 陆氏集团(越南) | C2087: 0.80000000000000004 | D2087: -98241000 | E2087: 53494000 | F2087: 84669000 | G2087: 61511000 | H2087: 122280000 | I2087: 144128000 | J2087: 94417000 | K2087: 111974000 | L2087: 89580000 | M2087: 92526000 | N2087: =POWER(D2087/M2087,1/9)-1 -> -2.0066815512301943 | O2087: =POWER(D2087/I2087,1/5)-1 -> -1.9262087571772686
A2088: 0513.HK | B2088: 恒和集团 | C2088: 0.19 | D2088: -98286000 | E2088: 12142000 | F2088: 19885000 | G2088: -15341000 | H2088: 43679000 | I2088: 354759000 | J2088: 98306000 | K2088: -175666000 | L2088: 141571000 | M2088: 50580000 | N2088: =POWER(D2088/M2088,1/9)-1 -> -2.076606460852243 | O2088: =POWER(D2088/I2088,1/5)-1 -> -1.7735914261410246
A2089: 0261.HK | B2089: GBA 集团 | C2089: 0.35 | D2089: -98407000 | E2089: -175000000 | F2089: -60000000 | G2089: -123000000 | H2089: -168000000 | I2089: -88000000 | J2089: -198000000 | K2089: -150000000 | L2089: -74000000 | M2089: -53000000 | N2089: =POWER(D2089/M2089,1/9)-1 -> 7.1176718034499098e-02 | O2089: =POWER(D2089/I2089,1/5)-1 -> 2.260677105427078e-02
A2090: 7855.HK | B2090: Techstaracq-Z | C2090: 8.53 | D2090: -99849000 | E2090: -- | F2090: -- | G2090: -- | H2090: -- | I2090: -- | J2090: -- | K2090: -- | L2090: -- | M2090: -- | N2090: =POWER(D2090/M2090,1/9)-1 -> #VALUE! | O2090: =POWER(D2090/I2090,1/5)-1 -> #VALUE!
A2091: 2320.HK | B2091: 合丰集团 | C2091: 0.10000000000000001 | D2091: -100804000 | E2091: -192725000 | F2091: -422787000 | G2091: 1363000 | H2091: -7919000 | I2091: 30472000 | J2091: 137710000 | K2091: 76387000 | L2091: 36288000 | M2091: 389172000 | N2091: =POWER(D2091/M2091,1/9)-1 -> -1.8606273253740961 | O2091: =POWER(D2091/I2091,1/5)-1 -> -2.2703265096533265
A2092: 1027.HK | B2092: 中国集成控股 | C2092: 0.52 | D2092: -101673646.2 | E2092: -33203367.300000001 | F2092: -156404160.5 | G2092: -40896472.799999997 | H2092: -18156022.5 | I2092: 21291820 | J2092: 4232117 | K2092: 6805295 | L2092: 29670565.449999999 | M2092: 91306347.200000003 | N2092: =POWER(D2092/M2092,1/9)-1 -> -2.0120214426513394 | O2092: =POWER(D2092/I2092,1/5)-1 -> -2.367096345898613
A2093: 1005.HK | B2093: 美力时 | C2093: 0.5 | D2093: -102604000 | E2093: 6228000 | F2093: 55092000 | G2093: 10588000 | H2093: 143001000 | I2093: 134960000 | J2093: 112670000 | K2093: 122654000 | L2093: 387873000 | M2093: 117898000 | N2093: =POWER(D2093/M2093,1/9)-1 -> -1.9846804537913256 | O2093: =POWER(D2093/I2093,1/5)-1 -> -1.9466552428486135
A2094: 6609.HK | B2094: 心玮医疗-B | C2094: 15.08 | D2094: -103055954.40000001 | E2094: -226053190.40000001 | F2094: -237828512.5 | G2094: -254666121.59999999 | H2094: -- | I2094: -- | J2094: -- | K2094: -- | L2094: -- | M2094: -- | N2094: =POWER(D2094/M2094,1/9)-1 -> #VALUE! | O2094: =POWER(D2094/I2094,1/5)-1 -> #VALUE!
A2095: 2159.HK | B2095: 麦迪卫康 | C2095: 0.35 | D2095: -103148035.2 | E2095: -100628776.2 | F2095: 5687802.5 | G2095: 25079959.800000001 | H2095: 23302110 | I2095: 43313482.600000001 | J2095: 35555777.299999997 | K2095: 11652567.5 | L2095: -- | M2095: -- | N2095: =POWER(D2095/M2095,1/9)-1 -> #VALUE! | O2095: =POWER(D2095/I2095,1/5)-1 -> -2.1895085583783329
A2096: 1079.HK | B2096: 松景科技 | C2096: 0.04 | D2096: -103225000 | E2096: -64502340 | F2096: -19603908 | G2096: -134240477 | H2096: -302582196 | I2096: -64611810 | J2096: -37145706 | K2096: -49359577 | L2096: -50904100.5 | M2096: 6270154.5 | N2096: =POWER(D2096/M2096,1/9)-1 -> -2.3651092375175611 | O2096: =POWER(D2096/I2096,1/5)-1 -> 9.8233271800070021e-02
A2097: 0397.HK | B2097: 嬴集团 | C2097: 0.13 | D2097: -104059000 | E2097: -171280000 | F2097: 153759000 | G2097: 44190000 | H2097: -71651000 | I2097: -500918000 | J2097: -922661000 | K2097: -926717000 | L2097: -191838000 | M2097: 255398000 | N2097: =POWER(D2097/M2097,1/9)-1 -> -1.9050520843292786 | O2097: =POWER(D2097/I2097,1/5)-1 -> -0.26969781162041495
A2098: 0848.HK | B2098: 茂业国际 | C2098: 0.15 | D2098: -105357974.40000001 | E2098: 257311713.30000001 | F2098: 80431282.5 | G2098: -208148648.40000001 | H2098: 208147785 | I2098: 910200255.79999995 | J2098: 1285188429.7 | K2098: 51541997.5 | L2098: 351200283.35000002 | M2098: 1703619353.0999999 | N2098: =POWER(D2098/M2098,1/9)-1 -> -1.7340056915348916 | O2098: =POWER(D2098/I2098,1/5)-1 -> -1.6496898648365379
A2099: 1498.HK | B2099: 培力农本方 | C2099: 0.71 | D2099: -106081000 | E2099: -120214000 | F2099: -121877000 | G2099: 31710000 | H2099: -227258000 | I2099: 20806000 | J2099: 1889000 | K2099: 32162000 | L2099: 28458000 | M2099: 34463000 | N2099: =POWER(D2099/M2099,1/9)-1 -> -2.1330624212147185 | O2099: =POWER(D2099/I2099,1/5)-1 -> -2.3851276608887142
A2100: 1739.HK | B2100: 齐屹科技 | C2100: 0.25 | D2100: -106187797.8 | E2100: -142190236.40000001 | F2100: 90679123 | G2100: 48406634.700000003 | H2100: 69211245 | I2100: 862596528.39999998 | J2100: -988000302.10000002 | K2100: -445823498.75 | L2100: -405591419.80000001 | M2100: -- | N2100: =POWER(D2100/M2100,1/9)-1 -> #VALUE! | O2100: =POWER(D2100/I2100,1/5)-1 -> -1.6577386788493544
A2101: 8137.HK | B2101: 洪桥集团 | C2101: 0.20000000000000001 | D2101: -106519000 | E2101: -199156000 | F2101: 88500000 | G2101: 1156593000 | H2101: 415609000 | I2101: 974477000 | J2101: 676063000 | K2101: 700010000 | L2101: -1984984000 | M2101: -3241459000 | N2101: =POWER(D2101/M2101,1/9)-1 -> -0.3157931872444335 | O2101: =POWER(D2101/I2101,1/5)-1 -> -1.6422899069466892
A2102: 6922.HK | B2102: 康沣生物-B | C2102: 8.05 | D2102: -106864153.2 | E2102: -126597638.2 | F2102: -124743488.5 | G2102: -163391611.5 | H2102: -- | I2102: -- | J2102: -- | K2102: -- | L2102: -- | M2102: -- | N2102: =POWER(D2102/M2102,1/9)-1 -> #VALUE! | O2102: =POWER(D2102/I2102,1/5)-1 -> #VALUE!
A2103: 0051.HK | B2103: 海港企业 | C2103: 5.42 | D2103: -107000000 | E2103: -197000000 | F2103: -24000000 | G2103: -1119000000 | H2103: 117000000 | I2103: 831000000 | J2103: 1320000000 | K2103: 692000000 | L2103: 1231000000 | M2103: 1082000000 | N2103: =POWER(D2103/M2103,1/9)-1 -> -1.7733048323977143 | O2103: =POWER(D2103/I2103,1/5)-1 -> -1.6636766691990825
A2104: 6918.HK | B2104: 奇士达 | C2104: 0.15 | D2104: -107421022.8 | E2104: -86477889.799999997 | F2104: 31942307 | G2104: 28776041.699999999 | H2104: 39609787.5 | I2104: 37315337.799999997 | J2104: 43264704.299999997 | K2104: 37165756.25 | L2104: -- | M2104: -- | N2104: =POWER(D2104/M2104,1/9)-1 -> #VALUE! | O2104: =POWER(D2104/I2104,1/5)-1 -> -2.2354932617253098
A2105: 8158.HK | B2105: 中国再生医学 | C2105: 0.16 | D2105: -107699000 | E2105: 4555000 | F2105: 13348000 | G2105: -404226000 | H2105: -395006000 | I2105: -1193501000 | J2105: -184502000 | K2105: -190902000 | L2105: -250098000 | M2105: -263442000 | N2105: =POWER(D2105/M2105,1/9)-1 -> -9.4608745619780832e-02 | O2105: =POWER(D2105/I2105,1/5)-1 -> -0.38187291092637587
A2106: 1080.HK | B2106: 胜利管道 | C2106: 0.03 | D2106: -107881426.8 | E2106: -37231812.399999999 | F2106: -319250415.5 | G2106: -387834724.80000001 | H2106: -154855327.5 | I2106: -61610784.600000001 | J2106: -300721285.89999998 | K2106: -233910346.25 | L2106: -355319986.5 | M2106: -273509730.39999998 | N2106: =POWER(D2106/M2106,1/9)-1 -> -9.8204194123086896e-02 | O2106: =POWER(D2106/I2106,1/5)-1 -> 0.11855666114629426
A2107: 8308.HK | B2107: 古兜控股 | C2107: 0.11 | D2107: -108007489.8 | E2107: -- | F2107: -84429275 | G2107: 3410025.8999999999 | H2107: 27506145 | I2107: 17728002 | J2107: 62848735.799999997 | K2107: -51836478.75 | L2107: -18219366.600000001 | M2107: 72423124.400000006 | N2107: =POWER(D2107/M2107,1/9)-1 -> -2.0454091348455092 | O2107: =POWER(D2107/I2107,1/5)-1 -> -2.4353533133033682
A2108: 1049.HK | B2108: 时富投资 | C2108: 1.13 | D2108: -108009000 | E2108: -33641000 | F2108: -43050000 | G2108: 39985000 | H2108: -99392000 | I2108: -202415000 | J2108: 45482000 | K2108: -31139000 | L2108: 15229000 | M2108: 2422000 | N2108: =POWER(D2108/M2108,1/9)-1 -> -2.5249442912968165 | O2108: =POWER(D2108/I2108,1/5)-1 -> -0.11805104400423894
A2109: 2239.HK | B2109: 国微控股 | C2109: 0.76 | D2109: -108547404.90000001 | E2109: 446515908.61000001 | F2109: 76764868.849999994 | G2109: -28745425.960000001 | H2109: 82558879.75 | I2109: 10323128.16 | J2109: 86726554.549999997 | K2109: 58159543.840000004 | L2109: 25752617.350000001 | M2109: 42346394.939999998 | N2109: =POWER(D2109/M2109,1/9)-1 -> -2.1102545347984378 | O2109: =POWER(D2109/I2109,1/5)-1 -> -2.6008904916977253
A2110: 0122.HK | B2110: 鳄鱼恤 | C2110: 0.10000000000000001 | D2110: -108786000 | E2110: -78385000 | F2110: -1933000 | G2110: -290483000 | H2110: 30607000 | I2110: 162493000 | J2110: 88118000 | K2110: 455000 | L2110: 51145000 | M2110: 106032000 | N2110: =POWER(D2110/M2110,1/9)-1 -> -2.0028531418533633 | O2110: =POWER(D2110/I2110,1/5)-1 -> -1.922885176371129
A2111: 1740.HK | B2111: 新石文化 | C2111: 0.11 | D2111: -109010512.8 | E2111: -159612612.80000001 | F2111: -46494265 | G2111: 1461269.3999999999 | H2111: 27749760 | I2111: 73420343.799999997 | J2111: 8021839.9000000004 | K2111: 36452333.75 | L2111: -- | M2111: -- | N2111: =POWER(D2111/M2111,1/9)-1 -> #VALUE! | O2111: =POWER(D2111/I2111,1/5)-1 -> -2.0822569757470024
A2112: 1206.HK | B2112: 同方泰德 | C2112: 0.27 | D2112: -110676736.8 | E2112: 62188768.700000003 | F2112: 55478421.5 | G2112: 155663331.90000001 | H2112: 126127755 | I2112: 297362469 | J2112: 310944306.19999999 | K2112: 260173628.75 | L2112: 916047689.95000005 | M2112: 1431059560 | N2112: =POWER(D2112/M2112,1/9)-1 -> -1.7524692160709914 | O2112: =POWER(D2112/I2112,1/5)-1 -> -1.8206425635149142
A2113: 2349.HK | B2113: 中国城市基础设施 | C2113: 0.05 | D2113: -111332000 | E2113: -114216000 | F2113: -167111000 | G2113: -85341000 | H2113: -175938000 | I2113: -174883000 | J2113: -286915000 | K2113: -451854000 | L2113: -179294000 | M2113: 32070000 | N2113: =POWER(D2113/M2113,1/9)-1 -> -2.1483066887756079 | O2113: =POWER(D2113/I2113,1/5)-1 -> -8.6361308277439042e-02
A2114: 1559.HK | B2114: 均安控股 | C2114: 0.13 | D2114: -111719000 | E2114: -67965000 | F2114: -24405000 | G2114: 16223000 | H2114: 24271000 | I2114: 27075000 | J2114: 33344000 | K2114: 27003000 | L2114: 17410000 | M2114: 20043000 | N2114: =POWER(D2114/M2114,1/9)-1 -> -2.2103393299581184 | O2114: =POWER(D2114/I2114,1/5)-1 -> -2.3277359513106926
A2115: 2325.HK | B2115: 云康集团 | C2115: 8.86 | D2115: -112096315.8 | E2115: 425642282.89999998 | F2115: 466451234 | G2115: 304332594.60000002 | H2115: -- | I2115: -- | J2115: -- | K2115: -- | L2115: -- | M2115: -- | N2115: =POWER(D2115/M2115,1/9)-1 -> #VALUE! | O2115: =POWER(D2115/I2115,1/5)-1 -> #VALUE!
A2116: 8021.HK | B2116: 汇隆控股 | C2116: 0.02 | D2116: -112384000 | E2116: -10818000 | F2116: -16903000 | G2116: -108888000 | H2116: -51898000 | I2116: -109788000 | J2116: -15954000 | K2116: -18197000 | L2116: -9655000 | M2116: -61275000 | N2116: =POWER(D2116/M2116,1/9)-1 -> 6.9717297330155636e-02 | O2116: =POWER(D2116/I2116,1/5)-1 -> 4.6850095169379546e-03
A2117: 6128.HK | B2117: 烯石电车新材料 | C2117: 0.10000000000000001 | D2117: -113168000 | E2117: -69663000 | F2117: -53546000 | G2117: -91696000 | H2117: -57082000 | I2117: -36039000 | J2117: -57313000 | K2117: -9365000 | L2117: 23527000 | M2117: 28020000 | N2117: =POWER(D2117/M2117,1/9)-1 -> -2.1677818561074886 | O2117: =POWER(D2117/I2117,1/5)-1 -> 0.2571589217063559
A2118: 6933.HK | B2118: 新娱科控股 | C2118: 0.20000000000000001 | D2118: -113322963.59999999 | E2118: -110017952.5 | F2118: -3612275 | G2118: 67086091.5 | H2118: 56433750 | I2118: 44850592.600000001 | J2118: 37710200.600000001 | K2118: 2959258.75 | L2118: -- | M2118: -- | N2118: =POWER(D2118/M2118,1/9)-1 -> #VALUE! | O2118: =POWER(D2118/I2118,1/5)-1 -> -2.2036769598958621
A2119: 8005.HK | B2119: 裕兴科技 | C2119: 0.15 | D2119: -113654000 | E2119: -290118000 | F2119: -172495000 | G2119: 21914000 | H2119: 41484000 | I2119: -397896000 | J2119: 94192000 | K2119: 54016000 | L2119: -188155000 | M2119: 31012000 | N2119: =POWER(D2119/M2119,1/9)-1 -> -2.1552414745669064 | O2119: =POWER(D2119/I2119,1/5)-1 -> -0.22167132597606187
A2120: 2211.HK | B2120: 大健康国际 | C2120: 0.08 | D2120: -113660124.8 | E2120: -219809695.80000001 | F2120: -812501388 | G2120: -538653590.75 | H2120: -301927202.85000002 | I2120: -- | J2120: -- | K2120: -97579973.75 | L2120: 36649246.149999999 | M2120: 589912279.60000002 | N2120: =POWER(D2120/M2120,1/9)-1 -> -1.8327902509125913 | O2120: =POWER(D2120/I2120,1/5)-1 -> #VALUE!
A2121: 2012.HK | B2121: 阳光油砂 | C2121: 0.55 | D2121: -113921355 | E2121: -376950190.5 | F2121: 8980716 | G2121: 13557380 | H2121: -481110172 | I2121: -730036506 | J2121: -1752273884 | K2121: -423255285 | L2121: -2267654772.5 | M2121: -178803560 | N2121: =POWER(D2121/M2121,1/9)-1 -> -4.8852951692782698e-02 | O2121: =POWER(D2121/I2121,1/5)-1 -> -0.31031288436978688
A2122: 1262.HK | B2122: 蜡笔小新食品 | C2122: 1.26 | D2122: -114831334.8 | E2122: -84977516.799999997 | F2122: -79842298 | G2122: -35045435.700000003 | H2122: -190097925 | I2122: -204485728.40000001 | J2122: -346967654.5 | K2122: -668601342.5 | L2122: -397764807.05000001 | M2122: 13869160.6 | N2122: =POWER(D2122/M2122,1/9)-1 -> -2.2647396595533529 | O2122: =POWER(D2122/I2122,1/5)-1 -> -0.10899635221274839
A2123: 8029.HK | B2123: 帝国金融集团 | C2123: 0.07 | D2123: -117622000 | E2123: -106163000 | F2123: -61928000 | G2123: -60485000 | H2123: -105538000 | I2123: -60735000 | J2123: -85358958 | K2123: -115695395 | L2123: -427905297 | M2123: -338869482 | N2123: =POWER(D2123/M2123,1/9)-1 -> -0.11092260823165601 | O2123: =POWER(D2123/I2123,1/5)-1 -> 0.14132650968444294
A2124: 0933.HK | B2124: 非凡领越 | C2124: 0.67 | D2124: -118990000 | E2124: 850416000 | F2124: 4562639000 | G2124: 1192392000 | H2124: -- | I2124: -- | J2124: -- | K2124: -- | L2124: -- | M2124: -- | N2124: =POWER(D2124/M2124,1/9)-1 -> #VALUE! | O2124: =POWER(D2124/I2124,1/5)-1 -> #VALUE!
A2125: 0527.HK | B2125: 瑞风新能源 | C2125: 0.39 | D2125: -119436471 | E2125: -174232788.80000001 | F2125: -451298046.5 | G2125: -253886619 | H2125: -116084782.5 | I2125: -73111783.200000003 | J2125: -8500201 | K2125: -42468641.25 | L2125: -99316246.450000003 | M2125: -188217013.30000001 | N2125: =POWER(D2125/M2125,1/9)-1 -> -4.927892634304698e-02 | O2125: =POWER(D2125/I2125,1/5)-1 -> 0.10313818335557756
A2126: 3680.HK | B2126: 瑞和数智 | C2126: 1 | D2126: -119741214.59999999 | E2126: -144613395.19999999 | F2126: -93353431 | G2126: -15623425.199999999 | H2126: 4608570 | I2126: 26365421.600000001 | J2126: 24895158.5 | K2126: 15081885 | L2126: -- | M2126: -- | N2126: =POWER(D2126/M2126,1/9)-1 -> #VALUE! | O2126: =POWER(D2126/I2126,1/5)-1 -> -2.3534486640660099
A2127: 2125.HK | B2127: 稻草熊娱乐 | C2127: 0.46 | D2127: -119822333.40000001 | E2127: 57457517.299999997 | F2127: 207245400.5 | G2127: 21966717 | H2127: 55910760 | I2127: 14157352.4 | J2127: 72612577.400000006 | K2127: -- | L2127: -- | M2127: -- | N2127: =POWER(D2127/M2127,1/9)-1 -> #VALUE! | O2127: =POWER(D2127/I2127,1/5)-1 -> -2.5328905470474616
A2128: 2459.HK | B2128: 升能集团 | C2128: 21 | D2128: -120883036 | E2128: 58528768 | F2128: 34217624 | G2128: 32454058 | H2128: -- | I2128: -- | J2128: -- | K2128: -- | L2128: -- | M2128: -- | N2128: =POWER(D2128/M2128,1/9)-1 -> #VALUE! | O2128: =POWER(D2128/I2128,1/5)-1 -> #VALUE!
A2129: 2448.HK | B2129: 恒宇集团 | C2129: 0.09 | D2129: -122579612.09999999 | E2129: 20859223.379999999 | F2129: 50315534.170000002 | G2129: 38248543.829999998 | H2129: 60150485.659999996 | I2129: 59806796.340000004 | J2129: 83701942.060000002 | K2129: 61950485.670000002 | L2129: 44430097.25 | M2129: 12175728.199999999 | N2129: =POWER(D2129/M2129,1/9)-1 -> -2.2925159823950008 | O2129: =POWER(D2129/I2129,1/5)-1 -> -2.1543394568935952
A2130: 8391.HK | B2130: 基石科技控股 | C2130: 0.53 | D2130: -124186000 | E2130: -160311000 | F2130: -61364000 | G2130: -16330000 | H2130: -7736000 | I2130: -8789000 | J2130: 1900000 | K2130: 1816000 | L2130: -- | M2130: -- | N2130: =POWER(D2130/M2130,1/9)-1 -> #VALUE! | O2130: =POWER(D2130/I2130,1/5)-1 -> 0.69834780730951884
A2131: 6118.HK | B2131: 奥星生命科技 | C2131: 0.66 | D2131: -124389102.59999999 | E2131: 98664754.099999994 | F2131: 339553850 | G2131: 39451890 | H2131: 9041692.5 | I2131: 121830.2 | J2131: -64842506.5 | K2131: -20747037.5 | L2131: 7507903.2000000002 | M2131: 81354344.700000003 | N2131: =POWER(D2131/M2131,1/9)-1 -> -2.0483083977045684 | O2131: =POWER(D2131/I2131,1/5)-1 -> -4.9976565093022156
A2132: 3963.HK | B2132: 融众金融 | C2132: 0.26 | D2132: -124609000 | E2132: -567548000 | F2132: -121383000 | G2132: -65726000 | H2132: -91410000 | I2132: -352522000 | J2132: -277160000 | K2132: 51594000 | L2132: 65563164 | M2132: 70247863 | N2132: =POWER(D2132/M2132,1/9)-1 -> -2.0657549684307339 | O2132: =POWER(D2132/I2132,1/5)-1 -> -0.18778194916093349
A2133: 3395.HK | B2133: 吉星新能源 | C2133: 0.18 | D2133: -124624917.53 | E2133: -20629416.579999998 | F2133: -29458800.690000001 | G2133: -132963919.16 | H2133: -301081552.04000002 | I2133: -41845981.560000002 | J2133: -72345935.859999999 | K2133: -13197089.390000001 | L2133: -13875516.77 | M2133: 20051710.039999999 | N2133: =POWER(D2133/M2133,1/9)-1 -> -2.2250716689074119 | O2133: =POWER(D2133/I2133,1/5)-1 -> 0.24391362528603899
A2134: 0373.HK | B2134: 联合集团 | C2134: 1.49 | D2134: -125400000 | E2134: -1220500000 | F2134: 6688900000 | G2134: 2037100000 | H2134: 2530700000 | I2134: 1698300000 | J2134: 3235900000 | K2134: 3263200000 | L2134: 2983200000 | M2134: 1655700000 | N2134: =POWER(D2134/M2134,1/9)-1 -> -1.750722691394329 | O2134: =POWER(D2134/I2134,1/5)-1 -> -1.5938224676497317
A2135: 0197.HK | B2135: 亨泰 | C2135: 0.24 | D2135: -125596000 | E2135: -216128000 | F2135: -247213000 | G2135: -318339000 | H2135: -285081000 | I2135: -153475000 | J2135: -405546000 | K2135: -248731000 | L2135: -73241000 | M2135: -681635000 | N2135: =POWER(D2135/M2135,1/9)-1 -> -0.17133225213923109 | O2135: =POWER(D2135/I2135,1/5)-1 -> -3.9300348366690052e-02
A2136: 0456.HK | B2136: 新城市建设发展 | C2136: 0.39 | D2136: -125946000 | E2136: -76228000 | F2136: -64419000 | G2136: -27950000 | H2136: -1075000 | I2136: 13753000 | J2136: 23274000 | K2136: 1294000 | L2136: 3715000 | M2136: 32964000 | N2136: =POWER(D2136/M2136,1/9)-1 -> -2.1606004090199429 | O2136: =POWER(D2136/I2136,1/5)-1 -> -2.5572465851933028
A2137: 0482.HK | B2137: 圣马丁国际 | C2137: 0.15 | D2137: -126566000 | E2137: -77548000 | F2137: -25433000 | G2137: -12594000 | H2137: -315461000 | I2137: -187435000 | J2137: -105798000 | K2137: -77655000 | L2137: -103162000 | M2137: -101432000 | N2137: =POWER(D2137/M2137,1/9)-1 -> 2.490226233434778e-02 | O2137: =POWER(D2137/I2137,1/5)-1 -> -7.5529041163145627e-02
A2138: 2297.HK | B2138: 润迈德-B | C2138: 0.17 | D2138: -126972846 | E2138: -1518380860.3 | F2138: -775898302.5 | G2138: -173111556 | H2138: -- | I2138: -- | J2138: -- | K2138: -- | L2138: -- | M2138: -- | N2138: =POWER(D2138/M2138,1/9)-1 -> #VALUE! | O2138: =POWER(D2138/I2138,1/5)-1 -> #VALUE!
A2139: 1873.HK | B2139: 维亚生物 | C2139: 0.5 | D2139: -127283070.59999999 | E2139: -596172647.5 | F2139: 352100077 | G2139: -461122272 | H2139: 297111960 | I2139: 103100230 | J2139: 91428114 | K2139: 27195621.25 | L2139: 22259098.350000001 | M2139: -- | N2139: =POWER(D2139/M2139,1/9)-1 -> #VALUE! | O2139: =POWER(D2139/I2139,1/5)-1 -> -2.0430429738506515
A2140: 3638.HK | B2140: 华邦科技 | C2140: 0.54 | D2140: -127605000 | E2140: -241018000 | F2140: -93108000 | G2140: 5607000 | H2140: -34717000 | I2140: 9211000 | J2140: 5389000 | K2140: 23448000 | L2140: 25347000 | M2140: 16790000 | N2140: =POWER(D2140/M2140,1/9)-1 -> -2.2527619527239473 | O2140: =POWER(D2140/I2140,1/5)-1 -> -2.6916565003865545
A2141: 0776.HK | B2141: 帝国科技集团 | C2141: 1.48 | D2141: -127733000 | E2141: -180883917 | F2141: -99031460 | G2141: -80214996 | H2141: -77936393 | I2141: -34901161 | J2141: -9112762 | K2141: -16602345 | L2141: -10377250 | M2141: -8081467 | N2141: =POWER(D2141/M2141,1/9)-1 -> 0.3589436050622592 | O2141: =POWER(D2141/I2141,1/5)-1 -> 0.29626157553388888
A2142: 0731.HK | B2142: 建发新胜 | C2142: 0.16 | D2142: -128798000 | E2142: 2558902000 | F2142: -3768764000 | G2142: -550566000 | H2142: 119677000 | I2142: 196755000 | J2142: 84714000 | K2142: 46675000 | L2142: 1717000 | M2142: 1981000 | N2142: =POWER(D2142/M2142,1/9)-1 -> -2.5901832795794113 | O2142: =POWER(D2142/I2142,1/5)-1 -> -1.9187485535100435
A2143: 0158.HK | B2143: 万邦投资 | C2143: 69.099999999999994 | D2143: -129165000 | E2143: -127390000 | F2143: 66863000 | G2143: -1185438000 | H2143: -548848000 | I2143: 2298582000 | J2143: 1515427000 | K2143: 281485000 | L2143: 560644000 | M2143: 11724000 | N2143: =POWER(D2143/M2143,1/9)-1 -> -2.3055257695992193 | O2143: =POWER(D2143/I2143,1/5)-1 -> -1.5622597166050129
A2144: 0108.HK | B2144: 国锐生活 | C2144: 0.46 | D2144: -129307000 | E2144: -320126000 | F2144: 207625000 | G2144: 552000 | H2144: 98599000 | I2144: 9579000 | J2144: -65014000 | K2144: -62798000 | L2144: -18152360 | M2144: -33490700 | N2144: =POWER(D2144/M2144,1/9)-1 -> 0.16195322498779663 | O2144: =POWER(D2144/I2144,1/5)-1 -> -2.682907990728252
A2145: 0306.HK | B2145: 冠忠巴士集团 | C2145: 1.51 | D2145: -130713000 | E2145: -139935000 | F2145: -46891000 | G2145: 20170000 | H2145: 253635000 | I2145: 275694000 | J2145: 363909000 | K2145: 282472000 | L2145: 382971000 | M2145: 165035000 | N2145: =POWER(D2145/M2145,1/9)-1 -> -1.974426736357469 | O2145: =POWER(D2145/I2145,1/5)-1 -> -1.8613472937369129
A2146: 6955.HK | B2146: 博安生物 | C2146: 9.04 | D2146: -130861067.40000001 | E2146: -374246046.89999998 | F2146: -276023116.5 | G2146: -286697242.19999999 | H2146: -- | I2146: -- | J2146: -- | K2146: -- | L2146: -- | M2146: -- | N2146: =POWER(D2146/M2146,1/9)-1 -> #VALUE! | O2146: =POWER(D2146/I2146,1/5)-1 -> #VALUE!
A2147: 0532.HK | B2147: WKK Intl (Hold) | C2147: 0.45 | D2147: -132784000 | E2147: 71763000 | F2147: 72013000 | G2147: 101185000 | H2147: 64383000 | I2147: 82106000 | J2147: 111471000 | K2147: 45164000 | L2147: 47037000 | M2147: 66639000 | N2147: =POWER(D2147/M2147,1/9)-1 -> -2.0796141952327662 | O2147: =POWER(D2147/I2147,1/5)-1 -> -2.1009159669064563
A2148: 0139.HK | B2148: 中达集团控股 | C2148: 0.02 | D2148: -132864000 | E2148: -106759000 | F2148: -371266000 | G2148: 27758000 | H2148: 208387000 | I2148: -67061000 | J2148: -156397000 | K2148: -1252637000 | L2148: -1266154000 | M2148: 5404000 | N2148: =POWER(D2148/M2148,1/9)-1 -> -2.4273199347122851 | O2148: =POWER(D2148/I2148,1/5)-1 -> 0.14653537675217976
A2149: 2307.HK | B2149: 锦兴国际控股 | C2149: 0.16 | D2149: -132908000 | E2149: -57958000 | F2149: 45986000 | G2149: -37298000 | H2149: 60091000 | I2149: 72826000 | J2149: 64575000 | K2149: 74995000 | L2149: 58256000 | M2149: 81055000 | N2149: =POWER(D2149/M2149,1/9)-1 -> -2.0564853500015814 | O2149: =POWER(D2149/I2149,1/5)-1 -> -2.1278541274183507
A2150: 3683.HK | B2150: 荣丰亿控股 | C2150: 0.11 | D2150: -134214236 | E2150: 193597982 | F2150: -25330950 | G2150: -79170795 | H2150: 79196410 | I2150: -21749579 | J2150: -170023140 | K2150: -318436245 | L2150: -290083530 | M2150: -51285978 | N2150: =POWER(D2150/M2150,1/9)-1 -> 0.11281306475220032 | O2150: =POWER(D2150/I2150,1/5)-1 -> 0.43902899868538103
A2151: 0348.HK | B2151: 中国智能健康 | C2151: 0.06 | D2151: -134558000 | E2151: -54274000 | F2151: -103046000 | G2151: -25222000 | H2151: -95316000 | I2151: -186103000 | J2151: -241937000 | K2151: -81324000 | L2151: 17037000 | M2151: 5287000 | N2151: =POWER(D2151/M2151,1/9)-1 -> -2.4328110182303551 | O2151: =POWER(D2151/I2151,1/5)-1 -> -6.2802266012847219e-02
A2152: 2235.HK | B2152: 微泰医疗-B | C2152: 3.7000000000000002 | D2152: -137042397.72 | E2152: -39532008.299999997 | F2152: -58963348.5 | G2152: -144230627.09999999 | H2152: -- | I2152: -- | J2152: -- | K2152: -- | L2152: -- | M2152: -- | N2152: =POWER(D2152/M2152,1/9)-1 -> #VALUE! | O2152: =POWER(D2152/I2152,1/5)-1 -> #VALUE!
A2153: 1026.HK | B2153: 环球实业科技 | C2153: 0.16 | D2153: -137336000 | E2153: -104068000 | F2153: -39102000 | G2153: -36337000 | H2153: -116634000 | I2153: -26805000 | J2153: 2660000 | K2153: -25171000 | L2153: -44412000 | M2153: 32694000 | N2153: =POWER(D2153/M2153,1/9)-1 -> -2.1728902352873778 | O2153: =POWER(D2153/I2153,1/5)-1 -> 0.38648034243126816
A2154: 1156.HK | B2154: Chinanewenergy | C2154: 0.12 | D2154: -138772342.80000001 | E2154: -56997252.5 | F2154: 10311514.5 | G2154: 52877451.600000001 | H2154: 66120240 | I2154: 52171790.600000001 | J2154: 54740575.100000001 | K2154: 11338083.75 | L2154: -- | M2154: -- | N2154: =POWER(D2154/M2154,1/9)-1 -> #VALUE! | O2154: =POWER(D2154/I2154,1/5)-1 -> -2.2161116125882701
A2155: 0619.HK | B2155: 南华金融 | C2155: 0.27 | D2155: -138898000 | E2155: -151122000 | F2155: -77234000 | G2155: -268229000 | H2155: -77565000 | I2155: -239750000 | J2155: 52539000 | K2155: -56703000 | L2155: -14842000 | M2155: -72893000 | N2155: =POWER(D2155/M2155,1/9)-1 -> 7.4267014499594941e-02 | O2155: =POWER(D2155/I2155,1/5)-1 -> -0.10342324434975025
A2156: 0613.HK | B2156: 梧桐国际 | C2156: 0.29999999999999999 | D2156: -140145000 | E2156: -17172000 | F2156: -22153000 | G2156: 41762000 | H2156: 22312000 | I2156: 109180000 | J2156: 127505000 | K2156: 21848000 | L2156: 161829000 | M2156: 295547000 | N2156: =POWER(D2156/M2156,1/9)-1 -> -1.9204380451776155 | O2156: =POWER(D2156/I2156,1/5)-1 -> -2.0512037550651616
A2157: 2436.HK | B2157: 凌雄科技 | C2157: 4.75 | D2157: -143895981.59999999 | E2157: 112751338.8 | F2157: -549435599 | G2157: -211326253.80000001 | H2157: -- | I2157: -- | J2157: -- | K2157: -- | L2157: -- | M2157: -- | N2157: =POWER(D2157/M2157,1/9)-1 -> #VALUE! | O2157: =POWER(D2157/I2157,1/5)-1 -> #VALUE!
A2158: 0707.HK | B2158: 亚洲电视控股 | C2158: 0.21 | D2158: -145118244.59999999 | E2158: -208038561.5 | F2158: -319184292.5 | G2158: -206342919.90000001 | H2158: -623062125 | I2158: -911483458 | J2158: -151956978.30000001 | K2158: 32445166.25 | L2158: -8114745 | M2158: 25908899.800000001 | N2158: =POWER(D2158/M2158,1/9)-1 -> -2.2109924888167973 | O2158: =POWER(D2158/I2158,1/5)-1 -> -0.30754007397414962
A2159: 2251.HK | B2159: 鹰瞳科技-B | C2159: 12.36 | D2159: -145282674.59999999 | E2159: -203061384.30000001 | F2159: -174655333 | G2159: -95428281.599999994 | H2159: -- | I2159: -- | J2159: -- | K2159: -- | L2159: -- | M2159: -- | N2159: =POWER(D2159/M2159,1/9)-1 -> #VALUE! | O2159: =POWER(D2159/I2159,1/5)-1 -> #VALUE!
A2160: 2898.HK | B2160: 盛禾生物-B | C2160: 5.7999999999999998 | D2160: -145466836.19999999 | E2160: -- | F2160: -- | G2160: -- | H2160: -36920000 | I2160: -33902000 | J2160: -32431000 | K2160: 2414000 | L2160: -203877000 | M2160: 14908000 | N2160: =POWER(D2160/M2160,1/9)-1 -> -2.2880335599896462 | O2160: =POWER(D2160/I2160,1/5)-1 -> 0.33815904747939629
A2161: 0156.HK | B2161: 力宝华润 | C2161: 0.69 | D2161: -146420000 | E2161: -277890000 | F2161: 48665000 | G2161: -361035000 | H2161: -78233000 | I2161: -122352000 | J2161: 387785000 | K2161: -309172000 | L2161: 399176000 | M2161: 124389000 | N2161: =POWER(D2161/M2161,1/9)-1 -> -2.0182835173074234 | O2161: =POWER(D2161/I2161,1/5)-1 -> 3.6568163196004422e-02
A2162: 0199.HK | B2162: 德祥地产 | C2162: 0.41 | D2162: -146913000 | E2162: 566164000 | F2162: -662160000 | G2162: -971000000 | H2162: 140583000 | I2162: 182488000 | J2162: 303238000 | K2162: 1460094000 | L2162: 803550000 | M2162: 386853000 | N2162: =POWER(D2162/M2162,1/9)-1 -> -1.898006255594537 | O2162: =POWER(D2162/I2162,1/5)-1 -> -1.9575582076273825
A2163: 1965.HK | B2163: 朗诗绿色生活 | C2163: 0.21 | D2163: -147146214.59999999 | E2163: 32060602 | F2163: 71426309.5 | G2163: 78140964 | H2163: -- | I2163: -- | J2163: -- | K2163: -- | L2163: -- | M2163: -- | N2163: =POWER(D2163/M2163,1/9)-1 -> #VALUE! | O2163: =POWER(D2163/I2163,1/5)-1 -> #VALUE!
A2164: 2088.HK | B2164: 西王置业 | C2164: 0.04 | D2164: -147375320.40000001 | E2164: -8271229.2000000002 | F2164: 9508242.5 | G2164: -13256311.800000001 | H2164: -58111117.5 | I2164: 54538940 | J2164: -9462917.6999999993 | K2164: -15209678.75 | L2164: -17741890.300000001 | M2164: -101017505 | N2164: =POWER(D2164/M2164,1/9)-1 -> 4.2858408464051978e-02 | O2164: =POWER(D2164/I2164,1/5)-1 -> -2.2199544453730407
A2165: 1980.HK | B2165: 天鸽互动 | C2165: 0.5 | D2165: -147625254 | E2165: -600875696.39999998 | F2165: 157749886 | G2165: 96087402.299999997 | H2165: 104859495 | I2165: 248529053.59999999 | J2165: 388562291.10000002 | K2165: 259157946.25 | L2165: 178514981.59999999 | M2165: -134152993.7 | N2165: =POWER(D2165/M2165,1/9)-1 -> 1.0689630441752973e-02 | O2165: =POWER(D2165/I2165,1/5)-1 -> -1.9010661984265464
A2166: 1068.HK | B2166: 雨润食品 | C2166: 0.15 | D2166: -147641000 | E2166: -15037000 | F2166: 3060499000 | G2166: -2019264000 | H2166: -3940484000 | I2166: -4758804000 | J2166: -1915101000 | K2166: -2341865000 | L2166: -2976405000 | M2166: 56774000 | N2166: =POWER(D2166/M2166,1/9)-1 -> -2.1120325467968808 | O2166: =POWER(D2166/I2166,1/5)-1 -> -0.5007226873171664
A2167: 1610.HK | B2167: 中粮家佳康 | C2167: 1.62 | D2167: -148731319.80000001 | E2167: 402363939.39999998 | F2167: -562898976.5 | G2167: 4761788295.6000004 | H2167: 1758639922.5 | I2167: -714661646.20000005 | J2167: 541458008.10000002 | K2167: 1057812210 | L2167: 177470649.19999999 | M2167: -480684840.5 | N2167: =POWER(D2167/M2167,1/9)-1 -> -0.12220408343671818 | O2167: =POWER(D2167/I2167,1/5)-1 -> -0.26943242770991704
A2168: 2324.HK | B2168: 首都创投 | C2168: 0.14 | D2168: -149059636 | E2168: -88125550 | F2168: 62724232 | G2168: -105482955 | H2168: -183559559 | I2168: -244421994 | J2168: -588017532 | K2168: -207005629 | L2168: -- | M2168: 72565143 | N2168: =POWER(D2168/M2168,1/9)-1 -> -2.0832704315120614 | O2168: =POWER(D2168/I2168,1/5)-1 -> -9.4175725735495153e-02
A2169: 0357.HK | B2169: 美兰空港 | C2169: 7.84 | D2169: -149092952.88999999 | E2169: -175192678.94 | F2169: 936903611.13999999 | G2169: -1597594328.4200001 | H2169: 643023519.03999996 | I2169: 708256252.64999998 | J2169: 580795316.22000003 | K2169: 436657033.08999997 | L2169: 516016796.83999997 | M2169: 416634542.32999998 | N2169: =POWER(D2169/M2169,1/9)-1 -> -1.8920954326230497 | O2169: =POWER(D2169/I2169,1/5)-1 -> -1.7322398153117629
A2170: 0747.HK | B2170: 沈阳公用发展股份 | C2170: 0.05 | D2170: -150353695.80000001 | E2170: -82939040.099999994 | F2170: -28819832 | G2170: -47295783.899999999 | H2170: -99512257.5 | I2170: -158510199 | J2170: -39362284.799999997 | K2170: 2610326.25 | L2170: -3261186.6499999999 | M2170: 54983721.899999999 | N2170: =POWER(D2170/M2170,1/9)-1 -> -2.1182585291108822 | O2170: =POWER(D2170/I2170,1/5)-1 -> -1.0510068726746757e-02
A2171: 0166.HK | B2171: 新时代能源 | C2171: 0.07 | D2171: -150500000 | E2171: 285905000 | F2171: 329401000 | G2171: -79483000 | H2171: -2290086000 | I2171: -257218000 | J2171: 101710000 | K2171: -123349000 | L2171: -1666254000 | M2171: -120448000 | N2171: =POWER(D2171/M2171,1/9)-1 -> 2.505824971191184e-02 | O2171: =POWER(D2171/I2171,1/5)-1 -> -0.10164698731639132
A2172: 6820.HK | B2172: 友谊时光 | C2172: 0.59999999999999998 | D2172: -151407144 | E2172: 28327719.100000001 | F2172: 337328933.5 | G2172: 600144296.10000002 | H2172: 464351422.5 | I2172: 383309690 | J2172: 141442625.30000001 | K2172: 90419078.75 | L2172: -- | M2172: -- | N2172: =POWER(D2172/M2172,1/9)-1 -> #VALUE! | O2172: =POWER(D2172/I2172,1/5)-1 -> -1.8304611373743618
A2173: 0572.HK | B2173: 未来世界控股 | C2173: 0.61 | D2173: -151730000 | E2173: -7021000 | F2173: -7637000 | G2173: -38003000 | H2173: -53991000 | I2173: -79839000 | J2173: 481840000 | K2173: 97451000 | L2173: -47620000 | M2173: 2715000 | N2173: =POWER(D2173/M2173,1/9)-1 -> -2.5636682748200164 | O2173: =POWER(D2173/I2173,1/5)-1 -> 0.13702829910434455
A2174: 1679.HK | B2174: 瑞斯康集团 | C2174: 0.38 | D2174: -151839046.80000001 | E2174: -133774610.40000001 | F2174: -67657298.5 | G2174: -150219924.59999999 | H2174: -264638527.5 | I2174: 4786674.4000000004 | J2174: 15190063 | K2174: 64166908.75 | L2174: 65035565 | M2174: 50608584.5 | N2174: =POWER(D2174/M2174,1/9)-1 -> -2.1298419550164684 | O2174: =POWER(D2174/I2174,1/5)-1 -> -2.9965027667619886
A2175: 2197.HK | B2175: 三叶草生物-B | C2175: 0.29999999999999999 | D2175: -151866451.80000001 | E2175: -2765991774.3000002 | F2175: -7366963023.5 | G2175: -1088083126.2 | H2175: -- | I2175: -- | J2175: -- | K2175: -- | L2175: -- | M2175: -- | N2175: =POWER(D2175/M2175,1/9)-1 -> #VALUE! | O2175: =POWER(D2175/I2175,1/5)-1 -> #VALUE!
A2176: 0600.HK | B2176: 中国基建投资 | C2176: 0.39 | D2176: -152345000 | E2176: -- | F2176: -83344000 | G2176: -278857000 | H2176: -28909000 | I2176: -20088000 | J2176: -44700000 | K2176: -5507000 | L2176: 5249000 | M2176: 16370000 | N2176: =POWER(D2176/M2176,1/9)-1 -> -2.2812744606060651 | O2176: =POWER(D2176/I2176,1/5)-1 -> 0.49960990773198599
A2177: 8215.HK | B2177: 第一信用 | C2177: 0.11 | D2177: -152953315 | E2177: -182481489 | F2177: -31536970 | G2177: -367611528 | H2177: -132893071 | I2177: 25925593 | J2177: 53177690 | K2177: 33646492 | L2177: 24872706 | M2177: 24997678 | N2177: =POWER(D2177/M2177,1/9)-1 -> -2.2229440277250792 | O2177: =POWER(D2177/I2177,1/5)-1 -> -2.4261527346677929
A2178: 0039.HK | B2178: 中国北大荒 | C2178: 0.09 | D2178: -153317000 | E2178: -218450000 | F2178: -170916000 | G2178: 14778000 | H2178: -291072000 | I2178: 4650000 | J2178: 115024000 | K2178: 7217000 | L2178: 19412000 | M2178: 117810000 | N2178: =POWER(D2178/M2178,1/9)-1 -> -2.0297030933400215 | O2178: =POWER(D2178/I2178,1/5)-1 -> -3.0119976631097654
A2179: 2306.HK | B2179: 乐华娱乐 | C2179: 0.65 | D2179: -154385519.40000001 | E2179: 1945374607 | F2179: 412269558 | G2179: 347283903 | H2179: -- | I2179: -- | J2179: -- | K2179: -- | L2179: -- | M2179: -- | N2179: =POWER(D2179/M2179,1/9)-1 -> #VALUE! | O2179: =POWER(D2179/I2179,1/5)-1 -> #VALUE!
A2180: 0983.HK | B2180: 瑞安建业 | C2180: 0.46 | D2180: -155000000 | E2180: -232000000 | F2180: 76000000 | G2180: 52000000 | H2180: 7000000 | I2180: -139000000 | J2180: -613000000 | K2180: -1382000000 | L2180: -1126000000 | M2180: -1374000000 | N2180: =POWER(D2180/M2180,1/9)-1 -> -0.21529757241559966 | O2180: =POWER(D2180/I2180,1/5)-1 -> 2.2029377787904592e-02
A2181: 0026.HK | B2181: 中华汽车 | C2181: 53.299999999999997 | D2181: -155236000 | E2181: 72347000 | F2181: -17922000 | G2181: 111495000 | H2181: 1391331000 | I2181: 942459000 | J2181: 627852000 | K2181: 349383000 | L2181: 465094000 | M2181: 666441000 | N2181: =POWER(D2181/M2181,1/9)-1 -> -1.8505352237483828 | O2181: =POWER(D2181/I2181,1/5)-1 -> -1.6971817265222535
A2182: 0362.HK | B2182: 中国天化工 | C2182: 0.10000000000000001 | D2182: -155876000 | E2182: -1064206000 | F2182: -450353000 | G2182: -354886000 | H2182: -667369000 | I2182: -199324000 | J2182: 68481000 | K2182: -421647000 | L2182: -248517000 | M2182: -559532000 | N2182: =POWER(D2182/M2182,1/9)-1 -> -0.13238259002371522 | O2182: =POWER(D2182/I2182,1/5)-1 -> -4.7984691928915524e-02
A2183: 1146.HK | B2183: 汇成国际控股 | C2183: 0.07 | D2183: -156232616.40000001 | E2183: -284483129.89999998 | F2183: -185897467.5 | G2183: -145595352.59999999 | H2183: 22271775 | I2183: 68519809.400000006 | J2183: 65759665 | K2183: 50454083.75 | L2183: 123293553.84999999 | M2183: 254081175.30000001 | N2183: =POWER(D2183/M2183,1/9)-1 -> -1.9473997073653511 | O2183: =POWER(D2183/I2183,1/5)-1 -> -2.1792098872419725
A2184: 1011.HK | B2184: 泰凌医药 | C2184: 0.34 | D2184: -157403358 | E2184: -74911480.5 | F2184: -183109281 | G2184: -426222248.10000002 | H2184: -656631825 | I2184: -1090398507.5999999 | J2184: 198052285.5 | K2184: 129106136.25 | L2184: 103132528.7 | M2184: 2604367.2999999998 | N2184: =POWER(D2184/M2184,1/9)-1 -> -2.5773335061875464 | O2184: =POWER(D2184/I2184,1/5)-1 -> -0.32097502383693355
A2185: 1340.HK | B2185: 惠生国际 | C2185: 0.05 | D2185: -158260586.40000001 | E2185: -6368124.5 | F2185: -38903589.5 | G2185: -43653337.5 | H2185: -214019130 | I2185: -390486285.80000001 | J2185: -329697.5 | K2185: 78566486.25 | L2185: 137237978.69999999 | M2185: 129297414.8 | N2185: =POWER(D2185/M2185,1/9)-1 -> -2.0227127229484565 | O2185: =POWER(D2185/I2185,1/5)-1 -> -0.16525582533457572
A2186: 1672.HK | B2186: 歌礼制药-B | C2186: 1.08 | D2186: -158636583 | E2186: -355174388.30000001 | F2186: -243696316.5 | G2186: -249394347.90000001 | H2186: -107245357.5 | I2186: -8263958.7999999998 | J2186: -64662671.5 | K2186: -29789278.75 | L2186: -- | M2186: -- | N2186: =POWER(D2186/M2186,1/9)-1 -> #VALUE! | O2186: =POWER(D2186/I2186,1/5)-1 -> 0.80568936702998895
A2187: 0605.HK | B2187: 中国金融投资管理 | C2187: 0.21 | D2187: -159972000 | E2187: -52553000 | F2187: -250065000 | G2187: -1216632000 | H2187: 182448000 | I2187: 270427000 | J2187: 286675000 | K2187: 329958000 | L2187: 345815000 | M2187: 293634000 | N2187: =POWER(D2187/M2187,1/9)-1 -> -1.9347448269201828 | O2187: =POWER(D2187/I2187,1/5)-1 -> -1.9003239119259898
A2188: 0797.HK | B2188: 第七大道 | C2188: 1.3999999999999999 | D2188: -160550548.19999999 | E2188: 318687121.89999998 | F2188: 115391982 | G2188: 96912197.099999994 | H2188: 12058942.5 | I2188: -111618096.59999999 | J2188: 308334300.89999998 | K2188: -18713450 | L2188: 198436092.55000001 | M2188: -- | N2188: =POWER(D2188/M2188,1/9)-1 -> #VALUE! | O2188: =POWER(D2188/I2188,1/5)-1 -> 7.5413381362830378e-02
A2189: 0717.HK | B2189: 英皇资本 | C2189: 0.04 | D2189: -160638000 | E2189: -299234000 | F2189: -576094000 | G2189: -689747000 | H2189: -258706000 | I2189: 549195000 | J2189: 659185000 | K2189: 525621000 | L2189: 430251000 | M2189: 220795000 | N2189: =POWER(D2189/M2189,1/9)-1 -> -1.9652748835592349 | O2189: =POWER(D2189/I2189,1/5)-1 -> -1.782031673003631
A2190: 1073.HK | B2190: 大禹金融 | C2190: 0.10000000000000001 | D2190: -161791000 | E2190: 5365000 | F2190: 1135000 | G2190: 48708000 | H2190: -13916000 | I2190: -4887000 | J2190: -17391000 | K2190: -621000 | L2190: -56467000 | M2190: -2464177000 | N2190: =POWER(D2190/M2190,1/9)-1 -> -0.26109783345592918 | O2190: =POWER(D2190/I2190,1/5)-1 -> 1.0136426631456756
A2191: 1008.HK | B2191: 力图控股 | C2191: 0.13 | D2191: -163881000 | E2191: 6204000 | F2191: 8628000 | G2191: 8915000 | H2191: 175886000 | I2191: 169383000 | J2191: 138025000 | K2191: 285827000 | L2191: 386372000 | M2191: 453711000 | N2191: =POWER(D2191/M2191,1/9)-1 -> -1.893019686517567 | O2191: =POWER(D2191/I2191,1/5)-1 -> -1.9934173872825829
A2192: 6908.HK | B2192: 宏光半导体 | C2192: 0.47 | D2192: -165222552.59999999 | E2192: -114261864.7 | F2192: -547138437 | G2192: 5438639.7000000002 | H2192: 19308165 | I2192: 27207985.600000001 | J2192: 15385483.699999999 | K2192: 6540817.5 | L2192: 9097922.8000000007 | M2192: 6742403.7000000002 | N2192: =POWER(D2192/M2192,1/9)-1 -> -2.426795133796154 | O2192: =POWER(D2192/I2192,1/5)-1 -> -2.4344142389939467
A2193: 1488.HK | B2193: 百福控股 | C2193: 0.75 | D2193: -166246403.40000001 | E2193: -176256600.19999999 | F2193: -783237955.5 | G2193: -167984002.19999999 | H2193: -135925995 | I2193: -12688558.4 | J2193: 18242462.399999999 | K2193: 9652317.5 | L2193: 10013000 | M2193: 33393000 | N2193: =POWER(D2193/M2193,1/9)-1 -> -2.1952402297638827 | O2193: =POWER(D2193/I2193,1/5)-1 -> 0.67289234978888124
A2194: 2286.HK | B2194: 辰兴发展 | C2194: 0.14 | D2194: -166443719.40000001 | E2194: 11781876.4 | F2194: 96396313.5 | G2194: 246411022.19999999 | H2194: 118486290 | I2194: 142198615.40000001 | J2194: 204435229.09999999 | K2194: 168723310 | L2194: 341175633.14999998 | M2194: 130208381.8 | N2194: =POWER(D2194/M2194,1/9)-1 -> -2.0276556346656456 | O2194: =POWER(D2194/I2194,1/5)-1 -> -2.0319874334183439
A2195: 0827.HK | B2195: 玖源集团 | C2195: 0.08 | D2195: -166996204.19999999 | E2195: 227383220.30000001 | F2195: 464373257.5 | G2195: -288176390.10000002 | H2195: -817522770 | I2195: -396470767.39999998 | J2195: -544707027.10000002 | K2195: -452449882.5 | L2195: -124244978.3 | M2195: -611529651.29999995 | N2195: =POWER(D2195/M2195,1/9)-1 -> -0.13430391523896068 | O2195: =POWER(D2195/I2195,1/5)-1 -> -0.15880034542425059
A2196: 0931.HK | B2196: 中国港能 | C2196: 0.43 | D2196: -167194000 | E2196: -198790000 | F2196: -82264000 | G2196: -252203000 | H2196: -- | I2196: -- | J2196: -123729000 | K2196: 92023000 | L2196: 401059000 | M2196: 293732000 | N2196: =POWER(D2196/M2196,1/9)-1 -> -1.9393073355117312 | O2196: =POWER(D2196/I2196,1/5)-1 -> #VALUE!
A2197: 0602.HK | B2197: 佳华百货控股 | C2197: 0.03 | D2197: -167256003.59999999 | E2197: -121718605.7 | F2197: -122589593 | G2197: -231778065.90000001 | H2197: -58492185 | I2197: 28696135.800000001 | J2197: 39802281.100000001 | K2197: 45901292.5 | L2197: 53627880 | M2197: 73196822.400000006 | N2197: =POWER(D2197/M2197,1/9)-1 -> -2.0961667127444992 | O2197: =POWER(D2197/I2197,1/5)-1 -> -2.4226945221510721
A2198: 0030.HK | B2198: 云白国际 | C2198: 0.13 | D2198: -168870808 | E2198: -- | F2198: 13207234 | G2198: 49573533 | H2198: 44271814 | I2198: -1465735 | J2198: -197882191 | K2198: -33537607 | L2198: -82291728 | M2198: -23453872 | N2198: =POWER(D2198/M2198,1/9)-1 -> 0.24525990082899063 | O2198: =POWER(D2198/I2198,1/5)-1 -> 1.5840435253325604
A2199: 9686.HK | B2199: 熙康云医院 | C2199: 0.87 | D2199: -169529522.40000001 | E2199: -272962972.69999999 | F2199: -363109556.5 | G2199: -234126108.90000001 | H2199: -- | I2199: -- | J2199: -- | K2199: -- | L2199: -- | M2199: -- | N2199: =POWER(D2199/M2199,1/9)-1 -> #VALUE! | O2199: =POWER(D2199/I2199,1/5)-1 -> #VALUE!
A2200: 1265.HK | B2200: 天津津燃公用 | C2200: 0.20000000000000001 | D2200: -170100337.56 | E2200: -77100278.739999995 | F2200: 1753034.8200000001 | G2200: -16108938.560000001 | H2200: 4897839.7199999997 | I2200: 45225934.810000002 | J2200: 48043832.859999999 | K2200: 41849099.950000003 | L2200: 43518554.200000003 | M2200: 84238241.599999994 | N2200: =POWER(D2200/M2200,1/9)-1 -> -2.0812114933593868 | O2200: =POWER(D2200/I2200,1/5)-1 -> -2.3033574076762982
A2201: 9958.HK | B2201: 力天影业 | C2201: 2.72 | D2201: -170413059.59999999 | E2201: -333531789.80000001 | F2201: -91988113.5 | G2201: 83528352 | H2201: 86085495 | I2201: 76976191.599999994 | J2201: 68049564 | K2201: 22902862.5 | L2201: -- | M2201: -- | N2201: =POWER(D2201/M2201,1/9)-1 -> #VALUE! | O2201: =POWER(D2201/I2201,1/5)-1 -> -2.1722744260348423
A2202: 0713.HK | B2202: 世界(集团) | C2202: 0.45 | D2202: -172132000 | E2202: -213452000 | F2202: 44022000 | G2202: 68984000 | H2202: -96282000 | I2202: 1166877000 | J2202: -113566000 | K2202: -26550000 | L2202: -41564000 | M2202: -48884000 | N2202: =POWER(D2202/M2202,1/9)-1 -> 0.1501219062550323 | O2202: =POWER(D2202/I2202,1/5)-1 -> -1.6819731981667463
A2203: 1555.HK | B2203: MI能源 | C2203: 0.03 | D2203: -172684386 | E2203: 2649175891.1999998 | F2203: -414323044.5 | G2203: -1610629964.7 | H2203: -1257228847.5 | I2203: -1361529909.8 | J2203: -1318161776.4000001 | K2203: -1469575896.25 | L2203: -1791362888.1500001 | M2203: 72979687.799999997 | N2203: =POWER(D2203/M2203,1/9)-1 -> -2.1004269804537299 | O2203: =POWER(D2203/I2203,1/5)-1 -> -0.33832431310766842
A2204: 0581.HK | B2204: 中国东方集团 | C2204: 1.21 | D2204: -175054370.40000001 | E2204: 910948646.70000005 | F2204: 3053283403 | G2204: 1890559598.7 | H2204: 3587520307.5 | I2204: 5444418570.8000002 | J2204: 5801573012 | K2204: 802463628.75 | L2204: -901445853.14999998 | M2204: 83253648.5 | N2204: =POWER(D2204/M2204,1/9)-1 -> -2.0860837056305384 | O2204: =POWER(D2204/I2204,1/5)-1 -> -1.5028567570103104
A2205: 0126.HK | B2205: 佳宁娜 | C2205: 0.18 | D2205: -175680000 | E2205: 3822000 | F2205: 81004000 | G2205: 14123000 | H2205: 277958000 | I2205: 317017000 | J2205: 127446000 | K2205: 121030000 | L2205: 120744000 | M2205: 195629000 | N2205: =POWER(D2205/M2205,1/9)-1 -> -1.9881204753988353 | O2205: =POWER(D2205/I2205,1/5)-1 -> -1.8886442890206576
A2206: 1166.HK | B2206: 星凯控股 | C2206: 0.40000000000000002 | D2206: -176246000 | E2206: -102218000 | F2206: 156346000 | G2206: -142259000 | H2206: -301963000 | I2206: -85639000 | J2206: -70197000 | K2206: -274945000 | L2206: -370292000 | M2206: -37709000 | N2206: =POWER(D2206/M2206,1/9)-1 -> 0.18688393197825648 | O2206: =POWER(D2206/I2206,1/5)-1 -> 0.15528606878305573
A2207: 0286.HK | B2207: 爱帝宫 | C2207: 0.05 | D2207: -177421000 | E2207: -165324000 | F2207: 5300000 | G2207: -381352000 | H2207: 11237000 | I2207: 2160000 | J2207: 1422000 | K2207: 42096000 | L2207: 34009000 | M2207: 27505000 | N2207: =POWER(D2207/M2207,1/9)-1 -> -2.2301407895702114 | O2207: =POWER(D2207/I2207,1/5)-1 -> -3.4149617381061592
A2208: 0720.HK | B2208: 意达利控股 | C2208: 0.15 | D2208: -179285000 | E2208: -63405000 | F2208: -7140000 | G2208: -89045000 | H2208: -24112000 | I2208: -7403000 | J2208: 85872000 | K2208: -12375000 | L2208: 27756000 | M2208: 27576000 | N2208: =POWER(D2208/M2208,1/9)-1 -> -2.2312173952472065 | O2208: =POWER(D2208/I2208,1/5)-1 -> 0.89159100964002125
A2209: 1832.HK | B2209: 海天地悦旅 | C2209: 0.63 | D2209: -179348371 | E2209: -89206400 | F2209: -46413696 | G2209: -72257960 | H2209: 78648700 | I2209: 91610796 | J2209: 101441348 | K2209: 96188370 | L2209: 82473070.5 | M2209: -- | N2209: =POWER(D2209/M2209,1/9)-1 -> #VALUE! | O2209: =POWER(D2209/I2209,1/5)-1 -> -2.1438001678287648
A2210: 0225.HK | B2210: 博富临置业 | C2210: 5.15 | D2210: -181785000 | E2210: 14795000 | F2210: 137121000 | G2210: -59535000 | H2210: 136847000 | I2210: 480770000 | J2210: 419883000 | K2210: 259012000 | L2210: 172434000 | M2210: 178001000 | N2210: =POWER(D2210/M2210,1/9)-1 -> -2.0023400115451024 | O2210: =POWER(D2210/I2210,1/5)-1 -> -1.8232355888795544
A2211: 0089.HK | B2211: 大生地产 | C2211: 2.18 | D2211: -185656000 | E2211: 360115000 | F2211: 633618000 | G2211: -155943000 | H2211: 436300000 | I2211: 492803000 | J2211: 502055056 | K2211: 373606922 | L2211: 263268373 | M2211: 620250411 | N2211: =POWER(D2211/M2211,1/9)-1 -> -1.8745679293755384 | O2211: =POWER(D2211/I2211,1/5)-1 -> -1.8226348979076668
A2212: 2556.HK | B2212: 迈富时 | C2212: 86.599999999999994 | D2212: -185781783.59999999 | E2212: -- | F2212: -- | G2212: -- | H2212: -- | I2212: -- | J2212: -- | K2212: -- | L2212: -- | M2212: -- | N2212: =POWER(D2212/M2212,1/9)-1 -> #VALUE! | O2212: =POWER(D2212/I2212,1/5)-1 -> #VALUE!
A2213: 1326.HK | B2213: 传递娱乐 | C2213: 0.03 | D2213: -186920000 | E2213: -92166000 | F2213: -7633000 | G2213: -126598000 | H2213: -35504000 | I2213: -189750000 | J2213: -39984000 | K2213: -72591000 | L2213: -215258000 | M2213: 26386000 | N2213: =POWER(D2213/M2213,1/9)-1 -> -2.2430133745604595 | O2213: =POWER(D2213/I2213,1/5)-1 -> -3.0008281760548483e-03
A2214: 0237.HK | B2214: 安全货仓 | C2214: 1.94 | D2214: -188289000 | E2214: -84538000 | F2214: -147581000 | G2214: -292527000 | H2214: 279042000 | I2214: 471213000 | J2214: 269630000 | K2214: 845719000 | L2214: 599270000 | M2214: 204657000 | N2214: =POWER(D2214/M2214,1/9)-1 -> -1.9907808272969285 | O2214: =POWER(D2214/I2214,1/5)-1 -> -1.8323798091775796
A2215: 0984.HK | B2215: 永旺 | C2215: 0.39 | D2215: -188659000 | E2215: -219872000 | F2215: -469963000 | G2215: -36806000 | H2215: -188726000 | I2215: -49224000 | J2215: -54749000 | K2215: -23228000 | L2215: 93170000 | M2215: 257565000 | N2215: =POWER(D2215/M2215,1/9)-1 -> -1.9659991456441857 | O2215: =POWER(D2215/I2215,1/5)-1 -> 0.30827826161311411
A2216: 6816.HK | B2216: 瑞港建设 | C2216: 0.11 | D2216: -188898000 | E2216: -12186000 | F2216: 2581000 | G2216: 13591000 | H2216: 12088000 | I2216: 30415000 | J2216: 64470000 | K2216: 69449000 | L2216: 95998000 | M2216: 37060000 | N2216: =POWER(D2216/M2216,1/9)-1 -> -2.198371100526916 | O2216: =POWER(D2216/I2216,1/5)-1 -> -2.4408803137755521
A2217: 2288.HK | B2217: 宏基资本 | C2217: 0.11 | D2217: -189329000 | E2217: -34870000 | F2217: 4500000 | G2217: -77319000 | H2217: 329957000 | I2217: 31120000 | J2217: 53510000 | K2217: -83363000 | L2217: 113414000 | M2217: 421874000 | N2217: =POWER(D2217/M2217,1/9)-1 -> -1.9148231653381713 | O2217: =POWER(D2217/I2217,1/5)-1 -> -2.4349458432893911
A2218: 2137.HK | B2218: 腾盛博药-B | C2218: 1.05 | D2218: -191647549.80000001 | E2218: -546352367.20000005 | F2218: -5098633100.5 | G2218: -1417884240 | H2218: -- | I2218: -- | J2218: -- | K2218: -- | L2218: -- | M2218: -- | N2218: =POWER(D2218/M2218,1/9)-1 -> #VALUE! | O2218: =POWER(D2218/I2218,1/5)-1 -> #VALUE!
A2219: 0218.HK | B2219: 申万宏源香港 | C2219: 0.33 | D2219: -192454000 | E2219: -879924000 | F2219: -95750000 | G2219: 175626000 | H2219: 136664000 | I2219: 96228000 | J2219: 104097000 | K2219: 82275000 | L2219: 184314000 | M2219: 93934000 | N2219: =POWER(D2219/M2219,1/9)-1 -> -2.082957889441917 | O2219: =POWER(D2219/I2219,1/5)-1 -> -2.1486959675357351
A2220: 0542.HK | B2220: 中国文旅农业 | C2220: 0.16 | D2220: -192711000 | E2220: 265177000 | F2220: -326264000 | G2220: -217714000 | H2220: -202376000 | I2220: -122400000 | J2220: -19770000 | K2220: -398898000 | L2220: -49491000 | M2220: 44978000 | N2220: =POWER(D2220/M2220,1/9)-1 -> -2.1754707271521498 | O2220: =POWER(D2220/I2220,1/5)-1 -> 9.5027478476281901e-02
A2221: 2185.HK | B2221: 百心安-B | C2221: 1.8 | D2221: -192813906.59999999 | E2221: -230398631.59999999 | F2221: -442594300.5 | G2221: -387990863.69999999 | H2221: -- | I2221: -- | J2221: -- | K2221: -- | L2221: -- | M2221: -- | N2221: =POWER(D2221/M2221,1/9)-1 -> #VALUE! | O2221: =POWER(D2221/I2221,1/5)-1 -> #VALUE!
A2222: 3886.HK | B2222: 康健国际医疗 | C2222: 0.29 | D2222: -194210000 | E2222: 15289000 | F2222: 22013000 | G2222: -281038000 | H2222: -8414000 | I2222: 64014000 | J2222: -107745000 | K2222: 63497000 | L2222: 231263000 | M2222: 84612000 | N2222: =POWER(D2222/M2222,1/9)-1 -> -2.0967137588283058 | O2222: =POWER(D2222/I2222,1/5)-1 -> -2.2485309843369348
A2223: 0575.HK | B2223: 励晶太平洋 | C2223: 0.55 | D2223: -195657739 | E2223: -284422016 | F2223: -98239204 | G2223: -189134435 | H2223: -514315776 | I2223: -243535558 | J2223: -213783226 | K2223: -19074840 | L2223: -72335416.5 | M2223: -66414628 | N2223: =POWER(D2223/M2223,1/9)-1 -> 0.12755317393155785 | O2223: =POWER(D2223/I2223,1/5)-1 -> -4.283473475389199e-02
A2224: 0202.HK | B2224: 润中国际控股 | C2224: 0.11 | D2224: -196544000 | E2224: -233386000 | F2224: -135055000 | G2224: -529070000 | H2224: -600252000 | I2224: -775807000 | J2224: 82403000 | K2224: -685672000 | L2224: -403159000 | M2224: 177124000 | N2224: =POWER(D2224/M2224,1/9)-1 -> -2.011626656037135 | O2224: =POWER(D2224/I2224,1/5)-1 -> -0.24012663958425851
A2225: 0410.HK | B2225: SOHO中国 | C2225: 0.68 | D2225: -197205283.80000001 | E2225: 69048744.799999997 | F2225: -160529501 | G2225: 631188523.5 | H2225: 1487608177.5 | I2225: 2191766287.5999999 | J2225: 5674970370.8999996 | K2225: 1011495310 | L2225: 632282113.60000002 | M2225: 5091221104.8999996 | N2225: =POWER(D2225/M2225,1/9)-1 -> -1.6968219831029823 | O2225: =POWER(D2225/I2225,1/5)-1 -> -1.6177672212235796
A2226: 0571.HK | B2226: 丰德丽控股 | C2226: 0.06 | D2226: -198763000 | E2226: -328732000 | F2226: -351126000 | G2226: -8585404000 | H2226: -77645000 | I2226: 263840000 | J2226: 514233000 | K2226: 80825000 | L2226: 258231000 | M2226: 268618000 | N2226: =POWER(D2226/M2226,1/9)-1 -> -1.9670896037891381 | O2226: =POWER(D2226/I2226,1/5)-1 -> -1.9449285718186755
A2227: 2099.HK | B2227: 中国黄金国际 | C2227: 47.65 | D2227: -199180500 | E2227: 1739177344 | F2227: 2084881078 | G2227: 868041386 | H2227: -255701719 | I2227: -37893058 | J2227: 493422844 | K2227: -103159216 | L2227: -63461094 | M2227: 308138124 | N2227: =POWER(D2227/M2227,1/9)-1 -> -1.9526746261497983 | O2227: =POWER(D2227/I2227,1/5)-1 -> 0.39359773794586617
A2228: 0769.HK | B2228: 中国稀土 | C2228: 0.31 | D2228: -200545000 | E2228: -373296000 | F2228: 24274000 | G2228: 19710000 | H2228: 38885000 | I2228: -5424000 | J2228: -5756000 | K2228: -104242000 | L2228: -256650000 | M2228: -92972000 | N2228: =POWER(D2228/M2228,1/9)-1 -> 8.9169617983327454e-02 | O2228: =POWER(D2228/I2228,1/5)-1 -> 1.0586306360154945
A2229: 2668.HK | B2229: 百德国际 | C2229: 0.74 | D2229: -201747000 | E2229: -14259000 | F2229: -5648000 | G2229: 21284000 | H2229: 54511000 | I2229: -9041000 | J2229: -28919000 | K2229: -39701000 | L2229: -6281000 | M2229: -27795000 | N2229: =POWER(D2229/M2229,1/9)-1 -> 0.24637558790750025 | O2229: =POWER(D2229/I2229,1/5)-1 -> 0.86087895001670245
A2230: 0372.HK | B2230: 保德国际发展 | C2230: 0.03 | D2230: -201962000 | E2230: -158417000 | F2230: 167056000 | G2230: -902258000 | H2230: 277056000 | I2230: -36828000 | J2230: -1293978000 | K2230: 435918000 | L2230: 240488000 | M2230: 109588000 | N2230: =POWER(D2230/M2230,1/9)-1 -> -2.0702882070655715 | O2230: =POWER(D2230/I2230,1/5)-1 -> 0.40545940374338474
A2231: 1223.HK | B2231: 新沣集团 | C2231: 0.84 | D2231: -205913000 | E2231: -81278000 | F2231: 36501000 | G2231: -216328000 | H2231: 71705000 | I2231: 118213000 | J2231: 41018000 | K2231: 27746000 | L2231: 180822000 | M2231: 19095000 | N2231: =POWER(D2231/M2231,1/9)-1 -> -2.3024215306463063 | O2231: =POWER(D2231/I2231,1/5)-1 -> -2.1173872342846929
A2232: 2170.HK | B2232: 贝康医疗-B | C2232: 1.8999999999999999 | D2232: -210125097 | E2232: -138377258.40000001 | F2232: -175900649.5 | G2232: -1045358278.8 | H2232: -593767980 | I2232: -176342952.19999999 | J2232: -- | K2232: -- | L2232: -- | M2232: -- | N2232: =POWER(D2232/M2232,1/9)-1 -> #VALUE! | O2232: =POWER(D2232/I2232,1/5)-1 -> 3.5676123092982515e-02
A2233: 2496.HK | B2233: 友芝友生物-B | C2233: 7.47 | D2233: -210143732.40000001 | E2233: -213059734.59999999 | F2233: -181860291 | G2233: -128540455.5 | H2233: -- | I2233: -- | J2233: -- | K2233: -- | L2233: -- | M2233: -- | N2233: =POWER(D2233/M2233,1/9)-1 -> #VALUE! | O2233: =POWER(D2233/I2233,1/5)-1 -> #VALUE!
A2234: 0292.HK | B2234: 泛海酒店 | C2234: 0.08 | D2234: -212794000 | E2234: -746382000 | F2234: 621505000 | G2234: 383010000 | H2234: 339737000 | I2234: 171830000 | J2234: 432849000 | K2234: 250612000 | L2234: 120061000 | M2234: 348965000 | N2234: =POWER(D2234/M2234,1/9)-1 -> -1.9465222646694302 | O2234: =POWER(D2234/I2234,1/5)-1 -> -2.0436913344877921
A2235: 1274.HK | B2235: 知行汽车科技 | C2235: 27.800000000000001 | D2235: -213877389.59999999 | E2235: -- | F2235: -- | G2235: -- | H2235: -- | I2235: -- | J2235: -- | K2235: -- | L2235: -- | M2235: -- | N2235: =POWER(D2235/M2235,1/9)-1 -> #VALUE! | O2235: =POWER(D2235/I2235,1/5)-1 -> #VALUE!
A2236: 2236.HK | B2236: 惠生工程 | C2236: 0.19 | D2236: -214988936.40000001 | E2236: -1337346756.5999999 | F2236: -113402169.5 | G2236: -323288572.19999999 | H2236: 56555557.5 | I2236: 64104318.600000001 | J2236: 165815063.40000001 | K2236: 16867663.75 | L2236: 241214911.30000001 | M2236: 223421520.19999999 | N2236: =POWER(D2236/M2236,1/9)-1 -> -1.9957342748128428 | O2236: =POWER(D2236/I2236,1/5)-1 -> -2.2738132575020185
A2237: 1981.HK | B2237: 华夏控股 | C2237: 0.88 | D2237: -215145693 | E2237: 108824422.7 | F2237: 70441811.5 | G2237: 377169603.60000002 | H2237: 198197565 | I2237: 154866679 | J2237: 196974474.40000001 | K2237: 93800612.5 | L2237: -- | M2237: -- | N2237: =POWER(D2237/M2237,1/9)-1 -> #VALUE! | O2237: =POWER(D2237/I2237,1/5)-1 -> -2.0679598709734561
A2238: 6086.HK | B2238: 方舟健客 | C2238: 4.63 | D2238: -215719005.59999999 | E2238: -- | F2238: -- | G2238: -- | H2238: -- | I2238: -- | J2238: -- | K2238: -- | L2238: -- | M2238: -- | N2238: =POWER(D2238/M2238,1/9)-1 -> #VALUE! | O2238: =POWER(D2238/I2238,1/5)-1 -> #VALUE!
A2239: 2255.HK | B2239: 海昌海洋公园 | C2239: 0.75 | D2239: -216235315.80000001 | E2239: -1574727199.0999999 | F2239: 1034520049.5 | G2239: -1730206140.3 | H2239: 28026900 | I2239: 45040738.799999997 | J2239: 335442628.80000001 | K2239: 223330135 | L2239: 271223003.10000002 | M2239: 239576833.59999999 | N2239: =POWER(D2239/M2239,1/9)-1 -> -1.9886749572766025 | O2239: =POWER(D2239/I2239,1/5)-1 -> -2.3685612021403015
A2240: 1062.HK | B2240: 国开国际投资 | C2240: 0.07 | D2240: -217901093 | E2240: -471601520 | F2240: -14118214 | G2240: 53157606 | H2240: 176046254 | I2240: 139579819 | J2240: 176961171 | K2240: 89792508 | L2240: 113261048 | M2240: 48558973 | N2240: =POWER(D2240/M2240,1/9)-1 -> -2.1815261116700153 | O2240: =POWER(D2240/I2240,1/5)-1 -> -2.0931691209907948
A2241: 0520.HK | B2241: 呷哺呷哺 | C2241: 1.35 | D2241: -218654629.19999999 | E2241: -398277961.19999999 | F2241: -359038094 | G2241: 2189520.2999999998 | H2241: 321951750 | I2241: 526577450.80000001 | J2241: 503741813 | K2241: 408971115 | L2241: 309728056.14999998 | M2241: 176194744.69999999 | N2241: =POWER(D2241/M2241,1/9)-1 -> -2.0242793423462699 | O2241: =POWER(D2241/I2241,1/5)-1 -> -1.8388016647435088
A2242: 2216.HK | B2242: 堃博医疗-B | C2242: 0.57 | D2242: -219418801 | E2242: -218905088 | F2242: -1838643632 | G2242: -373981461 | H2242: -- | I2242: -- | J2242: -- | K2242: -- | L2242: -- | M2242: -- | N2242: =POWER(D2242/M2242,1/9)-1 -> #VALUE! | O2242: =POWER(D2242/I2242,1/5)-1 -> #VALUE!
A2243: 9928.HK | B2243: 时代邻里 | C2243: 0.5 | D2243: -221172600.59999999 | E2243: -240992618.69999999 | F2243: 377146000 | G2243: 277243091.39999998 | H2243: 107629777.5 | I2243: 72328426.400000006 | J2243: 40519223.299999997 | K2243: 22216110 | L2243: -- | M2243: -- | N2243: =POWER(D2243/M2243,1/9)-1 -> #VALUE! | O2243: =POWER(D2243/I2243,1/5)-1 -> -2.2505022042399059
A2244: 2383.HK | B2244: TOM集团 | C2244: 0.51 | D2244: -221426000 | E2244: 142420000 | F2244: -114106000 | G2244: -1063933000 | H2244: -197281000 | I2244: -158623000 | J2244: -242274000 | K2244: -276561000 | L2244: -214474000 | M2244: -84879000 | N2244: =POWER(D2244/M2244,1/9)-1 -> 0.11242263690168408 | O2244: =POWER(D2244/I2244,1/5)-1 -> 6.898716567817087e-02
A2245: 0650.HK | B2245: 普达特科技 | C2245: 0.24 | D2245: -222513000 | E2245: -403761000 | F2245: -386701000 | G2245: -276790000 | H2245: 27379000 | I2245: 14493000 | J2245: -462426000 | K2245: -38943000 | L2245: -234020000 | M2245: -197298000 | N2245: =POWER(D2245/M2245,1/9)-1 -> 1.3453049973301878e-02 | O2245: =POWER(D2245/I2245,1/5)-1 -> -2.7267895802195987
A2246: 0592.HK | B2246: 堡狮龙 | C2246: 0.10000000000000001 | D2246: -223368000 | E2246: -132254000 | F2246: -- | G2246: -367735000 | H2246: -139105000 | I2246: -28972000 | J2246: 4886000 | K2246: 292121000 | L2246: 115359000 | M2246: 127096000 | N2246: =POWER(D2246/M2246,1/9)-1 -> -2.0646574489422145 | O2246: =POWER(D2246/I2246,1/5)-1 -> 0.50455648112715368
A2247: 2181.HK | B2247: 迈博药业-B | C2247: 0.36 | D2247: -229496047.19999999 | E2247: -237824913.90000001 | F2247: -357240528 | G2247: -220062880.80000001 | H2247: -226326157.5 | I2247: -142191783.80000001 | J2247: -37242629.600000001 | K2247: -25134252.5 | L2247: -- | M2247: -- | N2247: =POWER(D2247/M2247,1/9)-1 -> #VALUE! | O2247: =POWER(D2247/I2247,1/5)-1 -> 0.10047489994695979
A2248: 0268.HK | B2248: 金蝶国际 | C2248: 6.2000000000000002 | D2248: -230081418 | E2248: -439009139.80000001 | F2248: -370203085 | G2248: -399857420.10000002 | H2248: 416358150 | I2248: 469223891.60000002 | J2248: 371663795.60000002 | K2248: 320295587.5 | L2248: 124386104.3 | M2248: 245896199.19999999 | N2248: =POWER(D2248/M2248,1/9)-1 -> -1.9926409607745794 | O2248: =POWER(D2248/I2248,1/5)-1 -> -1.8671620944280567
A2249: 2122.HK | B2249: 凯知乐国际 | C2249: 0.04 | D2249: -230744619 | E2249: -205635708.5 | F2249: 1642054.5 | G2249: -151483338.59999999 | H2249: -91867440 | I2249: -93794452.200000003 | J2249: 59352000 | K2249: 89200000 | L2249: 106559000 | M2249: 96238000 | N2249: =POWER(D2249/M2249,1/9)-1 -> -2.1020424727376925 | O2249: =POWER(D2249/I2249,1/5)-1 -> 0.1972666521930142
A2250: 3336.HK | B2250: 巨腾国际 | C2250: 1.29 | D2250: -230815000 | E2250: 172149000 | F2250: 162396000 | G2250: 130506000 | H2250: 145913000 | I2250: 138660000 | J2250: 76929000 | K2250: 500586000 | L2250: 874957000 | M2250: 764667000 | N2250: =POWER(D2250/M2250,1/9)-1 -> -1.8753849497607733 | O2250: =POWER(D2250/I2250,1/5)-1 -> -2.1072930310594353
A2251: 9966.HK | B2251: 康宁杰瑞制药-B | C2251: 2.23 | D2251: -230852046.59999999 | E2251: -367446988.19999999 | F2251: -505004616.5 | G2251: -509854295.39999998 | H2251: -930586950 | I2251: -170611239.80000001 | J2251: -39636832.899999999 | K2251: -- | L2251: -- | M2251: -- | N2251: =POWER(D2251/M2251,1/9)-1 -> #VALUE! | O2251: =POWER(D2251/I2251,1/5)-1 -> 6.2344118992614606e-02
A2252: 1725.HK | B2252: 洲际航天科技 | C2252: 0.88 | D2252: -231452764.19999999 | E2252: -174054549 | F2252: -64990337.5 | G2252: 20647283.699999999 | H2252: 28448197.5 | I2252: 23448328.399999999 | J2252: 34181837.899999999 | K2252: 24537511.25 | L2252: 16455291.6 | M2252: -- | N2252: =POWER(D2252/M2252,1/9)-1 -> #VALUE! | O2252: =POWER(D2252/I2252,1/5)-1 -> -2.5807751378623611
A2253: 2552.HK | B2253: 华领医药-B | C2253: 1.21 | D2253: -231554710.80000001 | E2253: -229576246.69999999 | F2253: -398861283 | G2253: -468576414.60000002 | H2253: -475239225 | I2253: -4102063823.5999999 | J2253: -326956814.60000002 | K2253: -401525740 | L2253: -- | M2253: -- | N2253: =POWER(D2253/M2253,1/9)-1 -> #VALUE! | O2253: =POWER(D2253/I2253,1/5)-1 -> -0.43723090267850784
A2254: 0991.HK | B2254: 大唐发电 | C2254: 1.59 | D2254: -232396592.40000001 | E2254: -1925808840.5999999 | F2254: -12906710004 | G2254: 2181107869.8000002 | H2254: 436539082.5 | I2254: 1403028464 | J2254: 1792023404.7 | K2254: -3060250261.25 | L2254: 3278520450.9499998 | M2254: 2205559674.3000002 | N2254: =POWER(D2254/M2254,1/9)-1 -> -1.7787755837357524 | O2254: =POWER(D2254/I2254,1/5)-1 -> -1.6979634083744182
A2255: 0603.HK | B2255: 中油燃气 | C2255: 0.21 | D2255: -232496000 | E2255: 918875000 | F2255: 904182000 | G2255: 28757000 | H2255: 330984000 | I2255: 281904000 | J2255: 250467000 | K2255: 311791000 | L2255: -183831000 | M2255: 308650000 | N2255: =POWER(D2255/M2255,1/9)-1 -> -1.9690087291746945 | O2255: =POWER(D2255/I2255,1/5)-1 -> -1.9621944542250214
A2256: 0509.HK | B2256: 世纪阳光 | C2256: 0.17 | D2256: -236690000 | E2256: -1007080000 | F2256: -1121566000 | G2256: -745368000 | H2256: 380368000 | I2256: 474230000 | J2256: 260316000 | K2256: 302334000 | L2256: 314479000 | M2256: 287910000 | N2256: =POWER(D2256/M2256,1/9)-1 -> -1.9784688805062565 | O2256: =POWER(D2256/I2256,1/5)-1 -> -1.8702382679662848
A2257: 0641.HK | B2257: 中国恒天立信国际 | C2257: 0.35 | D2257: -238623000 | E2257: -204621000 | F2257: 77005000 | G2257: 6289000 | H2257: 168836000 | I2257: 141017000 | J2257: 281263000 | K2257: 91289000 | L2257: 166029000 | M2257: 117901000 | N2257: =POWER(D2257/M2257,1/9)-1 -> -2.0814878528631722 | O2257: =POWER(D2257/I2257,1/5)-1 -> -2.1109337634624956
A2258: 0176.HK | B2258: 先机企业集团 | C2258: 0.02 | D2258: -239044000 | E2258: -93426000 | F2258: -144126000 | G2258: -108257000 | H2258: -94285000 | I2258: -174334000 | J2258: 69324000 | K2258: 3486000 | L2258: -- | M2258: -178759000 | N2258: =POWER(D2258/M2258,1/9)-1 -> 3.2816876146784413e-02 | O2258: =POWER(D2258/I2258,1/5)-1 -> 6.5170549999536975e-02
A2259: 1090.HK | B2259: 大明国际 | C2259: 0.90000000000000002 | D2259: -240142341.59999999 | E2259: -201142486.19999999 | F2259: 606181378 | G2259: 414756170.10000002 | H2259: 198396480 | I2259: 124741600.2 | J2259: 80884987.400000006 | K2259: 431403918.75 | L2259: -290731320.5 | M2259: 206910555.30000001 | N2259: =POWER(D2259/M2259,1/9)-1 -> -2.0166871719205939 | O2259: =POWER(D2259/I2259,1/5)-1 -> -2.1399649173141366
A2260: 1129.HK | B2260: 中国水业集团 | C2260: 0.10000000000000001 | D2260: -243451000 | E2260: -89198000 | F2260: -44020000 | G2260: 11094000 | H2260: 115617000 | I2260: 6646000 | J2260: -49111000 | K2260: 31263000 | L2260: -97497000 | M2260: 203622000 | N2260: =POWER(D2260/M2260,1/9)-1 -> -2.0200483616953644 | O2260: =POWER(D2260/I2260,1/5)-1 -> -3.0548032557315188
A2261: 0117.HK | B2261: 天利控股集团 | C2261: 0.31 | D2261: -243518637.59999999 | E2261: -72030313.099999994 | F2261: 84268865.5 | G2261: -6873687.2999999998 | H2261: -140778180 | I2261: 181743332 | J2261: 160690964.80000001 | K2261: -76536232.5 | L2261: -38781424.799999997 | M2261: -58512783.100000001 | N2261: =POWER(D2261/M2261,1/9)-1 -> 0.17168008959092806 | O2261: =POWER(D2261/I2261,1/5)-1 -> -2.0602657777400113
A2262: 0399.HK | B2262: 领航医药生物科技 | C2262: 0.21 | D2262: -245698000 | E2262: 45803000 | F2262: -204939000 | G2262: -211117000 | H2262: -260272000 | I2262: -231048000 | J2262: -169788000 | K2262: -236865000 | L2262: -451684000 | M2262: -- | N2262: =POWER(D2262/M2262,1/9)-1 -> #VALUE! | O2262: =POWER(D2262/I2262,1/5)-1 -> 1.2371432479193922e-02
A2263: 0899.HK | B2263: 中加国信 | C2263: 0.09 | D2263: -246172000 | E2263: -361642000 | F2263: 91264000 | G2263: -338784000 | H2263: -158640000 | I2263: -123989000 | J2263: -92794000 | K2263: -76205000 | L2263: -157152000 | M2263: -207068000 | N2263: =POWER(D2263/M2263,1/9)-1 -> 1.9406259877900789e-02 | O2263: =POWER(D2263/I2263,1/5)-1 -> 0.14702028736983364
A2264: 9886.HK | B2264: 叮当健康 | C2264: 0.99 | D2264: -247531825.80000001 | E2264: -3196352899.5 | F2264: -1932292837 | G2264: -1101613575 | H2264: -- | I2264: -- | J2264: -- | K2264: -- | L2264: -- | M2264: -- | N2264: =POWER(D2264/M2264,1/9)-1 -> #VALUE! | O2264: =POWER(D2264/I2264,1/5)-1 -> #VALUE!
A2265: 6639.HK | B2265: 瑞尔集团 | C2265: 4.31 | D2265: -251344991.55000001 | E2265: -864547714 | F2265: -709863135 | G2265: -345893669.10000002 | H2265: -- | I2265: -- | J2265: -- | K2265: -- | L2265: -- | M2265: -- | N2265: =POWER(D2265/M2265,1/9)-1 -> #VALUE! | O2265: =POWER(D2265/I2265,1/5)-1 -> #VALUE!
A2266: 0871.HK | B2266: 中国疏浚环保 | C2266: 0.08 | D2266: -252854973 | E2266: -384017649.10000002 | F2266: 27665128.5 | G2266: -627634277.70000005 | H2266: -578402355 | I2266: -294495474.19999999 | J2266: 85169856 | K2266: 76447332.5 | L2266: -232697957.19999999 | M2266: 115460699.59999999 | N2266: =POWER(D2266/M2266,1/9)-1 -> -2.0910040639347685 | O2266: =POWER(D2266/I2266,1/5)-1 -> -3.0029391076239254e-02
A2267: 0438.HK | B2267: 彩虹新能源 | C2267: 3.3999999999999999 | D2267: -253173405.72999999 | E2267: 100663066.76000001 | F2267: 201346512.47 | G2267: 261814769.56 | H2267: 104086179.29000001 | I2267: 92565879.540000007 | J2267: 107910808.84 | K2267: 117472460 | L2267: 757371495.79999995 | M2267: -1016140012 | N2267: =POWER(D2267/M2267,1/9)-1 -> -0.14307955734745059 | O2267: =POWER(D2267/I2267,1/5)-1 -> -2.2229069983749836
A2268: 0681.HK | B2268: 中民控股 | C2268: 0.02 | D2268: -254043253.80000001 | E2268: 37103209 | F2268: 205447834.5 | G2268: 199366947.84999999 | H2268: 203472140 | I2268: 251749490.40000001 | J2268: 232434865.5 | K2268: -176427909.90000001 | L2268: 255082905 | M2268: 59075202 | N2268: =POWER(D2268/M2268,1/9)-1 -> -2.1759508253252262 | O2268: =POWER(D2268/I2268,1/5)-1 -> -2.0018156534474123
A2269: 2008.HK | B2269: 凤凰卫视 | C2269: 1.51 | D2269: -258989000 | E2269: -382500000 | F2269: -456201000 | G2269: -1037043000 | H2269: 122665000 | I2269: 243790000 | J2269: 286248000 | K2269: 230515000 | L2269: 110349000 | M2269: 663710000 | N2269: =POWER(D2269/M2269,1/9)-1 -> -1.9007187792303681 | O2269: =POWER(D2269/I2269,1/5)-1 -> -2.0121691267082538
A2270: 0553.HK | B2270: 南京熊猫电子股份 | C2270: 2.22 | D2270: -260744576.63999999 | E2270: 45671987.68 | F2270: 51341501.119999997 | G2270: 92155533.659999996 | H2270: 58845197.189999998 | I2270: 184407164.66999999 | J2270: 128740372.88 | K2270: 132506019.98 | L2270: 169159107.97999999 | M2270: 191215717 | N2270: =POWER(D2270/M2270,1/9)-1 -> -2.0350605210952351 | O2270: =POWER(D2270/I2270,1/5)-1 -> -2.0717352094759374
A2271: 0604.HK | B2271: 深圳控股 | C2271: 0.94 | D2271: -261397000 | E2271: 2085418000 | F2271: -2721886000 | G2271: 3722856000 | H2271: 4062796000 | I2271: 3415223000 | J2271: 4950941000 | K2271: 3170581000 | L2271: 2868796000 | M2271: 3131316000 | N2271: =POWER(D2271/M2271,1/9)-1 -> -1.7588830552300971 | O2271: =POWER(D2271/I2271,1/5)-1 -> -1.5981034485467565
A2272: 8295.HK | B2272: 金慧科技 | C2272: 0.06 | D2272: -263254530.55000001 | E2272: 99091637.5 | F2272: 30971690.25 | G2272: 1542501.45 | H2272: -284709000 | I2272: 20802000 | J2272: 79182000 | K2272: -- | L2272: -- | M2272: -1331000 | N2272: =POWER(D2272/M2272,1/9)-1 -> 0.79942226021750029 | O2272: =POWER(D2272/I2272,1/5)-1 -> -2.6613232859241776
A2273: 0863.HK | B2273: Osl集团 | C2273: 5.79 | D2273: -263862000 | E2273: -541038000 | F2273: -375675000 | G2273: -278745000 | H2273: -272201149.51999998 | I2273: -183579529.44999999 | J2273: -69790270.890000001 | K2273: -232164488.05000001 | L2273: 43933495.219999999 | M2273: 51192896.200000003 | N2273: =POWER(D2273/M2273,1/9)-1 -> -2.1998575353551271 | O2273: =POWER(D2273/I2273,1/5)-1 -> 7.5252644945259739e-02
A2274: 0474.HK | B2274: 信铭生命科技 | C2274: 0.11 | D2274: -264000000 | E2274: -370000000 | F2274: -376000000 | G2274: -284000000 | H2274: -380871000 | I2274: -444906000 | J2274: -3078901000 | K2274: 524398000 | L2274: 1522565000 | M2274: -12415000 | N2274: =POWER(D2274/M2274,1/9)-1 -> 0.40448616982031571 | O2274: =POWER(D2274/I2274,1/5)-1 -> -9.9119611321470069e-02
A2275: 3681.HK | B2275: 中国抗体-B | C2275: 1.57 | D2275: -266498278.19999999 | E2275: -320558639.80000001 | F2275: -352893553 | G2275: -146126940 | H2275: -308745135 | I2275: -95198346 | J2275: -57516028.600000001 | K2275: -- | L2275: -- | M2275: -- | N2275: =POWER(D2275/M2275,1/9)-1 -> #VALUE! | O2275: =POWER(D2275/I2275,1/5)-1 -> 0.22860704391860764
A2276: 2402.HK | B2276: 亿华通 | C2276: 24 | D2276: -266599868.12 | E2276: -187777051.44999999 | F2276: -198276089.97999999 | G2276: -436235.40000000002 | H2276: -- | I2276: -- | J2276: -- | K2276: -- | L2276: -- | M2276: -- | N2276: =POWER(D2276/M2276,1/9)-1 -> #VALUE! | O2276: =POWER(D2276/I2276,1/5)-1 -> #VALUE!
A2277: 1332.HK | B2277: 透云生物 | C2277: 0.16 | D2277: -268939000 | E2277: -198065000 | F2277: -72948000 | G2277: -168776000 | H2277: -200513000 | I2277: -253877000 | J2277: -245226000 | K2277: -1150825000 | L2277: 255259000 | M2277: 10349000 | N2277: =POWER(D2277/M2277,1/9)-1 -> -2.4361342652188509 | O2277: =POWER(D2277/I2277,1/5)-1 -> 1.1593629217533374e-02
A2278: 0137.HK | B2278: 金辉集团 | C2278: 0.74 | D2278: -271527000 | E2278: -45595000 | F2278: 826895000 | G2278: -85840000 | H2278: -3450000 | I2278: 48223000 | J2278: -13631000 | K2278: -805394000 | L2278: -1683183000 | M2278: -379923000 | N2278: =POWER(D2278/M2278,1/9)-1 -> -3.6635083776379807e-02 | O2278: =POWER(D2278/I2278,1/5)-1 -> -2.4129010871785703
A2279: 2480.HK | B2279: 绿竹生物-B | C2279: 24.199999999999999 | D2279: -273337470 | E2279: -818075558 | F2279: -660442646.5 | G2279: -207449003.09999999 | H2279: -- | I2279: -- | J2279: -- | K2279: -- | L2279: -- | M2279: -- | N2279: =POWER(D2279/M2279,1/9)-1 -> #VALUE! | O2279: =POWER(D2279/I2279,1/5)-1 -> #VALUE!
A2280: 0444.HK | B2280: Sincerewatch HK | C2280: 0.01 | D2280: -274500000 | E2280: -156819000 | F2280: -210300000 | G2280: -142315000 | H2280: -122831000 | I2280: -59972000 | J2280: -158935000 | K2280: -143491000 | L2280: 40232000 | M2280: 52074000 | N2280: =POWER(D2280/M2280,1/9)-1 -> -2.2028555877334819 | O2280: =POWER(D2280/I2280,1/5)-1 -> 0.35556005663156287
A2281: 0764.HK | B2281: 永恒策略 | C2281: 0.07 | D2281: -275152000 | E2281: -272772000 | F2281: -200375000 | G2281: -140858000 | H2281: -209148000 | I2281: -586090000 | J2281: -195545000 | K2281: -207902000 | L2281: 105256000 | M2281: 238077000 | N2281: =POWER(D2281/M2281,1/9)-1 -> -2.0162110540449723 | O2281: =POWER(D2281/I2281,1/5)-1 -> -0.14034999012756544
A2282: 3836.HK | B2282: 和谐汽车 | C2282: 0.47 | D2282: -276455062.80000001 | E2282: -1836278312.2 | F2282: 824278297.5 | G2282: 489514521.89999998 | H2282: 573620572.5 | I2282: 778451711.20000005 | J2282: 1210116908.4000001 | K2282: -411911482.5 | L2282: 662578337.64999998 | M2282: 679313083.5 | N2282: =POWER(D2282/M2282,1/9)-1 -> -1.9049345595531617 | O2282: =POWER(D2282/I2282,1/5)-1 -> -1.8129775894857252
A2283: 1168.HK | B2283: 百仕达控股 | C2283: 0.11 | D2283: -278244000 | E2283: -143388000 | F2283: 190711000 | G2283: -453114000 | H2283: -316575000 | I2283: -267723000 | J2283: 110088000 | K2283: -245527000 | L2283: -409456000 | M2283: 27745000 | N2283: =POWER(D2283/M2283,1/9)-1 -> -2.2919598243858346 | O2283: =POWER(D2283/I2283,1/5)-1 -> 7.7389042494937499e-03
A2284: 2708.HK | B2284: 艾伯科技 | C2284: 0.06 | D2284: -278381473.80000001 | E2284: 18083144.75 | F2284: -49853372.25 | G2284: -57808325.75 | H2284: 39627607.200000003 | I2284: 44332583.399999999 | J2284: 33240460.5 | K2284: 29798960.399999999 | L2284: 12147221.699999999 | M2284: -- | N2284: =POWER(D2284/M2284,1/9)-1 -> #VALUE! | O2284: =POWER(D2284/I2284,1/5)-1 -> -2.4440540802604689
A2285: 1225.HK | B2285: 隆成金融 | C2285: 0.22 | D2285: -279466000 | E2285: -367073000 | F2285: -65709000 | G2285: -13785000 | H2285: -86170000 | I2285: -68090000 | J2285: -534962000 | K2285: -246457000 | L2285: 586815000 | M2285: -145996000 | N2285: =POWER(D2285/M2285,1/9)-1 -> 7.4810752292566507e-02 | O2285: =POWER(D2285/I2285,1/5)-1 -> 0.32632247495771249
A2286: 0314.HK | B2286: 思派健康 | C2286: 6 | D2286: -280372881.60000002 | E2286: -1546142273.2 | F2286: -4580187147.5 | G2286: -1242890673.9000001 | H2286: -- | I2286: -- | J2286: -- | K2286: -- | L2286: -- | M2286: -- | N2286: =POWER(D2286/M2286,1/9)-1 -> #VALUE! | O2286: =POWER(D2286/I2286,1/5)-1 -> #VALUE!
A2287: 8130.HK | B2287: 大地国际集团 | C2287: 0.01 | D2287: -287148000 | E2287: -217838000 | F2287: -152500000 | G2287: 34588000 | H2287: -42680000 | I2287: -60037000 | J2287: -113701000 | K2287: -65349000 | L2287: -155627000 | M2287: -113528000 | N2287: =POWER(D2287/M2287,1/9)-1 -> 0.10860820831675677 | O2287: =POWER(D2287/I2287,1/5)-1 -> 0.36753157508816492
A2288: 1611.HK | B2288: 新火科技控股 | C2288: 1.84 | D2288: -287371000 | E2288: -199670000 | F2288: 141477000 | G2288: -32582000 | H2288: -6076000 | I2288: 6591000 | J2288: 5194000 | K2288: 14664000 | L2288: 33208000 | M2288: 30194000 | N2288: =POWER(D2288/M2288,1/9)-1 -> -2.284472168987981 | O2288: =POWER(D2288/I2288,1/5)-1 -> -3.1276408768610797
A2289: 0821.HK | B2289: 汇盈控股 | C2289: 0.05 | D2289: -287754000 | E2289: -178091000 | F2289: 15188000 | G2289: -31687000 | H2289: -93369000 | I2289: -486316000 | J2289: -67476000 | K2289: -56716000 | L2289: -12575000 | M2289: -8303000 | N2289: =POWER(D2289/M2289,1/9)-1 -> 0.48281636402910388 | O2289: =POWER(D2289/I2289,1/5)-1 -> -9.9630940842921234e-02
A2290: 0326.HK | B2290: 中国星集团 | C2290: 0.53 | D2290: -289477000 | E2290: -94101000 | F2290: -156496000 | G2290: -110430000 | H2290: -335226000 | I2290: 1053530000 | J2290: 73312000 | K2290: -335609000 | L2290: 107871000 | M2290: 209665000 | N2290: =POWER(D2290/M2290,1/9)-1 -> -2.03649055080413 | O2290: =POWER(D2290/I2290,1/5)-1 -> -1.772313153033271
A2291: 2285.HK | B2291: 泉峰控股 | C2291: 19.46 | D2291: -290077107 | E2291: 1088193152 | F2291: 1127154112 | G2291: 343915327 | H2291: -- | I2291: -- | J2291: -- | K2291: -- | L2291: -- | M2291: -- | N2291: =POWER(D2291/M2291,1/9)-1 -> #VALUE! | O2291: =POWER(D2291/I2291,1/5)-1 -> #VALUE!
A2292: 2420.HK | B2292: 子不语 | C2292: 4 | D2292: -291354613.19999999 | E2292: 124873901.40000001 | F2292: 245523270.5 | G2292: 135830115.90000001 | H2292: -- | I2292: -- | J2292: -- | K2292: -- | L2292: -- | M2292: -- | N2292: =POWER(D2292/M2292,1/9)-1 -> #VALUE! | O2292: =POWER(D2292/I2292,1/5)-1 -> #VALUE!
A2293: 0638.HK | B2293: 建溢集团 | C2293: 0.68 | D2293: -294169000 | E2293: 56858000 | F2293: 103626000 | G2293: 170049000 | H2293: 112384000 | I2293: 149821000 | J2293: 196375000 | K2293: -69843000 | L2293: -121583000 | M2293: 19818000 | N2293: =POWER(D2293/M2293,1/9)-1 -> -2.3494934677159574 | O2293: =POWER(D2293/I2293,1/5)-1 -> -2.1444711319294001
A2294: 1560.HK | B2294: 星星集团 | C2294: 0.20000000000000001 | D2294: -294595000 | E2294: 329933000 | F2294: -37134000 | G2294: 306936000 | H2294: 5724000 | I2294: 191811000 | J2294: 95814000 | K2294: 21739000 | L2294: 37102000 | M2294: 196090000 | N2294: =POWER(D2294/M2294,1/9)-1 -> -2.0462635674875376 | O2294: =POWER(D2294/I2294,1/5)-1 -> -2.0896082237741278
A2295: 1257.HK | B2295: 中国光大绿色环保 | C2295: 0.67 | D2295: -301711000 | E2295: 340201000 | F2295: 1110385000 | G2295: 1502532000 | H2295: 1621477000 | I2295: 1324871000 | J2295: 953823000 | K2295: 629222000 | L2295: 271953000 | M2295: 196368000 | N2295: =POWER(D2295/M2295,1/9)-1 -> -2.0488768302688936 | O2295: =POWER(D2295/I2295,1/5)-1 -> -1.7438468188972176
A2296: 0620.HK | B2296: 大唐西市 | C2296: 0.23 | D2296: -302064000 | E2296: 106448000 | F2296: -33656000 | G2296: 32556000 | H2296: 10286000 | I2296: -126909000 | J2296: -63925000 | K2296: -73497000 | L2296: -38142000 | M2296: -11714000 | N2296: =POWER(D2296/M2296,1/9)-1 -> 0.43489964357647759 | O2296: =POWER(D2296/I2296,1/5)-1 -> 0.18938185698548371
A2297: 9991.HK | B2297: 宝尊电商-W | C2297: 6.73 | D2297: -305206196.39999998 | E2297: -736976449 | F2297: -269181835 | G2297: 507739864.80000001 | H2297: 314349397.5 | I2297: 307094083.19999999 | J2297: 250409447.40000001 | K2297: -- | L2297: -- | M2297: -- | N2297: =POWER(D2297/M2297,1/9)-1 -> #VALUE! | O2297: =POWER(D2297/I2297,1/5)-1 -> -1.9987674484930835
A2298: 2112.HK | B2298: 恩典生命科技 | C2298: 0.17 | D2298: -309050026 | E2298: -435217920 | F2298: -444532788 | G2298: -229496553 | H2298: -444715570 | I2298: 19851356 | J2298: 26684810 | K2298: 33691130 | L2298: 4782058.5 | M2298: 17109736 | N2298: =POWER(D2298/M2298,1/9)-1 -> -2.3792494856147419 | O2298: =POWER(D2298/I2298,1/5)-1 -> -2.7316005749477563
A2299: 0612.HK | B2299: 鼎益丰控股 | C2299: 0.34 | D2299: -310932000 | E2299: -331187000 | F2299: 165130000 | G2299: 283393000 | H2299: -250770742 | I2299: 128556294 | J2299: -155077211 | K2299: -123448276 | L2299: -92697731 | M2299: -35599436 | N2299: =POWER(D2299/M2299,1/9)-1 -> 0.27227283926057844 | O2299: =POWER(D2299/I2299,1/5)-1 -> -2.1932032160255721
A2300: 0726.HK | B2300: 筑友智造科技 | C2300: 0.16 | D2300: -315733000 | E2300: -148150000 | F2300: 132375000 | G2300: 158833000 | H2300: 110749000 | I2300: 27427000 | J2300: 131719000 | K2300: -101136000 | L2300: -5212000 | M2300: -7395000 | N2300: =POWER(D2300/M2300,1/9)-1 -> 0.51758677447833956 | O2300: =POWER(D2300/I2300,1/5)-1 -> -2.630152873771312
A2301: 1104.HK | B2301: 亚太资源 | C2301: 1.04 | D2301: -318547000 | E2301: -465994000 | F2301: 1357290000 | G2301: -429401000 | H2301: 608432000 | I2301: 328115000 | J2301: 548595000 | K2301: -16845000 | L2301: -847926000 | M2301: 907260000 | N2301: =POWER(D2301/M2301,1/9)-1 -> -1.8902121724896093 | O2301: =POWER(D2301/I2301,1/5)-1 -> -1.9940986565688992
A2302: 0825.HK | B2302: 新世界百货中国 | C2302: 0.25 | D2302: -320852000 | E2302: -483381000 | F2302: -229359000 | G2302: -483668000 | H2302: 32663000 | I2302: 11028000 | J2302: 128611000 | K2302: 45643000 | L2302: 69741000 | M2302: 520525000 | N2302: =POWER(D2302/M2302,1/9)-1 -> -1.947657626387969 | O2302: =POWER(D2302/I2302,1/5)-1 -> -2.9622828068706379
A2303: 0926.HK | B2303: 碧生源 | C2303: 3.05 | D2303: -328030176.60000002 | E2303: -111782300.90000001 | F2303: -178425568.5 | G2303: 54206420.100000001 | H2303: 181423890 | I2303: -108507441.40000001 | J2303: 4898705.4000000004 | K2303: -76358432.5 | L2303: 108538830.55 | M2303: 56199176.5 | N2303: =POWER(D2303/M2303,1/9)-1 -> -2.2165544129696162 | O2303: =POWER(D2303/I2303,1/5)-1 -> 0.24764449576462577
A2304: 0298.HK | B2304: 庄士中国 | C2304: 0.12 | D2304: -328687000 | E2304: 227757000 | F2304: 419039000 | G2304: -192355000 | H2304: 167842000 | I2304: 279882000 | J2304: 1451977000 | K2304: 85006000 | L2304: 94491000 | M2304: 110268000 | N2304: =POWER(D2304/M2304,1/9)-1 -> -2.1290252895485753 | O2304: =POWER(D2304/I2304,1/5)-1 -> -2.0326698839946546
A2305: 0491.HK | B2305: 英皇文化产业 | C2305: 0.04 | D2305: -329939000 | E2305: -201379000 | F2305: -219775000 | G2305: -342181000 | H2305: -126437000 | I2305: -153797000 | J2305: -62327000 | K2305: -106015000 | L2305: -75115000 | M2305: -66832000 | N2305: =POWER(D2305/M2305,1/9)-1 -> 0.19412532966637364 | O2305: =POWER(D2305/I2305,1/5)-1 -> 0.16492283360145321
A2306: 1060.HK | B2306: 阿里影业 | C2306: 0.41 | D2306: -332749319.39999998 | E2306: 209471212.25 | F2306: -114056301.75 | G2306: -1256019740.5 | H2306: -295966904 | I2306: -- | J2306: -- | K2306: -1065217580 | L2306: 548086342 | M2306: -520718720.39999998 | N2306: =POWER(D2306/M2306,1/9)-1 -> -4.8540202117635101e-02 | O2306: =POWER(D2306/I2306,1/5)-1 -> #VALUE!
A2307: 0370.HK | B2307: 国华 | C2307: 0.09 | D2307: -333793000 | E2307: -6349000 | F2307: -- | G2307: -- | H2307: -106067000 | I2307: -75533000 | J2307: 24533000 | K2307: -10540000 | L2307: -48686000 | M2307: -17538000 | N2307: =POWER(D2307/M2307,1/9)-1 -> 0.38728710989545156 | O2307: =POWER(D2307/I2307,1/5)-1 -> 0.34607140380213997
A2308: 9990.HK | B2308: 祖龙娱乐 | C2308: 1.28 | D2308: -345917968.19999999 | E2308: -866997870.70000005 | F2308: -371421462.5 | G2308: -904678321.79999995 | H2308: 133378095 | I2308: -84860996.599999994 | J2308: -190872073.40000001 | K2308: -- | L2308: -- | M2308: -- | N2308: =POWER(D2308/M2308,1/9)-1 -> #VALUE! | O2308: =POWER(D2308/I2308,1/5)-1 -> 0.32450315984143807
A2309: 1172.HK | B2309: 融太集团 | C2309: 0.03 | D2309: -352847000 | E2309: -269993000 | F2309: 2983000 | G2309: -73715000 | H2309: 2541000 | I2309: 14696000 | J2309: 50437000 | K2309: 93146000 | L2309: -16649000 | M2309: -42521000 | N2309: =POWER(D2309/M2309,1/9)-1 -> 0.26505444734200623 | O2309: =POWER(D2309/I2309,1/5)-1 -> -2.8883281057700287
A2310: 1833.HK | B2310: 平安好医生 | C2310: 11.08 | D2310: -353627542.80000001 | E2310: -685398588.89999998 | F2310: -1883505083.5 | G2310: -1130490928.2 | H2310: -820088550 | I2310: -1038018353.2 | J2310: -1200869792.7 | K2310: -842566418.75 | L2310: -380696793.39999998 | M2310: -- | N2310: =POWER(D2310/M2310,1/9)-1 -> #VALUE! | O2310: =POWER(D2310/I2310,1/5)-1 -> -0.19375281707369729
A2311: 9955.HK | B2311: 智云健康 | C2311: 1.75 | D2311: -354143853 | E2311: -1905289829.7 | F2311: -5068098968.5 | G2311: -3417147502.5 | H2311: -- | I2311: -- | J2311: -- | K2311: -- | L2311: -- | M2311: -- | N2311: =POWER(D2311/M2311,1/9)-1 -> #VALUE! | O2311: =POWER(D2311/I2311,1/5)-1 -> #VALUE!
A2312: 1121.HK | B2312: 金阳新能源 | C2312: 3.21 | D2312: -357777756 | E2312: -188437824 | F2312: 11293563.5 | G2312: -129626276.40000001 | H2312: -351382230 | I2312: -313488460.80000001 | J2312: -521965093 | K2312: -352908552.5 | L2312: -30188027.449999999 | M2312: -38874580.799999997 | N2312: =POWER(D2312/M2312,1/9)-1 -> 0.27969151618849852 | O2312: =POWER(D2312/I2312,1/5)-1 -> 2.6782256745037536e-02
A2313: 2429.HK | B2313: 友宝在线 | C2313: 17.26 | D2313: -358780779 | E2313: -- | F2313: -- | G2313: -- | H2313: -- | I2313: -- | J2313: -- | K2313: -- | L2313: -- | M2313: -- | N2313: =POWER(D2313/M2313,1/9)-1 -> #VALUE! | O2313: =POWER(D2313/I2313,1/5)-1 -> #VALUE!
A2314: 3398.HK | B2314: 华鼎控股 | C2314: 0.20000000000000001 | D2314: -361526000 | E2314: -151678000 | F2314: -333295000 | G2314: 146044000 | H2314: -54686000 | I2314: 21045000 | J2314: 149689000 | K2314: 81827000 | L2314: -39098000 | M2314: -280928000 | N2314: =POWER(D2314/M2314,1/9)-1 -> 2.8422600495547012e-02 | O2314: =POWER(D2314/I2314,1/5)-1 -> -2.7660301806419842
A2315: 6978.HK | B2315: 永泰生物-B | C2315: 3.2999999999999998 | D2315: -367028587.80000001 | E2315: -358858762.89999998 | F2315: -433747288 | G2315: -523300119.30000001 | H2315: -121585117.5 | I2315: -39584567.600000001 | J2315: -19474931.600000001 | K2315: -- | L2315: -- | M2315: -- | N2315: =POWER(D2315/M2315,1/9)-1 -> #VALUE! | O2315: =POWER(D2315/I2315,1/5)-1 -> 0.56111464343552919
A2316: 0295.HK | B2316: 江山控股 | C2316: 0.02 | D2316: -368103960 | E2316: -332651871.80000001 | F2316: -1147323438.5 | G2316: -747104374.20000005 | H2316: -780717907.5 | I2316: 17551519 | J2316: 142693078 | K2316: 60786486.25 | L2316: -116421893.7 | M2316: 14559249.300000001 | N2316: =POWER(D2316/M2316,1/9)-1 -> -2.4317598099508606 | O2316: =POWER(D2316/I2316,1/5)-1 -> -2.8379392660332625
A2317: 0120.HK | B2317: 四海国际 | C2317: 0.34 | D2317: -372300000 | E2317: 4000000 | F2317: 33600000 | G2317: -123500000 | H2317: -170300000 | I2317: 201900000 | J2317: 13700000 | K2317: -115253000 | L2317: -344938000 | M2317: -127361000 | N2317: =POWER(D2317/M2317,1/9)-1 -> 0.12657949353157472 | O2317: =POWER(D2317/I2317,1/5)-1 -> -2.1301896958987099
A2318: 1431.HK | B2318: 原生态牧业 | C2318: 0.09 | D2318: -372378043.80000001 | E2318: 25766932.100000001 | F2318: 192234255 | G2318: 688859796.89999998 | H2318: 249291900 | I2318: -633417981.79999995 | J2318: -81413702.299999997 | K2318: -98422301.25 | L2318: 77822756.650000006 | M2318: 522608041 | N2318: =POWER(D2318/M2318,1/9)-1 -> -1.9630422284948175 | O2318: =POWER(D2318/I2318,1/5)-1 -> -0.10079495345914358
A2319: 0312.HK | B2319: 岁宝百货 | C2319: 0.04 | D2319: -373784468.39999998 | E2319: -627355587.70000005 | F2319: -536383653.5 | G2319: -89530760.400000006 | H2319: 152886292.5 | I2319: 125076348.59999999 | J2319: 54681829 | K2319: 67223957.5 | L2319: 59060054.950000003 | M2319: 40898674.600000001 | N2319: =POWER(D2319/M2319,1/9)-1 -> -2.2786980472029383 | O2319: =POWER(D2319/I2319,1/5)-1 -> -2.2447702824326567
A2320: 3322.HK | B2320: 永嘉集团 | C2320: 0.17 | D2320: -375291000 | E2320: 10070000 | F2320: -66416000 | G2320: -233821000 | H2320: 64214000 | I2320: 42253000 | J2320: 21045000 | K2320: 143494000 | L2320: 243419000 | M2320: 31770000 | N2320: =POWER(D2320/M2320,1/9)-1 -> -2.3156794878486533 | O2320: =POWER(D2320/I2320,1/5)-1 -> -2.5477546589674542
A2321: 2323.HK | B2321: 融科控股 | C2321: 0.02 | D2321: -376286000 | E2321: -466136000 | F2321: -451590000 | G2321: -1029974000 | H2321: -658619000 | I2321: -427668000 | J2321: 456113000 | K2321: 177228000 | L2321: 17904000 | M2321: -161895000 | N2321: =POWER(D2321/M2321,1/9)-1 -> 9.8242614994004773e-02 | O2321: =POWER(D2321/I2321,1/5)-1 -> -2.5274650236457252e-02
A2322: 0997.HK | B2322: 普汇中金国际 | C2322: 0.03 | D2322: -378642000 | E2322: -334063000 | F2322: -178853000 | G2322: -130060000 | H2322: 18887000 | I2322: -77877000 | J2322: 1337000 | K2322: 157663000 | L2322: -80189000 | M2322: -90342000 | N2322: =POWER(D2322/M2322,1/9)-1 -> 0.17259702279132338 | O2322: =POWER(D2322/I2322,1/5)-1 -> 0.37203096972811922
A2323: 1269.HK | B2323: 首控集团 | C2323: 0.08 | D2323: -380569946.39999998 | E2323: -474632281.60000002 | F2323: -1185601308.5 | G2323: -445441635.60000002 | H2323: -2444900025 | I2323: -1579025281.8 | J2323: -362270414.10000002 | K2323: 198540370 | L2323: -26615187.550000001 | M2323: 3190880.2999999998 | N2323: =POWER(D2323/M2323,1/9)-1 -> -2.7010805787393881 | O2323: =POWER(D2323/I2323,1/5)-1 -> -0.24766878572096984
A2324: 2358.HK | B2324: 久融控股 | C2324: 0.02 | D2324: -383293000 | E2324: -90151000 | F2324: 16291000 | G2324: 22904000 | H2324: 26241000 | I2324: 54193000 | J2324: 31641000 | K2324: -35317000 | L2324: -38920000 | M2324: 14385000 | N2324: =POWER(D2324/M2324,1/9)-1 -> -2.440132116535108 | O2324: =POWER(D2324/I2324,1/5)-1 -> -2.4788275711660304
A2325: 1115.HK | B2325: 西藏水资源 | C2325: 0.29999999999999999 | D2325: -386812805.39999998 | E2325: -115591894.59999999 | F2325: 57495173 | G2325: 20230118.699999999 | H2325: -832669365 | I2325: 361541935.19999999 | J2325: 377862108.60000002 | K2325: 341958295 | L2325: 325727040.35000002 | M2325: 428652402.10000002 | N2325: =POWER(D2325/M2325,1/9)-1 -> -1.9886531477990621 | O2325: =POWER(D2325/I2325,1/5)-1 -> -2.013604273491485
A2326: 0721.HK | B2326: 中国金融国际 | C2326: 0.03 | D2326: -387171000 | E2326: -215195000 | F2326: -66645000 | G2326: -218500000 | H2326: -327563000 | I2326: -72842000 | J2326: -184981000 | K2326: -489529000 | L2326: -626000 | M2326: -212880000 | N2326: =POWER(D2326/M2326,1/9)-1 -> 6.8717956720828255e-02 | O2326: =POWER(D2326/I2326,1/5)-1 -> 0.39670340441345364
A2327: 6657.HK | B2327: 百望股份 | C2327: 35.55 | D2327: -392417676 | E2327: -- | F2327: -- | G2327: -- | H2327: -- | I2327: -- | J2327: -- | K2327: -- | L2327: -- | M2327: -- | N2327: =POWER(D2327/M2327,1/9)-1 -> #VALUE! | O2327: =POWER(D2327/I2327,1/5)-1 -> #VALUE!
A2328: 1167.HK | B2328: 加科思-B | C2328: 1.68 | D2328: -393666247.80000001 | E2328: -419496394.10000002 | F2328: -368803481.5 | G2328: -1804125394.5 | H2328: -474726292.5 | I2328: -169892783.19999999 | J2328: -- | K2328: -- | L2328: -- | M2328: -- | N2328: =POWER(D2328/M2328,1/9)-1 -> #VALUE! | O2328: =POWER(D2328/I2328,1/5)-1 -> 0.18301608595403995
A2329: 2162.HK | B2329: 康诺亚-B | C2329: 32.05 | D2329: -393927143.39999998 | E2329: -347584531.5 | F2329: -4760009870.5 | G2329: -975669077.70000005 | H2329: -- | I2329: -- | J2329: -- | K2329: -- | L2329: -- | M2329: -- | N2329: =POWER(D2329/M2329,1/9)-1 -> #VALUE! | O2329: =POWER(D2329/I2329,1/5)-1 -> #VALUE!
A2330: 0547.HK | B2330: 数字王国 | C2330: 0.22 | D2330: -394571000 | E2330: -206320000 | F2330: -722004000 | G2330: -598527000 | H2330: -400813000 | I2330: -518030000 | J2330: -524893000 | K2330: -479377000 | L2330: -156298000 | M2330: 43323000 | N2330: =POWER(D2330/M2330,1/9)-1 -> -2.2782056642599793 | O2330: =POWER(D2330/I2330,1/5)-1 -> -5.2991122385717127e-02
A2331: 6638.HK | B2331: 金融壹账通 | C2331: 0.49 | D2331: -397608183 | E2331: -984012299.39999998 | F2331: -1569440425.5 | G2331: -1613365375.2 | H2331: -- | I2331: -- | J2331: -- | K2331: -- | L2331: -- | M2331: -- | N2331: =POWER(D2331/M2331,1/9)-1 -> #VALUE! | O2331: =POWER(D2331/I2331,1/5)-1 -> #VALUE!
A2332: 2616.HK | B2332: 基石药业-B | C2332: 1.22 | D2332: -402561910.80000001 | E2332: -1018311051.8 | F2332: -2351162450 | G2332: -1455308708.0999999 | H2332: -2579686170 | I2332: -1987172392.2 | J2332: -370345005.60000002 | K2332: -273468623.75 | L2332: -- | M2332: -- | N2332: =POWER(D2332/M2332,1/9)-1 -> #VALUE! | O2332: =POWER(D2332/I2332,1/5)-1 -> -0.2733597891588877
A2333: 2105.HK | B2333: 来凯医药-B | C2333: 4.2999999999999998 | D2333: -404293906.80000001 | E2333: -881716191.39999998 | F2333: -917106418 | G2333: -306447025.19999999 | H2333: -- | I2333: -- | J2333: -- | K2333: -- | L2333: -- | M2333: -- | N2333: =POWER(D2333/M2333,1/9)-1 -> #VALUE! | O2333: =POWER(D2333/I2333,1/5)-1 -> #VALUE!
A2334: 9877.HK | B2334: 健世科技-B | C2334: 3.63 | D2334: -407497003.19999999 | E2334: -495586739.10000002 | F2334: -612883066.5 | G2334: -356910879.30000001 | H2334: -- | I2334: -- | J2334: -- | K2334: -- | L2334: -- | M2334: -- | N2334: =POWER(D2334/M2334,1/9)-1 -> #VALUE! | O2334: =POWER(D2334/I2334,1/5)-1 -> #VALUE!
A2335: 2453.HK | B2335: 美中嘉和 | C2335: 43.700000000000003 | D2335: -408981258 | E2335: -- | F2335: -- | G2335: -- | H2335: -- | I2335: -- | J2335: -- | K2335: -- | L2335: -- | M2335: -- | N2335: =POWER(D2335/M2335,1/9)-1 -> #VALUE! | O2335: =POWER(D2335/I2335,1/5)-1 -> #VALUE!
A2336: 2678.HK | B2336: 天虹国际集团 | C2336: 4.17 | D2336: -411842340 | E2336: 176895104.80000001 | F2336: 3287990665 | G2336: 616289773.5 | H2336: 987563805 | I2336: 1324296551.2 | J2336: 1380967351.8 | K2336: 1319643823.75 | L2336: 694840917.29999995 | M2336: 382757135.89999998 | N2336: =POWER(D2336/M2336,1/9)-1 -> -2.008170971436968 | O2336: =POWER(D2336/I2336,1/5)-1 -> -1.7916790435900785
A2337: 1228.HK | B2337: 北海康成-B | C2337: 0.39 | D2337: -415281119.39999998 | E2337: -545408147.5 | F2337: -1318793847 | G2337: -1008398651.7 | H2337: -- | I2337: -- | J2337: -- | K2337: -- | L2337: -- | M2337: -- | N2337: =POWER(D2337/M2337,1/9)-1 -> #VALUE! | O2337: =POWER(D2337/I2337,1/5)-1 -> #VALUE!
A2338: 1541.HK | B2338: 宜明昂科-B | C2338: 13 | D2338: -415962955.80000001 | E2338: -454504721.39999998 | F2338: -897496050.5 | G2338: -787774386 | H2338: -- | I2338: -- | J2338: -- | K2338: -- | L2338: -- | M2338: -- | N2338: =POWER(D2338/M2338,1/9)-1 -> #VALUE! | O2338: =POWER(D2338/I2338,1/5)-1 -> #VALUE!
A2339: 1477.HK | B2339: 欧康维视生物-B | C2339: 7.05 | D2339: -416322509.39999998 | E2339: -454221568.30000001 | F2339: -318360204 | G2339: -2699493785.4000001 | H2339: -1466507542.5 | I2339: -236382468.80000001 | J2339: -- | K2339: -- | L2339: -- | M2339: -- | N2339: =POWER(D2339/M2339,1/9)-1 -> #VALUE! | O2339: =POWER(D2339/I2339,1/5)-1 -> 0.11985791967879234
A2340: 1198.HK | B2340: 皇朝家居 | C2340: 0.45 | D2340: -418239763.19999999 | E2340: 6301566.5999999996 | F2340: 76897000 | G2340: 714780000 | H2340: 62976000 | I2340: 52646000 | J2340: 46877000 | K2340: 43204000 | L2340: -97463000 | M2340: -151646000 | N2340: =POWER(D2340/M2340,1/9)-1 -> 0.11932171435378658 | O2340: =POWER(D2340/I2340,1/5)-1 -> -2.5136030288351954
A2341: 2315.HK | B2341: 百奥赛图-B | C2341: 7.42 | D2341: -419790886.19999999 | E2341: -679054154.5 | F2341: -668057812 | G2341: -510241662.89999998 | H2341: -- | I2341: -- | J2341: -- | K2341: -- | L2341: -- | M2341: -- | N2341: =POWER(D2341/M2341,1/9)-1 -> #VALUE! | O2341: =POWER(D2341/I2341,1/5)-1 -> #VALUE!
A2342: 6622.HK | B2342: 兆科眼科-B | C2342: 1.35 | D2342: -422078655.60000002 | E2342: -459494307.69999999 | F2342: -2607915610 | G2342: -866488653.89999998 | H2342: -- | I2342: -- | J2342: -- | K2342: -- | L2342: -- | M2342: -- | N2342: =POWER(D2342/M2342,1/9)-1 -> #VALUE! | O2342: =POWER(D2342/I2342,1/5)-1 -> #VALUE!
A2343: 0601.HK | B2343: 稀镁科技 | C2343: 0.07 | D2343: -423600000 | E2343: 1404000 | F2343: -331883000 | G2343: -74011000 | H2343: 209732000 | I2343: 285772000 | J2343: 168320000 | K2343: 137061000 | L2343: -107460000 | M2343: -80409000 | N2343: =POWER(D2343/M2343,1/9)-1 -> 0.20277246345458244 | O2343: =POWER(D2343/I2343,1/5)-1 -> -2.0819003354069645
A2344: 0196.HK | B2344: 宏华集团 | C2344: 0.08 | D2344: -423787631.39999998 | E2344: -715686945.79999995 | F2344: -878200379.5 | G2344: 59189754 | H2344: 120099960 | I2344: 93691978.200000003 | J2344: -1485878295.2 | K2344: -677516901.25 | L2344: -296608042.35000002 | M2344: 114540997.3 | N2344: =POWER(D2344/M2344,1/9)-1 -> -2.1564634837396754 | O2344: =POWER(D2344/I2344,1/5)-1 -> -2.3523502128795588
A2345: 1124.HK | B2345: 沿海家园 | C2345: 0.23 | D2345: -426485000 | E2345: -942595000 | F2345: -281028000 | G2345: -336784000 | H2345: 132475000 | I2345: 231077000 | J2345: 707452000 | K2345: -123268000 | L2345: -508414000 | M2345: 64824000 | N2345: =POWER(D2345/M2345,1/9)-1 -> -2.2328423605511425 | O2345: =POWER(D2345/I2345,1/5)-1 -> -2.1303928663105038
A2346: 2163.HK | B2346: 远大住工 | C2346: 1.06 | D2346: -428246973 | E2346: -911628891 | F2346: 39706861.5 | G2346: 257950998 | H2346: 756456982.5 | I2346: 530933734.39999998 | J2346: 201883969.90000001 | K2346: 219634117.5 | L2346: -- | M2346: -- | N2346: =POWER(D2346/M2346,1/9)-1 -> #VALUE! | O2346: =POWER(D2346/I2346,1/5)-1 -> -1.9579234309733815
A2347: 1246.HK | B2347: 保集健康 | C2347: 0.02 | D2347: -428255000 | E2347: -517798000 | F2347: -142486000 | G2347: -189432000 | H2347: -200114000 | I2347: -213775000 | J2347: -569421000 | K2347: -193393000 | L2347: 90562000 | M2347: 73379000 | N2347: =POWER(D2347/M2347,1/9)-1 -> -2.2165378570206205 | O2347: =POWER(D2347/I2347,1/5)-1 -> 0.14907693000599398
A2348: 9996.HK | B2348: 沛嘉医疗-B | C2348: 2.76 | D2348: -430285905 | E2348: -460049332.89999998 | F2348: -703127492 | G2348: -2465631086.4000001 | H2348: -594484297.5 | I2348: -94076825 | J2348: -- | K2348: -- | L2348: -- | M2348: -- | N2348: =POWER(D2348/M2348,1/9)-1 -> #VALUE! | O2348: =POWER(D2348/I2348,1/5)-1 -> 0.35536071532646507
A2349: 3313.HK | B2349: 雅高控股 | C2349: 0.23 | D2349: -434254149 | E2349: -167236312.59999999 | F2349: -511569161 | G2349: -274418288.39999998 | H2349: -100758270 | I2349: -450641939.60000002 | J2349: 10130705 | K2349: -606742.5 | L2349: 88682402.349999994 | M2349: 127700102.8 | N2349: =POWER(D2349/M2349,1/9)-1 -> -2.1456749420548276 | O2349: =POWER(D2349/I2349,1/5)-1 -> -7.3812516049266419e-03
A2350: 1321.HK | B2350: 中国新城市 | C2350: 0.81 | D2350: -443013883.19999999 | E2350: -487929196.30000001 | F2350: -361394032 | G2350: 52954925.100000001 | H2350: 29356725 | I2350: -277276426.39999998 | J2350: 585668644.5 | K2350: 163400422.5 | L2350: 870673328.85000002 | M2350: 594629341.60000002 | N2350: =POWER(D2350/M2350,1/9)-1 -> -1.9678248699920657 | O2350: =POWER(D2350/I2350,1/5)-1 -> 9.8249154657177762e-02
A2351: 9663.HK | B2351: 国鸿氢能 | C2351: 14.300000000000001 | D2351: -443354801.39999998 | E2351: -- | F2351: -- | G2351: -- | H2351: -- | I2351: -- | J2351: -- | K2351: -- | L2351: -- | M2351: -- | N2351: =POWER(D2351/M2351,1/9)-1 -> #VALUE! | O2351: =POWER(D2351/I2351,1/5)-1 -> #VALUE!
A2352: 3300.HK | B2352: 中国玻璃 | C2352: 0.57 | D2352: -449174527.19999999 | E2352: 131049120.8 | F2352: 901671595.5 | G2352: -100969424.7 | H2352: 92271975 | I2352: 106445436.8 | J2352: 77886538.5 | K2352: 23397368.75 | L2352: -501454783.44999999 | M2352: 2254955.2999999998 | N2352: =POWER(D2352/M2352,1/9)-1 -> -2.8008404721515041 | O2352: =POWER(D2352/I2352,1/5)-1 -> -2.3336983509192919
A2353: 6611.HK | B2353: 三巽集团 | C2353: 0.09 | D2353: -453053979 | E2353: -97156484.400000006 | F2353: 3662479.5 | G2353: 437728850.69999999 | H2353: -- | I2353: -- | J2353: -- | K2353: -- | L2353: -- | M2353: -- | N2353: =POWER(D2353/M2353,1/9)-1 -> #VALUE! | O2353: =POWER(D2353/I2353,1/5)-1 -> #VALUE!
A2354: 1240.HK | B2354: 青建国际 | C2354: 0.19 | D2354: -453104000 | E2354: -543331000 | F2354: 239333000 | G2354: 201454000 | H2354: 238842000 | I2354: 225298000 | J2354: 437978000 | K2354: 386479000 | L2354: 577317000 | M2354: 276299000 | N2354: =POWER(D2354/M2354,1/9)-1 -> -2.0564981269883633 | O2354: =POWER(D2354/I2354,1/5)-1 -> -2.1499742397102168
A2355: 0432.HK | B2355: 盈大地产 | C2355: 0.20000000000000001 | D2355: -466000000 | E2355: -598000000 | F2355: -825000000 | G2355: -749000000 | H2355: -295000000 | I2355: -437000000 | J2355: -339000000 | K2355: -364000000 | L2355: -81000000 | M2355: 1491000000 | N2355: =POWER(D2355/M2355,1/9)-1 -> -1.8787770309684619 | O2355: =POWER(D2355/I2355,1/5)-1 -> 1.2933410141225954e-02
A2356: 0008.HK | B2356: 电讯盈科 | C2356: 3.97 | D2356: -471000000 | E2356: 158000000 | F2356: 1039000000 | G2356: -1020000000 | H2356: 681000000 | I2356: 897000000 | J2356: 2038000000 | K2356: 2051000000 | L2356: 2295000000 | M2356: 3310000000 | N2356: =POWER(D2356/M2356,1/9)-1 -> -1.8052121579491804 | O2356: =POWER(D2356/I2356,1/5)-1 -> -1.8791150050609369
A2357: 2391.HK | B2357: 涂鸦智能-W | C2357: 12.6 | D2357: -471120465 | E2357: -1141334400 | F2357: -1367956352 | G2357: -518768736 | H2357: -- | I2357: -- | J2357: -- | K2357: -- | L2357: -- | M2357: -- | N2357: =POWER(D2357/M2357,1/9)-1 -> #VALUE! | O2357: =POWER(D2357/I2357,1/5)-1 -> #VALUE!
A2358: 0086.HK | B2358: 新鸿基公司 | C2358: 2.48 | D2358: -471400000 | E2358: -1534800000 | F2358: 2813700000 | G2358: 2547700000 | H2358: 2085200000 | I2358: 1183800000 | J2358: 1824300000 | K2358: 1109600000 | L2358: 3896500000 | M2358: 1328400000 | N2358: =POWER(D2358/M2358,1/9)-1 -> -1.891264781630793 | O2358: =POWER(D2358/I2358,1/5)-1 -> -1.8318063826940665
A2359: 0431.HK | B2359: 大中华金融 | C2359: 0.09 | D2359: -472487000 | E2359: -326213000 | F2359: -202592000 | G2359: -335628000 | H2359: -206395000 | I2359: -58603000 | J2359: 26020000 | K2359: -970550000 | L2359: 116130000 | M2359: -19575000 | N2359: =POWER(D2359/M2359,1/9)-1 -> 0.42440014871647613 | O2359: =POWER(D2359/I2359,1/5)-1 -> 0.51807770799867758
A2360: 2256.HK | B2360: 和誉-B | C2360: 3.1000000000000001 | D2360: -473101284.60000002 | E2360: -559093128.60000002 | F2360: -2216336428.5 | G2360: -842243024.10000002 | H2360: -- | I2360: -- | J2360: -- | K2360: -- | L2360: -- | M2360: -- | N2360: =POWER(D2360/M2360,1/9)-1 -> #VALUE! | O2360: =POWER(D2360/I2360,1/5)-1 -> #VALUE!
A2361: 1516.HK | B2361: 融创服务 | C2361: 1.74 | D2361: -476921541.60000002 | E2361: -543633646.20000005 | F2361: 1562861187 | G2361: 711324728.10000002 | H2361: 301611015 | I2361: 111932350.2 | J2361: 51502346.200000003 | K2361: -- | L2361: -- | M2361: -- | N2361: =POWER(D2361/M2361,1/9)-1 -> #VALUE! | O2361: =POWER(D2361/I2361,1/5)-1 -> -2.336282445832746
A2362: 0938.HK | B2362: 民生国际 | C2362: 1.13 | D2362: -482922000 | E2362: -371735000 | F2362: -521821000 | G2362: -202914000 | H2362: -128976000 | I2362: -92650000 | J2362: -121926000 | K2362: 51192000 | L2362: 10979000 | M2362: 68463000 | N2362: =POWER(D2362/M2362,1/9)-1 -> -2.2424216401606243 | O2362: =POWER(D2362/I2362,1/5)-1 -> 0.39125363928071333
A2363: 9959.HK | B2363: 联易融科技-W | C2363: 1.64 | D2363: -483687288 | E2363: -15181969.800000001 | F2363: -15908446855 | G2363: -854659046.39999998 | H2363: -- | I2363: -- | J2363: -- | K2363: -- | L2363: -- | M2363: -- | N2363: =POWER(D2363/M2363,1/9)-1 -> #VALUE! | O2363: =POWER(D2363/I2363,1/5)-1 -> #VALUE!
A2364: 1165.HK | B2364: 顺风清洁能源 | C2364: 0.03 | D2364: -492695859.60000002 | E2364: -196176590 | F2364: -912512094 | G2364: -658263723.89999998 | H2364: -2125178805 | I2364: -1942030318 | J2364: -997544745 | K2364: -2344563033.75 | L2364: 52690568.149999999 | M2364: 1632100956.2 | N2364: =POWER(D2364/M2364,1/9)-1 -> -1.8753939558725603 | O2364: =POWER(D2364/I2364,1/5)-1 -> -0.2399107655842293
A2365: 2168.HK | B2365: 佳兆业美好 | C2365: 1.99 | D2365: -493272460.80000001 | E2365: 105347618.5 | F2365: 69558947 | G2365: 264543396.90000001 | H2365: 183156015 | I2365: 61548161.600000001 | J2365: 85650614.900000006 | K2365: 64579182.5 | L2365: 67881606 | M2365: -- | N2365: =POWER(D2365/M2365,1/9)-1 -> #VALUE! | O2365: =POWER(D2365/I2365,1/5)-1 -> -2.5162623696304625
A2366: 0162.HK | B2366: 世纪金花 | C2366: 0.09 | D2366: -496852650 | E2366: -408075509.69999999 | F2366: -450575591.5 | G2366: -1524553330.5 | H2366: -305310340 | I2366: 34032968.100000001 | J2366: -397753239.30000001 | K2366: -- | L2366: -- | M2366: 120149000 | N2366: =POWER(D2366/M2366,1/9)-1 -> -2.1708488339840715 | O2366: =POWER(D2366/I2366,1/5)-1 -> -2.7094860327478214
A2367: 1360.HK | B2367: 诺发集团 | C2367: 0.01 | D2367: -506497000 | E2367: -122867000 | F2367: -822000 | G2367: 137097000 | H2367: 106251000 | I2367: 90706000 | J2367: -36411000 | K2367: -67346000 | L2367: 45919000 | M2367: 14120000 | N2367: =POWER(D2367/M2367,1/9)-1 -> -2.4885010014866005 | O2367: =POWER(D2367/I2367,1/5)-1 -> -2.4105489836472502
A2368: 6628.HK | B2368: 创胜集团-B | C2368: 1.47 | D2368: -507069234 | E2368: -458849034.5 | F2368: -2100682403.5 | G2368: -377386529.39999998 | H2368: -- | I2368: -- | J2368: -- | K2368: -- | L2368: -- | M2368: -- | N2368: =POWER(D2368/M2368,1/9)-1 -> #VALUE! | O2368: =POWER(D2368/I2368,1/5)-1 -> #VALUE!
A2369: 0910.HK | B2369: 中国三迪 | C2369: 0.04 | D2369: -509258345.39999998 | E2369: 47496394.299999997 | F2369: 207806221.5 | G2369: 501197525.69999999 | H2369: 538819387.5 | I2369: -114580000 | J2369: -169389000 | K2369: 161076000 | L2369: -266506000 | M2369: -439261000 | N2369: =POWER(D2369/M2369,1/9)-1 -> 1.6564774164866014e-02 | O2369: =POWER(D2369/I2369,1/5)-1 -> 0.34761509613417507
A2370: 0328.HK | B2370: 爱高集团 | C2370: 4.12 | D2370: -510242000 | E2370: -594575000 | F2370: -360463000 | G2370: -599374000 | H2370: -563134000 | I2370: -85808000 | J2370: 73897000 | K2370: 506028000 | L2370: 114250000 | M2370: -19099000 | N2370: =POWER(D2370/M2370,1/9)-1 -> 0.44055388618111002 | O2370: =POWER(D2370/I2370,1/5)-1 -> 0.42839948493241287
A2371: 0846.HK | B2371: 明发集团 | C2371: 0.21 | D2371: -512064617.39999998 | E2371: 54104804.100000001 | F2371: 2305313496.5 | G2371: 1281297267.5999999 | H2371: 1063985160 | I2371: 973589533.60000002 | J2371: 1227937358 | K2371: 1299534643.75 | L2371: 445772344.10000002 | M2371: 1034895949 | N2371: =POWER(D2371/M2371,1/9)-1 -> -1.9247994537755913 | O2371: =POWER(D2371/I2371,1/5)-1 -> -1.8794067085641251
A2372: 2160.HK | B2372: 心通医疗-B | C2372: 0.84 | D2372: -516895570.80000001 | E2372: -512602999.5 | F2372: -224406768 | G2372: -474479895.30000001 | H2372: -161503335 | I2372: -68615451.799999997 | J2372: -- | K2372: -- | L2372: -- | M2372: -- | N2372: =POWER(D2372/M2372,1/9)-1 -> #VALUE! | O2372: =POWER(D2372/I2372,1/5)-1 -> 0.49760119071766118
A2373: 0471.HK | B2373: 中播数据 | C2373: 0.09 | D2373: -521876343 | E2373: -218413184 | F2373: -276337726 | G2373: -990058100 | H2373: -221181948 | I2373: 194345872 | J2373: -51744308 | K2373: -134353558 | L2373: -165899452.5 | M2373: -15338637.890000001 | N2373: =POWER(D2373/M2373,1/9)-1 -> 0.47978243653708974 | O2373: =POWER(D2373/I2373,1/5)-1 -> -2.2184240365835257
A2374: 0582.HK | B2374: 神话世界 | C2374: 0.31 | D2374: -522439000 | E2374: -216911000 | F2374: -1055766000 | G2374: -2115001000 | H2374: -2132855000 | I2374: -701527000 | J2374: 505067000 | K2374: -1067455000 | L2374: -987971000 | M2374: -293677000 | N2374: =POWER(D2374/M2374,1/9)-1 -> 6.6095680752843444e-02 | O2374: =POWER(D2374/I2374,1/5)-1 -> -5.7246312506040176e-02
A2375: 2892.HK | B2375: 万城控股 | C2375: 0.46 | D2375: -528673143.60000002 | E2375: 78039701.799999997 | F2375: 203733534.5 | G2375: 134381957.40000001 | H2375: 20063595 | I2375: 38000775 | J2375: 46267948.799999997 | K2375: 75572778.75 | L2375: 491588.90000000002 | M2375: -- | N2375: =POWER(D2375/M2375,1/9)-1 -> #VALUE! | O2375: =POWER(D2375/I2375,1/5)-1 -> -2.693085767822724
A2376: 0733.HK | B2376: 合富辉煌 | C2376: 0.93 | D2376: -530950000 | E2376: -580377000 | F2376: -544799000 | G2376: 183951000 | H2376: 484321000 | I2376: 326999000 | J2376: 336794000 | K2376: 302207000 | L2376: 223330000 | M2376: 147121000 | N2376: =POWER(D2376/M2376,1/9)-1 -> -2.1532700008987939 | O2376: =POWER(D2376/I2376,1/5)-1 -> -2.1017966310927392
A2377: 2425.HK | B2377: 澳亚集团 | C2377: 1.05 | D2377: -535812694.19999999 | E2377: 26390771.399999999 | F2377: 815452456 | G2377: 743047520 | H2377: -- | I2377: -- | J2377: -- | K2377: -- | L2377: -- | M2377: -- | N2377: =POWER(D2377/M2377,1/9)-1 -> #VALUE! | O2377: =POWER(D2377/I2377,1/5)-1 -> #VALUE!
A2378: 0627.HK | B2378: 日本共生 | C2378: 1.19 | D2378: -536570168.39999998 | E2378: -748555267.39999998 | F2378: -709908773 | G2378: -1629545417.7 | H2378: 152967870 | I2378: -5781323276.1000004 | J2378: 54113000 | K2378: -13396000 | L2378: -- | M2378: -- | N2378: =POWER(D2378/M2378,1/9)-1 -> #VALUE! | O2378: =POWER(D2378/I2378,1/5)-1 -> -0.37838733584188733
A2379: 1738.HK | B2379: 飞尚无烟煤 | C2379: 0.12 | D2379: -540884811.60000002 | E2379: 59882932.299999997 | F2379: -139400753.5 | G2379: -424435590 | H2379: -115819935 | I2379: 228436179.40000001 | J2379: 218843609.30000001 | K2379: -236410658.75 | L2379: -605642229 | M2379: -279030440 | N2379: =POWER(D2379/M2379,1/9)-1 -> 7.6314632901510304e-02 | O2379: =POWER(D2379/I2379,1/5)-1 -> -2.1881409918895391
A2380: 1495.HK | B2380: 集一控股 | C2380: 0.10000000000000001 | D2380: -546552165.60000002 | E2380: -44854384.100000001 | F2380: 9255995.5 | G2380: 11812920.9 | H2380: 14605725 | I2380: 13995671.199999999 | J2380: 10767320.9 | K2380: 19554666.25 | L2380: 36776259.549999997 | M2380: 52416791.600000001 | N2380: =POWER(D2380/M2380,1/9)-1 -> -2.2975646952720048 | O2380: =POWER(D2380/I2380,1/5)-1 -> -3.0812659430624612
A2381: 2509.HK | B2381: 荃信生物-B | C2381: 19.76 | D2381: -556593357.60000002 | E2381: -- | F2381: -- | G2381: -- | H2381: -- | I2381: -- | J2381: -- | K2381: -- | L2381: -- | M2381: -- | N2381: =POWER(D2381/M2381,1/9)-1 -> #VALUE! | O2381: =POWER(D2381/I2381,1/5)-1 -> #VALUE!
A2382: 1141.HK | B2382: 民银资本 | C2382: 0.23 | D2382: -572306000 | E2382: -436597000 | F2382: 291156000 | G2382: 393220000 | H2382: 356863000 | I2382: 245196000 | J2382: 118268000 | K2382: -1874835000 | L2382: 487057000 | M2382: 417083000 | N2382: =POWER(D2382/M2382,1/9)-1 -> -2.0357795023587437 | O2382: =POWER(D2382/I2382,1/5)-1 -> -2.1847398143520644
A2383: 6990.HK | B2383: 科伦博泰生物-B | C2383: 148.69999999999999 | D2383: -572445505.79999995 | E2383: -618310481.89999998 | F2383: -1007212475 | G2383: -- | H2383: -- | I2383: -- | J2383: -- | K2383: -- | L2383: -- | M2383: -- | N2383: =POWER(D2383/M2383,1/9)-1 -> #VALUE! | O2383: =POWER(D2383/I2383,1/5)-1 -> #VALUE!
A2384: 2226.HK | B2384: 老恒和酿造 | C2384: 0.59999999999999998 | D2384: -574755199.20000005 | E2384: -548639025.89999998 | F2384: -389940800.5 | G2384: -1007504726.7 | H2384: 218241045 | I2384: 229662451.59999999 | J2384: 223924547.5 | K2384: 229624255 | L2384: 268760354.39999998 | M2384: 264059383.69999999 | N2384: =POWER(D2384/M2384,1/9)-1 -> -2.0902629551357288 | O2384: =POWER(D2384/I2384,1/5)-1 -> -2.2013749782825096
A2385: 1244.HK | B2385: 3D Medicines | C2385: 4.01 | D2385: -575172851.39999998 | E2385: -1155569235 | F2385: -1756045654 | G2385: -757309422 | H2385: -- | I2385: -- | J2385: -- | K2385: -- | L2385: -- | M2385: -- | N2385: =POWER(D2385/M2385,1/9)-1 -> #VALUE! | O2385: =POWER(D2385/I2385,1/5)-1 -> #VALUE!
A2386: 0138.HK | B2386: 中建富通 | C2386: 0.10000000000000001 | D2386: -577000000 | E2386: -465000000 | F2386: -517000000 | G2386: -689000000 | H2386: -141000000 | I2386: 34000000 | J2386: 181000000 | K2386: 303000000 | L2386: 369000000 | M2386: 358000000 | N2386: =POWER(D2386/M2386,1/9)-1 -> -2.0544658806435026 | O2386: =POWER(D2386/I2386,1/5)-1 -> -2.7617301190336669
A2387: 1101.HK | B2387: 华荣能源 | C2387: 0.03 | D2387: -577069277.39999998 | E2387: -770200122.10000002 | F2387: -226613317 | G2387: 932779748.10000002 | H2387: 153455100 | I2387: -157537834.59999999 | J2387: -2259717891.4000001 | K2387: -3961333993.75 | L2387: -7694741087.4499998 | M2387: -9677374651.2000008 | N2387: =POWER(D2387/M2387,1/9)-1 -> -0.26895997523748338 | O2387: =POWER(D2387/I2387,1/5)-1 -> 0.29648834323021478
A2388: 1125.HK | B2388: 丽丰控股 | C2388: 1.8 | D2388: -584702000 | E2388: -134523000 | F2388: -538967000 | G2388: -1006263000 | H2388: 668556000 | I2388: 1180117000 | J2388: 1477452000 | K2388: 873527000 | L2388: 1004901000 | M2388: 1099727000 | N2388: =POWER(D2388/M2388,1/9)-1 -> -1.932216171216542 | O2388: =POWER(D2388/I2388,1/5)-1 -> -1.8689642360381771
A2389: 1253.HK | B2389: 中国绿地博大绿泽 | C2389: 0.04 | D2389: -587473311.60000002 | E2389: -476953911.39999998 | F2389: 5561679 | G2389: 93319810.5 | H2389: 79770502.5 | I2389: 67454079.799999997 | J2389: 186571619.09999999 | K2389: 168584403.75 | L2389: 177002581.30000001 | M2389: 136447881.80000001 | N2389: =POWER(D2389/M2389,1/9)-1 -> -2.1761069488963201 | O2389: =POWER(D2389/I2389,1/5)-1 -> -2.5416861964172917
A2390: 1097.HK | B2390: 有线宽频 | C2390: 0.03 | D2390: -589274000 | E2390: -885718000 | F2390: -363652000 | G2390: -275387000 | H2390: -396966000 | I2390: -455588000 | J2390: -362827000 | K2390: -312790000 | L2390: -233098000 | M2390: -139490000 | N2390: =POWER(D2390/M2390,1/9)-1 -> 0.17362801364527591 | O2390: =POWER(D2390/I2390,1/5)-1 -> 5.28075739654148e-02
A2391: 2279.HK | B2391: 雍禾医疗 | C2391: 0.86 | D2391: -589606516.79999995 | E2391: -94733325.599999994 | F2391: 143964465 | G2391: 175166391.59999999 | H2391: -- | I2391: -- | J2391: -- | K2391: -- | L2391: -- | M2391: -- | N2391: =POWER(D2391/M2391,1/9)-1 -> #VALUE! | O2391: =POWER(D2391/I2391,1/5)-1 -> #VALUE!
A2392: 0299.HK | B2392: 宝新置地 | C2392: 0.17 | D2392: -601331000 | E2392: -787049000 | F2392: 334621000 | G2392: -735144000 | H2392: 385850000 | I2392: 103138000 | J2392: 87940000 | K2392: -861582000 | L2392: -76401000 | M2392: -56799000 | N2392: =POWER(D2392/M2392,1/9)-1 -> 0.29976146199806597 | O2392: =POWER(D2392/I2392,1/5)-1 -> -2.4227840160427361
A2393: 1370.HK | B2393: 奥威控股 | C2393: 0.49 | D2393: -601966171.79999995 | E2393: 68537715.5 | F2393: 248748603.5 | G2393: -84113574.900000006 | H2393: -110600092.5 | I2393: 47299721.200000003 | J2393: -428016891.19999999 | K2393: 95196342.5 | L2393: -276467010.05000001 | M2393: 328197700 | N2393: =POWER(D2393/M2393,1/9)-1 -> -2.0697215085585725 | O2393: =POWER(D2393/I2393,1/5)-1 -> -2.663193201420972
A2394: 0498.HK | B2394: 蓝河控股 | C2394: 0.11 | D2394: -605413000 | E2394: -1628546000 | F2394: 151290000 | G2394: -572268000 | H2394: 49208000 | I2394: 477390000 | J2394: -34143000 | K2394: -297902000 | L2394: 86028000 | M2394: 85586000 | N2394: =POWER(D2394/M2394,1/9)-1 -> -2.2428120227068424 | O2394: =POWER(D2394/I2394,1/5)-1 -> -2.0486623719729149
A2395: 1119.HK | B2395: 创梦天地 | C2395: 2.56 | D2395: -609867581.39999998 | E2395: -2811555733.3000002 | F2395: -192831811 | G2395: -526307283 | H2395: 393620377.5 | I2395: 280532822.39999998 | J2395: 179995652.59999999 | K2395: 6034087.5 | L2395: 88317826.849999994 | M2395: -- | N2395: =POWER(D2395/M2395,1/9)-1 -> #VALUE! | O2395: =POWER(D2395/I2395,1/5)-1 -> -2.1680202532673167
A2396: 2257.HK | B2396: 圣诺医药-B | C2396: 4.71 | D2396: -614655401 | E2396: -689438592 | F2396: -1661527658 | G2396: -339364316 | H2396: -- | I2396: -- | J2396: -- | K2396: -- | L2396: -- | M2396: -- | N2396: =POWER(D2396/M2396,1/9)-1 -> #VALUE! | O2396: =POWER(D2396/I2396,1/5)-1 -> #VALUE!
A2397: 2329.HK | B2397: 国瑞健康 | C2397: 0.12 | D2397: -618225010.20000005 | E2397: -1029709374.2 | F2397: 279593758.5 | G2397: 117688206 | H2397: 960786270 | I2397: 1148601462.4000001 | J2397: 2097884374.9000001 | K2397: 1736834855 | L2397: 1482469827.5 | M2397: 1186321126.5999999 | N2397: =POWER(D2397/M2397,1/9)-1 -> -1.930142240277045 | O2397: =POWER(D2397/I2397,1/5)-1 -> -1.8834773932641322
A2398: 0568.HK | B2398: 山东墨龙 | C2398: 0.92 | D2398: -621393588.15999997 | E2398: -479408347.44 | F2398: -450637757.06 | G2398: 38353710.280000001 | H2398: -219375606.88 | I2398: 105293600.59 | J2398: 45604338.68 | K2398: -680614373.02999997 | L2398: -305261423.32999998 | M2398: 25248998.760000002 | N2398: =POWER(D2398/M2398,1/9)-1 -> -2.4274771940820892 | O2398: =POWER(D2398/I2398,1/5)-1 -> -2.4262411354240756
A2399: 2179.HK | B2399: 瑞科生物-B | C2399: 8.97 | D2399: -626979263.39999998 | E2399: -815281254.29999995 | F2399: -805183444.5 | G2399: -213826860 | H2399: -- | I2399: -- | J2399: -- | K2399: -- | L2399: -- | M2399: -- | N2399: =POWER(D2399/M2399,1/9)-1 -> #VALUE! | O2399: =POWER(D2399/I2399,1/5)-1 -> #VALUE!
A2400: 9983.HK | B2400: 建业新生活 | C2400: 1.2 | D2400: -629623297.79999995 | E2400: 634285506 | F2400: 758649995.5 | G2400: 508449045.30000001 | H2400: 261443595 | I2400: 22169680.600000001 | J2400: 28067447.899999999 | K2400: 12215971.25 | L2400: -- | M2400: -- | N2400: =POWER(D2400/M2400,1/9)-1 -> #VALUE! | O2400: =POWER(D2400/I2400,1/5)-1 -> -2.9528292466784505
A2401: 6996.HK | B2401: 德琪医药-B | C2401: 0.65 | D2401: -637092804.60000002 | E2401: -678538612.79999995 | F2401: -802695260.5 | G2401: -3490980939.9000001 | H2401: -361831972.5 | I2401: -166180947.19999999 | J2401: -- | K2401: -- | L2401: -- | M2401: -- | N2401: =POWER(D2401/M2401,1/9)-1 -> #VALUE! | O2401: =POWER(D2401/I2401,1/5)-1 -> 0.30835107031264375
A2402: 9993.HK | B2402: 金辉控股 | C2402: 2.51 | D2402: -637164057.60000002 | E2402: 1923439830.5999999 | F2402: 4009960763 | G2402: 3727698239.4000001 | H2402: 2802765990 | I2402: 2286239345.4000001 | J2402: 2434768081.5 | K2402: -- | L2402: -- | M2402: -- | N2402: =POWER(D2402/M2402,1/9)-1 -> #VALUE! | O2402: =POWER(D2402/I2402,1/5)-1 -> -1.7745080123821784
A2403: 2121.HK | B2403: 创新奇智 | C2403: 4.64 | D2403: -638357819.39999998 | E2403: -409547680.19999999 | F2403: -779515475.5 | G2403: -430274708.10000002 | H2403: -- | I2403: -- | J2403: -- | K2403: -- | L2403: -- | M2403: -- | N2403: =POWER(D2403/M2403,1/9)-1 -> #VALUE! | O2403: =POWER(D2403/I2403,1/5)-1 -> #VALUE!
A2404: 0909.HK | B2404: 明源云 | C2404: 1.95 | D2404: -641971990.79999995 | E2404: -1301906367 | F2404: -421205959 | G2404: -839672095.79999995 | H2404: 241850467.5 | I2404: 178910495.19999999 | J2404: 87700733.900000006 | K2404: -- | L2404: -- | M2404: -- | N2404: =POWER(D2404/M2404,1/9)-1 -> #VALUE! | O2404: =POWER(D2404/I2404,1/5)-1 -> -2.2911480762270622
A2405: 0878.HK | B2405: 金朝阳集团 | C2405: 5.65 | D2405: -646511000 | E2405: -268201000 | F2405: -807930000 | G2405: -185807000 | H2405: 217782000 | I2405: 671592000 | J2405: 1200781000 | K2405: 2824747000 | L2405: -52604000 | M2405: 1625160000 | N2405: =POWER(D2405/M2405,1/9)-1 -> -1.9026512275749092 | O2405: =POWER(D2405/I2405,1/5)-1 -> -1.9924167390123029
A2406: 3366.HK | B2406: 华侨城(亚洲) | C2406: 0.19 | D2406: -650341477.79999995 | E2406: -2434352936.3000002 | F2406: -1361615836.5 | G2406: -261564838.80000001 | H2406: 298328917.5 | I2406: 909402097.20000005 | J2406: 1326947315.5999999 | K2406: 410397960 | L2406: 303038683.75 | M2406: 398370860.69999999 | N2406: =POWER(D2406/M2406,1/9)-1 -> -2.055967208849022 | O2406: =POWER(D2406/I2406,1/5)-1 -> -1.9351410042078308
A2407: 0174.HK | B2407: 盛洋投资 | C2407: 0.24 | D2407: -656107000 | E2407: -295966000 | F2407: -8337000 | G2407: -233262000 | H2407: -94713000 | I2407: 12229000 | J2407: -87018000 | K2407: -253378000 | L2407: -1135247000 | M2407: -144838000 | N2407: =POWER(D2407/M2407,1/9)-1 -> 0.18276680688853064 | O2407: =POWER(D2407/I2407,1/5)-1 -> -3.2177712297792658
A2408: 0242.HK | B2408: 信德集团 | C2408: 0.73 | D2408: -676726000 | E2408: -558222000 | F2408: 962431000 | G2408: 262440000 | H2408: 3455796000 | I2408: 4647326000 | J2408: 1450160000 | K2408: -587137000 | L2408: 744670000 | M2408: 4452909000 | N2408: =POWER(D2408/M2408,1/9)-1 -> -1.8111206333805563 | O2408: =POWER(D2408/I2408,1/5)-1 -> -1.6802083279962594
A2409: 0565.HK | B2409: 锦艺集团控股 | C2409: 0.40000000000000002 | D2409: -683448000 | E2409: -96672000 | F2409: -178319000 | G2409: -30658000 | H2409: 55925000 | I2409: 67599000 | J2409: 91094000 | K2409: 441275000 | L2409: -12441000 | M2409: 15402000 | N2409: =POWER(D2409/M2409,1/9)-1 -> -2.5241028036625401 | O2409: =POWER(D2409/I2409,1/5)-1 -> -2.5883749933325824
A2410: 6188.HK | B2410: 迪信通 | C2410: 1.81 | D2410: -690655329 | E2410: -310880669.89999998 | F2410: -4368327831 | G2410: 135950497.80000001 | H2410: 287688082.5 | I2410: 375209689.60000002 | J2410: 386633261 | K2410: 396002827.5 | L2410: 419922765.10000002 | M2410: 396998170.69999999 | N2410: =POWER(D2410/M2410,1/9)-1 -> -2.0634552187592394 | O2410: =POWER(D2410/I2410,1/5)-1 -> -2.1297893183637031
A2411: 9969.HK | B2411: 诺诚健华 | C2411: 4.71 | D2411: -691990500.60000002 | E2411: -1000165563.3 | F2411: -79035352.5 | G2411: -466503700.5 | H2411: -2393001090 | I2411: -626173070 | J2411: -409704892.60000002 | K2411: -- | L2411: -- | M2411: -- | N2411: =POWER(D2411/M2411,1/9)-1 -> #VALUE! | O2411: =POWER(D2411/I2411,1/5)-1 -> 2.0190204697802638e-02
A2412: 1252.HK | B2412: 中国天瑞水泥 | C2412: 0.05 | D2412: -694853775 | E2412: 506167189 | F2412: 1470122455 | G2412: 2217625302 | H2412: 2033205202.5 | I2412: 1380606014.2 | J2412: 1201014859.5999999 | K2412: 328721085 | L2412: 368196557.94999999 | M2412: 704986130.20000005 | N2412: =POWER(D2412/M2412,1/9)-1 -> -1.9983927706011535 | O2412: =POWER(D2412/I2412,1/5)-1 -> -1.8716953556098139
A2413: 2158.HK | B2413: 医渡科技 | C2413: 3.46 | D2413: -717733739.70000005 | E2413: -940128673.5 | F2413: -4382064879.75 | G2413: -1648258318.7 | H2413: -1089683913.5999999 | I2413: -1222617571.2 | J2413: -- | K2413: -- | L2413: -- | M2413: -- | N2413: =POWER(D2413/M2413,1/9)-1 -> #VALUE! | O2413: =POWER(D2413/I2413,1/5)-1 -> -0.10105205108462512
A2414: 0355.HK | B2414: 世纪城市国际 | C2414: 0.17 | D2414: -718400000 | E2414: -207900000 | F2414: -345600000 | G2414: -587800000 | H2414: 174900000 | I2414: 174800000 | J2414: 381200000 | K2414: 136200000 | L2414: 4600000 | M2414: 196600000 | N2414: =POWER(D2414/M2414,1/9)-1 -> -2.1548655418942659 | O2414: =POWER(D2414/I2414,1/5)-1 -> -2.3266763250010891
A2415: 2598.HK | B2415: 连连数字 | C2415: 9.5 | D2415: -719177356.79999995 | E2415: -- | F2415: -- | G2415: -- | H2415: -- | I2415: -- | J2415: -- | K2415: -- | L2415: -- | M2415: -- | N2415: =POWER(D2415/M2415,1/9)-1 -> #VALUE! | O2415: =POWER(D2415/I2415,1/5)-1 -> #VALUE!
A2416: 6998.HK | B2416: 嘉和生物-B | C2416: 1.2 | D2416: -739235624.39999998 | E2416: -823754413.39999998 | F2416: -1059466788 | G2416: -3608002873.8000002 | H2416: -583426635 | I2416: -328004472.19999999 | J2416: -- | K2416: -- | L2416: -- | M2416: -- | N2416: =POWER(D2416/M2416,1/9)-1 -> #VALUE! | O2416: =POWER(D2416/I2416,1/5)-1 -> 0.17646936983871919
A2417: 1548.HK | B2417: 金斯瑞生物科技 | C2417: 13.08 | D2417: -745770847 | E2417: -1771252608 | F2417: -2797236176 | G2417: -1588938585 | H2417: -754653744 | I2417: 166206144 | J2417: 204125122 | K2417: 202922180 | L2417: 135664752 | M2417: 47893300 | N2417: =POWER(D2417/M2417,1/9)-1 -> -2.3566917441944639 | O2417: =POWER(D2417/I2417,1/5)-1 -> -2.3501799847935976
A2418: 6839.HK | B2418: 云南水务 | C2418: 0.19 | D2418: -754260141.60000002 | E2418: -1196171810.2 | F2418: -1226797162 | G2418: 265906930.5 | H2418: 444935977.5 | I2418: 452881565.80000001 | J2418: 506909306.80000001 | K2418: 431268346.25 | L2418: 336177420.64999998 | M2418: 207883917.30000001 | N2418: =POWER(D2418/M2418,1/9)-1 -> -2.1539551201596785 | O2418: =POWER(D2418/I2418,1/5)-1 -> -2.1074070983912714
A2419: 0266.HK | B2419: 天德地产 | C2419: 1.97 | D2419: -759345000 | E2419: -554024000 | F2419: -777623000 | G2419: -460124000 | H2419: 73669000 | I2419: 108126000 | J2419: -90612000 | K2419: 438966000 | L2419: 679995000 | M2419: 730105000 | N2419: =POWER(D2419/M2419,1/9)-1 -> -2.0043726277330416 | O2419: =POWER(D2419/I2419,1/5)-1 -> -2.4767323883211541
A2420: 9680.HK | B2420: 如祺出行 | C2420: 18 | D2420: -759440782.79999995 | E2420: -- | F2420: -- | G2420: -- | H2420: -- | I2420: -- | J2420: -- | K2420: -- | L2420: -- | M2420: -- | N2420: =POWER(D2420/M2420,1/9)-1 -> #VALUE! | O2420: =POWER(D2420/I2420,1/5)-1 -> #VALUE!
A2421: 0511.HK | B2421: 电视广播 | C2421: 3.08 | D2421: -762796000 | E2421: -807132000 | F2421: -646735000 | G2421: -280881000 | H2421: -294925000 | I2421: -199080000 | J2421: 243621000 | K2421: 499945000 | L2421: 1331223000 | M2421: 1409632000 | N2421: =POWER(D2421/M2421,1/9)-1 -> -1.9340431974874759 | O2421: =POWER(D2421/I2421,1/5)-1 -> 0.30820605519008093
A2422: 9968.HK | B2422: 汇景控股 | C2422: 0.02 | D2422: -763744464 | E2422: -- | F2422: 313643430 | G2422: 615444716.39999998 | H2422: 687698325 | I2422: 459069856.80000001 | J2422: 189510123 | K2422: 376168126.25 | L2422: -- | M2422: -- | N2422: =POWER(D2422/M2422,1/9)-1 -> #VALUE! | O2422: =POWER(D2422/I2422,1/5)-1 -> -2.1071688528346804
A2423: 2500.HK | B2423: 启明医疗-B | C2423: 5.62 | D2423: -771455134.79999995 | E2423: -1193190241.9000001 | F2423: -457517282 | G2423: -216912689.09999999 | H2423: -425457952.5 | I2423: -342059350.60000002 | J2423: -187666214.80000001 | K2423: -- | L2423: -- | M2423: -- | N2423: =POWER(D2423/M2423,1/9)-1 -> #VALUE! | O2423: =POWER(D2423/I2423,1/5)-1 -> 0.17663521331536614
A2424: 6988.HK | B2424: 乐享集团 | C2424: 0.12 | D2424: -784166000 | E2424: -339450000 | F2424: 244642000 | G2424: 138679000 | H2424: 67361000 | I2424: 51750508.600000001 | J2424: 38440330.700000003 | K2424: -- | L2424: -- | M2424: -- | N2424: =POWER(D2424/M2424,1/9)-1 -> #VALUE! | O2424: =POWER(D2424/I2424,1/5)-1 -> -2.7222598495963446
A2425: 6116.HK | B2425: 拉夏贝尔 | C2425: 0.25 | D2425: -808392690 | E2425: -1209292741.3 | F2425: -1005657360 | G2425: -2192551301.6999998 | H2425: -2420846955 | I2425: -181621501.80000001 | J2425: 597684020.29999995 | K2425: 591143883.75 | L2425: 723565938.54999995 | M2425: 628257750.79999995 | N2425: =POWER(D2425/M2425,1/9)-1 -> -2.0284068173746927 | O2425: =POWER(D2425/I2425,1/5)-1 -> 0.34800351001976715
A2426: 0194.HK | B2426: 廖创兴企业 | C2426: 4.58 | D2426: -814937000 | E2426: 86148000 | F2426: 427302000 | G2426: 162560000 | H2426: 429984000 | I2426: 1014267000 | J2426: 744888000 | K2426: 457907000 | L2426: 410366000 | M2426: 2356935000 | N2426: =POWER(D2426/M2426,1/9)-1 -> -1.8886954092495229 | O2426: =POWER(D2426/I2426,1/5)-1 -> -1.9571816145239125
A2427: 1393.HK | B2427: 恒鼎实业 | C2427: 0.09 | D2427: -817975670.39999998 | E2427: 605432092.29999995 | F2427: 789980052.5 | G2427: -322039461 | H2427: -283557802.5 | I2427: -470817931.60000002 | J2427: -1288652051.8 | K2427: -1111028861.25 | L2427: -2687477706.6500001 | M2427: -1775700552.9000001 | N2427: =POWER(D2427/M2427,1/9)-1 -> -8.2519717564612627e-02 | O2427: =POWER(D2427/I2427,1/5)-1 -> 0.11680533073853061
A2428: 2171.HK | B2428: 科济药业-B | C2428: 4.53 | D2428: -819731782.79999995 | E2428: -1006543840.7 | F2428: -5809545963.5 | G2428: -1268240003.0999999 | H2428: -- | I2428: -- | J2428: -- | K2428: -- | L2428: -- | M2428: -- | N2428: =POWER(D2428/M2428,1/9)-1 -> #VALUE! | O2428: =POWER(D2428/I2428,1/5)-1 -> #VALUE!
A2429: 0895.HK | B2429: 东江环保 | C2429: 1.58 | D2429: -822665837.22000003 | E2429: -566071555.20000005 | F2429: 196832252.5 | G2429: 363434148 | H2429: 473741429.82999998 | I2429: 464454303.19 | J2429: 567530460.17999995 | K2429: 593200604.64999998 | L2429: 391076621.67000002 | M2429: 313984986.38999999 | N2429: =POWER(D2429/M2429,1/9)-1 -> -2.1129595947220077 | O2429: =POWER(D2429/I2429,1/5)-1 -> -2.1211303109865591
A2430: 2013.HK | B2430: 微盟集团 | C2430: 1.3999999999999999 | D2430: -831194746.20000005 | E2430: -2062805304.5999999 | F2430: -958811663.5 | G2430: -1378577761.8 | H2430: 348635415 | I2430: -1240169951.5999999 | J2430: 3394085.8999999999 | K2430: -85925183.75 | L2430: -104094537.59999999 | M2430: -- | N2430: =POWER(D2430/M2430,1/9)-1 -> #VALUE! | O2430: =POWER(D2430/I2430,1/5)-1 -> -7.6909424432794027e-02
A2431: 2126.HK | B2431: 药明巨诺-B | C2431: 1.74 | D2431: -841877215.20000005 | E2431: -954524893.5 | F2431: -860000636 | G2431: -1983086795.7 | H2431: -707664697.5 | I2431: -310400577.60000002 | J2431: -- | K2431: -- | L2431: -- | M2431: -- | N2431: =POWER(D2431/M2431,1/9)-1 -> #VALUE! | O2431: =POWER(D2431/I2431,1/5)-1 -> 0.22085826322995028
A2432: 0251.HK | B2432: 爪哇控股 | C2432: 1.48 | D2432: -853749000 | E2432: -383659000 | F2432: 70162000 | G2432: 150968000 | H2432: 173118000 | I2432: 121026000 | J2432: 267326000 | K2432: 684289000 | L2432: 1435932000 | M2432: 684462000 | N2432: =POWER(D2432/M2432,1/9)-1 -> -2.024859994341087 | O2432: =POWER(D2432/I2432,1/5)-1 -> -2.4780540155032149
A2433: 9989.HK | B2433: 海普瑞 | C2433: 3.42 | D2433: -858607419.60000002 | E2433: 820215563.70000005 | F2433: 294844906 | G2433: 1220755899 | H2433: 1184214750 | I2433: 728924888.39999998 | J2433: 286422005.60000002 | K2433: -- | L2433: -- | M2433: -- | N2433: =POWER(D2433/M2433,1/9)-1 -> #VALUE! | O2433: =POWER(D2433/I2433,1/5)-1 -> -2.0332903455339038
A2434: 0860.HK | B2434: Apollo出行 | C2434: 0.69 | D2434: -860535000 | E2434: -- | F2434: -349589000 | G2434: -345177000 | H2434: -605392000 | I2434: -94096000 | J2434: -700128000 | K2434: -32673000 | L2434: -199626000 | M2434: -1052066000 | N2434: =POWER(D2434/M2434,1/9)-1 -> -2.2081101046499518e-02 | O2434: =POWER(D2434/I2434,1/5)-1 -> 0.55682384689804176
A2435: 0980.HK | B2435: 联华超市 | C2435: 0.40000000000000002 | D2435: -867441695.39999998 | E2435: -238871790.69999999 | F2435: -517692885.5 | G2435: -380556983.39999998 | H2435: -422751367.5 | I2435: -249039146.40000001 | J2435: -339000964 | K2435: -500012493.75 | L2435: -584486265.54999995 | M2435: 38726080.700000003 | N2435: =POWER(D2435/M2435,1/9)-1 -> -2.4126231047945099 | O2435: =POWER(D2435/I2435,1/5)-1 -> 0.28349604539828865
A2436: 0014.HK | B2436: 希慎兴业 | C2436: 11.199999999999999 | D2436: -872000000 | E2436: -1157000000 | F2436: 1383000000 | G2436: -2547000000 | H2436: 4845000000 | I2436: 6033000000 | J2436: 3636000000 | K2436: 1218000000 | L2436: 2903000000 | M2436: 4902000000 | N2436: =POWER(D2436/M2436,1/9)-1 -> -1.8254344212544642 | O2436: =POWER(D2436/I2436,1/5)-1 -> -1.6791983652209819
A2437: 3611.HK | B2437: 花房集团 | C2437: 2.2999999999999998 | D2437: -873539856 | E2437: 436217092.30000001 | F2437: 397990663.5 | G2437: -1817255364.9000001 | H2437: -- | I2437: -- | J2437: -- | K2437: -- | L2437: -- | M2437: -- | N2437: =POWER(D2437/M2437,1/9)-1 -> #VALUE! | O2437: =POWER(D2437/I2437,1/5)-1 -> #VALUE!
A2438: 3688.HK | B2438: 莱蒙国际 | C2438: 0.34 | D2438: -876893000 | E2438: -185099000 | F2438: 33432000 | G2438: -283258000 | H2438: -582939000 | I2438: 102610000 | J2438: 4642246000 | K2438: 866428000 | L2438: 773443000 | M2438: 921603000 | N2438: =POWER(D2438/M2438,1/9)-1 -> -1.9944897300875077 | O2438: =POWER(D2438/I2438,1/5)-1 -> -2.535859127792282
A2439: 2438.HK | B2439: 出门问问 | C2439: 1.46 | D2439: -879812312.39999998 | E2439: -- | F2439: -- | G2439: -- | H2439: -- | I2439: -- | J2439: -- | K2439: -- | L2439: -- | M2439: -- | N2439: =POWER(D2439/M2439,1/9)-1 -> #VALUE! | O2439: =POWER(D2439/I2439,1/5)-1 -> #VALUE!
A2440: 1400.HK | B2440: 满地科技股份 | C2440: 0.04 | D2440: -889443525.60000002 | E2440: -158495793.80000001 | F2440: -123096536 | G2440: -261084503.09999999 | H2440: -321401940 | I2440: -420463346.60000002 | J2440: -878511958.5 | K2440: -367849308.75 | L2440: -27421957.850000001 | M2440: 82863055.799999997 | N2440: =POWER(D2440/M2440,1/9)-1 -> -2.3017530493456428 | O2440: =POWER(D2440/I2440,1/5)-1 -> 0.16165735662747038
A2441: 0369.HK | B2441: 永泰地产 | C2441: 2.09 | D2441: -890400000 | E2441: -540000000 | F2441: 854400000 | G2441: -674400000 | H2441: 238900000 | I2441: 1312400000 | J2441: 1981900000 | K2441: 1146500000 | L2441: 1099100000 | M2441: 1943600000 | N2441: =POWER(D2441/M2441,1/9)-1 -> -1.9169188855599653 | O2441: =POWER(D2441/I2441,1/5)-1 -> -1.9253452200551604
A2442: 2390.HK | B2442: 知乎-W | C2442: 8.5 | D2442: -924799264.20000005 | E2442: -1783703211.7 | F2442: -1799359892.5 | G2442: -1428234699.5999999 | H2442: -- | I2442: -- | J2442: -- | K2442: -- | L2442: -- | M2442: -- | N2442: =POWER(D2442/M2442,1/9)-1 -> #VALUE! | O2442: =POWER(D2442/I2442,1/5)-1 -> #VALUE!
A2443: 1952.HK | B2443: 云顶新耀-B | C2443: 19.62 | D2443: -925700340.60000002 | E2443: -278959952.30000001 | F2443: -1235176415.5 | G2443: -6743966863.5 | H2443: -239717160 | I2443: -1129120016.4000001 | J2443: -- | K2443: -- | L2443: -- | M2443: -- | N2443: =POWER(D2443/M2443,1/9)-1 -> #VALUE! | O2443: =POWER(D2443/I2443,1/5)-1 -> -3.8949822132933409e-02
A2444: 1176.HK | B2444: 珠光控股 | C2444: 0.13 | D2444: -939010000 | E2444: -1065194000 | F2444: 21265000 | G2444: 2194404000 | H2444: 747225000 | I2444: 4717000 | J2444: 174401000 | K2444: -175645000 | L2444: 591409000 | M2444: 180208000 | N2444: =POWER(D2444/M2444,1/9)-1 -> -2.2013100984060658 | O2444: =POWER(D2444/I2444,1/5)-1 -> -3.8827094262315072
A2445: 2009.HK | B2445: 金隅集团 | C2445: 0.58 | D2445: -939810760.09000003 | E2445: 394693894.77999997 | F2445: 2651114314.9899998 | G2445: 2380418201.0599999 | H2445: 4127578616.3499999 | I2445: 3712347546.7600002 | J2445: 3400877588.8800001 | K2445: 2985544111.04 | L2445: 2372626496.0799999 | M2445: 3023314553.9699998 | N2445: =POWER(D2445/M2445,1/9)-1 -> -1.8782485736766867 | O2445: =POWER(D2445/I2445,1/5)-1 -> -1.7597633799911367
A2446: 2038.HK | B2446: 富智康集团 | C2446: 0.83 | D2446: -942631480 | E2446: -563011456 | F2446: 439245744 | G2446: -1348549067 | H2446: -95725591 | I2446: -6714685914 | J2446: -4106155418 | K2446: 1072541034 | L2446: 1775376033 | M2446: 1314153372 | N2446: =POWER(D2446/M2446,1/9)-1 -> -1.9637540353545657 | O2446: =POWER(D2446/I2446,1/5)-1 -> -0.32475209213832568
A2447: 0106.HK | B2447: 朗诗绿色管理 | C2447: 0.05 | D2447: -943601286.60000002 | E2447: -2920247040.1999998 | F2447: -952053648 | G2447: -119871766.8 | H2447: 1309646302.5 | I2447: 1267004476.4000001 | J2447: 695989024.70000005 | K2447: 640944552.5 | L2447: 569472811.25 | M2447: 376354161 | N2447: =POWER(D2447/M2447,1/9)-1 -> -2.1075278216086941 | O2447: =POWER(D2447/I2447,1/5)-1 -> -1.942762012949113
A2448: 0171.HK | B2448: 银建国际 | C2448: 0.14 | D2448: -947409000 | E2448: -734563000 | F2448: -1452609000 | G2448: -317641000 | H2448: 55813000 | I2448: -49375000 | J2448: 260201000 | K2448: -35122000 | L2448: -65777000 | M2448: 109367000 | N2448: =POWER(D2448/M2448,1/9)-1 -> -2.2711109717752258 | O2448: =POWER(D2448/I2448,1/5)-1 -> 0.80553569805965219
A2449: 1973.HK | B2449: 天图投资 | C2449: 3.34 | D2449: -956940944.39999998 | E2449: 630929408.5 | F2449: 894047858.5 | G2449: 859358708.10000002 | H2449: -- | I2449: -- | J2449: -- | K2449: -- | L2449: -- | M2449: -- | N2449: =POWER(D2449/M2449,1/9)-1 -> #VALUE! | O2449: =POWER(D2449/I2449,1/5)-1 -> #VALUE!
A2450: 0367.HK | B2450: 庄士机构国际 | C2450: 0.37 | D2450: -966292000 | E2450: -523149000 | F2450: 37452000 | G2450: -705084000 | H2450: 1226643000 | I2450: 1297145000 | J2450: 1264279000 | K2450: 597759000 | L2450: 502952000 | M2450: 468530000 | N2450: =POWER(D2450/M2450,1/9)-1 -> -2.0837524914447885 | O2450: =POWER(D2450/I2450,1/5)-1 -> -1.9428095470388196
A2451: 0993.HK | B2451: 华融金控 | C2451: 0.05 | D2451: -967291000 | E2451: -2500007000 | F2451: -1823044000 | G2451: -2786174000 | H2451: -1545885000 | I2451: -1548222000 | J2451: 964093000 | K2451: 550914000 | L2451: -66628000 | M2451: 45162000 | N2451: =POWER(D2451/M2451,1/9)-1 -> -2.4056101569958592 | O2451: =POWER(D2451/I2451,1/5)-1 -> -8.9783335328011526e-02
A2452: 0691.HK | B2452: 山水水泥 | C2452: 0.51 | D2452: -968995855.79999995 | E2452: 844610726.20000005 | F2452: 3400801401 | G2452: 3798576956.6999998 | H2452: 3322443720 | I2452: 2501113660.1999998 | J2452: 720319501.29999995 | K2452: -820414761.25 | L2452: -7511735946.9499998 | M2452: 433832435 | N2452: =POWER(D2452/M2452,1/9)-1 -> -2.0933967201348684 | O2452: =POWER(D2452/I2452,1/5)-1 -> -1.8272517571233682
A2453: 1728.HK | B2453: 正通汽车 | C2453: 0.15 | D2453: -976703238 | E2453: -334239108.5 | F2453: -4435299409.5 | G2453: -10225436441.4 | H2453: 741865785 | I2453: 1393720409 | J2453: 1427644125.5 | K2453: 548159622.5 | L2453: 727422206.5 | M2453: 1003052036.8 | N2453: =POWER(D2453/M2453,1/9)-1 -> -1.9970466131773894 | O2453: =POWER(D2453/I2453,1/5)-1 -> -1.9313595960160614
A2454: 2416.HK | B2454: 易点云 | C2454: 1.55 | D2454: -987278279.39999998 | E2454: -689953856.70000005 | F2454: -426426002.5 | G2454: -105416403.59999999 | H2454: -- | I2454: -- | J2454: -- | K2454: -- | L2454: -- | M2454: -- | N2454: =POWER(D2454/M2454,1/9)-1 -> #VALUE! | O2454: =POWER(D2454/I2454,1/5)-1 -> #VALUE!
A2455: 0925.HK | B2455: 北京建设 | C2455: 0.05 | D2455: -988121257.20000005 | E2455: -137590972.69999999 | F2455: -373982000 | G2455: -270634000 | H2455: -504191000 | I2455: -23677000 | J2455: 300916000 | K2455: 115375000 | L2455: 276786000 | M2455: 166876000 | N2455: =POWER(D2455/M2455,1/9)-1 -> -2.2184958099624428 | O2455: =POWER(D2455/I2455,1/5)-1 -> 1.1090977754611266
A2456: 6682.HK | B2456: 第四范式 | C2456: 48.299999999999997 | D2456: -996135575.39999998 | E2456: -1855608305.7 | F2456: -2186534547.5 | G2456: -893507835 | H2456: -- | I2456: -- | J2456: -- | K2456: -- | L2456: -- | M2456: -- | N2456: =POWER(D2456/M2456,1/9)-1 -> #VALUE! | O2456: =POWER(D2456/I2456,1/5)-1 -> #VALUE!
A2457: 6855.HK | B2457: 亚盛医药-B | C2457: 28.300000000000001 | D2457: -1014683279.4 | E2457: -996026564.39999998 | F2457: -958078188 | G2457: -807638591.39999998 | H2457: -1654697895 | I2457: -393166550.19999999 | J2457: -142086434.59999999 | K2457: -119836088.75 | L2457: -- | M2457: -- | N2457: =POWER(D2457/M2457,1/9)-1 -> #VALUE! | O2457: =POWER(D2457/I2457,1/5)-1 -> 0.20878980476920961
A2458: 0230.HK | B2458: 五矿地产 | C2458: 0.41 | D2458: -1015518000 | E2458: -1362468000 | F2458: 89209000 | G2458: 112370000 | H2458: 942689000 | I2458: 934964000 | J2458: 712914000 | K2458: 512058000 | L2458: 278156000 | M2458: 425171000 | N2458: =POWER(D2458/M2458,1/9)-1 -> -2.1015742533736965 | O2458: =POWER(D2458/I2458,1/5)-1 -> -2.0166665793334069
A2459: 2511.HK | B2459: 君圣泰医药-B | C2459: 1.1000000000000001 | D2459: -1029667237.2 | E2459: -- | F2459: -- | G2459: -- | H2459: -- | I2459: -- | J2459: -- | K2459: -- | L2459: -- | M2459: -- | N2459: =POWER(D2459/M2459,1/9)-1 -> #VALUE! | O2459: =POWER(D2459/I2459,1/5)-1 -> #VALUE!
A2460: 1566.HK | B2460: 华夏文化科技 | C2460: 0.05 | D2460: -1033575000 | E2460: -1050184000 | F2460: 83086000 | G2460: 105222000 | H2460: 58372000 | I2460: 20790000 | J2460: 94840000 | K2460: 110372000 | L2460: 75632000 | M2460: 130602000 | N2460: =POWER(D2460/M2460,1/9)-1 -> -2.2584076566757636 | O2460: =POWER(D2460/I2460,1/5)-1 -> -3.1842256425064748
A2461: 0607.HK | B2461: 丰盛控股 | C2461: 0.47 | D2461: -1041979755.6 | E2461: -181602666.09999999 | F2461: -3288203728 | G2461: -1065922129.5 | H2461: -3211909560 | I2461: -3449905624.4000001 | J2461: 2718449401.6999998 | K2461: 3429338613.75 | L2461: 1432225443.3499999 | M2461: -- | N2461: =POWER(D2461/M2461,1/9)-1 -> #VALUE! | O2461: =POWER(D2461/I2461,1/5)-1 -> -0.21293533866151892
A2462: 9666.HK | B2462: 金科服务 | C2462: 6.49 | D2462: -1042527855.6 | E2462: -2051500614.5 | F2462: 1294519359 | G2462: 734944610.39999998 | H2462: 409510110 | I2462: 184198153.59999999 | J2462: 136136293.90000001 | K2462: -- | L2462: -- | M2462: -- | N2462: =POWER(D2462/M2462,1/9)-1 -> #VALUE! | O2462: =POWER(D2462/I2462,1/5)-1 -> -2.4143616728042563
A2463: 0727.HK | B2463: 皇冠环球集团 | C2463: 0.09 | D2463: -1069359000 | E2463: -726372000 | F2463: -105243000 | G2463: 9379000 | H2463: 3791000 | I2463: 108716000 | J2463: 81179000 | K2463: 172266000 | L2463: 155067000 | M2463: -45288000 | N2463: =POWER(D2463/M2463,1/9)-1 -> 0.4209249958768404 | O2463: =POWER(D2463/I2463,1/5)-1 -> -2.5796686992345172
A2464: 0702.HK | B2464: 中国油气控股 | C2464: 0.07 | D2464: -1086976000 | E2464: -551779000 | F2464: -788667000 | G2464: -184117000 | H2464: -230952000 | I2464: -376922000 | J2464: -160367000 | K2464: -96986000 | L2464: -478521000 | M2464: 10420000 | N2464: =POWER(D2464/M2464,1/9)-1 -> -2.6759511644730951 | O2464: =POWER(D2464/I2464,1/5)-1 -> 0.23592948650402756
A2465: 2252.HK | B2465: 微创机器人-B | C2465: 7.52 | D2465: -1109545138.8 | E2465: -1285815148.5999999 | F2465: -713786764.5 | G2465: -248956920.59999999 | H2465: -- | I2465: -- | J2465: -- | K2465: -- | L2465: -- | M2465: -- | N2465: =POWER(D2465/M2465,1/9)-1 -> #VALUE! | O2465: =POWER(D2465/I2465,1/5)-1 -> #VALUE!
A2466: 0617.HK | B2466: 百利保控股 | C2466: 0.82 | D2466: -1121400000 | E2466: -297200000 | F2466: -476200000 | G2466: -951600000 | H2466: 282600000 | I2466: 321000000 | J2466: 528500000 | K2466: 217000000 | L2466: 21500000 | M2466: 283700000 | N2466: =POWER(D2466/M2466,1/9)-1 -> -2.1649904287508615 | O2466: =POWER(D2466/I2466,1/5)-1 -> -2.2842545228111266
A2467: 1801.HK | B2467: 信达生物 | C2467: 40.55 | D2467: -1126798230.5999999 | E2467: -2458434487 | F2467: -3341360497.5 | G2467: -1190017989.9000001 | H2467: -1922044125 | I2467: -6571420791.1999998 | J2467: -674163050.20000005 | K2467: -560296695 | L2467: -- | M2467: -- | N2467: =POWER(D2467/M2467,1/9)-1 -> #VALUE! | O2467: =POWER(D2467/I2467,1/5)-1 -> -0.29719090056571817
A2468: 1232.HK | B2468: 金轮天地控股 | C2468: 0.05 | D2468: -1134676620 | E2468: -1188849313.0999999 | F2468: -2424748777.5 | G2468: 41463817.200000003 | H2468: 282236917.5 | I2468: 389692681.60000002 | J2468: 582019192.89999998 | K2468: 294899080 | L2468: 15263952.949999999 | M2468: 292501520.5 | N2468: =POWER(D2468/M2468,1/9)-1 -> -2.1625616634455525 | O2468: =POWER(D2468/I2468,1/5)-1 -> -2.2383116857017158
A2469: 0753.HK | B2469: 中国国航 | C2469: 3.56 | D2469: -1138306138.2 | E2469: -43564396109.5 | F2469: -20369775461 | G2469: -17167344521.700001 | H2469: 7174678545 | I2469: 8369462614.6000004 | J2469: 8685216446.8999996 | K2469: 7566677938.75 | L2469: 8306849239.3500004 | M2469: 4807524766.8000002 | N2469: =POWER(D2469/M2469,1/9)-1 -> -1.8520830961063619 | O2469: =POWER(D2469/I2469,1/5)-1 -> -1.6709842109015869
A2470: 9858.HK | B2470: 优然牧业 | C2470: 1.15 | D2470: -1150988076 | E2470: 467903165.10000002 | F2470: 1907790592 | G2470: 1598022046.5 | H2470: -- | I2470: -- | J2470: -- | K2470: -- | L2470: -- | M2470: -- | N2470: =POWER(D2470/M2470,1/9)-1 -> #VALUE! | O2470: =POWER(D2470/I2470,1/5)-1 -> #VALUE!
A2471: 1468.HK | B2471: 京基金融国际 | C2471: 0.08 | D2471: -1158455000 | E2471: -73129000 | F2471: -8440000 | G2471: -70314000 | H2471: -85782000 | I2471: -6710000 | J2471: -104371706 | K2471: -94441772 | L2471: 36639153 | M2471: 35841267 | N2471: =POWER(D2471/M2471,1/9)-1 -> -2.4713695266565683 | O2471: =POWER(D2471/I2471,1/5)-1 -> 1.8017625737512954
A2472: 9939.HK | B2472: 开拓药业-B | C2472: 1.03 | D2472: -1162870884 | E2472: -1076623668.9000001 | F2472: -1031145327.5 | G2472: -605843961.89999998 | H2472: -259904797.5 | I2472: -123519882.40000001 | J2472: -53675951.899999999 | K2472: -- | L2472: -- | M2472: -- | N2472: =POWER(D2472/M2472,1/9)-1 -> #VALUE! | O2472: =POWER(D2472/I2472,1/5)-1 -> 0.56588161629449885
A2473: 0718.HK | B2473: 太和控股 | C2473: 0.03 | D2473: -1167985000 | E2473: -1454890000 | F2473: -440801000 | G2473: -26782000 | H2473: -246440000 | I2473: -553243000 | J2473: 312096000 | K2473: -116204000 | L2473: -58027000 | M2473: -6894000 | N2473: =POWER(D2473/M2473,1/9)-1 -> 0.76873547883054272 | O2473: =POWER(D2473/I2473,1/5)-1 -> 0.16119262144629309
A2474: 2246.HK | B2474: 快狗打车 | C2474: 0.46 | D2474: -1205397963 | E2474: -1359820764.8 | F2474: -1068809723 | G2474: -784539569.39999998 | H2474: -- | I2474: -- | J2474: -- | K2474: -- | L2474: -- | M2474: -- | N2474: =POWER(D2474/M2474,1/9)-1 -> #VALUE! | O2474: =POWER(D2474/I2474,1/5)-1 -> #VALUE!
A2475: 1029.HK | B2475: 铁货 | C2475: 0.12 | D2475: -1224835099 | E2475: -686291968 | F2475: 1045470062 | G2475: 779571903 | H2475: -301115503 | I2475: 534552990 | J2475: 884966756 | K2475: -141324404 | L2475: -3944764234.5 | M2475: -2463646864 | N2475: =POWER(D2475/M2475,1/9)-1 -> -7.4710390834445084e-02 | O2475: =POWER(D2475/I2475,1/5)-1 -> -2.1803678499985963
A2476: 0698.HK | B2476: 通达集团 | C2476: 0.08 | D2476: -1229656000 | E2476: 137287000 | F2476: 228198000 | G2476: 351340000 | H2476: 401521000 | I2476: 542821000 | J2476: 1006125000 | K2476: 1003996000 | L2476: 702839000 | M2476: 501701000 | N2476: =POWER(D2476/M2476,1/9)-1 -> -2.1047394220060234 | O2476: =POWER(D2476/I2476,1/5)-1 -> -2.1776748445098137
A2477: 1310.HK | B2477: 香港宽频 | C2477: 2.52 | D2477: -1267408000 | E2477: 553321000 | F2477: 206872000 | G2477: 97174000 | H2477: 214527000 | I2477: 396897000 | J2477: 171110000 | K2477: 244679000 | L2477: 104268000 | M2477: 53550000 | N2477: =POWER(D2477/M2477,1/9)-1 -> -2.4212946054258735 | O2477: =POWER(D2477/I2477,1/5)-1 -> -2.2613851840827377
A2478: 0451.HK | B2478: 协鑫新能源 | C2478: 0.38 | D2478: -1277775664.2 | E2478: -1683741142.5999999 | F2478: -967690513 | G2478: -1630941132.5999999 | H2478: 329313840 | I2478: 534777648 | J2478: 1008801217.1 | K2478: 144891442.5 | L2478: -17910065.449999999 | M2478: -173309000 | N2478: =POWER(D2478/M2478,1/9)-1 -> 0.24854362582602252 | O2478: =POWER(D2478/I2478,1/5)-1 -> -2.1902995602223556
A2479: 1396.HK | B2479: 粤港湾控股 | C2479: 0.44 | D2479: -1331605661.4000001 | E2479: -1773183679.2 | F2479: -610393658 | G2479: 429913562.39999998 | H2479: -303089467.5 | I2479: 121824507 | J2479: 294417469.69999999 | K2479: 389248650 | L2479: 654912843.75 | M2479: 638990938.70000005 | N2479: =POWER(D2479/M2479,1/9)-1 -> -2.0850036890663404 | O2479: =POWER(D2479/I2479,1/5)-1 -> -2.6133485164956749
A2480: 9880.HK | B2480: 优必选 | C2480: 106.90000000000001 | D2480: -1352763417.5999999 | E2480: -- | F2480: -- | G2480: -- | H2480: -- | I2480: -- | J2480: -- | K2480: -- | L2480: -- | M2480: -- | N2480: =POWER(D2480/M2480,1/9)-1 -> #VALUE! | O2480: =POWER(D2480/I2480,1/5)-1 -> #VALUE!
A2481: 2048.HK | B2481: 易居企业控股 | C2481: 0.10000000000000001 | D2481: -1359012853.8 | E2481: -4395414901.8999996 | F2481: -14256470231.5 | G2481: 362829854.69999999 | H2481: 962024460 | I2481: 1082025243.2 | J2481: 422036778 | K2481: 541144301.25 | L2481: 194294044.44999999 | M2481: -- | N2481: =POWER(D2481/M2481,1/9)-1 -> #VALUE! | O2481: =POWER(D2481/I2481,1/5)-1 -> -2.0466397733016666
A2482: 1812.HK | B2482: 晨鸣纸业 | C2482: 1.71 | D2482: -1404549714.1300001 | E2482: 213538185.30000001 | F2482: 2529220801.6199999 | G2482: 2040567458.6900001 | H2482: 1851213158.5999999 | I2482: 2857691138.25 | J2482: 4519044283.1199999 | K2482: 2220920679 | L2482: 1201011282.6099999 | M2482: 630444551.70000005 | N2482: =POWER(D2482/M2482,1/9)-1 -> -2.093086344499357 | O2482: =POWER(D2482/I2482,1/5)-1 -> -1.8675696794586241
A2483: 6660.HK | B2483: 艾美疫苗 | C2483: 6.5 | D2483: -1426161681 | E2483: -360541888.10000002 | F2483: -848301763 | G2483: 452072175.30000001 | H2483: -- | I2483: -- | J2483: -- | K2483: -- | L2483: -- | M2483: -- | N2483: =POWER(D2483/M2483,1/9)-1 -> #VALUE! | O2483: =POWER(D2483/I2483,1/5)-1 -> #VALUE!
A2484: 6999.HK | B2484: 领地控股 | C2484: 0.25 | D2484: -1445978784.5999999 | E2484: -4681488652.8000002 | F2484: 598105800.5 | G2484: 1025404680.9 | H2484: 608841937.5 | I2484: 479220799.60000002 | J2484: 735956754 | K2484: -- | L2484: -- | M2484: -- | N2484: =POWER(D2484/M2484,1/9)-1 -> #VALUE! | O2484: =POWER(D2484/I2484,1/5)-1 -> -2.2471688419206246
A2485: 0323.HK | B2485: 马鞍山钢铁股份 | C2485: 1.1000000000000001 | D2485: -1454834436.3 | E2485: -999447561.49000001 | F2485: 6529343851.1499996 | G2485: 2363107210.75 | H2485: 1260706485.1500001 | I2485: 6767026105.6800003 | J2485: 4950185999.3500004 | K2485: 1365606687.28 | L2485: -5650096631.6099997 | M2485: 275306737.60000002 | N2485: =POWER(D2485/M2485,1/9)-1 -> -2.203186555011829 | O2485: =POWER(D2485/I2485,1/5)-1 -> -1.7353314551199079
A2486: 3329.HK | B2486: 交银国际 | C2486: 0.26 | D2486: -1469500000 | E2486: -2983800000 | F2486: 262420000 | G2486: 843155000 | H2486: 500567000 | I2486: 407605000 | J2486: 403907000 | K2486: 350609000 | L2486: 350238000 | M2486: 23677000 | N2486: =POWER(D2486/M2486,1/9)-1 -> -2.5819937685052996 | O2486: =POWER(D2486/I2486,1/5)-1 -> -2.2923674688445734
A2487: 0338.HK | B2487: 上海石油化工股份 | C2487: 1.09 | D2487: -1475646341.4000001 | E2487: -3210748583.5999999 | F2487: 2538916259.5 | G2487: 768861316.79999995 | H2487: 2476076040 | I2487: 6075946476.6000004 | J2487: 7365108855.8000002 | K2487: 6632457842.5 | L2487: 3850749923.4000001 | M2487: -863823833.79999995 | N2487: =POWER(D2487/M2487,1/9)-1 -> 6.1303699501596087e-02 | O2487: =POWER(D2487/I2487,1/5)-1 -> -1.753483365953771
A2488: 0105.HK | B2488: 凯联国际酒店 | C2488: 5.11 | D2488: -1584691000 | E2488: -1120762000 | F2488: -1525504000 | G2488: -912864000 | H2488: 148485000 | I2488: 159318000 | J2488: -159115000 | K2488: 871369000 | L2488: 1290379000 | M2488: 1382298000 | N2488: =POWER(D2488/M2488,1/9)-1 -> -2.0152982949848512 | O2488: =POWER(D2488/I2488,1/5)-1 -> -2.5832006121318116
A2489: 0610.HK | B2489: 惠记集团 | C2489: 0.75 | D2489: -1590096000 | E2489: -6762000 | F2489: 676165000 | G2489: 1083462000 | H2489: 1264484000 | I2489: 1210625000 | J2489: 912462000 | K2489: 669320000 | L2489: 420865000 | M2489: 542649000 | N2489: =POWER(D2489/M2489,1/9)-1 -> -2.126881527616288 | O2489: =POWER(D2489/I2489,1/5)-1 -> -2.0560457701794705
A2490: 0276.HK | B2490: 蒙古能源 | C2490: 0.63 | D2490: -1603099000 | E2490: -349052000 | F2490: 1795091000 | G2490: 1441938000 | H2490: -44425000 | I2490: -159938000 | J2490: -204847000 | K2490: -553455000 | L2490: -6868030000 | M2490: -1038124000 | N2490: =POWER(D2490/M2490,1/9)-1 -> 4.9464859865553379e-02 | O2490: =POWER(D2490/I2490,1/5)-1 -> 0.58562957070088761
A2491: 0666.HK | B2491: 瑞浦兰钧 | C2491: 13.4 | D2491: -1613389352.4000001 | E2491: -- | F2491: -- | G2491: -- | H2491: 16172460 | I2491: -43567000 | J2491: 166667000 | K2491: -73565000 | L2491: -103989000 | M2491: 87105000 | N2491: =POWER(D2491/M2491,1/9)-1 -> -2.3831049078119486 | O2491: =POWER(D2491/I2491,1/5)-1 -> 1.0592842891716425
A2492: 6185.HK | B2492: 康希诺生物 | C2492: 18.64 | D2492: -1625370818.4000001 | E2492: -1025929111.1 | F2492: 2344170555 | G2492: -472752832.19999999 | H2492: -175186005 | I2492: -157446746.59999999 | J2492: -77269105 | K2492: -55396923.75 | L2492: -- | M2492: -- | N2492: =POWER(D2492/M2492,1/9)-1 -> #VALUE! | O2492: =POWER(D2492/I2492,1/5)-1 -> 0.59501126049080688
A2493: 0433.HK | B2493: 北方矿业 | C2493: 0.03 | D2493: -1632535000 | E2493: -162643000 | F2493: -357732000 | G2493: -2605584000 | H2493: -742746000 | I2493: -484008000 | J2493: -145774000 | K2493: -324425000 | L2493: -436220000 | M2493: -165189000 | N2493: =POWER(D2493/M2493,1/9)-1 -> 0.28985940657087506 | O2493: =POWER(D2493/I2493,1/5)-1 -> 0.27526955631798633
A2494: 1053.HK | B2494: 重庆钢铁股份 | C2494: 0.59999999999999998 | D2494: -1638179804.1700001 | E2494: -1149995692.6300001 | F2494: 2784996140.6999998 | G2494: 761003120.10000002 | H2494: 1034495452.5 | I2494: 2035709771.5999999 | J2494: 383751105.39999998 | K2494: -5207268605 | L2494: -7041303010.3999996 | M2494: 64180744.899999999 | N2494: =POWER(D2494/M2494,1/9)-1 -> -2.433271730090504 | O2494: =POWER(D2494/I2494,1/5)-1 -> -1.9574787436213406
A2495: 9995.HK | B2495: 荣昌生物 | C2495: 15.5 | D2495: -1656609229.8 | E2495: -1126780123 | F2495: 338277921 | G2495: -831732849.89999998 | H2495: -480837900 | I2495: -307362792.80000001 | J2495: -- | K2495: -- | L2495: -- | M2495: -- | N2495: =POWER(D2495/M2495,1/9)-1 -> #VALUE! | O2495: =POWER(D2495/I2495,1/5)-1 -> 0.40059882156142779
A2496: 0191.HK | B2496: 丽新国际 | C2496: 0.63 | D2496: -1665400000 | E2496: -1196301000 | F2496: -1267964000 | G2496: -1965907000 | H2496: 2797488000 | I2496: 2567355000 | J2496: 1456666000 | K2496: 683316000 | L2496: 1290676000 | M2496: 940496000 | N2496: =POWER(D2496/M2496,1/9)-1 -> -2.0655492112678431 | O2496: =POWER(D2496/I2496,1/5)-1 -> -1.9170785320133479
A2497: 1622.HK | B2497: 力高集团 | C2497: 1.33 | D2497: -1705612658.4000001 | E2497: -- | F2497: 1082412693.5 | G2497: 1544661875.4000001 | H2497: 1156535392.5 | I2497: 1128064534.2 | J2497: 1033735939.3 | K2497: 500902605 | L2497: 471631331.5 | M2497: 433274623.69999999 | N2497: =POWER(D2497/M2497,1/9)-1 -> -2.1644588033970642 | O2497: =POWER(D2497/I2497,1/5)-1 -> -2.0861987358657554
A2498: 0467.HK | B2498: 联合能源集团 | C2498: 0.33 | D2498: -1707385000 | E2498: 2601162000 | F2498: 2000597000 | G2498: 864176000 | H2498: 1905957000 | I2498: 1637991000 | J2498: 1316340000 | K2498: 965008000 | L2498: -2943674000 | M2498: 1827887000 | N2498: =POWER(D2498/M2498,1/9)-1 -> -1.9924511154097964 | O2498: =POWER(D2498/I2498,1/5)-1 -> -2.0083330218156838
A2499: 0200.HK | B2499: 新濠国际发展 | C2499: 4.9000000000000004 | D2499: -1743932000 | E2499: -5113127000 | F2499: -3808968000 | G2499: -6339887000 | H2499: 689772000 | I2499: 522571000 | J2499: 474136000 | K2499: 10365940000 | L2499: 100924000 | M2499: 1487172000 | N2499: =POWER(D2499/M2499,1/9)-1 -> -2.0178537285272431 | O2499: =POWER(D2499/I2499,1/5)-1 -> -2.2725558400255572
A2500: 6698.HK | B2500: 星空华文 | C2500: 3.74 | D2500: -1758999790.8 | E2500: 98052195.799999997 | F2500: -422447602 | G2500: -19607946.899999999 | H2500: -- | I2500: -- | J2500: -- | K2500: -- | L2500: -- | M2500: -- | N2500: =POWER(D2500/M2500,1/9)-1 -> #VALUE! | O2500: =POWER(D2500/I2500,1/5)-1 -> #VALUE!
A2501: 0061.HK | B2501: 绿领控股 | C2501: 0.07 | D2501: -1803269000 | E2501: -229533000 | F2501: 265672000 | G2501: -312362000 | H2501: -695650000 | I2501: -1182062000 | J2501: 94108000 | K2501: 107605000 | L2501: -2373281000 | M2501: -452508000 | N2501: =POWER(D2501/M2501,1/9)-1 -> 0.16604394269922906 | O2501: =POWER(D2501/I2501,1/5)-1 -> 8.8138188176432264e-02
A2502: 0694.HK | B2502: 北京首都机场股份 | C2502: 2.69 | D2502: -1860019005.5999999 | E2502: -3978396943.5 | F2502: -2591699556.5 | G2502: -2425100526.9000001 | H2502: 2703649327.5 | I2502: 3270121823 | J2502: 3117692692.9000001 | K2502: 1979137361.25 | L2502: 1930974135.75 | M2502: 1736117164.9000001 | N2502: =POWER(D2502/M2502,1/9)-1 -> -2.0076889202579844 | O2502: =POWER(D2502/I2502,1/5)-1 -> -1.8932863340713015
A2503: 1862.HK | B2503: 景瑞控股 | C2503: 0.07 | D2503: -1886801364 | E2503: -4816752355.1999998 | F2503: 156176403.5 | G2503: 1141949854.8 | H2503: 1009762942.5 | I2503: 1174942973.4000001 | J2503: 966026862.89999998 | K2503: 118120318.75 | L2503: -414788130.80000001 | M2503: 341877179.80000001 | N2503: =POWER(D2503/M2503,1/9)-1 -> -2.2090059886569624 | O2503: =POWER(D2503/I2503,1/5)-1 -> -2.0993649296951862
A2504: 0078.HK | B2504: 富豪酒店 | C2504: 2.85 | D2504: -1906500000 | E2504: -473100000 | F2504: -608000000 | G2504: -999300000 | H2504: 340100000 | I2504: 432900000 | J2504: 901600000 | K2504: 213700000 | L2504: 119000000 | M2504: 410300000 | N2504: =POWER(D2504/M2504,1/9)-1 -> -2.1861132123540434 | O2504: =POWER(D2504/I2504,1/5)-1 -> -2.3451473015926929
A2505: 0337.HK | B2505: 绿地香港 | C2505: 0.21 | D2505: -1920392220.5999999 | E2505: 542507802.39999998 | F2505: 2638968930 | G2505: 3108841113.3000002 | H2505: 2764491615 | I2505: 1925953286 | J2505: 1527078493.7 | K2505: 1213931722.5 | L2505: 259013252 | M2505: 58416694.799999997 | N2505: =POWER(D2505/M2505,1/9)-1 -> -2.4741416521418174 | O2505: =POWER(D2505/I2505,1/5)-1 -> -1.9994218448103691
A2506: 0165.HK | B2506: 中国光大控股 | C2506: 3.92 | D2506: -1922639000 | E2506: -7443299000 | F2506: 2572840000 | G2506: 2264175000 | H2506: 2237166000 | I2506: 3103917000 | J2506: 4148342000 | K2506: 4074382000 | L2506: 5143994000 | M2506: 2559688000 | N2506: =POWER(D2506/M2506,1/9)-1 -> -1.9687017391795583 | O2506: =POWER(D2506/I2506,1/5)-1 -> -1.9086518802670511
A2507: 1224.HK | B2507: 中渝置地 | C2507: 1.2 | D2507: -1937240000 | E2507: -1940341000 | F2507: 490079000 | G2507: 588168000 | H2507: 414023000 | I2507: 171099000 | J2507: 291876000 | K2507: -356756000 | L2507: 1366665000 | M2507: 1068280000 | N2507: =POWER(D2507/M2507,1/9)-1 -> -2.0683708664288343 | O2507: =POWER(D2507/I2507,1/5)-1 -> -2.6247524154744153
A2508: 2419.HK | B2508: 德康农牧 | C2508: 50.55 | D2508: -1945893121.2 | E2508: -- | F2508: -- | G2508: -- | H2508: -- | I2508: -- | J2508: -- | K2508: -- | L2508: -- | M2508: -- | N2508: =POWER(D2508/M2508,1/9)-1 -> #VALUE! | O2508: =POWER(D2508/I2508,1/5)-1 -> #VALUE!
A2509: 2280.HK | B2509: 慧聪集团 | C2509: 0.19 | D2509: -2005541748 | E2509: -253039598.59999999 | F2509: -811978195 | G2509: -888605550.29999995 | H2509: -420727575 | I2509: 313809546 | J2509: 321037845.30000001 | K2509: 202007470 | L2509: 61803779.600000001 | M2509: 234147220.69999999 | N2509: =POWER(D2509/M2509,1/9)-1 -> -2.2695157047242773 | O2509: =POWER(D2509/I2509,1/5)-1 -> -2.44914923282413
A2510: 0880.HK | B2510: 澳博控股 | C2510: 2.48 | D2510: -2009800000 | E2510: -7798400000 | F2510: -4143700000 | G2510: -3024900000 | H2510: 3207300000 | I2510: 2850100000 | J2510: 1963400000 | K2510: 2326500000 | L2510: 2465000000 | M2510: 6730700000 | N2510: =POWER(D2510/M2510,1/9)-1 -> -1.8743331734807556 | O2510: =POWER(D2510/I2510,1/5)-1 -> -1.932520845444156
A2511: 0861.HK | B2511: 神州控股 | C2511: 3.2000000000000002 | D2511: -2010089881.8 | E2511: 350128397 | F2511: 725349718 | G2511: 612970000 | H2511: 301844000 | I2511: 149587000 | J2511: -413006000 | K2511: 389314000 | L2511: 661676000 | M2511: 700953000 | N2511: =POWER(D2511/M2511,1/9)-1 -> -2.1241811180183019 | O2511: =POWER(D2511/I2511,1/5)-1 -> -2.6813739907599867
A2512: 2231.HK | B2512: 景业名邦集团 | C2512: 0.86 | D2512: -2011973153.4000001 | E2512: -814329137.89999998 | F2512: 265038127 | G2512: 578313455.70000005 | H2512: 560445247.5 | I2512: 440052959.60000002 | J2512: 107648032.09999999 | K2512: 93908403.75 | L2512: -- | M2512: -- | N2512: =POWER(D2512/M2512,1/9)-1 -> #VALUE! | O2512: =POWER(D2512/I2512,1/5)-1 -> -2.3552625794080893
A2513: 2228.HK | B2513: Quantumph-P | C2513: 5.59 | D2513: -2098547740.8 | E2513: -- | F2513: -- | G2513: -- | H2513: -22938000 | I2513: -14665000 | J2513: -26588000 | K2513: -1769781000 | L2513: 181259000 | M2513: 266406000 | N2513: =POWER(D2513/M2513,1/9)-1 -> -2.2577583400337944 | O2513: =POWER(D2513/I2513,1/5)-1 -> 1.6985306630499437
A2514: 0163.HK | B2514: 英皇国际 | C2514: 0.35 | D2514: -2141983000 | E2514: -469329000 | F2514: -767448000 | G2514: -3644359000 | H2514: 3136289000 | I2514: 3371517000 | J2514: 3483150000 | K2514: -2391188000 | L2514: 898129000 | M2514: 1858140000 | N2514: =POWER(D2514/M2514,1/9)-1 -> -2.0159205186845037 | O2514: =POWER(D2514/I2514,1/5)-1 -> -1.9132677739493018
A2515: 2487.HK | B2515: 科笛-B | C2515: 7.45 | D2515: -2152671519.5999999 | E2515: -627038591.60000002 | F2515: -391326934.5 | G2515: -125309214.59999999 | H2515: -- | I2515: -- | J2515: -- | K2515: -- | L2515: -- | M2515: -- | N2515: =POWER(D2515/M2515,1/9)-1 -> #VALUE! | O2515: =POWER(D2515/I2515,1/5)-1 -> #VALUE!
A2516: 0095.HK | B2516: 绿景中国地产 | C2516: 0.59 | D2516: -2331041895 | E2516: -823678830.70000005 | F2516: 1411329312 | G2516: 4116083622 | H2516: 1955495370 | I2516: 1408638346.2 | J2516: 1241331468.8 | K2516: 891552541.25 | L2516: 491330169 | M2516: 2179589627.4000001 | N2516: =POWER(D2516/M2516,1/9)-1 -> -2.0074922293557442 | O2516: =POWER(D2516/I2516,1/5)-1 -> -2.1059872349511117
A2517: 0330.HK | B2517: 思捷环球 | C2517: 0.13 | D2517: -2339000000 | E2517: -664000000 | F2517: 381000000 | G2517: -3992000000 | H2517: -2144000000 | I2517: -2554000000 | J2517: 67000000 | K2517: 21000000 | L2517: -3696000000 | M2517: 210000000 | N2517: =POWER(D2517/M2517,1/9)-1 -> -2.3071105658522861 | O2517: =POWER(D2517/I2517,1/5)-1 -> -1.7433697447524876e-02
A2518: 3896.HK | B2518: 金山云 | C2518: 1.37 | D2518: -2385703908 | E2518: -2998697370.4000001 | F2518: -1945377844 | G2518: -1170477981.3 | H2518: -- | I2518: -- | J2518: -- | K2518: -- | L2518: -- | M2518: -- | N2518: =POWER(D2518/M2518,1/9)-1 -> #VALUE! | O2518: =POWER(D2518/I2518,1/5)-1 -> #VALUE!
A2519: 2019.HK | B2519: 德信中国 | C2519: 0.09 | D2519: -2399491911.5999999 | E2519: 421589019.60000002 | F2519: 1152812872 | G2519: 1421343133.8 | H2519: 1739404395 | I2519: 1654905001.5999999 | J2519: 884240302.70000005 | K2519: 367611501.25 | L2519: 36398747.5 | M2519: -- | N2519: =POWER(D2519/M2519,1/9)-1 -> #VALUE! | O2519: =POWER(D2519/I2519,1/5)-1 -> -2.0771327838109652
A2520: 0124.HK | B2520: 粤海置地 | C2520: 0.35 | D2520: -2444888000 | E2520: 392688000 | F2520: 1402249000 | G2520: 1681922000 | H2520: 341063000 | I2520: 224263000 | J2520: 49287000 | K2520: 17734000 | L2520: 174773000 | M2520: 81773000 | N2520: =POWER(D2520/M2520,1/9)-1 -> -2.4586832776118346 | O2520: =POWER(D2520/I2520,1/5)-1 -> -2.6125020234877576
A2521: 1877.HK | B2521: 君实生物 | C2521: 12.68 | D2521: -2501116228.8000002 | E2521: -2691722182.6999998 | F2521: -879873046.5 | G2521: -1985275124.0999999 | H2521: -831332835 | I2521: -815708980.39999998 | J2521: -384659871.60000002 | K2521: -145595975 | L2521: -- | M2521: -- | N2521: =POWER(D2521/M2521,1/9)-1 -> #VALUE! | O2521: =POWER(D2521/I2521,1/5)-1 -> 0.25117980554432862
A2522: 2689.HK | B2522: 玖龙纸业 | C2522: 3.13 | D2522: -2570232678.4000001 | E2522: 3836756704 | F2522: 8542672623 | G2522: 4569251948.25 | H2522: 4409133549 | I2522: 9277994265 | J2522: 5052834920.1999998 | K2522: 1302566810.4000001 | L2522: 1763200208 | M2522: 2190454656 | N2522: =POWER(D2522/M2522,1/9)-1 -> -2.0179239967217444 | O2522: =POWER(D2522/I2522,1/5)-1 -> -1.7735772127355707
A2523: 9688.HK | B2523: 再鼎医药 | C2523: 14.58 | D2523: -2613716820 | E2523: -3461177088 | F2523: -5493464858 | G2523: -2084820465 | H2523: -1519017877 | I2523: -1089513550 | J2523: -- | K2523: -- | L2523: -- | M2523: -- | N2523: =POWER(D2523/M2523,1/9)-1 -> #VALUE! | O2523: =POWER(D2523/I2523,1/5)-1 -> 0.19125621479636279
A2524: 1528.HK | B2524: 红星美凯龙 | C2524: 1.23 | D2524: -2644815990.5999999 | E2524: 765490304.60000002 | F2524: 2404451465.5 | G2524: 2062680437.3599999 | H2524: 5006044246.79 | I2524: 5097980440.6599998 | J2524: 4888991611.8299999 | K2524: 3775119869.1399999 | L2524: 4819532871.3999996 | M2524: 4533517124.3000002 | N2524: =POWER(D2524/M2524,1/9)-1 -> -1.9418800060950749 | O2524: =POWER(D2524/I2524,1/5)-1 -> -1.8769997295142047
A2525: 1608.HK | B2525: 伟能集团 | C2525: 0.25 | D2525: -2853972000 | E2525: -316852000 | F2525: 45689000 | G2525: 516294000 | H2525: 283551000 | I2525: 213288000 | J2525: 331924000 | K2525: 222013000 | L2525: 141223000 | M2525: 120746000 | N2525: =POWER(D2525/M2525,1/9)-1 -> -2.421083711913425 | O2525: =POWER(D2525/I2525,1/5)-1 -> -2.6799511647953977
A2526: 1238.HK | B2526: 宝龙地产 | C2526: 0.63 | D2526: -2908316161.8000002 | E2526: 459981646.89999998 | F2526: 7337325225.5 | G2526: 7262504150.3999996 | H2526: 4515947130 | I2526: 3230216170.1999998 | J2526: 4000431972.8000002 | K2526: 2738877872.5 | L2526: 2435728915.5 | M2526: 1710656261.2 | N2526: =POWER(D2526/M2526,1/9)-1 -> -2.0607395521210368 | O2526: =POWER(D2526/I2526,1/5)-1 -> -1.9792239026650851
A2527: 0377.HK | B2527: 中国华君 | C2527: 1.28 | D2527: -2937126490.1999998 | E2527: -3183879497.8000002 | F2527: -2177170796 | G2527: -1875833674.2 | H2527: -720463425 | I2527: -1060126549.4 | J2527: 25645221.300000001 | K2527: 32451111 | L2527: 242190000 | M2527: 123843000 | N2527: =POWER(D2527/M2527,1/9)-1 -> -2.4216198050819999 | O2527: =POWER(D2527/I2527,1/5)-1 -> 0.22606356835494879
A2528: 0488.HK | B2528: 丽新发展 | C2528: 0.64 | D2528: -2965960000 | E2528: -1966921000 | F2528: -2088090000 | G2528: -2934813000 | H2528: 4842944000 | I2528: 4335202000 | J2528: 2093572000 | K2528: 1148390000 | L2528: 2018262000 | M2528: 1478730000 | N2528: =POWER(D2528/M2528,1/9)-1 -> -2.0804042087350672 | O2528: =POWER(D2528/I2528,1/5)-1 -> -1.9268963890531339
A2529: 9669.HK | B2529: 北森控股 | C2529: 3.8999999999999999 | D2529: -2970517906.4000001 | E2529: -2353993069 | F2529: -1113363163.5 | G2529: -1383345429.9000001 | H2529: -- | I2529: -- | J2529: -- | K2529: -- | L2529: -- | M2529: -- | N2529: =POWER(D2529/M2529,1/9)-1 -> #VALUE! | O2529: =POWER(D2529/I2529,1/5)-1 -> #VALUE!
A2530: 2068.HK | B2530: 中铝国际 | C2530: 1.73 | D2530: -3051913977 | E2530: -12050955.25 | F2530: -1473069975.8 | G2530: -2507063442.5500002 | H2530: 38947738.649999999 | I2530: 348529813.87 | J2530: 739576233.10000002 | K2530: 1049762315 | L2530: 636218352.95000005 | M2530: 892123710 | N2530: =POWER(D2530/M2530,1/9)-1 -> -2.1464356685154491 | O2530: =POWER(D2530/I2530,1/5)-1 -> -2.543357265498372
A2531: 0845.HK | B2531: 恒盛地产 | C2531: 0.01 | D2531: -3232861518.5999999 | E2531: -335446175.5 | F2531: -6306214184 | G2531: 96547475.700000003 | H2531: -1069520137.5 | I2531: 598095194 | J2531: -3127472120.1999998 | K2531: -4468348473.75 | L2531: -4560630168.1000004 | M2531: -3738694673.0999999 | N2531: =POWER(D2531/M2531,1/9)-1 -> -1.6022350883884151e-02 | O2531: =POWER(D2531/I2531,1/5)-1 -> -2.4014040163478318
A2532: 2608.HK | B2532: 阳光100中国 | C2532: 0.03 | D2532: -3273033960 | E2532: -3568824445.0999999 | F2532: -4497238293 | G2532: 522095108.39999998 | H2532: 2016876292.5 | I2532: -34105624.399999999 | J2532: 711059197.70000005 | K2532: 217143806.25 | L2532: 706325045.54999995 | M2532: 956569009.70000005 | N2532: =POWER(D2532/M2532,1/9)-1 -> -2.1464611860249954 | O2532: =POWER(D2532/I2532,1/5)-1 -> 1.4912935366781723
A2533: 9885.HK | B2533: 药师帮 | C2533: 7.95 | D2533: -3496014194.4000001 | E2533: -1679388932.8 | F2533: -604953204.5 | G2533: -681422340.89999998 | H2533: -- | I2533: -- | J2533: -- | K2533: -- | L2533: -- | M2533: -- | N2533: =POWER(D2533/M2533,1/9)-1 -> #VALUE! | O2533: =POWER(D2533/I2533,1/5)-1 -> #VALUE!
A2534: 0347.HK | B2534: 鞍钢股份 | C2534: 1.2 | D2534: -3570323400 | E2534: 175983600 | F2534: 8527418000 | G2534: 2357578200 | H2534: 1996972500 | I2534: 9054147200 | J2534: 7958298200 | K2534: 1795780000 | L2534: -5401597650 | M2534: 1158051200 | N2534: =POWER(D2534/M2534,1/9)-1 -> -2.1332639881737219 | O2534: =POWER(D2534/I2534,1/5)-1 -> -1.8301794926281234
A2535: 0832.HK | B2535: 建业地产 | C2535: 0.10000000000000001 | D2535: -3578370604.1999998 | E2535: -8529583277.6999998 | F2535: 740717193 | G2535: 2147217385.2 | H2535: 2251834020 | I2535: 1314242713.2 | J2535: 972745498.5 | K2535: 447803746.25 | L2535: 942357104.5 | M2535: 1102271317.9000001 | N2535: =POWER(D2535/M2535,1/9)-1 -> -2.1397821935663521 | O2535: =POWER(D2535/I2535,1/5)-1 -> -2.2218051403431764
A2536: 0853.HK | B2536: 微创医疗 | C2536: 5.2000000000000002 | D2536: -3730760119 | E2536: -3408309120 | F2536: -2156022232 | G2536: -1482776756 | H2536: 360390147 | I2536: 187334442 | J2536: 147082922 | K2536: 109649314 | L2536: -93672543 | M2536: -461179516 | N2536: =POWER(D2536/M2536,1/9)-1 -> 0.26148128822552974 | O2536: =POWER(D2536/I2536,1/5)-1 -> -2.8190135698247025
A2537: 0059.HK | B2537: 天誉置业 | C2537: 0.01 | D2537: -3825066029.4000001 | E2537: -3938503943.1999998 | F2537: -348013920.5 | G2537: 1133377710 | H2537: 885348315 | I2537: 855447259 | J2537: 659946494 | K2537: 103255127.5 | L2537: -249050932.44999999 | M2537: -176268370.80000001 | N2537: =POWER(D2537/M2537,1/9)-1 -> 0.40765445996551075 | O2537: =POWER(D2537/I2537,1/5)-1 -> -2.3492397872990125
A2538: 1098.HK | B2538: 路劲 | C2538: 1.1000000000000001 | D2538: -3961585000 | E2538: -495378000 | F2538: 1028245000 | G2538: 1722848000 | H2538: 3028005000 | I2538: 2988242000 | J2538: 1943703000 | K2538: 1250075000 | L2538: 820005000 | M2538: 1005018000 | N2538: =POWER(D2538/M2538,1/9)-1 -> -2.164631007515835 | O2538: =POWER(D2538/I2538,1/5)-1 -> -2.0580121196522345
A2539: 3396.HK | B2539: 联想控股 | C2539: 5.84 | D2539: -4246984639.8000002 | E2539: 1316563770.3 | F2539: 7046857907 | G2539: 4610282310.8999996 | H2539: 4030706280 | I2539: 4966032365 | J2539: 6051838591.3999996 | K2539: 5399479295 | L2539: 5479314562.1499996 | M2539: 5191749433.1000004 | N2539: =POWER(D2539/M2539,1/9)-1 -> -1.9779292602416254 | O2539: =POWER(D2539/I2539,1/5)-1 -> -1.969201837686984
A2540: 0489.HK | B2540: 东风集团股份 | C2540: 2.2999999999999998 | D2540: -4380415200 | E2540: 11579946500 | F2540: 13950728500 | G2540: 12822460200 | H2540: 14368815000 | I2540: 14777889400 | J2540: 16857732900 | K2540: 14829631250 | L2540: 13583377500 | M2540: 15969376300 | N2540: =POWER(D2540/M2540,1/9)-1 -> -1.8661254772100218 | O2540: =POWER(D2540/I2540,1/5)-1 -> -1.7841164645324741
A2541: 1055.HK | B2541: 中国南方航空股份 | C2541: 2.86 | D2541: -4538268000 | E2541: -36887741900 | F2541: -14823797000 | G2541: -12928539300 | H2541: 2950200000 | I2541: 3296247000 | J2541: 7146642900 | K2541: 5605145000 | L2541: 4393722800 | M2541: 2217518300 | N2541: =POWER(D2541/M2541,1/9)-1 -> -2.0828245732146007 | O2541: =POWER(D2541/I2541,1/5)-1 -> -2.0660414179296991
A2542: 9863.HK | B2542: 零跑汽车 | C2542: 24.25 | D2542: -4621879558.8000002 | E2542: -5763334296.6000004 | F2542: -3484649038.5 | G2542: -1311200846.7 | H2542: -- | I2542: -- | J2542: -- | K2542: -- | L2542: -- | M2542: -- | N2542: =POWER(D2542/M2542,1/9)-1 -> #VALUE! | O2542: =POWER(D2542/I2542,1/5)-1 -> #VALUE!
A2543: 2772.HK | B2543: 中梁控股 | C2543: 0.12 | D2543: -4654090299.6000004 | E2543: -1518855790.4000001 | F2543: 3309293291.5 | G2543: 4461793025.1000004 | H2543: 4284158632.5 | I2543: 2199019169.5999999 | J2543: 602647466.29999995 | K2543: -187386753.75 | L2543: -203947062.84999999 | M2543: -- | N2543: =POWER(D2543/M2543,1/9)-1 -> #VALUE! | O2543: =POWER(D2543/I2543,1/5)-1 -> -2.1617726760487015
A2544: 2498.HK | B2544: 速腾聚创 | C2544: 15.199999999999999 | D2544: -4753812709.8000002 | E2544: -- | F2544: -- | G2544: -- | H2544: -- | I2544: -- | J2544: -- | K2544: -- | L2544: -- | M2544: -- | N2544: =POWER(D2544/M2544,1/9)-1 -> #VALUE! | O2544: =POWER(D2544/I2544,1/5)-1 -> #VALUE!
A2545: 9698.HK | B2545: 万国数据-SW | C2545: 11.14 | D2545: -4761539823.6000004 | E2545: -1703301268.5 | F2545: -1608913407.5 | G2545: -879315881.70000005 | H2545: -558958972.5 | I2545: -489903144.80000001 | J2545: -391920410 | K2545: -- | L2545: -- | M2545: -- | N2545: =POWER(D2545/M2545,1/9)-1 -> #VALUE! | O2545: =POWER(D2545/I2545,1/5)-1 -> 0.57589558469477176
A2546: 1233.HK | B2546: 时代中国控股 | C2546: 0.26 | D2546: -4940210557.8000002 | E2546: -11209124236.6 | F2546: 3992102655 | G2546: 5889404361 | H2546: 5825106202.5 | I2546: 5008917734 | J2546: 3197650930.5999999 | K2546: 2172515975 | L2546: 1670684869.5 | M2546: 1596096545.4000001 | N2546: =POWER(D2546/M2546,1/9)-1 -> -2.1337588762894364 | O2546: =POWER(D2546/I2546,1/5)-1 -> -1.9972414284153741
A2547: 9626.HK | B2547: 哔哩哔哩-W | C2547: 121.2 | D2547: -5286228280.1999998 | E2547: -8457380365.3000002 | F2547: -8313409686 | G2547: -3589649997.5999999 | H2547: -- | I2547: -- | J2547: -- | K2547: -- | L2547: -- | M2547: -- | N2547: =POWER(D2547/M2547,1/9)-1 -> #VALUE! | O2547: =POWER(D2547/I2547,1/5)-1 -> #VALUE!
A2548: 3301.HK | B2548: 融信中国 | C2548: 0.16 | D2548: -6489138965.3999996 | E2548: -12674018491.6 | F2548: 1585787500.5 | G2548: 2894079803.6999998 | H2548: 3524666520 | I2548: 2447602876 | J2548: 2013577726.9000001 | K2548: 1436111713.75 | L2548: 1685059728.6500001 | M2548: 632070085.29999995 | N2548: =POWER(D2548/M2548,1/9)-1 -> -2.2953293447031684 | O2548: =POWER(D2548/I2548,1/5)-1 -> -2.2153160235533225
A2549: 6160.HK | B2549: 百济神州 | C2549: 92.25 | D2549: -6887021188 | E2549: -15645787520 | F2549: -11368049168 | G2549: -12380812218 | H2549: -7386966236 | I2549: -5278306346 | J2549: -727522470 | K2549: -924408618 | L2549: -- | M2549: -- | N2549: =POWER(D2549/M2549,1/9)-1 -> #VALUE! | O2549: =POWER(D2549/I2549,1/5)-1 -> 5.4647591807546636e-02
A2550: 0020.HK | B2550: 商汤-W | C2550: 1.3 | D2550: -7059702295.8000002 | E2550: -6819134367.6000004 | F2550: -20988035307 | G2550: -14491350236.700001 | H2550: -- | I2550: -- | J2550: -- | K2550: -- | L2550: -- | M2550: -- | N2550: =POWER(D2550/M2550,1/9)-1 -> #VALUE! | O2550: =POWER(D2550/I2550,1/5)-1 -> #VALUE!
A2551: 80020.HK | B2551: 商汤-WR | C2551: 1.21 | D2551: -7059702295.8000002 | E2551: -6819134367.6000004 | F2551: -20988035307 | G2551: -14491350236.700001 | H2551: -- | I2551: -- | J2551: -- | K2551: -- | L2551: -- | M2551: -- | N2551: =POWER(D2551/M2551,1/9)-1 -> #VALUE! | O2551: =POWER(D2551/I2551,1/5)-1 -> #VALUE!
A2552: 1777.HK | B2552: 花样年控股 | C2552: 0.05 | D2552: -7112156562 | E2552: -6848951178.6999998 | F2552: -12815100261 | G2552: 1164986898 | H2552: 976297170 | I2552: 829286785.39999998 | J2552: 1383909452.4000001 | K2552: 895374130 | L2552: 1423737890.5 | M2552: 1566540033.9000001 | N2552: =POWER(D2552/M2552,1/9)-1 -> -2.1830596588044981 | O2552: =POWER(D2552/I2552,1/5)-1 -> -2.5369484902331321
A2553: 0817.HK | B2553: 中国金茂 | C2553: 0.64 | D2553: -7560101152.8000002 | E2553: 2238244032.3000002 | F2553: 5742836428 | G2553: 4625747213.3999996 | H2553: 7210344675 | I2553: 5933117076.8000002 | J2553: 4768878916.8000002 | K2553: 2817591043.75 | L2553: 3581683796 | M2553: 5296054000 | N2553: =POWER(D2553/M2553,1/9)-1 -> -2.0403393422651352 | O2553: =POWER(D2553/I2553,1/5)-1 -> -2.0496607009267755
A2554: 1996.HK | B2554: 弘阳地产 | C2554: 0.08 | D2554: -7908546958.1999998 | E2554: -4378742712 | F2554: 1525531080 | G2554: 1979706567.3 | H2554: 1639992712.5 | I2554: 1608003790.4000001 | J2554: 1463530799.2 | K2554: 1034662650 | L2554: 1562563536.7 | M2554: -- | N2554: =POWER(D2554/M2554,1/9)-1 -> #VALUE! | O2554: =POWER(D2554/I2554,1/5)-1 -> -2.3751875310330415
A2555: 1519.HK | B2555: 极兔速递-W | C2555: 6.78 | D2555: -8599817268 | E2555: -- | F2555: -- | G2555: -- | H2555: -- | I2555: -- | J2555: -- | K2555: -- | L2555: -- | M2555: -- | N2555: =POWER(D2555/M2555,1/9)-1 -> #VALUE! | O2555: =POWER(D2555/I2555,1/5)-1 -> #VALUE!
A2556: 1918.HK | B2556: 融创中国 | C2556: 1.1000000000000001 | D2556: -8735577240.6000004 | E2556: -31213406796.700001 | F2556: -46855074945.5 | G2556: 42483818998.199997 | H2556: 29085736837.5 | I2556: 18862656751 | J2556: 13192531350.700001 | K2556: 2754069771.25 | L2556: 3878410619.4000001 | M2556: 4020821153 | N2556: =POWER(D2556/M2556,1/9)-1 -> -2.0900385879167755 | O2556: =POWER(D2556/I2556,1/5)-1 -> -1.8573097230851316
A2557: 1966.HK | B2557: 中骏集团控股 | C2557: 0.13 | D2557: -8759789010 | E2557: 27688086.399999999 | F2557: 3759241939 | G2557: 4533079372.1999998 | H2557: 3922475287.5 | I2557: 3854484362.4000001 | J2557: 3404917961.5 | K2557: 2302825595 | L2557: 1080390093 | M2557: 1123833782 | N2557: =POWER(D2557/M2557,1/9)-1 -> -2.2562843552587459 | O2557: =POWER(D2557/I2557,1/5)-1 -> -2.1784345625720212
A2558: 0670.HK | B2558: 中国东方航空股份 | C2558: 2.02 | D2558: -8953761600 | E2558: -42175146600 | F2558: -14956043000 | G2558: -14107328400 | H2558: 3567060000 | I2558: 3071942800 | J2558: 7603423800 | K2558: 4998402500 | L2558: 5335738850 | M2558: 4255339000 | N2558: =POWER(D2558/M2558,1/9)-1 -> -2.0861675357892748 | O2558: =POWER(D2558/I2558,1/5)-1 -> -2.2385640790308035
A2559: 6158.HK | B2559: 正荣地产 | C2559: 0.06 | D2559: -9282558020.3999996 | E2559: -14526595592.6 | F2559: 990626622.5 | G2559: 3159421773.5999999 | H2559: 2800907587.5 | I2559: 2414667732.4000001 | J2559: 1689101436.4000001 | K2559: 1314893230 | L2559: 492455648.85000002 | M2559: 66586696.100000001 | N2559: =POWER(D2559/M2559,1/9)-1 -> -2.7308257838994638 | O2559: =POWER(D2559/I2559,1/5)-1 -> -2.3090675540530654
A2560: 3380.HK | B2560: 龙光集团 | C2560: 0.75 | D2560: -9794044940.3999996 | E2560: -9708777182.8999996 | F2560: 12021390381.5 | G2560: 15314799381.6 | H2560: 12593156670 | I2560: 9437169962.7999992 | J2560: 7825699860 | K2560: 4986996630 | L2560: 3115684567.9499998 | M2560: 2929607477 | N2560: =POWER(D2560/M2560,1/9)-1 -> -2.1435079390110219 | O2560: =POWER(D2560/I2560,1/5)-1 -> -2.007451303564844
A2561: 0884.HK | B2561: 旭辉控股集团 | C2561: 0.31 | D2561: -9847464958.7999992 | E2561: -14720676172.799999 | F2561: 9322019315.5 | G2561: 9573215650.5 | H2561: 7193214517.5 | I2561: 6158677152.6000004 | J2561: 5788415084.5 | K2561: 3119888826.25 | L2561: 2464370437.1999998 | M2561: 2322527837.0999999 | N2561: =POWER(D2561/M2561,1/9)-1 -> -2.1741053239185164 | O2561: =POWER(D2561/I2561,1/5)-1 -> -2.0984173929906076
A2562: 3883.HK | B2562: 中国奥园 | C2562: 0.14 | D2562: -10450695049.200001 | E2562: -8847640919.7999992 | F2562: -40499858720.5 | G2562: 7041208845 | H2562: 4694371650 | I2562: 2742747352.1999998 | J2562: 1966109679.2 | K2562: 978969022.5 | L2562: 955140768 | M2562: 1010040276.8 | N2562: =POWER(D2562/M2562,1/9)-1 -> -2.2964515040333655 | O2562: =POWER(D2562/I2562,1/5)-1 -> -2.3067480904988873
A2563: 0493.HK | B2563: 国美零售 | C2563: 0.02 | D2563: -11024749776.6 | E2563: -22512343294.200001 | F2563: -5390294306.5 | G2563: -8335929290.3999996 | H2563: -2894130555 | I2563: -5564218647 | J2563: -539379115.5 | K2563: 361310713.75 | L2563: 1420624886.1500001 | M2563: 1597024983 | N2563: =POWER(D2563/M2563,1/9)-1 -> -2.2394487077720546 | O2563: =POWER(D2563/I2563,1/5)-1 -> 0.14654976800319353
A2564: 9868.HK | B2564: 小鹏汽车-W | C2564: 32.399999999999999 | D2564: -11373924555 | E2564: -10309674313.200001 | F2564: -5954861052 | G2564: -5828067995.1000004 | H2564: -- | I2564: -- | J2564: -- | K2564: -- | L2564: -- | M2564: -- | N2564: =POWER(D2564/M2564,1/9)-1 -> #VALUE! | O2564: =POWER(D2564/I2564,1/5)-1 -> #VALUE!
A2565: 1628.HK | B2565: 禹洲集团 | C2565: 0.08 | D2565: -11821295833.200001 | E2565: -13716560003.299999 | F2565: 928581207.5 | G2565: 5563789.2000000002 | H2565: 4029454680 | I2565: 3990724684 | J2565: 3344987348.3000002 | K2565: 1972373182.5 | L2565: 1948541970.6500001 | M2565: 1565345793.5999999 | N2565: =POWER(D2565/M2565,1/9)-1 -> -2.2518769523177684 | O2565: =POWER(D2565/I2565,1/5)-1 -> -2.242575149197215
A2566: 0708.HK | B2566: 恒大汽车 | C2566: 0.35 | D2566: -13082268943.799999 | E2566: -31203654372.200001 | F2566: -68908174230 | G2566: -8812997992.5 | H2566: -4946398072.5 | I2566: -1627493206.5999999 | J2566: 368959077.19999999 | K2566: 49278381.25 | L2566: -- | M2566: 11019000 | N2566: =POWER(D2566/M2566,1/9)-1 -> -3.1959156528421211 | O2566: =POWER(D2566/I2566,1/5)-1 -> 0.51716486888639612
A2567: 3383.HK | B2567: 雅居乐集团 | C2567: 0.51 | D2567: -15128869959 | E2567: -16900239827.4 | F2567: 8218888082 | G2567: 11292772164.299999 | H2567: 8394429795 | I2567: 8112532970.1999998 | J2567: 7223665031.6000004 | K2567: 2537694950 | L2567: 1635112885.1500001 | M2567: 5350053035.5 | N2567: =POWER(D2567/M2567,1/9)-1 -> -2.1224343102914718 | O2567: =POWER(D2567/I2567,1/5)-1 -> -2.1327393900960909
A2568: 1813.HK | B2568: 合景泰富集团 | C2568: 0.31 | D2568: -20535083906.400002 | E2568: -10424342293.9 | F2568: 2964944299.5 | G2568: 7957830004.8000002 | H2568: 10957996027.5 | I2568: 4594723519 | J2568: 4340103121.8999996 | K2568: 3850163432.5 | L2568: 4017678460.4000001 | M2568: 4083409577.5 | N2568: =POWER(D2568/M2568,1/9)-1 -> -2.1965793515775434 | O2568: =POWER(D2568/I2568,1/5)-1 -> -2.3491101809071568
A2569: 1638.HK | B2569: 佳兆业集团 | C2569: 0.13 | D2569: -21849626118.599998 | E2569: -14905412700.700001 | F2569: -15756792530 | G2569: 6492428287.5 | H2569: 5134091137.5 | I2569: 3131384551.5999999 | J2569: 3938253422.0999999 | K2569: -680507275 | L2569: -1319030630.8499999 | M2569: -1606651283.5999999 | N2569: =POWER(D2569/M2569,1/9)-1 -> 0.33643220195396406 | O2569: =POWER(D2569/I2569,1/5)-1 -> -2.4748284986410942
A2570: 2777.HK | B2570: 富力地产 | C2570: 0.83 | D2570: -22104308457 | E2570: -17752514865 | F2570: -20166521930.5 | G2570: 10732837806.6 | H2570: 10808516992.5 | I2570: 9531490448.2000008 | J2570: 25400436103.900002 | K2570: 7507502765 | L2570: 6604455709.75 | M2570: 6514790483.6999998 | N2570: =POWER(D2570/M2570,1/9)-1 -> -2.1453888263636278 | O2570: =POWER(D2570/I2570,1/5)-1 -> -2.1832137913210059
A2571: 0813.HK | B2571: 世茂集团 | C2571: 0.76 | D2571: -23053284412.200001 | E2571: -24245664431.799999 | F2571: -33175121355 | G2571: 15050930600.1 | H2571: 12178068000 | I2571: 10059291894 | J2571: 9399968256.6000004 | K2571: 5747223868.75 | L2571: 7192467773.1999998 | M2571: 10112773200.700001 | N2571: =POWER(D2571/M2571,1/9)-1 -> -2.0958787471149991 | O2571: =POWER(D2571/I2571,1/5)-1 -> -2.1804105423653537
A2572: 3377.HK | B2572: 远洋集团 | C2572: 0.37 | D2572: -23126028244.200001 | E2572: -17970868772.900002 | F2572: 3341835603.5 | G2572: 3416322707.6999998 | H2572: 2968389547.5 | I2572: 4069066057 | J2572: 6132859054.5 | K2572: 4112905160 | L2572: 2503011912.0500002 | M2572: 5422179159.6999998 | N2572: =POWER(D2572/M2572,1/9)-1 -> -2.1748756687346447 | O2572: =POWER(D2572/I2572,1/5)-1 -> -2.4155371194481701
A2573: 9866.HK | B2573: 蔚来-SW | C2573: 35.399999999999999 | D2573: -23181305225.400002 | E2573: -16424509904.5 | F2573: -12945792370.5 | G2573: -6687500601 | H2573: -- | I2573: -- | J2573: -- | K2573: -- | L2573: -- | M2573: -- | N2573: =POWER(D2573/M2573,1/9)-1 -> #VALUE! | O2573: =POWER(D2573/I2573,1/5)-1 -> #VALUE!
A2574: 0007.HK | B2574: 智富资源投资 | C2574: 0.03 | D2574: -- | E2574: 250227000 | F2574: 267895000 | G2574: -211940000 | H2574: 677713000 | I2574: 159982000 | J2574: 11664000 | K2574: -4621000 | L2574: -36480000 | M2574: -37756000 | N2574: =POWER(D2574/M2574,1/9)-1 -> #VALUE! | O2574: =POWER(D2574/I2574,1/5)-1 -> #VALUE!
A2575: 0009.HK | B2575: 金奥国际 | C2575: 0.01 | D2575: -- | E2575: -505952000 | F2575: -537362000 | G2575: -597189000 | H2575: -288950000 | I2575: -354055000 | J2575: -395423000 | K2575: -328714000 | L2575: -643538000 | M2575: -178032000 | N2575: =POWER(D2575/M2575,1/9)-1 -> #VALUE! | O2575: =POWER(D2575/I2575,1/5)-1 -> #VALUE!
A2576: 0091.HK | B2576: 金禧国际控股 | C2576: 0.02 | D2576: -- | E2576: -155759000 | F2576: -61960000 | G2576: -64369000 | H2576: -396791000 | I2576: -530452000 | J2576: -303913000 | K2576: -384448000 | L2576: -423744000 | M2576: -196428000 | N2576: =POWER(D2576/M2576,1/9)-1 -> #VALUE! | O2576: =POWER(D2576/I2576,1/5)-1 -> #VALUE!
A2577: 0102.HK | B2577: 凯升控股 | C2577: 0.05 | D2577: -- | E2577: 11847000 | F2577: -229988000 | G2577: 10018000 | H2577: 81998000 | I2577: 7611000 | J2577: 13778000 | K2577: 559000 | L2577: -85365000 | M2577: -78874000 | N2577: =POWER(D2577/M2577,1/9)-1 -> #VALUE! | O2577: =POWER(D2577/I2577,1/5)-1 -> #VALUE!
A2578: 0167.HK | B2578: 万威国际 | C2578: 0.02 | D2578: -- | E2578: -- | F2578: -84200000 | G2578: -95800000 | H2578: -83100000 | I2578: -215600000 | J2578: -85700000 | K2578: -64000000 | L2578: -67000000 | M2578: -68800000 | N2578: =POWER(D2578/M2578,1/9)-1 -> #VALUE! | O2578: =POWER(D2578/I2578,1/5)-1 -> #VALUE!
A2579: 0185.HK | B2579: 正商实业 | C2579: 0.33 | D2579: -- | E2579: -3323510075.3000002 | F2579: 489151015 | G2579: 933243397.20000005 | H2579: 1286880592.5 | I2579: 34124980.600000001 | J2579: 157905920.09999999 | K2579: -56702000 | L2579: -54920000 | M2579: -43503000 | N2579: =POWER(D2579/M2579,1/9)-1 -> #VALUE! | O2579: =POWER(D2579/I2579,1/5)-1 -> #VALUE!
A2580: 0254.HK | B2580: 国家联合资源 | C2580: 0.04 | D2580: -- | E2580: -- | F2580: 54756000 | G2580: 36726000 | H2580: 61556000 | I2580: -14673000 | J2580: -131036000 | K2580: -1438382000 | L2580: -132674000 | M2580: -68647000 | N2580: =POWER(D2580/M2580,1/9)-1 -> #VALUE! | O2580: =POWER(D2580/I2580,1/5)-1 -> #VALUE!
A2581: 0269.HK | B2581: 中国资源交通 | C2581: 0.01 | D2581: -- | E2581: -4358017000 | F2581: -1332463000 | G2581: -3154695000 | H2581: -1072414000 | I2581: -1284931000 | J2581: -1676202000 | K2581: -3456008000 | L2581: -1765900000 | M2581: -590485000 | N2581: =POWER(D2581/M2581,1/9)-1 -> #VALUE! | O2581: =POWER(D2581/I2581,1/5)-1 -> #VALUE!
A2582: 0274.HK | B2582: 复兴亚洲 | C2582: 0.15 | D2582: -- | E2582: -38572000 | F2582: -55378000 | G2582: -108567000 | H2582: -98434000 | I2582: -72742000 | J2582: -15849000 | K2582: -27181000 | L2582: -34460000 | M2582: -601987000 | N2582: =POWER(D2582/M2582,1/9)-1 -> #VALUE! | O2582: =POWER(D2582/I2582,1/5)-1 -> #VALUE!
A2583: 0550.HK | B2583: 律齐文化 | C2583: 0.13 | D2583: -- | E2583: -8850000 | F2583: -7109000 | G2583: -22562000 | H2583: -33777000 | I2583: -55952000 | J2583: -57834000 | K2583: -12115000 | L2583: -26065000 | M2583: 78913000 | N2583: =POWER(D2583/M2583,1/9)-1 -> #VALUE! | O2583: =POWER(D2583/I2583,1/5)-1 -> #VALUE!
A2584: 0589.HK | B2584: 建中建设 | C2584: 0.19 | D2584: -- | E2584: -243754207.5 | F2584: -115051571 | G2584: 71216025 | H2584: 200300700 | I2584: 159966468.40000001 | J2584: 80984496.099999994 | K2584: 18793460 | L2584: -- | M2584: -- | N2584: =POWER(D2584/M2584,1/9)-1 -> #VALUE! | O2584: =POWER(D2584/I2584,1/5)-1 -> #VALUE!
A2585: 0593.HK | B2585: 梦东方 | C2585: 0.19 | D2585: -- | E2585: -903659000 | F2585: -860648000 | G2585: -1765132000 | H2585: -199812000 | I2585: 159932000 | J2585: 115575000 | K2585: 39741000 | L2585: 551825000 | M2585: -143597000 | N2585: =POWER(D2585/M2585,1/9)-1 -> #VALUE! | O2585: =POWER(D2585/I2585,1/5)-1 -> #VALUE!
A2586: 0663.HK | B2586: 金山能源 | C2586: 0.10000000000000001 | D2586: -- | E2586: 108445000 | F2586: -42860000 | G2586: -268935000 | H2586: -88404000 | I2586: -143308000 | J2586: -60230000 | K2586: -111384000 | L2586: 2020128000 | M2586: -1723508000 | N2586: =POWER(D2586/M2586,1/9)-1 -> #VALUE! | O2586: =POWER(D2586/I2586,1/5)-1 -> #VALUE!
A2587: 0704.HK | B2587: 和嘉控股 | C2587: 0.09 | D2587: -- | E2587: -- | F2587: -31259000 | G2587: -484675000 | H2587: 9761000 | I2587: 129118000 | J2587: 117898000 | K2587: 55663000 | L2587: -110474000 | M2587: -989409000 | N2587: =POWER(D2587/M2587,1/9)-1 -> #VALUE! | O2587: =POWER(D2587/I2587,1/5)-1 -> #VALUE!
A2588: 0715.HK | B2588: 中泛控股 | C2588: 0.03 | D2588: -- | E2588: -2420051000 | F2588: -5359792000 | G2588: -926596000 | H2588: -58044000 | I2588: -48840000 | J2588: 70422000 | K2588: 136214000 | L2588: 122510000 | M2588: 85808000 | N2588: =POWER(D2588/M2588,1/9)-1 -> #VALUE! | O2588: =POWER(D2588/I2588,1/5)-1 -> #VALUE!
A2589: 0901.HK | B2589: 金石投资集团 | C2589: 0.02 | D2589: -- | E2589: -34858695 | F2589: -41843270 | G2589: -36301591 | H2589: -43673836 | I2589: -53267690 | J2589: -45248621 | K2589: -76815200 | L2589: -60402871 | M2589: -25202733 | N2589: =POWER(D2589/M2589,1/9)-1 -> #VALUE! | O2589: =POWER(D2589/I2589,1/5)-1 -> #VALUE!
A2590: 1004.HK | B2590: 中国智慧能源 | C2590: 0.02 | D2590: -- | E2590: -94744000 | F2590: -650707000 | G2590: -772377000 | H2590: -122175000 | I2590: -236738000 | J2590: -351804000 | K2590: -275537000 | L2590: -28778000 | M2590: -118084000 | N2590: =POWER(D2590/M2590,1/9)-1 -> #VALUE! | O2590: =POWER(D2590/I2590,1/5)-1 -> #VALUE!
A2591: 1034.HK | B2591: 富汇国际集团控股 | C2591: 0.15 | D2591: -- | E2591: 71849000 | F2591: 79175000 | G2591: -73403000 | H2591: 7179000 | I2591: 12236000 | J2591: 45611000 | K2591: 28467000 | L2591: 14211000 | M2591: -- | N2591: =POWER(D2591/M2591,1/9)-1 -> #VALUE! | O2591: =POWER(D2591/I2591,1/5)-1 -> #VALUE!
A2592: 1064.HK | B2592: 中华国际 | C2592: 0.05 | D2592: -- | E2592: 3273000 | F2592: 6811000 | G2592: -6576000 | H2592: -18505000 | I2592: 11989000 | J2592: 18609000 | K2592: 58628000 | L2592: 28736000 | M2592: 16438000 | N2592: =POWER(D2592/M2592,1/9)-1 -> #VALUE! | O2592: =POWER(D2592/I2592,1/5)-1 -> #VALUE!
A2593: 1107.HK | B2593: 当代置业 | C2593: 0.02 | D2593: -- | E2593: -5024239275.8000002 | F2593: -2515896884 | G2593: 880815291.89999998 | H2593: 816525960 | I2593: 597527032.60000002 | J2593: 846422201.10000002 | K2593: 738238935 | L2593: 679600485.35000002 | M2593: 650315631.20000005 | N2593: =POWER(D2593/M2593,1/9)-1 -> #VALUE! | O2593: =POWER(D2593/I2593,1/5)-1 -> #VALUE!
A2594: 1116.HK | B2594: 美亚控股 | C2594: 0.85 | D2594: -- | E2594: -- | F2594: -- | G2594: 18896382.600000001 | H2594: 3712335 | I2594: -55719668.200000003 | J2594: -17511133.399999999 | K2594: 16474281.25 | L2594: -10050523.300000001 | M2594: -17222267.899999999 | N2594: =POWER(D2594/M2594,1/9)-1 -> #VALUE! | O2594: =POWER(D2594/I2594,1/5)-1 -> #VALUE!
A2595: 1153.HK | B2595: 佳源服务 | C2595: 0.28 | D2595: -- | E2595: -- | F2595: 123035311 | G2595: 77981249.400000006 | H2595: 56114145 | I2595: 40734553.600000001 | J2595: 21998616.100000001 | K2595: -- | L2595: -- | M2595: -- | N2595: =POWER(D2595/M2595,1/9)-1 -> #VALUE! | O2595: =POWER(D2595/I2595,1/5)-1 -> #VALUE!
A2596: 1185.HK | B2596: 中国航天万源 | C2596: 0.04 | D2596: -- | E2596: 458373000 | F2596: -76499000 | G2596: -1061359000 | H2596: -1045306000 | I2596: -1320525000 | J2596: -237098000 | K2596: 76024000 | L2596: 75469000 | M2596: 90894000 | N2596: =POWER(D2596/M2596,1/9)-1 -> #VALUE! | O2596: =POWER(D2596/I2596,1/5)-1 -> #VALUE!
A2597: 1189.HK | B2597: 大湾区聚变力量 | C2597: 0.05 | D2597: -- | E2597: -23455000 | F2597: -33410000 | G2597: -71648000 | H2597: -95435000 | I2597: -3785000 | J2597: -116128000 | K2597: -86438000 | L2597: -105098000 | M2597: 380755000 | N2597: =POWER(D2597/M2597,1/9)-1 -> #VALUE! | O2597: =POWER(D2597/I2597,1/5)-1 -> #VALUE!
A2598: 1207.HK | B2598: 上置集团 | C2598: 0.01 | D2598: -- | E2598: -302064568.39999998 | F2598: 46704879 | G2598: -1095091498.2 | H2598: -2521784025 | I2598: 129265258 | J2598: 827892002.70000005 | K2598: 257543300 | L2598: -1899412000 | M2598: -105954000 | N2598: =POWER(D2598/M2598,1/9)-1 -> #VALUE! | O2598: =POWER(D2598/I2598,1/5)-1 -> #VALUE!
A2599: 1210.HK | B2599: 克莉丝汀 | C2599: 0.06 | D2599: -- | E2599: -- | F2599: -208318062.5 | G2599: -131551194.90000001 | H2599: -250651897.5 | I2599: -264354455 | J2599: -154243280.59999999 | K2599: -134694612.5 | L2599: -174468193.55000001 | M2599: -188164601.5 | N2599: =POWER(D2599/M2599,1/9)-1 -> #VALUE! | O2599: =POWER(D2599/I2599,1/5)-1 -> #VALUE!
A2600: 1255.HK | B2600: TATA健康 | C2600: 0.29999999999999999 | D2600: -- | E2600: 9613000 | F2600: -60761000 | G2600: -151869000 | H2600: -60925000 | I2600: -1749000 | J2600: -43442000 | K2600: -33674000 | L2600: -16373000 | M2600: 9035000 | N2600: =POWER(D2600/M2600,1/9)-1 -> #VALUE! | O2600: =POWER(D2600/I2600,1/5)-1 -> #VALUE!
A2601: 1266.HK | B2601: 西王特钢 | C2601: 0.01 | D2601: -- | E2601: -1499010255.2 | F2601: 79630459.5 | G2601: 21892819.199999999 | H2601: 22114207.5 | I2601: 1094820830 | J2601: 1076675741.7 | K2601: 369589526.25 | L2601: 199015885.19999999 | M2601: 507401131.60000002 | N2601: =POWER(D2601/M2601,1/9)-1 -> #VALUE! | O2601: =POWER(D2601/I2601,1/5)-1 -> #VALUE!
A2602: 1371.HK | B2602: 中国生态旅游 | C2602: 0.23 | D2602: -- | E2602: -- | F2602: -258312000 | G2602: -573971000 | H2602: -518793000 | I2602: -169468000 | J2602: -192568000 | K2602: -297967000 | L2602: -497654000 | M2602: 100010000 | N2602: =POWER(D2602/M2602,1/9)-1 -> #VALUE! | O2602: =POWER(D2602/I2602,1/5)-1 -> #VALUE!
A2603: 1372.HK | B2603: 中国碳中和 | C2603: 0.39 | D2603: -- | E2603: -197471000 | F2603: 267651000 | G2603: 302029000 | H2603: -905423000 | I2603: -703767000 | J2603: 37713000 | K2603: 90152000 | L2603: 15874000 | M2603: 28396000 | N2603: =POWER(D2603/M2603,1/9)-1 -> #VALUE! | O2603: =POWER(D2603/I2603,1/5)-1 -> #VALUE!
A2604: 1383.HK | B2604: Let Group | C2604: 0.04 | D2604: -- | E2604: -408762000 | F2604: -527492000 | G2604: 795745000 | H2604: -1658667255 | I2604: -1660694782.5999999 | J2604: 236185697.80000001 | K2604: -780359755 | L2604: -288140482.35000002 | M2604: -179356923.30000001 | N2604: =POWER(D2604/M2604,1/9)-1 -> #VALUE! | O2604: =POWER(D2604/I2604,1/5)-1 -> #VALUE!
A2605: 1387.HK | B2605: 中国地利 | C2605: 0.66 | D2605: -- | E2605: -- | F2605: 300053929 | G2605: 231475323.30000001 | H2605: 622765987.5 | I2605: -410921878.60000002 | J2605: -152320245 | K2605: -16206368876.25 | L2605: -5216584992.1499996 | M2605: -2079641572.7 | N2605: =POWER(D2605/M2605,1/9)-1 -> #VALUE! | O2605: =POWER(D2605/I2605,1/5)-1 -> #VALUE!
A2606: 1563.HK | B2606: 友联国际教育租赁 | C2606: 0.44 | D2606: -- | E2606: 406551446.60000002 | F2606: 96611825.5 | G2606: 19797459 | H2606: -94643310 | I2606: 46224882.799999997 | J2606: 43850966.399999999 | K2606: 32536288.75 | L2606: 10081100.6 | M2606: -- | N2606: =POWER(D2606/M2606,1/9)-1 -> #VALUE! | O2606: =POWER(D2606/I2606,1/5)-1 -> #VALUE!
A2607: 1580.HK | B2607: 大森控股 | C2607: 0.13 | D2607: -- | E2607: -- | F2607: -145900399.5 | G2607: -280456453.80000001 | H2607: -84461767.5 | I2607: 21944237.800000001 | J2607: 60116442.700000003 | K2607: 59152948.75 | L2607: 53183333.100000001 | M2607: 48575755.399999999 | N2607: =POWER(D2607/M2607,1/9)-1 -> #VALUE! | O2607: =POWER(D2607/I2607,1/5)-1 -> #VALUE!
A2608: 1623.HK | B2608: 海隆控股 | C2608: 0.11 | D2608: -- | E2608: 159035025.59999999 | F2608: 54182900.5 | G2608: -356146871.39999998 | H2608: 197594115 | I2608: 169356502.59999999 | J2608: 142848935 | K2608: 138473973.75 | L2608: 189324057.15000001 | M2608: 496279846.80000001 | N2608: =POWER(D2608/M2608,1/9)-1 -> #VALUE! | O2608: =POWER(D2608/I2608,1/5)-1 -> #VALUE!
A2609: 1636.HK | B2609: 中国金属利用 | C2609: 0.05 | D2609: -- | E2609: -- | F2609: -116911586.5 | G2609: -461562083.10000002 | H2609: -242872980 | I2609: 22912047.800000001 | J2609: 221296558.69999999 | K2609: -345398725 | L2609: -586901872.25 | M2609: 310119372.69999999 | N2609: =POWER(D2609/M2609,1/9)-1 -> #VALUE! | O2609: =POWER(D2609/I2609,1/5)-1 -> #VALUE!
A2610: 1676.HK | B2610: 高地股份 | C2610: 1.43 | D2610: -- | E2610: -- | F2610: -119322627 | G2610: -38444734.5 | H2610: 34463700 | I2610: 87004980.400000006 | J2610: 84165177.799999997 | K2610: 67955160 | L2610: 65675336.200000003 | M2610: 33033160.899999999 | N2610: =POWER(D2610/M2610,1/9)-1 -> #VALUE! | O2610: =POWER(D2610/I2610,1/5)-1 -> #VALUE!
A2611: 1699.HK | B2611: 普甜食品 | C2611: 0.04 | D2611: -- | E2611: -- | F2611: -326277821 | G2611: 8951169 | H2611: 64811647.5 | I2611: -36580940.799999997 | J2611: 9471310 | K2611: 20190301.25 | L2611: -9541293.6500000004 | M2611: 75369416.299999997 | N2611: =POWER(D2611/M2611,1/9)-1 -> #VALUE! | O2611: =POWER(D2611/I2611,1/5)-1 -> #VALUE!
A2612: 1706.HK | B2612: 双运控股 | C2612: 0.06 | D2612: -- | E2612: 3422155.8500000001 | F2612: 11348062.51 | G2612: 3357433.2000000002 | H2612: 31721715.440000001 | I2612: 17864763.050000001 | J2612: 15294272.49 | K2612: 37809239.329999998 | L2612: 30736972.870000001 | M2612: 16196758.720000001 | N2612: =POWER(D2612/M2612,1/9)-1 -> #VALUE! | O2612: =POWER(D2612/I2612,1/5)-1 -> #VALUE!
A2613: 1761.HK | B2613: 宝宝树集团 | C2613: 0.27 | D2613: -- | E2613: -527525506.30000001 | F2613: -474002725.5 | G2613: -560505277.79999995 | H2613: -551928780 | I2613: 599245180 | J2613: -1092363348.2 | K2613: -1038506463.75 | L2613: -336844241 | M2613: -- | N2613: =POWER(D2613/M2613,1/9)-1 -> #VALUE! | O2613: =POWER(D2613/I2613,1/5)-1 -> #VALUE!
A2614: 1831.HK | B2614: 十方控股 | C2614: 0.07 | D2614: -- | E2614: -191561532.90000001 | F2614: -229554566 | G2614: -87943149.599999994 | H2614: -155516887.5 | I2614: -187189255.80000001 | J2614: -67729457.700000003 | K2614: -63484601.25 | L2614: -192627581.59999999 | M2614: -379578734.60000002 | N2614: =POWER(D2614/M2614,1/9)-1 -> #VALUE! | O2614: =POWER(D2614/I2614,1/5)-1 -> #VALUE!
A2615: 1859.HK | B2615: 煜盛文化 | C2615: 0.08 | D2615: -- | E2615: 11538206.800000001 | F2615: 212198503 | G2615: -236681542.5 | H2615: 165242490 | I2615: 98213358.799999997 | J2615: 67392566.799999997 | K2615: 15406370 | L2615: -- | M2615: -- | N2615: =POWER(D2615/M2615,1/9)-1 -> #VALUE! | O2615: =POWER(D2615/I2615,1/5)-1 -> #VALUE!
A2616: 1902.HK | B2616: 银城国际控股 | C2616: 0.05 | D2616: -- | E2616: -1127970268.5 | F2616: 173329199.5 | G2616: 217673121.30000001 | H2616: 167970307.5 | I2616: 503762184 | J2616: 503800559.10000002 | K2616: 386875020 | L2616: 107843785 | M2616: -- | N2616: =POWER(D2616/M2616,1/9)-1 -> #VALUE! | O2616: =POWER(D2616/I2616,1/5)-1 -> #VALUE!
A2617: 1911.HK | B2617: 华兴资本控股 | C2617: 7.27 | D2617: -- | E2617: -636013755.20000005 | F2617: 1989031269 | G2617: 1236896608.8 | H2617: 275774415 | I2617: -1843838592.5999999 | J2617: 250048 | K2617: 246833082 | L2617: 223555422 | M2617: -- | N2617: =POWER(D2617/M2617,1/9)-1 -> #VALUE! | O2617: =POWER(D2617/I2617,1/5)-1 -> #VALUE!
A2618: 1991.HK | B2618: 大洋集团 | C2618: 0.13 | D2618: -- | E2618: -98063000 | F2618: -84901000 | G2618: -95822000 | H2618: -- | I2618: -3756000 | J2618: -72943000 | K2618: -71304000 | L2618: -156335000 | M2618: -216563000 | N2618: =POWER(D2618/M2618,1/9)-1 -> #VALUE! | O2618: =POWER(D2618/I2618,1/5)-1 -> #VALUE!
A2619: 2007.HK | B2619: 碧桂园 | C2619: 0.49 | D2619: -- | E2619: -6827261200 | F2619: 32812926500 | G2619: 41742721800 | H2619: 44197125000 | I2619: 39416054800 | J2619: 31248129600 | K2619: 12798060668.75 | L2619: 10909610184.25 | M2619: 12764967516.1 | N2619: =POWER(D2619/M2619,1/9)-1 -> #VALUE! | O2619: =POWER(D2619/I2619,1/5)-1 -> #VALUE!
A2620: 2060.HK | B2620: 浦江国际 | C2620: 0.19 | D2620: -- | E2620: 193248042.40000001 | F2620: 251043316.5 | G2620: 180237926.09999999 | H2620: 111458332.5 | I2620: 131907948.59999999 | J2620: 85738134.599999994 | K2620: 64900333.75 | L2620: 55945874.549999997 | M2620: -- | N2620: =POWER(D2620/M2620,1/9)-1 -> #VALUE! | O2620: =POWER(D2620/I2620,1/5)-1 -> #VALUE!
A2621: 2117.HK | B2621: 大唐集团控股 | C2621: 0.5 | D2621: -- | E2621: -- | F2621: 889523331 | G2621: 852651886.79999995 | H2621: 793711080 | I2621: 778383395.20000005 | J2621: 508400738.39999998 | K2621: 147069492.5 | L2621: -- | M2621: -- | N2621: =POWER(D2621/M2621,1/9)-1 -> #VALUE! | O2621: =POWER(D2621/I2621,1/5)-1 -> #VALUE!
A2622: 2369.HK | B2622: 酷派集团 | C2622: 0.06 | D2622: -- | E2622: -625450000 | F2622: -572376000 | G2622: -393986000 | H2622: 112321000 | I2622: -409321000 | J2622: -2674457000 | K2622: -4379631000 | L2622: 2324518000 | M2622: 512855000 | N2622: =POWER(D2622/M2622,1/9)-1 -> #VALUE! | O2622: =POWER(D2622/I2622,1/5)-1 -> #VALUE!
A2623: 2371.HK | B2623: 创联控股 | C2623: 0.02 | D2623: -- | E2623: 15255296.300000001 | F2623: 40421969.5 | G2623: -2454122.1000000001 | H2623: -22572382.5 | I2623: 8639696.8000000007 | J2623: -18261644.800000001 | K2623: -210285171.25 | L2623: -351236740.89999998 | M2623: 30240360.699999999 | N2623: =POWER(D2623/M2623,1/9)-1 -> #VALUE! | O2623: =POWER(D2623/I2623,1/5)-1 -> #VALUE!
A2624: 2599.HK | B2624: 祥生控股集团 | C2624: 0.18 | D2624: -- | E2624: -- | F2624: -263711993.5 | G2624: 3153774551.4000001 | H2624: 2583976252.5 | I2624: 370098514.19999999 | J2624: -359817464.69999999 | K2624: -- | L2624: -- | M2624: -- | N2624: =POWER(D2624/M2624,1/9)-1 -> #VALUE! | O2624: =POWER(D2624/I2624,1/5)-1 -> #VALUE!
A2625: 2699.HK | B2625: 新明中国 | C2625: 0.01 | D2625: -- | E2625: -- | F2625: -1057888407.5 | G2625: -1192801076.4000001 | H2625: -130720680 | I2625: 48858464.600000001 | J2625: 290467094.19999999 | K2625: 11346973.75 | L2625: 432341853.10000002 | M2625: 412030374.10000002 | N2625: =POWER(D2625/M2625,1/9)-1 -> #VALUE! | O2625: =POWER(D2625/I2625,1/5)-1 -> #VALUE!
A2626: 2768.HK | B2626: 佳源国际控股 | C2626: 0.17 | D2626: -- | E2626: -- | F2626: 2963139386.5 | G2626: 4026032001.3000002 | H2626: 2291617020 | I2626: 2544567190.5999999 | J2626: 1597535448.9000001 | K2626: 901393771.25 | L2626: 330168981.19999999 | M2626: 213334744.5 | N2626: =POWER(D2626/M2626,1/9)-1 -> #VALUE! | O2626: =POWER(D2626/I2626,1/5)-1 -> #VALUE!
A2627: 3333.HK | B2627: 中国恒大 | C2627: 0.16 | D2627: -- | E2627: -119481583400 | F2627: -582904857500 | G2627: 9625784400 | H2627: 19310400000 | I2627: 42572254000 | J2627: 29219590800 | K2627: 5657373750 | L2627: 12301483000 | M2627: 15728531600 | N2627: =POWER(D2627/M2627,1/9)-1 -> #VALUE! | O2627: =POWER(D2627/I2627,1/5)-1 -> #VALUE!
A2628: 3588.HK | B2628: 富途控股-W | C2628: -- | D2628: -- | E2628: -- | F2628: 2810210000 | G2628: 1325523000 | H2628: -- | I2628: -- | J2628: -- | K2628: -- | L2628: -- | M2628: -- | N2628: =POWER(D2628/M2628,1/9)-1 -> #VALUE! | O2628: =POWER(D2628/I2628,1/5)-1 -> #VALUE!
A2629: 3616.HK | B2629: 恒达集团控股 | C2629: 0.26 | D2629: -- | E2629: 95676417.200000003 | F2629: 375814968.5 | G2629: 338512710.89999998 | H2629: 327472200 | I2629: 255621393 | J2629: 177190226.59999999 | K2629: 82352515 | L2629: 78807110.5 | M2629: 179702591.59999999 | N2629: =POWER(D2629/M2629,1/9)-1 -> #VALUE! | O2629: =POWER(D2629/I2629,1/5)-1 -> #VALUE!
A2630: 3639.HK | B2630: 亿达中国 | C2630: 0.10000000000000001 | D2630: -- | E2630: -831153621.29999995 | F2630: 3592683 | G2630: 205693334.40000001 | H2630: 503058270 | I2630: 949500173.39999998 | J2630: 1180079667.8 | K2630: 626745000 | L2630: 965846351.14999998 | M2630: 1119225287.3 | N2630: =POWER(D2630/M2630,1/9)-1 -> #VALUE! | O2630: =POWER(D2630/I2630,1/5)-1 -> #VALUE!
A2631: 6111.HK | B2631: 大发地产 | C2631: 0.09 | D2631: -- | E2631: -- | F2631: -588251024.5 | G2631: 403886042.10000002 | H2631: 576429967.5 | I2631: 542903836.20000005 | J2631: 164842755.5 | K2631: 27473433.75 | L2631: 68657799 | M2631: -- | N2631: =POWER(D2631/M2631,1/9)-1 -> #VALUE! | O2631: =POWER(D2631/I2631,1/5)-1 -> #VALUE!
A2632: 6606.HK | B2632: 诺辉健康 | C2632: 14.14 | D2632: -- | E2632: -89388387.799999997 | F2632: -3777993932 | G2632: -940080135.60000002 | H2632: -118974637.5 | I2632: -256035843.40000001 | J2632: -- | K2632: -- | L2632: -- | M2632: -- | N2632: =POWER(D2632/M2632,1/9)-1 -> #VALUE! | O2632: =POWER(D2632/I2632,1/5)-1 -> #VALUE!
A2633: 6678.HK | B2633: 百德医疗 | C2633: -- | D2633: -- | E2633: -- | F2633: 90864022.5 | G2633: 55242181.200000003 | H2633: -- | I2633: -- | J2633: -- | K2633: -- | L2633: -- | M2633: -- | N2633: =POWER(D2633/M2633,1/9)-1 -> #VALUE! | O2633: =POWER(D2633/I2633,1/5)-1 -> #VALUE!
A2634: 6689.HK | B2634: 洪九果品 | C2634: 1.74 | D2634: -- | E2634: 1638242613.4000001 | F2634: 351742523 | G2634: 530395.5 | H2634: -- | I2634: -- | J2634: -- | K2634: -- | L2634: -- | M2634: -- | N2634: =POWER(D2634/M2634,1/9)-1 -> #VALUE! | O2634: =POWER(D2634/I2634,1/5)-1 -> #VALUE!
A2635: 6836.HK | B2635: 天韵国际控股 | C2635: 3.2000000000000002 | D2635: -- | E2635: 108978972.40000001 | F2635: -1149805.5 | G2635: 177894650.69999999 | H2635: 188958075 | I2635: 167974242.19999999 | J2635: 147801590.90000001 | K2635: 143102330 | L2635: 113979237.84999999 | M2635: 111451196.90000001 | N2635: =POWER(D2635/M2635,1/9)-1 -> #VALUE! | O2635: =POWER(D2635/I2635,1/5)-1 -> #VALUE!
A2636: 6878.HK | B2636: 鼎丰集团汽车 | C2636: 0.11 | D2636: -- | E2636: -203289260.5 | F2636: 539709395.5 | G2636: 424453468.5 | H2636: 374924602.5 | I2636: 291171900.80000001 | J2636: 209011430.40000001 | K2636: 150584376.25 | L2636: 122059877.40000001 | M2636: 91112922.700000003 | N2636: =POWER(D2636/M2636,1/9)-1 -> #VALUE! | O2636: =POWER(D2636/I2636,1/5)-1 -> #VALUE!
A2637: 6880.HK | B2637: 腾邦控股 | C2637: 0.13 | D2637: -- | E2637: -- | F2637: -74545000 | G2637: -82192000 | H2637: -262469000 | I2637: -33922000 | J2637: 24142000 | K2637: -7982000 | L2637: 12137000 | M2637: 8722000 | N2637: =POWER(D2637/M2637,1/9)-1 -> #VALUE! | O2637: =POWER(D2637/I2637,1/5)-1 -> #VALUE!
A2638: 6899.HK | B2638: 联众 | C2638: 0.19 | D2638: -- | E2638: -33401912.899999999 | F2638: 32454148 | G2638: -222160624.80000001 | H2638: -468470527.5 | I2638: -709313642 | J2638: -28768804.399999999 | K2638: 165208426.25 | L2638: 134482493.55000001 | M2638: 121846203.90000001 | N2638: =POWER(D2638/M2638,1/9)-1 -> #VALUE! | O2638: =POWER(D2638/I2638,1/5)-1 -> #VALUE!
A2639: 6900.HK | B2639: 上坤地产 | C2639: 0.01 | D2639: -- | E2639: -2185133084.3000002 | F2639: 306194796.5 | G2639: 424392681.60000002 | H2639: 245327010 | I2639: 175974045.80000001 | J2639: 59910231.899999999 | K2639: -- | L2639: -- | M2639: -- | N2639: =POWER(D2639/M2639,1/9)-1 -> #VALUE! | O2639: =POWER(D2639/I2639,1/5)-1 -> #VALUE!
A2640: 8001.HK | B2640: 东方汇财证券 | C2640: 0.19 | D2640: -- | E2640: -- | F2640: 17975000 | G2640: 16860000 | H2640: 4173000 | I2640: -2097000 | J2640: -399000 | K2640: -3469000 | L2640: 26105000 | M2640: 17930000 | N2640: =POWER(D2640/M2640,1/9)-1 -> #VALUE! | O2640: =POWER(D2640/I2640,1/5)-1 -> #VALUE!
A2641: 8045.HK | B2641: 南大苏富特 | C2641: 0.20000000000000001 | D2641: -- | E2641: -25533415.399999999 | F2641: -48970204 | G2641: -36568683.899999999 | H2641: -115191900 | I2641: -61140542.799999997 | J2641: -64541582.600000001 | K2641: -121803001.25 | L2641: -188629984.19 | M2641: -98406827.870000005 | N2641: =POWER(D2641/M2641,1/9)-1 -> #VALUE! | O2641: =POWER(D2641/I2641,1/5)-1 -> #VALUE!
A2642: 8159.HK | B2642: 新华联合投资 | C2642: 0.09 | D2642: -- | E2642: -- | F2642: 49989000 | G2642: -4576000 | H2642: 12255000 | I2642: 24456000 | J2642: 17004000 | K2642: 2953000 | L2642: -17688000 | M2642: 1395000 | N2642: =POWER(D2642/M2642,1/9)-1 -> #VALUE! | O2642: =POWER(D2642/I2642,1/5)-1 -> #VALUE!
A2643: 8166.HK | B2643: 中国农业生态 | C2643: 0.05 | D2643: -- | E2643: -- | F2643: -51270000 | G2643: -58845000 | H2643: -99411000 | I2643: -68428000 | J2643: -71648000 | K2643: -29955000 | L2643: -59214000 | M2643: -27393000 | N2643: =POWER(D2643/M2643,1/9)-1 -> #VALUE! | O2643: =POWER(D2643/I2643,1/5)-1 -> #VALUE!
A2644: 8167.HK | B2644: 中国新电信 | C2644: 0.02 | D2644: -- | E2644: -55657000 | F2644: -62667000 | G2644: -110344000 | H2644: -94550000 | I2644: -84425000 | J2644: 40905000 | K2644: 192009000 | L2644: -32227000 | M2644: -567394000 | N2644: =POWER(D2644/M2644,1/9)-1 -> #VALUE! | O2644: =POWER(D2644/I2644,1/5)-1 -> #VALUE!
A2645: 8279.HK | B2645: 亚博科技控股 | C2645: 0.17 | D2645: -- | E2645: -126700000 | F2645: -63633000 | G2645: -121372000 | H2645: -123883000 | I2645: 315157000 | J2645: -365664000 | K2645: 332989000 | L2645: -280222000 | M2645: -189184000 | N2645: =POWER(D2645/M2645,1/9)-1 -> #VALUE! | O2645: =POWER(D2645/I2645,1/5)-1 -> #VALUE!
A2646: 8280.HK | B2646: 中国数字视频 | C2646: 0.03 | D2646: -- | E2646: -- | F2646: -128538214 | G2646: -84696414 | H2646: -193707450 | I2646: -192121671 | J2646: -108307427.09999999 | K2646: 376387042.5 | L2646: 129000924.5 | M2646: -94665694 | N2646: =POWER(D2646/M2646,1/9)-1 -> #VALUE! | O2646: =POWER(D2646/I2646,1/5)-1 -> #VALUE!
A2647: 8325.HK | B2647: 中国支付通 | C2647: 0.04 | D2647: -- | E2647: -67676000 | F2647: -98544000 | G2647: -709551000 | H2647: -308140000 | I2647: -361229000 | J2647: -174396000 | K2647: 63820000 | L2647: -78232000 | M2647: -17762000 | N2647: =POWER(D2647/M2647,1/9)-1 -> #VALUE! | O2647: =POWER(D2647/I2647,1/5)-1 -> #VALUE!
A2648: 8331.HK | B2648: 倍搏集团 | C2648: 0.13 | D2648: -- | E2648: -- | F2648: 11163766.5 | G2648: 8585255.6999999993 | H2648: 8278440 | I2648: -65566281 | J2648: -86169738.599999994 | K2648: 3111500 | L2648: -12788367.699999999 | M2648: 8766497.5 | N2648: =POWER(D2648/M2648,1/9)-1 -> #VALUE! | O2648: =POWER(D2648/I2648,1/5)-1 -> #VALUE!
A2649: 8335.HK | B2649: 创徽国际 | C2649: -- | D2649: -- | E2649: -- | F2649: -- | G2649: -- | H2649: -- | I2649: -- | J2649: -- | K2649: -- | L2649: 485000 | M2649: 31883000 | N2649: =POWER(D2649/M2649,1/9)-1 -> #VALUE! | O2649: =POWER(D2649/I2649,1/5)-1 -> #VALUE!
A2650: 8363.HK | B2650: SDM教育 | C2650: 0.20000000000000001 | D2650: -- | E2650: -37190000 | F2650: 38252000 | G2650: -311798000 | H2650: -98807000 | I2650: -53505000 | J2650: -25702000 | K2650: -10429000 | L2650: -4528000 | M2650: -2317000 | N2650: =POWER(D2650/M2650,1/9)-1 -> #VALUE! | O2650: =POWER(D2650/I2650,1/5)-1 -> #VALUE!
A2651: 8383.HK | B2651: 东骏控股 | C2651: 0.06 | D2651: -- | E2651: 10262650.199999999 | F2651: 13693680 | G2651: 5624442.6500000004 | H2651: 12373073.4 | I2651: 13392218.800000001 | J2651: -11354170 | K2651: 16204730 | L2651: 4853513.8499999996 | M2651: -- | N2651: =POWER(D2651/M2651,1/9)-1 -> #VALUE! | O2651: =POWER(D2651/I2651,1/5)-1 -> #VALUE!
A2652: 9608.HK | B2652: 宋都服务 | C2652: 0.16 | D2652: -- | E2652: 37114490 | F2652: 66889537 | G2652: 38925070.200000003 | H2652: 39271185 | I2652: 23784215.399999999 | J2652: 16742638.5 | K2652: -- | L2652: -- | M2652: -- | N2652: =POWER(D2652/M2652,1/9)-1 -> #VALUE! | O2652: =POWER(D2652/I2652,1/5)-1 -> #VALUE!
A2653: 9982.HK | B2653: 中原建业 | C2653: 0.11 | D2653: -- | E2653: 342352403.69999999 | F2653: 943054797.5 | G2653: 812244093 | H2653: -- | I2653: -- | J2653: -- | K2653: -- | L2653: -- | M2653: -- | N2653: =POWER(D2653/M2653,1/9)-1 -> #VALUE! | O2653: =POWER(D2653/I2653,1/5)-1 -> #VALUE!
A2654: 9986.HK | B2654: 大山教育 | C2654: 2.92 | D2654: -- | E2654: -- | F2654: -69089963.5 | G2654: 2446970.7000000002 | H2654: 54719505 | I2654: 51172099.799999997 | J2654: 33643531.799999997 | K2654: -- | L2654: -- | M2654: -- | N2654: =POWER(D2654/M2654,1/9)-1 -> #VALUE! | O2654: =POWER(D2654/I2654,1/5)-1 -> #VALUE!