A1: 股票代码 | B1: 股票简称 | C1: 现价(元) | D1: 所属同花顺行业 | E1: 资产总计(元)2024.06.30 | F1: 净资产(元) [1]2024.06.30 | G1: 总市值(元) [2]2024.09.20 | H1: a股流通市值 (元)2024.09.20 | I1: [1]-[2] | J1: 总市值和流通市值是否相等 | K1: 股份数 | L1: 每股多出来的净资产
A2: 601398.SH | B2: 工商银行 | C2: 5.67 | D2: 银行-银行-国有大型银行 | E2: 47116536000000 | F2: 3864501000000 | G2: 1874120234467.2 | H2: 1528701245096.1001 | I2: 1990380765532.8 | J2: =IF(G2=H2,"是","否") -> 否 | K2: =G2/C2 -> 330532669218.20105 | L2: =I2/K2 -> 6.0217368838020997
A3: 601939.SH | B3: 建设银行 | C3: 7.23 | D3: 银行-银行-国有大型银行 | E3: 40294387000000 | F3: 3255476000000 | G3: 1285524937553 | H3: 69362144491.380005 | I3: 1969951062447 | J3: =IF(G3=H3,"是","否") -> 否 | K3: =G3/C3 -> 177804279052.97372 | L3: =I3/K3 -> 11.079323135187805
A4: 601288.SH | B4: 农业银行 | C4: 4.54 | D4: 银行-银行-国有大型银行 | E4: 41984553000000 | F4: 3056463000000 | G4: 1551637964812.7 | H4: 1449368716927.6001 | I4: 1504825035187.3 | J4: =IF(G4=H4,"是","否") -> 否 | K4: =G4/C4 -> 341770476830.99115 | L4: =I4/K4 -> 4.4030281642245264
A5: 601988.SH | B5: 中国银行 | C5: 4.64 | D5: 银行-银行-国有大型银行 | E5: 33907267000000 | F5: 2778976000000 | G5: 1243279200216 | H5: 977951988885.43994 | I5: 1535696799784 | J5: =IF(G5=H5,"是","否") -> 否 | K5: =G5/C5 -> 267948103494.82761 | L5: =I5/K5 -> 5.7313217737092312
A6: 601857.SH | B6: 中国石油 | C6: 7.91 | D6: 石油石化-石油加工贸易-石油加工 | E6: 2768297000000 | F6: 1678153000000 | G6: 1392889073219.1001 | H6: 1280803635540.3999 | I6: 285263926780.90002 | J6: =IF(G6=H6,"是","否") -> 否 | K6: =G6/C6 -> 176092171077.00381 | L6: =I6/K6 -> 1.6199693889636706
A7: 601318.SH | B7: 中国平安 | C7: 44.15 | D7: 非银金融-保险-保险Ⅲ | E7: 12226666000000 | F7: 1264950000000 | G7: 729369109220.69995 | H7: 475171337234.25 | I7: 535580890779.29999 | J7: =IF(G7=H7,"是","否") -> 否 | K7: =G7/C7 -> 16520251624.477915 | L7: =I7/K7 -> 32.419656973368035
A8: 601328.SH | B8: 交通银行 | C8: 6.59 | D8: 银行-银行-国有大型银行 | E8: 14177914000000 | F8: 1119291000000 | G8: 431328815984.56 | H8: 258663193858.85001 | I8: 687962184015.43994 | J8: =IF(G8=H8,"是","否") -> 否 | K8: =G8/C8 -> 65452020634.986343 | L8: =I8/K8 -> 10.510938811989872
A9: 600036.SH | B9: 招商银行 | C9: 30.94 | D9: 银行-银行-股份制银行 | E9: 11574783000000 | F9: 1117025000000 | G9: 766237395450.67004 | H9: 638259540633.26001 | I9: 350787604549.33002 | J9: =IF(G9=H9,"是","否") -> 否 | K9: =G9/C9 -> 24765268114.113445 | L9: =I9/K9 -> 14.164498560361643
A10: 601658.SH | B10: 邮储银行 | C10: 4.71 | D10: 银行-银行-国有大型银行 | E10: 16413529000000 | F10: 1006799000000 | G10: 450748730720.59998 | H10: 316146481392 | I10: 556050269279.40002 | J10: =IF(G10=H10,"是","否") -> 否 | K10: =G10/C10 -> 95700367456.602966 | L10: =I10/K10 -> 5.8103253316300059
A11: 600028.SH | B11: 中国石化 | C11: 6.38 | D11: 石油石化-石油加工贸易-石油加工 | E11: 2141936000000 | F11: 986345000000 | G11: 721117938210.83997 | H11: 605921175273.47998 | I11: 265227061789.16 | J11: =IF(G11=H11,"是","否") -> 否 | K11: =G11/C11 -> 113027890001.69905 | L11: =I11/K11 -> 2.3465629747239647
A12: 601166.SH | B12: 兴业银行 | C12: 16.25 | D12: 银行-银行-股份制银行 | E12: 10350090000000 | F12: 858862000000 | G12: 337582379810 | H12: 337582379810 | I12: 521279620190 | J12: =IF(G12=H12,"是","否") -> 是 | K12: =G12/C12 -> 20774300296 | L12: =I12/K12 -> 25.092523587442802
A13: 601998.SH | B13: 中信银行 | C13: 5.88 | D13: 银行-银行-股份制银行 | E13: 9104623000000 | F13: 815751000000 | G13: 288610361256.14001 | H13: 226819635457.79999 | I13: 527140638743.85999 | J13: =IF(G13=H13,"是","否") -> 否 | K13: =G13/C13 -> 49083394771.452385 | L13: =I13/K13 -> 10.739693967754093
A14: 601668.SH | B14: 中国建筑 | C14: 4.91 | D14: 建筑装饰-建筑装饰-房屋建设 | E14: 3198004370000 | F14: 758454010000 | G14: 204306683200.04001 | H14: 202883117080.04001 | I14: 554147326799.95996 | J14: =IF(G14=H14,"是","否") -> 否 | K14: =G14/C14 -> 41610322444 | L14: =I14/K14 -> 13.317544644018138
A15: 600000.SH | B15: 浦发银行 | C15: 8.51 | D15: 银行-银行-股份制银行 | E15: 9253778000000 | F15: 753756000000 | G15: 249787029461.25 | H15: 249787029461.25 | I15: 503968970538.75 | J15: =IF(G15=H15,"是","否") -> 是 | K15: =G15/C15 -> 29352177375 | L15: =I15/K15 -> 17.169730344025286
A16: 600016.SH | B16: 民生银行 | C16: 3.43 | D16: 银行-银行-股份制银行 | E16: 7551013000000 | F16: 609642000000 | G16: 142830248601.41 | H16: 121635082620.59 | I16: 466811751398.59003 | J16: =IF(G16=H16,"是","否") -> 否 | K16: =G16/C16 -> 41641471895.454811 | L16: =I16/K16 -> 11.210260592386572
A17: 601818.SH | B17: 光大银行 | C17: 3.09 | D17: 银行-银行-股份制银行 | E17: 6796694000000 | F17: 570865000000 | G17: 169947986795.47 | H17: 143397060083.48999 | I17: 400917013204.53003 | J17: =IF(G17=H17,"是","否") -> 否 | K17: =G17/C17 -> 54999348477.498383 | L17: =I17/K17 -> 7.2894865903467068
A18: 000001.SZ | B18: 平安银行 | C18: 9.9000000000000004 | D18: 银行-银行-股份制银行 | E18: 5754033000000 | F18: 481869000000 | G18: 192118590160.20001 | H18: 192115613527.20001 | I18: 289750409839.79999 | J18: =IF(G18=H18,"是","否") -> 否 | K18: =G18/C18 -> 19405918198 | L18: =I18/K18 -> 14.931033248901464
A19: 601390.SH | B19: 中国中铁 | C19: 5.18 | D19: 建筑装饰-建筑装饰-基础建设 | E19: 2004571635000 | F19: 471425097000 | G19: 118619452346.46001 | H19: 105772751626.78 | I19: 352805644653.53998 | J19: =IF(G19=H19,"是","否") -> 否 | K19: =G19/C19 -> 22899508174.992279 | L19: =I19/K19 -> 15.406690919188657
A20: 601800.SH | B20: 中国交建 | C20: 7.26 | D20: 建筑装饰-建筑装饰-基础建设 | E20: 1864850181313 | F20: 469698781363 | G20: 102247027939.23 | H20: 85284929185.5 | I20: 367451753423.77002 | J20: =IF(G20=H20,"是","否") -> 否 | K20: =G20/C20 -> 14083612663.805784 | L20: =I20/K20 -> 26.090731277217213
A21: 601186.SH | B21: 中国铁建 | C21: 6.96 | D21: 建筑装饰-建筑装饰-基础建设 | E21: 1745841521000 | F21: 414056676000 | G21: 88382205013.5 | H21: 80062588680 | I21: 325674470986.5 | J21: =IF(G21=H21,"是","否") -> 否 | K21: =G21/C21 -> 12698592674.353449 | L21: =I21/K21 -> 25.64650109962534
A22: 000002.SZ | B22: 万科A | C22: 6.89 | D22: 房地产-房地产-住宅开发 | E22: 1422819020978.8501 | F22: 385057205367.08002 | G22: 75921115907.960007 | H22: 66949688109.849998 | I22: 309136089459.12 | J22: =IF(G22=H22,"是","否") -> 否 | K22: =G22/C22 -> 11019029885.044994 | L22: =I22/K22 -> 28.054746441760621
A23: 600050.SH | B23: 中国联通 | C23: 4.49 | D23: 通信-通信服务-电信运营商 | E23: 668339156427 | F23: 368220429089 | G23: 142784610090.88 | H23: 139035778880.88 | I23: 225435818998.12 | J23: =IF(G23=H23,"是","否") -> 否 | K23: =G23/C23 -> 31800581312 | L23: =I23/K23 -> 7.0890471084895363
A24: 600104.SH | B24: 上汽集团 | C24: 11.86 | D24: 汽车-汽车整车-乘用车 | E24: 973114791728.41003 | F24: 346404108450.90997 | G24: 137283051417.7 | H24: 137283051417.7 | I24: 209121057033.20999 | J24: =IF(G24=H24,"是","否") -> 是 | K24: =G24/C24 -> 11575299445 | L24: =I24/K24 -> 18.066146627726397
A25: 601319.SH | B25: 中国人保 | C25: 6.05 | D25: 非银金融-保险-保险Ⅲ | E25: 1650688000000 | F25: 345754000000 | G25: 239996775437.45999 | H25: 214761427327.14999 | I25: 105757224562.53999 | J25: =IF(G25=H25,"是","否") -> 否 | K25: =G25/C25 -> 39668888502.059502 | L25: =I25/K25 -> 2.6659991886853436
A26: 600048.SH | B26: 保利发展 | C26: 8.05 | D26: 房地产-房地产-住宅开发 | E26: 1389984322559.8601 | F26: 343208505619.20001 | G26: 96362069514.899994 | H26: 96362069514.899994 | I26: 246846436104.29999 | J26: =IF(G26=H26,"是","否") -> 是 | K26: =G26/C26 -> 11970443417.999998 | L26: =I26/K26 -> 20.621327672216061
A27: 601169.SH | B27: 北京银行 | C27: 4.98 | D27: 银行-银行-城商行 | E27: 3945656000000 | F27: 339060000000 | G27: 105292061674.56 | H27: 105292061674.56 | I27: 233767938325.44 | J27: =IF(G27=H27,"是","否") -> 是 | K27: =G27/C27 -> 21142984271.999996 | L27: =I27/K27 -> 11.056525196162717
A28: 600015.SH | B28: 华夏银行 | C28: 6.19 | D28: 银行-银行-股份制银行 | E28: 4328297000000 | F28: 329187000000 | G28: 98513407216.919998 | H28: 95246916454.770004 | I28: 230673592783.07999 | J28: =IF(G28=H28,"是","否") -> 否 | K28: =G28/C28 -> 15914928467.999998 | L28: =I28/K28 -> 14.494164598156585
A29: 601601.SH | B29: 中国太保 | C29: 30.28 | D29: 非银金融-保险-保险Ⅲ | E29: 2553488000000 | F29: 293656000000 | G29: 259347983307.89999 | H29: 207267855257.39999 | I29: 34308016692.099998 | J29: =IF(G29=H29,"是","否") -> 否 | K29: =G29/C29 -> 8564992843.7219286 | L29: =I29/K29 -> 4.005609498815577
A30: 600919.SH | B30: 江苏银行 | C30: 7.51 | D30: 银行-银行-城商行 | E30: 3770833849000 | F30: 292233575000 | G30: 137818446717.13 | H30: 137818446717.13 | I30: 154415128282.87 | J30: =IF(G30=H30,"是","否") -> 是 | K30: =G30/C30 -> 18351324463 | L30: =I30/K30 -> 8.4143860348718853
A31: 001979.SZ | B31: 招商蛇口 | C31: 9.58 | D31: 房地产-房地产-商业地产 | E31: 912693150372.01001 | F31: 290626517133.46002 | G31: 86802810575.660004 | H31: 79729908780.580002 | I31: 203823706557.79999 | J31: =IF(G31=H31,"是","否") -> 否 | K31: =G31/C31 -> 9060836177 | L31: =I31/K31 -> 22.495021715014062
A32: 600030.SH | B32: 中信证券 | C32: 19.29 | D32: 非银金融-证券-证券Ⅲ | E32: 1495011600037.1699 | F32: 284482896922 | G32: 263849833873.26001 | H32: 234885668288.45999 | I32: 20633063048.740002 | J32: =IF(G32=H32,"是","否") -> 否 | K32: =G32/C32 -> 13678062927.592537 | L32: =I32/K32 -> 1.5084784415721071
A33: 601669.SH | B33: 中国电建 | C33: 4.48 | D33: 建筑装饰-建筑装饰-基础建设 | E33: 1247988033084.3 | F33: 265907722921.29999 | G33: 77173193816.320007 | H33: 58560435808 | I33: 188734529104.98001 | J33: =IF(G33=H33,"是","否") -> 否 | K33: =G33/C33 -> 17226159334 | L33: =I33/K33 -> 10.95627443387608
A34: 601919.SH | B34: 中远海控 | C34: 12.98 | D34: 交通运输-港口航运-航运 | E34: 467117979399.65002 | F34: 257430296950.06 | G34: 198241032240.76001 | H34: 165636483557.60001 | I34: 59189264709.300003 | J34: =IF(G34=H34,"是","否") -> 否 | K34: =G34/C34 -> 15272806798.209553 | L34: =I34/K34 -> 3.8754673905937724
A35: 601229.SH | B35: 上海银行 | C35: 6.9000000000000004 | D35: 银行-银行-城商行 | E35: 3223330590000 | F35: 246206360000 | G35: 98026039953.300003 | H35: 95548589999.100006 | I35: 148180320046.70001 | J35: =IF(G35=H35,"是","否") -> 否 | K35: =G35/C35 -> 14206672457 | L35: =I35/K35 -> 10.430332683125082
A36: 600153.SH | B36: 建发股份 | C36: 7.53 | D36: 交通运输-物流-物流Ⅲ | E36: 902308785563.10999 | F36: 229176980166.25 | G36: 22191626863.529999 | H36: 21833525289.029999 | I36: 206985353302.72 | J36: =IF(G36=H36,"是","否") -> 否 | K36: =G36/C36 -> 2947095200.9999995 | L36: =I36/K36 -> 70.233684080679296
A37: 688981.SH | B37: 中芯国际 | C37: 43.86 | D37: 电子-半导体-集成电路制造 | E37: 337466574000 | F37: 220714663000 | G37: 175076733865.51001 | H37: 87209431397.940002 | I37: 45637929134.489998 | J37: =IF(G37=H37,"是","否") -> 否 | K37: =G37/C37 -> 3991717598.3928413 | L37: =I37/K37 -> 11.433155780575483
A38: 002142.SZ | B38: 宁波银行 | C38: 19.21 | D38: 银行-银行-城商行 | E38: 3033744000000 | F38: 219828000000 | G38: 126854979114.32001 | H38: 125318321018.59 | I38: 92973020885.679993 | J38: =IF(G38=H38,"是","否") -> 否 | K38: =G38/C38 -> 6603590792 | L38: =I38/K38 -> 14.079161446271517
A39: 600019.SH | B39: 宝钢股份 | C39: 5.61 | D39: 钢铁-钢铁-普钢 | E39: 367973623390.88 | F39: 219357297576.42999 | G39: 123337200517.74001 | H39: 122622925500.24001 | I39: 96020097058.690002 | J39: =IF(G39=H39,"是","否") -> 否 | K39: =G39/C39 -> 21985240734 | L39: =I39/K39 -> 4.3674799025600697
A40: 000725.SZ | B40: 京东方A | C40: 3.78 | D40: 电子-光学光电子-面板 | E40: 422367862387 | F40: 200523032842 | G40: 141217912287.32001 | H40: 139303227795.48001 | I40: 59305120554.68 | J40: =IF(G40=H40,"是","否") -> 否 | K40: =G40/C40 -> 37359236054.846565 | L40: =I40/K40 -> 1.5874286205321488
A41: 601766.SH | B41: 中国中车 | C41: 6.85 | D41: 机械设备-轨交设备-轨交设备Ⅲ | E41: 479499893000 | F41: 199906611000 | G41: 184516697161.51001 | H41: 166645416628.79999 | I41: 15389913838.49 | J41: =IF(G41=H41,"是","否") -> 否 | K41: =G41/C41 -> 26936744111.169346 | L41: =I41/K41 -> 0.57133533937787817
A42: 600585.SH | B42: 海螺水泥 | C42: 19.87 | D42: 建筑材料-建筑材料-水泥 | E42: 243734511380 | F42: 196203888590 | G42: 100303824323.13 | H42: 79474090244.729996 | I42: 95900064266.869995 | J42: =IF(G42=H42,"是","否") -> 否 | K42: =G42/C42 -> 5048003237.1982889 | L42: =I42/K42 -> 18.997623369214764
A43: 601916.SH | B43: 浙商银行 | C43: 2.53 | D43: 银行-银行-股份制银行 | E43: 3246610000000 | F43: 194374000000 | G43: 64704641875.389999 | H43: 54507422986.389999 | I43: 129669358124.61 | J43: =IF(G43=H43,"是","否") -> 否 | K43: =G43/C43 -> 25574957263 | L43: =I43/K43 -> 5.0701691029687961
A44: 601868.SH | B44: 中国能建 | C44: 2.05 | D44: 建筑装饰-建筑装饰-基础建设 | E44: 849231871000 | F44: 191997562000 | G44: 73028443511.320007 | H44: 29156126974.150002 | I44: 118969118488.67999 | J44: =IF(G44=H44,"是","否") -> 否 | K44: =G44/C44 -> 35623630981.131714 | L44: =I44/K44 -> 3.339612364379497
A45: 000617.SZ | B45: 中油资本 | C45: 5.12 | D45: 非银金融-多元金融-多元金融Ⅲ | E45: 1084717000225.49 | F45: 189512969824.20999 | G45: 64727444884.480003 | H45: 64727444884.480003 | I45: 124785524939.73 | J45: =IF(G45=H45,"是","否") -> 是 | K45: =G45/C45 -> 12642079079 | L45: =I45/K45 -> 9.8706489779053523
A46: 601898.SH | B46: 中煤能源 | C46: 12.93 | D46: 煤炭-煤炭开采加工-煤炭开采 | E46: 361378832000 | F46: 188014346000 | G46: 150128891398.23001 | H46: 118335365172 | I46: 37885454601.769997 | J46: =IF(G46=H46,"是","否") -> 否 | K46: =G46/C46 -> 11610896473.180975 | L46: =I46/K46 -> 3.2629224357721553
A47: 601688.SH | B47: 华泰证券 | C47: 13 | D47: 非银金融-证券-证券Ⅲ | E47: 834581631208.68994 | F47: 183428286932.60001 | G47: 108097903047.11 | H47: 94826299386 | I47: 75330383885.490005 | J47: =IF(G47=H47,"是","否") -> 否 | K47: =G47/C47 -> 8315223311.3161535 | L47: =I47/K47 -> 9.0593338344832173
A48: 601009.SH | B48: 南京银行 | C48: 10.28 | D48: 银行-银行-城商行 | E48: 2482820922000 | F48: 180116615000 | G48: 106334197395.88 | H48: 94706404462.520004 | I48: 73782417604.119995 | J48: =IF(G48=H48,"是","否") -> 否 | K48: =G48/C48 -> 10343793521.000002 | L48: =I48/K48 -> 7.1330133818242505
A49: 600011.SH | B49: 华能国际 | C49: 6.46 | D49: 公用事业-电力-火电 | E49: 552246280557 | F49: 176442961455 | G49: 89197630984.830002 | H49: 71045206076.740005 | I49: 87245330470.169998 | J49: =IF(G49=H49,"是","否") -> 否 | K49: =G49/C49 -> 13807682814.989164 | L49: =I49/K49 -> 6.318607664963114
A50: 601211.SH | B50: 国泰君安 | C50: 14.699999999999999 | D50: 非银金融-证券-证券Ⅲ | E50: 898059606314 | F50: 174812059994 | G50: 120400462480.81 | H50: 109960745983.2 | I50: 54411597513.190002 | J50: =IF(G50=H50,"是","否") -> 否 | K50: =G50/C50 -> 8190507651.7557821 | L50: =I50/K50 -> 6.6432509224902443
A51: 600837.SH | B51: 海通证券 | C51: 8.77 | D51: 非银金融-证券-证券Ⅲ | E51: 721414534571.72998 | F51: 171191555197.64001 | G51: 95881971562.75 | H51: 84671115448.600006 | I51: 75309583634.889999 | J51: =IF(G51=H51,"是","否") -> 否 | K51: =G51/C51 -> 10932950007.155075 | L51: =I51/K51 -> 6.8883131803953734
A52: 601618.SH | B52: 中国中冶 | C52: 2.67 | D52: 建筑装饰-建筑装饰-专业工程 | E52: 755551432000 | F52: 170054916000 | G52: 50997955647.900002 | H52: 47666493183.900002 | I52: 119056960352.10001 | J52: =IF(G52=H52,"是","否") -> 否 | K52: =G52/C52 -> 19100357920.561798 | L52: =I52/K52 -> 6.233231903153686
A53: 601006.SH | B53: 大秦铁路 | C53: 6.02 | D53: 交通运输-公路铁路运输-铁路运输 | E53: 212256312850 | F53: 163820818564 | G53: 109908626319.94 | H53: 109908626319.94 | I53: 53912192244.059998 | J53: =IF(G53=H53,"是","否") -> 是 | K53: =G53/C53 -> 18257246897 | L53: =I53/K53 -> 2.9529201499114719
A54: 000776.SZ | B54: 广发证券 | C54: 12.37 | D54: 非银金融-证券-证券Ⅲ | E54: 689327990130.47998 | F54: 145650497188.12 | G54: 83866702490.940002 | H54: 73221635409.679993 | I54: 61783794697.18 | J54: =IF(G54=H54,"是","否") -> 否 | K54: =G54/C54 -> 6779846603.9563465 | L54: =I54/K54 -> 9.1128602616357668
A55: 600606.SH | B55: 绿地控股 | C55: 1.47 | D55: 房地产-房地产-住宅开发 | E55: 1069748581253.0699 | F55: 143006519035.09 | G55: 20659700921.580002 | H55: 20659700921.580002 | I55: 122346818113.50999 | J55: =IF(G55=H55,"是","否") -> 是 | K55: =G55/C55 -> 14054218314.000002 | L55: =I55/K55 -> 8.7053449277669994
A56: 600018.SH | B56: 上港集团 | C56: 5.5999999999999996 | D56: 交通运输-港口航运-港口 | E56: 207396984782.78 | F56: 141800921221.01999 | G56: 130391210600 | H56: 130001635422.39999 | I56: 11409710621.02 | J56: =IF(G56=H56,"是","否") -> 否 | K56: =G56/C56 -> 23284144750 | L56: =I56/K56 -> 0.49002060172384043
A57: 000100.SZ | B57: TCL科技 | C57: 3.74 | D57: 电子-光学光电子-面板 | E57: 382333540000 | F57: 138236190000 | G57: 70233762068.580002 | H57: 67687000481.540001 | I57: 68002427931.419998 | J57: =IF(G57=H57,"是","否") -> 否 | K57: =G57/C57 -> 18779080767 | L57: =I57/K57 -> 3.621179799754572
A58: 600325.SH | B58: 华发股份 | C58: 5.48 | D58: 房地产-房地产-住宅开发 | E58: 444233921283.40002 | F58: 134312348166.82001 | G58: 15081793595.68 | H58: 14090398575.68 | I58: 119230554571.14 | J58: =IF(G58=H58,"是","否") -> 否 | K58: =G58/C58 -> 2752152116 | L58: =I58/K58 -> 43.322661519316981
A59: 601881.SH | B59: 中国银河 | C59: 11.19 | D59: 非银金融-证券-证券Ⅲ | E59: 766309104139.08997 | F59: 133961032821.44 | G59: 95274607207.320007 | H59: 81053843201.369995 | I59: 38686425614.120003 | J59: =IF(G59=H59,"是","否") -> 否 | K59: =G59/C59 -> 8514263378.6702423 | L59: =I59/K59 -> 4.5437196259439707
A60: 000166.SZ | B60: 申万宏源 | C60: 4.24 | D60: 非银金融-证券-证券Ⅲ | E60: 607386031531.42004 | F60: 130182203248.37 | G60: 98912006710.399994 | H60: 95550551019.839996 | I60: 31270196537.970001 | J60: =IF(G60=H60,"是","否") -> 否 | K60: =G60/C60 -> 23328303469.43396 | L60: =I60/K60 -> 1.3404402329960234
A61: 601077.SH | B61: 渝农商行 | C61: 4.84 | D61: 银行-银行-农商行 | E61: 1509870994000 | F61: 129260129000 | G61: 51302007220.68 | H61: 42766597138.760002 | I61: 77958121779.320007 | J61: =IF(G61=H61,"是","否") -> 否 | K61: =G61/C61 -> 10599588268.735538 | L61: =I61/K61 -> 7.3548254708406615
A62: 600926.SH | B62: 杭州银行 | C62: 12.13 | D62: 银行-银行-城商行 | E62: 1984813627000 | F62: 128921111000 | G62: 71934377731.649994 | H62: 65050114462.760002 | I62: 56986733268.349998 | J62: =IF(G62=H62,"是","否") -> 否 | K62: =G62/C62 -> 5930286704.999999 | L62: =I62/K62 -> 9.6094398303378501
A63: 600795.SH | B63: 国电电力 | C63: 4.89 | D63: 公用事业-电力-火电 | E63: 468803835295.37 | F63: 127171292704.57001 | G63: 87216177310.979996 | H63: 87216177310.979996 | I63: 39955115393.589996 | J63: =IF(G63=H63,"是","否") -> 是 | K63: =G63/C63 -> 17835619082 | L63: =I63/K63 -> 2.2401866293451711
A64: 001872.SZ | B64: 招商港口 | C64: 19.03 | D64: 交通运输-港口航运-港口 | E64: 200745131615.31 | F64: 126973758099.21001 | G64: 45907909611.639999 | H64: 33188126160.419998 | I64: 81065848487.570007 | J64: =IF(G64=H64,"是","否") -> 否 | K64: =G64/C64 -> 2412396721.5785599 | L64: =I64/K64 -> 33.60386281511952
A65: 601238.SH | B65: 广汽集团 | C65: 7.34 | D65: 汽车-汽车整车-乘用车 | E65: 216285349992 | F65: 124761051314 | G65: 60700090838.860001 | H65: 54038908856.419998 | I65: 64060960475.150002 | J65: =IF(G65=H65,"是","否") -> 否 | K65: =G65/C65 -> 8269767144.2588558 | L65: =I65/K65 -> 7.7464043857175868
A66: 600999.SH | B66: 招商证券 | C66: 15.05 | D66: 非银金融-证券-证券Ⅲ | E66: 639129526310.92004 | F66: 124529488953.67 | G66: 118575913448.64999 | H66: 111701179343.60001 | I66: 5953575505.0200005 | J66: =IF(G66=H66,"是","否") -> 否 | K66: =G66/C66 -> 7878798235.7906971 | L66: =I66/K66 -> 0.75564512846323884
A67: 600188.SH | B67: 兖矿能源 | C67: 13.43 | D67: 煤炭-煤炭开采加工-煤炭开采 | E67: 359462871000 | F67: 123766445000 | G67: 114535447171.86 | H67: 79064725090.259995 | I67: 9230997828.1399994 | J67: =IF(G67=H67,"是","否") -> 否 | K67: =G67/C67 -> 8528328158.7386446 | L67: =I67/K67 -> 1.0823924286592275
A68: 601825.SH | B68: 沪农商行 | C68: 6.86 | D68: 银行-银行-农商行 | E68: 1454957287000 | F68: 122393896000 | G68: 66160888892.699997 | H68: 63911763557.739998 | I68: 56233007107.300003 | J68: =IF(G68=H68,"是","否") -> 否 | K68: =G68/C68 -> 9644444445 | L68: =I68/K68 -> 5.8306113356745044
A69: 000338.SZ | B69: 潍柴动力 | C69: 12.48 | D69: 汽车-汽车零部件-底盘与发动机系统 | E69: 343596495189.47998 | F69: 118384896014 | G69: 105302635254.72 | H69: 62015151232.32 | I69: 13082260759.280001 | J69: =IF(G69=H69,"是","否") -> 否 | K69: =G69/C69 -> 8437711158.2307692 | L69: =I69/K69 -> 1.5504513622178917
A70: 002736.SZ | B70: 国信证券 | C70: 8.94 | D70: 非银金融-证券-证券Ⅲ | E70: 465681139775.63 | F70: 112619593639.75999 | G70: 85935118630.380005 | H70: 81701245754.580002 | I70: 26684475009.380001 | J70: =IF(G70=H70,"是","否") -> 否 | K70: =G70/C70 -> 9612429377.0000019 | L70: =I70/K70 -> 2.7760386019822296
A71: 600383.SH | B71: 金地集团 | C71: 4.08 | D71: 房地产-房地产-住宅开发 | E71: 349156723643.38 | F71: 110543561730.75999 | G71: 18419500973.759998 | H71: 18419500973.759998 | I71: 92124060757 | J71: =IF(G71=H71,"是","否") -> 是 | K71: =G71/C71 -> 4514583571.999999 | L71: =I71/K71 -> 20.405882245344781
A72: 601995.SH | B72: 中金公司 | C72: 28.73 | D72: 非银金融-证券-证券Ⅲ | E72: 599104371599 | F72: 105926592021 | G72: 98386649005.830002 | H72: 83993374301.199997 | I72: 7539943015.1700001 | J72: =IF(G72=H72,"是","否") -> 否 | K72: =G72/C72 -> 3424526592.6150365 | L72: =I72/K72 -> 2.201747544151015
A73: 000877.SZ | B73: 天山股份 | C73: 4.34 | D73: 建筑材料-建筑材料-水泥 | E73: 294934855348.62 | F73: 96849281472.410004 | G73: 30859533951.959999 | H73: 7908090407.9799995 | I73: 65989747520.449997 | J73: =IF(G73=H73,"是","否") -> 否 | K73: =G73/C73 -> 7110491694 | L73: =I73/K73 -> 9.2806166381058706
A74: 002493.SZ | B74: 荣盛石化 | C74: 8.49 | D74: 石油石化-石油加工贸易-石油加工 | E74: 386095763409.31 | F74: 95295604115.779999 | G74: 85965707250 | H74: 80640407812.5 | I74: 9329896865.7800007 | J74: =IF(G74=H74,"是","否") -> 否 | K74: =G74/C74 -> 10125525000 | L74: =I74/K74 -> 0.9214235178699377
A75: 601991.SH | B75: 大唐发电 | C75: 2.46 | D75: 公用事业-电力-火电 | E75: 310343345000 | F75: 94991894000 | G75: 38139004883.889999 | H75: 30494379200.759998 | I75: 56852889116.110001 | J75: =IF(G75=H75,"是","否") -> 否 | K75: =G75/C75 -> 15503660521.906504 | L75: =I75/K75 -> 3.667062306722821
A76: 601992.SH | B76: 金隅集团 | C76: 1.36 | D76: 建筑材料-建筑材料-水泥 | E76: 270457917850.60001 | F76: 93724622829.979996 | G76: 12528364603.059999 | H76: 11334455239.040001 | I76: 81196258226.919998 | J76: =IF(G76=H76,"是","否") -> 否 | K76: =G76/C76 -> 9212032796.3676453 | L76: =I76/K76 -> 8.8141521010363881
A77: 600089.SH | B77: 特变电工 | C77: 12.04 | D77: 综合-综合-综合Ⅲ | E77: 203467643334.73001 | F77: 90762904553.860001 | G77: 60835622193.639999 | H77: 60835622193.639999 | I77: 29927282360.220001 | J77: =IF(G77=H77,"是","否") -> 是 | K77: =G77/C77 -> 5052792541 | L77: =I77/K77 -> 5.9229192802554849
A78: 601336.SH | B78: 新华保险 | C78: 32.79 | D78: 非银金融-保险-保险Ⅲ | E78: 1494684000000 | F78: 90052000000 | G78: 84243547285.080002 | H78: 68381555958.599998 | I78: 5808452714.9200001 | J78: =IF(G78=H78,"是","否") -> 否 | K78: =G78/C78 -> 2569184119.7035685 | L78: =I78/K78 -> 2.2608160584419994
A79: 600027.SH | B79: 华电国际 | C79: 5.0999999999999996 | D79: 公用事业-电力-火电 | E79: 222219637000 | F79: 85992351000 | G79: 49474027086.610001 | H79: 43402670418.300003 | I79: 36518323913.389999 | J79: =IF(G79=H79,"是","否") -> 否 | K79: =G79/C79 -> 9700789624.825491 | L79: =I79/K79 -> 3.7644692159837385
A80: 001965.SZ | B80: 招商公路 | C80: 11.83 | D80: 交通运输-公路铁路运输-高速公路 | E80: 161776819332.57001 | F80: 85708029027.100006 | G80: 80684591371.020004 | H80: 80684591371.020004 | I80: 5023437656.0799999 | J80: =IF(G80=H80,"是","否") -> 是 | K80: =G80/C80 -> 6820337394 | L80: =I80/K80 -> 0.73653799891178817
A81: 601155.SH | B81: 新城控股 | C81: 10.36 | D81: 房地产-房地产-商业地产 | E81: 355649344589 | F81: 85154601690 | G81: 23368252788.16 | H81: 23368252788.16 | I81: 61786348901.839996 | J81: =IF(G81=H81,"是","否") -> 是 | K81: =G81/C81 -> 2255622856 | L81: =I81/K81 -> 27.392145250473554
A82: 000069.SZ | B82: 华侨城A | C82: 2.02 | D82: 房地产-房地产-商业地产 | E82: 353121493902.22998 | F82: 84425005359.600006 | G82: 16236271267.059999 | H82: 13927119082.139999 | I82: 68188734092.540001 | J82: =IF(G82=H82,"是","否") -> 否 | K82: =G82/C82 -> 8037758053 | L82: =I82/K82 -> 8.483551463344849
A83: 600362.SH | B83: 江西铜业 | C83: 19.86 | D83: 有色金属-工业金属-铜 | E83: 226358513809 | F83: 84187877030 | G83: 57691879136.309998 | H83: 41214413463.300003 | I83: 26495997893.689999 | J83: =IF(G83=H83,"是","否") -> 否 | K83: =G83/C83 -> 2904928456.0075526 | L83: =I83/K83 -> 9.1210500688561922
A84: 601607.SH | B84: 上海医药 | C84: 18.91 | D84: 医药生物-医药商业-医药流通 | E84: 221335871829.06 | F84: 82228621195.059998 | G84: 61398327851.629997 | H84: 36541829512.449997 | I84: 20830293343.43 | J84: =IF(G84=H84,"是","否") -> 否 | K84: =G84/C84 -> 3246870854.1316762 | L84: =I84/K84 -> 6.4154979607283238
A85: 600023.SH | B85: 浙能电力 | C85: 5.68 | D85: 公用事业-电力-火电 | E85: 151134614373.82001 | F85: 81706764654.559998 | G85: 76161602014.320007 | H85: 76161602014.320007 | I85: 5545162640.2399998 | J85: =IF(G85=H85,"是","否") -> 是 | K85: =G85/C85 -> 13408732749.000002 | L85: =I85/K85 -> 0.4135485988154658
A86: 601018.SH | B86: 宁波港 | C86: 3.27 | D86: 交通运输-港口航运-港口 | E86: 111597452000 | F86: 81429704000 | G86: 63615850064.730003 | H86: 51690254799.900002 | I86: 17813853935.27 | J86: =IF(G86=H86,"是","否") -> 否 | K86: =G86/C86 -> 19454388399 | L86: =I86/K86 -> 0.9156727813754183
A87: 600958.SH | B87: 东方证券 | C87: 8.58 | D87: 非银金融-证券-证券Ⅲ | E87: 367546853606.84003 | F87: 80421694938.740005 | G87: 67142414018.18 | H87: 64088162973.120003 | I87: 13279280920.559999 | J87: =IF(G87=H87,"是","否") -> 否 | K87: =G87/C87 -> 7825456179.2750578 | L87: =I87/K87 -> 1.6969337782158762
A88: 601727.SH | B88: 上海电气 | C88: 3.81 | D88: 电力设备-其他电源设备-其他电源设备Ⅲ | E88: 282295166000 | F88: 77625741000 | G88: 52220091847.739998 | H88: 48216796220.519997 | I88: 25405649152.259998 | J88: =IF(G88=H88,"是","否") -> 否 | K88: =G88/C88 -> 13706060852.425196 | L88: =I88/K88 -> 1.853606913452791
A89: 601838.SH | B89: 成都银行 | C89: 13.4 | D89: 银行-银行-城商行 | E89: 1200305422000 | F89: 74220827000 | G89: 51106924465.800003 | H89: 51008070548.599998 | I89: 23113902534.200001 | J89: =IF(G89=H89,"是","否") -> 否 | K89: =G89/C89 -> 3813949587 | L89: =I89/K89 -> 6.0603586929897197
A90: 601577.SH | B90: 长沙银行 | C90: 6.73 | D90: 银行-银行-城商行 | E90: 1096921911000 | F90: 71176445000 | G90: 27065056764.419998 | H90: 27058615043.970001 | I90: 44111388235.580002 | J90: =IF(G90=H90,"是","否") -> 否 | K90: =G90/C90 -> 4021553753.9999995 | L90: =I90/K90 -> 10.968742663629707
A91: 000709.SZ | B91: 河钢股份 | C91: 1.71 | D91: 钢铁-钢铁-普钢 | E91: 269242148172.31 | F91: 68573075742.110001 | G91: 17676477067.32 | H91: 17673555200.580002 | I91: 50896598674.790001 | J91: =IF(G91=H91,"是","否") -> 否 | K91: =G91/C91 -> 10337121092 | L91: =I91/K91 -> 4.9236724830648813
A92: 601788.SH | B92: 光大证券 | C92: 14.66 | D92: 非银金融-证券-证券Ⅲ | E92: 237082163562.62 | F92: 67790514634.169998 | G92: 60501960990.040001 | H92: 57272204979.739998 | I92: 7288553644.1300001 | J92: =IF(G92=H92,"是","否") -> 否 | K92: =G92/C92 -> 4127009617.3287859 | L92: =I92/K92 -> 1.7660617056781973
A93: 601117.SH | B93: 中国化学 | C93: 6.31 | D93: 建筑装饰-建筑装饰-专业工程 | E93: 223590854861.78 | F93: 67461193400.040001 | G93: 38548235246.220001 | H93: 38172411646.220001 | I93: 28912958153.82 | J93: =IF(G93=H93,"是","否") -> 否 | K93: =G93/C93 -> 6109070562.000001 | L93: =I93/K93 -> 4.7327916514283004
A94: 000039.SZ | B94: 中集集团 | C94: 7 | D94: 机械设备-通用设备-金属制品 | E94: 179111959000 | F94: 66188120000 | G94: 30180261999.439999 | H94: 16109849987 | I94: 36007858000.57 | J94: =IF(G94=H94,"是","否") -> 否 | K94: =G94/C94 -> 4311465999.9200001 | L94: =I94/K94 -> 8.3516506917225204
A95: 601997.SH | B95: 贵阳银行 | C95: 4.75 | D95: 银行-银行-城商行 | E95: 713891639000 | F95: 65689813000 | G95: 17366940861 | H95: 17366940861 | I95: 48322872139 | J95: =IF(G95=H95,"是","否") -> 是 | K95: =G95/C95 -> 3656198076 | L95: =I95/K95 -> 13.216699734131144
A96: 600705.SH | B96: 中航产融 | C96: 2.3999999999999999 | D96: 非银金融-多元金融-多元金融Ⅲ | E96: 449920912536.12 | F96: 64909920795.93 | G96: 21179746238.400002 | H96: 21130619599.200001 | I96: 43730174557.529999 | J96: =IF(G96=H96,"是","否") -> 否 | K96: =G96/C96 -> 8824894266.0000019 | L96: =I96/K96 -> 4.9553199437199904
A97: 000932.SZ | B97: 华菱钢铁 | C97: 3.42 | D97: 钢铁-钢铁-普钢 | E97: 151060459789.75 | F97: 64651229861.010002 | G97: 23627523146.580002 | H97: 23627229313.860001 | I97: 41023706714.43 | J97: =IF(G97=H97,"是","否") -> 否 | K97: =G97/C97 -> 6908632499.000001 | L97: =I97/K97 -> 5.9380357430168749
A98: 688347.SH | B98: 华虹公司 | C98: 27.51 | D98: 电子-半导体-集成电路制造 | E98: 84986190575.199997 | F98: 63179014119.75 | G98: 30573516205.459999 | H98: 10768514400 | I98: 32605497914.299999 | J98: =IF(G98=H98,"是","否") -> 否 | K98: =G98/C98 -> 1111360094.7095602 | L98: =I98/K98 -> 29.338373826370859
A99: 600390.SH | B99: 五矿资本 | C99: 4.15 | D99: 非银金融-多元金融-多元金融Ⅲ | E99: 170288266774.10001 | F99: 62483258375.660004 | G99: 18666971654.849998 | H99: 18666971654.849998 | I99: 43816286720.809998 | J99: =IF(G99=H99,"是","否") -> 是 | K99: =G99/C99 -> 4498065458.999999 | L99: =I99/K99 -> 9.7411403013577189
A100: 600741.SH | B100: 华域汽车 | C100: 15.97 | D100: 汽车-汽车零部件-车身附件及饰件 | E100: 178343470643.89999 | F100: 62289978786.410004 | G100: 50349002024.480003 | H100: 50349002024.480003 | I100: 11940976761.93 | J100: =IF(G100=H100,"是","否") -> 是 | K100: =G100/C100 -> 3152723984 | L100: =I100/K100 -> 3.7875109976420949
A101: 601963.SH | B101: 重庆银行 | C101: 6.73 | D101: 银行-银行-城商行 | E101: 805967923000 | F101: 61826633000 | G101: 19685292004.5 | H101: 12624932588.530001 | I101: 42141340995.5 | J101: =IF(G101=H101,"是","否") -> 否 | K101: =G101/C101 -> 2925006241.3818722 | L101: =I101/K101 -> 14.407265324531753
A102: 601377.SH | B102: 兴业证券 | C102: 5.22 | D102: 非银金融-证券-证券Ⅲ | E102: 265611688595.78 | F102: 61547061456.879997 | G102: 45079853674.68 | H102: 45079853674.68 | I102: 16467207782.200001 | J102: =IF(G102=H102,"是","否") -> 是 | K102: =G102/C102 -> 8635987294 | L102: =I102/K102 -> 1.9068124143305394
A103: 600376.SH | B103: 首开股份 | C103: 2.36 | D103: 房地产-房地产-住宅开发 | E103: 241407557074.89999 | F103: 60271255030.199997 | G103: 6087773971.1199999 | H103: 6087773971.1199999 | I103: 54183481059.080002 | J103: =IF(G103=H103,"是","否") -> 是 | K103: =G103/C103 -> 2579565242 | L103: =I103/K103 -> 21.004888799428166
A104: 600061.SH | B104: 国投资本 | C104: 5.96 | D104: 非银金融-多元金融-多元金融Ⅲ | E104: 279576462053.26001 | F104: 59905686079.449997 | G104: 38294852379.919998 | H104: 38294852379.919998 | I104: 21610833699.529999 | J104: =IF(G104=H104,"是","否") -> 是 | K104: =G104/C104 -> 6425310802 | L104: =I104/K104 -> 3.3633911830075545
A105: 600196.SH | B105: 复星医药 | C105: 22.33 | D105: 医药生物-化学制药-化学制剂 | E105: 115537814165.89 | F105: 58861941625.059998 | G105: 53504280273.010002 | H105: 47305855462.25 | I105: 5357661352.0500002 | J105: =IF(G105=H105,"是","否") -> 否 | K105: =G105/C105 -> 2396071664.7115989 | L105: =I105/K105 -> 2.236018826546605
A106: 000157.SZ | B106: 中联重科 | C106: 5.97 | D106: 机械设备-工程机械-工程机械Ⅲ | E106: 130690024506.75 | F106: 58823374076.459999 | G106: 48114146440.93 | H106: 42210945076.110001 | I106: 10709227635.530001 | J106: =IF(G106=H106,"是","否") -> 否 | K106: =G106/C106 -> 8059321011.881072 | L106: =I106/K106 -> 1.3288002326427288
A107: 002244.SZ | B107: 滨江集团 | C107: 8.72 | D107: 房地产-房地产-住宅开发 | E107: 282920632066.48999 | F107: 58760111203.75 | G107: 27131790720.799999 | H107: 23390124612.799999 | I107: 31628320482.950001 | J107: =IF(G107=H107,"是","否") -> 否 | K107: =G107/C107 -> 3111443889.9999995 | L107: =I107/K107 -> 10.165158556965013
A108: 600803.SH | B108: 新奥股份 | C108: 17.899999999999999 | D108: 公用事业-燃气-燃气Ⅲ | E108: 130749640000 | F108: 57512190000 | G108: 55447310415.300003 | H108: 50833602921.5 | I108: 2064879584.7 | J108: =IF(G108=H108,"是","否") -> 否 | K108: =G108/C108 -> 3097615107.0000005 | L108: =I108/K108 -> 0.66660301986317749
A109: 000027.SZ | B109: 深圳能源 | C109: 5.54 | D109: 公用事业-电力-火电 | E109: 162465283072.20001 | F109: 57086923102.510002 | G109: 26355940134.639999 | H109: 26355940134.639999 | I109: 30730982967.869999 | J109: =IF(G109=H109,"是","否") -> 是 | K109: =G109/C109 -> 4757389916 | L109: =I109/K109 -> 6.4596309132694598
A110: 002936.SZ | B110: 郑州银行 | C110: 1.63 | D110: 银行-银行-城商行 | E110: 645680374000 | F110: 56324341000 | G110: 12863864099.469999 | H110: 10922005304.129999 | I110: 43460476900.529999 | J110: =IF(G110=H110,"是","否") -> 否 | K110: =G110/C110 -> 7891941165.3190184 | L110: =I110/K110 -> 5.5069438545127802
A111: 002129.SZ | B111: TCL中环 | C111: 7.54 | D111: 电力设备-光伏设备-硅料硅片 | E111: 125196372986.19 | F111: 55935389830.099998 | G111: 30485092928.419998 | H111: 30462034349.240002 | I111: 25450296901.68 | J111: =IF(G111=H111,"是","否") -> 否 | K111: =G111/C111 -> 4043115772.9999995 | L111: =I111/K111 -> 6.2947237552873316
A112: 000959.SZ | B112: 首钢股份 | C112: 2.63 | D112: 钢铁-钢铁-普钢 | E112: 135580976331.55 | F112: 54703424551.300003 | G112: 20445570082.599998 | H112: 17114103391.610001 | I112: 34257854468.700001 | J112: =IF(G112=H112,"是","否") -> 否 | K112: =G112/C112 -> 7773981020 | L112: =I112/K112 -> 4.4067324554260363
A113: 600219.SH | B113: 南山铝业 | C113: 3.73 | D113: 有色金属-工业金属-铝 | E113: 67827165094.879997 | F113: 54518419983.709999 | G113: 43672902123.040001 | H113: 43672902123.040001 | I113: 10845517860.67 | J113: =IF(G113=H113,"是","否") -> 是 | K113: =G113/C113 -> 11708552848 | L113: =I113/K113 -> 0.92629020865909839
A114: 600350.SH | B114: 山东高速 | C114: 8.65 | D114: 交通运输-公路铁路运输-高速公路 | E114: 154724365692.91 | F114: 53801306496.870003 | G114: 41970500866.25 | H114: 41970500866.25 | I114: 11830805630.620001 | J114: =IF(G114=H114,"是","否") -> 是 | K114: =G114/C114 -> 4852081025 | L114: =I114/K114 -> 2.438295149990823
A115: 000898.SZ | B115: 鞍钢股份 | C115: 1.85 | D115: 钢铁-钢铁-普钢 | E115: 96702000000 | F115: 53044000000 | G115: 16129945530.059999 | H115: 14720954576.4 | I115: 36914054469.940002 | J115: =IF(G115=H115,"是","否") -> 否 | K115: =G115/C115 -> 8718889475.708107 | L115: =I115/K115 -> 4.2338023176904667
A116: 002460.SZ | B116: 赣锋锂业 | C116: 25.49 | D116: 有色金属-能源金属-锂 | E116: 97964416055.199997 | F116: 52589133316.080002 | G116: 47328173180.389999 | H116: 30810318580.040001 | I116: 5260960135.6999998 | J116: =IF(G116=H116,"是","否") -> 否 | K116: =G116/C116 -> 1856734922.7300904 | L116: =I116/K116 -> 2.8334470749138672
A117: 600704.SH | B117: 物产中大 | C117: 4.11 | D117: 交通运输-物流-物流Ⅲ | E117: 207241926199.34 | F117: 52557153849.129997 | G117: 21341428956.900002 | H117: 21181715384.400002 | I117: 31215724892.23 | J117: =IF(G117=H117,"是","否") -> 否 | K117: =G117/C117 -> 5192561790 | L117: =I117/K117 -> 6.011623193843592
A118: 600021.SH | B118: 上海电力 | C118: 8.0999999999999996 | D118: 公用事业-电力-火电 | E118: 174758783831.22 | F118: 52319134614.349998 | G118: 22815623524.5 | H118: 21199029995.700001 | I118: 29503511089.849998 | J118: =IF(G118=H118,"是","否") -> 否 | K118: =G118/C118 -> 2816743645 | L118: =I118/K118 -> 10.474333062656115
A119: 600157.SH | B119: 永泰能源 | C119: 1.06 | D119: 公用事业-电力-火电 | E119: 106622606444.55 | F119: 51933953057.699997 | G119: 23550829993.700001 | H119: 23550829993.700001 | I119: 28383123064 | J119: =IF(G119=H119,"是","否") -> 是 | K119: =G119/C119 -> 22217764145 | L119: =I119/K119 -> 1.2774968209565536
A120: 601828.SH | B120: 美凯龙 | C120: 2.17 | D120: 商贸零售-零售-商业物业经营 | E120: 118265611301.52 | F120: 51403584034.860001 | G120: 8580393815.2799997 | H120: 7841180074.6300001 | I120: 42823190219.580002 | J120: =IF(G120=H120,"是","否") -> 否 | K120: =G120/C120 -> 3954098532.3870969 | L120: =I120/K120 -> 10.830076658137186
A121: 600170.SH | B121: 上海建工 | C121: 1.94 | D121: 建筑装饰-建筑装饰-房屋建设 | E121: 359954440932.53003 | F121: 51270554078.730003 | G121: 17238723103.360001 | H121: 17238723103.360001 | I121: 34031830975.369999 | J121: =IF(G121=H121,"是","否") -> 是 | K121: =G121/C121 -> 8885939744 | L121: =I121/K121 -> 3.8298516483131801
A122: 000983.SZ | B122: 山西焦煤 | C122: 7.51 | D122: 煤炭-煤炭开采加工-煤炭开采 | E122: 93654908723.679993 | F122: 51156354804.779999 | G122: 42635028953.089996 | H122: 34848003602.790001 | I122: 8521325851.6899996 | J122: =IF(G122=H122,"是","否") -> 否 | K122: =G122/C122 -> 5677101059 | L122: =I122/K122 -> 1.5009995001200487
A123: 002466.SZ | B123: 天齐锂业 | C123: 24.94 | D123: 有色金属-能源金属-锂 | E123: 69263521570.229996 | F123: 50114884450.68 | G123: 39888950710.43 | H123: 36818597780 | I123: 10225933740.26 | J123: =IF(G123=H123,"是","否") -> 否 | K123: =G123/C123 -> 1599396580.2097032 | L123: =I123/K123 -> 6.3936198606347139
A124: 600039.SH | B124: 四川路桥 | C124: 5.66 | D124: 建筑装饰-建筑装饰-基础建设 | E124: 244879300376.17999 | F124: 49691568832.790001 | G124: 49314551040.300003 | H124: 37922494485.900002 | I124: 377017792.49000001 | J124: =IF(G124=H124,"是","否") -> 否 | K124: =G124/C124 -> 8712818205 | L124: =I124/K124 -> 4.3271623901625984e-02
A125: 002966.SZ | B125: 苏州银行 | C125: 6.89 | D125: 银行-银行-城商行 | E125: 659514376685 | F125: 49487722437 | G125: 25263879561.049999 | H125: 24705551291.07 | I125: 24223842875.950001 | J125: =IF(G125=H125,"是","否") -> 否 | K125: =G125/C125 -> 3666745945 | L125: =I125/K125 -> 6.606359764025048
A126: 688009.SH | B126: 中国通号 | C126: 4.82 | D126: 机械设备-轨交设备-轨交设备Ⅲ | E126: 118548740196.3 | F126: 48935945184.610001 | G126: 46479400428.480003 | H126: 41553306760 | I126: 2456544756.1300001 | J126: =IF(G126=H126,"是","否") -> 否 | K126: =G126/C126 -> 9643029134.5394192 | L126: =I126/K126 -> 0.25474824579043776
A127: 601877.SH | B127: 正泰电器 | C127: 18.58 | D127: 电力设备-电网设备-输变电设备 | E127: 130735689914.14999 | F127: 48137286032.550003 | G127: 39927843574.080002 | H127: 39927843574.080002 | I127: 8209442458.4700003 | J127: =IF(G127=H127,"是","否") -> 是 | K127: =G127/C127 -> 2148968976.0000005 | L127: =I127/K127 -> 3.8201772804327345
A128: 600663.SH | B128: 陆家嘴 | C128: 8.16 | D128: 房地产-房地产-商业地产 | E128: 157679966113.95999 | F128: 48123423936.540001 | G128: 35891779447.660004 | H128: 23937045350.400002 | I128: 12231644488.879999 | J128: =IF(G128=H128,"是","否") -> 否 | K128: =G128/C128 -> 4398502383.291667 | L128: =I128/K128 -> 2.7808657181461647
A129: 601699.SH | B129: 潞安环能 | C129: 13.81 | D129: 煤炭-煤炭开采加工-煤炭开采 | E129: 81176157540.360001 | F129: 48063091376.190002 | G129: 41311361052 | H129: 41311361052 | I129: 6751730324.1899996 | J129: =IF(G129=H129,"是","否") -> 是 | K129: =G129/C129 -> 2991409200 | L129: =I129/K129 -> 2.2570400345730031
A130: 600482.SH | B130: 中国动力 | C130: 21 | D130: 电力设备-其他电源设备-其他电源设备Ⅲ | E130: 102381768280.53 | F130: 47975228610.790001 | G130: 46177783470 | H130: 46177783470 | I130: 1797445140.79 | J130: =IF(G130=H130,"是","否") -> 是 | K130: =G130/C130 -> 2198942070 | L130: =I130/K130 -> 0.81741359416075932
A131: 000415.SZ | B131: 渤海租赁 | C131: 2.21 | D131: 非银金融-多元金融-多元金融Ⅲ | E131: 268547010000 | F131: 47382183000 | G131: 13667792033.219999 | H131: 11917894647.1 | I131: 33714390966.779999 | J131: =IF(G131=H131,"是","否") -> 否 | K131: =G131/C131 -> 6184521282 | L131: =I131/K131 -> 5.451414819269111
A132: 603799.SH | B132: 华友钴业 | C132: 21.96 | D132: 有色金属-能源金属-钴 | E132: 131246143028.25999 | F132: 46317395576.089996 | G132: 37270796667.480003 | H132: 37031917983.480003 | I132: 9046598908.6100006 | J132: =IF(G132=H132,"是","否") -> 否 | K132: =G132/C132 -> 1697212963 | L132: =I132/K132 -> 5.330267388848597
A133: 000031.SZ | B133: 大悦城 | C133: 2.5 | D133: 房地产-房地产-商业地产 | E133: 192815512509.45001 | F133: 44997824016.330002 | G133: 10715783347.5 | H133: 10007217922.5 | I133: 34282040668.830002 | J133: =IF(G133=H133,"是","否") -> 否 | K133: =G133/C133 -> 4286313339 | L133: =I133/K133 -> 7.9980248660094517
A134: 600985.SH | B134: 淮北矿业 | C134: 13.84 | D134: 煤炭-煤炭开采加工-煤炭开采 | E134: 87672721644.149994 | F134: 44572712837.5 | G134: 37274700532.559998 | H134: 37274700532.559998 | I134: 7298012304.9399996 | J134: =IF(G134=H134,"是","否") -> 是 | K134: =G134/C134 -> 2693258709 | L134: =I134/K134 -> 2.7097331127352904
A135: 600918.SH | B135: 中泰证券 | C135: 5.55 | D135: 非银金融-证券-证券Ⅲ | E135: 194683745489.95999 | F135: 44523592679.019997 | G135: 38675872945.800003 | H135: 22049094495.450001 | I135: 5847719733.2200003 | J135: =IF(G135=H135,"是","否") -> 否 | K135: =G135/C135 -> 6968625756.000001 | L135: =I135/K135 -> 0.83914963121460517
A136: 601665.SH | B136: 齐鲁银行 | C136: 4.2999999999999998 | D136: 银行-银行-城商行 | E136: 647543775000 | F136: 44247440000 | G136: 20790397462.200001 | H136: 20790397462.200001 | I136: 23457042537.799999 | J136: =IF(G136=H136,"是","否") -> 是 | K136: =G136/C136 -> 4834976154 | L136: =I136/K136 -> 4.8515322083634
A137: 600208.SH | B137: 衢州发展 | C137: 1.82 | D137: 房地产-房地产-住宅开发 | E137: 101069774532.74001 | F137: 44176861320.760002 | G137: 15486272256 | H137: 15484139916.700001 | I137: 28690589064.759998 | J137: =IF(G137=H137,"是","否") -> 否 | K137: =G137/C137 -> 8508940800 | L137: =I137/K137 -> 3.3718167441898288
A138: 002948.SZ | B138: 青岛银行 | C138: 3.08 | D138: 银行-银行-城商行 | E138: 654024373000 | F138: 42855737000 | G138: 15500912357.879999 | H138: 9578554000.3999996 | I138: 27354824642.119999 | J138: =IF(G138=H138,"是","否") -> 否 | K138: =G138/C138 -> 5032763752.5584412 | L138: =I138/K138 -> 5.4353484461125321
A139: 600642.SH | B139: 申能股份 | C139: 7.28 | D139: 公用事业-电力-火电 | E139: 95399819327.550003 | F139: 42837363939.739998 | G139: 35629009241.279999 | H139: 35519414883.68 | I139: 7208354698.46 | J139: =IF(G139=H139,"是","否") -> 否 | K139: =G139/C139 -> 4894094676 | L139: =I139/K139 -> 1.4728678490444471
A140: 601880.SH | B140: 辽港股份 | C140: 1.23 | D140: 交通运输-港口航运-港口 | E140: 54742099716.489998 | F140: 42825265147.18 | G140: 25964850668.25 | H140: 23158870274.91 | I140: 16860414478.93 | J140: =IF(G140=H140,"是","否") -> 否 | K140: =G140/C140 -> 21109634689.634148 | L140: =I140/K140 -> 0.79870707034116895
A141: 002608.SZ | B141: 江苏国信 | C141: 6.64 | D141: 公用事业-电力-火电 | E141: 89973295404.149994 | F141: 42646409198.120003 | G141: 25086449234.560001 | H141: 25086449234.560001 | I141: 17559959963.560001 | J141: =IF(G141=H141,"是","否") -> 是 | K141: =G141/C141 -> 3778079704.0000005 | L141: =I141/K141 -> 4.6478532321508688
A142: 688303.SH | B142: 大全能源 | C142: 19.24 | D142: 电力设备-光伏设备-硅料硅片 | E142: 47830392854.43 | F142: 42356388338.330002 | G142: 41268601636.599998 | H142: 10628901636.6 | I142: 1087786701.73 | J142: =IF(G142=H142,"是","否") -> 否 | K142: =G142/C142 -> 2144937715 | L142: =I142/K142 -> 0.50714139348796894
A143: 000987.SZ | B143: 越秀资本 | C143: 5.12 | D143: 非银金融-多元金融-多元金融Ⅲ | E143: 197602841292.17001 | F143: 42260159477.849998 | G143: 25687718205.439999 | H143: 25677986268.16 | I143: 16572441272.41 | J143: =IF(G143=H143,"是","否") -> 否 | K143: =G143/C143 -> 5017132462 | L143: =I143/K143 -> 3.3031699676917956
A144: 600875.SH | B144: 东方电气 | C144: 12.47 | D144: 电力设备-其他电源设备-其他电源设备Ⅲ | E144: 131570407734.38 | F144: 41461110561.300003 | G144: 37101234228.790001 | H144: 25230601615.73 | I144: 4359876332.5100002 | J144: =IF(G144=H144,"是","否") -> 否 | K144: =G144/C144 -> 2975239312.6535683 | L144: =I144/K144 -> 1.4653867720716207
A145: 000630.SZ | B145: 铜陵有色 | C145: 3.17 | D145: 有色金属-工业金属-铜 | E145: 85409102057.570007 | F145: 41151606145.339996 | G145: 40553557671.169998 | H145: 33368891406.220001 | I145: 598048474.16999996 | J145: =IF(G145=H145,"是","否") -> 否 | K145: =G145/C145 -> 12792920401 | L145: =I145/K145 -> 4.6748393285027522e-02
A146: 601555.SH | B146: 东吴证券 | C146: 6.23 | D146: 非银金融-证券-证券Ⅲ | E146: 156593752384.73999 | F146: 41077517487.730003 | G146: 30955018674.509998 | H146: 30955018674.509998 | I146: 10122498813.219999 | J146: =IF(G146=H146,"是","否") -> 是 | K146: =G146/C146 -> 4968702836.999999 | L146: =I146/K146 -> 2.0372518029940703
A147: 601598.SH | B147: 中国外运 | C147: 4.64 | D147: 交通运输-物流-物流Ⅲ | E147: 77490851391.630005 | F147: 40935793009.779999 | G147: 30707001658.299999 | H147: 24387454300 | I147: 10228791351.48 | J147: =IF(G147=H147,"是","否") -> 否 | K147: =G147/C147 -> 6617888288.4267244 | L147: =I147/K147 -> 1.545627684493855
A148: 002202.SZ | B148: 金风科技 | C148: 8.21 | D148: 电力设备-风电设备-风电整机 | E148: 144211910449.67001 | F148: 40691263185.860001 | G148: 31794096533.57 | H148: 27866588719.59 | I148: 8897166652.2999992 | J148: =IF(G148=H148,"是","否") -> 否 | K148: =G148/C148 -> 3872606155.1242385 | L148: =I148/K148 -> 2.2974623021055871
A149: 002958.SZ | B149: 青农商行 | C149: 2.38 | D149: 银行-银行-农商行 | E149: 475405371000 | F149: 40601363000 | G149: 13222367914.98 | H149: 11724491362.5 | I149: 27378995085.02 | J149: =IF(G149=H149,"是","否") -> 否 | K149: =G149/C149 -> 5555616771 | L149: =I149/K149 -> 4.9281648129397224
A150: 600755.SH | B150: 厦门国贸 | C150: 5.74 | D150: 交通运输-物流-物流Ⅲ | E150: 130091829219.59 | F150: 40060402590.190002 | G150: 12652267899.18 | H150: 12237330072.379999 | I150: 27408134691.009998 | J150: =IF(G150=H150,"是","否") -> 否 | K150: =G150/C150 -> 2204227857 | L150: =I150/K150 -> 12.434347294890394
A151: 600655.SH | B151: 豫园股份 | C151: 5.09 | D151: 商贸零售-零售-商业物业经营 | E151: 124321287766.64 | F151: 39945981458.110001 | G151: 19831126873.77 | H151: 19770736375.349998 | I151: 20114854584.34 | J151: =IF(G151=H151,"是","否") -> 否 | K151: =G151/C151 -> 3896095653 | L151: =I151/K151 -> 5.1628235997880418
A152: 000883.SZ | B152: 湖北能源 | C152: 4.49 | D152: 公用事业-电力-电能综合服务 | E152: 95552802675.039993 | F152: 39774135527.519997 | G152: 29189110253.759998 | H152: 29094106478.459999 | I152: 10585025273.76 | J152: =IF(G152=H152,"是","否") -> 否 | K152: =G152/C152 -> 6500915423.999999 | L152: =I152/K152 -> 1.6282361149757978
A153: 600248.SH | B153: 陕建股份 | C153: 3.54 | D153: 建筑装饰-建筑装饰-房屋建设 | E153: 343707279381.15002 | F153: 39090964278.330002 | G153: 13337241292.440001 | H153: 13029650692.440001 | I153: 25753722985.889999 | J153: =IF(G153=H153,"是","否") -> 否 | K153: =G153/C153 -> 3767582286 | L153: =I153/K153 -> 6.8356099564403783
A154: 600177.SH | B154: 雅戈尔 | C154: 6.55 | D154: 纺织服饰-服装家纺-服装 | E154: 74388205553.320007 | F154: 39058931695.099998 | G154: 30283544458.099998 | H154: 30283544458.099998 | I154: 8775387237 | J154: =IF(G154=H154,"是","否") -> 是 | K154: =G154/C154 -> 4623441902 | L154: =I154/K154 -> 1.8980204408330423
A155: 600008.SH | B155: 首创环保 | C155: 2.7999999999999998 | D155: 环保-环境治理-综合环境治理 | E155: 110969602131.44 | F155: 38780305879.980003 | G155: 20553653895.599998 | H155: 20553653895.599998 | I155: 18226651984.380001 | J155: =IF(G155=H155,"是","否") -> 是 | K155: =G155/C155 -> 7340590677 | L155: =I155/K155 -> 2.4829952774085187
A156: 601611.SH | B156: 中国核建 | C156: 6.92 | D156: 建筑装饰-建筑装饰-基础建设 | E156: 225495660248.42001 | F156: 38555844283.029999 | G156: 20839822262.279999 | H156: 20839822262.279999 | I156: 17716022020.75 | J156: =IF(G156=H156,"是","否") -> 是 | K156: =G156/C156 -> 3011535009 | L156: =I156/K156 -> 5.882721591416173
A157: 600745.SH | B157: 闻泰科技 | C157: 24.899999999999999 | D157: 电子-半导体-分立器件 | E157: 75710178195.25 | F157: 37697364231.510002 | G157: 30945961629.599998 | H157: 30945961629.599998 | I157: 6751402601.9099998 | J157: =IF(G157=H157,"是","否") -> 是 | K157: =G157/C157 -> 1242809704 | L157: =I157/K157 -> 5.4323703622368882
A158: 000783.SZ | B158: 长江证券 | C158: 4.99 | D158: 非银金融-证券-证券Ⅲ | E158: 147840865556.70001 | F158: 37453308736.480003 | G158: 27595064010.52 | H158: 27595064010.52 | I158: 9858244725.9599991 | J158: =IF(G158=H158,"是","否") -> 是 | K158: =G158/C158 -> 5530072948 | L158: =I158/K158 -> 1.7826608832574842
A159: 000402.SZ | B159: 金融街 | C159: 2.27 | D159: 房地产-房地产-住宅开发 | E159: 137203224097.57001 | F159: 37133663082.260002 | G159: 6784870888.8900003 | H159: 6783281877.54 | I159: 30348792193.369999 | J159: =IF(G159=H159,"是","否") -> 否 | K159: =G159/C159 -> 2988929907 | L159: =I159/K159 -> 10.153731649007185
A160: 601233.SH | B160: 桐昆股份 | C160: 10.300000000000001 | D160: 基础化工-化学纤维-涤纶 | E160: 110952578912.53 | F160: 36963632375.599998 | G160: 24834530777.900002 | H160: 23404789261.099998 | I160: 12129101597.700001 | J160: =IF(G160=H160,"是","否") -> 否 | K160: =G160/C160 -> 2411119493 | L160: =I160/K160 -> 5.0304854790123006
A161: 600352.SH | B161: 浙江龙盛 | C161: 8.91 | D161: 基础化工-化学制品-纺织化学用品 | E161: 72870917518.100006 | F161: 36587217458.309998 | G161: 28987186872.599998 | H161: 28987186872.599998 | I161: 7600030585.71 | J161: =IF(G161=H161,"是","否") -> 是 | K161: =G161/C161 -> 3253331860 | L161: =I161/K161 -> 2.3360760330518509
A162: 002128.SZ | B162: 电投能源 | C162: 16.22 | D162: 煤炭-煤炭开采加工-煤炭开采 | E162: 51185135969.019997 | F162: 36445925725.870003 | G162: 36358322056.459999 | H162: 34282162056.459999 | I162: 87603669.409999996 | J162: =IF(G162=H162,"是","否") -> 否 | K162: =G162/C162 -> 2241573493 | L162: =I162/K162 -> 3.9081328220363643e-02
A163: 688599.SH | B163: 天合光能 | C163: 16.100000000000001 | D163: 电力设备-光伏设备-光伏电池组件 | E163: 140730114447.06 | F163: 36107067750.980003 | G163: 35087779752.199997 | H163: 35087779752.199997 | I163: 1019287998.78 | J163: =IF(G163=H163,"是","否") -> 是 | K163: =G163/C163 -> 2179365201.9999995 | L163: =I163/K163 -> 0.46769949242311532
A164: 000825.SZ | B164: 太钢不锈 | C164: 3.01 | D164: 钢铁-钢铁-特钢 | E164: 68870430214.919998 | F164: 36079216288.459999 | G164: 17177809923.959999 | H164: 17145705865.959999 | I164: 18901406364.5 | J164: =IF(G164=H164,"是","否") -> 否 | K164: =G164/C164 -> 5706913596 | L164: =I164/K164 -> 3.3120190180815205
A165: 000728.SZ | B165: 国元证券 | C165: 6.47 | D165: 非银金融-证券-证券Ⅲ | E165: 149899188846.34 | F165: 35662427281.410004 | G165: 28233642954.77 | H165: 28233642954.77 | I165: 7428784326.6400003 | J165: =IF(G165=H165,"是","否") -> 是 | K165: =G165/C165 -> 4363777891 | L165: =I165/K165 -> 1.7023745278056821
A166: 601108.SH | B166: 财通证券 | C166: 6.58 | D166: 非银金融-证券-证券Ⅲ | E166: 141282025765.07999 | F166: 35275851381.769997 | G166: 30555806265.32 | H166: 30555806265.32 | I166: 4720045116.4499998 | J166: =IF(G166=H166,"是","否") -> 是 | K166: =G166/C166 -> 4643739554 | L166: =I166/K166 -> 1.0164319212054587
A167: 600820.SH | B167: 隧道股份 | C167: 5.33 | D167: 建筑装饰-建筑装饰-基础建设 | E167: 160461842704.84 | F167: 35198645932.949997 | G167: 16758032181.02 | H167: 16758032181.02 | I167: 18440613751.93 | J167: =IF(G167=H167,"是","否") -> 是 | K167: =G167/C167 -> 3144096094 | L167: =I167/K167 -> 5.8651558987401611
A168: 600057.SH | B168: 厦门象屿 | C168: 4.84 | D168: 交通运输-物流-物流Ⅲ | E168: 125166772840.8 | F168: 35189934799.849998 | G168: 10998484064.92 | H168: 10609812303.200001 | I168: 24191450734.93 | J168: =IF(G168=H168,"是","否") -> 否 | K168: =G168/C168 -> 2272414063 | L168: =I168/K168 -> 10.645705432307034
A169: 002459.SZ | B169: 晶澳科技 | C169: 9.9000000000000004 | D169: 电力设备-光伏设备-光伏电池组件 | E169: 120012503900.96001 | F169: 34867679157.809998 | G169: 32765739563.700001 | H169: 32739126334.200001 | I169: 2101939594.1099999 | J169: =IF(G169=H169,"是","否") -> 否 | K169: =G169/C169 -> 3309670663 | L169: =I169/K169 -> 0.63509025765262372
A170: 000539.SZ | B170: 粤电力A | C170: 4.26 | D170: 公用事业-电力-火电 | E170: 164569341102 | F170: 34482153594 | G170: 20361919471.09 | H170: 10879599724.74 | I170: 14120234122.91 | J170: =IF(G170=H170,"是","否") -> 否 | K170: =G170/C170 -> 4779793303.0727701 | L170: =I170/K170 -> 2.9541516186134182
A171: 001227.SZ | B171: 兰州银行 | C171: 2.13 | D171: 银行-银行-城商行 | E171: 470693859428.15997 | F171: 34342167590.639999 | G171: 12131834967.84 | H171: 5896099174.1400003 | I171: 22210332622.799999 | J171: =IF(G171=H171,"是","否") -> 否 | K171: =G171/C171 -> 5695697168 | L171: =I171/K171 -> 3.8994932433528566
A172: 600637.SH | B172: 东方明珠 | C172: 6.28 | D172: 传媒-文化传媒-电视广播 | E172: 44448733495.400002 | F172: 34337685092.630001 | G172: 21112730850.759998 | H172: 21112730850.759998 | I172: 13224954241.870001 | J172: =IF(G172=H172,"是","否") -> 是 | K172: =G172/C172 -> 3361899816.9999995 | L172: =I172/K172 -> 3.9337740449598897
A173: 600348.SH | B173: 华阳股份 | C173: 6.83 | D173: 煤炭-煤炭开采加工-煤炭开采 | E173: 74077740358.199997 | F173: 34324421559.34 | G173: 24639225000 | H173: 24639225000 | I173: 9685196559.3400002 | J173: =IF(G173=H173,"是","否") -> 是 | K173: =G173/C173 -> 3607500000 | L173: =I173/K173 -> 2.6847391709882191
A174: 600578.SH | B174: 京能电力 | C174: 3.06 | D174: 公用事业-电力-火电 | E174: 91140266128.089996 | F174: 33787402643.310001 | G174: 20485540305.900002 | H174: 20485540305.900002 | I174: 13301862337.41 | J174: =IF(G174=H174,"是","否") -> 是 | K174: =G174/C174 -> 6694621015 | L174: =I174/K174 -> 1.9869477760736243
A175: 000498.SZ | B175: 山东路桥 | C175: 4.92 | D175: 建筑装饰-建筑装饰-基础建设 | E175: 147076781991.16 | F175: 33770385869.619999 | G175: 7680102971.8800001 | H175: 7172879286.4799995 | I175: 26090282897.740002 | J175: =IF(G175=H175,"是","否") -> 否 | K175: =G175/C175 -> 1560996539 | L175: =I175/K175 -> 16.713863385279421
A176: 000627.SZ | B176: 天茂集团 | C176: 2.68 | D176: 非银金融-保险-保险Ⅲ | E176: 278294193630.35999 | F176: 33375373420.84 | G176: 13240886162.200001 | H176: 12200711162.200001 | I176: 20134487258.639999 | J176: =IF(G176=H176,"是","否") -> 否 | K176: =G176/C176 -> 4940629165 | L176: =I176/K176 -> 4.0752881032389725
A177: 600801.SH | B177: 华新水泥 | C177: 10.17 | D177: 建筑材料-建筑材料-水泥 | E177: 68975448352 | F177: 32982745374 | G177: 18180512366.650002 | H177: 13671283350.33 | I177: 14802233007.35 | J177: =IF(G177=H177,"是","否") -> 否 | K177: =G177/C177 -> 1787660999.6705999 | L177: =I177/K177 -> 8.2802237169561259
A178: 600109.SH | B178: 国金证券 | C178: 7.16 | D178: 非银金融-证券-证券Ⅲ | E178: 114927472991.58 | F178: 32658939326.310001 | G178: 26581926091.599998 | H178: 22908827919.52 | I178: 6077013234.71 | J178: =IF(G178=H178,"是","否") -> 否 | K178: =G178/C178 -> 3712559509.9999995 | L178: =I178/K178 -> 1.6368796832323371
A179: 300207.SZ | B179: 欣旺达 | C179: 15.44 | D179: 电力设备-电池-锂电池 | E179: 81892145912.399994 | F179: 32530454063.25 | G179: 28752634432.639999 | H179: 26681801174.639999 | I179: 3777819630.6100001 | J179: =IF(G179=H179,"是","否") -> 否 | K179: =G179/C179 -> 1862217256 | L179: =I179/K179 -> 2.028667502912453
A180: 600848.SH | B180: 上海临港 | C180: 8.84 | D180: 房地产-房地产-产业地产 | E180: 84964363787.509995 | F180: 32289966270.200001 | G180: 21657209807.990002 | H180: 21162184493.32 | I180: 10632756462.209999 | J180: =IF(G180=H180,"是","否") -> 否 | K180: =G180/C180 -> 2449910611.7635751 | L180: =I180/K180 -> 4.3400589438469268
A181: 600928.SH | B181: 西安银行 | C181: 2.96 | D181: 银行-银行-城商行 | E181: 445262317000 | F181: 32071454000 | G181: 13155555557.200001 | H181: 13086886295.200001 | I181: 18915898442.799999 | J181: =IF(G181=H181,"是","否") -> 否 | K181: =G181/C181 -> 4444444445 | L181: =I181/K181 -> 4.2560771490979903
A182: 600739.SH | B182: 辽宁成大 | C182: 8.18 | D182: 医药生物-生物制品-疫苗 | E182: 47615822873.459999 | F182: 31975367918.610001 | G182: 12513026294.879999 | H182: 12513026294.879999 | I182: 19462341623.73 | J182: =IF(G182=H182,"是","否") -> 是 | K182: =G182/C182 -> 1529709816 | L182: =I182/K182 -> 12.722897781110923
A183: 000703.SZ | B183: 恒逸石化 | C183: 5.5 | D183: 石油石化-石油加工贸易-石油加工 | E183: 110871982353.53 | F183: 31973404299.580002 | G183: 20164663095.5 | H183: 20060346383 | I183: 11808741204.08 | J183: =IF(G183=H183,"是","否") -> 否 | K183: =G183/C183 -> 3666302381 | L183: =I183/K183 -> 3.220885779982805
A184: 601187.SH | B184: 厦门银行 | C184: 4.5 | D184: 银行-银行-城商行 | E184: 398454505909.19 | F184: 31233466513.720001 | G184: 11876075496 | H184: 5771153268 | I184: 19357391017.720001 | J184: =IF(G184=H184,"是","否") -> 否 | K184: =G184/C184 -> 2639127888 | L184: =I184/K184 -> 7.3347680897682972
A185: 002423.SZ | B185: 中粮资本 | C185: 7.41 | D185: 非银金融-多元金融-多元金融Ⅲ | E185: 145256998885.01001 | F185: 31096579678.419998 | G185: 17073422310.75 | H185: 17073422310.75 | I185: 14023157367.67 | J185: =IF(G185=H185,"是","否") -> 是 | K185: =G185/C185 -> 2304105575 | L185: =I185/K185 -> 6.086160946713564
A186: 600808.SH | B186: 马钢股份 | C186: 1.83 | D186: 钢铁-钢铁-普钢 | E186: 83527981602 | F186: 30949995328 | G186: 12403813659.82 | H186: 10920984670.379999 | I186: 18546181668.189999 | J186: =IF(G186=H186,"是","否") -> 否 | K186: =G186/C186 -> 6778040251.2677593 | L186: =I186/K186 -> 2.7362159238758039
A187: 600998.SH | B187: 九州通 | C187: 4.49 | D187: 医药生物-医药商业-医药流通 | E187: 98704644100.570007 | F187: 30590977711.43 | G187: 22640691350.66 | H187: 22640691350.66 | I187: 7950286360.7700005 | J187: =IF(G187=H187,"是","否") -> 是 | K187: =G187/C187 -> 5042470234 | L187: =I187/K187 -> 1.5766650058067553
A188: 601866.SH | B188: 中远海发 | C188: 2.13 | D188: 交通运输-港口航运-航运 | E188: 124495219663.24001 | F188: 30207856485.330002 | G188: 23886150595.560001 | H188: 17539761450.57 | I188: 6321705889.7700005 | J188: =IF(G188=H188,"是","否") -> 否 | K188: =G188/C188 -> 11214155209.1831 | L188: =I188/K188 -> 0.56372555683849035
A189: 300070.SZ | B189: 碧水源 | C189: 3.19 | D189: 环保-环境治理-水务及水治理 | E189: 77999523371.720001 | F189: 29924491618.77 | G189: 11561227867.969999 | H189: 10956910704.74 | I189: 18363263750.799999 | J189: =IF(G189=H189,"是","否") -> 否 | K189: =G189/C189 -> 3624209363 | L189: =I189/K189 -> 5.0668330417863885
A190: 002939.SZ | B190: 长城证券 | C190: 6.87 | D190: 非银金融-证券-证券Ⅲ | E190: 117370275436.8 | F190: 29646484538.07 | G190: 27716513187.720001 | H190: 23959969714.59 | I190: 1929971350.3499999 | J190: =IF(G190=H190,"是","否") -> 否 | K190: =G190/C190 -> 4034426956 | L190: =I190/K190 -> 0.47837558379381401
A191: 000401.SZ | B191: 冀东水泥 | C191: 4.42 | D191: 建筑材料-建筑材料-水泥 | E191: 59406489375.18 | F191: 29546493582.75 | G191: 11749309340.860001 | H191: 6839065703.8599997 | I191: 17797184241.889999 | J191: =IF(G191=H191,"是","否") -> 否 | K191: =G191/C191 -> 2658214783 | L191: =I191/K191 -> 6.6951641213147219
A192: 601666.SH | B192: 平煤股份 | C192: 8.41 | D192: 煤炭-煤炭开采加工-煤炭开采 | E192: 74332998474.759995 | F192: 29534500841.18 | G192: 20815958491.77 | H192: 20767198993.77 | I192: 8718542349.4099998 | J192: =IF(G192=H192,"是","否") -> 否 | K192: =G192/C192 -> 2475143697 | L192: =I192/K192 -> 3.5224388628334253
A193: 600022.SH | B193: 山东钢铁 | C193: 1.23 | D193: 钢铁-钢铁-普钢 | E193: 67084456563.919998 | F193: 29455437876.619999 | G193: 13159584951.42 | H193: 13159584951.42 | I193: 16295852925.200001 | J193: =IF(G193=H193,"是","否") -> 是 | K193: =G193/C193 -> 10698849554 | L193: =I193/K193 -> 1.5231406744202172
A194: 600582.SH | B194: 天地科技 | C194: 5.33 | D194: 机械设备-专用设备-能源及重型设备 | E194: 52366294506.120003 | F194: 29454475624.889999 | G194: 22058678794.360001 | H194: 22058678794.360001 | I194: 7395796830.5299997 | J194: =IF(G194=H194,"是","否") -> 是 | K194: =G194/C194 -> 4138588892 | L194: =I194/K194 -> 1.7870334608074427
A195: 000958.SZ | B195: 电投产融 | C195: 3.3999999999999999 | D195: 非银金融-多元金融-多元金融Ⅲ | E195: 46144319212.330002 | F195: 29282212299.549999 | G195: 18303622968 | H195: 18303546468 | I195: 10978589331.549999 | J195: =IF(G195=H195,"是","否") -> 否 | K195: =G195/C195 -> 5383418520 | L195: =I195/K195 -> 2.0393341685702713
A196: 000050.SZ | B196: 深天马A | C196: 6.25 | D196: 电子-光学光电子-面板 | E196: 81314897631.149994 | F196: 28977435279.02 | G196: 15360922881.25 | H196: 15360744287.5 | I196: 13616512397.77 | J196: =IF(G196=H196,"是","否") -> 否 | K196: =G196/C196 -> 2457747661 | L196: =I196/K196 -> 5.5402402019700263
A197: 600483.SH | B197: 福能股份 | C197: 9.05 | D197: 公用事业-电力-电能综合服务 | E197: 51883154066.610001 | F197: 28897316876.360001 | G197: 23803962514.049999 | H197: 23803962514.049999 | I197: 5093354362.3100004 | J197: =IF(G197=H197,"是","否") -> 是 | K197: =G197/C197 -> 2630272100.9999995 | L197: =I197/K197 -> 1.9364362950789635
A198: 600098.SH | B198: 广州发展 | C198: 5.5 | D198: 综合-综合-综合Ⅲ | E198: 76642263843.070007 | F198: 28860379259.040001 | G198: 19287788894 | H198: 19200663784.5 | I198: 9572590365.0400009 | J198: =IF(G198=H198,"是","否") -> 否 | K198: =G198/C198 -> 3506870708 | L198: =I198/K198 -> 2.729667319414617
A199: 000623.SZ | B199: 吉林敖东 | C199: 12.91 | D199: 医药生物-中药-中药Ⅲ | E199: 33424066025.689999 | F199: 28623760598.689999 | G199: 15439009446.17 | H199: 15383321593.129999 | I199: 13184751152.52 | J199: =IF(G199=H199,"是","否") -> 否 | K199: =G199/C199 -> 1195895387 | L199: =I199/K199 -> 11.02500377193946
A200: 000778.SZ | B200: 新兴铸管 | C200: 3.04 | D200: 钢铁-钢铁-普钢 | E200: 55039714326.5 | F200: 28522436692.720001 | G200: 12129778679.040001 | H200: 11844683700.32 | I200: 16392658013.68 | J200: =IF(G200=H200,"是","否") -> 否 | K200: =G200/C200 -> 3990058776.0000005 | L200: =I200/K200 -> 4.1083750726382782
A201: 601128.SH | B201: 常熟银行 | C201: 6.19 | D201: 银行-银行-农商行 | E201: 367302864000 | F201: 28391337000 | G201: 18662726658.060001 | H201: 17998775428.970001 | I201: 9728610341.9400005 | J201: =IF(G201=H201,"是","否") -> 否 | K201: =G201/C201 -> 3014980074 | L201: =I201/K201 -> 3.2267577573184321
A202: 300919.SZ | B202: 中伟股份 | C202: 28 | D202: 电力设备-电池-电池化学品 | E202: 68164968040.449997 | F202: 28296585891.73 | G202: 26238514792 | H202: 25474898428 | I202: 2058071099.73 | J202: =IF(G202=H202,"是","否") -> 否 | K202: =G202/C202 -> 937089814 | L202: =I202/K202 -> 2.1962367629897215
A203: 601615.SH | B203: 明阳智能 | C203: 8.36 | D203: 电力设备-风电设备-风电整机 | E203: 85121270322.699997 | F203: 28100107032.669998 | G203: 18990527562.16 | H203: 18927858494.16 | I203: 9109579470.5100002 | J203: =IF(G203=H203,"是","否") -> 否 | K203: =G203/C203 -> 2271594206 | L203: =I203/K203 -> 4.0102142567755781
A204: 002092.SZ | B204: ST中泰 | C204: 3.37 | D204: 基础化工-化学原料-氯碱 | E204: 72309199194.320007 | F204: 27934877358.16 | G204: 8728365772.2900009 | H204: 8679855464.7900009 | I204: 19206511585.869999 | J204: =IF(G204=H204,"是","否") -> 否 | K204: =G204/C204 -> 2590019517 | L204: =I204/K204 -> 7.4155856586427413
A205: 002271.SZ | B205: 东方雨虹 | C205: 10.4 | D205: 建筑材料-建筑材料-其他建材 | E205: 47291791536.93 | F205: 27687682250.029999 | G205: 25337681491.200001 | H205: 20095121508.799999 | I205: 2350000758.8299999 | J205: =IF(G205=H205,"是","否") -> 否 | K205: =G205/C205 -> 2436315528 | L205: =I205/K205 -> 0.96457159666799941
A206: 601198.SH | B206: 东兴证券 | C206: 8.17 | D206: 非银金融-证券-证券Ⅲ | E206: 99597745525.610001 | F206: 27584696803.27 | G206: 26409079898.400002 | H206: 26409079898.400002 | I206: 1175616904.8699999 | J206: =IF(G206=H206,"是","否") -> 是 | K206: =G206/C206 -> 3232445520 | L206: =I206/K206 -> 0.36369272044838669
A207: 002812.SZ | B207: 恩捷股份 | C207: 24.600000000000001 | D207: 电力设备-电池-电池化学品 | E207: 49061197669 | F207: 27522071180.740002 | G207: 24038717199.599998 | H207: 20246204620.799999 | I207: 3483353981.1399999 | J207: =IF(G207=H207,"是","否") -> 否 | K207: =G207/C207 -> 977183625.99999988 | L207: =I207/K207 -> 3.5646872178965472
A208: 600282.SH | B208: 南钢股份 | C208: 4.11 | D208: 钢铁-钢铁-普钢 | E208: 69457553110.5 | F208: 27395848924.869999 | G208: 25338524055.209999 | H208: 25338524055.209999 | I208: 2057324869.6600001 | J208: =IF(G208=H208,"是","否") -> 是 | K208: =G208/C208 -> 6165091010.999999 | L208: =I208/K208 -> 0.33370551480736288
A209: 600583.SH | B209: 海油工程 | C209: 4.85 | D209: 石油石化-油气开采及服务-油服工程 | E209: 46219965800 | F209: 27351549600 | G209: 21443570780 | H209: 21443570780 | I209: 5907978820 | J209: =IF(G209=H209,"是","否") -> 是 | K209: =G209/C209 -> 4421354800 | L209: =I209/K209 -> 1.3362372139869887
A210: 600548.SH | B210: 深高速 | C210: 9.47 | D210: 交通运输-公路铁路运输-高速公路 | E210: 65869267280.470001 | F210: 27249149869.27 | G210: 18153957792.220001 | H210: 13573069987.219999 | I210: 9095192077.0499992 | J210: =IF(G210=H210,"是","否") -> 否 | K210: =G210/C210 -> 1916996598.9672651 | L210: =I210/K210 -> 4.7445008937156228
A211: 600623.SH | B211: 华谊集团 | C211: 5.73 | D211: 基础化工-化学原料-煤化工 | E211: 62422682707.43 | F211: 27006575079.560001 | G211: 11560423477.379999 | H211: 10670387451.99 | I211: 15446151602.18 | J211: =IF(G211=H211,"是","否") -> 否 | K211: =G211/C211 -> 2017525912.2827222 | L211: =I211/K211 -> 7.655986725198245
A212: 601333.SH | B212: 广深铁路 | C212: 3.19 | D212: 交通运输-公路铁路运输-铁路运输 | E212: 37513156357 | F212: 26872876253 | G212: 20612750609.849998 | H212: 18030636030 | I212: 6260125643.1499996 | J212: =IF(G212=H212,"是","否") -> 否 | K212: =G212/C212 -> 6461677307.1630087 | L212: =I212/K212 -> 0.96880815082028604
A213: 002602.SZ | B213: 世纪华通 | C213: 3.22 | D213: 传媒-游戏-游戏Ⅲ | E213: 38580835199.239998 | F213: 26799634251.209999 | G213: 23997233436.959999 | H213: 22156459836.560001 | I213: 2802400814.25 | J213: =IF(G213=H213,"是","否") -> 否 | K213: =G213/C213 -> 7452556967.999999 | L213: =I213/K213 -> 0.37603212243569933
A214: 600782.SH | B214: 新钢股份 | C214: 2.61 | D214: 钢铁-钢铁-普钢 | E214: 52370555437.68 | F214: 26761699363.639999 | G214: 8210152108.8900003 | H214: 8210152108.8900003 | I214: 18551547254.75 | J214: =IF(G214=H214,"是","否") -> 是 | K214: =G214/C214 -> 3145652149.0000005 | L214: =I214/K214 -> 5.8975202520874781
A215: 600339.SH | B215: 中油工程 | C215: 2.87 | D215: 石油石化-油气开采及服务-油服工程 | E215: 109567560998.53 | F215: 26494819132.77 | G215: 16023633241.77 | H215: 16023633241.77 | I215: 10471185891 | J215: =IF(G215=H215,"是","否") -> 是 | K215: =G215/C215 -> 5583147471 | L215: =I215/K215 -> 1.8754987120418121
A216: 600528.SH | B216: 中铁工业 | C216: 6.77 | D216: 机械设备-轨交设备-轨交设备Ⅲ | E216: 62741180716.660004 | F216: 26478782270.32 | G216: 15039904250.76 | H216: 15039904250.76 | I216: 11438878019.559999 | J216: =IF(G216=H216,"是","否") -> 是 | K216: =G216/C216 -> 2221551588 | L216: =I216/K216 -> 5.1490490166190996
A217: 600956.SH | B217: 新天绿能 | C217: 6.68 | D217: 公用事业-电力-新能源发电 | E217: 81774294311.910004 | F217: 26436523515 | G217: 20960972117.110001 | H217: 14464894872.32 | I217: 5475551397.8900003 | J217: =IF(G217=H217,"是","否") -> 否 | K217: =G217/C217 -> 3137870077.4116769 | L217: =I217/K217 -> 1.7449898379497593
A218: 002146.SZ | B218: 荣盛发展 | C218: 1.25 | D218: 房地产-房地产-住宅开发 | E218: 190219365273.60001 | F218: 26368938127.490002 | G218: 5435204813.75 | H218: 4875339188.75 | I218: 20933733313.740002 | J218: =IF(G218=H218,"是","否") -> 否 | K218: =G218/C218 -> 4348163851 | L218: =I218/K218 -> 4.8143846531739181
A219: 002080.SZ | B219: 中材科技 | C219: 9.51 | D219: 建筑材料-建筑材料-玻璃玻纤 | E219: 58188804915.660004 | F219: 26230299084.740002 | G219: 15958955283.84 | H219: 15958955283.84 | I219: 10271343800.9 | J219: =IF(G219=H219,"是","否") -> 是 | K219: =G219/C219 -> 1678123584 | L219: =I219/K219 -> 6.1207314519810714
A220: 600266.SH | B220: 城建发展 | C220: 4.47 | D220: 房地产-房地产-住宅开发 | E220: 134539502708.57001 | F220: 26080673922.209999 | G220: 9278573476.2900009 | H220: 9278573476.2900009 | I220: 16802100445.92 | J220: =IF(G220=H220,"是","否") -> 是 | K220: =G220/C220 -> 2075743507.0000002 | L220: =I220/K220 -> 8.0944974122566276
A221: 600717.SH | B221: 天津港 | C221: 4.19 | D221: 交通运输-港口航运-港口 | E221: 35711083445 | F221: 25872734824.82 | G221: 12125864349.219999 | H221: 12125864349.219999 | I221: 13746870475.6 | J221: =IF(G221=H221,"是","否") -> 是 | K221: =G221/C221 -> 2894001037.9999995 | L221: =I221/K221 -> 4.7501263113230445
A222: 600369.SH | B222: 西南证券 | C222: 3.61 | D222: 非银金融-证券-证券Ⅲ | E222: 79593457090.850006 | F222: 25528765043.869999 | G222: 23988843937.639999 | H222: 22797543937.639999 | I222: 1539921106.23 | J222: =IF(G222=H222,"是","否") -> 否 | K222: =G222/C222 -> 6645109124 | L222: =I222/K222 -> 0.23173751965461328
A223: 601001.SH | B223: 晋控煤业 | C223: 14.37 | D223: 煤炭-煤炭开采加工-煤炭开采 | E223: 38249173511.699997 | F223: 25448449078.43 | G223: 24051069000 | H223: 24051069000 | I223: 1397380078.4300001 | J223: =IF(G223=H223,"是","否") -> 是 | K223: =G223/C223 -> 1673700000 | L223: =I223/K223 -> 0.83490474901714773
A224: 600502.SH | B224: 安徽建工 | C224: 4.12 | D224: 建筑装饰-建筑装饰-基础建设 | E224: 176081559699.29001 | F224: 25183462798.5 | G224: 7072119824.5600004 | H224: 7072119824.5600004 | I224: 18111342973.939999 | J224: =IF(G224=H224,"是","否") -> 是 | K224: =G224/C224 -> 1716533938 | L224: =I224/K224 -> 10.551112665469477
A225: 600657.SH | B225: 信达地产 | C225: 3.16 | D225: 房地产-房地产-住宅开发 | E225: 79288107743.729996 | F225: 25080162063.970001 | G225: 9011936360.2000008 | H225: 9011936360.2000008 | I225: 16068225703.77 | J225: =IF(G225=H225,"是","否") -> 是 | K225: =G225/C225 -> 2851878595 | L225: =I225/K225 -> 5.634260074023242
A226: 600688.SH | B226: 上海石化 | C226: 2.52 | D226: 石油石化-石油加工贸易-石油加工 | E226: 42941617000 | F226: 24884166000 | G226: 21653986212.290001 | H226: 18468610020 | I226: 3230179787.7199998 | J226: =IF(G226=H226,"是","否") -> 否 | K226: =G226/C226 -> 8592851671.5436516 | L226: =I226/K226 -> 0.37591476161716619
A227: 600295.SH | B227: 鄂尔多斯 | C227: 8.38 | D227: 钢铁-钢铁-冶钢原料 | E227: 50137825472.190002 | F227: 24813909950.009998 | G227: 21318153140.040001 | H227: 16555329008.52 | I227: 3495756809.9699998 | J227: =IF(G227=H227,"是","否") -> 否 | K227: =G227/C227 -> 2543932355.6133652 | L227: =I227/K227 -> 1.3741547813786665
A228: 000937.SZ | B228: 冀中能源 | C228: 5.63 | D228: 煤炭-煤炭开采加工-煤炭开采 | E228: 52704777997.330002 | F228: 24711177285.400002 | G228: 19893868765.5 | H228: 16364157110.459999 | I228: 4817308519.8999996 | J228: =IF(G228=H228,"是","否") -> 否 | K228: =G228/C228 -> 3533546850 | L228: =I228/K228 -> 1.3633068201430525
A229: 600839.SH | B229: 四川长虹 | C229: 5.05 | D229: 家用电器-黑色家电-彩电 | E229: 95132503975.100006 | F229: 24318894649.279999 | G229: 23312033321.099998 | H229: 23305541086.549999 | I229: 1006861328.1799999 | J229: =IF(G229=H229,"是","否") -> 否 | K229: =G229/C229 -> 4616244222 | L229: =I229/K229 -> 0.21811266470294646
A230: 601228.SH | B230: 广州港 | C230: 3.03 | D230: 交通运输-港口航运-港口 | E230: 49687312288.660004 | F230: 24140006658.57 | G230: 22859929993.529999 | H230: 22859929993.529999 | I230: 1280076665.04 | J230: =IF(G230=H230,"是","否") -> 是 | K230: =G230/C230 -> 7544531351 | L230: =I230/K230 -> 0.1696694738859201
A231: 601162.SH | B231: 天风证券 | C231: 2.74 | D231: 非银金融-证券-证券Ⅲ | E231: 94522080082.259995 | F231: 24125734426.34 | G231: 23744175451.360001 | H231: 23744175451.360001 | I231: 381558974.98000002 | J231: =IF(G231=H231,"是","否") -> 是 | K231: =G231/C231 -> 8665757464 | L231: =I231/K231 -> 4.403065474254312e-02
A232: 600879.SH | B232: 航天电子 | C232: 7.17 | D232: 国防军工-军工装备-航天装备 | E232: 49150854499.82 | F232: 23907250233.599998 | G232: 23655976224.779999 | H232: 23153171177.189999 | I232: 251274008.81999999 | J232: =IF(G232=H232,"是","否") -> 否 | K232: =G232/C232 -> 3299299334 | L232: =I232/K232 -> 7.6159809517907781e-02
A233: 600060.SH | B233: 海信视像 | C233: 16.74 | D233: 家用电器-黑色家电-彩电 | E233: 41620956817 | F233: 23534669757.490002 | G233: 21852413660.700001 | H233: 21679880055.119999 | I233: 1682256096.79 | J233: =IF(G233=H233,"是","否") -> 否 | K233: =G233/C233 -> 1305401055.0000002 | L233: =I233/K233 -> 1.288689089338908
A234: 000537.SZ | B234: 中绿电 | C234: 7.97 | D234: 公用事业-电力-新能源发电 | E234: 80240818270.559998 | F234: 23383135597.189999 | G234: 16470820745.440001 | H234: 14844290138.4 | I234: 6912314851.75 | J234: =IF(G234=H234,"是","否") -> 否 | K234: =G234/C234 -> 2066602352.0000002 | L234: =I234/K234 -> 3.3447725659754788
A235: 000591.SZ | B235: 太阳能 | C235: 4.09 | D235: 公用事业-电力-新能源发电 | E235: 48038987854.410004 | F235: 23296954992.509998 | G235: 16006383528.450001 | H235: 14717521161.879999 | I235: 7290571464.0600004 | J235: =IF(G235=H235,"是","否") -> 否 | K235: =G235/C235 -> 3913541205.0000005 | L235: =I235/K235 -> 1.8629090846789742
A236: 600959.SH | B236: 江苏有线 | C236: 2.77 | D236: 传媒-文化传媒-电视广播 | E236: 37156524996.160004 | F236: 23202826646.880001 | G236: 13851987990.219999 | H236: 13851987990.219999 | I236: 9350838656.6599998 | J236: =IF(G236=H236,"是","否") -> 是 | K236: =G236/C236 -> 5000717686 | L236: =I236/K236 -> 1.869899331217715
A237: 600380.SH | B237: 健康元 | C237: 9.56 | D237: 医药生物-化学制药-化学制剂 | E237: 36496077306.199997 | F237: 23113627134.830002 | G237: 17917356015.200001 | H237: 17917356015.200001 | I237: 5196271119.6300001 | J237: =IF(G237=H237,"是","否") -> 是 | K237: =G237/C237 -> 1874200420 | L237: =I237/K237 -> 2.772526920909558
A238: 600884.SH | B238: 杉杉股份 | C238: 7.03 | D238: 电力设备-电池-电池化学品 | E238: 50312352232.699997 | F238: 22981922772.09 | G238: 15844506926.040001 | H238: 12353372538.76 | I238: 7137415846.0500002 | J238: =IF(G238=H238,"是","否") -> 否 | K238: =G238/C238 -> 2253841668 | L238: =I238/K238 -> 3.1667778386507317
A239: 002926.SZ | B239: 华西证券 | C239: 6.58 | D239: 非银金融-证券-证券Ⅲ | E239: 84191134553.539993 | F239: 22869743755.610001 | G239: 17272500000 | H239: 17272500000 | I239: 5597243755.6099997 | J239: =IF(G239=H239,"是","否") -> 是 | K239: =G239/C239 -> 2625000000 | L239: =I239/K239 -> 2.132283335470476
A240: 600908.SH | B240: 无锡银行 | C240: 4.9000000000000004 | D240: 银行-银行-农商行 | E240: 250127228000 | F240: 22848094000 | G240: 10753940305.5 | H240: 9360196942.6000004 | I240: 12094153694.5 | J240: =IF(G240=H240,"是","否") -> 否 | K240: =G240/C240 -> 2194681695 | L240: =I240/K240 -> 5.5106641304993431
A241: 601717.SH | B241: 郑煤机 | C241: 11.31 | D241: 机械设备-专用设备-能源及重型设备 | E241: 49466334815.610001 | F241: 22577957564.419998 | G241: 19382329289.59 | H241: 17441894406.299999 | I241: 3195628274.8299999 | J241: =IF(G241=H241,"是","否") -> 否 | K241: =G241/C241 -> 1713733801.0247569 | L241: =I241/K241 -> 1.8647168381221859
A242: 000750.SZ | B242: 国海证券 | C242: 3.02 | D242: 非银金融-证券-证券Ⅲ | E242: 62312770352.800003 | F242: 22566374174.93 | G242: 19286246920.540001 | H242: 17504536010.540001 | I242: 3280127254.3899999 | J242: =IF(G242=H242,"是","否") -> 否 | K242: =G242/C242 -> 6386174477 | L242: =I242/K242 -> 0.51362944532810328
A243: 600340.SH | B243: 华夏幸福 | C243: 1.07 | D243: 房地产-房地产-产业地产 | E243: 348042168016.75 | F243: 22140837683.34 | G243: 4187680765.9400001 | H243: 4165889916.3400002 | I243: 17953156917.400002 | J243: =IF(G243=H243,"是","否") -> 否 | K243: =G243/C243 -> 3913720342 | L243: =I243/K243 -> 4.587235507027958
A244: 600141.SH | B244: 兴发集团 | C244: 17.77 | D244: 基础化工-农化制品-磷肥及磷化工 | E244: 45370032975.5 | F244: 22045701268.790001 | G244: 19604833922.139999 | H244: 19604833922.139999 | I244: 2440867346.6500001 | J244: =IF(G244=H244,"是","否") -> 是 | K244: =G244/C244 -> 1103254582 | L244: =I244/K244 -> 2.2124243909553054
A245: 000413.SZ | B245: ST旭电 | C245: -- | D245: 电子-光学光电子-面板 | E245: 56646843378.870003 | F245: 21645003612.080002 | G245: 2027879480.54 | H245: 1860859557.72 | I245: 19617124131.549999 | J245: =IF(G245=H245,"是","否") -> 否 | K245: =G245/C245 -> #VALUE! | L245: =I245/K245 -> #VALUE!
A246: 600909.SH | B246: 华安证券 | C246: 4.38 | D246: 非银金融-证券-证券Ⅲ | E246: 84402881256.110001 | F246: 21578397024.049999 | G246: 20575778354.580002 | H246: 20575778354.580002 | I246: 1002618669.47 | J246: =IF(G246=H246,"是","否") -> 是 | K246: =G246/C246 -> 4697666291.000001 | L246: =I246/K246 -> 0.21342909593022
A247: 002091.SZ | B247: 江苏国泰 | C247: 6.63 | D247: 商贸零售-贸易-贸易Ⅲ | E247: 42173566474.160004 | F247: 21445238019.709999 | G247: 10791068852.85 | H247: 10589644646.1 | I247: 10654169166.860001 | J247: =IF(G247=H247,"是","否") -> 否 | K247: =G247/C247 -> 1627612195 | L247: =I247/K247 -> 6.5458892478131139
A248: 600500.SH | B248: 中化国际 | C248: 3.71 | D248: 基础化工-化学制品-其他化学制品 | E248: 54668850678.25 | F248: 21440596822.220001 | G248: 13313422530.030001 | H248: 13306741413.629999 | I248: 8127174292.1899996 | J248: =IF(G248=H248,"是","否") -> 否 | K248: =G248/C248 -> 3588523593 | L248: =I248/K248 -> 2.2647682484360359
A249: 600707.SH | B249: 彩虹股份 | C249: 5.9000000000000004 | D249: 电子-光学光电子-面板 | E249: 40492421985.339996 | F249: 21366589289.830002 | G249: 21171499418.799999 | H249: 21167251418.799999 | I249: 195089871.03 | J249: =IF(G249=H249,"是","否") -> 否 | K249: =G249/C249 -> 3588389731.9999995 | L249: =I249/K249 -> 5.4366968361952726e-02
A250: 000028.SZ | B250: 国药一致 | C250: 24.47 | D250: 医药生物-医药商业-医药流通 | E250: 51405241387.830002 | F250: 21348942792.34 | G250: 12687546913.9 | H250: 11697974332.639999 | I250: 8661395878.4400005 | J250: =IF(G250=H250,"是","否") -> 否 | K250: =G250/C250 -> 518493948.25909275 | L250: =I250/K250 -> 16.704912193327818
A251: 601003.SH | B251: 柳钢股份 | C251: 2.51 | D251: 钢铁-钢铁-普钢 | E251: 66638093939.660004 | F251: 21340594094.049999 | G251: 6432610932 | H251: 6432610932 | I251: 14907983162.049999 | J251: =IF(G251=H251,"是","否") -> 是 | K251: =G251/C251 -> 2562793200 | L251: =I251/K251 -> 5.8170839387469888
A252: 000543.SZ | B252: 皖能电力 | C252: 7.55 | D252: 公用事业-电力-火电 | E252: 64007588829.800003 | F252: 21325502943.43 | G252: 17114818149.049999 | H252: 17114818149.049999 | I252: 4210684794.3800001 | J252: =IF(G252=H252,"是","否") -> 是 | K252: =G252/C252 -> 2266863331 | L252: =I252/K252 -> 1.8574938933449094
A253: 600649.SH | B253: 城投控股 | C253: 3.2999999999999998 | D253: 房地产-房地产-住宅开发 | E253: 81023076721.960007 | F253: 21322218013.490002 | G253: 8347599592.1999998 | H253: 8347599592.1999998 | I253: 12974618421.290001 | J253: =IF(G253=H253,"是","否") -> 是 | K253: =G253/C253 -> 2529575634 | L253: =I253/K253 -> 5.1291680101983461
A254: 000009.SZ | B254: 中国宝安 | C254: 7.41 | D254: 电力设备-电池-电池化学品 | E254: 51581219175.93 | F254: 21233635498.389999 | G254: 19111975480.650002 | H254: 18906098700.84 | I254: 2121660017.74 | J254: =IF(G254=H254,"是","否") -> 否 | K254: =G254/C254 -> 2579213965 | L254: =I254/K254 -> 0.82259946112690963
A255: 000785.SZ | B255: 居然之家 | C255: 2.29 | D255: 商贸零售-零售-商业物业经营 | E255: 52530006969.07 | F255: 21172300731.130001 | G255: 14397890145.17 | H255: 13645735273.559999 | I255: 6774410585.96 | J255: =IF(G255=H255,"是","否") -> 否 | K255: =G255/C255 -> 6287288273 | L255: =I255/K255 -> 1.0774773307360326
A256: 600777.SH | B256: ST新潮 | C256: 1.77 | D256: 石油石化-油气开采及服务-油气开采 | E256: 35430982072.5 | F256: 21145539282.060001 | G256: 12036877610.25 | H256: 11268089732.07 | I256: 9108661671.8099995 | J256: =IF(G256=H256,"是","否") -> 否 | K256: =G256/C256 -> 6800495825 | L256: =I256/K256 -> 1.3394114056102666
A257: 600155.SH | B257: 华创云信 | C257: 6.14 | D257: 非银金融-证券-证券Ⅲ | E257: 58183741952.980003 | F257: 21051579469.02 | G257: 13885141161.879999 | H257: 13885141161.879999 | I257: 7166438307.1400003 | J257: =IF(G257=H257,"是","否") -> 是 | K257: =G257/C257 -> 2261423642 | L257: =I257/K257 -> 3.1689941566198594
A258: 000875.SZ | B258: 吉电股份 | C258: 4.48 | D258: 公用事业-电力-电能综合服务 | E258: 79730472286.460007 | F258: 21041543886.84 | G258: 12500132619.52 | H258: 12499049019.52 | I258: 8541411267.3199997 | J258: =IF(G258=H258,"是","否") -> 否 | K258: =G258/C258 -> 2790208174 | L258: =I258/K258 -> 3.0612093201186354
A259: 000553.SZ | B259: 安道麦A | C259: 4.34 | D259: 基础化工-农化制品-农药 | E259: 52854481000 | F259: 20982486000 | G259: 9697731597.1399994 | H259: 9448472780.7399998 | I259: 11284754402.860001 | J259: =IF(G259=H259,"是","否") -> 否 | K259: =G259/C259 -> 2234500368.0046082 | L259: =I259/K259 -> 5.0502360905571031
A260: 000488.SZ | B260: 晨鸣纸业 | C260: 3.31 | D260: 轻工制造-造纸-造纸Ⅲ | E260: 77501281219.729996 | F260: 20691235012.279999 | G260: 7233517579.8800001 | H260: 5570183426.3199997 | I260: 13457717432.4 | J260: =IF(G260=H260,"是","否") -> 否 | K260: =G260/C260 -> 2185352743.166163 | L260: =I260/K260 -> 6.1581442513039386
A261: 600859.SH | B261: 王府井 | C261: 12.02 | D261: 商贸零售-零售-百货零售 | E261: 41055032962.93 | F261: 20472493924.27 | G261: 13643294401.02 | H261: 13143503702.52 | I261: 6829199523.25 | J261: =IF(G261=H261,"是","否") -> 否 | K261: =G261/C261 -> 1135049451 | L261: =I261/K261 -> 6.0166537389479782
A262: 002110.SZ | B262: 三钢闽光 | C262: 2.61 | D262: 钢铁-钢铁-普钢 | E262: 52617696552.040001 | F262: 20331257054.68 | G262: 6398613981.1800003 | H262: 6339888952.4700003 | I262: 13932643073.5 | J262: =IF(G262=H262,"是","否") -> 否 | K262: =G262/C262 -> 2451576238 | L262: =I262/K262 -> 5.6831367744314054
A263: 600143.SH | B263: 金发科技 | C263: 7.27 | D263: 基础化工-塑料制品-改性塑料 | E263: 61863404675.25 | F263: 20325340022.009998 | G263: 19168174307.189999 | H263: 18881829864.82 | I263: 1157165714.8199999 | J263: =IF(G263=H263,"是","否") -> 否 | K263: =G263/C263 -> 2636612697 | L263: =I263/K263 -> 0.43888346443019499
A264: 000581.SZ | B264: 威孚高科 | C264: 16.24 | D264: 汽车-汽车零部件-底盘与发动机系统 | E264: 27864965288.970001 | F264: 20198039404.990002 | G264: 15173096612.92 | H264: 13378513916.32 | I264: 5024942792.0699997 | J264: =IF(G264=H264,"是","否") -> 否 | K264: =G264/C264 -> 934303978.62807894 | L264: =I264/K264 -> 5.3782739954169596
A265: 600126.SH | B265: 杭钢股份 | C265: 3.41 | D265: 钢铁-钢铁-普钢 | E265: 32056762167.119999 | F265: 20171661966.82 | G265: 11516214773.030001 | H265: 11516214773.030001 | I265: 8655447193.7900009 | J265: =IF(G265=H265,"是","否") -> 是 | K265: =G265/C265 -> 3377189083 | L265: =I265/K265 -> 2.5629145958571136
A266: 601326.SH | B266: 秦港股份 | C266: 3.15 | D266: 交通运输-港口航运-港口 | E266: 28697357170.080002 | F266: 19864022059.799999 | G266: 16483394291.93 | H266: 14986310850 | I266: 3380627767.8699999 | J266: =IF(G266=H266,"是","否") -> 否 | K266: =G266/C266 -> 5232823584.7396832 | L266: =I266/K266 -> 0.64604275552663715
A267: 600269.SH | B267: 赣粤高速 | C267: 4.14 | D267: 交通运输-公路铁路运输-高速公路 | E267: 35515320015.029999 | F267: 19773868353.560001 | G267: 9668585037.9599991 | H267: 9668585037.9599991 | I267: 10105283315.6 | J267: =IF(G267=H267,"是","否") -> 是 | K267: =G267/C267 -> 2335407014 | L267: =I267/K267 -> 4.3269902226987149
A268: 600827.SH | B268: 百联股份 | C268: 7.72 | D268: 商贸零售-零售-百货零售 | E268: 54793837035.349998 | F268: 19715730696.990002 | G268: 12920855500.6 | H268: 12386353382.4 | I268: 6794875196.3900003 | J268: =IF(G268=H268,"是","否") -> 否 | K268: =G268/C268 -> 1673685945.6735752 | L268: =I268/K268 -> 4.0598268832659654
A269: 000582.SZ | B269: 北部湾港 | C269: 6.99 | D269: 交通运输-港口航运-港口 | E269: 35637884068.18 | F269: 19642262130.959999 | G269: 15920114769.389999 | H269: 9866069072.9699993 | I269: 3722147361.5700002 | J269: =IF(G269=H269,"是","否") -> 否 | K269: =G269/C269 -> 2277555761 | L269: =I269/K269 -> 1.6342727696536077
A270: 603077.SH | B270: 和邦生物 | C270: 1.68 | D270: 基础化工-农化制品-磷肥及磷化工 | E270: 26222909702.240002 | F270: 19617564185.27 | G270: 14836500383.040001 | H270: 14836500383.040001 | I270: 4781063802.2299995 | J270: =IF(G270=H270,"是","否") -> 是 | K270: =G270/C270 -> 8831250228 | L270: =I270/K270 -> 0.54138017594285293
A271: 600064.SH | B271: 南京高科 | C271: 5.72 | D271: 房地产-房地产-住宅开发 | E271: 38535269581.389999 | F271: 19592444724.360001 | G271: 9897542763.6800003 | H271: 9897542763.6800003 | I271: 9694901960.6800003 | J271: =IF(G271=H271,"是","否") -> 是 | K271: =G271/C271 -> 1730339644.0000002 | L271: =I271/K271 -> 5.6028895796830041
A272: 600100.SH | B272: 同方股份 | C272: 5.0999999999999996 | D272: 计算机-计算机设备-其他计算机设备 | E272: 49736208820.260002 | F272: 19387578356.080002 | G272: 17086518336.299999 | H272: 17086518336.299999 | I272: 2301060019.7800002 | J272: =IF(G272=H272,"是","否") -> 是 | K272: =G272/C272 -> 3350297713 | L272: =I272/K272 -> 0.68682255038150997
A273: 601512.SH | B273: 中新集团 | C273: 6.59 | D273: 房地产-房地产-产业地产 | E273: 35454672495.57 | F273: 19253403115.150002 | G273: 9877685100 | H273: 9877685100 | I273: 9375718015.1499996 | J273: =IF(G273=H273,"是","否") -> 是 | K273: =G273/C273 -> 1498890000 | L273: =I273/K273 -> 6.2551074562843167
A274: 601860.SH | B274: 紫金银行 | C274: 2.42 | D274: 银行-银行-农商行 | E274: 269304373000 | F274: 19162882000 | G274: 8859573468.2399998 | H274: 8568303294.3199997 | I274: 10303308531.76 | J274: =IF(G274=H274,"是","否") -> 否 | K274: =G274/C274 -> 3660980772 | L274: =I274/K274 -> 2.814357455947873
A275: 601005.SH | B275: 重庆钢铁 | C275: 1.04 | D275: 钢铁-钢铁-普钢 | E275: 36496090054 | F275: 19103479603.32 | G275: 9013275989.7099991 | H275: 8715694069.6800003 | I275: 10090203613.610001 | J275: =IF(G275=H275,"是","否") -> 否 | K275: =G275/C275 -> 8666611528.5673065 | L275: =I275/K275 -> 1.1642616702444988
A276: 600320.SH | B276: 振华重工 | C276: 3.34 | D276: 机械设备-专用设备-能源及重型设备 | E276: 84507179920 | F276: 19026501554 | G276: 13776690245.98 | H276: 11095472187.74 | I276: 5249811308.0200005 | J276: =IF(G276=H276,"是","否") -> 否 | K276: =G276/C276 -> 4124757558.6766467 | L276: =I276/K276 -> 1.2727563337575425
A277: 600682.SH | B277: 南京新百 | C277: 5.25 | D277: 综合-综合-综合Ⅲ | E277: 26020091860.950001 | F277: 18922262391.27 | G277: 7067194160.25 | H277: 6116566443.75 | I277: 11855068231.02 | J277: =IF(G277=H277,"是","否") -> 否 | K277: =G277/C277 -> 1346132221 | L277: =I277/K277 -> 8.8067635898450138
A278: 002010.SZ | B278: 传化智联 | C278: 3.59 | D278: 交通运输-物流-物流Ⅲ | E278: 41383917865.559998 | F278: 18882779261.77 | G278: 10008814123.719999 | H278: 9979426735.5400009 | I278: 8873965138.0499992 | J278: =IF(G278=H278,"是","否") -> 否 | K278: =G278/C278 -> 2787970508 | L278: =I278/K278 -> 3.1829479948178845
A279: 001213.SZ | B279: 中铁特货 | C279: 3.72 | D279: 交通运输-公路铁路运输-铁路运输 | E279: 20983540654.279999 | F279: 18848010935.349998 | G279: 16533333331.68 | H279: 16533333331.68 | I279: 2314677603.6700001 | J279: =IF(G279=H279,"是","否") -> 是 | K279: =G279/C279 -> 4444444444 | L279: =I279/K279 -> 0.52080246087783022
A280: 000686.SZ | B280: 东北证券 | C280: 5.95 | D280: 非银金融-证券-证券Ⅲ | E280: 84053018367.210007 | F280: 18827591100.84 | G280: 13925694844.25 | H280: 13925694844.25 | I280: 4901896256.5900002 | J280: =IF(G280=H280,"是","否") -> 是 | K280: =G280/C280 -> 2340452915 | L280: =I280/K280 -> 2.0944220775276738
A281: 600032.SH | B281: 浙江新能 | C281: 6.76 | D281: 公用事业-电力-新能源发电 | E281: 55290350508.550003 | F281: 18818820512.279999 | G281: 16255605190.24 | H281: 16255605190.24 | I281: 2563215322.04 | J281: =IF(G281=H281,"是","否") -> 是 | K281: =G281/C281 -> 2404675324 | L281: =I281/K281 -> 1.0659298976696281
A282: 600736.SH | B282: 苏州高新 | C282: 4.12 | D282: 房地产-房地产-住宅开发 | E282: 72944163663.869995 | F282: 18676495034.720001 | G282: 4743326776.8400002 | H282: 4743326776.8400002 | I282: 13933168257.879999 | J282: =IF(G282=H282,"是","否") -> 是 | K282: =G282/C282 -> 1151292907 | L282: =I282/K282 -> 12.102192390107376
A283: 000990.SZ | B283: 诚志股份 | C283: 6.39 | D283: 基础化工-化学原料-煤化工 | E283: 26278864050.419998 | F283: 18651674020.990002 | G283: 7765367848.6499996 | H283: 7765362097.6499996 | I283: 10886306172.34 | J283: =IF(G283=H283,"是","否") -> 否 | K283: =G283/C283 -> 1215237535 | L283: =I283/K283 -> 8.958171434640553
A284: 600516.SH | B284: 方大炭素 | C284: 3.98 | D284: 钢铁-钢铁-冶钢原料 | E284: 21528704862.189999 | F284: 18585151987.490002 | G284: 16023362064.639999 | H284: 16023362064.639999 | I284: 2561789922.8499999 | J284: =IF(G284=H284,"是","否") -> 是 | K284: =G284/C284 -> 4025970368 | L284: =I284/K284 -> 0.63631613963483591
A285: 000598.SZ | B285: 兴蓉环境 | C285: 6.07 | D285: 环保-环境治理-水务及水治理 | E285: 45412221863.330002 | F285: 18421132140.299999 | G285: 18118927668.470001 | H285: 18057756636.470001 | I285: 302204471.82999998 | J285: =IF(G285=H285,"是","否") -> 否 | K285: =G285/C285 -> 2984996321 | L285: =I285/K285 -> 0.1012411538680754
A286: 600373.SH | B286: 中文传媒 | C286: 13.48 | D286: 传媒-文化传媒-出版 | E286: 29957700074.599998 | F286: 18323096389.360001 | G286: 18266258932.119999 | H286: 18266258932.119999 | I286: 56837457.240000002 | J286: =IF(G286=H286,"是","否") -> 是 | K286: =G286/C286 -> 1355063718.9999998 | L286: =I286/K286 -> 4.1944490464215591e-02
A287: 002500.SZ | B287: 山西证券 | C287: 4.95 | D287: 非银金融-证券-证券Ⅲ | E287: 79001301782 | F287: 18095361609 | G287: 17769369157.650002 | H287: 17769369157.650002 | I287: 325992451.35000002 | J287: =IF(G287=H287,"是","否") -> 是 | K287: =G287/C287 -> 3589771547 | L287: =I287/K287 -> 9.0811475627866747e-02
A288: 600639.SH | B288: 浦东金桥 | C288: 9.79 | D288: 房地产-房地产-产业地产 | E288: 45403410447.449997 | F288: 17950430959.459999 | G288: 9817802989.7199993 | H288: 8323817322.3699999 | I288: 8132627969.7399998 | J288: =IF(G288=H288,"是","否") -> 否 | K288: =G288/C288 -> 1002839937.6629213 | L288: =I288/K288 -> 8.1095972191661687
A289: 601016.SH | B289: 节能风电 | C289: 2.69 | D289: 公用事业-电力-新能源发电 | E289: 42982338169.769997 | F289: 17907437004.459999 | G289: 17415640319.080002 | H289: 16031418184.969999 | I289: 491796685.38 | J289: =IF(G289=H289,"是","否") -> 否 | K289: =G289/C289 -> 6474215732.000001 | L289: =I289/K289 -> 7.5962356791604041e-02
A290: 000967.SZ | B290: 盈峰环境 | C290: 3.81 | D290: 环保-环保设备-环保设备Ⅲ | E290: 28898337407.560001 | F290: 17849000656.27 | G290: 12066047259.780001 | H290: 12060302922.780001 | I290: 5782953396.4899998 | J290: =IF(G290=H290,"是","否") -> 否 | K290: =G290/C290 -> 3166941538 | L290: =I290/K290 -> 1.8260373066886717
A291: 002839.SZ | B291: 张家港行 | C291: 3.66 | D291: 银行-银行-农商行 | E291: 216718169613.98001 | F291: 17739352794.099998 | G291: 7940937567.1800003 | H291: 7585129364.2200003 | I291: 9798415226.9200001 | J291: =IF(G291=H291,"是","否") -> 否 | K291: =G291/C291 -> 2169655073 | L291: =I291/K291 -> 4.5161165702581707
A292: 601528.SH | B292: 瑞丰银行 | C292: 4.49 | D292: 银行-银行-农商行 | E292: 210394834000 | F292: 17646440000 | G292: 8810104663.5499992 | H292: 7657435509.4300003 | I292: 8836335336.4500008 | J292: =IF(G292=H292,"是","否") -> 否 | K292: =G292/C292 -> 1962161394.9999998 | L292: =I292/K292 -> 4.5033682545007983
A293: 002807.SZ | B293: 江阴银行 | C293: 3.45 | D293: 银行-银行-农商行 | E293: 186747128000 | F293: 17536437000 | G293: 8491805122.0500002 | H293: 8481719868.1499996 | I293: 9044631877.9500008 | J293: =IF(G293=H293,"是","否") -> 否 | K293: =G293/C293 -> 2461392789 | L293: =I293/K293 -> 3.6745991612434192
A294: 300003.SZ | B294: 乐普医疗 | C294: 9.08 | D294: 医药生物-医疗器械-医疗耗材 | E294: 25296397719.599998 | F294: 17440655307.330002 | G294: 17075944211.68 | H294: 14674169240.719999 | I294: 364711095.64999998 | J294: =IF(G294=H294,"是","否") -> 否 | K294: =G294/C294 -> 1880610596 | L294: =I294/K294 -> 0.19393227732829385
A295: 002314.SZ | B295: 南山控股 | C295: 2.07 | D295: 房地产-房地产-住宅开发 | E295: 70685695287.070007 | F295: 17432120614.07 | G295: 5605109801.9099998 | H295: 2770273835.73 | I295: 11827010812.16 | J295: =IF(G295=H295,"是","否") -> 否 | K295: =G295/C295 -> 2707782513 | L295: =I295/K295 -> 4.3677846191039347
A296: 000563.SZ | B296: 陕国投A | C296: 2.81 | D296: 非银金融-多元金融-多元金融Ⅲ | E296: 25040395108.75 | F296: 17417206554.360001 | G296: 14370256705.98 | H296: 14370256705.98 | I296: 3046949848.3800001 | J296: =IF(G296=H296,"是","否") -> 是 | K296: =G296/C296 -> 5113970358 | L296: =I296/K296 -> 0.5958090554071217
A297: 000552.SZ | B297: 甘肃能化 | C297: 2.2999999999999998 | D297: 煤炭-煤炭开采加工-煤炭开采 | E297: 31037625898.389999 | F297: 17225604327.130001 | G297: 12309136637.4 | H297: 8569280165.5 | I297: 4916467689.7299995 | J297: =IF(G297=H297,"是","否") -> 否 | K297: =G297/C297 -> 5351798538 | L297: =I297/K297 -> 0.91865709346512769
A298: 600271.SH | B298: 航天信息 | C298: 8.28 | D298: 计算机-IT服务-IT服务Ⅲ | E298: 21377518101.389999 | F298: 17191459713.419998 | G298: 15341884802.639999 | H298: 15341884802.639999 | I298: 1849574910.78 | J298: =IF(G298=H298,"是","否") -> 是 | K298: =G298/C298 -> 1852884638 | L298: =I298/K298 -> 0.99821374350452141
A299: 601677.SH | B299: 明泰铝业 | C299: 12.35 | D299: 有色金属-工业金属-铝 | E299: 23264951863.689999 | F299: 17153182285.450001 | G299: 15359744733.450001 | H299: 14727276533.450001 | I299: 1793437552 | J299: =IF(G299=H299,"是","否") -> 否 | K299: =G299/C299 -> 1243704027 | L299: =I299/K299 -> 1.4420131422473879
A300: 600711.SH | B300: ST盛屯 | C300: 3.58 | D300: 有色金属-能源金属-镍 | E300: 39108605135.32 | F300: 17081612104.799999 | G300: 11179156022.4 | H300: 11179156022.4 | I300: 5902456082.3999996 | J300: =IF(G300=H300,"是","否") -> 是 | K300: =G300/C300 -> 3122669280 | L300: =I300/K300 -> 1.8901957117918038
A301: 000685.SZ | B301: 中山公用 | C301: 7.24 | D301: 环保-环境治理-水务及水治理 | E301: 30329389713.099998 | F301: 17052090142.4 | G301: 10679806181.24 | H301: 9078686045.6399994 | I301: 6372283961.1599998 | J301: =IF(G301=H301,"是","否") -> 否 | K301: =G301/C301 -> 1475111351 | L301: =I301/K301 -> 4.3198663998078066
A302: 000060.SZ | B302: 中金岭南 | C302: 4.14 | D302: 有色金属-工业金属-铅锌 | E302: 45236461013.57 | F302: 17015548907.77 | G302: 15473625303.42 | H302: 15472437640.92 | I302: 1541923604.3499999 | J302: =IF(G302=H302,"是","否") -> 否 | K302: =G302/C302 -> 3737590653.0000005 | L302: =I302/K302 -> 0.41254480426109941
A303: 000736.SZ | B303: 中交地产 | C303: 9.71 | D303: 房地产-房地产-住宅开发 | E303: 115910699604.57001 | F303: 17002398253.92 | G303: 7254325473.71 | H303: 6752661120.1899996 | I303: 9748072780.2099991 | J303: =IF(G303=H303,"是","否") -> 否 | K303: =G303/C303 -> 747098400.99999988 | L303: =I303/K303 -> 13.047910110852989
A304: 603225.SH | B304: 新凤鸣 | C304: 9.66 | D304: 基础化工-化学纤维-涤纶 | E304: 55206227484.860001 | F304: 16999861899.92 | G304: 14729222123.700001 | H304: 14729222123.700001 | I304: 2270639776.2199998 | J304: =IF(G304=H304,"是","否") -> 是 | K304: =G304/C304 -> 1524764195 | L304: =I304/K304 -> 1.4891743809737084
A305: 002203.SZ | B305: 海亮股份 | C305: 8.22 | D305: 有色金属-工业金属-铜 | E305: 47689042198.849998 | F305: 16939904893.32 | G305: 16426188682.02 | H305: 15886372215.360001 | I305: 513716211.30000001 | J305: =IF(G305=H305,"是","否") -> 否 | K305: =G305/C305 -> 1998319791 | L305: =I305/K305 -> 0.25707407473701993
A306: 601718.SH | B306: 际华集团 | C306: 2.38 | D306: 纺织服饰-服装家纺-服装 | E306: 25134791871.150002 | F306: 16856848463.290001 | G306: 10452077981.52 | H306: 10452077981.52 | I306: 6404770481.7700005 | J306: =IF(G306=H306,"是","否") -> 是 | K306: =G306/C306 -> 4391629404 | L306: =I306/K306 -> 1.4584041349063708
A307: 300677.SZ | B307: 英科医疗 | C307: 21.41 | D307: 医药生物-医疗器械-医疗耗材 | E307: 31215039197 | F307: 16841044825 | G307: 13871586530.200001 | H307: 10041835762.309999 | I307: 2969458294.8000002 | J307: =IF(G307=H307,"是","否") -> 否 | K307: =G307/C307 -> 647902220 | L307: =I307/K307 -> 4.5831889490979059
A308: 603323.SH | B308: 苏农银行 | C308: 4.25 | D308: 银行-银行-农商行 | E308: 217502290000 | F308: 16717651000 | G308: 7798910097.5 | H308: 6696703201.75 | I308: 8918740902.5 | J308: =IF(G308=H308,"是","否") -> 否 | K308: =G308/C308 -> 1835037670 | L308: =I308/K308 -> 4.8602494914995393
A309: 600120.SH | B309: 浙江东方 | C309: 3.58 | D309: 非银金融-多元金融-多元金融Ⅲ | E309: 41554082887.5 | F309: 16715175844.43 | G309: 12227065741.360001 | H309: 12227065741.360001 | I309: 4488110103.0699997 | J309: =IF(G309=H309,"是","否") -> 是 | K309: =G309/C309 -> 3415381492 | L309: =I309/K309 -> 1.3140874931783462
A310: 600675.SH | B310: 中华企业 | C310: 2.63 | D310: 房地产-房地产-住宅开发 | E310: 56203400871.68 | F310: 16672862131.059999 | G310: 15901335920.530001 | H310: 15901335920.530001 | I310: 771526210.52999997 | J310: =IF(G310=H310,"是","否") -> 是 | K310: =G310/C310 -> 6046135331.000001 | L310: =I310/K310 -> 0.12760650701518342
A311: 601107.SH | B311: 四川成渝 | C311: 4.42 | D311: 交通运输-公路铁路运输-高速公路 | E311: 60161427051.360001 | F311: 16624245254.780001 | G311: 12140365260.280001 | H311: 9559310800 | I311: 4483879994.5 | J311: =IF(G311=H311,"是","否") -> 否 | K311: =G311/C311 -> 2746688972.9140272 | L311: =I311/K311 -> 1.6324673229175073
A312: 600811.SH | B312: 东方集团 | C312: 1.34 | D312: 农林牧渔-农产品加工-粮油加工 | E312: 36242149740.269997 | F312: 16531990531.059999 | G312: 4902718212.8999996 | H312: 4902718212.8999996 | I312: 11629272318.16 | J312: =IF(G312=H312,"是","否") -> 是 | K312: =G312/C312 -> 3658744934.9999995 | L312: =I312/K312 -> 3.1784867556393355
A313: 000656.SZ | B313: *ST金科 | C313: 1.19 | D313: 房地产-房地产-住宅开发 | E313: 208254810661.42001 | F313: 16396041637.799999 | G313: 6354261821.04 | H313: 6320974450.8400002 | I313: 10041779816.76 | J313: =IF(G313=H313,"是","否") -> 否 | K313: =G313/C313 -> 5339715816 | L313: =I313/K313 -> 1.8805831925868919
A314: 002004.SZ | B314: 华邦健康 | C314: 3.99 | D314: 医药生物-化学制药-化学制剂 | E314: 31132974950.849998 | F314: 16272402250.639999 | G314: 7899877572.0900002 | H314: 7510093725.96 | I314: 8372524678.5500002 | J314: =IF(G314=H314,"是","否") -> 否 | K314: =G314/C314 -> 1979919191 | L314: =I314/K314 -> 4.228720402634857
A315: 002061.SZ | B315: 浙江交科 | C315: 3.37 | D315: 建筑装饰-建筑装饰-基础建设 | E315: 68380202435.099998 | F315: 16232469668.57 | G315: 8759094723 | H315: 8759094723 | I315: 7473374945.5699997 | J315: =IF(G315=H315,"是","否") -> 是 | K315: =G315/C315 -> 2599137900 | L315: =I315/K315 -> 2.8753283715996751
A316: 000761.SZ | B316: 本钢板材 | C316: 2.3999999999999999 | D316: 钢铁-钢铁-普钢 | E316: 45631488543.540001 | F316: 16097490511.620001 | G316: 9353005575.2000008 | H316: 8899730575.2000008 | I316: 6744484936.4200001 | J316: =IF(G316=H316,"是","否") -> 否 | K316: =G316/C316 -> 3897085656.333334 | L316: =I316/K316 -> 1.7306483693678187
A317: 600567.SH | B317: 山鹰国际 | C317: 1.3999999999999999 | D317: 轻工制造-造纸-造纸Ⅲ | E317: 54840941983.68 | F317: 16043568557.559999 | G317: 6258804220.1999998 | H317: 6258804220.1999998 | I317: 9784764337.3600006 | J317: =IF(G317=H317,"是","否") -> 是 | K317: =G317/C317 -> 4470574443 | L317: =I317/K317 -> 2.1887040383995684
A318: 600835.SH | B318: 上海机电 | C318: 10.9 | D318: 机械设备-专用设备-楼宇设备 | E318: 36784478087.120003 | F318: 16043531025.709999 | G318: 10136686560.24 | H318: 8790896870 | I318: 5906844465.4700003 | J318: =IF(G318=H318,"是","否") -> 否 | K318: =G318/C318 -> 929971244.05871558 | L318: =I318/K318 -> 6.3516420568989762
A319: 600123.SH | B319: 兰花科创 | C319: 7.95 | D319: 煤炭-煤炭开采加工-煤炭开采 | E319: 31335117939.52 | F319: 16027440124.49 | G319: 11806704000 | H319: 11806704000 | I319: 4220736124.4899998 | J319: =IF(G319=H319,"是","否") -> 是 | K319: =G319/C319 -> 1485120000 | L319: =I319/K319 -> 2.8420168905475651
A320: 600017.SH | B320: 日照港 | C320: 2.62 | D320: 交通运输-港口航运-港口 | E320: 39220983608.620003 | F320: 15725814569.34 | G320: 8058213186.5600004 | H320: 8058213186.5600004 | I320: 7667601382.7799997 | J320: =IF(G320=H320,"是","否") -> 是 | K320: =G320/C320 -> 3075653888 | L320: =I320/K320 -> 2.4929987774944329
A321: 601778.SH | B321: 晶科科技 | C321: 2.31 | D321: 公用事业-电力-新能源发电 | E321: 42875225011.489998 | F321: 15715411484.76 | G321: 8248909572.75 | H321: 8248909572.75 | I321: 7466501912.0100002 | J321: =IF(G321=H321,"是","否") -> 是 | K321: =G321/C321 -> 3570956525 | L321: =I321/K321 -> 2.0908968954781662
A322: 000950.SZ | B322: 重药控股 | C322: 4.69 | D322: 医药生物-医药商业-医药流通 | E322: 66247763087.360001 | F322: 15715181650.85 | G322: 8105186224.2399998 | H322: 8105186224.2399998 | I322: 7609995426.6099997 | J322: =IF(G322=H322,"是","否") -> 是 | K322: =G322/C322 -> 1728184695.9999998 | L322: =I322/K322 -> 4.4034618777864702
A323: 601636.SH | B323: 旗滨集团 | C323: 4.81 | D323: 建筑材料-建筑材料-玻璃玻纤 | E323: 35026733693.760002 | F323: 15705152342.370001 | G323: 12907703633.889999 | H323: 12907703633.889999 | I323: 2797448708.48 | J323: =IF(G323=H323,"是","否") -> 是 | K323: =G323/C323 -> 2683514269 | L323: =I323/K323 -> 1.0424571766940733
A324: 600595.SH | B324: 中孚实业 | C324: 2.38 | D324: 有色金属-工业金属-铝 | E324: 24153350000.369999 | F324: 15654956909.860001 | G324: 9542443671.3199997 | H324: 9538814171.3199997 | I324: 6112513238.54 | J324: =IF(G324=H324,"是","否") -> 否 | K324: =G324/C324 -> 4009430114 | L324: =I324/K324 -> 1.5245341768638194
A325: 601222.SH | B325: 林洋能源 | C325: 7.02 | D325: 公用事业-电力-新能源发电 | E325: 23833660880.299999 | F325: 15608584641.74 | G325: 14462387475.120001 | H325: 14462387475.120001 | I325: 1146197166.6199999 | J325: =IF(G325=H325,"是","否") -> 是 | K325: =G325/C325 -> 2060169156.0000002 | L325: =I325/K325 -> 0.55636070624678347
A326: 600740.SH | B326: 山西焦化 | C326: 3.53 | D326: 煤炭-煤炭开采加工-焦炭加工 | E326: 25937721769.98 | F326: 15482453698.879999 | G326: 9044287673.6200008 | H326: 9044287673.6200008 | I326: 6438166025.2600002 | J326: =IF(G326=H326,"是","否") -> 是 | K326: =G326/C326 -> 2562121154.0000005 | L326: =I326/K326 -> 2.5128265364066382
A327: 000156.SZ | B327: 华数传媒 | C327: 6.08 | D327: 传媒-文化传媒-电视广播 | E327: 28383947069.790001 | F327: 15439233858.84 | G327: 11265829247.360001 | H327: 9877569793.6000004 | I327: 4173404611.48 | J327: =IF(G327=H327,"是","否") -> 否 | K327: =G327/C327 -> 1852932442 | L327: =I327/K327 -> 2.2523242169451962
A328: 601101.SH | B328: 昊华能源 | C328: 8.17 | D328: 煤炭-煤炭开采加工-煤炭开采 | E328: 29861928124.52 | F328: 15310951641.49 | G328: 11764783055.42 | H328: 11764783055.42 | I328: 3546168586.0700002 | J328: =IF(G328=H328,"是","否") -> 是 | K328: =G328/C328 -> 1439997926 | L328: =I328/K328 -> 2.4626206205174772
A329: 600997.SH | B329: 开滦股份 | C329: 6.01 | D329: 煤炭-煤炭开采加工-煤炭开采 | E329: 27785843090.849998 | F329: 15280325055.209999 | G329: 9542677104.5100002 | H329: 9542677104.5100002 | I329: 5737647950.6999998 | J329: =IF(G329=H329,"是","否") -> 是 | K329: =G329/C329 -> 1587799851 | L329: =I329/K329 -> 3.6135838828089168
A330: 600409.SH | B330: 三友化工 | C330: 4.66 | D330: 基础化工-化学原料-纯碱 | E330: 26033313762 | F330: 15247539648.92 | G330: 9619868427.6800003 | H330: 9619868427.6800003 | I330: 5627671221.2399998 | J330: =IF(G330=H330,"是","否") -> 是 | K330: =G330/C330 -> 2064349448 | L330: =I330/K330 -> 2.7261233444232258
A331: 600420.SH | B331: 国药现代 | C331: 10.05 | D331: 医药生物-化学制药-化学制剂 | E331: 19969316497.540001 | F331: 15088420838.23 | G331: 13478785554.6 | H331: 13478785554.6 | I331: 1609635283.6300001 | J331: =IF(G331=H331,"是","否") -> 是 | K331: =G331/C331 -> 1341172692 | L331: =I331/K331 -> 1.200170040168101
A332: 600020.SH | B332: 中原高速 | C332: 3.59 | D332: 交通运输-公路铁路运输-高速公路 | E332: 50486674495.230003 | F332: 14955035269.85 | G332: 8068064876.8800001 | H332: 8068064876.8800001 | I332: 6886970392.9700003 | J332: =IF(G332=H332,"是","否") -> 是 | K332: =G332/C332 -> 2247371832 | L332: =I332/K332 -> 3.0644552427450735
A333: 301039.SZ | B333: 中集车辆 | C333: 9.09 | D333: 汽车-汽车整车-商用载货车 | E333: 24377812656.5 | F333: 14946778673.360001 | G333: 13213951200 | H333: 13213951200 | I333: 1732827473.3599999 | J333: =IF(G333=H333,"是","否") -> 是 | K333: =G333/C333 -> 1453680000 | L333: =I333/K333 -> 1.1920281446810852
A334: 688172.SH | B334: 燕东微 | C334: 12.16 | D334: 电子-半导体-分立器件 | E334: 18224709318.040001 | F334: 14933973570.629999 | G334: 14581105989.76 | H334: 5588600756.4799995 | I334: 352867580.87 | J334: =IF(G334=H334,"是","否") -> 否 | K334: =G334/C334 -> 1199104111 | L334: =I334/K334 -> 0.29427601626327843
A335: 000090.SZ | B335: 天健集团 | C335: 3.3999999999999999 | D335: 房地产-房地产-住宅开发 | E335: 68396698133.889999 | F335: 14810291926.299999 | G335: 6353054475.6000004 | H335: 6352763775.6000004 | I335: 8457237450.6999998 | J335: =IF(G335=H335,"是","否") -> 否 | K335: =G335/C335 -> 1868545434.0000002 | L335: =I335/K335 -> 4.5261074720541146
A336: 600787.SH | B336: 中储股份 | C336: 4.37 | D336: 交通运输-物流-物流Ⅲ | E336: 23255470631.330002 | F336: 14783639394.139999 | G336: 9504542774.6000004 | H336: 9483247773.3400002 | I336: 5279096619.54 | J336: =IF(G336=H336,"是","否") -> 否 | K336: =G336/C336 -> 2174952580 | L336: =I336/K336 -> 2.4272237786168191
A337: 300390.SZ | B337: 天华新能 | C337: 15.94 | D337: 有色金属-能源金属-锂 | E337: 18113709119.040001 | F337: 14685120983.1 | G337: 13242167560.719999 | H337: 10716787494.799999 | I337: 1442953422.3800001 | J337: =IF(G337=H337,"是","否") -> 否 | K337: =G337/C337 -> 830750788 | L337: =I337/K337 -> 1.7369269379254566
A338: 601869.SH | B338: 长飞光纤 | C338: 22.55 | D338: 通信-通信设备-通信线缆及配套 | E338: 29879907627 | F338: 14548363766 | G338: 11693509224.879999 | H338: 9162928980.7000008 | I338: 2854854541.1199999 | J338: =IF(G338=H338,"是","否") -> 否 | K338: =G338/C338 -> 518559167.40044343 | L338: =I338/K338 -> 5.5053593120944964
A339: 000012.SZ | B339: 南玻A | C339: 4.89 | D339: 建筑材料-建筑材料-玻璃玻纤 | E339: 32268955506 | F339: 14493501510 | G339: 11883862328.49 | H339: 9580877464.0499992 | I339: 2609639181.5100002 | J339: =IF(G339=H339,"是","否") -> 否 | K339: =G339/C339 -> 2430237694.98773 | L339: =I339/K339 -> 1.073820551336307
A340: 601588.SH | B340: 北辰实业 | C340: 1.44 | D340: 房地产-房地产-住宅开发 | E340: 52638412386 | F340: 14394622869 | G340: 4214969388.5999999 | H340: 3830400000 | I340: 10179653480.4 | J340: =IF(G340=H340,"是","否") -> 否 | K340: =G340/C340 -> 2927062075.4166665 | L340: =I340/K340 -> 3.4777716420485989
A341: 601375.SH | B341: 中原证券 | C341: 3.51 | D341: 非银金融-证券-证券Ⅲ | E341: 53198797130.309998 | F341: 14274856666.950001 | G341: 13249471776.200001 | H341: 12100794147 | I341: 1025384890.76 | J341: =IF(G341=H341,"是","否") -> 否 | K341: =G341/C341 -> 3774778283.8176641 | L341: =I341/K341 -> 0.27164109085712063
A342: 000059.SZ | B342: 华锦股份 | C342: 3.7999999999999998 | D342: 石油石化-石油加工贸易-石油加工 | E342: 28203751540.310001 | F342: 14232478549.809999 | G342: 6077881640.6000004 | H342: 6077881640.6000004 | I342: 8154596909.21 | J342: =IF(G342=H342,"是","否") -> 是 | K342: =G342/C342 -> 1599442537.0000002 | L342: =I342/K342 -> 5.0983994239050299
A343: 000900.SZ | B343: 现代投资 | C343: 3.42 | D343: 交通运输-公路铁路运输-高速公路 | E343: 58588146840.900002 | F343: 14218752579.799999 | G343: 5190972902.2799997 | H343: 5190742052.2799997 | I343: 9027779677.5200005 | J343: =IF(G343=H343,"是","否") -> 否 | K343: =G343/C343 -> 1517828334 | L343: =I343/K343 -> 5.9478265593637287
A344: 002060.SZ | B344: 广东建工 | C344: 3.16 | D344: 建筑装饰-建筑装饰-基础建设 | E344: 130536136249.23 | F344: 14061069289.860001 | G344: 11863882644.719999 | H344: 4938456405.6000004 | I344: 2197186645.1399999 | J344: =IF(G344=H344,"是","否") -> 否 | K344: =G344/C344 -> 3754393241.9999995 | L344: =I344/K344 -> 0.58523082253619718
A345: 300140.SZ | B345: 节能环境 | C345: 4.51 | D345: 环保-环境治理-固废治理 | E345: 31227197330.41 | F345: 14009369332.139999 | G345: 13976792242.16 | H345: 4600461020.7600002 | I345: 32577089.98 | J345: =IF(G345=H345,"是","否") -> 否 | K345: =G345/C345 -> 3099067016 | L345: =I345/K345 -> 1.0511902392497342e-02
A346: 300118.SZ | B346: 东方日升 | C346: 9.05 | D346: 电力设备-光伏设备-光伏电池组件 | E346: 50166596657.720001 | F346: 13966216211.690001 | G346: 10317125460.15 | H346: 8387776024 | I346: 3649090751.54 | J346: =IF(G346=H346,"是","否") -> 否 | K346: =G346/C346 -> 1140013862.9999998 | L346: =I346/K346 -> 3.2009178747504414
A347: 600596.SH | B347: 新安股份 | C347: 6.97 | D347: 基础化工-农化制品-农药 | E347: 23083197196.52 | F347: 13875736154.48 | G347: 9406691431.5300007 | H347: 9012014198.7600002 | I347: 4469044722.9499998 | J347: =IF(G347=H347,"是","否") -> 否 | K347: =G347/C347 -> 1349597049.0000002 | L347: =I347/K347 -> 3.311391890091484
A348: 002048.SZ | B348: 宁波华翔 | C348: 12.05 | D348: 汽车-汽车零部件-车身附件及饰件 | E348: 26219623427.919998 | F348: 13842800841.52 | G348: 9809850871.3999996 | H348: 6292634259.6000004 | I348: 4032949970.1199999 | J348: =IF(G348=H348,"是","否") -> 否 | K348: =G348/C348 -> 814095507.99999988 | L348: =I348/K348 -> 4.9539027429690723
A349: 600710.SH | B349: 苏美达 | C349: 8.27 | D349: 商贸零售-贸易-贸易Ⅲ | E349: 58010765703.75 | F349: 13796099453.34 | G349: 10806817819.18 | H349: 10806817819.18 | I349: 2989281634.1599998 | J349: =IF(G349=H349,"是","否") -> 是 | K349: =G349/C349 -> 1306749434 | L349: =I349/K349 -> 2.28757063625405
A350: 002081.SZ | B350: 金螳螂 | C350: 2.92 | D350: 建筑装饰-建筑装饰-装饰园林 | E350: 34273351592.810001 | F350: 13795409505.48 | G350: 7753545171.8800001 | H350: 7718842215.8000002 | I350: 6041864333.6000004 | J350: =IF(G350=H350,"是","否") -> 否 | K350: =G350/C350 -> 2655323689 | L350: =I350/K350 -> 2.2753777095535113
A351: 600033.SH | B351: 福建高速 | C351: 3.22 | D351: 交通运输-公路铁路运输-高速公路 | E351: 17066909344.879999 | F351: 13789359678.190001 | G351: 8836968000 | H351: 8836968000 | I351: 4952391678.1899996 | J351: =IF(G351=H351,"是","否") -> 是 | K351: =G351/C351 -> 2744400000 | L351: =I351/K351 -> 1.8045444097762715
A352: 002015.SZ | B352: 协鑫能科 | C352: 6.34 | D352: 公用事业-电力-热力 | E352: 39196761570.519997 | F352: 13684169053.389999 | G352: 10291878052.76 | H352: 10291878052.76 | I352: 3392291000.6300001 | J352: =IF(G352=H352,"是","否") -> 是 | K352: =G352/C352 -> 1623324614 | L352: =I352/K352 -> 2.0897182063118769
A353: 600499.SH | B353: 科达制造 | C353: 7.03 | D353: 机械设备-专用设备-其他专用设备 | E353: 24914617200 | F353: 13668868600 | G353: 13482530428.73 | H353: 13482530428.73 | I353: 186338171.27000001 | J353: =IF(G353=H353,"是","否") -> 是 | K353: =G353/C353 -> 1917856390.9999998 | L353: =I353/K353 -> 9.7159605976983726e-02
A354: 603185.SH | B354: 弘元绿能 | C354: 12.17 | D354: 电力设备-光伏设备-硅料硅片 | E354: 31823250261.139999 | F354: 13464803824.299999 | G354: 8263700198.3400002 | H354: 8263700198.3400002 | I354: 5201103625.96 | J354: =IF(G354=H354,"是","否") -> 是 | K354: =G354/C354 -> 679022202 | L354: =I354/K354 -> 7.6596959725920719
A355: 002745.SZ | B355: 木林森 | C355: 6.92 | D355: 电子-光学光电子-LED | E355: 23518722425.73 | F355: 13459584790.120001 | G355: 10270431481.08 | H355: 7367558120.6800003 | I355: 3189153309.04 | J355: =IF(G355=H355,"是","否") -> 否 | K355: =G355/C355 -> 1484166399 | L355: =I355/K355 -> 2.1487842004702329
A356: 600648.SH | B356: 外高桥 | C356: 8.96 | D356: 房地产-房地产-产业地产 | E356: 44058644791.589996 | F356: 13089154420.83 | G356: 9340586283.4799995 | H356: 8375732951.04 | I356: 3748568137.3499999 | J356: =IF(G356=H356,"是","否") -> 否 | K356: =G356/C356 -> 1042476147.7098212 | L356: =I356/K356 -> 3.5958310850421813
A357: 000926.SZ | B357: 福星股份 | C357: 1.92 | D357: 房地产-房地产-住宅开发 | E357: 36168000877.470001 | F357: 13080490758.42 | G357: 3058492366.0799999 | H357: 3020561560.3200002 | I357: 10021998392.34 | J357: =IF(G357=H357,"是","否") -> 否 | K357: =G357/C357 -> 1592964774 | L357: =I357/K357 -> 6.2914124379375638
A358: 600094.SH | B358: 大名城 | C358: 3.43 | D358: 房地产-房地产-住宅开发 | E358: 24093064423.970001 | F358: 13078347479.5 | G358: 8097945696.9200001 | H358: 7808755019.6599998 | I358: 4980401782.5799999 | J358: =IF(G358=H358,"是","否") -> 否 | K358: =G358/C358 -> 2360917112.8046646 | L358: =I358/K358 -> 2.1095199639022923
A359: 600328.SH | B359: 中盐化工 | C359: 7.05 | D359: 基础化工-化学原料-无机盐 | E359: 18590747076.43 | F359: 13039157057.700001 | G359: 10375487516.85 | H359: 10298473020.75 | I359: 2663669540.8499999 | J359: =IF(G359=H359,"是","否") -> 否 | K359: =G359/C359 -> 1471700357 | L359: =I359/K359 -> 1.8099265439330188
A360: 601163.SH | B360: 三角轮胎 | C360: 13.54 | D360: 汽车-汽车零部件-轮胎轮毂 | E360: 19112785368.360001 | F360: 12954721045.73 | G360: 10832000000 | H360: 10832000000 | I360: 2122721045.73 | J360: =IF(G360=H360,"是","否") -> 是 | K360: =G360/C360 -> 800000000 | L360: =I360/K360 -> 2.6534013071625
A361: 002373.SZ | B361: 千方科技 | C361: 7.42 | D361: 计算机-IT服务-IT服务Ⅲ | E361: 18524351574.040001 | F361: 12952608469.030001 | G361: 11724996555.299999 | H361: 10221748414.92 | I361: 1227611913.73 | J361: =IF(G361=H361,"是","否") -> 否 | K361: =G361/C361 -> 1580188215 | L361: =I361/K361 -> 0.7768770214059596
A362: 601200.SH | B362: 上海环境 | C362: 7.4000000000000004 | D362: 环保-环境治理-固废治理 | E362: 29595143298.75 | F362: 12897794230.209999 | G362: 9962103857.3999996 | H362: 9962103857.3999996 | I362: 2935690372.8099999 | J362: =IF(G362=H362,"是","否") -> 是 | K362: =G362/C362 -> 1346230251 | L362: =I362/K362 -> 2.1806747921682232
A363: 000600.SZ | B363: 建投能源 | C363: 4.32 | D363: 公用事业-电力-火电 | E363: 40425513174.75 | F363: 12834965198.33 | G363: 7816173304.3199997 | H363: 4709019784.3199997 | I363: 5018791894.0100002 | J363: =IF(G363=H363,"是","否") -> 否 | K363: =G363/C363 -> 1809299375.9999998 | L363: =I363/K363 -> 2.7738869313632044
A364: 600508.SH | B364: 上海能源 | C364: 10.96 | D364: 煤炭-煤炭开采加工-煤炭开采 | E364: 19992157091.279999 | F364: 12822915584.629999 | G364: 7920989280 | H364: 7920989280 | I364: 4901926304.6300001 | J364: =IF(G364=H364,"是","否") -> 是 | K364: =G364/C364 -> 722718000 | L364: =I364/K364 -> 6.7826265633760334
A365: 600575.SH | B365: 淮河能源 | C365: 3.25 | D365: 公用事业-电力-火电 | E365: 23761306630.5 | F365: 12785084642.139999 | G365: 12630348461.25 | H365: 12630348461.25 | I365: 154736180.88999999 | J365: =IF(G365=H365,"是","否") -> 是 | K365: =G365/C365 -> 3886261065 | L365: =I365/K365 -> 3.9816208510428518e-02
A366: 002240.SZ | B366: 盛新锂能 | C366: 10.99 | D366: 有色金属-能源金属-锂 | E366: 21877572100.450001 | F366: 12757609870.629999 | G366: 10124711933.280001 | H366: 9524484104.4500008 | I366: 2632897937.3499999 | J366: =IF(G366=H366,"是","否") -> 否 | K366: =G366/C366 -> 921265872 | L366: =I366/K366 -> 2.8579132445600894
A367: 002131.SZ | B367: 利欧股份 | C367: 1.46 | D367: 机械设备-通用设备-其他通用设备 | E367: 22880209821.77 | F367: 12746805775.27 | G367: 9886397924.8799992 | H367: 8542805628.7200003 | I367: 2860407850.3899999 | J367: =IF(G367=H367,"是","否") -> 否 | K367: =G367/C367 -> 6771505428 | L367: =I367/K367 -> 0.42241830576732425
A368: 600037.SH | B368: 歌华有线 | C368: 5.91 | D368: 传媒-文化传媒-电视广播 | E368: 15617519014.51 | F368: 12744823939.200001 | G368: 8225407294.4399996 | H368: 8225407294.4399996 | I368: 4519416644.7600002 | J368: =IF(G368=H368,"是","否") -> 是 | K368: =G368/C368 -> 1391777884 | L368: =I368/K368 -> 3.2472255068251972
A369: 600428.SH | B369: 中远海特 | C369: 5.73 | D369: 交通运输-港口航运-航运 | E369: 30649522775.939999 | F369: 12632849814.15 | G369: 12300308917.83 | H369: 12300308917.83 | I369: 332540896.31999999 | J369: =IF(G369=H369,"是","否") -> 是 | K369: =G369/C369 -> 2146650770.9999998 | L369: =I369/K369 -> 0.1549115025193821
A370: 000923.SZ | B370: 河钢资源 | C370: 12.5 | D370: 钢铁-钢铁-冶钢原料 | E370: 16572921543.639999 | F370: 12627681343.879999 | G370: 8159112012.5 | H370: 7848696612.5 | I370: 4468569331.3800001 | J370: =IF(G370=H370,"是","否") -> 否 | K370: =G370/C370 -> 652728961 | L370: =I370/K370 -> 6.8459798758339456
A371: 600643.SH | B371: 爱建集团 | C371: 4.0999999999999996 | D371: 非银金融-多元金融-多元金融Ⅲ | E371: 24156947149.029999 | F371: 12528788443.139999 | G371: 6532000189.8000002 | H371: 6520442035.6000004 | I371: 5996788253.3400002 | J371: =IF(G371=H371,"是","否") -> 否 | K371: =G371/C371 -> 1593170778.0000002 | L371: =I371/K371 -> 3.7640586534408551
A372: 600971.SH | B372: 恒源煤电 | C372: 8.61 | D372: 煤炭-煤炭开采加工-煤炭开采 | E372: 20839746017.380001 | F372: 12497982779.77 | G372: 10332042051.24 | H372: 10332042051.24 | I372: 2165940728.5300002 | J372: =IF(G372=H372,"是","否") -> 是 | K372: =G372/C372 -> 1200004884 | L372: =I372/K372 -> 1.8049432609892613
A373: 600864.SH | B373: 哈投股份 | C373: 4.82 | D373: 非银金融-证券-证券Ⅲ | E373: 37808986753.040001 | F373: 12428998701.26 | G373: 10028349906.4 | H373: 10028349906.4 | I373: 2400648794.8600001 | J373: =IF(G373=H373,"是","否") -> 是 | K373: =G373/C373 -> 2080570519.9999998 | L373: =I373/K373 -> 1.1538415890176126
A374: 002399.SZ | B374: 海普瑞 | C374: 9.15 | D374: 医药生物-化学制药-化学制剂 | E374: 18573510350.970001 | F374: 12209423349.18 | G374: 12076319399.290001 | H374: 11411895591.6 | I374: 133103949.89 | J374: =IF(G374=H374,"是","否") -> 否 | K374: =G374/C374 -> 1319816327.7912569 | L374: =I374/K374 -> 0.10085035855917356
A375: 600395.SH | B375: 盘江股份 | C375: 4.74 | D375: 煤炭-煤炭开采加工-煤炭开采 | E375: 39186912667.529999 | F375: 11895013476.07 | G375: 10175001997.559999 | H375: 10175001997.559999 | I375: 1720011478.51 | J375: =IF(G375=H375,"是","否") -> 是 | K375: =G375/C375 -> 2146624893.9999998 | L375: =I375/K375 -> 0.80126317519077472
A376: 600967.SH | B376: 内蒙一机 | C376: 6.59 | D376: 国防军工-军工装备-地面兵装 | E376: 21135735934.23 | F376: 11884230026.85 | G376: 11220376096.83 | H376: 11195839549.83 | I376: 663853930.01999998 | J376: =IF(G376=H376,"是","否") -> 否 | K376: =G376/C376 -> 1702636737 | L376: =I376/K376 -> 0.38989757215605059
A377: 000690.SZ | B377: 宝新能源 | C377: 3.92 | D377: 公用事业-电力-火电 | E377: 21057379891.360001 | F377: 11855203549.67 | G377: 8529480419.04 | H377: 8523926104.3999996 | I377: 3325723130.6300001 | J377: =IF(G377=H377,"是","否") -> 否 | K377: =G377/C377 -> 2175887862 | L377: =I377/K377 -> 1.5284441761502874
A378: 600167.SH | B378: 联美控股 | C378: 5.17 | D378: 公用事业-电力-热力 | E378: 17549026307.41 | F378: 11833912139.940001 | G378: 11829577685.75 | H378: 11829577685.75 | I378: 4334454.1900000004 | J378: =IF(G378=H378,"是","否") -> 是 | K378: =G378/C378 -> 2288119475 | L378: =I378/K378 -> 1.8943303605245528e-03
A379: 601801.SH | B379: 皖新传媒 | C379: 5.95 | D379: 传媒-文化传媒-出版 | E379: 20000728167.970001 | F379: 11719884702.209999 | G379: 11649690860.15 | H379: 11649690860.15 | I379: 70193842.060000002 | J379: =IF(G379=H379,"是","否") -> 是 | K379: =G379/C379 -> 1957931236.9999998 | L379: =I379/K379 -> 3.5851025170604608e-02
A380: 600491.SH | B380: 龙元建设 | C380: 2.53 | D380: 建筑装饰-建筑装饰-房屋建设 | E380: 56166353792.720001 | F380: 11717367489.719999 | G380: 3870287626.1500001 | H380: 3870287626.1500001 | I380: 7847079863.5699997 | J380: =IF(G380=H380,"是","否") -> 是 | K380: =G380/C380 -> 1529757955.0000002 | L380: =I380/K380 -> 5.1296218711737298
A381: 002233.SZ | B381: 塔牌集团 | C381: 6.55 | D381: 建筑材料-建筑材料-水泥 | E381: 13036666797.77 | F381: 11679604237.209999 | G381: 7809401354.8000002 | H381: 7804226527.3000002 | I381: 3870202882.4099998 | J381: =IF(G381=H381,"是","否") -> 否 | K381: =G381/C381 -> 1192275016 | L381: =I381/K381 -> 3.246065572517205
A382: 600708.SH | B382: 光明地产 | C382: 1.8999999999999999 | D382: 房地产-房地产-住宅开发 | E382: 63151536451.82 | F382: 11513428785.959999 | G382: 4234409811.6999998 | H382: 4228027764.9000001 | I382: 7279018974.2600002 | J382: =IF(G382=H382,"是","否") -> 否 | K382: =G382/C382 -> 2228636743 | L382: =I382/K382 -> 3.2661307398448471
A383: 600810.SH | B383: 神马股份 | C383: 6.25 | D383: 基础化工-化学纤维-其他纤维 | E383: 30952373762.18 | F383: 11511558472.66 | G383: 6526127318.75 | H383: 6526127318.75 | I383: 4985431153.9099998 | J383: =IF(G383=H383,"是","否") -> 是 | K383: =G383/C383 -> 1044180371 | L383: =I383/K383 -> 4.7744923122194951
A384: 002051.SZ | B384: 中工国际 | C384: 6.66 | D384: 建筑装饰-建筑装饰-专业工程 | E384: 22971570148.009998 | F384: 11485662678.73 | G384: 8241143520.4200001 | H384: 8240421643.0200005 | I384: 3244519158.3099999 | J384: =IF(G384=H384,"是","否") -> 否 | K384: =G384/C384 -> 1237408937 | L384: =I384/K384 -> 2.6220266084194281
A385: 002407.SZ | B385: 多氟多 | C385: 9.5 | D385: 基础化工-化学制品-氟化工 | E385: 22681946958.98 | F385: 11441421594.879999 | G385: 11309109405.5 | H385: 10262988472 | I385: 132312189.38 | J385: =IF(G385=H385,"是","否") -> 否 | K385: =G385/C385 -> 1190432569 | L385: =I385/K385 -> 0.11114631170679941
A386: 601678.SH | B386: 滨化股份 | C386: 3.18 | D386: 基础化工-化学原料-氯碱 | E386: 21568973283.34 | F386: 11331986541.98 | G386: 6544555357.6800003 | H386: 6544555357.6800003 | I386: 4787431184.3000002 | J386: =IF(G386=H386,"是","否") -> 是 | K386: =G386/C386 -> 2058036276 | L386: =I386/K386 -> 2.326213216029823
A387: 000917.SZ | B387: 电广传媒 | C387: 4.85 | D387: 传媒-文化传媒-广告营销 | E387: 17153067699.360001 | F387: 11326683290.75 | G387: 6875148239.3000002 | H387: 6874677910.5500002 | I387: 4451535051.4499998 | J387: =IF(G387=H387,"是","否") -> 否 | K387: =G387/C387 -> 1417556338.0000002 | L387: =I387/K387 -> 3.1402879251561706
A388: 600597.SH | B388: 光明乳业 | C388: 7.63 | D388: 食品饮料-饮料制造-乳品 | E388: 22931954057 | F388: 11238013417 | G388: 10517754811.690001 | H388: 10517614419.690001 | I388: 720258605.30999994 | J388: =IF(G388=H388,"是","否") -> 否 | K388: =G388/C388 -> 1378473763 | L388: =I388/K388 -> 0.52250439917150604
A389: 000501.SZ | B389: 武商集团 | C389: 7.2000000000000002 | D389: 商贸零售-零售-百货零售 | E389: 31050292284.080002 | F389: 11186103378.16 | G389: 5536747663.1999998 | H389: 5531716015.1999998 | I389: 5649355714.96 | J389: =IF(G389=H389,"是","否") -> 否 | K389: =G389/C389 -> 768992731 | L389: =I389/K389 -> 7.3464357817967461
A390: 600335.SH | B390: 国机汽车 | C390: 5.37 | D390: 汽车-汽车服务及其他-汽车服务 | E390: 30584704610.259998 | F390: 11119375366.73 | G390: 8032385276.04 | H390: 8032385276.04 | I390: 3086990090.6900001 | J390: =IF(G390=H390,"是","否") -> 是 | K390: =G390/C390 -> 1495788692 | L390: =I390/K390 -> 2.063787557159845
A391: 600748.SH | B391: 上实发展 | C391: 2.6000000000000001 | D391: 房地产-房地产-住宅开发 | E391: 29594088327.470001 | F391: 11080598856.57 | G391: 4795863519.1999998 | H391: 4795863519.1999998 | I391: 6284735337.3699999 | J391: =IF(G391=H391,"是","否") -> 是 | K391: =G391/C391 -> 1844562891.9999998 | L391: =I391/K391 -> 3.4071678253028637
A392: 600510.SH | B392: 黑牡丹 | C392: 3.67 | D392: 房地产-房地产-住宅开发 | E392: 29468055970.169998 | F392: 11043144258.370001 | G392: 3818854469.6700001 | H392: 3787533427.1900001 | I392: 7224289788.6999998 | J392: =IF(G392=H392,"是","否") -> 否 | K392: =G392/C392 -> 1040559801 | L392: =I392/K392 -> 6.9426954431233119
A393: 000040.SZ | B393: ST旭蓝 | C393: 1.26 | D393: 公用事业-电力-新能源发电 | E393: 23427264745.990002 | F393: 11005471696.16 | G393: 1873461076.2 | H393: 1336029244.2 | I393: 9132010619.9599991 | J393: =IF(G393=H393,"是","否") -> 否 | K393: =G393/C393 -> 1486873870 | L393: =I393/K393 -> 6.1417520370843555
A394: 000767.SZ | B394: 晋控电力 | C394: 2.21 | D394: 公用事业-电力-火电 | E394: 58422516834.510002 | F394: 11003614363.9 | G394: 6800042303.9899998 | H394: 6436064623.5600004 | I394: 4203572059.9099998 | J394: =IF(G394=H394,"是","否") -> 否 | K394: =G394/C394 -> 3076942219 | L394: =I394/K394 -> 1.366152420397466
A395: 000035.SZ | B395: 中国天楹 | C395: 4.0999999999999996 | D395: 环保-环境治理-固废治理 | E395: 28446401910.060001 | F395: 10987375025.870001 | G395: 10347486917.700001 | H395: 10044618704.1 | I395: 639888108.16999996 | J395: =IF(G395=H395,"是","否") -> 否 | K395: =G395/C395 -> 2523777297.0000005 | L395: =I395/K395 -> 0.25354380869129428
A396: 002302.SZ | B396: 西部建设 | C396: 5.48 | D396: 建筑材料-建筑材料-水泥 | E396: 36376256524.809998 | F396: 10954937543.559999 | G396: 6917701585.9200001 | H396: 6917701585.9200001 | I396: 4037235957.6399999 | J396: =IF(G396=H396,"是","否") -> 是 | K396: =G396/C396 -> 1262354304 | L396: =I396/K396 -> 3.1981797383248751
A397: 000719.SZ | B397: 中原传媒 | C397: 10.65 | D397: 传媒-文化传媒-出版 | E397: 18103200129.970001 | F397: 10917753294.059999 | G397: 10897119926.85 | H397: 7105121332.9499998 | I397: 20633367.210000001 | J397: =IF(G397=H397,"是","否") -> 否 | K397: =G397/C397 -> 1023203749 | L397: =I397/K397 -> 2.0165453097846304e-02
A398: 000930.SZ | B398: 中粮科技 | C398: 4.67 | D398: 农林牧渔-农产品加工-其他农产品加工 | E398: 18446400676.580002 | F398: 10849673854.83 | G398: 8684904980.9799995 | H398: 8668600142.9799995 | I398: 2164768873.8499999 | J398: =IF(G398=H398,"是","否") -> 否 | K398: =G398/C398 -> 1859722694 | L398: =I398/K398 -> 1.1640277772778524
A399: 002497.SZ | B399: 雅化集团 | C399: 8.23 | D399: 基础化工-化学制品-民爆用品 | E399: 14023405160.1 | F399: 10758689095.370001 | G399: 9485589539.6000004 | H399: 8670502017.9699993 | I399: 1273099555.77 | J399: =IF(G399=H399,"是","否") -> 否 | K399: =G399/C399 -> 1152562520 | L399: =I399/K399 -> 1.1045817764141765
A400: 002208.SZ | B400: 合肥城建 | C400: -- | D400: 房地产-房地产-住宅开发 | E400: 40213644981.910004 | F400: 10746356015.33 | G400: 4040558226.8200002 | H400: 4035934419.4400001 | I400: 6705797788.5100002 | J400: =IF(G400=H400,"是","否") -> 否 | K400: =G400/C400 -> #VALUE! | L400: =I400/K400 -> #VALUE!
A401: 600633.SH | B401: 浙数文化 | C401: 8.09 | D401: 传媒-游戏-游戏Ⅲ | E401: 12187910587.4 | F401: 10646835027.23 | G401: 10239759931.07 | H401: 10239759931.07 | I401: 407075096.16000003 | J401: =IF(G401=H401,"是","否") -> 是 | K401: =G401/C401 -> 1265730523 | L401: =I401/K401 -> 0.32161276730149613
A402: 002183.SZ | B402: 怡亚通 | C402: 3.24 | D402: 商贸零售-贸易-贸易Ⅲ | E402: 51424851129 | F402: 10511468336 | G402: 8414309454.8400002 | H402: 8414260854.8400002 | I402: 2097158881.1600001 | J402: =IF(G402=H402,"是","否") -> 否 | K402: =G402/C402 -> 2597009091 | L402: =I402/K402 -> 0.8075285097875694
A403: 600874.SH | B403: 创业环保 | C403: 4.86 | D403: 环保-环境治理-水务及水治理 | E403: 25047157000 | F403: 10409101000 | G403: 6855196573.1000004 | H403: 5979831893.1000004 | I403: 3553904426.9000001 | J403: =IF(G403=H403,"是","否") -> 否 | K403: =G403/C403 -> 1410534274.3004115 | L403: =I403/K403 -> 2.519544892776636
A404: 603588.SH | B404: 高能环境 | C404: 4.28 | D404: 环保-环境治理-固废治理 | E404: 27983445898.619999 | F404: 10407423984.200001 | G404: 6570118675.96 | H404: 6519443475.96 | I404: 3837305308.2399998 | J404: =IF(G404=H404,"是","否") -> 否 | K404: =G404/C404 -> 1535074457 | L404: =I404/K404 -> 2.4997519115387115
A405: 600888.SH | B405: 新疆众和 | C405: 6.47 | D405: 有色金属-工业金属-铝 | E405: 17016335654.08 | F405: 10403403385.379999 | G405: 8907030378.7000008 | H405: 8851516484.7000008 | I405: 1496373006.6800001 | J405: =IF(G405=H405,"是","否") -> 否 | K405: =G405/C405 -> 1376666210.0000002 | L405: =I405/K405 -> 1.0869541184424072
A406: 000544.SZ | B406: 中原环保 | C406: 7 | D406: 环保-环境治理-水务及水治理 | E406: 38540579125.43 | F406: 10401760796.450001 | G406: 6822791416 | H406: 6822791416 | I406: 3578969380.4499998 | J406: =IF(G406=H406,"是","否") -> 是 | K406: =G406/C406 -> 974684488 | L406: =I406/K406 -> 3.6719260689106195
A407: 600475.SH | B407: 华光环能 | C407: 8.21 | D407: 公用事业-电力-热力 | E407: 26124963690.41 | F407: 10399428368.48 | G407: 7848478635.0900002 | H407: 7737157291.1099997 | I407: 2550949733.3899999 | J407: =IF(G407=H407,"是","否") -> 否 | K407: =G407/C407 -> 955965728.99999988 | L407: =I407/K407 -> 2.6684531212833886
A408: 601908.SH | B408: 京运通 | C408: 2.12 | D408: 公用事业-电力-新能源发电 | E408: 23607279072.48 | F408: 10334316106.33 | G408: 5118958065.3199997 | H408: 5118958065.3199997 | I408: 5215358041.0100002 | J408: =IF(G408=H408,"是","否") -> 是 | K408: =G408/C408 -> 2414602860.9999995 | L408: =I408/K408 -> 2.1599237395296043
A409: 600179.SH | B409: 安通控股 | C409: 2.12 | D409: 交通运输-港口航运-航运 | E409: 13816426403.860001 | F409: 10316515581.49 | G409: 8970837195.4799995 | H409: 7916581369.3999996 | I409: 1345678386.01 | J409: =IF(G409=H409,"是","否") -> 否 | K409: =G409/C409 -> 4231526978.9999995 | L409: =I409/K409 -> 0.31801247934569771
A410: 002761.SZ | B410: 浙江建投 | C410: 7.64 | D410: 建筑装饰-建筑装饰-房屋建设 | E410: 119711663401.06 | F410: 10311117634.219999 | G410: 8261453728.04 | H410: 8261453728.04 | I410: 2049663906.1800001 | J410: =IF(G410=H410,"是","否") -> 是 | K410: =G410/C410 -> 1081342111 | L410: =I410/K410 -> 1.8954814441513967
A411: 002226.SZ | B411: 江南化工 | C411: 3.79 | D411: 基础化工-化学制品-民爆用品 | E411: 17519746547.459999 | F411: 10278894514.59 | G411: 10039417620.450001 | H411: 6926855132.9799995 | I411: 239476894.13999999 | J411: =IF(G411=H411,"是","否") -> 否 | K411: =G411/C411 -> 2648922855 | L411: =I411/K411 -> 9.0405386358448706e-02
A412: 000789.SZ | B412: 万年青 | C412: 4.34 | D412: 建筑材料-建筑材料-水泥 | E412: 16166535557.02 | F412: 10277463359.35 | G412: 3460729319.46 | H412: 3460647263.0799999 | I412: 6816734039.8900003 | J412: =IF(G412=H412,"是","否") -> 否 | K412: =G412/C412 -> 797403069 | L412: =I412/K412 -> 8.5486679257940015
A413: 001914.SZ | B413: 招商积余 | C413: 8.97 | D413: 房地产-房地产-房地产服务 | E413: 18607473859.41 | F413: 10185134286.01 | G413: 9511304158.2000008 | H413: 9511274557.2000008 | I413: 673830127.80999994 | J413: =IF(G413=H413,"是","否") -> 否 | K413: =G413/C413 -> 1060346060 | L413: =I413/K413 -> 0.63548133315080169
A414: 600273.SH | B414: 嘉化能源 | C414: 7.04 | D414: 基础化工-化学制品-其他化学制品 | E414: 12640320162.549999 | F414: 10010902841.84 | G414: 9792958257.2800007 | H414: 9792958257.2800007 | I414: 217944584.56 | J414: =IF(G414=H414,"是","否") -> 是 | K414: =G414/C414 -> 1391045207 | L414: =I414/K414 -> 0.15667685238643722
A415: 688005.SH | B415: 容百科技 | C415: 19.39 | D415: 电力设备-电池-电池化学品 | E415: 24691535637.459999 | F415: 9970497295.7000008 | G415: 9365945088.0100002 | H415: 6116630412.4799995 | I415: 604552207.69000006 | J415: =IF(G415=H415,"是","否") -> 否 | K415: =G415/C415 -> 483029659 | L415: =I415/K415 -> 1.2515840309714814
A416: 300568.SZ | B416: 星源材质 | C416: 6.83 | D416: 电力设备-电池-电池化学品 | E416: 19730284098.459999 | F416: 9930395301.1000004 | G416: 9172396105.1000004 | H416: 8290834515.8500004 | I416: 757999196 | J416: =IF(G416=H416,"是","否") -> 否 | K416: =G416/C416 -> 1342956970 | L416: =I416/K416 -> 0.56442552734954721
A417: 000791.SZ | B417: 甘肃能源 | C417: 5.78 | D417: 公用事业-电力-水电 | E417: 20697469378.32 | F417: 9899941076.7700005 | G417: 9251124292.2999992 | H417: 9251033257.2999992 | I417: 648816784.47000003 | J417: =IF(G417=H417,"是","否") -> 否 | K417: =G417/C417 -> 1600540534.9999998 | L417: =I417/K417 -> 0.40537354117682506
A418: 600635.SH | B418: 大众公用 | C418: 2.86 | D418: 公用事业-燃气-燃气Ⅲ | E418: 22904160016.860001 | F418: 9851966203.9599991 | G418: 7532137248.8000002 | H418: 6917744190.5 | I418: 2319828955.1599998 | J418: =IF(G418=H418,"是","否") -> 否 | K418: =G418/C418 -> 2633614422.6573429 | L418: =I418/K418 -> 0.88085367971947448
A419: 000718.SZ | B419: 苏宁环球 | C419: 1.8 | D419: 房地产-房地产-住宅开发 | E419: 14748110507.32 | F419: 9847808582.7399998 | G419: 5462345491.1999998 | H419: 4110184119.5999999 | I419: 4385463091.54 | J419: =IF(G419=H419,"是","否") -> 否 | K419: =G419/C419 -> 3034636384 | L419: =I419/K419 -> 1.4451362656370232
A420: 300244.SZ | B420: 迪安诊断 | C420: 8.96 | D420: 医药生物-医疗服务-其他医疗服务 | E420: 17546997257.650002 | F420: 9833191510.5400009 | G420: 5599815746.5600004 | H420: 4493296290.5600004 | I420: 4233375763.98 | J420: =IF(G420=H420,"是","否") -> 否 | K420: =G420/C420 -> 624979436 | L420: =I420/K420 -> 6.7736240908572869
A421: 000541.SZ | B421: 佛山照明 | C421: 4.53 | D421: 电子-光学光电子-LED | E421: 17074410700.639999 | F421: 9794021845.7700005 | G421: 6256986355.3199997 | H421: 5420909360.4899998 | I421: 3537035490.4499998 | J421: =IF(G421=H421,"是","否") -> 否 | K421: =G421/C421 -> 1381233191.0198674 | L421: =I421/K421 -> 2.5607808395035332
A422: 601311.SH | B422: 骆驼股份 | C422: 7.4000000000000004 | D422: 电力设备-电池-其他电池 | E422: 14939625683.98 | F422: 9744868162.9599991 | G422: 8681281273.2000008 | H422: 8681281273.2000008 | I422: 1063586889.76 | J422: =IF(G422=H422,"是","否") -> 是 | K422: =G422/C422 -> 1173146118 | L422: =I422/K422 -> 0.90661075670030045
A423: 000065.SZ | B423: 北方国际 | C423: 8.35 | D423: 建筑装饰-建筑装饰-专业工程 | E423: 24258717954.060001 | F423: 9733476418.8400002 | G423: 8368959601.8500004 | H423: 7563822658.75 | I423: 1364516816.99 | J423: =IF(G423=H423,"是","否") -> 否 | K423: =G423/C423 -> 1002270611.0000001 | L423: =I423/K423 -> 1.3614255491623908
A424: 600507.SH | B424: 方大特钢 | C424: 3.61 | D424: 钢铁-钢铁-特钢 | E424: 22540554289.09 | F424: 9700959761.7000008 | G424: 8350608282.8999996 | H424: 8350608282.8999996 | I424: 1350351478.8 | J424: =IF(G424=H424,"是","否") -> 是 | K424: =G424/C424 -> 2313187890 | L424: =I424/K424 -> 0.58376212526341731
A425: 600035.SH | B425: 楚天高速 | C425: 3.72 | D425: 交通运输-公路铁路运输-高速公路 | E425: 19656761253.82 | F425: 9696628983.75 | G425: 5989631151.7200003 | H425: 5989631151.7200003 | I425: 3706997832.0300002 | J425: =IF(G425=H425,"是","否") -> 是 | K425: =G425/C425 -> 1610115901 | L425: =I425/K425 -> 2.3023173858028994
A426: 000726.SZ | B426: 鲁泰A | C426: 5.34 | D426: 纺织服饰-纺织制造-棉纺 | E426: 13765510933.73 | F426: 9693816242.3700008 | G426: 3950229521.6599998 | H426: 3142824901.2600002 | I426: 5743586720.71 | J426: =IF(G426=H426,"是","否") -> 否 | K426: =G426/C426 -> 739743356.11610484 | L426: =I426/K426 -> 7.7642964593365376
A427: 600742.SH | B427: 一汽富维 | C427: 7.54 | D427: 汽车-汽车零部件-车身附件及饰件 | E427: 21960959066.419998 | F427: 9663338270.3799992 | G427: 5602656415.1999998 | H427: 5602656415.1999998 | I427: 4060681855.1799998 | J427: =IF(G427=H427,"是","否") -> 是 | K427: =G427/C427 -> 743057880 | L427: =I427/K427 -> 5.4648257753218363
A428: 002440.SZ | B428: 闰土股份 | C428: 5.43 | D428: 基础化工-化学制品-纺织化学用品 | E428: 11464122275.030001 | F428: 9599646170.3400002 | G428: 6103319484.1499996 | H428: 5138731694.04 | I428: 3496326686.1900001 | J428: =IF(G428=H428,"是","否") -> 否 | K428: =G428/C428 -> 1123999905 | L428: =I428/K428 -> 3.1106111936815513
A429: 000828.SZ | B429: 东莞控股 | C429: 8.78 | D429: 交通运输-公路铁路运输-高速公路 | E429: 19454041186.68 | F429: 9598073126.2700005 | G429: 9126959189.7600002 | H429: 9126947336.7600002 | I429: 471113936.50999999 | J429: =IF(G429=H429,"是","否") -> 否 | K429: =G429/C429 -> 1039516992.0000001 | L429: =I429/K429 -> 0.45320465190625758
A430: 000560.SZ | B430: 我爱我家 | C430: 2.82 | D430: 房地产-房地产-房地产服务 | E430: 32380653813.93 | F430: 9586108222.7800007 | G430: 6642512399.8199997 | H430: 6359868151.0799999 | I430: 2943595822.96 | J430: =IF(G430=H430,"是","否") -> 否 | K430: =G430/C430 -> 2355500851 | L430: =I430/K430 -> 1.2496687580097163
A431: 000507.SZ | B431: 珠海港 | C431: 4.41 | D431: 交通运输-港口航运-港口 | E431: 20208010016.41 | F431: 9526029278.8600006 | G431: 4056030886.9499998 | H431: 3979309490.73 | I431: 5469998391.9099998 | J431: =IF(G431=H431,"是","否") -> 否 | K431: =G431/C431 -> 919734894.99999988 | L431: =I431/K431 -> 5.9473642042362656
A432: 000727.SZ | B432: 冠捷科技 | C432: 1.91 | D432: 电子-光学光电子-面板 | E432: 36150581243.57 | F432: 9463397085.1599998 | G432: 8651472931.7999992 | H432: 8651472931.7999992 | I432: 811924153.36000001 | J432: =IF(G432=H432,"是","否") -> 是 | K432: =G432/C432 -> 4529566980 | L432: =I432/K432 -> 0.17924983932128541
A433: 688739.SH | B433: 成大生物 | C433: 22.55 | D433: 医药生物-生物制品-疫苗 | E433: 9931394306.6200008 | F433: 9445094412.6800003 | G433: 9390947500 | H433: 4257129621.8000002 | I433: 54146912.68 | J433: =IF(G433=H433,"是","否") -> 否 | K433: =G433/C433 -> 416450000 | L433: =I433/K433 -> 0.13002020093648697
A434: 600894.SH | B434: 广日股份 | C434: 10.37 | D434: 机械设备-专用设备-楼宇设备 | E434: 14281883762.049999 | F434: 9398721559.7299995 | G434: 9061913630.1499996 | H434: 8917649301.1499996 | I434: 336807929.57999998 | J434: =IF(G434=H434,"是","否") -> 否 | K434: =G434/C434 -> 873858595 | L434: =I434/K434 -> 0.38542612215194838
A435: 600480.SH | B435: 凌云股份 | C435: 7.73 | D435: 汽车-汽车零部件-其他汽车零部件 | E435: 18817445035.330002 | F435: 9383269660.2199993 | G435: 7270052709.3000002 | H435: 7088142619.3000002 | I435: 2113216950.9200001 | J435: =IF(G435=H435,"是","否") -> 否 | K435: =G435/C435 -> 940498410 | L435: =I435/K435 -> 2.2469117740666888
A436: 002382.SZ | B436: 蓝帆医疗 | C436: 4.33 | D436: 医药生物-医疗器械-医疗耗材 | E436: 16317902759.43 | F436: 9365408817.3600006 | G436: 4360838199.3800001 | H436: 4328658180.6300001 | I436: 5004570617.9799995 | J436: =IF(G436=H436,"是","否") -> 否 | K436: =G436/C436 -> 1007121986 | L436: =I436/K436 -> 4.9691801862619647
A437: 603599.SH | B437: 广信股份 | C437: 9.65 | D437: 基础化工-农化制品-农药 | E437: 15770181755.469999 | F437: 9348086164.3500004 | G437: 8784099179.25 | H437: 8784099179.25 | I437: 563986985.10000002 | J437: =IF(G437=H437,"是","否") -> 是 | K437: =G437/C437 -> 910269345 | L437: =I437/K437 -> 0.61958253147588971
A438: 000906.SZ | B438: 浙商中拓 | C438: 4.43 | D438: 交通运输-物流-物流Ⅲ | E438: 47828805517.209999 | F438: 9341482078.6299992 | G438: 3138928237.9699998 | H438: 3109951984.52 | I438: 6202553840.6599998 | J438: =IF(G438=H438,"是","否") -> 否 | K438: =G438/C438 -> 708561679 | L438: =I438/K438 -> 8.7537246572715084
A439: 601339.SH | B439: 百隆东方 | C439: 4.55 | D439: 纺织服饰-纺织制造-棉纺 | E439: 14942566551.91 | F439: 9339306401.0300007 | G439: 6825000000 | H439: 6825000000 | I439: 2514306401.0300002 | J439: =IF(G439=H439,"是","否") -> 是 | K439: =G439/C439 -> 1500000000 | L439: =I439/K439 -> 1.6762042673533335
A440: 600308.SH | B440: 华泰股份 | C440: 3.06 | D440: 轻工制造-造纸-造纸Ⅲ | E440: 15514293618.34 | F440: 9333125176.5400009 | G440: 4641622738.5600004 | H440: 4641622738.5600004 | I440: 4691502437.9799995 | J440: =IF(G440=H440,"是","否") -> 是 | K440: =G440/C440 -> 1516870176 | L440: =I440/K440 -> 3.0928833015568498
A441: 601015.SH | B441: 陕西黑猫 | C441: 2.79 | D441: 煤炭-煤炭开采加工-焦炭加工 | E441: 21222259552.66 | F441: 9317316318.7900009 | G441: 5698568412.8100004 | H441: 5698568412.8100004 | I441: 3618747905.98 | J441: =IF(G441=H441,"是","否") -> 是 | K441: =G441/C441 -> 2042497639.0000002 | L441: =I441/K441 -> 1.7717268489728715
A442: 000672.SZ | B442: 上峰水泥 | C442: 6.11 | D442: 建筑材料-建筑材料-水泥 | E442: 17649728928.950001 | F442: 9285223625.4799995 | G442: 5923006199.5 | H442: 5923006199.5 | I442: 3362217425.98 | J442: =IF(G442=H442,"是","否") -> 是 | K442: =G442/C442 -> 969395450 | L442: =I442/K442 -> 3.4683651815984899
A443: 600075.SH | B443: 新疆天业 | C443: 3.76 | D443: 基础化工-化学原料-氯碱 | E443: 20219545099.259998 | F443: 9266821206.3899994 | G443: 6419680296.5600004 | H443: 6419680296.5600004 | I443: 2847140909.8299999 | J443: =IF(G443=H443,"是","否") -> 是 | K443: =G443/C443 -> 1707361781.0000002 | L443: =I443/K443 -> 1.6675674373842619
A444: 002541.SZ | B444: 鸿路钢构 | C444: 11.199999999999999 | D444: 建筑装饰-建筑装饰-专业工程 | E444: 24539237711.23 | F444: 9265654701.5400009 | G444: 7728127702.3999996 | H444: 5557130667.1999998 | I444: 1537526999.1400001 | J444: =IF(G444=H444,"是","否") -> 否 | K444: =G444/C444 -> 690011402 | L444: =I444/K444 -> 2.2282631775119568
A445: 688063.SH | B445: 派能科技 | C445: 32.899999999999999 | D445: 电力设备-电池-锂电池 | E445: 11699162469.27 | F445: 9254029736.7700005 | G445: 8072319292.1000004 | H445: 8072319292.1000004 | I445: 1181710444.6700001 | J445: =IF(G445=H445,"是","否") -> 是 | K445: =G445/C445 -> 245359249.00000003 | L445: =I445/K445 -> 4.8162457681389457
A446: 600133.SH | B446: 东湖高新 | C446: 8.57 | D446: 建筑装饰-建筑装饰-基础建设 | E446: 17563050142.150002 | F446: 9233902973.4699993 | G446: 9137675728.75 | H446: 9137675728.75 | I446: 96227244.719999999 | J446: =IF(G446=H446,"是","否") -> 是 | K446: =G446/C446 -> 1066239875 | L446: =I446/K446 -> 9.0249152161937296e-02
A447: 002387.SZ | B447: 维信诺 | C447: 5.99 | D447: 电子-光学光电子-面板 | E447: 40754725706.199997 | F447: 9225146469.3299999 | G447: 8323333314.8400002 | H447: 8291881987.2299995 | I447: 901813154.49000001 | J447: =IF(G447=H447,"是","否") -> 否 | K447: =G447/C447 -> 1389538116 | L447: =I447/K447 -> 0.64900209940696585
A448: 002212.SZ | B448: 天融信 | C448: 4.37 | D448: 计算机-软件开发-横向通用软件 | E448: 10787431849 | F448: 9224143587.1100006 | G448: 5154213451.2299995 | H448: 5101437197.21 | I448: 4069930135.8800001 | J448: =IF(G448=H448,"是","否") -> 否 | K448: =G448/C448 -> 1179453878.9999998 | L448: =I448/K448 -> 3.4506903647056477
A449: 600307.SH | B449: 酒钢宏兴 | C449: 1.25 | D449: 钢铁-钢铁-普钢 | E449: 45973357779.209999 | F449: 9209471446.6100006 | G449: 7829196780 | H449: 7829196780 | I449: 1380274666.6099999 | J449: =IF(G449=H449,"是","否") -> 是 | K449: =G449/C449 -> 6263357424 | L449: =I449/K449 -> 0.2203729682296349
A450: 002585.SZ | B450: 双星新材 | C450: 4.28 | D450: 基础化工-塑料制品-膜材料 | E450: 13003513478.35 | F450: 9113794654.9200001 | G450: 4932637922.8800001 | H450: 3821452929.52 | I450: 4181156732.04 | J450: =IF(G450=H450,"是","否") -> 否 | K450: =G450/C450 -> 1152485496 | L450: =I450/K450 -> 3.6279473768232133
A451: 600683.SH | B451: 京投发展 | C451: 4.05 | D451: 房地产-房地产-住宅开发 | E451: 60005648232.230003 | F451: 9071594897.5400009 | G451: 3000149267.8499999 | H451: 3000149267.8499999 | I451: 6071445629.6899996 | J451: =IF(G451=H451,"是","否") -> 是 | K451: =G451/C451 -> 740777597 | L451: =I451/K451 -> 8.1960437981360812
A452: 002396.SZ | B452: 星网锐捷 | C452: 13.97 | D452: 通信-通信设备-通信网络设备及器件 | E452: 15768644977.32 | F452: 9008961839.6599998 | G452: 8222873569.46 | H452: 8148425483.6599998 | I452: 786088270.20000005 | J452: =IF(G452=H452,"是","否") -> 否 | K452: =G452/C452 -> 588609418 | L452: =I452/K452 -> 1.3355006667596339
A453: 000758.SZ | B453: 中色股份 | C453: 4.09 | D453: 有色金属-工业金属-铅锌 | E453: 19673698176.5 | F453: 8998957305.7700005 | G453: 8150721178.7600002 | H453: 8054495871.46 | I453: 848236127.00999999 | J453: =IF(G453=H453,"是","否") -> 否 | K453: =G453/C453 -> 1992841364.0000002 | L453: =I453/K453 -> 0.42564157003818587
A454: 000885.SZ | B454: 城发环境 | C454: 10.63 | D454: 环保-环境治理-固废治理 | E454: 29583706892.279999 | F454: 8932648236.1200008 | G454: 6825291850.6499996 | H454: 6825291850.6499996 | I454: 2107356385.47 | J454: =IF(G454=H454,"是","否") -> 是 | K454: =G454/C454 -> 642078254.99999988 | L454: =I454/K454 -> 3.2820865199211591
A455: 002258.SZ | B455: 利尔化学 | C455: 6.85 | D455: 基础化工-农化制品-农药 | E455: 14833613831.950001 | F455: 8874224501.3999996 | G455: 5482995011.8000002 | H455: 5474179863.25 | I455: 3391229489.5999999 | J455: =IF(G455=H455,"是","否") -> 否 | K455: =G455/C455 -> 800437228.00000012 | L455: =I455/K455 -> 4.2367213454994364
A456: 600694.SH | B456: 大商股份 | C456: 15.16 | D456: 商贸零售-零售-百货零售 | E456: 17572052077.330002 | F456: 8854823311.3199997 | G456: 4745876976.3599997 | H456: 4745876976.3599997 | I456: 4108946334.96 | J456: =IF(G456=H456,"是","否") -> 是 | K456: =G456/C456 -> 313052571 | L456: =I456/K456 -> 13.125419548015786
A457: 000517.SZ | B457: 荣安地产 | C457: 1.99 | D457: 房地产-房地产-住宅开发 | E457: 33448709244.720001 | F457: 8811644590.3600006 | G457: 6336005745.1499996 | H457: 4959052967.8400002 | I457: 2475638845.21 | J457: =IF(G457=H457,"是","否") -> 否 | K457: =G457/C457 -> 3183922485 | L457: =I457/K457 -> 0.77754369237101573
A458: 000030.SZ | B458: 富奥股份 | C458: 4.36 | D458: 汽车-汽车零部件-底盘与发动机系统 | E458: 16649002309.18 | F458: 8758176311.0100002 | G458: 7517725107.6199999 | H458: 7378033249.96 | I458: 1240451203.3900001 | J458: =IF(G458=H458,"是","否") -> 否 | K458: =G458/C458 -> 1724248877.8944952 | L458: =I458/K458 -> 0.71941540417572003
A459: 300284.SZ | B459: 苏交科 | C459: 6.03 | D459: 建筑装饰-建筑装饰-工程咨询服务 | E459: 16228416042.08 | F459: 8734598832.25 | G459: 7614851477.2200003 | H459: 5445246116.6999998 | I459: 1119747355.03 | J459: =IF(G459=H459,"是","否") -> 否 | K459: =G459/C459 -> 1262827774 | L459: =I459/K459 -> 0.88669839077359414
A460: 002030.SZ | B460: 达安基因 | C460: 5.06 | D460: 医药生物-医疗器械-体外诊断 | E460: 10126297087.24 | F460: 8719795612.3999996 | G460: 7101436921.9200001 | H460: 7101436921.9200001 | I460: 1618358690.48 | J460: =IF(G460=H460,"是","否") -> 是 | K460: =G460/C460 -> 1403446032.0000002 | L460: =I460/K460 -> 1.1531321145094091
A461: 002344.SZ | B461: 海宁皮城 | C461: 3.15 | D461: 商贸零售-零售-商业物业经营 | E461: 13101487602 | F461: 8679383630.1800003 | G461: 4040243424 | H461: 4036567789.8000002 | I461: 4639140206.1800003 | J461: =IF(G461=H461,"是","否") -> 否 | K461: =G461/C461 -> 1282616960 | L461: =I461/K461 -> 3.6169334656076901
A462: 600496.SH | B462: 精工钢构 | C462: 2.39 | D462: 建筑装饰-建筑装饰-专业工程 | E462: 23604387841.900002 | F462: 8676802796.6000004 | G462: 4810793759.0200005 | H462: 4810793759.0200005 | I462: 3866009037.5799999 | J462: =IF(G462=H462,"是","否") -> 是 | K462: =G462/C462 -> 2012884418 | L462: =I462/K462 -> 1.9206314098358725
A463: 000717.SZ | B463: 中南股份 | C463: 1.77 | D463: 钢铁-钢铁-普钢 | E463: 20121578999.130001 | F463: 8664335970.4899998 | G463: 4290206694.3000002 | H463: 4289637196.8000002 | I463: 4374129276.1899996 | J463: =IF(G463=H463,"是","否") -> 否 | K463: =G463/C463 -> 2423845590 | L463: =I463/K463 -> 1.8046237327312584
A464: 600939.SH | B464: 重庆建工 | C464: 2.25 | D464: 建筑装饰-建筑装饰-房屋建设 | E464: 85605291610.389999 | F464: 8653723052.0599995 | G464: 4279033948.5 | H464: 4279033948.5 | I464: 4374689103.5600004 | J464: =IF(G464=H464,"是","否") -> 是 | K464: =G464/C464 -> 1901792866 | L464: =I464/K464 -> 2.3002973571781191
A465: 603113.SH | B465: 金能科技 | C465: 4.54 | D465: 基础化工-化学原料-其他化学原料 | E465: 17968843989.040001 | F465: 8641427248.3899994 | G465: 3849689549.5999999 | H465: 3849689549.5999999 | I465: 4791737698.79 | J465: =IF(G465=H465,"是","否") -> 是 | K465: =G465/C465 -> 847949240 | L465: =I465/K465 -> 5.6509723374361416
A466: 000589.SZ | B466: 贵州轮胎 | C466: 4.33 | D466: 汽车-汽车零部件-轮胎轮毂 | E466: 18235029325.75 | F466: 8620967190.7399998 | G466: 6734256765.3199997 | H466: 6625365492.3199997 | I466: 1886710425.4200001 | J466: =IF(G466=H466,"是","否") -> 否 | K466: =G466/C466 -> 1555255604 | L466: =I466/K466 -> 1.2131191944060664
A467: 600955.SH | B467: 维远股份 | C467: 12.57 | D467: 基础化工-化学原料-其他化学原料 | E467: 13493600761.6 | F467: 8577658358.5200005 | G467: 6913500000 | H467: 4586793000 | I467: 1664158358.52 | J467: =IF(G467=H467,"是","否") -> 否 | K467: =G467/C467 -> 550000000 | L467: =I467/K467 -> 3.0257424700363638
A468: 002539.SZ | B468: 云图控股 | C468: 6.99 | D468: 基础化工-农化制品-复合肥 | E468: 20461543500.700001 | F468: 8569792868.3699999 | G468: 8441989096.3800001 | H468: 6173149019.3999996 | I468: 127803771.98999999 | J468: =IF(G468=H468,"是","否") -> 否 | K468: =G468/C468 -> 1207723762 | L468: =I468/K468 -> 0.10582202322355233
A469: 600929.SH | B469: 雪天盐业 | C469: 5.09 | D469: 基础化工-化学原料-无机盐 | E469: 11636535473.719999 | F469: 8554180417.4499998 | G469: 8445195151 | H469: 6318180850.8199997 | I469: 108985266.45 | J469: =IF(G469=H469,"是","否") -> 否 | K469: =G469/C469 -> 1659173900 | L469: =I469/K469 -> 6.5686463878198667e-02
A470: 002545.SZ | B470: 东方铁塔 | C470: 5.79 | D470: 基础化工-农化制品-钾肥 | E470: 13295001285.780001 | F470: 8537231075.1700001 | G470: 7203119460.5699997 | H470: 6543647869.3199997 | I470: 1334111614.5999999 | J470: =IF(G470=H470,"是","否") -> 否 | K470: =G470/C470 -> 1244062083 | L470: =I470/K470 -> 1.0723834709139672
A471: 601886.SH | B471: 江河集团 | C471: 4.51 | D471: 建筑装饰-建筑装饰-装饰园林 | E471: 28386195149.529999 | F471: 8505888051.7299995 | G471: 5109839290.6000004 | H471: 5109839290.6000004 | I471: 3396048761.1300001 | J471: =IF(G471=H471,"是","否") -> 是 | K471: =G471/C471 -> 1133002060.0000002 | L471: =I471/K471 -> 2.9973897497856266
A472: 600963.SH | B472: 岳阳林纸 | C472: 3.91 | D472: 轻工制造-造纸-造纸Ⅲ | E472: 16347494704.290001 | F472: 8405288920.0900002 | G472: 6904089749.1400003 | H472: 6872090309.1400003 | I472: 1501199170.95 | J472: =IF(G472=H472,"是","否") -> 否 | K472: =G472/C472 -> 1765751854 | L472: =I472/K472 -> 0.85017561643743855
A473: 601330.SH | B473: 绿色动力 | C473: 5.46 | D473: 环保-环境治理-固废治理 | E473: 22515212843.200001 | F473: 8401112286.3999996 | G473: 6569808648.0699997 | H473: 5400442789.5600004 | I473: 1831303638.3299999 | J473: =IF(G473=H473,"是","否") -> 否 | K473: =G473/C473 -> 1203261657.1556776 | L473: =I473/K473 -> 1.521949633680604
A474: 600138.SH | B474: 中青旅 | C474: 9.07 | D474: 社会服务-旅游及酒店-人工景点 | E474: 16954960616.34 | F474: 8387056264.1099997 | G474: 6565228800 | H474: 6565228800 | I474: 1821827464.1099999 | J474: =IF(G474=H474,"是","否") -> 是 | K474: =G474/C474 -> 723840000 | L474: =I474/K474 -> 2.5168924957311005
A475: 601609.SH | B475: 金田股份 | C475: 4.88 | D475: 有色金属-工业金属-铜 | E475: 26743030153.23 | F475: 8364411957.4200001 | G475: 7216996795.6800003 | H475: 7214959346.8800001 | I475: 1147415161.74 | J475: =IF(G475=H475,"是","否") -> 否 | K475: =G475/C475 -> 1478892786 | L475: =I475/K475 -> 0.7758609498957959
A476: 000928.SZ | B476: 中钢国际 | C476: 5.26 | D476: 建筑装饰-建筑装饰-专业工程 | E476: 26603259665.040001 | F476: 8260180440.9499998 | G476: 7546230706.46 | H476: 7546138393.46 | I476: 713949734.49000001 | J476: =IF(G476=H476,"是","否") -> 否 | K476: =G476/C476 -> 1434644621 | L476: =I476/K476 -> 0.49764919063534413
A477: 002243.SZ | B477: 力合科创 | C477: 5.91 | D477: 美容护理-美容护理-化妆品 | E477: 15976346315.030001 | F477: 8241609762.3199997 | G477: 7154670934.29 | H477: 7116480933.8999996 | I477: 1086938828.03 | J477: =IF(G477=H477,"是","否") -> 否 | K477: =G477/C477 -> 1210604219 | L477: =I477/K477 -> 0.89784820750736205
A478: 600618.SH | B478: 氯碱化工 | C478: 7.37 | D478: 基础化工-化学原料-氯碱 | E478: 10493051809.299999 | F478: 8213651702.5900002 | G478: 6942267137.8699999 | H478: 5526320623.1199999 | I478: 1271384564.72 | J478: =IF(G478=H478,"是","否") -> 否 | K478: =G478/C478 -> 941962976.64450467 | L478: =I478/K478 -> 1.3497181908878979
A479: 002375.SZ | B479: 亚厦股份 | C479: 3.15 | D479: 建筑装饰-建筑装饰-装饰园林 | E479: 22089518184.650002 | F479: 8166960327.9399996 | G479: 4220988968.6999998 | H479: 4179400148.6999998 | I479: 3945971359.2399998 | J479: =IF(G479=H479,"是","否") -> 否 | K479: =G479/C479 -> 1339996498 | L479: =I479/K479 -> 2.9447624416403508
A480: 002100.SZ | B480: 天康生物 | C480: 5.7999999999999998 | D480: 农林牧渔-农产品加工-畜禽饲料 | E480: 16652519915.24 | F480: 8151033518.1700001 | G480: 7918458787 | H480: 7918458787 | I480: 232574731.16999999 | J480: =IF(G480=H480,"是","否") -> 是 | K480: =G480/C480 -> 1365251515 | L480: =I480/K480 -> 0.17035302917792403
A481: 600604.SH | B481: 市北高新 | C481: 3.74 | D481: 房地产-房地产-产业地产 | E481: 21596618404.650002 | F481: 8151031625.7200003 | G481: 5685122661.6800003 | H481: 5263880966.96 | I481: 2465908964.04 | J481: =IF(G481=H481,"是","否") -> 否 | K481: =G481/C481 -> 1520086273.1764705 | L481: =I481/K481 -> 1.6222164541273549
A482: 600509.SH | B482: 天富能源 | C482: 4.97 | D482: 公用事业-电力-火电 | E482: 25395219730.16 | F482: 8139919026.6300001 | G482: 6853792056.79 | H482: 6853792056.79 | I482: 1286126969.8399999 | J482: =IF(G482=H482,"是","否") -> 是 | K482: =G482/C482 -> 1379032607 | L482: =I482/K482 -> 0.93262984741012722
A483: 000826.SZ | B483: 启迪环境 | C483: 1.51 | D483: 环保-环境治理-综合环境治理 | E483: 23362583326.369999 | F483: 8127042065.9099998 | G483: 2152283404.48 | H483: 2151897918.0900002 | I483: 5974758661.4300003 | J483: =IF(G483=H483,"是","否") -> 否 | K483: =G483/C483 -> 1425353248 | L483: =I483/K483 -> 4.1917739829151461
A484: 002386.SZ | B484: 天原股份 | C484: 3.64 | D484: 基础化工-化学原料-氯碱 | E484: 20280985971.77 | F484: 8100440627.6800003 | G484: 4737995345.7200003 | H484: 4215685630.52 | I484: 3362445281.96 | J484: =IF(G484=H484,"是","否") -> 否 | K484: =G484/C484 -> 1301647073 | L484: =I484/K484 -> 2.5832234802405614
A485: 600330.SH | B485: 天通股份 | C485: 5.91 | D485: 电子-电子化学品-电子化学品Ⅲ | E485: 11414111687.73 | F485: 8035720943.6000004 | G485: 7289597398.5600004 | H485: 7289597398.5600004 | I485: 746123545.03999996 | J485: =IF(G485=H485,"是","否") -> 是 | K485: =G485/C485 -> 1233434416 | L485: =I485/K485 -> 0.60491545830191917
A486: 600252.SH | B486: 中恒集团 | C486: 1.92 | D486: 医药生物-中药-中药Ⅲ | E486: 11377560007.530001 | F486: 8028637189.0500002 | G486: 6626859751.6800003 | H486: 6576400711.6800003 | I486: 1401777437.3699999 | J486: =IF(G486=H486,"是","否") -> 否 | K486: =G486/C486 -> 3451489454.0000005 | L486: =I486/K486 -> 0.40613696088378654
A487: 300171.SZ | B487: 东富龙 | C487: 9.78 | D487: 医药生物-医疗器械-医疗设备 | E487: 12912852821.530001 | F487: 8028066731.21 | G487: 7489152751.1999998 | H487: 5502143451.8999996 | I487: 538913980.00999999 | J487: =IF(G487=H487,"是","否") -> 否 | K487: =G487/C487 -> 765762040 | L487: =I487/K487 -> 0.703761680338712
A488: 600180.SH | B488: 瑞茂通 | C488: 3.58 | D488: 交通运输-物流-物流Ⅲ | E488: 35736354390.5 | F488: 8025390187.3699999 | G488: 3890126321.1199999 | H488: 3890126321.1199999 | I488: 4135263866.25 | J488: =IF(G488=H488,"是","否") -> 是 | K488: =G488/C488 -> 1086627464 | L488: =I488/K488 -> 3.8055948365483241
A489: 600063.SH | B489: 皖维高新 | C489: 3.22 | D489: 基础化工-化学纤维-其他纤维 | E489: 14455511438.5 | F489: 8009478956.8199997 | G489: 6945244938.5200005 | H489: 6201380908.2399998 | I489: 1064234018.3 | J489: =IF(G489=H489,"是","否") -> 否 | K489: =G489/C489 -> 2156908366 | L489: =I489/K489 -> 0.49340715399682394
A490: 603368.SH | B490: 柳药集团 | C490: 14.99 | D490: 医药生物-医药商业-医药流通 | E490: 21860485832.34 | F490: 8008306352.9700003 | G490: 5981474330.2399998 | H490: 5393591938.29 | I490: 2026832022.73 | J490: =IF(G490=H490,"是","否") -> 否 | K490: =G490/C490 -> 399030976 | L490: =I490/K490 -> 5.0793851721676866
A491: 002727.SZ | B491: 一心堂 | C491: 11.51 | D491: 医药生物-医药商业-药店 | E491: 17498532050.029999 | F491: 7962156382.1300001 | G491: 6860022441.75 | H491: 4692785066.8299999 | I491: 1102133940.3800001 | J491: =IF(G491=H491,"是","否") -> 否 | K491: =G491/C491 -> 596005425 | L491: =I491/K491 -> 1.8492011886972339
A492: 600279.SH | B492: 重庆港 | C492: 3.62 | D492: 交通运输-港口航运-港口 | E492: 12501226419.700001 | F492: 7887005696.9300003 | G492: 4296455944.46 | H492: 4296455944.46 | I492: 3590549752.4699998 | J492: =IF(G492=H492,"是","否") -> 是 | K492: =G492/C492 -> 1186866283 | L492: =I492/K492 -> 3.0252352804178528
A493: 002254.SZ | B493: 泰和新材 | C493: 8.17 | D493: 基础化工-化学纤维-氨纶 | E493: 14433193836.26 | F493: 7885384965.9799995 | G493: 7057205011.1099997 | H493: 6633918430.3999996 | I493: 828179954.87 | J493: =IF(G493=H493,"是","否") -> 否 | K493: =G493/C493 -> 863794983 | L493: =I493/K493 -> 0.95876911902601314
A494: 002573.SZ | B494: 清新环境 | C494: 3.2999999999999998 | D494: 环保-环境治理-大气治理 | E494: 25554862717.150002 | F494: 7881578181.4700003 | G494: 4700482310.6999998 | H494: 4627748990.6999998 | I494: 3181095870.77 | J494: =IF(G494=H494,"是","否") -> 否 | K494: =G494/C494 -> 1424388579 | L494: =I494/K494 -> 2.2333062183096879
A495: 300769.SZ | B495: 德方纳米 | C495: 22.47 | D495: 电力设备-电池-电池化学品 | E495: 19378153115.560001 | F495: 7870309729.3800001 | G495: 6295825034.1000004 | H495: 5656764033.0600004 | I495: 1574484695.28 | J495: =IF(G495=H495,"是","否") -> 否 | K495: =G495/C495 -> 280188030.00000006 | L495: =I495/K495 -> 5.6193860076035351
A496: 002101.SZ | B496: 广东鸿图 | C496: 10.24 | D496: 汽车-汽车零部件-其他汽车零部件 | E496: 12803281498.4 | F496: 7814087561.7200003 | G496: 6806008207.3599997 | H496: 6379098787.8400002 | I496: 1008079354.36 | J496: =IF(G496=H496,"是","否") -> 否 | K496: =G496/C496 -> 664649239 | L496: =I496/K496 -> 1.5167088070042911
A497: 600067.SH | B497: 冠城大通 | C497: 1.86 | D497: 房地产-房地产-住宅开发 | E497: 20517769425.59 | F497: 7758644767.6999998 | G497: 2588503854.54 | H497: 2588503854.54 | I497: 5170140913.1599998 | J497: =IF(G497=H497,"是","否") -> 是 | K497: =G497/C497 -> 1391668739 | L497: =I497/K497 -> 3.7150657827343778
A498: 600619.SH | B498: 海立股份 | C498: 7.17 | D498: 家用电器-白色家电-家电零部件 | E498: 21780220365.48 | F498: 7752136786.9799995 | G498: 6204419977.4799995 | H498: 5658383301.6599998 | I498: 1547716809.5 | J498: =IF(G498=H498,"是","否") -> 否 | K498: =G498/C498 -> 865330540.7921896 | L498: =I498/K498 -> 1.7885845194867409
A499: 603693.SH | B499: 江苏新能 | C499: 8.4000000000000004 | D499: 公用事业-电力-新能源发电 | E499: 17027983257.92 | F499: 7690055189.0799999 | G499: 7488397392 | H499: 6748560000 | I499: 201657797.08000001 | J499: =IF(G499=H499,"是","否") -> 否 | K499: =G499/C499 -> 891475880 | L499: =I499/K499 -> 0.22620667771740499
A500: 600284.SH | B500: 浦东建设 | C500: 5.04 | D500: 建筑装饰-建筑装饰-基础建设 | E500: 29947990870.529999 | F500: 7670223553.1700001 | G500: 4890090240 | H500: 4890090240 | I500: 2780133313.1700001 | J500: =IF(G500=H500,"是","否") -> 是 | K500: =G500/C500 -> 970256000 | L500: =I500/K500 -> 2.8653605988213422
A501: 600658.SH | B501: 电子城 | C501: 4.38 | D501: 房地产-房地产-产业地产 | E501: 18792567621.939999 | F501: 7657571561.8599997 | G501: 4899402497.1000004 | H501: 4899402497.1000004 | I501: 2758169064.7600002 | J501: =IF(G501=H501,"是","否") -> 是 | K501: =G501/C501 -> 1118585045 | L501: =I501/K501 -> 2.4657660828640884
A502: 002643.SZ | B502: 万润股份 | C502: 7.89 | D502: 电子-电子化学品-电子化学品Ⅲ | E502: 10515686724.09 | F502: 7657091455.5299997 | G502: 7338537562.9499998 | H502: 7121796540.8999996 | I502: 318553892.57999998 | J502: =IF(G502=H502,"是","否") -> 否 | K502: =G502/C502 -> 930106155 | L502: =I502/K502 -> 0.34249197348876803
A503: 600828.SH | B503: 茂业商业 | C503: 2.5 | D503: 商贸零售-零售-百货零售 | E503: 19194042620.369999 | F503: 7650801317.8699999 | G503: 4329956365 | H503: 4328400452.5 | I503: 3320844952.8699999 | J503: =IF(G503=H503,"是","否") -> 否 | K503: =G503/C503 -> 1731982546 | L503: =I503/K503 -> 1.9173662924834116
A504: 603612.SH | B504: 索通发展 | C504: 9.97 | D504: 基础化工-非金属材料-非金属材料Ⅲ | E504: 18914100059.66 | F504: 7606296896.1000004 | G504: 5392236255.0799999 | H504: 4966101456.2299995 | I504: 2214060641.02 | J504: =IF(G504=H504,"是","否") -> 否 | K504: =G504/C504 -> 540846164 | L504: =I504/K504 -> 4.0936975953480186
A505: 600278.SH | B505: 东方创业 | C505: 5.79 | D505: 商贸零售-贸易-贸易Ⅲ | E505: 17041627023.98 | F505: 7605821416.1300001 | G505: 5109392650.6499996 | H505: 5045543367.75 | I505: 2496428765.48 | J505: =IF(G505=H505,"是","否") -> 否 | K505: =G505/C505 -> 882451234.99999988 | L505: =I505/K505 -> 2.8289707878078953
A506: 600058.SH | B506: 五矿发展 | C506: 6.26 | D506: 商贸零售-贸易-贸易Ⅲ | E506: 29268671327.529999 | F506: 7587107702.5500002 | G506: 6710161050.8599997 | H506: 6710161050.8599997 | I506: 876946651.69000006 | J506: =IF(G506=H506,"是","否") -> 是 | K506: =G506/C506 -> 1071910711 | L506: =I506/K506 -> 0.81811539215974871
A507: 003012.SZ | B507: 东鹏控股 | C507: 5.2999999999999998 | D507: 轻工制造-家居用品-瓷砖地板 | E507: 11400209066.59 | F507: 7573544207.3599997 | G507: 6216900000 | H507: 6183399097.5 | I507: 1356644207.3599999 | J507: =IF(G507=H507,"是","否") -> 否 | K507: =G507/C507 -> 1173000000 | L507: =I507/K507 -> 1.1565594265643648
A508: 603609.SH | B508: 禾丰股份 | C508: 6.67 | D508: 农林牧渔-农产品加工-畜禽饲料 | E508: 14853926663.620001 | F508: 7490765438.3699999 | G508: 6132623185.8699999 | H508: 6132623185.8699999 | I508: 1358142252.5 | J508: =IF(G508=H508,"是","否") -> 是 | K508: =G508/C508 -> 919433761 | L508: =I508/K508 -> 1.4771507313619301
A509: 600603.SH | B509: ST广物 | C509: 5.17 | D509: 房地产-房地产-住宅开发 | E509: 22556936591.029999 | F509: 7475480255.0900002 | G509: 6361944280.6700001 | H509: 6361944280.6700001 | I509: 1113535974.4200001 | J509: =IF(G509=H509,"是","否") -> 是 | K509: =G509/C509 -> 1230550151 | L509: =I509/K509 -> 0.90490905512066377
A510: 600449.SH | B510: 宁夏建材 | C510: 10.45 | D510: 建筑材料-建筑材料-水泥 | E510: 11486930269.34 | F510: 7469917691.4099998 | G510: 4996991888.8999996 | H510: 4996991888.8999996 | I510: 2472925802.5100002 | J510: =IF(G510=H510,"是","否") -> 是 | K510: =G510/C510 -> 478181042 | L510: =I510/K510 -> 5.1715262323385884
A511: 300376.SZ | B511: ST易事特 | C511: 2.38 | D511: 电力设备-其他电源设备-其他电源设备Ⅲ | E511: 13490227484.879999 | F511: 7451070565.6099997 | G511: 5541212332.8800001 | H511: 5539295064.3800001 | I511: 1909858232.73 | J511: =IF(G511=H511,"是","否") -> 否 | K511: =G511/C511 -> 2328240476 | L511: =I511/K511 -> 0.82030110395263145
A512: 600751.SH | B512: 海航科技 | C512: 2.2000000000000002 | D512: 交通运输-港口航运-航运 | E512: 9372579875.6000004 | F512: 7450414609.0900002 | G512: 5960541776.79 | H512: 5661015914.3999996 | I512: 1489872832.3 | J512: =IF(G512=H512,"是","否") -> 否 | K512: =G512/C512 -> 2709337171.2681818 | L512: =I512/K512 -> 0.5499030715334049
A513: 600110.SH | B513: 诺德股份 | C513: 2.71 | D513: 电力设备-电池-锂电池 | E513: 15584770814.83 | F513: 7398614960.3599997 | G513: 4732940561.7200003 | H513: 4732940561.7200003 | I513: 2665674398.6399999 | J513: =IF(G513=H513,"是","否") -> 是 | K513: =G513/C513 -> 1746472532.0000002 | L513: =I513/K513 -> 1.5263191088309653
A514: 600713.SH | B514: 南京医药 | C514: 4.2000000000000002 | D514: 医药生物-医药商业-医药流通 | E514: 31655450862.759998 | F514: 7387465061.0100002 | G514: 5499169368 | H514: 4396809614.3999996 | I514: 1888295693.01 | J514: =IF(G514=H514,"是","否") -> 否 | K514: =G514/C514 -> 1309326040 | L514: =I514/K514 -> 1.442189061641209
A515: 600780.SH | B515: 通宝能源 | C515: 5.09 | D515: 公用事业-电力-火电 | E515: 10364757114.629999 | F515: 7384868085.5500002 | G515: 5835697842.0699997 | H515: 5835697842.0699997 | I515: 1549170243.48 | J515: =IF(G515=H515,"是","否") -> 是 | K515: =G515/C515 -> 1146502523 | L515: =I515/K515 -> 1.3512139854924681
A516: 600125.SH | B516: 铁龙物流 | C516: 5.19 | D516: 交通运输-公路铁路运输-铁路运输 | E516: 9727182546.3099995 | F516: 7342946018.3999996 | G516: 6775658526.0600004 | H516: 6775658526.0600004 | I516: 567287492.34000003 | J516: =IF(G516=H516,"是","否") -> 是 | K516: =G516/C516 -> 1305521874 | L516: =I516/K516 -> 0.4345292895031187
A517: 600117.SH | B517: 西宁特钢 | C517: 1.99 | D517: 钢铁-钢铁-特钢 | E517: 13158533100.41 | F517: 7287674463.2700005 | G517: 6477678565.4300003 | H517: 6477678565.4300003 | I517: 809995897.84000003 | J517: =IF(G517=H517,"是","否") -> 是 | K517: =G517/C517 -> 3255114857 | L517: =I517/K517 -> 0.24883788542764776
A518: 300323.SZ | B518: 华灿光电 | C518: 4.06 | D518: 电子-光学光电子-LED | E518: 11615496860.84 | F518: 7284750127.6700001 | G518: 6563797115.8199997 | H518: 3051499337.3200002 | I518: 720953011.85000002 | J518: =IF(G518=H518,"是","否") -> 否 | K518: =G518/C518 -> 1616698797 | L518: =I518/K518 -> 0.44594145377470706
A519: 000531.SZ | B519: 穗恒运A | C519: 4.57 | D519: 公用事业-电力-火电 | E519: 19379676862.599998 | F519: 7252454668.9099998 | G519: 4759204087.2399998 | H519: 4157535851.9099998 | I519: 2493250581.6700001 | J519: =IF(G519=H519,"是","否") -> 否 | K519: =G519/C519 -> 1041401331.9999999 | L519: =I519/K519 -> 2.3941303943617389
A520: 688298.SH | B520: 东方生物 | C520: 26.93 | D520: 医药生物-医疗器械-体外诊断 | E520: 8442942831.4099998 | F520: 7186771893.2799997 | G520: 5429088000 | H520: 5429088000 | I520: 1757683893.28 | J520: =IF(G520=H520,"是","否") -> 是 | K520: =G520/C520 -> 201600000 | L520: =I520/K520 -> 8.7186701055555549
A521: 688388.SH | B521: 嘉元科技 | C521: 8.38 | D521: 电力设备-电池-锂电池 | E521: 12587537985.67 | F521: 7178936820.3699999 | G521: 3571874993.0799999 | H521: 3571874993.0799999 | I521: 3607061827.29 | J521: =IF(G521=H521,"是","否") -> 是 | K521: =G521/C521 -> 426238065.99999994 | L521: =I521/K521 -> 8.4625520689416796
A522: 600073.SH | B522: 光明肉业 | C522: 6.02 | D522: 食品饮料-食品加工制造-肉制品 | E522: 14060684044.93 | F522: 7167057478.1800003 | G522: 5645131421.4399996 | H522: 5645131421.4399996 | I522: 1521926056.74 | J522: =IF(G522=H522,"是","否") -> 是 | K522: =G522/C522 -> 937729472 | L522: =I522/K522 -> 1.6229905342465338
A523: 002390.SZ | B523: 信邦制药 | C523: 2.96 | D523: 医药生物-中药-中药Ⅲ | E523: 9005185038.7999992 | F523: 7078526815.6499996 | G523: 5753801529.2799997 | H523: 5480880054.3199997 | I523: 1324725286.3699999 | J523: =IF(G523=H523,"是","否") -> 否 | K523: =G523/C523 -> 1943851868 | L523: =I523/K523 -> 0.68149497818112537
A524: 002758.SZ | B524: 浙农股份 | C524: 7.23 | D524: 综合-综合-综合Ⅲ | E524: 19512811571.349998 | F524: 7063874952.0299997 | G524: 3770790586.77 | H524: 3744878628.27 | I524: 3293084365.2600002 | J524: =IF(G524=H524,"是","否") -> 否 | K524: =G524/C524 -> 521547798.99999994 | L524: =I524/K524 -> 6.3140605167427823
A525: 000006.SZ | B525: 深振业A | C525: 4.42 | D525: 房地产-房地产-住宅开发 | E525: 22587441749.810001 | F525: 7027180475.29 | G525: 5966978103.3199997 | H525: 5966944290.3199997 | I525: 1060202371.97 | J525: =IF(G525=H525,"是","否") -> 否 | K525: =G525/C525 -> 1349995046 | L525: =I525/K525 -> 0.78533797224764035
A526: 000882.SZ | B526: 华联股份 | C526: 1.16 | D526: 商贸零售-零售-商业物业经营 | E526: 12000734867.35 | F526: 6989225906.3699999 | G526: 3175328258.52 | H526: 3173196548.5599999 | I526: 3813897647.8499999 | J526: =IF(G526=H526,"是","否") -> 否 | K526: =G526/C526 -> 2737351947 | L526: =I526/K526 -> 1.393279973380785
A527: 002277.SZ | B527: 友阿股份 | C527: 2.23 | D527: 商贸零售-零售-百货零售 | E527: 15003941011.1 | F527: 6973344854.96 | G527: 3109005344 | H527: 3109005344 | I527: 3864339510.96 | J527: =IF(G527=H527,"是","否") -> 是 | K527: =G527/C527 -> 1394172800 | L527: =I527/K527 -> 2.771779445819055
A528: 600403.SH | B528: 大有能源 | C528: 2.46 | D528: 煤炭-煤炭开采加工-煤炭开采 | E528: 21957507149.91 | F528: 6963881809.9200001 | G528: 5881398508.9200001 | H528: 5881398508.9200001 | I528: 1082483301 | J528: =IF(G528=H528,"是","否") -> 是 | K528: =G528/C528 -> 2390812402 | L528: =I528/K528 -> 0.45276797966016241
A529: 600231.SH | B529: 凌钢股份 | C529: 1.45 | D529: 钢铁-钢铁-普钢 | E529: 14937708517.790001 | F529: 6908932772.1599998 | G529: 4135637766.6500001 | H529: 4135637766.6500001 | I529: 2773295005.5100002 | J529: =IF(G529=H529,"是","否") -> 是 | K529: =G529/C529 -> 2852163977 | L529: =I529/K529 -> 0.97234767281053847
A530: 300409.SZ | B530: 道氏技术 | C530: 9.12 | D530: 电力设备-电池-电池化学品 | E530: 14772787034.08 | F530: 6904810606.3400002 | G530: 5304855999.8400002 | H530: 4441607634.7200003 | I530: 1599954606.5 | J530: =IF(G530=H530,"是","否") -> 否 | K530: =G530/C530 -> 581672807.00000012 | L530: =I530/K530 -> 2.7506092553162791
A531: 002191.SZ | B531: 劲嘉股份 | C531: 3.39 | D531: 轻工制造-包装印刷-包装 | E531: 9107942461.2299995 | F531: 6853274514.8900003 | G531: 4921530247.2600002 | H531: 4884395177.04 | I531: 1931744267.6300001 | J531: =IF(G531=H531,"是","否") -> 否 | K531: =G531/C531 -> 1451778834 | L531: =I531/K531 -> 1.3306050635189244
A532: 000910.SZ | B532: 大亚圣象 | C532: 6.12 | D532: 轻工制造-家居用品-瓷砖地板 | E532: 9273591414.1299992 | F532: 6825714620.54 | G532: 3350072700 | H532: 3348356040 | I532: 3475641920.54 | J532: =IF(G532=H532,"是","否") -> 否 | K532: =G532/C532 -> 547397500 | L532: =I532/K532 -> 6.3493931202462557
A533: 600966.SH | B533: 博汇纸业 | C533: 3.74 | D533: 轻工制造-造纸-造纸Ⅲ | E533: 23210720651.169998 | F533: 6760744849.71 | G533: 4999797637.1199999 | H533: 4999797637.1199999 | I533: 1760947212.5899999 | J533: =IF(G533=H533,"是","否") -> 是 | K533: =G533/C533 -> 1336844288 | L533: =I533/K533 -> 1.3172418271872812
A534: 002250.SZ | B534: 联化科技 | C534: 4.55 | D534: 基础化工-农化制品-农药 | E534: 13603046367.530001 | F534: 6756987952.5100002 | G534: 4200770464.8000002 | H534: 4178935192.25 | I534: 2556217487.71 | J534: =IF(G534=H534,"是","否") -> 否 | K534: =G534/C534 -> 923246256.00000012 | L534: =I534/K534 -> 2.7687277052006802
A535: 002034.SZ | B535: 旺能环境 | C535: 13.16 | D535: 环保-环境治理-固废治理 | E535: 14735908284.299999 | F535: 6736418722.1300001 | G535: 5652170399.96 | H535: 5623826549.8800001 | I535: 1084248322.1700001 | J535: =IF(G535=H535,"是","否") -> 否 | K535: =G535/C535 -> 429496231 | L535: =I535/K535 -> 2.5244652779502506
A536: 002029.SZ | B536: 七匹狼 | C536: 4.94 | D536: 纺织服饰-服装家纺-服装 | E536: 9724181292.2700005 | F536: 6688683011.3000002 | G536: 3482816272.7800002 | H536: 3287105437.46 | I536: 3205866738.52 | J536: =IF(G536=H536,"是","否") -> 否 | K536: =G536/C536 -> 705023537 | L536: =I536/K536 -> 4.5471768959112069
A537: 002039.SZ | B537: 黔源电力 | C537: 14.34 | D537: 公用事业-电力-水电 | E537: 16009820074.67 | F537: 6672610597.5100002 | G537: 6131183526.8400002 | H537: 6131183526.8400002 | I537: 541427070.66999996 | J537: =IF(G537=H537,"是","否") -> 是 | K537: =G537/C537 -> 427558126 | L537: =I537/K537 -> 1.2663238931634759
A538: 600195.SH | B538: 中牧股份 | C538: 5.67 | D538: 农林牧渔-养殖业-动物保健 | E538: 9208018754.4799995 | F538: 6608628831.6999998 | G538: 5789910634.1999998 | H538: 5789910634.1999998 | I538: 818718197.5 | J538: =IF(G538=H538,"是","否") -> 是 | K538: =G538/C538 -> 1021148260 | L538: =I538/K538 -> 0.80176231950882426
A539: 600169.SH | B539: 太原重工 | C539: 1.82 | D539: 机械设备-专用设备-能源及重型设备 | E539: 33397535733.34 | F539: 6588847696.2200003 | G539: 6117487448.8000002 | H539: 6066317530 | I539: 471360247.42000002 | J539: =IF(G539=H539,"是","否") -> 否 | K539: =G539/C539 -> 3361256840 | L539: =I539/K539 -> 0.14023333230911328
A540: 002135.SZ | B540: 东南网架 | C540: 3.6000000000000001 | D540: 建筑装饰-建筑装饰-专业工程 | E540: 19816521896.77 | F540: 6584698251.6199999 | G540: 4138553498.4000001 | H540: 3880611993.5999999 | I540: 2446144753.2199998 | J540: =IF(G540=H540,"是","否") -> 否 | K540: =G540/C540 -> 1149598194 | L540: =I540/K540 -> 2.127825849054874
A541: 300072.SZ | B541: 海新能科 | C541: 2.08 | D541: 基础化工-化学制品-其他化学制品 | E541: 10437713697.370001 | F541: 6579428542.5600004 | G541: 4887418228.1599998 | H541: 4849246066.0799999 | I541: 1692010314.4000001 | J541: =IF(G541=H541,"是","否") -> 否 | K541: =G541/C541 -> 2349720302 | L541: =I541/K541 -> 0.72009009453585604
A542: 000965.SZ | B542: 天保基建 | C542: 2.81 | D542: 房地产-房地产-住宅开发 | E542: 14765451199.82 | F542: 6564822282.9399996 | G542: 3118624814.9499998 | H542: 3118624814.9499998 | I542: 3446197467.9899998 | J542: =IF(G542=H542,"是","否") -> 是 | K542: =G542/C542 -> 1109830895 | L542: =I542/K542 -> 3.1051554642385404
A543: 000652.SZ | B543: 泰达股份 | C543: 3.15 | D543: 综合-综合-综合Ⅲ | E543: 42157875518.620003 | F543: 6561097244.3400002 | G543: 4648057633.8000002 | H543: 4644530443.3500004 | I543: 1913039610.54 | J543: =IF(G543=H543,"是","否") -> 否 | K543: =G543/C543 -> 1475573852 | L543: =I543/K543 -> 1.2964716120084785
A544: 600425.SH | B544: 青松建化 | C544: 3.13 | D544: 建筑材料-建筑材料-水泥 | E544: 9501035238.2199993 | F544: 6543125923.2700005 | G544: 5022722602.9099998 | H544: 4315612969.1800003 | I544: 1520403320.3599999 | J544: =IF(G544=H544,"是","否") -> 否 | K544: =G544/C544 -> 1604703707 | L544: =I544/K544 -> 0.94746669664171212
A545: 000912.SZ | B545: 泸天化 | C545: 3.84 | D545: 基础化工-农化制品-氮肥 | E545: 10100337076.59 | F545: 6539485752.0299997 | G545: 6021120000 | H545: 6021120000 | I545: 518365752.02999997 | J545: =IF(G545=H545,"是","否") -> 是 | K545: =G545/C545 -> 1568000000 | L545: =I545/K545 -> 0.33059040308035714
A546: 000949.SZ | B546: 新乡化纤 | C546: 3.07 | D546: 基础化工-化学纤维-氨纶 | E546: 13078960632.969999 | F546: 6512207901.2299995 | G546: 5220012860.54 | H546: 4501453603.2399998 | I546: 1292195040.6900001 | J546: =IF(G546=H546,"是","否") -> 否 | K546: =G546/C546 -> 1700329922 | L546: =I546/K546 -> 0.75996724163394458
A547: 601011.SH | B547: 宝泰隆 | C547: 1.63 | D547: 煤炭-煤炭开采加工-焦炭加工 | E547: 12374515112.780001 | F547: 6497186399.6400003 | G547: 3122533198.5700002 | H547: 3122533198.5700002 | I547: 3374653201.0700002 | J547: =IF(G547=H547,"是","否") -> 是 | K547: =G547/C547 -> 1915664539.0000002 | L547: =I547/K547 -> 1.7616096828892649
A548: 002768.SZ | B548: 国恩股份 | C548: 17.81 | D548: 基础化工-塑料制品-改性塑料 | E548: 15800952630.860001 | F548: 6494604963.2299995 | G548: 4830962500 | H548: 3147884106.25 | I548: 1663642463.23 | J548: =IF(G548=H548,"是","否") -> 否 | K548: =G548/C548 -> 271250000 | L548: =I548/K548 -> 6.1332441040737331
A549: 600368.SH | B549: 五洲交通 | C549: 3.26 | D549: 交通运输-公路铁路运输-高速公路 | E549: 9335048409.3199997 | F549: 6443217912.4399996 | G549: 5247471577.0799999 | H549: 5247471577.0799999 | I549: 1195746335.3599999 | J549: =IF(G549=H549,"是","否") -> 是 | K549: =G549/C549 -> 1609653858 | L549: =I549/K549 -> 0.74285929823801899
A550: 600790.SH | B550: 轻纺城 | C550: 3.28 | D550: 商贸零售-零售-商业物业经营 | E550: 12193217610.559999 | F550: 6422769086.6400003 | G550: 4807794243.8400002 | H550: 4807794243.8400002 | I550: 1614974842.8 | J550: =IF(G550=H550,"是","否") -> 是 | K550: =G550/C550 -> 1465790928.0000002 | L550: =I550/K550 -> 1.1017770760824355
A551: 603995.SH | B551: 甬金股份 | C551: 15.79 | D551: 钢铁-钢铁-特钢 | E551: 14290702564.450001 | F551: 6421513753.8599997 | G551: 5773094387.96 | H551: 5773094387.96 | I551: 648419365.89999998 | J551: =IF(G551=H551,"是","否") -> 是 | K551: =G551/C551 -> 365617124 | L551: =I551/K551 -> 1.7734928791245566
A552: 000905.SZ | B552: 厦门港务 | C552: 5.51 | D552: 交通运输-港口航运-港口 | E552: 14073484805.98 | F552: 6346982676.8400002 | G552: 4087370879.4699998 | H552: 4087362614.4699998 | I552: 2259611797.3699999 | J552: =IF(G552=H552,"是","否") -> 否 | K552: =G552/C552 -> 741809597 | L552: =I552/K552 -> 3.046080566372074
A553: 601929.SH | B553: 吉视传媒 | C553: 1.11 | D553: 传媒-文化传媒-电视广播 | E553: 13920532513.07 | F553: 6346893408.2700005 | G553: 3873664866.48 | H553: 3873664866.48 | I553: 2473228541.79 | J553: =IF(G553=H553,"是","否") -> 是 | K553: =G553/C553 -> 3489788167.9999995 | L553: =I553/K553 -> 0.70870448942103248
A554: 002042.SZ | B554: 华孚时尚 | C554: 2.99 | D554: 纺织服饰-纺织制造-棉纺 | E554: 17577527193.619999 | F554: 6331886098.5 | G554: 5085037251.4499998 | H554: 5085037251.4499998 | I554: 1246848847.05 | J554: =IF(G554=H554,"是","否") -> 是 | K554: =G554/C554 -> 1700681354.9999998 | L554: =I554/K554 -> 0.73314665524159883
A555: 600622.SH | B555: 光大嘉宝 | C555: 1.88 | D555: 房地产-房地产-住宅开发 | E555: 23913785908.259998 | F555: 6308734637.21 | G555: 2819408555.7600002 | H555: 2819408555.7600002 | I555: 3489326081.4499998 | J555: =IF(G555=H555,"是","否") -> 是 | K555: =G555/C555 -> 1499685402.0000002 | L555: =I555/K555 -> 2.3267053722044562
A556: 600512.SH | B556: 腾达建设 | C556: 1.93 | D556: 建筑装饰-建筑装饰-基础建设 | E556: 10492509078.809999 | F556: 6213226660.4700003 | G556: 3085882465.7600002 | H556: 3063691964.5900002 | I556: 3127344194.71 | J556: =IF(G556=H556,"是","否") -> 否 | K556: =G556/C556 -> 1598902832.0000002 | L556: =I556/K556 -> 1.9559313625069616
A557: 000797.SZ | B557: 中国武夷 | C557: 2.7000000000000002 | D557: 房地产-房地产-住宅开发 | E557: 23929178545.040001 | F557: 6181437968.6400003 | G557: 4241036385.9000001 | H557: 4240549878.3000002 | I557: 1940401582.74 | J557: =IF(G557=H557,"是","否") -> 否 | K557: =G557/C557 -> 1570754217 | L557: =I557/K557 -> 1.2353311305736892
A558: 600433.SH | B558: 冠豪高新 | C558: 2.63 | D558: 轻工制造-造纸-造纸Ⅲ | E558: 10816823359.280001 | F558: 6172271748.2200003 | G558: 4630999292.79 | H558: 4603234382.79 | I558: 1541272455.4300001 | J558: =IF(G558=H558,"是","否") -> 否 | K558: =G558/C558 -> 1760836233 | L558: =I558/K558 -> 0.87530709928888661
A559: 002462.SZ | B559: 嘉事堂 | C559: 10.43 | D559: 医药生物-医药商业-医药流通 | E559: 14792519439.690001 | F559: 6163960436.7700005 | G559: 3042505261.5999999 | H559: 3040036470.1700001 | I559: 3121455175.1700001 | J559: =IF(G559=H559,"是","否") -> 否 | K559: =G559/C559 -> 291707120 | L559: =I559/K559 -> 10.700647879866628
A560: 600370.SH | B560: 三房巷 | C560: 1.38 | D560: 基础化工-化学纤维-涤纶 | E560: 18628953902.400002 | F560: 6131664131.7299995 | G560: 5376968397.1800003 | H560: 5376968397.1800003 | I560: 754695734.54999995 | J560: =IF(G560=H560,"是","否") -> 是 | K560: =G560/C560 -> 3896353911.0000005 | L560: =I560/K560 -> 0.19369280917202591
A561: 002932.SZ | B561: 明德生物 | C561: 15.5 | D561: 医药生物-医疗器械-体外诊断 | E561: 6933422004.0299997 | F561: 6128653230.8800001 | G561: 3604074833.5 | H561: 2419319995.5 | I561: 2524578397.3800001 | J561: =IF(G561=H561,"是","否") -> 否 | K561: =G561/C561 -> 232520957 | L561: =I561/K561 -> 10.857423046732086
A562: 688275.SH | B562: 万润新能 | C562: 24.51 | D562: 电力设备-电池-电池化学品 | E562: 17398407534.380001 | F562: 6120190628.2600002 | G562: 3091163528.1300001 | H562: 1934493098.3699999 | I562: 3029027100.1300001 | J562: =IF(G562=H562,"是","否") -> 否 | K562: =G562/C562 -> 126118463 | L562: =I562/K562 -> 24.017316958025408
A563: 603071.SH | B563: 物产环能 | C563: 10.49 | D563: 交通运输-物流-物流Ⅲ | E563: 11882277513.07 | F563: 6096305547.6899996 | G563: 5852942096.5799999 | H563: 2493313531.02 | I563: 243363451.11000001 | J563: =IF(G563=H563,"是","否") -> 否 | K563: =G563/C563 -> 557954442 | L563: =I563/K563 -> 0.43617082828063586
A564: 000055.SZ | B564: 方大集团 | C564: 3.33 | D564: 建筑材料-建筑材料-其他建材 | E564: 13756615957.93 | F564: 6087238659.9899998 | G564: 2781573219.8099999 | H564: 2250595248.5700002 | I564: 3305665440.1799998 | J564: =IF(G564=H564,"是","否") -> 否 | K564: =G564/C564 -> 835307273.21621621 | L564: =I564/K564 -> 3.9574244666301865
A565: 600569.SH | B565: 安阳钢铁 | C565: 1.36 | D565: 钢铁-钢铁-普钢 | E565: 45483168067.660004 | F565: 6082037157.1000004 | G565: 3906493084.96 | H565: 3906493084.96 | I565: 2175544072.1399999 | J565: =IF(G565=H565,"是","否") -> 是 | K565: =G565/C565 -> 2872421386 | L565: =I565/K565 -> 0.75739029194792373
A566: 001330.SZ | B566: 博纳影业 | C566: 4.07 | D566: 传媒-影视院线-影视院线Ⅲ | E566: 14909145217.030001 | F566: 6017371701.4899998 | G566: 5594292264.8800001 | H566: 4294574805.9499998 | I566: 423079436.61000001 | J566: =IF(G566=H566,"是","否") -> 否 | K566: =G566/C566 -> 1374518984 | L566: =I566/K566 -> 0.30780181396898043
A567: 300443.SZ | B567: 金雷股份 | C567: 15 | D567: 电力设备-风电设备-风电零部件 | E567: 6519111428.21 | F567: 6014555255.21 | G567: 4802018970 | H567: 3641610675 | I567: 1212536285.21 | J567: =IF(G567=H567,"是","否") -> 否 | K567: =G567/C567 -> 320134598 | L567: =I567/K567 -> 3.7875827629539747
A568: 000557.SZ | B568: 西部创业 | C568: 4 | D568: 交通运输-公路铁路运输-铁路运输 | E568: 6421395314.5699997 | F568: 6003345021.4300003 | G568: 5833498940 | H568: 5831664792 | I568: 169846081.43000001 | J568: =IF(G568=H568,"是","否") -> 否 | K568: =G568/C568 -> 1458374735 | L568: =I568/K568 -> 0.11646257806982648
A569: 300080.SZ | B569: 易成新能 | C569: 2.92 | D569: 电力设备-光伏设备-光伏电池组件 | E569: 16078082789.16 | F569: 5992807645.6800003 | G569: 5470270873.1199999 | H569: 3786159497.8000002 | I569: 522536772.56 | J569: =IF(G569=H569,"是","否") -> 否 | K569: =G569/C569 -> 1873380436 | L569: =I569/K569 -> 0.27892720694559447
A570: 002283.SZ | B570: 天润工业 | C570: 3.99 | D570: 汽车-汽车零部件-底盘与发动机系统 | E570: 8490238146.3500004 | F570: 5962513248.5699997 | G570: 4546434140.2200003 | H570: 3995854902.0599999 | I570: 1416079108.3499999 | J570: =IF(G570=H570,"是","否") -> 否 | K570: =G570/C570 -> 1139457178 | L570: =I570/K570 -> 1.2427664116658887
A571: 000036.SZ | B571: 华联控股 | C571: 3.17 | D571: 房地产-房地产-住宅开发 | E571: 7737167591.2399998 | F571: 5950952349.4399996 | G571: 4704070859.25 | H571: 4693736484.8999996 | I571: 1246881490.1900001 | J571: =IF(G571=H571,"是","否") -> 否 | K571: =G571/C571 -> 1483934025 | L571: =I571/K571 -> 0.84025399322587813
A572: 000881.SZ | B572: 中广核技 | C572: 5.84 | D572: 基础化工-化学制品-其他化学制品 | E572: 11174022032.639999 | F572: 5940639659.6400003 | G572: 5521286759.6000004 | H572: 4615609141.04 | I572: 419352900.04000002 | J572: =IF(G572=H572,"是","否") -> 否 | K572: =G572/C572 -> 945425815.00000012 | L572: =I572/K572 -> 0.44355981546791162
A573: 688598.SH | B573: 金博股份 | C573: 14.79 | D573: 电力设备-光伏设备-光伏辅材 | E573: 6839917699.3400002 | F573: 5904312063.8599997 | G573: 3019495577.6399999 | H573: 3019495577.6399999 | I573: 2884816486.2199998 | J573: =IF(G573=H573,"是","否") -> 是 | K573: =G573/C573 -> 204157916 | L573: =I573/K573 -> 14.130319033135114
A574: 300355.SZ | B574: 蒙草生态 | C574: 2.2999999999999998 | D574: 环保-环境治理-综合环境治理 | E574: 15483429849.25 | F574: 5903183250.5500002 | G574: 3689756786.3000002 | H574: 3141951326.1999998 | I574: 2213426464.25 | J574: =IF(G574=H574,"是","否") -> 否 | K574: =G574/C574 -> 1604242081.0000002 | L574: =I574/K574 -> 1.3797334519926483
A575: 000968.SZ | B575: 蓝焰控股 | C575: 5.59 | D575: 石油石化-油气开采及服务-油气开采 | E575: 11179757527.01 | F575: 5901430472.0200005 | G575: 5408339869.3999996 | H575: 5408339869.3999996 | I575: 493090602.62 | J575: =IF(G575=H575,"是","否") -> 是 | K575: =G575/C575 -> 967502660 | L575: =I575/K575 -> 0.50965296841664498
A576: 603367.SH | B576: 辰欣药业 | C576: 11.83 | D576: 医药生物-化学制药-化学制剂 | E576: 7288277470.0299997 | F576: 5838600197.25 | G576: 5356205561.0699997 | H576: 5356081346.0699997 | I576: 482394636.18000001 | J576: =IF(G576=H576,"是","否") -> 否 | K576: =G576/C576 -> 452764629 | L576: =I576/K576 -> 1.0654424071187769
A577: 600881.SH | B577: 亚泰集团 | C577: 1.06 | D577: 综合-综合-综合Ⅲ | E577: 45075218527.360001 | F577: 5838089558.1700001 | G577: 3443848403.2800002 | H577: 3443848403.2800002 | I577: 2394241154.8899999 | J577: =IF(G577=H577,"是","否") -> 是 | K577: =G577/C577 -> 3248913588 | L577: =I577/K577 -> 0.73693592951601761
A578: 000417.SZ | B578: 合百集团 | C578: 4.21 | D578: 商贸零售-零售-百货零售 | E578: 12515150035.559999 | F578: 5820378136.4200001 | G578: 3283312482 | H578: 3279705568.71 | I578: 2537065654.4200001 | J578: =IF(G578=H578,"是","否") -> 否 | K578: =G578/C578 -> 779884200 | L578: =I578/K578 -> 3.253131239766109
A579: 600162.SH | B579: 香江控股 | C579: 1.34 | D579: 房地产-房地产-住宅开发 | E579: 18408104109.349998 | F579: 5815744983.9399996 | G579: 4379707083.4799995 | H579: 4379707083.4799995 | I579: 1436037900.46 | J579: =IF(G579=H579,"是","否") -> 是 | K579: =G579/C579 -> 3268438121.9999995 | L579: =I579/K579 -> 0.43936517898073896
A580: 601515.SH | B580: 东峰集团 | C580: 2.33 | D580: 轻工制造-包装印刷-包装 | E580: 7018178847.0200005 | F580: 5773413359.0699997 | G580: 4294111259.98 | H580: 4294111259.98 | I580: 1479302099.0899999 | J580: =IF(G580=H580,"是","否") -> 是 | K580: =G580/C580 -> 1842966206 | L580: =I580/K580 -> 0.80267456574838569
A581: 002106.SZ | B581: 莱宝高科 | C581: 7.52 | D581: 电子-光学光电子-面板 | E581: 9201239265.8799992 | F581: 5753666367.04 | G581: 5307737523.1999998 | H581: 5294462166.3999996 | I581: 445928843.83999997 | J581: =IF(G581=H581,"是","否") -> 否 | K581: =G581/C581 -> 705816160 | L581: =I581/K581 -> 0.63179177399395325
A582: 000631.SZ | B582: 顺发恒业 | C582: 2.33 | D582: 综合-综合-综合Ⅲ | E582: 7009248390.9399996 | F582: 5752826222.0799999 | G582: 5581000265.7200003 | H582: 5581000265.7200003 | I582: 171825956.36000001 | J582: =IF(G582=H582,"是","否") -> 是 | K582: =G582/C582 -> 2395279084 | L582: =I582/K582 -> 7.1735255197510839e-02
A583: 300981.SZ | B583: 中红医疗 | C583: 9.53 | D583: 医药生物-医疗器械-医疗耗材 | E583: 7461891884.2299995 | F583: 5745407150.1800003 | G583: 3716774334 | H583: 3406327674.75 | I583: 2028632816.1800001 | J583: =IF(G583=H583,"是","否") -> 否 | K583: =G583/C583 -> 390007800 | L583: =I583/K583 -> 5.2015185752182393
A584: 301109.SZ | B584: 军信股份 | C584: 13.81 | D584: 环保-环境治理-固废治理 | E584: 9704890122.8299999 | F584: 5721256307.0500002 | G584: 5662238100 | H584: 1362367976.1099999 | I584: 59018207.049999997 | J584: =IF(G584=H584,"是","否") -> 否 | K584: =G584/C584 -> 410010000 | L584: =I584/K584 -> 0.14394333565034997
A585: 002589.SZ | B585: 瑞康医药 | C585: 2.35 | D585: 医药生物-医药商业-医药流通 | E585: 15725268636.690001 | F585: 5693573500.1199999 | G585: 3536069606.8499999 | H585: 3209140137.8000002 | I585: 2157503893.27 | J585: =IF(G585=H585,"是","否") -> 否 | K585: =G585/C585 -> 1504710471 | L585: =I585/K585 -> 1.4338332422423874
A586: 300569.SZ | B586: 天能重工 | C586: 3.94 | D586: 电力设备-风电设备-风电零部件 | E586: 11891300755.379999 | F586: 5693517038.5200005 | G586: 4029338743.52 | H586: 3680948274.1399999 | I586: 1664178295 | J586: =IF(G586=H586,"是","否") -> 否 | K586: =G586/C586 -> 1022674808 | L586: =I586/K586 -> 1.6272800326963759
A587: 600551.SH | B587: 时代出版 | C587: 7.95 | D587: 传媒-文化传媒-出版 | E587: 8533225215.3599997 | F587: 5678915411.1700001 | G587: 5390539150.0500002 | H587: 5390539150.0500002 | I587: 288376261.12 | J587: =IF(G587=H587,"是","否") -> 是 | K587: =G587/C587 -> 678055239 | L587: =I587/K587 -> 0.4252990678831699
A588: 603301.SH | B588: 振德医疗 | C588: 19.92 | D588: 医药生物-医疗器械-医疗耗材 | E588: 7795782199.4200001 | F588: 5674377897.0799999 | G588: 5307707943.8400002 | H588: 5307707943.8400002 | I588: 366669953.24000001 | J588: =IF(G588=H588,"是","否") -> 是 | K588: =G588/C588 -> 266451201.99999997 | L588: =I588/K588 -> 1.3761242227010109
A589: 301216.SZ | B589: 万凯新材 | C589: 9.25 | D589: 基础化工-化学制品-聚氨酯 | E589: 14432161778.459999 | F589: 5651716935.0600004 | G589: 4764611175 | H589: 2633445834.75 | I589: 887105760.05999994 | J589: =IF(G589=H589,"是","否") -> 否 | K589: =G589/C589 -> 515093100 | L589: =I589/K589 -> 1.7222241184360652
A590: 002307.SZ | B590: 北新路桥 | C590: 2.89 | D590: 建筑装饰-建筑装饰-基础建设 | E590: 55985015219.029999 | F590: 5624200375.3599997 | G590: 3665362671.98 | H590: 3153078772.1300001 | I590: 1958837703.3800001 | J590: =IF(G590=H590,"是","否") -> 否 | K590: =G590/C590 -> 1268291582 | L590: =I590/K590 -> 1.5444695298624163
A591: 600292.SH | B591: 远达环保 | C591: 4.83 | D591: 环保-环境治理-大气治理 | E591: 9449809295.9400005 | F591: 5613702542.2200003 | G591: 3771345578.6999998 | H591: 3771345578.6999998 | I591: 1842356963.52 | J591: =IF(G591=H591,"是","否") -> 是 | K591: =G591/C591 -> 780816890 | L591: =I591/K591 -> 2.3595249886564313
A592: 600853.SH | B592: 龙建股份 | C592: 3.05 | D592: 建筑装饰-建筑装饰-基础建设 | E592: 35183693751.910004 | F592: 5613500483.1000004 | G592: 3095071515.3000002 | H592: 3076998435.3000002 | I592: 2518428967.8000002 | J592: =IF(G592=H592,"是","否") -> 否 | K592: =G592/C592 -> 1014777546.0000001 | L592: =I592/K592 -> 2.4817547232169441
A593: 002067.SZ | B593: 景兴纸业 | C593: 2.7000000000000002 | D593: 轻工制造-造纸-造纸Ⅲ | E593: 8072795515.3800001 | F593: 5606265714.3599997 | G593: 3223734174 | H593: 2853159174 | I593: 2382531540.3600001 | J593: =IF(G593=H593,"是","否") -> 否 | K593: =G593/C593 -> 1193975620 | L593: =I593/K593 -> 1.9954607953887702
A594: 600477.SH | B594: 杭萧钢构 | C594: 2.19 | D594: 建筑装饰-建筑装饰-专业工程 | E594: 16218262806.23 | F594: 5586618814.0200005 | G594: 5188035868.5 | H594: 5188035868.5 | I594: 398582945.51999998 | J594: =IF(G594=H594,"是","否") -> 是 | K594: =G594/C594 -> 2368966150 | L594: =I594/K594 -> 0.16825185345936663
A595: 002641.SZ | B595: 公元股份 | C595: 3.86 | D595: 建筑材料-建筑材料-管材 | E595: 8770772322.2000008 | F595: 5557440901.96 | G595: 4744302342.0600004 | H595: 4377219360.5799999 | I595: 813138559.89999998 | J595: =IF(G595=H595,"是","否") -> 否 | K595: =G595/C595 -> 1229093871.0000002 | L595: =I595/K595 -> 0.6615756363982388
A596: 600081.SH | B596: 东风科技 | C596: 8.26 | D596: 汽车-汽车零部件-车身附件及饰件 | E596: 9995303939.6200008 | F596: 5551905617.6300001 | G596: 4567996164.1999998 | H596: 4567996164.1999998 | I596: 983909453.42999995 | J596: =IF(G596=H596,"是","否") -> 是 | K596: =G596/C596 -> 553026170 | L596: =I596/K596 -> 1.7791372394366074
A597: 833819.BJ | B597: 颖泰生物 | C597: 2.17 | D597: 基础化工-农化制品-农药 | E597: 12734196624.68 | F597: 5550277997.6000004 | G597: 2659986000 | H597: 2621513527.5 | I597: 2890291997.5999999 | J597: =IF(G597=H597,"是","否") -> 否 | K597: =G597/C597 -> 1225800000 | L597: =I597/K597 -> 2.3578821974220916
A598: 002109.SZ | B598: 兴化股份 | C598: 2.44 | D598: 基础化工-化学原料-其他化学原料 | E598: 11574750957.700001 | F598: 5544593052.6700001 | G598: 3114098436.4400001 | H598: 3114098436.4400001 | I598: 2430494616.23 | J598: =IF(G598=H598,"是","否") -> 是 | K598: =G598/C598 -> 1276269851 | L598: =I598/K598 -> 1.9043736043170074
A599: 002478.SZ | B599: 常宝股份 | C599: 4.36 | D599: 钢铁-钢铁-特钢 | E599: 8016365340.8100004 | F599: 5524027236.6000004 | G599: 3929921874.0799999 | H599: 3116627791.6799998 | I599: 1594105362.52 | J599: =IF(G599=H599,"是","否") -> 否 | K599: =G599/C599 -> 901358227.99999988 | L599: =I599/K599 -> 1.7685591732569175
A600: 601008.SH | B600: 连云港 | C600: 3.35 | D600: 交通运输-港口航运-港口 | E600: 13037089394.18 | F600: 5508245434.4099998 | G600: 4156137320.0999999 | H600: 4156137320.0999999 | I600: 1352108114.3099999 | J600: =IF(G600=H600,"是","否") -> 是 | K600: =G600/C600 -> 1240638006 | L600: =I600/K600 -> 1.0898490194326675
A601: 600168.SH | B601: 武汉控股 | C601: 3.69 | D601: 环保-环境治理-水务及水治理 | E601: 23107049075.849998 | F601: 5504614247.1400003 | G601: 3665637029.6100001 | H601: 3665637029.6100001 | I601: 1838977217.53 | J601: =IF(G601=H601,"是","否") -> 是 | K601: =G601/C601 -> 993397569 | L601: =I601/K601 -> 1.851199635389887
A602: 601518.SH | B602: 吉林高速 | C602: 2.2999999999999998 | D602: 交通运输-公路铁路运输-高速公路 | E602: 6768714303.04 | F602: 5499031063.1800003 | G602: 4348272288.6999998 | H602: 4348272288.6999998 | I602: 1150758774.48 | J602: =IF(G602=H602,"是","否") -> 是 | K602: =G602/C602 -> 1890553169 | L602: =I602/K602 -> 0.60868892414630626
A603: 300055.SZ | B603: 万邦达 | C603: 3.88 | D603: 石油石化-石油加工贸易-石油加工 | E603: 7645164640.2299995 | F603: 5497679779.25 | G603: 3246588471.2800002 | H603: 2454880438.7199998 | I603: 2251091307.9699998 | J603: =IF(G603=H603,"是","否") -> 否 | K603: =G603/C603 -> 836749606.00000012 | L603: =I603/K603 -> 2.690280690696853
A604: 688660.SH | B604: 电气风电 | C604: 3.05 | D604: 电力设备-风电设备-风电整机 | E604: 25126562323.389999 | F604: 5493258866.9899998 | G604: 4066666870 | H604: 4066666870 | I604: 1426591996.99 | J604: =IF(G604=H604,"是","否") -> 是 | K604: =G604/C604 -> 1333333400 | L604: =I604/K604 -> 1.0699439442453027
A605: 002392.SZ | B605: 北京利尔 | C605: 3.01 | D605: 建筑材料-建筑材料-耐火材料 | E605: 9186984762.1000004 | F605: 5464857288.3800001 | G605: 3583377425.3899999 | H605: 2740001046.5100002 | I605: 1881479862.99 | J605: =IF(G605=H605,"是","否") -> 否 | K605: =G605/C605 -> 1190490839 | L605: =I605/K605 -> 1.5804236381780339
A606: 600676.SH | B606: 交运股份 | C606: 3.17 | D606: 综合-综合-综合Ⅲ | E606: 7379887773.9399996 | F606: 5457801178.8999996 | G606: 3260322632.48 | H606: 3260322632.48 | I606: 2197478546.4200001 | J606: =IF(G606=H606,"是","否") -> 是 | K606: =G606/C606 -> 1028492944 | L606: =I606/K606 -> 2.1366005078008588
A607: 300057.SZ | B607: 万顺新材 | C607: 3.96 | D607: 有色金属-工业金属-铝 | E607: 10498946679.27 | F607: 5440091490.5799999 | G607: 3606075693 | H607: 2922597612 | I607: 1834015797.5799999 | J607: =IF(G607=H607,"是","否") -> 否 | K607: =G607/C607 -> 910625175 | L607: =I607/K607 -> 2.0140183337013497
A608: 600629.SH | B608: 华建集团 | C608: 4.42 | D608: 建筑装饰-建筑装饰-工程咨询服务 | E608: 15076409671.370001 | F608: 5412214197.96 | G608: 4289857687.96 | H608: 4175392576.6799998 | I608: 1122356510 | J608: =IF(G608=H608,"是","否") -> 否 | K608: =G608/C608 -> 970556038 | L608: =I608/K608 -> 1.156405674743739
A609: 600758.SH | B609: 辽宁能源 | C609: 2.76 | D609: 煤炭-煤炭开采加工-煤炭开采 | E609: 12848538897.700001 | F609: 5382793410.46 | G609: 3648768007.4400001 | H609: 3645251767.4400001 | I609: 1734025403.02 | J609: =IF(G609=H609,"是","否") -> 否 | K609: =G609/C609 -> 1322017394.0000002 | L609: =I609/K609 -> 1.3116509744046527
A610: 300197.SZ | B610: 节能铁汉 | C610: 1.39 | D610: 环保-环境治理-综合环境治理 | E610: 29298224316.880001 | F610: 5381633658.8400002 | G610: 4121764331.1999998 | H610: 4121764331.1999998 | I610: 1259869327.6400001 | J610: =IF(G610=H610,"是","否") -> 是 | K610: =G610/C610 -> 2965298080 | L610: =I610/K610 -> 0.4248710563492491
A611: 600668.SH | B611: 尖峰集团 | C611: 8.29 | D611: 建筑材料-建筑材料-水泥 | E611: 7012622546.9099998 | F611: 5371832466.3199997 | G611: 2852454934.1199999 | H611: 2852454934.1199999 | I611: 2519377532.1999998 | J611: =IF(G611=H611,"是","否") -> 是 | K611: =G611/C611 -> 344083828 | L611: =I611/K611 -> 7.3219876297121402
A612: 002538.SZ | B612: 司尔特 | C612: 4.69 | D612: 基础化工-农化制品-复合肥 | E612: 6449598822.3599997 | F612: 5308970238.8800001 | G612: 4003176528.4699998 | H612: 4003176528.4699998 | I612: 1305793710.4100001 | J612: =IF(G612=H612,"是","否") -> 是 | K612: =G612/C612 -> 853555762.99999988 | L612: =I612/K612 -> 1.5298282397163081
A613: 000822.SZ | B613: 山东海化 | C613: 4.81 | D613: 基础化工-化学原料-纯碱 | E613: 8295803312.1700001 | F613: 5304313676.1199999 | G613: 4305392164.0600004 | H613: 4305392164.0600004 | I613: 998921512.05999994 | J613: =IF(G613=H613,"是","否") -> 是 | K613: =G613/C613 -> 895091926.00000012 | L613: =I613/K613 -> 1.1159987963739042
A614: 601789.SH | B614: 宁波建工 | C614: 3.3999999999999999 | D614: 建筑装饰-建筑装饰-房屋建设 | E614: 29841041678.84 | F614: 5302364649.7700005 | G614: 3695115206 | H614: 3695115206 | I614: 1607249443.77 | J614: =IF(G614=H614,"是","否") -> 是 | K614: =G614/C614 -> 1086798590 | L614: =I614/K614 -> 1.4788843660259072
A615: 600981.SH | B615: 汇鸿集团 | C615: 1.81 | D615: 商贸零售-贸易-贸易Ⅲ | E615: 25377765519.990002 | F615: 5278916104.8500004 | G615: 4058804077.52 | H615: 4058804077.52 | I615: 1220112027.3299999 | J615: =IF(G615=H615,"是","否") -> 是 | K615: =G615/C615 -> 2242433192 | L615: =I615/K615 -> 0.54410184066255118
A616: 000823.SZ | B616: 超声电子 | C616: 7.44 | D616: 电子-元件-印制电路板 | E616: 8274620834.8599997 | F616: 5231776765.8400002 | G616: 3995205280.0799999 | H616: 3994866849.3600001 | I616: 1236571485.76 | J616: =IF(G616=H616,"是","否") -> 否 | K616: =G616/C616 -> 536989957 | L616: =I616/K616 -> 2.3027832637100882
A617: 000936.SZ | B617: 华西股份 | C617: 5.33 | D617: 基础化工-化学纤维-涤纶 | E617: 6586762890.9300003 | F617: 5174879168 | G617: 4722448687.71 | H617: 4721779506.21 | I617: 452430480.29000002 | J617: =IF(G617=H617,"是","否") -> 否 | K617: =G617/C617 -> 886012887 | L617: =I617/K617 -> 0.51063645566365223
A618: 688075.SH | B618: 安旭生物 | C618: 31.56 | D618: 医药生物-医疗器械-体外诊断 | E618: 5796453539.0900002 | F618: 5171271491.96 | G618: 4010733325.8000002 | H618: 1002686605.8 | I618: 1160538166.1600001 | J618: =IF(G618=H618,"是","否") -> 否 | K618: =G618/C618 -> 127082805.00000001 | L618: =I618/K618 -> 9.1321415683262579
A619: 000404.SZ | B619: 长虹华意 | C619: 6.2000000000000002 | D619: 家用电器-白色家电-家电零部件 | E619: 15106116657 | F619: 5153849519.5900002 | G619: 4315175069.8000002 | H619: 4296532866.3999996 | I619: 838674449.78999996 | J619: =IF(G619=H619,"是","否") -> 否 | K619: =G619/C619 -> 695995979 | L619: =I619/K619 -> 1.2049989871996085
A620: 000042.SZ | B620: 中洲控股 | C620: 3.86 | D620: 房地产-房地产-住宅开发 | E620: 32148617393.720001 | F620: 5144360872.54 | G620: 2566248196.54 | H620: 2562892169.7199998 | I620: 2578112676 | J620: =IF(G620=H620,"是","否") -> 否 | K620: =G620/C620 -> 664831139 | L620: =I620/K620 -> 3.8778458540282061
A621: 603035.SH | B621: 常熟汽饰 | C621: 12.44 | D621: 汽车-汽车零部件-车身附件及饰件 | E621: 10147638059.610001 | F621: 5109854282.8900003 | G621: 4727584806.5200005 | H621: 4727584806.5200005 | I621: 382269476.37 | J621: =IF(G621=H621,"是","否") -> 是 | K621: =G621/C621 -> 380030933.00000006 | L621: =I621/K621 -> 1.0058904241092395
A622: 300737.SZ | B622: 科顺股份 | C622: 4.11 | D622: 建筑材料-建筑材料-其他建材 | E622: 14149618002.370001 | F622: 5109323741.8100004 | G622: 4838663301.5100002 | H622: 3698989424.9699998 | I622: 270660440.30000001 | J622: =IF(G622=H622,"是","否") -> 否 | K622: =G622/C622 -> 1177290341 | L622: =I622/K622 -> 0.22990118144526595
A623: 600798.SH | B623: 宁波海运 | C623: 2.62 | D623: 交通运输-港口航运-航运 | E623: 6557944968.1599998 | F623: 5098267448.1300001 | G623: 3161119606.6199999 | H623: 3161119606.6199999 | I623: 1937147841.51 | J623: =IF(G623=H623,"是","否") -> 是 | K623: =G623/C623 -> 1206534201 | L623: =I623/K623 -> 1.6055473934385387
A624: 002303.SZ | B624: 美盈森 | C624: 2.65 | D624: 轻工制造-包装印刷-包装 | E624: 8056552259.1599998 | F624: 5084977481.9399996 | G624: 4058007765.25 | H624: 2103809642.1500001 | I624: 1026969716.6900001 | J624: =IF(G624=H624,"是","否") -> 否 | K624: =G624/C624 -> 1531323685 | L624: =I624/K624 -> 0.67064182886324264
A625: 600716.SH | B625: 凤凰股份 | C625: 2.77 | D625: 房地产-房地产-住宅开发 | E625: 7932934630.4899998 | F625: 5081506863.6400003 | G625: 2592887834.3000002 | H625: 2592887834.3000002 | I625: 2488619029.3400002 | J625: =IF(G625=H625,"是","否") -> 是 | K625: =G625/C625 -> 936060590.00000012 | L625: =I625/K625 -> 2.6586089147712113
A626: 300158.SZ | B626: 振东制药 | C626: 3.24 | D626: 医药生物-化学制药-化学制剂 | E626: 5924924761.3299999 | F626: 5071535755 | G626: 3257236009.4400001 | H626: 3243708306.3600001 | I626: 1814299745.5599999 | J626: =IF(G626=H626,"是","否") -> 否 | K626: =G626/C626 -> 1005319756 | L626: =I626/K626 -> 1.8046991862358268
A627: 002108.SZ | B627: 沧州明珠 | C627: 2.99 | D627: 基础化工-塑料制品-其他塑料制品 | E627: 7286858265.6300001 | F627: 5066851654.6300001 | G627: 5001366320.3400002 | H627: 4928607480.9399996 | I627: 65485334.289999999 | J627: =IF(G627=H627,"是","否") -> 否 | K627: =G627/C627 -> 1672697766 | L627: =I627/K627 -> 3.9149531745115033e-02
A628: 300850.SZ | B628: 新强联 | C628: 13.98 | D628: 电力设备-风电设备-风电零部件 | E628: 10146045907.299999 | F628: 5059563935.1700001 | G628: 5015246152.8000002 | H628: 3431324161.6199999 | I628: 44317782.369999997 | J628: =IF(G628=H628,"是","否") -> 否 | K628: =G628/C628 -> 358744360 | L628: =I628/K628 -> 0.12353583027758261
A629: 600876.SH | B629: 凯盛新能 | C629: 8.35 | D629: 电力设备-光伏设备-光伏辅材 | E629: 12782640526.030001 | F629: 5005258239.0500002 | G629: 4156042941.0500002 | H629: 3303885941.0500002 | I629: 849215298 | J629: =IF(G629=H629,"是","否") -> 否 | K629: =G629/C629 -> 497729693.53892219 | L629: =I629/K629 -> 1.7061776884597137
A630: 603018.SH | B630: 华设集团 | C630: 6.26 | D630: 建筑装饰-建筑装饰-工程咨询服务 | E630: 12318100811.02 | F630: 4996922127.3599997 | G630: 4280529450.2199998 | H630: 4233078650.2199998 | I630: 716392677.13999999 | J630: =IF(G630=H630,"是","否") -> 否 | K630: =G630/C630 -> 683790647 | L630: =I630/K630 -> 1.0476783797541471
A631: 600982.SH | B631: 宁波能源 | C631: 3.33 | D631: 公用事业-电力-热力 | E631: 13959769312.18 | F631: 4992413039.3299999 | G631: 3721699525.0500002 | H631: 3721699525.0500002 | I631: 1270713514.28 | J631: =IF(G631=H631,"是","否") -> 是 | K631: =G631/C631 -> 1117627485 | L631: =I631/K631 -> 1.1369741092936705
A632: 000665.SZ | B632: 湖北广电 | C632: 3.59 | D632: 传媒-文化传媒-电视广播 | E632: 10616290341.780001 | F632: 4989716422 | G632: 4082366687.0500002 | H632: 4082226084.6999998 | I632: 907349734.95000005 | J632: =IF(G632=H632,"是","否") -> 否 | K632: =G632/C632 -> 1137149495 | L632: =I632/K632 -> 0.79791596350311011
A633: 600973.SH | B633: 宝胜股份 | C633: 3.36 | D633: 电力设备-电网设备-线缆部件及其他 | E633: 23209309358.23 | F633: 4982782873.9899998 | G633: 4607790593.2799997 | H633: 4607790593.2799997 | I633: 374992280.70999998 | J633: =IF(G633=H633,"是","否") -> 是 | K633: =G633/C633 -> 1371366248 | L633: =I633/K633 -> 0.27344429779928492
A634: 002759.SZ | B634: 天际股份 | C634: 5.69 | D634: 电力设备-电池-电池化学品 | E634: 7006788749.0900002 | F634: 4960803040.4799995 | G634: 2852867022.4499998 | H634: 2851100209.1700001 | I634: 2107936018.03 | J634: =IF(G634=H634,"是","否") -> 否 | K634: =G634/C634 -> 501382604.99999994 | L634: =I634/K634 -> 4.2042464118395175
A635: 002393.SZ | B635: 力生制药 | C635: 14.38 | D635: 医药生物-化学制药-化学制剂 | E635: 6050798977.6400003 | F635: 4933742686.0299997 | G635: 3709220167.4400001 | H635: 3673183887.4400001 | I635: 1224522518.5899999 | J635: =IF(G635=H635,"是","否") -> 否 | K635: =G635/C635 -> 257942988 | L635: =I635/K635 -> 4.7472603464995133
A636: 000411.SZ | B636: 英特集团 | C636: 9.03 | D636: 医药生物-医药商业-医药流通 | E636: 15789468184.18 | F636: 4911423633.4300003 | G636: 4714979888.0100002 | H636: 2894077552.5900002 | I636: 196443745.41999999 | J636: =IF(G636=H636,"是","否") -> 否 | K636: =G636/C636 -> 522146167.00000006 | L636: =I636/K636 -> 0.37622366654278239
A637: 300639.SZ | B637: 凯普生物 | C637: 5.04 | D637: 医药生物-医疗器械-体外诊断 | E637: 5423009244.3100004 | F637: 4896831737.3199997 | G637: 3258363396.96 | H637: 3201228429.8400002 | I637: 1638468340.3599999 | J637: =IF(G637=H637,"是","否") -> 否 | K637: =G637/C637 -> 646500674 | L637: =I637/K637 -> 2.5343644736246631
A638: 600805.SH | B638: 悦达投资 | C638: 3.48 | D638: 综合-综合-综合Ⅲ | E638: 8771697645.0200005 | F638: 4869658767.6099997 | G638: 2961112839.1199999 | H638: 2958958280.6399999 | I638: 1908545928.49 | J638: =IF(G638=H638,"是","否") -> 否 | K638: =G638/C638 -> 850894494 | L638: =I638/K638 -> 2.2429877522394688
A639: 002022.SZ | B639: 科华生物 | C639: 5.71 | D639: 医药生物-医疗器械-体外诊断 | E639: 6583956876.9899998 | F639: 4846006982.1199999 | G639: 2936751628.8299999 | H639: 2936334085.0799999 | I639: 1909255353.29 | J639: =IF(G639=H639,"是","否") -> 否 | K639: =G639/C639 -> 514317273 | L639: =I639/K639 -> 3.7122131678630206
A640: 600984.SH | B640: 建设机械 | C640: 2.2000000000000002 | D640: 机械设备-工程机械-工程机械Ⅲ | E640: 17760230697.369999 | F640: 4841807301.6199999 | G640: 2765496635 | H640: 2765496635 | I640: 2076310666.6199999 | J640: =IF(G640=H640,"是","否") -> 是 | K640: =G640/C640 -> 1257043925 | L640: =I640/K640 -> 1.6517407429656843
A641: 600841.SH | B641: 动力新科 | C641: 3.71 | D641: 汽车-汽车零部件-底盘与发动机系统 | E641: 16608750978.360001 | F641: 4830691212.6499996 | G641: 4222809812.3299999 | H641: 3413734677.7800002 | I641: 607881400.32000005 | J641: =IF(G641=H641,"是","否") -> 否 | K641: =G641/C641 -> 1138223669.0916443 | L641: =I641/K641 -> 0.53406146509421815
A642: 601188.SH | B642: 龙江交通 | C642: 2.95 | D642: 交通运输-公路铁路运输-高速公路 | E642: 5385367510.5100002 | F642: 4792398179.1099997 | G642: 3881841784.4499998 | H642: 3881841784.4499998 | I642: 910556394.65999997 | J642: =IF(G642=H642,"是","否") -> 是 | K642: =G642/C642 -> 1315878570.9999998 | L642: =I642/K642 -> 0.69197600350617772
A643: 000546.SZ | B643: 金圆股份 | C643: 5.09 | D643: 环保-环境治理-固废治理 | E643: 5895243476.9399996 | F643: 4789332763.3999996 | G643: 3964000186.5799999 | H643: 3626688095.6399999 | I643: 825332576.82000005 | J643: =IF(G643=H643,"是","否") -> 否 | K643: =G643/C643 -> 778781962 | L643: =I643/K643 -> 1.0597736171244296
A644: 000601.SZ | B644: 韶能股份 | C644: 3.47 | D644: 公用事业-电力-水电 | E644: 12862544569.51 | F644: 4784188614.0500002 | G644: 3749514291.4299998 | H644: 3747743994.5900002 | I644: 1034674322.62 | J644: =IF(G644=H644,"是","否") -> 否 | K644: =G644/C644 -> 1080551669 | L644: =I644/K644 -> 0.95754266297838642
A645: 300267.SZ | B645: 尔康制药 | C645: 2.18 | D645: 医药生物-化学制药-原料药 | E645: 5428013634.6899996 | F645: 4777819525.1199999 | G645: 4496478616.6000004 | H645: 3100825113.3800001 | I645: 281340908.51999998 | J645: =IF(G645=H645,"是","否") -> 否 | K645: =G645/C645 -> 2062604870 | L645: =I645/K645 -> 0.13640077777960447
A646: 688033.SH | B646: 天宜上佳 | C646: 4.67 | D646: 电力设备-光伏设备-光伏辅材 | E646: 7949411582.8599997 | F646: 4767561567.4899998 | G646: 2625467443.3200002 | H646: 2625467443.3200002 | I646: 2142094124.1700001 | J646: =IF(G646=H646,"是","否") -> 是 | K646: =G646/C646 -> 562198596 | L646: =I646/K646 -> 3.810208953581236
A647: 600665.SH | B647: 天地源 | C647: 2.66 | D647: 房地产-房地产-住宅开发 | E647: 37565401921.43 | F647: 4766607862.04 | G647: 2298565905.8600001 | H647: 2298565905.8600001 | I647: 2468041956.1799998 | J647: =IF(G647=H647,"是","否") -> 是 | K647: =G647/C647 -> 864122521 | L647: =I647/K647 -> 2.8561250241735103
A648: 603916.SH | B648: 苏博特 | C648: 6.57 | D648: 基础化工-化学制品-其他化学制品 | E648: 7896432034.0900002 | F648: 4752611808.6199999 | G648: 2844106379.2800002 | H648: 2761455779.2800002 | I648: 1908505429.3399999 | J648: =IF(G648=H648,"是","否") -> 否 | K648: =G648/C648 -> 432892904 | L648: =I648/K648 -> 4.4087242172488921
A649: 688707.SH | B649: 振华新材 | C649: 8 | D649: 电力设备-电池-电池化学品 | E649: 8406642531.0299997 | F649: 4743498046.3900003 | G649: 4070273640 | H649: 2792139144 | I649: 673224406.38999999 | J649: =IF(G649=H649,"是","否") -> 否 | K649: =G649/C649 -> 508784205 | L649: =I649/K649 -> 1.323202253084881
A650: 300358.SZ | B650: 楚天科技 | C650: 5.93 | D650: 医药生物-医疗器械-医疗设备 | E650: 13016019331.559999 | F650: 4730367010.1000004 | G650: 3500493077.8200002 | H650: 3364953291.5700002 | I650: 1229873932.28 | J650: =IF(G650=H650,"是","否") -> 否 | K650: =G650/C650 -> 590302374 | L650: =I650/K650 -> 2.0834643166791667
A651: 002672.SZ | B651: 东江环保 | C651: 3.44 | D651: 环保-环境治理-固废治理 | E651: 11713938485.209999 | F651: 4724394389.75 | G651: 3371244162.77 | H651: 2888938033.9200001 | I651: 1353150226.98 | J651: =IF(G651=H651,"是","否") -> 否 | K651: =G651/C651 -> 980012838.01453495 | L651: =I651/K651 -> 1.3807474499226213
A652: 600638.SH | B652: 新黄浦 | C652: 3.99 | D652: 房地产-房地产-住宅开发 | E652: 20472961966.450001 | F652: 4722670612.3199997 | G652: 2686853176.1399999 | H652: 2686853176.1399999 | I652: 2035817436.1800001 | J652: =IF(G652=H652,"是","否") -> 是 | K652: =G652/C652 -> 673396785.99999988 | L652: =I652/K652 -> 3.0232063450626572
A653: 601368.SH | B653: 绿城水务 | C653: 4.15 | D653: 环保-环境治理-水务及水治理 | E653: 21658475314.93 | F653: 4721299876.0500002 | G653: 3664338269.5500002 | H653: 3664338269.5500002 | I653: 1056961606.5 | J653: =IF(G653=H653,"是","否") -> 是 | K653: =G653/C653 -> 882973077 | L653: =I653/K653 -> 1.1970485103477284
A654: 002062.SZ | B654: 宏润建设 | C654: 3.26 | D654: 建筑装饰-建筑装饰-基础建设 | E654: 14817050854.33 | F654: 4674125266.1400003 | G654: 3594150000 | H654: 3227171920.6199999 | I654: 1079975266.1400001 | J654: =IF(G654=H654,"是","否") -> 否 | K654: =G654/C654 -> 1102500000 | L654: =I654/K654 -> 0.97956940239455792
A655: 600979.SH | B655: 广安爱众 | C655: 2.95 | D655: 公用事业-电力-电能综合服务 | E655: 11222075907.18 | F655: 4667575134.7299995 | G655: 3721888132.3000002 | H655: 3635166380.5 | I655: 945687002.42999995 | J655: =IF(G655=H655,"是","否") -> 否 | K655: =G655/C655 -> 1261656994 | L655: =I655/K655 -> 0.74955951334424253
A656: 600960.SH | B656: 渤海汽车 | C656: 2.69 | D656: 汽车-汽车零部件-底盘与发动机系统 | E656: 7984015192.8000002 | F656: 4654879740 | G656: 2556886743.4200001 | H656: 2556886743.4200001 | I656: 2097992996.5799999 | J656: =IF(G656=H656,"是","否") -> 是 | K656: =G656/C656 -> 950515518 | L656: =I656/K656 -> 2.2072159337223991
A657: 002140.SZ | B657: 东华科技 | C657: 6.52 | D657: 建筑装饰-建筑装饰-专业工程 | E657: 16048840274.6 | F657: 4652382995.4499998 | G657: 4616421595.4399996 | H657: 3530648492.5999999 | I657: 35961400.009999998 | J657: =IF(G657=H657,"是","否") -> 否 | K657: =G657/C657 -> 708040122 | L657: =I657/K657 -> 5.07900596203784e-02
A658: 000016.SZ | B658: 深康佳A | C658: 2.62 | D658: 家用电器-白色家电-冰洗 | E658: 34324017267.75 | F658: 4650638315.3500004 | G658: 4624394236.1400003 | H658: 4183075756 | I658: 26244079.210000001 | J658: =IF(G658=H658,"是","否") -> 否 | K658: =G658/C658 -> 1765035967.9923666 | L658: =I658/K658 -> 1.4868863686586076e-02
A659: 002746.SZ | B659: 仙坛股份 | C659: 5.26 | D659: 农林牧渔-养殖业-肉鸡养殖 | E659: 6867369882.0699997 | F659: 4616334990.8599997 | G659: 4526433704.0200005 | H659: 3732896954.02 | I659: 89901286.840000004 | J659: =IF(G659=H659,"是","否") -> 否 | K659: =G659/C659 -> 860538727.00000012 | L659: =I659/K659 -> 0.10447093665779901
A660: 600814.SH | B660: 杭州解百 | C660: 5.87 | D660: 商贸零售-零售-百货零售 | E660: 8245356281.6899996 | F660: 4601837268.9899998 | G660: 4315069860.2600002 | H660: 4246703613.8600001 | I660: 286767408.73000002 | J660: =IF(G660=H660,"是","否") -> 否 | K660: =G660/C660 -> 735105598 | L660: =I660/K660 -> 0.39010369327917976
A661: 300388.SZ | B661: 节能国祯 | C661: 5.45 | D661: 环保-环境治理-水务及水治理 | E661: 16168327101.07 | F661: 4596901509.1999998 | G661: 3711680158.9499998 | H661: 3701028237.5 | I661: 885221350.25 | J661: =IF(G661=H661,"是","否") -> 否 | K661: =G661/C661 -> 681042231 | L661: =I661/K661 -> 1.2998039034234281
A662: 600819.SH | B662: 耀皮玻璃 | C662: 4.4000000000000004 | D662: 建筑材料-建筑材料-玻璃玻纤 | E662: 8009218931.2700005 | F662: 4584570730.7200003 | G662: 3650239673.6599998 | H662: 3288630694.8000002 | I662: 934331057.05999994 | J662: =IF(G662=H662,"是","否") -> 否 | K662: =G662/C662 -> 829599925.8318181 | L662: =I662/K662 -> 1.1262429370677325
A663: 002441.SZ | B663: 众业达 | C663: 6.2000000000000002 | D663: 电力设备-电网设备-输变电设备 | E663: 6766009765.8900003 | F663: 4572633316.2700005 | G663: 3376170375.8000002 | H663: 2474294319.8000002 | I663: 1196462940.47 | J663: =IF(G663=H663,"是","否") -> 否 | K663: =G663/C663 -> 544543609 | L663: =I663/K663 -> 2.1971847997026077
A664: 603936.SH | B664: 博敏电子 | C664: 6.74 | D664: 电子-元件-印制电路板 | E664: 8525185849.1300001 | F664: 4537024474.3599997 | G664: 4248882546.96 | H664: 4248882546.96 | I664: 288141927.39999998 | J664: =IF(G664=H664,"是","否") -> 是 | K664: =G664/C664 -> 630398004 | L664: =I664/K664 -> 0.45707937774498408
A665: 000011.SZ | B665: 深物业A | C665: 8.05 | D665: 房地产-房地产-住宅开发 | E665: 16658662273.549999 | F665: 4519045885.1800003 | G665: 4467915850.1000004 | H665: 4238128121.1500001 | I665: 51130035.079999998 | J665: =IF(G665=H665,"是","否") -> 否 | K665: =G665/C665 -> 555020602.49689436 | L665: =I665/K665 -> 9.2122769587253475e-02
A666: 300196.SZ | B666: 长海股份 | C666: 9.63 | D666: 建筑材料-建筑材料-玻璃玻纤 | E666: 6822799368.9099998 | F666: 4508472531.3299999 | G666: 3935940366.8699999 | H666: 2372035926.4200001 | I666: 572532164.46000004 | J666: =IF(G666=H666,"是","否") -> 否 | K666: =G666/C666 -> 408716548.99999994 | L666: =I666/K666 -> 1.4008049487127572
A667: 000731.SZ | B667: 四川美丰 | C667: 6.51 | D667: 基础化工-农化制品-氮肥 | E667: 5956357755.8000002 | F667: 4507539250.2600002 | G667: 3735032296.8000002 | H667: 3735032296.8000002 | I667: 772506953.46000004 | J667: =IF(G667=H667,"是","否") -> 是 | K667: =G667/C667 -> 573737680 | L667: =I667/K667 -> 1.346446260005095
A668: 600526.SH | B668: 菲达环保 | C668: 3.71 | D668: 环保-环保设备-环保设备Ⅲ | E668: 10405458312.08 | F668: 4461037879.2600002 | G668: 3300798649.4000001 | H668: 2640132730.8299999 | I668: 1160239229.8599999 | J668: =IF(G668=H668,"是","否") -> 否 | K668: =G668/C668 -> 889703140 | L668: =I668/K668 -> 1.3040745589141114
A669: 300664.SZ | B669: 鹏鹞环保 | C669: 4.13 | D669: 环保-环境治理-水务及水治理 | E669: 7974498044.1199999 | F669: 4448644110.46 | G669: 3138024931.1599998 | H669: 3089827831.1599998 | I669: 1310619179.3 | J669: =IF(G669=H669,"是","否") -> 否 | K669: =G669/C669 -> 759812332 | L669: =I669/K669 -> 1.7249248585504664
A670: 300332.SZ | B670: 天壕能源 | C670: 4.25 | D670: 公用事业-燃气-燃气Ⅲ | E670: 8797204034.3299999 | F670: 4447143621.6899996 | G670: 3628563946 | H670: 3477130708.5 | I670: 818579675.69000006 | J670: =IF(G670=H670,"是","否") -> 否 | K670: =G670/C670 -> 853779752 | L670: =I670/K670 -> 0.95877147914606442
A671: 601010.SH | B671: 文峰股份 | C671: 1.7 | D671: 商贸零售-零售-百货零售 | E671: 6249058413.9499998 | F671: 4423494867.5200005 | G671: 3141600000 | H671: 3141600000 | I671: 1281894867.52 | J671: =IF(G671=H671,"是","否") -> 是 | K671: =G671/C671 -> 1848000000 | L671: =I671/K671 -> 0.69366605385281388
A672: 002614.SZ | B672: 奥佳华 | C672: 5.44 | D672: 家用电器-小家电-小家电Ⅲ | E672: 7371460322.8199997 | F672: 4423201918.3199997 | G672: 3391704816 | H672: 2399106950.0799999 | I672: 1031497102.3200001 | J672: =IF(G672=H672,"是","否") -> 否 | K672: =G672/C672 -> 623475150 | L672: =I672/K672 -> 1.6544317801920414
A673: 000919.SZ | B673: 金陵药业 | C673: 5.77 | D673: 医药生物-化学制药-化学制剂 | E673: 5302223451.3800001 | F673: 4421715622.3800001 | G673: 3629679246.5599999 | H673: 2907396110.75 | I673: 792036375.82000005 | J673: =IF(G673=H673,"是","否") -> 否 | K673: =G673/C673 -> 629060528 | L673: =I673/K673 -> 1.259078165877227
A674: 603511.SH | B674: 爱慕股份 | C674: 10.24 | D674: 纺织服饰-服装家纺-服装 | E674: 5432664804.1800003 | F674: 4408807469.96 | G674: 4179159040 | H674: 4115326074.8800001 | I674: 229648429.96000001 | J674: =IF(G674=H674,"是","否") -> 否 | K674: =G674/C674 -> 408121000 | L674: =I674/K674 -> 0.56269692066813526
A675: 002454.SZ | B675: 松芝股份 | C675: 5.39 | D675: 汽车-汽车零部件-汽车电子电气系统 | E675: 7336012700.5900002 | F675: 4401275000.9300003 | G675: 3388054824 | H675: 3379418038.9200001 | I675: 1013220176.9299999 | J675: =IF(G675=H675,"是","否") -> 否 | K675: =G675/C675 -> 628581600 | L675: =I675/K675 -> 1.6119151068532709
A676: 002391.SZ | B676: 长青股份 | C676: 4.46 | D676: 基础化工-农化制品-农药 | E676: 8613374696.7999992 | F676: 4399688731.9200001 | G676: 2897182773 | H676: 2069978817.0599999 | I676: 1502505958.9200001 | J676: =IF(G676=H676,"是","否") -> 否 | K676: =G676/C676 -> 649592550 | L676: =I676/K676 -> 2.3129975227086579
A677: 002483.SZ | B677: 润邦股份 | C677: 4.19 | D677: 机械设备-专用设备-能源及重型设备 | E677: 11184387544.85 | F677: 4394659638.6999998 | G677: 3714302650.4699998 | H677: 3709200847.8099999 | I677: 680356988.23000002 | J677: =IF(G677=H677,"是","否") -> 否 | K677: =G677/C677 -> 886468412.99999988 | L677: =I677/K677 -> 0.76749151831312923
A678: 600770.SH | B678: 综艺股份 | C678: 2.3999999999999999 | D678: 综合-综合-综合Ⅲ | E678: 5193043472 | F678: 4393434963.9700003 | G678: 3120000000 | H678: 3120000000 | I678: 1273434963.97 | J678: =IF(G678=H678,"是","否") -> 是 | K678: =G678/C678 -> 1300000000 | L678: =I678/K678 -> 0.97956535690000002
A679: 000850.SZ | B679: 华茂股份 | C679: 3.45 | D679: 纺织服饰-纺织制造-棉纺 | E679: 6891672234.9099998 | F679: 4373547648.7799997 | G679: 3255644281.0500002 | H679: 3254719232.5500002 | I679: 1117903367.73 | J679: =IF(G679=H679,"是","否") -> 否 | K679: =G679/C679 -> 943665009 | L679: =I679/K679 -> 1.1846400545407951
A680: 000862.SZ | B680: 银星能源 | C680: 4.29 | D680: 公用事业-电力-新能源发电 | E680: 9375946348.8600006 | F680: 4372560917.9899998 | G680: 3938025645.8400002 | H680: 2693978807.52 | I680: 434535272.14999998 | J680: =IF(G680=H680,"是","否") -> 否 | K680: =G680/C680 -> 917954696 | L680: =I680/K680 -> 0.47337333099715412
A681: 600693.SH | B681: 东百集团 | C681: 2.94 | D681: 商贸零售-零售-百货零售 | E681: 14494766376.209999 | F681: 4363813564.7700005 | G681: 2557347963.2399998 | H681: 2554721179.0799999 | I681: 1806465601.53 | J681: =IF(G681=H681,"是","否") -> 否 | K681: =G681/C681 -> 869846245.99999988 | L681: =I681/K681 -> 2.0767642670610549
A682: 002133.SZ | B682: 广宇集团 | C682: 2.13 | D682: 房地产-房地产-住宅开发 | E682: 12754763565.5 | F682: 4354636170.8900003 | G682: 1648927092.75 | H682: 1639823528.1300001 | I682: 2705709078.1399999 | J682: =IF(G682=H682,"是","否") -> 否 | K682: =G682/C682 -> 774144175 | L682: =I682/K682 -> 3.4950971221090694
A683: 600076.SH | B683: 康欣新材 | C683: 1.45 | D683: 轻工制造-包装印刷-包装 | E683: 7036195424.1999998 | F683: 4353330300.4399996 | G683: 1949587882.1500001 | H683: 1949587882.1500001 | I683: 2403742418.29 | J683: =IF(G683=H683,"是","否") -> 是 | K683: =G683/C683 -> 1344543367 | L683: =I683/K683 -> 1.7877760415071833
A684: 301246.SZ | B684: 宏源药业 | C684: 10.86 | D684: 医药生物-化学制药-原料药 | E684: 5844315787.46 | F684: 4346327180.6400003 | G684: 4344073848 | H684: 1747880076 | I684: 2253332.6400000001 | J684: =IF(G684=H684,"是","否") -> 否 | K684: =G684/C684 -> 400006800 | L684: =I684/K684 -> 5.6332358349908051e-03
A685: 600590.SH | B685: 泰豪科技 | C685: 3.76 | D685: 国防军工-军工电子-军工电子Ⅲ | E685: 13132548873.51 | F685: 4324815717.1700001 | G685: 3206790260 | H685: 3171821406.48 | I685: 1118025457.1700001 | J685: =IF(G685=H685,"是","否") -> 否 | K685: =G685/C685 -> 852869750 | L685: =I685/K685 -> 1.3108982434539389
A686: 600230.SH | B686: 沧州大化 | C686: 9.39 | D686: 基础化工-化学制品-聚氨酯 | E686: 6205125829.0299997 | F686: 4298956209.4499998 | G686: 3887093930.8499999 | H686: 3887093930.8499999 | I686: 411862278.60000002 | J686: =IF(G686=H686,"是","否") -> 是 | K686: =G686/C686 -> 413961014.99999994 | L686: =I686/K686 -> 0.99493011099124895
A687: 000514.SZ | B687: 渝开发 | C687: 3.71 | D687: 房地产-房地产-住宅开发 | E687: 8308857363.9499998 | F687: 4281765750.04 | G687: 3130390280.1500001 | H687: 3130390280.1500001 | I687: 1151375469.8900001 | J687: =IF(G687=H687,"是","否") -> 是 | K687: =G687/C687 -> 843770965 | L687: =I687/K687 -> 1.3645592437397986
A688: 300483.SZ | B688: 首华燃气 | C688: 6.7000000000000002 | D688: 石油石化-油气开采及服务-油气开采 | E688: 8641862158.1100006 | F688: 4278160354.9299998 | G688: 1799310734.7 | H688: 1752191309.7 | I688: 2478849620.23 | J688: =IF(G688=H688,"是","否") -> 否 | K688: =G688/C688 -> 268553841 | L688: =I688/K688 -> 9.2303636805179785
A689: 600533.SH | B689: 栖霞建设 | C689: 1.8999999999999999 | D689: 房地产-房地产-住宅开发 | E689: 23571681194.080002 | F689: 4274776507.04 | G689: 1995000000 | H689: 1995000000 | I689: 2279776507.04 | J689: =IF(G689=H689,"是","否") -> 是 | K689: =G689/C689 -> 1050000000 | L689: =I689/K689 -> 2.1712157209904763
A690: 835368.BJ | B690: 连城数控 | C690: 18.03 | D690: 电力设备-光伏设备-光伏加工设备 | E690: 11451815259.84 | F690: 4268529702.1999998 | G690: 4209998509.1999998 | H690: 2298138706.0799999 | I690: 58531193 | J690: =IF(G690=H690,"是","否") -> 否 | K690: =G690/C690 -> 233499639.99999997 | L690: =I690/K690 -> 0.25066930724175851
A691: 605050.SH | B691: 福然德 | C691: 7.96 | D691: 交通运输-物流-物流Ⅲ | E691: 8161055728.3699999 | F691: 4260212824.6900001 | G691: 3922920280.7600002 | H691: 3922920280.7600002 | I691: 337292543.93000001 | J691: =IF(G691=H691,"是","否") -> 是 | K691: =G691/C691 -> 492829181.00000006 | L691: =I691/K691 -> 0.68440051225375786
A692: 601366.SH | B692: 利群股份 | C692: 5.03 | D692: 商贸零售-零售-百货零售 | E692: 15990269364.459999 | F692: 4259017063.3299999 | G692: 4237401024.5300002 | H692: 4237401024.5300002 | I692: 21616038.800000001 | J692: =IF(G692=H692,"是","否") -> 是 | K692: =G692/C692 -> 842425651 | L692: =I692/K692 -> 2.5659283729478937e-02
A693: 002291.SZ | B693: 遥望科技 | C693: 4.57 | D693: 传媒-文化传媒-广告营销 | E693: 6494349211.9499998 | F693: 4254534464.25 | G693: 4252811892.8400002 | H693: 4010897978.5700002 | I693: 1722571.4099999999 | J693: =IF(G693=H693,"是","否") -> 否 | K693: =G693/C693 -> 930593412 | L693: =I693/K693 -> 1.8510462117907191e-03
A694: 002479.SZ | B694: 富春环保 | C694: 3.78 | D694: 公用事业-电力-热力 | E694: 8948591253.7000008 | F694: 4244755117.8800001 | G694: 3269700000 | H694: 3262415350.3200002 | I694: 975055117.88 | J694: =IF(G694=H694,"是","否") -> 否 | K694: =G694/C694 -> 865000000 | L694: =I694/K694 -> 1.1272313501502891
A695: 300271.SZ | B695: 华宇软件 | C695: 4.9000000000000004 | D695: 计算机-软件开发-垂直应用软件 | E695: 5084483771.4300003 | F695: 4243964368.3200002 | G695: 3999749817.6999998 | H695: 3928484614.5999999 | I695: 244214550.62 | J695: =IF(G695=H695,"是","否") -> 否 | K695: =G695/C695 -> 816275472.99999988 | L695: =I695/K695 -> 0.2991815369907605
A696: 600103.SH | B696: 青山纸业 | C696: 1.75 | D696: 轻工制造-造纸-造纸Ⅲ | E696: 6127223156.29 | F696: 4243622356.5300002 | G696: 3943196332.25 | H696: 3871575832.25 | I696: 300426024.27999997 | J696: =IF(G696=H696,"是","否") -> 否 | K696: =G696/C696 -> 2253255047 | L696: =I696/K696 -> 0.13332979090848562
A697: 600697.SH | B697: 欧亚集团 | C697: 9.57 | D697: 商贸零售-零售-百货零售 | E697: 20084991996 | F697: 4232682073.9099998 | G697: 1522472877.75 | H697: 1486948463.55 | I697: 2710209196.1599998 | J697: =IF(G697=H697,"是","否") -> 否 | K697: =G697/C697 -> 159088075 | L697: =I697/K697 -> 17.035904144040966
A698: 600628.SH | B698: 新世界 | C698: 5.96 | D698: 商贸零售-零售-百货零售 | E698: 5676081691.9700003 | F698: 4226261532.0500002 | G698: 3855377288.6399999 | H698: 3855377288.6399999 | I698: 370884243.41000003 | J698: =IF(G698=H698,"是","否") -> 是 | K698: =G698/C698 -> 646875384 | L698: =I698/K698 -> 0.5733472823105602
A699: 002218.SZ | B699: 拓日新能 | C699: 2.8999999999999999 | D699: 公用事业-电力-新能源发电 | E699: 6893284068.5600004 | F699: 4224942269.3299999 | G699: 4097759592.0999999 | H699: 4037954922.0999999 | I699: 127182677.23 | J699: =IF(G699=H699,"是","否") -> 否 | K699: =G699/C699 -> 1413020549 | L699: =I699/K699 -> 9.0007662889267717e-02
A700: 002181.SZ | B700: 粤传媒 | C700: 3.24 | D700: 传媒-文化传媒-出版 | E700: 5238910771.5799999 | F700: 4172196668.3299999 | G700: 3761828483.7600002 | H700: 3675658409.2800002 | I700: 410368184.56999999 | J700: =IF(G700=H700,"是","否") -> 否 | K700: =G700/C700 -> 1161058174 | L700: =I700/K700 -> 0.35344325870961912
A701: 300020.SZ | B701: *ST银江 | C701: 1.77 | D701: 计算机-IT服务-IT服务Ⅲ | E701: 6924431806.1300001 | F701: 4165791408.7800002 | G701: 1406580013.98 | H701: 1356952063.6800001 | I701: 2759211394.8000002 | J701: =IF(G701=H701,"是","否") -> 否 | K701: =G701/C701 -> 794677974 | L701: =I701/K701 -> 3.4721125853174839
A702: 002662.SZ | B702: 京威股份 | C702: 2.64 | D702: 汽车-汽车零部件-车身附件及饰件 | E702: 4898647497.4899998 | F702: 4158500798.0500002 | G702: 3960000000 | H702: 3959950104 | I702: 198500798.05000001 | J702: =IF(G702=H702,"是","否") -> 否 | K702: =G702/C702 -> 1500000000 | L702: =I702/K702 -> 0.13233386536666666
A703: 000045.SZ | B703: 深纺织A | C703: 8.18 | D703: 电子-光学光电子-面板 | E703: 5648549738.4200001 | F703: 4145680577.9099998 | G703: 3882036244.8200002 | H703: 3738438724.8200002 | I703: 263644333.09 | J703: =IF(G703=H703,"是","否") -> 否 | K703: =G703/C703 -> 474576558.04645479 | L703: =I703/K703 -> 0.55553593750029406
A704: 600545.SH | B704: 卓郎智能 | C704: 1.38 | D704: 机械设备-专用设备-纺织服装设备 | E704: 9252551000 | F704: 4097661000 | G704: 2467318866.3600001 | H704: 2467318866.3600001 | I704: 1630342133.6400001 | J704: =IF(G704=H704,"是","否") -> 是 | K704: =G704/C704 -> 1787912222.0000002 | L704: =I704/K704 -> 0.91186922578126428
A705: 000863.SZ | B705: 三湘印象 | C705: 3.31 | D705: 房地产-房地产-住宅开发 | E705: 6474397571.5299997 | F705: 4074360795.9499998 | G705: 3908115543.5999999 | H705: 3851566785.3299999 | I705: 166245252.34999999 | J705: =IF(G705=H705,"是","否") -> 否 | K705: =G705/C705 -> 1180699560 | L705: =I705/K705 -> 0.14080233277125978
A706: 002986.SZ | B706: 宇新股份 | C706: 10.48 | D706: 石油石化-石油加工贸易-石油加工 | E706: 7265478716.1099997 | F706: 4051545233.6199999 | G706: 4026527632.96 | H706: 3141726070.5599999 | I706: 25017600.66 | J706: =IF(G706=H706,"是","否") -> 否 | K706: =G706/C706 -> 384210652 | L706: =I706/K706 -> 6.5114281787273298e-02
A707: 002187.SZ | B707: 广百股份 | C707: 4.33 | D707: 商贸零售-零售-百货零售 | E707: 9379023507.3799992 | F707: 4043633949.1900001 | G707: 3048488575.5599999 | H707: 2239090482.7800002 | I707: 995145373.63 | J707: =IF(G707=H707,"是","否") -> 否 | K707: =G707/C707 -> 704038932 | L707: =I707/K707 -> 1.4134806022772615
A708: 601002.SH | B708: 晋亿实业 | C708: 3.04 | D708: 机械设备-通用设备-金属制品 | E708: 5121499516.6000004 | F708: 4039777870.4200001 | G708: 2901499788.8000002 | H708: 2901499788.8000002 | I708: 1138278081.6199999 | J708: =IF(G708=H708,"是","否") -> 是 | K708: =G708/C708 -> 954440720 | L708: =I708/K708 -> 1.1926126555245882
A709: 603366.SH | B709: 日出东方 | C709: 3.83 | D709: 家用电器-厨卫电器-厨卫电器Ⅲ | E709: 6979123389.4399996 | F709: 4032895403.6900001 | G709: 3114854743.8299999 | H709: 3087515284.6300001 | I709: 918040659.86000001 | J709: =IF(G709=H709,"是","否") -> 否 | K709: =G709/C709 -> 813278001 | L709: =I709/K709 -> 1.1288153112849293
A710: 603906.SH | B710: 龙蟠科技 | C710: 6.73 | D710: 电力设备-电池-电池化学品 | E710: 17223460594.860001 | F710: 4012376059.5599999 | G710: 3802981017.1900001 | H710: 3802981017.1900001 | I710: 209395042.37 | J710: =IF(G710=H710,"是","否") -> 是 | K710: =G710/C710 -> 565078903 | L710: =I710/K710 -> 0.37055894541155787
A711: 002083.SZ | B711: 孚日股份 | C711: 4.2000000000000002 | D711: 纺织服饰-纺织制造-棉纺 | E711: 7880581301.2799997 | F711: 3996705304.5700002 | G711: 3280280018.4000001 | H711: 3278963318.4000001 | I711: 716425286.16999996 | J711: =IF(G711=H711,"是","否") -> 否 | K711: =G711/C711 -> 781019052 | L711: =I711/K711 -> 0.91729553118507023
A712: 002394.SZ | B712: 联发股份 | C712: 5.87 | D712: 纺织服饰-纺织制造-棉纺 | E712: 5977346449.8100004 | F712: 3996108630.6199999 | G712: 1900119000 | H712: 1897686507.22 | I712: 2095989630.6199999 | J712: =IF(G712=H712,"是","否") -> 否 | K712: =G712/C712 -> 323700000 | L712: =I712/K712 -> 6.4750992604881059
A713: 002406.SZ | B713: 远东传动 | C713: 4.9000000000000004 | D713: 汽车-汽车零部件-底盘与发动机系统 | E713: 4822774306.1999998 | F713: 3993986586.9000001 | G713: 3578102901.8000002 | H713: 2950838971.5 | I713: 415883685.10000002 | J713: =IF(G713=H713,"是","否") -> 否 | K713: =G713/C713 -> 730225082 | L713: =I713/K713 -> 0.56952807476969136
A714: 603187.SH | B714: 海容冷链 | C714: 9.16 | D714: 机械设备-通用设备-制冷空调设备 | E714: 5420192679.8400002 | F714: 3986810270.54 | G714: 3539587295.3200002 | H714: 3538983697.1199999 | I714: 447222975.22000003 | J714: =IF(G714=H714,"是","否") -> 否 | K714: =G714/C714 -> 386417827 | L714: =I714/K714 -> 1.1573559602362755
A715: 000639.SZ | B715: 西王食品 | C715: 2.31 | D715: 食品饮料-食品加工制造-其他食品 | E715: 6965709860.9499998 | F715: 3958787825.6100001 | G715: 2493478899.4499998 | H715: 2493475843.3200002 | I715: 1465308926.1600001 | J715: =IF(G715=H715,"是","否") -> 否 | K715: =G715/C715 -> 1079428095 | L715: =I715/K715 -> 1.3574863698169726
A716: 688101.SH | B716: 三达膜 | C716: 11.300000000000001 | D716: 环保-环境治理-水务及水治理 | E716: 5685993747.9899998 | F716: 3950421473.5999999 | G716: 3772844000 | H716: 3772844000 | I716: 177577473.59999999 | J716: =IF(G716=H716,"是","否") -> 是 | K716: =G716/C716 -> 333880000 | L716: =I716/K716 -> 0.53186017012100151
A717: 603313.SH | B717: 梦百合 | C717: 5.5 | D717: 轻工制造-家居用品-成品家居 | E717: 10089918964.41 | F717: 3935715977.6799998 | G717: 3138227867.5 | H717: 3138227867.5 | I717: 797488110.17999995 | J717: =IF(G717=H717,"是","否") -> 是 | K717: =G717/C717 -> 570586885 | L717: =I717/K717 -> 1.397662882104274
A718: 688186.SH | B718: 广大特材 | C718: 9.14 | D718: 钢铁-钢铁-特钢 | E718: 10937019873.309999 | F718: 3934358371.3200002 | G718: 1958158818.9400001 | H718: 1958158818.9400001 | I718: 1976199552.3800001 | J718: =IF(G718=H718,"是","否") -> 是 | K718: =G718/C718 -> 214240571 | L718: =I718/K718 -> 9.2242078293377965
A719: 603385.SH | B719: 惠达卫浴 | C719: 4.96 | D719: 轻工制造-家居用品-其他家居用品 | E719: 5641459461.3699999 | F719: 3891551726.6300001 | G719: 1893337638.0799999 | H719: 1893337638.0799999 | I719: 1998214088.55 | J719: =IF(G719=H719,"是","否") -> 是 | K719: =G719/C719 -> 381721298 | L719: =I719/K719 -> 5.2347461328972011
A720: 600969.SH | B720: 郴电国际 | C720: 5.23 | D720: 公用事业-电力-电能综合服务 | E720: 14899672088.129999 | F720: 3876403191.8200002 | G720: 1935364031.3199999 | H720: 1935364031.3199999 | I720: 1941039160.5 | J720: =IF(G720=H720,"是","否") -> 是 | K720: =G720/C720 -> 370050483.99999994 | L720: =I720/K720 -> 5.2453360944665057
A721: 002255.SZ | B721: 海陆重工 | C721: 4.19 | D721: 电力设备-其他电源设备-其他电源设备Ⅲ | E721: 6525254193.9300003 | F721: 3873684194.3200002 | G721: 3529115720.4499998 | H721: 2720827798.1700001 | I721: 344568473.87 | J721: =IF(G721=H721,"是","否") -> 否 | K721: =G721/C721 -> 842271054.99999988 | L721: =I721/K721 -> 0.40909452108620786
A722: 603980.SH | B722: 吉华集团 | C722: 3.27 | D722: 基础化工-化学制品-纺织化学用品 | E722: 4445114472.7600002 | F722: 3867285230.9499998 | G722: 2213245087.1999998 | H722: 2213245087.1999998 | I722: 1654040143.75 | J722: =IF(G722=H722,"是","否") -> 是 | K722: =G722/C722 -> 676833359.99999988 | L722: =I722/K722 -> 2.4437922855191423
A723: 002448.SZ | B723: 中原内配 | C723: 5.21 | D723: 汽车-汽车零部件-底盘与发动机系统 | E723: 5805090449.4799995 | F723: 3866544303.8899999 | G723: 3065614255.6599998 | H723: 2536627388.1799998 | I723: 800930048.23000002 | J723: =IF(G723=H723,"是","否") -> 否 | K723: =G723/C723 -> 588409646 | L723: =I723/K723 -> 1.3611776313911754
A724: 002040.SZ | B724: 南京港 | C724: 5.46 | D724: 交通运输-港口航运-港口 | E724: 4964816767.8199997 | F724: 3857516154.0500002 | G724: 2679193007.4000001 | H724: 2642458728 | I724: 1178323146.6500001 | J724: =IF(G724=H724,"是","否") -> 否 | K724: =G724/C724 -> 490694690 | L724: =I724/K724 -> 2.4013366573214805
A725: 603167.SH | B725: 渤海轮渡 | C725: 7.16 | D725: 交通运输-港口航运-航运 | E725: 4461697579.2399998 | F725: 3839903718.6999998 | G725: 3359074641.48 | H725: 3359074641.48 | I725: 480829077.22000003 | J725: =IF(G725=H725,"是","否") -> 是 | K725: =G725/C725 -> 469144503 | L725: =I725/K725 -> 1.0249061305104965
A726: 600173.SH | B726: 卧龙地产 | C726: 3.74 | D726: 房地产-房地产-住宅开发 | E726: 6315127929.6400003 | F726: 3834842803.8699999 | G726: 2619893352.5599999 | H726: 2619556752.5599999 | I726: 1214949451.3099999 | J726: =IF(G726=H726,"是","否") -> 否 | K726: =G726/C726 -> 700506244 | L726: =I726/K726 -> 1.7343877541654003
A727: 002645.SZ | B727: 华宏科技 | C727: 6.13 | D727: 环保-环境治理-综合环境治理 | E727: 6149703317.6499996 | F727: 3830694385.75 | G727: 3564751376.3000002 | H727: 3120605934.9499998 | I727: 265943009.44999999 | J727: =IF(G727=H727,"是","否") -> 否 | K727: =G727/C727 -> 581525510 | L727: =I727/K727 -> 0.45731959282405338
A728: 002328.SZ | B728: 新朋股份 | C728: 4.28 | D728: 汽车-汽车零部件-其他汽车零部件 | E728: 5964529154.4300003 | F728: 3829925127.5999999 | G728: 3303175600 | H728: 2444057174.8800001 | I728: 526749527.60000002 | J728: =IF(G728=H728,"是","否") -> 否 | K728: =G728/C728 -> 771770000 | L728: =I728/K728 -> 0.68252138279539243
A729: 688317.SH | B729: 之江生物 | C729: 14.26 | D729: 医药生物-医疗器械-体外诊断 | E729: 3996487296.52 | F729: 3819327757.2399998 | G729: 2740173065.7399998 | H729: 2740173065.7399998 | I729: 1079154691.5 | J729: =IF(G729=H729,"是","否") -> 是 | K729: =G729/C729 -> 192157999 | L729: =I729/K729 -> 5.6159759006441359
A730: 002918.SZ | B730: 蒙娜丽莎 | C730: 7.16 | D730: 轻工制造-家居用品-瓷砖地板 | E730: 9158108621.5699997 | F730: 3812487056.8800001 | G730: 2972684432.4000001 | H730: 1571347497.5599999 | I730: 839802624.48000002 | J730: =IF(G730=H730,"是","否") -> 否 | K730: =G730/C730 -> 415179390 | L730: =I730/K730 -> 2.0227464192767375
A731: 603869.SH | B731: ST智知 | C731: 4.55 | D731: 计算机-IT服务-IT服务Ⅲ | E731: 5432041723.54 | F731: 3789833045.5300002 | G731: 2295477311.4000001 | H731: 2295477311.4000001 | I731: 1494355734.1300001 | J731: =IF(G731=H731,"是","否") -> 是 | K731: =G731/C731 -> 504500508.00000006 | L731: =I731/K731 -> 2.9620500087385442
A732: 300258.SZ | B732: 精锻科技 | C732: 7.07 | D732: 汽车-汽车零部件-底盘与发动机系统 | E732: 6669197270.6000004 | F732: 3783125787.6799998 | G732: 3406164697.9499998 | H732: 3271514391.5999999 | I732: 376961089.73000002 | J732: =IF(G732=H732,"是","否") -> 否 | K732: =G732/C732 -> 481777184.99999994 | L732: =I732/K732 -> 0.78243864895760906
A733: 000779.SZ | B733: 甘咨询 | C733: 7.15 | D733: 建筑装饰-建筑装饰-工程咨询服务 | E733: 5226556664.1700001 | F733: 3775447233.5700002 | G733: 3323530581.8000002 | H733: 3323240635 | I733: 451916651.76999998 | J733: =IF(G733=H733,"是","否") -> 否 | K733: =G733/C733 -> 464829452 | L733: =I733/K733 -> 0.97222034839995464
A734: 000421.SZ | B734: 南京公用 | C734: 4.5999999999999996 | D734: 公用事业-燃气-燃气Ⅲ | E734: 15456051520.309999 | F734: 3765681992.6900001 | G734: 2652820855.5999999 | H734: 2641607196.4000001 | I734: 1112861137.0899999 | J734: =IF(G734=H734,"是","否") -> 否 | K734: =G734/C734 -> 576700186 | L734: =I734/K734 -> 1.9297048346885741
A735: 000419.SZ | B735: 通程控股 | C735: 4.4000000000000004 | D735: 商贸零售-零售-百货零售 | E735: 5549670629.8599997 | F735: 3748913925.1900001 | G735: 2391763682 | H735: 2391763682 | I735: 1357150243.1900001 | J735: =IF(G735=H735,"是","否") -> 是 | K735: =G735/C735 -> 543582655 | L735: =I735/K735 -> 2.4966768727931541
A736: 002582.SZ | B736: 好想你 | C736: 4.62 | D736: 食品饮料-食品加工制造-休闲食品 | E736: 5058575264.3800001 | F736: 3746220004.8000002 | G736: 2093984364.78 | H736: 1586182853.6400001 | I736: 1652235640.02 | J736: =IF(G736=H736,"是","否") -> 否 | K736: =G736/C736 -> 453243369 | L736: =I736/K736 -> 3.6453608657648116
A737: 688353.SH | B737: 华盛锂电 | C737: 15.19 | D737: 电力设备-电池-电池化学品 | E737: 4267789104.9499998 | F737: 3721626929.4299998 | G737: 2422805000 | H737: 949593629.66999996 | I737: 1298821929.4300001 | J737: =IF(G737=H737,"是","否") -> 否 | K737: =G737/C737 -> 159500000 | L737: =I737/K737 -> 8.1430841970532928
A738: 603012.SH | B738: 创力集团 | C738: 4.17 | D738: 机械设备-专用设备-能源及重型设备 | E738: 6756454141.1700001 | F738: 3719941835.0900002 | G738: 2713669200 | H738: 2678140800 | I738: 1006272635.09 | J738: =IF(G738=H738,"是","否") -> 否 | K738: =G738/C738 -> 650760000 | L738: =I738/K738 -> 1.546303760357121
A739: 300190.SZ | B739: 维尔利 | C739: 2.83 | D739: 环保-环境治理-综合环境治理 | E739: 8606798598.7199993 | F739: 3689528906.4000001 | G739: 2211909981.3899999 | H739: 2196559769.9000001 | I739: 1477618925.01 | J739: =IF(G739=H739,"是","否") -> 否 | K739: =G739/C739 -> 781593632.99999988 | L739: =I739/K739 -> 1.8905206780388399
A740: 600503.SH | B740: 华丽家族 | C740: 1.81 | D740: 房地产-房地产-住宅开发 | E740: 4066977476.1100001 | F740: 3688959034.9099998 | G740: 2900144900 | H740: 2900144900 | I740: 788814134.90999997 | J740: =IF(G740=H740,"是","否") -> 是 | K740: =G740/C740 -> 1602290000 | L740: =I740/K740 -> 0.49230422389829553
A741: 002132.SZ | B741: 恒星科技 | C741: 2.25 | D741: 机械设备-通用设备-金属制品 | E741: 8439297471.9200001 | F741: 3679500132.0700002 | G741: 3153475570.5 | H741: 3148834851 | I741: 526024561.56999999 | J741: =IF(G741=H741,"是","否") -> 否 | K741: =G741/C741 -> 1401544698 | L741: =I741/K741 -> 0.37531772074100483
A742: 603003.SH | B742: *ST龙宇 | C742: 3.94 | D742: 通信-通信服务-通信应用增值服务 | E742: 4456151958.8199997 | F742: 3677831466.8699999 | G742: 1482595735.96 | H742: 1482595735.96 | I742: 2195235730.9099998 | J742: =IF(G742=H742,"是","否") -> 是 | K742: =G742/C742 -> 376293334 | L742: =I742/K742 -> 5.833841667017146
A743: 002160.SZ | B743: 常铝股份 | C743: 3.1000000000000001 | D743: 有色金属-工业金属-铝 | E743: 8462202917.29 | F743: 3662885099.6999998 | G743: 3201621617.6999998 | H743: 2459943923.8000002 | I743: 461263482 | J743: =IF(G743=H743,"是","否") -> 否 | K743: =G743/C743 -> 1032781166.9999999 | L743: =I743/K743 -> 0.44662266967925845
A744: 603686.SH | B744: 福龙马 | C744: 7.34 | D744: 环保-环境治理-固废治理 | E744: 6675024807.1899996 | F744: 3661068569.8099999 | G744: 3049259165.3600001 | H744: 3049259165.3600001 | I744: 611809404.45000005 | J744: =IF(G744=H744,"是","否") -> 是 | K744: =G744/C744 -> 415430404 | L744: =I744/K744 -> 1.47271215240664
A745: 600051.SH | B745: 宁波联合 | C745: 5.2999999999999998 | D745: 综合-综合-综合Ⅲ | E745: 5251450853.5299997 | F745: 3660402658.79 | G745: 1647664000 | H745: 1647664000 | I745: 2012738658.79 | J745: =IF(G745=H745,"是","否") -> 是 | K745: =G745/C745 -> 310880000 | L745: =I745/K745 -> 6.4743266173121459
A746: 688330.SH | B746: 宏力达 | C746: 19.98 | D746: 电力设备-电网设备-电气自控设备 | E746: 4161622949.04 | F746: 3660048974.5900002 | G746: 2797200000 | H746: 2797200000 | I746: 862848974.59000003 | J746: =IF(G746=H746,"是","否") -> 是 | K746: =G746/C746 -> 140000000 | L746: =I746/K746 -> 6.163206961357143
A747: 002398.SZ | B747: 垒知集团 | C747: 3.2999999999999998 | D747: 建筑材料-建筑材料-其他建材 | E747: 5936516562.7200003 | F747: 3648523418.52 | G747: 2303449212.9000001 | H747: 1911888511.5 | I747: 1345074205.6199999 | J747: =IF(G747=H747,"是","否") -> 否 | K747: =G747/C747 -> 698014913.00000012 | L747: =I747/K747 -> 1.9269992382240115
A748: 002443.SZ | B748: 金洲管道 | C748: 5.18 | D748: 钢铁-钢铁-特钢 | E748: 4422680137.4300003 | F748: 3628312655.9699998 | G748: 2696373993.5999999 | H748: 2690629642.96 | I748: 931938662.37 | J748: =IF(G748=H748,"是","否") -> 否 | K748: =G748/C748 -> 520535520 | L748: =I748/K748 -> 1.7903459544316975
A749: 688211.SH | B749: 中科微至 | C749: 25.11 | D749: 机械设备-通用设备-其他通用设备 | E749: 6594771394.0500002 | F749: 3621135888.9699998 | G749: 3304694406.7800002 | H749: 1632368406.78 | I749: 316441482.19 | J749: =IF(G749=H749,"是","否") -> 否 | K749: =G749/C749 -> 131608698.00000001 | L749: =I749/K749 -> 2.4044116156365285
A750: 300616.SZ | B750: 尚品宅配 | C750: 9.77 | D750: 轻工制造-家居用品-定制家居 | E750: 8033674131.9799995 | F750: 3596201215.0900002 | G750: 2193521124.5999999 | H750: 1523790184.3399999 | I750: 1402680090.49 | J750: =IF(G750=H750,"是","否") -> 否 | K750: =G750/C750 -> 224515980 | L750: =I750/K750 -> 6.2475735156579946
A751: 300867.SZ | B751: 圣元环保 | C751: 11.199999999999999 | D751: 环保-环境治理-固废治理 | E751: 8776551519.6800003 | F751: 3591316996.2399998 | G751: 3043499793.5999999 | H751: 2146231606.4000001 | I751: 547817202.63999999 | J751: =IF(G751=H751,"是","否") -> 否 | K751: =G751/C751 -> 271741053 | L751: =I751/K751 -> 2.0159530427667844
A752: 002425.SZ | B752: ST凯文 | C752: 2.39 | D752: 传媒-游戏-游戏Ⅲ | E752: 4044598029.23 | F752: 3568767099.2600002 | G752: 2286429507.7399998 | H752: 2284985546.2199998 | I752: 1282337591.52 | J752: =IF(G752=H752,"是","否") -> 否 | K752: =G752/C752 -> 956665065.99999988 | L752: =I752/K752 -> 1.3404248122926652
A753: 301150.SZ | B753: 中一科技 | C753: 17 | D753: 电力设备-电池-锂电池 | E753: 5574314036.0699997 | F753: 3556944465.8800001 | G753: 3079077434 | H753: 1571680634 | I753: 477867031.88 | J753: =IF(G753=H753,"是","否") -> 否 | K753: =G753/C753 -> 181122202 | L753: =I753/K753 -> 2.6383680553972062
A754: 002225.SZ | B754: 濮耐股份 | C754: 3.2000000000000002 | D754: 建筑材料-建筑材料-耐火材料 | E754: 8179787741.9899998 | F754: 3543816778.1900001 | G754: 3233212518.4000001 | H754: 2641615520 | I754: 310604259.79000002 | J754: =IF(G754=H754,"是","否") -> 否 | K754: =G754/C754 -> 1010378912 | L754: =I754/K754 -> 0.30741364066592874
A755: 002026.SZ | B755: 山东威达 | C755: 7.55 | D755: 机械设备-通用设备-金属制品 | E755: 4980654515.9300003 | F755: 3531368109.77 | G755: 3363903768.4000001 | H755: 3231490433.9000001 | I755: 167464341.37 | J755: =IF(G755=H755,"是","否") -> 否 | K755: =G755/C755 -> 445550168 | L755: =I755/K755 -> 0.37585967506581663
A756: 600792.SH | B756: 云煤能源 | C756: 3.05 | D756: 煤炭-煤炭开采加工-焦炭加工 | E756: 10761266685.889999 | F756: 3518268424.4200001 | G756: 3385266980 | H756: 3019266980 | I756: 133001444.42 | J756: =IF(G756=H756,"是","否") -> 否 | K756: =G756/C756 -> 1109923600 | L756: =I756/K756 -> 0.11982936881421388
A757: 600327.SH | B757: 大东方 | C757: 3.24 | D757: 商贸零售-零售-百货零售 | E757: 5671392256.1800003 | F757: 3511751165.1700001 | G757: 2866685638.3200002 | H757: 2866685638.3200002 | I757: 645065526.85000002 | J757: =IF(G757=H757,"是","否") -> 是 | K757: =G757/C757 -> 884779518 | L757: =I757/K757 -> 0.72906923558553716
A758: 603687.SH | B758: 大胜达 | C758: 5.87 | D758: 轻工制造-包装印刷-包装 | E758: 4327724585.1800003 | F758: 3481862631.0900002 | G758: 3228687041.6799998 | H758: 3207969399.1100001 | I758: 253175589.41 | J758: =IF(G758=H758,"是","否") -> 否 | K758: =G758/C758 -> 550031864 | L758: =I758/K758 -> 0.46029258663094469
A759: 601113.SH | B759: 华鼎股份 | C759: 2.92 | D759: 商贸零售-互联网电商-互联网电商Ⅲ | E759: 6271800604.1700001 | F759: 3476107564.2600002 | G759: 3224124499.9200001 | H759: 3224124499.9200001 | I759: 251983064.34 | J759: =IF(G759=H759,"是","否") -> 是 | K759: =G759/C759 -> 1104152226 | L759: =I759/K759 -> 0.22821406179912007
A760: 000701.SZ | B760: 厦门信达 | C760: 3.54 | D760: 商贸零售-贸易-贸易Ⅲ | E760: 21849380506.639999 | F760: 3474881121.9200001 | G760: 2392357155.2399998 | H760: 2266714738.9200001 | I760: 1082523966.6800001 | J760: =IF(G760=H760,"是","否") -> 否 | K760: =G760/C760 -> 675807105.99999988 | L760: =I760/K760 -> 1.601823888901222
A761: 603518.SH | B761: 锦泓集团 | C761: 6.25 | D761: 纺织服饰-服装家纺-服装 | E761: 5402479921.9200001 | F761: 3454415330.9499998 | G761: 2168361843.75 | H761: 2145789968.75 | I761: 1286053487.2 | J761: =IF(G761=H761,"是","否") -> 否 | K761: =G761/C761 -> 346937895 | L761: =I761/K761 -> 3.7068694591578129
A762: 002282.SZ | B762: 博深股份 | C762: 5.87 | D762: 机械设备-通用设备-磨具磨料 | E762: 3834912307.1799998 | F762: 3452598737.1500001 | G762: 3092541102.7600002 | H762: 2946828860.0599999 | I762: 360057634.38999999 | J762: =IF(G762=H762,"是","否") -> 否 | K762: =G762/C762 -> 526838348 | L762: =I762/K762 -> 0.68343095326462455
A763: 000570.SZ | B763: 苏常柴A | C763: 4.41 | D763: 汽车-汽车零部件-底盘与发动机系统 | E763: 5329179139.0699997 | F763: 3447288917.21 | G763: 2687213505.8699999 | H763: 2450603955.8699999 | I763: 760075411.34000003 | J763: =IF(G763=H763,"是","否") -> 否 | K763: =G763/C763 -> 609345466.18367338 | L763: =I763/K763 -> 1.2473636935388184
A764: 603020.SH | B764: 爱普股份 | C764: 6.26 | D764: 基础化工-化学制品-食品及饲料添加剂 | E764: 3796730402.1999998 | F764: 3437170788.46 | G764: 2399068465.2399998 | H764: 2399068465.2399998 | I764: 1038102323.22 | J764: =IF(G764=H764,"是","否") -> 是 | K764: =G764/C764 -> 383237774 | L764: =I764/K764 -> 2.7087682729834457
A765: 603590.SH | B765: 康辰药业 | C765: 20.17 | D765: 医药生物-生物制品-其他生物制品 | E765: 3908493704.73 | F765: 3431404354.4400001 | G765: 3227200000 | H765: 3166286600 | I765: 204204354.44 | J765: =IF(G765=H765,"是","否") -> 否 | K765: =G765/C765 -> 160000000 | L765: =I765/K765 -> 1.2762772152499999
A766: 002298.SZ | B766: 中电兴发 | C766: 4.11 | D766: 电力设备-电网设备-输变电设备 | E766: 6438795987.9200001 | F766: 3421334983.6199999 | G766: 3041855803.1100001 | H766: 2686564859.7600002 | I766: 379479180.50999999 | J766: =IF(G766=H766,"是","否") -> 否 | K766: =G766/C766 -> 740110901 | L766: =I766/K766 -> 0.51273286205792556
A767: 600261.SH | B767: 阳光照明 | C767: 2.43 | D767: 电子-光学光电子-LED | E767: 5099584704.6999998 | F767: 3420723892.98 | G767: 3244178707.3800001 | H767: 3244178707.3800001 | I767: 176545185.59999999 | J767: =IF(G767=H767,"是","否") -> 是 | K767: =G767/C767 -> 1335052966 | L767: =I767/K767 -> 0.13223833817541589
A768: 600727.SH | B768: 鲁北化工 | C768: 6.05 | D768: 基础化工-化学制品-其他化学制品 | E768: 9153494147.0499992 | F768: 3410902958.3800001 | G768: 3197927966.75 | H768: 3197564966.75 | I768: 212974991.63 | J768: =IF(G768=H768,"是","否") -> 否 | K768: =G768/C768 -> 528583135 | L768: =I768/K768 -> 0.4029167363237951
A769: 002666.SZ | B769: 德联集团 | C769: 3.52 | D769: 基础化工-化学制品-其他化学制品 | E769: 5067293583.8900003 | F769: 3409099441.8499999 | G769: 2773757539.52 | H769: 1587477932.48 | I769: 635341902.33000004 | J769: =IF(G769=H769,"是","否") -> 否 | K769: =G769/C769 -> 787999301 | L769: =I769/K769 -> 0.80627216486579101
A770: 600467.SH | B770: 好当家 | C770: 1.55 | D770: 农林牧渔-养殖业-水产养殖 | E770: 7049881888.4899998 | F770: 3398809333.1100001 | G770: 2264541171.1999998 | H770: 2264541171.1999998 | I770: 1134268161.9100001 | J770: =IF(G770=H770,"是","否") -> 是 | K770: =G770/C770 -> 1460994303.9999998 | L770: =I770/K770 -> 0.77636727179875453
A771: 603359.SH | B771: 东珠生态 | C771: 3.39 | D771: 环保-环境治理-综合环境治理 | E771: 8008055198.1499996 | F771: 3384030655.4099998 | G771: 1512265440 | H771: 1512265440 | I771: 1871765215.4100001 | J771: =IF(G771=H771,"是","否") -> 是 | K771: =G771/C771 -> 446096000 | L771: =I771/K771 -> 4.1958798451678563
A772: 002228.SZ | B772: 合兴包装 | C772: 2.52 | D772: 轻工制造-包装印刷-包装 | E772: 8125573764.6199999 | F772: 3367495707.3800001 | G772: 3081543769.0799999 | H772: 3071302690.6799998 | I772: 285951938.30000001 | J772: =IF(G772=H772,"是","否") -> 否 | K772: =G772/C772 -> 1222834829 | L772: =I772/K772 -> 0.23384346889583074
A773: 600337.SH | B773: 美克家居 | C773: 1.26 | D773: 轻工制造-家居用品-成品家居 | E773: 8819043057.8199997 | F773: 3352793801.1999998 | G773: 1864223596.6199999 | H773: 1864223596.6199999 | I773: 1488570204.5799999 | J773: =IF(G773=H773,"是","否") -> 是 | K773: =G773/C773 -> 1479542537 | L773: =I773/K773 -> 1.0061016613948153
A774: 300485.SZ | B774: 赛升药业 | C774: 6.29 | D774: 医药生物-生物制品-其他生物制品 | E774: 3503664154.98 | F774: 3348962866.02 | G774: 3029681656 | H774: 1722310074.78 | I774: 319281210.01999998 | J774: =IF(G774=H774,"是","否") -> 否 | K774: =G774/C774 -> 481666400 | L774: =I774/K774 -> 0.662867931041069
A775: 002772.SZ | B775: 众兴菌业 | C775: 6.02 | D775: 农林牧渔-种植业与林业-其他种植业 | E775: 6172257763.7799997 | F775: 3346166143.2600002 | G775: 2367312981.1799998 | H775: 2336304725.7199998 | I775: 978853162.08000004 | J775: =IF(G775=H775,"是","否") -> 否 | K775: =G775/C775 -> 393241359 | L775: =I775/K775 -> 2.4891917894119575
A776: 600360.SH | B776: ST华微 | C776: 3.18 | D776: 电子-半导体-分立器件 | E776: 6682448034.5200005 | F776: 3338414973.1999998 | G776: 3053739066.7199998 | H776: 3053739066.7199998 | I776: 284675906.48000002 | J776: =IF(G776=H776,"是","否") -> 是 | K776: =G776/C776 -> 960295303.99999988 | L776: =I776/K776 -> 0.29644621325775017
A777: 603458.SH | B777: 勘设股份 | C777: 5.18 | D777: 建筑装饰-建筑装饰-工程咨询服务 | E777: 6328232687.25 | F777: 3335071974.7199998 | G777: 1612636807.46 | H777: 1612636807.46 | I777: 1722435167.26 | J777: =IF(G777=H777,"是","否") -> 是 | K777: =G777/C777 -> 311319847 | L777: =I777/K777 -> 5.5326866688971483
A778: 000655.SZ | B778: 金岭矿业 | C778: 5.16 | D778: 钢铁-钢铁-冶钢原料 | E778: 3779980605.52 | F778: 3319388629.0700002 | G778: 3071955586.8000002 | H778: 3071955586.8000002 | I778: 247433042.27000001 | J778: =IF(G778=H778,"是","否") -> 是 | K778: =G778/C778 -> 595340230 | L778: =I778/K778 -> 0.41561619692658769
A779: 603797.SH | B779: 联泰环保 | C779: 3.11 | D779: 环保-环境治理-水务及水治理 | E779: 10304560437.68 | F779: 3314023383.71 | G779: 1816717835.95 | H779: 1816717835.95 | I779: 1497305547.76 | J779: =IF(G779=H779,"是","否") -> 是 | K779: =G779/C779 -> 584153645 | L779: =I779/K779 -> 2.5632050070662489
A780: 000809.SZ | B780: *ST和展 | C780: 2 | D780: 电力设备-风电设备-风电零部件 | E780: 4448181969.0299997 | F780: 3303674700.21 | G780: 1649582586 | H780: 1649582586 | I780: 1654092114.21 | J780: =IF(G780=H780,"是","否") -> 是 | K780: =G780/C780 -> 824791293 | L780: =I780/K780 -> 2.0054674779526316
A781: 000407.SZ | B781: 胜利股份 | C781: 2.69 | D781: 公用事业-燃气-燃气Ⅲ | E781: 6724053755.6499996 | F781: 3290145976.3499999 | G781: 2367427724.6399999 | H781: 2355812371.8899999 | I781: 922718251.71000004 | J781: =IF(G781=H781,"是","否") -> 否 | K781: =G781/C781 -> 880084656 | L781: =I781/K781 -> 1.0484426076734146
A782: 600784.SH | B782: 鲁银投资 | C782: 4.82 | D782: 综合-综合-综合Ⅲ | E782: 5333417220.1300001 | F782: 3279290407.7399998 | G782: 3256643975.1399999 | H782: 2738617217.7199998 | I782: 22646432.600000001 | J782: =IF(G782=H782,"是","否") -> 否 | K782: =G782/C782 -> 675652276.99999988 | L782: =I782/K782 -> 3.3517880973558838e-02
A783: 002743.SZ | B783: 富煌钢构 | C783: 3.61 | D783: 建筑装饰-建筑装饰-专业工程 | E783: 10689896214.07 | F783: 3258674585.9699998 | G783: 1571319205.5799999 | H783: 1568801230.5799999 | I783: 1687355380.3900001 | J783: =IF(G783=H783,"是","否") -> 否 | K783: =G783/C783 -> 435268478 | L783: =I783/K783 -> 3.8765852931578477
A784: 688057.SH | B784: 金达莱 | C784: 9.3000000000000007 | D784: 环保-环境治理-水务及水治理 | E784: 3683741874.1300001 | F784: 3252133611.3200002 | G784: 2566800000 | H784: 2566800000 | I784: 685333611.32000005 | J784: =IF(G784=H784,"是","否") -> 是 | K784: =G784/C784 -> 276000000 | L784: =I784/K784 -> 2.4830927946376815
A785: 600218.SH | B785: 全柴动力 | C785: 6.5 | D785: 汽车-汽车零部件-底盘与发动机系统 | E785: 5993119547.7399998 | F785: 3215222809.0100002 | G785: 2831399473.5 | H785: 2831399473.5 | I785: 383823335.50999999 | J785: =IF(G785=H785,"是","否") -> 是 | K785: =G785/C785 -> 435599919 | L785: =I785/K785 -> 0.88113729770918525
A786: 300121.SZ | B786: 阳谷华泰 | C786: 7.07 | D786: 基础化工-橡胶制品-其他橡胶制品 | E786: 4466434954.8800001 | F786: 3207333415.1399999 | G786: 2891561739.1500001 | H786: 2788783296.8099999 | I786: 315771675.99000001 | J786: =IF(G786=H786,"是","否") -> 否 | K786: =G786/C786 -> 408990345 | L786: =I786/K786 -> 0.77207611341045235
A787: 002669.SZ | B787: 康达新材 | C787: 7.82 | D787: 基础化工-化学制品-其他化学制品 | E787: 7192609870.8299999 | F787: 3206252171.9299998 | G787: 2372588000 | H787: 2358709064 | I787: 833664171.92999995 | J787: =IF(G787=H787,"是","否") -> 否 | K787: =G787/C787 -> 303400000 | L787: =I787/K787 -> 2.7477395251483188
A788: 688068.SH | B788: 热景生物 | C788: 23.08 | D788: 医药生物-医疗器械-体外诊断 | E788: 3372834166.0599999 | F788: 3206171323.79 | G788: 2134315891.3599999 | H788: 2134315891.3599999 | I788: 1071855432.4299999 | J788: =IF(G788=H788,"是","否") -> 是 | K788: =G788/C788 -> 92474692 | L788: =I788/K788 -> 11.590797538747141
A789: 603585.SH | B789: 苏利股份 | C789: 10.36 | D789: 基础化工-农化制品-农药 | E789: 5736691870.3199997 | F789: 3205880633.0599999 | G789: 1904709724.4000001 | H789: 1864823724.4000001 | I789: 1301170908.6600001 | J789: =IF(G789=H789,"是","否") -> 否 | K789: =G789/C789 -> 183852290.00000003 | L789: =I789/K789 -> 7.0772624516126497
A790: 000851.SZ | B790: ST高鸿 | C790: 2.65 | D790: 通信-通信设备-通信网络设备及器件 | E790: 6288006348.8400002 | F790: 3198789830.29 | G790: 3068329053 | H790: 2999739754.9000001 | I790: 130460777.29000001 | J790: =IF(G790=H790,"是","否") -> 否 | K790: =G790/C790 -> 1157860020 | L790: =I790/K790 -> 0.11267404957120811
A791: 002623.SZ | B791: 亚玛顿 | C791: 14.08 | D791: 电力设备-光伏设备-光伏辅材 | E791: 5576680784.1000004 | F791: 3196553922.4699998 | G791: 2802800000 | H791: 2796796640 | I791: 393753922.47000003 | J791: =IF(G791=H791,"是","否") -> 否 | K791: =G791/C791 -> 199062500 | L791: =I791/K791 -> 1.9780416827378338
A792: 002358.SZ | B792: 森源电气 | C792: 3.27 | D792: 电力设备-电网设备-输变电设备 | E792: 6332235259.29 | F792: 3194138580.25 | G792: 3040305314.79 | H792: 3038464805.0999999 | I792: 153833265.46000001 | J792: =IF(G792=H792,"是","否") -> 否 | K792: =G792/C792 -> 929756977 | L792: =I792/K792 -> 0.16545534937136591
A793: 603727.SH | B793: 博迈科 | C793: 9.4000000000000004 | D793: 石油石化-油气开采及服务-油服工程 | E793: 4483954333.1099997 | F793: 3193049003.3699999 | G793: 2648161203.8000002 | H793: 2648161203.8000002 | I793: 544887799.57000005 | J793: =IF(G793=H793,"是","否") -> 是 | K793: =G793/C793 -> 281719277 | L793: =I793/K793 -> 1.9341516326907231
A794: 603217.SH | B794: 元利科技 | C794: 12.5 | D794: 基础化工-化学制品-其他化学制品 | E794: 3878901932.3800001 | F794: 3175557506.1900001 | G794: 2602316000 | H794: 2586410000 | I794: 573241506.19000006 | J794: =IF(G794=H794,"是","否") -> 否 | K794: =G794/C794 -> 208185280 | L794: =I794/K794 -> 2.7535160324015227
A795: 000529.SZ | B795: 广弘控股 | C795: 4.98 | D795: 食品饮料-食品加工制造-肉制品 | E795: 6423098869.29 | F795: 3161712762.1700001 | G795: 2907275843.4000001 | H795: 2838024197.46 | I795: 254436918.77000001 | J795: =IF(G795=H795,"是","否") -> 否 | K795: =G795/C795 -> 583790330 | L795: =I795/K795 -> 0.4358361310472546
A796: 000530.SZ | B796: 冰山冷热 | C796: 3.69 | D796: 机械设备-通用设备-制冷空调设备 | E796: 7788630011.0100002 | F796: 3156431425.2800002 | G796: 2526823705.8299999 | H796: 2214067685.6700001 | I796: 629607719.45000005 | J796: =IF(G796=H796,"是","否") -> 否 | K796: =G796/C796 -> 684776072.04065037 | L796: =I796/K796 -> 0.91943592242315475
A797: 002788.SZ | B797: 鹭燕医药 | C797: 7.13 | D797: 医药生物-医药商业-医药流通 | E797: 12007991151.719999 | F797: 3152023248.48 | G797: 2770124327.6799998 | H797: 2720709855.5500002 | I797: 381898920.80000001 | J797: =IF(G797=H797,"是","否") -> 否 | K797: =G797/C797 -> 388516736 | L797: =I797/K797 -> 0.98296646042038205
A798: 002574.SZ | B798: 明牌珠宝 | C798: 3.98 | D798: 纺织服饰-服装家纺-饰品 | E798: 7556679229.6499996 | F798: 3142693143.1900001 | G798: 2101440000 | H798: 2101440000 | I798: 1041253143.1900001 | J798: =IF(G798=H798,"是","否") -> 是 | K798: =G798/C798 -> 528000000 | L798: =I798/K798 -> 1.9720703469507577
A799: 301292.SZ | B799: 海科新源 | C799: 11.35 | D799: 电力设备-电池-电池化学品 | E799: 7664400461.3299999 | F799: 3142421654.5500002 | G799: 2530632070.3000002 | H799: 962360144 | I799: 611789584.25 | J799: =IF(G799=H799,"是","否") -> 否 | K799: =G799/C799 -> 222963178.00000003 | L799: =I799/K799 -> 2.7439041268509365
A800: 600731.SH | B800: 湖南海利 | C800: 4.84 | D800: 基础化工-农化制品-农药 | E800: 4252899947.29 | F800: 3132438738.3899999 | G800: 2704313293.4400001 | H800: 2700636098.5999999 | I800: 428125444.94999999 | J800: =IF(G800=H800,"是","否") -> 否 | K800: =G800/C800 -> 558742416 | L800: =I800/K800 -> 0.76623043586868123
A801: 300230.SZ | B801: 永利股份 | C801: 3.19 | D801: 基础化工-塑料制品-其他塑料制品 | E801: 4214562994.27 | F801: 3115788435.3099999 | G801: 2603697270.79 | H801: 2018680165.8099999 | I801: 512091164.51999998 | J801: =IF(G801=H801,"是","否") -> 否 | K801: =G801/C801 -> 816206041 | L801: =I801/K801 -> 0.62740428126774916
A802: 603776.SH | B802: 永安行 | C802: 9.46 | D802: 汽车-汽车服务及其他-其他运输设备 | E802: 4527795305.4099998 | F802: 3105117574.0599999 | G802: 2170845069.5799999 | H802: 2170845069.5799999 | I802: 934272504.48000002 | J802: =IF(G802=H802,"是","否") -> 是 | K802: =G802/C802 -> 229476222.99999997 | L802: =I802/K802 -> 4.0713259625159512
A803: 003038.SZ | B803: 鑫铂股份 | C803: 12.05 | D803: 有色金属-工业金属-铝 | E803: 9764203478.9699993 | F803: 3093581845.0900002 | G803: 2964509489.25 | H803: 2038714315.5 | I803: 129072355.84 | J803: =IF(G803=H803,"是","否") -> 否 | K803: =G803/C803 -> 246017385 | L803: =I803/K803 -> 0.52464729612502792
A804: 603898.SH | B804: 好莱客 | C804: 7.33 | D804: 轻工制造-家居用品-定制家居 | E804: 4407674918.4300003 | F804: 3091055925.1999998 | G804: 2281710334.6300001 | H804: 2281710334.6300001 | I804: 809345590.57000005 | J804: =IF(G804=H804,"是","否") -> 是 | K804: =G804/C804 -> 311283811 | L804: =I804/K804 -> 2.6000246783473107
A805: 002431.SZ | B805: 棕榈股份 | C805: 1.56 | D805: 建筑装饰-建筑装饰-装饰园林 | E805: 19271517810.049999 | F805: 3077133963.5599999 | G805: 2827993373.4000001 | H805: 2827993373.4000001 | I805: 249140590.16 | J805: =IF(G805=H805,"是","否") -> 是 | K805: =G805/C805 -> 1812816265 | L805: =I805/K805 -> 0.1374328965213692
A806: 600387.SH | B806: *ST海越 | C806: 2.58 | D806: 石油石化-石油加工贸易-油品石化贸易 | E806: 4225151335.8800001 | F806: 3076658861.1700001 | G806: 1207812717.1199999 | H806: 1042445109.36 | I806: 1868846144.05 | J806: =IF(G806=H806,"是","否") -> 否 | K806: =G806/C806 -> 468144463.99999994 | L806: =I806/K806 -> 3.9920287171226705
A807: 603116.SH | B807: 红蜻蜓 | C807: 4.09 | D807: 纺织服饰-服装家纺-鞋帽及其他 | E807: 4203492339.9200001 | F807: 3075170665.8099999 | G807: 2356661272 | H807: 2356661272 | I807: 718509393.80999994 | J807: =IF(G807=H807,"是","否") -> 是 | K807: =G807/C807 -> 576200800 | L807: =I807/K807 -> 1.2469774318432045
A808: 603808.SH | B808: 歌力思 | C808: 6.01 | D808: 纺织服饰-服装家纺-服装 | E808: 4417582636.6300001 | F808: 3070528725.5700002 | G808: 2218248196.7800002 | H808: 2218248196.7800002 | I808: 852280528.78999996 | J808: =IF(G808=H808,"是","否") -> 是 | K808: =G808/C808 -> 369092878.00000006 | L808: =I808/K808 -> 2.309122119636239
A809: 000619.SZ | B809: 海螺新材 | C809: 4.06 | D809: 建筑材料-建筑材料-其他建材 | E809: 5372485875.8500004 | F809: 3067481993.8099999 | G809: 1791145453.8599999 | H809: 1461600000 | I809: 1276336539.95 | J809: =IF(G809=H809,"是","否") -> 否 | K809: =G809/C809 -> 441168831 | L809: =I809/K809 -> 2.893079588276716
A810: 002586.SZ | B810: *ST围海 | C810: 1.74 | D810: 建筑装饰-建筑装饰-基础建设 | E810: 7305272523.1800003 | F810: 3067149086.6999998 | G810: 1990949262.3599999 | H810: 1560707440.26 | I810: 1076199824.3399999 | J810: =IF(G810=H810,"是","否") -> 否 | K810: =G810/C810 -> 1144223714 | L810: =I810/K810 -> 0.94055018365053733
A811: 600052.SH | B811: 东望时代 | C811: 3.56 | D811: 公用事业-电力-热力 | E811: 3370635482.1700001 | F811: 3065253736.48 | G811: 3005333277.96 | H811: 3005333277.96 | I811: 59920458.520000003 | J811: =IF(G811=H811,"是","否") -> 是 | K811: =G811/C811 -> 844194741 | L811: =I811/K811 -> 7.0979426440184373e-02
A812: 603618.SH | B812: 杭电股份 | C812: 4.25 | D812: 电力设备-电网设备-线缆部件及其他 | E812: 10716517395.83 | F812: 3062495216.4699998 | G812: 2938346368 | H812: 2938346368 | I812: 124148848.47 | J812: =IF(G812=H812,"是","否") -> 是 | K812: =G812/C812 -> 691375616 | L812: =I812/K812 -> 0.17956787250940595
A813: 002546.SZ | B813: 新联电子 | C813: 3.17 | D813: 电力设备-电网设备-电气自控设备 | E813: 3375641516.8600001 | F813: 3048353563.1199999 | G813: 2643935634.3200002 | H813: 2539905744.3200002 | I813: 404417928.80000001 | J813: =IF(G813=H813,"是","否") -> 否 | K813: =G813/C813 -> 834049096.00000012 | L813: =I813/K813 -> 0.48488503942938144
A814: 000753.SZ | B814: 漳州发展 | C814: 2.74 | D814: 综合-综合-综合Ⅲ | E814: 10336307971.15 | F814: 3046823349.96 | G814: 2716658134.54 | H814: 2716658134.54 | I814: 330165215.42000002 | J814: =IF(G814=H814,"是","否") -> 是 | K814: =G814/C814 -> 991481070.99999988 | L814: =I814/K814 -> 0.33300203612258378
A815: 300983.SZ | B815: 尤安设计 | C815: 15.56 | D815: 建筑装饰-建筑装饰-工程咨询服务 | E815: 3156528124.4200001 | F815: 3041492573.02 | G815: 2688768000 | H815: 672192000 | I815: 352724573.01999998 | J815: =IF(G815=H815,"是","否") -> 否 | K815: =G815/C815 -> 172800000 | L815: =I815/K815 -> 2.0412301679398146
A816: 002628.SZ | B816: 成都路桥 | C816: 2.15 | D816: 建筑装饰-建筑装饰-基础建设 | E816: 7109680544.04 | F816: 3037176900.5900002 | G816: 1627765892.25 | H816: 1623312784.3 | I816: 1409411008.3399999 | J816: =IF(G816=H816,"是","否") -> 否 | K816: =G816/C816 -> 757100415 | L816: =I816/K816 -> 1.86159059012007
A817: 300040.SZ | B817: 九洲集团 | C817: 5.0999999999999996 | D817: 公用事业-电力-电能综合服务 | E817: 7487262074.25 | F817: 3034216266.8699999 | G817: 2997627285.5999999 | H817: 2349751891.5 | I817: 36588981.270000003 | J817: =IF(G817=H817,"是","否") -> 否 | K817: =G817/C817 -> 587770056 | L817: =I817/K817 -> 6.2250502380134867e-02
A818: 002663.SZ | B818: 普邦股份 | C818: 1.35 | D818: 建筑装饰-建筑装饰-装饰园林 | E818: 5215467172.6899996 | F818: 3011238002.7399998 | G818: 2326521017.6999998 | H818: 1885204982.25 | I818: 684716985.03999996 | J818: =IF(G818=H818,"是","否") -> 否 | K818: =G818/C818 -> 1723348901.9999998 | L818: =I818/K818 -> 0.39731767853007866
A819: 600579.SH | B819: 克劳斯 | C819: 5.36 | D819: 机械设备-专用设备-其他专用设备 | E819: 17693448839.900002 | F819: 3002987479.4899998 | G819: 2661192612.2399998 | H819: 2661192612.2399998 | I819: 341794867.25 | J819: =IF(G819=H819,"是","否") -> 是 | K819: =G819/C819 -> 496491158.99999994 | L819: =I819/K819 -> 0.68842085312943113
A820: 300120.SZ | B820: 经纬辉开 | C820: 5.12 | D820: 电子-光学光电子-面板 | E820: 4795244495.4700003 | F820: 3000351770.1500001 | G820: 2940896916.48 | H820: 2521278095.3600001 | I820: 59454853.670000002 | J820: =IF(G820=H820,"是","否") -> 否 | K820: =G820/C820 -> 574393929 | L820: =I820/K820 -> 0.10350884761875678
A821: 300326.SZ | B821: 凯利泰 | C821: 4.04 | D821: 医药生物-医疗器械-医疗耗材 | E821: 3367072932.6300001 | F821: 2996764163.7600002 | G821: 2896786385.3200002 | H821: 2895018400.52 | I821: 99977778.439999998 | J821: =IF(G821=H821,"是","否") -> 否 | K821: =G821/C821 -> 717026333 | L821: =I821/K821 -> 0.13943390059567032
A822: 603610.SH | B822: 麒盛科技 | C822: 7.86 | D822: 轻工制造-家居用品-成品家居 | E822: 4523416825.2399998 | F822: 2990165400.0700002 | G822: 2817725512.8600001 | H822: 2817725512.8600001 | I822: 172439887.21000001 | J822: =IF(G822=H822,"是","否") -> 是 | K822: =G822/C822 -> 358489251 | L822: =I822/K822 -> 0.48101829198220508
A823: 002661.SZ | B823: 克明食品 | C823: 8.13 | D823: 食品饮料-食品加工制造-预加工食品 | E823: 6048624918.7299995 | F823: 2988223787.4699998 | G823: 2795377265.46 | H823: 2624484340.2600002 | I823: 192846522.00999999 | J823: =IF(G823=H823,"是","否") -> 否 | K823: =G823/C823 -> 343834842 | L823: =I823/K823 -> 0.56086963406111123
A824: 600382.SH | B824: 广东明珠 | C824: 3.42 | D824: 钢铁-钢铁-冶钢原料 | E824: 3455517724.0799999 | F824: 2953663109.4899998 | G824: 2374875664.3800001 | H824: 2374875664.3800001 | I824: 578787445.11000001 | J824: =IF(G824=H824,"是","否") -> 是 | K824: =G824/C824 -> 694408089 | L824: =I824/K824 -> 0.83349755608909681
A825: 301356.SZ | B825: 天振股份 | C825: 12.79 | D825: 轻工制造-家居用品-瓷砖地板 | E825: 3152909972.2399998 | F825: 2939856060.21 | G825: 2762640000 | H825: 701019900 | I825: 177216060.21000001 | J825: =IF(G825=H825,"是","否") -> 否 | K825: =G825/C825 -> 216000000 | L825: =I825/K825 -> 0.8204447231944445
A826: 000608.SZ | B826: 阳光股份 | C826: 1.56 | D826: 房地产-房地产-商业地产 | E826: 4303880993.79 | F826: 2913803874.6399999 | G826: 1169864762.04 | H826: 1161824990.04 | I826: 1743939112.5999999 | J826: =IF(G826=H826,"是","否") -> 否 | K826: =G826/C826 -> 749913309 | L826: =I826/K826 -> 2.3255209524491849
A827: 002054.SZ | B827: 德美化工 | C827: 4.56 | D827: 基础化工-化学制品-纺织化学用品 | E827: 6750215141.9799995 | F827: 2909690827.6700001 | G827: 2198446461.1199999 | H827: 1745743008.24 | I827: 711244366.54999995 | J827: =IF(G827=H827,"是","否") -> 否 | K827: =G827/C827 -> 482115452 | L827: =I827/K827 -> 1.4752573550577672
A828: 603817.SH | B828: 海峡环保 | C828: 4.64 | D828: 环保-环境治理-水务及水治理 | E828: 6613904981.8199997 | F828: 2902838764.8499999 | G828: 2479421152.48 | H828: 2479421152.48 | I828: 423417612.37 | J828: =IF(G828=H828,"是","否") -> 是 | K828: =G828/C828 -> 534358007.00000006 | L828: =I828/K828 -> 0.79238564187922789
A829: 603001.SH | B829: 奥康国际 | C829: 3.99 | D829: 纺织服饰-服装家纺-鞋帽及其他 | E829: 3940411969.77 | F829: 2899123058 | G829: 1599910200 | H829: 1599910200 | I829: 1299212858 | J829: =IF(G829=H829,"是","否") -> 是 | K829: =G829/C829 -> 400980000 | L829: =I829/K829 -> 3.2400939149084742
A830: 301223.SZ | B830: 中荣股份 | C830: 14.09 | D830: 轻工制造-包装印刷-包装 | E830: 3865316225.3400002 | F830: 2871055424.8400002 | G830: 2721167320.4000001 | H830: 1578292195.4000001 | I830: 149888104.44 | J830: =IF(G830=H830,"是","否") -> 否 | K830: =G830/C830 -> 193127560 | L830: =I830/K830 -> 0.77610934679649035
A831: 000626.SZ | B831: 远大控股 | C831: 4.25 | D831: 商贸零售-贸易-贸易Ⅲ | E831: 9010263601.7999992 | F831: 2864579481.1500001 | G831: 2162996972 | H831: 2133597898.75 | I831: 701582509.14999998 | J831: =IF(G831=H831,"是","否") -> 否 | K831: =G831/C831 -> 508940464 | L831: =I831/K831 -> 1.3785158751888904
A832: 600594.SH | B832: 益佰制药 | C832: 3.09 | D832: 医药生物-中药-中药Ⅲ | E832: 4405858145.3299999 | F832: 2855053308.29 | G832: 2447055666 | H832: 2447055666 | I832: 407997642.29000002 | J832: =IF(G832=H832,"是","否") -> 是 | K832: =G832/C832 -> 791927400 | L832: =I832/K832 -> 0.51519576452336413
A833: 301322.SZ | B833: 绿通科技 | C833: 17.67 | D833: 汽车-汽车服务及其他-其他运输设备 | E833: 2990273743.77 | F833: 2854278886.02 | G833: 2593424079.9899998 | H833: 1719603741.3299999 | I833: 260854806.03 | J833: =IF(G833=H833,"是","否") -> 否 | K833: =G833/C833 -> 146769896.99999997 | L833: =I833/K833 -> 1.7773045519681741
A834: 300732.SZ | B834: 设研院 | C834: 6.23 | D834: 建筑装饰-建筑装饰-工程咨询服务 | E834: 6702583357.1000004 | F834: 2839327979.9200001 | G834: 2020457486.3900001 | H834: 2016902916.28 | I834: 818870493.52999997 | J834: =IF(G834=H834,"是","否") -> 否 | K834: =G834/C834 -> 324310993 | L834: =I834/K834 -> 2.5249544764275074
A835: 601218.SH | B835: 吉鑫科技 | C835: 2.68 | D835: 电力设备-风电设备-风电零部件 | E835: 3651318988.0900002 | F835: 2838633764.71 | G835: 2618617097.7600002 | H835: 2615688672.48 | I835: 220016666.94999999 | J835: =IF(G835=H835,"是","否") -> 否 | K835: =G835/C835 -> 977095932 | L835: =I835/K835 -> 0.22517406914145252
A836: 688133.SH | B836: 泰坦科技 | C836: 14.62 | D836: 基础化工-化学制品-其他化学制品 | E836: 4712268899.5500002 | F836: 2832855533.71 | G836: 2404068603.7399998 | H836: 2404068603.7399998 | I836: 428786929.97000003 | J836: =IF(G836=H836,"是","否") -> 是 | K836: =G836/C836 -> 164436977 | L836: =I836/K836 -> 2.6076064994189236
A837: 300195.SZ | B837: 长荣股份 | C837: 4.0999999999999996 | D837: 机械设备-专用设备-印刷包装机械 | E837: 6272916670.8199997 | F837: 2831503470.46 | G837: 1737201799.5999999 | H837: 1287041172.0999999 | I837: 1094301670.8599999 | J837: =IF(G837=H837,"是","否") -> 否 | K837: =G837/C837 -> 423707756 | L837: =I837/K837 -> 2.5826802916961471
A838: 688560.SH | B838: 明冠新材 | C838: 10.45 | D838: 电力设备-光伏设备-光伏辅材 | E838: 3214258986.4899998 | F838: 2814166571.73 | G838: 2103605043.0999999 | H838: 2103605043.0999999 | I838: 710561528.63 | J838: =IF(G838=H838,"是","否") -> 是 | K838: =G838/C838 -> 201301918 | L838: =I838/K838 -> 3.5298298977459321
A839: 603987.SH | B839: 康德莱 | C839: 5.83 | D839: 医药生物-医疗器械-医疗耗材 | E839: 4074393311.8000002 | F839: 2806965231.9400001 | G839: 2571040377.4000001 | H839: 2571040377.4000001 | I839: 235924854.53999999 | J839: =IF(G839=H839,"是","否") -> 是 | K839: =G839/C839 -> 441001780 | L839: =I839/K839 -> 0.53497483511291044
A840: 002082.SZ | B840: 万邦德 | C840: 4.02 | D840: 医药生物-中药-中药Ⅲ | E840: 4321707988.1499996 | F840: 2791711469.96 | G840: 2479090001.0999999 | H840: 2479090001.0999999 | I840: 312621468.86000001 | J840: =IF(G840=H840,"是","否") -> 是 | K840: =G840/C840 -> 616689055 | L840: =I840/K840 -> 0.50693532879386027
A841: 600831.SH | B841: ST广网 | C841: 2.07 | D841: 传媒-文化传媒-电视广播 | E841: 11593281796.99 | F841: 2782190050.1500001 | G841: 1471660273.4400001 | H841: 1471660273.4400001 | I841: 1310529776.71 | J841: =IF(G841=H841,"是","否") -> 是 | K841: =G841/C841 -> 710946992.00000012 | L841: =I841/K841 -> 1.8433579316838853
A842: 301115.SZ | B842: 建科股份 | C842: 12.23 | D842: 社会服务-其他社会服务-专业服务 | E842: 3789992140.1900001 | F842: 2778117010.79 | G842: 2264942677.1999998 | H842: 1293345908.22 | I842: 513174333.58999997 | J842: =IF(G842=H842,"是","否") -> 否 | K842: =G842/C842 -> 185195639.99999997 | L842: =I842/K842 -> 2.7709849626589484
A843: 603759.SH | B843: 海天股份 | C843: 5.58 | D843: 环保-环境治理-水务及水治理 | E843: 6388917784.2299995 | F843: 2765847447.75 | G843: 2576620800 | H843: 2576620800 | I843: 189226647.75 | J843: =IF(G843=H843,"是","否") -> 是 | K843: =G843/C843 -> 461760000 | L843: =I843/K843 -> 0.40979436882796255
A844: 002551.SZ | B844: 尚荣医疗 | C844: 2.48 | D844: 医药生物-医疗器械-医疗耗材 | E844: 3902165496.4299998 | F844: 2765327027.9899998 | G844: 2095162748.72 | H844: 1513763787.52 | I844: 670164279.26999998 | J844: =IF(G844=H844,"是","否") -> 否 | K844: =G844/C844 -> 844823689 | L844: =I844/K844 -> 0.79325933682477501
A845: 300490.SZ | B845: 华自科技 | C845: 6.38 | D845: 电力设备-电池-锂电专用设备 | E845: 6636406385 | F845: 2763243616.0100002 | G845: 2527833032.1199999 | H845: 2495153000.5599999 | I845: 235410583.88999999 | J845: =IF(G845=H845,"是","否") -> 否 | K845: =G845/C845 -> 396212074 | L845: =I845/K845 -> 0.59415297851321913
A846: 688196.SH | B846: 卓越新能 | C846: 19.44 | D846: 基础化工-化学制品-其他化学制品 | E846: 3301628876.0100002 | F846: 2750665904.96 | G846: 2332800000 | H846: 2332800000 | I846: 417865904.95999998 | J846: =IF(G846=H846,"是","否") -> 是 | K846: =G846/C846 -> 119999999.99999999 | L846: =I846/K846 -> 3.4822158746666667
A847: 601996.SH | B847: 丰林集团 | C847: 1.67 | D847: 轻工制造-家居用品-其他家居用品 | E847: 3426895518.8800001 | F847: 2739854946.48 | G847: 1871927074.72 | H847: 1871927074.72 | I847: 867927871.75999999 | J847: =IF(G847=H847,"是","否") -> 是 | K847: =G847/C847 -> 1120914416 | L847: =I847/K847 -> 0.77430342528487917
A848: 600858.SH | B848: 银座股份 | C848: 4.18 | D848: 商贸零售-零售-百货零售 | E848: 11408984106.389999 | F848: 2738789822.0500002 | G848: 2173878342.02 | H848: 2163350761.2199998 | I848: 564911480.02999997 | J848: =IF(G848=H848,"是","否") -> 否 | K848: =G848/C848 -> 520066589.00000006 | L848: =I848/K848 -> 1.086229132919746
A849: 003016.SZ | B849: 欣贺股份 | C849: 6.22 | D849: 纺织服饰-服装家纺-服装 | E849: 3478632388.9099998 | F849: 2727677308.3499999 | G849: 2665404426.6399999 | H849: 2654574940.1399999 | I849: 62272881.710000001 | J849: =IF(G849=H849,"是","否") -> 否 | K849: =G849/C849 -> 428521612 | L849: =I849/K849 -> 0.14532028249254322
A850: 600128.SH | B850: 苏豪弘业 | C850: 6.83 | D850: 商贸零售-贸易-贸易Ⅲ | E850: 5918767751.9099998 | F850: 2722089278.4000001 | G850: 1685422025 | H850: 1685422025 | I850: 1036667253.4 | J850: =IF(G850=H850,"是","否") -> 是 | K850: =G850/C850 -> 246767500 | L850: =I850/K850 -> 4.2009877856686959
A851: 603180.SH | B851: 金牌家居 | C851: 15.99 | D851: 轻工制造-家居用品-定制家居 | E851: 5777884472.1000004 | F851: 2720149506.04 | G851: 2466569589.9000001 | H851: 2466569589.9000001 | I851: 253579916.13999999 | J851: =IF(G851=H851,"是","否") -> 是 | K851: =G851/C851 -> 154257010 | L851: =I851/K851 -> 1.6438793682050494
A852: 000605.SZ | B852: 渤海股份 | C852: 4.43 | D852: 环保-环境治理-水务及水治理 | E852: 8058210561.79 | F852: 2717773774.79 | G852: 1562277598 | H852: 1473589516.3099999 | I852: 1155496176.79 | J852: =IF(G852=H852,"是","否") -> 否 | K852: =G852/C852 -> 352658600 | L852: =I852/K852 -> 3.2765291326795944
A853: 301349.SZ | B853: 信德新材 | C853: 22.56 | D853: 电力设备-电池-电池化学品 | E853: 3166136548.52 | F853: 2717263338.54 | G853: 2301120000 | H853: 950661547.67999995 | I853: 416143338.54000002 | J853: =IF(G853=H853,"是","否") -> 否 | K853: =G853/C853 -> 102000000 | L853: =I853/K853 -> 4.0798366523529417
A854: 688199.SH | B854: 久日新材 | C854: 11.31 | D854: 基础化工-化学制品-其他化学制品 | E854: 4193298919.73 | F854: 2698843990.1999998 | G854: 1823480208.8099999 | H854: 1823480208.8099999 | I854: 875363781.38999999 | J854: =IF(G854=H854,"是","否") -> 是 | K854: =G854/C854 -> 161227251 | L854: =I854/K854 -> 5.4293785694454346
A855: 605138.SH | B855: 盛泰集团 | C855: 4.7999999999999998 | D855: 纺织服饰-服装家纺-服装 | E855: 7112105456.2299995 | F855: 2696660135.9400001 | G855: 2666699145.5999999 | H855: 1427154345.5999999 | I855: 29960990.34 | J855: =IF(G855=H855,"是","否") -> 否 | K855: =G855/C855 -> 555562322 | L855: =I855/K855 -> 5.3929125776819686e-02
A856: 002863.SZ | B856: 今飞凯达 | C856: 3.64 | D856: 汽车-汽车零部件-轮胎轮毂 | E856: 7580024412.5 | F856: 2693891075.2399998 | G856: 2179104578.5599999 | H856: 2179104578.5599999 | I856: 514786496.68000001 | J856: =IF(G856=H856,"是","否") -> 是 | K856: =G856/C856 -> 598655104 | L856: =I856/K856 -> 0.85990496571461617
A857: 605500.SH | B857: 森林包装 | C857: 6.02 | D857: 轻工制造-造纸-造纸Ⅲ | E857: 3549853469.4499998 | F857: 2688494366.1799998 | G857: 2494688000 | H857: 2494688000 | I857: 193806366.18000001 | J857: =IF(G857=H857,"是","否") -> 是 | K857: =G857/C857 -> 414400000 | L857: =I857/K857 -> 0.46767945506756758
A858: 002734.SZ | B858: 利民股份 | C858: 6.75 | D858: 基础化工-农化制品-农药 | E858: 6767255311.04 | F858: 2684886383.23 | G858: 2476320619.5 | H858: 2192541878.25 | I858: 208565763.72999999 | J858: =IF(G858=H858,"是","否") -> 否 | K858: =G858/C858 -> 366862314 | L858: =I858/K858 -> 0.56851237036573887
A859: 605001.SH | B859: 威奥股份 | C859: 5.03 | D859: 机械设备-轨交设备-轨交设备Ⅲ | E859: 4610035192.6000004 | F859: 2680104211.4000001 | G859: 1976216580 | H859: 1976216580 | I859: 703887631.39999998 | J859: =IF(G859=H859,"是","否") -> 是 | K859: =G859/C859 -> 392886000 | L859: =I859/K859 -> 1.7915823709676597
A860: 605006.SH | B860: 山东玻纤 | C860: 4.24 | D860: 建筑材料-建筑材料-玻璃玻纤 | E860: 6223431012.79 | F860: 2664868374.4699998 | G860: 2590456810.8000002 | H860: 2544027962.8000002 | I860: 74411563.670000002 | J860: =IF(G860=H860,"是","否") -> 否 | K860: =G860/C860 -> 610956795 | L860: =I860/K860 -> 0.12179513228918258
A861: 688370.SH | B861: 丛麟科技 | C861: 15.56 | D861: 环保-环境治理-固废治理 | E861: 3261622174.4400001 | F861: 2649434609.4499998 | G861: 2152259200 | H861: 699596847.72000003 | I861: 497175409.44999999 | J861: =IF(G861=H861,"是","否") -> 否 | K861: =G861/C861 -> 138320000 | L861: =I861/K861 -> 3.5943855512579526
A862: 688121.SH | B862: 卓然股份 | C862: 9.34 | D862: 机械设备-专用设备-能源及重型设备 | E862: 8302520264.3599997 | F862: 2643582801.1700001 | G862: 2181954788.02 | H862: 1322344749.78 | I862: 461628013.14999998 | J862: =IF(G862=H862,"是","否") -> 否 | K862: =G862/C862 -> 233614003 | L862: =I862/K862 -> 1.9760288648022524
A863: 688184.SH | B863: 帕瓦股份 | C863: 11.08 | D863: 电力设备-电池-电池化学品 | E863: 3808242679.1700001 | F863: 2642241394.5999999 | G863: 1786692923.9200001 | H863: 1137848123.9200001 | I863: 855548470.67999995 | J863: =IF(G863=H863,"是","否") -> 否 | K863: =G863/C863 -> 161253874 | L863: =I863/K863 -> 5.3055994839541034
A864: 601616.SH | B864: 广电电气 | C864: 2.76 | D864: 电力设备-电网设备-输变电设备 | E864: 3138467848.6999998 | F864: 2624849064.5799999 | G864: 2356143880.4400001 | H864: 2356143880.4400001 | I864: 268705184.13999999 | J864: =IF(G864=H864,"是","否") -> 是 | K864: =G864/C864 -> 853675319.00000012 | L864: =I864/K864 -> 0.31476274194592235
A865: 603278.SH | B865: 大业股份 | C865: 5.18 | D865: 机械设备-通用设备-金属制品 | E865: 7888277589.5 | F865: 2604112578.02 | G865: 1770313650.5599999 | H865: 1770313650.5599999 | I865: 833798927.46000004 | J865: =IF(G865=H865,"是","否") -> 是 | K865: =G865/C865 -> 341759392 | L865: =I865/K865 -> 2.4397249848220706
A866: 300695.SZ | B866: 兆丰股份 | C866: 34.61 | D866: 汽车-汽车零部件-轮胎轮毂 | E866: 3028984607.6199999 | F866: 2584045685.5700002 | G866: 2454882869.9200001 | H866: 2454882869.9200001 | I866: 129162815.65000001 | J866: =IF(G866=H866,"是","否") -> 是 | K866: =G866/C866 -> 70929872 | L866: =I866/K866 -> 1.8209932149602639
A867: 600356.SH | B867: 恒丰纸业 | C867: 6.24 | D867: 轻工制造-造纸-造纸Ⅲ | E867: 3279496560.7399998 | F867: 2578822907.5900002 | G867: 1864083798.72 | H867: 1864083798.72 | I867: 714739108.87 | J867: =IF(G867=H867,"是","否") -> 是 | K867: =G867/C867 -> 298731378 | L867: =I867/K867 -> 2.3925813004819334
A868: 600419.SH | B868: 天润乳业 | C868: 7.01 | D868: 食品饮料-饮料制造-乳品 | E868: 5860201083.3800001 | F868: 2567648285.1599998 | G868: 2244533624.46 | H868: 2244533624.46 | I868: 323114660.69999999 | J868: =IF(G868=H868,"是","否") -> 是 | K868: =G868/C868 -> 320190246 | L868: =I868/K868 -> 1.0091333659801742
A869: 002722.SZ | B869: 物产金轮 | C869: 12.04 | D869: 机械设备-专用设备-纺织服装设备 | E869: 3011669891.0300002 | F869: 2556173158.8699999 | G869: 2487182035.2399998 | H869: 2112908630 | I869: 68991123.629999995 | J869: =IF(G869=H869,"是","否") -> 否 | K869: =G869/C869 -> 206576581 | L869: =I869/K869 -> 0.33397359611639615
A870: 688308.SH | B870: 欧科亿 | C870: 14.300000000000001 | D870: 机械设备-通用设备-金属制品 | E870: 3750335733 | F870: 2552082526.3000002 | G870: 2270578424.4000001 | H870: 2270578424.4000001 | I870: 281504101.89999998 | J870: =IF(G870=H870,"是","否") -> 是 | K870: =G870/C870 -> 158781708 | L870: =I870/K870 -> 1.7729000742327321
A871: 300305.SZ | B871: 裕兴股份 | C871: 4.56 | D871: 基础化工-塑料制品-膜材料 | E871: 4092726180.5599999 | F871: 2541327635.3000002 | G871: 1711823142.72 | H871: 1452349644.24 | I871: 829504492.58000004 | J871: =IF(G871=H871,"是","否") -> 否 | K871: =G871/C871 -> 375399812.00000006 | L871: =I871/K871 -> 2.2096561214580466
A872: 002674.SZ | B872: 兴业科技 | C872: 7.87 | D872: 纺织服饰-纺织制造-辅料 | E872: 4277228212.1999998 | F872: 2525352742.6399999 | G872: 2296961369.2800002 | H872: 2273451381.2399998 | I872: 228391373.36000001 | J872: =IF(G872=H872,"是","否") -> 否 | K872: =G872/C872 -> 291862944 | L872: =I872/K872 -> 0.78252953331410247
A873: 600791.SH | B873: 京能置业 | C873: 3.66 | D873: 房地产-房地产-住宅开发 | E873: 22085969734.169998 | F873: 2520093804.27 | G873: 1657540800 | H873: 1655468127.3599999 | I873: 862553004.26999998 | J873: =IF(G873=H873,"是","否") -> 否 | K873: =G873/C873 -> 452880000 | L873: =I873/K873 -> 1.9045950456412295
A874: 301088.SZ | B874: 戎美股份 | C874: 10.48 | D874: 纺织服饰-服装家纺-服装 | E874: 2690073883.6300001 | F874: 2515009205.98 | G874: 2389440000 | H874: 605220000 | I874: 125569205.98 | J874: =IF(G874=H874,"是","否") -> 否 | K874: =G874/C874 -> 228000000 | L874: =I874/K874 -> 0.55074213149122808
A875: 300214.SZ | B875: 日科化学 | C875: 4.36 | D875: 基础化工-化学制品-其他化学制品 | E875: 4570119034.46 | F875: 2514924133.9400001 | G875: 2031945797.04 | H875: 1759538324.96 | I875: 482978336.89999998 | J875: =IF(G875=H875,"是","否") -> 否 | K875: =G875/C875 -> 466042613.99999994 | L875: =I875/K875 -> 1.0363394298959967
A876: 605136.SH | B876: 丽人丽妆 | C876: 6.02 | D876: 商贸零售-互联网电商-互联网电商Ⅲ | E876: 2844527534.9400001 | F876: 2512172726.79 | G876: 2410760170 | H876: 2410760170 | I876: 101412556.79000001 | J876: =IF(G876=H876,"是","否") -> 是 | K876: =G876/C876 -> 400458500 | L876: =I876/K876 -> 0.25324111434767899
A877: 002197.SZ | B877: ST证通 | C877: 3.25 | D877: 计算机-IT服务-IT服务Ⅲ | E877: 6514271168.54 | F877: 2508190266.1500001 | G877: 1996679516 | H877: 1735502232.75 | I877: 511510750.14999998 | J877: =IF(G877=H877,"是","否") -> 否 | K877: =G877/C877 -> 614362928 | L877: =I877/K877 -> 0.83258726534033312
A878: 300420.SZ | B878: 五洋自控 | C878: 2.1000000000000001 | D878: 机械设备-通用设备-其他通用设备 | E878: 3340845856.5799999 | F878: 2504727886.0799999 | G878: 2344405478.0999999 | H878: 2344364528.0999999 | I878: 160322407.97999999 | J878: =IF(G878=H878,"是","否") -> 否 | K878: =G878/C878 -> 1116383561 | L878: =I878/K878 -> 0.14360871440671455
A879: 688061.SH | B879: 灿瑞科技 | C879: 21.17 | D879: 电子-半导体-模拟芯片设计 | E879: 2713472045.4899998 | F879: 2492482861.2800002 | G879: 2432208407.4699998 | H879: 898372173.49000001 | I879: 60274453.810000002 | J879: =IF(G879=H879,"是","否") -> 否 | K879: =G879/C879 -> 114889390.99999999 | L879: =I879/K879 -> 0.52463028383534571
A880: 603681.SH | B880: 永冠新材 | C880: 10.04 | D880: 基础化工-化学制品-其他化学制品 | E880: 6680453271.5100002 | F880: 2475374598.2600002 | G880: 1918953081.4000001 | H880: 1918953081.4000001 | I880: 556421516.86000001 | J880: =IF(G880=H880,"是","否") -> 是 | K880: =G880/C880 -> 191130785.00000003 | L880: =I880/K880 -> 2.9112082434025472
A881: 300692.SZ | B881: 中环环保 | C881: 4.24 | D881: 环保-环境治理-水务及水治理 | E881: 6805926683.3400002 | F881: 2454452205.8600001 | G881: 1796720644.5599999 | H881: 1588222566.5599999 | I881: 657731561.29999995 | J881: =IF(G881=H881,"是","否") -> 否 | K881: =G881/C881 -> 423754868.99999994 | L881: =I881/K881 -> 1.5521510415966455
A882: 002593.SZ | B882: 日上集团 | C882: 2.62 | D882: 建筑装饰-建筑装饰-专业工程 | E882: 4777003679.79 | F882: 2396688175.3200002 | G882: 2106108035.98 | H882: 1494628214.0799999 | I882: 290580139.33999997 | J882: =IF(G882=H882,"是","否") -> 否 | K882: =G882/C882 -> 803858029 | L882: =I882/K882 -> 0.36148191453841905
A883: 002887.SZ | B883: 绿茵生态 | C883: 5.56 | D883: 环保-环境治理-综合环境治理 | E883: 4242432738.02 | F883: 2389029979.3099999 | G883: 1701277033.6800001 | H883: 886622102.91999996 | I883: 687752945.63 | J883: =IF(G883=H883,"是","否") -> 否 | K883: =G883/C883 -> 305985078.00000006 | L883: =I883/K883 -> 2.2476682527309384
A884: 002822.SZ | B884: ST中装 | C884: 2.04 | D884: 建筑装饰-建筑装饰-装饰园林 | E884: 7287829977.1899996 | F884: 2388907158.6700001 | G884: 1455862468.9200001 | H884: 1067220573.6 | I884: 933044689.75 | J884: =IF(G884=H884,"是","否") -> 否 | K884: =G884/C884 -> 713658073 | L884: =I884/K884 -> 1.3074113851578331
A885: 300745.SZ | B885: 欣锐科技 | C885: 13.69 | D885: 汽车-汽车零部件-汽车电子电气系统 | E885: 4292950489.46 | F885: 2384329031.1799998 | G885: 2294641012.79 | H885: 1934365718.3499999 | I885: 89688018.390000001 | J885: =IF(G885=H885,"是","否") -> 否 | K885: =G885/C885 -> 167614391 | L885: =I885/K885 -> 0.53508542944859672
A886: 688162.SH | B886: 巨一科技 | C886: 15.75 | D886: 机械设备-专用设备-其他专用设备 | E886: 7185328343.46 | F886: 2363965162.8800001 | G886: 2162527762.5 | H886: 765715387.5 | I886: 201437400.38 | J886: =IF(G886=H886,"是","否") -> 否 | K886: =G886/C886 -> 137303350 | L886: =I886/K886 -> 1.4670974916489656
A887: 603818.SH | B887: 曲美家居 | C887: 2.16 | D887: 轻工制造-家居用品-成品家居 | E887: 6955974153.3900003 | F887: 2360822946.4400001 | G887: 1488373606.8 | H887: 1482934726.8 | I887: 872449339.63999999 | J887: =IF(G887=H887,"是","否") -> 否 | K887: =G887/C887 -> 689061854.99999988 | L887: =I887/K887 -> 1.2661408164002927
A888: 002330.SZ | B888: 得利斯 | C888: 3.68 | D888: 食品饮料-食品加工制造-肉制品 | E888: 3338742621.5 | F888: 2351319265.3299999 | G888: 2338181067.1999998 | H888: 2337457671.1999998 | I888: 13138198.130000001 | J888: =IF(G888=H888,"是","否") -> 否 | K888: =G888/C888 -> 635375289.99999988 | L888: =I888/K888 -> 2.0677855020140936e-02
A889: 300715.SZ | B889: 凯伦股份 | C889: 5.92 | D889: 建筑材料-建筑材料-其他建材 | E889: 6338340555.6800003 | F889: 2338687737.8299999 | G889: 2278664997.7600002 | H889: 2018797398.0799999 | I889: 60022740.07 | J889: =IF(G889=H889,"是","否") -> 否 | K889: =G889/C889 -> 384909628.00000006 | L889: =I889/K889 -> 0.15593982510097146
A890: 300422.SZ | B890: 博世科 | C890: 3.72 | D890: 环保-环境治理-水务及水治理 | E890: 10790994140.1 | F890: 2329833353.21 | G890: 1986035047.0799999 | H890: 1553219612.8800001 | I890: 343798306.13 | J890: =IF(G890=H890,"是","否") -> 否 | K890: =G890/C890 -> 533880388.99999994 | L890: =I890/K890 -> 0.64396129397815371
A891: 002566.SZ | B891: 益盛药业 | C891: 5.98 | D891: 医药生物-中药-中药Ⅲ | E891: 3004725858.04 | F891: 2316139715.5300002 | G891: 1979090568 | H891: 1386106998.6400001 | I891: 337049147.52999997 | J891: =IF(G891=H891,"是","否") -> 否 | K891: =G891/C891 -> 330951600 | L891: =I891/K891 -> 1.018424287811269
A892: 002753.SZ | B892: 永东股份 | C892: 5.39 | D892: 基础化工-橡胶制品-炭黑 | E892: 3226219155.1900001 | F892: 2277372538.6999998 | G892: 2024966232.52 | H892: 1308685769.1600001 | I892: 252406306.18000001 | J892: =IF(G892=H892,"是","否") -> 否 | K892: =G892/C892 -> 375689468 | L892: =I892/K892 -> 0.67184823552200301
A893: 688499.SH | B893: 利元亨 | C893: 17.37 | D893: 电力设备-电池-锂电专用设备 | E893: 9267486748.2399998 | F893: 2264717176.8200002 | G893: 2147389299.99 | H893: 2147389299.99 | I893: 117327876.83 | J893: =IF(G893=H893,"是","否") -> 是 | K893: =G893/C893 -> 123626327 | L893: =I893/K893 -> 0.94905251718754047
A894: 301189.SZ | B894: 奥尼电子 | C894: 19.31 | D894: 电子-消费电子-品牌消费电子 | E894: 2498382775.5700002 | F894: 2241905158.1500001 | G894: 2218650739.1500001 | H894: 789544827.63 | I894: 23254419 | J894: =IF(G894=H894,"是","否") -> 否 | K894: =G894/C894 -> 114896465.00000001 | L894: =I894/K894 -> 0.20239455582902396
A895: 002360.SZ | B895: 同德化工 | C895: 4.18 | D895: 基础化工-化学制品-民爆用品 | E895: 4535838144.4799995 | F895: 2224945163.3099999 | G895: 1679416356.6400001 | H895: 1372140460.24 | I895: 545528806.66999996 | J895: =IF(G895=H895,"是","否") -> 否 | K895: =G895/C895 -> 401774248.00000006 | L895: =I895/K895 -> 1.3577993347896202
A896: 605122.SH | B896: 四方新材 | C896: 8.85 | D896: 建筑材料-建筑材料-水泥 | E896: 4228749598.9699998 | F896: 2224860923.04 | G896: 1525332900 | H896: 1525332900 | I896: 699528023.03999996 | J896: =IF(G896=H896,"是","否") -> 是 | K896: =G896/C896 -> 172354000 | L896: =I896/K896 -> 4.0586700804158884
A897: 600287.SH | B897: ST舜天 | C897: 2.99 | D897: 商贸零售-贸易-贸易Ⅲ | E897: 3573942443.8200002 | F897: 2214150092.98 | G897: 1312155442.26 | H897: 1306020261.26 | I897: 901994650.72000003 | J897: =IF(G897=H897,"是","否") -> 否 | K897: =G897/C897 -> 438847973.99999994 | L897: =I897/K897 -> 2.055369294515645
A898: 600097.SH | B898: 开创国际 | C898: 7.28 | D898: 农林牧渔-养殖业-海洋捕捞 | E898: 3145810458.3299999 | F898: 2213938889.8899999 | G898: 1754018149.52 | H898: 1754018149.52 | I898: 459920740.37 | J898: =IF(G898=H898,"是","否") -> 是 | K898: =G898/C898 -> 240936559 | L898: =I898/K898 -> 1.9088873115764886
A899: 600854.SH | B899: 春兰股份 | C899: 3.98 | D899: 房地产-房地产-住宅开发 | E899: 2384870818.6700001 | F899: 2208938796.3400002 | G899: 2067444981.24 | H899: 2067444981.24 | I899: 141493815.09999999 | J899: =IF(G899=H899,"是","否") -> 是 | K899: =G899/C899 -> 519458538 | L899: =I899/K899 -> 0.27238711995142911
A900: 603538.SH | B900: 美诺华 | C900: 10.01 | D900: 医药生物-化学制药-原料药 | E900: 4536569111.2200003 | F900: 2207209716.6700001 | G900: 2189698841.3299999 | H900: 2124705022.4400001 | I900: 17510875.34 | J900: =IF(G900=H900,"是","否") -> 否 | K900: =G900/C900 -> 218751133 | L900: =I900/K900 -> 8.004930123036208e-02
A901: 301290.SZ | B901: 东星医疗 | C901: 18.65 | D901: 医药生物-医疗器械-医疗耗材 | E901: 2373152059.4699998 | F901: 2205113962.5100002 | G901: 1868232679.0999999 | H901: 1271541147.5 | I901: 336881283.41000003 | J901: =IF(G901=H901,"是","否") -> 否 | K901: =G901/C901 -> 100173334 | L901: =I901/K901 -> 3.362983640037378
A902: 605288.SH | B902: 凯迪股份 | C902: 29.22 | D902: 机械设备-自动化设备-工控设备 | E902: 2763180498.1900001 | F902: 2190776806 | G902: 2051212208.6400001 | H902: 2051212208.6400001 | I902: 139564597.36000001 | J902: =IF(G902=H902,"是","否") -> 是 | K902: =G902/C902 -> 70198912 | L902: =I902/K902 -> 1.9881304906833885
A903: 000759.SZ | B903: 中百集团 | C903: 3.13 | D903: 商贸零售-零售-百货零售 | E903: 11061800349.84 | F903: 2180663198.27 | G903: 2130345295 | H903: 2052357980.25 | I903: 50317903.270000003 | J903: =IF(G903=H903,"是","否") -> 否 | K903: =G903/C903 -> 680621500 | L903: =I903/K903 -> 7.3929347324467418e-02
A904: 688137.SH | B904: 近岸蛋白 | C904: 29.71 | D904: 医药生物-生物制品-其他生物制品 | E904: 2296249384.98 | F904: 2151154806.9400001 | G904: 2084912292.6900001 | H904: 954000429.64999998 | I904: 66242514.25 | J904: =IF(G904=H904,"是","否") -> 否 | K904: =G904/C904 -> 70175439 | L904: =I904/K904 -> 0.94395582263475397
A905: 603333.SH | B905: 尚纬股份 | C905: 3.13 | D905: 电力设备-电网设备-线缆部件及其他 | E905: 3217793939.5599999 | F905: 2136189531.53 | G905: 1945381344.1800001 | H905: 1945381344.1800001 | I905: 190808187.34999999 | J905: =IF(G905=H905,"是","否") -> 是 | K905: =G905/C905 -> 621527586 | L905: =I905/K905 -> 0.30699874253047232
A906: 001218.SZ | B906: 丽臣实业 | C906: 13.11 | D906: 基础化工-化学制品-其他化学制品 | E906: 2675334695.23 | F906: 2132290943.8299999 | G906: 1726062600 | H906: 995649044.70000005 | I906: 406228343.82999998 | J906: =IF(G906=H906,"是","否") -> 否 | K906: =G906/C906 -> 131660000 | L906: =I906/K906 -> 3.0854347852802673
A907: 688529.SH | B907: 豪森智能 | C907: 10.87 | D907: 机械设备-专用设备-其他专用设备 | E907: 6151734888.8400002 | F907: 2122985277.77 | G907: 1818413048.8299999 | H907: 1818413048.8299999 | I907: 304572228.94 | J907: =IF(G907=H907,"是","否") -> 是 | K907: =G907/C907 -> 167287309 | L907: =I907/K907 -> 1.8206535257256125
A908: 688181.SH | B908: 八亿时空 | C908: 15.58 | D908: 电子-光学光电子-面板 | E908: 2825006959.2600002 | F908: 2122917992.8299999 | G908: 2095222486.6800001 | H908: 2095222486.6800001 | I908: 27695506.149999999 | J908: =IF(G908=H908,"是","否") -> 是 | K908: =G908/C908 -> 134481546 | L908: =I908/K908 -> 0.20594280013705374
A909: 605208.SH | B909: 永茂泰 | C909: 6 | D909: 有色金属-工业金属-铝 | E909: 3611119605.1799998 | F909: 2102059063.29 | G909: 1979640000 | H909: 1979640000 | I909: 122419063.29000001 | J909: =IF(G909=H909,"是","否") -> 是 | K909: =G909/C909 -> 329940000 | L909: =I909/K909 -> 0.3710343192398618
A910: 002798.SZ | B910: 帝欧家居 | C910: 3.17 | D910: 轻工制造-家居用品-瓷砖地板 | E910: 6366625926.8500004 | F910: 2098472003.6400001 | G910: 1220405223.75 | H910: 999382882.63 | I910: 878066779.88999999 | J910: =IF(G910=H910,"是","否") -> 否 | K910: =G910/C910 -> 384985875 | L910: =I910/K910 -> 2.2807766126224762
A911: 300599.SZ | B911: 雄塑科技 | C911: 4.85 | D911: 建筑材料-建筑材料-管材 | E911: 2481661203.1100001 | F911: 2095810930.28 | G911: 1736938099.95 | H911: 1029124249.95 | I911: 358872830.32999998 | J911: =IF(G911=H911,"是","否") -> 否 | K911: =G911/C911 -> 358131567.00000006 | L911: =I911/K911 -> 1.0020698072951495
A912: 830809.BJ | B912: 安达科技 | C912: 3.19 | D912: 电力设备-电池-电池化学品 | E912: 5231541508.9399996 | F912: 2087769736.1500001 | G912: 1915436811.0899999 | H912: 1022658934.22 | I912: 172332925.06 | J912: =IF(G912=H912,"是","否") -> 否 | K912: =G912/C912 -> 600450411 | L912: =I912/K912 -> 0.28700609059954496
A913: 603968.SH | B913: 醋化股份 | C913: 8.45 | D913: 基础化工-化学制品-食品及饲料添加剂 | E913: 3604993315.9000001 | F913: 2055445026.28 | G913: 1752369450 | H913: 1727856000 | I913: 303075576.27999997 | J913: =IF(G913=H913,"是","否") -> 否 | K913: =G913/C913 -> 207381000.00000003 | L913: =I913/K913 -> 1.4614433158293187
A914: 603900.SH | B914: 莱绅通灵 | C914: 5.28 | D914: 纺织服饰-服装家纺-饰品 | E914: 2433393439.54 | F914: 2054336606.1400001 | G914: 1811799475.2 | H914: 1797701875.2 | I914: 242537130.94 | J914: =IF(G914=H914,"是","否") -> 否 | K914: =G914/C914 -> 343143840 | L914: =I914/K914 -> 0.70680893161305181
A915: 002872.SZ | B915: ST天圣 | C915: 3.62 | D915: 医药生物-化学制药-化学制剂 | E915: 2794904574.0700002 | F915: 2053385829.8599999 | G915: 1151160000 | H915: 778003645.08000004 | I915: 902225829.86000001 | J915: =IF(G915=H915,"是","否") -> 否 | K915: =G915/C915 -> 318000000 | L915: =I915/K915 -> 2.8371881442138367
A916: 605566.SH | B916: 福莱蒽特 | C916: 13.92 | D916: 基础化工-化学制品-纺织化学用品 | E916: 2614923321.2800002 | F916: 2051575165.1300001 | G916: 1856092800 | H916: 867048570.24000001 | I916: 195482365.13 | J916: =IF(G916=H916,"是","否") -> 否 | K916: =G916/C916 -> 133340000 | L916: =I916/K916 -> 1.4660444362531873
A917: 603982.SH | B917: 泉峰汽车 | C917: 7.13 | D917: 汽车-汽车零部件-底盘与发动机系统 | E917: 6655458852.8199997 | F917: 2050723841.8099999 | G917: 1863627927.8299999 | H917: 1863627927.8299999 | I917: 187095913.97999999 | J917: =IF(G917=H917,"是","否") -> 是 | K917: =G917/C917 -> 261378391 | L917: =I917/K917 -> 0.71580482710982785
A918: 002365.SZ | B918: 永安药业 | C918: 6.93 | D918: 医药生物-化学制药-原料药 | E918: 2314556162.4400001 | F918: 2043263730.8900001 | G918: 2042149725 | H918: 1690944698.52 | I918: 1114005.8899999999 | J918: =IF(G918=H918,"是","否") -> 否 | K918: =G918/C918 -> 294682500 | L918: =I918/K918 -> 3.780359844917835e-03
A919: 688680.SH | B919: 海优新材 | C919: 23.49 | D919: 电力设备-光伏设备-光伏辅材 | E919: 4188780955.6300001 | F919: 2033929478.8199999 | G919: 1973634756.3900001 | H919: 1973634756.3900001 | I919: 60294722.43 | J919: =IF(G919=H919,"是","否") -> 是 | K919: =G919/C919 -> 84020211.000000015 | L919: =I919/K919 -> 0.71762164974805875
A920: 301276.SZ | B920: 嘉曼服饰 | C920: 17.27 | D920: 纺织服饰-服装家纺-服装 | E920: 2354391407.1300001 | F920: 2022022437.48 | G920: 1865160000 | H920: 664955963.10000002 | I920: 156862437.47999999 | J920: =IF(G920=H920,"是","否") -> 否 | K920: =G920/C920 -> 108000000 | L920: =I920/K920 -> 1.4524299766666666
A921: 603086.SH | B921: 先达股份 | C921: 3.71 | D921: 基础化工-农化制品-农药 | E921: 3680338031.3299999 | F921: 2019780561.1300001 | G921: 1613156760.53 | H921: 1613156760.53 | I921: 406623800.60000002 | J921: =IF(G921=H921,"是","否") -> 是 | K921: =G921/C921 -> 434813143 | L921: =I921/K921 -> 0.93516906548521705
A922: 000548.SZ | B922: 湖南投资 | C922: 4.02 | D922: 交通运输-公路铁路运输-高速公路 | E922: 2778011628.2800002 | F922: 2018771280.02 | G922: 2006847560.22 | H922: 2006739020.22 | I922: 11923719.800000001 | J922: =IF(G922=H922,"是","否") -> 否 | K922: =G922/C922 -> 499215811.00000006 | L922: =I922/K922 -> 2.3884900151930483e-02
A923: 300335.SZ | B923: 迪森股份 | C923: 3.81 | D923: 公用事业-电力-热力 | E923: 2782696062.5300002 | F923: 2017338239.6500001 | G923: 1817417198.28 | H923: 1465891171.5899999 | I923: 199921041.37 | J923: =IF(G923=H923,"是","否") -> 否 | K923: =G923/C923 -> 477012388 | L923: =I923/K923 -> 0.4191107954412287
A924: 000632.SZ | B924: 三木集团 | C924: 2.68 | D924: 综合-综合-综合Ⅲ | E924: 9476040906.2600002 | F924: 2015589383.76 | G924: 1247592447.5999999 | H924: 1247490704.0799999 | I924: 767996936.15999997 | J924: =IF(G924=H924,"是","否") -> 否 | K924: =G924/C924 -> 465519569.99999994 | L924: =I924/K924 -> 1.6497629437146972
A925: 605287.SH | B925: 德才股份 | C925: 10.800000000000001 | D925: 建筑装饰-建筑装饰-装饰园林 | E925: 11528464044.610001 | F925: 2010923555.4400001 | G925: 1512000000 | H925: 1078791382.8 | I925: 498923555.44 | J925: =IF(G925=H925,"是","否") -> 否 | K925: =G925/C925 -> 140000000 | L925: =I925/K925 -> 3.5637396817142859
A926: 605177.SH | B926: 东亚药业 | C926: 16.47 | D926: 医药生物-化学制药-原料药 | E926: 3327245996.3499999 | F926: 2006924736.3499999 | G926: 1889987427.45 | H926: 1889987427.45 | I926: 116937308.90000001 | J926: =IF(G926=H926,"是","否") -> 是 | K926: =G926/C926 -> 114753335.00000001 | L926: =I926/K926 -> 1.0190318991600549
A927: 603839.SH | B927: 安正时尚 | C927: 4.2999999999999998 | D927: 纺织服饰-服装家纺-服装 | E927: 2639112826.1999998 | F927: 2004832351.8699999 | G927: 1716612288 | H927: 1716612288 | I927: 288220063.87 | J927: =IF(G927=H927,"是","否") -> 是 | K927: =G927/C927 -> 399212160 | L927: =I927/K927 -> 0.7219721560335236
A928: 002144.SZ | B928: 宏达高科 | C928: 8.44 | D928: 纺织服饰-纺织制造-其他纺织 | E928: 2159025739.6500001 | F928: 1989059219.48 | G928: 1491875736.3199999 | H928: 1153570878.1600001 | I928: 497183483.16000003 | J928: =IF(G928=H928,"是","否") -> 否 | K928: =G928/C928 -> 176762528 | L928: =I928/K928 -> 2.8127199174250328
A929: 603377.SH | B929: ST东时 | C929: 1.42 | D929: 社会服务-教育-教育Ⅲ | E929: 4576225255.2600002 | F929: 1937540780.98 | G929: 1023489612.86 | H929: 1023489612.86 | I929: 914051168.12 | J929: =IF(G929=H929,"是","否") -> 是 | K929: =G929/C929 -> 720767333 | L929: =I929/K929 -> 1.2681639778477585
A930: 605336.SH | B930: 帅丰电器 | C930: 9.52 | D930: 家用电器-厨卫电器-厨卫电器Ⅲ | E930: 2241223884.3499999 | F930: 1901652348.6600001 | G930: 1746086524 | H930: 1746086524 | I930: 155565824.66 | J930: =IF(G930=H930,"是","否") -> 是 | K930: =G930/C930 -> 183412450 | L930: =I930/K930 -> 0.84817483578677455
A931: 688737.SH | B931: 中自科技 | C931: 12.05 | D931: 汽车-汽车零部件-其他汽车零部件 | E931: 2612191446.46 | F931: 1890315260.6300001 | G931: 1448926776.3 | H931: 857320494.45000005 | I931: 441388484.32999998 | J931: =IF(G931=H931,"是","否") -> 否 | K931: =G931/C931 -> 120242885.99999999 | L931: =I931/K931 -> 3.6708074715538683
A932: 301258.SZ | B932: 富士莱 | C932: 20.25 | D932: 医药生物-化学制药-原料药 | E932: 2059591610.0799999 | F932: 1887129564.9200001 | G932: 1856317500 | H932: 685376437.5 | I932: 30812064.920000002 | J932: =IF(G932=H932,"是","否") -> 否 | K932: =G932/C932 -> 91670000 | L932: =I932/K932 -> 0.33611939478564418
A933: 001230.SZ | B933: 劲旅环境 | C933: 13.9 | D933: 环保-环境治理-固废治理 | E933: 3051279755.9499998 | F933: 1857065259.23 | G933: 1855595748.3 | H933: 751680224.60000002 | I933: 1469510.9299999999 | J933: =IF(G933=H933,"是","否") -> 否 | K933: =G933/C933 -> 133496097 | L933: =I933/K933 -> 1.1007894335667356e-02
A934: 605189.SH | B934: 富春染织 | C934: 11.37 | D934: 纺织服饰-纺织制造-印染 | E934: 4349921730.4499998 | F934: 1855970150.3399999 | G934: 1702835952.1500001 | H934: 1702835952.1500001 | I934: 153134198.19 | J934: =IF(G934=H934,"是","否") -> 是 | K934: =G934/C934 -> 149765695.00000003 | L934: =I934/K934 -> 1.0224918209073177
A935: 605100.SH | B935: 华丰股份 | C935: 10.63 | D935: 机械设备-通用设备-金属制品 | E935: 2375865638.4699998 | F935: 1852627593.1099999 | G935: 1819133160 | H935: 1806377160 | I935: 33494433.109999999 | J935: =IF(G935=H935,"是","否") -> 否 | K935: =G935/C935 -> 171132000 | L935: =I935/K935 -> 0.19572279357455064
A936: 001228.SZ | B936: 永泰运 | C936: 17.42 | D936: 交通运输-物流-物流Ⅲ | E936: 4445511583.6700001 | F936: 1852242456.5899999 | G936: 1809321488.78 | H936: 955741488.77999997 | I936: 42920967.810000002 | J936: =IF(G936=H936,"是","否") -> 否 | K936: =G936/C936 -> 103864608.99999999 | L936: =I936/K936 -> 0.4132395839472135
A937: 301108.SZ | B937: 洁雅股份 | C937: 21.48 | D937: 美容护理-美容护理-个护用品 | E937: 2143175743.4400001 | F937: 1849779315.71 | G937: 1744386890.6400001 | H937: 756919285.44000006 | I937: 105392425.06999999 | J937: =IF(G937=H937,"是","否") -> 否 | K937: =G937/C937 -> 81209818 | L937: =I937/K937 -> 1.2977793531072805
A938: 301126.SZ | B938: 达嘉维康 | C938: 8.78 | D938: 医药生物-医药商业-医药流通 | E938: 6095014296.6999998 | F938: 1838345359.03 | G938: 1803440096 | H938: 953694258.91999996 | I938: 34905263.030000001 | J938: =IF(G938=H938,"是","否") -> 否 | K938: =G938/C938 -> 205403200.00000003 | L938: =I938/K938 -> 0.16993534195182936
A939: 688175.SH | B939: 高凌信息 | C939: 11.12 | D939: 国防军工-军工电子-军工电子Ⅲ | E939: 1984223665.79 | F939: 1834046114.6800001 | G939: 1446366501.5999999 | H939: 650841701.60000002 | I939: 387679613.07999998 | J939: =IF(G939=H939,"是","否") -> 否 | K939: =G939/C939 -> 130068930 | L939: =I939/K939 -> 2.9805704796679731
A940: 003027.SZ | B940: 同兴环保 | C940: 11.73 | D940: 环保-环境治理-大气治理 | E940: 2523734901.2800002 | F940: 1799437785.5799999 | G940: 1533383136 | H940: 1194951486.8099999 | I940: 266054649.58000001 | J940: =IF(G940=H940,"是","否") -> 否 | K940: =G940/C940 -> 130723200 | L940: =I940/K940 -> 2.0352519643031997
A941: 603955.SH | B941: 大千生态 | C941: 7.2000000000000002 | D941: 建筑装饰-建筑装饰-装饰园林 | E941: 2735832143.6500001 | F941: 1764662071.8199999 | G941: 977184000 | H941: 977184000 | I941: 787478071.82000005 | J941: =IF(G941=H941,"是","否") -> 是 | K941: =G941/C941 -> 135720000 | L941: =I941/K941 -> 5.8022256986442677
A942: 688669.SH | B942: 聚石化学 | C942: 9.55 | D942: 基础化工-塑料制品-改性塑料 | E942: 5029205355.8000002 | F942: 1762731583.4100001 | G942: 1158733339.7 | H942: 1158733339.7 | I942: 603998243.71000004 | J942: =IF(G942=H942,"是","否") -> 是 | K942: =G942/C942 -> 121333334 | L942: =I942/K942 -> 4.9780074757527064
A943: 603903.SH | B943: 中持股份 | C943: 5.48 | D943: 环保-环境治理-水务及水治理 | E943: 4761203028.6999998 | F943: 1758478519.9400001 | G943: 1399150750.4000001 | H943: 1108624560.96 | I943: 359327769.54000002 | J943: =IF(G943=H943,"是","否") -> 否 | K943: =G943/C943 -> 255319480 | L943: =I943/K943 -> 1.4073652724813634
A944: 002998.SZ | B944: 优彩资源 | C944: 4.99 | D944: 基础化工-化学纤维-涤纶 | E944: 2498740025.7399998 | F944: 1755400573.96 | G944: 1628750436.0699999 | H944: 1219926582.3499999 | I944: 126650137.89 | J944: =IF(G944=H944,"是","否") -> 否 | K944: =G944/C944 -> 326402893 | L944: =I944/K944 -> 0.38801781664968271
A945: 301235.SZ | B945: 华康医疗 | C945: 15.91 | D945: 医药生物-医疗服务-其他医疗服务 | E945: 2982593810 | F945: 1742116267.4200001 | G945: 1680096000 | H945: 810646320 | I945: 62020267.420000002 | J945: =IF(G945=H945,"是","否") -> 否 | K945: =G945/C945 -> 105600000 | L945: =I945/K945 -> 0.58731313844696975
A946: 002084.SZ | B946: 海鸥住工 | C946: 2.43 | D946: 轻工制造-家居用品-其他家居用品 | E946: 3800508937.4699998 | F946: 1738666235.1600001 | G946: 1581588947.0699999 | H946: 1572716577.24 | I946: 157077288.09 | J946: =IF(G946=H946,"是","否") -> 否 | K946: =G946/C946 -> 650859648.99999988 | L946: =I946/K946 -> 0.24133818762822096
A947: 600082.SH | B947: 海泰发展 | C947: 2.5 | D947: 房地产-房地产-产业地产 | E947: 2996892138.3200002 | F947: 1735797865.77 | G947: 1615289565 | H947: 1585838530 | I947: 120508300.77 | J947: =IF(G947=H947,"是","否") -> 否 | K947: =G947/C947 -> 646115826 | L947: =I947/K947 -> 0.18651191616222693
A948: 301227.SZ | B948: 森鹰窗业 | C948: 14.61 | D948: 轻工制造-家居用品-定制家居 | E948: 2170000933.9200001 | F948: 1722028345.28 | G948: 1385028000 | H948: 513914055 | I948: 337000345.27999997 | J948: =IF(G948=H948,"是","否") -> 否 | K948: =G948/C948 -> 94800000 | L948: =I948/K948 -> 3.554855962869198
A949: 688265.SH | B949: 南模生物 | C949: 20.53 | D949: 医药生物-医疗服务-医疗研发外包 | E949: 1944093253.3599999 | F949: 1699358248.2 | G949: 1600590921.8900001 | H949: 1013946171.89 | I949: 98767326.310000002 | J949: =IF(G949=H949,"是","否") -> 否 | K949: =G949/C949 -> 77963513 | L949: =I949/K949 -> 1.2668403783959812
A950: 688053.SH | B950: 思科瑞 | C950: 16.78 | D950: 国防军工-军工电子-军工电子Ⅲ | E950: 1791589372.0999999 | F950: 1680673175.5899999 | G950: 1678000000 | H950: 726134364 | I950: 2673175.5899999999 | J950: =IF(G950=H950,"是","否") -> 否 | K950: =G950/C950 -> 100000000 | L950: =I950/K950 -> 2.6731755899999998e-02
A951: 600408.SH | B951: 安泰集团 | C951: 1.51 | D951: 煤炭-煤炭开采加工-焦炭加工 | E951: 5020690861.46 | F951: 1672029476.01 | G951: 1520268000 | H951: 1520268000 | I951: 151761476.00999999 | J951: =IF(G951=H951,"是","否") -> 是 | K951: =G951/C951 -> 1006800000 | L951: =I951/K951 -> 0.15073646802741358
A952: 002809.SZ | B952: 红墙股份 | C952: 6.61 | D952: 基础化工-化学制品-其他化学制品 | E952: 2514498429.1599998 | F952: 1648419146.1300001 | G952: 1389609995.01 | H952: 910425560.58000004 | I952: 258809151.12 | J952: =IF(G952=H952,"是","否") -> 否 | K952: =G952/C952 -> 210228441 | L952: =I952/K952 -> 1.2310853369264152
A953: 603183.SH | B953: 建研院 | C953: 3.11 | D953: 社会服务-其他社会服务-专业服务 | E953: 1992359829.72 | F953: 1635179123.3399999 | G953: 1546146610.6099999 | H953: 1546146610.6099999 | I953: 89032512.730000004 | J953: =IF(G953=H953,"是","否") -> 是 | K953: =G953/C953 -> 497153251 | L953: =I953/K953 -> 0.17908464351971018
A954: 000573.SZ | B954: 粤宏远A | C954: 2.27 | D954: 房地产-房地产-住宅开发 | E954: 2241420489.0599999 | F954: 1633091651.95 | G954: 1448896971.0799999 | H954: 1436830139.1300001 | I954: 184194680.87 | J954: =IF(G954=H954,"是","否") -> 否 | K954: =G954/C954 -> 638280604 | L954: =I954/K954 -> 0.28857947384846433
A955: 603937.SH | B955: 丽岛新材 | C955: 7.7000000000000002 | D955: 有色金属-工业金属-铝 | E955: 2593391667.71 | F955: 1631706484.21 | G955: 1608376585.2 | H955: 1608376585.2 | I955: 23329899.010000002 | J955: =IF(G955=H955,"是","否") -> 是 | K955: =G955/C955 -> 208880076 | L955: =I955/K955 -> 0.11169039889663772
A956: 600303.SH | B956: ST曙光 | C956: 2.33 | D956: 汽车-汽车整车-商用载客车 | E956: 3571342639.6700001 | F956: 1628473079.98 | G956: 1574157811.6300001 | H956: 1574157811.6300001 | I956: 54315268.350000001 | J956: =IF(G956=H956,"是","否") -> 是 | K956: =G956/C956 -> 675604211 | L956: =I956/K956 -> 8.0395100364464719e-02
A957: 688022.SH | B957: 瀚川智能 | C957: 8.39 | D957: 机械设备-专用设备-其他专用设备 | E957: 3927635677.7199998 | F957: 1623295242.1199999 | G957: 1475619138.3599999 | H957: 1475619138.3599999 | I957: 147676103.75999999 | J957: =IF(G957=H957,"是","否") -> 是 | K957: =G957/C957 -> 175878323.99999997 | L957: =I957/K957 -> 0.83964925524307366
A958: 688667.SH | B958: 菱电电控 | C958: 30.65 | D958: 汽车-汽车零部件-汽车电子电气系统 | E958: 1982193947.4200001 | F958: 1611124017.1300001 | G958: 1588042091 | H958: 1588042091 | I958: 23081926.129999999 | J958: =IF(G958=H958,"是","否") -> 是 | K958: =G958/C958 -> 51812140 | L958: =I958/K958 -> 0.44549262257841499
A959: 002357.SZ | B959: 富临运业 | C959: 5.06 | D959: 交通运输-公路铁路运输-公交 | E959: 2877613517.4899998 | F959: 1597807256.75 | G959: 1586254522.1600001 | H959: 1586197597.1600001 | I959: 11552734.59 | J959: =IF(G959=H959,"是","否") -> 否 | K959: =G959/C959 -> 313489036.00000006 | L959: =I959/K959 -> 3.6852116863187512e-02
A960: 605178.SH | B960: 时空科技 | C960: 15.29 | D960: 建筑装饰-建筑装饰-装饰园林 | E960: 2005023644.6800001 | F960: 1578335468.5999999 | G960: 1517556964 | H960: 1517556964 | I960: 60778504.600000001 | J960: =IF(G960=H960,"是","否") -> 是 | K960: =G960/C960 -> 99251600 | L960: =I960/K960 -> 0.61236800817316805
A961: 000757.SZ | B961: 浩物股份 | C961: 2.88 | D961: 汽车-汽车服务及其他-汽车服务 | E961: 2604681808.8499999 | F961: 1568517850.54 | G961: 1534222353.5999999 | H961: 1534217872.3199999 | I961: 34295496.939999998 | J961: =IF(G961=H961,"是","否") -> 否 | K961: =G961/C961 -> 532716095 | L961: =I961/K961 -> 6.4378563482299131e-02
A962: 300877.SZ | B962: 金春股份 | C962: 10.31 | D962: 纺织服饰-纺织制造-其他纺织 | E962: 1822145017.5799999 | F962: 1560822103.54 | G962: 1237200000 | H962: 1237189174.5 | I962: 323622103.54000002 | J962: =IF(G962=H962,"是","否") -> 否 | K962: =G962/C962 -> 120000000 | L962: =I962/K962 -> 2.6968508628333336
A963: 603810.SH | B963: 丰山集团 | C963: 7.86 | D963: 基础化工-农化制品-农药 | E963: 2570222406.4899998 | F963: 1553180035.8199999 | G963: 1298822115.8399999 | H963: 1298822115.8399999 | I963: 254357919.97999999 | J963: =IF(G963=H963,"是","否") -> 是 | K963: =G963/C963 -> 165244543.99999997 | L963: =I963/K963 -> 1.539281805152974
A964: 300614.SZ | B964: 百川畅银 | C964: 8.0999999999999996 | D964: 环保-环境治理-固废治理 | E964: 2453541651.7199998 | F964: 1552374231.9100001 | G964: 1299523856.4000001 | H964: 1299523856.4000001 | I964: 252850375.50999999 | J964: =IF(G964=H964,"是","否") -> 是 | K964: =G964/C964 -> 160435044.00000003 | L964: =I964/K964 -> 1.5760295831003104
A965: 002963.SZ | B965: 豪尔赛 | C965: 9.61 | D965: 建筑装饰-建筑装饰-装饰园林 | E965: 2043913036.22 | F965: 1536958048.5799999 | G965: 1444958927.3 | H965: 1181972801.28 | I965: 91999121.280000001 | J965: =IF(G965=H965,"是","否") -> 否 | K965: =G965/C965 -> 150359930 | L965: =I965/K965 -> 0.61185929841813569
A966: 688350.SH | B966: 富淼科技 | C966: 9.49 | D966: 基础化工-化学制品-其他化学制品 | E966: 2497542058.1799998 | F966: 1526133294.77 | G966: 1159204439.51 | H966: 1159204439.51 | I966: 366928855.25999999 | J966: =IF(G966=H966,"是","否") -> 是 | K966: =G966/C966 -> 122150099 | L966: =I966/K966 -> 3.0039177885561927
A967: 301063.SZ | B967: 海锅股份 | C967: 13.25 | D967: 机械设备-专用设备-能源及重型设备 | E967: 2365450430.1799998 | F967: 1522588949.51 | G967: 1382779593 | H967: 810021843 | I967: 139809356.50999999 | J967: =IF(G967=H967,"是","否") -> 否 | K967: =G967/C967 -> 104360724 | L967: =I967/K967 -> 1.3396740761399852
A968: 430017.BJ | B968: 星昊医药 | C968: 10.53 | D968: 医药生物-化学制药-化学制剂 | E968: 1889058644.5 | F968: 1511151222.1900001 | G968: 1290737916 | H968: 828130523.22000003 | I968: 220413306.19 | J968: =IF(G968=H968,"是","否") -> 否 | K968: =G968/C968 -> 122577200 | L968: =I968/K968 -> 1.7981590882317429
A969: 002094.SZ | B969: 青岛金王 | C969: 2.17 | D969: 轻工制造-家居用品-其他家居用品 | E969: 3550429896.9299998 | F969: 1508410881.0799999 | G969: 1499247681.3299999 | H969: 1498284201.3299999 | I969: 9163199.75 | J969: =IF(G969=H969,"是","否") -> 否 | K969: =G969/C969 -> 690897549 | L969: =I969/K969 -> 1.3262747513379875e-02
A970: 300970.SZ | B970: 华绿生物 | C970: 10.86 | D970: 农林牧渔-种植业与林业-其他种植业 | E970: 2091839035 | F970: 1485520556.99 | G970: 1280270196 | H970: 985513820.94000006 | I970: 205250360.99000001 | J970: =IF(G970=H970,"是","否") -> 否 | K970: =G970/C970 -> 117888600 | L970: =I970/K970 -> 1.7410535114506407
A971: 002696.SZ | B971: 百洋股份 | C971: 3.87 | D971: 农林牧渔-农产品加工-水产饲料 | E971: 3039370871.6599998 | F971: 1468459589.76 | G971: 1340421953.9400001 | H971: 1331817728.76 | I971: 128037635.81999999 | J971: =IF(G971=H971,"是","否") -> 否 | K971: =G971/C971 -> 346362262 | L971: =I971/K971 -> 0.36966393244076917
A972: 300462.SZ | B972: 华铭智能 | C972: 7.78 | D972: 计算机-计算机设备-其他计算机设备 | E972: 2080505093.4300001 | F972: 1452034024.3699999 | G972: 1409906677.6400001 | H972: 1063793733.14 | I972: 42127346.729999997 | J972: =IF(G972=H972,"是","否") -> 否 | K972: =G972/C972 -> 181221938 | L972: =I972/K972 -> 0.23246273158164768
A973: 300883.SZ | B973: 龙利得 | C973: 3.99 | D973: 轻工制造-包装印刷-包装 | E973: 2266560090.0900002 | F973: 1431002358.3099999 | G973: 1380540000 | H973: 1308180751.5 | I973: 50462358.310000002 | J973: =IF(G973=H973,"是","否") -> 否 | K973: =G973/C973 -> 346000000 | L973: =I973/K973 -> 0.14584496621387283
A974: 300871.SZ | B974: 回盛生物 | C974: 8.02 | D974: 农林牧渔-养殖业-动物保健 | E974: 2941070559.1599998 | F974: 1430036323 | G974: 1329428643.4000001 | H974: 1329428643.4000001 | I974: 100607679.59999999 | J974: =IF(G974=H974,"是","否") -> 是 | K974: =G974/C974 -> 165764170.00000003 | L974: =I974/K974 -> 0.60693260552023987
A975: 300165.SZ | B975: 天瑞仪器 | C975: 2.65 | D975: 机械设备-通用设备-仪器仪表 | E975: 3694059210.8600001 | F975: 1420781540.02 | G975: 1313106071.25 | H975: 1114410091.5 | I975: 107675468.77 | J975: =IF(G975=H975,"是","否") -> 否 | K975: =G975/C975 -> 495511725 | L975: =I975/K975 -> 0.21730155582090413
A976: 003011.SZ | B976: 海象新材 | C976: 11.9 | D976: 轻工制造-家居用品-瓷砖地板 | E976: 2259794750.2199998 | F976: 1362393594.5999999 | G976: 1221844400 | H976: 924592467.39999998 | I976: 140549194.59999999 | J976: =IF(G976=H976,"是","否") -> 否 | K976: =G976/C976 -> 102676000 | L976: =I976/K976 -> 1.3688612197592427
A977: 002853.SZ | B977: 皮阿诺 | C977: 6.95 | D977: 轻工制造-家居用品-定制家居 | E977: 2061358727.25 | F977: 1349155810.6600001 | G977: 1296472098.5999999 | H977: 919704724.25 | I977: 52683712.060000002 | J977: =IF(G977=H977,"是","否") -> 否 | K977: =G977/C977 -> 186542747.99999997 | L977: =I977/K977 -> 0.28242165736724328
A978: 688227.SH | B978: 品高股份 | C978: 11.03 | D978: 计算机-IT服务-IT服务Ⅲ | E978: 1875306989.6600001 | F978: 1347771990.98 | G978: 1246999683.25 | H978: 696672977.44000006 | I978: 100772307.73 | J978: =IF(G978=H978,"是","否") -> 否 | K978: =G978/C978 -> 113055275 | L978: =I978/K978 -> 0.89135431964585465
A979: 002295.SZ | B979: 精艺股份 | C979: 4.97 | D979: 有色金属-工业金属-铜 | E979: 2063151354.1400001 | F979: 1344843430.99 | G979: 1245561520 | H979: 1243961180 | I979: 99281910.989999995 | J979: =IF(G979=H979,"是","否") -> 否 | K979: =G979/C979 -> 250616000 | L979: =I979/K979 -> 0.39615152659846137
A980: 688670.SH | B980: 金迪克 | C980: 9.51 | D980: 医药生物-生物制品-疫苗 | E980: 1539850639.45 | F980: 1330214539.21 | G980: 1171632000 | H980: 1171632000 | I980: 158582539.21000001 | J980: =IF(G980=H980,"是","否") -> 是 | K980: =G980/C980 -> 123200000 | L980: =I980/K980 -> 1.287195935146104
A981: 002193.SZ | B981: 如意集团 | C981: 3.89 | D981: 纺织服饰-服装家纺-服装 | E981: 3231737439.3400002 | F981: 1302194736.9200001 | G981: 1018073489.5 | H981: 1018067654.5 | I981: 284121247.42000002 | J981: =IF(G981=H981,"是","否") -> 否 | K981: =G981/C981 -> 261715550 | L981: =I981/K981 -> 1.085610875700737
A982: 688485.SH | B982: 九州一轨 | C982: 8.0999999999999996 | D982: 环保-环境治理-综合环境治理 | E982: 1499809090.5999999 | F982: 1295967316.21 | G982: 1217365702.2 | H982: 698862548.70000005 | I982: 78601614.010000005 | J982: =IF(G982=H982,"是","否") -> 否 | K982: =G982/C982 -> 150292062 | L982: =I982/K982 -> 0.52299245192337573
A983: 605081.SH | B983: 太和水 | C983: 10.59 | D983: 环保-环境治理-水务及水治理 | E983: 1602102107.8900001 | F983: 1290241951.6400001 | G983: 1199286492.48 | H983: 1199286492.48 | I983: 90955459.159999996 | J983: =IF(G983=H983,"是","否") -> 是 | K983: =G983/C983 -> 113247072 | L983: =I983/K983 -> 0.80315947735937931
A984: 000506.SZ | B984: *ST中润 | C984: 1.33 | D984: 有色金属-贵金属-贵金属Ⅲ | E984: 2347847053.6399999 | F984: 1271960907.1700001 | G984: 1235593622.1300001 | H984: 1235132378.1300001 | I984: 36367285.039999999 | J984: =IF(G984=H984,"是","否") -> 否 | K984: =G984/C984 -> 929017761 | L984: =I984/K984 -> 3.9145952388309611e-02
A985: 832023.BJ | B985: 田野股份 | C985: 2.38 | D985: 农林牧渔-农产品加工-果蔬加工 | E985: 1555385609.3699999 | F985: 1210623401.5899999 | G985: 778983520 | H985: 587930638.39999998 | I985: 431639881.58999997 | J985: =IF(G985=H985,"是","否") -> 否 | K985: =G985/C985 -> 327304000 | L985: =I985/K985 -> 1.3187736220455599
A986: 603716.SH | B986: 塞力医疗 | C986: 5.71 | D986: 医药生物-医药商业-医药流通 | E986: 3208196934.0999999 | F986: 1210078030.8499999 | G986: 1149649744.0999999 | H986: 1149649744.0999999 | I986: 60428286.75 | J986: =IF(G986=H986,"是","否") -> 是 | K986: =G986/C986 -> 201339709.99999997 | L986: =I986/K986 -> 0.30013099129823922
A987: 688335.SH | B987: 复洁环保 | C987: 7.48 | D987: 环保-环保设备-环保设备Ⅲ | E987: 1385446113.28 | F987: 1200241730.03 | G987: 1107298748.1600001 | H987: 1107298748.1600001 | I987: 92942981.870000005 | J987: =IF(G987=H987,"是","否") -> 是 | K987: =G987/C987 -> 148034592 | L987: =I987/K987 -> 0.62784637437984769
A988: 002494.SZ | B988: 华斯股份 | C988: 2.96 | D988: 纺织服饰-服装家纺-服装 | E988: 1555762145 | F988: 1193793143.9400001 | G988: 1116839725.28 | H988: 848840496.48000002 | I988: 76953418.659999996 | J988: =IF(G988=H988,"是","否") -> 否 | K988: =G988/C988 -> 377310718 | L988: =I988/K988 -> 0.2039523792695441
A989: 603388.SH | B989: ST元成 | C989: 1.81 | D989: 建筑装饰-建筑装饰-装饰园林 | E989: 2645081742.4899998 | F989: 1168426839.45 | G989: 589577765.32000005 | H989: 589577765.32000005 | I989: 578849074.13 | J989: =IF(G989=H989,"是","否") -> 是 | K989: =G989/C989 -> 325733572 | L989: =I989/K989 -> 1.7770629860958882
A990: 605303.SH | B990: 园林股份 | C990: 6.03 | D990: 建筑装饰-建筑装饰-装饰园林 | E990: 2466933743.3099999 | F990: 1166590408.76 | G990: 972261570.24000001 | H990: 972261570.24000001 | I990: 194328838.52000001 | J990: =IF(G990=H990,"是","否") -> 是 | K990: =G990/C990 -> 161237408 | L990: =I990/K990 -> 1.2052342004902485
A991: 301098.SZ | B991: 金埔园林 | C991: 7.18 | D991: 建筑装饰-建筑装饰-装饰园林 | E991: 3363732898.9200001 | F991: 1158003616.8900001 | G991: 1137349910.4000001 | H991: 787404235.03999996 | I991: 20653706.489999998 | J991: =IF(G991=H991,"是","否") -> 否 | K991: =G991/C991 -> 158405280.00000003 | L991: =I991/K991 -> 0.13038521500040903
A992: 688178.SH | B992: 万德斯 | C992: 8.51 | D992: 环保-环境治理-综合环境治理 | E992: 2203872765.23 | F992: 1145571804.3699999 | G992: 724496007.65999997 | H992: 723331652.44000006 | I992: 421075796.70999998 | J992: =IF(G992=H992,"是","否") -> 否 | K992: =G992/C992 -> 85134666 | L992: =I992/K992 -> 4.945996930439593
A993: 688671.SH | B993: 碧兴物联 | C993: 14.36 | D993: 环保-环保设备-环保设备Ⅲ | E993: 1380442442.8 | F993: 1135855570 | G993: 1127531404 | H993: 617457024 | I993: 8324166 | J993: =IF(G993=H993,"是","否") -> 否 | K993: =G993/C993 -> 78518900 | L993: =I993/K993 -> 0.10601480662617535
A994: 688679.SH | B994: 通源环境 | C994: 6.21 | D994: 环保-环境治理-固废治理 | E994: 2802831339.6300001 | F994: 1131212052.0699999 | G994: 817792881.75 | H994: 817792881.75 | I994: 313419170.31999999 | J994: =IF(G994=H994,"是","否") -> 是 | K994: =G994/C994 -> 131689675 | L994: =I994/K994 -> 2.3799828674495553
A995: 000668.SZ | B995: 荣丰控股 | C995: 6.66 | D995: 房地产-房地产-住宅开发 | E995: 1748117614.6500001 | F995: 1083887783.05 | G995: 977966987.39999998 | H995: 977966987.39999998 | I995: 105920795.65000001 | J995: =IF(G995=H995,"是","否") -> 是 | K995: =G995/C995 -> 146841890 | L995: =I995/K995 -> 0.72132547224773536
A996: 839792.BJ | B996: 东和新材 | C996: 5.52 | D996: 建筑材料-建筑材料-耐火材料 | E996: 1534462447.0899999 | F996: 1027243154.47 | G996: 913780800 | H996: 299262886.31999999 | I996: 113462354.47 | J996: =IF(G996=H996,"是","否") -> 否 | K996: =G996/C996 -> 165540000 | L996: =I996/K996 -> 0.68540748139422492
A997: 833266.BJ | B997: 生物谷 | C997: 7.53 | D997: 医药生物-中药-中药Ⅲ | E997: 1218948203.4200001 | F997: 1004279941.35 | G997: 933720052.71000004 | H997: 584630231.61000001 | I997: 70559888.640000001 | J997: =IF(G997=H997,"是","否") -> 否 | K997: =G997/C997 -> 124000007 | L997: =I997/K997 -> 0.56903132787726374
A998: 839719.BJ | B998: 宁新新材 | C998: 5.94 | D998: 钢铁-钢铁-冶钢原料 | E998: 1983380389.1600001 | F998: 960462816.92999995 | G998: 552974796 | H998: 395380762.92000002 | I998: 407488020.93000001 | J998: =IF(G998=H998,"是","否") -> 否 | K998: =G998/C998 -> 93093400 | L998: =I998/K998 -> 4.3771956006548267
A999: 688217.SH | B999: 睿昂基因 | C999: 13.65 | D999: 医药生物-医疗器械-体外诊断 | E999: 1024084887.86 | F999: 952358248.60000002 | G999: 762432980.39999998 | H999: 762432980.39999998 | I999: 189925268.19999999 | J999: =IF(G999=H999,"是","否") -> 是 | K999: =G999/C999 -> 55855896 | L999: =I999/K999 -> 3.4002725191267182
A1000: 688193.SH | B1000: 仁度生物 | C1000: 23.44 | D1000: 医药生物-医疗器械-体外诊断 | E1000: 1021502138.11 | F1000: 938619899.38999999 | G1000: 937600000 | H1000: 709237440.79999995 | I1000: 1019899.39 | J1000: =IF(G1000=H1000,"是","否") -> 否 | K1000: =G1000/C1000 -> 40000000 | L1000: =I1000/K1000 -> 2.549748475e-02
A1001: 836807.BJ | B1001: 奔朗新材 | C1001: 4.57 | D1001: 机械设备-通用设备-磨具磨料 | E1001: 1312759037.28 | F1001: 926149330.63 | G1001: 831191600 | H1001: 444550460.83999997 | I1001: 94957730.629999995 | J1001: =IF(G1001=H1001,"是","否") -> 否 | K1001: =G1001/C1001 -> 181880000 | L1001: =I1001/K1001 -> 0.52209000786232673
A1002: 688021.SH | B1002: 奥福环保 | C1002: 7.5 | D1002: 汽车-汽车零部件-其他汽车零部件 | E1002: 1377421792.95 | F1002: 902994325.30999994 | G1002: 573102877.5 | H1002: 573102877.5 | I1002: 329891447.81 | J1002: =IF(G1002=H1002,"是","否") -> 是 | K1002: =G1002/C1002 -> 76413717 | L1002: =I1002/K1002 -> 4.3171757736899519
A1003: 830964.BJ | B1003: 润农节水 | C1003: 2.78 | D1003: 农林牧渔-种植业与林业-农业综合 | E1003: 1270518638.1400001 | F1003: 893839007.23000002 | G1003: 726158240 | H1003: 498719242.57999998 | I1003: 167680767.22999999 | J1003: =IF(G1003=H1003,"是","否") -> 否 | K1003: =G1003/C1003 -> 261208000.00000003 | L1003: =I1003/K1003 -> 0.6419434597332393
A1004: 833914.BJ | B1004: 远航精密 | C1004: 7.71 | D1004: 有色金属-能源金属-镍 | E1004: 1022998265.1799999 | F1004: 877641093.55999994 | G1004: 771000000 | H1004: 771000000 | I1004: 106641093.56 | J1004: =IF(G1004=H1004,"是","否") -> 是 | K1004: =G1004/C1004 -> 100000000 | L1004: =I1004/K1004 -> 1.0664109356
A1005: 834639.BJ | B1005: 晨光电缆 | C1005: 3.85 | D1005: 电力设备-电网设备-线缆部件及其他 | E1005: 1916025927.45 | F1005: 849767215.75 | G1005: 776160000 | H1005: 451281149.55000001 | I1005: 73607215.75 | J1005: =IF(G1005=H1005,"是","否") -> 否 | K1005: =G1005/C1005 -> 201600000 | L1005: =I1005/K1005 -> 0.36511515749007939
A1006: 832175.BJ | B1006: 东方碳素 | C1006: 5.56 | D1006: 基础化工-非金属材料-非金属材料Ⅲ | E1006: 1392083456.26 | F1006: 833867180.71000004 | G1006: 661640000 | H1006: 336342742.44 | I1006: 172227180.71000001 | J1006: =IF(G1006=H1006,"是","否") -> 否 | K1006: =G1006/C1006 -> 119000000.00000001 | L1006: =I1006/K1006 -> 1.4472872328571427
A1007: 688096.SH | B1007: 京源环保 | C1007: 4.97 | D1007: 环保-环境治理-水务及水治理 | E1007: 1887805877.9100001 | F1007: 802262737.03999996 | G1007: 757251068 | H1007: 757251068 | I1007: 45011669.039999999 | J1007: =IF(G1007=H1007,"是","否") -> 是 | K1007: =G1007/C1007 -> 152364400 | L1007: =I1007/K1007 -> 0.29542116819939568
A1008: 830832.BJ | B1008: 齐鲁华信 | C1008: 3.91 | D1008: 基础化工-非金属材料-非金属材料Ⅲ | E1008: 1050257864.88 | F1008: 759866720.14999998 | G1008: 542566712.14999998 | H1008: 488177591.63999999 | I1008: 217300008 | J1008: =IF(G1008=H1008,"是","否") -> 否 | K1008: =G1008/C1008 -> 138763865 | L1008: =I1008/K1008 -> 1.5659696996764971
A1009: 831175.BJ | B1009: 派诺科技 | C1009: 8.66 | D1009: 电力设备-电网设备-电气自控设备 | E1009: 1034403558.87 | F1009: 749181243.50999999 | G1009: 689422600 | H1009: 349055156 | I1009: 59758643.509999998 | J1009: =IF(G1009=H1009,"是","否") -> 否 | K1009: =G1009/C1009 -> 79610000 | L1009: =I1009/K1009 -> 0.75064242570028883
A1010: 835857.BJ | B1010: 百甲科技 | C1010: 3.07 | D1010: 建筑装饰-建筑装饰-专业工程 | E1010: 1559019731.5 | F1010: 724651435.25999999 | G1010: 556478321.78999996 | H1010: 356888356.52999997 | I1010: 168173113.47 | J1010: =IF(G1010=H1010,"是","否") -> 否 | K1010: =G1010/C1010 -> 181263297 | L1010: =I1010/K1010 -> 0.9277835957601499
A1011: 831370.BJ | B1011: 新安洁 | C1011: 1.84 | D1011: 环保-环境治理-固废治理 | E1011: 857706461.67999995 | F1011: 706195981.63999999 | G1011: 563555200 | H1011: 492134162.95999998 | I1011: 142640781.63999999 | J1011: =IF(G1011=H1011,"是","否") -> 否 | K1011: =G1011/C1011 -> 306280000 | L1011: =I1011/K1011 -> 0.4657201960297766
A1012: 831195.BJ | B1012: 三祥科技 | C1012: 6.67 | D1012: 汽车-汽车零部件-底盘与发动机系统 | E1012: 1285053458.25 | F1012: 693848659.33000004 | G1012: 653860100 | H1012: 471962429.94999999 | I1012: 39988559.329999998 | J1012: =IF(G1012=H1012,"是","否") -> 否 | K1012: =G1012/C1012 -> 98030000 | L1012: =I1012/K1012 -> 0.40792164980108131
A1013: 831768.BJ | B1013: 拾比佰 | C1013: 3.97 | D1013: 家用电器-白色家电-家电零部件 | E1013: 1350692386.5 | F1013: 656208324.22000003 | G1013: 440550900 | H1013: 304334769.04000002 | I1013: 215657424.22 | J1013: =IF(G1013=H1013,"是","否") -> 否 | K1013: =G1013/C1013 -> 110970000 | L1013: =I1013/K1013 -> 1.9433849168243669
A1014: 873833.BJ | B1014: 美心翼申 | C1014: 7.48 | D1014: 机械设备-通用设备-其他通用设备 | E1014: 734060825.36000001 | F1014: 617573503.26999998 | G1014: 616052800 | H1014: 236629800 | I1014: 1520703.27 | J1014: =IF(G1014=H1014,"是","否") -> 否 | K1014: =G1014/C1014 -> 82360000 | L1014: =I1014/K1014 -> 1.8464099927149102e-02
A1015: 832000.BJ | B1015: 安徽凤凰 | C1015: 6.17 | D1015: 汽车-汽车零部件-底盘与发动机系统 | E1015: 729600127.51999998 | F1015: 576820422.22000003 | G1015: 565665600 | H1015: 298049871 | I1015: 11154822.220000001 | J1015: =IF(G1015=H1015,"是","否") -> 否 | K1015: =G1015/C1015 -> 91680000 | L1015: =I1015/K1015 -> 0.12167127203315882
A1016: 836717.BJ | B1016: 瑞星股份 | C1016: 4.72 | D1016: 机械设备-专用设备-其他专用设备 | E1016: 649618561.63999999 | F1016: 555769697.37 | G1016: 541289600 | H1016: 159913600 | I1016: 14480097.369999999 | J1016: =IF(G1016=H1016,"是","否") -> 否 | K1016: =G1016/C1016 -> 114680000 | L1016: =I1016/K1016 -> 0.12626523692012556
A1017: 836263.BJ | B1017: 中航泰达 | C1017: 3.85 | D1017: 环保-环境治理-大气治理 | E1017: 982550200.51999998 | F1017: 551375083.47000003 | G1017: 538846000 | H1017: 393751100.05000001 | I1017: 12529083.470000001 | J1017: =IF(G1017=H1017,"是","否") -> 否 | K1017: =G1017/C1017 -> 139960000 | L1017: =I1017/K1017 -> 8.9519030222920834e-02
A1018: 870508.BJ | B1018: 丰安股份 | C1018: 7.16 | D1018: 机械设备-专用设备-农用机械 | E1018: 539724302.75 | F1018: 464415785.36000001 | G1018: 445638400 | H1018: 292840763.68000001 | I1018: 18777385.359999999 | J1018: =IF(G1018=H1018,"是","否") -> 否 | K1018: =G1018/C1018 -> 62240000 | L1018: =I1018/K1018 -> 0.30169320951156814
A1019: 831856.BJ | B1019: 浩淼科技 | C1019: 4.47 | D1019: 机械设备-专用设备-其他专用设备 | E1019: 598280929.75 | F1019: 432479343.06999999 | G1019: 386560025.91000003 | H1019: 214197603.69 | I1019: 45919317.159999996 | J1019: =IF(G1019=H1019,"是","否") -> 否 | K1019: =G1019/C1019 -> 86478753.000000015 | L1019: =I1019/K1019 -> 0.53098958492151227